研报名称,机构名称,发布时间,行业,研报地址
生物医药Ⅱ行业周报：DS-8201新适应症申报上市并获FDA优先审评,太平洋,2024-01-30,化学制药,https://pdf.dfcfw.com/pdf/H3_AP202401301619517269_1.pdf?1706634202000.pdf
医药生物行业2024年1月投资策略：业绩预告陆续披露，关注季度边际改善标的,国信证券,2024-01-30,化学制药,https://pdf.dfcfw.com/pdf/H3_AP202401301619517267_1.pdf?1706635270000.pdf
医药生物行业周报：基金持仓仍处底部，持续关注高股息国改标的,中泰证券,2024-01-30,化学制药,https://pdf.dfcfw.com/pdf/H3_AP202401301619500332_1.pdf?1706606572000.pdf
医药生物行业周报：关注央国企医药上市公司投资机会,东海证券,2024-01-30,化学制药,https://pdf.dfcfw.com/pdf/H3_AP202401301619502052_1.pdf?1706636350000.pdf
医药生物周报（24年第5周）：河北牵头开展28种医用耗材联盟集采，23Q4公募基金医药持仓环比提升,国信证券,2024-01-30,化学制药,https://pdf.dfcfw.com/pdf/H3_AP202401301619509271_1.pdf?1706626104000.pdf
医药生物行业双周报2024年第3期总第101期：《浦东新区综合改革试点实施方案（2023-2027年）》发布，生物医药新品可参照国际同类药品定价,长城国瑞证券,2024-01-30,化学制药,https://pdf.dfcfw.com/pdf/H3_AP202401301619509277_1.pdf?1706631076000.pdf
医药生物行业周报：重视央国企改革+药店&中药消费类院外资产,信达证券,2024-01-29,化学制药,https://pdf.dfcfw.com/pdf/H3_AP202401291619354038_1.pdf?1706607467000.pdf
医药行业点评：飞利浦呼吸机退出美国，行业变动催化投资机遇,民生证券,2024-01-29,化学制药,https://pdf.dfcfw.com/pdf/H3_AP202401281619246826_1.pdf?1706520370000.pdf
医药生物行业研究周报：创新药商业化价值兑现加强，呈现多主线投资机会,天风证券,2024-01-29,化学制药,https://pdf.dfcfw.com/pdf/H3_AP202401291619252571_1.pdf?1706513949000.pdf
医药行业周报：持续关注医药低估值个股,西南证券,2024-01-29,化学制药,https://pdf.dfcfw.com/pdf/H3_AP202401291619252586_1.pdf?1706620108000.pdf
医药行业周报：国企改革进一步深化，重视中药+国改,德邦证券,2024-01-29,化学制药,https://pdf.dfcfw.com/pdf/H3_AP202401291619253438_1.pdf?1706570541000.pdf
医药生物行业周报：银发经济，前景可期,上海证券,2024-01-29,化学制药,https://pdf.dfcfw.com/pdf/H3_AP202401291619253782_1.pdf?1706621529000.pdf
生物医药Ⅱ行业周报：诺和诺德口服司美格鲁肽片获批上市,太平洋,2024-01-29,化学制药,https://pdf.dfcfw.com/pdf/H3_AP202401291619253798_1.pdf?1706621811000.pdf
医药生物行业周报：关注国产小而美超声企业，AI叠加便携化走出新路线,华福证券,2024-01-29,化学制药,https://pdf.dfcfw.com/pdf/H3_AP202401291619257061_1.pdf?1706521574000.pdf
医药行业创新药周报：2024年1月第四周创新药周报(附小专题URAT1靶点研发概况),西南证券,2024-01-29,化学制药,https://pdf.dfcfw.com/pdf/H3_AP202401291619270772_1.pdf?1706550131000.pdf
中国抗高血压药物行业市场规模测算逻辑模型 头豹词条报告系列,头豹研究院,2024-01-29,化学制药,https://pdf.dfcfw.com/pdf/H3_AP202401291619283941_1.pdf?1706560383000.pdf
医药生物行业报告：医药板块开启止跌反弹，积极布局出海、刚需方向,中邮证券,2024-01-29,化学制药,https://pdf.dfcfw.com/pdf/H3_AP202401291619248686_1.pdf?1706520165000.pdf
医药行业周报：血透耗材集采降幅温和,华金证券,2024-01-29,化学制药,https://pdf.dfcfw.com/pdf/H3_AP202401291619248970_1.pdf?1706519779000.pdf
医药生物行业周报：自免赛道成长性高，国产单品商业化元年即将开启,开源证券,2024-01-29,化学制药,https://pdf.dfcfw.com/pdf/H3_AP202401291619251722_1.pdf?1706511737000.pdf
医药：创新药license out交易加速，关注跨境和融资业务机遇,招商银行,2024-01-29,化学制药,https://pdf.dfcfw.com/pdf/H3_AP202401291619251757_1.pdf?1706536640000.pdf
