研报名称,机构名称,发布时间,行业,研报地址
非银金融行业周报：重视市场底部保险的弹性,信达证券,2024-01-29,证券,https://pdf.dfcfw.com/pdf/H3_AP202401291619260716_1.pdf?1706527760000.pdf
非银金融行业周报：政策组合拳带来beta催化，保险业务端和弹性占优,开源证券,2024-01-29,证券,https://pdf.dfcfw.com/pdf/H3_AP202401291619252456_1.pdf?1706513949000.pdf
非银行金融行业点评：融券监管再度强化，全力维护市场公平与稳定,平安证券,2024-01-29,证券,https://pdf.dfcfw.com/pdf/H3_AP202401291619252560_1.pdf?1706536901000.pdf
证券行业事件点评：暂停限售股出借提振市场信心,东莞证券,2024-01-29,证券,https://pdf.dfcfw.com/pdf/H3_AP202401291619277259_1.pdf?1706549715000.pdf
华福非银周报：板块回升，关注国企改革、流动性宽松政策下的左侧配置机会,华福证券,2024-01-29,证券,https://pdf.dfcfw.com/pdf/H3_AP202401291619251716_1.pdf?1706612030000.pdf
