研报名称,机构名称,发布时间,行业,研报地址
医药生物行业周报：眼科医疗服务规模逐渐扩大，看好长期发展,上海证券,2024-07-15,中药,https://pdf.dfcfw.com/pdf/H3_AP202407151637920501_1.pdf?1721057744000.pdf
中药OTC行业专题报告：需求与政策共驱，改革与拓展并进，引领高质量新篇章,中银证券,2024-07-14,中药,https://pdf.dfcfw.com/pdf/H3_AP202407141637882100_1.pdf?1720960802000.pdf
医药行业周报：血制品外延还有多大空间？,华源证券,2024-07-14,中药,https://pdf.dfcfw.com/pdf/H3_AP202407141637888774_1.pdf?1720971794000.pdf
医药生物行业定期报告：实体瘤双抗研发为产业趋势，中国企业已取得突破进展！,华福证券,2024-07-14,中药,https://pdf.dfcfw.com/pdf/H3_AP202407141637894252_1.pdf?1720989754000.pdf
医药生物周报（24年第27周）：全链条支持创新药发展政策出台，关注创新药及产业链投资机会,国信证券,2024-07-09,中药,https://pdf.dfcfw.com/pdf/H3_AP202407091637716244_1.pdf?1720540944000.pdf
医药生物行业周报：政策落地，利好创新药长期发展,东海证券,2024-07-08,中药,https://pdf.dfcfw.com/pdf/H3_AP202407081637678821_1.pdf?1720458837000.pdf
医药生物行业报告：《全链条支持创新药发展实施方案》审议通过，医药板块或迎全面反转,中邮证券,2024-07-08,中药,https://pdf.dfcfw.com/pdf/H3_AP202407081637680410_1.pdf?1720458054000.pdf
医药生物行业周报：创新药发展迎来政策春风，有望迈入快速通道,上海证券,2024-07-08,中药,https://pdf.dfcfw.com/pdf/H3_AP202407081637681984_1.pdf?1720460074000.pdf
医药行业周报：维生素A_E_D3涨价趋势形成，投资机会凸显,德邦证券,2024-07-08,中药,https://pdf.dfcfw.com/pdf/H3_AP202407081637686638_1.pdf?1720466926000.pdf
医药行业周报：创新药迎来政策利好,西南证券,2024-07-07,中药,https://pdf.dfcfw.com/pdf/H3_AP202407071637651186_1.pdf?1720433001000.pdf
医药生物行业跟踪周报：《全链条支持创新药发展实施方案》，其板块有望走强,东吴证券,2024-07-07,中药,https://pdf.dfcfw.com/pdf/H3_AP202407071637651496_1.pdf?1720433609000.pdf
医药生物行业周报：维生素行业拐点向上，维生素E及D3价格快速大幅上涨,开源证券,2024-07-07,中药,https://pdf.dfcfw.com/pdf/H3_AP202407071637652301_1.pdf?1720383845000.pdf
医药生物行业定期报告：复盘医药历时至暗时刻，当前可以乐观起来！,华福证券,2024-07-07,中药,https://pdf.dfcfw.com/pdf/H3_AP202407071637653143_1.pdf?1720433826000.pdf
医药行业周报：顶层明确支持创新药发展，有望带动医药板块反弹,华源证券,2024-07-07,中药,https://pdf.dfcfw.com/pdf/H3_AP202407071637645733_1.pdf?1720373293000.pdf
医药生物行业周报（24年第24周）：药品价格管控政策梳理，价格体系日趋完善,国信证券,2024-07-05,中药,https://pdf.dfcfw.com/pdf/H3_AP202407051637596085_1.pdf?1720202432000.pdf
中药行业动态点评：允许进口牛黄试点，成本端压力有望缓解,中银证券,2024-07-04,中药,https://pdf.dfcfw.com/pdf/H3_AP202407041637548642_1.pdf?1720099884000.pdf
医药生物行业周报：医药板块处于底部位置，建议加大对医药的配置,华安证券,2024-07-02,中药,https://pdf.dfcfw.com/pdf/H3_AP202407021637460785_1.pdf?1719931915000.pdf
2024年中国中式养生水行业发展趋势洞察报告,深圳前瞻产业研究院,2024-07-02,中药,https://pdf.dfcfw.com/pdf/H3_AP202407021637463341_1.pdf?1719938721000.pdf
医药生物行业双周报：16部门联合启动“体重管理年”活动,东莞证券,2024-07-01,中药,https://pdf.dfcfw.com/pdf/H3_AP202407011637125387_1.pdf?1719828976000.pdf
医药生物行业跟踪周报：GLP1原料药业绩能否持续超预期？关注诺泰生物、奥瑞特等,东吴证券,2024-07-01,中药,https://pdf.dfcfw.com/pdf/H3_AP202407011637120374_1.pdf?1719827322000.pdf
医药生物行业周报：司美减重适应症国内获批，产业链上游业绩开始兑现,上海证券,2024-07-01,中药,https://pdf.dfcfw.com/pdf/H3_AP202407011637125373_1.pdf?1719832823000.pdf
医药生物：减重步入新阶段，产业链开始体现业绩和新药亦有进展,华福证券,2024-07-01,中药,https://pdf.dfcfw.com/pdf/H3_AP202407011637124605_1.pdf?1719827555000.pdf
医药生物行业报告：设备更新贷款财政贴息政策落地，看好医药板块底部投资机会,中邮证券,2024-07-01,中药,https://pdf.dfcfw.com/pdf/H3_AP202407011637174642_1.pdf?1719853884000.pdf
医药生物行业周报：第84届ADA大会圆满落幕，国产新药数据惊艳,开源证券,2024-06-30,中药,https://pdf.dfcfw.com/pdf/H3_AP202406301637108109_1.pdf?1719768339000.pdf
医药行业周报：否极泰来，积极布局潜力品种,华源证券,2024-06-30,中药,https://pdf.dfcfw.com/pdf/H3_AP202406301637117633_1.pdf?1719829473000.pdf
中药Ⅱ行业跟踪报告：2024H1中药新药数据跟踪：1.1类IND受理和经典名方NDA受理数量较多,万联证券,2024-06-28,中药,https://pdf.dfcfw.com/pdf/H3_AP202406281636992344_1.pdf?1719567462000.pdf
2024年中期医药生物行业投资策略报告：产业政策落地，基本面筑底,万联证券,2024-06-26,中药,https://pdf.dfcfw.com/pdf/H3_AP202406261636917210_1.pdf?1719423796000.pdf
医药行业周报：重点关注科创板医药企业投资机会,德邦证券,2024-06-24,中药,https://pdf.dfcfw.com/pdf/H3_AP202406241636813717_1.pdf?1719223167000.pdf
医药生物行业周报：重视中药板块投资价值；夏季关注清热解毒中成药市场,上海证券,2024-06-24,中药,https://pdf.dfcfw.com/pdf/H3_AP202406241636814606_1.pdf?1719225423000.pdf
医药生物行业跟踪周报：国产创新药出海加速兑现，重点推荐和黄医药、科伦博泰、百利天恒等,东吴证券,2024-06-24,中药,https://pdf.dfcfw.com/pdf/H3_AP202406241636806063_1.pdf?1719228023000.pdf
医药生物行业周报：关注Q2业绩表现，精选优质个股,东海证券,2024-06-24,中药,https://pdf.dfcfw.com/pdf/H3_AP202406241636827799_1.pdf?1719252632000.pdf
医药生物行业双周报2024年第13期总第111期：2024医保目录调整启动 创新仍是行业主线之一,长城国瑞证券,2024-06-24,中药,https://pdf.dfcfw.com/pdf/H3_AP202406241636829183_1.pdf?1719252341000.pdf
医药生物行业报告：广东2024药品集采纳入国谈品种，国谈药品进院进程有望加快,中邮证券,2024-06-24,中药,https://pdf.dfcfw.com/pdf/H3_AP202406241636819476_1.pdf?1719240683000.pdf
医药生物行业周报：各省医疗设备更新政策落地节奏逐渐明朗，器械公司有望长期获益,开源证券,2024-06-23,中药,https://pdf.dfcfw.com/pdf/H3_AP202406231636799835_1.pdf?1719154242000.pdf
医药生物周报（24年第21周）：人工耳蜗或将纳入国采，设备更新政策进入项目申报阶段,国信证券,2024-06-21,中药,https://pdf.dfcfw.com/pdf/H3_AP202406211636744702_1.pdf?1718968767000.pdf
医药生物：重磅品种舒利迭首仿获批，吸入制剂国产替代加速,华福证券,2024-06-17,中药,https://pdf.dfcfw.com/pdf/H3_AP202406171636462385_1.pdf?1718618147000.pdf
医药行业周报：重点关注减肥赛道机会,德邦证券,2024-06-17,中药,https://pdf.dfcfw.com/pdf/H3_AP202406171636464667_1.pdf?1718616501000.pdf
医药生物行业周报：政策频出，精选个股,东海证券,2024-06-17,中药,https://pdf.dfcfw.com/pdf/H3_AP202406171636488897_1.pdf?1718648372000.pdf
医药生物行业报告：药品比价系统推出，零售药店中长期集中度提升逻辑未变,中邮证券,2024-06-17,中药,https://pdf.dfcfw.com/pdf/H3_AP202406171636480869_1.pdf?1718631350000.pdf
医药生物行业周报：《生物安全法案》落地受阻，CXO将迎来边际改善,开源证券,2024-06-16,中药,https://pdf.dfcfw.com/pdf/H3_AP202406161636458420_1.pdf?1718562014000.pdf
医药生物行业跟踪周报：医保统筹目录院内外终端价趋统一，利于OTC类产品放量,东吴证券,2024-06-16,中药,https://pdf.dfcfw.com/pdf/H3_AP202406161636458424_1.pdf?1718615859000.pdf
医药生物周报（24年第22周）：罗氏诊断研发开放日缩影，幽门螺杆菌检测及防治梳理,国信证券,2024-06-13,中药,https://pdf.dfcfw.com/pdf/H3_AP202406131636084555_1.pdf?1718291383000.pdf
医药生物行业周报：监管加码板块分化，布局细分领域优质龙头,中泰证券,2024-06-11,中药,https://pdf.dfcfw.com/pdf/H3_AP202406111635958476_1.pdf?1718100562000.pdf
医药生物行业跟踪周报：持续强化推荐GLP1产业链，关注博瑞医药、信达生物、诺泰生物等,东吴证券,2024-06-11,中药,https://pdf.dfcfw.com/pdf/H3_AP202406111635962025_1.pdf?1718106538000.pdf
医药生物行业周报：医改2024年重点任务发布，布局细分领域优质个股,东海证券,2024-06-11,中药,https://pdf.dfcfw.com/pdf/H3_AP202406111635963675_1.pdf?1718128748000.pdf
医药行业周报：医改持续深化，支持创新和中药,德邦证券,2024-06-11,中药,https://pdf.dfcfw.com/pdf/H3_AP202406111635975346_1.pdf?1718135585000.pdf
医药生物行业周报：医药生物行业报告深化医药卫生体制改革2024年重点工作任务发布，创新药重视程度不断提升,中邮证券,2024-06-11,中药,https://pdf.dfcfw.com/pdf/H3_AP202406111635979762_1.pdf?1718145531000.pdf
医药生物行业周报：多款ADC药物亮相2024 ASCO，研发热情高涨,开源证券,2024-06-09,中药,https://pdf.dfcfw.com/pdf/H3_AP202406091635914182_1.pdf?1717961337000.pdf
医药行业6月策略报告：国产创新药闪耀ASCO会议，创新药及中药等为首选,东吴证券,2024-06-05,中药,https://pdf.dfcfw.com/pdf/H3_AP202406051635588761_1.pdf?1717614962000.pdf
国药系专题报告：国改大潮持续深化，国药系标的潜力巨大,华福证券,2024-06-04,中药,https://pdf.dfcfw.com/pdf/H3_AP202406041635336101_1.pdf?1717507468000.pdf
医药生物行业周报：医药生物行业报告康方PD-1_VEGF头对头K药获得成功，建议继续布局业绩高确定性标的,中邮证券,2024-06-03,中药,https://pdf.dfcfw.com/pdf/H3_AP202406031635245102_1.pdf?1717412670000.pdf
医药生物行业双周报：医疗反腐工作持续推进,东莞证券,2024-06-03,中药,https://pdf.dfcfw.com/pdf/H3_AP202406031635234878_1.pdf?1717407053000.pdf
医药生物行业定期报告：医药短期调整到位，关注ICU救治利器之CRRT,华福证券,2024-06-03,中药,https://pdf.dfcfw.com/pdf/H3_AP202406031635276102_1.pdf?1717441024000.pdf
医药生物行业周报：自免BD风再起，新靶点新技术带来多项重磅交易,开源证券,2024-06-02,中药,https://pdf.dfcfw.com/pdf/H3_AP202406021635197733_1.pdf?1717341687000.pdf
医药生物行业跟踪周报：IVD出海正当时，重点推荐新产业、迈瑞医疗等,东吴证券,2024-06-02,中药,https://pdf.dfcfw.com/pdf/H3_AP202406021635215575_1.pdf?1717369115000.pdf
医药生物周报（24年第21周）：ASCO摘要重点数据整理，2024年集采8号文解读,国信证券,2024-05-31,中药,https://pdf.dfcfw.com/pdf/H3_AP202405311635018877_1.pdf?1717141519000.pdf
医药生物行业2024年5月投资策略：一季报整体表现承压，创新药商业化成效卓著,国信证券,2024-05-31,中药,https://pdf.dfcfw.com/pdf/H3_AP202405311635052956_1.pdf?1717168707000.pdf
医药行业周报：积极把握医药回调良机,西南证券,2024-05-27,中药,https://pdf.dfcfw.com/pdf/H3_AP202405271634705568_1.pdf?1716809111000.pdf
医药生物行业周报：医药生物行业报告国产头部企业人工关节接续采购中标价格良好，未来有望持续扩大份额,中邮证券,2024-05-27,中药,https://pdf.dfcfw.com/pdf/H3_AP202405271634707464_1.pdf?1716807802000.pdf
医药生物行业周报：行业政策频出，关注相关投资机会,东海证券,2024-05-27,中药,https://pdf.dfcfw.com/pdf/H3_AP202405271634723066_1.pdf?1716841068000.pdf
中药行业2023年年报及2024年一季报总结：2023年稳健增长，高基数下2024年一季度略有下滑,国信证券,2024-05-26,中药,https://pdf.dfcfw.com/pdf/H3_AP202405261634687791_1.pdf?1716732499000.pdf
医药生物行业周报：集采提质扩面，省级集采有望升级；上海12项辅助生殖技术纳入医保,上海证券,2024-05-26,中药,https://pdf.dfcfw.com/pdf/H3_AP202405261634687834_1.pdf?1716733507000.pdf
医药生物行业周报：骨科关节国采顺利续标，国产替代和格局优化正当时,开源证券,2024-05-26,中药,https://pdf.dfcfw.com/pdf/H3_AP202405261634691167_1.pdf?1716743517000.pdf
医药生物行业跟踪周报：药店统筹全国逐步落地，重点推荐老百姓、益丰药房等,东吴证券,2024-05-26,中药,https://pdf.dfcfw.com/pdf/H3_AP202405261634694033_1.pdf?1716759225000.pdf
医药生物行业专题：国药集团：央企综合性医药平台龙头,华源证券,2024-05-24,中药,https://pdf.dfcfw.com/pdf/H3_AP202405241634539068_1.pdf?1716556210000.pdf
