研报名称,机构名称,发布时间,行业,研报地址
医药生物行业周报（25年第13周）：炎症靶点在心血管领域进展梳理,国信证券,2026-03-26,中药Ⅱ,https://pdf.dfcfw.com/pdf/H3_AP202603261820770462_1.pdf?1774548434000.pdf
医药行业跟踪报告：GSK首创小核酸新药拟纳入优先审评，有望实现乙肝功能性治愈,爱建证券,2026-03-23,中药Ⅱ,https://pdf.dfcfw.com/pdf/H3_AP202603231820701705_1.pdf?1774287509000.pdf
医药生物行业跟踪周报：BD放量及再融资，创新药龙头现金流充裕,东吴证券,2026-03-22,中药Ⅱ,https://pdf.dfcfw.com/pdf/H3_AP202603221820687529_1.pdf?1774197639000.pdf
医药生物行业周报：国产侵入式脑机接口获批上市，实现全球首发,上海证券,2026-03-18,中药Ⅱ,https://pdf.dfcfw.com/pdf/H3_AP202603181820615087_1.pdf?1773830851000.pdf
医药生物行业周报（26年第12周）：美股医疗器械公司2025年业绩及经营情况汇总,国信证券,2026-03-17,中药Ⅱ,https://pdf.dfcfw.com/pdf/H3_AP202603171820601914_1.pdf?1773771400000.pdf
医药生物行业跟踪周报：注：微创脑科学、翔宇医疗、爱朋医疗等,东吴证券,2026-03-15,中药Ⅱ,https://pdf.dfcfw.com/pdf/H3_AP202603151820565929_1.pdf?1773598935000.pdf
医药生物行业周报：维生素启动进入涨价通道，后续或有较大上涨空间,中邮证券,2026-03-14,中药Ⅱ,https://pdf.dfcfw.com/pdf/H3_AP202603141820563128_1.pdf?1773516232000.pdf
医药生物行业双周报：关注创新药产业链,东莞证券,2026-03-13,中药Ⅱ,https://pdf.dfcfw.com/pdf/H3_AP202603131820543834_1.pdf?1773430111000.pdf
医药生物行业周报（26年第11周）：政府工作报告明确将生物医药打造为新兴支柱产业,国信证券,2026-03-12,中药Ⅱ,https://pdf.dfcfw.com/pdf/H3_AP202603121820519596_1.pdf?1773333358000.pdf
医药生物行业周报：罗伐昔替尼达成高额独家授权协议，创新药BD交易持续活跃,上海证券,2026-03-11,中药Ⅱ,https://pdf.dfcfw.com/pdf/H3_AP202603111820485643_1.pdf?1773236750000.pdf
医药生物行业周报-聚焦两会：打造生物医药等新兴支柱产业，健全医疗保障体系，推动商保和创新发展,中邮证券,2026-03-09,中药Ⅱ,https://pdf.dfcfw.com/pdf/H3_AP202603091820411020_1.pdf?1773069903000.pdf
医药生物行业跟踪周报：两会将创新药列为新兴支柱产业，26年BD出海再提速,东吴证券,2026-03-08,中药Ⅱ,https://pdf.dfcfw.com/pdf/H3_AP202603081820392571_1.pdf?1773001260000.pdf
医药生物行业周报：手术机器人行业或出台收费标准，龙头公司有望迎加速发展,中邮证券,2026-03-02,中药Ⅱ,https://pdf.dfcfw.com/pdf/H3_AP202603021820184065_1.pdf?1772467135000.pdf
医药生物行业跟踪周报：2026版基药目录调整在即，利好拟纳入目录的中药标的,东吴证券,2026-03-01,中药Ⅱ,https://pdf.dfcfw.com/pdf/H3_AP202603011820159212_1.pdf?1772383560000.pdf
医药生物行业周报：GSK联手中国新锐，siRNA赛道布局再下一城,开源证券,2026-03-01,中药Ⅱ,https://pdf.dfcfw.com/pdf/H3_AP202603011820161899_1.pdf?1772394625000.pdf
医药生物行业周报：产业链体系持续完善、板块业绩回暖在望，关注中药高质量发展,上海证券,2026-02-27,中药Ⅱ,https://pdf.dfcfw.com/pdf/H3_AP202602271820094534_1.pdf?1772199235000.pdf
医药生物行业双周报：静待板块回暖,东莞证券,2026-02-27,中药Ⅱ,https://pdf.dfcfw.com/pdf/H3_AP202602271820103562_1.pdf?1772213842000.pdf
医药生物行业跟踪周报：FDA创新药审评政策再松绑，利好创新药板块,东吴证券,2026-02-23,中药Ⅱ,https://pdf.dfcfw.com/pdf/H3_AP202602231819984483_1.pdf?1771884375000.pdf
医药行业专题报告：25Q4持仓调整筑底，2026年医药板块有望迎来修复性机会,国信证券,2026-02-14,中药Ⅱ,https://pdf.dfcfw.com/pdf/H3_AP202602141819934729_1.pdf?1771068690000.pdf
