研报名称,机构名称,发布时间,行业,研报地址
医药行业周报：药品反垄断法出台，业绩预报持续落地,西南证券,2025-01-27,中药,https://pdf.dfcfw.com/pdf/H3_AP202501271642585005_1.pdf?1737968430000.pdf
医药行业24Q4基金持仓分析：药基_非药基医药重仓占比续创新低，被动基金占比持续提升,华福证券,2025-01-27,中药,https://pdf.dfcfw.com/pdf/H3_AP202501271642588946_1.pdf?1737981251000.pdf
医药生物行业定期报告：公募Q4进一步低配医药，药基和非药基分化,华福证券,2025-01-26,中药,https://pdf.dfcfw.com/pdf/H3_AP202501261642556041_1.pdf?1737879810000.pdf
医药生物行业周报：2024年全球医疗健康投融资整体企稳，国内环比改善趋势已现,开源证券,2025-01-26,中药,https://pdf.dfcfw.com/pdf/H3_AP202501261642569550_1.pdf?1737920655000.pdf
医药生物周报：海外制药及医疗器械企业 JPM大会业务进展更新,国信证券,2025-01-22,中药,https://pdf.dfcfw.com/pdf/H3_AP202501221642439560_1.pdf?1737541118000.pdf
医药生物行业报告：2024年国家医保基金运行稳中求进，各改革措施成效显著,中邮证券,2025-01-21,中药,https://pdf.dfcfw.com/pdf/H3_AP202501211642393508_1.pdf?1737452059000.pdf
医药生物行业定期报告：中硼硅药用玻璃产业趋势向好，成长天花板有望打开,华福证券,2025-01-20,中药,https://pdf.dfcfw.com/pdf/H3_AP202501191642339781_1.pdf?1737372295000.pdf
医药生物行业周报：业绩边际回暖+并购重组提速，持续看好2025年科研服务板块机会,开源证券,2025-01-20,中药,https://pdf.dfcfw.com/pdf/H3_AP202501201642345410_1.pdf?1737337475000.pdf
医药生物行业跟踪周报：海外创新药峰会国产成果丰硕，建议关注百利天恒、科伦博泰、百济神州等,东吴证券,2025-01-20,中药,https://pdf.dfcfw.com/pdf/H3_AP202501201642351007_1.pdf?1737359216000.pdf
医药生物行业周报：医保“丙类”目录有望为创新药商保支付提供支持,中银证券,2025-01-20,中药,https://pdf.dfcfw.com/pdf/H3_AP202501201642363300_1.pdf?1737387986000.pdf
医药行业周报：供应链出口回暖，重点推荐海泰新光,华源证券,2025-01-19,中药,https://pdf.dfcfw.com/pdf/H3_AP202501191642325710_1.pdf?1737281887000.pdf
医药生物行业周报：首版丙类医保目录今年启动，多元支付机制利好创新药发展,中航证券,2025-01-19,中药,https://pdf.dfcfw.com/pdf/H3_AP202501191642343096_1.pdf?1737322194000.pdf
医药行业周报：医保改革显成效，支持创新药发展,西南证券,2025-01-19,中药,https://pdf.dfcfw.com/pdf/H3_AP202501191642343138_1.pdf?1737372519000.pdf
医药生物行业双周报：全国第三批中成药集采开标并产生拟中选结果,中航证券,2025-01-16,中药,https://pdf.dfcfw.com/pdf/H3_AP202501161641957964_1.pdf?1737069524000.pdf
医药生物行业周报（1月第2周）：AI+医药有望加速落地,世纪证券,2025-01-13,中药,https://pdf.dfcfw.com/pdf/H3_AP202501131641898203_1.pdf?1736758720000.pdf
医药行业周报：中国-东盟医药区域集采平台启动，持续看好出海主线,西南证券,2025-01-13,中药,https://pdf.dfcfw.com/pdf/H3_AP202501131641899196_1.pdf?1736763985000.pdf
医药生物行业周报：全球首个实体瘤泛癌种TCE POC成功，或将加速整个领域的快速发展,信达证券,2025-01-13,中药,https://pdf.dfcfw.com/pdf/H3_AP202501131641899692_1.pdf?1736767872000.pdf
医药生物行业报告：眼科医疗服务价格项目指南推进行业规范高质量发展,中邮证券,2025-01-13,中药,https://pdf.dfcfw.com/pdf/H3_AP202501131641902672_1.pdf?1736783800000.pdf
医药生物行业跟踪周报：痛风URAT1靶点潜力大，关注一品红、益方生物、恒瑞医药等,东吴证券,2025-01-12,中药,https://pdf.dfcfw.com/pdf/H3_AP202501121641897117_1.pdf?1736722191000.pdf
医药生物行业定期报告：TSLP靶点重磅BD再起，看好超长效方向突破,华福证券,2025-01-12,中药,https://pdf.dfcfw.com/pdf/H3_AP202501121641896496_1.pdf?1736722399000.pdf
医药生物行业周报：关注AI制药，推荐泓博医药,开源证券,2025-01-12,中药,https://pdf.dfcfw.com/pdf/H3_AP202501121641896731_1.pdf?1736707141000.pdf
医药生物行业双周报：我国进入流感高发期,东莞证券,2025-01-10,中药,https://pdf.dfcfw.com/pdf/H3_AP202501101641886535_1.pdf?1736537610000.pdf
2024年中国备案中药材保健食品行业概览,头豹研究院,2025-01-09,中药,https://pdf.dfcfw.com/pdf/H3_AP202501091641874962_1.pdf?1736453549000.pdf
医药生物行业双周报2025年第1期总第124期：《关于全面深化药品医疗器械监管改革促进医药产业高质量发展的意见》发布，持续关注创新药械板块,长城国瑞证券,2025-01-07,中药,https://pdf.dfcfw.com/pdf/H3_AP202501071641832540_1.pdf?1736241169000.pdf
医药行业周报：创新药械政策发布，年度持续看好创新+出海主线,西南证券,2025-01-06,中药,https://pdf.dfcfw.com/pdf/H3_AP202501061641816385_1.pdf?1736180908000.pdf
医药行业周报：中成药集采落地，重点推荐昆药集团,华源证券,2025-01-05,中药,https://pdf.dfcfw.com/pdf/H3_AP202501051641812502_1.pdf?1736111988000.pdf
医药生物行业周报：国产家用医疗器械市场份额提升，化学原料药行业整体呈现量价齐升的趋势,开源证券,2025-01-05,中药,https://pdf.dfcfw.com/pdf/H3_AP202501051641812543_1.pdf?1736106684000.pdf
医药生物行业跟踪周报：信达生物DLL-3 ADC全球权益授权罗氏，提升该靶点热度,东吴证券,2025-01-05,中药,https://pdf.dfcfw.com/pdf/H3_AP202501051641812795_1.pdf?1736116545000.pdf
医药生物：重视第四代基因测序，应用端正加速发展,华福证券,2025-01-05,中药,https://pdf.dfcfw.com/pdf/H3_AP202501051641812316_1.pdf?1736156615000.pdf
医药生物周报（24年第53周）：他雷替尼获批上市，关注差异化靶点和适应症创新药,国信证券,2024-12-31,中药,https://pdf.dfcfw.com/pdf/H3_AP202412311641493615_1.pdf?1735677868000.pdf
医药生物行业周报：肿标与甲功试剂集采规则与报量已明，国产替代强化国产玩家成长逻辑,开源证券,2024-12-29,中药,https://pdf.dfcfw.com/pdf/H3_AP202412291641463349_1.pdf?1735511438000.pdf
医药行业周报：国产新药授权节奏前移，建议关注临床早期资产,华源证券,2024-12-29,中药,https://pdf.dfcfw.com/pdf/H3_AP202412291641462066_1.pdf?1735486821000.pdf
医药生物：24年即将过去，25年初医药大概率将显著表现,华福证券,2024-12-29,中药,https://pdf.dfcfw.com/pdf/H3_AP202412291641462379_1.pdf?1735490959000.pdf
医药生物行业跟踪周报：双抗ADC药物国产进度领先，重点推荐百利天恒等,东吴证券,2024-12-29,中药,https://pdf.dfcfw.com/pdf/H3_AP202412291641462817_1.pdf?1735492751000.pdf
医药行业周报：安徽IVD集采规则温和，国产替代持续,西南证券,2024-12-29,中药,https://pdf.dfcfw.com/pdf/H3_AP202412291641462991_1.pdf?1735506125000.pdf
中药板块及医药流通板块投资策略：厚积薄发，静候繁花绽放,华安证券,2024-12-27,中药,https://pdf.dfcfw.com/pdf/H3_AP202412271641445231_1.pdf?1735297398000.pdf
医药生物行业周报（24年第52周）：医保局推进医疗服务价格规范治理，发布医学影像检查价格指南,国信证券,2024-12-27,中药,https://pdf.dfcfw.com/pdf/H3_AP202412271641445687_1.pdf?1735295518000.pdf
中药行业信息点评：湖北中成药联盟集采相关数据信息发布,海通国际,2024-12-25,中药,https://pdf.dfcfw.com/pdf/H3_AP202412251641420929_1.pdf?1735118899000.pdf
医药生物行业双周报：第十批药品集采推动创新转型，高值耗材集采加速国产替代,中航证券,2024-12-25,中药,https://pdf.dfcfw.com/pdf/H3_AP202412251641423102_1.pdf?1735130157000.pdf
医药生物行业周报：CXO行业有望迎来回暖,中银证券,2024-12-24,中药,https://pdf.dfcfw.com/pdf/H3_AP202412241641419430_1.pdf?1735071970000.pdf
医药生物行业周报（12月第3周）：创新药出海加速,世纪证券,2024-12-23,中药,https://pdf.dfcfw.com/pdf/H3_AP202412231641391142_1.pdf?1734945194000.pdf
医药生物行业报告：第五批高值医用耗材集采开标，国产替代进程有望加速,中邮证券,2024-12-23,中药,https://pdf.dfcfw.com/pdf/H3_AP202412231641399005_1.pdf?1734974676000.pdf
医药行业周报：国产CGM出海可期，重点推荐三诺生物,华源证券,2024-12-22,中药,https://pdf.dfcfw.com/pdf/H3_AP202412221641389052_1.pdf?1734862866000.pdf
医药生物行业跟踪周报：抗抑郁新药进入收获期，关注吉贝尔、翰森制药、绿叶制药等,东吴证券,2024-12-22,中药,https://pdf.dfcfw.com/pdf/H3_AP202412221641390205_1.pdf?1734900730000.pdf
医药行业周报：创新药出海再添重磅产品，持续看好创新药出海,西南证券,2024-12-22,中药,https://pdf.dfcfw.com/pdf/H3_AP202412221641390240_1.pdf?1734902937000.pdf
医药生物行业周报：心血管疾病高发，Lp（a）或成为降脂治疗新靶点,开源证券,2024-12-22,中药,https://pdf.dfcfw.com/pdf/H3_AP202412221641390259_1.pdf?1734903920000.pdf
医药生物行业点评报告：药审中心发布濒危动物类中药材人工制成品相关试行稿，产业迎来新机遇,甬兴证券,2024-12-18,中药,https://pdf.dfcfw.com/pdf/H3_AP202412181641344271_1.pdf?1734535638000.pdf
医药生物行业报告：科学仪器和科研试剂领域迎政策利好，坚定看好创新、出海、并购大方向,中邮证券,2024-12-16,中药,https://pdf.dfcfw.com/pdf/H3_AP202412161641310079_1.pdf?1734346489000.pdf
医药生物行业跟踪周报：仿制药第十批集采，再次驱动向创新药转型,东吴证券,2024-12-15,中药,https://pdf.dfcfw.com/pdf/H3_AP202412151641307510_1.pdf?1734293053000.pdf
生物医药行业：第十批国采竞争相对激烈，中标品种集中度再度提升,平安证券,2024-12-15,中药,https://pdf.dfcfw.com/pdf/H3_AP202412151641307517_1.pdf?1734293263000.pdf
医药生物行业周报：政策支持+业绩改善，推荐科研服务板块性机会,开源证券,2024-12-15,中药,https://pdf.dfcfw.com/pdf/H3_AP202412151641307609_1.pdf?1734297453000.pdf
医药行业周报：集采落地看好创新，医药消费受益政策,西南证券,2024-12-15,中药,https://pdf.dfcfw.com/pdf/H3_AP202412151641307695_1.pdf?1734301336000.pdf
医药行业周报：血软价格体系有望维持稳定，重点推荐昆药集团,华源证券,2024-12-15,中药,https://pdf.dfcfw.com/pdf/H3_AP202412151641307172_1.pdf?1734284774000.pdf
医药生物行业2025年投资策略：蓄势待发，创新为王,上海证券,2024-12-13,中药,https://pdf.dfcfw.com/pdf/H3_AP202412131641288633_1.pdf?1734084781000.pdf
中药：看好行业底部反转，国企改革与并购重组共振发展,海通国际,2024-12-12,中药,https://pdf.dfcfw.com/pdf/H3_AP202412121641278024_1.pdf?1734025555000.pdf
