研报名称,机构名称,发布时间,行业,研报地址
医药生物：医药有望走出低谷，积极把握反弹行情,中泰证券,2024-11-11,中药,https://pdf.dfcfw.com/pdf/H3_AP202411111640809563_1.pdf?1731338926000.pdf
医药生物行业周报（24年第46周）：TCE双抗达成多项出海合作，自免是潜力蓝海赛道,国信证券,2024-11-11,中药,https://pdf.dfcfw.com/pdf/H3_AP202411111640810115_1.pdf?1731337614000.pdf
医药生物行业跟踪周报：不受集采影响的中药标的配置好机会，重点推荐佐力药业、华润三九等,东吴证券,2024-11-10,中药,https://pdf.dfcfw.com/pdf/H3_AP202411101640805755_1.pdf?1731276027000.pdf
医药生物行业周报：医疗服务整体业绩稳健增长，消费医疗业绩有望逐步复苏,开源证券,2024-11-10,中药,https://pdf.dfcfw.com/pdf/H3_AP202411101640805680_1.pdf?1731272463000.pdf
医药生物：关注内需，看好中药OTC+消费医疗,华福证券,2024-11-10,中药,https://pdf.dfcfw.com/pdf/H3_AP202411101640805108_1.pdf?1731259650000.pdf
医药行业周报：上调和黄医药呋喹峰值，持续看好创新药出海,华源证券,2024-11-10,中药,https://pdf.dfcfw.com/pdf/H3_AP202411101640804635_1.pdf?1731250346000.pdf
医药生物行业点评：两部门发文支持珍稀濒危中药材替代品研制,国都证券,2024-11-08,中药,https://pdf.dfcfw.com/pdf/H3_AP202411081640779326_1.pdf?1731056918000.pdf
医药生物行业周报（24年第45周）：2018年以来历年国家医保谈判情况梳理,国信证券,2024-11-06,中药,https://pdf.dfcfw.com/pdf/H3_AP202411061640748213_1.pdf?1730919877000.pdf
医药行业周报：Q3医药业绩或现筑底信号，看好Q4板块反弹,华源证券,2024-11-05,中药,https://pdf.dfcfw.com/pdf/H3_AP202411051640715778_1.pdf?1730801714000.pdf
医药生物行业双周报2024年第22期总第120期：2024年前三季度业绩总结，关注化学制药板块,长城国瑞证券,2024-11-05,中药,https://pdf.dfcfw.com/pdf/H3_AP202411051640716692_1.pdf?1730807605000.pdf
医药生物行业周报：行业三季度业绩承压，基金重仓持股总市值提升,中航证券,2024-11-05,中药,https://pdf.dfcfw.com/pdf/H3_AP202411051640729046_1.pdf?1730833659000.pdf
医药生物行业双周报：2024年国谈落幕,东莞证券,2024-11-04,中药,https://pdf.dfcfw.com/pdf/H3_AP202411041640694635_1.pdf?1730730809000.pdf
医药生物行业跟踪周报：院内化药、科研服务等业绩表现亮眼，医药板块有望补涨,东吴证券,2024-11-03,中药,https://pdf.dfcfw.com/pdf/H3_AP202411031640689204_1.pdf?1730670944000.pdf
医药生物行业定期报告：回归产业趋势，看好创新药和创新转型Pahrma,华福证券,2024-11-03,中药,https://pdf.dfcfw.com/pdf/H3_AP202411031640687529_1.pdf?1730709084000.pdf
医药生物行业周报：制药产业链温和复苏趋势已现，关注细分赛道的机会,开源证券,2024-11-03,中药,https://pdf.dfcfw.com/pdf/H3_AP202411031640687993_1.pdf?1730655674000.pdf
医药生物行业定期报告：Q3业绩有望逐步出清，把握医药反弹机会,中泰证券,2024-10-28,中药,https://pdf.dfcfw.com/pdf/H3_AP202410281640531564_1.pdf?1730112910000.pdf
医药生物行业周报：新一轮国谈启动，关注创新药链,东海证券,2024-10-28,中药,https://pdf.dfcfw.com/pdf/H3_AP202410281640537812_1.pdf?1730155280000.pdf
医药生物行业跟踪周报：双抗临床优势明显，建议关注康方生物、奥赛康、信达生物等,东吴证券,2024-10-27,中药,https://pdf.dfcfw.com/pdf/H3_AP202410271640528595_1.pdf?1730114448000.pdf
医药生物行业周报：关注医药政策密集落地后的投资机会,开源证券,2024-10-27,中药,https://pdf.dfcfw.com/pdf/H3_AP202410271640528811_1.pdf?1730065116000.pdf
医药生物行业周报：医美细分赛道仍存在增长潜力,中银证券,2024-10-27,中药,https://pdf.dfcfw.com/pdf/H3_AP202410271640528301_1.pdf?1730053974000.pdf
生物医药行业：第三批中成药带量采购开始，产品价格降幅及日均费用为中选关键,平安证券,2024-10-27,中药,https://pdf.dfcfw.com/pdf/H3_AP202410271640528412_1.pdf?1730056803000.pdf
医药生物周报（24年第43周）：辅助生殖加速纳入医保，预计带动国内IVF需求量提升,国信证券,2024-10-22,中药,https://pdf.dfcfw.com/pdf/H3_AP202410221640407303_1.pdf?1729625361000.pdf
医药生物行业双周报2024年第21期总第119期：《肥胖症诊疗指南（2024年版）》发布 关注GLP-1RA相关投资机会,长城国瑞证券,2024-10-21,中药,https://pdf.dfcfw.com/pdf/H3_AP202410211640385414_1.pdf?1729544041000.pdf
医药生物行业双周报：第十批国采进入报量测试,东莞证券,2024-10-21,中药,https://pdf.dfcfw.com/pdf/H3_AP202410211640386997_1.pdf?1729532139000.pdf
医药生物行业周报：医保外配处方集中治理，药店行业有望加速整合,东海证券,2024-10-21,中药,https://pdf.dfcfw.com/pdf/H3_AP202410211640390239_1.pdf?1729541494000.pdf
医药生物行业周报：博瑞医药BGM0504 II期减重数据公布，中国GLP-1相关管线前景可期,中银证券,2024-10-21,中药,https://pdf.dfcfw.com/pdf/H3_AP202410211640392765_1.pdf?1729543158000.pdf
医药生物行业周报：《肥胖症诊疗指南（2024年版）》发布，关注相关投资机会,开源证券,2024-10-20,中药,https://pdf.dfcfw.com/pdf/H3_AP202410201640375160_1.pdf?1729452246000.pdf
医药生物行业跟踪周报：IL市场空间大、竞争格局相对较好，关注奥赛康、信达生物、三生国健等,东吴证券,2024-10-20,中药,https://pdf.dfcfw.com/pdf/H3_AP202410201640374575_1.pdf?1729443933000.pdf
生物医药行业周报：高耗集采不断推进，规则温和利好相关国产龙头,平安证券,2024-10-20,中药,https://pdf.dfcfw.com/pdf/H3_AP202410201640374715_1.pdf?1729443448000.pdf
中药Ⅱ行业跟踪报告：2024年前三季度：中药新药研发热情延续，上市受理数量超2023年全年水平,万联证券,2024-10-16,中药,https://pdf.dfcfw.com/pdf/H3_AP202410161640326639_1.pdf?1729101402000.pdf
医药健康行业周报：景气度温和回升，把握创新药和消费两大核心领域，兼顾器械板块改善,国金证券,2024-10-14,中药,https://pdf.dfcfw.com/pdf/H3_AP202410141640278875_1.pdf?1728892079000.pdf
医药生物行业报告：财政支持地方化债，利好医药流通和ICL板块,中邮证券,2024-10-14,中药,https://pdf.dfcfw.com/pdf/H3_AP202410141640279420_1.pdf?1728895827000.pdf
医药生物行业周报：医药生物板块估值仍位于近年低位，医药及医美行业均存在回暖机会,中银证券,2024-10-13,中药,https://pdf.dfcfw.com/pdf/H3_AP202410131640276706_1.pdf?1728819502000.pdf
医药生物行业跟踪周报：MicroRNA斩获2024年诺贝尔奖，小核酸药物大有可为,东吴证券,2024-10-13,中药,https://pdf.dfcfw.com/pdf/H3_AP202410131640278366_1.pdf?1728904222000.pdf
医药生物行业周报：震荡中成长，把握后续分化行情,中航证券,2024-10-13,中药,https://pdf.dfcfw.com/pdf/H3_AP202410131640278402_1.pdf?1728861070000.pdf
医药生物行业报告：全面看多，更应把握分化后的超额收益机会,中邮证券,2024-10-08,中药,https://pdf.dfcfw.com/pdf/H3_AP202410081640189740_1.pdf?1728377477000.pdf
中药饮片加工行业集中度较低，产业处于竞争发展阶段,深圳汉鼎智库咨询服务,2024-10-08,中药,https://pdf.dfcfw.com/pdf/H3_AP202410081640195931_1.pdf?1728406036000.pdf
医药行业周报：上周哪些港股医药涨幅显著？,华源证券,2024-10-07,中药,https://pdf.dfcfw.com/pdf/H3_AP202410071640177728_1.pdf?1728300767000.pdf
医药生物行业定期报告：复盘历次牛市，数说医药表现，亟需加大仓位配置,华福证券,2024-10-07,中药,https://pdf.dfcfw.com/pdf/H3_AP202410071640177998_1.pdf?1728378856000.pdf
医药生物行业跟踪周报：市场暴涨，医药四条配置思路,东吴证券,2024-10-07,中药,https://pdf.dfcfw.com/pdf/H3_AP202410071640186849_1.pdf?1728379495000.pdf
生物医药行业：经济政策提振信心，消费医疗估值修复可期,平安证券,2024-09-30,中药,https://pdf.dfcfw.com/pdf/H3_AP202409301640096287_1.pdf?1727683525000.pdf
医药生物行业定期报告：牛市医药不会缺席，坚持创新、复苏和政策三主线,华福证券,2024-09-29,中药,https://pdf.dfcfw.com/pdf/H3_AP202409291640090916_1.pdf?1727600315000.pdf
医药行业周报：医药大涨后买什么？,华源证券,2024-09-29,中药,https://pdf.dfcfw.com/pdf/H3_AP202409291640095301_1.pdf?1727647246000.pdf
医药生物行业周报：加仓攻守兼备的医药板块,开源证券,2024-09-29,中药,https://pdf.dfcfw.com/pdf/H3_AP202409291640094419_1.pdf?1727630352000.pdf
医药行业2024年半年报总结：期待下半年业绩恢复,西南证券,2024-09-25,中药,https://pdf.dfcfw.com/pdf/H3_AP202409251640027922_1.pdf?1727275431000.pdf
医药生物行业周报：诺奖风向标表彰cGAS-STING、GLP-1、HIV相关研究,中泰证券,2024-09-23,中药,https://pdf.dfcfw.com/pdf/H3_AP202409231639975113_1.pdf?1727081363000.pdf
医药生物行业报告：医保药品目录调整专家评审结果公布，建议关注创新品种，消费医疗板块有望回暖,中邮证券,2024-09-23,中药,https://pdf.dfcfw.com/pdf/H3_AP202409231639980699_1.pdf?1727103319000.pdf
医药行业周报：医疗设备板块见底了吗？,华源证券,2024-09-22,中药,https://pdf.dfcfw.com/pdf/H3_AP202409221639974115_1.pdf?1727041047000.pdf
医药生物行业周报：中国创新药研发实力持续增强，出海前景可期。,中银证券,2024-09-22,中药,https://pdf.dfcfw.com/pdf/H3_AP202409221639974294_1.pdf?1727045480000.pdf
医药生物行业周报：产新药闪耀ESMO；关爱计划加快短缺药物研发,中泰证券,2024-09-20,中药,https://pdf.dfcfw.com/pdf/H3_AP202409201639951372_1.pdf?1726822049000.pdf
医药生物行业周报：人工耳蜗纳入新批次国采，安徽省中成药集采覆盖多个OTC大品种,上海证券,2024-09-19,中药,https://pdf.dfcfw.com/pdf/H3_AP202409191639933293_1.pdf?1726754588000.pdf
中药板块2024H1总结：业绩短期承压，提质增效为主线,中泰证券,2024-09-18,中药,https://pdf.dfcfw.com/pdf/H3_AP202409181639910831_1.pdf?1726649640000.pdf
医药行业周报：创新药为何持续上涨？,华源证券,2024-09-18,中药,https://pdf.dfcfw.com/pdf/H3_AP202409181639912581_1.pdf?1726655288000.pdf
医药生物行业报告：安徽省拟2024年中成药集采价格降幅较温和，血制品集中度加速提升,中邮证券,2024-09-18,中药,https://pdf.dfcfw.com/pdf/H3_AP202409181639914893_1.pdf?1726669435000.pdf
医药生物行业周报：医美细分行业仍然存在增长潜力，医药生物板块下半年有望迎来业绩增速改善,中银证券,2024-09-18,中药,https://pdf.dfcfw.com/pdf/H3_AP202409181639918759_1.pdf?1726675648000.pdf
医药生物行业跟踪周报：国产创新药闪耀WCLC、ESMO，关注康方生物、信达生物、恒瑞医药等,东吴证券,2024-09-17,中药,https://pdf.dfcfw.com/pdf/H3_AP202409171639905082_1.pdf?1726592448000.pdf
医药生物行业周报：医疗器械板块2024H1收入利润承压，耗材表现较佳,开源证券,2024-09-17,中药,https://pdf.dfcfw.com/pdf/H3_AP202409171639906307_1.pdf?1726598554000.pdf
生物医药行业：安罗替尼肝癌、肾癌一线治疗数据优效，具备爆发潜力,平安证券,2024-09-17,中药,https://pdf.dfcfw.com/pdf/H3_AP202409171639906890_1.pdf?1726605014000.pdf
中药Ⅲ：安徽省2024年中成药集采征求意见稿涉及较多独家品种、日常用药，价格降幅较温和,中邮证券,2024-09-11,中药,https://pdf.dfcfw.com/pdf/H3_AP202409111639831315_1.pdf?1726067479000.pdf
医药生物行业周报：健康乡村建设助力渠道下沉，看好医药Q3修复,中泰证券,2024-09-09,中药,https://pdf.dfcfw.com/pdf/H3_AP202409091639801754_1.pdf?1725909436000.pdf
医药生物行业报告：半年报业绩整体稳健，分化中挖掘底部机会,中邮证券,2024-09-09,中药,https://pdf.dfcfw.com/pdf/H3_AP202409091639790416_1.pdf?1725885357000.pdf
医药生物行业周报：寒冬渐逝，重拾信心,上海证券,2024-09-09,中药,https://pdf.dfcfw.com/pdf/H3_AP202409091639790539_1.pdf?1725889846000.pdf
医药行业周报：Pharma创新成果显著，迈入商业化收获阶段,华源证券,2024-09-08,中药,https://pdf.dfcfw.com/pdf/H3_AP202409081639787066_1.pdf?1725870695000.pdf
医药生物行业跟踪周报：医药商业受益于院内复苏，关注上海医药、国药股份、九州通等,东吴证券,2024-09-08,中药,https://pdf.dfcfw.com/pdf/H3_AP202409081639786393_1.pdf?1725814041000.pdf
医药生物行业周报：中药及商业板块整体略显承压，部分个股表现亮眼,开源证券,2024-09-08,中药,https://pdf.dfcfw.com/pdf/H3_AP202409081639786701_1.pdf?1725820713000.pdf
医药生物行业周报：赛诺菲流感疫苗暂停供应，国产流感疫苗有望承接市场空缺,中银证券,2024-09-07,中药,https://pdf.dfcfw.com/pdf/H3_AP202409071639785093_1.pdf?1725716179000.pdf
医药生物行业周报：2024H1医药生物板块受到高基数影响，2024H2伴随政策支持落地有望实现增速改善,中银证券,2024-09-03,中药,https://pdf.dfcfw.com/pdf/H3_AP202409031639708243_1.pdf?1725372148000.pdf
医药生物行业双周报2024年第18期总第116期：行业分化明显，关注化学制剂、原料药和CXO板块,长城国瑞证券,2024-09-03,中药,https://pdf.dfcfw.com/pdf/H3_AP202409031639712156_1.pdf?1725381076000.pdf
医药生物：中报分化，至暗已过，看多Pharma和创新药,华福证券,2024-09-02,中药,https://pdf.dfcfw.com/pdf/H3_AP202409021639684450_1.pdf?1725271415000.pdf
医药行业周报：2024中报总结，重点关注血制品、创新药、原料药板块,德邦证券,2024-09-02,中药,https://pdf.dfcfw.com/pdf/H3_AP202409021639685839_1.pdf?1725278109000.pdf
医药生物行业周报：行业估值处于低位+24H2行业有望环比改善，建议重点关注医药行业,信达证券,2024-09-02,中药,https://pdf.dfcfw.com/pdf/H3_AP202409021639691570_1.pdf?1725293131000.pdf
生物医药行业周报：国产两款IL-17单抗获批上市，打破外资垄断竞争局面,平安证券,2024-09-02,中药,https://pdf.dfcfw.com/pdf/H3_AP202409021639692054_1.pdf?1725298997000.pdf
医药行业周报：中报业绩落地，期待下半年边际改善,华源证券,2024-09-02,中药,https://pdf.dfcfw.com/pdf/H3_AP202409021639697903_1.pdf?1725305132000.pdf
医药生物行业周报：原料药公司业绩较快增长，景气度有望持续提升,开源证券,2024-09-01,中药,https://pdf.dfcfw.com/pdf/H3_AP202409011639682014_1.pdf?1725228485000.pdf
医药生物周报（24年第29周）：关注中报后板块机会，重点推荐创新药械产业链,国信证券,2024-08-28,中药,https://pdf.dfcfw.com/pdf/H3_AP202408281639521218_1.pdf?1724871656000.pdf
医药生物行业报告：半年报业绩整体稳健，板块回调后有望迎来反弹,中邮证券,2024-08-27,中药,https://pdf.dfcfw.com/pdf/H3_AP202408271639474693_1.pdf?1724761704000.pdf
医药生物行业深度研究：处方外流持续推进，零售药店集中度提升,国联证券,2024-08-27,中药,https://pdf.dfcfw.com/pdf/H3_AP202408271639500384_1.pdf?1724795432000.pdf
医药生物行业跟踪周报：创新药通过商业化或BD实现盈利，跨越到新阶段,东吴证券,2024-08-26,中药,https://pdf.dfcfw.com/pdf/H3_AP202408261639445261_1.pdf?1724630563000.pdf
医药行业周报：以日本为鉴，关注结构性机会,德邦证券,2024-08-26,中药,https://pdf.dfcfw.com/pdf/H3_AP202408261639446035_1.pdf?1724659774000.pdf
2024年中国中药行业发展前景分析：银发经济与政策双轮推动中药行业高景气发展,头豹研究院,2024-08-26,中药,https://pdf.dfcfw.com/pdf/H3_AP202408261639462932_1.pdf?1724702248000.pdf
医药生物行业周报：多数制药公司业绩稳健，迎接制药商业化新周期,开源证券,2024-08-25,中药,https://pdf.dfcfw.com/pdf/H3_AP202408251639443800_1.pdf?1724617386000.pdf
生物医药行业：氟泽雷塞国内获批上市，KRAS赛道曙光初现,平安证券,2024-08-25,中药,https://pdf.dfcfw.com/pdf/H3_AP202408251639444077_1.pdf?1724622549000.pdf
医药行业周报：头部药企创新转型成果显著，迈入创新收获新周期,华源证券,2024-08-25,中药,https://pdf.dfcfw.com/pdf/H3_AP202408251639441490_1.pdf?1724596251000.pdf
医药生物行业周报：2024H1创新药License-out表现优秀，创新药出海前景可期,中银证券,2024-08-24,中药,https://pdf.dfcfw.com/pdf/H3_AP202408241639439390_1.pdf?1724511233000.pdf
医药产业链数据库之：中成药零售端销售，H1保持平稳，细分领域大品种排名稳定,国投证券,2024-08-22,中药,https://pdf.dfcfw.com/pdf/H3_AP202408221639392990_1.pdf?1724333932000.pdf
医药生物行业跟踪周报：院内标的Q2已超预期趋势，Q3望加速,东吴证券,2024-08-19,中药,https://pdf.dfcfw.com/pdf/H3_AP202408191639326505_1.pdf?1724030859000.pdf
医药生物行业报告：坚持高确定性成长板块加底部业绩反转个股配置思路,中邮证券,2024-08-19,中药,https://pdf.dfcfw.com/pdf/H3_AP202408191639332291_1.pdf?1724080617000.pdf
行业点评报告：关注2024年医保目录调整，多家公司有望受益,开源证券,2024-08-18,中药,https://pdf.dfcfw.com/pdf/H3_AP202408181639325611_1.pdf?1724009964000.pdf
医药生物行业定期报告：看好院内+创新，亦可关注人工骨市场变化,华福证券,2024-08-18,中药,https://pdf.dfcfw.com/pdf/H3_AP202408181639324209_1.pdf?1723999551000.pdf
医药行业周报：关注老龄化带来医疗器械投资机会,华源证券,2024-08-18,中药,https://pdf.dfcfw.com/pdf/H3_AP202408181639324287_1.pdf?1723998930000.pdf
医药生物行业周报：县域医共体设备更新逐步推进,中银证券,2024-08-18,中药,https://pdf.dfcfw.com/pdf/H3_AP202408181639324919_1.pdf?1723998240000.pdf
随着中医药高质量融入“一带一路”发展，中药材进出口迎来发展机遇,深圳汉鼎智库咨询服务,2024-08-15,中药,https://pdf.dfcfw.com/pdf/H3_AP202408151639292679_1.pdf?1723750966000.pdf
我国中药材资源丰富，中药材市场发展空间广阔,深圳汉鼎智库咨询服务,2024-08-15,中药,https://pdf.dfcfw.com/pdf/H3_AP202408151639292680_1.pdf?1723751165000.pdf
医药生物行业研究周报：积极关注人口老龄化带来的长期投资机会,天风证券,2024-08-13,中药,https://pdf.dfcfw.com/pdf/H3_AP202408131639249470_1.pdf?1723543444000.pdf
医药生物行业跟踪周报：看好创新药品种商业放量，关注海思科、迪哲医药-U、康方生物等,东吴证券,2024-08-12,中药,https://pdf.dfcfw.com/pdf/H3_AP202408121639233083_1.pdf?1723430240000.pdf
医药生物行业周报：关注医美新品进展，聚焦细分赛道增长,上海证券,2024-08-12,中药,https://pdf.dfcfw.com/pdf/H3_AP202408121639234539_1.pdf?1723454894000.pdf
医药生物行业周报：详解GLP-1事件及观点；医保目录初审名单公布,中泰证券,2024-08-12,中药,https://pdf.dfcfw.com/pdf/H3_AP202408121639234932_1.pdf?1723458168000.pdf
医药生物行业报告：关注中报绩优标的，看好板块持续反弹,中邮证券,2024-08-12,中药,https://pdf.dfcfw.com/pdf/H3_AP202408121639235137_1.pdf?1723460280000.pdf
医药生物行业周报：多个细分领域获政策支持，医药估值低位值得加仓布局,信达证券,2024-08-12,中药,https://pdf.dfcfw.com/pdf/H3_AP202408121639236208_1.pdf?1723473284000.pdf
医药生物行业周报：2024H1 GLP-1单品快速放量，产业景气度持续提升,开源证券,2024-08-11,中药,https://pdf.dfcfw.com/pdf/H3_AP202408111639232370_1.pdf?1723405325000.pdf
医药行业周报：GLP-1显著放大注射笔需求，重点推荐美好医疗,华源证券,2024-08-11,中药,https://pdf.dfcfw.com/pdf/H3_AP202408111639232443_1.pdf?1723413050000.pdf
医药生物行业周报：大规模设备更新政策持续推进，首批支持资金预计于近日下达,中银证券,2024-08-10,中药,https://pdf.dfcfw.com/pdf/H3_AP202408101639230696_1.pdf?1723307638000.pdf
医药生物行业点评：政策持续推动，中药有望迎来黄金发展期,国都证券,2024-08-08,中药,https://pdf.dfcfw.com/pdf/H3_AP202409131639871231_1.pdf?1726242745000.pdf
医药生物行业跟踪周报：国务院鼓励医保参保长效机制，利于医保收入稳增长,东吴证券,2024-08-05,中药,https://pdf.dfcfw.com/pdf/H3_AP202408051639134173_1.pdf?1722824003000.pdf
中药Ⅱ行业点评：天士力拟变更实际控制人为华润集团，中药国企改革新篇章拉开序幕,华安证券,2024-08-05,中药,https://pdf.dfcfw.com/pdf/H3_AP202408051639134194_1.pdf?1722844212000.pdf
生物医药行业：原料药上下游供需关系持续改善，专利悬崖+制剂一体化有望贡献长期增量,平安证券,2024-08-05,中药,https://pdf.dfcfw.com/pdf/H3_AP202408051639134539_1.pdf?1722850052000.pdf
医药行业周报：下半年医药配置思路需紧跟政策导向,德邦证券,2024-08-05,中药,https://pdf.dfcfw.com/pdf/H3_AP202408051639134517_1.pdf?1722844212000.pdf
医药生物行业周报：估值仍位于近年低位，医药生物支持政策持续推出,中银证券,2024-08-05,中药,https://pdf.dfcfw.com/pdf/H3_AP202408051639136407_1.pdf?1722851143000.pdf
医药生物行业周报：政策促服务消费高质量发展，关注“养老&健康消费”相关标的,信达证券,2024-08-05,中药,https://pdf.dfcfw.com/pdf/H3_AP202408051639137838_1.pdf?1722858967000.pdf
医药生物行业周报：创新药支持政策持续加码，利好全产业链,上海证券,2024-08-05,中药,https://pdf.dfcfw.com/pdf/H3_AP202408051639138353_1.pdf?1722866042000.pdf
医药生物行业报告：医保利好政策密集发布，医药生物整体明显反弹,中邮证券,2024-08-05,中药,https://pdf.dfcfw.com/pdf/H3_AP202408051639141994_1.pdf?1722874636000.pdf
医药生物行业周报：全链条支持创新产业发展，创新药再迎政策利好,开源证券,2024-08-04,中药,https://pdf.dfcfw.com/pdf/H3_AP202408041639133106_1.pdf?1722795629000.pdf
医药行业周报：全球CGM延续快增趋势，关注国产企业出海机会,华源证券,2024-08-04,中药,https://pdf.dfcfw.com/pdf/H3_AP202408041639133522_1.pdf?1722806326000.pdf
医药行业周报：医疗设备更新逐步落地有望推动行业快速恢复,德邦证券,2024-08-01,中药,https://pdf.dfcfw.com/pdf/H3_AP202408011638816735_1.pdf?1722534559000.pdf
医药生物行业周报：2024H行业基金重仓持股数据出炉，器械、中药板块内部轮动,中航证券,2024-07-30,中药,https://pdf.dfcfw.com/pdf/H3_AP202407301638460616_1.pdf?1722336666000.pdf
医药生物行业周报：DRG_DIP 2.0版分组方案出炉，特例单议机制支持新药、新技术合理应用,上海证券,2024-07-29,中药,https://pdf.dfcfw.com/pdf/H3_AP202407291638428179_1.pdf?1722268466000.pdf
医药生物行业周报：DRG_DIP 2.0版发布，利好创新应用,东海证券,2024-07-29,中药,https://pdf.dfcfw.com/pdf/H3_AP202407291638428348_1.pdf?1722268890000.pdf
医药生物行业报告：2024Q2部分子板块公募基金持仓占比环比提升,中邮证券,2024-07-29,中药,https://pdf.dfcfw.com/pdf/H3_AP202407291638436098_1.pdf?1722279378000.pdf
医药生物行业双周报：新版的DRG_DIP分组方案正式“出炉”,东莞证券,2024-07-28,中药,https://pdf.dfcfw.com/pdf/H3_AP202407281638399331_1.pdf?1722263456000.pdf
医药生物行业周报：DRG+DIP2.0方案深度优化医保付费，助力医保+医疗+医药三医均衡发展,开源证券,2024-07-28,中药,https://pdf.dfcfw.com/pdf/H3_AP202407281638399482_1.pdf?1722190398000.pdf
医药生物行业跟踪周报：DRG_DIP2.0版医保政策利好创新药械，医保累计结余再创新高,东吴证券,2024-07-28,中药,https://pdf.dfcfw.com/pdf/H3_AP202407281638400867_1.pdf?1722195171000.pdf
医药生物：继续关注医药中报，布局底部核心资产,华福证券,2024-07-28,中药,https://pdf.dfcfw.com/pdf/H3_AP202407281638403183_1.pdf?1722203260000.pdf
医药生物行业周报：持续深化医疗改革，大力发展新质生产力,东海证券,2024-07-23,中药,https://pdf.dfcfw.com/pdf/H3_AP202407231638201425_1.pdf?1721721011000.pdf
医药生物行业周报：上半年6款中药新药获批，板块迎来收获期,上海证券,2024-07-22,中药,https://pdf.dfcfw.com/pdf/H3_AP202407221638178482_1.pdf?1721658891000.pdf
医药生物行业报告：替尔泊肽减重适应症在华获批，减肥药赛道再添重磅产品,中邮证券,2024-07-22,中药,https://pdf.dfcfw.com/pdf/H3_AP202407221638182452_1.pdf?1721663703000.pdf
医药生物行业跟踪周报：为什么底部的医药资产具有强吸引力？,东吴证券,2024-07-21,中药,https://pdf.dfcfw.com/pdf/H3_AP202407211638149878_1.pdf?1721572372000.pdf
医药生物行业周报：中药集采由点到面，规则逐步完善,开源证券,2024-07-21,中药,https://pdf.dfcfw.com/pdf/H3_AP202407211638150055_1.pdf?1721572998000.pdf
医药生物2024年中期投资策略：布局创新药、中药及医疗设备领域优质个股,国都证券,2024-07-16,中药,https://pdf.dfcfw.com/pdf/H3_AP202407161637963399_1.pdf?1721148199000.pdf
医药行业周报：关注低估值板块超跌反弹,西南证券,2024-07-15,中药,https://pdf.dfcfw.com/pdf/H3_AP202407141637895229_1.pdf?1721038007000.pdf
医药生物行业跟踪周报：医药板块估值底已现，看好子行业龙头,东吴证券,2024-07-15,中药,https://pdf.dfcfw.com/pdf/H3_AP202407151637898474_1.pdf?1721003455000.pdf
医药生物行业报告：国产创新药企业出海进程不断深化，建议关注医药板块底部投资机会,中邮证券,2024-07-15,中药,https://pdf.dfcfw.com/pdf/H3_AP202407151637924599_1.pdf?1721063636000.pdf
