研报名称,机构名称,发布时间,行业,研报地址
医药生物行业周报（25年第22周）：血液净化器械行业分析，关注产业链国产替代趋势,国信证券,2025-06-05,中药,https://pdf.dfcfw.com/pdf/H3_AP202506051685113267_1.pdf?1749123756000.pdf
医药生物行业周报：创新药密集上市，关注后续医保谈判,东海证券,2025-06-03,中药,https://pdf.dfcfw.com/pdf/H3_AP202506031684160775_1.pdf?1748984799000.pdf
医药生物行业报告：国产创新药密集获批上市，创新药关注度持续提升,中邮证券,2025-06-03,中药,https://pdf.dfcfw.com/pdf/H3_AP202506031684192019_1.pdf?1748985339000.pdf
医药生物行业周报：重视Pharma估值重塑的机会,开源证券,2025-06-02,中药,https://pdf.dfcfw.com/pdf/H3_AP202506021683456581_1.pdf?1748868343000.pdf
医药生物行业跟踪周报：脑卒中千亿市场，千红制药创新药106有望成为50亿大单品,东吴证券,2025-06-02,中药,https://pdf.dfcfw.com/pdf/H3_AP202506021683623710_1.pdf?1748893236000.pdf
医药行业周报：中国创新药BD能力显著提升，后续潜力值得继续期待,华源证券,2025-06-02,中药,https://pdf.dfcfw.com/pdf/H3_AP202506021683696868_1.pdf?1748949580000.pdf
医药生物行业周报：ASCO催化创新药投资热情，内需复苏&自主可控条线或值得重视,信达证券,2025-06-02,中药,https://pdf.dfcfw.com/pdf/H3_AP202506021683663949_1.pdf?1748899673000.pdf
医药生物行业周报：创新药板块表现靓眼,东莞证券,2025-05-30,中药,https://pdf.dfcfw.com/pdf/H3_AP202505301681821107_1.pdf?1748621204000.pdf
医药生物行业周报：关注ASCO2025数据发布，国产创新药展现丰硕成果,中航证券,2025-05-26,中药,https://pdf.dfcfw.com/pdf/H3_AP202505261679280081_1.pdf?1748245149000.pdf
医药生物行业周报：重磅BD交易再次带动创新药热度,东海证券,2025-05-26,中药,https://pdf.dfcfw.com/pdf/H3_AP202505261679601342_1.pdf?1748293136000.pdf
医药生物周报（25年第21周）：脓毒症治疗或迎来创新疗法，建议关注远大医药,国信证券,2025-05-26,中药,https://pdf.dfcfw.com/pdf/H3_AP202505261679625361_1.pdf?1748296396000.pdf
医药生物行业周报：经营拐点显现，动保业务有望贡献较大业绩弹性，推荐国邦医药,开源证券,2025-05-25,中药,https://pdf.dfcfw.com/pdf/H3_AP202505251678900043_1.pdf?1748190186000.pdf
医药生物行业跟踪周报：国产创新药闪耀ASCO国际舞台,东吴证券,2025-05-25,中药,https://pdf.dfcfw.com/pdf/H3_AP202505251679064459_1.pdf?1748212236000.pdf
2024年和2025Q1医药生物行业业绩总结,中航证券,2025-05-20,中药,https://pdf.dfcfw.com/pdf/H3_AP202505201676001046_1.pdf?1747756937000.pdf
医药生物行业跟踪周报：三抗药物研发进入快车道，建议关注泽璟制药、三生制药等,东吴证券,2025-05-19,中药,https://pdf.dfcfw.com/pdf/H3_AP202505191675410105_1.pdf?1747676637000.pdf
医药生物行业报告：特朗普计划降低美国药品价格，CXO企业有望受益,中邮证券,2025-05-19,中药,https://pdf.dfcfw.com/pdf/H3_AP202505191675506124_1.pdf?1747679041000.pdf
医药生物行业周报：创新药链热度持续，关注中药等细分板块,东海证券,2025-05-19,中药,https://pdf.dfcfw.com/pdf/H3_AP202505191675620398_1.pdf?1747697750000.pdf
医药生物行业周报：医药商业2024及2025Q1总结，关注龙头企稳恢复,开源证券,2025-05-18,中药,https://pdf.dfcfw.com/pdf/H3_AP202505181674988251_1.pdf?1747602241000.pdf
医药生物行业双周报：河南省耗材集采新规发布,东莞证券,2025-05-17,中药,https://pdf.dfcfw.com/pdf/H3_AP202505171674018059_1.pdf?1747582859000.pdf
医药生物行业2025年5月投资策略：推荐关注创新药及创新产业链,国信证券,2025-05-16,中药,https://pdf.dfcfw.com/pdf/H3_AP202505161673838830_1.pdf?1747412984000.pdf
医药生物行业周报（25年第19周）：美国药品价格改革回顾,国信证券,2025-05-14,中药,https://pdf.dfcfw.com/pdf/H3_AP202505141672592803_1.pdf?1747229834000.pdf
医药行业周报：慢性心衰大品种JK07潜力，继续重点推荐信立泰,华源证券,2025-05-12,中药,https://pdf.dfcfw.com/pdf/H3_AP202505121671420973_1.pdf?1747047888000.pdf
医药生物周报（25年第18周）：2024年及2025一季度A股生物医药行业财报总结,国信证券,2025-05-12,中药,https://pdf.dfcfw.com/pdf/H3_AP202505121671595071_1.pdf?1747083934000.pdf
医药生物行业跟踪报告：关注创新、出海、自主可控,万联证券,2025-05-12,中药,https://pdf.dfcfw.com/pdf/H3_AP202505121671615297_1.pdf?1747084241000.pdf
医药生物行业周报：TCE实体瘤赛道更新，关注Janux和Vir积极进展,开源证券,2025-05-11,中药,https://pdf.dfcfw.com/pdf/H3_AP202505111671173084_1.pdf?1746993692000.pdf
医药生物行业跟踪周报：GLP-1药物成为药王，建议关注博瑞医药、信达生物、联邦制药等,东吴证券,2025-05-11,中药,https://pdf.dfcfw.com/pdf/H3_AP202505111671224737_1.pdf?1747005254000.pdf
医药生物行业2024年及2025年一季度业绩综述：Q1板块业绩承压，关注细分景气方向,东莞证券,2025-05-08,中药,https://pdf.dfcfw.com/pdf/H3_AP202505081669489873_1.pdf?1746723959000.pdf
医药行业：2024年&2025Q1总结：业绩持续探底，Q2有望企稳回升,华源证券,2025-05-08,中药,https://pdf.dfcfw.com/pdf/H3_AP202505081669404647_1.pdf?1746713431000.pdf
医药行业周报：2024&25Q1业绩总结：增速持续探底，看好Q2企稳回升,华源证券,2025-05-06,中药,https://pdf.dfcfw.com/pdf/H3_AP202505051667877474_1.pdf?1746519314000.pdf
医药生物周报（24年第17周）：ASCO摘要标题整理，25Q1公募基金医药持仓分析,国信证券,2025-04-30,中药,https://pdf.dfcfw.com/pdf/H3_AP202504301665073574_1.pdf?1746035550000.pdf
医药行业周报：抑郁_癫痫新药需求突出，建议关注华纳药厂_海南海药,华源证券,2025-04-28,中药,https://pdf.dfcfw.com/pdf/H3_AP202504281663736265_1.pdf?1745852851000.pdf
医药生物行业周报：医药数智化转型方案发布，加快中医药产业升级步伐,上海证券,2025-04-28,中药,https://pdf.dfcfw.com/pdf/H3_AP202504281663761301_1.pdf?1745840916000.pdf
医药生物行业报告：强生公布PFA研究进展，2025年国产PFA品牌有望进入商业化快车道,中邮证券,2025-04-28,中药,https://pdf.dfcfw.com/pdf/H3_AP202504281664019842_1.pdf?1745875919000.pdf
医药生物行业周报：看好Q2板块复苏，重点关注创新药+AI医疗+消费医疗,信达证券,2025-04-27,中药,https://pdf.dfcfw.com/pdf/H3_AP202504271663366471_1.pdf?1745780674000.pdf
医药生物行业周报：关注左侧中药板块的结构性机会,开源证券,2025-04-27,中药,https://pdf.dfcfw.com/pdf/H3_AP202504271663366482_1.pdf?1745777696000.pdf
医药生物行业跟踪周报：康方生物PD1_VEGF双抗研发成果，点燃全球双抗热情,东吴证券,2025-04-27,中药,https://pdf.dfcfw.com/pdf/H3_AP202504271663412760_1.pdf?1745788769000.pdf
医药生物行业周报：公募基金医药重仓持股比例环比提升，化学制药和医疗服务板块持仓比重提升,中航证券,2025-04-27,中药,https://pdf.dfcfw.com/pdf/H3_AP202504271663465614_1.pdf?1745794514000.pdf
医药生物行业双周报：福建省医疗设备集采结果公布,东莞证券,2025-04-25,中药,https://pdf.dfcfw.com/pdf/H3_AP202504251662184480_1.pdf?1745595137000.pdf
医药生物行业周报（25年第16周）：映恩生物完成港股IPO，继续推荐关注具备全球潜力的创新药标的,国信证券,2025-04-24,中药,https://pdf.dfcfw.com/pdf/H3_AP202504241661513224_1.pdf?1745494959000.pdf
医药生物行业周报（4月第3周）：减肥药BD有望加速,世纪证券,2025-04-21,中药,https://pdf.dfcfw.com/pdf/H3_AP202504211659781550_1.pdf?1745224978000.pdf
医药生物行业跟踪周报：核药创新药全面进入收获期，建议关注东诚药业、远大医药等,东吴证券,2025-04-21,中药,https://pdf.dfcfw.com/pdf/H3_AP202504211659791945_1.pdf?1745225888000.pdf
医药生物行业报告：12部门联合发布《促进健康消费专项行动方案》，药店板块有望受益,中邮证券,2025-04-21,中药,https://pdf.dfcfw.com/pdf/H3_AP202504211659874321_1.pdf?1745250343000.pdf
医药行业周报：重磅大单品S086上市在即，重点推荐信立泰,华源证券,2025-04-20,中药,https://pdf.dfcfw.com/pdf/H3_AP202504201659567967_1.pdf?1745186793000.pdf
医药生物行业周报：Bima联合司美的数据将在ADA大会读出，减重进入高质量时代,开源证券,2025-04-20,中药,https://pdf.dfcfw.com/pdf/H3_AP202504201659383390_1.pdf?1745156574000.pdf
医药生物行业跟踪周报：医药板块，看好内需国产替代+自主可控,东吴证券,2025-04-16,中药,https://pdf.dfcfw.com/pdf/H3_AP202504161657254265_1.pdf?1744797647000.pdf
医药行业周报：PD1_VEGF重磅数据即将来临，继续推荐康方生物、三生制药,华源证券,2025-04-14,中药,https://pdf.dfcfw.com/pdf/H3_AP202504131655866342_1.pdf?1744622406000.pdf
医药生物行业周报：北京、深圳传政策东风，坚定看好创新药投资主线,中航证券,2025-04-14,中药,https://pdf.dfcfw.com/pdf/H3_AP202504141656201582_1.pdf?1744618812000.pdf
医药生物周报（25年第15周）：生育支持和健康消费齐发力，推荐关注医疗服务板块,国信证券,2025-04-14,中药,https://pdf.dfcfw.com/pdf/H3_AP202504141656399102_1.pdf?1744663452000.pdf
医药生物行业报告：FDA将逐步取消对单抗和其他药物的动物实验要求，AI制药有望受益,中邮证券,2025-04-14,中药,https://pdf.dfcfw.com/pdf/H3_AP202504141656405819_1.pdf?1744653424000.pdf
医药生物行业周报：推荐科研服务板块国产替代的机会,开源证券,2025-04-13,中药,https://pdf.dfcfw.com/pdf/H3_AP202504131655848243_1.pdf?1744557561000.pdf
医药生物行业报告：中美互加关税，部分器械行业或将受益于国产替代加速,中邮证券,2025-04-08,中药,https://pdf.dfcfw.com/pdf/H3_AP202504071652810437_1.pdf?1744108029000.pdf
医药生物行业专题报告：医药行业24H2基金全部持仓分析-非药主动基金自22H1以来再次低配医药,华福证券,2025-04-07,中药,https://pdf.dfcfw.com/pdf/H3_AP202504071652677424_1.pdf?1744024277000.pdf
医药生物：痛风专题：有望诞生创新药大单品的蓝海，关注一品红,华福证券,2025-04-06,中药,https://pdf.dfcfw.com/pdf/H3_AP202504061652392078_1.pdf?1743973311000.pdf
医药行业周报：政策持续支持中药创新，关注健民集团,华源证券,2025-04-06,中药,https://pdf.dfcfw.com/pdf/H3_AP202504061652328870_1.pdf?1743961324000.pdf
医药生物行业跟踪周报：关税战背景下，医药板块确定性更高,东吴证券,2025-04-06,中药,https://pdf.dfcfw.com/pdf/H3_AP202504061652352073_1.pdf?1743965946000.pdf
医药生物行业周报：关注优化药品集采下的投资机会,开源证券,2025-04-06,中药,https://pdf.dfcfw.com/pdf/H3_AP202504061652367033_1.pdf?1743971666000.pdf
医药行业周报：关税对医药细分板块影响有限，部分有利于国产替代,西南证券,2025-04-06,中药,https://pdf.dfcfw.com/pdf/H3_AP202504061652367047_1.pdf?1743971948000.pdf
医药生物行业周报：创新药出海持续推进，中国创新药资产价值不断提升,中航证券,2025-04-03,中药,https://pdf.dfcfw.com/pdf/H3_AP202504031650646808_1.pdf?1743664049000.pdf
医药生物周报（25年第13周）：后奥马珠时代，CSU领域迎来新疗法,国信证券,2025-04-01,中药,https://pdf.dfcfw.com/pdf/H3_AP202504011649920715_1.pdf?1743536267000.pdf
医药生物行业跟踪周报：国内创新药与MNC的BD交易活跃，建议关注三生制药、新诺威、恒瑞医药等,东吴证券,2025-03-31,中药,https://pdf.dfcfw.com/pdf/H3_AP202503311649434880_1.pdf?1743410519000.pdf
医药行业周报：期待优化集采政策落地,西南证券,2025-03-31,中药,https://pdf.dfcfw.com/pdf/H3_AP202503311649502524_1.pdf?1743422425000.pdf
医药生物行业周报：医药生物行业双周报2025年第7期总第130期2024年医疗保障事业发展统计快报发布建议关注三大主线机会,长城国瑞证券,2025-03-31,中药,https://pdf.dfcfw.com/pdf/H3_AP202503311649603860_1.pdf?1743439214000.pdf
医药生物行业周报：关注业绩,东海证券,2025-03-31,中药,https://pdf.dfcfw.com/pdf/H3_AP202503311649647989_1.pdf?1743446629000.pdf
医药生物行业报告：集采政策进一步优化，关注创仿、流通药企,中邮证券,2025-03-31,中药,https://pdf.dfcfw.com/pdf/H3_AP202503311649520602_1.pdf?1743426059000.pdf
医药生物行业：政策驱动医药情绪回暖，创新药及尼古丁袋表现强势,华福证券,2025-03-30,中药,https://pdf.dfcfw.com/pdf/H3_AP202503301649149796_1.pdf?1743356550000.pdf
医药生物行业周报：看好2025年行业企稳反转，短期关注Q1业绩超预期个股,信达证券,2025-03-30,中药,https://pdf.dfcfw.com/pdf/H3_AP202503301649159301_1.pdf?1743358366000.pdf
医药行业周报：Pharma业绩超预期，关注商业化+BD预期,华源证券,2025-03-30,中药,https://pdf.dfcfw.com/pdf/H3_AP202503301649187032_1.pdf?1743364100000.pdf
医药生物行业周报：脑机接口发展加速，商业落地前景可期,开源证券,2025-03-30,中药,https://pdf.dfcfw.com/pdf/H3_AP202503301649195365_1.pdf?1743374814000.pdf
医药生物行业周报：体系高质量发展,东海证券,2025-03-25,中药,https://pdf.dfcfw.com/pdf/H3_AP202503251647229077_1.pdf?1742903988000.pdf
医药行业周报：脑机技术潜力可期，医保立项有望助力加速落地,华源证券,2025-03-24,中药,https://pdf.dfcfw.com/pdf/H3_AP202503231646530755_1.pdf?1742807841000.pdf
医药生物行业周报：国务院部署促进中医药产业高质量发展，利好中药龙头企业,中航证券,2025-03-24,中药,https://pdf.dfcfw.com/pdf/H3_AP202503241646706992_1.pdf?1742803420000.pdf
医药生物行业跟踪周报：2024年医保结余再创新高，持续向创新药倾斜,东吴证券,2025-03-24,中药,https://pdf.dfcfw.com/pdf/H3_AP202503241646707042_1.pdf?1742803936000.pdf
医药行业周报：财报来临，关注业绩和估值匹配标的,西南证券,2025-03-23,中药,https://pdf.dfcfw.com/pdf/H3_AP202503231646502805_1.pdf?1742764044000.pdf
医药生物行业周报：原发性头痛用中成药市场待开发，关注NDA新品,开源证券,2025-03-23,中药,https://pdf.dfcfw.com/pdf/H3_AP202503231646366418_1.pdf?1742737231000.pdf
医药生物行业定期报告：DLL3靶点，将改变SCLC疗法，潜在市场巨大,华福证券,2025-03-23,中药,https://pdf.dfcfw.com/pdf/H3_AP202503231646442807_1.pdf?1742750337000.pdf
医药生物行业周报（25年第11周）：TYK2抑制剂银屑病数据读出，持续关注自免适应症临床进展,国信证券,2025-03-21,中药,https://pdf.dfcfw.com/pdf/H3_AP202503211645404591_1.pdf?1742545304000.pdf
医药生物行业周报：关注医疗服务消费投资机会,东海证券,2025-03-18,中药,https://pdf.dfcfw.com/pdf/H3_AP202503181644464830_1.pdf?1742263834000.pdf
县域医共体信息,中航证券,2025-03-17,中药,https://pdf.dfcfw.com/pdf/H3_AP202503171644435636_1.pdf?1742202515000.pdf
医药生物行业周报：辅助生殖政策量变引发市场关注，医药板块持续活跃,华安证券,2025-03-17,中药,https://pdf.dfcfw.com/pdf/H3_AP202503171644436462_1.pdf?1742203903000.pdf
生物医药行业：实施提振消费专项行动，消费医疗有望迎来复苏,平安证券,2025-03-17,中药,https://pdf.dfcfw.com/pdf/H3_AP202503171644436789_1.pdf?1742206470000.pdf
医药生物行业报告：多胎补贴政策下，辅助生殖、NITP等板块有望受益,中邮证券,2025-03-17,中药,https://pdf.dfcfw.com/pdf/H3_AP202503171644443328_1.pdf?1742222084000.pdf
医药生物行业周报：行业趋势：强生、艾伯维、礼来、赛诺菲等大药企纷纷布局下一代自免口服药,开源证券,2025-03-16,中药,https://pdf.dfcfw.com/pdf/H3_AP202503161644424097_1.pdf?1742154507000.pdf
医药生物行业跟踪周报：H股仿创药被显著低估，关注三生制药、康哲药业、远大医药等,东吴证券,2025-03-16,中药,https://pdf.dfcfw.com/pdf/H3_AP202503161644425403_1.pdf?1742159272000.pdf
医药生物行业周报：消费刺激政策预期强烈，关注生育及儿童相关的医疗消费,信达证券,2025-03-16,中药,https://pdf.dfcfw.com/pdf/H3_AP202503161644426584_1.pdf?1742164877000.pdf
医药生物周报（25年第10周）：Illumina被禁止向中国出口测序仪，国产替代有望加速,国信证券,2025-03-11,中药,https://pdf.dfcfw.com/pdf/H3_AP202503111644271158_1.pdf?1741725151000.pdf
医药生物行业周报：医疗设备招投标复苏信号显现，《政府工作报告》加大创新药支持力度,中航证券,2025-03-10,中药,https://pdf.dfcfw.com/pdf/H3_AP202503091644212822_1.pdf?1741598024000.pdf
生物医药行业：两会定调支持创新药发展，释放积极信号,平安证券,2025-03-10,中药,https://pdf.dfcfw.com/pdf/H3_AP202503101644220986_1.pdf?1741594932000.pdf
医药生物行业报告：基因测序仪行业格局迎巨变，国产替代有望提速,中邮证券,2025-03-10,中药,https://pdf.dfcfw.com/pdf/H3_AP202503101644230621_1.pdf?1741621102000.pdf
医药生物行业跟踪周报：政府工作报告：从市场化定价、商保支付支持创新药,东吴证券,2025-03-09,中药,https://pdf.dfcfw.com/pdf/H3_AP202503091644210901_1.pdf?1741551107000.pdf
医药行业周报：优化集采政策，关注创仿药企,西南证券,2025-03-09,中药,https://pdf.dfcfw.com/pdf/H3_AP202503091644211996_1.pdf?1741555268000.pdf
医药行业周报：痛风领域有望迎重磅新药，建议重点关注一品红,华源证券,2025-03-09,中药,https://pdf.dfcfw.com/pdf/H3_AP202503091644212844_1.pdf?1741592816000.pdf
医药生物行业周报：从海内外公司2024年业绩看科研服务的投资机会,开源证券,2025-03-09,中药,https://pdf.dfcfw.com/pdf/H3_AP202503091644210156_1.pdf?1741548620000.pdf
医药生物行业双周报：多地医疗设备采购更新,东莞证券,2025-03-07,中药,https://pdf.dfcfw.com/pdf/H3_AP202503071644146074_1.pdf?1741360590000.pdf
医药生物行业快评报告：两会围绕“促创新、保民生”促进三医协同发展和治理,万联证券,2025-03-06,中药,https://pdf.dfcfw.com/pdf/H3_AP202503061644108880_1.pdf?1741275118000.pdf
医药生物行业周报：建议关注AI医疗相关标的,中银证券,2025-03-04,中药,https://pdf.dfcfw.com/pdf/H3_AP202503041644027886_1.pdf?1741080713000.pdf
医药生物行业报告：零售药店行业规范化政策持续落地，龙头集中度有望加速提升,中邮证券,2025-03-03,中药,https://pdf.dfcfw.com/pdf/H3_AP202503031643998593_1.pdf?1741016460000.pdf
医药生物行业周报（25年第9周）：海外器械龙头2024年年报业绩概览，继续推荐创新药械,国信证券,2025-03-03,中药,https://pdf.dfcfw.com/pdf/H3_AP202503031644013206_1.pdf?1741038343000.pdf
医药生物行业周报：诊疗流程优化加速，AI技术重塑精准医疗与产业生态,开源证券,2025-03-02,中药,https://pdf.dfcfw.com/pdf/H3_AP202503021643659981_1.pdf?1740945041000.pdf
医药生物行业周报：短期回调不改市场回暖趋势，持续看好创新和AI医疗，建议关注25Q1业绩有望超预期标的,信达证券,2025-03-02,中药,https://pdf.dfcfw.com/pdf/H3_AP202503021643660898_1.pdf?1741002584000.pdf
生物医药行业：AI心脏大模型发布，医疗AI商业化进程加速,平安证券,2025-03-02,中药,https://pdf.dfcfw.com/pdf/H3_AP202503021643661663_1.pdf?1740951851000.pdf
医药生物行业跟踪周报：随AI赋能，看好医疗机器人赛道,东吴证券,2025-03-02,中药,https://pdf.dfcfw.com/pdf/H3_AP202503021643662505_1.pdf?1740957226000.pdf
医药生物行业周报：商业险药品目录体系开启，创新药械支付空间有望打开,中航证券,2025-03-02,中药,https://pdf.dfcfw.com/pdf/H3_AP202503021643662467_1.pdf?1740955863000.pdf
医药生物：HER3 ADC：有望首次成药，关注末线治疗潜力,华福证券,2025-03-02,中药,https://pdf.dfcfw.com/pdf/H3_AP202503021643656430_1.pdf?1740999893000.pdf
医药行业周报：全球肿瘤免疫研发进入双抗+ADC联用新阶段,华源证券,2025-03-02,中药,https://pdf.dfcfw.com/pdf/H3_AP202503021643657079_1.pdf?1740933894000.pdf
中药行业深度：多重因素共振，把握全年主线投资机会,平安证券,2025-02-28,中药,https://pdf.dfcfw.com/pdf/H3_AP202502281643612209_1.pdf?1740768044000.pdf
医药生物行业周报：CXO复苏进程开启，AI赋能新药研发潜力可期,中航证券,2025-02-26,中药,https://pdf.dfcfw.com/pdf/H3_AP202502261643521864_1.pdf?1740586124000.pdf
医药生物行业周报（2月第3周）：商业健康保险药品目录落地加速,世纪证券,2025-02-24,中药,https://pdf.dfcfw.com/pdf/H3_AP202502241643424232_1.pdf?1740386121000.pdf
医药生物行业报告：“AI+医疗”高景气度有望持续，创新药利好政策持续加码,中邮证券,2025-02-24,中药,https://pdf.dfcfw.com/pdf/H3_AP202502241643432191_1.pdf?1740403197000.pdf
医药生物行业跟踪周报：医保丙类目录及商保积极变化，创新药板块弹性大,东吴证券,2025-02-23,中药,https://pdf.dfcfw.com/pdf/H3_AP202502231643416188_1.pdf?1740350015000.pdf
医药生物行业周报：创新板块接力AI破局,华安证券,2025-02-23,中药,https://pdf.dfcfw.com/pdf/H3_AP202502231643417459_1.pdf?1740397218000.pdf
医药行业周报：创新药热度上涨,西南证券,2025-02-23,中药,https://pdf.dfcfw.com/pdf/H3_AP202502231643412307_1.pdf?1740333253000.pdf
医药生物行业周报：中国化学原料药行业整体呈现量升价稳的趋势，兽药原料药价格企稳回升,开源证券,2025-02-23,中药,https://pdf.dfcfw.com/pdf/H3_AP202502231643412353_1.pdf?1740334518000.pdf
医药生物行业双周报：AI医疗板块走强,东莞证券,2025-02-21,中药,https://pdf.dfcfw.com/pdf/H3_AP202502211643361235_1.pdf?1740157849000.pdf
医药生物行业2025年2月投资策略：关注AI+医疗、高质量创新和业绩稳健的价值标的,国信证券,2025-02-20,中药,https://pdf.dfcfw.com/pdf/H3_AP202502201643298563_1.pdf?1740041106000.pdf
中国中医药创新发展研究报告,艾瑞股份,2025-02-20,中药,https://pdf.dfcfw.com/pdf/H3_AP202502201643325464_1.pdf?1740070433000.pdf
医药生物行业周报：AI医疗市场关注度提升，赋能医疗智能化、高效化、便捷化发,中航证券,2025-02-17,中药,https://pdf.dfcfw.com/pdf/H3_AP202502171643154692_1.pdf?1739779138000.pdf
医药生物行业周报（2月第2周）：影像云索引打通医疗数据共享,世纪证券,2025-02-17,中药,https://pdf.dfcfw.com/pdf/H3_AP202502171643155433_1.pdf?1739781504000.pdf
生物医药行业：AI浪潮已至，行业有望迎新发展机遇,平安证券,2025-02-17,中药,https://pdf.dfcfw.com/pdf/H3_AP202502171643156525_1.pdf?1739787295000.pdf
医药行业周报：AI医疗主题投资持续发酵,西南证券,2025-02-17,中药,https://pdf.dfcfw.com/pdf/H3_AP202502171643159103_1.pdf?1739789917000.pdf
医药生物行业周报：医疗AI持续火热，建议关注三大应用方向,信达证券,2025-02-17,中药,https://pdf.dfcfw.com/pdf/H3_AP202502171643162154_1.pdf?1739802701000.pdf
医药生物行业周报：AI破局医药板块,华安证券,2025-02-17,中药,https://pdf.dfcfw.com/pdf/H3_AP202502171643171299_1.pdf?1739826998000.pdf
医药生物行业周报：AI赋能开启医疗新篇章，商业化落地加速,开源证券,2025-02-16,中药,https://pdf.dfcfw.com/pdf/H3_AP202502161643147103_1.pdf?1739780106000.pdf
医药行业周报：AI加持下，家用器械有望迎新发展机遇,华源证券,2025-02-16,中药,https://pdf.dfcfw.com/pdf/H3_AP202502161643143143_1.pdf?1739738313000.pdf
医药行业周报：商务部启动制裁，国产智造迎来契机,西南证券,2025-02-10,中药,https://pdf.dfcfw.com/pdf/H3_AP202502101642930522_1.pdf?1739187447000.pdf
医药生物行业报告：美股“AI+医疗”板块爆发，看好AI助力国内医疗行业全面智能化升级,中邮证券,2025-02-10,中药,https://pdf.dfcfw.com/pdf/H3_AP202502101642933919_1.pdf?1739198401000.pdf
医药生物行业周报：医药+AI前景可期,中银证券,2025-02-10,中药,https://pdf.dfcfw.com/pdf/H3_AP202502101642932567_1.pdf?1739192533000.pdf
医药生物行业跟踪周报：AI医疗仍被显著低估，关注华大智造、晶泰控股-P等,东吴证券,2025-02-09,中药,https://pdf.dfcfw.com/pdf/H3_AP202502091642917969_1.pdf?1739142378000.pdf
医药行业周报：科研上游呈复苏迹象，建议关注板块机会,华源证券,2025-02-09,中药,https://pdf.dfcfw.com/pdf/H3_AP202502091642917972_1.pdf?1739142481000.pdf
医药生物：AI医疗怎么选？从数据优势+商业化前景+硬件结合出发,华福证券,2025-02-09,中药,https://pdf.dfcfw.com/pdf/H3_AP202502091642914784_1.pdf?1739141779000.pdf
医药生物行业周报：美股big pharma 2024年报：关注业绩表现、指引及2025年重点催化剂事件,开源证券,2025-02-09,中药,https://pdf.dfcfw.com/pdf/H3_AP202502091642916306_1.pdf?1739141402000.pdf
医药生物行业周报：医药生物行业双周报2025年第3期总第126期多地取消医院用药数量限制，为新药引进开辟顺畅通道,长城国瑞证券,2025-02-06,中药,https://pdf.dfcfw.com/pdf/H3_AP202502061642828526_1.pdf?1738841978000.pdf
医药生物行业周报（2月第2周）：医保商保一体化结算加速,世纪证券,2025-02-05,中药,https://pdf.dfcfw.com/pdf/H3_AP202502051642786248_1.pdf?1738744890000.pdf
医药生物行业跟踪周报：2025年哪些医药股会取得显著超额收益？,东吴证券,2025-02-04,中药,https://pdf.dfcfw.com/pdf/H3_AP202502041642777848_1.pdf?1738708063000.pdf
