研报名称,机构名称,发布时间,行业,研报地址
偏光镜行业研究：探索视觉新纪元，光学科技引领未来视界 头豹词条报告系列,头豹研究院,2024-04-03,仪器仪表,https://pdf.dfcfw.com/pdf/H3_AP202404031629712797_1.pdf?1712173239000.pdf
科学仪器双周谈第十七期：大规模设备更新撬动5万亿大市场，深度探讨科学仪器产业链需求,开源证券,2024-03-21,仪器仪表,https://pdf.dfcfw.com/pdf/H3_AP202403211627430445_1.pdf?1711016136000.pdf
机器人新技术专题（三）：冷锻工艺极限精度C3，兼具高效率低成本优势,国金证券,2024-03-14,仪器仪表,https://pdf.dfcfw.com/pdf/H3_AP202403141626722049_1.pdf?1710414819000.pdf
软式内窥镜行业深度报告：内镜市场空间广阔，国产替代扬帆起航,民生证券,2024-03-10,仪器仪表,https://pdf.dfcfw.com/pdf/H3_AP202403091626187248_1.pdf?1710063471000.pdf
科学仪器双周谈第十六期：纵览解析国内科学仪器2023年快报，电子测量等领域公司业绩突出,开源证券,2024-03-10,仪器仪表,https://pdf.dfcfw.com/pdf/H3_AP202403101626201737_1.pdf?1710150431000.pdf
科学仪器双周谈第十五期：2023进出口数据梳理，质谱仪需求增长、液相色谱仪及对俄出口高增,开源证券,2024-02-07,仪器仪表,https://pdf.dfcfw.com/pdf/H3_AP202402071621008201_1.pdf?1707295139000.pdf
科学仪器双周谈第十四期：回顾丹纳赫并购发展模式，看生命科学巨头进化之路,开源证券,2024-01-19,仪器仪表,https://pdf.dfcfw.com/pdf/H3_AP202401191617711524_1.pdf?1705652636000.pdf
人形机器人专题报告二：供应端从0到1有望突破，需求端人机替代市场广阔,华宝证券,2023-12-22,仪器仪表,https://pdf.dfcfw.com/pdf/H3_AP202312221614810202_1.pdf?1703234631000.pdf
机械行业工业机器人深度报告：成长与周期共振，加速工业机器人国产替代,华福证券,2023-12-22,仪器仪表,https://pdf.dfcfw.com/pdf/H3_AP202312221614811813_1.pdf?1703236913000.pdf
人形机器人专题报告一：智能化进阶开启，商业化落地在即,华宝证券,2023-12-21,仪器仪表,https://pdf.dfcfw.com/pdf/H3_AP202312211614640195_1.pdf?1703148760000.pdf
科学仪器双周谈第十期：海关数据来看进口色谱仪承压而质谱仪量价齐升，俄罗斯市场驱动国产出海,开源证券,2023-11-24,仪器仪表,https://pdf.dfcfw.com/pdf/H3_AP202311241612230920_1.pdf?1700851160000.pdf
人形机器人深度系列报告：机器人运动的“心脏”，电机有望迎来广阔空间,德邦证券,2023-11-16,仪器仪表,https://pdf.dfcfw.com/pdf/H3_AP202311161611029242_1.pdf?1700150548000.pdf
机器人行业周报：OpenAI举办首届开发者大会，发布最强ChatGPT,西南证券,2023-11-13,仪器仪表,https://pdf.dfcfw.com/pdf/H3_AP202311131609918784_1.pdf?1699875786000.pdf
科学仪器行业双周谈第九期：科学仪器厂商三季报全梳理，需求承压之下投入加码看好远期增长,开源证券,2023-11-12,仪器仪表,https://pdf.dfcfw.com/pdf/H3_AP202311121609916132_1.pdf?1699795229000.pdf
