研报名称,机构名称,发布时间,行业,研报地址
从4Q23偿二代二期工程季报看头部寿险公司经营质效：核心偿付能力显分化，投资收益率成胜负手,东吴证券,2024-04-11,保险,https://pdf.dfcfw.com/pdf/H3_AP202404111630141164_1.pdf?1712842402000.pdf
保险精算假设调整研究暨2023年报分析：行“稳”以致远,平安证券,2024-04-11,保险,https://pdf.dfcfw.com/pdf/H3_AP202404111630151925_1.pdf?1712861367000.pdf
险企综述：2023年报综述暨一季报前瞻：负债端高质量增长可期，看好左侧布局机会,开源证券,2024-04-10,保险,https://pdf.dfcfw.com/pdf/H3_AP202404101630103824_1.pdf?1712747475000.pdf
金融行业周报：Q1货币政策委员会例会召开，2024年人身险“负面清单”发布,平安证券,2024-04-08,保险,https://pdf.dfcfw.com/pdf/H3_AP202404081630040567_1.pdf?1712564187000.pdf
保险业2023年财报综述：负债改革延续，资产收益承压,国信证券,2024-04-08,保险,https://pdf.dfcfw.com/pdf/H3_AP202404081630054467_1.pdf?1712601035000.pdf
上市险企2023年年报综述：寿财负债质量有望持续提升，关注资产端边际弹性,信达证券,2024-04-07,保险,https://pdf.dfcfw.com/pdf/H3_AP202404071630034807_1.pdf?1712500200000.pdf
保险行业2月月报：寿险保费增速明显提升，产险单月增速转负,海通国际,2024-04-03,保险,https://pdf.dfcfw.com/pdf/H3_AP202404031629684740_1.pdf?1712134548000.pdf
非银行金融行业点评：负债端改善但资产端承压，国寿23年利润下滑,平安证券,2024-03-28,保险,https://pdf.dfcfw.com/pdf/H3_AP202403281628448449_1.pdf?1711652751000.pdf
万能险定价利率下调预期分析：资产和负债端双向突围,国信证券,2024-03-27,保险,https://pdf.dfcfw.com/pdf/H3_AP202403271628289738_1.pdf?1711528662000.pdf
金融行业周报：人身险公司监管评级办法出台，央行表示降准仍有空间,平安证券,2024-03-25,保险,https://pdf.dfcfw.com/pdf/H3_AP202403251628066544_1.pdf?1711352542000.pdf
上市险企2月保费点评：寿险单月增速转正，产险阶段性调整,海通国际,2024-03-20,保险,https://pdf.dfcfw.com/pdf/H3_AP202403201627283214_1.pdf?1710934556000.pdf
2024年2月保费收入点评：关注“开门红”后的结构性机会,国信证券,2024-03-18,保险,https://pdf.dfcfw.com/pdf/H3_AP202403181626958259_1.pdf?1710749351000.pdf
上市险企2月保费数据点评：车险受春节错位放缓，个险达成和增长良好,东吴证券,2024-03-18,保险,https://pdf.dfcfw.com/pdf/H3_AP202403171626954626_1.pdf?1710746696000.pdf
保险Ⅱ行业点评报告：2月人身险保费正增长，经代报行合一利好头部险企,开源证券,2024-03-18,保险,https://pdf.dfcfw.com/pdf/H3_AP202403181626972420_1.pdf?1710783195000.pdf
保险Ⅱ行业深度报告：寿险内含价值精算假设调整分析与展望,东吴证券,2024-03-18,保险,https://pdf.dfcfw.com/pdf/H3_AP202403181626964814_1.pdf?1710769968000.pdf
主要上市险企2024年2月保费点评：寿险回暖，财险放缓，结构和质态有望持续提升,信达证券,2024-03-17,保险,https://pdf.dfcfw.com/pdf/H3_AP202403171626952783_1.pdf?1710671110000.pdf
2023保险资产管理年度报告：初心如磐，应势而谋,华宝证券,2024-03-10,保险,https://pdf.dfcfw.com/pdf/H3_AP202403101626199099_1.pdf?1710078146000.pdf
保险行业2023年报前瞻：投资与保费“冰火两重天”，净利润承压而NBV高增长,海通国际,2024-03-08,保险,https://pdf.dfcfw.com/pdf/H3_AP202403081626021100_1.pdf?1709890235000.pdf
保险Ⅱ行业深度报告：保险资金长期入市现状、动因和展望,东吴证券,2024-03-07,保险,https://pdf.dfcfw.com/pdf/H3_AP202403071625927401_1.pdf?1709816777000.pdf
从债券赎回决策看中小保险公司风险：偿付能力成主因，中长期看格局演变,国信证券,2024-03-04,保险,https://pdf.dfcfw.com/pdf/H3_AP202403041625214628_1.pdf?1709544513000.pdf
农业保险 头豹词条报告系列,头豹研究院,2024-03-01,保险,https://pdf.dfcfw.com/pdf/H3_AP202403011624859875_1.pdf?1709322419000.pdf
上市险企1月保费：人身险保费承压，财险保费稳健增长,南京证券,2024-02-29,保险,https://pdf.dfcfw.com/pdf/H3_AP202402291624098520_1.pdf?1709204956000.pdf
保险Ⅱ行业点评报告：1月人身险新单续期分化，2024年负债端展望乐观,开源证券,2024-02-27,保险,https://pdf.dfcfw.com/pdf/H3_AP202402271623722913_1.pdf?1709023436000.pdf
《公开发行证券的公司信息披露编报规则第4号——保险公司信息披露特别规定》深度分析建议：优化信息披露，打开报表黑箱，提高长期估值,东吴证券,2024-02-27,保险,https://pdf.dfcfw.com/pdf/H3_AP202402271623742632_1.pdf?1709053223000.pdf
非银金融行业2024年1月上市险企保费点评：业务结构持续优化、价值增长未来可期。,华福证券,2024-02-23,保险,https://pdf.dfcfw.com/pdf/H3_AP202402231623038406_1.pdf?1708681381000.pdf
上市险企2024年1月保费点评：寿险开门红首月承压，但结构改善有望提升业务品质,东海证券,2024-02-23,保险,https://pdf.dfcfw.com/pdf/H3_AP202402231623214787_1.pdf?1708703275000.pdf
主要上市险企2024年1月保费点评：“报行合一”下开门红保费有所分化，产品结构有望优化,信达证券,2024-02-22,保险,https://pdf.dfcfw.com/pdf/H3_AP202402221622762369_1.pdf?1708597551000.pdf
2024年1月保费收入点评：产险保费新高，银保整顿下寿险保费负增,国信证券,2024-02-22,保险,https://pdf.dfcfw.com/pdf/H3_AP202402221622821402_1.pdf?1708615499000.pdf
上市险企2024年1月保费数据点评：寿险略有承压，产险维持稳健,平安证券,2024-02-22,保险,https://pdf.dfcfw.com/pdf/H3_AP202402221622832726_1.pdf?1708624257000.pdf
意外险 头豹词条报告系列,头豹研究院,2024-02-22,保险,https://pdf.dfcfw.com/pdf/H3_AP202402221622865096_1.pdf?1708632198000.pdf
上市险企1月保费数据点评：主动放缓银保趸交业务，个险新单稳步增长,东吴证券,2024-02-22,保险,https://pdf.dfcfw.com/pdf/H3_AP202402221622901067_1.pdf?1708637577000.pdf
寿险渠道专题研究（二）：他山之石银保篇，推动银保合作向更紧密的模式转型,平安证券,2024-02-19,保险,https://pdf.dfcfw.com/pdf/H3_AP202402191622397294_1.pdf?1708365919000.pdf
保险业“开门红”跟踪（二）：队伍规模企稳质态改善，银保“报行合一”推动价值率提升,东海证券,2024-02-09,保险,https://pdf.dfcfw.com/pdf/H3_AP202402091621198439_1.pdf?1707476937000.pdf
保险业“开门红”跟踪（一）：开门红产品供需旺盛，制度层面降低负债端利差损风险,东海证券,2024-02-07,保险,https://pdf.dfcfw.com/pdf/H3_AP202402071621008414_1.pdf?1707296635000.pdf
保险业“开门红”跟踪（一）：开门红产品供需旺盛，制度层面降低负债端利差损风险,东海证券,2024-02-07,保险,https://pdf.dfcfw.com/pdf/H3_AP202402071621010451_1.pdf?1707298864000.pdf
保险Ⅱ行业点评报告：上市险企2023年年报前瞻-追溯基数使净利润下滑，现金分红或超预期保持平稳,东吴证券,2024-02-05,保险,https://pdf.dfcfw.com/pdf/H3_AP202402041620555365_1.pdf?1707120615000.pdf
养老金融观察系列（一）：个人养老金制度将推进全面实施,平安证券,2024-02-04,保险,https://pdf.dfcfw.com/pdf/H3_AP202402041620268731_1.pdf?1707039769000.pdf
保险业：寿险保费收入增速亮眼，固收资产配置力度加大,中国银河,2024-02-02,保险,https://pdf.dfcfw.com/pdf/H3_AP202402021620065461_1.pdf?1706869370000.pdf
人身保险 头豹词条报告系列,头豹研究院,2024-02-02,保险,https://pdf.dfcfw.com/pdf/H3_AP202402021620081554_1.pdf?1706903306000.pdf
保险业深度报告：供需推动寿险回暖，“市值考核”催化估值提升,东莞证券,2024-01-31,保险,https://pdf.dfcfw.com/pdf/H3_AP202401311619789196_1.pdf?1706716824000.pdf
保险行业12月月报：寿险全年保费实现两位数增长，下半年车险明显回暖,海通国际,2024-01-30,保险,https://pdf.dfcfw.com/pdf/H3_AP202401301619492151_1.pdf?1706637243000.pdf
2023年12月保费点评：保费增长对冲短期负面影响,中邮证券,2024-01-30,保险,https://pdf.dfcfw.com/pdf/H3_AP202401301619508264_1.pdf?1706619021000.pdf
保险Ⅱ：市值管理预期激活市场，保险板块或超越大盘,中邮证券,2024-01-29,保险,https://pdf.dfcfw.com/pdf/H3_AP202401291619271719_1.pdf?1706539224000.pdf
非银金融：个人养老金制度全面推行点评-推动产品供给，驱动长期资金,国信证券,2024-01-29,保险,https://pdf.dfcfw.com/pdf/H3_AP202401291619251669_1.pdf?1706536316000.pdf
保险Ⅱ行业点评报告：反弹β最强音，右侧机会显现，优选超跌个股,东吴证券,2024-01-25,保险,https://pdf.dfcfw.com/pdf/H3_AP202401251618103538_1.pdf?1706194073000.pdf
2023年中国保险行业概览：保险护航，稳步前行，共筑幸福长寿时代（摘要版）,头豹研究院,2024-01-22,保险,https://pdf.dfcfw.com/pdf/H3_AP202401221617916084_1.pdf?1705953764000.pdf
保险Ⅱ行业点评报告：明确附加费用即可用总费用水平，银保价值有望超预期释放,东吴证券,2024-01-22,保险,https://pdf.dfcfw.com/pdf/H3_AP202401221617921284_1.pdf?1705956763000.pdf
非银金融行业周报：雪球产品风险可控，证监会重磅发声回应市场关切,开源证券,2024-01-22,保险,https://pdf.dfcfw.com/pdf/H3_AP202401221617892214_1.pdf?1705916739000.pdf
保险行业事件点评：银保“报行合一”再强化，推动行业高质量发展,东莞证券,2024-01-22,保险,https://pdf.dfcfw.com/pdf/H3_AP202401221617908948_1.pdf?1705941036000.pdf
上市险企12月保费点评：全年寿险新单高增长，产险分化主要受非车险影响,海通国际,2024-01-19,保险,https://pdf.dfcfw.com/pdf/H3_AP202401191617730233_1.pdf?1705675304000.pdf
2023上市险企保费点评：政策端影响基本消化，供需高景气推动全年保费增长,华福证券,2024-01-18,保险,https://pdf.dfcfw.com/pdf/H3_AP202401181617672023_1.pdf?1705569654000.pdf
上市险企12月保费数据点评：收官与开门红两手抓，开门红表现稳中有进,东吴证券,2024-01-17,保险,https://pdf.dfcfw.com/pdf/H3_AP202401171617583581_1.pdf?1705504237000.pdf
上市险企2023年保费数据点评：寿险新单如期增长，产险保费高开低走,平安证券,2024-01-17,保险,https://pdf.dfcfw.com/pdf/H3_AP202401171617577607_1.pdf?1705483547000.pdf
非银金融·保险Ⅱ：从长城人寿举牌无锡银行看险资举牌动向 高ROE资产进一步受险资青睐,国信证券,2024-01-17,保险,https://pdf.dfcfw.com/pdf/H3_AP202401171617575973_1.pdf?1705487821000.pdf
上市保险公司12月保费收入数据点评：人身险2023年高景气收官，2024年负债端展望乐观,开源证券,2024-01-17,保险,https://pdf.dfcfw.com/pdf/H3_AP202401171617583328_1.pdf?1705502187000.pdf
2023年12月保费收入点评：存款降息下保费增长延续,国信证券,2024-01-17,保险,https://pdf.dfcfw.com/pdf/H3_AP202401171617583326_1.pdf?1705502269000.pdf
养老备忘录系列（二）：勇敢者的遗产？法国博尔内养老保障改革及其争议,平安证券,2024-01-15,保险,https://pdf.dfcfw.com/pdf/H3_AP202401151617485159_1.pdf?1705327699000.pdf
保险2024年度策略报告：需求景气持续，价值探底复苏,华福证券,2024-01-08,保险,https://pdf.dfcfw.com/pdf/H3_AP202401081616763416_1.pdf?1704722373000.pdf
新华保险与中金资本设立基金点评：增配不动产，匹配长线需求,国信证券,2024-01-03,保险,https://pdf.dfcfw.com/pdf/H3_AP202401031616217462_1.pdf?1704293667000.pdf
保险行业2024Q1展望：估值已反应资产端悲观预期，关注负债端催化,开源证券,2024-01-03,保险,https://pdf.dfcfw.com/pdf/H3_AP202401031616218752_1.pdf?1704297390000.pdf
储蓄型保险产品空间深度研究报告：供需两端改善确定性强，储蓄型产品有望成新动能,开源证券,2024-01-03,保险,https://pdf.dfcfw.com/pdf/H3_AP202401031616225204_1.pdf?1704305028000.pdf
保险行业2024年投资展望：经济复苏推动需求释放，基本面改善有望延续,东兴证券,2023-12-29,保险,https://pdf.dfcfw.com/pdf/H3_AP202312291615465372_1.pdf?1703839363000.pdf
2024年保险行业分析与预测：路远行则将至,太平洋,2023-12-29,保险,https://pdf.dfcfw.com/pdf/H3_AP202312291615465342_1.pdf?1703842739000.pdf
保险Ⅱ行业点评报告：定期存款利率再下调，对保险影响几何？,东吴证券,2023-12-22,保险,https://pdf.dfcfw.com/pdf/H3_AP202312221614818146_1.pdf?1703259788000.pdf
上市险企11月保费点评：寿险降幅边际收窄，车险延续较快增长,海通国际,2023-12-20,保险,https://pdf.dfcfw.com/pdf/H3_AP202312201614590761_1.pdf?1703084554000.pdf
上市险企11月保费收入数据点评：11月寿险保费同比延续分化，开门红预期不断改善,开源证券,2023-12-18,保险,https://pdf.dfcfw.com/pdf/H3_AP202312181614436176_1.pdf?1702887394000.pdf
上市险企11月保费数据点评：严格执行“不得大幅提前”预收保费，“开门红”意向预录推进,东吴证券,2023-12-18,保险,https://pdf.dfcfw.com/pdf/H3_AP202312171614435185_1.pdf?1702885791000.pdf
2023年11月保费收入点评：淡化“开门红”，回归价值本源,国信证券,2023-12-18,保险,https://pdf.dfcfw.com/pdf/H3_AP202312181614439560_1.pdf?1702911361000.pdf
主要上市险企11月保费点评：寿险保费有望平稳收官，车险推动财险保费稳增,信达证券,2023-12-17,保险,https://pdf.dfcfw.com/pdf/H3_AP202312161614433874_1.pdf?1702809065000.pdf
保险行业2024年度策略报告：于变革中谋发展,平安证券,2023-12-13,保险,https://pdf.dfcfw.com/pdf/H3_AP202312131614064627_1.pdf?1702459485000.pdf
保险Ⅱ10月保费数据总结：单月回落不改客需优势，调结构利好远期,太平洋,2023-12-11,保险,https://pdf.dfcfw.com/pdf/H3_AP202312111613696805_1.pdf?1702301176000.pdf
保险Ⅱ行业深度报告：从车险“报行合一”成效看寿险施行影响几何？,东吴证券,2023-12-11,保险,https://pdf.dfcfw.com/pdf/H3_AP202312111613705483_1.pdf?1702314008000.pdf
养老备忘录系列（一）：全国社保基金投资范围小幅扩容,平安证券,2023-12-07,保险,https://pdf.dfcfw.com/pdf/H3_AP202312071613555270_1.pdf?1701940857000.pdf
保险行业事件点评：中国人寿与新华保险合作设立私募基金，响应长期资金入市号召,东莞证券,2023-12-04,保险,https://pdf.dfcfw.com/pdf/H3_AP202312041613222875_1.pdf?1701681424000.pdf
10月保费点评：短期将有改善，中长期或存压力,中邮证券,2023-12-01,保险,https://pdf.dfcfw.com/pdf/H3_AP202312011613161190_1.pdf?1705070361000.pdf
保险Ⅱ行业点评报告：中国人寿与新华保险共同对外投资公告点评-响应长期资金入市，公司型基金降低业绩波动,东吴证券,2023-11-30,保险,https://pdf.dfcfw.com/pdf/H3_AP202311301613035880_1.pdf?1701355313000.pdf
传统险 头豹词条报告系列,头豹研究院,2023-11-23,保险,https://pdf.dfcfw.com/pdf/H3_AP202311231612213401_1.pdf?1700769596000.pdf
上市保险公司10月保费收入数据点评：10月寿险保费同比分化，关注超跌带来左侧机会,开源证券,2023-11-21,保险,https://pdf.dfcfw.com/pdf/H3_AP202311211611741727_1.pdf?1700558751000.pdf
健康险 头豹词条报告系列,头豹研究院,2023-11-20,保险,https://pdf.dfcfw.com/pdf/H3_AP202311201611699767_1.pdf?1700509600000.pdf
上市险企2023年10月保费点评：“报行合一”下寿险增速放缓，财险分化依旧但整体增速稳健,东海证券,2023-11-20,保险,https://pdf.dfcfw.com/pdf/H3_AP202311201611685503_1.pdf?1700497632000.pdf
非银金融：寿险有望顺利收官，财险保费维持稳定,国联证券,2023-11-17,保险,https://pdf.dfcfw.com/pdf/H3_AP202311171611301318_1.pdf?1700214634000.pdf
上市险企10月保费数据点评：银保“报行合一”调整拖累新单数据，“开门红”上新造势延续,东吴证券,2023-11-17,保险,https://pdf.dfcfw.com/pdf/H3_AP202311171611362119_1.pdf?1700239235000.pdf
保险Q4股价复盘专题：资产端或是提振板块股价的主要因素,国联证券,2023-11-15,保险,https://pdf.dfcfw.com/pdf/H3_AP202311151610992254_1.pdf?1700126911000.pdf
从科技视角看财产险行业转型之路：风险减量，科技赋能,国信证券,2023-11-13,保险,https://pdf.dfcfw.com/pdf/H3_AP202311131609921534_1.pdf?1699884343000.pdf
保险行业2023三季报综述：投资拖累利润表现，延续高增长态势,东海证券,2023-11-13,保险,https://pdf.dfcfw.com/pdf/H3_AP202311131609922768_1.pdf?1699886131000.pdf
保险行业2023年三季报回顾与展望：投资波动导致利润短期承压，负债端改善趋势仍可持乐观判断,海通国际,2023-11-13,保险,https://pdf.dfcfw.com/pdf/H3_AP202311131609923420_1.pdf?1699894097000.pdf
保险Ⅱ行业深度报告：从“双十一”兴替看“开门红”路在何方？,东吴证券,2023-11-12,保险,https://pdf.dfcfw.com/pdf/H3_AP202311121609916358_1.pdf?1699798098000.pdf
2023年中国商业保险行业概览： 互联网保险VS传统保险，TO C端模式如何发展？,头豹研究院,2023-11-10,保险,https://pdf.dfcfw.com/pdf/H3_AP202311101609907326_1.pdf?1699646232000.pdf
保险业2023年三季报综述：投资单季承压，负债改革深化,国信证券,2023-11-08,保险,https://pdf.dfcfw.com/pdf/H3_AP202311081609281514_1.pdf?1699431948000.pdf
全球公共养老金研究系列（三）：日本GPIF：保守稳健型养老基金进化论,平安证券,2023-11-08,保险,https://pdf.dfcfw.com/pdf/H3_AP202311081609283306_1.pdf?1699435532000.pdf
保险行业9月月报：寿险单月增速回正，产险业务持续回暖,海通国际,2023-11-03,保险,https://pdf.dfcfw.com/pdf/H3_AP202311031608171187_1.pdf?1699005498000.pdf
保险行业信息点评：国有商业保险公司绩效考核长周期化，险企长期投资资金再松绑,海通国际,2023-11-03,保险,https://pdf.dfcfw.com/pdf/H3_AP202311031608171188_1.pdf?1699005833000.pdf
寿险渠道专题研究（一）：保持战略定力，银保量增价升,平安证券,2023-11-02,保险,https://pdf.dfcfw.com/pdf/H3_AP202311021607888530_1.pdf?1705502975000.pdf
非银行金融行业点评：权益投资承压+产险赔付增加，人保Q3利润下滑,平安证券,2023-11-01,保险,https://pdf.dfcfw.com/pdf/H3_AP202311011607612643_1.pdf?1705502975000.pdf
保险Ⅱ行业点评报告：《关于引导保险资金长期稳健投资 加强国有商业保险公司长周期考核的通知》点评-引导经营长期主义，发挥险资中长期资金优势,东吴证券,2023-10-31,保险,https://pdf.dfcfw.com/pdf/H3_AP202310311606049246_1.pdf?1698747521000.pdf
保险Ⅱ：引导险资长期资金入市政策点评-大钱细思,国信证券,2023-10-31,保险,https://pdf.dfcfw.com/pdf/H3_AP202310311607003622_1.pdf?1698763662000.pdf
非银行金融行业点评：关注长周期考核，引导保险资金长期稳健投资,平安证券,2023-10-31,保险,https://pdf.dfcfw.com/pdf/H3_AP202310311607030778_1.pdf?1698762030000.pdf
保险Ⅱ行业简评：引导长期资金入市，强化险企资负匹配与跨周期配置能力,东海证券,2023-10-31,保险,https://pdf.dfcfw.com/pdf/H3_AP202310311607060740_1.pdf?1698784903000.pdf
保险行业事件点评：国有商业保险公司实施3年长周期考核，引导险资长期稳健投资,东莞证券,2023-10-31,保险,https://pdf.dfcfw.com/pdf/H3_AP202310311607030813_1.pdf?1698762030000.pdf
非银行金融行业点评：投资拖累利润，太保寿险前三季度新单与NBV增幅走阔,平安证券,2023-10-30,保险,https://pdf.dfcfw.com/pdf/H3_AP202310301605646511_1.pdf?1705502975000.pdf
非银行金融行业点评：投资承压使新华Q3亏损，预计前三季度NBV仍正增,平安证券,2023-10-30,保险,https://pdf.dfcfw.com/pdf/H3_AP202310301605646637_1.pdf?1698681531000.pdf
保险行业报告：9月份保费点评：寿险回落，推动提前启动开门红,中邮证券,2023-10-26,保险,https://pdf.dfcfw.com/pdf/H3_AP202310261603997754_1.pdf?1698334939000.pdf
保险行业8月月报：产品切换后寿险增速回落，车险保费持续回暖,海通国际,2023-10-25,保险,https://pdf.dfcfw.com/pdf/H3_AP202310251603445663_1.pdf?1698228072000.pdf
保险行业信息点评：保险销售行为新规落地，行业向规范化发展再迈进,海通国际,2023-10-25,保险,https://pdf.dfcfw.com/pdf/H3_AP202310251603470276_1.pdf?1698241555000.pdf
保险行业2023年中报回顾与展望：二季度NBV超高增长，净利润短期承压,海通国际,2023-10-23,保险,https://pdf.dfcfw.com/pdf/H3_AP202310231602720145_1.pdf?1698083763000.pdf
金融&金融科技行业周报：分红新规正式出台，人身险管理进一步强化,平安证券,2023-10-23,保险,https://pdf.dfcfw.com/pdf/H3_AP202310231602719950_1.pdf?1698078864000.pdf
保险行业跟踪报告：上市险企9月保费点评：寿险增速继续下降，持续关注2024年“开门红”,海通国际,2023-10-23,保险,https://pdf.dfcfw.com/pdf/H3_AP202310231602717760_1.pdf?1698082152000.pdf
养老金融双周报：英美业内呼吁调整养老金待遇涨幅机制,平安证券,2023-10-22,保险,https://pdf.dfcfw.com/pdf/H3_AP202310221602714545_1.pdf?1697973988000.pdf
上市险企9月保费数据点评：寿险新单月降幅近半，2024年开门红暗流涌动,东吴证券,2023-10-22,保险,https://pdf.dfcfw.com/pdf/H3_AP202310221602714929_1.pdf?1697985733000.pdf
非银金融周报：看好后续市场反弹下的非银股投资机会,国联证券,2023-10-22,保险,https://pdf.dfcfw.com/pdf/H3_AP202310221602716178_1.pdf?1698056403000.pdf
“中央汇金增持四大行股份”点评：非银行金融：汇金后续增持可期，非银蓝筹或受青睐,东兴证券,2023-10-20,保险,https://pdf.dfcfw.com/pdf/H3_AP202310201602160238_1.pdf?1697798233000.pdf
上市保险公司9月保费收入数据点评：9月新单承压符合预期，汇金入市提振资产端信心,开源证券,2023-10-18,保险,https://pdf.dfcfw.com/pdf/H3_AP202310181601871646_1.pdf?1697620057000.pdf
2023年9月保费收入点评：新产品格局下的“开门红”,国信证券,2023-10-18,保险,https://pdf.dfcfw.com/pdf/H3_AP202310181601897534_1.pdf?1697628097000.pdf
