研报名称,机构名称,发布时间,行业,研报地址
上市险企2024年半年报综述：负债端延续向好，净利润增速环比显著改善,国联证券,2024-09-03,保险,https://pdf.dfcfw.com/pdf/H3_AP202409031639715932_1.pdf?1725391780000.pdf
保险行业研究：《保险资产风险分类办法（征求意见稿）》明确保险公司各类投资资产风险分类标准，强化内外部监督管理机制，压实投资端资产质量,中诚信国际,2024-09-02,保险,https://pdf.dfcfw.com/pdf/H3_AP202409021639691208_1.pdf?1725298877000.pdf
保险行业专题报告：以邻为镜：日本寿险行业的过去与现在,海通国际,2024-09-02,保险,https://pdf.dfcfw.com/pdf/H3_AP202409021639694084_1.pdf?1725305544000.pdf
保险行业研究2024中报综述：投资改善驱动Q2利润高增，Margin提升NBV高增延续,国金证券,2024-09-01,保险,https://pdf.dfcfw.com/pdf/H3_AP202409011639679275_1.pdf?1725199014000.pdf
金融行业周报：国常会研究推动保险业高质量发展，Q2对公贷款保持较高增速,平安证券,2024-09-01,保险,https://pdf.dfcfw.com/pdf/H3_AP202409011639681695_1.pdf?1725223111000.pdf
非银行金融行业点评：产寿险业绩略有分化，人保24H1稳中向好,平安证券,2024-08-30,保险,https://pdf.dfcfw.com/pdf/H3_AP202408301639593000_1.pdf?1725004488000.pdf
非银行金融行业点评：业务结构优化，国寿24H1业绩稳中向好,平安证券,2024-08-30,保险,https://pdf.dfcfw.com/pdf/H3_AP202408301639624867_1.pdf?1725036621000.pdf
保险业深度报告：寿险NBVM提振NBV增长，资产端为估值修复的关键,东莞证券,2024-08-29,保险,https://pdf.dfcfw.com/pdf/H3_AP202408291639563615_1.pdf?1724953600000.pdf
保险行业2024年中报前瞻：预计投资改善带动Q2净利润提升，寿险NBV有望延续较快增长,海通国际,2024-08-27,保险,https://pdf.dfcfw.com/pdf/H3_AP202408271639475000_1.pdf?1724766494000.pdf
保险行业信息点评：互联网财险业务新规落地，准入门槛明显提高,海通国际,2024-08-27,保险,https://pdf.dfcfw.com/pdf/H3_AP202408271639475002_1.pdf?1724766304000.pdf
保险利差系列报告一：基于日美德利差调控经验-定价调控政策“及时雨”助力缓释利差压力,国金证券,2024-08-26,保险,https://pdf.dfcfw.com/pdf/H3_AP202408261639447447_1.pdf?1724679975000.pdf
基于保险机构负债成本下调的研究：从负债成本看机构投债的安全边际,国信证券,2024-08-25,保险,https://pdf.dfcfw.com/pdf/H3_AP202408251639441429_1.pdf?1724594640000.pdf
金融行业周报：市场准入制度完善意见出台，国新办公布高质量发展成果,平安证券,2024-08-25,保险,https://pdf.dfcfw.com/pdf/H3_AP202408251639444061_1.pdf?1724620904000.pdf
保险资产管理业创新型产品1季度观察与展望：2024年上半年业务持续收缩，化债政策持续加码，绿色投资、城投转型项目有望增长,中诚信国际,2024-08-23,保险,https://pdf.dfcfw.com/pdf/H3_AP202408231639423156_1.pdf?1724448848000.pdf
上市险企2024年7月保费点评：高基数压力逐渐缓释，关注产品与渠道优化后的价值提升,东海证券,2024-08-21,保险,https://pdf.dfcfw.com/pdf/H3_AP202408211639373830_1.pdf?1724252078000.pdf
中国人寿拟减持杭州银行点评：国寿减持不改红利行情,国信证券,2024-08-21,保险,https://pdf.dfcfw.com/pdf/H3_AP202408211639386354_1.pdf?1724276429000.pdf
上市险企7月保费数据点评：寿险延续高增，车险增速企稳,东吴证券,2024-08-20,保险,https://pdf.dfcfw.com/pdf/H3_AP202408201639346300_1.pdf?1724140247000.pdf
非银金融行业2024年7月上市险企保费点评：人身险延续高增，财险增速稳健平缓,华福证券,2024-08-19,保险,https://pdf.dfcfw.com/pdf/H3_AP202408191639339298_1.pdf?1724093364000.pdf
2024年7月保费收入点评：负债成本下行，短期销售激活,国信证券,2024-08-18,保险,https://pdf.dfcfw.com/pdf/H3_AP202408181639323781_1.pdf?1723980701000.pdf
保险Ⅱ行业点评报告：7月人身险增速延续改善，关注险企中报景气度,开源证券,2024-08-17,保险,https://pdf.dfcfw.com/pdf/H3_AP202408171639323073_1.pdf?1723910974000.pdf
保险资产管理行业研究,中诚信国际,2024-08-15,保险,https://pdf.dfcfw.com/pdf/H3_AP202408151639292794_1.pdf?1723759883000.pdf
非银金融行业简评：预定利率持续下调，强化资负匹配助推三差均衡,东海证券,2024-08-07,保险,https://pdf.dfcfw.com/pdf/H3_AP202408071639181976_1.pdf?1723052312000.pdf
金融行业周报：股份行调降存款利率，人身险产品预定利率分批下调,平安证券,2024-08-05,保险,https://pdf.dfcfw.com/pdf/H3_AP202408051639143904_1.pdf?1722877644000.pdf
人身险预定利率下调点评：压降负债成本， 政策靴子落地,国信证券,2024-08-04,保险,https://pdf.dfcfw.com/pdf/H3_AP202408041639132403_1.pdf?1722783985000.pdf
行业点评报告：建立预定利率动态调节机制，鼓励分红型产品发展,开源证券,2024-08-03,保险,https://pdf.dfcfw.com/pdf/H3_AP202408031639131379_1.pdf?1722783905000.pdf
保险Ⅱ行业点评报告：预定利率如期下调，鼓励发展长期分红险，动态定价机制提升资产负债管理水平,东吴证券,2024-08-03,保险,https://pdf.dfcfw.com/pdf/H3_AP202408031639131741_1.pdf?1722785417000.pdf
保险Ⅱ行业深度报告：来自分红实现率和万能结算利率的视角-寿险负债成本下行幅度或大于资产收益率压力,东吴证券,2024-08-01,保险,https://pdf.dfcfw.com/pdf/H3_AP202407311638801192_1.pdf?1722496405000.pdf
金融行业周报：主动型基金重仓增持银行、保险，减持券商，LPR下调10BP,平安证券,2024-07-29,保险,https://pdf.dfcfw.com/pdf/H3_AP202407291638413651_1.pdf?1722240250000.pdf
非银金融行业2024Q2金融板块持仓点评：保险和银行获增配，证券被减配,国联证券,2024-07-24,保险,https://pdf.dfcfw.com/pdf/H3_AP202407241638248190_1.pdf?1721809823000.pdf
上市险企2024年6月保费点评：续期拉动缓解寿险新单压力，非车增速提升推动财险边际改善,东海证券,2024-07-21,保险,https://pdf.dfcfw.com/pdf/H3_AP202407211638151699_1.pdf?1721583500000.pdf
2024年6月上市险企保费点评：寿险增速分化，财险增速稳中向好,华福证券,2024-07-19,保险,https://pdf.dfcfw.com/pdf/H3_AP202407191638088538_1.pdf?1721402042000.pdf
保险Ⅱ行业点评报告：2024H1个险新单好于预期，全年负债端展望乐观,开源证券,2024-07-18,保险,https://pdf.dfcfw.com/pdf/H3_AP202407171638015279_1.pdf?1721285703000.pdf
上市险企6月保费数据点评：寿险增速当弱不弱，车险增速再度放缓,东吴证券,2024-07-18,保险,https://pdf.dfcfw.com/pdf/H3_AP202407171638015986_1.pdf?1721286364000.pdf
上市险企2024年6月保费数据点评：寿险量稳价增，产险保持稳健,平安证券,2024-07-17,保险,https://pdf.dfcfw.com/pdf/H3_AP202407171637997228_1.pdf?1721228777000.pdf
2024年6月保费收入点评：人身险回调，产险景气延续，寻找转型下增量机遇,国信证券,2024-07-17,保险,https://pdf.dfcfw.com/pdf/H3_AP202407171637999208_1.pdf?1721230277000.pdf
非银行金融行业研究框架,天风证券,2024-07-03,保险,https://pdf.dfcfw.com/pdf/H3_AP202407031637518158_1.pdf?1720035961000.pdf
保险Ⅱ行业点评报告：央行“卖债”定调长端利率底部，利率反弹力度决定寿险修复高度，首推太保和新华,东吴证券,2024-07-02,保险,https://pdf.dfcfw.com/pdf/H3_AP202407021637470676_1.pdf?1719942655000.pdf
金融行业周报：央行货币政策委员会召开二季度例会，科技金融新工作方案发布,平安证券,2024-07-01,保险,https://pdf.dfcfw.com/pdf/H3_AP202407011637125092_1.pdf?1719817525000.pdf
保险行业2024年中期策略报告：重视当前险企股债配置下的投资弹性,信达证券,2024-06-25,保险,https://pdf.dfcfw.com/pdf/H3_AP202406251636871639_1.pdf?1719333027000.pdf
保险估值探讨系列：从显著因子定量测算看合理估值区间在什么位置,华福证券,2024-06-23,保险,https://pdf.dfcfw.com/pdf/H3_AP202406231636799292_1.pdf?1719150896000.pdf
非银金融行业2024年5月上市险企保费点评：寿险增速平稳向好，财险单月迅速回暖,华福证券,2024-06-19,保险,https://pdf.dfcfw.com/pdf/H3_AP202406191636677017_1.pdf?1718782625000.pdf
保险业2024年中期策略报告：负债端已行稳，资产端待起航,平安证券,2024-06-19,保险,https://pdf.dfcfw.com/pdf/H3_AP202406191636687412_1.pdf?1718817434000.pdf
保险Ⅱ行业点评报告：5月人身险保费增速延续改善，财险景气度回升,开源证券,2024-06-18,保险,https://pdf.dfcfw.com/pdf/H3_AP202406171636547839_1.pdf?1718693168000.pdf
2024年5月保费收入点评：寿险定价调整有利短期销售,国信证券,2024-06-17,保险,https://pdf.dfcfw.com/pdf/H3_AP202406171636462415_1.pdf?1718616402000.pdf
金融行业周报：5月社融增速环比回升，部分险企拟下调增额终身寿险预定利率,平安证券,2024-06-17,保险,https://pdf.dfcfw.com/pdf/H3_AP202406171636463177_1.pdf?1718613295000.pdf
保险行业2024年度中期投资策略：降本增效有望促进业绩回暖,国联证券,2024-06-17,保险,https://pdf.dfcfw.com/pdf/H3_AP202406171636463814_1.pdf?1718615859000.pdf
转折中的前行：保险行业23年及24年Q1业绩总结与策略,太平洋,2024-06-17,保险,https://pdf.dfcfw.com/pdf/H3_AP202406171636464625_1.pdf?1718618254000.pdf
上市险企5月保费数据点评：寿险增速当弱不弱，车险增速逐月回暖,东吴证券,2024-06-16,保险,https://pdf.dfcfw.com/pdf/H3_AP202406161636459336_1.pdf?1718623170000.pdf
增额终身寿险定价利率下调点评：短期销售激活，长期利差压力缓解,国信证券,2024-06-14,保险,https://pdf.dfcfw.com/pdf/H3_AP202406141636236985_1.pdf?1718379042000.pdf
保险Ⅱ行业点评报告：关注险企调降增额终身寿预定利率，负债成本有望持续下降,开源证券,2024-06-13,保险,https://pdf.dfcfw.com/pdf/H3_AP202406131636079651_1.pdf?1718271930000.pdf
金融行业周报：中小行补降存款利率，严监管理念持续深化,平安证券,2024-06-11,保险,https://pdf.dfcfw.com/pdf/H3_AP202406111635944639_1.pdf?1718093872000.pdf
金融行业双周报：程序化交易管理新规出台，加强高频交易重点监控,东莞证券,2024-06-10,保险,https://pdf.dfcfw.com/pdf/H3_AP202406101635917142_1.pdf?1718035714000.pdf
保险行业4月月报：寿险保费仍实现两位数增长，产险业务增速放缓,海通国际,2024-06-07,保险,https://pdf.dfcfw.com/pdf/H3_AP202406071635855367_1.pdf?1717773488000.pdf
保险：机构立体博弈系列之二-“资产荒”下保险资管两端突围,国信证券,2024-06-03,保险,https://pdf.dfcfw.com/pdf/H3_AP202406031635234914_1.pdf?1717416040000.pdf
上市险企4月保费数据点评：个险新单面临高基数增长压力，银保降幅有望逐步收窄,东吴证券,2024-05-23,保险,https://pdf.dfcfw.com/pdf/H3_AP202405231634382590_1.pdf?1716472973000.pdf
上市险企4月保费点评：续期驱动寿险增速改善，非车大幅拖累财险增速,国金证券,2024-05-21,保险,https://pdf.dfcfw.com/pdf/H3_AP202405211634046870_1.pdf?1716298122000.pdf
保险业2024年一季报综述暨四月保费收入点评：资负共振，估值修复,国信证券,2024-05-20,保险,https://pdf.dfcfw.com/pdf/H3_AP202405201633850147_1.pdf?1716204468000.pdf
保险Ⅱ行业点评报告：地产掣肘打开，利率底部明确，股市反弹催化，继续首推中国太保,东吴证券,2024-05-20,保险,https://pdf.dfcfw.com/pdf/H3_AP202405191633835872_1.pdf?1716190962000.pdf
保险Ⅱ行业点评报告：4月人身险保费增速改善，关注资产端弹性催化,开源证券,2024-05-19,保险,https://pdf.dfcfw.com/pdf/H3_AP202405191633829700_1.pdf?1716125226000.pdf
保险资产管理业创新型产品1季度观察与展望：化债进程下一季度延续缩减趋势，新领域、新产品开拓有待进一步探索，城投行业的区域整合和清退风险需密切关注,中诚信国际,2024-05-17,保险,https://pdf.dfcfw.com/pdf/H3_AP202405171633703888_1.pdf?1715963338000.pdf
保险II：从1Q24偿二代二期工程季报看头部寿险公司经营质效-投资收益率逆市改善，保单盈利能力仍待改善,东吴证券,2024-05-17,保险,https://pdf.dfcfw.com/pdf/H3_AP202405171633710757_1.pdf?1715968573000.pdf
保险II行业研究深度报告：从1Q24偿二代二期工程季报看头部财险公司经营质效-承保利润小幅下降，综合投资收益率逆势改善,东吴证券,2024-05-15,保险,https://pdf.dfcfw.com/pdf/H3_AP202405151633173307_1.pdf?1715795547000.pdf
银保渠道监管政策导向梳理：银保升级，渠道改善,国信证券,2024-05-14,保险,https://pdf.dfcfw.com/pdf/H3_AP202405141633054393_1.pdf?1715694385000.pdf
中国财产险行业展望,中诚信国际,2024-05-14,保险,https://pdf.dfcfw.com/pdf/H3_AP202405141633060377_1.pdf?1715703899000.pdf
金融行业周报：新增社融转负，信贷重质不重量,平安证券,2024-05-13,保险,https://pdf.dfcfw.com/pdf/H3_AP202405131632933894_1.pdf?1715592141000.pdf
非银金融行业上市险企2024年一季报综述：负债端延续高景气，净利润表现分化,国联证券,2024-05-11,保险,https://pdf.dfcfw.com/pdf/H3_AP202405101632839973_1.pdf?1715415892000.pdf
保险Ⅱ：《关于商业银行代理保险业务有关事项的通知》点评-因势而变多方受益，头部险企仍然具有相对优势,开源证券,2024-05-11,保险,https://pdf.dfcfw.com/pdf/H3_AP202405111632892266_1.pdf?1715440717000.pdf
中国人身险行业展望，2024年,中诚信国际,2024-05-11,保险,https://pdf.dfcfw.com/pdf/H3_AP202405111632892828_1.pdf?1715443574000.pdf
保险行业研究：监管积极引导人身险行业压实负债质量-“率费双降”,中诚信国际,2024-05-11,保险,https://pdf.dfcfw.com/pdf/H3_AP202405111632893670_1.pdf?1715445062000.pdf
保险Ⅱ行业点评报告：《商业银行代理保险业务有关事项的通知》点评-放开1+3合作网点限制，大型险企产品+服务优势凸显,东吴证券,2024-05-10,保险,https://pdf.dfcfw.com/pdf/H3_AP202405091632779595_1.pdf?1715329844000.pdf
保险行业研究：银保新规点评：报行合一叠加资源禀赋和品牌优势下大型公司银保优势依然明显,国金证券,2024-05-10,保险,https://pdf.dfcfw.com/pdf/H3_AP202405101632810825_1.pdf?1715346658000.pdf
上市险企1Q24季报综述：高基数下资负两端全面超预期,东吴证券,2024-05-08,保险,https://pdf.dfcfw.com/pdf/H3_AP202405081632677442_1.pdf?1715204845000.pdf
保险行业2024年一季报综述：寿险持续改善，产险有所承压,平安证券,2024-05-07,保险,https://pdf.dfcfw.com/pdf/H3_AP202405071632549813_1.pdf?1715077787000.pdf
险企综述：2024年一季报综述：负债端保持高质量增长，关注资产端复苏的β弹性,开源证券,2024-05-07,保险,https://pdf.dfcfw.com/pdf/H3_AP202405071632574747_1.pdf?1715112866000.pdf
保险行业研究：24Q1季报综述：寿险NBV高增延续，财险受暴雪影响COR抬升,国金证券,2024-05-06,保险,https://pdf.dfcfw.com/pdf/H3_AP202405061632470554_1.pdf?1714991993000.pdf
金融行业周报：加快建设金融强国，金融板块持仓分化,平安证券,2024-04-29,保险,https://pdf.dfcfw.com/pdf/H3_AP202404291631564907_1.pdf?1714383509000.pdf
保险Ⅱ行业点评报告：利率底部上行，季报全面超预期，首推中国太保,东吴证券,2024-04-29,保险,https://pdf.dfcfw.com/pdf/H3_AP202404291631569660_1.pdf?1714389905000.pdf
保险资产管理行业研究：浙江省债权投资计划产品运行分析：产品登记数量全国领先，区县级基投主体为产品运用主力,中诚信国际,2024-04-29,保险,https://pdf.dfcfw.com/pdf/H3_AP202404291631569928_1.pdf?1714406217000.pdf
非银金融行业深圳无人驾驶航空器责任险业务空间分析：政策推动，低空经济延申产险场景,国信证券,2024-04-26,保险,https://pdf.dfcfw.com/pdf/H3_AP202404261631419859_1.pdf?1714163509000.pdf
综合金融服务行业周报：公募基金费改第二阶段正式落地；3月寿险保费增长提速,海通国际,2024-04-24,保险,https://pdf.dfcfw.com/pdf/H3_AP202404241631146925_1.pdf?1713992609000.pdf
保险Ⅱ行业点评报告：《关于推进新能源车险高质量发展有关工作的通知（征求意见稿）》点评-市场化理念下激活风险识别与定价能力,东吴证券,2024-04-22,保险,https://pdf.dfcfw.com/pdf/H3_AP202404221630955763_1.pdf?1713782665000.pdf
新能源车险新规征求意见稿点评：定价系数调整，车险供给优化,国信证券,2024-04-21,保险,https://pdf.dfcfw.com/pdf/H3_AP202404211630897254_1.pdf?1713697299000.pdf
非银金融行业2024年3月上市险企保费点评：财险单月增速边际改善，Q1价值预计延续高增,华福证券,2024-04-19,保险,https://pdf.dfcfw.com/pdf/H3_AP202404191630696994_1.pdf?1713556357000.pdf
保险Ⅱ行业点评报告：3月财险保费增速回暖，2024年负债端展望乐观,开源证券,2024-04-18,保险,https://pdf.dfcfw.com/pdf/H3_AP202404171630452566_1.pdf?1713426740000.pdf
上市险企3月保费数据点评：寿险新单量跌价升，车险保费增速回暖,东吴证券,2024-04-18,保险,https://pdf.dfcfw.com/pdf/H3_AP202404181630581082_1.pdf?1713476365000.pdf
2024年3月保费收入点评：改善持续，龙头受益,国信证券,2024-04-17,保险,https://pdf.dfcfw.com/pdf/H3_AP202404171630396158_1.pdf?1713362255000.pdf
上市险企2024年3月保费点评：寿险开门红持续改善，财险回暖增速提升,东海证券,2024-04-17,保险,https://pdf.dfcfw.com/pdf/H3_AP202404171630405108_1.pdf?1713374432000.pdf
保险行业研究：2023年报综述：资产端拖累利润表现，分红韧性强劲,国金证券,2024-04-14,保险,https://pdf.dfcfw.com/pdf/H3_AP202404141630208032_1.pdf?1713110465000.pdf
上市险企2023年报综述及2024Q1前瞻：负债端维持高景气，资产端持续承压,国联证券,2024-04-12,保险,https://pdf.dfcfw.com/pdf/H3_AP202404121630178416_1.pdf?1712936132000.pdf
从4Q23偿二代二期工程季报看头部寿险公司经营质效：核心偿付能力显分化，投资收益率成胜负手,东吴证券,2024-04-11,保险,https://pdf.dfcfw.com/pdf/H3_AP202404111630141164_1.pdf?1712842402000.pdf
保险精算假设调整研究暨2023年报分析：行“稳”以致远,平安证券,2024-04-11,保险,https://pdf.dfcfw.com/pdf/H3_AP202404111630151925_1.pdf?1712861367000.pdf
险企综述：2023年报综述暨一季报前瞻：负债端高质量增长可期，看好左侧布局机会,开源证券,2024-04-10,保险,https://pdf.dfcfw.com/pdf/H3_AP202404101630103824_1.pdf?1712747475000.pdf
金融行业周报：Q1货币政策委员会例会召开，2024年人身险“负面清单”发布,平安证券,2024-04-08,保险,https://pdf.dfcfw.com/pdf/H3_AP202404081630040567_1.pdf?1712564187000.pdf
保险业2023年财报综述：负债改革延续，资产收益承压,国信证券,2024-04-08,保险,https://pdf.dfcfw.com/pdf/H3_AP202404081630054467_1.pdf?1712601035000.pdf
上市险企2023年年报综述：寿财负债质量有望持续提升，关注资产端边际弹性,信达证券,2024-04-07,保险,https://pdf.dfcfw.com/pdf/H3_AP202404071630034807_1.pdf?1712500200000.pdf
保险行业2月月报：寿险保费增速明显提升，产险单月增速转负,海通国际,2024-04-03,保险,https://pdf.dfcfw.com/pdf/H3_AP202404031629684740_1.pdf?1712134548000.pdf
非银行金融行业点评：负债端改善但资产端承压，国寿23年利润下滑,平安证券,2024-03-28,保险,https://pdf.dfcfw.com/pdf/H3_AP202403281628448449_1.pdf?1711652751000.pdf
万能险定价利率下调预期分析：资产和负债端双向突围,国信证券,2024-03-27,保险,https://pdf.dfcfw.com/pdf/H3_AP202403271628289738_1.pdf?1711528662000.pdf
金融行业周报：人身险公司监管评级办法出台，央行表示降准仍有空间,平安证券,2024-03-25,保险,https://pdf.dfcfw.com/pdf/H3_AP202403251628066544_1.pdf?1711352542000.pdf
上市险企2月保费点评：寿险单月增速转正，产险阶段性调整,海通国际,2024-03-20,保险,https://pdf.dfcfw.com/pdf/H3_AP202403201627283214_1.pdf?1710934556000.pdf
2024年2月保费收入点评：关注“开门红”后的结构性机会,国信证券,2024-03-18,保险,https://pdf.dfcfw.com/pdf/H3_AP202403181626958259_1.pdf?1710749351000.pdf
上市险企2月保费数据点评：车险受春节错位放缓，个险达成和增长良好,东吴证券,2024-03-18,保险,https://pdf.dfcfw.com/pdf/H3_AP202403171626954626_1.pdf?1710746696000.pdf
保险Ⅱ行业点评报告：2月人身险保费正增长，经代报行合一利好头部险企,开源证券,2024-03-18,保险,https://pdf.dfcfw.com/pdf/H3_AP202403181626972420_1.pdf?1710783195000.pdf
保险Ⅱ行业深度报告：寿险内含价值精算假设调整分析与展望,东吴证券,2024-03-18,保险,https://pdf.dfcfw.com/pdf/H3_AP202403181626964814_1.pdf?1710769968000.pdf
主要上市险企2024年2月保费点评：寿险回暖，财险放缓，结构和质态有望持续提升,信达证券,2024-03-17,保险,https://pdf.dfcfw.com/pdf/H3_AP202403171626952783_1.pdf?1710671110000.pdf
2023保险资产管理年度报告：初心如磐，应势而谋,华宝证券,2024-03-10,保险,https://pdf.dfcfw.com/pdf/H3_AP202403101626199099_1.pdf?1710078146000.pdf
