研报名称,机构名称,发布时间,行业,研报地址
非银金融：“两个力争”预计或将为市场带来可观的增量资金,天风证券,2025-01-24,保险,https://pdf.dfcfw.com/pdf/H3_AP202501241642530778_1.pdf?1737752155000.pdf
新华保险接手杭州银行股份点评：“资产荒”延续，险资加快优质资产布局,国信证券,2025-01-24,保险,https://pdf.dfcfw.com/pdf/H3_AP202501241642532393_1.pdf?1737755688000.pdf
非银金融行业点评报告：六部委联合发文，切实引导中长期资金入市,东吴证券,2025-01-23,保险,https://pdf.dfcfw.com/pdf/H3_AP202501221642462898_1.pdf?1737617716000.pdf
非银行金融：长期资金入市指导意见点评：全面实施长周期考核，利于资本市场长期稳定发展,国金证券,2025-01-23,保险,https://pdf.dfcfw.com/pdf/H3_AP202501231642471400_1.pdf?1737619420000.pdf
保险行业事件点评：引导大型国有保险公司增加A股投资规模和实际比例，打通中长期资金入市的卡点堵点,东莞证券,2025-01-23,保险,https://pdf.dfcfw.com/pdf/H3_AP202501231642480067_1.pdf?1737643733000.pdf
中国互联网保险发展报告（2024）,清华大学五道口金融学院,2025-01-22,保险,https://pdf.dfcfw.com/pdf/H3_AP202501221642428722_1.pdf?1737539240000.pdf
财产保险行业2024年信用回顾与2025年展望,新世纪资信评估,2025-01-22,保险,https://pdf.dfcfw.com/pdf/H3_AP202501221642437517_1.pdf?1737542824000.pdf
健康保险2025年热门趋势,凯捷研究院,2025-01-20,保险,https://pdf.dfcfw.com/pdf/H3_AP202501191642333237_1.pdf?1737368106000.pdf
财产和意外伤害保险2025年热门趋势,凯捷研究院,2025-01-20,保险,https://pdf.dfcfw.com/pdf/H3_AP202501191642333238_1.pdf?1737366504000.pdf
上市险企12月保费点评：预计储蓄需求依旧旺盛，将带动寿险开门红延续增长；财险保费有望稳中有升,东吴证券,2025-01-19,保险,https://pdf.dfcfw.com/pdf/H3_AP202501181642318382_1.pdf?1737281467000.pdf
2024年12月保费收入点评：“开门红”全面启动,国信证券,2025-01-19,保险,https://pdf.dfcfw.com/pdf/H3_AP202501181642321686_1.pdf?1737281259000.pdf
凯捷金融服务2025年热门趋势：人寿保险,凯捷研究院,2025-01-19,保险,https://pdf.dfcfw.com/pdf/H3_AP202501191642333240_1.pdf?1737382611000.pdf
保险技术的AI拐点,威廉博莱,2025-01-19,保险,https://pdf.dfcfw.com/pdf/H3_AP202501191642333180_1.pdf?1737382360000.pdf
保险Ⅱ行业点评报告：健全保险机构监管评级分类监管，预计利好经营稳健的头部公司,东吴证券,2025-01-17,保险,https://pdf.dfcfw.com/pdf/H3_AP202501171642301972_1.pdf?1737146827000.pdf
Apache Doris助力中科软打造保险行业智能风控平台,中科软,2025-01-16,保险,https://pdf.dfcfw.com/pdf/H3_AP202501161641945803_1.pdf?1737033494000.pdf
养老保险体系研究（五）：中国补充养老险：个人养老金的发展现状与制度优化,平安证券,2025-01-15,保险,https://pdf.dfcfw.com/pdf/H3_AP202501151641930129_1.pdf?1736937073000.pdf
保险行业：浅析商业保理公司在资产证券化业务中的作用及相关风险缓释措施,联合资信,2025-01-15,保险,https://pdf.dfcfw.com/pdf/H3_AP202501151641929703_1.pdf?1736950772000.pdf
保险行业2025年信用风险展望：高质量发展再明晰 精准掌舵引领行业发展新阶段——厚积成势蓄待发 深耕易耨见富饶,大公国际,2025-01-13,保险,https://pdf.dfcfw.com/pdf/H3_AP202501131641899160_1.pdf?1736767463000.pdf
保险Ⅱ行业点评报告：预定利率动态调整机制落地，头部险企预定利率暂时维持不变,东吴证券,2025-01-12,保险,https://pdf.dfcfw.com/pdf/H3_AP202501111641894620_1.pdf?1736675439000.pdf
保险Ⅱ《预定利率动态调整政策》点评：预定利率动态调整细则落地，险企预定利率保持不变,开源证券,2025-01-12,保险,https://pdf.dfcfw.com/pdf/H3_AP202501121641897115_1.pdf?1736719133000.pdf
保险行业研究：预定利率动态调整机制落地，各大保险公司预定利率暂不下调,国金证券,2025-01-12,保险,https://pdf.dfcfw.com/pdf/H3_AP202501121641896638_1.pdf?1736704230000.pdf
保险行业建立预定利率与市场利率挂钩机制点评：优化负债管理，提高定价效率,国信证券,2025-01-12,保险,https://pdf.dfcfw.com/pdf/H3_AP202501121641896028_1.pdf?1736687915000.pdf
金融行业周报：政府投资基金指导意见出台，保险动态调整预定利率,平安证券,2025-01-12,保险,https://pdf.dfcfw.com/pdf/H3_AP202501121641896930_1.pdf?1736713231000.pdf
保险行业：利率换挡影响延续，财产险业务增速回落,中国银河,2025-01-06,保险,https://pdf.dfcfw.com/pdf/H3_AP202501061641814925_1.pdf?1736172255000.pdf
保险业高质量发展“有序的活力”系列报告之七：构建服务体系新能力点燃高质量发展新引擎,安永(中国)企业咨询,2025-01-02,保险,https://pdf.dfcfw.com/pdf/H3_AP202501021641517216_1.pdf?1735852317000.pdf
IFRS9对保险行业影响深度解析：透视金融资产风险真谛,联合资信,2024-12-30,保险,https://pdf.dfcfw.com/pdf/H3_AP202412301641466510_1.pdf?1735584917000.pdf
IFRS17对保险行业影响的深度解析：专题二：开启计量“黑盒子”,联合资信,2024-12-30,保险,https://pdf.dfcfw.com/pdf/H3_AP202412301641466508_1.pdf?1735569966000.pdf
非银行业点评：寿险重点转向开门红，车险受益于汽车产销高增,民生证券,2024-12-30,保险,https://pdf.dfcfw.com/pdf/H3_AP202412301641466805_1.pdf?1735636016000.pdf
保险：2024新康养需求洞察白皮书：泰享懂你 康养友伴,华泰财产,2024-12-27,保险,https://pdf.dfcfw.com/pdf/H3_AP202412271641444832_1.pdf?1735293432000.pdf
保险行业11月月报：产险单月保费增速回落，关注寿险2025年开门红表现,东吴证券,2024-12-27,保险,https://pdf.dfcfw.com/pdf/H3_AP202412271641446150_1.pdf?1735304954000.pdf
保险行业2025年度投资策略：又一个春天,民生证券,2024-12-25,保险,https://pdf.dfcfw.com/pdf/H3_AP202412251641420438_1.pdf?1735111383000.pdf
2024年保险行业分析及2025年展望,联合资信,2024-12-25,保险,https://pdf.dfcfw.com/pdf/H3_AP202412251641423127_1.pdf?1735136550000.pdf
长债破2%后险资配置行为分析：偿二代延续，资产荒犹存,国信证券,2024-12-23,保险,https://pdf.dfcfw.com/pdf/H3_AP202412231641393081_1.pdf?1734951206000.pdf
人身险行业研究框架专题报告：渠道产品转型深化，春回草木业态复苏,东海证券,2024-12-23,保险,https://pdf.dfcfw.com/pdf/H3_AP202412231641402133_1.pdf?1734981689000.pdf
上市险企2024年11月保费点评：寿险改善财险稳健， 业务重心转向2025“开门红”预录,东海证券,2024-12-18,保险,https://pdf.dfcfw.com/pdf/H3_AP202412181641344266_1.pdf?1734535526000.pdf
保险Ⅱ行业深度报告：分红型产品占比提升，开门红有望延续景气度,开源证券,2024-12-17,保险,https://pdf.dfcfw.com/pdf/H3_AP202412171641326500_1.pdf?1734434103000.pdf
保险Ⅱ：关于大力发展长期护理险的点评-长护险的探索实践与展望,国信证券,2024-12-17,保险,https://pdf.dfcfw.com/pdf/H3_AP202412171641335327_1.pdf?1734467407000.pdf
保险Ⅱ上市险企保费点评：11月人身险保费增速企稳，2025开门红有望延续景气度,开源证券,2024-12-17,保险,https://pdf.dfcfw.com/pdf/H3_AP202412171641335409_1.pdf?1734467842000.pdf
保险Ⅱ行业点评报告：金融支持银发经济大有可为，保险业可从资负两端双管齐下,东吴证券,2024-12-15,保险,https://pdf.dfcfw.com/pdf/H3_AP202412151641306331_1.pdf?1734262148000.pdf
保险Ⅱ行业点评报告：上市险企11月保费点评：寿险单月保费增速转正，关注25年开门红表现,东吴证券,2024-12-15,保险,https://pdf.dfcfw.com/pdf/H3_AP202412141641305443_1.pdf?1734258135000.pdf
金融行业周报：个人养老金制度全面实施，11月金融数据发布,平安证券,2024-12-15,保险,https://pdf.dfcfw.com/pdf/H3_AP202412151641307518_1.pdf?1734293263000.pdf
2024年11月保费收入点评：存款降息叠加产品优化，驱动新一轮“开门红”,国信证券,2024-12-15,保险,https://pdf.dfcfw.com/pdf/H3_AP202412151641306402_1.pdf?1734270757000.pdf
保险行业2025年度策略报告：稳中求进，变革图强,平安证券,2024-12-14,保险,https://pdf.dfcfw.com/pdf/H3_AP202412141641305748_1.pdf?1734258349000.pdf
保险行业研究：“报行合一”一周年，几家欢喜几家忧？,中诚信国际,2024-12-13,保险,https://pdf.dfcfw.com/pdf/H3_AP202412131641290559_1.pdf?1734106980000.pdf
保险行业研究：个人养老金迎全国推广，预计年缴存额有望超1500亿元,国金证券,2024-12-13,保险,https://pdf.dfcfw.com/pdf/H3_AP202412131641294166_1.pdf?1734109470000.pdf
保险Ⅱ行业点评报告：个人养老金制度全面实施，看好第三支柱长期空间,东吴证券,2024-12-12,保险,https://pdf.dfcfw.com/pdf/H3_AP202412121641283495_1.pdf?1734041147000.pdf
金融行业周报：财险业高质量发展行动方案出台，国信证券发布与万和重组草案,平安证券,2024-12-08,保险,https://pdf.dfcfw.com/pdf/H3_AP202412081641220426_1.pdf?1733695258000.pdf
保险行业：寿险保费增速放缓，权益资产配置提升,中国银河,2024-12-05,保险,https://pdf.dfcfw.com/pdf/H3_AP202412051641188382_1.pdf?1733393317000.pdf
保险年度策略报告：拥抱产品转型，重塑行业发展逻辑,国金证券,2024-12-05,保险,https://pdf.dfcfw.com/pdf/H3_AP202412051641188839_1.pdf?1733396539000.pdf
保险行业2025年投资策略：资负共振，长期可期,东吴证券,2024-12-05,保险,https://pdf.dfcfw.com/pdf/H3_AP202412051641194424_1.pdf?1733420412000.pdf
保险Ⅱ行业点评报告：新华保险举牌海通证券H股，体现对资本市场与优质券商发展信心,东吴证券,2024-12-05,保险,https://pdf.dfcfw.com/pdf/H3_AP202412051641196047_1.pdf?1733424610000.pdf
医保、商保数据互通点评：商业模式重塑，医疗险空间望打开,国信证券,2024-12-03,保险,https://pdf.dfcfw.com/pdf/H3_AP202412031641163788_1.pdf?1733247776000.pdf
保险Ⅱ行业点评报告：保险资产风险分类新规发布，有利于进一步压实保险资产质量管理,东吴证券,2024-12-01,保险,https://pdf.dfcfw.com/pdf/H3_AP202411291641125740_1.pdf?1733047739000.pdf
非银行业周报：保险资金运用风险监管再加强,民生证券,2024-12-01,保险,https://pdf.dfcfw.com/pdf/H3_AP202411301641129051_1.pdf?1733048878000.pdf
保险行业10月月报：产险保费显著回暖，寿险单月增速转负,东吴证券,2024-12-01,保险,https://pdf.dfcfw.com/pdf/H3_AP202412011641129103_1.pdf?1733048792000.pdf
金融行业周报：保险风险分类办法修订，存款利率自律管理强化,平安证券,2024-12-01,保险,https://pdf.dfcfw.com/pdf/H3_AP202412011641130272_1.pdf?1733076822000.pdf
2024年三季度保险业资金运用情况点评与展望：静待发令枪,国信证券,2024-11-29,保险,https://pdf.dfcfw.com/pdf/H3_AP202411291641116377_1.pdf?1732895777000.pdf
非银行业事件点评：商业健康险：医保赋能下的发展第二曲线,民生证券,2024-11-28,保险,https://pdf.dfcfw.com/pdf/H3_AP202411281641100243_1.pdf?1732791550000.pdf
保险行业信息点评：医保数据共享进一步推进，有望赋能商业健康险长期发展,海通国际,2024-11-25,保险,https://pdf.dfcfw.com/pdf/H3_AP202411251641052295_1.pdf?1732555235000.pdf
金融行业周报：宽基ETF批量降费，Q3银行净息差环比-1bp,平安证券,2024-11-24,保险,https://pdf.dfcfw.com/pdf/H3_AP202411241641043365_1.pdf?1732481922000.pdf
2025年上半年保险行业投资策略：资负双轮驱动，优选高弹性标的,东莞证券,2024-11-22,保险,https://pdf.dfcfw.com/pdf/H3_AP202411221641029529_1.pdf?1732297637000.pdf
保险资产管理业创新型产品1季度观察与展望：化债背景下全年趋势难扭转，绿金与ABS或成新机遇？,中诚信国际,2024-11-19,保险,https://pdf.dfcfw.com/pdf/H3_AP202411191640953682_1.pdf?1732014415000.pdf
上市险企保费点评：10月保费增速回落，关注开门红筹备及产品切换进展,开源证券,2024-11-19,保险,https://pdf.dfcfw.com/pdf/H3_AP202411191640954748_1.pdf?1732024510000.pdf
上市险企2024年10月保费点评：寿险承压财险改善，关注新定价策略下的“开门红”布局,东海证券,2024-11-18,保险,https://pdf.dfcfw.com/pdf/H3_AP202411181640941918_1.pdf?1731957472000.pdf
上市险企10月保费点评：寿险保费增速持续回落，关注25年开门红表现,海通国际,2024-11-18,保险,https://pdf.dfcfw.com/pdf/H3_AP202411181640942066_1.pdf?1731967586000.pdf
保险Ⅱ：从近期险资配置看红利行情持续-又见险资“举牌”时,国信证券,2024-11-17,保险,https://pdf.dfcfw.com/pdf/H3_AP202411171640927684_1.pdf?1731858330000.pdf
2024年10月保费收入点评：短期调整，蓄力备战,国信证券,2024-11-17,保险,https://pdf.dfcfw.com/pdf/H3_AP202411171640927682_1.pdf?1731863690000.pdf
非银行业点评：寿险聚焦分红险销售，财险维持回暖趋势,民生证券,2024-11-16,保险,https://pdf.dfcfw.com/pdf/H3_AP202411161640927290_1.pdf?1731840050000.pdf
保险Ⅱ：保险公司的投资策略如何演变？,国联证券,2024-11-15,保险,https://pdf.dfcfw.com/pdf/H3_AP202411151640912285_1.pdf?1731686281000.pdf
保险业2024年三季报综述：资产价值重估，利润大幅改善,国信证券,2024-11-14,保险,https://pdf.dfcfw.com/pdf/H3_AP202411141640883158_1.pdf?1731601163000.pdf
保险业2025年“开门红”前瞻：“开门红”被透支了吗？,国信证券,2024-11-05,保险,https://pdf.dfcfw.com/pdf/H3_AP202411051640716543_1.pdf?1730812084000.pdf
上市险企2024年三季报综述：资产端驱动业绩超预期，负债端较中报延续扩张,开源证券,2024-11-05,保险,https://pdf.dfcfw.com/pdf/H3_AP202411051640725230_1.pdf?1730829087000.pdf
上市险企2024年三季报综述：寿险NBV延续向好，投资收益改善带动净利润同比高增,国联证券,2024-11-04,保险,https://pdf.dfcfw.com/pdf/H3_AP202411041640709046_1.pdf?1730790499000.pdf
保险行业研究：24Q3季报综述：投资好转驱动利润大幅高增,国金证券,2024-11-03,保险,https://pdf.dfcfw.com/pdf/H3_AP202411031640686769_1.pdf?1730644439000.pdf
非银行金融行业点评：资产负债双驱，新华24Q3净利润与NBV高增,平安证券,2024-11-01,保险,https://pdf.dfcfw.com/pdf/H3_AP202411011640657724_1.pdf?1730451338000.pdf
非银行金融行业点评：负债端稳健，资产端驱动太保24Q3净利润高增,平安证券,2024-10-31,保险,https://pdf.dfcfw.com/pdf/H3_AP202410311640641801_1.pdf?1730392695000.pdf
金融行业周报：LPR调降25BP，券商收益凭证新规正式落地,平安证券,2024-10-28,保险,https://pdf.dfcfw.com/pdf/H3_AP202410281640529992_1.pdf?1730102890000.pdf
关于大力发展商业保险年金的点评：多元养老产品供给，共筑养老三支柱建设,国信证券,2024-10-25,保险,https://pdf.dfcfw.com/pdf/H3_AP202410251640477017_1.pdf?1729843531000.pdf
养老保险体系研究（四）：中国补充养老险：企职业年金的历史、现状与挑战,平安证券,2024-10-23,保险,https://pdf.dfcfw.com/pdf/H3_AP202410231640439354_1.pdf?1729705833000.pdf
金融行业周报：互换便利迅速落地，大行调降存款利率,平安证券,2024-10-20,保险,https://pdf.dfcfw.com/pdf/H3_AP202410201640375287_1.pdf?1729454574000.pdf
上市险企2024年9月保费点评：9月产寿险增速环比回落，关注新定价产品全面上线后的价值提升,东海证券,2024-10-18,保险,https://pdf.dfcfw.com/pdf/H3_AP202410181640355597_1.pdf?1729255581000.pdf
上市险企保费点评：3季度寿险新单增速扩张，9月车险延续改善趋势,开源证券,2024-10-18,保险,https://pdf.dfcfw.com/pdf/H3_AP202410181640358552_1.pdf?1729263487000.pdf
2024年9月保费收入点评：筹备“开门红”,国信证券,2024-10-18,保险,https://pdf.dfcfw.com/pdf/H3_AP202410181640363676_1.pdf?1729273944000.pdf
非银金融：中国财险COR与自然灾害的相关性解析,国联证券,2024-10-16,保险,https://pdf.dfcfw.com/pdf/H3_AP202410161640331131_1.pdf?1729115181000.pdf
金融行业周报：六大行调降存量按揭利率，国君海通重组方案落地,平安证券,2024-10-13,保险,https://pdf.dfcfw.com/pdf/H3_AP202410131640277806_1.pdf?1728846058000.pdf
行业点评报告：新华保险前三季业绩翻倍，全年ROE高增助推估值上行,开源证券,2024-10-09,保险,https://pdf.dfcfw.com/pdf/H3_AP202410091640222440_1.pdf?1728480985000.pdf
金融行业周报：政治局会议定调未来经济，政策“组合拳”陆续出台,平安证券,2024-09-30,保险,https://pdf.dfcfw.com/pdf/H3_AP202409301640096288_1.pdf?1727689296000.pdf
保险新“国十条”官方解析：防风险与促发展并举，健康险、养老险、车险等方面均将有政策出台,国金证券,2024-09-30,保险,https://pdf.dfcfw.com/pdf/H3_AP202409301640098337_1.pdf?1727692325000.pdf
保险Ⅱ行业点评报告：布局权益强β的寿险股，调整组合首推新华保险,东吴证券,2024-09-30,保险,https://pdf.dfcfw.com/pdf/H3_AP202409301640098279_1.pdf?1727691585000.pdf
非银金融行业专题研究：低利率环境下海外保险公司的突围之路,国联证券,2024-09-27,保险,https://pdf.dfcfw.com/pdf/H3_AP202409271640082948_1.pdf?1727466878000.pdf
保险Ⅱ行业点评报告：8月人身险高增受益停售窗口，全年负债端展望乐观,开源证券,2024-09-18,保险,https://pdf.dfcfw.com/pdf/H3_AP202409181639912811_1.pdf?1726657185000.pdf
保险Ⅱ行业点评报告：养老保障与财富管理需求或被激发——渐进式延迟法定退休年龄对商业保险影响分析,东吴证券,2024-09-18,保险,https://pdf.dfcfw.com/pdf/H3_AP202409181639916458_1.pdf?1726671027000.pdf
金融行业周报：新保险国十条发布，全面风险监管政策出台,平安证券,2024-09-17,保险,https://pdf.dfcfw.com/pdf/H3_AP202409171639905647_1.pdf?1726595830000.pdf
非银金融：保险新“国十条”有望推动行业高质量发展,国联证券,2024-09-16,保险,https://pdf.dfcfw.com/pdf/H3_AP202409151639888524_1.pdf?1726479364000.pdf
金融行业双周报：保险业迎来新“国十条”，M1连续五个月负增长,东莞证券,2024-09-16,保险,https://pdf.dfcfw.com/pdf/H3_AP202409161639890599_1.pdf?1726495948000.pdf
2024年8月保费收入点评：定价利率切换，配置需求提升,国信证券,2024-09-15,保险,https://pdf.dfcfw.com/pdf/H3_AP202409151639888497_1.pdf?1726479188000.pdf
保险“国十条”及基金分类点评：防范风险重于规模扩张，局部鼓励创新探索,国信证券,2024-09-13,保险,https://pdf.dfcfw.com/pdf/H3_AP202409131639876723_1.pdf?1726253606000.pdf
保险Ⅱ行业点评报告：新保险国十条解读：谱写严监管、防风险与促发展的协奏曲,东吴证券,2024-09-12,保险,https://pdf.dfcfw.com/pdf/H3_AP202409121639846662_1.pdf?1726135204000.pdf
保险Ⅱ行业点评报告：保险业高质量发展意见出台，支持头部险企做优做强,开源证券,2024-09-12,保险,https://pdf.dfcfw.com/pdf/H3_AP202409121639847531_1.pdf?1726147602000.pdf
保险行业研究：新“国十条”点评：助力行业长期健康发展，行业集中度有望提升,国金证券,2024-09-12,保险,https://pdf.dfcfw.com/pdf/H3_AP202409121639855489_1.pdf?1726163517000.pdf
保险Ⅱ行业深度报告：以日韩寿险业为鉴，监管呵护下利差损风险可控,开源证券,2024-09-11,保险,https://pdf.dfcfw.com/pdf/H3_AP202409111639828376_1.pdf?1726053164000.pdf
保险业2024年半年报综述：利润回升，负债投资双轮驱动,国信证券,2024-09-09,保险,https://pdf.dfcfw.com/pdf/H3_AP202409091639790243_1.pdf?1725887084000.pdf
养老保险体系研究（三）：中国基本养老险：制度现状、问题与政策建议,平安证券,2024-09-08,保险,https://pdf.dfcfw.com/pdf/H3_AP202409071639785087_1.pdf?1725806247000.pdf
非银行业（保险）2024年中报业绩综述：权益投资驱动利润表现回暖，资负有望共振,民生证券,2024-09-08,保险,https://pdf.dfcfw.com/pdf/H3_AP202409081639786210_1.pdf?1725812480000.pdf
险企：2024年中报综述-资负两端均超预期，负债端有望延续高景气,开源证券,2024-09-06,保险,https://pdf.dfcfw.com/pdf/H3_AP202409061639770776_1.pdf?1725633921000.pdf
上市险企2024年半年报综述：负债端延续向好，净利润增速环比显著改善,国联证券,2024-09-03,保险,https://pdf.dfcfw.com/pdf/H3_AP202409031639715932_1.pdf?1725391780000.pdf
保险行业研究：《保险资产风险分类办法（征求意见稿）》明确保险公司各类投资资产风险分类标准，强化内外部监督管理机制，压实投资端资产质量,中诚信国际,2024-09-02,保险,https://pdf.dfcfw.com/pdf/H3_AP202409021639691208_1.pdf?1725298877000.pdf
保险行业专题报告：以邻为镜：日本寿险行业的过去与现在,海通国际,2024-09-02,保险,https://pdf.dfcfw.com/pdf/H3_AP202409021639694084_1.pdf?1725305544000.pdf
保险行业研究2024中报综述：投资改善驱动Q2利润高增，Margin提升NBV高增延续,国金证券,2024-09-01,保险,https://pdf.dfcfw.com/pdf/H3_AP202409011639679275_1.pdf?1725199014000.pdf
金融行业周报：国常会研究推动保险业高质量发展，Q2对公贷款保持较高增速,平安证券,2024-09-01,保险,https://pdf.dfcfw.com/pdf/H3_AP202409011639681695_1.pdf?1725223111000.pdf
非银行金融行业点评：产寿险业绩略有分化，人保24H1稳中向好,平安证券,2024-08-30,保险,https://pdf.dfcfw.com/pdf/H3_AP202408301639593000_1.pdf?1725004488000.pdf
非银行金融行业点评：业务结构优化，国寿24H1业绩稳中向好,平安证券,2024-08-30,保险,https://pdf.dfcfw.com/pdf/H3_AP202408301639624867_1.pdf?1725036621000.pdf
保险业深度报告：寿险NBVM提振NBV增长，资产端为估值修复的关键,东莞证券,2024-08-29,保险,https://pdf.dfcfw.com/pdf/H3_AP202408291639563615_1.pdf?1724953600000.pdf
保险行业2024年中报前瞻：预计投资改善带动Q2净利润提升，寿险NBV有望延续较快增长,海通国际,2024-08-27,保险,https://pdf.dfcfw.com/pdf/H3_AP202408271639475000_1.pdf?1724766494000.pdf
保险行业信息点评：互联网财险业务新规落地，准入门槛明显提高,海通国际,2024-08-27,保险,https://pdf.dfcfw.com/pdf/H3_AP202408271639475002_1.pdf?1724766304000.pdf
保险利差系列报告一：基于日美德利差调控经验-定价调控政策“及时雨”助力缓释利差压力,国金证券,2024-08-26,保险,https://pdf.dfcfw.com/pdf/H3_AP202408261639447447_1.pdf?1724679975000.pdf
基于保险机构负债成本下调的研究：从负债成本看机构投债的安全边际,国信证券,2024-08-25,保险,https://pdf.dfcfw.com/pdf/H3_AP202408251639441429_1.pdf?1724594640000.pdf
金融行业周报：市场准入制度完善意见出台，国新办公布高质量发展成果,平安证券,2024-08-25,保险,https://pdf.dfcfw.com/pdf/H3_AP202408251639444061_1.pdf?1724620904000.pdf
保险资产管理业创新型产品1季度观察与展望：2024年上半年业务持续收缩，化债政策持续加码，绿色投资、城投转型项目有望增长,中诚信国际,2024-08-23,保险,https://pdf.dfcfw.com/pdf/H3_AP202408231639423156_1.pdf?1724448848000.pdf
上市险企2024年7月保费点评：高基数压力逐渐缓释，关注产品与渠道优化后的价值提升,东海证券,2024-08-21,保险,https://pdf.dfcfw.com/pdf/H3_AP202408211639373830_1.pdf?1724252078000.pdf
中国人寿拟减持杭州银行点评：国寿减持不改红利行情,国信证券,2024-08-21,保险,https://pdf.dfcfw.com/pdf/H3_AP202408211639386354_1.pdf?1724276429000.pdf
上市险企7月保费数据点评：寿险延续高增，车险增速企稳,东吴证券,2024-08-20,保险,https://pdf.dfcfw.com/pdf/H3_AP202408201639346300_1.pdf?1724140247000.pdf
非银金融行业2024年7月上市险企保费点评：人身险延续高增，财险增速稳健平缓,华福证券,2024-08-19,保险,https://pdf.dfcfw.com/pdf/H3_AP202408191639339298_1.pdf?1724093364000.pdf
2024年7月保费收入点评：负债成本下行，短期销售激活,国信证券,2024-08-18,保险,https://pdf.dfcfw.com/pdf/H3_AP202408181639323781_1.pdf?1723980701000.pdf
保险Ⅱ行业点评报告：7月人身险增速延续改善，关注险企中报景气度,开源证券,2024-08-17,保险,https://pdf.dfcfw.com/pdf/H3_AP202408171639323073_1.pdf?1723910974000.pdf
保险资产管理行业研究,中诚信国际,2024-08-15,保险,https://pdf.dfcfw.com/pdf/H3_AP202408151639292794_1.pdf?1723759883000.pdf
非银金融行业简评：预定利率持续下调，强化资负匹配助推三差均衡,东海证券,2024-08-07,保险,https://pdf.dfcfw.com/pdf/H3_AP202408071639181976_1.pdf?1723052312000.pdf
金融行业周报：股份行调降存款利率，人身险产品预定利率分批下调,平安证券,2024-08-05,保险,https://pdf.dfcfw.com/pdf/H3_AP202408051639143904_1.pdf?1722877644000.pdf
人身险预定利率下调点评：压降负债成本， 政策靴子落地,国信证券,2024-08-04,保险,https://pdf.dfcfw.com/pdf/H3_AP202408041639132403_1.pdf?1722783985000.pdf
行业点评报告：建立预定利率动态调节机制，鼓励分红型产品发展,开源证券,2024-08-03,保险,https://pdf.dfcfw.com/pdf/H3_AP202408031639131379_1.pdf?1722783905000.pdf
保险Ⅱ行业点评报告：预定利率如期下调，鼓励发展长期分红险，动态定价机制提升资产负债管理水平,东吴证券,2024-08-03,保险,https://pdf.dfcfw.com/pdf/H3_AP202408031639131741_1.pdf?1722785417000.pdf
