研报名称,机构名称,发布时间,行业,研报地址
NIFD季报：保险业运行,国家金融与发展实验室,2026-03-08,保险Ⅱ,https://pdf.dfcfw.com/pdf/H3_AP202603081820383242_1.pdf?1772982412000.pdf
2026年全球保险业展望：驾驭结构性变革与持续不确定性时代的关键制胜举措,安永(中国)企业咨询,2026-03-08,保险Ⅱ,https://pdf.dfcfw.com/pdf/H3_AP202603081820383247_1.pdf?1772981198000.pdf
从友邦保险经验比较，看好中资保险估值有望提升：基于新业务恢复增长、利率敏感性减弱和审慎的精算假设角度,华源证券,2026-02-25,保险Ⅱ,https://pdf.dfcfw.com/pdf/H3_AP202602251820026353_1.pdf?1772033235000.pdf
2025年四季度保险业资金运用情况点评：压实固收底仓，增持权益有空间,国信证券,2026-02-24,保险Ⅱ,https://pdf.dfcfw.com/pdf/H3_AP202602241819996429_1.pdf?1771954949000.pdf
保险行业研究：25全年股票+基金+长股投增长近2万亿、Q4单季增长千亿,国金证券,2026-02-24,保险Ⅱ,https://pdf.dfcfw.com/pdf/H3_AP202602241819995286_1.pdf?1771953134000.pdf
