研报名称,机构名称,发布时间,行业,研报地址
远洋渔业 头豹词条报告系列,头豹研究院,2024-01-25,农牧饲渔,https://pdf.dfcfw.com/pdf/H3_AP202401251618113059_1.pdf?1706211916000.pdf
柑桔种植 头豹词条报告系列,头豹研究院,2024-01-25,农牧饲渔,https://pdf.dfcfw.com/pdf/H3_AP202401251618112172_1.pdf?1706211611000.pdf
水产品加工 头豹词条报告系列,头豹研究院,2024-01-25,农牧饲渔,https://pdf.dfcfw.com/pdf/H3_AP202401251618113060_1.pdf?1706212210000.pdf
农林牧渔：12月猪企销售均价下滑 行业亏损产能去化持续,国联证券,2024-01-23,农牧饲渔,https://pdf.dfcfw.com/pdf/H3_AP202401221617926992_1.pdf?1705993849000.pdf
生猪养殖与饲料数据,中泰证券,2024-01-23,农牧饲渔,https://pdf.dfcfw.com/pdf/H3_AP202401231617941571_1.xls?1706002428000.xls
农业：2024年第02周黄羽肉鸡周报,中泰证券,2024-01-23,农牧饲渔,https://pdf.dfcfw.com/pdf/H3_AP202401231617941572_1.xls?1706003559000.xls
白羽肉鸡数据,中泰证券,2024-01-23,农牧饲渔,https://pdf.dfcfw.com/pdf/H3_AP202401231617941576_1.xls?1706004769000.xls
农业：白羽肉种鸡祖代及父母代生产和价格周报汇总表,中泰证券,2024-01-23,农牧饲渔,https://pdf.dfcfw.com/pdf/H3_AP202401231617941575_1.xls?1706003364000.xls
农林牧渔行业周报：猪价震荡不改去化趋势，鸡苗市场持续回暖,国投证券,2024-01-22,农牧饲渔,https://pdf.dfcfw.com/pdf/H3_AP202401221617910179_1.pdf?1705944665000.pdf
农林牧渔行业报告：生猪反弹乏力，旺季持续不旺,中邮证券,2024-01-22,农牧饲渔,https://pdf.dfcfw.com/pdf/H3_AP202401221617910930_1.pdf?1705945091000.pdf
农林牧渔行业周报：把握养殖股配置机遇,国海证券,2024-01-22,农牧饲渔,https://pdf.dfcfw.com/pdf/H3_AP202401221617916071_1.pdf?1705952848000.pdf
农业行业周报：白鸡价格上涨显著，12月宠物食品出口快增长,中国银河,2024-01-22,农牧饲渔,https://pdf.dfcfw.com/pdf/H3_AP202401221617898598_1.pdf?1705918789000.pdf
农林牧渔周报（第3期）：养猪业长时间亏损叠加疫情影响，产能深度去化逻辑坚挺,太平洋,2024-01-22,农牧饲渔,https://pdf.dfcfw.com/pdf/H3_AP202401221617903807_1.pdf?1705922078000.pdf
农林牧渔行业周报：猪价反弹乏力；转基因生物安全证书发放,民生证券,2024-01-22,农牧饲渔,https://pdf.dfcfw.com/pdf/H3_AP202401221617904182_1.pdf?1705928814000.pdf
农林牧渔行业研究周报：仔猪价格反弹不改产能去化大势,申港证券,2024-01-22,农牧饲渔,https://pdf.dfcfw.com/pdf/H3_AP202401221617905217_1.pdf?1705934304000.pdf
农林牧渔2024年第3周周报：仔猪价格反弹难改去化趋势，重视猪板块“前瞻性”机会！,天风证券,2024-01-22,农牧饲渔,https://pdf.dfcfw.com/pdf/H3_AP202401221617890166_1.pdf?1705914579000.pdf
农林牧渔行业周报：猪价反弹，预计节前涨幅有限,德邦证券,2024-01-22,农牧饲渔,https://pdf.dfcfw.com/pdf/H3_AP202401221617890997_1.pdf?1705915470000.pdf
农林牧渔行业：生猪重点关注集团厂母猪去化与补栏情况，宠物Q1看出口,华福证券,2024-01-22,农牧饲渔,https://pdf.dfcfw.com/pdf/H3_AP202401221617891026_1.pdf?1705919480000.pdf
农林牧渔行业周报：寒潮降温支撑短期猪价，仔猪涨价不改去化大势,开源证券,2024-01-22,农牧饲渔,https://pdf.dfcfw.com/pdf/H3_AP202401221617891040_1.pdf?1705915784000.pdf
农林牧渔行业研究：仔猪价格短时反弹，行业去产能趋势不变,国金证券,2024-01-22,农牧饲渔,https://pdf.dfcfw.com/pdf/H3_AP202401221617891593_1.pdf?1705913291000.pdf
农林牧渔行业周报：仔猪价格反弹空间有限，23年白羽祖代更新128万套,华安证券,2024-01-21,农牧饲渔,https://pdf.dfcfw.com/pdf/H3_AP202401211617887114_1.pdf?1705845178000.pdf
农产品研究跟踪系列报告（93）：本周生猪价格环比上涨，出栏均重延续下降,国信证券,2024-01-21,农牧饲渔,https://pdf.dfcfw.com/pdf/H3_AP202401211617887180_1.pdf?1705846987000.pdf
农业行业周报：根据“亏损期+低PB”策略，圣农发展已经进入配置窗口期,山西证券,2024-01-21,农牧饲渔,https://pdf.dfcfw.com/pdf/H3_AP202401211617887132_1.pdf?1705847081000.pdf
农林牧渔行业双周报：2023年12月能繁母猪存栏量持续回落,东莞证券,2024-01-21,农牧饲渔,https://pdf.dfcfw.com/pdf/H3_AP202401211617888110_1.pdf?1705857585000.pdf
农业周观点：肉鸡和生物育种的两个催化,中航证券,2024-01-21,农牧饲渔,https://pdf.dfcfw.com/pdf/H3_AP202401211617888955_1.pdf?1705916614000.pdf
种业重大政策点评：新一批转基因安全证书下发，共计6个新转基因玉米性状获批,国信证券,2024-01-19,农牧饲渔,https://pdf.dfcfw.com/pdf/H3_AP202401191617728208_1.pdf?1705662837000.pdf
农林牧渔周报（第51期）：养猪业产能去化动力充足，推荐养猪板块,太平洋,2024-01-19,农牧饲渔,https://pdf.dfcfw.com/pdf/H3_AP202401191617730843_1.pdf?1705677076000.pdf
淡水养殖 头豹词条报告系列,头豹研究院,2024-01-19,农牧饲渔,https://pdf.dfcfw.com/pdf/H3_AP202401191617744764_1.pdf?1705694346000.pdf
猪饲料 头豹词条报告系列,头豹研究院,2024-01-19,农牧饲渔,https://pdf.dfcfw.com/pdf/H3_AP202401191617744760_1.pdf?1705694039000.pdf
上市猪企销售月报总结：旺季亏损加剧，产能去化加速,中邮证券,2024-01-18,农牧饲渔,https://pdf.dfcfw.com/pdf/H3_AP202401181617679569_1.pdf?1705580365000.pdf
农林牧渔行业点评报告：季节性停苗带动白鸡价格上行，供给缺口传导已至低位布局正当时,开源证券,2024-01-17,农牧饲渔,https://pdf.dfcfw.com/pdf/H3_AP202401171617577407_1.pdf?1705480293000.pdf
农林牧渔12月上市猪企经营数据跟踪：旺季生猪价格持续走弱，产能去化趋势不改,山西证券,2024-01-17,农牧饲渔,https://pdf.dfcfw.com/pdf/H3_AP202401171617582071_1.pdf?1705490567000.pdf
农林牧渔：生猪产能去化延续，关注生猪养殖趋势性机会,南京证券,2024-01-17,农牧饲渔,https://pdf.dfcfw.com/pdf/H3_AP202401171617582558_1.pdf?1705496866000.pdf
农林牧渔周报（第2期）：数据利好，行业产能去化速度明显加快，推荐养猪板块,太平洋,2024-01-16,农牧饲渔,https://pdf.dfcfw.com/pdf/H3_AP202401161617509440_1.pdf?1705410563000.pdf
农林牧渔行业点评报告：USDA上调2023_2024年全球玉米、小麦和大豆产量，下调水稻产量,开源证券,2024-01-16,农牧饲渔,https://pdf.dfcfw.com/pdf/H3_AP202401161617510036_1.pdf?1705414978000.pdf
农林牧渔2024年第2周周报：从12月生猪销售月报，如何看猪企亏损幅度和资金压力？,天风证券,2024-01-15,农牧饲渔,https://pdf.dfcfw.com/pdf/H3_AP202401151617485898_1.pdf?1705313294000.pdf
农林牧渔行业研究：猪价持续下跌，USDA报告利空玉米,国金证券,2024-01-15,农牧饲渔,https://pdf.dfcfw.com/pdf/H3_AP202401151617486090_1.pdf?1705315168000.pdf
农业行业周报：本周猪价低迷，亏损加剧，产能去化持续,中国银河,2024-01-15,农牧饲渔,https://pdf.dfcfw.com/pdf/H3_AP202401151617485508_1.pdf?1705308287000.pdf
农林牧渔：猪肉消费处于近年底部，1H2024产能去化有望加速,华安证券,2024-01-15,农牧饲渔,https://pdf.dfcfw.com/pdf/H3_AP202401151617488256_1.pdf?1705315682000.pdf
农业周观点：猪价下探，产能去化预期进一步加强,中航证券,2024-01-15,农牧饲渔,https://pdf.dfcfw.com/pdf/H3_AP202401141617484565_1.pdf?1705318338000.pdf
农林牧渔行业周报：生猪价格震荡，鸡苗市场持续回暖,国投证券,2024-01-15,农牧饲渔,https://pdf.dfcfw.com/pdf/H3_AP202401141617484612_1.pdf?1705309701000.pdf
农林牧渔行业：养殖价格走低加速去化，宠物出口Q1超预期,华福证券,2024-01-15,农牧饲渔,https://pdf.dfcfw.com/pdf/H3_AP202401151617484925_1.pdf?1705315891000.pdf
农林牧渔行业周报：节后腌腊需求回落，南方猪价加速下跌,德邦证券,2024-01-15,农牧饲渔,https://pdf.dfcfw.com/pdf/H3_AP202401151617485812_1.pdf?1705313350000.pdf
农林牧渔行业周报：供给过剩猪价持续承压，冻品出货及非瘟高发或加重供需矛盾,开源证券,2024-01-15,农牧饲渔,https://pdf.dfcfw.com/pdf/H3_AP202401151617485877_1.pdf?1705306730000.pdf
农林牧渔行业研究周报：仔猪价格回暖 补栏情绪依旧低迷,申港证券,2024-01-15,农牧饲渔,https://pdf.dfcfw.com/pdf/H3_AP202401151617499539_1.pdf?1705352084000.pdf
农林牧渔行业周报：生猪价格周环比再跌3.4%，全球玉米大豆库消比近年最高,华安证券,2024-01-14,农牧饲渔,https://pdf.dfcfw.com/pdf/H3_AP202401141617483159_1.pdf?1705230621000.pdf
农业行业2024年度策略：看好生猪养殖股在2024年的投资机会,山西证券,2024-01-14,农牧饲渔,https://pdf.dfcfw.com/pdf/H3_AP202401141617483181_1.pdf?1705237286000.pdf
农产品研究跟踪系列报告（93）：本周生猪价格环比下跌，1月USDA报告利空豆粕,国信证券,2024-01-14,农牧饲渔,https://pdf.dfcfw.com/pdf/H3_AP202401141617483479_1.pdf?1705246391000.pdf
农林牧渔行业周专题：宠物主粮市场逐步实现国产替代,国联证券,2024-01-14,农牧饲渔,https://pdf.dfcfw.com/pdf/H3_AP202401141617483394_1.pdf?1705247235000.pdf
农林牧渔行业点评报告：肥猪集中出栏猪价旺季不旺，多重压力下能繁去化有望延续,开源证券,2024-01-12,农牧饲渔,https://pdf.dfcfw.com/pdf/H3_AP202401121617310228_1.pdf?1705053437000.pdf
农林牧渔2024年1月投资策略：本月重点推荐生猪养殖，春节前猪价或将提前回落,国信证券,2024-01-12,农牧饲渔,https://pdf.dfcfw.com/pdf/H3_AP202401121617336567_1.pdf?1705090110000.pdf
农林牧渔24年度策略：踏雪寻梅：掘金供给驱动的养殖大周期,天风证券,2024-01-11,农牧饲渔,https://pdf.dfcfw.com/pdf/H3_AP202401111617231775_1.pdf?1704961463000.pdf
2024年重要农产品价格展望,中泰证券,2024-01-11,农牧饲渔,https://pdf.dfcfw.com/pdf/H3_AP202401111617234363_1.pdf?1704966412000.pdf
农林牧渔行业周报：猪价震荡下跌，12月能繁去化持续,德邦证券,2024-01-09,农牧饲渔,https://pdf.dfcfw.com/pdf/H3_AP202401091616859356_1.pdf?1704790138000.pdf
农林牧渔行业周报：白羽肉鸡行情短期有望回暖，猫三联获批企业再添一员,国投证券,2024-01-09,农牧饲渔,https://pdf.dfcfw.com/pdf/H3_AP202401091616864959_1.pdf?1704796785000.pdf
农林牧渔行业周报（第1期）：节后猪价下跌，养猪业产能去化动力充足，推荐养猪板块,太平洋,2024-01-09,农牧饲渔,https://pdf.dfcfw.com/pdf/H3_AP202401091616867257_1.pdf?1704806256000.pdf
动物保健行业：周期与成长并存，增量空间广阔,国投证券,2024-01-09,农牧饲渔,https://pdf.dfcfw.com/pdf/H3_AP202401091616900611_1.pdf?1704832554000.pdf
农业行业周报：猪价旺季不旺，生猪产能去化逻辑有望进一步演绎,山西证券,2024-01-08,农牧饲渔,https://pdf.dfcfw.com/pdf/H3_AP202401081616761986_1.pdf?1704712070000.pdf
农业周观点：12月产能调减，生猪板块望进一步推动,中航证券,2024-01-08,农牧饲渔,https://pdf.dfcfw.com/pdf/H3_AP202401081616763961_1.pdf?1704733690000.pdf
农业行业周报：本周猪价持续下行，饲料原料价格下行,中国银河,2024-01-08,农牧饲渔,https://pdf.dfcfw.com/pdf/H3_AP202401081616765088_1.pdf?1704728988000.pdf
农林牧渔行业周报：猪企下调月出栏计划不改过剩大势，1-2月或再迎布局良机,开源证券,2024-01-08,农牧饲渔,https://pdf.dfcfw.com/pdf/H3_AP202401081616765724_1.pdf?1704744208000.pdf
农林牧渔行业周报：养殖仍处于配置窗口期,国海证券,2024-01-08,农牧饲渔,https://pdf.dfcfw.com/pdf/H3_AP202401081616774860_1.pdf?1704743122000.pdf
农林牧渔行业报告：生猪持续旺季亏损，产能去化速度依然较快,中邮证券,2024-01-08,农牧饲渔,https://pdf.dfcfw.com/pdf/H3_AP202401071616758316_1.pdf?1704701423000.pdf
农林牧渔行业双周报：能繁母猪产能持续去化,东莞证券,2024-01-08,农牧饲渔,https://pdf.dfcfw.com/pdf/H3_AP202401081616758744_1.pdf?1704699155000.pdf
农产品研究跟踪系列报告（92）：本周生猪价格环比下跌，猪肉需求边际减弱,国信证券,2024-01-08,农牧饲渔,https://pdf.dfcfw.com/pdf/H3_AP202401081616758852_1.pdf?1704704388000.pdf
农林牧渔2024年第1周周报：第三方数据显示能繁持续去化！重视生猪“前瞻性”机会！,天风证券,2024-01-08,农牧饲渔,https://pdf.dfcfw.com/pdf/H3_AP202401081616758907_1.pdf?1704705519000.pdf
农林牧渔行业周报：生猪进入需求真空期；俄克拉荷马州引种恢复,民生证券,2024-01-08,农牧饲渔,https://pdf.dfcfw.com/pdf/H3_AP202401081616761367_1.pdf?1704707533000.pdf
农林牧渔行业研究：生猪产能持续去化，节后猪价走弱,国金证券,2024-01-08,农牧饲渔,https://pdf.dfcfw.com/pdf/H3_AP202401081616761327_1.pdf?1704708449000.pdf
农林牧渔行业周报：生猪价格持续回落，本周出栏均重再升,华安证券,2024-01-07,农牧饲渔,https://pdf.dfcfw.com/pdf/H3_AP202401071616756954_1.pdf?1704630671000.pdf
农业行业2024年投资策略：生猪养殖周期布局，宠物赛道长坡厚雪,华福证券,2024-01-05,农牧饲渔,https://pdf.dfcfw.com/pdf/H3_AP202401051616475577_1.pdf?1704439631000.pdf
农林牧渔行业周观点（2023年第52周）：元旦猪价弱势运行，转基因品种获生产许可,东兴证券,2024-01-04,农牧饲渔,https://pdf.dfcfw.com/pdf/H3_AP202401041616342992_1.pdf?1704387253000.pdf
2024年农林牧渔行业年度策略：养殖链条动力强劲，种业振兴趋势不改,中航证券,2024-01-04,农牧饲渔,https://pdf.dfcfw.com/pdf/H3_AP202401041616352479_1.pdf?1704405826000.pdf
农林牧渔行业研究周报：年末猪价依然疲弱 产能有望加速去化,申港证券,2024-01-03,农牧饲渔,https://pdf.dfcfw.com/pdf/H3_AP202401031616127665_1.pdf?1704272327000.pdf
农林牧渔行业周报：年后猪价或加速下行，重视生猪板块前瞻布局机会,开源证券,2024-01-03,农牧饲渔,https://pdf.dfcfw.com/pdf/H3_AP202401031616219943_1.pdf?1704298672000.pdf
农林牧渔行业：生猪养殖与饲料数据,中泰证券,2024-01-02,农牧饲渔,https://pdf.dfcfw.com/pdf/H3_AP202401021615918334_1.xls?1704215509000.xls
农业：黄羽鸡价格,中泰证券,2024-01-02,农牧饲渔,https://pdf.dfcfw.com/pdf/H3_AP202401021615918339_1.xls?1704212418000.xls
农业：2023年第51周白羽肉鸡生产价格数据周报,中泰证券,2024-01-02,农牧饲渔,https://pdf.dfcfw.com/pdf/H3_AP202401021615918354_1.xls?1704213423000.xls
白羽肉鸡数据,中泰证券,2024-01-02,农牧饲渔,https://pdf.dfcfw.com/pdf/H3_AP202401021615918355_1.xls?1704215660000.xls
农业第50周：黄羽肉鸡数据周报,中泰证券,2024-01-02,农牧饲渔,https://pdf.dfcfw.com/pdf/H3_AP202401021615918377_1.xls?1704211691000.xls
农业行业周报：猪价旺季不旺，生猪产能去化逻辑有望进一步演绎,山西证券,2024-01-02,农牧饲渔,https://pdf.dfcfw.com/pdf/H3_AP202401021615922819_1.pdf?1704220271000.pdf
农业周观点：屠宰需求放缓，生物育种商业化双证落地,中航证券,2024-01-02,农牧饲渔,https://pdf.dfcfw.com/pdf/H3_AP202401021615911503_1.pdf?1704190960000.pdf
农林牧渔行业周报：冬至后需求回落，猪价延续下跌,德邦证券,2024-01-02,农牧饲渔,https://pdf.dfcfw.com/pdf/H3_AP202401021615913076_1.pdf?1704183615000.pdf
农林牧渔行业周报：供应端减量趋势显现，关注白羽鸡景气度上行,国投证券,2024-01-02,农牧饲渔,https://pdf.dfcfw.com/pdf/H3_AP202401021615913084_1.pdf?1704204025000.pdf
农林牧渔行业研究：生猪价格疲软，出栏均重持续上升,国金证券,2024-01-02,农牧饲渔,https://pdf.dfcfw.com/pdf/H3_AP202401021615914460_1.pdf?1704190960000.pdf
农产品研究跟踪系列报告（91）：本周生猪价格环比下跌，标肥价差进一步收窄,国信证券,2024-01-02,农牧饲渔,https://pdf.dfcfw.com/pdf/H3_AP202401021615914483_1.pdf?1704191413000.pdf
农林牧渔行业报告：节日拉动有限，猪价旺季不旺难以改变,中邮证券,2024-01-02,农牧饲渔,https://pdf.dfcfw.com/pdf/H3_AP202401021615915024_1.pdf?1704192917000.pdf
农林牧渔行业2023年第52周周报：新年第一周，如何看待农业板块投资机会？,天风证券,2024-01-02,农牧饲渔,https://pdf.dfcfw.com/pdf/H3_AP202401021615911940_1.pdf?1704187943000.pdf
养殖业月度简报：去化显著加速，能繁母猪出现年内最大跌幅,西南证券,2024-01-02,农牧饲渔,https://pdf.dfcfw.com/pdf/H3_AP202401021615912465_1.pdf?1704190655000.pdf
农林牧渔行业2024年度投资策略：养殖周期静待反转，转基因推动市场扩容,国联证券,2024-01-01,农牧饲渔,https://pdf.dfcfw.com/pdf/H3_AP202312301615847819_1.pdf?1704105623000.pdf
农林牧渔行业周报：元旦前猪价不涨反跌，出栏均重逾124公斤,华安证券,2024-01-01,农牧饲渔,https://pdf.dfcfw.com/pdf/H3_AP202401011615905385_1.pdf?1704104688000.pdf
2024年种植业年度策略：大鹏一日同风起，扶摇直上九万里,中泰证券,2023-12-28,农牧饲渔,https://pdf.dfcfw.com/pdf/H3_AP202312281615139473_1.pdf?1703749160000.pdf
农林牧渔：猪价旺季仍亏损，产能去化加速,南京证券,2023-12-28,农牧饲渔,https://pdf.dfcfw.com/pdf/H3_AP202312281615145061_1.pdf?1703757252000.pdf
农林牧渔12月行业动态报告：生猪产能去化加速中，关注养殖链布局机会,中国银河,2023-12-28,农牧饲渔,https://pdf.dfcfw.com/pdf/H3_AP202312281615146969_1.pdf?1703761233000.pdf
农林牧渔行业2024年投资策略：产能去化进行时，养殖产业链反转突破,西南证券,2023-12-28,农牧饲渔,https://pdf.dfcfw.com/pdf/H3_AP202312281615158502_1.pdf?1703786327000.pdf
农业行业深度报告：如何以数据测度白羽肉鸡周期？,海通国际,2023-12-27,农牧饲渔,https://pdf.dfcfw.com/pdf/H3_AP202312271614995095_1.pdf?1703664909000.pdf
海水捕捞 头豹词条报告系列,头豹研究院,2023-12-27,农牧饲渔,https://pdf.dfcfw.com/pdf/H3_AP202312271615027519_1.pdf?1703706273000.pdf
花生种植 头豹词条报告系列,头豹研究院,2023-12-27,农牧饲渔,https://pdf.dfcfw.com/pdf/H3_AP202312271615027518_1.pdf?1703706608000.pdf
内陆捕捞 头豹词条报告系列,头豹研究院,2023-12-27,农牧饲渔,https://pdf.dfcfw.com/pdf/H3_AP202312271615027522_1.pdf?1703706801000.pdf
生猪养殖行业,中诚信国际,2023-12-27,农牧饲渔,https://pdf.dfcfw.com/pdf/H3_AP202312271615019475_1.pdf?1703689139000.pdf
农林牧渔行业周报：生猪产能持续加速去化，关注白羽鸡景气度变化,国投证券,2023-12-26,农牧饲渔,https://pdf.dfcfw.com/pdf/H3_AP202312261614915735_1.pdf?1703623069000.pdf
农林牧渔行业周报：养殖板块产能去化有望提速,国海证券,2023-12-26,农牧饲渔,https://pdf.dfcfw.com/pdf/H3_AP202312251614897710_1.pdf?1703574299000.pdf
农林牧渔行业研究：猪价旺季不旺，重视生猪板块投资机会,国金证券,2023-12-25,农牧饲渔,https://pdf.dfcfw.com/pdf/H3_AP202312251614885301_1.pdf?1703502273000.pdf
农林牧渔行业周报：供需博弈，猪价“旺季不旺”,德邦证券,2023-12-25,农牧饲渔,https://pdf.dfcfw.com/pdf/H3_AP202312251614885324_1.pdf?1703501641000.pdf
农业行业周报：猪价旺季不旺，产能去化进程有望进一步深化,山西证券,2023-12-25,农牧饲渔,https://pdf.dfcfw.com/pdf/H3_AP202312251614886619_1.pdf?1703513848000.pdf
农林牧渔行业报告：猪价上涨乏力，白羽鸡从美国引种恢复,中邮证券,2023-12-25,农牧饲渔,https://pdf.dfcfw.com/pdf/H3_AP202312251614888050_1.pdf?1703520381000.pdf
农产品研究跟踪系列报告（90）：本周生猪价格环比下跌，预计春节前延续旺季不旺,国信证券,2023-12-25,农牧饲渔,https://pdf.dfcfw.com/pdf/H3_AP202312251614882227_1.pdf?1703500342000.pdf
农业行业周报：猪价震荡运行，白鸡祖代美国渠道引种恢复,中国银河,2023-12-25,农牧饲渔,https://pdf.dfcfw.com/pdf/H3_AP202312251614882696_1.pdf?1703498039000.pdf
农林牧渔2023年第51周周报：从150+份生猪产业问卷中，透视了哪些变化？,天风证券,2023-12-25,农牧饲渔,https://pdf.dfcfw.com/pdf/H3_AP202312251614885222_1.pdf?1703502458000.pdf
农林牧渔行业研究周报：腌腊提振有限 后市生猪供给压力大,申港证券,2023-12-25,农牧饲渔,https://pdf.dfcfw.com/pdf/H3_AP202312251614885240_1.pdf?1703502002000.pdf
农业周观点：备货需求抬升，生猪行情仍望催化,中航证券,2023-12-25,农牧饲渔,https://pdf.dfcfw.com/pdf/H3_AP202312251614882196_1.pdf?1703497466000.pdf
农林牧渔行业双周报：种业振兴行动取得阶段性成效,东莞证券,2023-12-24,农牧饲渔,https://pdf.dfcfw.com/pdf/H3_AP202312241614880528_1.pdf?1703430670000.pdf
农林牧渔行业周报：年末集中出栏难尽或致供给后移，猪价低迷延续养户资金持续承压,开源证券,2023-12-24,农牧饲渔,https://pdf.dfcfw.com/pdf/H3_AP202312241614880829_1.pdf?1703438145000.pdf
农林牧渔行业周报：腌腊旺季猪价持续疲弱，出栏均重升至124公斤,华安证券,2023-12-24,农牧饲渔,https://pdf.dfcfw.com/pdf/H3_AP202312241614880429_1.pdf?1703429538000.pdf
上市猪企销售月报总结：量增价跌，产能去化加速,中邮证券,2023-12-22,农牧饲渔,https://pdf.dfcfw.com/pdf/H3_AP202312221614822477_1.pdf?1703264754000.pdf
农林牧渔行业：2023年中国农业分子育种行业发展白皮书,亿欧智库,2023-12-21,农牧饲渔,https://pdf.dfcfw.com/pdf/H3_AP202312211614644813_1.pdf?1703170787000.pdf
农业2024年年度投资策略：养殖蓄能周期反转，转基因育种迎来新篇章,民生证券,2023-12-20,农牧饲渔,https://pdf.dfcfw.com/pdf/H3_AP202312201614589700_1.pdf?1703077719000.pdf
农林牧渔行业2024年度策略：农业大年，布局养殖,国信证券,2023-12-19,农牧饲渔,https://pdf.dfcfw.com/pdf/H3_AP202312191614507542_1.pdf?1702979032000.pdf
农林牧渔：白鸡价格震荡磨底拐点渐至，重视板块低位布局机会,开源证券,2023-12-18,农牧饲渔,https://pdf.dfcfw.com/pdf/H3_AP202312181614436187_1.pdf?1702888001000.pdf
农林牧渔2023年第50周周报：猪价小幅反弹不改产能去化趋势，重视猪板块“前瞻性”机会！,天风证券,2023-12-18,农牧饲渔,https://pdf.dfcfw.com/pdf/H3_AP202312181614436222_1.pdf?1702898098000.pdf
农林牧渔行业周报：2024H1猪肉供给或同比+3%，重视生猪板块回调后的布局良机,开源证券,2023-12-18,农牧饲渔,https://pdf.dfcfw.com/pdf/H3_AP202312181614436188_1.pdf?1702919259000.pdf
农业周观点：重视生猪备货需求过后的行情催化,中航证券,2023-12-18,农牧饲渔,https://pdf.dfcfw.com/pdf/H3_AP202312171614435432_1.pdf?1702892669000.pdf
农林牧渔行业报告：猪价季节性上涨，不改产能去化之势,中邮证券,2023-12-18,农牧饲渔,https://pdf.dfcfw.com/pdf/H3_AP202312171614435399_1.pdf?1702893356000.pdf
农林牧渔：11 月上市猪企经营数据跟踪-进入旺季出栏节奏， 均价近年同期最低,山西证券,2023-12-18,农牧饲渔,https://pdf.dfcfw.com/pdf/H3_AP202312181614439820_1.pdf?1702914991000.pdf
农林牧渔周报（第50期）：低猪价叠加疫情，养猪业去产能动力足，推荐养猪板块,太平洋,2023-12-18,农牧饲渔,https://pdf.dfcfw.com/pdf/H3_AP202312181614440511_1.pdf?1702925343000.pdf
农林牧渔行业简评：猪价旺季不旺加速产能去化，重视板块布局机会,东海证券,2023-12-18,农牧饲渔,https://pdf.dfcfw.com/pdf/H3_AP202312181614441318_1.pdf?1702916456000.pdf
农业2024年度策略报告：产能去化主轴下迎来养殖反转,国海证券,2023-12-18,农牧饲渔,https://pdf.dfcfw.com/pdf/H3_AP202312181614444485_1.pdf?1702918830000.pdf
农业行业周报：建议在当前第3个“亏损底”期间布局生猪养殖股,山西证券,2023-12-18,农牧饲渔,https://pdf.dfcfw.com/pdf/H3_AP202312181614447156_1.pdf?1702927333000.pdf
香蕉种植 头豹词条报告系列,头豹研究院,2023-12-18,农牧饲渔,https://pdf.dfcfw.com/pdf/H3_AP202312181614449216_1.pdf?1702930422000.pdf
农业行业周报：本周猪价反弹，持续关注产能去化节奏,中国银河,2023-12-18,农牧饲渔,https://pdf.dfcfw.com/pdf/H3_AP202312181614437968_1.pdf?1702905725000.pdf
农林牧渔行业周报：腌腊价格反弹不改产能去化趋势,国投证券,2023-12-18,农牧饲渔,https://pdf.dfcfw.com/pdf/H3_AP202312181614437970_1.pdf?1702907413000.pdf
农林牧渔行业周报：猪价反弹后下跌，产能去化仍为主旋律,德邦证券,2023-12-18,农牧饲渔,https://pdf.dfcfw.com/pdf/H3_AP202312181614439605_1.pdf?1702906688000.pdf
农产品研究跟踪系列报告（89）：本周生猪价格环比上涨，预计春节前延续旺季不旺,国信证券,2023-12-18,农牧饲渔,https://pdf.dfcfw.com/pdf/H3_AP202312181614439669_1.pdf?1702909180000.pdf
农林牧渔行业周报：腌腊旺季猪价反弹有限，生猪产能有望加速去化,华安证券,2023-12-17,农牧饲渔,https://pdf.dfcfw.com/pdf/H3_AP202312171614434405_1.pdf?1702825275000.pdf
农林牧渔行业点评报告：USDA上调2023_2024年全球玉米、小麦、水稻产量，下调大豆产量,开源证券,2023-12-15,农牧饲渔,https://pdf.dfcfw.com/pdf/H3_AP202312151614275810_1.pdf?1702652277000.pdf
农林牧渔：年末集中出栏去化延续，降温驱动短期猪价上涨不改长期去化大势,开源证券,2023-12-14,农牧饲渔,https://pdf.dfcfw.com/pdf/H3_AP202312141614120430_1.pdf?1702539696000.pdf
