研报名称,机构名称,发布时间,行业,研报地址
农林牧渔行业点评报告：白鸡价格趋势向上，供给偏紧或贯穿2024全年,开源证券,2024-03-14,农牧饲渔,https://pdf.dfcfw.com/pdf/H3_AP202403141626756527_1.pdf?1710443772000.pdf
农林牧渔&食品饮料：无糖茶饮空间广阔，猪价近期延续上行,首创证券,2024-03-13,农牧饲渔,https://pdf.dfcfw.com/pdf/H3_AP202403131626550493_1.pdf?1710321398000.pdf
农林牧渔周报（第10期）：仔猪价格持续回落，继续推荐养猪板块,太平洋,2024-03-13,农牧饲渔,https://pdf.dfcfw.com/pdf/H3_AP202403131626608852_1.pdf?1710335848000.pdf
农林牧渔行业周观点（2024年第10周）：二育入场猪价回升，不改产能去化趋势,东兴证券,2024-03-13,农牧饲渔,https://pdf.dfcfw.com/pdf/H3_AP202403131626652781_1.pdf?1710355567000.pdf
农林牧渔行业报告：短期价格回升，不影响产能去化之势,中邮证券,2024-03-12,农牧饲渔,https://pdf.dfcfw.com/pdf/H3_AP202403121626421077_1.pdf?1710235519000.pdf
农林牧渔行业点评报告：USDA上调2023_2024年全球小麦和水稻产量，下调玉米和大豆产量,开源证券,2024-03-12,农牧饲渔,https://pdf.dfcfw.com/pdf/H3_AP202403121626492550_1.pdf?1710316671000.pdf
农林牧渔行业点评报告：标肥价差走扩或缺乏持续性，猪价下行及标肥价差收窄或自3月下旬开启,开源证券,2024-03-12,农牧饲渔,https://pdf.dfcfw.com/pdf/H3_AP202403121626490723_1.pdf?1710278845000.pdf
农林牧渔行业2024年第9周周报：仔猪价格回落，行业主动产能去化有望加快，生猪板块价值凸显,天风证券,2024-03-11,农牧饲渔,https://pdf.dfcfw.com/pdf/H3_AP202403111626208699_1.pdf?1710150531000.pdf
农产品研究跟踪系列报告（99）：生猪挺价情绪缓和，仔猪价格企稳回落,国信证券,2024-03-11,农牧饲渔,https://pdf.dfcfw.com/pdf/H3_AP202403111626208995_1.pdf?1710148714000.pdf
农林牧渔行业2024年二季度投资策略报告：产能去化持续，左侧布局正当时,中邮证券,2024-03-11,农牧饲渔,https://pdf.dfcfw.com/pdf/H3_AP202403111626209551_1.pdf?1710147153000.pdf
农林牧渔行业研究：产能去化趋势延续，关注生猪投资机会,国金证券,2024-03-11,农牧饲渔,https://pdf.dfcfw.com/pdf/H3_AP202403111626210103_1.pdf?1710151508000.pdf
农林牧渔行业双周报：能繁母猪正常保有量目标下调,东莞证券,2024-03-11,农牧饲渔,https://pdf.dfcfw.com/pdf/H3_AP202403111626208962_1.pdf?1710150798000.pdf
农林牧渔行业周报：2月猪价震荡走弱，产能延续去化,德邦证券,2024-03-11,农牧饲渔,https://pdf.dfcfw.com/pdf/H3_AP202403111626215427_1.pdf?1710164927000.pdf
农林牧渔行业周报：仔猪价格持续回调，毛鸡价格企稳但仍亏损,国投证券,2024-03-11,农牧饲渔,https://pdf.dfcfw.com/pdf/H3_AP202403111626215429_1.pdf?1710165749000.pdf
农业行业周报：根据“亏损期+低PB”策略，圣农发展已经进入配置窗口期,山西证券,2024-03-11,农牧饲渔,https://pdf.dfcfw.com/pdf/H3_AP202403111626220526_1.pdf?1710178356000.pdf
农林牧渔行业周报：产能去化仍将持续，看好养殖板块机会,国海证券,2024-03-11,农牧饲渔,https://pdf.dfcfw.com/pdf/H3_AP202403111626322192_1.pdf?1710227409000.pdf
农业行业周报：畜禽价格低位震荡，产能去化进行中,中国银河,2024-03-11,农牧饲渔,https://pdf.dfcfw.com/pdf/H3_AP202403111626214488_1.pdf?1710167758000.pdf
本周仔猪价格继续回落，3月主要农产品库消比回落,华安证券,2024-03-10,农牧饲渔,https://pdf.dfcfw.com/pdf/H3_AP202403101626198957_1.pdf?1710069354000.pdf
行业周报：猪价上涨或缺乏持续性，重视猪鸡低位布局机会,开源证券,2024-03-10,农牧饲渔,https://pdf.dfcfw.com/pdf/H3_AP202403101626202369_1.pdf?1710102298000.pdf
农业周观点：两会重视粮食增产，关注种植资源与技术,中航证券,2024-03-10,农牧饲渔,https://pdf.dfcfw.com/pdf/H3_AP202403101626202591_1.pdf?1710150798000.pdf
农林牧渔周专题1月猪企收入出栏双增能繁存栏去化加速,国联证券,2024-03-09,农牧饲渔,https://pdf.dfcfw.com/pdf/H3_AP202403091626191058_1.pdf?1710022405000.pdf
农林牧渔2024年3月投资策略：把握生猪养殖主线，关注动保等后周期布局,国信证券,2024-03-08,农牧饲渔,https://pdf.dfcfw.com/pdf/H3_AP202403081626058986_1.pdf?1709932600000.pdf
生猪养殖行业深度报告：曙光初现，猪周期迎来重要转折,民生证券,2024-03-07,农牧饲渔,https://pdf.dfcfw.com/pdf/H3_AP202403061625781931_1.pdf?1709797535000.pdf
农林牧渔行业点评：2024年政府工作报告中农业关注点有哪些？,天风证券,2024-03-07,农牧饲渔,https://pdf.dfcfw.com/pdf/H3_AP202403071625917083_1.pdf?1709800981000.pdf
农业行业周报：能繁正常保有量目标下调，去产能仍为当前主线,海通国际,2024-03-05,农牧饲渔,https://pdf.dfcfw.com/pdf/H3_AP202403051625515309_1.pdf?1709655828000.pdf
农业行业周报：根据“亏损期+低PB”策略，圣农发展已经进入配置窗口期,山西证券,2024-03-05,农牧饲渔,https://pdf.dfcfw.com/pdf/H3_AP202403051625523555_1.pdf?1709669132000.pdf
农林牧渔行业周观点：生猪产能调控方案修订，产能去化趋势持续,东兴证券,2024-03-05,农牧饲渔,https://pdf.dfcfw.com/pdf/H3_AP202403051625505025_1.pdf?1709643873000.pdf
农业周观点：能繁母猪正常保有量调降，去产能逻辑强化,中航证券,2024-03-04,农牧饲渔,https://pdf.dfcfw.com/pdf/H3_AP202403041625215997_1.pdf?1709550927000.pdf
农业行业周报：猪价低位震荡，能繁母猪正常保有量降至3900万头,中国银河,2024-03-04,农牧饲渔,https://pdf.dfcfw.com/pdf/H3_AP202403041625222975_1.pdf?1709548067000.pdf
农林牧渔行业周报：能繁正常保有量下调或打击养殖信心，3月能繁去化有望加速,开源证券,2024-03-04,农牧饲渔,https://pdf.dfcfw.com/pdf/H3_AP202403041625233037_1.pdf?1709545486000.pdf
农林牧渔行业周报：仔猪价格回落，能繁母猪正常保有量下调,国金证券,2024-03-04,农牧饲渔,https://pdf.dfcfw.com/pdf/H3_AP202403041625248110_1.pdf?1709546527000.pdf
农林牧渔行业报告：下调能繁正常保有量目标，产能去化仍是主旋律,中邮证券,2024-03-04,农牧饲渔,https://pdf.dfcfw.com/pdf/H3_AP202403041625289921_1.pdf?1709553989000.pdf
农林牧渔行业动态点评：能繁母猪正常保有量下调，产能持续去化,东方财富证券,2024-03-04,农牧饲渔,https://pdf.dfcfw.com/pdf/H3_AP202403041625283082_1.pdf?1709548931000.pdf
农林牧渔行业：能繁去化持续，板块逢低加配,华福证券,2024-03-04,农牧饲渔,https://pdf.dfcfw.com/pdf/H3_AP202403041625297882_1.pdf?1709551035000.pdf
农林牧渔行业2024年第8周周报：仔猪价格有所回落，产能去化逻辑持续，重视养猪板块！,天风证券,2024-03-04,农牧饲渔,https://pdf.dfcfw.com/pdf/H3_AP202403041625214778_1.pdf?1709538128000.pdf
农林牧渔周报（第9期）：仔猪价格走弱，产能去化逻辑强化，继续推荐养猪板块,太平洋,2024-03-04,农牧饲渔,https://pdf.dfcfw.com/pdf/H3_AP202403041625379359_1.pdf?1709564636000.pdf
养殖业月度简报：加速去化兑现，能繁母猪出现周期内最大跌幅,西南证券,2024-03-04,农牧饲渔,https://pdf.dfcfw.com/pdf/H3_AP202403041625382471_1.pdf?1709569044000.pdf
中国海水捕捞行业市场规模测算逻辑模型 头豹词条报告系列,头豹研究院,2024-03-04,农牧饲渔,https://pdf.dfcfw.com/pdf/H3_AP202403041625394970_1.pdf?1709581341000.pdf
农林牧渔行业周报：生猪产能调控政策落地，产能去化为大势所趋,德邦证券,2024-03-04,农牧饲渔,https://pdf.dfcfw.com/pdf/H3_AP202403041625377614_1.pdf?1709559398000.pdf
农林牧渔行业周报：能繁母猪正常保有量目标下调至3900万头，持续关注产能去化,国投证券,2024-03-03,农牧饲渔,https://pdf.dfcfw.com/pdf/H3_AP202403031625210428_1.pdf?1709543155000.pdf
行业研究_行业周报：1月生猪产能去化1.8%，仔猪价格节后如期回落,华安证券,2024-03-03,农牧饲渔,https://pdf.dfcfw.com/pdf/H3_AP202403031625208725_1.pdf?1709477192000.pdf
农产品研究跟踪系列报告（98）：本周仔猪价格企稳回落，1月能繁母猪产能加速去化,国信证券,2024-03-03,农牧饲渔,https://pdf.dfcfw.com/pdf/H3_AP202403031625209403_1.pdf?1709482737000.pdf
农林牧渔：2-3月生猪调查问卷数据汇总,天风证券,2024-03-01,农牧饲渔,https://pdf.dfcfw.com/pdf/H3_AP202403011624847193_1.pdf?1709315605000.pdf
农林牧渔行业周观点（2024年第8周）：节后猪价持续下行，产能维持去化趋势,东兴证券,2024-02-29,农牧饲渔,https://pdf.dfcfw.com/pdf/H3_AP202402291624114148_1.pdf?1709228551000.pdf
农林牧渔行业月报：2月行业动态报告-生猪与仔猪价格分化，关注后续情绪演变,中国银河,2024-02-27,农牧饲渔,https://pdf.dfcfw.com/pdf/H3_AP202402271623728678_1.pdf?1709033483000.pdf
农业行业周报：能繁去化仍在途中，水产价格大多走强,海通国际,2024-02-27,农牧饲渔,https://pdf.dfcfw.com/pdf/H3_AP202402271623744840_1.pdf?1709055594000.pdf
农林牧渔行业周观点（2024年第8周）：元旦猪价弱势运行，转基因品种获生产许可,东兴证券,2024-02-27,农牧饲渔,https://pdf.dfcfw.com/pdf/H3_AP202402271623793204_1.pdf?1709106001000.pdf
农林牧渔行业报：生猪去化未变白鸡景气抬升，猪鸡低位布局正当时,开源证券,2024-02-26,农牧饲渔,https://pdf.dfcfw.com/pdf/H3_AP202402261623573103_1.pdf?1708934883000.pdf
农林牧渔行业2024年第7周周报：猪价加速探底，仔猪有价无市，重视养猪板块！,天风证券,2024-02-26,农牧饲渔,https://pdf.dfcfw.com/pdf/H3_AP202402261623573130_1.pdf?1708934981000.pdf
农林牧渔行业研究：节后猪价持续回落，行业去化持续加深,国金证券,2024-02-26,农牧饲渔,https://pdf.dfcfw.com/pdf/H3_AP202402261623573832_1.pdf?1708943119000.pdf
农林牧渔行业周报：节后消费惯性回落，生猪价格弱势下跌,德邦证券,2024-02-26,农牧饲渔,https://pdf.dfcfw.com/pdf/H3_AP202402261623574060_1.pdf?1708938774000.pdf
农林牧渔行业：仔猪与肥猪涨跌分化，板块逢低加配,华福证券,2024-02-26,农牧饲渔,https://pdf.dfcfw.com/pdf/H3_AP202402261623574604_1.pdf?1708941557000.pdf
种植业2月观点汇报,中泰证券,2024-02-26,农牧饲渔,https://pdf.dfcfw.com/pdf/H3_AP202402261623576199_1.pdf?1708946811000.pdf
农林牧渔行业周报：生猪价格周环比大跌6.7%，仔猪价格节后呈回落态势,华安证券,2024-02-26,农牧饲渔,https://pdf.dfcfw.com/pdf/H3_AP202402251623566742_1.pdf?1708935895000.pdf
农业周观点：节后猪价下探，仔猪行情难改去化趋势,中航证券,2024-02-26,农牧饲渔,https://pdf.dfcfw.com/pdf/H3_AP202402251623567407_1.pdf?1708937117000.pdf
农林牧渔行业周报：节后猪价跌幅明显，毛鸡价格持稳,国投证券,2024-02-26,农牧饲渔,https://pdf.dfcfw.com/pdf/H3_AP202402251623568208_1.pdf?1708933504000.pdf
农林牧渔行业报告：节后猪价持续走低,中邮证券,2024-02-26,农牧饲渔,https://pdf.dfcfw.com/pdf/H3_AP202402261623583568_1.pdf?1708965335000.pdf
农业行业周报：根据“亏损期+低PB”策略，圣农发展已经进入配置窗口期,山西证券,2024-02-26,农牧饲渔,https://pdf.dfcfw.com/pdf/H3_AP202402261623586371_1.pdf?1708970589000.pdf
农林牧渔行业周报：节后猪价低迷，继续看好养殖板块机会,国海证券,2024-02-26,农牧饲渔,https://pdf.dfcfw.com/pdf/H3_AP202402261623589120_1.pdf?1708975395000.pdf
农林牧渔行业点评报告：1月能繁去化延续，节后淡季猪价持续回落,开源证券,2024-02-25,农牧饲渔,https://pdf.dfcfw.com/pdf/H3_AP202402251623563175_1.pdf?1708860138000.pdf
农林牧渔：仔猪价格或呈回落态势，静待生猪产能加速去化,华安证券,2024-02-25,农牧饲渔,https://pdf.dfcfw.com/pdf/H3_AP202402251623563205_1.pdf?1708864437000.pdf
农林牧渔行业周报：生猪价格节后有所回落,东莞证券,2024-02-25,农牧饲渔,https://pdf.dfcfw.com/pdf/H3_AP202402251623565174_1.pdf?1708878136000.pdf
农产品研究跟踪系列报告（97）：猪价在春节后接续回落，上半年预计将淡季更淡,国信证券,2024-02-25,农牧饲渔,https://pdf.dfcfw.com/pdf/H3_AP202402251623565184_1.pdf?1708874844000.pdf
农林牧渔：节后猪价如期回落，去化延续但速度或受限,南京证券,2024-02-22,农牧饲渔,https://pdf.dfcfw.com/pdf/H3_AP202402221622753133_1.pdf?1708593098000.pdf
消费出海系列研究（ 二）：宠物食品出口明显改善，自主品牌出海新机遇,东海证券,2024-02-22,农牧饲渔,https://pdf.dfcfw.com/pdf/H3_AP202402221622801364_1.pdf?1708605980000.pdf
农林牧渔行业月报：畜禽价格反弹，“一号文件”提出生物育种产业化扩面提速,中原证券,2024-02-22,农牧饲渔,https://pdf.dfcfw.com/pdf/H3_AP202402221622818552_1.pdf?1708609809000.pdf
农林牧渔行业：寒潮不改去化趋势，持续推荐生猪养殖——生猪养殖行业跟踪,东兴证券,2024-02-22,农牧饲渔,https://pdf.dfcfw.com/pdf/H3_AP202402221622835384_1.pdf?1708628312000.pdf
如何看待生猪南北价差收窄？,国联证券,2024-02-22,农牧饲渔,https://pdf.dfcfw.com/pdf/H3_AP202402221622900927_1.pdf?1708636251000.pdf
农林牧渔行业点评报告：USDA上调2023_2024年全球小麦和水稻产量，下调玉米和大豆产量,开源证券,2024-02-20,农牧饲渔,https://pdf.dfcfw.com/pdf/H3_AP202402201622406328_1.pdf?1708419394000.pdf
农林牧渔：仔猪价格阶段反弹不改去化逻辑，继续重点推荐生猪养殖板块！,天风证券,2024-02-20,农牧饲渔,https://pdf.dfcfw.com/pdf/H3_AP202402201622416600_1.pdf?1708450728000.pdf
农林牧渔周报（第7期）：节后猪价下行有利于产能去化，继续推荐养猪板块,太平洋,2024-02-19,农牧饲渔,https://pdf.dfcfw.com/pdf/H3_AP202402191622381993_1.pdf?1708332086000.pdf
农林牧渔行业周报：寒潮降温难挡年后猪价回落，饲料原料价格下行缓解养殖压力,开源证券,2024-02-19,农牧饲渔,https://pdf.dfcfw.com/pdf/H3_AP202402191622383415_1.pdf?1708334502000.pdf
农林牧渔行业周报：春节期间海外农产品价格多数下跌；节后猪价如预期回落,民生证券,2024-02-19,农牧饲渔,https://pdf.dfcfw.com/pdf/H3_AP202402191622387641_1.pdf?1708356308000.pdf
农业周观点：春节期间行情变化支持养殖链催化,中航证券,2024-02-19,农牧饲渔,https://pdf.dfcfw.com/pdf/H3_AP202402191622382013_1.pdf?1708349666000.pdf
农林牧渔行业周报：节后猪价如期回落，静待生猪产能加速去化,华安证券,2024-02-18,农牧饲渔,https://pdf.dfcfw.com/pdf/H3_AP202402171622227986_1.pdf?1708248594000.pdf
农林牧渔2024年第6周周报：春节猪价如何看？,天风证券,2024-02-18,农牧饲渔,https://pdf.dfcfw.com/pdf/H3_AP202402181622358635_1.pdf?1708278963000.pdf
农林牧渔行业专题研究：透过农业2023业绩预告，我们看到了什么？,天风证券,2024-02-18,农牧饲渔,https://pdf.dfcfw.com/pdf/H3_AP202402181622336010_1.pdf?1708264055000.pdf
农产品研究跟踪系列报告（96）：猪价如期在春节前开启回落，春节后预计将进一步回调,国信证券,2024-02-18,农牧饲渔,https://pdf.dfcfw.com/pdf/H3_AP202402181622354107_1.pdf?1708273451000.pdf
农林牧渔2024年2月投资策略：生猪养殖布局正当时，行业产能去化有望进一步加速,国信证券,2024-02-15,农牧饲渔,https://pdf.dfcfw.com/pdf/H3_AP202402151621802470_1.pdf?1708007184000.pdf
农林牧渔：2024年中央一号文件点评报告-提升粮食单产水平，推动生物育种产业化扩面提速,中原证券,2024-02-08,农牧饲渔,https://pdf.dfcfw.com/pdf/H3_AP202402081621127073_1.pdf?1707391618000.pdf
农业行业周报：2024中央一号文件发布，聚焦国家粮食安全,中国银河,2024-02-05,农牧饲渔,https://pdf.dfcfw.com/pdf/H3_AP202402051620559347_1.pdf?1707125734000.pdf
农林牧渔行业：生猪价格往后预期不乐观，板块逢低加配,华福证券,2024-02-05,农牧饲渔,https://pdf.dfcfw.com/pdf/H3_AP202402051620560067_1.pdf?1707127291000.pdf
农林牧渔行业周报：2024年中央一号文件出台，确保国家粮食安全强化农业科技支撑,开源证券,2024-02-05,农牧饲渔,https://pdf.dfcfw.com/pdf/H3_AP202402051620560105_1.pdf?1707126538000.pdf
农林牧渔行业2024年第5周周报：一号文件发布，强调“粮食安全”是底线，看点有哪些？,天风证券,2024-02-05,农牧饲渔,https://pdf.dfcfw.com/pdf/H3_AP202402051620560163_1.pdf?1707126614000.pdf
证券研究报告：农林牧渔_行业周报,中邮证券,2024-02-05,农牧饲渔,https://pdf.dfcfw.com/pdf/H3_AP202402051620561205_1.pdf?1707129897000.pdf
农业周观点：猪价回暖不改去化趋势，增配生猪板块,中航证券,2024-02-05,农牧饲渔,https://pdf.dfcfw.com/pdf/H3_AP202402051620558122_1.pdf?1707129897000.pdf
农林牧渔行业周报：小年备货结束，猪价冲高回落,德邦证券,2024-02-05,农牧饲渔,https://pdf.dfcfw.com/pdf/H3_AP202402051620559216_1.pdf?1707124270000.pdf
白羽肉鸡行业点评：白羽肉鸡苗价格上涨超预期，供应减量有望形成支撑,民生证券,2024-02-05,农牧饲渔,https://pdf.dfcfw.com/pdf/H3_AP202402051620565357_1.pdf?1707153554000.pdf
农业行业周报：根据“亏损期+低PB”策略，圣农发展已经进入配置窗口期,山西证券,2024-02-05,农牧饲渔,https://pdf.dfcfw.com/pdf/H3_AP202402051620576714_1.pdf?1707169630000.pdf
农林牧渔：推动生物育种扩面提速，优化生猪产能调控机制,国联证券,2024-02-05,农牧饲渔,https://pdf.dfcfw.com/pdf/H3_AP202402051620576954_1.pdf?1707161914000.pdf
农林牧渔行业2024年中央一号文件点评：粮食安全为底线，生物育种产业化扩面提速,东兴证券,2024-02-05,农牧饲渔,https://pdf.dfcfw.com/pdf/H3_AP202402051620579885_1.pdf?1707166506000.pdf
农林牧渔行业周报：2024年中央一号文件发布，持续关注养殖和种植景气度,国投证券,2024-02-05,农牧饲渔,https://pdf.dfcfw.com/pdf/H3_AP202402051620583224_1.pdf?1707169055000.pdf
农林牧渔行业周报：如何看待春节前猪价上涨,国海证券,2024-02-05,农牧饲渔,https://pdf.dfcfw.com/pdf/H3_AP202402051620597371_1.pdf?1707205126000.pdf
农林牧渔行业研究周报：多因素促使猪价反弹，去产能逻辑不变,国金证券,2024-02-05,农牧饲渔,https://pdf.dfcfw.com/pdf/H3_AP202402051620562747_1.pdf?1707138407000.pdf
农林牧渔行业周报：节前猪价反弹明显,中邮证券,2024-02-05,农牧饲渔,https://pdf.dfcfw.com/pdf/H3_AP202402051620562643_1.pdf?1707140019000.pdf
农林牧渔周报（第5期）：一号文件强调粮食安全，利好种植和种子板块,太平洋,2024-02-05,农牧饲渔,https://pdf.dfcfw.com/pdf/H3_AP202402051620563216_1.pdf?1707141576000.pdf
农林牧渔：如何看待近期仔猪和猪价走势？,国联证券,2024-02-04,农牧饲渔,https://pdf.dfcfw.com/pdf/H3_AP202402031620263984_1.pdf?1707037153000.pdf
农林牧渔行业双周报：中央一号文件发布，生猪价格季节性回升,东莞证券,2024-02-04,农牧饲渔,https://pdf.dfcfw.com/pdf/H3_AP202402041620551985_1.pdf?1707068204000.pdf
2024年一号文点评：确保国家粮食安全、确保不发生规模性返贫为底线，打好乡村全面振兴漂亮仗,国信证券,2024-02-04,农牧饲渔,https://pdf.dfcfw.com/pdf/H3_AP202402041620552994_1.pdf?1707066679000.pdf
农产品研究跟踪系列报告（95）：本周生猪价格开启回落，春节前存栏及冻品库存压力较大,国信证券,2024-02-04,农牧饲渔,https://pdf.dfcfw.com/pdf/H3_AP202402041620552995_1.pdf?1707069269000.pdf
2024年农林牧渔行业策略报告：周期底部蓄势，布局养殖正当时,首创证券,2024-02-04,农牧饲渔,https://pdf.dfcfw.com/pdf/H3_AP202402041620551306_1.pdf?1707056515000.pdf
农林牧渔行业：2024年中央一号文件点评-生物育种扩面提速，乡村振兴稳步推进,东莞证券,2024-02-04,农牧饲渔,https://pdf.dfcfw.com/pdf/H3_AP202402041620551979_1.pdf?1707062804000.pdf
农林牧渔行业周报：生猪、仔猪价格涨跌分化，猪肉消费春节前上升,华安证券,2024-02-03,农牧饲渔,https://pdf.dfcfw.com/pdf/H3_AP202402031620264256_1.pdf?1707039290000.pdf
硝酸钾肥 头豹词条报告系列,头豹研究院,2024-02-02,农牧饲渔,https://pdf.dfcfw.com/pdf/H3_AP202402021620081557_1.pdf?1706903416000.pdf
农林牧渔行业简评报告：产能持续去化，继续关注生猪养殖板块,首创证券,2024-02-01,农牧饲渔,https://pdf.dfcfw.com/pdf/H3_AP202402011619996160_1.pdf?1706780482000.pdf
农林牧渔深度报告：国产替代进程加速，首款国产猫三联疫苗上市,华安证券,2024-01-31,农牧饲渔,https://pdf.dfcfw.com/pdf/H3_AP202401311619781525_1.pdf?1706706877000.pdf
农林牧渔行业养殖业月度简报：生猪出栏保持增长，基础产能合理调减,西南证券,2024-01-31,农牧饲渔,https://pdf.dfcfw.com/pdf/H3_AP202401311619778542_1.pdf?1706697084000.pdf
磷肥 头豹词条报告系列,头豹研究院,2024-01-30,农牧饲渔,https://pdf.dfcfw.com/pdf/H3_AP202401301619525491_1.pdf?1706644309000.pdf
生猪养殖行业深度报告：跟随产能去化 把握周期拐点,东莞证券,2024-01-30,农牧饲渔,https://pdf.dfcfw.com/pdf/H3_AP202401301619507023_1.pdf?1706611463000.pdf
农林牧渔1月行业动态报告：生猪养殖持续亏损，把握猪周期布局窗口期,中国银河,2024-01-29,农牧饲渔,https://pdf.dfcfw.com/pdf/H3_AP202401291619255825_1.pdf?1706524473000.pdf
农林牧渔周报（第4期）：猪价周环比上涨，能繁母猪存栏持续减少,太平洋,2024-01-29,农牧饲渔,https://pdf.dfcfw.com/pdf/H3_AP202401291619262787_1.pdf?1706525834000.pdf
农业行业周报：根据“亏损期+低PB”策略，圣农发展已经进入配置窗口期,山西证券,2024-01-29,农牧饲渔,https://pdf.dfcfw.com/pdf/H3_AP202401291619280439_1.pdf?1706568605000.pdf
复合肥 头豹词条报告系列,头豹研究院,2024-01-29,农牧饲渔,https://pdf.dfcfw.com/pdf/H3_AP202401291619283946_1.pdf?1706564563000.pdf
农产品研究跟踪系列报告（94）：本周生猪价格环比上涨，预计春节前后将开启回落,国信证券,2024-01-29,农牧饲渔,https://pdf.dfcfw.com/pdf/H3_AP202401291619251671_1.pdf?1706520269000.pdf
农林牧渔行业：供多需少现状不支撑旺季行情持续，集体补仔猪有可能导致行情误判,华福证券,2024-01-29,农牧饲渔,https://pdf.dfcfw.com/pdf/H3_AP202401291619252439_1.pdf?1706523627000.pdf
农林牧渔行业周报：2023Q4农业板块公募重仓持股环比提升，生猪优质标的增持居前,开源证券,2024-01-29,农牧饲渔,https://pdf.dfcfw.com/pdf/H3_AP202401291619252562_1.pdf?1706513949000.pdf
农林牧渔2024年第4周周报：如何看近期仔猪价格反弹？,天风证券,2024-01-29,农牧饲渔,https://pdf.dfcfw.com/pdf/H3_AP202401291619252585_1.pdf?1706542557000.pdf
农林牧渔行业周报：年前备货陆续开启，生猪价格延续反弹,德邦证券,2024-01-29,农牧饲渔,https://pdf.dfcfw.com/pdf/H3_AP202401291619253340_1.pdf?1706516871000.pdf
农林牧渔行业研究：猪价短时反弹不改趋势，重视生猪投资机会,国金证券,2024-01-29,农牧饲渔,https://pdf.dfcfw.com/pdf/H3_AP202401291619253761_1.pdf?1706528721000.pdf
行业周观点：春节备货提振猪价，仔猪价格涨幅明显,中航证券,2024-01-29,农牧饲渔,https://pdf.dfcfw.com/pdf/H3_AP202401281619247804_1.pdf?1706522875000.pdf
农林牧渔行业报告：生猪阶段性反弹，不改产能去化之势,中邮证券,2024-01-29,农牧饲渔,https://pdf.dfcfw.com/pdf/H3_AP202401291619248861_1.pdf?1706521942000.pdf
农林牧渔行业周报：预计猪价反弹难以持续，鸡苗市场涨势迅猛,国投证券,2024-01-28,农牧饲渔,https://pdf.dfcfw.com/pdf/H3_AP202401281619241247_1.pdf?1706449848000.pdf
农林牧渔行业周报：生猪、仔猪价格周环比大涨，猪肉消费相对疲弱,华安证券,2024-01-28,农牧饲渔,https://pdf.dfcfw.com/pdf/H3_AP202401281619243051_1.pdf?1706450398000.pdf
农林牧渔：宠物产品出口持续向好，国产自有品牌加速突围,华安证券,2024-01-26,农牧饲渔,https://pdf.dfcfw.com/pdf/H3_AP202401261618261582_1.pdf?1706261411000.pdf
农林牧渔2023Q4基金持仓分析：生猪板块增持明显，饲料、动保持仓环比提升,国信证券,2024-01-26,农牧饲渔,https://pdf.dfcfw.com/pdf/H3_AP202401261618278096_1.pdf?1706255167000.pdf
“读懂猪周期”系列报告二十：把握周期低迷&估值低位阶段的猪股配置时机,中国银河,2024-01-26,农牧饲渔,https://pdf.dfcfw.com/pdf/H3_AP202401261618316414_1.pdf?1706274683000.pdf
反刍动物饲料 头豹词条报告系列,头豹研究院,2024-01-26,农牧饲渔,https://pdf.dfcfw.com/pdf/H3_AP202401261618330124_1.pdf?1706298875000.pdf
葡萄种植 头豹词条报告系列,头豹研究院,2024-01-26,农牧饲渔,https://pdf.dfcfw.com/pdf/H3_AP202401261618330151_1.pdf?1706299311000.pdf
油料种植 头豹词条报告系列,头豹研究院,2024-01-26,农牧饲渔,https://pdf.dfcfw.com/pdf/H3_AP202401261618330181_1.pdf?1706299073000.pdf
农林牧渔行业月报：首批转基因玉米、大豆生产经营许可证发放，生物育种商业化加速,中原证券,2024-01-25,农牧饲渔,https://pdf.dfcfw.com/pdf/H3_AP202401251618101719_1.pdf?1706181114000.pdf
中国海水捕捞行业市场规模测算逻辑模型 头豹词条报告系列,头豹研究院,2024-01-25,农牧饲渔,https://pdf.dfcfw.com/pdf/H3_AP202401251618112171_1.pdf?1706211309000.pdf
