研报名称,机构名称,发布时间,行业,研报地址
农林牧渔：旺季猪价持续走低，11月产能去化或加速,南京证券,2023-12-14,农牧饲渔,https://pdf.dfcfw.com/pdf/H3_AP202312141614120432_1.pdf?1702545307000.pdf
农林牧渔行业专题研究：资金吃紧，产能去化，行业磨底,东方财富证券,2023-12-13,农牧饲渔,https://pdf.dfcfw.com/pdf/H3_AP202312131614068963_1.pdf?1702461277000.pdf
农林牧渔行业周报：如何看待11月能繁存栏变动？,德邦证券,2023-12-12,农牧饲渔,https://pdf.dfcfw.com/pdf/H3_AP202312121613742951_1.pdf?1702370544000.pdf
农林牧渔行业周观点（2023年第49周）：猪价旺季不旺，产能加速去化已现,东兴证券,2023-12-12,农牧饲渔,https://pdf.dfcfw.com/pdf/H3_AP202312121613762477_1.pdf?1702376969000.pdf
农业行业周报：建议在当前第3个“亏损底”期间布局生猪养殖股,山西证券,2023-12-12,农牧饲渔,https://pdf.dfcfw.com/pdf/H3_AP202312121613747318_1.pdf?1702388004000.pdf
农林牧渔行业研究：11月产能去化加速，转基因品种审定通过,国金证券,2023-12-11,农牧饲渔,https://pdf.dfcfw.com/pdf/H3_AP202312111613696178_1.pdf?1702306551000.pdf
农林牧渔行业双周报：农业农村部：引导养殖场户顺时顺势出栏生猪,东莞证券,2023-12-11,农牧饲渔,https://pdf.dfcfw.com/pdf/H3_AP202312111613696686_1.pdf?1702286816000.pdf
农林牧渔2023年12月投资策略：本月重点推荐生猪养殖，板块布局正当时,国信证券,2023-12-11,农牧饲渔,https://pdf.dfcfw.com/pdf/H3_AP202312111613696741_1.pdf?1702300740000.pdf
农产品研究跟踪系列报告（88）：生猪价格延续下跌，出栏均重向下调整,国信证券,2023-12-11,农牧饲渔,https://pdf.dfcfw.com/pdf/H3_AP202312111613696742_1.pdf?1702300825000.pdf
农林牧渔：生猪价格持续低迷，猪价预期走弱或推动产能去化延续,南京证券,2023-12-11,农牧饲渔,https://pdf.dfcfw.com/pdf/H3_AP202312111613696787_1.pdf?1702303380000.pdf
农林牧渔行业周报：年末生猪集中出栏致供需矛盾加剧，2024H1生猪供给或仍过剩,开源证券,2023-12-11,农牧饲渔,https://pdf.dfcfw.com/pdf/H3_AP202312111613696771_1.pdf?1702286256000.pdf
农林牧渔2023年第49周周报：11月多数据库能繁去化提速，静待大周期，重点推荐生猪板块！,天风证券,2023-12-11,农牧饲渔,https://pdf.dfcfw.com/pdf/H3_AP202312111613696809_1.pdf?1702293375000.pdf
农业行业周报：关注生猪冬季疫病进展，全球禽流感再爆发,中国银河,2023-12-11,农牧饲渔,https://pdf.dfcfw.com/pdf/H3_AP202312111613698199_1.pdf?1706192321000.pdf
农林牧渔周报（第49期）：疫情催动养猪行业加速去产能，推荐养猪板块,太平洋,2023-12-11,农牧饲渔,https://pdf.dfcfw.com/pdf/H3_AP202312111613698605_1.pdf?1702302922000.pdf
农林牧渔行业周报：产能去化加速，关注冬季猪病,国投证券,2023-12-11,农牧饲渔,https://pdf.dfcfw.com/pdf/H3_AP202312111613700460_1.pdf?1702308980000.pdf
农林牧渔行业报告：生猪旺季亏损，产能去化加速,中邮证券,2023-12-11,农牧饲渔,https://pdf.dfcfw.com/pdf/H3_AP202312101613694923_1.pdf?1702289082000.pdf
农业周观点：11月能繁去化加速，重视养殖链机会,中航证券,2023-12-11,农牧饲渔,https://pdf.dfcfw.com/pdf/H3_AP202312101613694901_1.pdf?1702289982000.pdf
农林牧渔行业周报：低体重猪出栏占比上升，11月生猪产能去化加速,华安证券,2023-12-10,农牧饲渔,https://pdf.dfcfw.com/pdf/H3_AP202312101613693596_1.pdf?1702216476000.pdf
农林牧渔2024年度投资策略：猪周期有望反转，种业将迎新成长,太平洋,2023-12-08,农牧饲渔,https://pdf.dfcfw.com/pdf/H3_AP202312081613630766_1.pdf?1702033078000.pdf
农林牧渔行业深度：决定产能去化的因素是什么,德邦证券,2023-12-08,农牧饲渔,https://pdf.dfcfw.com/pdf/H3_AP202312081613630776_1.pdf?1702032722000.pdf
2024年农林牧渔行业年度策略：直面行业低谷期，静候种养双链之佳音,中国银河,2023-12-08,农牧饲渔,https://pdf.dfcfw.com/pdf/H3_AP202312081613632830_1.pdf?1702048063000.pdf
农林牧渔深度报告：产能去化有望超预期，生猪养殖股配置正当时,华安证券,2023-12-07,农牧饲渔,https://pdf.dfcfw.com/pdf/H3_AP202312071613559807_1.pdf?1701964444000.pdf
农林牧渔行业2024年上半年投资策略：布局周期 拥抱景气,东莞证券,2023-12-07,农牧饲渔,https://pdf.dfcfw.com/pdf/H3_AP202312071613562631_1.pdf?1701969237000.pdf
农林牧渔行业周报：产能去化仍将持续，关注生猪板块,安信证券,2023-12-06,农牧饲渔,https://pdf.dfcfw.com/pdf/H3_AP202312061613416680_1.pdf?1701854056000.pdf
农林牧渔行业研究：周期底部蓄力 技术变革引领种业振兴,国金证券,2023-12-06,农牧饲渔,https://pdf.dfcfw.com/pdf/H3_AP202312061613424937_1.pdf?1701879603000.pdf
农林牧渔2023年第48周周报：猪价旺季不旺产能去化有望加速，静待大周期，重点推荐生猪板块！,天风证券,2023-12-05,农牧饲渔,https://pdf.dfcfw.com/pdf/H3_AP202312051613366419_1.pdf?1701770869000.pdf
农林牧渔行业研究周报：收储提振有限 猪价旺季不旺,申港证券,2023-12-05,农牧饲渔,https://pdf.dfcfw.com/pdf/H3_AP202312051613368794_1.pdf?1701781490000.pdf
生猪养殖行业投资四问四答-系列二：看好明年周期反转，养殖布局正当时,国信证券,2023-12-05,农牧饲渔,https://pdf.dfcfw.com/pdf/H3_AP202312051613369613_1.pdf?1701782121000.pdf
农林牧渔行业周报：重视消费弱势下生猪对冲、白鸡供需双驱投资机会,开源证券,2023-12-04,农牧饲渔,https://pdf.dfcfw.com/pdf/H3_AP202312041613222294_1.pdf?1701675565000.pdf
农产品研究跟踪系列报告（87）：生猪或季节性弱涨价，预计2024H1淡季更淡,国信证券,2023-12-04,农牧饲渔,https://pdf.dfcfw.com/pdf/H3_AP202312041613222900_1.pdf?1701690268000.pdf
农业行业周报：建议在当前第3个“亏损底”期间布局生猪养殖股,山西证券,2023-12-04,农牧饲渔,https://pdf.dfcfw.com/pdf/H3_AP202312041613231564_1.pdf?1701710348000.pdf
农林牧渔行业周报：生猪维持低价，主动去产能或将到来,国海证券,2023-12-04,农牧饲渔,https://pdf.dfcfw.com/pdf/H3_AP202312041613234700_1.pdf?1701715234000.pdf
农业周观点：国常会研究生物育种产业化，关注板块催化,中航证券,2023-12-04,农牧饲渔,https://pdf.dfcfw.com/pdf/H3_AP202312041613224980_1.pdf?1701703623000.pdf
农林牧渔行业报告：需求改善但供应压力大，猪价低位震荡,中邮证券,2023-12-04,农牧饲渔,https://pdf.dfcfw.com/pdf/H3_AP202312041613225272_1.pdf?1701689313000.pdf
农林牧渔行业周报：生猪价格震荡下跌，产能去化有望持续,德邦证券,2023-12-04,农牧饲渔,https://pdf.dfcfw.com/pdf/H3_AP202312041613227525_1.pdf?1701701398000.pdf
农业行业周报：猪价低位震荡，亏损持续显著,中国银河,2023-12-04,农牧饲渔,https://pdf.dfcfw.com/pdf/H3_AP202312041613227904_1.pdf?1701701602000.pdf
生猪系列报告之三：从资本流动和现金流的角度分析本轮“猪周期”的投资机会,国海证券,2023-12-03,农牧饲渔,https://pdf.dfcfw.com/pdf/H3_AP202312021613220109_1.pdf?1701597473000.pdf
农林牧渔行业周专题：复盘非瘟周期不同阶段中养殖股走势,国联证券,2023-12-03,农牧饲渔,https://pdf.dfcfw.com/pdf/H3_AP202312031613220465_1.pdf?1701595988000.pdf
农林牧渔行业周报：猪肉收储对猪价支撑有限，出栏均重升至124公斤,华安证券,2023-12-03,农牧饲渔,https://pdf.dfcfw.com/pdf/H3_AP202312031613220800_1.pdf?1701611428000.pdf
农林牧渔行业2024年年度策略：把握养殖周期复苏，拥抱宠物龙头崛起,中原证券,2023-12-01,农牧饲渔,https://pdf.dfcfw.com/pdf/H3_AP202312011613162816_1.pdf?1701448373000.pdf
农林牧渔行业投资策略：猪周期磨底蓄势，转基因大幕拉开,开源证券,2023-11-30,农牧饲渔,https://pdf.dfcfw.com/pdf/H3_AP202311301613020916_1.pdf?1701343970000.pdf
养殖业月度简报：猪价创新低，产能去化逻辑加强,西南证券,2023-11-30,农牧饲渔,https://pdf.dfcfw.com/pdf/H3_AP202311301613035129_1.pdf?1701350969000.pdf
大宗农产品投资分析框架——玉米,国信证券,2023-11-28,农牧饲渔,https://pdf.dfcfw.com/pdf/H3_AP202311281612479752_1.pdf?1701162341000.pdf
农林牧渔11月行业动态报告：关注冬季疫病及猪价走势，产能去化或加速,中国银河,2023-11-28,农牧饲渔,https://pdf.dfcfw.com/pdf/H3_AP202311281612484678_1.pdf?1701166558000.pdf
农林牧渔行业2024年年度行业投资策略：猪粮安天下，关注养殖周期回暖和转基因技术变革,东兴证券,2023-11-28,农牧饲渔,https://pdf.dfcfw.com/pdf/H3_AP202311281612484755_1.pdf?1701199153000.pdf
中国饲料行业市场规模测算逻辑模型 头豹词条报告系列,头豹研究院,2023-11-28,农牧饲渔,https://pdf.dfcfw.com/pdf/H3_AP202311281612497763_1.pdf?1701200699000.pdf
农林牧渔行业周报：生猪消费端支撑较弱，关注产能去化,安信证券,2023-11-27,农牧饲渔,https://pdf.dfcfw.com/pdf/H3_AP202311271612402771_1.pdf?1701122624000.pdf
农林牧渔行业周报：猪肉收储开启，把握周期底部布局机遇,德邦证券,2023-11-27,农牧饲渔,https://pdf.dfcfw.com/pdf/H3_AP202311271612386247_1.pdf?1701081548000.pdf
农林牧渔行业报告：猪价持续弱势，产能去化预期加强,中邮证券,2023-11-27,农牧饲渔,https://pdf.dfcfw.com/pdf/H3_AP202311271612386710_1.pdf?1701089127000.pdf
农林牧渔行业周报：猪价依然震荡偏弱，年底供应压力仍存,民生证券,2023-11-27,农牧饲渔,https://pdf.dfcfw.com/pdf/H3_AP202311271612387244_1.pdf?1701089591000.pdf
农业行业周报：建议在当前第3个“亏损底”期间布局生猪养殖股,山西证券,2023-11-27,农牧饲渔,https://pdf.dfcfw.com/pdf/H3_AP202311271612389288_1.pdf?1701096624000.pdf
农林牧渔周报（第47期）：国内生猪行业产能去化动力增强，建议增配养猪板块,太平洋,2023-11-27,农牧饲渔,https://pdf.dfcfw.com/pdf/H3_AP202311271612390599_1.pdf?1701101413000.pdf
农林牧渔行业：旺季价格远低预期，重点关注生猪板块逻辑持续演绎,华福证券,2023-11-27,农牧饲渔,https://pdf.dfcfw.com/pdf/H3_AP202311271612384146_1.pdf?1701082229000.pdf
农林牧渔行业研究：生猪需求偏弱，猪价或旺季不旺,国金证券,2023-11-27,农牧饲渔,https://pdf.dfcfw.com/pdf/H3_AP202311271612384699_1.pdf?1701079875000.pdf
农产品研究跟踪系列报告（86）：生猪或季节性弱涨价，大豆、玉米延续震荡走弱,国信证券,2023-11-27,农牧饲渔,https://pdf.dfcfw.com/pdf/H3_AP202311271612384919_1.pdf?1701086005000.pdf
农林牧渔行业周报：年末市场或不缺大猪，冻品出货压力仍较大,开源证券,2023-11-27,农牧饲渔,https://pdf.dfcfw.com/pdf/H3_AP202311271612385790_1.pdf?1701078662000.pdf
农林牧渔行业周报：腌腊旺季猪价不涨反跌，生猪产能去化有望加速,华安证券,2023-11-26,农牧饲渔,https://pdf.dfcfw.com/pdf/H3_AP202311261612382358_1.pdf?1701011638000.pdf
农林牧渔行业双周报：国家将启动年内第三批中央猪肉储备收储工作,东莞证券,2023-11-26,农牧饲渔,https://pdf.dfcfw.com/pdf/H3_AP202311261612382878_1.pdf?1701017496000.pdf
农林牧渔2023年第47周周报：猪肉收储政策再现，如何看待生猪养殖板块？,天风证券,2023-11-26,农牧饲渔,https://pdf.dfcfw.com/pdf/H3_AP202311261612382886_1.pdf?1701018113000.pdf
农业周观点：养殖预期抬升，重视动保板块机会,中航证券,2023-11-26,农牧饲渔,https://pdf.dfcfw.com/pdf/H3_AP202311261612383312_1.pdf?1701078866000.pdf
农林牧渔行业月报：畜禽价格震荡下行，双十一宠物消费亮眼,中原证券,2023-11-24,农牧饲渔,https://pdf.dfcfw.com/pdf/H3_AP202311241612223104_1.pdf?1700833540000.pdf
农林牧渔行业：黄羽肉鸡数据周报,中泰证券,2023-11-23,农牧饲渔,https://pdf.dfcfw.com/pdf/H3_AP202311231612193624_1.xls?1700731664000.xls
农林牧渔行业2023三季报总结：养殖报表进一步恶化，部分动保企业表现亮眼,国信证券,2023-11-23,农牧饲渔,https://pdf.dfcfw.com/pdf/H3_AP202311231612199610_1.pdf?1700733369000.pdf
橡胶市场近况及海南橡胶深度报告汇报,中泰证券,2023-11-23,农牧饲渔,https://pdf.dfcfw.com/pdf/H3_AP202311231612201128_1.pdf?1700735639000.pdf
农林牧渔行业：黄羽肉鸡数据周报,中泰证券,2023-11-22,农牧饲渔,https://pdf.dfcfw.com/pdf/H3_AP202311221611846179_1.xls?1700641351000.xls
农林牧渔&食品饮料：猪价短期震荡偏强，持续关注养殖板块,首创证券,2023-11-22,农牧饲渔,https://pdf.dfcfw.com/pdf/H3_AP202311221612018405_1.pdf?1700660689000.pdf
农业：黄羽肉鸡数据周报,中泰证券,2023-11-21,农牧饲渔,https://pdf.dfcfw.com/pdf/H3_AP202311211611761693_1.xls?1700584543000.xls
农林牧渔2023年第46周周报：猪价低位震荡，继续推荐猪板块“前瞻性”机会！,天风证券,2023-11-20,农牧饲渔,https://pdf.dfcfw.com/pdf/H3_AP202311201611683315_1.pdf?1700478594000.pdf
农林牧渔行业研究周报：肥猪价格回暖 季节性反弹高度有限,申港证券,2023-11-20,农牧饲渔,https://pdf.dfcfw.com/pdf/H3_AP202311201611683329_1.pdf?1700477425000.pdf
农林牧渔行业研究：猪价持续低迷，产能去化速度有望加快,国金证券,2023-11-20,农牧饲渔,https://pdf.dfcfw.com/pdf/H3_AP202311201611683396_1.pdf?1700479643000.pdf
农林牧渔行业周报：南方腌腊零星开启，生猪价格小幅上行,德邦证券,2023-11-20,农牧饲渔,https://pdf.dfcfw.com/pdf/H3_AP202311201611683419_1.pdf?1700478510000.pdf
农林牧渔行业：生猪需求转暖价格持续下跌，关注板块前瞻性机会,华福证券,2023-11-20,农牧饲渔,https://pdf.dfcfw.com/pdf/H3_AP202311201611683573_1.pdf?1700480305000.pdf
上市猪企销售月报点评：量稳价跌，产能去化虽慢但持续,中邮证券,2023-11-20,农牧饲渔,https://pdf.dfcfw.com/pdf/H3_AP202311201611692810_1.pdf?1700501016000.pdf
农林牧渔行业周报：生猪维持低价，产能有望加速去化,国海证券,2023-11-20,农牧饲渔,https://pdf.dfcfw.com/pdf/H3_AP202311201611699835_1.pdf?1700512817000.pdf
农业周观点：猪价延续低迷，玉米大豆调增产量预期,中航证券,2023-11-20,农牧饲渔,https://pdf.dfcfw.com/pdf/H3_AP202311191611679422_1.pdf?1700474458000.pdf
农产品研究跟踪系列报告（85）：生猪价格或季节性弱涨价，养殖情绪继续悲观,国信证券,2023-11-20,农牧饲渔,https://pdf.dfcfw.com/pdf/H3_AP202311201611680407_1.pdf?1700468323000.pdf
农林牧渔行业周报：肥猪溢价猪价反弹不改去化大势，农业板块进入年末较好布局时点,开源证券,2023-11-20,农牧饲渔,https://pdf.dfcfw.com/pdf/H3_AP202311201611680423_1.pdf?1700466739000.pdf
农业行业周报：本周猪价回升，大猪出栏占比提升,中国银河,2023-11-20,农牧饲渔,https://pdf.dfcfw.com/pdf/H3_AP202311201611681035_1.pdf?1700470696000.pdf
农林牧渔行业周报：鸡苗价格企稳；关注非瘟疫苗研发进程,民生证券,2023-11-20,农牧饲渔,https://pdf.dfcfw.com/pdf/H3_AP202311201611682029_1.pdf?1700472570000.pdf
透视宠物板块双11：原料工艺成分创新，国产品牌强势崛起！,天风证券,2023-11-19,农牧饲渔,https://pdf.dfcfw.com/pdf/H3_AP202311191611678415_1.pdf?1705080014000.pdf
农林牧渔行业周报：上市猪企10月出栏同比增14.7%，出栏生猪周均重逾123公斤,华安证券,2023-11-19,农牧饲渔,https://pdf.dfcfw.com/pdf/H3_AP202311191611678812_1.pdf?1700411269000.pdf
农林牧渔行业深度分析：白羽鸡拐点将近，产能下行趋势已现,安信证券,2023-11-17,农牧饲渔,https://pdf.dfcfw.com/pdf/H3_AP202311171611293815_1.pdf?1700213974000.pdf
食品饮料&农林牧渔行业简评报告：关注食品细分亮点，猪价延续低位震荡,首创证券,2023-11-17,农牧饲渔,https://pdf.dfcfw.com/pdf/H3_AP202311171611379913_1.pdf?1700251240000.pdf
宠物食品专题报告一：复盘历年双十一宠物食品发展新趋势,中泰证券,2023-11-16,农牧饲渔,https://pdf.dfcfw.com/pdf/H3_AP202311161611020199_1.pdf?1700126807000.pdf
农林牧渔行业点评报告：USDA上调2023_2024年全球玉米、大豆产量，下调小麦、水稻产量,开源证券,2023-11-16,农牧饲渔,https://pdf.dfcfw.com/pdf/H3_AP202311161611039048_1.pdf?1700163052000.pdf
动物保健行业投资框架,国信证券,2023-11-16,农牧饲渔,https://pdf.dfcfw.com/pdf/H3_AP202311161610996111_1.pdf?1700120331000.pdf
农林牧渔行业点评报告：肉鸡需求回落价格下行，静待年末白鸡景气抬升,开源证券,2023-11-16,农牧饲渔,https://pdf.dfcfw.com/pdf/H3_AP202311161611014941_1.pdf?1700125014000.pdf
农林牧渔行业周报：如何看待10月猪企销售数据？,德邦证券,2023-11-14,农牧饲渔,https://pdf.dfcfw.com/pdf/H3_AP202311141610633282_1.pdf?1699947098000.pdf
农林牧渔行业专题：生猪产业资金链紧张，产能去化有望加速,华安证券,2023-11-14,农牧饲渔,https://pdf.dfcfw.com/pdf/H3_AP202311141610699475_1.pdf?1699974067000.pdf
农林牧渔行业点评报告：猪价低迷能繁加速去化，天气转凉腌腊需求或对年末猪价形成支撑,开源证券,2023-11-14,农牧饲渔,https://pdf.dfcfw.com/pdf/H3_AP202311141610701302_1.pdf?1699978853000.pdf
农林牧渔2023年第45周周报：第三方机构10月能繁数据降幅扩大，重视猪板块“前瞻性”机会！,天风证券,2023-11-13,农牧饲渔,https://pdf.dfcfw.com/pdf/H3_AP202311131609918781_1.pdf?1699864343000.pdf
农林牧渔行业点评：10月生猪销售月报透露哪些信号？,天风证券,2023-11-13,农牧饲渔,https://pdf.dfcfw.com/pdf/H3_AP202311131609918782_1.pdf?1699866199000.pdf
农林牧渔行业周报：生猪产能去化有望加速 USDA报告利空美豆美玉米,国联证券,2023-11-13,农牧饲渔,https://pdf.dfcfw.com/pdf/H3_AP202311131609920615_1.pdf?1699869977000.pdf
农林牧渔行业研究：生猪产能持续去化，关注养殖板块投资机会,国金证券,2023-11-13,农牧饲渔,https://pdf.dfcfw.com/pdf/H3_AP202311131609921525_1.pdf?1699874155000.pdf
农林牧渔行业：生猪去化加速，双十一宠物行业迎来大幅增长,华福证券,2023-11-13,农牧饲渔,https://pdf.dfcfw.com/pdf/H3_AP202311131609922168_1.pdf?1699882196000.pdf
农林牧渔行业周报：双十一宠食板块销售靓丽，国货品牌崛起领跑行业,开源证券,2023-11-13,农牧饲渔,https://pdf.dfcfw.com/pdf/H3_AP202311131609922182_1.pdf?1699881616000.pdf
农业周观点：10月能繁调降，美国禽流感催化,中航证券,2023-11-13,农牧饲渔,https://pdf.dfcfw.com/pdf/H3_AP202311131609922767_1.pdf?1699891165000.pdf
农林牧渔行业周报：10月母猪产能去化加速；11月美玉米、美大豆单产上调,民生证券,2023-11-13,农牧饲渔,https://pdf.dfcfw.com/pdf/H3_AP202311131609922794_1.pdf?1699886412000.pdf
农林牧渔周报（第45期）：猪鸡产能去化动力增强，种业关注转基因品审结果落地,太平洋,2023-11-13,农牧饲渔,https://pdf.dfcfw.com/pdf/H3_AP202311131609923169_1.pdf?1699889882000.pdf
农林牧渔周报（第44期）：多因素共同催化，生猪养殖业产能有望加速去化,太平洋,2023-11-13,农牧饲渔,https://pdf.dfcfw.com/pdf/H3_AP202311131609923170_1.pdf?1699890193000.pdf
农业行业周报：看好生猪养殖股在当前的配置时机,山西证券,2023-11-13,农牧饲渔,https://pdf.dfcfw.com/pdf/H3_AP202311131609922811_1.pdf?1699889015000.pdf
农林牧渔行业报告：猪价低位震荡，10月产能继续去化,中邮证券,2023-11-13,农牧饲渔,https://pdf.dfcfw.com/pdf/H3_AP202311131609922259_1.pdf?1699881616000.pdf
农林牧渔行业周报：生猪价格弱势回落,东莞证券,2023-11-12,农牧饲渔,https://pdf.dfcfw.com/pdf/H3_AP202311121609916888_1.pdf?1699806862000.pdf
农林牧渔行业周报：10月生猪产业加速去产能，生猪价格周环比再降,华安证券,2023-11-12,农牧饲渔,https://pdf.dfcfw.com/pdf/H3_AP202311121609916311_1.pdf?1699795540000.pdf
农业行业周报：10月能繁母猪去化略加速，关注后续节奏,中国银河,2023-11-12,农牧饲渔,https://pdf.dfcfw.com/pdf/H3_AP202311121609917255_1.pdf?1699868953000.pdf
农林牧渔行业周报：美国禽流感持续发酵，生猪产能去化幅度加大,安信证券,2023-11-12,农牧饲渔,https://pdf.dfcfw.com/pdf/H3_AP202311121609917636_1.pdf?1699869789000.pdf
农产品研究跟踪系列报告（84）：生猪价格预计旺季不旺，养殖情绪维持悲观,国信证券,2023-11-12,农牧饲渔,https://pdf.dfcfw.com/pdf/H3_AP202311121609916521_1.pdf?1699804337000.pdf
农林牧渔行业2023年三季报业绩综述：Q3盈利环比有所改善,东莞证券,2023-11-09,农牧饲渔,https://pdf.dfcfw.com/pdf/H3_AP202311091609772626_1.pdf?1699522235000.pdf
农林牧渔行业专题研究：宠物产业链的投资机会在哪个环节？,华福证券,2023-11-09,农牧饲渔,https://pdf.dfcfw.com/pdf/H3_AP202311091609778236_1.pdf?1699538062000.pdf
宠物行业深度报告：探究日本宠物食品发展，看中国未来趋势,东海证券,2023-11-08,农牧饲渔,https://pdf.dfcfw.com/pdf/H3_AP202311081609339677_1.pdf?1699467506000.pdf
农林牧渔行业周报：生猪价格延续弱势，白鸡引种受限或加剧,德邦证券,2023-11-07,农牧饲渔,https://pdf.dfcfw.com/pdf/H3_AP202311071609229762_1.pdf?1699350327000.pdf
农林牧渔2023年11月投资策略：本月重点推荐养殖（华统股份、牧原股份、巨星农牧、天康生物、立华股份）,国信证券,2023-11-06,农牧饲渔,https://pdf.dfcfw.com/pdf/H3_AP202311061609025360_1.pdf?1699267290000.pdf
农林牧渔行业点评报告：2023Q3行业营收同比微降，利润转盈但同比下滑,开源证券,2023-11-06,农牧饲渔,https://pdf.dfcfw.com/pdf/H3_AP202311061609025414_1.pdf?1699260910000.pdf
农林牧渔2023年第44周周报：10月母猪淘汰量增幅明显，如何看生猪养殖板块？,天风证券,2023-11-06,农牧饲渔,https://pdf.dfcfw.com/pdf/H3_AP202311061609025449_1.pdf?1699261470000.pdf
农产品研究跟踪系列报告（83）：生猪价格预计反弹空间有限，淘汰母猪均价继续下探,国信证券,2023-11-06,农牧饲渔,https://pdf.dfcfw.com/pdf/H3_AP202311061609025361_1.pdf?1699269742000.pdf
农林牧渔行业研究：生猪养殖现金持续消耗，关注生猪板块投资机会,国金证券,2023-11-06,农牧饲渔,https://pdf.dfcfw.com/pdf/H3_AP202311061609026141_1.pdf?1699270654000.pdf
农业行业周报：产能去化有望加速，看好生猪养殖股在当前的配置时机,山西证券,2023-11-06,农牧饲渔,https://pdf.dfcfw.com/pdf/H3_AP202311061609026798_1.pdf?1699283138000.pdf
农林牧渔行业周报：养殖亏损幅度增加 产能有望持续去化,国联证券,2023-11-06,农牧饲渔,https://pdf.dfcfw.com/pdf/H3_AP202311061609026805_1.pdf?1699263285000.pdf
农业行业周报：阿拉巴马州商业养殖场首次发生禽流感，我国祖代白鸡引种或受影响,中国银河,2023-11-06,农牧饲渔,https://pdf.dfcfw.com/pdf/H3_AP202311061609028253_1.pdf?1699272221000.pdf
农业周观点：Q3养殖改善，种业延续景气,中航证券,2023-11-06,农牧饲渔,https://pdf.dfcfw.com/pdf/H3_AP202311061609025734_1.pdf?1699280750000.pdf
农林牧渔2023Q3基金持仓分析：种业优质标的持仓提升，生猪龙头增持明显,国信证券,2023-11-06,农牧饲渔,https://pdf.dfcfw.com/pdf/H3_AP202311061609028913_1.pdf?1699282090000.pdf
大宗农产品投资分析框架：白糖,国信证券,2023-11-06,农牧饲渔,https://pdf.dfcfw.com/pdf/H3_AP202311061609028914_1.pdf?1699283138000.pdf
农林牧渔行业周报：2023Q3行业营收同比微降，生猪环比减亏禽养殖盈利向上,开源证券,2023-11-06,农牧饲渔,https://pdf.dfcfw.com/pdf/H3_AP202311061609026165_1.pdf?1699261337000.pdf
生猪养殖专题报告三：生猪养殖板块三季报综述：产能去化加速，猪周期左侧投资启动,中泰证券,2023-11-06,农牧饲渔,https://pdf.dfcfw.com/pdf/H3_AP202311061609029011_1.pdf?1699279103000.pdf
农林牧渔行业报告：猪价低位反弹，白鸡海外引种再起波折,中邮证券,2023-11-06,农牧饲渔,https://pdf.dfcfw.com/pdf/H3_AP202311061609029043_1.pdf?1699276133000.pdf
农林牧渔行业周报：猪价反弹乏力；海外引种受禽流感疫情影响再迎变数,民生证券,2023-11-06,农牧饲渔,https://pdf.dfcfw.com/pdf/H3_AP202311061609029330_1.pdf?1699278527000.pdf
农林牧渔行业周报：猪价持续下行，关注美国禽流感发展,安信证券,2023-11-06,农牧饲渔,https://pdf.dfcfw.com/pdf/H3_AP202311051609023432_1.pdf?1699263837000.pdf
农林牧渔行业周报：多数生猪养殖企业Q3业绩环比改善,东莞证券,2023-11-06,农牧饲渔,https://pdf.dfcfw.com/pdf/H3_AP202311061609025301_1.pdf?1699266660000.pdf
农林牧渔行业：生猪去化加速，宠物大促开启,华福证券,2023-11-06,农牧饲渔,https://pdf.dfcfw.com/pdf/H3_AP202311061609030331_1.pdf?1699283765000.pdf
农林牧渔行业研究周报：生猪止跌淘母探底 产能去化加速可期,申港证券,2023-11-06,农牧饲渔,https://pdf.dfcfw.com/pdf/H3_AP202311061609030347_1.pdf?1699283892000.pdf
农林牧渔行业周报：阿拉巴马州爆发禽流感引种或收缩，生猪迎来板块性机会,国海证券,2023-11-06,农牧饲渔,https://pdf.dfcfw.com/pdf/H3_AP202311061609044966_1.pdf?1699303708000.pdf
