研报名称,机构名称,发布时间,行业,研报地址
农林牧渔2024年5月投资策略：看好生猪下半年景气上行，重点推荐养殖板块,国信证券,2024-05-06,农牧饲渔,https://pdf.dfcfw.com/pdf/H3_AP202405061632467865_1.pdf?1714987862000.pdf
农产品研究跟踪系列报告（107）：生猪价格震荡调整，关注后续南方降雨对非瘟防控影响,国信证券,2024-05-06,农牧饲渔,https://pdf.dfcfw.com/pdf/H3_AP202405061632467864_1.pdf?1714987657000.pdf
农林牧渔：对比中美生猪养殖业，寻找同与异,华福证券,2024-05-06,农牧饲渔,https://pdf.dfcfw.com/pdf/H3_AP202405061632470688_1.pdf?1714991993000.pdf
农林牧渔行业周报：猪价上行趋势不改，关注养殖板块投资机会,国海证券,2024-05-06,农牧饲渔,https://pdf.dfcfw.com/pdf/H3_AP202405061632498261_1.pdf?1715032652000.pdf
农林牧渔行业点评报告：2023年生猪养殖亏损承压，种子板块盈利修复,开源证券,2024-05-05,农牧饲渔,https://pdf.dfcfw.com/pdf/H3_AP202405051632449978_1.pdf?1714927039000.pdf
农林牧渔行业周报：2023年生猪养殖亏损承压，种子板块盈利修复,开源证券,2024-05-05,农牧饲渔,https://pdf.dfcfw.com/pdf/H3_AP202405051632454072_1.pdf?1714934353000.pdf
农林牧渔行业周报：生猪价格周环比上涨0.9%，节前仔猪价格继续回落,华安证券,2024-05-04,农牧饲渔,https://pdf.dfcfw.com/pdf/H3_AP202405041632435534_1.pdf?1714863775000.pdf
农林牧渔：冷链食品产业链分析之河南概况,中原证券,2024-04-30,农牧饲渔,https://pdf.dfcfw.com/pdf/H3_AP202404301632037489_1.pdf?1714488080000.pdf
关注农业新质生产力——种业阵型企业发展,大公国际,2024-04-30,农牧饲渔,https://pdf.dfcfw.com/pdf/H3_AP202404301631757729_1.docx?1714475877000.docx
4月行业动态报告：Q2猪价或趋势向好，关注养殖产业链机会,中国银河,2024-04-29,农牧饲渔,https://pdf.dfcfw.com/pdf/H3_AP202404281631554767_1.pdf?1714376554000.pdf
农林牧渔2024年第16周周报：大猪库存加速出清，重视生猪养殖大周期！,天风证券,2024-04-29,农牧饲渔,https://pdf.dfcfw.com/pdf/H3_AP202404291631567054_1.pdf?1714388423000.pdf
农林牧渔行业周报：关注南方降雨对养殖疫情的影响，静待猪周期反转,国投证券,2024-04-29,农牧饲渔,https://pdf.dfcfw.com/pdf/H3_AP202404291631675525_1.pdf?1714473072000.pdf
农业行业周报：近期猪价回调或助力生猪产能进一步去化,山西证券,2024-04-29,农牧饲渔,https://pdf.dfcfw.com/pdf/H3_AP202404291631573579_1.pdf?1714406143000.pdf
农林牧渔行业周报：生猪出栏均重春节后首降，仔猪价格周环比继续回落,华安证券,2024-04-28,农牧饲渔,https://pdf.dfcfw.com/pdf/H3_AP202404281631517850_1.pdf?1714305335000.pdf
农产品研究跟踪系列报告（106）：生猪和仔猪价格本周环比略有调整，鸡蛋价格短期受益五一备货提振,国信证券,2024-04-28,农牧饲渔,https://pdf.dfcfw.com/pdf/H3_AP202404281631520173_1.pdf?1714316706000.pdf
农林牧渔行业周报：均重下行供给压力释放，关注南方雨季非瘟影响,开源证券,2024-04-28,农牧饲渔,https://pdf.dfcfw.com/pdf/H3_AP202404281631544289_1.pdf?1714323344000.pdf
农林牧渔行业研究周报：能繁环比下降，产能去化加快,申港证券,2024-04-25,农牧饲渔,https://pdf.dfcfw.com/pdf/H3_AP202404251631271790_1.pdf?1714060558000.pdf
生猪养殖3月份数据点评：产能延续去化态势，预计生猪养殖利润逐季提升,万联证券,2024-04-25,农牧饲渔,https://pdf.dfcfw.com/pdf/H3_AP202404251631280264_1.pdf?1714065407000.pdf
宠物专题报告（一）：如何看待宠物食品行业当前新渠道与价格战情况？,山西证券,2024-04-25,农牧饲渔,https://pdf.dfcfw.com/pdf/H3_AP202404251631284006_1.pdf?1714070392000.pdf
农林牧渔：24Q1行业持仓环比微降，关注生猪养殖及水产链,国联证券,2024-04-25,农牧饲渔,https://pdf.dfcfw.com/pdf/H3_AP202404251631325295_1.pdf?1714082458000.pdf
农林牧渔行业报告：短期猪价微跌，不影响周期上行趋势,中邮证券,2024-04-23,农牧饲渔,https://pdf.dfcfw.com/pdf/H3_AP202404231631034905_1.pdf?1713866956000.pdf
农林牧渔行业研究：产能持续去化，重视猪周期投资机会,国金证券,2024-04-22,农牧饲渔,https://pdf.dfcfw.com/pdf/H3_AP202404221630945627_1.pdf?1713780282000.pdf
农林牧渔行业2024年第15周周报：布局大周期，重视生猪板块投资机会！,天风证券,2024-04-22,农牧饲渔,https://pdf.dfcfw.com/pdf/H3_AP202404221630945800_1.pdf?1713779957000.pdf
农业行业周报：本周猪价略有下行，Q1宠物食品出口快增长,中国银河,2024-04-22,农牧饲渔,https://pdf.dfcfw.com/pdf/H3_AP202404221630953334_1.pdf?1713781214000.pdf
农林周观点：地缘政治风险抬升，关注资源属性,中航证券,2024-04-22,农牧饲渔,https://pdf.dfcfw.com/pdf/H3_AP202404221630957121_1.pdf?1713785659000.pdf
农林牧渔行业周报：静待周期反转，布局养殖右侧和后周期,国投证券,2024-04-22,农牧饲渔,https://pdf.dfcfw.com/pdf/H3_AP202404221630960451_1.pdf?1713795512000.pdf
农业行业周报：建议重视融资端对生猪产能去化趋势的影响,山西证券,2024-04-22,农牧饲渔,https://pdf.dfcfw.com/pdf/H3_AP202404221630961462_1.pdf?1713802768000.pdf
农林牧渔行业周报：生猪出栏均重升至126.67公斤，Q1白羽祖代更新29万套,华安证券,2024-04-21,农牧饲渔,https://pdf.dfcfw.com/pdf/H3_AP202404211630914928_1.pdf?1713701167000.pdf
农林牧渔行业双周报：能繁母猪存栏连续5个季度下滑,东莞证券,2024-04-21,农牧饲渔,https://pdf.dfcfw.com/pdf/H3_AP202404211630931991_1.pdf?1713722788000.pdf
农产品研究跟踪系列报告（105）：统计局公布2024Q1末能繁存栏环比去化3.6%，看好生猪下半年景气上行,国信证券,2024-04-21,农牧饲渔,https://pdf.dfcfw.com/pdf/H3_AP202404211630931997_1.pdf?1713720549000.pdf
农林牧渔行业周报：能繁去化至低位，猪鸡共振向上积极布局,开源证券,2024-04-21,农牧饲渔,https://pdf.dfcfw.com/pdf/H3_AP202404211630931169_1.pdf?1713717495000.pdf
3月上市猪企经营数据跟踪：生猪出栏节奏恢复，产能去化趋势继续,山西证券,2024-04-19,农牧饲渔,https://pdf.dfcfw.com/pdf/H3_AP202404191630625412_1.pdf?1713510984000.pdf
农林牧渔行业月报：生猪产能持续去化，生物育种加速推进,中原证券,2024-04-19,农牧饲渔,https://pdf.dfcfw.com/pdf/H3_AP202404191630642706_1.pdf?1713519392000.pdf
农林牧渔行业点评报告：白鸡价格中枢抬升，猪周期反转受益共振向上,开源证券,2024-04-19,农牧饲渔,https://pdf.dfcfw.com/pdf/H3_AP202404191630646873_1.pdf?1713525543000.pdf
宠物行业研究：多重因素推动宠物市场扩容，行业前景未来可期,源达信息,2024-04-19,农牧饲渔,https://pdf.dfcfw.com/pdf/H3_AP202404191630656672_1.pdf?1713541702000.pdf
上市猪企销售月报总结：量、价、体重均增长，上行周期酝酿中,中邮证券,2024-04-18,农牧饲渔,https://pdf.dfcfw.com/pdf/H3_AP202404181630503368_1.pdf?1713439652000.pdf
农林牧渔：如何看待3月上市猪企销售数据？,国联证券,2024-04-18,农牧饲渔,https://pdf.dfcfw.com/pdf/H3_AP202404181630544971_1.pdf?1713474342000.pdf
种植业：大豆供给相对充裕，价格存进一步回落可能,华安证券,2024-04-17,农牧饲渔,https://pdf.dfcfw.com/pdf/H3_AP202404171630414078_1.pdf?1713382639000.pdf
农林牧渔行业点评报告：USDA上调2023_2024年全球小麦和水稻产量，下调玉米和大豆产量,开源证券,2024-04-16,农牧饲渔,https://pdf.dfcfw.com/pdf/H3_AP202404161630272165_1.pdf?1713263929000.pdf
农业行业周报：建议重视融资端对生猪产能去化趋势的影响,山西证券,2024-04-16,农牧饲渔,https://pdf.dfcfw.com/pdf/H3_AP202404161630281956_1.pdf?1713287193000.pdf
农林牧渔行业周报：短期内猪价或窄幅震荡，看好下半年猪价景气度,国投证券,2024-04-16,农牧饲渔,https://pdf.dfcfw.com/pdf/H3_AP202404161630292311_1.pdf?1713295927000.pdf
农林牧渔行业研究：如何看待3月能繁母猪存栏数据,国金证券,2024-04-15,农牧饲渔,https://pdf.dfcfw.com/pdf/H3_AP202404151630210891_1.pdf?1713176224000.pdf
农产品研究跟踪系列报告（104）：猪价表现延续坚挺，看好下半年板块景气提升,国信证券,2024-04-15,农牧饲渔,https://pdf.dfcfw.com/pdf/H3_AP202404151630210936_1.pdf?1713174112000.pdf
农林牧渔行业2024年第14周周报：短期震荡不改猪价反转趋势，重视生猪大周期,天风证券,2024-04-15,农牧饲渔,https://pdf.dfcfw.com/pdf/H3_AP202404151630211049_1.pdf?1713170426000.pdf
农林牧渔周报（第15期）：南方雨季来临，关注养殖业疫情和产能去化,太平洋,2024-04-15,农牧饲渔,https://pdf.dfcfw.com/pdf/H3_AP202404151630217030_1.pdf?1713192793000.pdf
农林牧渔周报（第13期）：24年猪价走势或复刻2022年，被动去产能动力仍然较强,太平洋,2024-04-15,农牧饲渔,https://pdf.dfcfw.com/pdf/H3_AP202404151630217029_1.pdf?1713192696000.pdf
农林牧渔行业周报：终端需求不佳，猪价震荡走低,德邦证券,2024-04-15,农牧饲渔,https://pdf.dfcfw.com/pdf/H3_AP202404151630218997_1.pdf?1713194792000.pdf
农业行业周报：生猪价格震荡，关注周期反转机会,海通国际,2024-04-15,农牧饲渔,https://pdf.dfcfw.com/pdf/H3_AP202404151630219728_1.pdf?1713196189000.pdf
农林牧渔行业点评报告：3月猪价淡季不淡周期趋势向上,开源证券,2024-04-15,农牧饲渔,https://pdf.dfcfw.com/pdf/H3_AP202404151630221525_1.pdf?1713199158000.pdf
农林牧渔行业周报：持续推荐生猪板块右侧机会,国海证券,2024-04-15,农牧饲渔,https://pdf.dfcfw.com/pdf/H3_AP202404151630223514_1.pdf?1713202659000.pdf
农业行业周报：本周猪价震荡，持续关注养殖产业链机会,中国银河,2024-04-14,农牧饲渔,https://pdf.dfcfw.com/pdf/H3_AP202404141630209728_1.pdf?1713168800000.pdf
农业行业周观点：3月母猪产能调整，生猪行情有支撑,中航证券,2024-04-14,农牧饲渔,https://pdf.dfcfw.com/pdf/H3_AP202404141630208014_1.pdf?1713109017000.pdf
农林牧渔行业周报：生猪出栏均重升至126公斤，4月全球玉米小麦库消比回落,华安证券,2024-04-14,农牧饲渔,https://pdf.dfcfw.com/pdf/H3_AP202404141630209134_1.pdf?1713113973000.pdf
农林牧渔行业周报：4月压栏二育出货压力有限，周期向上积极布局,开源证券,2024-04-14,农牧饲渔,https://pdf.dfcfw.com/pdf/H3_AP202404141630209190_1.pdf?1713116916000.pdf
农林牧渔行业报告：农林牧渔行业报告价格微跌，产去化预期现分歧,中邮证券,2024-04-14,农牧饲渔,https://pdf.dfcfw.com/pdf/H3_AP202404141630209796_1.pdf?1713167000000.pdf
农林牧渔行业专题研究：如何看待3月能繁母猪存栏变动情况？,国联证券,2024-04-11,农牧饲渔,https://pdf.dfcfw.com/pdf/H3_AP202404111630142995_1.pdf?1712848650000.pdf
养殖业月度简报：预期好转，猪价上行趋势确立,西南证券,2024-04-10,农牧饲渔,https://pdf.dfcfw.com/pdf/H3_AP202404101630101380_1.pdf?1712739526000.pdf
农业行业周报：体重升而猪价稳，周期上行基础愈发坚实,海通国际,2024-04-09,农牧饲渔,https://pdf.dfcfw.com/pdf/H3_AP202404091630069425_1.pdf?1712659506000.pdf
农林牧渔行业研究：静待周期反转，重视生猪投资机会,国金证券,2024-04-08,农牧饲渔,https://pdf.dfcfw.com/pdf/H3_AP202404081630040489_1.pdf?1712566792000.pdf
农产品研究跟踪系列报告（103）：生猪和仔猪价格趋势坚挺，豆类与玉米供需宽松,国信证券,2024-04-08,农牧饲渔,https://pdf.dfcfw.com/pdf/H3_AP202404081630040514_1.pdf?1712566975000.pdf
农林牧渔行业研究报告：猪价淡季支撑强，布局周期反转,南京证券,2024-04-08,农牧饲渔,https://pdf.dfcfw.com/pdf/H3_AP202404081630040564_1.pdf?1712566686000.pdf
农林牧渔2024年第13周周报：4月怎么看：春暖“农”情，静待花开,天风证券,2024-04-08,农牧饲渔,https://pdf.dfcfw.com/pdf/H3_AP202404081630040580_1.pdf?1712566180000.pdf
农林牧渔行业报告：猪价温和上行周期启动,中邮证券,2024-04-08,农牧饲渔,https://pdf.dfcfw.com/pdf/H3_AP202404081630044323_1.pdf?1712586933000.pdf
农林牧渔行业周报：缩量出栏+二育进场，清明猪价窄幅上涨,德邦证券,2024-04-08,农牧饲渔,https://pdf.dfcfw.com/pdf/H3_AP202404081630044373_1.pdf?1712587277000.pdf
农业行业周报：建议重视融资端对生猪产能去化趋势的影响,山西证券,2024-04-08,农牧饲渔,https://pdf.dfcfw.com/pdf/H3_AP202404081630047254_1.pdf?1712593518000.pdf
农林牧渔行业周报（第14期）：猪价淡季不淡，养殖板块估值相对低位，继续推荐,太平洋,2024-04-08,农牧饲渔,https://pdf.dfcfw.com/pdf/H3_AP202404081630051824_1.pdf?1712598367000.pdf
农林牧渔2024年4月投资策略：猪周期反转正当时，重视养殖链布局,国信证券,2024-04-07,农牧饲渔,https://pdf.dfcfw.com/pdf/H3_AP202404071630033163_1.pdf?1712484971000.pdf
农林牧渔行业双周报：生猪价格温和反弹，关注盈利改善,东莞证券,2024-04-07,农牧饲渔,https://pdf.dfcfw.com/pdf/H3_AP202404071630036791_1.pdf?1712512123000.pdf
农林牧渔行业周报：市场逻辑向猪周期反转演绎，出栏均重升至125.36公斤,华安证券,2024-04-07,农牧饲渔,https://pdf.dfcfw.com/pdf/H3_AP202404071630037633_1.pdf?1712517071000.pdf
农林牧渔行业周报：关注生猪周期反转，动保饲料板块仍在估值低位,国投证券,2024-04-07,农牧饲渔,https://pdf.dfcfw.com/pdf/H3_AP202404071630038638_1.pdf?1712563400000.pdf
农林牧渔行业周报：4月猪价面临压栏二育出货压力但下行空间有限,开源证券,2024-04-06,农牧饲渔,https://pdf.dfcfw.com/pdf/H3_AP202404061630032208_1.pdf?1712441846000.pdf
农林牧渔行业2024年第12周周报：静待大周期反转，重视生猪板块投资机会！,天风证券,2024-04-05,农牧饲渔,https://pdf.dfcfw.com/pdf/H3_AP202404051629949160_1.pdf?1712310956000.pdf
农林牧渔行业周报：猪价震荡上涨，均重延续上行,德邦证券,2024-04-02,农牧饲渔,https://pdf.dfcfw.com/pdf/H3_AP202404021629500085_1.pdf?1712086204000.pdf
农产品研究跟踪系列报告（102）：生猪和仔猪价格环比上行，看好下半年板块景气提升,国信证券,2024-04-01,农牧饲渔,https://pdf.dfcfw.com/pdf/H3_AP202404011629191784_1.pdf?1711965052000.pdf
农林牧渔行业简评：猪价淡季不淡，周期反转渐近,东海证券,2024-04-01,农牧饲渔,https://pdf.dfcfw.com/pdf/H3_AP202404011629193922_1.pdf?1711967799000.pdf
农林牧渔行业周报：生猪价格小幅反弹，关注板块投资机会,国金证券,2024-04-01,农牧饲渔,https://pdf.dfcfw.com/pdf/H3_AP202404011629195344_1.pdf?1711970369000.pdf
农林牧渔行业周报：关注生猪养殖右侧和后周期布局，鸡肉领先大市-A产品消费偏弱,国投证券,2024-04-01,农牧饲渔,https://pdf.dfcfw.com/pdf/H3_AP202404011629190254_1.pdf?1711930124000.pdf
农业行业周报：建议重视融资端对生猪产能去化趋势的影响,山西证券,2024-04-01,农牧饲渔,https://pdf.dfcfw.com/pdf/H3_AP202404011629201042_1.pdf?1711991115000.pdf
农业行业周报：猪价震荡上行，宠物食品出口向好,中国银河,2024-03-31,农牧饲渔,https://pdf.dfcfw.com/pdf/H3_AP202403311629189393_1.pdf?1711956719000.pdf
农业周观点：猪价延续景气，补栏情绪抬升,中航证券,2024-03-31,农牧饲渔,https://pdf.dfcfw.com/pdf/H3_AP202403311629189486_1.pdf?1711963493000.pdf
农林牧渔行业周报：2月能繁存栏环比降0.6%，出栏均重升至124.67公斤,华安证券,2024-03-31,农牧饲渔,https://pdf.dfcfw.com/pdf/H3_AP202403311629187175_1.pdf?1711892964000.pdf
农林牧渔行业周报：关注南方多雨非瘟影响，宠物食品出口景气抬升,开源证券,2024-03-31,农牧饲渔,https://pdf.dfcfw.com/pdf/H3_AP202403311629189224_1.pdf?1711956414000.pdf
农林牧渔&食品饮料：食品掘金品类红利，生猪产能去化持续,首创证券,2024-03-29,农牧饲渔,https://pdf.dfcfw.com/pdf/H3_AP202403291629021168_1.pdf?1711703826000.pdf
宠物食品行业深度报告：市场扩容，国产崛起,东莞证券,2024-03-29,农牧饲渔,https://pdf.dfcfw.com/pdf/H3_AP202403291629029894_1.pdf?1711709982000.pdf
上市猪企销售月报总结：量减价涨，周期反转可期,中邮证券,2024-03-26,农牧饲渔,https://pdf.dfcfw.com/pdf/H3_AP202403261628172054_1.pdf?1711443623000.pdf
农林牧渔行业报告：猪价上涨与产能去化共存,中邮证券,2024-03-26,农牧饲渔,https://pdf.dfcfw.com/pdf/H3_AP202403261628173592_1.pdf?1711446417000.pdf
农林牧渔2024年第11周周报：生猪库存压力有所累积，长期趋势已成，静待猪周期反转！,天风证券,2024-03-25,农牧饲渔,https://pdf.dfcfw.com/pdf/H3_AP202403251628066532_1.pdf?1711363466000.pdf
农林牧渔行业周报：二育进场增量，猪价延续上涨,德邦证券,2024-03-25,农牧饲渔,https://pdf.dfcfw.com/pdf/H3_AP202403251628066938_1.pdf?1711354677000.pdf
农林牧渔行业周报：仔猪价格易涨难跌，毛鸡价格持稳运行,国投证券,2024-03-25,农牧饲渔,https://pdf.dfcfw.com/pdf/H3_AP202403251628066609_1.pdf?1711354954000.pdf
农林牧渔行业研究：生猪市场供需博弈，产能有望持续去化,国金证券,2024-03-25,农牧饲渔,https://pdf.dfcfw.com/pdf/H3_AP202403251628068543_1.pdf?1711364453000.pdf
生猪养殖行业点评：政策端加强生猪屠宰环节的非瘟常态化防控，将有利于产业长期健康发展,国信证券,2024-03-25,农牧饲渔,https://pdf.dfcfw.com/pdf/H3_AP202403251628069350_1.pdf?1711365326000.pdf
农业周观点：猪价淡季上扬，行情趋势向好，增配板块,中航证券,2024-03-25,农牧饲渔,https://pdf.dfcfw.com/pdf/H3_AP202403241628065923_1.pdf?1711363966000.pdf
农林牧渔行业双周报：2月能繁母猪持续去化,东莞证券,2024-03-25,农牧饲渔,https://pdf.dfcfw.com/pdf/H3_AP202403251628066291_1.pdf?1711365136000.pdf
农林牧渔行业周报：猪价中枢上移，看好生猪养殖板块,国海证券,2024-03-25,农牧饲渔,https://pdf.dfcfw.com/pdf/H3_AP202403251628078437_1.pdf?1711399862000.pdf
农业行业周报：建议重视融资端对生猪产能去化趋势的影响,山西证券,2024-03-25,农牧饲渔,https://pdf.dfcfw.com/pdf/H3_AP202403251628083328_1.pdf?1711399978000.pdf
农林牧渔3月行业动态报告：生猪养殖盈亏分化，关注产能去化走势,中国银河,2024-03-25,农牧饲渔,https://pdf.dfcfw.com/pdf/H3_AP202403251628080411_1.pdf?1711390629000.pdf
农林牧渔行业：情绪推升猪价上行，产能有望波动去化,东兴证券,2024-03-25,农牧饲渔,https://pdf.dfcfw.com/pdf/H3_AP202403251628084909_1.pdf?1711393677000.pdf
农林牧渔行业周报：本周仔猪生猪价格再涨，出栏均重升逾124公斤,华安证券,2024-03-24,农牧饲渔,https://pdf.dfcfw.com/pdf/H3_AP202403241628064100_1.pdf?1711285890000.pdf
农产品研究跟踪系列报告（101）：猪价表现淡季不淡，看好生猪板块景气上行,国信证券,2024-03-24,农牧饲渔,https://pdf.dfcfw.com/pdf/H3_AP202403241628064332_1.pdf?1711294333000.pdf
农林牧渔行业周报：猪周期反转蓄势，各农业子板块有望共振受益,开源证券,2024-03-24,农牧饲渔,https://pdf.dfcfw.com/pdf/H3_AP202403241628064377_1.pdf?1711293526000.pdf
农林牧渔：如何看又一家猪企拟重整？,天风证券,2024-03-20,农牧饲渔,https://pdf.dfcfw.com/pdf/H3_AP202403201627331925_1.pdf?1710968036000.pdf
农林牧渔行业报告：生猪价格反季节上涨,中邮证券,2024-03-19,农牧饲渔,https://pdf.dfcfw.com/pdf/H3_AP202403191627110310_1.pdf?1710838647000.pdf
农业行业周报：能繁去化趋势不改，关注水产饲料行业景气修复,海通国际,2024-03-19,农牧饲渔,https://pdf.dfcfw.com/pdf/H3_AP202403191627141942_1.pdf?1710873052000.pdf
农业行业周报：本周猪价回升，亏损幅度收窄,中国银河,2024-03-18,农牧饲渔,https://pdf.dfcfw.com/pdf/H3_AP202403181626957724_1.pdf?1710750154000.pdf
农林牧渔行业周报：补栏需求支撑仔猪价格，毛鸡价格短期回暖,国投证券,2024-03-18,农牧饲渔,https://pdf.dfcfw.com/pdf/H3_AP202403181626958289_1.pdf?1710753680000.pdf
农林牧渔行业周报：二育压栏支撑猪价、生猪均重延续上涨,德邦证券,2024-03-18,农牧饲渔,https://pdf.dfcfw.com/pdf/H3_AP202403181626959135_1.pdf?1710751893000.pdf
农林牧渔行业周报：生猪价格震荡，关注生猪投资机会,国金证券,2024-03-18,农牧饲渔,https://pdf.dfcfw.com/pdf/H3_AP202403181626963750_1.pdf?1710760679000.pdf
农业周观点：消费预期改善，关注板块相关细分,中航证券,2024-03-18,农牧饲渔,https://pdf.dfcfw.com/pdf/H3_AP202403171626954741_1.pdf?1710753475000.pdf
农业行业周报：根据“亏损期+低PB”策略，圣农发展已经进入配置窗口期,山西证券,2024-03-18,农牧饲渔,https://pdf.dfcfw.com/pdf/H3_AP202403181626973312_1.pdf?1710795797000.pdf
农林牧渔行业周报（第11期）：猪价上涨难以持续，行业超长亏损，继续推荐养猪板块,太平洋,2024-03-18,农牧饲渔,https://pdf.dfcfw.com/pdf/H3_AP202403181626970994_1.pdf?1710781755000.pdf
农林牧渔2024年第10周周报：短期分歧不改长期趋势，静待周期反转！,天风证券,2024-03-18,农牧饲渔,https://pdf.dfcfw.com/pdf/H3_AP202403181626958110_1.pdf?1710756435000.pdf
农产品研究跟踪系列报告（100）：生猪价格环比略涨，行业现金流持续承压,国信证券,2024-03-17,农牧饲渔,https://pdf.dfcfw.com/pdf/H3_AP202403171626953394_1.pdf?1710682435000.pdf
农林牧渔行业月报：生猪产能调控政策优化，推动产能持续去化,中原证券,2024-03-17,农牧饲渔,https://pdf.dfcfw.com/pdf/H3_AP202403171626954052_1.pdf?1710691646000.pdf
农林牧渔行业周报：本周仔猪生猪价格上涨，出栏均重升至123.5公斤,华安证券,2024-03-17,农牧饲渔,https://pdf.dfcfw.com/pdf/H3_AP202403171626954150_1.pdf?1710694320000.pdf
农林牧渔行业周报：猪价淡季上涨缺乏持续性，弱现实强预期下Q2或以被动去化为主,开源证券,2024-03-17,农牧饲渔,https://pdf.dfcfw.com/pdf/H3_AP202403171626954581_1.pdf?1710699555000.pdf
农林牧渔行业周报：补栏需求支撑仔猪价格，毛鸡价格短期领先大市-A回暖,国投证券,2024-03-17,农牧饲渔,https://pdf.dfcfw.com/pdf/H3_AP202403171626954641_1.pdf?1710701308000.pdf
农林牧渔行业点评报告：白鸡价格趋势向上，供给偏紧或贯穿2024全年,开源证券,2024-03-14,农牧饲渔,https://pdf.dfcfw.com/pdf/H3_AP202403141626756527_1.pdf?1710443772000.pdf
农林牧渔&食品饮料：无糖茶饮空间广阔，猪价近期延续上行,首创证券,2024-03-13,农牧饲渔,https://pdf.dfcfw.com/pdf/H3_AP202403131626550493_1.pdf?1710321398000.pdf
农林牧渔周报（第10期）：仔猪价格持续回落，继续推荐养猪板块,太平洋,2024-03-13,农牧饲渔,https://pdf.dfcfw.com/pdf/H3_AP202403131626608852_1.pdf?1710335848000.pdf
农林牧渔行业周观点（2024年第10周）：二育入场猪价回升，不改产能去化趋势,东兴证券,2024-03-13,农牧饲渔,https://pdf.dfcfw.com/pdf/H3_AP202403131626652781_1.pdf?1710355567000.pdf
农林牧渔行业报告：短期价格回升，不影响产能去化之势,中邮证券,2024-03-12,农牧饲渔,https://pdf.dfcfw.com/pdf/H3_AP202403121626421077_1.pdf?1710235519000.pdf
农林牧渔行业点评报告：USDA上调2023_2024年全球小麦和水稻产量，下调玉米和大豆产量,开源证券,2024-03-12,农牧饲渔,https://pdf.dfcfw.com/pdf/H3_AP202403121626492550_1.pdf?1710316671000.pdf
农林牧渔行业点评报告：标肥价差走扩或缺乏持续性，猪价下行及标肥价差收窄或自3月下旬开启,开源证券,2024-03-12,农牧饲渔,https://pdf.dfcfw.com/pdf/H3_AP202403121626490723_1.pdf?1710278845000.pdf
农林牧渔行业2024年第9周周报：仔猪价格回落，行业主动产能去化有望加快，生猪板块价值凸显,天风证券,2024-03-11,农牧饲渔,https://pdf.dfcfw.com/pdf/H3_AP202403111626208699_1.pdf?1710150531000.pdf
农产品研究跟踪系列报告（99）：生猪挺价情绪缓和，仔猪价格企稳回落,国信证券,2024-03-11,农牧饲渔,https://pdf.dfcfw.com/pdf/H3_AP202403111626208995_1.pdf?1710148714000.pdf
农林牧渔行业2024年二季度投资策略报告：产能去化持续，左侧布局正当时,中邮证券,2024-03-11,农牧饲渔,https://pdf.dfcfw.com/pdf/H3_AP202403111626209551_1.pdf?1710147153000.pdf
农林牧渔行业研究：产能去化趋势延续，关注生猪投资机会,国金证券,2024-03-11,农牧饲渔,https://pdf.dfcfw.com/pdf/H3_AP202403111626210103_1.pdf?1710151508000.pdf
农林牧渔行业双周报：能繁母猪正常保有量目标下调,东莞证券,2024-03-11,农牧饲渔,https://pdf.dfcfw.com/pdf/H3_AP202403111626208962_1.pdf?1710150798000.pdf
农林牧渔行业周报：2月猪价震荡走弱，产能延续去化,德邦证券,2024-03-11,农牧饲渔,https://pdf.dfcfw.com/pdf/H3_AP202403111626215427_1.pdf?1710164927000.pdf
农林牧渔行业周报：仔猪价格持续回调，毛鸡价格企稳但仍亏损,国投证券,2024-03-11,农牧饲渔,https://pdf.dfcfw.com/pdf/H3_AP202403111626215429_1.pdf?1710165749000.pdf
农业行业周报：根据“亏损期+低PB”策略，圣农发展已经进入配置窗口期,山西证券,2024-03-11,农牧饲渔,https://pdf.dfcfw.com/pdf/H3_AP202403111626220526_1.pdf?1710178356000.pdf
