研报名称,机构名称,发布时间,行业,研报地址
基础化工行业周专题：CPI受益于折叠屏放量，国产替代方兴未艾,国联证券,2024-06-17,化学制品,https://pdf.dfcfw.com/pdf/H3_AP202406171636505291_1.pdf?1718652018000.pdf
基础化工行业周报：英力士计划关闭43万公吨_年苯乙烯生产基地，原油价格上涨,华安证券,2024-06-17,化学制品,https://pdf.dfcfw.com/pdf/H3_AP202406171636481087_1.pdf?1718632574000.pdf
基础化工行业周报：磷铵价格持续上行，猪肉价格上涨有望带动维生素需求,太平洋,2024-06-17,化学制品,https://pdf.dfcfw.com/pdf/H3_AP202406171636480306_1.pdf?1718629737000.pdf
化工新材料行业周报：国家大基金三期成立，电子化学品国产替代有望加速,太平洋,2024-06-17,化学制品,https://pdf.dfcfw.com/pdf/H3_AP202406171636487685_1.pdf?1718645465000.pdf
基础化工行业周报：涤纶长丝价格延续上涨，大厂迎来产销放量期,开源证券,2024-06-16,化学制品,https://pdf.dfcfw.com/pdf/H3_AP202406161636456077_1.pdf?1718540492000.pdf
基础化工行业周报：英力士苯领宣布将永久关闭萨尼亚苯乙烯工厂，欧盟公布对华钛白粉临时反倾销税率,华福证券,2024-06-16,化学制品,https://pdf.dfcfw.com/pdf/H3_AP202406161636457125_1.pdf?1718553123000.pdf
氟化工行业周报：萤石市场表现坚挺，制冷剂市场静待破冰点出现,开源证券,2024-06-16,化学制品,https://pdf.dfcfw.com/pdf/H3_AP202406161636457630_1.pdf?1718557755000.pdf
化工行业周报：国际油价上涨，涤纶长丝价格上涨,中银证券,2024-06-16,化学制品,https://pdf.dfcfw.com/pdf/H3_AP202406161636459657_1.pdf?1718576726000.pdf
基础化工行业月报：行业景气边际回暖，围绕两条主线布局,中原证券,2024-06-13,化学制品,https://pdf.dfcfw.com/pdf/H3_AP202406131636078595_1.pdf?1718270051000.pdf
基础化工行业周报：多部门联合印发合成氨行业节能降碳细则，合成橡胶、尿素价格上行,上海证券,2024-06-13,化学制品,https://pdf.dfcfw.com/pdf/H3_AP202406131636080987_1.pdf?1718277843000.pdf
基础化工行业周报：合成生物学周报：凯赛生物与韩国3P公司签订合资协议，大肠杆菌高产聚酯单体改造取得进展,华安证券,2024-06-12,化学制品,https://pdf.dfcfw.com/pdf/H3_AP202406121635988880_1.pdf?1718181782000.pdf
基础化工行业周报：华神新材料己二胺项目正式开车，美瑞聚氨酯新材料产业园一期即将投产,华福证券,2024-06-11,化学制品,https://pdf.dfcfw.com/pdf/H3_AP202406111635940848_1.pdf?1718102604000.pdf
新材料周报：聚酰亚胺纤维及碳纤维项目签约，万华化学一新材料项目投产,华福证券,2024-06-11,化学制品,https://pdf.dfcfw.com/pdf/H3_AP202406111635940849_1.pdf?1718102287000.pdf
基础化工行业研究：海运扰动出口链，继续看好绩优股,国金证券,2024-06-11,化学制品,https://pdf.dfcfw.com/pdf/H3_AP202406111635957762_1.pdf?1718103011000.pdf
基础化工行业研究周报：发改委等部门印发《合成氨行业节能降碳专项行动计划》，丁苯橡胶、正丁醇价格上涨,天风证券,2024-06-11,化学制品,https://pdf.dfcfw.com/pdf/H3_AP202406111635958095_1.pdf?1718100562000.pdf
化工行业周报：中海油勘探再突破；华神新材料己二胺项目投产,中泰证券,2024-06-11,化学制品,https://pdf.dfcfw.com/pdf/H3_AP202406111635958328_1.pdf?1718103191000.pdf
基础化工行业周报：节能降碳路径进一步细化，5月我国出口景气延续,开源证券,2024-06-11,化学制品,https://pdf.dfcfw.com/pdf/H3_AP202406111635964011_1.pdf?1718117148000.pdf
基础化工行业周报：R22、磷酸一铵等涨幅居前，继续建议继续关注涤纶长丝、制冷剂和农化板块,华鑫证券,2024-06-11,化学制品,https://pdf.dfcfw.com/pdf/H3_AP202406111635980244_1.pdf?1718147955000.pdf
基础化工行业周报：R22、尿素价格上涨，持续关注地产链化工品投资机会,国海证券,2024-06-11,化学制品,https://pdf.dfcfw.com/pdf/H3_AP202406111635962193_1.pdf?1718128276000.pdf
化工行业周报：国际油价下跌，聚合MDI价格上涨,中银证券,2024-06-10,化学制品,https://pdf.dfcfw.com/pdf/H3_AP202406101635915111_1.pdf?1718030219000.pdf
基础化工行业双周报：加拿大、欧洲相继降息，美国非农就业高于预期,东莞证券,2024-06-10,化学制品,https://pdf.dfcfw.com/pdf/H3_AP202406101635917141_1.pdf?1718035430000.pdf
基础化工行业周报：国家将鼓励西部发展多项特色化工业，制冷剂R22、MDI价格上涨,华安证券,2024-06-10,化学制品,https://pdf.dfcfw.com/pdf/H3_AP202406101635918120_1.pdf?1718040576000.pdf
新材料行业双周报：瑞联新材拟增资参股出光电子向OLED终端材料延伸，继续看好OLED材料行业,开源证券,2024-06-10,化学制品,https://pdf.dfcfw.com/pdf/H3_AP202406101635920598_1.pdf?1718052690000.pdf
基础化工行业周报：OPEC+减产协议再延期，顺酐、锦纶价格上行,上海证券,2024-06-06,化学制品,https://pdf.dfcfw.com/pdf/H3_AP202406061635678453_1.pdf?1717673143000.pdf
工业气体月度跟踪：5月气体均价环比小幅波动；杭氧设备出海加速,海通国际,2024-06-06,化学制品,https://pdf.dfcfw.com/pdf/H3_AP202406061635723401_1.pdf?1717705912000.pdf
基础化工行业周报：涤纶长丝、磷酸一铵等涨幅居前，建议继续关注涤纶长丝、制冷剂和农化板块,华鑫证券,2024-06-05,化学制品,https://pdf.dfcfw.com/pdf/H3_AP202406051635551107_1.pdf?1717577343000.pdf
基础化工行业研究周报：国务院印发《2024-2025年节能降碳行动方案》，顺酐、新戊二醇价格上涨,天风证券,2024-06-04,化学制品,https://pdf.dfcfw.com/pdf/H3_AP202406041635326389_1.pdf?1717493009000.pdf
基础化工行业周报：节能降碳行动方案颁布，房地产政策频发,国金证券,2024-06-04,化学制品,https://pdf.dfcfw.com/pdf/H3_AP202406041635326362_1.pdf?1717493009000.pdf
基础化工行业周报：节能降碳方案发布，建议关注磷化工、纯碱、氯碱等,太平洋,2024-06-04,化学制品,https://pdf.dfcfw.com/pdf/H3_AP202406041635345852_1.pdf?1717516227000.pdf
基础化工行业：《2024-2025年节能降碳行动方案》出台，强化化工行业供给约束,华福证券,2024-06-03,化学制品,https://pdf.dfcfw.com/pdf/H3_AP202406031635234932_1.pdf?1717400287000.pdf
基础化工行业新材料周报：国家大基金三期成立，预估Q2MLCC出货量季增6.8%,华福证券,2024-06-03,化学制品,https://pdf.dfcfw.com/pdf/H3_AP202406031635234933_1.pdf?1717406888000.pdf
基础化工行业周报：其亚600万吨煤基甲醇项目获批，康菲石油宣布收购马拉松石油公司,华福证券,2024-06-03,化学制品,https://pdf.dfcfw.com/pdf/H3_AP202406031635234934_1.pdf?1717406985000.pdf
基础化工行业专题研究：24Q1持仓配置环比小幅回落，细分龙头受到持续青睐,天风证券,2024-06-03,化学制品,https://pdf.dfcfw.com/pdf/H3_AP202406031635235286_1.pdf?1717414193000.pdf
基础化工行业周报：维生素D3价格上涨，关注相关投资机会,中邮证券,2024-06-03,化学制品,https://pdf.dfcfw.com/pdf/H3_AP202406031635237542_1.pdf?1717412872000.pdf
基础化工行业事件点评：节能降碳行动方案发布，化工领域减碳进程加快,民生证券,2024-06-03,化学制品,https://pdf.dfcfw.com/pdf/H3_AP202406031635238594_1.pdf?1717404893000.pdf
基础化工行业专题研究：节能降碳行动方案，尽最大努力实现“升级”,天风证券,2024-06-03,化学制品,https://pdf.dfcfw.com/pdf/H3_AP202406031635235287_1.pdf?1717402582000.pdf
基础化工行业周报：涤纶长丝价格上涨，持续关注地产链化工品投资机会,国海证券,2024-06-03,化学制品,https://pdf.dfcfw.com/pdf/H3_AP202406021635208620_1.pdf?1717400536000.pdf
地产链化工品追踪系列报告（2024-05）：地产政策持续优化，纯碱、PVC等价格环比回升,信达证券,2024-06-03,化学制品,https://pdf.dfcfw.com/pdf/H3_AP202406031635280301_1.pdf?1717444349000.pdf
基础化工：节能降碳行动方案出炉，高耗能准入门槛进一步提高,华安证券,2024-06-03,化学制品,https://pdf.dfcfw.com/pdf/H3_AP202406031635250470_1.pdf?1717420664000.pdf
基础化工行业周报：合成生物学周报：华恒生物与巴斯夫达成新一轮战略合作，DPP-1抑制剂临床试验成功,华安证券,2024-06-03,化学制品,https://pdf.dfcfw.com/pdf/H3_AP202406031635252165_1.pdf?1717422397000.pdf
基础化工5月周报：《2024-2025年节能降碳行动方案》蕴含哪些化工投资机遇？,国联证券,2024-06-02,化学制品,https://pdf.dfcfw.com/pdf/H3_AP202406021635196784_1.pdf?1717346130000.pdf
基础化工行业周报：《2024-2025年节能降碳行动方案》或加速深化供给侧改革，纯碱、一铵、钾肥、VD3价格延续上行,开源证券,2024-06-02,化学制品,https://pdf.dfcfw.com/pdf/H3_AP202406021635201214_1.pdf?1717347440000.pdf
化工行业周报：国际油价小幅下跌，工铵、涤纶长丝价格上涨,中银证券,2024-06-02,化学制品,https://pdf.dfcfw.com/pdf/H3_AP202406021635206603_1.pdf?1717355372000.pdf
基础化工行业周报：国务院印发节能降碳行动方案，顺酐、纯碱价格上涨,华安证券,2024-06-02,化学制品,https://pdf.dfcfw.com/pdf/H3_AP202406021635208588_1.pdf?1717358083000.pdf
化工新材料产业周报：国家集成电路产业投资基金三期成立，欧盟推迟公布是否对中国电动车征税,国海证券,2024-06-02,化学制品,https://pdf.dfcfw.com/pdf/H3_AP202406021635202858_1.pdf?1717349196000.pdf
基础化工：纯碱：供需两端均面临结构性变化,天风证券,2024-05-31,化学制品,https://pdf.dfcfw.com/pdf/H3_AP202405311635020719_1.pdf?1717146655000.pdf
基础化工行业深度分析：行业景气低位运行，一季度经营形势有所改善,中原证券,2024-05-31,化学制品,https://pdf.dfcfw.com/pdf/H3_AP202405311635040127_1.pdf?1717150977000.pdf
基础化工行业简评：节能降碳行动方案有望缓解产能过剩压力，提升行业景气度,东海证券,2024-05-31,化学制品,https://pdf.dfcfw.com/pdf/H3_AP202405311635044879_1.pdf?1717160514000.pdf
基础化工行业专题研究：制冷剂：配额落地，景气高启,天风证券,2024-05-31,化学制品,https://pdf.dfcfw.com/pdf/H3_AP202405311635050298_1.pdf?1717167113000.pdf
全球粉末涂料行业市场持续增长，粉末涂料用聚酯树脂行业迎契机（三）,深圳汉鼎智库咨询服务,2024-05-31,化学制品,https://pdf.dfcfw.com/pdf/H3_AP202405311635071687_1.pdf?1717180542000.pdf
基础化工行业事件点评：《2024-2025年节能降碳行动方案》发布，严控高耗能领域新增产能,东莞证券,2024-05-30,化学制品,https://pdf.dfcfw.com/pdf/H3_AP202405301634933481_1.pdf?1717076633000.pdf
基础化工行业研究：节能降碳行动方案出台，进程加速，要求升级,国金证券,2024-05-30,化学制品,https://pdf.dfcfw.com/pdf/H3_AP202405301634933978_1.pdf?1717078908000.pdf
基础化工行业周报：MDI海外供应缩减，制冷剂价格持续上行,上海证券,2024-05-29,化学制品,https://pdf.dfcfw.com/pdf/H3_AP202405291634791703_1.pdf?1716982077000.pdf
基础化工行业2023年报及2024年一季报综述：整体经营向好，盈利能力改善,华龙证券,2024-05-28,化学制品,https://pdf.dfcfw.com/pdf/H3_AP202405281634735989_1.pdf?1716886798000.pdf
化工行业周报：原油价格区间整理，制冷剂延续偏强走势,华龙证券,2024-05-28,化学制品,https://pdf.dfcfw.com/pdf/H3_AP202405281634735987_1.pdf?1716895541000.pdf
基础化工行业报告：4月份化学原料和制品制造业增加值同比增长12.3%，R22、PVC价格上涨,天风证券,2024-05-28,化学制品,https://pdf.dfcfw.com/pdf/H3_AP202405281634736018_1.pdf?1716885328000.pdf
基础化工行业双周报：央行三箭齐发，地产政策发力,东莞证券,2024-05-27,化学制品,https://pdf.dfcfw.com/pdf/H3_AP202405271634702492_1.pdf?1716795180000.pdf
基础化工行业动态跟踪：海外装置不可抗力，聚合MDI有望景气向上,华福证券,2024-05-27,化学制品,https://pdf.dfcfw.com/pdf/H3_AP202405271634705239_1.pdf?1716803414000.pdf
基础化工行业周报：华鲁恒升拟建酰胺原料优化升级等项目，杜邦将拆分为三家独立上市公司,华福证券,2024-05-27,化学制品,https://pdf.dfcfw.com/pdf/H3_AP202405271634705622_1.pdf?1716809539000.pdf
基础化工行业周报：合成生物学周报：凯赛生物与招商科创合作项目落地，纳米颗粒疫苗理性设计时代到来,华安证券,2024-05-27,化学制品,https://pdf.dfcfw.com/pdf/H3_AP202405271634725479_1.pdf?1716843312000.pdf
基础化工行业周报：制冷剂涤纶长丝等涨幅居前，建议继续关注涤纶长丝、制冷剂和农化板块,华鑫证券,2024-05-27,化学制品,https://pdf.dfcfw.com/pdf/H3_AP202405271634727349_1.pdf?1716850127000.pdf
化工新材料行业周报：光伏材料关注度提升，生物柴油及SAF未来需求值得期待,太平洋,2024-05-27,化学制品,https://pdf.dfcfw.com/pdf/H3_AP202405271634710198_1.pdf?1716814492000.pdf
基础化工行业周报：制冷剂R22与R32价格延续强势，MDI价格上涨,太平洋,2024-05-27,化学制品,https://pdf.dfcfw.com/pdf/H3_AP202405271634710200_1.pdf?1716814492000.pdf
化工周期新起点系列1：单位GDP能耗下降2.5%目标及设备更新换代将深化化工结构性供给侧改革,开源证券,2024-05-26,化学制品,https://pdf.dfcfw.com/pdf/H3_AP202405261634684412_1.pdf?1716717882000.pdf
化工行业周报：国际油价下跌，工业级磷铵价格上涨,中银证券,2024-05-26,化学制品,https://pdf.dfcfw.com/pdf/H3_AP202405261634690128_1.pdf?1716740352000.pdf
化工行业周报：涤纶长丝价差企稳反弹，行业盈利预期向好,开源证券,2024-05-26,化学制品,https://pdf.dfcfw.com/pdf/H3_AP202405261634690368_1.pdf?1716740462000.pdf
基础化工行业周报：R22价格上涨，关注制冷剂投资机会,中邮证券,2024-05-26,化学制品,https://pdf.dfcfw.com/pdf/H3_AP202405261634691970_1.pdf?1716747433000.pdf
新材料行业双周报：染发剂市场稳步拓展，染发剂原料有望充分受益,开源证券,2024-05-26,化学制品,https://pdf.dfcfw.com/pdf/H3_AP202405261634692002_1.pdf?1716748359000.pdf
基础化工行业周报：陶氏44万吨_年的MDI装置遭遇不可抗力，制冷剂R22、R32价格持续上涨,华安证券,2024-05-26,化学制品,https://pdf.dfcfw.com/pdf/H3_AP202405261634693991_1.pdf?1716758679000.pdf
基础化工行业周报：PVC、POM、重质纯碱价格上涨，持续关注地产链化工品投资机会,国海证券,2024-05-26,化学制品,https://pdf.dfcfw.com/pdf/H3_AP202405261634695832_1.pdf?1716803137000.pdf
基础化工行业化工可转债、定增双周报：惠城转债创历史新高,太平洋,2024-05-24,化学制品,https://pdf.dfcfw.com/pdf/H3_AP202405241634541098_1.pdf?1716558573000.pdf
基础化工行业事件点评：供给收缩需求向好，聚合MDI景气提升,东莞证券,2024-05-23,化学制品,https://pdf.dfcfw.com/pdf/H3_AP202405231634381784_1.pdf?1716470280000.pdf
磷化工行业点评：水溶肥及磷酸铁需求提升，工业一铵景气上行,国信证券,2024-05-23,化学制品,https://pdf.dfcfw.com/pdf/H3_AP202405231634381792_1.pdf?1716470134000.pdf
基础化工行业点评：供给收缩预期升温，涤纶长丝供需格局有望改善,东莞证券,2024-05-23,化学制品,https://pdf.dfcfw.com/pdf/H3_AP202405231634388621_1.pdf?1716481965000.pdf
基础化工行业周报：地产政策利好频发，关注顺周期涨价品种,上海证券,2024-05-22,化学制品,https://pdf.dfcfw.com/pdf/H3_AP202405221634316876_1.pdf?1716387758000.pdf
基础化工行业事件点评：供需偏紧景气度维持，R32价格持续上涨,东莞证券,2024-05-22,化学制品,https://pdf.dfcfw.com/pdf/H3_AP202405221634336332_1.pdf?1716410950000.pdf
新材料产业周报：美国加征自华进口电动汽车及半导体关税，2024年新能源汽车下乡活动开展,国海证券,2024-05-21,化学制品,https://pdf.dfcfw.com/pdf/H3_AP202405211633907553_1.pdf?1716281466000.pdf
地产链行业点评：地产利好政策频出，地产链化工品有望受益,华安证券,2024-05-21,化学制品,https://pdf.dfcfw.com/pdf/H3_AP202405211634035028_1.pdf?1716284522000.pdf
基础化工：尼龙产业链分析及河南省产业概况,中原证券,2024-05-21,化学制品,https://pdf.dfcfw.com/pdf/H3_AP202405211634051550_1.pdf?1716306059000.pdf
基础化工行业周报：夏季化肥市场延续偏强走势，超长期特别国债拉动民爆景气,华龙证券,2024-05-21,化学制品,https://pdf.dfcfw.com/pdf/H3_AP202405211634062901_1.pdf?1716324143000.pdf
新材料行业点评报告：底部显现，静待修复,开源证券,2024-05-21,化学制品,https://pdf.dfcfw.com/pdf/H3_AP202405211634077923_1.pdf?1716326492000.pdf
基础化工行业周专题：泰国全钢胎反倾销初裁出台，轮胎后市怎么看？,国联证券,2024-05-20,化学制品,https://pdf.dfcfw.com/pdf/H3_AP202405201633849794_1.pdf?1716198111000.pdf
基础化工行业周报：地产发力，周期行情有望继续,国金证券,2024-05-20,化学制品,https://pdf.dfcfw.com/pdf/H3_AP202405201633849792_1.pdf?1716198213000.pdf
万华化学基本面周度动态跟踪：化工景气有所反弹，聚合MDI价差小幅改善,华安证券,2024-05-20,化学制品,https://pdf.dfcfw.com/pdf/H3_AP202405201633850891_1.pdf?1716199540000.pdf
基础化工行业周报：R32价格持续上涨，关注制冷剂投资机会,中邮证券,2024-05-20,化学制品,https://pdf.dfcfw.com/pdf/H3_AP202405201633871513_1.pdf?1716229302000.pdf
基础化工行业报告：地产迎重磅政策，化工“硬资产”、地产链两手抓,天风证券,2024-05-20,化学制品,https://pdf.dfcfw.com/pdf/H3_AP202405201633881657_1.pdf?1716237920000.pdf
基础化工行业周报：工业一铵、PVC、维生素价格上涨，关注地产链化工品投资机会,国海证券,2024-05-20,化学制品,https://pdf.dfcfw.com/pdf/H3_AP202405201633884500_1.pdf?1716243361000.pdf
基础化工行业专题研究：再提“节能”，以基准指标倒逼产业改造升级,天风证券,2024-05-20,化学制品,https://pdf.dfcfw.com/pdf/H3_AP202405201633845346_1.pdf?1716190362000.pdf
基础化工行业周报：地产政策频出，建议关注聚氨酯、纯碱、钛白粉等,太平洋,2024-05-20,化学制品,https://pdf.dfcfw.com/pdf/H3_AP202405201633855817_1.pdf?1716211268000.pdf
化工新材料行业周报：北京发布低空经济产业发展三年规划，碳纤维关注度提升,太平洋,2024-05-20,化学制品,https://pdf.dfcfw.com/pdf/H3_AP202405201633855815_1.pdf?1716211268000.pdf
基础化工行业周报：地产政策持续出台，关注化工行业相关投资机会,开源证券,2024-05-19,化学制品,https://pdf.dfcfw.com/pdf/H3_AP202405191633829672_1.pdf?1716122594000.pdf
基础化工行业深度报告：2023年化工行业业绩承压，2024年利润有望修复,开源证券,2024-05-19,化学制品,https://pdf.dfcfw.com/pdf/H3_AP202405191633829693_1.pdf?1716125020000.pdf
基础化工行业周报：地产政策全面放松，看好地产链化工品景气回暖,华安证券,2024-05-19,化学制品,https://pdf.dfcfw.com/pdf/H3_AP202405191633829727_1.pdf?1716125720000.pdf
化工行业周报：国际油价上涨，磷酸一铵、VA、VE价格上涨,中银证券,2024-05-19,化学制品,https://pdf.dfcfw.com/pdf/H3_AP202405191633833483_1.pdf?1716135860000.pdf
新材料产业周报：日本成功开发全球首个高速6G无线设备，年全球新太阳能工厂投资达亿美元2023800,国海证券,2024-05-18,化学制品,https://pdf.dfcfw.com/pdf/H3_AP202405181633741119_1.pdf?1716016947000.pdf
化工行业2023年报及2024Q1总结,太平洋,2024-05-17,化学制品,https://pdf.dfcfw.com/pdf/H3_AP202405171633686636_1.pdf?1715936580000.pdf
基础化工行业月报：化工品整体延续涨势，继续关注煤化工、轻烃化工与磷化工,中原证券,2024-05-17,化学制品,https://pdf.dfcfw.com/pdf/H3_AP202405171633691010_1.pdf?1715937796000.pdf
基础化工行业周报：长丝供给出现扰动，国际油价震荡下行,上海证券,2024-05-16,化学制品,https://pdf.dfcfw.com/pdf/H3_AP202405161633239853_1.pdf?1715851387000.pdf
基础化工行业研究周报：化工品涨价品种数量增多，推荐化工“硬资产”,天风证券,2024-05-16,化学制品,https://pdf.dfcfw.com/pdf/H3_AP202405161633287865_1.pdf?1715855928000.pdf
日本化工新材料现状,海通国际,2024-05-16,化学制品,https://pdf.dfcfw.com/pdf/H3_AP202405161633548108_1.pdf?1715875825000.pdf
基础化工行业2023年报及2024一季报业绩综述：2024Q1业绩同比承压，轮胎、氟化工等板块改善明显,东莞证券,2024-05-16,化学制品,https://pdf.dfcfw.com/pdf/H3_AP202405161633555617_1.pdf?1715881727000.pdf
基础化工行业周报：氯化钾尿素等涨幅居前，建议继续关注涤纶长丝、轮胎行业和农化板块,华鑫证券,2024-05-15,化学制品,https://pdf.dfcfw.com/pdf/H3_AP202405151633151734_1.pdf?1715760916000.pdf
合成生物学周报：国资委部署生物制造，生物制造反式乌头酸取得新进展,华安证券,2024-05-15,化学制品,https://pdf.dfcfw.com/pdf/H3_AP202405151633162521_1.pdf?1715783699000.pdf
万华化学基本面周度动态跟踪：宁波基地MDI技改、己二胺项目开始调试，本周聚合MDI小幅上涨,华安证券,2024-05-15,化学制品,https://pdf.dfcfw.com/pdf/H3_AP202405151633171445_1.pdf?1715793173000.pdf
化工新材料行业周报：可持续航空燃料关注度提升，合成生物平台型公司未来可期,太平洋,2024-05-14,化学制品,https://pdf.dfcfw.com/pdf/H3_AP202405141633054024_1.pdf?1715692767000.pdf
基础化工行业周报：涤纶长丝供给侧或阶段性收缩，草甘膦、纯碱价格上涨,太平洋,2024-05-14,化学制品,https://pdf.dfcfw.com/pdf/H3_AP202405141633054398_1.pdf?1715694171000.pdf
基础化工行业周专题：如何看待萤石后市行情？,国联证券,2024-05-14,化学制品,https://pdf.dfcfw.com/pdf/H3_AP202405141633063782_1.pdf?1715708444000.pdf
钾长石行业研究：中高档钾长石需求增长，新能源等领域应用潜力大 头豹词条报告系列,头豹研究院,2024-05-14,化学制品,https://pdf.dfcfw.com/pdf/H3_AP202405141633074844_1.pdf?1715715427000.pdf
中国化妆品级透明质酸终端产品行业市场规模测算逻辑模型 头豹词条报告系列,头豹研究院,2024-05-14,化学制品,https://pdf.dfcfw.com/pdf/H3_AP202405141633074845_1.pdf?1715715636000.pdf
基础化工行业周报：纯碱、尿素、聚合MDI价格上涨，重视化工长周期机会,国海证券,2024-05-13,化学制品,https://pdf.dfcfw.com/pdf/H3_AP202405131632935069_1.pdf?1715597311000.pdf
化工行业周报：制冷剂、聚合MDI价格上行,中银证券,2024-05-13,化学制品,https://pdf.dfcfw.com/pdf/H3_AP202405131632932493_1.pdf?1715589602000.pdf
基础化工行业研究：化工关注度明显提升，建议重点关注涨价和合成生物学方向,国金证券,2024-05-13,化学制品,https://pdf.dfcfw.com/pdf/H3_AP202405131632947846_1.pdf?1715633821000.pdf
涤纶长丝行业动态研究：涤纶长丝行业降负， 供需格局持续优化,国海证券,2024-05-13,化学制品,https://pdf.dfcfw.com/pdf/H3_AP202405131632938834_1.pdf?1715607775000.pdf
基础化工行业周报：关注涨价及生物合成学双主线,中邮证券,2024-05-13,化学制品,https://pdf.dfcfw.com/pdf/H3_AP202405131632940826_1.pdf?1715612112000.pdf
基础化工行业双周报：板块迎来反弹，关注供给收缩领域,东莞证券,2024-05-12,化学制品,https://pdf.dfcfw.com/pdf/H3_AP202405121632919528_1.pdf?1715536307000.pdf
新材料行业双周报：硅油冷却液具备环保、价格优势，市场前景广阔,开源证券,2024-05-12,化学制品,https://pdf.dfcfw.com/pdf/H3_AP202405121632920544_1.pdf?1715543203000.pdf
基础化工行业周报：化工节后启动涨价行情，TMA、制冷剂、维生素价格上涨,华安证券,2024-05-12,化学制品,https://pdf.dfcfw.com/pdf/H3_AP202405121632919486_1.pdf?1715535351000.pdf
基础化工行业周报：环保督察持续进行，涤纶长丝供给侧扰动延续,开源证券,2024-05-12,化学制品,https://pdf.dfcfw.com/pdf/H3_AP202405121632922741_1.pdf?1715552157000.pdf
化工行业周报：细分板块关注度提升，产品价格延续涨势,华龙证券,2024-05-09,化学制品,https://pdf.dfcfw.com/pdf/H3_AP202405091632714934_1.pdf?1715245883000.pdf
基础化工行业周报：国际油价暂稳，萤石、氢氟酸价格上行,上海证券,2024-05-09,化学制品,https://pdf.dfcfw.com/pdf/H3_AP202405091632758928_1.pdf?1715272966000.pdf
化工新材料行业周报：以旧换新细则出台带动碳酸锂价格上涨，制冷剂延续强势,太平洋,2024-05-07,化学制品,https://pdf.dfcfw.com/pdf/H3_AP202405071632545665_1.pdf?1715072694000.pdf
化工行业周报：海外天然气价格上涨，纯碱、草甘膦价格上涨,中银证券,2024-05-07,化学制品,https://pdf.dfcfw.com/pdf/H3_AP202405071632547252_1.pdf?1715074574000.pdf
基础化工行业周报：维A、维E价格回暖，聚合MDI价格上涨,太平洋,2024-05-07,化学制品,https://pdf.dfcfw.com/pdf/H3_AP202405071632554577_1.pdf?1715089793000.pdf
基础化工行业点评：地产政策相继出台，提振信心，带动内生循环,国金证券,2024-05-07,化学制品,https://pdf.dfcfw.com/pdf/H3_AP202405071632554561_1.pdf?1715090110000.pdf
