研报名称,机构名称,发布时间,行业,研报地址
医药行业周报：武田与达歌生物达成12亿美元合作，开发分子胶药物,太平洋,2024-05-28,化学制药,https://pdf.dfcfw.com/pdf/H3_AP202405281634742129_1.pdf?1716906372000.pdf
医药生物：纠风部际机制印发2024年医疗整顿指导性文件，严监管趋向常态化,中邮证券,2024-05-28,化学制药,https://pdf.dfcfw.com/pdf/H3_AP202405281634749635_1.pdf?1716915827000.pdf
生物医药Ⅱ行业周报：克利加巴林获批上市，领跑DPNP大单品赛道,太平洋,2024-05-27,化学制药,https://pdf.dfcfw.com/pdf/H3_AP202405271634702526_1.pdf?1716795180000.pdf
医药生物：制剂出口已成方向，白紫为例海外可期,华福证券,2024-05-27,化学制药,https://pdf.dfcfw.com/pdf/H3_AP202405271634705623_1.pdf?1716808569000.pdf
医药生物行业周报：ASCO精彩纷呈；积极关注国产重点品种亚组数据,中泰证券,2024-05-27,化学制药,https://pdf.dfcfw.com/pdf/H3_AP202405271634705641_1.pdf?1716809005000.pdf
医药行业周报：政策鼓励支持、创新催化不断，关注医药创新、设备更新,民生证券,2024-05-27,化学制药,https://pdf.dfcfw.com/pdf/H3_AP202405271634719644_1.pdf?1716840560000.pdf
创新药研究框架之ASCO 2024：国产ADC精彩纷呈，创新双抗崭露头角,国投证券,2024-05-27,化学制药,https://pdf.dfcfw.com/pdf/H3_AP202405271634710451_1.pdf?1716818926000.pdf
2023年度和2024年一季度医药业绩总结和投资展望：低仓位、24Q1业绩增长和品类驱动医药行情,华安证券,2024-05-27,化学制药,https://pdf.dfcfw.com/pdf/H3_AP202405271634711352_1.pdf?1716820668000.pdf
医药行业周报：关注资源型品种的抗风险溢价,华鑫证券,2024-05-27,化学制药,https://pdf.dfcfw.com/pdf/H3_AP202405271634712179_1.pdf?1716821370000.pdf
生物医药Ⅱ行业周报：新药周观点：科伦博泰TROP2 ADC一线NSCLC数据优异，未来一线治疗值得期,国投证券,2024-05-26,化学制药,https://pdf.dfcfw.com/pdf/H3_AP202405261634688512_1.pdf?1716735953000.pdf
医药行业周报：赛诺菲Rilzabrutinib二期临床达主要终点,太平洋,2024-05-26,化学制药,https://pdf.dfcfw.com/pdf/H3_AP202405261634687796_1.pdf?1716732427000.pdf
医药行业周报：基因泰克Vixarelimab在中国获批临床，治疗溃疡性结肠炎,太平洋,2024-05-26,化学制药,https://pdf.dfcfw.com/pdf/H3_AP202405261634687797_1.pdf?1716732427000.pdf
医药行业周报：医药底部已明确，主题投资趋势不变（附MCD型弥漫大B淋巴瘤专题研究）,太平洋,2024-05-24,化学制药,https://pdf.dfcfw.com/pdf/H3_AP202405241634541099_1.pdf?1716562571000.pdf
医药行业周报：罗氏小分子联合疗法获FDA授予突破性疗法认定,太平洋,2024-05-23,化学制药,https://pdf.dfcfw.com/pdf/H3_AP202405231634383027_1.pdf?1716481513000.pdf
医药行业周报：医药政策持续边际回暖，关注医药创新、设备更新和中医药,民生证券,2024-05-22,化学制药,https://pdf.dfcfw.com/pdf/H3_AP202405221634105819_1.pdf?1716366601000.pdf
医药行业重点公司2023年年报_2024年一季报总结暨投资展望：分化态势延续，关注业绩确定性标的和拐点方向,首创证券,2024-05-22,化学制药,https://pdf.dfcfw.com/pdf/H3_AP202405221634239294_1.pdf?1716369490000.pdf
医药生物5月月报暨年报_一季报总结：影响出清，拐点在即；真空期兼顾基本面与主题,中泰证券,2024-05-22,化学制药,https://pdf.dfcfw.com/pdf/H3_AP202405221634312071_1.pdf?1716371327000.pdf
医药行业周报：礼来替尔泊肽注射液在华获批上市，用于治疗糖尿病,太平洋,2024-05-22,化学制药,https://pdf.dfcfw.com/pdf/H3_AP202405221634314322_1.pdf?1716377225000.pdf
原料药板块2024Q1跟踪报告：VB1价格环比略增，肝素报价环比下滑明显,西南证券,2024-05-22,化学制药,https://pdf.dfcfw.com/pdf/H3_AP202405221634314323_1.pdf?1716378140000.pdf
医药行业深度研究：行业短期承压，静待需求改善,太平洋,2024-05-22,化学制药,https://pdf.dfcfw.com/pdf/H3_AP202405221634316878_1.pdf?1716385493000.pdf
医药行业周报：赛诺菲FIC创新药在华启动3期临床，用于治疗nrSPMS,太平洋,2024-05-21,化学制药,https://pdf.dfcfw.com/pdf/H3_AP202405211634004542_1.pdf?1716281878000.pdf
医药行业周报：艾伯维JAK抑制剂拟纳入突破性治疗品种,太平洋,2024-05-21,化学制药,https://pdf.dfcfw.com/pdf/H3_AP202405211634004535_1.pdf?1716281878000.pdf
血液制品报告：全球血液制品行业景气持续，新浆站和新品种共振蓝海可期,山西证券,2024-05-21,化学制药,https://pdf.dfcfw.com/pdf/H3_AP202405211634041900_1.pdf?1716287850000.pdf
医药行业深度报告：终端市场恢复增长，围绕空间和格局优选品种,平安证券,2024-05-21,化学制药,https://pdf.dfcfw.com/pdf/H3_AP202405211634055359_1.pdf?1716310195000.pdf
医药行业周报：拜耳Elinzanetant三期临床结果积极，用于治疗VMS,太平洋,2024-05-21,化学制药,https://pdf.dfcfw.com/pdf/H3_AP202405211634071238_1.pdf?1716322790000.pdf
医药行业周报：出海难度增加，大品种需大市场,华鑫证券,2024-05-20,化学制药,https://pdf.dfcfw.com/pdf/H3_AP202405201633847843_1.pdf?1716199821000.pdf
生物医药行业周报：行业政策回暖，关注硬真创新能力的企业,平安证券,2024-05-20,化学制药,https://pdf.dfcfw.com/pdf/H3_AP202405201633849854_1.pdf?1716198588000.pdf
医药生物行业2023年报和2024年一季报综述：底部夯实，逐季向好,东海证券,2024-05-20,化学制药,https://pdf.dfcfw.com/pdf/H3_AP202405201633849917_1.pdf?1716201414000.pdf
医药行业周报：再生元重磅抗炎药获FDA优先审评资格，用于治疗CRSwNP,太平洋,2024-05-20,化学制药,https://pdf.dfcfw.com/pdf/H3_AP202405201633855820_1.pdf?1716211268000.pdf
医药行业周报：卫材_渤健皮下注射仑卡奈单抗申报上市，用于治疗AD,太平洋,2024-05-20,化学制药,https://pdf.dfcfw.com/pdf/H3_AP202405201633855819_1.pdf?1716211268000.pdf
维生素行业动态研究：多种维生素报价上行，看好中期景气度,国海证券,2024-05-20,化学制药,https://pdf.dfcfw.com/pdf/H3_AP202405201633855978_1.pdf?1716211707000.pdf
新药周观点：迈威NECTIN-4 ADC三阴乳腺癌数据披露，泛瘤种治疗潜力展露无疑,国投证券,2024-05-19,化学制药,https://pdf.dfcfw.com/pdf/H3_AP202405191633836720_1.pdf?1716197712000.pdf
2024年中国呼吸道疾病检测行业概览：快速检测助力呼吸道疾病诊疗,头豹研究院,2024-05-17,化学制药,https://pdf.dfcfw.com/pdf/H3_AP202405171633719967_1.pdf?1715974568000.pdf
医药生物：生物安全法案更新，CXO板块迎来边际改善,中邮证券,2024-05-16,化学制药,https://pdf.dfcfw.com/pdf/H3_AP202405151633203979_1.pdf?1715846777000.pdf
中国中低通量测序仪行业市场规模测算逻辑模型 头豹词条报告系列,头豹研究院,2024-05-16,化学制药,https://pdf.dfcfw.com/pdf/H3_AP202405161633637142_1.pdf?1715888762000.pdf
医药行业周报：勃林格殷格翰创新疗法早期临床结果积极，用于治疗DMI,太平洋,2024-05-15,化学制药,https://pdf.dfcfw.com/pdf/H3_AP202405151633152664_1.pdf?1715761662000.pdf
2024年中国肝炎用药行业概览：病毒性肝炎多发驱动中国肝炎药物市场速增，政府重点关注推动药品加速迭代,头豹研究院,2024-05-15,化学制药,https://pdf.dfcfw.com/pdf/H3_AP202405151633181525_1.pdf?1715803502000.pdf
医药行业深度研究：原料药板块Q1业绩环比改善明显，Q2有望确认行业拐点,太平洋,2024-05-15,化学制药,https://pdf.dfcfw.com/pdf/H3_AP202405151633187344_1.pdf?1715807708000.pdf
生物医药Ⅱ行业周报：Nectin-4 ADC赛道渐热，迈威生物9MW2821展现BIC潜质,太平洋,2024-05-14,化学制药,https://pdf.dfcfw.com/pdf/H3_AP202405141633046424_1.pdf?1715676037000.pdf
生物医药行业周报：设备更新换代政策持续推进，下半年需求集中释放可期,平安证券,2024-05-14,化学制药,https://pdf.dfcfw.com/pdf/H3_AP202405141633046423_1.pdf?1715676143000.pdf
IgA肾病全景图：国内百万级患者基数，IgAN掘金之路待启航,平安证券,2024-05-14,化学制药,https://pdf.dfcfw.com/pdf/H3_AP202405141633054397_1.pdf?1715694385000.pdf
医药行业2024年5月投资月报：看好医药反弹,西南证券,2024-05-14,化学制药,https://pdf.dfcfw.com/pdf/H3_AP202405141633070607_1.pdf?1715713583000.pdf
新兴产业行业研究周报：合成生物学引发关注，应用领域有望持续拓宽,天风证券,2024-05-13,化学制药,https://pdf.dfcfw.com/pdf/H3_AP202405131632933915_1.pdf?1715592707000.pdf
2024年5月第二周创新药周报（附小专题血友病RNAi疗法研发概况）,西南证券,2024-05-13,化学制药,https://pdf.dfcfw.com/pdf/H3_AP202405131632940152_1.pdf?1715614595000.pdf
生物信息测序服务：中国制造引领第4代测序技术面世，业务模式变革成当下热门趋势,头豹研究院,2024-05-12,化学制药,https://pdf.dfcfw.com/pdf/H3_AP202405111632897456_1.pdf?1715506668000.pdf
医药行业周报：诺华布西珠单抗3期临床结果积极，用于治疗PDR,太平洋,2024-05-12,化学制药,https://pdf.dfcfw.com/pdf/H3_AP202405121632916299_1.pdf?1715525116000.pdf
医药行业周报：盐野义1.5亿美元引入庞贝病小分子药物,太平洋,2024-05-12,化学制药,https://pdf.dfcfw.com/pdf/H3_AP202405121632916346_1.pdf?1715526265000.pdf
生物医药Ⅱ行业周报：新药周观点：Biotech进入商业化放量加速阶段，亏损逐渐改善,国投证券,2024-05-12,化学制药,https://pdf.dfcfw.com/pdf/H3_AP202405121632916979_1.pdf?1715527303000.pdf
医药行业2024年中期投资策略：行业拐点将至，布局创新弹性及业绩确定性方向,开源证券,2024-05-10,化学制药,https://pdf.dfcfw.com/pdf/H3_AP202405101632803672_1.pdf?1715330925000.pdf
医药2024中期策略报告_2023年报&2024Q1季报总结：业绩呈现改善趋势，紧抓确定性机会,中邮证券,2024-05-10,化学制药,https://pdf.dfcfw.com/pdf/H3_AP202405101632820939_1.pdf?1715363718000.pdf
生物医药之创新药：ADC行业加速发展，中国力量不容忽视,招商银行,2024-05-10,化学制药,https://pdf.dfcfw.com/pdf/H3_AP202405101632822042_1.pdf?1715363509000.pdf
医药行业2023年年报及2024年一季报总结：业绩低点已过，看好后续医药行情,西南证券,2024-05-10,化学制药,https://pdf.dfcfw.com/pdf/H3_AP202405101632827462_1.pdf?1715367902000.pdf
中国帕金森病药物治疗行业市场规模测算逻辑模型 头豹词条报告系列,头豹研究院,2024-05-10,化学制药,https://pdf.dfcfw.com/pdf/H3_AP202405101632829458_1.pdf?1715371706000.pdf
医药制造行业2024年度行业分析,联合资信,2024-05-09,化学制药,https://pdf.dfcfw.com/pdf/H3_AP202405091632714952_1.pdf?1715249384000.pdf
2023年年报及2024年一季报总结：抗疫与反腐中展现韧性，2024有望先抑后扬,平安证券,2024-05-09,化学制药,https://pdf.dfcfw.com/pdf/H3_AP202405091632747790_1.pdf?1715248729000.pdf
医药行业周报：赛诺菲siRNA疗法在华申报上市，用于治疗血友病,太平洋,2024-05-09,化学制药,https://pdf.dfcfw.com/pdf/H3_AP202405091632749845_1.pdf?1715250378000.pdf
中国生物信息测序服务行业市场规模测算逻辑模型 头豹词条报告系列,头豹研究院,2024-05-09,化学制药,https://pdf.dfcfw.com/pdf/H3_AP202405091632774616_1.pdf?1715284566000.pdf
医药行业周报：诺华盐酸伊普可泮胶囊在华获批，用于治疗PNH,太平洋,2024-05-08,化学制药,https://pdf.dfcfw.com/pdf/H3_AP202405081632651607_1.pdf?1715173564000.pdf
医药行业周报：强生前列腺癌疗法达到2期临床主要终点,太平洋,2024-05-07,化学制药,https://pdf.dfcfw.com/pdf/H3_AP202405071632554580_1.pdf?1715089793000.pdf
医药板块23年年报和Q1季报总结：至暗时刻已过，静待反转,华福证券,2024-05-06,化学制药,https://pdf.dfcfw.com/pdf/H3_AP202405061632474862_1.pdf?1715010559000.pdf
医药：关节接续采购2号文件点评：延续温和续约趋势，产品价格有望拉平符合市场预期,平安证券,2024-05-06,化学制药,https://pdf.dfcfw.com/pdf/H3_AP202405061632474901_1.pdf?1715002710000.pdf
医药行业周报：BMS玛伐凯泰在中国获批上市，用于治疗心肌病,太平洋,2024-05-06,化学制药,https://pdf.dfcfw.com/pdf/H3_AP202405061632474921_1.pdf?1715000487000.pdf
医药行业政策点评：人工关节国采续标规则温和，国产企业有望受益,西南证券,2024-05-06,化学制药,https://pdf.dfcfw.com/pdf/H3_AP202405061632474931_1.pdf?1715001075000.pdf
医药行业2023年及24Q1总结报告：医疗服务、药店、中药增速较快，处方药及中药等二季度有望拐点,东吴证券,2024-05-06,化学制药,https://pdf.dfcfw.com/pdf/H3_AP202405051632456273_1.pdf?1714984685000.pdf
医药行业动态分析：医药行业24Q1基金持仓分析：医药持仓比例下降，基金配置倾向于红利资产,国投证券,2024-05-06,化学制药,https://pdf.dfcfw.com/pdf/H3_AP202405061632459537_1.pdf?1714987378000.pdf
医药行业周报：医药板块关注度大幅提升，创新药和原料药行情有望延续（附A+H创新药企催化剂梳理）,太平洋,2024-05-06,化学制药,https://pdf.dfcfw.com/pdf/H3_AP202405061632467911_1.pdf?1714986168000.pdf
医药行业专题：Q1医药板块业绩企稳，整装待发,国投证券,2024-05-06,化学制药,https://pdf.dfcfw.com/pdf/H3_AP202405061632488805_1.pdf?1715025731000.pdf
医药行业5月策略报告：利空出尽，重点推荐中药、创新药及原料药等板块,东吴证券,2024-05-05,化学制药,https://pdf.dfcfw.com/pdf/H3_AP202405041632435522_1.pdf?1714908803000.pdf
2024Q1持仓分析：医药占比略有下降,西南证券,2024-04-30,化学制药,https://pdf.dfcfw.com/pdf/H3_AP202404301632037480_1.pdf?1714488376000.pdf
医药行业周报：辉瑞基因疗法Beqvez获FDA批准上市,太平洋,2024-04-30,化学制药,https://pdf.dfcfw.com/pdf/H3_AP202404301631828765_1.pdf?1714473978000.pdf
医药行业周报：基因泰克Ocrelizumab三期临床结果积极，用于治疗RMS_PPMS,太平洋,2024-04-29,化学制药,https://pdf.dfcfw.com/pdf/H3_AP202404291631571971_1.pdf?1714394771000.pdf
生物医药Ⅱ行业周报：高股息板块盛行，建议关注医药相关领域,太平洋,2024-04-29,化学制药,https://pdf.dfcfw.com/pdf/H3_AP202404291631571970_1.pdf?1714394771000.pdf
医药行业周报：创新聚焦大品种方向,华鑫证券,2024-04-29,化学制药,https://pdf.dfcfw.com/pdf/H3_AP202404291631572947_1.pdf?1714405658000.pdf
生物医药Ⅱ行业周报：新药周观点：24Q1创新药板块持仓环比微增，机构关注度不断提升中,国投证券,2024-04-28,化学制药,https://pdf.dfcfw.com/pdf/H3_AP202404281631543866_1.pdf?1714322735000.pdf
医药行业周报：赛诺菲Amlitelimab在中国启动3期临床，治疗特应性皮炎,太平洋,2024-04-26,化学制药,https://pdf.dfcfw.com/pdf/H3_AP202404261631370569_1.pdf?1714127997000.pdf
医药生物：公募基金持仓占比下降，板块后续有望企稳,国联证券,2024-04-26,化学制药,https://pdf.dfcfw.com/pdf/H3_AP202404261631378471_1.pdf?1714145044000.pdf
医药行业研究框架与近期投资观点：科技与消费属性齐备的医药板块星辰大海,华安证券,2024-04-25,化学制药,https://pdf.dfcfw.com/pdf/H3_AP202404241631181821_1.pdf?1714041964000.pdf
医药行业专题：终端用量回升且供需格局优化，大输液行业步入高质量发展阶段,国投证券,2024-04-25,化学制药,https://pdf.dfcfw.com/pdf/H3_AP202404241631186780_1.pdf?1714034557000.pdf
医药行业周报：赛诺菲BTK抑制剂Rilzabrutinib达3期主要终点,太平洋,2024-04-25,化学制药,https://pdf.dfcfw.com/pdf/H3_AP202404251631266245_1.pdf?1714054716000.pdf
医药行业周报：FDA批准Anktiva与卡介苗联用治疗NMIBC,太平洋,2024-04-24,化学制药,https://pdf.dfcfw.com/pdf/H3_AP202404241631114867_1.pdf?1713955356000.pdf
医药行业点评：胰岛素续约拟中选结果公布，加速国产替代步伐,民生证券,2024-04-24,化学制药,https://pdf.dfcfw.com/pdf/H3_AP202404241631115391_1.pdf?1713956806000.pdf
医药行业行业研究：胰岛素专项接续集采拟中选结果公布，看好国产替代进程进一步加速,国金证券,2024-04-24,化学制药,https://pdf.dfcfw.com/pdf/H3_AP202404241631118967_1.pdf?1713977847000.pdf
医药行业周报：武田维得利珠单抗获FDA批准治疗克罗恩病,太平洋,2024-04-23,化学制药,https://pdf.dfcfw.com/pdf/H3_AP202404231631037580_1.pdf?1713869269000.pdf
医药生物：系统性红斑狼疮蓝海市场，生物制剂脱颖而出,西南证券,2024-04-23,化学制药,https://pdf.dfcfw.com/pdf/H3_AP202404231631058223_1.pdf?1713902454000.pdf
医药行业周报：Seagen靶向整合素β6的ADC疗法在中国获批临床,太平洋,2024-04-22,化学制药,https://pdf.dfcfw.com/pdf/H3_AP202404221630945793_1.pdf?1713775991000.pdf
生物医药Ⅱ行业周报：血液透析远期市场空间广阔，国产企业有望加速进口替代,太平洋,2024-04-22,化学制药,https://pdf.dfcfw.com/pdf/H3_AP202404221630945792_1.pdf?1713781730000.pdf
生物医药Ⅱ行业周报：新药周观点：恒瑞最新创新药管线披露，24年有望迎来多个新品种获批,国投证券,2024-04-21,化学制药,https://pdf.dfcfw.com/pdf/H3_AP202404211630934327_1.pdf?1713731306000.pdf
2023年创新药企年报核心看点（一）：产品销售放量；经营效率提升；出海主线不变,平安证券,2024-04-19,化学制药,https://pdf.dfcfw.com/pdf/H3_AP202404191630636537_1.pdf?1713516267000.pdf
医药行业周报：赛诺菲抗CD40L单抗在华获批临床，治疗多发性硬化,太平洋,2024-04-19,化学制药,https://pdf.dfcfw.com/pdf/H3_AP202404191630642701_1.pdf?1713519157000.pdf
医药行业周报：礼来巴瑞替尼新适应症国内获批上市,太平洋,2024-04-18,化学制药,https://pdf.dfcfw.com/pdf/H3_AP202404181630498848_1.pdf?1713430661000.pdf
医药行业周报：罗氏双特异性抗体3期临床达到主要终点,太平洋,2024-04-17,化学制药,https://pdf.dfcfw.com/pdf/H3_AP202404171630393300_1.pdf?1713352264000.pdf
生物医药Ⅱ行业周报：AD免疫诊断准确性较高，诺唯赞产品获批探索新市场,太平洋,2024-04-16,化学制药,https://pdf.dfcfw.com/pdf/H3_AP202404161630270352_1.pdf?1713260377000.pdf
医药行业周报：CDE发布《化学仿制药生物等效性研究摘要》,太平洋,2024-04-16,化学制药,https://pdf.dfcfw.com/pdf/H3_AP202404161630272290_1.pdf?1713264656000.pdf
医药生物行业周报：看好央国企改革和创新药械受益于国内政策春风,信达证券,2024-04-15,化学制药,https://pdf.dfcfw.com/pdf/H3_AP202404151630210704_1.pdf?1713169687000.pdf
医药行业周报：诺华11.6亿美元获得Arvinas两款PROTAC授权,太平洋,2024-04-15,化学制药,https://pdf.dfcfw.com/pdf/H3_AP202404151630211044_1.pdf?1713170426000.pdf
医药行业深度研究：2024年1-2月原料药行业边际改善持续，Q2有望迎来行业拐点,太平洋,2024-04-15,化学制药,https://pdf.dfcfw.com/pdf/H3_AP202404151630211043_1.pdf?1713174689000.pdf
医药行业周报：关注医药创新产业链、原料药等细分方向积极变化,民生证券,2024-04-15,化学制药,https://pdf.dfcfw.com/pdf/H3_AP202404151630214564_1.pdf?1713179785000.pdf
医药行业周报：部分原料药品种处于景气提升阶段,华鑫证券,2024-04-15,化学制药,https://pdf.dfcfw.com/pdf/H3_AP202404151630241991_1.pdf?1713218747000.pdf
医药行业周报：Vertex以49亿美元收购Alpine，获得泰它西普同类药物,太平洋,2024-04-14,化学制药,https://pdf.dfcfw.com/pdf/H3_AP202404141630208132_1.pdf?1713103146000.pdf
新药周观点：AACR 2024闭幕，国产ADC药物方兴未艾,国投证券,2024-04-14,化学制药,https://pdf.dfcfw.com/pdf/H3_AP202404141630208247_1.pdf?1713107647000.pdf
医药生物行业跟踪周报：原料药多维度积极变化，关注同和药业、华海药业等,东吴证券,2024-04-14,化学制药,https://pdf.dfcfw.com/pdf/H3_AP202404141630209965_1.pdf?1713167856000.pdf
合成生物学行业专题系列三：生物制造继往开来，细分领域皆有可为,国投证券,2024-04-13,化学制药,https://pdf.dfcfw.com/pdf/H3_AP202404131630207101_1.pdf?1713087418000.pdf
医药行业周报：Alnylam长效高血压RNAi疗法II期临床结果积极,太平洋,2024-04-11,化学制药,https://pdf.dfcfw.com/pdf/H3_AP202404111630139054_1.pdf?1712827373000.pdf
医药行业周报：罗氏PI3Kα抑制剂拟纳入优先审评,太平洋,2024-04-10,化学制药,https://pdf.dfcfw.com/pdf/H3_AP202404101630104944_1.pdf?1712756683000.pdf
中药Ⅱ行业快评报告：三地方政府齐出台创新药产业相关政策文件，关注中药创新药,万联证券,2024-04-09,化学制药,https://pdf.dfcfw.com/pdf/H3_AP202404091630067740_1.pdf?1712651891000.pdf
医药行业点评：多地出台创新器械发展政策，关注相关投资机遇,民生证券,2024-04-09,化学制药,https://pdf.dfcfw.com/pdf/H3_AP202404091630073637_1.pdf?1712677536000.pdf
医药行业周报：第一三共_阿斯利康Dato-DXd新适应症在美报上市,太平洋,2024-04-09,化学制药,https://pdf.dfcfw.com/pdf/H3_AP202404091630078072_1.pdf?1712685247000.pdf
医药行业周报：卫材_渤健仑卡奈单抗新适应症在美报上市,太平洋,2024-04-09,化学制药,https://pdf.dfcfw.com/pdf/H3_AP202404091630078073_1.pdf?1712685322000.pdf
生物医药Ⅱ行业周报：创新支持政策多地开花，创新药械春天正在开启,太平洋,2024-04-09,化学制药,https://pdf.dfcfw.com/pdf/H3_AP202404091630067739_1.pdf?1712651105000.pdf
中国多发性硬化症药物治疗行业市场规模测算逻辑模型,头豹研究院,2024-04-08,化学制药,https://pdf.dfcfw.com/pdf/H3_AP202404071630038349_1.pdf?1712568002000.pdf
医药生物行业周报：持续聚集高增长方向,华鑫证券,2024-04-08,化学制药,https://pdf.dfcfw.com/pdf/H3_AP202404081630043282_1.pdf?1712576909000.pdf
医药生物行业周报：创新药利好政策频出，关注相关机会,东海证券,2024-04-08,化学制药,https://pdf.dfcfw.com/pdf/H3_AP202404081630046468_1.pdf?1712591434000.pdf
医药行业周报：Genmab以18亿美元收购普方生物,太平洋,2024-04-08,化学制药,https://pdf.dfcfw.com/pdf/H3_AP202404081630051825_1.pdf?1712598152000.pdf
医药生物行业动态跟踪：多地出台创新药支持文件，看多创新药为全年主线之一,华福证券,2024-04-08,化学制药,https://pdf.dfcfw.com/pdf/H3_AP202404081630058890_1.pdf?1712606221000.pdf
新药周观点：创新药板块机构持仓持续提升，2023年底达近年高峰,国投证券,2024-04-07,化学制药,https://pdf.dfcfw.com/pdf/H3_AP202404071630034798_1.pdf?1712501511000.pdf
医药生物行业双周报2024年第7期总第105期：年报密集披露期到来，关注业绩确定性及创新属性公司,长城国瑞证券,2024-04-02,化学制药,https://pdf.dfcfw.com/pdf/H3_AP202404021629500251_1.pdf?1712088090000.pdf
新药周观点：首个Claudin 18.2靶向药物获批，国内企业处于该领域全球前列,国投证券,2024-04-01,化学制药,https://pdf.dfcfw.com/pdf/H3_AP202404011629191769_1.pdf?1711965237000.pdf
医药行业周报：吉利德超6亿美元囊获创新肿瘤免疫疗法,太平洋,2024-04-01,化学制药,https://pdf.dfcfw.com/pdf/H3_AP202404011629191865_1.pdf?1711961565000.pdf
医药行业周报：关注GLP-1、仿制药研发、听力连锁和医保数据要素,民生证券,2024-04-01,化学制药,https://pdf.dfcfw.com/pdf/H3_AP202404011629193468_1.pdf?1711966976000.pdf
医药行业周报：关注1季度延续增长的方向,华鑫证券,2024-04-01,化学制药,https://pdf.dfcfw.com/pdf/H3_AP202404011629193490_1.pdf?1711964390000.pdf
医疗行业行业周报：合理预期Q1，Q2是布局窗口，下半年提速反弹,国金证券,2024-04-01,化学制药,https://pdf.dfcfw.com/pdf/H3_AP202404011629195349_1.pdf?1711970931000.pdf
医药生物行业跟踪周报：创新药政策明显回暖，关注诺思格、泰格医药等,东吴证券,2024-04-01,化学制药,https://pdf.dfcfw.com/pdf/H3_AP202404011629190637_1.pdf?1711958212000.pdf
医药行业创新药周报：2024年3月第五周创新药周报（附小专题MET靶点研发概况）,西南证券,2024-04-01,化学制药,https://pdf.dfcfw.com/pdf/H3_AP202404011629212061_1.pdf?1712009379000.pdf
医药行业周报：Beckley Psytech抑郁症创新疗法2期临床结果积极,太平洋,2024-03-29,化学制药,https://pdf.dfcfw.com/pdf/H3_AP202403291629026682_1.pdf?1711708106000.pdf
医药行业周报报：Viking创新口服减肥疗法一期临床结果积极,太平洋,2024-03-29,化学制药,https://pdf.dfcfw.com/pdf/H3_AP202403291629026683_1.pdf?1711708106000.pdf
医药生物行业点评：二季度建议逐步增加医药板块配置比例,中银证券,2024-03-29,化学制药,https://pdf.dfcfw.com/pdf/H3_AP202403291629065346_1.pdf?1711743730000.pdf
2024年生物医药行业一季报业绩前瞻：关注一季报高增长标的，积极把握布局窗口期,国信证券,2024-03-28,化学制药,https://pdf.dfcfw.com/pdf/H3_AP202403281628431737_1.pdf?1711623484000.pdf
肌萎缩侧索硬化症患者群体超20万人，精准治疗方案面临怎样发展机遇？ 头豹词条报告系列,头豹研究院,2024-03-28,化学制药,https://pdf.dfcfw.com/pdf/H3_AP202403281628474199_1.pdf?1711657212000.pdf
医药行业周报：罗氏PI3Kα抑制剂拟纳入突破性治疗品种,太平洋,2024-03-27,化学制药,https://pdf.dfcfw.com/pdf/H3_AP202403271628297489_1.pdf?1711533722000.pdf
