研报名称,机构名称,发布时间,行业,研报地址
化工行业行业周报：有机硅DMC、黄磷价格上涨，关注周期弹性标的,中国银河,2025-03-26,化学原料,https://pdf.dfcfw.com/pdf/H3_AP202503251647427379_1.pdf?1742981935000.pdf
基础化工行业周报：本周有机硅价格延续上涨趋势，尿素价格重心窄幅上移,开源证券,2025-03-25,化学原料,https://pdf.dfcfw.com/pdf/H3_AP202503251647309993_1.pdf?1742918651000.pdf
锦纶行业点评：解锁冰雪经济里的“织”热新需求,民生证券,2025-03-18,化学原料,https://pdf.dfcfw.com/pdf/H3_AP202503181644476880_1.pdf?1742302146000.pdf
基础化工行业周报：杀虫剂价格率先上涨，需求旺季到来有望推动农药产品景气向上,开源证券,2025-03-17,化学原料,https://pdf.dfcfw.com/pdf/H3_AP202503171644445717_1.pdf?1742225942000.pdf
轮胎行业月报：成本助推轮胎新一轮涨价，国产品牌进入高端市场,东海证券,2025-03-13,化学原料,https://pdf.dfcfw.com/pdf/H3_AP202503121644312948_1.pdf?1741850871000.pdf
煤化工行业深度报告：新疆煤化工大发展背景下的投资机会,民生证券,2025-03-13,化学原料,https://pdf.dfcfw.com/pdf/H3_AP202503131644335704_1.pdf?1741884054000.pdf
氟化工行业月报：制冷剂价格稳步上行，未来空间广阔,东海证券,2025-03-11,化学原料,https://pdf.dfcfw.com/pdf/H3_AP202503111644267882_1.pdf?1741712646000.pdf
基础化工行业研究：AI系列深度（三）：超级芯片推动AI赋能预想，刺激高频高速树脂材料需求,国金证券,2025-03-06,化学原料,https://pdf.dfcfw.com/pdf/H3_AP202503061644098907_1.pdf?1741249314000.pdf
化工行业2025年政府工作报告解读：多维度赋能，探寻化工结构性机会,中国银河,2025-03-06,化学原料,https://pdf.dfcfw.com/pdf/H3_AP202503061644103212_1.pdf?1741268961000.pdf
企业竞争图谱：2025年工业雷管 头豹词条报告系列,头豹研究院,2025-03-05,化学原料,https://pdf.dfcfw.com/pdf/H3_AP202503051644082313_1.pdf?1741203974000.pdf
化工行业行业周报：钾肥、有机硅DMC价格上涨，关注周期弹性标的,中国银河,2025-03-03,化学原料,https://pdf.dfcfw.com/pdf/H3_AP202503031643996207_1.pdf?1741013228000.pdf
磷化工行业：2025年2月月度观察：春耕备货提高磷肥需求，磷酸氢钙价格上涨,国信证券,2025-03-02,化学原料,https://pdf.dfcfw.com/pdf/H3_AP202503011643639566_1.pdf?1740912558000.pdf
基础化工行业研究：小米发布SU7 Ultra，碳纤维和国产轮胎有望受益,国金证券,2025-03-02,化学原料,https://pdf.dfcfw.com/pdf/H3_AP202503021643651590_1.pdf?1740913253000.pdf
氟化工行业：2025年2月月度观察 空调排产双位数增长，制冷剂厂家报价继续上涨,国信证券,2025-03-02,化学原料,https://pdf.dfcfw.com/pdf/H3_AP202503021643657891_1.pdf?1740941395000.pdf
公用&化工&交运行业研究：新疆煤炭放量启新章，民爆、能源龙头展宏图,国金证券,2025-02-28,化学原料,https://pdf.dfcfw.com/pdf/H3_AP202502281643593241_1.pdf?1740729864000.pdf
新材料周报：民营企业座谈会释放重要信号，国资委深化部署利好新材料,华福证券,2025-02-24,化学原料,https://pdf.dfcfw.com/pdf/H3_AP202502241643425774_1.pdf?1740389648000.pdf
DeepSeek冲击波（化工篇）：AI赋能下的化工行业机遇与变革,中国银河,2025-02-19,化学原料,https://pdf.dfcfw.com/pdf/H3_AP202502191643263584_1.pdf?1739981152000.pdf
化工行业行业周报：石油焦、有机硅DMC价格上涨，看好成长属性标的,中国银河,2025-02-18,化学原料,https://pdf.dfcfw.com/pdf/H3_AP202502181643189528_1.pdf?1739883738000.pdf
氟化工行业月报：氟化工企业业绩预增，制冷剂维持高景气,东海证券,2025-02-14,化学原料,https://pdf.dfcfw.com/pdf/H3_AP202502131643060954_1.pdf?1739517959000.pdf
棕榈油行业点评：马来西亚1月棕榈油产量低于市场预期，棕榈油价格走强,民生证券,2025-02-12,化学原料,https://pdf.dfcfw.com/pdf/H3_AP202502121643011895_1.pdf?1739370065000.pdf
基础化工行业周报：山东27家化工园区完成扩区调区，MDI、TDI价格上涨,华安证券,2025-02-10,化学原料,https://pdf.dfcfw.com/pdf/H3_AP202502101642928616_1.pdf?1739181496000.pdf
化工行业行业周报：化工品价差表现偏强，关注结构性机会,中国银河,2025-02-10,化学原料,https://pdf.dfcfw.com/pdf/H3_AP202502101642938030_1.pdf?1739205432000.pdf
氟化工行业周报：节后行情稳定，萤石、制冷剂静待旺季新一轮涨势,开源证券,2025-02-09,化学原料,https://pdf.dfcfw.com/pdf/H3_AP202502091642913009_1.pdf?1739116350000.pdf
煤化工行业专题：煤炭资源优势凸显，西北煤化工前景可期,国信证券,2025-02-07,化学原料,https://pdf.dfcfw.com/pdf/H3_AP202502071642857375_1.pdf?1738921528000.pdf
磷化工行业：2025年1月月度观察：磷矿石价格高位运行，磷肥保供稳价工作稳步推进,国信证券,2025-02-07,化学原料,https://pdf.dfcfw.com/pdf/H3_AP202502071642868413_1.pdf?1738948030000.pdf
氟化工行业：2025年1月月度观察：制冷剂价格继续上涨，氟化工企业四季度业绩大增,国信证券,2025-02-05,化学原料,https://pdf.dfcfw.com/pdf/H3_AP202502051642789613_1.pdf?1738763841000.pdf
基础化工行业研究：有机硅：供需边际改善，有望开启新一轮景气周期,国金证券,2025-01-27,化学原料,https://pdf.dfcfw.com/pdf/H3_AP202501271642596182_1.pdf?1737994495000.pdf
企业竞争图谱：2024年有机涂层板 头豹词条报告系列,头豹研究院,2025-01-23,化学原料,https://pdf.dfcfw.com/pdf/H3_AP202501231642492225_1.pdf?1737663959000.pdf
高端钛锅：烹饪艺术革新，科技与健康的融合 头豹词条报告系列,头豹研究院,2025-01-23,化学原料,https://pdf.dfcfw.com/pdf/H3_AP202501231642492227_1.pdf?1737663676000.pdf
2024年中国生物柴油行业概览,头豹研究院,2025-01-21,化学原料,https://pdf.dfcfw.com/pdf/H3_AP202501211642413404_1.pdf?1737491907000.pdf
基础化工行业周报：2025年河北省重点化工项目名单公布，TDI价格价差双增,华安证券,2025-01-20,化学原料,https://pdf.dfcfw.com/pdf/H3_AP202501201642359719_1.pdf?1737382523000.pdf
生物柴油行业周报：国内生物柴油企业价差扩大，美国财政部宣布最新清洁燃料税收抵免指南,民生证券,2025-01-20,化学原料,https://pdf.dfcfw.com/pdf/H3_AP202501201642366255_1.pdf?1737392339000.pdf
新材料周报：光伏产业链上游涨价，珠海力争建全国最大光刻胶产业集群,华福证券,2025-01-13,化学原料,https://pdf.dfcfw.com/pdf/H3_AP202501131641897768_1.pdf?1736765981000.pdf
2024年中国功能型湿电子化学品镀层材料行业市场报告,爱集微咨询(厦门),2025-01-10,化学原料,https://pdf.dfcfw.com/pdf/H3_AP202501101641881030_1.pdf?1736528064000.pdf
有机硅行业深度报告：供需拐点已至，盈利修复可期,开源证券,2025-01-10,化学原料,https://pdf.dfcfw.com/pdf/H3_AP202501101641891669_1.pdf?1736673202000.pdf
氟化工行业月报：空调长协订单落地，再度提振制冷剂,东海证券,2025-01-08,化学原料,https://pdf.dfcfw.com/pdf/H3_AP202501081641858406_1.pdf?1736361049000.pdf
新材料周报：国家发改委成立低空经济发展司，泰和新材对位芳纶项目延期,山西证券,2025-01-07,化学原料,https://pdf.dfcfw.com/pdf/H3_AP202501071641834773_1.pdf?1736259270000.pdf
基础化工行业周报：壳牌关闭新加坡炼油厂，原油、制冷剂R22价格上涨,华安证券,2025-01-06,化学原料,https://pdf.dfcfw.com/pdf/H3_AP202501061641816634_1.pdf?1736175459000.pdf
化工行业周报：下游需求投产加速，或加剧烧碱、乙二醇供需紧平衡态势,开源证券,2025-01-06,化学原料,https://pdf.dfcfw.com/pdf/H3_AP202501061641820715_1.pdf?1736182792000.pdf
氟化工行业周报：制冷剂2025开年迎开门红，趋势仍在向上，把握布局机遇,开源证券,2025-01-05,化学原料,https://pdf.dfcfw.com/pdf/H3_AP202501051641811745_1.pdf?1736084411000.pdf
基础化工行业研究：周期底部，部分行业生态逐步向好,国金证券,2025-01-05,化学原料,https://pdf.dfcfw.com/pdf/H3_AP202501051641811773_1.pdf?1736093734000.pdf
氟化工行业：2024年12月月度观察：2025年制冷剂配额公示，一季度空调排产持续增长,国信证券,2025-01-02,化学原料,https://pdf.dfcfw.com/pdf/H3_AP202501021641507524_1.pdf?1735831398000.pdf
磷化工行业：2024年12月月度观察-磷矿石表观消费量创新高，价格继续高位运行,国信证券,2025-01-02,化学原料,https://pdf.dfcfw.com/pdf/H3_AP202501021641507532_1.pdf?1735831506000.pdf
地产链化工品追踪系列报告（2024-12）：住建部表示将持续用力推动房地产市场止跌回稳，PVA等月均价环比回暖,信达证券,2025-01-02,化学原料,https://pdf.dfcfw.com/pdf/H3_AP202501021641510762_1.pdf?1735836440000.pdf
新能源之生物柴油行业展望：市场需求广阔 国际化布局和打通内循环为发展着力点,大公国际,2024-12-30,化学原料,https://pdf.dfcfw.com/pdf/H3_AP202412301641465860_1.pdf?1735556535000.pdf
基础化工行业周报：山东布局精细化工产业发展，制冷剂R32、R125、R134a价格上涨,华安证券,2024-12-30,化学原料,https://pdf.dfcfw.com/pdf/H3_AP202412301641465733_1.pdf?1735556245000.pdf
化工行业2025年年度策略报告：聚焦内需主线、探寻成长新动能,中国银河,2024-12-30,化学原料,https://pdf.dfcfw.com/pdf/H3_AP202412301641466074_1.pdf?1735572016000.pdf
化工行业转型升级研究专题：国民经济支柱性产业，转型升级持续推进,中国银河,2024-12-26,化学原料,https://pdf.dfcfw.com/pdf/H3_AP202412261641433036_1.pdf?1735213130000.pdf
新材料周报：原材料工业标准提升行动方案出台，凯赛生物强化生物基聚酰胺布局,山西证券,2024-12-25,化学原料,https://pdf.dfcfw.com/pdf/H3_AP202412251641423409_1.pdf?1735142640000.pdf
化工行业行业周报：化工品价差表现较强，把握行业结构性机会,中国银河,2024-12-24,化学原料,https://pdf.dfcfw.com/pdf/H3_AP202412231641405099_1.pdf?1735033229000.pdf
化工行业2025年投资策略：关注供给收缩、内需增长、新兴材料三大主线,华安证券,2024-12-24,化学原料,https://pdf.dfcfw.com/pdf/H3_AP202412241641410491_1.pdf?1735037719000.pdf
化工行业2025年投资策略：供需有望共振，周期或迎拐点,西南证券,2024-12-24,化学原料,https://pdf.dfcfw.com/pdf/H3_AP202412241641411306_1.pdf?1735045765000.pdf
氟化工：2025年制冷剂配额下发，行业高景气持续,华金证券,2024-12-20,化学原料,https://pdf.dfcfw.com/pdf/H3_AP202412191641367940_1.pdf?1734676615000.pdf
化工及新能源材料行业周报：叶酸价格快速上涨,国都证券,2024-12-19,化学原料,https://pdf.dfcfw.com/pdf/H3_AP202412191641364624_1.pdf?1734634026000.pdf
基础化工行业周报：山东化工园区扩区调整加速，原油、天然气价格上涨,华安证券,2024-12-18,化学原料,https://pdf.dfcfw.com/pdf/H3_AP202412181641343448_1.pdf?1734530550000.pdf
轮胎行业月报：原材料价格回落，供需相对平稳,东海证券,2024-12-16,化学原料,https://pdf.dfcfw.com/pdf/H3_AP202412161641310736_1.pdf?1734355373000.pdf
化工行业：中央经济工作会议解读-构建发展新格局，探寻成长新动能,中国银河,2024-12-16,化学原料,https://pdf.dfcfw.com/pdf/H3_AP202412161641310949_1.pdf?1734361277000.pdf
煤化工11月月报：尿素、DMF价格下跌，EVA出口同比高增,华福证券,2024-12-15,化学原料,https://pdf.dfcfw.com/pdf/H3_AP202412151641306423_1.pdf?1734271174000.pdf
四氯化硅：高科技材料，推动半导体与光伏产业发展 头豹词条报告系列,头豹研究院,2024-12-13,化学原料,https://pdf.dfcfw.com/pdf/H3_AP202412131641299714_1.pdf?1734119547000.pdf
其他化学原料：SAF前景广阔，政策驱动迎发展良机,华金证券,2024-12-12,化学原料,https://pdf.dfcfw.com/pdf/H3_AP202412121641271528_1.pdf?1733995087000.pdf
中国真空镀膜行业市场规模测算逻辑模型 头豹词条报告系列,头豹研究院,2024-12-12,化学原料,https://pdf.dfcfw.com/pdf/H3_AP202412121641281805_1.pdf?1734032853000.pdf
生物柴油行业动态报告：船燃打开新市场，出口退税政策边际利好国内生柴企业,民生证券,2024-12-11,化学原料,https://pdf.dfcfw.com/pdf/H3_AP202412111641254205_1.pdf?1733905552000.pdf
氟化工行业月报：下游需求旺盛，制冷剂价格进一步上涨,东海证券,2024-12-10,化学原料,https://pdf.dfcfw.com/pdf/H3_AP202412101641240393_1.pdf?1733842568000.pdf
基础化工行业周报：《西部地区鼓励类产业目录》发布，己二酸价格价差双增,华安证券,2024-12-09,化学原料,https://pdf.dfcfw.com/pdf/H3_AP202412091641223226_1.pdf?1733744467000.pdf
化工行业周报：百菌清企业续发涨价函，赖氨酸价格继续上涨,开源证券,2024-12-09,化学原料,https://pdf.dfcfw.com/pdf/H3_AP202412091641226183_1.pdf?1733761376000.pdf
可持续航空燃料（SAF）深度报告：2025年全球进入SAF爆发性增长元年,国信证券,2024-12-06,化学原料,https://pdf.dfcfw.com/pdf/H3_AP202412061641201356_1.pdf?1733474259000.pdf
氟化工行业：2024年11月月度观察：年末空调排产双位数增长，R125、R134a价格进一步上涨,国信证券,2024-12-06,化学原料,https://pdf.dfcfw.com/pdf/H3_AP202412061641211706_1.pdf?1733509903000.pdf
基础化工行业周报：生物柴油原料价格下降，脂肪醇市场价格延续上涨,开源证券,2024-11-25,化学原料,https://pdf.dfcfw.com/pdf/H3_AP202411251641050974_1.pdf?1732551327000.pdf
企业竞争图谱：2024年太阳能电池背膜 头豹词条报告系列,头豹研究院,2024-11-25,化学原料,https://pdf.dfcfw.com/pdf/H3_AP202411251641057985_1.pdf?1732564792000.pdf
化工行业行业周报：化工品表现偏弱，建议关注结构性机会,中国银河,2024-11-25,化学原料,https://pdf.dfcfw.com/pdf/H3_AP202411251641046666_1.pdf?1732544240000.pdf
氟化工行业周报：制冷剂10月出口行情显著反转，行业或酝酿新一轮涨势,开源证券,2024-11-24,化学原料,https://pdf.dfcfw.com/pdf/H3_AP202411241641042598_1.pdf?1732461645000.pdf
央国企引领专题报告（化工篇）：牢筑压舱石，激发新动能,中国银河,2024-11-21,化学原料,https://pdf.dfcfw.com/pdf/H3_AP202411211641001657_1.pdf?1732201923000.pdf
基础化工行业研究：叶酸、正丙醇价格上行，香兰素反倾销初裁落地,国金证券,2024-11-18,化学原料,https://pdf.dfcfw.com/pdf/H3_AP202411181640929237_1.pdf?1731917044000.pdf
基础化工行业周报：棕榈油短期价格存涨价预期，丁辛醇本周价格上涨,开源证券,2024-11-18,化学原料,https://pdf.dfcfw.com/pdf/H3_AP202411181640932173_1.pdf?1731926786000.pdf
中国非常规油气开发行业市场规模测算逻辑模型 头豹词条报告系列,头豹研究院,2024-11-07,化学原料,https://pdf.dfcfw.com/pdf/H3_AP202411071640771205_1.pdf?1731012014000.pdf
新材料周报：2024年全球芯片市场将增长18.8%，美国宣布禁止向中国半导体、AI、量子领域投资,华福证券,2024-11-04,化学原料,https://pdf.dfcfw.com/pdf/H3_AP202411041640692546_1.pdf?1730717464000.pdf
磷化工行业：2024年10月月度观察：磷矿石价格高位运行，磷化工板块利润同比增长,国信证券,2024-11-04,化学原料,https://pdf.dfcfw.com/pdf/H3_AP202411041640708827_1.pdf?1730755065000.pdf
基础化工行业研究：基本面仍然承压，成长和主题方向重获关注,国金证券,2024-11-03,化学原料,https://pdf.dfcfw.com/pdf/H3_AP202411031640686773_1.pdf?1730671164000.pdf
基础化工行业专题研究：2024年上半年海外钛白粉企业经营情况,天风证券,2024-11-01,化学原料,https://pdf.dfcfw.com/pdf/H3_AP202411011640657813_1.pdf?1730453079000.pdf
氟化工行业：2024年10月月度观察-四季度空调出口排产创新高，三代制冷剂价格进一步上涨,国信证券,2024-10-30,化学原料,https://pdf.dfcfw.com/pdf/H3_AP202410301640589980_1.pdf?1730293536000.pdf
化工企业发展新质生产力面临的机遇和挑战,联合资信,2024-10-30,化学原料,https://pdf.dfcfw.com/pdf/H3_AP202412081641220357_1.pdf?1733688777000.pdf
基础化工行业深度报告：重视当前化工并购重组相关机会,东海证券,2024-10-28,化学原料,https://pdf.dfcfw.com/pdf/H3_AP202410281640545319_1.pdf?1730140327000.pdf
化工行业周报：化工品整体表现偏弱，建议关注结构性机会,中国银河,2024-10-28,化学原料,https://pdf.dfcfw.com/pdf/H3_AP202410281640531680_1.pdf?1730127430000.pdf
氟化工行业周报：巨化股份发布三季报，萤石、制冷剂行情延续向好趋势,开源证券,2024-10-26,化学原料,https://pdf.dfcfw.com/pdf/H3_AP202410261640524719_1.pdf?1730024457000.pdf
基础化工&石油石化行情复盘与投资机会展望,东吴证券,2024-10-24,化学原料,https://pdf.dfcfw.com/pdf/H3_AP202410241640454162_1.pdf?1729777973000.pdf
镁行业月度报告：下游市场需求大幅增加，镁锭产量与价格有望企稳,华宝证券,2024-10-24,化学原料,https://pdf.dfcfw.com/pdf/H3_AP202410241640464983_1.pdf?1729791133000.pdf
氟化工行业研究框架专题报告：供需格局向好，景气周期到来,东海证券,2024-10-22,化学原料,https://pdf.dfcfw.com/pdf/H3_AP202410221640415898_1.pdf?1729623189000.pdf
化工行业周报：价差偏强运行，把握成长确定性机会,中国银河,2024-10-21,化学原料,https://pdf.dfcfw.com/pdf/H3_AP202410211640378086_1.pdf?1729528299000.pdf
基础化工行业深度报告：氨基酸：夯实粮食安全，开拓合成生物,开源证券,2024-10-16,化学原料,https://pdf.dfcfw.com/pdf/H3_AP202410161640321218_1.pdf?1729091669000.pdf
磷矿石行业点评报告：磷矿石维持供需紧平衡，高景气度有望延续,民生证券,2024-10-16,化学原料,https://pdf.dfcfw.com/pdf/H3_AP202410161640330782_1.pdf?1729113318000.pdf
新材料板块2024年中报总结：板块业绩略降，关注生物制造、供需格局优化及折叠屏新趋势,山西证券,2024-10-15,化学原料,https://pdf.dfcfw.com/pdf/H3_AP202410151640296043_1.pdf?1728976659000.pdf
化工行业行业周报：财政政策加码，拥抱化工核心资产,中国银河,2024-10-14,化学原料,https://pdf.dfcfw.com/pdf/H3_AP202410141640281821_1.pdf?1728913361000.pdf
制冷剂行业价格上涨点评：四季度现货价格持续上涨，看好制冷剂高景气延续,民生证券,2024-10-14,化学原料,https://pdf.dfcfw.com/pdf/H3_AP202410141640282413_1.pdf?1728913472000.pdf
地产链化工品追踪系列报告（2024-09）：多地持续优化楼市政策，部分化工品需求仍相对疲软,信达证券,2024-10-09,化学原料,https://pdf.dfcfw.com/pdf/H3_AP202410091640221595_1.pdf?1728470002000.pdf
氟化工行业月报：三代制冷剂政策延续，看好制冷剂景气向上,东海证券,2024-10-09,化学原料,https://pdf.dfcfw.com/pdf/H3_AP202410091640222592_1.pdf?1728482379000.pdf
2024年港股18A：生物科技行业洞察报告：市场表现及监管体系-18A规则推出五年，市场表现如何,头豹研究院,2024-10-09,化学原料,https://pdf.dfcfw.com/pdf/H3_AP202410091640232744_1.pdf?1728504402000.pdf
大化工28大细分高频估值监测,国联证券,2024-10-09,化学原料,https://pdf.dfcfw.com/pdf/H3_AP202410091640235146_1.pdf?1728509383000.pdf
化工行业周报：价差底部徘徊，把握成长确定性机会,中国银河,2024-10-07,化学原料,https://pdf.dfcfw.com/pdf/H3_AP202410011640130983_1.pdf?1728294713000.pdf
企业竞争图谱：2024年绿氢 头豹词条报告系列,头豹研究院,2024-09-27,化学原料,https://pdf.dfcfw.com/pdf/H3_AP202409271640082653_1.pdf?1727467362000.pdf
氟化工行业：2024年9月月度观察：空调排产大幅提升，HFCs外贸价格显著上涨,国信证券,2024-09-27,化学原料,https://pdf.dfcfw.com/pdf/H3_AP202409271640079052_1.pdf?1727463085000.pdf
