研报名称,机构名称,发布时间,行业,研报地址
化工行业可转债双周报：永和转债、科思转债近期或将达成强赎条件,太平洋,2024-03-25,化学制品,https://pdf.dfcfw.com/pdf/H3_AP202403251628068537_1.pdf?1711360723000.pdf
化工新材料行业周报：鼎际得年产20万吨POE项目开工，滨海能源拟投建太阳能光伏电池片等项目,德邦证券,2024-03-24,化学制品,https://pdf.dfcfw.com/pdf/H3_AP202403241628064316_1.pdf?1711293221000.pdf
基础化工行业周报：粘胶长丝行业格局向好，饲料级磷酸钙盐价格上行,开源证券,2024-03-24,化学制品,https://pdf.dfcfw.com/pdf/H3_AP202403241628064929_1.pdf?1711298837000.pdf
大炼化周报：化工品价差整体收窄 长丝下游采购仍相对谨慎,东吴证券,2024-03-24,化学制品,https://pdf.dfcfw.com/pdf/H3_AP202403241628064932_1.pdf?1711355210000.pdf
基础化工行业周报：万华化学2023年业绩同比增长，R32、R134a价格上涨,华安证券,2024-03-24,化学制品,https://pdf.dfcfw.com/pdf/H3_AP202403241628065810_1.pdf?1711316644000.pdf
基础化工行业周报：液氯、赖氨酸、R22等价格上涨，中国优势企业迎来长周期向上机遇,国海证券,2024-03-24,化学制品,https://pdf.dfcfw.com/pdf/H3_AP202403241628065982_1.pdf?1711363567000.pdf
基础化工行业周报：主要产油国宣布将减产延长至二季度末，关注行业供给侧结构优化,上海证券,2024-03-21,化学制品,https://pdf.dfcfw.com/pdf/H3_AP202403211627428544_1.pdf?1711012925000.pdf
化工新材料行业周报：“东数西算”甘肃节点算力突破5000P，关注上游特种树脂,甬兴证券,2024-03-21,化学制品,https://pdf.dfcfw.com/pdf/H3_AP202403211627431765_1.pdf?1711028701000.pdf
基础化工行业动态跟踪：高耗能行业供给侧节能减排大势所趋，利好龙头,华福证券,2024-03-21,化学制品,https://pdf.dfcfw.com/pdf/H3_AP202403211627427553_1.pdf?1711009823000.pdf
基础化工行业简评报告：硫酸价格涨幅居前，卫星化学2023年归母净利润同比增长55.1%,首创证券,2024-03-19,化学制品,https://pdf.dfcfw.com/pdf/H3_AP202403191627110034_1.pdf?1710837644000.pdf
基础化工行业周报：天然橡胶_氧气价格上涨，丙烯酸异辛酯价格下跌,中邮证券,2024-03-19,化学制品,https://pdf.dfcfw.com/pdf/H3_AP202403191627111343_1.pdf?1710839222000.pdf
聚酯纤维 头豹词条报告系列,头豹研究院,2024-03-19,化学制品,https://pdf.dfcfw.com/pdf/H3_AP202403191627182174_1.pdf?1710877185000.pdf
合成纤维 头豹词条报告系列,头豹研究院,2024-03-19,化学制品,https://pdf.dfcfw.com/pdf/H3_AP202403191627182309_1.pdf?1710877185000.pdf
基础化工行业双周报：空调生产旺季来临，制冷剂价格有望维持强势,东莞证券,2024-03-18,化学制品,https://pdf.dfcfw.com/pdf/H3_AP202403181626958080_1.pdf?1710747182000.pdf
基础化工行业周报：原油价格强势上涨，维生素价格有望持续回升,太平洋,2024-03-18,化学制品,https://pdf.dfcfw.com/pdf/H3_AP202403181626981199_1.pdf?1710795905000.pdf
基础化工行业周报：原油价格上涨，建议继续关注低估值高股息中国海油,华鑫证券,2024-03-18,化学制品,https://pdf.dfcfw.com/pdf/H3_AP202403181626997131_1.pdf?1710801736000.pdf
基础化工行业研究周报：CCUS领域国家重点研发项目启动，天然橡胶、二氯甲烷价格上涨,天风证券,2024-03-18,化学制品,https://pdf.dfcfw.com/pdf/H3_AP202403181626965931_1.pdf?1710773940000.pdf
基础化工行业周报：合成生物学周报：2'-FL、甜菊糖苷等多个成分获批，十部委再将生物质能源与材料列入产业目录,华安证券,2024-03-18,化学制品,https://pdf.dfcfw.com/pdf/H3_AP202403181626967923_1.pdf?1710778253000.pdf
基础化工行业周专题：COFs专题研究：大有可为的有机多孔材料,国联证券,2024-03-17,化学制品,https://pdf.dfcfw.com/pdf/H3_AP202403151626867507_1.pdf?1710669454000.pdf
制冷剂行业深度：供需格局持续优化，制冷剂进入景气向上周期,华安证券,2024-03-17,化学制品,https://pdf.dfcfw.com/pdf/H3_AP202403171626954269_1.pdf?1710695719000.pdf
新材料行业双周报：石墨烯导热膜性能优异，未来应用前景可期,开源证券,2024-03-17,化学制品,https://pdf.dfcfw.com/pdf/H3_AP202403171626953665_1.pdf?1710688615000.pdf
化工行业周报：国际油价上涨，涤纶长丝价格窄幅下跌,中银证券,2024-03-17,化学制品,https://pdf.dfcfw.com/pdf/H3_AP202403171626954137_1.pdf?1710692630000.pdf
化工行业周报：应急管理部印发重磅通知或拉开新一轮供给侧改革序幕，先进工艺双氧水企业或率先受益,开源证券,2024-03-17,化学制品,https://pdf.dfcfw.com/pdf/H3_AP202403171626954794_1.pdf?1710707233000.pdf
基础化工行业周报：国务院发布以旧换新行动法案，原油、纯苯价格上涨,华安证券,2024-03-17,化学制品,https://pdf.dfcfw.com/pdf/H3_AP202403171626955182_1.pdf?1710715462000.pdf
基础化工行业周报：氨基酸、维生素、PX等价格上涨，轮胎设备景气有望上行,国海证券,2024-03-17,化学制品,https://pdf.dfcfw.com/pdf/H3_AP202403171626955233_1.pdf?1710746880000.pdf
基础化工材料制品行业专题报告：OLED下游需求持续增长，终端材料逐步实现进口替代,海通国际,2024-03-14,化学制品,https://pdf.dfcfw.com/pdf/H3_AP202403141626725512_1.pdf?1710435699000.pdf
化工新材料行业周报：Claude 3大模型发布，AI“装备竞赛”催生特种树脂需求,甬兴证券,2024-03-13,化学制品,https://pdf.dfcfw.com/pdf/H3_AP202403131626652773_1.pdf?1710355567000.pdf
蛋氨酸系列报告之一：供给改善叠加补库周期，蛋氨酸价格中枢有望上移,华安证券,2024-03-13,化学制品,https://pdf.dfcfw.com/pdf/H3_AP202403131626654478_1.pdf?1710358132000.pdf
基础化工行业周报：萤石供给或将收紧，看好上游核心资源品景气度上行,上海证券,2024-03-13,化学制品,https://pdf.dfcfw.com/pdf/H3_AP202403131626658502_1.pdf?1710366416000.pdf
基础化工行业简评报告：液氯价格涨幅居前，华恒生物子公司拟对外投资新项目,首创证券,2024-03-12,化学制品,https://pdf.dfcfw.com/pdf/H3_AP202403121626418500_1.pdf?1710232637000.pdf
中泰化工周度观点24W10：OPEC+自愿减产延期，支撑油价偏强震荡,中泰证券,2024-03-12,化学制品,https://pdf.dfcfw.com/pdf/H3_AP202403121626420329_1.pdf?1710239458000.pdf
基础化工行业周报：工业气体_碳酸锂涨价，关注工业气体投资机会,中邮证券,2024-03-12,化学制品,https://pdf.dfcfw.com/pdf/H3_AP202403121626423980_1.pdf?1710241957000.pdf
基础化工材料制品行业跟踪报告：制冷剂配额发布，制冷剂价格持续上涨,海通国际,2024-03-12,化学制品,https://pdf.dfcfw.com/pdf/H3_AP202403121626448826_1.pdf?1710258827000.pdf
基础化工债券&定增&ETF双周报：贵州轮胎拟建设越南年产600万条半钢子午线轮胎智能制造项目,海通国际,2024-03-12,化学制品,https://pdf.dfcfw.com/pdf/H3_AP202403121626458034_1.pdf?1710273061000.pdf
基础化工行业七天部门发文：加快推动制造业绿色化发展，合成氨、三氯甲烷价格上涨,天风证券,2024-03-11,化学制品,https://pdf.dfcfw.com/pdf/H3_AP202403111626208709_1.pdf?1710142752000.pdf
基础化工行业日报：金属锂价格上涨，AI材料&中特估股价表现较好,中邮证券,2024-03-11,化学制品,https://pdf.dfcfw.com/pdf/H3_AP202403111626212209_1.pdf?1710152516000.pdf
合成生物学周报：上海化工区建大宗生物化学品转化平台，生物制造菌株空间工程取得重要进展,华安证券,2024-03-11,化学制品,https://pdf.dfcfw.com/pdf/H3_AP202403111626213024_1.pdf?1710156289000.pdf
万华化学基本面周度动态跟踪：董事长两会四条建议，MDI价差保持稳定,华安证券,2024-03-11,化学制品,https://pdf.dfcfw.com/pdf/H3_AP202403111626225333_1.pdf?1710180160000.pdf
基础化工行业专题研究：行业基本面情况跟踪,天风证券,2024-03-11,化学制品,https://pdf.dfcfw.com/pdf/H3_AP202403111626230752_1.pdf?1710183946000.pdf
基础化工行业周报：丁二烯焦炭等价格上涨，建议继续关注涤纶长丝、轮胎板块,华鑫证券,2024-03-11,化学制品,https://pdf.dfcfw.com/pdf/H3_AP202403111626263359_1.pdf?1710187841000.pdf
基础化工行业周报：磷肥价格上涨，水利基建有望拉动民爆景气,太平洋,2024-03-11,化学制品,https://pdf.dfcfw.com/pdf/H3_AP202403111626214734_1.pdf?1710166770000.pdf
化工行业周报：制冷剂、EVA等价格继续上扬，USTMA预计2024年美国轮胎总出货量同比增长1.1%,信达证券,2024-03-10,化学制品,https://pdf.dfcfw.com/pdf/H3_AP202403101626199831_1.pdf?1710080275000.pdf
基础化工行业周报：荣盛集团两大煤化工项目启动，纯碱价格、价差双增,华安证券,2024-03-10,化学制品,https://pdf.dfcfw.com/pdf/H3_AP202403101626202419_1.pdf?1710142236000.pdf
化工行业周报：国际油价下跌，钛白粉价格上涨,中银证券,2024-03-10,化学制品,https://pdf.dfcfw.com/pdf/H3_AP202403101626202444_1.pdf?1710103483000.pdf
基础化工行业周报：碳酸锂、制冷剂、维生素价格持续上涨，华恒生物拟投建三支链氨基酸等项目,国海证券,2024-03-10,化学制品,https://pdf.dfcfw.com/pdf/H3_AP202403101626202710_1.pdf?1710146753000.pdf
化工新材料周报：“商业航天”首次写入政府工作报告，1月全球半导体行业销售额同增15.2%,国海证券,2024-03-10,化学制品,https://pdf.dfcfw.com/pdf/H3_AP202403101626202466_1.pdf?1710146059000.pdf
蛋氨酸景气改善进行中？,国联证券,2024-03-09,化学制品,https://pdf.dfcfw.com/pdf/H3_AP202403091626190993_1.pdf?1710020260000.pdf
基础化工行业月报：化工品价格持续回暖，关注煤化工、轻烃化工与磷化工行业,中原证券,2024-03-08,化学制品,https://pdf.dfcfw.com/pdf/H3_AP202403081626021034_1.pdf?1709889591000.pdf
基础化工行业周报：有机硅价格上涨，轮胎板块业绩表现亮眼,上海证券,2024-03-06,化学制品,https://pdf.dfcfw.com/pdf/H3_AP202403061625658064_1.pdf?1709718329000.pdf
基础化工行业周报：制冷剂价格持续上涨，MDI价差改善,上海证券,2024-03-06,化学制品,https://pdf.dfcfw.com/pdf/H3_AP202403061625659298_1.pdf?1709719843000.pdf
化工新材料行业周报：Open AI推出Sora模型，AI升级迭代催生特种树脂需求,甬兴证券,2024-03-06,化学制品,https://pdf.dfcfw.com/pdf/H3_AP202403061625659315_1.pdf?1709720402000.pdf
磷矿石行业专题报告：2024年供需紧张局面仍将延续,国海证券,2024-03-06,化学制品,https://pdf.dfcfw.com/pdf/H3_AP202403061625668801_1.pdf?1709730244000.pdf
环氧树脂 头豹词条报告系列,头豹研究院,2024-03-06,化学制品,https://pdf.dfcfw.com/pdf/H3_AP202403061625695947_1.pdf?1709754619000.pdf
基础化工行业简评报告：硫酸价格涨幅居前，森麒麟2023年归母净利润同比增长70.88%,首创证券,2024-03-05,化学制品,https://pdf.dfcfw.com/pdf/H3_AP202403051625452455_1.pdf?1709629184000.pdf
合成生物学周报：中科新材拟引入苏美达资本战略投资，秸秆转糖纯度获重大突破,华安证券,2024-03-05,化学制品,https://pdf.dfcfw.com/pdf/H3_AP202403051625455181_1.pdf?1709634827000.pdf
基础化工行业周报：台积电晶圆产能预计年底翻倍高通2023年专利授权量位居国内前三,国海证券,2024-03-05,化学制品,https://pdf.dfcfw.com/pdf/H3_AP202403051625523780_1.pdf?1709667382000.pdf
基础化工行业周报：有机硅价格上涨，制冷剂景气度提升,太平洋,2024-03-04,化学制品,https://pdf.dfcfw.com/pdf/H3_AP202403041625297934_1.pdf?1709549856000.pdf
基础化工行业周报：有机硅_生胶涨价，把握节后涨价行情,中邮证券,2024-03-04,化学制品,https://pdf.dfcfw.com/pdf/H3_AP202403041625290446_1.pdf?1709550707000.pdf
基础化工行业双周报：板块迎来反弹，制冷剂价格强势,东莞证券,2024-03-04,化学制品,https://pdf.dfcfw.com/pdf/H3_AP202403041625214606_1.pdf?1709537526000.pdf
基础化工行业周报：有机硅、磷酸一铵等化工品价格上涨，涤纶长丝市场延续上行,开源证券,2024-03-04,化学制品,https://pdf.dfcfw.com/pdf/H3_AP202403041625214642_1.pdf?1709537526000.pdf
基础化工新材料行业双周报：PI泡沫综合性能优异，未来应用前景可期,开源证券,2024-03-04,化学制品,https://pdf.dfcfw.com/pdf/H3_AP202403041625214645_1.pdf?1709537526000.pdf
基础化工行业周报：MDI价格上涨，轮胎开工率提升,太平洋,2024-03-04,化学制品,https://pdf.dfcfw.com/pdf/H3_AP202403041625377454_1.pdf?1709559019000.pdf
基础化工行业周报：分化开始，继续推轮胎和错杀的优质中小盘成长标的,国金证券,2024-03-04,化学制品,https://pdf.dfcfw.com/pdf/H3_AP202403041625214806_1.pdf?1709563382000.pdf
化工行业周报：制冷剂等价格继续上扬，普利司通商用胎退出中国市场,信达证券,2024-03-03,化学制品,https://pdf.dfcfw.com/pdf/H3_AP202403031625207582_1.pdf?1709465924000.pdf
基础化工行业生态环境部：力推碳交易市场扩围，有机硅、烧碱价格上涨,天风证券,2024-03-03,化学制品,https://pdf.dfcfw.com/pdf/H3_AP202403031625209450_1.pdf?1709479051000.pdf
基础化工行业周报：MDI、磷肥、制冷剂等价格上涨，关注轮胎的补库需求,国海证券,2024-03-03,化学制品,https://pdf.dfcfw.com/pdf/H3_AP202403031625210452_1.pdf?1709538742000.pdf
基础化工行业周报：七部门推动制造业绿色化发展，MDI、制冷剂R22价差扩大,华安证券,2024-03-03,化学制品,https://pdf.dfcfw.com/pdf/H3_AP202403031625210368_1.pdf?1709542318000.pdf
化工行业周报：海外天然气价格上涨，MDI、甲醇价格上涨,中银证券,2024-03-03,化学制品,https://pdf.dfcfw.com/pdf/H3_AP202403031625211018_1.pdf?1709536498000.pdf
油气行业2024年2月月报：地缘政治冲突加剧，原油价格持续上行,国信证券,2024-03-03,化学制品,https://pdf.dfcfw.com/pdf/H3_AP202403031625209398_1.pdf?1709480519000.pdf
化工系列研究（十八）：出海研究：从日本住友沙特拉比格炼化项目看我国炼化出海,东海证券,2024-02-29,化学制品,https://pdf.dfcfw.com/pdf/H3_AP202402291624139899_1.pdf?1709237979000.pdf
电解液行业深度研究：电解液周期性研究（系列一）：行业底部到来，看好龙头穿越周期成长,太平洋,2024-02-28,化学制品,https://pdf.dfcfw.com/pdf/H3_AP202402281623994161_1.pdf?1709148226000.pdf
数码印花墨水 头豹词条报告系列,头豹研究院,2024-02-28,化学制品,https://pdf.dfcfw.com/pdf/H3_AP202402281623995490_1.pdf?1709149366000.pdf
基础化工行业简评报告：硫磺价格涨幅居前，华恒生物2023年归母净利润同比快速增长,首创证券,2024-02-27,化学制品,https://pdf.dfcfw.com/pdf/H3_AP202402271623722922_1.pdf?1709023373000.pdf
合成生物学周报：湖南衡阳绿色低碳盐碱产业基地项目开工，DON降解酶取得新突破,华安证券,2024-02-27,化学制品,https://pdf.dfcfw.com/pdf/H3_AP202402271623731782_1.pdf?1709045111000.pdf
基础化工行业周报：涤纶长丝、粘胶短纤、氨纶价格上涨，钛白粉、蛋氨酸报价上行,开源证券,2024-02-26,化学制品,https://pdf.dfcfw.com/pdf/H3_AP202402261623573104_1.pdf?1708934883000.pdf
基础化工行业周报：万华化学福建工业园停产检修，MDI价格价差双增,华安证券,2024-02-26,化学制品,https://pdf.dfcfw.com/pdf/H3_AP202402261623573149_1.pdf?1708934981000.pdf
基础化工行业研究：市场大幅向上，再谈轮胎、优质小盘股、氟化工预期差,国金证券,2024-02-26,化学制品,https://pdf.dfcfw.com/pdf/H3_AP202402261623573146_1.pdf?1708946127000.pdf
基础化工行业周报：MDI、炭黑价格上涨，看好配额约束下制冷剂持续强势,国海证券,2024-02-26,化学制品,https://pdf.dfcfw.com/pdf/H3_AP202402261623573676_1.pdf?1708938163000.pdf
基础化工行业研究：设备升级和消费品以旧换新刺激需求，上游材料有望受益,国金证券,2024-02-26,化学制品,https://pdf.dfcfw.com/pdf/H3_AP202402261623573799_1.pdf?1708940314000.pdf
基础化工行业周报：聚合MDI、制冷剂等价格上涨，建议继续关注制冷剂、轮胎板块,华鑫证券,2024-02-26,化学制品,https://pdf.dfcfw.com/pdf/H3_AP202402261623580434_1.pdf?1708961745000.pdf
化工行业运行指标跟踪：2023年12月数据,天风证券,2024-02-26,化学制品,https://pdf.dfcfw.com/pdf/H3_AP202402261623571862_1.pdf?1708954450000.pdf
化工出口链行业报告：海外有望进入补库周期，化工需求拐点向上,华安证券,2024-02-26,化学制品,https://pdf.dfcfw.com/pdf/H3_AP202402261623579503_1.pdf?1708959819000.pdf
基础化工行业周报：MDI、炭黑价格上涨，看好配额约束下制冷剂持,国海证券,2024-02-25,化学制品,https://pdf.dfcfw.com/pdf/H3_AP202402251623566848_1.pdf?1708937296000.pdf
化工行业周报：制冷剂等产品价格上扬，通用股份等胎企订单旺盛,信达证券,2024-02-25,化学制品,https://pdf.dfcfw.com/pdf/H3_AP202402251623563215_1.pdf?1708866230000.pdf
基础化工行业周报：节后基础化工持续反弹，关注氟化工&原油涨价,中邮证券,2024-02-25,化学制品,https://pdf.dfcfw.com/pdf/H3_AP202402251623566757_1.pdf?1708886557000.pdf
基础化工行业周专题（2.19-2.25）如何看待当下制冷剂价格和板块估值？,国联证券,2024-02-24,化学制品,https://pdf.dfcfw.com/pdf/H3_AP202402241623477686_1.pdf?1708733488000.pdf
含氟制冷剂行业点评：底部反转且格局优化，制冷剂开启景气复苏周期,国信证券,2024-02-23,化学制品,https://pdf.dfcfw.com/pdf/H3_AP202402231623155911_1.pdf?1708694942000.pdf
基础化工行业周报：丁二烯、苯胺价格上涨，森麒麟拟回购注销股份,国海证券,2024-02-21,化学制品,https://pdf.dfcfw.com/pdf/H3_AP202402211622485430_1.pdf?1708521444000.pdf
基础化工行业研究周报：国家发展改革委部署春耕化肥保供稳价工作，R134a、DMF价格上涨,天风证券,2024-02-20,化学制品,https://pdf.dfcfw.com/pdf/H3_AP202402201622408873_1.pdf?1708427935000.pdf
化工行业周报：国际油价上涨，尿素、制冷剂价格上涨,中银证券,2024-02-20,化学制品,https://pdf.dfcfw.com/pdf/H3_AP202402201622410104_1.pdf?1708439275000.pdf
基础化工行业双周报：行业估值处于历史底部，关注供需格局良好领域,东莞证券,2024-02-19,化学制品,https://pdf.dfcfw.com/pdf/H3_AP202402191622380014_1.pdf?1708325940000.pdf
化学制品行业深度研究：OLED-人机交互首选材料，向中大尺寸渗透,天风证券,2024-02-19,化学制品,https://pdf.dfcfw.com/pdf/H3_AP202402191622400873_1.pdf?1708371955000.pdf
基础化工行业研究周报：市场强劲反弹，当下就是优质小盘股买点,国金证券,2024-02-18,化学制品,https://pdf.dfcfw.com/pdf/H3_AP202402181622303658_1.pdf?1708254005000.pdf
基础化工行业周报：MOFs结构特性优异，应用领域兼具热度与难度,开源证券,2024-02-18,化学制品,https://pdf.dfcfw.com/pdf/H3_AP202402181622309399_1.pdf?1708253792000.pdf
基础化工行业月报：化工品价格有所回暖，关注煤化工、轻烃化工与轮胎行业,中原证券,2024-02-18,化学制品,https://pdf.dfcfw.com/pdf/H3_AP202402181622312075_1.pdf?1708252337000.pdf
基础化工行业周报：估值底部&盈利底部，持续看好节后行情,中邮证券,2024-02-17,化学制品,https://pdf.dfcfw.com/pdf/H3_AP202402171622240490_1.pdf?1708213501000.pdf
基础化工行业点评报告：多种维生素报价上行，蛋氨酸厂商检修或提价，关注饲料添加剂行业供给端扰动,开源证券,2024-02-07,化学制品,https://pdf.dfcfw.com/pdf/H3_AP202402071621022029_1.pdf?1707321554000.pdf
化工和新材料行业点评：苹果Vision Pro正式上线，有望催生光学材料市场需求,甬兴证券,2024-02-07,化学制品,https://pdf.dfcfw.com/pdf/H3_AP202404101630105452_1.pdf?1712759064000.pdf
制冷剂行业深度报告（二）：拐点已现，行则将至,开源证券,2024-02-06,化学制品,https://pdf.dfcfw.com/pdf/H3_AP202402061620909571_1.pdf?1707212141000.pdf
基础化工行业2024年年度策略：周期筑底，成长可待,天风证券,2024-02-06,化学制品,https://pdf.dfcfw.com/pdf/H3_AP202402061620950493_1.pdf?1707234370000.pdf
基础化工行业周报：市场底部区域，当下就是优质标的买点,国金证券,2024-02-05,化学制品,https://pdf.dfcfw.com/pdf/H3_AP202402051620559230_1.pdf?1707124382000.pdf
化工行业周报：国际油价下跌，制冷剂价格上涨,中银证券,2024-02-05,化学制品,https://pdf.dfcfw.com/pdf/H3_AP202402051620559428_1.pdf?1707124863000.pdf
基础化工行业研究周报：工信部召开2024年化肥生产保供工作座谈会，R410a、丁二烯价格上涨,天风证券,2024-02-05,化学制品,https://pdf.dfcfw.com/pdf/H3_AP202402051620560165_1.pdf?1707126614000.pdf
化学品毒理检测 头豹词条报告系列,头豹研究院,2024-02-05,化学制品,https://pdf.dfcfw.com/pdf/H3_AP202402041620554450_1.pdf?1707122935000.pdf
化工行业周报20240204国际油价下跌，制冷剂价格上涨,中银证券,2024-02-05,化学制品,https://pdf.dfcfw.com/pdf/H3_AP202402051620558197_1.pdf?1707122102000.pdf
油气行业2024年1月月报：全球供给影响，原油价格上行,国信证券,2024-02-05,化学制品,https://pdf.dfcfw.com/pdf/H3_AP202402051620565532_1.pdf?1707153554000.pdf
合成生物学周报：七部门发文推动生物制造发展，丙二酰辅酶A生物合成取得新突破,华安证券,2024-02-05,化学制品,https://pdf.dfcfw.com/pdf/H3_AP202402051620567962_1.pdf?1707153554000.pdf
基础化工行业深度报告：光伏行业估值见底，库存周期拐点将至,开源证券,2024-02-04,化学制品,https://pdf.dfcfw.com/pdf/H3_AP202402041620274647_1.pdf?1707041519000.pdf
化工新材料行业周报：苹果Vision Pro预售开启，有望催生光学材料市场需求,甬兴证券,2024-02-04,化学制品,https://pdf.dfcfw.com/pdf/H3_AP202402041620497499_1.pdf?1707050471000.pdf
基础化工行业周报：R410a、R125价格大幅上涨，关注氟化工投资机会,中邮证券,2024-02-04,化学制品,https://pdf.dfcfw.com/pdf/H3_AP202402041620555027_1.pdf?1707081880000.pdf
基础化工行业周报：2023年石油和化学工业经济运行低位回升稳中有进，万华化学(福建)TDI项目一期拟技改扩建,开源证券,2024-02-04,化学制品,https://pdf.dfcfw.com/pdf/H3_AP202402041620551917_1.pdf?1707061601000.pdf
化工&新材料行业周报：轮胎企业业绩预增，海外市场竞争力不断提升,太平洋,2024-02-04,化学制品,https://pdf.dfcfw.com/pdf/H3_AP202404101630105420_1.pdf?1712760353000.pdf
化工行业点评报告：配额落地推动三代制冷剂价格持续上涨,甬兴证券,2024-02-02,化学制品,https://pdf.dfcfw.com/pdf/H3_AP202402021620068914_1.pdf?1706883067000.pdf
化工新材料行业周报：日本瑞翁冰见工厂继续停产，关注COC国产化进度,甬兴证券,2024-02-01,化学制品,https://pdf.dfcfw.com/pdf/H3_AP202402011619994270_1.pdf?1706775839000.pdf
基础化工行业专题研究：23Q4持仓配置环比下降，持续聚焦细分龙头,天风证券,2024-01-31,化学制品,https://pdf.dfcfw.com/pdf/H3_AP202401311619773553_1.pdf?1706692544000.pdf
化工行业2024年2月投资策略：看好油气、氟化工、轮胎、民爆的投资方向,国信证券,2024-01-31,化学制品,https://pdf.dfcfw.com/pdf/H3_AP202401311619768856_1.pdf?1706692748000.pdf
民爆行业专题：供需格局持续改善，民爆行业景气度上行,国信证券,2024-01-31,化学制品,https://pdf.dfcfw.com/pdf/H3_AP202401311619768864_1.pdf?1706694379000.pdf
基础化工行业：美国商务部对泰国乘用车和轻卡轮胎反倾销终裁落地,南京证券,2024-01-31,化学制品,https://pdf.dfcfw.com/pdf/H3_AP202401311619783935_1.pdf?1706710493000.pdf
基础化工行业简评报告：卫星化学业绩快速增长，森麒麟双反终裁落地,首创证券,2024-01-30,化学制品,https://pdf.dfcfw.com/pdf/H3_AP202401301619500280_1.pdf?1706606571000.pdf
