研报名称,机构名称,发布时间,行业,研报地址
基础化工行业研究周报：工信部印发工业重点行业领域设备更新和技术改造指南，辛醇、正丁醇价格上涨,天风证券,2024-09-23,化学制品,https://pdf.dfcfw.com/pdf/H3_AP202409231639982801_1.pdf?1727107854000.pdf
基础化工行业周报：磷矿石市场行情暂稳，阿科力千吨级高透光材料生产线试生产,开源证券,2024-09-23,化学制品,https://pdf.dfcfw.com/pdf/H3_AP202409231639983618_1.pdf?1727109523000.pdf
新材料行业2024年中报总结：电子材料静待复苏，尼龙、氟化液板块表现亮眼,中泰证券,2024-09-23,化学制品,https://pdf.dfcfw.com/pdf/H3_AP202409231639975293_1.pdf?1727082746000.pdf
基础化工行业研究：美联储降息，天然橡胶表现亮眼,国金证券,2024-09-23,化学制品,https://pdf.dfcfw.com/pdf/H3_AP202409231639975311_1.pdf?1727092556000.pdf
化工行业周报：化工品价差表现较弱，建议关注结构性机会,中国银河,2024-09-23,化学制品,https://pdf.dfcfw.com/pdf/H3_AP202409231639980507_1.pdf?1727102336000.pdf
化工行业周报（-）：辛醇价格大幅上扬，纯碱需求承压价格下行,民生证券,2024-09-22,化学制品,https://pdf.dfcfw.com/pdf/H3_AP202409221639974090_1.pdf?1727039781000.pdf
基础化工行业周报：工信部公布重点行业领域设备更新指南，PTA、MDI、PVC价差修复,华安证券,2024-09-22,化学制品,https://pdf.dfcfw.com/pdf/H3_AP202409221639974106_1.pdf?1727040524000.pdf
新材料周报：Q3全球半导体收入环比增长8.5%，MMA-PMMA产业成本控制与高端市场战略并行,华福证券,2024-09-22,化学制品,https://pdf.dfcfw.com/pdf/H3_AP202409221639974155_1.pdf?1727074898000.pdf
化工行业周报：国际油价上涨，天然橡胶价格上涨,中银证券,2024-09-22,化学制品,https://pdf.dfcfw.com/pdf/H3_AP202409221639974297_1.pdf?1727081950000.pdf
基础化工行业周报：三美股份拟建2万吨PVDF产品，巴斯夫拟启动分拆业务上市计划,华福证券,2024-09-22,化学制品,https://pdf.dfcfw.com/pdf/H3_AP202409221639972952_1.pdf?1727016680000.pdf
钛白粉9月月报：钛白粉价差有所改善，关注龙头龙佰集团,华福证券,2024-09-22,化学制品,https://pdf.dfcfw.com/pdf/H3_AP202409221639972962_1.pdf?1727010448000.pdf
基础化工行业2024年半年报总结：2024Q2收入盈利同比略增，资本开支已连续3个季度负增,中泰证券,2024-09-22,化学制品,https://pdf.dfcfw.com/pdf/H3_AP202409221639973081_1.pdf?1727014424000.pdf
基础化工：农化巨头抢先布局核酸农药，润丰股份任命Alejandro Crespo为全球业务总经理,华福证券,2024-09-21,化学制品,https://pdf.dfcfw.com/pdf/H3_AP202409211639972450_1.pdf?1727002676000.pdf
基础化工：生态环境部公布2025年制冷剂配额方案，巨化股份预计下半年制冷剂出口形势较好,华福证券,2024-09-20,化学制品,https://pdf.dfcfw.com/pdf/H3_AP202409201639951127_1.pdf?1726820169000.pdf
涤纶长丝定期跟踪：长丝库存环比有所下降，下游织机开工率回暖,华福证券,2024-09-20,化学制品,https://pdf.dfcfw.com/pdf/H3_AP202409201639960896_1.pdf?1726851861000.pdf
化工行业2024半年报业绩回顾：24H1行业呈现回暖态势，制冷剂、轮胎、煤化工等板块业绩亮眼,上海证券,2024-09-20,化学制品,https://pdf.dfcfw.com/pdf/H3_AP202409201639954208_1.pdf?1726838296000.pdf
基础化工行业研究：2025年制冷剂配额征求意见稿出台，供给管控持续,国金证券,2024-09-19,化学制品,https://pdf.dfcfw.com/pdf/H3_AP202409191639932117_1.pdf?1726743655000.pdf
基础化工行业事件点评：2025年消耗臭氧层物质和氢氟碳化物配额总量设定和分配方案征求意见稿发布,东莞证券,2024-09-19,化学制品,https://pdf.dfcfw.com/pdf/H3_AP202409191639941369_1.pdf?1726766912000.pdf
基础化工行业简评：R22配额削减，三代制冷剂配额政策延续，看好制冷剂景气向上,东海证券,2024-09-19,化学制品,https://pdf.dfcfw.com/pdf/H3_AP202409191639943053_1.pdf?1726771066000.pdf
基础化工行业研究周报：8月份工业生产者出厂价格同比下降1.8%，三氯蔗糖、丁二烯价格上涨,天风证券,2024-09-18,化学制品,https://pdf.dfcfw.com/pdf/H3_AP202409181639910702_1.pdf?1726647749000.pdf
基础化工行业专题研究：24Q2盈利同环比提升、在建工程增速显著回落,天风证券,2024-09-18,化学制品,https://pdf.dfcfw.com/pdf/H3_AP202409181639910700_1.pdf?1726647933000.pdf
基础化工行业周报：2025年制冷剂配额方案（征求意见稿）发布，聚合MDI价格上涨,华安证券,2024-09-18,化学制品,https://pdf.dfcfw.com/pdf/H3_AP202409181639910563_1.pdf?1726653031000.pdf
2024年第四季度化工行业供需较为均衡，盈利处于高位,大公国际,2024-09-18,化学制品,https://pdf.dfcfw.com/pdf/H3_AP202409181639911806_1.pdf?1726656117000.pdf
化工行业周报：国际油价企稳，三氯蔗糖、安赛蜜提价,中银证券,2024-09-18,化学制品,https://pdf.dfcfw.com/pdf/H3_AP202409181639912631_1.pdf?1726656006000.pdf
化工行业周报：三氯蔗糖价格继续上涨，原油价格有所下跌,民生证券,2024-09-18,化学制品,https://pdf.dfcfw.com/pdf/H3_AP202409181639922720_1.pdf?1726684362000.pdf
2025年制冷剂配额征求意见稿点评：制冷剂配额长期约束，看好R22及R32景气度延续,国信证券,2024-09-18,化学制品,https://pdf.dfcfw.com/pdf/H3_AP202409181639924455_1.pdf?1726689862000.pdf
新材料产业周报：朱雀三号可重复使用火箭完成飞行试验,国海证券,2024-09-18,化学制品,https://pdf.dfcfw.com/pdf/H3_AP202409181639927178_1.pdf?1726730608000.pdf
基础化工行业定期报告：尿素、醋酸价格承压，关注碳酸二甲酯库存去化,华福证券,2024-09-17,化学制品,https://pdf.dfcfw.com/pdf/H3_AP202409171639907450_1.pdf?1726653211000.pdf
基础化工：纤维行业整体价格承压，出口同比增长,华福证券,2024-09-17,化学制品,https://pdf.dfcfw.com/pdf/H3_AP202409171639907452_1.pdf?1726644769000.pdf
基础化工：聚合MDI与TDI价差环比改善，冰箱冰柜出口维持高增,华福证券,2024-09-17,化学制品,https://pdf.dfcfw.com/pdf/H3_AP202409171639907453_1.pdf?1726652176000.pdf
基础化工行业双周报：三氯蔗糖、安赛蜜价格上调,东莞证券,2024-09-16,化学制品,https://pdf.dfcfw.com/pdf/H3_AP202409161639890583_1.pdf?1726495339000.pdf
氟化工行业点评报告：制冷剂2025年配额方案征求意见稿下发，看好制冷剂景气向上趋势延续,开源证券,2024-09-16,化学制品,https://pdf.dfcfw.com/pdf/H3_AP202409161639895434_1.pdf?1726562062000.pdf
基础化工：烧碱价格边际改善，地产拖累PVC需求,华福证券,2024-09-16,化学制品,https://pdf.dfcfw.com/pdf/H3_AP202409161639895556_1.pdf?1726569894000.pdf
基础化工行业周报：丁二烯价格持续上涨，盐湖股份实控人拟变更,国海证券,2024-09-15,化学制品,https://pdf.dfcfw.com/pdf/H3_AP202409151639888992_1.pdf?1726442742000.pdf
化工行业专题报告：国内盈利企稳回升，产能扩张放缓，欧美多数企业盈利仍在底部——2024H1半年报总结,国海证券,2024-09-13,化学制品,https://pdf.dfcfw.com/pdf/H3_AP202409121639860228_1.pdf?1726213867000.pdf
化工及新能源材料行业周报：氨纶中报披露完毕，华峰化学成本优势明显,国都证券,2024-09-13,化学制品,https://pdf.dfcfw.com/pdf/H3_AP202409131639862828_1.pdf?1726218488000.pdf
基础化工行业月报：化工品价格回调态势放缓，关注三条主线,中原证券,2024-09-13,化学制品,https://pdf.dfcfw.com/pdf/H3_AP202409131639875470_1.pdf?1726250315000.pdf
石油石化行业2024年半年报总结：三桶油业绩表现亮眼，一口价托底长丝盈利,中泰证券,2024-09-12,化学制品,https://pdf.dfcfw.com/pdf/H3_AP202409121639844586_1.pdf?1726134992000.pdf
基础化工行业深度报告：2024Q2化工板块业绩实现同环比增长，未来有望持续修复,开源证券,2024-09-12,化学制品,https://pdf.dfcfw.com/pdf/H3_AP202409121639847727_1.pdf?1726150135000.pdf
基础化工行业周报：国际油价下跌，制冷剂、苯胺涨幅居前,上海证券,2024-09-12,化学制品,https://pdf.dfcfw.com/pdf/H3_AP202409121639850599_1.pdf?1726154497000.pdf
化工行业周报：三氯蔗糖价格继续上涨，两省公布“两高”目录,民生证券,2024-09-09,化学制品,https://pdf.dfcfw.com/pdf/H3_AP202409091639787575_1.pdf?1725840978000.pdf
基础化工行业周报：苯胺、天然气价格上涨，万华化学MDI配套甲醛项目环评第二次公示,国海证券,2024-09-09,化学制品,https://pdf.dfcfw.com/pdf/H3_AP202409091639788127_1.pdf?1725876266000.pdf
基础化工行业研究周报：“四省一区”化工产业发展战略联盟成立，三氯蔗糖、聚合MDI价格上涨,天风证券,2024-09-09,化学制品,https://pdf.dfcfw.com/pdf/H3_AP202409091639789057_1.pdf?1725875138000.pdf
基础化工行业研究周报：继续关注价值方向，静待政策催化,国金证券,2024-09-09,化学制品,https://pdf.dfcfw.com/pdf/H3_AP202409091639790552_1.pdf?1725897542000.pdf
卫星化学及烯烃行业周度动态跟踪,华安证券,2024-09-09,化学制品,https://pdf.dfcfw.com/pdf/H3_AP202409091639793196_1.pdf?1725903640000.pdf
基础化工行业周报：万华化学匈牙利装置复产，制冷剂R143a价格上涨,华安证券,2024-09-09,化学制品,https://pdf.dfcfw.com/pdf/H3_AP202409091639793255_1.pdf?1725894594000.pdf
基础化工行业周报：合成生物学周报：华灏化学、源天生物布局全球首个千吨级生物PTT，安徽首支生物制造子基金设立,华安证券,2024-09-09,化学制品,https://pdf.dfcfw.com/pdf/H3_AP202409091639792932_1.pdf?1725923350000.pdf
新材料周报：全球半导体销售额大幅增长，PEEK中间体企业拟挂牌新三板,华福证券,2024-09-08,化学制品,https://pdf.dfcfw.com/pdf/H3_AP202409081639787042_1.pdf?1725832066000.pdf
化工新材料产业周报：2024Q2全球半导体设备出货金额同增4%，台积电预计2027年实现CoW-SoW量产,国海证券,2024-09-08,化学制品,https://pdf.dfcfw.com/pdf/H3_AP202409081639787187_1.pdf?1725832672000.pdf
基础化工行业周报：R134a、天然气等涨幅居前，建议继续关注石化板块和轮胎板块,华鑫证券,2024-09-08,化学制品,https://pdf.dfcfw.com/pdf/H3_AP202409081639787112_1.pdf?1725828344000.pdf
基础化工行业周报：三井化学退出碳粉粘合剂树脂业务，中石化生物基聚烯烃试运成功投产,华福证券,2024-09-08,化学制品,https://pdf.dfcfw.com/pdf/H3_AP202409081639785989_1.pdf?1725816357000.pdf
化工行业周报：国际油价下跌，有机硅DMC、聚合MDI价格上涨,中银证券,2024-09-08,化学制品,https://pdf.dfcfw.com/pdf/H3_AP202409081639786171_1.pdf?1725805941000.pdf
氟化工行业周报：R32外贸价格持续拉涨，制冷剂外贸市场继续回暖,开源证券,2024-09-08,化学制品,https://pdf.dfcfw.com/pdf/H3_AP202409081639786413_1.pdf?1725814837000.pdf
基础化工行业周报：三氯蔗糖大幅提价，万华柠檬醛成功投产,上海证券,2024-09-06,化学制品,https://pdf.dfcfw.com/pdf/H3_AP202409061639767990_1.pdf?1725621756000.pdf
基础化工行业2024年半年报业绩综述：Q2整体业绩同环比改善，但内部分化明显,东莞证券,2024-09-06,化学制品,https://pdf.dfcfw.com/pdf/H3_AP202409061639768385_1.pdf?1725629299000.pdf
化工价值报告系列（一）：“卷王”的胜出,国金证券,2024-09-06,化学制品,https://pdf.dfcfw.com/pdf/H3_AP202409061639770763_1.pdf?1725634599000.pdf
化工行业2024年半年报总结：周期行业供需格局有望改善，优选高景气新材料产品,太平洋,2024-09-06,化学制品,https://pdf.dfcfw.com/pdf/H3_AP202409061639773922_1.pdf?1725641010000.pdf
基础化工行业简评报告：行业单季度业绩改善，未来供需格局有望好转,首创证券,2024-09-05,化学制品,https://pdf.dfcfw.com/pdf/H3_AP202409051639751034_1.pdf?1725547868000.pdf
基础化工行业周报：三氯蔗糖价格调涨，聚合MDI、天然橡胶价格持续上行,太平洋,2024-09-03,化学制品,https://pdf.dfcfw.com/pdf/H3_AP202409031639704103_1.pdf?1725353875000.pdf
地产链化工品追踪系列报告（2024-08）：8月百城二手房价跌幅收窄，MDI、TDI均价环比上行,信达证券,2024-09-03,化学制品,https://pdf.dfcfw.com/pdf/H3_AP202409031639709367_1.pdf?1725373732000.pdf
化工行业周报：磷矿石、维生素市场高位持稳运行，关注供给约束方向,华龙证券,2024-09-03,化学制品,https://pdf.dfcfw.com/pdf/H3_AP202409031639712189_1.pdf?1725381076000.pdf
基础化工行业专题研究：化工行业运行指标跟踪-2024年7月数据,天风证券,2024-09-03,化学制品,https://pdf.dfcfw.com/pdf/H3_AP202409031639719748_1.pdf?1725397474000.pdf
基础化工行业周报：顺丁橡胶价格上涨，万华化学全球单套产能最大柠檬醛装置成功投产,国海证券,2024-09-02,化学制品,https://pdf.dfcfw.com/pdf/H3_AP202409021639684884_1.pdf?1725272658000.pdf
卫星化学及烯烃行业周度动态跟踪,华安证券,2024-09-02,化学制品,https://pdf.dfcfw.com/pdf/H3_AP202409021639685766_1.pdf?1725277425000.pdf
基础化工行业周报：合成氨、顺丁橡胶等涨幅居前，建议继续关注石化板块和轮胎板块,华鑫证券,2024-09-02,化学制品,https://pdf.dfcfw.com/pdf/H3_AP202409021639690898_1.pdf?1725291383000.pdf
基础化工行业事件点评：三氯蔗糖价格上调50%，主流企业预计停产检修两个月,东莞证券,2024-09-02,化学制品,https://pdf.dfcfw.com/pdf/H3_AP202409021639691818_1.pdf?1725293734000.pdf
基础化工行业研究周报：1-7月份化学原料和化学制品制造业利润增长4.8%，三氯蔗糖、DMF价格上涨,天风证券,2024-09-02,化学制品,https://pdf.dfcfw.com/pdf/H3_AP202409021639695806_1.pdf?1725297753000.pdf
化工行业周报：三氯蔗糖价格涨幅居前，万华化学柠檬醛开车成功,民生证券,2024-09-02,化学制品,https://pdf.dfcfw.com/pdf/H3_AP202409021639702208_1.pdf?1725316193000.pdf
化工行业周报：国际油价震荡，三氯蔗糖企业调价,中银证券,2024-09-01,化学制品,https://pdf.dfcfw.com/pdf/H3_AP202409011639681328_1.pdf?1725220667000.pdf
基础化工行业双周报：三氯蔗糖主力企业发布涨价函，涨幅达50%,东莞证券,2024-09-01,化学制品,https://pdf.dfcfw.com/pdf/H3_AP202409011639681858_1.pdf?1725225919000.pdf
基础化工行业周报：维生素价格震荡，关注相关投资机会,中邮证券,2024-09-01,化学制品,https://pdf.dfcfw.com/pdf/H3_AP202409011639682039_1.pdf?1725233975000.pdf
基础化工行业研究：涨价品种表现亮眼，看好优质龙头的长期成长,国金证券,2024-09-01,化学制品,https://pdf.dfcfw.com/pdf/H3_AP202409011639679281_1.pdf?1725198918000.pdf
基础化工行业研究：市场反弹，三氯蔗糖、VE价格上行,国金证券,2024-09-01,化学制品,https://pdf.dfcfw.com/pdf/H3_AP202409011639679837_1.pdf?1725271182000.pdf
基础化工行业周报：万华柠檬醛成功投产，隆华新材聚醚改扩建装置开车成功,华福证券,2024-09-01,化学制品,https://pdf.dfcfw.com/pdf/H3_AP202409011639680283_1.pdf?1725223657000.pdf
基础化工行业周报：高性能有机颜料供需偏紧，德国辉柏赫的破产程序或于近期发生新进展,开源证券,2024-09-01,化学制品,https://pdf.dfcfw.com/pdf/H3_AP202409011639680533_1.pdf?1725209771000.pdf
基础化工行业简评报告：维生素A涨幅居前，华鲁恒升上半年利润同比增长,首创证券,2024-08-28,化学制品,https://pdf.dfcfw.com/pdf/H3_AP202408281639505434_1.pdf?1724838243000.pdf
基础化工行业周报：HFCs配额再调整，三代制冷剂涨价趋势不改,上海证券,2024-08-28,化学制品,https://pdf.dfcfw.com/pdf/H3_AP202408281639508024_1.pdf?1724844428000.pdf
基础化工行业事件点评：生态环境部分配R32内用生产配额3.5万吨，有助维护空调生产稳定性,东莞证券,2024-08-28,化学制品,https://pdf.dfcfw.com/pdf/H3_AP202408281639508946_1.pdf?1724853606000.pdf
基础化工行业研究周报：商务部，对多国卤化丁基胶续征反倾销税，维生素A、醋酸价格上涨,天风证券,2024-08-27,化学制品,https://pdf.dfcfw.com/pdf/H3_AP202408271639470101_1.pdf?1724748087000.pdf
基础化工行业周报：维A价格持续上行，聚合MDI价格小幅上涨,太平洋,2024-08-27,化学制品,https://pdf.dfcfw.com/pdf/H3_AP202408271639475077_1.pdf?1724767011000.pdf
卫星化学及烯烃行业周度动态跟踪,华安证券,2024-08-26,化学制品,https://pdf.dfcfw.com/pdf/H3_AP202408261639445529_1.pdf?1724658754000.pdf
基础化工行业周报：板块防守为主，优先关注需求刚性方向,国金证券,2024-08-26,化学制品,https://pdf.dfcfw.com/pdf/H3_AP202408261639447498_1.pdf?1724667710000.pdf
合成生物学周报：马斯克旗下公司宣布生物基材料新合作，bp投资连云港嘉澳助力生物燃料,华安证券,2024-08-26,化学制品,https://pdf.dfcfw.com/pdf/H3_AP202408261639448664_1.pdf?1724703178000.pdf
化工行业周报：MDI价格上涨，PC行业开工率回升,民生证券,2024-08-26,化学制品,https://pdf.dfcfw.com/pdf/H3_AP202408261639455206_1.pdf?1724692821000.pdf
化工行业周报：赛轮、确成发布业绩喜报，国际油价下跌,信达证券,2024-08-25,化学制品,https://pdf.dfcfw.com/pdf/H3_AP202408251639441085_1.pdf?1724586258000.pdf
基础化工行业周报：醋酸、甲醇、苯酚价格上涨，赛轮轮胎、华鲁恒升净利润同比增长,国海证券,2024-08-25,化学制品,https://pdf.dfcfw.com/pdf/H3_AP202408251639443897_1.pdf?1724619808000.pdf
化工行业周报：海外天然气及TDI价格下跌，部分维生素继续涨价,中银证券,2024-08-25,化学制品,https://pdf.dfcfw.com/pdf/H3_AP202408251639444026_1.pdf?1724620497000.pdf
基础化工行业周报：维生素价格持续上涨，关注相关投资机会,中邮证券,2024-08-25,化学制品,https://pdf.dfcfw.com/pdf/H3_AP202408251639444985_1.pdf?1724658445000.pdf
基础化工行业周报：乙烯、醋酸等涨幅居前，建议继续关注石化板块和轮胎板块,华鑫证券,2024-08-25,化学制品,https://pdf.dfcfw.com/pdf/H3_AP202408251639445000_1.pdf?1724628076000.pdf
基础化工行业周报：国际石油巨头bp拟入股连云港嘉澳新能源，浙石化α-烯烃中试装置投料成功,华福证券,2024-08-25,化学制品,https://pdf.dfcfw.com/pdf/H3_AP202408251639441526_1.pdf?1724596143000.pdf
基础化工行业周报：随着金九银十旺季到来，看好粘胶长丝景气上行,开源证券,2024-08-25,化学制品,https://pdf.dfcfw.com/pdf/H3_AP202408251639443143_1.pdf?1724606941000.pdf
基础化工行业周报：国际油价震荡运行，碳酸锂价格大幅下跌,上海证券,2024-08-23,化学制品,https://pdf.dfcfw.com/pdf/H3_AP202408231639428265_1.pdf?1724445414000.pdf
化工行业2024年中期策略：供需略改善，关注油气油服、新材料与景气上行子行业,中银证券,2024-08-21,化学制品,https://pdf.dfcfw.com/pdf/H3_AP202408211639379421_1.pdf?1724260147000.pdf
基础化工行业周报：西南水电建设提升民爆行业关注度，供应偏紧纯MDI价格上涨,太平洋,2024-08-20,化学制品,https://pdf.dfcfw.com/pdf/H3_AP202408201639348331_1.pdf?1724142520000.pdf
基础化工行业研究：冬去春来，天然橡胶价格有望步入上行周期,国金证券,2024-08-20,化学制品,https://pdf.dfcfw.com/pdf/H3_AP202408201639351345_1.pdf?1724162835000.pdf
化工行业周报：旺季备货将至，行业有望触底回升,华龙证券,2024-08-20,化学制品,https://pdf.dfcfw.com/pdf/H3_AP202408201639360615_1.pdf?1724186188000.pdf
合成生物学周报：浙江开始推进非粮生物质项目高效利用，德曲妥珠单抗在国内获批胃癌适应症,华安证券,2024-08-20,化学制品,https://pdf.dfcfw.com/pdf/H3_AP202408201639367472_1.pdf?1724223983000.pdf
化工：涤纶长丝延续下行走势 煤制烯烃盈利能力扩大,东吴证券,2024-08-19,化学制品,https://pdf.dfcfw.com/pdf/H3_AP202408191639326514_1.pdf?1724057637000.pdf
基础化工行业研究：绿色转型意见发布，静待板块向上催化剂,国金证券,2024-08-19,化学制品,https://pdf.dfcfw.com/pdf/H3_AP202408191639328165_1.pdf?1724062627000.pdf
基础化工行业简评报告：液氯涨幅居前，凯赛生物上半年利润同比增长,首创证券,2024-08-19,化学制品,https://pdf.dfcfw.com/pdf/H3_AP202408191639333247_1.pdf?1724082376000.pdf
基础化工行业周报：甘氨酸、聚合MDI价格上涨，宝丰能源、振华股份净利润同比增长,国海证券,2024-08-19,化学制品,https://pdf.dfcfw.com/pdf/H3_AP202408191639343450_1.pdf?1724105641000.pdf
基础化工行业研究周报：7月份化学原料和化学制品制造业增加值同比增长8.6%，维生素、纯MDI价格上涨,天风证券,2024-08-19,化学制品,https://pdf.dfcfw.com/pdf/H3_AP202408191639344655_1.pdf?1724100626000.pdf
化工新材料产业周报：台积电通过296亿美元资本预算，2024年我国商业航天规模望超2.3万亿元,国海证券,2024-08-19,化学制品,https://pdf.dfcfw.com/pdf/H3_AP202408191639345428_1.pdf?1724138406000.pdf
基础化工行业周报：硫酸、二氯甲烷等涨幅居前，建议继续关注石化板块和轮胎板块,华鑫证券,2024-08-19,化学制品,https://pdf.dfcfw.com/pdf/H3_AP202408191639345491_1.pdf?1724106767000.pdf
化工行业周报：维生素VK3价格继续上扬，纯碱需求承压价格下行,民生证券,2024-08-19,化学制品,https://pdf.dfcfw.com/pdf/H3_AP202408191639330119_1.pdf?1724076597000.pdf
基础化工行业周报：维生素价格持续上涨，关注相关投资机会,中邮证券,2024-08-19,化学制品,https://pdf.dfcfw.com/pdf/H3_AP202408191639330445_1.pdf?1724082855000.pdf
新材料周报：珂玛科技强势登A，2030全球GaN功率元件市场规模或升至43.76亿美元,华福证券,2024-08-18,化学制品,https://pdf.dfcfw.com/pdf/H3_AP202408181639325576_1.pdf?1724020133000.pdf
化工行业周报：国际油价上涨，维生素价格震荡,中银证券,2024-08-18,化学制品,https://pdf.dfcfw.com/pdf/H3_AP202408181639325617_1.pdf?1724010149000.pdf
基础化工行业周报：万华化学1H24营收同比增长10.8%，原油、天然气价格上涨,华安证券,2024-08-18,化学制品,https://pdf.dfcfw.com/pdf/H3_AP202408181639326066_1.pdf?1724018027000.pdf
基础化工行业周报：瑞联新材等公司发布半年度报告，生物法L-蛋氨酸产业化进度持续推进,开源证券,2024-08-18,化学制品,https://pdf.dfcfw.com/pdf/H3_AP202408181639324857_1.pdf?1723997158000.pdf
基础化工：硅化工7月定期跟踪：工业硅价格底部震荡，有机硅仍显疲软,华福证券,2024-08-18,化学制品,https://pdf.dfcfw.com/pdf/H3_AP202408181639324183_1.pdf?1723988749000.pdf
基础化工行业周报：国内最大电池电解液溶剂项目中交，中国天楹绿氢项目签约,华福证券,2024-08-18,化学制品,https://pdf.dfcfw.com/pdf/H3_AP202408181639324252_1.pdf?1724008273000.pdf
基础化工行业双周报：国务院发布关于加快经济社会发展全面绿色转型的意见,东莞证券,2024-08-18,化学制品,https://pdf.dfcfw.com/pdf/H3_AP202408181639324797_1.pdf?1723995511000.pdf
基础化工行业周报：三部委发文禁止新建受控HFCs产能，维生素、烟酰胺涨幅居前,上海证券,2024-08-17,化学制品,https://pdf.dfcfw.com/pdf/H3_AP202408171639323280_1.pdf?1723927442000.pdf
化工新材料行业周报：“硅岛”地震提升电子化学品关注度，新政策或拉动碳纤维需求,太平洋,2024-08-15,化学制品,https://pdf.dfcfw.com/pdf/H3_AP202408151639286312_1.pdf?1723734730000.pdf
基础化工行业月报：油价震荡下跌，化工品价格延续回调态势,中原证券,2024-08-14,化学制品,https://pdf.dfcfw.com/pdf/H3_AP202408141639272769_1.pdf?1723657572000.pdf
基础化工行业简评报告：维生素A涨幅居前，金石资源半年利润同比增长,首创证券,2024-08-13,化学制品,https://pdf.dfcfw.com/pdf/H3_AP202408131639249334_1.pdf?1723536039000.pdf
化工行业周报：原油、维生素、TDI价格向上，全面绿色转型系统部署发布,华龙证券,2024-08-13,化学制品,https://pdf.dfcfw.com/pdf/H3_AP202408131639249459_1.pdf?1723542212000.pdf
涤纶长丝7月跟踪：库存环比去化显著，价格上涨带动价差扩大,华福证券,2024-08-13,化学制品,https://pdf.dfcfw.com/pdf/H3_AP202408131639249430_1.pdf?1723542111000.pdf
化工行业行业周报：价差整体表现偏弱，关注化工结构性机会,中国银河,2024-08-13,化学制品,https://pdf.dfcfw.com/pdf/H3_AP202408131639251330_1.pdf?1723546288000.pdf
基础化工行业点评：中央层面首次对加快经济社会发展全面绿色转型进行系统部署,民生证券,2024-08-13,化学制品,https://pdf.dfcfw.com/pdf/H3_AP202408131639251486_1.pdf?1723548264000.pdf
基础化工行业周报：维生素、纯MDI价格上涨，民爆行业整合加速,太平洋,2024-08-13,化学制品,https://pdf.dfcfw.com/pdf/H3_AP202408131639252141_1.pdf?1723559932000.pdf
基础化工行业研究周报：强化“双碳”标准计量体系建设方案发布，维生素、TDI价格上涨,天风证券,2024-08-12,化学制品,https://pdf.dfcfw.com/pdf/H3_AP202408121639233614_1.pdf?1723451337000.pdf
外贸化学品运输专题：小而美，景气度稳步提升,西南证券,2024-08-12,化学制品,https://pdf.dfcfw.com/pdf/H3_AP202408121639233632_1.pdf?1723460174000.pdf
