研报名称,机构名称,发布时间,行业,研报地址
基础化工行业研究：业绩边际改善，看好顺周期龙头和轮胎板块,国金证券,2024-05-06,化学制品,https://pdf.dfcfw.com/pdf/H3_AP202405061632474771_1.pdf?1715003023000.pdf
基础化工行业研究周报：一季度化学原料和制品制造业利润同比下降3.5%，VA、纯碱价格上涨,天风证券,2024-05-06,化学制品,https://pdf.dfcfw.com/pdf/H3_AP202405061632497131_1.pdf?1715030200000.pdf
基础化工行业周报：能耗管控政策持续加码，关注涤纶长丝供给侧扰动,开源证券,2024-05-05,化学制品,https://pdf.dfcfw.com/pdf/H3_AP202405051632451554_1.pdf?1714925105000.pdf
基础化工行业专题：基础化工行业专题化工板块2023年年报及2024年一季报业绩分析,国联证券,2024-05-05,化学制品,https://pdf.dfcfw.com/pdf/H3_AP202405051632457777_1.pdf?1714985804000.pdf
基础化工行业周报：万华福建工业园MDI装置完成技改扩能，制冷剂R32、纯碱价格上涨,华安证券,2024-05-05,化学制品,https://pdf.dfcfw.com/pdf/H3_AP202405051632458712_1.pdf?1714952117000.pdf
化工新材料行业周报：三代制冷剂价格延续强势，碳纤维价格上涨,太平洋,2024-04-30,化学制品,https://pdf.dfcfw.com/pdf/H3_AP202404301631732327_1.pdf?1714469501000.pdf
基础化工行业周报：合成生物学周报：合成生物学CNSB重大项目启动，华恒生物PDO项目实现高品质连续量产,华安证券,2024-04-30,化学制品,https://pdf.dfcfw.com/pdf/H3_AP202404301631885198_1.pdf?1714476052000.pdf
化工新材料产业周报：星舰预计5月再次试飞，宁德时代发布神行PLUS,国海证券,2024-04-29,化学制品,https://pdf.dfcfw.com/pdf/H3_AP202404281631554499_1.pdf?1714378881000.pdf
聚酯板块偏弱运行化工品价差整体改善,东吴证券,2024-04-29,化学制品,https://pdf.dfcfw.com/pdf/H3_AP202404291631555619_1.pdf?1714382264000.pdf
基础化工行业专题研究：“升级”是化工领域单位GDP能耗降低的主要推动力,天风证券,2024-04-29,化学制品,https://pdf.dfcfw.com/pdf/H3_AP202404291631567177_1.pdf?1714387262000.pdf
基础化工行业周报：三代制冷剂延续强势，纯碱现货价格继续上涨,太平洋,2024-04-29,化学制品,https://pdf.dfcfw.com/pdf/H3_AP202404291631571969_1.pdf?1714394771000.pdf
化工：万华化学基本面周度动态跟踪：北美部分MDI装置停产，福建扩建36万TDI项目,华安证券,2024-04-29,化学制品,https://pdf.dfcfw.com/pdf/H3_AP202404291631627092_1.pdf?1714422230000.pdf
基础化工行业周报：纯碱尿素等涨幅居前，建议继续关注轮胎、油气开采板块,华鑫证券,2024-04-29,化学制品,https://pdf.dfcfw.com/pdf/H3_AP202404291631673706_1.pdf?1714430151000.pdf
基础化工行业研究周报：金融助力石化业绿色低碳转型，MMA、纯碱价格上涨,天风证券,2024-04-29,化学制品,https://pdf.dfcfw.com/pdf/H3_AP202404291631574531_1.pdf?1714400355000.pdf
基础化工行业周报：关注制冷剂涨价及供给缺口下TMA涨价机会,中邮证券,2024-04-28,化学制品,https://pdf.dfcfw.com/pdf/H3_AP202404281631517278_1.pdf?1714302652000.pdf
化工行业周报：国际油价止跌企稳，纯碱价格上涨,中银证券,2024-04-28,化学制品,https://pdf.dfcfw.com/pdf/H3_AP202404281631546572_1.pdf?1714327810000.pdf
基础化工行业周报：液态金属电池性能优异，产业化应用有望加速,开源证券,2024-04-28,化学制品,https://pdf.dfcfw.com/pdf/H3_AP202404281631551779_1.pdf?1714338773000.pdf
生物制造行业点评：生物制造政策有望近期出台，合成生物产业迎来重要拐点,华安证券,2024-04-28,化学制品,https://pdf.dfcfw.com/pdf/H3_AP202404281631552181_1.pdf?1714341260000.pdf
基础化工行业周报：贵州大型磷煤化工一体化项目签约，制冷剂R32、R22价格上涨,华安证券,2024-04-28,化学制品,https://pdf.dfcfw.com/pdf/H3_AP202404281631521127_1.pdf?1714315404000.pdf
基础化工行业周报：看好草甘膦等农药海外补库渐启，粘胶长丝报价上行,开源证券,2024-04-28,化学制品,https://pdf.dfcfw.com/pdf/H3_AP202404281631518234_1.pdf?1714309661000.pdf
氟化工行业周报：巨化股份、金石资源一季度业绩大幅增长，制冷剂、萤石趋势上行态势不变,开源证券,2024-04-28,化学制品,https://pdf.dfcfw.com/pdf/H3_AP202404281631545020_1.pdf?1714324759000.pdf
基础化工行业双周报：一季报密集披露，制冷剂、轮胎等业绩改善明显,东莞证券,2024-04-28,化学制品,https://pdf.dfcfw.com/pdf/H3_AP202404281631545795_1.pdf?1714326002000.pdf
基础化工行业周专题（4.22—4.28）如何看待COFs在锂电领域的应用前景？,国联证券,2024-04-27,化学制品,https://pdf.dfcfw.com/pdf/H3_AP202404271631495241_1.pdf?1714220407000.pdf
基础化工行业研究：价值回归风格再现，建议重点关注传统龙头和轮胎板块,国金证券,2024-04-25,化学制品,https://pdf.dfcfw.com/pdf/H3_AP202404251631271007_1.pdf?1714059975000.pdf
卫星化学及烯烃行业周度动态跟踪,华安证券,2024-04-24,化学制品,https://pdf.dfcfw.com/pdf/H3_AP202404241631115907_1.pdf?1713958880000.pdf
基础化工行业日报：基础化工板块指数下跌，焦炭价格上涨,中邮证券,2024-04-24,化学制品,https://pdf.dfcfw.com/pdf/H3_AP202404241631115195_1.pdf?1713956523000.pdf
基础化工行业周报：海外化工装置异动较多，重点关注烯烃、维生素、TMA等行业,上海证券,2024-04-24,化学制品,https://pdf.dfcfw.com/pdf/H3_AP202404241631119166_1.pdf?1713972944000.pdf
基础化工行业周报：合成生物学周报：岱山生物基材料生产基地启航，万吨长碳链二元酸项目奠基开工,华安证券,2024-04-24,化学制品,https://pdf.dfcfw.com/pdf/H3_AP202404241631162837_1.pdf?1713994265000.pdf
基础化工行业周报：麦芽酚、TMA价格持续上涨，关注TMA投资机会,中邮证券,2024-04-23,化学制品,https://pdf.dfcfw.com/pdf/H3_AP202404231631033343_1.pdf?1713862945000.pdf
基础化工行业七部门联合发文：提升磷石膏综合利用水平，麦芽酚、尿素价格上涨,天风证券,2024-04-23,化学制品,https://pdf.dfcfw.com/pdf/H3_AP202404231631034448_1.pdf?1713864210000.pdf
基础化工：万华化学基本面周度动态跟踪：万华一季度业绩环比改善，3月份国内聚合MDI出口11.3万吨,华安证券,2024-04-23,化学制品,https://pdf.dfcfw.com/pdf/H3_AP202404231631041040_1.pdf?1713880611000.pdf
基础化工行业周报：尿素甘氨酸等涨幅居前，建议继续关注轮胎、油气开采板块,华鑫证券,2024-04-23,化学制品,https://pdf.dfcfw.com/pdf/H3_AP202404231631061549_1.pdf?1713899055000.pdf
聚酯链维持偏弱运行 化工品价差整体上涨,东吴证券,2024-04-22,化学制品,https://pdf.dfcfw.com/pdf/H3_AP202404211630935159_1.pdf?1713773327000.pdf
基础化工行业日报：基础化工板块指数上涨，关注供给偏紧、TMA涨价延续,中邮证券,2024-04-22,化学制品,https://pdf.dfcfw.com/pdf/H3_AP202404221630945644_1.pdf?1713778802000.pdf
基础化工行业研究：化工关注度明显提升，建议重点关注轮胎和涨价品种,国金证券,2024-04-22,化学制品,https://pdf.dfcfw.com/pdf/H3_AP202404221630945626_1.pdf?1713781437000.pdf
基础化工行业周报：合成生物学周报：合成生物CVC基金落地，万吨长碳链二元酸项目奠基开工,华安证券,2024-04-22,化学制品,https://pdf.dfcfw.com/pdf/H3_AP202404221630997697_1.pdf?1713818960000.pdf
基础化工行业周报：磷矿石价格维持高位，纯碱现货价格上涨,太平洋,2024-04-22,化学制品,https://pdf.dfcfw.com/pdf/H3_AP202404221630958595_1.pdf?1713793529000.pdf
化工新材料行业周报：低空经济前景光明，生物能源及材料未来可期,太平洋,2024-04-22,化学制品,https://pdf.dfcfw.com/pdf/H3_AP202404221630958594_1.pdf?1713789968000.pdf
新材料产业周报：国内首台大芯片先进封装专用光刻机交付入厂 2024Q1新能源汽车市占率达31.1%,国海证券,2024-04-21,化学制品,https://pdf.dfcfw.com/pdf/H3_AP202404211630937877_1.pdf?1713773040000.pdf
基础化工行业周报：金融监管总局等三部门联合发文助力新型工业化，制冷剂R32、尿素价格上涨,华安证券,2024-04-21,化学制品,https://pdf.dfcfw.com/pdf/H3_AP202404211630934274_1.pdf?1713729304000.pdf
基础化工行业周报：丙烯酸乙酯、丙烯腈、尿素价格上涨，轮胎及轮胎设备景气延续上行,国海证券,2024-04-21,化学制品,https://pdf.dfcfw.com/pdf/H3_AP202404211630934321_1.pdf?1713774241000.pdf
化工行业周报：国际油价下跌，尿素价格强势上行,中银证券,2024-04-21,化学制品,https://pdf.dfcfw.com/pdf/H3_AP202404211630934353_1.pdf?1713731611000.pdf
化工行业周报：供需边际双重改善，建议超配化工板块,开源证券,2024-04-21,化学制品,https://pdf.dfcfw.com/pdf/H3_AP202404211630935595_1.pdf?1713734353000.pdf
基础化工行业周专题（4.15—4.21）TMA价格上涨弹性、持续性如何？,国联证券,2024-04-20,化学制品,https://pdf.dfcfw.com/pdf/H3_AP202404201630821493_1.pdf?1713643890000.pdf
基础化工行业日报：基础化工指数反弹，关注旺季制冷剂涨价,中邮证券,2024-04-18,化学制品,https://pdf.dfcfw.com/pdf/H3_AP202404181630501631_1.pdf?1713435444000.pdf
基础化工行业周报：地缘局势紧张国际油价高位震荡，维生素、醋酸等品种价格上涨,上海证券,2024-04-18,化学制品,https://pdf.dfcfw.com/pdf/H3_AP202404181630505282_1.pdf?1713455816000.pdf
基础化工行业日报：基础化工板块指数下跌，关注麦芽酚涨价,中邮证券,2024-04-17,化学制品,https://pdf.dfcfw.com/pdf/H3_AP202404171630393061_1.pdf?1713351885000.pdf
基础化工行业点评报告：产能投放高峰已过，消费品以旧换新有望带动需求高增，PC行业或迎拐点,开源证券,2024-04-16,化学制品,https://pdf.dfcfw.com/pdf/H3_AP202404151630259752_1.pdf?1713253618000.pdf
化工行业周报：原料成本上涨，提振中游化工产品价格,华龙证券,2024-04-16,化学制品,https://pdf.dfcfw.com/pdf/H3_AP202404161630270339_1.pdf?1713261202000.pdf
基础化工行业日报：基础化工板块小幅下跌，关注尿素涨价,中邮证券,2024-04-16,化学制品,https://pdf.dfcfw.com/pdf/H3_AP202404161630272603_1.pdf?1713267142000.pdf
基础化工行业周报：苯胺尿素等涨幅居前，原油价格高位震荡，建议继续关注轮胎、油气开采板块,华鑫证券,2024-04-16,化学制品,https://pdf.dfcfw.com/pdf/H3_AP202404161630273120_1.pdf?1713273623000.pdf
基础化工行业研究：新国九条出台，高质量发展成为主线，重点关注行业优质龙头企业,国金证券,2024-04-16,化学制品,https://pdf.dfcfw.com/pdf/H3_AP202404161630273166_1.pdf?1713274270000.pdf
合成生物学周报：上海合成生物学创新中心揭牌，有机硒化物合成取得新进展,华安证券,2024-04-16,化学制品,https://pdf.dfcfw.com/pdf/H3_AP202404161630273578_1.pdf?1713278146000.pdf
化工：碳纤维需求有望受益于低空经济政策持续推进,五矿证券,2024-04-16,化学制品,https://pdf.dfcfw.com/pdf/H3_AP202404161630274245_1.pdf?1713278782000.pdf
化工行业周报：吉林化纤6万吨碳纤维项目预计5月投产，华润尼龙66项目即将完工,德邦证券,2024-04-15,化学制品,https://pdf.dfcfw.com/pdf/H3_AP202404151630210833_1.pdf?1713170280000.pdf
基础化工行业双周报：加快发展新质生产力，高端新材料国产替代空间广阔,东莞证券,2024-04-15,化学制品,https://pdf.dfcfw.com/pdf/H3_AP202404151630210853_1.pdf?1713170280000.pdf
基础化工行业：4月空调排产亮眼，三代制冷剂价格稳中向上,南京证券,2024-04-15,化学制品,https://pdf.dfcfw.com/pdf/H3_AP202404151630211018_1.pdf?1713170426000.pdf
其他化学制品Ⅲ：供应短缺，TMA强势上涨,华金证券,2024-04-15,化学制品,https://pdf.dfcfw.com/pdf/H3_AP202404151630214608_1.pdf?1713181114000.pdf
卫星化学及烯烃行业周度动态跟踪,华安证券,2024-04-15,化学制品,https://pdf.dfcfw.com/pdf/H3_AP202404151630243886_1.pdf?1713222311000.pdf
基础化工行业周报：七部门推动石化化工老旧装置安全改造，尿素价格价差双增,华安证券,2024-04-15,化学制品,https://pdf.dfcfw.com/pdf/H3_AP202404151630216853_1.pdf?1713192456000.pdf
化工新材料行业周报：全球首款固态电池走向量产应用，相关材料值得关注,太平洋,2024-04-15,化学制品,https://pdf.dfcfw.com/pdf/H3_AP202404151630219005_1.pdf?1713194792000.pdf
基础化工行业研究周报：七部门联合发文推动工业领域设备更新，麦芽酚、MMA价格上涨,天风证券,2024-04-15,化学制品,https://pdf.dfcfw.com/pdf/H3_AP202404151630219814_1.pdf?1713196069000.pdf
基础化工行业周报：TMA供需偏紧关注度提升，相关产品价格上行,太平洋,2024-04-15,化学制品,https://pdf.dfcfw.com/pdf/H3_AP202404151630225264_1.pdf?1713206711000.pdf
基础化工行业点评报告：国内外装置异动较多，2024年H1新增产能有限，醋酸价格或继续上行,开源证券,2024-04-14,化学制品,https://pdf.dfcfw.com/pdf/H3_AP202404131630207041_1.pdf?1713086554000.pdf
新材料产业周报：2023年中国半导体设备市场同比增长29% 京东方柔性AMOLED出货量创新高,国海证券,2024-04-14,化学制品,https://pdf.dfcfw.com/pdf/H3_AP202404141630209386_1.pdf?1713169065000.pdf
化工行业周报：国际油价小幅下跌，TDI价格上涨,中银证券,2024-04-14,化学制品,https://pdf.dfcfw.com/pdf/H3_AP202404141630209657_1.pdf?1713123969000.pdf
基础化工行业周报：关注醋酸、粘胶长丝、聚碳酸酯产业链等涨价品种,开源证券,2024-04-14,化学制品,https://pdf.dfcfw.com/pdf/H3_AP202404141630208101_1.pdf?1713103045000.pdf
基础化工行业月报：围绕供需与资源品两条主线，关注煤化工与轻烃化工、磷化工和粘胶长丝行业,中原证券,2024-04-14,化学制品,https://pdf.dfcfw.com/pdf/H3_AP202404141630208158_1.pdf?1713103501000.pdf
基础化工行业周报：TMA供应短缺带动价格上涨，下游需求或持续向好,开源证券,2024-04-14,化学制品,https://pdf.dfcfw.com/pdf/H3_AP202404141630209207_1.pdf?1713114939000.pdf
基础化工行业日报：基础化工指数小幅下跌，关注TMA涨价,中邮证券,2024-04-14,化学制品,https://pdf.dfcfw.com/pdf/H3_AP202404141630209220_1.pdf?1713116015000.pdf
基础化工行业周报：TMA、麦芽酚、醋酸价格上涨，持续看好轮胎及轮胎设备景气上行,国海证券,2024-04-14,化学制品,https://pdf.dfcfw.com/pdf/H3_AP202404141630209817_1.pdf?1713168378000.pdf
基础化工行业日报：基础化工指数小幅上涨，关注麦芽酚涨价,中邮证券,2024-04-12,化学制品,https://pdf.dfcfw.com/pdf/H3_AP202404121630175919_1.pdf?1712930327000.pdf
基础化工行业周专题：海外农化企业龙头2023年经营情况分析,国联证券,2024-04-12,化学制品,https://pdf.dfcfw.com/pdf/H3_AP202404121630194603_1.pdf?1712957301000.pdf
基础化工行业日报：基础化工指数小幅上涨，关注氯化钾涨价,中邮证券,2024-04-11,化学制品,https://pdf.dfcfw.com/pdf/H3_AP202404111630140568_1.pdf?1712834086000.pdf
基础化工行业日报：基础化工指数小幅回调，关注苯胺涨价,中邮证券,2024-04-11,化学制品,https://pdf.dfcfw.com/pdf/H3_AP202404111630142523_1.pdf?1712848049000.pdf
基础化工行业周报：国际油价全面上行，下游需求端持续向好,上海证券,2024-04-10,化学制品,https://pdf.dfcfw.com/pdf/H3_AP202404101630102943_1.pdf?1712745103000.pdf
基础化工行业周报：液氯、碳酸二甲酯价格上涨，万华化学福建工业园装置复产,国海证券,2024-04-10,化学制品,https://pdf.dfcfw.com/pdf/H3_AP202404101630128987_1.pdf?1712820978000.pdf
基础化工行业周报：首批转基因作物除草剂获登记，草甘膦价格上涨,太平洋,2024-04-09,化学制品,https://pdf.dfcfw.com/pdf/H3_AP202404091630067738_1.pdf?1712651105000.pdf
基础化工行业研究：粘胶长丝：供给格局高度集中，国风服饰需求推动行业景气度上行,国金证券,2024-04-09,化学制品,https://pdf.dfcfw.com/pdf/H3_AP202404091630067712_1.pdf?1712652098000.pdf
基础化工行业简评报告：原油价格表现强势，万华福建工业园装置复产,首创证券,2024-04-09,化学制品,https://pdf.dfcfw.com/pdf/H3_AP202404091630068887_1.pdf?1712655420000.pdf
湿电子化学品行业深度报告：湿电子化学品渐入佳境——AI赋能化工之三,国海证券,2024-04-09,化学制品,https://pdf.dfcfw.com/pdf/H3_AP202404091630069041_1.pdf?1712657196000.pdf
化工新材料产业周报：全球晶圆代工市场同增12%，2023我国充电基础设施同增65%,国海证券,2024-04-08,化学制品,https://pdf.dfcfw.com/pdf/H3_AP202404081630041757_1.pdf?1712572350000.pdf
化工行业周报：国际油价上涨，萤石价格上涨,中银证券,2024-04-08,化学制品,https://pdf.dfcfw.com/pdf/H3_AP202404081630045056_1.pdf?1712589344000.pdf
化工新材料行业周报：国家能源局发布生物柴油应用试点通知，相关公司值得关注,太平洋,2024-04-08,化学制品,https://pdf.dfcfw.com/pdf/H3_AP202404081630051821_1.pdf?1712598152000.pdf
基础化工行业周报：发改委等六部门，探索现代煤化工与绿氢、碳捕集利用与封存耦合发展模式，氢氟酸、萤石价格上涨,天风证券,2024-04-08,化学制品,https://pdf.dfcfw.com/pdf/H3_AP202404081630044387_1.pdf?1712587277000.pdf
基础化工：化工行业运行指标跟踪-2024年1-2月数据,天风证券,2024-04-07,化学制品,https://pdf.dfcfw.com/pdf/H3_AP202404071630032733_1.pdf?1712483494000.pdf
基础化工行业周报：万华化学福建工业园复产，原油、氢氟酸价格上涨,华安证券,2024-04-07,化学制品,https://pdf.dfcfw.com/pdf/H3_AP202404071630039579_1.pdf?1712528068000.pdf
基础化工行业周报：本周化工品市场整体上行，氯化钾价格触底反弹,开源证券,2024-04-07,化学制品,https://pdf.dfcfw.com/pdf/H3_AP202404071630036838_1.pdf?1712510355000.pdf
化工新材料行业周报：南亚新材投建高端电子基材，覆铜板高端化带来特种树脂需求,甬兴证券,2024-04-05,化学制品,https://pdf.dfcfw.com/pdf/H3_AP202404051629949153_1.pdf?1712310956000.pdf
地产链化工品追踪系列报告（2024-03）：DMC等产品均价环比上行,信达证券,2024-04-03,化学制品,https://pdf.dfcfw.com/pdf/H3_AP202404031629688313_1.pdf?1712142452000.pdf
基础化工行业简评报告：二氯甲烷价格涨幅居前，关注2023业绩高增标的,首创证券,2024-04-02,化学制品,https://pdf.dfcfw.com/pdf/H3_AP202404021629412326_1.pdf?1712052897000.pdf
油气行业2024年3月月报：供给端持续收紧，国际油价创年内新高,国信证券,2024-04-02,化学制品,https://pdf.dfcfw.com/pdf/H3_AP202404021629415550_1.pdf?1712063057000.pdf
卫星化学及烯烃行业周度动态跟踪,华安证券,2024-04-02,化学制品,https://pdf.dfcfw.com/pdf/H3_AP202404021629431902_1.pdf?1712083960000.pdf
化工行业周报：原油价格高位震荡背景下，煤化工标的成本效益凸显,华龙证券,2024-04-02,化学制品,https://pdf.dfcfw.com/pdf/H3_AP202404021629500090_1.pdf?1712087786000.pdf
基础化工行业周报：制冷剂价格持续上扬，下游积极备货迎接旺季到来,上海证券,2024-04-02,化学制品,https://pdf.dfcfw.com/pdf/H3_AP202404021629522418_1.pdf?1712091358000.pdf
基础化工行业周报：天然橡胶价格下跌、原油等价格上涨，建议继续关注轮胎、油气开采板块,华鑫证券,2024-04-02,化学制品,https://pdf.dfcfw.com/pdf/H3_AP202404021629421000_1.pdf?1712074494000.pdf
合成生物学周报：物理提取杜仲胶生产线项目落地，维达提高可生物降解材料比例,华安证券,2024-04-02,化学制品,https://pdf.dfcfw.com/pdf/H3_AP202404021629531923_1.pdf?1712093262000.pdf
新材料产业周报：小米发布首款新能源汽车SU7中国移动宣布正式商用5G-A,国海证券,2024-04-01,化学制品,https://pdf.dfcfw.com/pdf/H3_AP202404011629193672_1.pdf?1711967258000.pdf
化工行业周报：原油价格继续走高，无水氢氟酸价格上涨,中银证券,2024-04-01,化学制品,https://pdf.dfcfw.com/pdf/H3_AP202404011629194646_1.pdf?1711968388000.pdf
化工新材料行业周报：陶氏投资建设新工厂开发新能源汽车材料，合肥威迈芯材半导体光刻胶项目开工,德邦证券,2024-04-01,化学制品,https://pdf.dfcfw.com/pdf/H3_AP202404011629195286_1.pdf?1711970369000.pdf
基础化工行业周报：制冷剂价格继续上涨，中国化工优势企业迎来长周期向上机遇,国海证券,2024-04-01,化学制品,https://pdf.dfcfw.com/pdf/H3_AP202404011629195343_1.pdf?1711970369000.pdf
化工新材料行业周报：关注日本气体企业4月起集体涨价的影响力,平安证券,2024-04-01,化学制品,https://pdf.dfcfw.com/pdf/H3_AP202404011629195438_1.pdf?1711970931000.pdf
基础化工行业周报：R32价格延续涨势，关注制冷剂投资机会,中邮证券,2024-04-01,化学制品,https://pdf.dfcfw.com/pdf/H3_AP202404011629197667_1.pdf?1711984183000.pdf
基础化工行业研究周报：1-2月化学原料和制品制造业利润增长0.3%，R32、合成氨价格上涨,天风证券,2024-04-01,化学制品,https://pdf.dfcfw.com/pdf/H3_AP202404011629200711_1.pdf?1711989394000.pdf
基础化工行业周报：制冷剂价格持续上涨，以旧换新政策有望拉动需求,太平洋,2024-04-01,化学制品,https://pdf.dfcfw.com/pdf/H3_AP202404011629196584_1.pdf?1711980282000.pdf
基础化工行业双周报：R32价格持续上涨，氟化工板块表现强势,东莞证券,2024-04-01,化学制品,https://pdf.dfcfw.com/pdf/H3_AP202404011629191722_1.pdf?1711959784000.pdf
基础化工行业研究：制冷剂涨价，建议关注一季度业绩较佳标的,国金证券,2024-04-01,化学制品,https://pdf.dfcfw.com/pdf/H3_AP202404011629191745_1.pdf?1711966149000.pdf
基础化工行业周报：国产涂料企业持续发力，汽车涂料国产替代进行时,开源证券,2024-03-31,化学制品,https://pdf.dfcfw.com/pdf/H3_AP202403311629188776_1.pdf?1711956259000.pdf
基础化工行业周报：卫星化学2023年业绩同比高增，天然气、钛白粉价格上涨,华安证券,2024-03-31,化学制品,https://pdf.dfcfw.com/pdf/H3_AP202403311629189170_1.pdf?1711917530000.pdf
基础化工行业日报：基础化工小幅上涨，关注低空经济材料,中邮证券,2024-03-29,化学制品,https://pdf.dfcfw.com/pdf/H3_AP202403291629024330_1.pdf?1711705386000.pdf
基础化工行业周专题：海外代表性化工企业2023年经营情况分析,国联证券,2024-03-29,化学制品,https://pdf.dfcfw.com/pdf/H3_AP202403291629026670_1.pdf?1711708366000.pdf
基础化工行业周报：制冷剂、液氯等产品价格上行，轮胎行业迎来涨价潮,上海证券,2024-03-29,化学制品,https://pdf.dfcfw.com/pdf/H3_AP202403291629026680_1.pdf?1711708289000.pdf
化工新材料行业周报：国内首个金融大模型发布，新质生产力或带来特种树脂新需求,甬兴证券,2024-03-29,化学制品,https://pdf.dfcfw.com/pdf/H3_AP202403291629044895_1.pdf?1711735003000.pdf
基础化工行业周专题：海外化工综合巨头和聚氨酯领先企业业绩解读,国联证券,2024-03-29,化学制品,https://pdf.dfcfw.com/pdf/H3_AP202403291629048741_1.pdf?1711736899000.pdf
基础化工行业日报：基础化工小幅下跌，关注制冷剂&橡胶涨价,中邮证券,2024-03-28,化学制品,https://pdf.dfcfw.com/pdf/H3_AP202403281628430233_1.pdf?1711618131000.pdf
化工新材料行业周报：制冷剂价格延续强势，饲料添加剂价格上涨,太平洋,2024-03-27,化学制品,https://pdf.dfcfw.com/pdf/H3_AP202403271628291198_1.pdf?1711529537000.pdf
基础化工行业周报：橡胶制冷剂等价格上涨，建议继续关注轮胎、制冷剂板块,华鑫证券,2024-03-27,化学制品,https://pdf.dfcfw.com/pdf/H3_AP202403271628299484_1.pdf?1711549559000.pdf
合成生物学周报：大阪大学开发创新生物制造技术，华恒生物发布PDO,华安证券,2024-03-26,化学制品,https://pdf.dfcfw.com/pdf/H3_AP202403261628171245_1.pdf?1711444386000.pdf
基础化工行业简评报告：液氯价格涨幅居前，万华化学2023年归母净利润同比增长3.59%,首创证券,2024-03-26,化学制品,https://pdf.dfcfw.com/pdf/H3_AP202403261628171774_1.pdf?1711442866000.pdf
卫星化学及烯烃行业周度动态跟踪,华安证券,2024-03-26,化学制品,https://pdf.dfcfw.com/pdf/H3_AP202403261628178435_1.pdf?1711468454000.pdf
聚酰氨纤维 头豹词条报告系列,头豹研究院,2024-03-26,化学制品,https://pdf.dfcfw.com/pdf/H3_AP202403261628191956_1.pdf?1711483343000.pdf
基础化工行业研究周报：天然橡胶影响弱化，继续看好轮胎,国金证券,2024-03-25,化学制品,https://pdf.dfcfw.com/pdf/H3_AP202403251628066956_1.pdf?1711354677000.pdf
化工行业周报：海外天然气价格上涨，辛醇价格下跌,中银证券,2024-03-25,化学制品,https://pdf.dfcfw.com/pdf/H3_AP202403251628067289_1.pdf?1711357176000.pdf
基础化工行业研究周报：前2月化学原料和化学制品制造业增加值同比增长10.0%，苯胺、赖氨酸价格上涨,天风证券,2024-03-25,化学制品,https://pdf.dfcfw.com/pdf/H3_AP202403251628067527_1.pdf?1711357399000.pdf
基础化工行业周报：赖氨酸价格大幅上涨，关注低空经济材料标的,中邮证券,2024-03-25,化学制品,https://pdf.dfcfw.com/pdf/H3_AP202403251628067721_1.pdf?1711357618000.pdf
