研报名称,机构名称,发布时间,行业,研报地址
基础化工行业研究周报：六部门联合制定发布《大力实施可再生能源替代行动的指导意见》，氢氟酸、BDO价格上涨,天风证券,2024-11-05,化学制品,https://pdf.dfcfw.com/pdf/H3_AP202411051640713464_1.pdf?1730795081000.pdf
基础化工行业定期报告：三季度化工整体仍承压；资本开支连续四个季度同比负增,中泰证券,2024-11-05,化学制品,https://pdf.dfcfw.com/pdf/H3_AP202411051640715830_1.pdf?1730805757000.pdf
地产链化工品追踪系列报告（2024-10）：10月份商品房成交实现“双增长”，水泥、聚合MDI等月均价环比回暖,信达证券,2024-11-05,化学制品,https://pdf.dfcfw.com/pdf/H3_AP202411051640716005_1.pdf?1730803344000.pdf
化工行业周报：国际油价先跌后涨，维生素价格涨跌互现,中银证券,2024-11-04,化学制品,https://pdf.dfcfw.com/pdf/H3_AP202411041640690927_1.pdf?1730710190000.pdf
化工行业行业周报：价差表现分化，关注化工结构性机会,中国银河,2024-11-04,化学制品,https://pdf.dfcfw.com/pdf/H3_AP202411041640692836_1.pdf?1730719312000.pdf
基础化工行业周报：合成生物学周报：聚乳酸和聚乙醇酸新国标正式实施，陕西省将重点发展合成生物,华安证券,2024-11-04,化学制品,https://pdf.dfcfw.com/pdf/H3_AP202411041640693886_1.pdf?1730721576000.pdf
新材料产业周报：神舟十九号发射圆满成功，英伟达被纳入道琼斯工业平均指数,国海证券,2024-11-04,化学制品,https://pdf.dfcfw.com/pdf/H3_AP202411041640698246_1.pdf?1730739646000.pdf
化工行业周报：关注中游制造业供给侧改革机遇，看好电子新材料成长机遇,开源证券,2024-11-04,化学制品,https://pdf.dfcfw.com/pdf/H3_AP202411041640700995_1.pdf?1730739010000.pdf
基础化工行业周报：天然气、氧化铝等涨幅居前，建议继续关注石化板块、钛白粉板块和轮胎板块,华鑫证券,2024-11-04,化学制品,https://pdf.dfcfw.com/pdf/H3_AP202411041640706928_1.pdf?1730748216000.pdf
化工行业周报：三代制冷剂毛利普遍提升，维生素E价格上涨,太平洋,2024-11-04,化学制品,https://pdf.dfcfw.com/pdf/H3_AP202411041640708324_1.pdf?1730752027000.pdf
基础化工行业双周报：板块第三季度业绩同环比承压,东莞证券,2024-11-04,化学制品,https://pdf.dfcfw.com/pdf/H3_AP202411041640694636_1.pdf?1730728076000.pdf
化工行业周报：天然气、百菌清等涨幅靠前，建议关注大股东拥有优质体外资产的标的,民生证券,2024-11-03,化学制品,https://pdf.dfcfw.com/pdf/H3_AP202411031640689418_1.pdf?1730703097000.pdf
基础化工：PA6、氨纶价格承压，织物制品出口同比下滑,华福证券,2024-11-03,化学制品,https://pdf.dfcfw.com/pdf/H3_AP202411031640686713_1.pdf?1730648877000.pdf
基础化工行业周报：欧盟调低对华钛白粉反倾销关税税率，广汇能源百亿级煤化工项目开工,华福证券,2024-11-03,化学制品,https://pdf.dfcfw.com/pdf/H3_AP202411031640686722_1.pdf?1730642448000.pdf
基础化工周报：新材料价格普遍下降,东吴证券,2024-11-03,化学制品,https://pdf.dfcfw.com/pdf/H3_AP202411031640687064_1.pdf?1730646318000.pdf
基础化工：尿素、炭黑价格承压，醋酸出口同比高增,华福证券,2024-11-01,化学制品,https://pdf.dfcfw.com/pdf/H3_AP202411011640660583_1.pdf?1730459492000.pdf
基础化工：烧碱、PVC价格上涨，下游地产需求仍然偏弱,华福证券,2024-11-01,化学制品,https://pdf.dfcfw.com/pdf/H3_AP202411011640660592_1.pdf?1730459602000.pdf
雄安新区专题研究：系统布局高端高新产业，新材料产业发展空间广阔,源达信息,2024-10-31,化学制品,https://pdf.dfcfw.com/pdf/H3_AP202410311640642557_1.pdf?1730402080000.pdf
中国氟磷矿石行业市场规模测算逻辑模型 头豹词条报告系列,头豹研究院,2024-10-31,化学制品,https://pdf.dfcfw.com/pdf/H3_AP202410311640648822_1.pdf?1730406799000.pdf
化工行业运行指标跟踪-2024年9月数据,天风证券,2024-10-30,化学制品,https://pdf.dfcfw.com/pdf/H3_AP202410301640590783_1.pdf?1730294953000.pdf
基础化工：旺季MDI与TDI价差环比扩大，冰箱冰柜需求向好,华福证券,2024-10-30,化学制品,https://pdf.dfcfw.com/pdf/H3_AP202410301640596586_1.pdf?1730304805000.pdf
基础化工行业简评报告：液氯涨幅居前，兴发集团前三季度利润同比快速增长,首创证券,2024-10-30,化学制品,https://pdf.dfcfw.com/pdf/H3_AP202410301640598115_1.pdf?1730315889000.pdf
化工行业周报：氧化铝需求强劲带动烧碱价格上涨,太平洋,2024-10-29,化学制品,https://pdf.dfcfw.com/pdf/H3_AP202410291640557582_1.pdf?1730191578000.pdf
基础化工周报：化工品价格普遍下降,东吴证券,2024-10-28,化学制品,https://pdf.dfcfw.com/pdf/H3_AP202410281640529463_1.pdf?1730083362000.pdf
维生素10月月报：巴斯夫延迟维生素E、A复产时间，价格有望延续涨势,华福证券,2024-10-28,化学制品,https://pdf.dfcfw.com/pdf/H3_AP202410281640530164_1.pdf?1730108539000.pdf
基础化工行业周报：化工品价格普遍下降,东吴证券,2024-10-28,化学制品,https://pdf.dfcfw.com/pdf/H3_AP202410281640530676_1.pdf?1730114810000.pdf
化工行业周报：国际油价上涨，BDO价格上涨,中银证券,2024-10-28,化学制品,https://pdf.dfcfw.com/pdf/H3_AP202410281640531237_1.pdf?1730108335000.pdf
基础化工行业研究周报：工信部，将制定出台《制造业绿色低碳发展行动方案》，维生素、BDO价格上涨,天风证券,2024-10-28,化学制品,https://pdf.dfcfw.com/pdf/H3_AP202410281640538269_1.pdf?1730131548000.pdf
基础化工行业周报：国内纯碱市场大稳小动，磷矿石市场横盘整理,开源证券,2024-10-28,化学制品,https://pdf.dfcfw.com/pdf/H3_AP202410281640541530_1.pdf?1730135163000.pdf
基础化工行业周报：巴斯夫维生素复产推迟，天然橡胶、BDO价格上涨（更正）,上海证券,2024-10-28,化学制品,https://pdf.dfcfw.com/pdf/H3_AP202410281640540370_1.pdf?1730155469000.pdf
卫星化学及烯烃行业周度动态跟踪,华安证券,2024-10-28,化学制品,https://pdf.dfcfw.com/pdf/H3_AP202410281640541909_1.pdf?1730151669000.pdf
中国化工行业信用梳理（2024）,惠誉博华信用评级,2024-10-28,化学制品,https://pdf.dfcfw.com/pdf/H3_AP202410281640543281_1.pdf?1730137536000.pdf
基础化工行业周报：液氯、BDO等涨幅居前，建议继续关注石化板块、钛白粉板块和轮胎板块,华鑫证券,2024-10-28,化学制品,https://pdf.dfcfw.com/pdf/H3_AP202410281640544681_1.pdf?1730138815000.pdf
基础化工行业专题研究：双碳若加速，化工看点足,国联证券,2024-10-28,化学制品,https://pdf.dfcfw.com/pdf/H3_AP202410281640550064_1.pdf?1730147523000.pdf
化工行业周报：液氯、硫酸等涨幅靠前，建议关注大股东拥有优质体外资产的标的,民生证券,2024-10-28,化学制品,https://pdf.dfcfw.com/pdf/H3_AP202410281640550725_1.pdf?1730150193000.pdf
基础化工行业研究：信心回升，配置龙头的同时建议重点关注成长方向,国金证券,2024-10-28,化学制品,https://pdf.dfcfw.com/pdf/H3_AP202410281640532246_1.pdf?1730122371000.pdf
基础化工行业周报：BDO、毒死蜱价格上涨，阳谷华泰拟发行股份购买波米科技,国海证券,2024-10-27,化学制品,https://pdf.dfcfw.com/pdf/H3_AP202410271640529069_1.pdf?1730068251000.pdf
合成生物学周报：化销华中实现生物基产品突破，PEF生产商Avantium签署供应协议,华安证券,2024-10-27,化学制品,https://pdf.dfcfw.com/pdf/H3_AP202410271640529288_1.pdf?1730099585000.pdf
化工新材料产业周报：2024年全球硅晶圆出货量预计下降2%，美商务部或撤销部分中国光伏产品双反关税,国海证券,2024-10-27,化学制品,https://pdf.dfcfw.com/pdf/H3_AP202410271640529310_1.pdf?1730100927000.pdf
基础化工行业周报：万华化学150万吨MDI扩产项目公示，MDI价差扩大,华安证券,2024-10-27,化学制品,https://pdf.dfcfw.com/pdf/H3_AP202410271640529308_1.pdf?1730071192000.pdf
新材料周报：彤程新材Q3扣非净利润同增19.85%，广东省大力推动光芯片关键装备研发和国产化替代,华福证券,2024-10-27,化学制品,https://pdf.dfcfw.com/pdf/H3_AP202410271640527763_1.pdf?1730114001000.pdf
基础化工行业周报：中化学年产30万吨煤制乙二醇项目投产，尼龙巨头奥升德在华生产基地开业,华福证券,2024-10-27,化学制品,https://pdf.dfcfw.com/pdf/H3_AP202410271640527774_1.pdf?1730113815000.pdf
钛白粉10月月报：钛白粉价格下行，行业利润预计承压,华福证券,2024-10-27,化学制品,https://pdf.dfcfw.com/pdf/H3_AP202410271640528117_1.pdf?1730060096000.pdf
农药行业点评：部分农药价格反弹，关注具有成本优势的龙头企业,首创证券,2024-10-25,化学制品,https://pdf.dfcfw.com/pdf/H3_AP202410251640491608_1.pdf?1729848858000.pdf
基础化工行业专题研究：当下化工怎么看？,国联证券,2024-10-23,化学制品,https://pdf.dfcfw.com/pdf/H3_AP202410231640435948_1.pdf?1729701441000.pdf
基础化工行业简评报告：国际油价回调，兴福电子获中国证监会注册,首创证券,2024-10-22,化学制品,https://pdf.dfcfw.com/pdf/H3_AP202410221640398904_1.pdf?1729586625000.pdf
基础化工行业周报：中国资环集团成立，纯MDI、TDI价格上涨,华安证券,2024-10-22,化学制品,https://pdf.dfcfw.com/pdf/H3_AP202410221640400217_1.pdf?1729589442000.pdf
化工行业周报：制冷剂、天然橡胶价格上涨,太平洋,2024-10-22,化学制品,https://pdf.dfcfw.com/pdf/H3_AP202410221640411220_1.pdf?1729619154000.pdf
基础化工行业周报：关注点预计逐渐回归基本面，龙头仍是重点方向,国金证券,2024-10-21,化学制品,https://pdf.dfcfw.com/pdf/H3_AP202410211640378538_1.pdf?1729510553000.pdf
基础化工行业研究周报：9月份化学原料和制品制造业增加值同比增长4.6%，BDO、纯MDI价格上涨,天风证券,2024-10-21,化学制品,https://pdf.dfcfw.com/pdf/H3_AP202410211640378832_1.pdf?1729512103000.pdf
合成生物学周报：中科国生举办生物基产业研讨会，产业技术基础公共服务平台申报开启,华安证券,2024-10-21,化学制品,https://pdf.dfcfw.com/pdf/H3_AP202410211640385705_1.pdf?1729544182000.pdf
基础化工行业双周报：预计三季度制冷剂、轮胎等细分领域业绩较好,东莞证券,2024-10-21,化学制品,https://pdf.dfcfw.com/pdf/H3_AP202410211640386968_1.pdf?1729530563000.pdf
化工行业周报：液氯、磷酸氢钙等涨幅靠前，成长股迎来较佳配置时机,民生证券,2024-10-21,化学制品,https://pdf.dfcfw.com/pdf/H3_AP202410211640391848_1.pdf?1729542119000.pdf
基础化工行业周报：硫酸、尿素等涨幅居前，建议继续关注石化板块、钛白粉板块和轮胎板块,华鑫证券,2024-10-21,化学制品,https://pdf.dfcfw.com/pdf/H3_AP202410211640392795_1.pdf?1729543756000.pdf
基础化工行业定期报告：地产增量政策频出；巴斯夫延迟复产或开启维生素新一轮上涨,中泰证券,2024-10-21,化学制品,https://pdf.dfcfw.com/pdf/H3_AP202410211640393530_1.pdf?1729547142000.pdf
化工行业周报：国际油价下跌，TDI价格上涨,中银证券,2024-10-21,化学制品,https://pdf.dfcfw.com/pdf/H3_AP202410211640379157_1.pdf?1729521157000.pdf
基础化工行业周报：科技创新重要性凸显，我国新材料企业成长空间广阔,开源证券,2024-10-21,化学制品,https://pdf.dfcfw.com/pdf/H3_AP202410211640379339_1.pdf?1729519553000.pdf
基础化工行业点评报告：巴斯夫VA、VE复产推迟，继续看好产品景气上行,开源证券,2024-10-20,化学制品,https://pdf.dfcfw.com/pdf/H3_AP202410201640373639_1.pdf?1729415942000.pdf
基础化工行业点评报告：本土高世代OLED产线快速推进，OLED中尺寸应用渗透率提升，继续看好OLED材料,开源证券,2024-10-20,化学制品,https://pdf.dfcfw.com/pdf/H3_AP202410201640375327_1.pdf?1729455732000.pdf
基础化工周报：聚氨酯价格价差上升,东吴证券,2024-10-20,化学制品,https://pdf.dfcfw.com/pdf/H3_AP202410201640375386_1.pdf?1729462356000.pdf
基础化工行业周报：巴斯夫推迟VE、VA复产时间，液化空气集团在华两套电气化空气分离装置投产,华福证券,2024-10-20,化学制品,https://pdf.dfcfw.com/pdf/H3_AP202410201640374179_1.pdf?1729447633000.pdf
基础化工：新材料周报：三菱化学宣布扩产半导体超纯水离子交换树脂，国产光刻胶“自主可控”实现重大突破,华福证券,2024-10-20,化学制品,https://pdf.dfcfw.com/pdf/H3_AP202410201640374867_1.pdf?1729445341000.pdf
新材料产业周报：SpaceX首次回收星舰成功,国海证券,2024-10-20,化学制品,https://pdf.dfcfw.com/pdf/H3_AP202410201640375105_1.pdf?1729457724000.pdf
基础化工行业周报：甲基丙烯酸甲酯、丁二醇价格上涨，万润股份、德邦科技、京东方拟设立合资公司,国海证券,2024-10-20,化学制品,https://pdf.dfcfw.com/pdf/H3_AP202410201640375053_1.pdf?1729449927000.pdf
基础化工行业周报：两部委发文推动新材料中试平台建设，国际油价震荡下跌,上海证券,2024-10-18,化学制品,https://pdf.dfcfw.com/pdf/H3_AP202410181640354655_1.pdf?1729249834000.pdf
化工行业：2024绿色化工产业深度研究-可持续燃油（SAF）,上海久挚管理咨询,2024-10-18,化学制品,https://pdf.dfcfw.com/pdf/H3_AP202410181640358530_1.pdf?1729264917000.pdf
基础化工行业研究：地产政策持续，市场见底改善,国金证券,2024-10-18,化学制品,https://pdf.dfcfw.com/pdf/H3_AP202410181640364063_1.pdf?1729274596000.pdf
基础化工行业研究：巴斯夫VE复产推迟，继续看好产品价格,国金证券,2024-10-18,化学制品,https://pdf.dfcfw.com/pdf/H3_AP202410181640364064_1.pdf?1729274666000.pdf
基础化工行业研究：泰国反倾销税率可能提高，看好多基地布局的国产胎企,国金证券,2024-10-17,化学制品,https://pdf.dfcfw.com/pdf/H3_AP202410171640333825_1.pdf?1729153003000.pdf
基础化工行业简评报告：硫酸涨幅居前，兴发集团前三季度业绩同比增长,首创证券,2024-10-15,化学制品,https://pdf.dfcfw.com/pdf/H3_AP202410151640299749_1.pdf?1729001781000.pdf
合成生物学周报：中东巨头收购科思创，具有真核核小体的大肠杆菌首次被构建成功,华安证券,2024-10-15,化学制品,https://pdf.dfcfw.com/pdf/H3_AP202410151640299516_1.pdf?1729007085000.pdf
基础化工行业周报：两部委发文支持新材料产业中试平台建设，原油价格上涨,华安证券,2024-10-15,化学制品,https://pdf.dfcfw.com/pdf/H3_AP202410151640299528_1.pdf?1728997116000.pdf
基础化工行业周报：化工景气回升，关注四大机会,国海证券,2024-10-14,化学制品,https://pdf.dfcfw.com/pdf/H3_AP202410141640278468_1.pdf?1728905112000.pdf
化工行业周报（-）：顺酐、原盐等价格大幅上扬，关注旺季来临的粘胶短纤和涤纶长丝,民生证券,2024-10-14,化学制品,https://pdf.dfcfw.com/pdf/H3_AP202410141640278789_1.pdf?1728891161000.pdf
基础化工行业研究：从提仓位到调结构，建议重点关注优质成长股,国金证券,2024-10-14,化学制品,https://pdf.dfcfw.com/pdf/H3_AP202410141640278881_1.pdf?1728903942000.pdf
基础化工行业研究周报：两部委，到2027年力争建成300个左右地方新材料中试平台，顺酐、己二酸价格上涨,天风证券,2024-10-14,化学制品,https://pdf.dfcfw.com/pdf/H3_AP202410141640279061_1.pdf?1728893999000.pdf
基础化工行业周报：一揽子增量政策出台，或有效拉动改性塑料、地产相关化工品需求增长,开源证券,2024-10-14,化学制品,https://pdf.dfcfw.com/pdf/H3_AP202410141640281134_1.pdf?1728901196000.pdf
基础化工行业周报：PX、涤纶POY等涨幅居前，建议继续关注石化板块、钛白粉板块和轮胎板块,华鑫证券,2024-10-14,化学制品,https://pdf.dfcfw.com/pdf/H3_AP202410141640287304_1.pdf?1728922873000.pdf
化工周期新起点系列5：地方债务限额置换开启，关注化工减水剂、民爆等行业,开源证券,2024-10-14,化学制品,https://pdf.dfcfw.com/pdf/H3_AP202410141640290178_1.pdf?1728931822000.pdf
大化工28大细分高频估值监测,国联证券,2024-10-14,化学制品,https://pdf.dfcfw.com/pdf/H3_AP202410141640294402_1.pdf?1728943208000.pdf
卫星化学及烯烃行业周度动态跟踪,华安证券,2024-10-14,化学制品,https://pdf.dfcfw.com/pdf/H3_AP202410141640284945_1.pdf?1728942316000.pdf
氟化工行业周报：萤石价格开启上行趋势，制冷剂行情持续向好,开源证券,2024-10-13,化学制品,https://pdf.dfcfw.com/pdf/H3_AP202410131640276695_1.pdf?1728817938000.pdf
新材料周报：新材料研发重点或将受益，万盛股份拟收购熵能新材布局功能性新材料,华福证券,2024-10-13,化学制品,https://pdf.dfcfw.com/pdf/H3_AP202410131640278093_1.pdf?1728893666000.pdf
新材料行业周报：特斯拉发布无人出租车Cybercab，星舰第五次试飞获批,国海证券,2024-10-13,化学制品,https://pdf.dfcfw.com/pdf/H3_AP202410131640278407_1.pdf?1728894208000.pdf
基础化工周报：乙烷裂解制乙烯的盈利扩大,东吴证券,2024-10-13,化学制品,https://pdf.dfcfw.com/pdf/H3_AP202410131640278420_1.pdf?1728905112000.pdf
化工行业周报：国际油价上涨，涤纶长丝价格上涨,中银证券,2024-10-13,化学制品,https://pdf.dfcfw.com/pdf/H3_AP202410131640278049_1.pdf?1728852915000.pdf
2024年第四季度化工行业：供需较为均衡，盈利处于高位,大公国际,2024-10-12,化学制品,https://pdf.dfcfw.com/pdf/H3_AP202410121640273007_1.pdf?1728725765000.pdf
基础化工行业专题报告：2025年配额政策逐渐明朗，看好制冷剂价格中枢向上,华福证券,2024-10-11,化学制品,https://pdf.dfcfw.com/pdf/H3_AP202410111640258161_1.pdf?1728647830000.pdf
轮胎行业专题报告（2024年9月）：运费持续回落，赛轮Q3业绩预喜,信达证券,2024-10-11,化学制品,https://pdf.dfcfw.com/pdf/H3_AP202410111640263264_1.pdf?1728663884000.pdf
基础化工行业周报：美瑞新材PPDI装置投产，英力士比利时PTA工厂因环保面临关闭威胁,华福证券,2024-10-11,化学制品,https://pdf.dfcfw.com/pdf/H3_AP202410111640269803_1.pdf?1728683660000.pdf
传统煤化工行业研究框架专题报告：存量优化，成本优先,东海证券,2024-10-10,化学制品,https://pdf.dfcfw.com/pdf/H3_AP202410101640248233_1.pdf?1728581404000.pdf
轮胎行业月报：原材料价格上涨，国内需求有望提升,东海证券,2024-10-10,化学制品,https://pdf.dfcfw.com/pdf/H3_AP202410101640252967_1.pdf?1728596892000.pdf
基础化工行业月报：多项政策驱动叠加行业基本面改善，关注三条投资主线,中原证券,2024-10-09,化学制品,https://pdf.dfcfw.com/pdf/H3_AP202410091640232698_1.pdf?1728502478000.pdf
农化制品行业专题研究：2024年上半年全球创制农化企业经营情况,天风证券,2024-10-09,化学制品,https://pdf.dfcfw.com/pdf/H3_AP202410091640235115_1.pdf?1728509202000.pdf
大化工28大细分高频估值监测,国联证券,2024-10-08,化学制品,https://pdf.dfcfw.com/pdf/H3_AP202410081640190777_1.pdf?1728398556000.pdf
卫星化学及烯烃行业周度动态跟踪,华安证券,2024-10-08,化学制品,https://pdf.dfcfw.com/pdf/H3_AP202410081640191642_1.pdf?1728407977000.pdf
基础化工行业深度研究：从全球视野看氟制冷剂供应格局,国联证券,2024-10-08,化学制品,https://pdf.dfcfw.com/pdf/H3_AP202410081640191723_1.pdf?1728396998000.pdf
基础化工行业周报：国内政策超预期改善需求，海外油价修复化工品价差有望扩大,华安证券,2024-10-08,化学制品,https://pdf.dfcfw.com/pdf/H3_AP202410081640199370_1.pdf?1728410341000.pdf
基础化工行业周报：政策密集出台助力核心资产反弹，重点关注化工白马及顺周期个股,上海证券,2024-10-07,化学制品,https://pdf.dfcfw.com/pdf/H3_AP202410071640177704_1.pdf?1728299759000.pdf
基础化工行业周报：百菌清、代森锰锌、苏氨酸等库存低位，看好化工白马以及部分化工子行业龙头,开源证券,2024-10-07,化学制品,https://pdf.dfcfw.com/pdf/H3_AP202410071640182912_1.pdf?1728319363000.pdf
化工新材料产业周报：我国5G基站突破400万个，汽车消费指数3个月连续走高,国海证券,2024-10-07,化学制品,https://pdf.dfcfw.com/pdf/H3_AP202410071640186552_1.pdf?1728375863000.pdf
化工板块有望迎来戴维斯双击,西南证券,2024-10-07,化学制品,https://pdf.dfcfw.com/pdf/H3_AP202410031640162994_1.pdf?1728310971000.pdf
基础化工行业深度分析：行业景气复苏态势初现，二季度经营态势明显改善,中原证券,2024-10-07,化学制品,https://pdf.dfcfw.com/pdf/H3_AP202409301640125759_1.pdf?1728306458000.pdf
陶瓷基复合材料专题报告：新型热结构材料战略地位凸显，产业化应用拐点将至,中泰证券,2024-10-07,化学制品,https://pdf.dfcfw.com/pdf/H3_AP202410071640177292_1.pdf?1728315696000.pdf
基础化工行业研究：政策持续超预期，重点推荐顺周期和超跌成长股,国金证券,2024-10-07,化学制品,https://pdf.dfcfw.com/pdf/H3_AP202410071640177177_1.pdf?1728315095000.pdf
基础化工行业双周报：政策组合拳重磅出台，板块大幅上涨,东莞证券,2024-09-30,化学制品,https://pdf.dfcfw.com/pdf/H3_AP202409301640098797_1.pdf?1727695068000.pdf
基础化工行业周报：地产消费政策持续加码，化工行业有望迎来需求拐点,华安证券,2024-09-30,化学制品,https://pdf.dfcfw.com/pdf/H3_AP202409301640099430_1.pdf?1727701700000.pdf
化工行业周报：国际油价下跌，制冷剂价格上涨,中银证券,2024-09-30,化学制品,https://pdf.dfcfw.com/pdf/H3_AP202409301640099454_1.pdf?1727702701000.pdf
基础化工行业简评报告：天然橡胶延续上涨，湖北宜化签署子公司股权转让合同,首创证券,2024-09-30,化学制品,https://pdf.dfcfw.com/pdf/H3_AP202409301640099624_1.pdf?1727704259000.pdf
基础化工行业周报：丙烯酸甲酯、天然橡胶、焦炭价格上涨，万华化学48万吨EDC改扩建项目环评公示,国海证券,2024-09-30,化学制品,https://pdf.dfcfw.com/pdf/H3_AP202409301640102260_1.pdf?1727716480000.pdf
新材料周报：长阳科技聚酰亚胺薄膜项目开工，国产LCD面板厂产能利用率将降至70%以下,华福证券,2024-09-30,化学制品,https://pdf.dfcfw.com/pdf/H3_AP202409301640103642_1.pdf?1727715889000.pdf
基础化工行业研究周报：1-8月份化学原料和化学制品制造业利润增长0.6%，三氯蔗糖、天然橡胶价格上涨,天风证券,2024-09-30,化学制品,https://pdf.dfcfw.com/pdf/H3_AP202409301640108569_1.pdf?1727720771000.pdf
基础化工行业周报：裕龙岛炼化一体化项目投产，南山智尚高性能锦纶项目进入设备安装阶段,华福证券,2024-09-29,化学制品,https://pdf.dfcfw.com/pdf/H3_AP202409291640090927_1.pdf?1727600130000.pdf
化工行业周报：政策加码助力宏观预期扭转，全面看好化工白马与子行业龙头,开源证券,2024-09-29,化学制品,https://pdf.dfcfw.com/pdf/H3_AP202409291640091954_1.pdf?1727606168000.pdf
基础化工行业周报：国际汽油、国际柴油等涨幅居前，建议继续关注石化板块、钛白粉板块和轮胎板块,华鑫证券,2024-09-29,化学制品,https://pdf.dfcfw.com/pdf/H3_AP202409291640095066_1.pdf?1727637955000.pdf
基础化工行业研究：系列政策出台信心逐步回归，市场逐步释放回暖信号,国金证券,2024-09-25,化学制品,https://pdf.dfcfw.com/pdf/H3_AP202409251640020300_1.pdf?1727249745000.pdf
基础化工行业动态：制冷剂配额政策延续，行业长景气周期逻辑不变,上海证券,2024-09-25,化学制品,https://pdf.dfcfw.com/pdf/H3_AP202409251640021561_1.pdf?1727255189000.pdf
卫星化学及烯烃行业周度动态跟踪,华安证券,2024-09-25,化学制品,https://pdf.dfcfw.com/pdf/H3_AP202409251640026201_1.pptx?1727283223000.pptx
基础化工行业简评报告：天然橡胶涨幅靠前，三美股份拟对外投资丰富产品结构,首创证券,2024-09-24,化学制品,https://pdf.dfcfw.com/pdf/H3_AP202409241639998020_1.pdf?1727176459000.pdf
化工行业2024年中报总结：景气度筑底，供给侧反弹,华安证券,2024-09-24,化学制品,https://pdf.dfcfw.com/pdf/H3_AP202409241639998484_1.pdf?1727184990000.pdf
合成生物学周报：器官生物打印进展更新，富祥药业加速微生物蛋白产业化,华安证券,2024-09-24,化学制品,https://pdf.dfcfw.com/pdf/H3_AP202409241639998513_1.pdf?1727187011000.pdf
基础化工行业点评报告：美联储降息开启宽松周期，海外地产链及资源属性化工品有望受益,中原证券,2024-09-24,化学制品,https://pdf.dfcfw.com/pdf/H3_AP202409241640005594_1.pdf?1727197990000.pdf
维生素9月月报：聚焦维生素E品种，预计量、价双兑现,华福证券,2024-09-23,化学制品,https://pdf.dfcfw.com/pdf/H3_AP202409231639974994_1.pdf?1727080095000.pdf
基础化工行业周报：天然橡胶、合成氨等涨幅居前，建议继续关注石化板块和轮胎板块,华鑫证券,2024-09-23,化学制品,https://pdf.dfcfw.com/pdf/H3_AP202409231639975031_1.pdf?1727080279000.pdf
新材料产业周报：工信部推广国产DUV光刻机,国海证券,2024-09-23,化学制品,https://pdf.dfcfw.com/pdf/H3_AP202409231639980717_1.pdf?1727106961000.pdf
基础化工行业周报：橡胶、原油价格上涨，万华化学3800吨香酮项目环评公示,国海证券,2024-09-23,化学制品,https://pdf.dfcfw.com/pdf/H3_AP202409231639980866_1.pdf?1727107427000.pdf
