研报名称,机构名称,发布时间,行业,研报地址
医药行业周报：艾伯维JAK抑制剂完成欧、美监管递交,太平洋,2024-07-19,化学制药,https://pdf.dfcfw.com/pdf/H3_AP202407191638081549_1.pdf?1721384245000.pdf
医药行业周报：罗氏潜在BIC口服GLP-1减肥药临床结果积极,太平洋,2024-07-19,化学制药,https://pdf.dfcfw.com/pdf/H3_AP202407191638082392_1.pdf?1721385027000.pdf
核医学系列报告（一）：核药具有多重临床优势，高壁垒造就寡头垄断格局,平安证券,2024-07-18,化学制药,https://pdf.dfcfw.com/pdf/H3_AP202407181638027689_1.pdf?1721291609000.pdf
医药：从中报业绩预告，看医药行业投资方向,首创证券,2024-07-18,化学制药,https://pdf.dfcfw.com/pdf/H3_AP202407181638041345_1.pdf?1721312768000.pdf
医药行业周报：益普生长效新药在华再获批，用于治疗CPP,太平洋,2024-07-17,化学制药,https://pdf.dfcfw.com/pdf/H3_AP202407171637995957_1.pdf?1721225396000.pdf
医药行业2024年中期策略：估值再平衡逐步完成，内需的性价比、出海的必然性,山西证券,2024-07-17,化学制药,https://pdf.dfcfw.com/pdf/H3_AP202407171638007101_1.pdf?1721240909000.pdf
生物医药行业专题：DRG_DIP更新报告：院端变革加速，结构持续优化,德邦证券,2024-07-16,化学制药,https://pdf.dfcfw.com/pdf/H3_AP202407161637948674_1.pdf?1721123910000.pdf
医药生物：日本药店发展史对中国药店的启示,国联证券,2024-07-16,化学制药,https://pdf.dfcfw.com/pdf/H3_AP202407161637951217_1.pdf?1721122713000.pdf
医药生物行业周报：关注院内品种修复，把握底部反弹机会,中泰证券,2024-07-16,化学制药,https://pdf.dfcfw.com/pdf/H3_AP202407161637950234_1.pdf?1721122713000.pdf
新质生产力系列：中国仿制药与创新药拓展海外市场研究分析,头豹研究院,2024-07-16,化学制药,https://pdf.dfcfw.com/pdf/H3_AP202407161637970877_1.pdf?1721158866000.pdf
医药行业周报：Arcutis创新疗法获FDA批准，用于治疗AD,太平洋,2024-07-15,化学制药,https://pdf.dfcfw.com/pdf/H3_AP202407151637906787_1.pdf?1721032442000.pdf
医药行业周报：益普生以10.3亿美元囊获潜在FIC的ADC新药,太平洋,2024-07-15,化学制药,https://pdf.dfcfw.com/pdf/H3_AP202407151637906806_1.pdf?1721032442000.pdf
生物医药行业周报：放射性药物鼓励及规范政策不断，关注核药行业发展机遇,平安证券,2024-07-15,化学制药,https://pdf.dfcfw.com/pdf/H3_AP202407151637906834_1.pdf?1721035974000.pdf
医药生物行业周报：市场情绪渐稳，建议中长期角度关注优质核心资产,信达证券,2024-07-15,化学制药,https://pdf.dfcfw.com/pdf/H3_AP202407151637924164_1.pdf?1721081121000.pdf
医药生物行业周报：关注业绩边际变化趋势，布局个股机会,东海证券,2024-07-15,化学制药,https://pdf.dfcfw.com/pdf/H3_AP202407151637924476_1.pdf?1721081242000.pdf
医药行业周报：和黄研发日详解新一轮研发潜力，Syk抑制剂潜在下一个重磅大品种,德邦证券,2024-07-15,化学制药,https://pdf.dfcfw.com/pdf/H3_AP202407151637925906_1.pdf?1721081040000.pdf
医药生物行业周报：关注原料药供给侧变化带来业绩趋势转变,华鑫证券,2024-07-15,化学制药,https://pdf.dfcfw.com/pdf/H3_AP202407151637935005_1.pdf?1721079298000.pdf
辅助生殖行业报告：从产业链视角探索辅助生殖行业发展逻辑,国金证券,2024-07-14,化学制药,https://pdf.dfcfw.com/pdf/H3_AP202407131637872004_1.pdf?1720970891000.pdf
医药生物行业双周报：《全链条支持创新药发展实施方案》落地,东莞证券,2024-07-14,化学制药,https://pdf.dfcfw.com/pdf/H3_AP202407141637891615_1.pdf?1720985120000.pdf
新药周观点：辉瑞Danuglipron重获重视，国内企业布局如火如荼,国投证券,2024-07-14,化学制药,https://pdf.dfcfw.com/pdf/H3_AP202407141637895827_1.pdf?1720994763000.pdf
医药行业周报：政策催化不断，全面看多医药创新及多方向医药底部资产,民生证券,2024-07-14,化学制药,https://pdf.dfcfw.com/pdf/H3_AP202407141637897063_1.pdf?1721038106000.pdf
中国抗体药物行业市场规模测算逻辑模型 头豹词条报告系列,头豹研究院,2024-07-12,化学制药,https://pdf.dfcfw.com/pdf/H3_AP202407121637840995_1.pdf?1720812917000.pdf
医药行业周报：CDE发布征求意见稿，规范AAV基因治疗产品非临床研究,太平洋,2024-07-11,化学制药,https://pdf.dfcfw.com/pdf/H3_AP202407111637785238_1.pdf?1720698463000.pdf
医药行业周报：UniQure在研基因疗法AMT-130临床试验中期结果积极,太平洋,2024-07-11,化学制药,https://pdf.dfcfw.com/pdf/H3_AP202407111637786093_1.pdf?1720701456000.pdf
医药行业周报：礼来以32美元收购Morphic，囊获IBD相关管线,太平洋,2024-07-11,化学制药,https://pdf.dfcfw.com/pdf/H3_AP202407111637786094_1.pdf?1720701456000.pdf
医药生物行业双周报2024年第14期总第112期：《全链条支持创新药发展实施方案》审议通过创新药板块迎来政策利好,长城国瑞证券,2024-07-10,化学制药,https://pdf.dfcfw.com/pdf/H3_AP202407101637742517_1.pdf?1720607778000.pdf
药品出海行业研究报告：中国力量河出伏流，出海浪潮中各显身手,国元证券,2024-07-10,化学制药,https://pdf.dfcfw.com/pdf/H3_AP202407101637745578_1.pdf?1720606541000.pdf
医药生物行业周报：《全链条支持创新药发展实施方案》落地，积极拥抱国产创新浪潮,中泰证券,2024-07-09,化学制药,https://pdf.dfcfw.com/pdf/H3_AP202407091637704580_1.pdf?1720515133000.pdf
医药行业：行业底部明确，聚焦优质细分领域和个股,首创证券,2024-07-09,化学制药,https://pdf.dfcfw.com/pdf/H3_AP202407091637715539_1.pdf?1720540037000.pdf
2024年中国帕金森病药物治疗行业概览：患病负担全球占比36.5%，治疗方案由多巴胺替代转向精准诊疗前景如何？,头豹研究院,2024-07-09,化学制药,https://pdf.dfcfw.com/pdf/H3_AP202407091637725872_1.pdf?1720554788000.pdf
创新药专题：2024年下半年创新药投资手册,西南证券,2024-07-09,化学制药,https://pdf.dfcfw.com/pdf/H3_AP202407091637728107_1.pdf?1720558310000.pdf
医药行业2024年7月投资月报：中报业绩进入披露期，精选景气个股,西南证券,2024-07-08,化学制药,https://pdf.dfcfw.com/pdf/H3_AP202407071637651195_1.pdf?1720431016000.pdf
生物医药Ⅱ行业周报：Tau聚集抑制剂提交MAA，有望成为首款AD口服靶向药,太平洋,2024-07-08,化学制药,https://pdf.dfcfw.com/pdf/H3_AP202407071637653171_1.pdf?1720422169000.pdf
生物医药行业周报：全链条支持创新药发展实施方案发布，释放积极信号,平安证券,2024-07-08,化学制药,https://pdf.dfcfw.com/pdf/H3_AP202407081637663437_1.pdf?1720431641000.pdf
新药周观点：全链条支持创新药政策通过，看好板块后续行情,国投证券,2024-07-08,化学制药,https://pdf.dfcfw.com/pdf/H3_AP202407081637663493_1.pdf?1720431756000.pdf
医药行业周报：全链条支持创新药发展,华鑫证券,2024-07-08,化学制药,https://pdf.dfcfw.com/pdf/H3_AP202407081637666979_1.pdf?1720432452000.pdf
医药生物：设备更新贷款财政贴息政策发布，关注设备龙头底部机遇,中泰证券,2024-07-08,化学制药,https://pdf.dfcfw.com/pdf/H3_AP202407081637665095_1.pdf?1720428532000.pdf
医药行业周报：创新全链条支持政策催化，积极看好医药底部资产,民生证券,2024-07-08,化学制药,https://pdf.dfcfw.com/pdf/H3_AP202407081637684850_1.pdf?1720474439000.pdf
2024年中国获得性血友病药物治疗行业概览：近6万人患病，国产药品发展空间如何？,头豹研究院,2024-07-08,化学制药,https://pdf.dfcfw.com/pdf/H3_AP202407081637686712_1.pdf?1720470622000.pdf
医药行业月报24_06：国产GLP-1亮相2024ADA,中国银河,2024-07-07,化学制药,https://pdf.dfcfw.com/pdf/H3_AP202407061637619838_1.pdf?1720348030000.pdf
医药行业7月策略报告：低估值+中报选股策略，精选医药子行业龙头,东吴证券,2024-07-07,化学制药,https://pdf.dfcfw.com/pdf/H3_AP202407061637629585_1.pdf?1720349624000.pdf
医药行业周报：礼来1.4亿美元首付款引进靶向GPCR放射性药物,太平洋,2024-07-07,化学制药,https://pdf.dfcfw.com/pdf/H3_AP202407071637643686_1.pdf?1720355068000.pdf
医药行业周报：FDA批准礼来阿尔茨海默病疗法,太平洋,2024-07-07,化学制药,https://pdf.dfcfw.com/pdf/H3_AP202407071637643827_1.pdf?1720355578000.pdf
医药行业周报：强生抗肿瘤双抗新药在韩国获批上市,太平洋,2024-07-07,化学制药,https://pdf.dfcfw.com/pdf/H3_AP202407071637653166_1.pdf?1720386840000.pdf
医药生物行业周报：创新药支持政策+医疗设备更新政策+23Q3低基数，建议重视3季度医药板块投资机会,信达证券,2024-07-07,化学制药,https://pdf.dfcfw.com/pdf/H3_AP202407071637655224_1.pdf?1720433077000.pdf
医药生物：全链条支持方案正式通过，看好创新药放量和出海！,华福证券,2024-07-07,化学制药,https://pdf.dfcfw.com/pdf/H3_AP202407061637626272_1.pdf?1720348753000.pdf
医药行业周报：安进获得Tavneos亚洲等地商业化权益，用于治疗ANCA,太平洋,2024-07-05,化学制药,https://pdf.dfcfw.com/pdf/H3_AP202407051637584008_1.pdf?1720183349000.pdf
医药行业2024年半年度策略：寻找拐点，聚焦创新，关注成长,中原证券,2024-07-05,化学制药,https://pdf.dfcfw.com/pdf/H3_AP202407051637595144_1.pdf?1720201367000.pdf
乳腺癌：两大百亿单品领衔，细分市场异彩纷呈,西南证券,2024-07-05,化学制药,https://pdf.dfcfw.com/pdf/H3_AP202407051637599764_1.pdf?1720208664000.pdf
医药行业周报：艾伯维以2.5亿美元收购Celsius,太平洋,2024-07-04,化学制药,https://pdf.dfcfw.com/pdf/H3_AP202407041637539754_1.pdf?1720081104000.pdf
医药行业周报：板块持续探底，关注GLP-1和业绩超预期个股投资机会（附复发_难治性DLBCL专题研究）,太平洋,2024-07-04,化学制药,https://pdf.dfcfw.com/pdf/H3_AP202407041637539747_1.pdf?1720082151000.pdf
医药行业周报：诺和诺德口服双激动剂在华获批临床，用于减重,太平洋,2024-07-04,化学制药,https://pdf.dfcfw.com/pdf/H3_AP202407041637539760_1.pdf?1720081104000.pdf
医药行业周报：阿斯利康奥希替尼新适应症在华获批,太平洋,2024-07-04,化学制药,https://pdf.dfcfw.com/pdf/H3_AP202407041637539795_1.pdf?1720081191000.pdf
医药板块7月投资策略：重拾信心，寻找稳增长个股,中邮证券,2024-07-04,化学制药,https://pdf.dfcfw.com/pdf/H3_AP202407041637560055_1.pdf?1720121553000.pdf
ADC药物适应症系列之胃癌：HER2+胃癌治疗迈入ADC时代，CLDN18.2靶点潜力已现,平安证券,2024-07-03,化学制药,https://pdf.dfcfw.com/pdf/H3_AP202407031637511802_1.pdf?1720028136000.pdf
医药行业周报：罗氏Crovalimab获CHMP积极意见，用于治疗PNH,太平洋,2024-07-03,化学制药,https://pdf.dfcfw.com/pdf/H3_AP202407031637521417_1.pdf?1720042170000.pdf
原料药行业动态点评：部分产品价格企稳，关注后续价格走势,中银证券,2024-07-02,化学制药,https://pdf.dfcfw.com/pdf/H3_AP202407021637463191_1.pdf?1719934787000.pdf
医药生物7月月报：医药价值突出，关注Q2、把握底部,中泰证券,2024-07-01,化学制药,https://pdf.dfcfw.com/pdf/H3_AP202407011637130137_1.pdf?1719829085000.pdf
医药行业周报：关注原料药产业的景气度变化,华鑫证券,2024-07-01,化学制药,https://pdf.dfcfw.com/pdf/H3_AP202407011637119345_1.pdf?1719827141000.pdf
生物医药行业新药周观点：24年医保调整工作启动，国内企业约32款创新药有望首次参与医保谈判,国投证券,2024-07-01,化学制药,https://pdf.dfcfw.com/pdf/H3_AP202407011637125068_1.pdf?1719817525000.pdf
生物医药行业：体重管理助力慢病防治，国内减肥药在研管线争先竞渡,平安证券,2024-07-01,化学制药,https://pdf.dfcfw.com/pdf/H3_AP202407011637125116_1.pdf?1719819934000.pdf
医药行业周报：关注GLP-1赛道以及医药底部资产,民生证券,2024-07-01,化学制药,https://pdf.dfcfw.com/pdf/H3_AP202407011637206596_1.pdf?1719873390000.pdf
医药生物行业周报：医保目录调整启动，精选优质个股,东海证券,2024-07-01,化学制药,https://pdf.dfcfw.com/pdf/H3_AP202407011637424168_1.pdf?1719868953000.pdf
医药行业：登台2024年ADA大会，中国减重降糖药物引人注目,西南证券,2024-07-01,化学制药,https://pdf.dfcfw.com/pdf/H3_AP202407011637133570_1.pdf?1719848624000.pdf
医药生物：设备更新贷款财政贴息政策落地，板块有望迎来全面高增长,中邮证券,2024-06-28,化学制药,https://pdf.dfcfw.com/pdf/H3_AP202406281637000485_1.pdf?1719581560000.pdf
医药行业点评：体重管理助力慢病防治，国内减肥药在研管线争先竞渡,平安证券,2024-06-27,化学制药,https://pdf.dfcfw.com/pdf/H3_AP202406271636969175_1.pdf?1719520881000.pdf
医药行业：银屑病生物制剂用药全景图—从发病机制TNF-α_IL-23_IL-17轴出发，生物制剂治疗银屑病占比逐步提升,平安证券,2024-06-26,化学制药,https://pdf.dfcfw.com/pdf/H3_AP202406261636906256_1.pdf?1719412480000.pdf
医药行业周报：Vyvgart Hytrulo获批新适应症，用于治疗CIDP,太平洋,2024-06-26,化学制药,https://pdf.dfcfw.com/pdf/H3_AP202406261636906249_1.pdf?1719408766000.pdf
医药行业周报：减肥药Pemvidutide二期数据亮眼，减重近80%为脂肪,太平洋,2024-06-26,化学制药,https://pdf.dfcfw.com/pdf/H3_AP202406261636906248_1.pdf?1719408766000.pdf
生物安全法案深度复盘报告：2024H2国会立法进度或变缓，生物安全法案立法概率降低,平安证券,2024-06-26,化学制药,https://pdf.dfcfw.com/pdf/H3_AP202406261636923628_1.pdf?1719432271000.pdf
医药行业周报：关注原料药产业的供需变化,华鑫证券,2024-06-25,化学制药,https://pdf.dfcfw.com/pdf/H3_AP202406251636857488_1.pdf?1719305620000.pdf
医药行业周报：短期情绪演绎，静待市场回暖,西南证券,2024-06-24,化学制药,https://pdf.dfcfw.com/pdf/H3_AP202406241636810962_1.pdf?1719227708000.pdf
医药行业2024年中期策略报告：内看复苏，外看出海，远看创新,平安证券,2024-06-24,化学制药,https://pdf.dfcfw.com/pdf/H3_AP202406241636814621_1.pdf?1719225956000.pdf
原料药深度报告：抗生素价格处于高位，肝素出口量恢复良好增长,中邮证券,2024-06-24,化学制药,https://pdf.dfcfw.com/pdf/H3_AP202406241636825708_1.pdf?1719247465000.pdf
医药行业周报：聚焦半年报，关注GLP-1和医药底部资产,民生证券,2024-06-24,化学制药,https://pdf.dfcfw.com/pdf/H3_AP202406241636827678_1.pdf?1719251975000.pdf
医药行业2024年中期策略报告：支付约束下的行业突围：待时而动,中国银河,2024-06-24,化学制药,https://pdf.dfcfw.com/pdf/H3_AP202406241636815579_1.pdf?1719240025000.pdf
医药行业周报：吉利德长效HIV疗法3期试验结果亮眼，一年仅需2针,太平洋,2024-06-24,化学制药,https://pdf.dfcfw.com/pdf/H3_AP202406241636816820_1.pdf?1719234699000.pdf
医药生物行业动态点评：重症医学政策出台，助推市场扩容,东方财富证券,2024-06-24,化学制药,https://pdf.dfcfw.com/pdf/H3_AP202406241636818761_1.pdf?1719239391000.pdf
医药生物行业专题研究：脑机融合，引领医疗健康新浪潮,东方财富证券,2024-06-24,化学制药,https://pdf.dfcfw.com/pdf/H3_AP202406241636819128_1.pdf?1719240128000.pdf
医药生物行业周报：积极把握Q2超预期机会：GLP-1、特色原料药、创新药,中泰证券,2024-06-24,化学制药,https://pdf.dfcfw.com/pdf/H3_AP202406241636819239_1.pdf?1719240491000.pdf
新药周观点：HIV暴露前预防迎来积极进展，长效方案有望成为主流,国投证券,2024-06-23,化学制药,https://pdf.dfcfw.com/pdf/H3_AP202406231636803475_1.pdf?1719175574000.pdf
医药生物行业动态点评：大规模设备更新政策启航，开局稳健,东方财富证券,2024-06-21,化学制药,https://pdf.dfcfw.com/pdf/H3_AP202406211636754051_1.pdf?1718976405000.pdf
医药行业周报：Woolsey小分子疗法2期临床结果积极，用于治疗ALS,太平洋,2024-06-21,化学制药,https://pdf.dfcfw.com/pdf/H3_AP202406211636755989_1.pdf?1718981946000.pdf
海外创新药龙头研究系列（一）：礼来LLY.N：从管线变动趋势看MNC未来研发策略-降糖领域加速兑现，肿瘤、自免管线持续加码,西南证券,2024-06-21,化学制药,https://pdf.dfcfw.com/pdf/H3_AP202406211636762383_1.pdf?1718989684000.pdf
海外创新药龙头研究系列（二）：诺和诺德NVO.N：从管线变动趋势看MNC未来研发策略-强化降糖减重全球领先地位，内生+外延布局新兴治疗领域,西南证券,2024-06-21,化学制药,https://pdf.dfcfw.com/pdf/H3_AP202406211636762374_1.pdf?1718990136000.pdf
医药生物行业2024年中期投资策略：医疗生态趋于重构，关注底部优质资产机会,国信证券,2024-06-21,化学制药,https://pdf.dfcfw.com/pdf/H3_AP202406211636762372_1.pdf?1718989313000.pdf
消化道黏膜疾病治疗药物的精准化迭代路径解析 头豹词条报告系列,头豹研究院,2024-06-21,化学制药,https://pdf.dfcfw.com/pdf/H3_AP202406211636769811_1.pdf?1718999701000.pdf
2024年中国肌萎缩侧索硬化症药物治疗行业概览：ALS患病群体超20万人，精准治疗方案面临挑战（摘要版）,头豹研究院,2024-06-21,化学制药,https://pdf.dfcfw.com/pdf/H3_AP202406211636769815_1.pdf?1718999861000.pdf
医药行业周报：强生Nipocalimab达到2期临床主要终点，用于治疗SjD,太平洋,2024-06-20,化学制药,https://pdf.dfcfw.com/pdf/H3_AP202406201636706637_1.pdf?1718897334000.pdf
医药行业周报：艾伯维IL-23抑制剂再获FDA批准，治疗溃疡性结肠炎,太平洋,2024-06-20,化学制药,https://pdf.dfcfw.com/pdf/H3_AP202406201636706636_1.pdf?1718897334000.pdf
医药行业周报：礼邦医药小分子新药拟纳入突破性治疗品种,太平洋,2024-06-19,化学制药,https://pdf.dfcfw.com/pdf/H3_AP202406191636687416_1.pdf?1718816737000.pdf
医药行业周报：益普生FIC小分子获FDA批准，用于治疗PBC,太平洋,2024-06-19,化学制药,https://pdf.dfcfw.com/pdf/H3_AP202406191636689424_1.pdf?1718819645000.pdf
医药行业周报：诺华芦可替尼新适应症在华获批，用于治疗cGVHD,太平洋,2024-06-19,化学制药,https://pdf.dfcfw.com/pdf/H3_AP202406191636689423_1.pdf?1718819645000.pdf
医药行业周报：再生元IL-6受体靶向单抗再获FDA批准，用于治疗pJIA,太平洋,2024-06-18,化学制药,https://pdf.dfcfw.com/pdf/H3_AP202406181636610107_1.pdf?1718723610000.pdf
医药行业周报：美生物安全法案加入NDAA未获批准，板块情绪出现快速恢复（附局限期小细胞肺癌专题研究）,太平洋,2024-06-18,化学制药,https://pdf.dfcfw.com/pdf/H3_AP202406181636610106_1.pdf?1718726520000.pdf
医药生物行业周报：科创板表现亮眼，积极关注Q2业绩,中泰证券,2024-06-17,化学制药,https://pdf.dfcfw.com/pdf/H3_AP202406171636464616_1.pdf?1718617197000.pdf
2024年中国合同研究组织（CRO）行业概览：降本增效核心驱动，一站式发展成大势所趋（摘要版）,头豹研究院,2024-06-17,化学制药,https://pdf.dfcfw.com/pdf/H3_AP202406171636506028_1.pdf?1718653751000.pdf
医药行业周报：聚焦二季度业绩与经营拐点，看好GLP-1产业链、仿制药研发等,民生证券,2024-06-17,化学制药,https://pdf.dfcfw.com/pdf/H3_AP202406171636510189_1.pdf?1718660461000.pdf
医药行业国企改革报告：国企改革正当时，船到中流当奋楫,海通国际,2024-06-17,化学制药,https://pdf.dfcfw.com/pdf/H3_AP202406171636462389_1.pdf?1718701179000.pdf
新药周观点：泽璟制药JAK抑制剂重症斑秃3期成功，后续数据披露值得期待,国投证券,2024-06-16,化学制药,https://pdf.dfcfw.com/pdf/H3_AP202406161636459589_1.pdf?1718576112000.pdf
医药行业2024年中期投资策略：基本面持续改善，政策鼓励支持，全面看多医药底部资产,民生证券,2024-06-14,化学制药,https://pdf.dfcfw.com/pdf/H3_AP202406141636295842_1.pdf?1718394369000.pdf
ADC药物全景图系列（一）：新技术平台崭露头角，乳腺癌治疗迎来突破,平安证券,2024-06-13,化学制药,https://pdf.dfcfw.com/pdf/H3_AP202406131636104390_1.pdf?1718307356000.pdf
医药生物行业2024年下半年投资策略：业绩承压，精选方向,东莞证券,2024-06-12,化学制药,https://pdf.dfcfw.com/pdf/H3_AP202406121636001239_1.pdf?1718210136000.pdf
医药板块中期策略：一季度是医药阶段性业绩低点，二三季度整体拐点将来临,国金证券,2024-06-11,化学制药,https://pdf.dfcfw.com/pdf/H3_AP202406111635940820_1.pdf?1718098377000.pdf
医药生物行业医改24重点任务：明确高度重视创新药、中药,华福证券,2024-06-11,化学制药,https://pdf.dfcfw.com/pdf/H3_AP202406111635940791_1.pdf?1718102685000.pdf
医药生物行业周报：政策助推ICU建设提速，器械巨头加码重症监护赛道,上海证券,2024-06-11,化学制药,https://pdf.dfcfw.com/pdf/H3_AP202406111635940846_1.pdf?1718091187000.pdf
医药行业周报：医药情绪回落，仍看好后续行情,西南证券,2024-06-11,化学制药,https://pdf.dfcfw.com/pdf/H3_AP202406111635944653_1.pdf?1718102894000.pdf
医药行业周报：回归业绩主线，关注低估值、经营边际改善的底部医药资产,民生证券,2024-06-11,化学制药,https://pdf.dfcfw.com/pdf/H3_AP202406111635968377_1.pdf?1718128861000.pdf
新药周观点：ASCO 2024年会闭幕，国产创新双抗崭露头角,国投证券,2024-06-10,化学制药,https://pdf.dfcfw.com/pdf/H3_AP202406101635918254_1.pdf?1718042440000.pdf
医药行业周报：Vir创新疗法2期临床试验成功，用于治疗HDV感染,太平洋,2024-06-07,化学制药,https://pdf.dfcfw.com/pdf/H3_AP202406071635855358_1.pdf?1717766833000.pdf
医药行业周报：赛诺菲鼻喷疫苗在中国获批临床，预防婴幼儿RSV感染,太平洋,2024-06-06,化学制药,https://pdf.dfcfw.com/pdf/H3_AP202406061635689679_1.pdf?1717682330000.pdf
医药行业周报：艾伯维ADC药物Teliso-V拟纳入突破性治疗品种,太平洋,2024-06-05,化学制药,https://pdf.dfcfw.com/pdf/H3_AP202406051635581787_1.pdf?1717605015000.pdf
非小细胞肺癌靶向治疗：中国患病负担居全球前列，集采带动国产药品话语权提升 头豹词条报告系列,头豹研究院,2024-06-05,化学制药,https://pdf.dfcfw.com/pdf/H3_AP202406051635597342_1.pdf?1717616118000.pdf
医药行业周报：诺华BTK抑制剂Remibrutini三期临床试验成功,太平洋,2024-06-04,化学制药,https://pdf.dfcfw.com/pdf/H3_AP202406041635326388_1.pdf?1717493009000.pdf
创新药专题：多发性骨髓瘤：BCMA靶向疗法推向前线,西南证券,2024-06-04,化学制药,https://pdf.dfcfw.com/pdf/H3_AP202406041635367789_1.pdf?1717533664000.pdf
医药行业周报：默沙东将以30亿美元收购EyeBio，囊获FIC三抗疗法,太平洋,2024-06-03,化学制药,https://pdf.dfcfw.com/pdf/H3_AP202406031635239000_1.pdf?1717405067000.pdf
医药行业周报：Soterios创新疗法STS-01二期临床成功，用于治疗斑秃,太平洋,2024-06-03,化学制药,https://pdf.dfcfw.com/pdf/H3_AP202406031635239001_1.pdf?1717405067000.pdf
生物医药Ⅱ行业新药周观点：康方PD-1_VEGF双抗单药头对头K药获阳性结果，有望成为未来IO治疗基石药物,国投证券,2024-06-03,化学制药,https://pdf.dfcfw.com/pdf/H3_AP202406031635239008_1.pdf?1717405067000.pdf
医药生物6月月报：把握Q2业绩，持续看好创新_出海、国改_红利,中泰证券,2024-06-03,化学制药,https://pdf.dfcfw.com/pdf/H3_AP202406031635239053_1.pdf?1717405562000.pdf
医药行业周报：关注资源型品种及上游产业链,华鑫证券,2024-06-03,化学制药,https://pdf.dfcfw.com/pdf/H3_AP202406031635242930_1.pdf?1717410491000.pdf
创新药专题：中国之声闪耀2024ASCO,西南证券,2024-06-03,化学制药,https://pdf.dfcfw.com/pdf/H3_AP202406031635235294_1.pdf?1717409090000.pdf
医药行业周报：短期调整不改医药基本面向上，继续看好医药创新方向,民生证券,2024-06-03,化学制药,https://pdf.dfcfw.com/pdf/H3_AP202406031635268140_1.pdf?1717435269000.pdf
医药生物行业周报：耐心布局，精选个股,东海证券,2024-06-03,化学制药,https://pdf.dfcfw.com/pdf/H3_AP202406031635275803_1.pdf?1717445421000.pdf
医药行业周报：板块持续缩量下跌，潜在政策催化或引领反弹（附Trop2 ADC在2L+基因驱动阴性NSCLC中的探索研究）,太平洋,2024-06-03,化学制药,https://pdf.dfcfw.com/pdf/H3_AP202406031635283797_1.pdf?1717447770000.pdf
中国消化道黏膜疾病药物治疗行业市场规模测算逻辑模型 头豹词条报告系列,头豹研究院,2024-05-31,化学制药,https://pdf.dfcfw.com/pdf/H3_AP202406251636880553_1.pdf?1719346184000.pdf
医药生物行业2023年报及2024一季报分析之CRO、CDMO：寒冬已逝，黎明将临，底部区域积极配置,中泰证券,2024-05-30,化学制药,https://pdf.dfcfw.com/pdf/H3_AP202405301634928731_1.pdf?1717061390000.pdf
医药行业周报：Insmed首创DPP1抑制剂NCFBE三期临床成功,太平洋,2024-05-30,化学制药,https://pdf.dfcfw.com/pdf/H3_AP202405301634933494_1.pdf?1717076388000.pdf
医药行业周报：卫材_渤健AD新药Lecanemab在韩国获批上市,太平洋,2024-05-29,化学制药,https://pdf.dfcfw.com/pdf/H3_AP202405291634801684_1.pdf?1716979989000.pdf
医药与健康护理行业周报：《北京市加快医药健康协同创新行动计划（2024-2026年）》印发，支持创新药械发展,海通国际,2024-05-28,化学制药,https://pdf.dfcfw.com/pdf/H3_AP202405281634735790_1.pdf?1716886568000.pdf
