研报名称,机构名称,发布时间,行业,研报地址
氟化工行业周报：萤石行情持续复苏、制冷剂继续向上，印度对我国HFCs制冷剂发起反倾销调查,开源证券,2025-09-29,化学原料,https://pdf.dfcfw.com/pdf/H3_AP202509281752324332_1.pdf?1759130173000.pdf
氟化工行业月报：行业高景气持续，企业盈利能力提升,东海证券,2025-09-23,化学原料,https://pdf.dfcfw.com/pdf/H3_AP202509231749146227_1.pdf?1758649153000.pdf
可持续航空燃料（SAF）行业点评：欧盟SAF强制添加需求拉动，国内生物航煤出口量价齐升,国信证券,2025-09-18,化学原料,https://pdf.dfcfw.com/pdf/H3_AP202509181746158058_1.pdf?1758227936000.pdf
基础化工行业研究：关税压力测试下胎企开始分化，下半年行业有望改善,国金证券,2025-09-17,化学原料,https://pdf.dfcfw.com/pdf/H3_AP202509171745453273_1.pdf?1758129767000.pdf
生物柴油行业周报：SAF本周实现高位继续上涨，单吨到岸价突破2700美元,民生证券,2025-09-09,化学原料,https://pdf.dfcfw.com/pdf/H3_AP202509091740672552_1.pdf?1757422597000.pdf
2025年中国民爆行业研究报告：_十四五_收官显成效，内外需求双轮驱动（精华版）,头豹研究院,2025-09-09,化学原料,https://pdf.dfcfw.com/pdf/H3_AP202509091740796588_1.pdf?1757447546000.pdf
天然色素行业点评：FDA计划淘汰合成色素，国内天然色素企业或受益于需求爆发,山西证券,2025-09-03,化学原料,https://pdf.dfcfw.com/pdf/H3_AP202509031738338910_1.pdf?1756895017000.pdf
氟化工行业：2025年8月月度观察：主流制冷剂价格持续上涨，液冷板块开启增长空间,国信证券,2025-09-02,化学原料,https://pdf.dfcfw.com/pdf/H3_AP202509021738032659_1.pdf?1756824884000.pdf
氟化工行业周报：制冷剂企业2025H1利润继续断层式上涨，萤石景气有所复苏，制冷剂价格或将继续上调，行情远未结束,开源证券,2025-08-31,化学原料,https://pdf.dfcfw.com/pdf/H3_AP202508311737359879_1.pdf?1756678726000.pdf
市场洞察：从实验室到深空，陶瓷基复合材料加速商业化落地,头豹研究院,2025-08-26,化学原料,https://pdf.dfcfw.com/pdf/H3_AP202508261734888639_1.pdf?1756237785000.pdf
原油周报：美国原油库存下降，对油价有所支撑,东吴证券,2025-08-24,化学原料,https://pdf.dfcfw.com/pdf/H3_AP202508241733472111_1.pdf?1756042137000.pdf
基础化工行业研究：AI系列深度（五）：AI服务器散热进入液冷时代，导热散热材料需求突显,国金证券,2025-08-21,化学原料,https://pdf.dfcfw.com/pdf/H3_AP202508211731724669_1.pdf?1755871344000.pdf
大炼化周报：长丝价格拉涨，产销增加,东吴证券,2025-08-17,化学原料,https://pdf.dfcfw.com/pdf/H3_AP202508171729328767_1.pdf?1755462321000.pdf
氟化工行业周报：萤石价格筑底上涨，制冷剂成交重心持续上移，东阳光、永和股份等2025中报表现较佳,开源证券,2025-08-17,化学原料,https://pdf.dfcfw.com/pdf/H3_AP202508171729193614_1.pdf?1755445921000.pdf
原油周报：美国原油库存量增加，国际油价下降,东吴证券,2025-08-17,化学原料,https://pdf.dfcfw.com/pdf/H3_AP202508171729229087_1.pdf?1755448448000.pdf
聚醚行业点评：出口维持高增长，产品价格触底反弹,民生证券,2025-08-14,化学原料,https://pdf.dfcfw.com/pdf/H3_AP202508141727423096_1.pdf?1755192725000.pdf
氟化工行业月报：制冷剂价格再度提升，行业有望持续高景气,东海证券,2025-08-13,化学原料,https://pdf.dfcfw.com/pdf/H3_AP202508131726814072_1.pdf?1755107843000.pdf
原油周报：国际油价下滑，关注美俄会议走向,东吴证券,2025-08-10,化学原料,https://pdf.dfcfw.com/pdf/H3_AP202508101725059885_1.pdf?1754864603000.pdf
新能源及工业周报：NASA启动100kW月球反应堆项目，2030年前完成部署,海通国际,2025-08-09,化学原料,https://pdf.dfcfw.com/pdf/H3_AP202508091724388084_1.pdf?1754838732000.pdf
环保监管严格和能源成本高企，化工巨头产能退出欧洲市场,环球富盛理财,2025-08-07,化学原料,https://pdf.dfcfw.com/pdf/H3_AP202508071722956213_1.pdf?1754558267000.pdf
农化行业：2025年7月月度观察：钾肥、草甘膦价格上行，磷肥出口价差扩大,国信证券,2025-08-06,化学原料,https://pdf.dfcfw.com/pdf/H3_AP202508061722351745_1.pdf?1754470675000.pdf
化工行业行业深度报告：“反内卷”系列研究-涤纶长丝产能趋于集中，行业自律激发周期弹性,中国银河,2025-08-01,化学原料,https://pdf.dfcfw.com/pdf/H3_AP202508011719439364_1.pdf?1754045494000.pdf
氟化工行业：2025年7月月度观察：主流制冷剂价格持续上涨，8月空调排产预期上调,国信证券,2025-07-31,化学原料,https://pdf.dfcfw.com/pdf/H3_AP202507311719084679_1.pdf?1753994293000.pdf
直接空气捕集（DAC）行业点评：新兴碳移除技术，固体吸附材料作为核心环节有望受益,山西证券,2025-07-29,化学原料,https://pdf.dfcfw.com/pdf/H3_AP202507281717318337_1.pdf?1753781646000.pdf
农药行业快评：“正风治卷”三年行动开启，农药行业有望迎来景气拐点,国信证券,2025-07-28,化学原料,https://pdf.dfcfw.com/pdf/H3_AP202507281717200569_1.pdf?1753723565000.pdf
基础化工行业研究：多产品涨价，反内卷继续推进,国金证券,2025-07-27,化学原料,https://pdf.dfcfw.com/pdf/H3_AP202507271716633787_1.pdf?1753641846000.pdf
原油周报：美国原油产量下滑，钻机&压裂车队数量下降,东吴证券,2025-07-27,化学原料,https://pdf.dfcfw.com/pdf/H3_AP202507271716535830_1.pdf?1753627612000.pdf
化工“反内卷”系列报告（四）：产能投放高峰已过，供需格局好转叠加行业自律助力有机硅盈利修复,开源证券,2025-07-24,化学原料,https://pdf.dfcfw.com/pdf/H3_AP202507241714772830_1.pdf?1753369804000.pdf
化工“反内卷”系列报告（五）：涤纶长丝：“反内卷”先锋，行业扩产已到尾声，底部利润有望向上抬升,开源证券,2025-07-24,化学原料,https://pdf.dfcfw.com/pdf/H3_AP202507241714774166_1.pdf?1753370020000.pdf
化工“反内卷”系列报告（开篇）：“反内卷”势在必行，化工行业新一轮供给侧改革呼之欲出,开源证券,2025-07-22,化学原料,https://pdf.dfcfw.com/pdf/H3_AP202507221713446769_1.pdf?1753178932000.pdf
化工“反内卷”系列报告（二）：聚酯瓶片：本轮扩产周期进入尾声，行业自律有望促进盈利能力向上修复,开源证券,2025-07-21,化学原料,https://pdf.dfcfw.com/pdf/H3_AP202507211712837033_1.pdf?1753091475000.pdf
化工行业周报：行业催化再起，关注民爆、TDI板块,中国银河,2025-07-21,化学原料,https://pdf.dfcfw.com/pdf/H3_AP202507211712858157_1.pdf?1753095763000.pdf
能源化工：严厉打击黑加油站，加大力度推进成品油消费税改革,东吴证券,2025-07-21,化学原料,https://pdf.dfcfw.com/pdf/H3_AP202507211712996612_1.pdf?1753114447000.pdf
大炼化周报：长丝价格承压，产销上升,东吴证券,2025-07-13,化学原料,https://pdf.dfcfw.com/pdf/H3_AP202507131707988052_1.pdf?1752414888000.pdf
原油周报：OPEC+或将在10月暂停增产,东吴证券,2025-07-13,化学原料,https://pdf.dfcfw.com/pdf/H3_AP202507131708177988_1.pdf?1752427865000.pdf
氟化工行业月报：氟化工企业业绩预增，行业景气度有望维持,东海证券,2025-07-11,化学原料,https://pdf.dfcfw.com/pdf/H3_AP202507101706535035_1.pdf?1752215763000.pdf
农化行业：2025年6月月度观察：钾肥、草甘膦价格上行，杀虫剂“康宽”供给突发受限,国信证券,2025-07-07,化学原料,https://pdf.dfcfw.com/pdf/H3_AP202507071704710602_1.pdf?1751923546000.pdf
大炼化周报：长丝价格继续下跌，库存增加,东吴证券,2025-07-06,化学原料,https://pdf.dfcfw.com/pdf/H3_AP202507061704043420_1.pdf?1751833655000.pdf
原油周报：OPEC+或将在八月继续增产,东吴证券,2025-07-06,化学原料,https://pdf.dfcfw.com/pdf/H3_AP202507061703991076_1.pdf?1751820689000.pdf
氟化工行业周报：制冷剂报价坚挺上行，趋势延续,开源证券,2025-07-06,化学原料,https://pdf.dfcfw.com/pdf/H3_AP202507061703991095_1.pdf?1751819896000.pdf
氟化工行业：2025年6月月度观察：三代制冷剂长协价格落地，重视供给侧受限品种,国信证券,2025-07-01,化学原料,https://pdf.dfcfw.com/pdf/H3_AP202507011701137647_1.pdf?1751406720000.pdf
基础化工2025中期投资策略：供给优化的弹性β，需求驱动的优质α,东海证券,2025-06-30,化学原料,https://pdf.dfcfw.com/pdf/H3_AP202506301700437565_1.pdf?1751308321000.pdf
生物柴油行业周报：HVO&SAF价格中枢继续上移，原材料端价格仍处高位,民生证券,2025-06-30,化学原料,https://pdf.dfcfw.com/pdf/H3_AP202506301700518937_1.pdf?1751318775000.pdf
大炼化周报：长丝价格增加，产销明显上升,东吴证券,2025-06-29,化学原料,https://pdf.dfcfw.com/pdf/H3_AP202506291699764261_1.pdf?1751219280000.pdf
染料行业点评：H酸价格单日上涨超5%，有望带动活性染料价格,民生证券,2025-06-25,化学原料,https://pdf.dfcfw.com/pdf/H3_AP202506251697298381_1.pdf?1750857051000.pdf
化工行业周报：硫化锂为固态电池电解质主流量产趋势，瓶片宣布联合减产后价格有所上扬,开源证券,2025-06-23,化学原料,https://pdf.dfcfw.com/pdf/H3_AP202506231696112122_1.pdf?1750687478000.pdf
原油周报：伊以冲突局势尚未明朗，国际油价维持高位,东吴证券,2025-06-22,化学原料,https://pdf.dfcfw.com/pdf/H3_AP202506221695569251_1.pdf?1750611431000.pdf
大炼化周报：长丝价格回暖，产销明显下降,东吴证券,2025-06-22,化学原料,https://pdf.dfcfw.com/pdf/H3_AP202506221695611925_1.pdf?1750619362000.pdf
民爆行业深度报告：行业整合加速，需求稳健增长,太平洋,2025-06-18,化学原料,https://pdf.dfcfw.com/pdf/H3_AP202506181693066590_1.pdf?1750244562000.pdf
市场洞察：2025年中国环氧丙烷行业简报：全球供给重构——海外产能退出下的中国机遇与全球布局,头豹研究院,2025-06-18,化学原料,https://pdf.dfcfw.com/pdf/H3_AP202506181693289292_1.pdf?1750276931000.pdf
大炼化周报：长丝价格下跌，产销增加,东吴证券,2025-06-15,化学原料,https://pdf.dfcfw.com/pdf/H3_AP202506151691432616_1.pdf?1750012558000.pdf
钾肥行业快报：中国钾肥大合同落定，支撑钾肥景气,华金证券,2025-06-15,化学原料,https://pdf.dfcfw.com/pdf/H3_AP202506141690938068_1.pdf?1749986473000.pdf
原油周报：伊以冲突推动国际油价大幅上涨,东吴证券,2025-06-15,化学原料,https://pdf.dfcfw.com/pdf/H3_AP202506151691346429_1.pdf?1749998855000.pdf
基础化工行业周报：2025年印度钾肥大合同价敲定349美元_吨，有望提振钾肥景气,开源证券,2025-06-09,化学原料,https://pdf.dfcfw.com/pdf/H3_AP202506091687605878_1.pdf?1749477391000.pdf
大炼化周报：长丝价格承压，产销下滑,东吴证券,2025-06-08,化学原料,https://pdf.dfcfw.com/pdf/H3_AP202506081687092010_1.pdf?1749404574000.pdf
原油周报：俄乌冲突升温，国际油价震荡,东吴证券,2025-06-08,化学原料,https://pdf.dfcfw.com/pdf/H3_AP202506081687124951_1.pdf?1749418076000.pdf
氟化工行业周报：制冷剂行情向上趋势延续，产业逻辑不断验证，积极把握投资机会,开源证券,2025-06-07,化学原料,https://pdf.dfcfw.com/pdf/H3_AP202506071686630461_1.pdf?1749378127000.pdf
原油周报：OPEC+讨论7月增产事宜，国际油价波动,东吴证券,2025-06-03,化学原料,https://pdf.dfcfw.com/pdf/H3_AP202506021683456573_1.pdf?1752749691000.pdf
大炼化周报：长丝价格持平，产销大幅增长,东吴证券,2025-06-01,化学原料,https://pdf.dfcfw.com/pdf/H3_AP202506011682804430_1.pdf?1748775900000.pdf
氟化工行业：2025年5月月度观察：二季度空调排产同比增长，三代制冷剂价格持续上涨,国信证券,2025-05-30,化学原料,https://pdf.dfcfw.com/pdf/H3_AP202505301681759009_1.pdf?1748613805000.pdf
2025能源化工业行业白皮书,薪郅互联网科技(上海),2025-05-28,化学原料,https://pdf.dfcfw.com/pdf/H3_AP202505271680173770_1.pdf?1748420203000.pdf
新材料周报：人形机器人格斗大赛正式开赛，轻量化PEEK材料有望高速发展,山西证券,2025-05-28,化学原料,https://pdf.dfcfw.com/pdf/H3_AP202505281680642106_1.pdf?1748447527000.pdf
氟化工：关注萤石资源和政策约束下制冷剂的高景气,信达证券,2025-05-28,化学原料,https://pdf.dfcfw.com/pdf/H3_AP202505281680659471_1.pdf?1748449758000.pdf
化工行业行业周报：化工品价差表现偏强，把握结构性机会,中国银河,2025-05-27,化学原料,https://pdf.dfcfw.com/pdf/H3_AP202505271679933793_1.pdf?1748353236000.pdf
2025年工业清洗剂品牌推荐：工业清洗剂“隐形战场”，本土企业“配方+设备”一体化突围,头豹研究院,2025-05-26,化学原料,https://pdf.dfcfw.com/pdf/H3_AP202505261679571101_1.pdf?1748289150000.pdf
氟化工行业周报：制冷剂4月外贸均价持续抬升，积极关注回调后布局机会,开源证券,2025-05-25,化学原料,https://pdf.dfcfw.com/pdf/H3_AP202505251678987826_1.pdf?1748204673000.pdf
化工行业2024年年报综述：基础化工静待复苏，石油石化保持稳健,中银证券,2025-05-19,化学原料,https://pdf.dfcfw.com/pdf/H3_AP202505191675466307_1.pdf?1747674460000.pdf
大炼化周报：长丝价格上涨，产销大幅增加,东吴证券,2025-05-19,化学原料,https://pdf.dfcfw.com/pdf/H3_AP202505191675272883_1.pdf?1747662738000.pdf
轮胎行业月报：原料成本端压力缓解，关注内外需变化,东海证券,2025-05-14,化学原料,https://pdf.dfcfw.com/pdf/H3_AP202505141672608247_1.pdf?1747228740000.pdf
氟化工行业月报：制冷剂价格维持上行趋势，需求持续提升,东海证券,2025-05-13,化学原料,https://pdf.dfcfw.com/pdf/H3_AP202505131672173808_1.pdf?1747151051000.pdf
大炼化周报：成本端支撑尚存，长丝价格稳中有涨,东吴证券,2025-05-11,化学原料,https://pdf.dfcfw.com/pdf/H3_AP202505111670945249_1.pdf?1746963930000.pdf
大陆能源化工周报,群益证券,2025-05-09,化学原料,https://pdf.dfcfw.com/pdf/H3_AP202505091670035409_1.pdf?1746811158000.pdf
钾肥、磷化工行业：2025年4月月度观察：国际钾肥价格持续上行，磷矿石价格高位运行,国信证券,2025-05-08,化学原料,https://pdf.dfcfw.com/pdf/H3_AP202505081669366461_1.pdf?1746709023000.pdf
化工行业行业周报：聚焦内需主线，静待贸易争端指引,中国银河,2025-04-29,化学原料,https://pdf.dfcfw.com/pdf/H3_AP202504291664346098_1.pdf?1745936334000.pdf
氟化工行业：2025年4月月度观察：空调整体排产保持增长，制冷剂价格超预期上涨,国信证券,2025-04-29,化学原料,https://pdf.dfcfw.com/pdf/H3_AP202504291664557573_1.pdf?1745955296000.pdf
氟化工行业周报：制冷剂报价进一步上涨，需求、政策助力行情延续,开源证券,2025-04-28,化学原料,https://pdf.dfcfw.com/pdf/H3_AP202504271663483010_1.pdf?1745824474000.pdf
化工行业行业周报：焦炭、双酚A价格上探，聚焦化工内需主线,中国银河,2025-04-21,化学原料,https://pdf.dfcfw.com/pdf/H3_AP202504211659947105_1.pdf?1745251574000.pdf
中国合成橡胶行业市场规模测算逻辑模型 头豹词条报告系列,头豹研究院,2025-04-17,化学原料,https://pdf.dfcfw.com/pdf/H3_AP202504171657981678_1.pdf?1744918664000.pdf
氟化工行业月报：制冷剂企业Q1业绩兑现，行业景气持续上行,东海证券,2025-04-15,化学原料,https://pdf.dfcfw.com/pdf/H3_AP202504151656891510_1.pdf?1744737159000.pdf
氟化工行业周报：巨化股份、三美股份、东阳光、永和股份2025Q1业绩亮眼，制冷剂景气持续向上，主升行情徐徐展开,开源证券,2025-04-14,化学原料,https://pdf.dfcfw.com/pdf/H3_AP202504131655988137_1.pdf?1744615701000.pdf
基础化工行业周报：本周百菌清、代森锰锌、菊酯等农药价格上涨，中国调整对原产于美国的进口商品加征关税措施,开源证券,2025-04-14,化学原料,https://pdf.dfcfw.com/pdf/H3_AP202504141656381761_1.pdf?1744649652000.pdf
