研报名称,机构名称,发布时间,行业,研报地址
涤纶长丝行业深度：行业量变到质变，竞争格局改善有望提振利润,财信证券,2024-08-14,化纤行业,https://pdf.dfcfw.com/pdf/H3_AP202408141639273733_1.pdf?1723669765000.pdf
化学纤维行业深度报告：供需格局渐入佳境，盈利中枢或将上移,开源证券,2024-07-04,化纤行业,https://pdf.dfcfw.com/pdf/H3_AP202407041637555885_1.pdf?1720111749000.pdf
地产链化工品追踪系列报告（2024-06）：地产政策持续发力，MDI等化工品月均价环比回升,信达证券,2024-07-03,化纤行业,https://pdf.dfcfw.com/pdf/H3_AP202407031637497501_1.pdf?1720002506000.pdf
化工新材料周报：终端上行周期渐进，看好半导体材料需求持续回暖,平安证券,2024-06-24,化纤行业,https://pdf.dfcfw.com/pdf/H3_AP202406241636809574_1.pdf?1719227914000.pdf
基础化工行业周报：涤纶长丝大厂产销放量，MDI供应偏紧价格上涨,太平洋,2024-06-19,化纤行业,https://pdf.dfcfw.com/pdf/H3_AP202406191636687414_1.pdf?1718817143000.pdf
基础化工：化工行业运行指标跟踪-2024年4月数据,天风证券,2024-06-13,化纤行业,https://pdf.dfcfw.com/pdf/H3_AP202406131636054359_1.pdf?1718268241000.pdf
基础化工行业2024年度中期策略,国金证券,2024-06-13,化纤行业,https://pdf.dfcfw.com/pdf/H3_AP202406131636076911_1.pdf?1718270723000.pdf
涤纶长丝行业点评：涤纶长丝供给端扰动，看好行业景气修复,国信证券,2024-05-14,化纤行业,https://pdf.dfcfw.com/pdf/H3_AP202405141633070561_1.pdf?1715713277000.pdf
