研报名称,机构名称,发布时间,行业,研报地址
医药行业月报（2025年第1期）：医疗设备行业回暖迹象明显,民银证券,2025-03-05,医疗器械,https://pdf.dfcfw.com/pdf/H3_AP202503051644084636_1.pdf?1741209827000.pdf
2025中国创新药械多元支付白皮书,中国人寿再保险,2025-03-05,医疗器械,https://pdf.dfcfw.com/pdf/H3_AP202503051644069297_1.pdf?1741187563000.pdf
公共卫生：脑炎全球威胁，趋势和公众健康影响,WHO,2025-02-27,医疗器械,https://pdf.dfcfw.com/pdf/H3_AP202502271643555209_1.pdf?1740661827000.pdf
2024年中国医疗器械市场海外拓展现状与可行性分析：政策与需求共同通驱动行业高质量发展，国产品牌海外市场深度渗透带动出口贸易快速增长,头豹研究院,2025-02-26,医疗器械,https://pdf.dfcfw.com/pdf/H3_AP202502261643529242_1.pdf?1740601757000.pdf
医疗器械专题之基因测序：分子诊断掌上明珠，四代测序开启规模化应用时代,华安证券,2025-02-24,医疗器械,https://pdf.dfcfw.com/pdf/H3_AP202502241643432197_1.pdf?1740406398000.pdf
医药生物行业行业深度报告：Deepseek冲击波系列报告-医疗AI赋能，大数据价值深度挖掘,中国银河,2025-02-21,医疗器械,https://pdf.dfcfw.com/pdf/H3_AP202502211643350047_1.pdf?1740132551000.pdf
医疗器械行业月度点评：国务院创新药械支持文件出台，政策红利有望进一步释放,财信证券,2025-02-11,医疗器械,https://pdf.dfcfw.com/pdf/H3_AP202502111642973048_1.pdf?1739293437000.pdf
医疗器械-生命信息与支持设备专题：论高国产化率赛道增长点在何方？,西南证券,2025-02-05,医疗器械,https://pdf.dfcfw.com/pdf/H3_AP202502041642773880_1.pdf?1738749737000.pdf
医疗器械行业深度：政策东风来，医械新机遇,财信证券,2025-01-24,医疗器械,https://pdf.dfcfw.com/pdf/H3_AP202501241642513183_1.pdf?1737723933000.pdf
2024年度口腔行业投放报告,快商通,2025-01-24,医疗器械,https://pdf.dfcfw.com/pdf/H3_AP202501241642522017_1.pdf?1737739061000.pdf
人工耳蜗类及外周血管支架类耗材国采点评：人工耳蜗内外资主流品牌均中选，集采有望推动市场扩容及国产替代进程,国信证券,2025-01-23,医疗器械,https://pdf.dfcfw.com/pdf/H3_AP202501231642474700_1.pdf?1737627965000.pdf
医疗器械行业深度分析：医疗器械产业链分析及河南产业概况,中原证券,2025-01-17,医疗器械,https://pdf.dfcfw.com/pdf/H3_AP202501171642124549_1.pdf?1737133421000.pdf
深圳市医疗器械产业专利导航分析报告,深圳市医疗器械行业协会,2025-01-15,医疗器械,https://pdf.dfcfw.com/pdf/H3_AP202501151641929665_1.pdf?1736951674000.pdf
医疗创新器械-IVD专题一：集采当道，破局之路在何方？,西南证券,2025-01-13,医疗器械,https://pdf.dfcfw.com/pdf/H3_AP202501131641900706_1.pdf?1736781368000.pdf
医疗器械行业月度点评：28省肿标及甲功集采报量结果出炉，国产品牌报量情况较好,财信证券,2025-01-09,医疗器械,https://pdf.dfcfw.com/pdf/H3_AP202501091641872109_1.pdf?1736443026000.pdf
千亿蓝海，患者庞大，巨头躁动，免扎针血糖仪CGM，会是一个性感的故事吗？,北京韬联科技,2025-01-02,医疗器械,https://pdf.dfcfw.com/pdf/H3_AP202501021641514031_1.pdf?1735844621000.pdf
医疗器械行业：新政策下医疗器械市场及院端趋势洞察,北京医装数胜科技,2024-12-27,医疗器械,https://pdf.dfcfw.com/pdf/H3_AP202412271641444722_1.pdf?1735294723000.pdf
中国肝癌早筛行业市场规模测算逻辑模型 头豹词条报告系列,头豹研究院,2024-12-27,医疗器械,https://pdf.dfcfw.com/pdf/H3_AP202412271641456327_1.pdf?1735328875000.pdf
CGM行业深度报告：青萍之末风乍起，CGM赛道大有可为,民生证券,2024-12-26,医疗器械,https://pdf.dfcfw.com/pdf/H3_AP202412261641433054_1.pdf?1735208906000.pdf
医疗器械行业点评：第五批高值耗材国采中选结果公布，企业中标情况良好,财信证券,2024-12-25,医疗器械,https://pdf.dfcfw.com/pdf/H3_AP202412251641423342_1.pdf?1735135556000.pdf
医疗器械行业2025年投资策略：聚焦院内刚需高成长，积极关注院外及出海市场,华安证券,2024-12-25,医疗器械,https://pdf.dfcfw.com/pdf/H3_AP202412251641423421_1.pdf?1735139499000.pdf
支持中国式养老，加大银发经济融资支持力度，如何看待家用医疗器械行业投资机会？,北京韬联科技,2024-12-25,医疗器械,https://pdf.dfcfw.com/pdf/H3_AP202412251641428006_1.pdf?1735152347000.pdf
2024医疗器械十大前沿技术研究报告,赛迪顾问,2024-12-25,医疗器械,https://pdf.dfcfw.com/pdf/H3_AP202412251641428473_1.pdf?1735155135000.pdf
生物医药行业：第五批耗材国采结果公布，降幅温和有望加速国产替代,平安证券,2024-12-24,医疗器械,https://pdf.dfcfw.com/pdf/H3_AP202412241641409989_1.pdf?1735039731000.pdf
新政策下医疗器械市场及院端趋势洞察,北京医装数胜科技,2024-12-24,医疗器械,https://pdf.dfcfw.com/pdf/H3_AP202412241641415348_1.pdf?1735066823000.pdf
医疗器械行业行业研究：第五批耗材国采拟中选结果公布，内外资主流产品普遍中选,国金证券,2024-12-20,医疗器械,https://pdf.dfcfw.com/pdf/H3_AP202412201641383758_1.pdf?1734726084000.pdf
医疗科技：欧盟AI法案如何在EMEA重塑医疗技术,Alpha Sense Investments Limited,2024-12-09,医疗器械,https://pdf.dfcfw.com/pdf/H3_AP202412081641219286_1.pdf?1733736342000.pdf
医疗器械行业月度点评：检验检查结果互认政策出台，关注医疗设备及IVD行业投资机会,财信证券,2024-12-08,医疗器械,https://pdf.dfcfw.com/pdf/H3_AP202412071641219099_1.pdf?1733650874000.pdf
医药生物：财政部关于政府采购通知的解读：政采明确国产品价格优势并细化国产品定义，或助力医疗设备国产替代,华福证券,2024-12-06,医疗器械,https://pdf.dfcfw.com/pdf/H3_AP202412061641211844_1.pdf?1733510119000.pdf
医疗器械行业点评：《关于进一步推进医疗机构检查检验结果互认的指导意见》发布，国产企业有望受益,财信证券,2024-12-05,医疗器械,https://pdf.dfcfw.com/pdf/H3_AP202412051641189307_1.pdf?1733400435000.pdf
2024年前三季度中国骨科手术机器人市场洞察,众成数科,2024-12-05,医疗器械,https://pdf.dfcfw.com/pdf/H3_AP202412051641191529_1.pdf?1733417657000.pdf
海外医疗器械公司24Q3业绩回顾：创新单品引领增长，关注国内医疗设备采购复苏,国信证券,2024-11-25,医疗器械,https://pdf.dfcfw.com/pdf/H3_AP202411251641052592_1.pdf?1732553617000.pdf
医疗器械：2024年三季度投融市场报告,深圳来觅数据信息科技,2024-11-19,医疗器械,https://pdf.dfcfw.com/pdf/H3_AP202411191640951912_1.pdf?1732013994000.pdf
医疗器械板块2024三季报总结：政策扰动下基本面见底，看好院内诊疗边际改善+设备更新陆续落地,中泰证券,2024-11-11,医疗器械,https://pdf.dfcfw.com/pdf/H3_AP202411111640809562_1.pdf?1731334372000.pdf
医疗器械行业月度点评：2024Q3板块业绩承压，后续有望迎来业绩复苏,财信证券,2024-11-08,医疗器械,https://pdf.dfcfw.com/pdf/H3_AP202411081640783190_1.pdf?1731075879000.pdf
医疗器械行业2024年三季报总结：三季度行业持续承压，板块结构性机会渐显,国信证券,2024-11-05,医疗器械,https://pdf.dfcfw.com/pdf/H3_AP202411051640729140_1.pdf?1730834122000.pdf
医疗器械行业行业研究：CGM海外专题研究：“价格+医保”优势带来放量突破口,国金证券,2024-11-01,医疗器械,https://pdf.dfcfw.com/pdf/H3_AP202411011640657516_1.pdf?1730452770000.pdf
中国隐形正畸行业年度洞见报告：稳固“双寡头”格局下的韧性增长2024年3月,灼识投资咨询(上海),2024-10-23,医疗器械,https://pdf.dfcfw.com/pdf/H3_AP202410231640430878_1.pdf?1729696360000.pdf
医疗器械出海专题二：出海风起，制定差异化战略布局,西南证券,2024-10-23,医疗器械,https://pdf.dfcfw.com/pdf/H3_AP202410231640433479_1.pdf?1729696666000.pdf
医疗器械行业快评报告：政策助力，医疗设备更新提速,万联证券,2024-10-22,医疗器械,https://pdf.dfcfw.com/pdf/H3_AP202410221640399625_1.pdf?1729588941000.pdf
医疗器械行业周报：设备更新政策逐步落地，医疗设备招标有望回暖,太平洋,2024-10-21,医疗器械,https://pdf.dfcfw.com/pdf/H3_AP202410211640376171_1.pdf?1729498312000.pdf
医疗器械专题之IVD：化学发光相关体外诊断试剂集采演绎,华安证券,2024-10-17,医疗器械,https://pdf.dfcfw.com/pdf/H3_AP202410171640336406_1.pdf?1729170812000.pdf
医疗器械行业月度点评：第五批耗材国采工作开启，关注板块催化行情,财信证券,2024-10-17,医疗器械,https://pdf.dfcfw.com/pdf/H3_AP202410171640339218_1.pdf?1729175950000.pdf
医疗器械：PPG连续生理特征感知技术及应用,蚂蚁集团,2024-10-12,医疗器械,https://pdf.dfcfw.com/pdf/H3_AP202410121640274717_1.pdf?1728749585000.pdf
医疗器械行业海外商标保护白皮书,中华商标协会商标海外维权工作委员会,2024-10-11,医疗器械,https://pdf.dfcfw.com/pdf/H3_AP202410111640255486_1.pdf?1728641255000.pdf
睡眠和呼吸护理行业专题系列二：国产呼吸机海外之路渐入佳境,西南证券,2024-10-10,医疗器械,https://pdf.dfcfw.com/pdf/H3_AP202410101640248766_1.pdf?1728583489000.pdf
2024年港股18A生物科技行业洞察报告：医疗器械赛道（下）：大数据与人工智能浪潮下，热门赛道的创新突破,头豹研究院,2024-09-27,医疗器械,https://pdf.dfcfw.com/pdf/H3_AP202409271640082650_1.pdf?1727466718000.pdf
中国心脏封堵器行业市场规模测算逻辑模型 头豹词条报告系列,头豹研究院,2024-09-27,医疗器械,https://pdf.dfcfw.com/pdf/H3_AP202409271640082655_1.pdf?1727467053000.pdf
2024年上半年超声影像诊断设备市场洞察报告,众成数科,2024-09-25,医疗器械,https://pdf.dfcfw.com/pdf/H3_AP202409251640034590_1.pdf?1727284679000.pdf
2024年港股18A：生物科技行业洞察报告：医疗器械赛道（上）-寒冬困境下，医疗器械行业的机遇与挑战,头豹研究院,2024-09-25,医疗器械,https://pdf.dfcfw.com/pdf/H3_AP202409251640039501_1.pdf?1727293546000.pdf
医药生物行业跟踪周报：医疗器械出海重要性日益凸显，关注新产业、三诺生物、迈瑞医疗等,东吴证券,2024-09-22,医疗器械,https://pdf.dfcfw.com/pdf/H3_AP202409221639972979_1.pdf?1727011578000.pdf
体外诊断流水线专题：引领检验提质增效，国产替代千帆竞发,国信证券,2024-09-20,医疗器械,https://pdf.dfcfw.com/pdf/H3_AP202409201639956740_1.pdf?1726843259000.pdf
医疗设备以旧换新专题系列二：从招投标数据看政策落地节奏，静待拐点,西南证券,2024-09-20,医疗器械,https://pdf.dfcfw.com/pdf/H3_AP202409201639958831_1.pdf?1726847706000.pdf
中国磁在医疗中的应用行业市场规模测算逻辑模型 头豹词条报告系列,头豹研究院,2024-09-18,医疗器械,https://pdf.dfcfw.com/pdf/H3_AP202409181639923989_1.pdf?1726688742000.pdf
2024年上半年胸腹腔镜市场洞察报告,众成数科,2024-09-13,医疗器械,https://pdf.dfcfw.com/pdf/H3_AP202409131639871661_1.pdf?1726243658000.pdf
医疗器械行业2024年中报总结：24H1行业整体业绩承压，景气度逐季回升可期,国信证券,2024-09-13,医疗器械,https://pdf.dfcfw.com/pdf/H3_AP202409131639875247_1.pdf?1726250315000.pdf
医疗器械板块2024H1总结：低耗板块表现亮眼，看好下半年院内诊疗边际改善+设备更新陆续落地,中泰证券,2024-09-09,医疗器械,https://pdf.dfcfw.com/pdf/H3_AP202409091639788280_1.pdf?1725874317000.pdf
