研报名称,机构名称,发布时间,行业,研报地址
腔镜手术机器人：微创精准者——腔镜手术机器人引领外科手术精度革命 头豹词条报告系列,头豹研究院,2025-08-25,医疗器械,https://pdf.dfcfw.com/pdf/H3_AP202508251734257162_1.pdf?1756151025000.pdf
2025年中国AI脑卒中诊断医疗器械行业概览：人机协同深化，AI将重塑脑卒中诊疗生态链,头豹研究院,2025-08-18,医疗器械,https://pdf.dfcfw.com/pdf/H3_AP202508181729927734_1.pdf?1755545888000.pdf
医疗器械行业专题研究：医疗设备月度中标梳理——2025年7月,天风证券,2025-08-15,医疗器械,https://pdf.dfcfw.com/pdf/H3_AP202508151728015118_1.pdf?1755274705000.pdf
政策赋能，医疗器械国产替代加速前行！,深圳汉鼎智库咨询服务,2025-08-11,医疗器械,https://pdf.dfcfw.com/pdf/H3_AP202508111725453954_1.pdf?1754939530000.pdf
医疗器械行业行业研究：脑机接口行业深度：政策+创新双轮驱动，商业化落地进入快车道,国金证券,2025-08-10,医疗器械,https://pdf.dfcfw.com/pdf/H3_AP202508101724743592_1.pdf?1754820451000.pdf
市场洞察：全民健身计划开启，中国筋膜枪品牌的增长密码在哪？,头豹研究院,2025-08-01,医疗器械,https://pdf.dfcfw.com/pdf/H3_AP202508011719670009_1.pdf?1754077745000.pdf
医疗器械：集采“反内卷”，医疗器械行业估值有望迎来修复,华金证券,2025-07-27,医疗器械,https://pdf.dfcfw.com/pdf/H3_AP202507261716067856_1.pdf?1753610925000.pdf
医疗器械行业行业研究：医保局支持国内创新器械发展，头部企业有望受益于政策拐点,国金证券,2025-07-27,医疗器械,https://pdf.dfcfw.com/pdf/H3_AP202507271716518597_1.pdf?1753625545000.pdf
治疗设备：人工智能、机器人技术与生物材料融合创新报告 头豹词条报告系列,头豹研究院,2025-07-22,医疗器械,https://pdf.dfcfw.com/pdf/H3_AP202507221713685679_1.pdf?1753213164000.pdf
医疗设备招投标数据跟踪：设备招投标景气度持续，公司报表端拐点有望来临,平安证券,2025-07-17,医疗器械,https://pdf.dfcfw.com/pdf/H3_AP202507171710461596_1.pdf?1752751543000.pdf
医疗器械行业专题研究：医疗设备月度中标梳理——2025年6月,天风证券,2025-07-16,医疗器械,https://pdf.dfcfw.com/pdf/H3_AP202507161710031989_1.pdf?1752687321000.pdf
医疗器械行业2025H2投资策略：国内不利因素逐渐消退，海外市场进展迅速,华安证券,2025-07-14,医疗器械,https://pdf.dfcfw.com/pdf/H3_AP202507131708308623_1.pdf?1752481905000.pdf
医疗器械和中药板块2025年中期投资策略：关注业绩拐点与行业结构性机遇,华金证券,2025-07-14,医疗器械,https://pdf.dfcfw.com/pdf/H3_AP202507131708337991_1.pdf?1752482393000.pdf
动态数据输入灵活工作流程：QARA在医疗器械监管中的未来,艾昆纬,2025-07-02,医疗器械,https://pdf.dfcfw.com/pdf/H3_AP202507021701439611_1.pdf?1751463645000.pdf
中国智慧医疗行业白皮书,德勤,2025-07-02,医疗器械,https://pdf.dfcfw.com/pdf/H3_AP202507021701722481_1.pdf?1751490457000.pdf
CT医用影像设备报告：AI重建与国产替代推动的市场突围战 头豹词条报告系列,头豹研究院,2025-07-01,医疗器械,https://pdf.dfcfw.com/pdf/H3_AP202507011701084023_1.pdf?1751398699000.pdf
2025年中国可穿戴健康监测设备行业概览：24小时健康守护，迈向智能康养时代,头豹研究院,2025-06-25,医疗器械,https://pdf.dfcfw.com/pdf/H3_AP202506251697466412_1.pdf?1750880714000.pdf
医疗设备招投标数据跟踪：设备更新不断深化，县域医共体持续发力,平安证券,2025-06-20,医疗器械,https://pdf.dfcfw.com/pdf/H3_AP202506201694370157_1.pdf?1750431850000.pdf
医疗器械：医疗设备月度中标梳理——2025年5月,天风证券,2025-06-19,医疗器械,https://pdf.dfcfw.com/pdf/H3_AP202506191693758702_1.pdf?1750344723000.pdf
2025中国医疗器械出海现状与趋势蓝皮书,沙利文公司,2025-06-13,医疗器械,https://pdf.dfcfw.com/pdf/H3_AP202506131690029101_1.pdf?1749806158000.pdf
医疗技术与器械篇：2025易凯资本中国健康产业白皮书,易凯资本,2025-06-10,医疗器械,https://pdf.dfcfw.com/pdf/H3_AP202506101688063083_1.pdf?1749544794000.pdf
XR设备：从技术突破到医疗影像新革命，解码体内影像“数字眼” 头豹词条报告系列,头豹研究院,2025-06-06,医疗器械,https://pdf.dfcfw.com/pdf/H3_AP202506061685977802_1.pdf?1749239629000.pdf
MRI医用影像行业研究报告：高端设备国产替代与精准诊疗驱动的百亿市场突围头 豹词条报告系列,头豹研究院,2025-06-03,医疗器械,https://pdf.dfcfw.com/pdf/H3_AP202506031684208482_1.pdf?1748979619000.pdf
医疗设备招投标数据跟踪：招投标持续恢复，国产替代趋势显著,平安证券,2025-05-29,医疗器械,https://pdf.dfcfw.com/pdf/H3_AP202505291681045523_1.pdf?1748508040000.pdf
2025年医疗器械海外市场拓展现状剖析及前景洞察,头豹研究院,2025-05-12,医疗器械,https://pdf.dfcfw.com/pdf/H3_AP202505121671717640_1.pdf?1747082455000.pdf
2025年中国CT医用影像行业：国产CT采购商44.4%为基层医疗卫生机构，进军高端之路还有多久？,头豹研究院,2025-04-28,医疗器械,https://pdf.dfcfw.com/pdf/H3_AP202504281663965450_1.pdf?1745869423000.pdf
IQVIA加拿大医疗器械部门关于应对贸易不确定性的观点：在医疗技术领域缓解风险和中断。,艾昆纬,2025-04-25,医疗器械,https://pdf.dfcfw.com/pdf/H3_AP202504251661992301_1.pdf?1745590512000.pdf
医疗器械专题：集采常态化推进，关注创新赛道的国产化率提升机会,平安证券,2025-04-25,医疗器械,https://pdf.dfcfw.com/pdf/H3_AP202504251662226903_1.pdf?1745600585000.pdf
2025年中国MRI医用影像行业：CR5占比90%+，AI加持下，会重新洗牌吗？,头豹研究院,2025-04-23,医疗器械,https://pdf.dfcfw.com/pdf/H3_AP202504231661148865_1.pdf?1745437618000.pdf
宫颈癌早筛行业洞察：广阔需求下的巨大市场潜力挖掘 头豹词条报告系列,头豹研究院,2025-04-23,医疗器械,https://pdf.dfcfw.com/pdf/H3_AP202504231661148898_1.pdf?1745437711000.pdf
医疗设备以旧换新专题系列四：3月数据同比+109%，环比亦有所提升,西南证券,2025-04-17,医疗器械,https://pdf.dfcfw.com/pdf/H3_AP202504171657910925_1.pdf?1744907507000.pdf
医疗器械行业国产替代进行时，各细分子行业分化加大,中证鹏元,2025-04-17,医疗器械,https://pdf.dfcfw.com/pdf/H3_AP202504171657962587_1.pdf?1744917233000.pdf
中企出海白皮书：医药和医疗器械篇-破浪前行：医药出海新格局与未来路径,安永(中国)企业咨询,2025-04-15,医疗器械,https://pdf.dfcfw.com/pdf/H3_AP202504151656721424_1.pdf?1744717397000.pdf
医疗器械行业月度点评：国家药监局发布征求意见稿，全力支持高端医疗器械重大创新,财信证券,2025-04-15,医疗器械,https://pdf.dfcfw.com/pdf/H3_AP202504151656745014_1.pdf?1744713027000.pdf
质量跃迁、结构优化与创新生态构建：医药制造行业技术要素对信用质量的影响分析（下篇）,新世纪资信评估,2025-04-07,医疗器械,https://pdf.dfcfw.com/pdf/H3_AP202504071652666496_1.pdf?1744024277000.pdf
医学影像诊断的新前沿：超声造影剂从技术突破到市场潜力 头豹词条报告系列,头豹研究院,2025-04-07,医疗器械,https://pdf.dfcfw.com/pdf/H3_AP202504071652842326_1.pdf?1744059639000.pdf
脑机接口：临床与商业化并进,深圳来觅数据信息科技,2025-03-28,医疗器械,https://pdf.dfcfw.com/pdf/H3_AP202503281648634573_1.pdf?1743176550000.pdf
全球医疗器械：创新与效率平衡之道,罗兰贝格,2025-03-25,医疗器械,https://pdf.dfcfw.com/pdf/H3_AP202503251647207855_1.pdf?1742908635000.pdf
2025年中国医疗器械行业前景展望及代表市场出海可行性分析,头豹研究院,2025-03-24,医疗器械,https://pdf.dfcfw.com/pdf/H3_AP202503241646930267_1.pdf?1742845790000.pdf
中国CMP设备行业市场规模测算逻辑模型 头豹词条报告系列,头豹研究院,2025-03-24,医疗器械,https://pdf.dfcfw.com/pdf/H3_AP202503241646930283_1.pdf?1742845984000.pdf
医疗器械行业月度点评：DeepSeek加速AI医疗落地，建议关注相关企业投资机遇,财信证券,2025-03-13,医疗器械,https://pdf.dfcfw.com/pdf/H3_AP202503131644335921_1.pdf?1741884272000.pdf
医疗器械行业人才供需洞察报告：深度解析医疗器械行业的人才需求与供给现状,同道猎聘,2025-03-13,医疗器械,https://pdf.dfcfw.com/pdf/H3_AP202503131644339430_1.pdf?1741889784000.pdf
2024年一脉阳光企业研究：智能影像，精准医疗,头豹研究院,2025-03-10,医疗器械,https://pdf.dfcfw.com/pdf/H3_AP202503101644239783_1.pdf?1741635628000.pdf
AI医疗器械爆发前夜：医学影像与诊断设备引领千亿级市场变革 头豹词条报告系列,头豹研究院,2025-03-10,医疗器械,https://pdf.dfcfw.com/pdf/H3_AP202503101644239782_1.pdf?1741635523000.pdf
医药行业月报（2025年第1期）：医疗设备行业回暖迹象明显,民银证券,2025-03-05,医疗器械,https://pdf.dfcfw.com/pdf/H3_AP202503051644084636_1.pdf?1741209827000.pdf
2025中国创新药械多元支付白皮书,中国人寿再保险,2025-03-05,医疗器械,https://pdf.dfcfw.com/pdf/H3_AP202503051644069297_1.pdf?1741187563000.pdf
公共卫生：脑炎全球威胁，趋势和公众健康影响,WHO,2025-02-27,医疗器械,https://pdf.dfcfw.com/pdf/H3_AP202502271643555209_1.pdf?1740661827000.pdf
