研报名称,机构名称,发布时间,行业,研报地址
产业经济医疗周观点：跟踪2024年银龄旅游数据,华福证券,2024-10-23,医疗服务,https://pdf.dfcfw.com/pdf/H3_AP202410231640430726_1.pdf?1729689674000.pdf
2024中老年人群癌症认知及早筛意识调查报告,21世纪新健康研究院,2024-10-17,医疗服务,https://pdf.dfcfw.com/pdf/H3_AP202410171640337300_1.pdf?1729176899000.pdf
医疗保健：医疗设备2024,Chambers & Partners,2024-10-16,医疗服务,https://pdf.dfcfw.com/pdf/H3_AP202410151640309147_1.pdf?1729070501000.pdf
OTC行业营销通案,行吟信息科技,2024-10-15,医疗服务,https://pdf.dfcfw.com/pdf/H3_AP202410151640309294_1.pdf?1729027774000.pdf
医疗健康行业：韩红爱心·抑郁症干预项目文献研究报告,北京韩红爱心慈善基金会,2024-10-15,医疗服务,https://pdf.dfcfw.com/pdf/H3_AP202410151640309392_1.pdf?1729026768000.pdf
2024年中国流式荧光行业研究报告,头豹研究院,2024-10-14,医疗服务,https://pdf.dfcfw.com/pdf/H3_AP202410141640292457_1.pdf?1728934762000.pdf
医疗IT订单月度数据跟踪系列：9月中标订单平稳,海通国际,2024-10-12,医疗服务,https://pdf.dfcfw.com/pdf/H3_AP202410121640273133_1.pdf?1728721830000.pdf
医疗服务中报总结：刚需增长稳健，消费仍有承压，经营门槛提升下集中度有望加速提升,中邮证券,2024-10-09,医疗服务,https://pdf.dfcfw.com/pdf/H3_AP202410091640227574_1.pdf?1728491693000.pdf
医药生物行业深度研究：2023年全国医疗保障事业发展统计公报系列分析,天风证券,2024-09-26,医疗服务,https://pdf.dfcfw.com/pdf/H3_AP202409261640047276_1.pdf?1727343951000.pdf
2024年中国医疗大健康产业宏观环境分析报告：“民生”+“科技”属性保证行业长期发展基本面,头豹研究院,2024-09-23,医疗服务,https://pdf.dfcfw.com/pdf/H3_AP202409231639989132_1.pdf?1727127341000.pdf
国谈系列专题：2024年国家医保谈判品种前瞻,西南证券,2024-09-18,医疗服务,https://pdf.dfcfw.com/pdf/H3_AP202409181639924602_1.pdf?1726691663000.pdf
医疗行业研究：康方生物重磅数据公布，三季报重点关注药品板块和个股反转,国金证券,2024-09-17,医疗服务,https://pdf.dfcfw.com/pdf/H3_AP202409171639905313_1.pdf?1726594153000.pdf
养老备忘录系列（五）：延迟退休：怎么改？影响谁？影响有多大？,平安证券,2024-09-16,医疗服务,https://pdf.dfcfw.com/pdf/H3_AP202409151639888913_1.pdf?1726480820000.pdf
医疗IT订单月度数据跟踪系列：8月中标订单向好，医疗IT需求回暖,海通国际,2024-09-12,医疗服务,https://pdf.dfcfw.com/pdf/H3_AP202409121639855504_1.pdf?1726173755000.pdf
2024年上半年CRRT设备市场洞察报告,北京医装数胜科技,2024-09-11,医疗服务,https://pdf.dfcfw.com/pdf/H3_AP202409111639827552_1.pdf?1726050907000.pdf
医药商业中报总结：集中度加速提升，龙头企业有望率先触底反弹,中邮证券,2024-09-10,医疗服务,https://pdf.dfcfw.com/pdf/H3_AP202409101639812144_1.pdf?1725979164000.pdf
医疗服务2024年二季度投融市场报告,深圳来觅数据信息科技,2024-09-06,医疗服务,https://pdf.dfcfw.com/pdf/H3_AP202410121640273706_1.pdf?1728739006000.pdf
中国医疗瘦身产业洞察白皮书：享“瘦”轻盈健康,艾瑞股份,2024-09-05,医疗服务,https://pdf.dfcfw.com/pdf/H3_AP202409051639752008_1.pdf?1725550855000.pdf
互联网医疗健康：重塑医疗生态，引领健康未来新篇章 头豹词条报告系列,头豹研究院,2024-08-30,医疗服务,https://pdf.dfcfw.com/pdf/H3_AP202408301639641567_1.pdf?1725052303000.pdf
中国肿瘤医疗服务行业市场规模测算逻辑模型 头豹词条报告系列,头豹研究院,2024-08-30,医疗服务,https://pdf.dfcfw.com/pdf/H3_AP202408301639641573_1.pdf?1725051911000.pdf
信息服务行业信息点评：深入推进DRG_DIP 2.0版分组工作，医疗IT建设有望提速,海通国际,2024-08-11,医疗服务,https://pdf.dfcfw.com/pdf/H3_AP202408111639231201_1.pdf?1723393003000.pdf
医疗IT订单月度数据跟踪系列：Q2中标金额显著增长，“公立医疗机构经济管理年”活动发布助推医疗信息化建设,海通国际,2024-08-11,医疗服务,https://pdf.dfcfw.com/pdf/H3_AP202408111639231212_1.pdf?1723393381000.pdf
医药行业月报24_07：医药持仓降至历史低位，医疗改革持续推进,中国银河,2024-08-02,医疗服务,https://pdf.dfcfw.com/pdf/H3_AP202408021639121222_1.pdf?1722626134000.pdf
养老备忘录系列（四）：养老改革新目标——二十届三中全会的政策关键词,平安证券,2024-07-23,医疗服务,https://pdf.dfcfw.com/pdf/H3_AP202407231638208351_1.pdf?1721726095000.pdf
体外辅助生殖用液：刚性需求加速国产替代步伐 头豹词条报告系列,头豹研究院,2024-07-17,医疗服务,https://pdf.dfcfw.com/pdf/H3_AP202407171638009843_1.pdf?1721244923000.pdf
2024年中国生物信息测序行业概览：中国制造引领第4代测序技术面世，业务模式变革成当下热门趋势,头豹研究院,2024-07-15,医疗服务,https://pdf.dfcfw.com/pdf/H3_AP202407151637931300_1.pdf?1721076929000.pdf
2024年中国康复专科医院行业概览：老龄化浪潮下，康复专科医院发展路在何方？,头豹研究院,2024-07-11,医疗服务,https://pdf.dfcfw.com/pdf/H3_AP202407111637801437_1.pdf?1720727235000.pdf
零售药店行业深度报告：行业仍然存在整合空间，处方外流环境有望逐步发生变化,中银证券,2024-07-10,医疗服务,https://pdf.dfcfw.com/pdf/H3_AP202407101637767730_1.pdf?1720648877000.pdf
医疗行业周报：高层级政策落地推动医药复苏，重点布局两大战略方向,国金证券,2024-07-08,医疗服务,https://pdf.dfcfw.com/pdf/H3_AP202407081637676164_1.pdf?1720452407000.pdf
2024年中国口腔医疗服务行业概览：“医疗”+“消费”千亿市场加速渗透,头豹研究院,2024-06-28,医疗服务,https://pdf.dfcfw.com/pdf/H3_AP202406281637027347_1.pdf?1719604094000.pdf
骨科治疗类透明质酸终端产品：老龄化加剧，骨科发病率提升市场需求 头豹词条报告系列,头豹研究院,2024-06-27,医疗服务,https://pdf.dfcfw.com/pdf/H3_AP202406271636966621_1.pdf?1719517129000.pdf
医药生物行业动态：关节续标执行在即，国产化加速在望,东方财富证券,2024-06-24,医疗服务,https://pdf.dfcfw.com/pdf/H3_AP202406241636819200_1.pdf?1719241269000.pdf
中国智慧医院现状及趋势研究报告,艾瑞股份,2024-06-20,医疗服务,https://pdf.dfcfw.com/pdf/H3_AP202407301638466014_1.pdf?1722352914000.pdf
智慧医院评级标准2024解读：数据资产化时代下智慧医院发展研究报告,亿欧智库,2024-06-18,医疗服务,https://pdf.dfcfw.com/pdf/H3_AP202406181636607998_1.pdf?1718724526000.pdf
中国大病网络众筹用户调研报告,艾瑞股份,2024-06-11,医疗服务,https://pdf.dfcfw.com/pdf/H3_AP202406111635962858_1.pdf?1718115681000.pdf
体检行业深度报告行业篇：行业持续内生增长，龙头提质增效稳健发展,海通国际,2024-06-03,医疗服务,https://pdf.dfcfw.com/pdf/H3_AP202406031635235500_1.pdf?1717421333000.pdf
2024年中国物理治疗设备前景发展报告：老龄化驱动，智能化家庭化趋势成市场新引擎（摘要版）,头豹研究院,2024-05-27,医疗服务,https://pdf.dfcfw.com/pdf/H3_AP202405271634723059_1.pdf?1716840368000.pdf
中国脱发白发理疗产业洞察报告：乌发如瀑映日辉，防脱防白正当时,艾瑞股份,2024-05-27,医疗服务,https://pdf.dfcfw.com/pdf/H3_AP202405271634710388_1.pdf?1716829521000.pdf
2024年中国肿瘤医疗服务行业概览：肿瘤服务市场供需错配，民营机构大有可为,头豹研究院,2024-05-21,医疗服务,https://pdf.dfcfw.com/pdf/H3_AP202405211634068004_1.pdf?1716320385000.pdf
医药与健康护理行业月报：23年年报&24年一季报总结与展望,海通国际,2024-05-07,医疗服务,https://pdf.dfcfw.com/pdf/H3_AP202405071632549631_1.pdf?1715078883000.pdf
