研报名称,机构名称,发布时间,行业,研报地址
预见未来中国元医院建设发展调研报告,中国信通院,2025-01-07,医疗服务,https://pdf.dfcfw.com/pdf/H3_AP202501071641831854_1.pdf?1736250191000.pdf
11月全球医疗健康领域投融资,北京蛋黄科技,2024-12-27,医疗服务,https://pdf.dfcfw.com/pdf/H3_AP202412271641445673_1.pdf?1735299081000.pdf
数字医疗的创新浪潮：2024年新质生产力引领的新机遇研究报告,亿欧智库,2024-12-25,医疗服务,https://pdf.dfcfw.com/pdf/H3_AP202412251641423071_1.pdf?1735136361000.pdf
医疗服务&生物制品行业2025年投资策略：看好消费复苏带来的消费医疗板块性行情，积极关注生物制品出海机遇,华安证券,2024-12-23,医疗服务,https://pdf.dfcfw.com/pdf/H3_AP202412231641393765_1.pdf?1734963457000.pdf
2024中国干细胞行业市场研究报告,深圳前瞻产业研究院,2024-12-18,医疗服务,https://pdf.dfcfw.com/pdf/H3_AP202412181641344248_1.pdf?1734536300000.pdf
医疗保健行业：行星现在会见到你,理特管理顾问,2024-12-16,医疗服务,https://pdf.dfcfw.com/pdf/H3_AP202412151641307744_1.pdf?1734342488000.pdf
健康的未来6_健康中的AI（r）进化,罗兰贝格,2024-12-08,医疗服务,https://pdf.dfcfw.com/pdf/H3_AP202412081641219290_1.pdf?1733669050000.pdf
2024年医保目录调整点评：鼓励真创新、全球新，真金白银助力医药新质生产力发展,海通国际,2024-12-06,医疗服务,https://pdf.dfcfw.com/pdf/H3_AP202412061641205138_1.pdf?1733496082000.pdf
医药与健康护理行业信息点评：《紧密型县域医疗卫生共同体监测指标体系（2024版）》发布，提升县域医疗卫生服务能力,海通国际,2024-12-06,医疗服务,https://pdf.dfcfw.com/pdf/H3_AP202412061641205139_1.pdf?1733496181000.pdf
医药与健康护理行业信息点评：加强首诊和转诊服务，提升医疗服务连续性,海通国际,2024-12-06,医疗服务,https://pdf.dfcfw.com/pdf/H3_AP202412061641205141_1.pdf?1733495191000.pdf
医药与健康护理行业信息点评：深化医疗卫生机构与养老机构协议合作，提升养老机构医疗服务可及性,海通国际,2024-12-06,医疗服务,https://pdf.dfcfw.com/pdf/H3_AP202412061641205140_1.pdf?1733495191000.pdf
睡眠数字疗法：循证医学驱动的睡眠障碍解决方案 头豹词条报告系列,头豹研究院,2024-12-05,医疗服务,https://pdf.dfcfw.com/pdf/H3_AP202412051641197623_1.pdf?1733427413000.pdf
兼谈商保及中国医疗体制改革：公平和效率,海通国际,2024-11-29,医疗服务,https://pdf.dfcfw.com/pdf/H3_AP202411291641111180_1.pdf?1732878598000.pdf
创新器械专题—持续血糖检测CGM：复盘海外龙头发展之路，看CGM全球发展四大趋势,西南证券,2024-11-25,医疗服务,https://pdf.dfcfw.com/pdf/H3_AP202411251641059955_1.pdf?1732567634000.pdf
医疗保健行业研究：造物致用，合成生物赋能未来,国元证券,2024-11-21,医疗服务,https://pdf.dfcfw.com/pdf/H3_AP202411211641000350_1.pdf?1732185302000.pdf
医疗服务：2024年三季度投融市场报告,深圳来觅数据信息科技,2024-11-19,医疗服务,https://pdf.dfcfw.com/pdf/H3_AP202411191640953740_1.pdf?1732013993000.pdf
医药生物：医保预付金制度出台，医疗服务、流通赛道景气度上行,甬兴证券,2024-11-15,医疗服务,https://pdf.dfcfw.com/pdf/H3_AP202411151640907124_1.pdf?1731664665000.pdf
免疫球蛋白行业稳健增长，技术革新驱动市场扩容 头豹词条报告系列,头豹研究院,2024-11-13,医疗服务,https://pdf.dfcfw.com/pdf/H3_AP202411131640864116_1.pdf?1731526555000.pdf
连锁药店行业研究框架专题报告：行业加速整合，集中度持续提升,东海证券,2024-11-04,医疗服务,https://pdf.dfcfw.com/pdf/H3_AP202411041640699590_1.pdf?1730737491000.pdf
癌症免疫疗法：个性化治疗驱动精准抗癌进一步发展 头豹词条报告系列,头豹研究院,2024-10-29,医疗服务,https://pdf.dfcfw.com/pdf/H3_AP202410291640576775_1.pdf?1730231845000.pdf
医疗大模型：智能诊疗，精准医疗的未来之路 头豹词条报告系列,头豹研究院,2024-10-24,医疗服务,https://pdf.dfcfw.com/pdf/H3_AP202410241640469729_1.pdf?1729799240000.pdf
产业经济医疗周观点：跟踪2024年银龄旅游数据,华福证券,2024-10-23,医疗服务,https://pdf.dfcfw.com/pdf/H3_AP202410231640430726_1.pdf?1729689674000.pdf
2024中老年人群癌症认知及早筛意识调查报告,21世纪新健康研究院,2024-10-17,医疗服务,https://pdf.dfcfw.com/pdf/H3_AP202410171640337300_1.pdf?1729176899000.pdf
医疗保健：医疗设备2024,Chambers & Partners,2024-10-16,医疗服务,https://pdf.dfcfw.com/pdf/H3_AP202410151640309147_1.pdf?1729070501000.pdf
OTC行业营销通案,行吟信息科技,2024-10-15,医疗服务,https://pdf.dfcfw.com/pdf/H3_AP202410151640309294_1.pdf?1729027774000.pdf
医疗健康行业：韩红爱心·抑郁症干预项目文献研究报告,北京韩红爱心慈善基金会,2024-10-15,医疗服务,https://pdf.dfcfw.com/pdf/H3_AP202410151640309392_1.pdf?1729026768000.pdf
2024年中国流式荧光行业研究报告,头豹研究院,2024-10-14,医疗服务,https://pdf.dfcfw.com/pdf/H3_AP202410141640292457_1.pdf?1728934762000.pdf
医疗IT订单月度数据跟踪系列：9月中标订单平稳,海通国际,2024-10-12,医疗服务,https://pdf.dfcfw.com/pdf/H3_AP202410121640273133_1.pdf?1728721830000.pdf
医疗服务中报总结：刚需增长稳健，消费仍有承压，经营门槛提升下集中度有望加速提升,中邮证券,2024-10-09,医疗服务,https://pdf.dfcfw.com/pdf/H3_AP202410091640227574_1.pdf?1728491693000.pdf
医药生物行业深度研究：2023年全国医疗保障事业发展统计公报系列分析,天风证券,2024-09-26,医疗服务,https://pdf.dfcfw.com/pdf/H3_AP202409261640047276_1.pdf?1727343951000.pdf
2024年中国医疗大健康产业宏观环境分析报告：“民生”+“科技”属性保证行业长期发展基本面,头豹研究院,2024-09-23,医疗服务,https://pdf.dfcfw.com/pdf/H3_AP202409231639989132_1.pdf?1727127341000.pdf
国谈系列专题：2024年国家医保谈判品种前瞻,西南证券,2024-09-18,医疗服务,https://pdf.dfcfw.com/pdf/H3_AP202409181639924602_1.pdf?1726691663000.pdf
医疗行业研究：康方生物重磅数据公布，三季报重点关注药品板块和个股反转,国金证券,2024-09-17,医疗服务,https://pdf.dfcfw.com/pdf/H3_AP202409171639905313_1.pdf?1726594153000.pdf
养老备忘录系列（五）：延迟退休：怎么改？影响谁？影响有多大？,平安证券,2024-09-16,医疗服务,https://pdf.dfcfw.com/pdf/H3_AP202409151639888913_1.pdf?1726480820000.pdf
医疗IT订单月度数据跟踪系列：8月中标订单向好，医疗IT需求回暖,海通国际,2024-09-12,医疗服务,https://pdf.dfcfw.com/pdf/H3_AP202409121639855504_1.pdf?1726173755000.pdf
2024年上半年CRRT设备市场洞察报告,北京医装数胜科技,2024-09-11,医疗服务,https://pdf.dfcfw.com/pdf/H3_AP202409111639827552_1.pdf?1726050907000.pdf
医药商业中报总结：集中度加速提升，龙头企业有望率先触底反弹,中邮证券,2024-09-10,医疗服务,https://pdf.dfcfw.com/pdf/H3_AP202409101639812144_1.pdf?1725979164000.pdf
医疗服务2024年二季度投融市场报告,深圳来觅数据信息科技,2024-09-06,医疗服务,https://pdf.dfcfw.com/pdf/H3_AP202410121640273706_1.pdf?1728739006000.pdf
中国医疗瘦身产业洞察白皮书：享“瘦”轻盈健康,艾瑞股份,2024-09-05,医疗服务,https://pdf.dfcfw.com/pdf/H3_AP202409051639752008_1.pdf?1725550855000.pdf
互联网医疗健康：重塑医疗生态，引领健康未来新篇章 头豹词条报告系列,头豹研究院,2024-08-30,医疗服务,https://pdf.dfcfw.com/pdf/H3_AP202408301639641567_1.pdf?1725052303000.pdf
中国肿瘤医疗服务行业市场规模测算逻辑模型 头豹词条报告系列,头豹研究院,2024-08-30,医疗服务,https://pdf.dfcfw.com/pdf/H3_AP202408301639641573_1.pdf?1725051911000.pdf
信息服务行业信息点评：深入推进DRG_DIP 2.0版分组工作，医疗IT建设有望提速,海通国际,2024-08-11,医疗服务,https://pdf.dfcfw.com/pdf/H3_AP202408111639231201_1.pdf?1723393003000.pdf
医疗IT订单月度数据跟踪系列：Q2中标金额显著增长，“公立医疗机构经济管理年”活动发布助推医疗信息化建设,海通国际,2024-08-11,医疗服务,https://pdf.dfcfw.com/pdf/H3_AP202408111639231212_1.pdf?1723393381000.pdf
医药行业月报24_07：医药持仓降至历史低位，医疗改革持续推进,中国银河,2024-08-02,医疗服务,https://pdf.dfcfw.com/pdf/H3_AP202408021639121222_1.pdf?1722626134000.pdf
养老备忘录系列（四）：养老改革新目标——二十届三中全会的政策关键词,平安证券,2024-07-23,医疗服务,https://pdf.dfcfw.com/pdf/H3_AP202407231638208351_1.pdf?1721726095000.pdf
体外辅助生殖用液：刚性需求加速国产替代步伐 头豹词条报告系列,头豹研究院,2024-07-17,医疗服务,https://pdf.dfcfw.com/pdf/H3_AP202407171638009843_1.pdf?1721244923000.pdf
2024年中国生物信息测序行业概览：中国制造引领第4代测序技术面世，业务模式变革成当下热门趋势,头豹研究院,2024-07-15,医疗服务,https://pdf.dfcfw.com/pdf/H3_AP202407151637931300_1.pdf?1721076929000.pdf
2024年中国康复专科医院行业概览：老龄化浪潮下，康复专科医院发展路在何方？,头豹研究院,2024-07-11,医疗服务,https://pdf.dfcfw.com/pdf/H3_AP202407111637801437_1.pdf?1720727235000.pdf
