研报名称,机构名称,发布时间,行业,研报地址
医疗器械板块2024三季报总结：政策扰动下基本面见底，看好院内诊疗边际改善+设备更新陆续落地,中泰证券,2024-11-11,医疗器械,https://pdf.dfcfw.com/pdf/H3_AP202411111640809562_1.pdf?1731334372000.pdf
医疗器械行业月度点评：2024Q3板块业绩承压，后续有望迎来业绩复苏,财信证券,2024-11-08,医疗器械,https://pdf.dfcfw.com/pdf/H3_AP202411081640783190_1.pdf?1731075879000.pdf
医疗器械行业2024年三季报总结：三季度行业持续承压，板块结构性机会渐显,国信证券,2024-11-05,医疗器械,https://pdf.dfcfw.com/pdf/H3_AP202411051640729140_1.pdf?1730834122000.pdf
医疗器械行业行业研究：CGM海外专题研究：“价格+医保”优势带来放量突破口,国金证券,2024-11-01,医疗器械,https://pdf.dfcfw.com/pdf/H3_AP202411011640657516_1.pdf?1730452770000.pdf
中国隐形正畸行业年度洞见报告：稳固“双寡头”格局下的韧性增长2024年3月,灼识投资咨询(上海),2024-10-23,医疗器械,https://pdf.dfcfw.com/pdf/H3_AP202410231640430878_1.pdf?1729696360000.pdf
医疗器械出海专题二：出海风起，制定差异化战略布局,西南证券,2024-10-23,医疗器械,https://pdf.dfcfw.com/pdf/H3_AP202410231640433479_1.pdf?1729696666000.pdf
医疗器械行业快评报告：政策助力，医疗设备更新提速,万联证券,2024-10-22,医疗器械,https://pdf.dfcfw.com/pdf/H3_AP202410221640399625_1.pdf?1729588941000.pdf
医疗器械行业周报：设备更新政策逐步落地，医疗设备招标有望回暖,太平洋,2024-10-21,医疗器械,https://pdf.dfcfw.com/pdf/H3_AP202410211640376171_1.pdf?1729498312000.pdf
医疗器械专题之IVD：化学发光相关体外诊断试剂集采演绎,华安证券,2024-10-17,医疗器械,https://pdf.dfcfw.com/pdf/H3_AP202410171640336406_1.pdf?1729170812000.pdf
医疗器械行业月度点评：第五批耗材国采工作开启，关注板块催化行情,财信证券,2024-10-17,医疗器械,https://pdf.dfcfw.com/pdf/H3_AP202410171640339218_1.pdf?1729175950000.pdf
医疗器械：PPG连续生理特征感知技术及应用,蚂蚁集团,2024-10-12,医疗器械,https://pdf.dfcfw.com/pdf/H3_AP202410121640274717_1.pdf?1728749585000.pdf
医疗器械行业海外商标保护白皮书,中华商标协会商标海外维权工作委员会,2024-10-11,医疗器械,https://pdf.dfcfw.com/pdf/H3_AP202410111640255486_1.pdf?1728641255000.pdf
睡眠和呼吸护理行业专题系列二：国产呼吸机海外之路渐入佳境,西南证券,2024-10-10,医疗器械,https://pdf.dfcfw.com/pdf/H3_AP202410101640248766_1.pdf?1728583489000.pdf
2024年港股18A生物科技行业洞察报告：医疗器械赛道（下）：大数据与人工智能浪潮下，热门赛道的创新突破,头豹研究院,2024-09-27,医疗器械,https://pdf.dfcfw.com/pdf/H3_AP202409271640082650_1.pdf?1727466718000.pdf
中国心脏封堵器行业市场规模测算逻辑模型 头豹词条报告系列,头豹研究院,2024-09-27,医疗器械,https://pdf.dfcfw.com/pdf/H3_AP202409271640082655_1.pdf?1727467053000.pdf
2024年上半年超声影像诊断设备市场洞察报告,众成数科,2024-09-25,医疗器械,https://pdf.dfcfw.com/pdf/H3_AP202409251640034590_1.pdf?1727284679000.pdf
2024年港股18A：生物科技行业洞察报告：医疗器械赛道（上）-寒冬困境下，医疗器械行业的机遇与挑战,头豹研究院,2024-09-25,医疗器械,https://pdf.dfcfw.com/pdf/H3_AP202409251640039501_1.pdf?1727293546000.pdf
医药生物行业跟踪周报：医疗器械出海重要性日益凸显，关注新产业、三诺生物、迈瑞医疗等,东吴证券,2024-09-22,医疗器械,https://pdf.dfcfw.com/pdf/H3_AP202409221639972979_1.pdf?1727011578000.pdf
体外诊断流水线专题：引领检验提质增效，国产替代千帆竞发,国信证券,2024-09-20,医疗器械,https://pdf.dfcfw.com/pdf/H3_AP202409201639956740_1.pdf?1726843259000.pdf
医疗设备以旧换新专题系列二：从招投标数据看政策落地节奏，静待拐点,西南证券,2024-09-20,医疗器械,https://pdf.dfcfw.com/pdf/H3_AP202409201639958831_1.pdf?1726847706000.pdf
中国磁在医疗中的应用行业市场规模测算逻辑模型 头豹词条报告系列,头豹研究院,2024-09-18,医疗器械,https://pdf.dfcfw.com/pdf/H3_AP202409181639923989_1.pdf?1726688742000.pdf
2024年上半年胸腹腔镜市场洞察报告,众成数科,2024-09-13,医疗器械,https://pdf.dfcfw.com/pdf/H3_AP202409131639871661_1.pdf?1726243658000.pdf
医疗器械行业2024年中报总结：24H1行业整体业绩承压，景气度逐季回升可期,国信证券,2024-09-13,医疗器械,https://pdf.dfcfw.com/pdf/H3_AP202409131639875247_1.pdf?1726250315000.pdf
医疗器械板块2024H1总结：低耗板块表现亮眼，看好下半年院内诊疗边际改善+设备更新陆续落地,中泰证券,2024-09-09,医疗器械,https://pdf.dfcfw.com/pdf/H3_AP202409091639788280_1.pdf?1725874317000.pdf
2024年上半年超声刀设备市场洞察报告,众成数科,2024-09-04,医疗器械,https://pdf.dfcfw.com/pdf/H3_AP202409041639726690_1.pdf?1725449213000.pdf
医药行业周报：器械出海突破内卷,华鑫证券,2024-08-26,医疗器械,https://pdf.dfcfw.com/pdf/H3_AP202408261639452414_1.pdf?1724700962000.pdf
医疗器械行业月度点评：补短板强基层，医疗设备更新行动不断推进,财信证券,2024-08-23,医疗器械,https://pdf.dfcfw.com/pdf/H3_AP202408231639427074_1.pdf?1724442335000.pdf
医药产业链数据库之：医疗设备全国招投标，7月整体延续Q2景气度回升趋势，设备更新持续推进,国投证券,2024-08-20,医疗器械,https://pdf.dfcfw.com/pdf/H3_AP202408201639349700_1.pdf?1724149807000.pdf
医药产业链数据库之：医疗设备全国招投标，行业边际趋势向上，等待进一步回暖,国投证券,2024-08-07,医疗器械,https://pdf.dfcfw.com/pdf/H3_AP202408071639179748_1.pdf?1723048068000.pdf
医疗器械CRO：成本优势驱动下的创新力量 头豹词条报告系列,头豹研究院,2024-08-06,医疗器械,https://pdf.dfcfw.com/pdf/H3_AP202408061639167477_1.pdf?1722973415000.pdf
医疗器械：设备更新政策加速落地，长期看好医疗设备板块,华安证券,2024-08-06,医疗器械,https://pdf.dfcfw.com/pdf/H3_AP202408061639166358_1.pdf?1722969645000.pdf
医疗设备行业更新政策跟踪专题：设备更新政策持续推进，关注医疗设备投资机会,国信证券,2024-08-05,医疗器械,https://pdf.dfcfw.com/pdf/H3_AP202408051639138250_1.pdf?1722863119000.pdf
医疗器械板块：医疗设备以旧换新专题,西南证券,2024-08-05,医疗器械,https://pdf.dfcfw.com/pdf/H3_AP202408051639145888_1.pdf?1722884049000.pdf
2024年中国认知障碍康复设备行业概览：老年人口增长，如何满足市场对认知障碍康复设备不断上升的需求？,头豹研究院,2024-08-05,医疗器械,https://pdf.dfcfw.com/pdf/H3_AP202408051639148039_1.pdf?1722886858000.pdf
2024年中国医疗器械出海之路：带量采购风暴后中国医疗器械价格狂降66.1%，出海能否为医疗器械企业找到新的增长点？,头豹研究院,2024-07-29,医疗器械,https://pdf.dfcfw.com/pdf/H3_AP202407291638437659_1.pdf?1722281990000.pdf
医疗器械行业月度点评：设备更新财政贴息贷款政策发布，国产厂商有望受益,财信证券,2024-07-22,医疗器械,https://pdf.dfcfw.com/pdf/H3_AP202407221638186120_1.pdf?1721668639000.pdf
医疗行业行业研究：中报窗口防守赛道表现较好，展望Q3建议由守转攻,国金证券,2024-07-15,医疗器械,https://pdf.dfcfw.com/pdf/H3_AP202407151637916666_1.pdf?1721053119000.pdf
医疗器械行业专题：呼吸道检测系列三：国内淡季不淡，关注美国流感样病例逐年上升带来的投资机会,国投证券,2024-07-14,医疗器械,https://pdf.dfcfw.com/pdf/H3_AP202407141637895733_1.pdf?1720994601000.pdf
抗体药物：新技术新靶点新工艺引领治疗新纪元 头豹词条报告系列,头豹研究院,2024-07-02,医疗器械,https://pdf.dfcfw.com/pdf/H3_AP202407021637475116_1.pdf?1719950838000.pdf
医药行业2024年度中期投资策略：关注创新、出海与银发经济,国联证券,2024-06-26,医疗器械,https://pdf.dfcfw.com/pdf/H3_AP202406261636906258_1.pdf?1719409844000.pdf
医疗器械行业月度点评：集采提质扩面，关注创新+出海主线,财信证券,2024-06-25,医疗器械,https://pdf.dfcfw.com/pdf/H3_AP202406251636874572_1.pdf?1719336564000.pdf
2024年第一季度中国医用消化道内窥镜市占率分析报告：进口品牌优势依旧，国产品牌基层突围,众成数科,2024-06-20,医疗器械,https://pdf.dfcfw.com/pdf/H3_AP202408271639481018_1.pdf?1724777751000.pdf
医疗器械行业专题：中国医疗器械：供给端出清叠加需求端恢复有望共同提升行业景气度,国投证券,2024-06-10,医疗器械,https://pdf.dfcfw.com/pdf/H3_AP202406081635913647_1.pdf?1718014848000.pdf
2024年中国医疗传感器行业概览：进口依赖亟待破局，智能化与MEMS传感器成为医疗新宠（摘要版）,头豹研究院,2024-06-07,医疗器械,https://pdf.dfcfw.com/pdf/H3_AP202406071635888091_1.pdf?1717789785000.pdf
医药生物行业专题研究：家用呼吸机：海外去库存有望迎来拐点,国联证券,2024-05-31,医疗器械,https://pdf.dfcfw.com/pdf/H3_AP202405311635079505_1.pdf?1717188386000.pdf
医疗器械行业行业研究：关节接续采购中选结果公布，国产头部企业中标价格良好,国金证券,2024-05-22,医疗器械,https://pdf.dfcfw.com/pdf/H3_AP202405221634316896_1.pdf?1716387918000.pdf
医疗器械行业2023年&2024年一季报总结：23年业绩整体承压，24年业绩逐季度加速可期,国信证券,2024-05-21,医疗器械,https://pdf.dfcfw.com/pdf/H3_AP202405211634055360_1.pdf?1716310292000.pdf
