研报名称,机构名称,发布时间,行业,研报地址
2026年医疗器械标杆企业组织效能报告,北京顺为人和企业咨询,2026-07-08,医疗器械,https://pdf.dfcfw.com/pdf/H3_AP202607081826791433_1.pdf?1783503628000.pdf
北交所医疗产业系列研究（一）：医疗器械行业稳步扩容，北交所医疗器械标的梳理,华源证券,2026-07-06,医疗器械,https://pdf.dfcfw.com/pdf/H3_AP202607061826747304_1.pdf?1783358592000.pdf
全球眼科创新与增长白皮书2026：价格重构、技术分化与全周期视觉管理,北京思宇博特科技,2026-07-03,医疗器械,https://pdf.dfcfw.com/pdf/H3_AP202607031826682263_1.pdf?1783071257000.pdf
2025年中国可穿戴健康监测设备行业概览：24小时健康守护，迈向智能康养时代,头豹研究院,2026-07-01,医疗器械,https://pdf.dfcfw.com/pdf/H3_AP202607011826637374_1.pdf?1782934956000.pdf
海外医疗器械公司经营情况回顾：医疗器械MNC如何看待中国市场？,国信证券,2026-06-24,医疗器械,https://pdf.dfcfw.com/pdf/H3_AP202606241823794052_1.pdf?1782290489000.pdf
国产高端医疗器械创新观察,摩熵数科(成都)医药科技,2026-06-24,医疗器械,https://pdf.dfcfw.com/pdf/H3_AP202606241823810044_1.pdf?1782319735000.pdf
2025年中国MRI医用影像行业概览：AI驱动全流程优化，国产与进口品牌竞争激烈,头豹研究院,2026-06-15,医疗器械,https://pdf.dfcfw.com/pdf/H3_AP202606151823577347_1.pdf?1781552726000.pdf
AI医疗5月月报：技术验证持续突破，监管规范与商业落地并进,中航证券,2026-06-12,医疗器械,https://pdf.dfcfw.com/pdf/H3_AP202606121823512795_1.pdf?1781285902000.pdf
2025高性能医疗器械行业年度创新发展报告,深圳高性能医疗器械国家研究院,2026-06-11,医疗器械,https://pdf.dfcfw.com/pdf/H3_AP202606111823466174_1.pdf?1781252115000.pdf
医疗器械行业2026年中期策略：紧扣出海创新，掘金器械复苏,国金证券,2026-06-09,医疗器械,https://pdf.dfcfw.com/pdf/H3_AP202606091823376353_1.pdf?1780992870000.pdf
2025年中国医疗器械行业前景展望及代表市场出海可行性分析,头豹研究院,2026-06-08,医疗器械,https://pdf.dfcfw.com/pdf/H3_AP202606081823366233_1.pdf?1780948169000.pdf
医疗器械行业点评报告：商业保险首次覆盖脑机接口，支付端全链路打通,开源证券,2026-05-28,医疗器械,https://pdf.dfcfw.com/pdf/H3_AP202605281822941416_1.pdf?1779977733000.pdf
全球与中国医疗仪器及器械行业产销贸易概况及分国别出口潜力研判报告2026版,北京智研科信咨询,2026-05-28,医疗器械,https://pdf.dfcfw.com/pdf/H3_AP202605281822944761_1.pdf?1779986342000.pdf
中国改善睡眠类保健食品行业概览报告,头豹研究院,2026-05-27,医疗器械,https://pdf.dfcfw.com/pdf/H3_AP202605271822919642_1.pdf?1779910957000.pdf
中国医疗器械出海之路：带量采购风暴后中国医疗器械价格狂降66.1%，出海能否为医疗器械企业找到新的增长点？,头豹研究院,2026-05-22,医疗器械,https://pdf.dfcfw.com/pdf/H3_AP202605221822692059_1.pdf?1779479163000.pdf
中国认知障碍康复设备行业概览：老年人口增长，如何满足市场对认知障碍康复设备不断上升的需求？,头豹研究院,2026-05-20,医疗器械,https://pdf.dfcfw.com/pdf/H3_AP202605201822501103_1.pdf?1779307030000.pdf
中国正畸行业概览：案例渗透增长，赛道大有可为,头豹研究院,2026-05-20,医疗器械,https://pdf.dfcfw.com/pdf/H3_AP202605201822501104_1.pdf?1779307246000.pdf
创新医疗器械专题：脑机接口行业专题系列三：中国牵头编制的国际标准正式发布，脑机行业从实验室走向规模化产业化应用元年,西南证券,2026-05-10,医疗器械,https://pdf.dfcfw.com/pdf/H3_AP202605101822122234_1.pdf?1778421337000.pdf
中国物理治疗设备前景发展报告,头豹研究院,2026-05-06,医疗器械,https://pdf.dfcfw.com/pdf/H3_AP202605061821994298_1.pdf?1778096504000.pdf
医疗器械行业25年年报&26一季报总结：技术突破叠加政策支持，出海与创新双轮驱动,国金证券,2026-05-05,医疗器械,https://pdf.dfcfw.com/pdf/H3_AP202605051821971937_1.pdf?1778006316000.pdf
手术机器人专题：政策与创新双轮驱动，开启出海破局新阶段,国金证券,2026-04-28,医疗器械,https://pdf.dfcfw.com/pdf/H3_AP202604281821675137_1.pdf?1777397539000.pdf
AI医疗4月月报：重磅合作频现，应用场景纵深拓展,中航证券,2026-04-27,医疗器械,https://pdf.dfcfw.com/pdf/H3_AP202604271821599567_1.pdf?1777295358000.pdf
脑机接口行业深度报告：政策催化、技术突破、商业化落地，脑机行业迎三重共振,中银证券,2026-04-27,医疗器械,https://pdf.dfcfw.com/pdf/H3_AP202604271821599563_1.pdf?1777295156000.pdf
医疗器械：脑机接口发展进入快车道,建银国际证券,2026-04-21,医疗器械,https://pdf.dfcfw.com/pdf/H3_AP202604211821391287_1.pdf?1776799535000.pdf
高端眼科医疗设备行业现状与未来发展趋势蓝皮书,沙利文公司,2026-04-20,医疗器械,https://pdf.dfcfw.com/pdf/H3_AP202604201821348337_1.pdf?1776715523000.pdf
潮起南洋：中国医疗器械全球化新征程,艾意凯咨询,2026-04-17,医疗器械,https://pdf.dfcfw.com/pdf/H3_AP202604171821280070_1.pdf?1776411759000.pdf
血管介入特殊球囊行业现状与发展趋势蓝皮书,沙利文公司,2026-04-14,医疗器械,https://pdf.dfcfw.com/pdf/H3_AP202604141821195164_1.pdf?1776196186000.pdf
医疗行业：PBM垂直关联药房如何塑造肿瘤和自身免疫病患者获取途径,艾昆纬,2026-04-01,医疗器械,https://pdf.dfcfw.com/pdf/H3_AP202604011820946630_1.pdf?1775061818000.pdf
中国呼气检测行业发展蓝皮书,沙利文公司,2026-03-31,医疗器械,https://pdf.dfcfw.com/pdf/H3_AP202603311820922326_1.pdf?1774987258000.pdf
脑机接口深度报告：未来产业制高点竞速，多场景需求打开成长空间,中航证券,2026-03-24,医疗器械,https://pdf.dfcfw.com/pdf/H3_AP202603241820726076_1.pdf?1774379614000.pdf
视界舒缓力——从缓解疲劳到主动护眼，眼部按摩仪的科技跃迁与需求共振 头豹词条报告系列,头豹研究院,2026-03-19,医疗器械,https://pdf.dfcfw.com/pdf/H3_AP202603191820651115_1.pdf?1773949833000.pdf
医疗器械行业点评报告：全球首个侵入式脑机接口获批，2026脑机量产元年已至,开源证券,2026-03-18,医疗器械,https://pdf.dfcfw.com/pdf/H3_AP202603181820614288_1.pdf?1773828738000.pdf
医药健康行业研究：脑机接口产业密集突破，关注器械板块投资机会,国金证券,2026-03-15,医疗器械,https://pdf.dfcfw.com/pdf/H3_AP202603151820566374_1.pdf?1773605958000.pdf
市场简报：新政出台，推进医药工业高端化、智能化、绿色化、融合化发展,头豹研究院,2026-03-05,医疗器械,https://pdf.dfcfw.com/pdf/H3_AP202603051820309031_1.pdf?1772740137000.pdf
医疗器械行业ESG白皮书,荣续ESG智库研究中心,2026-03-04,医疗器械,https://pdf.dfcfw.com/pdf/H3_AP202603031820234581_1.pdf?1772611405000.pdf
科技缔造光明视界：高视医疗战略升级，攀登眼科医疗器械新高峰,头豹研究院,2026-03-03,医疗器械,https://pdf.dfcfw.com/pdf/H3_AP202603031820232045_1.pdf?1772571268000.pdf
2025年AI医疗器械品牌推荐：重构医疗生态的 AI驱动型领跑者,头豹研究院,2026-03-02,医疗器械,https://pdf.dfcfw.com/pdf/H3_AP202603021820194272_1.pdf?1772482745000.pdf
医药健康行业研究：创新器械进入加速新阶段，看好国产龙头发展机遇,国金证券,2026-03-01,医疗器械,https://pdf.dfcfw.com/pdf/H3_AP202603011820157814_1.pdf?1772381824000.pdf
2025年医疗大模型品牌推荐：海量知识深度整合，智能生成革新医疗范式,头豹研究院,2026-02-27,医疗器械,https://pdf.dfcfw.com/pdf/H3_AP202602271820107543_1.pdf?1772222373000.pdf
2025年中国AI肺结节检测医疗器械行业概览：三类证获批加速，AI肺结节检测产品商业化提速,头豹研究院,2026-02-27,医疗器械,https://pdf.dfcfw.com/pdf/H3_AP202602271820107544_1.pdf?1772222164000.pdf
2025年中国带状疱疹疫苗行业洞察报告：免疫需求扩容+政策红利加持背景下，百克生物率先获批，国产疫苗如何承接市场？,头豹研究院,2026-02-24,医疗器械,https://pdf.dfcfw.com/pdf/H3_AP202602241819998923_1.pdf?1771961794000.pdf
创新医疗器械盘点系列（4）：肿瘤基因检测的“勇敢者游戏”（上篇）,国信证券,2026-02-02,医疗器械,https://pdf.dfcfw.com/pdf/H3_AP202602021819360469_1.pdf?1770059051000.pdf
家用医疗器械专题报告（一）：健康监测&呼吸治疗篇,国信证券,2026-02-01,医疗器械,https://pdf.dfcfw.com/pdf/H3_AP202602011819066664_1.pdf?1769970930000.pdf
医疗设备以旧换新专题系列六：12月数据同比-8%，25年全年同比+25%,西南证券,2026-01-23,医疗器械,https://pdf.dfcfw.com/pdf/H3_AP202601231818338975_1.pdf?1769199849000.pdf
