研报名称,机构名称,发布时间,行业,研报地址
2024年6月社零数据点评：社会消费品零售总额增长2%，网上零售增速较好,国信证券,2024-07-16,商业百货,https://pdf.dfcfw.com/pdf/H3_AP202407161637952527_1.pdf?1721125054000.pdf
商贸零售行业点评报告：6月社零总额同比+2.0%略低于预期，618大促提前到5月底，影响线上消费表现,东吴证券,2024-07-16,商业百货,https://pdf.dfcfw.com/pdf/H3_AP202407161637957182_1.pdf?1721139158000.pdf
商贸零售行业点评：三部委提升港澳进境免税额度，略低于预期影响有限,国都证券,2024-07-16,商业百货,https://pdf.dfcfw.com/pdf/H3_AP202407161637963419_1.pdf?1721148026000.pdf
商贸零售行业：24年上半年消费需求较弱，高性价比消费趋势明显,东兴证券,2024-07-16,商业百货,https://pdf.dfcfw.com/pdf/H3_AP202407161637967555_1.pdf?1721154670000.pdf
商贸零售行业跟踪周报：奢侈品集团24Q1业绩总览：亚太地区消费承压，日本地区虹吸延续,东吴证券,2024-07-15,商业百货,https://pdf.dfcfw.com/pdf/H3_AP202407151637900084_1.pdf?1721009469000.pdf
商贸零售行业周报：电商平台积极布局线下渠道，京东MALL四川首店落户成都,上海证券,2024-07-15,商业百货,https://pdf.dfcfw.com/pdf/H3_AP202407151637907627_1.pdf?1721034143000.pdf
商贸零售行业双周报：老铺黄金招股书梳理，古法黄金珠宝龙头,国信证券,2024-07-15,商业百货,https://pdf.dfcfw.com/pdf/H3_AP202407151637908769_1.pdf?1721035974000.pdf
商贸零售行业点评报告：6月社零同比+2.0%，上半年社会消费稳健,开源证券,2024-07-15,商业百货,https://pdf.dfcfw.com/pdf/H3_AP202407151637932179_1.pdf?1721073463000.pdf
商贸零售行业周报：昊海生科第四代玻尿酸获批，关注差异化医美产品,开源证券,2024-07-14,商业百货,https://pdf.dfcfw.com/pdf/H3_AP202407141637883123_1.pdf?1720952902000.pdf
2024巨量引擎母婴行业白皮书：随心所育 看见成长,巨量引擎-汽车策略研究院,2024-07-14,商业百货,https://pdf.dfcfw.com/pdf/H3_AP202407141637883083_1.pdf?1720971568000.pdf
零售周观点：24H1化妆品市场规模同比+2.38%，继续看好头部国货美妆集中度提升,民生证券,2024-07-14,商业百货,https://pdf.dfcfw.com/pdf/H3_AP202407141637890409_1.pdf?1720977301000.pdf
商贸零售行业2024年中期投资策略：把握结构性投资机遇，长线布局国货崛起与出海主线,国信证券,2024-07-14,商业百货,https://pdf.dfcfw.com/pdf/H3_AP202407141637889522_1.pdf?1720982018000.pdf
中国购物中心升级趋势：新场景激发新活力,戴德梁行,2024-07-14,商业百货,https://pdf.dfcfw.com/pdf/H3_AP202407141637893700_1.pdf?1720989353000.pdf
新消费周观点：央行出手再次证明美联储降息预期有助于打开我国政策空间,信达证券,2024-07-14,商业百货,https://pdf.dfcfw.com/pdf/H3_AP202407141637886053_1.pdf?1720963258000.pdf
宠物洗护：“萌宠经济”火热升温，宠物洗护行业快速发展 头豹词条报告系列,头豹研究院,2024-07-11,商业百货,https://pdf.dfcfw.com/pdf/H3_AP202407111637801454_1.pdf?1720727349000.pdf
商贸零售行业跟踪周报：消费税改革或有推进，建议关注可能受益的免税和百货板块,东吴证券,2024-07-08,商业百货,https://pdf.dfcfw.com/pdf/H3_AP202407081637656199_1.pdf?1720397271000.pdf
商贸零售行业周报：消费税改革预期下黄金珠宝板块涨幅居前,国金证券,2024-07-08,商业百货,https://pdf.dfcfw.com/pdf/H3_AP202407081637666413_1.pdf?1720430905000.pdf
商贸零售行业周报：消费税改革将近，关注对零售企业的影响,上海证券,2024-07-08,商业百货,https://pdf.dfcfw.com/pdf/H3_AP202407081637682007_1.pdf?1720460074000.pdf
零售周观点：新一轮消费税改革，零售行业或迎来新机遇,民生证券,2024-07-08,商业百货,https://pdf.dfcfw.com/pdf/H3_AP202407081637676255_1.pdf?1720452636000.pdf
商贸零售行业周报：锦波生物业绩预告亮眼，看好重组胶原蛋白赛道发展,开源证券,2024-07-07,商业百货,https://pdf.dfcfw.com/pdf/H3_AP202407071637642811_1.pdf?1720353427000.pdf
商贸零售行业7月投资策略：线下零售积极求变，胖东来调改为传统商超注入活力,国信证券,2024-07-04,商业百货,https://pdf.dfcfw.com/pdf/H3_AP202407041637544738_1.pdf?1720089817000.pdf
2024年传媒及新消费行业半年度策略：消费渐进复苏，传媒内容技术双驱动,国元证券,2024-07-04,商业百货,https://pdf.dfcfw.com/pdf/H3_AP202407041637547476_1.pdf?1720098754000.pdf
商贸零售行业周报：创健医疗“技术+转化”双轮驱动、商业版图全产业链快速覆盖,国金证券,2024-07-03,商业百货,https://pdf.dfcfw.com/pdf/H3_AP202407031637493729_1.pdf?1719993950000.pdf
干擦拭巾：从洗脸巾到棉柔巾，擦拭巾迎来细分“革命” 头豹词条报告系列,头豹研究院,2024-07-03,商业百货,https://pdf.dfcfw.com/pdf/H3_AP202407031637517804_1.pdf?1720035367000.pdf
商贸零售：新能源渗透率提升如何影响汽车维保市场？,国联证券,2024-07-02,商业百货,https://pdf.dfcfw.com/pdf/H3_AP202407021637448264_1.pdf?1719911888000.pdf
跨境电商系列之五：外部博弈难阻行业成长，大浪淘沙方显龙头本色,国信证券,2024-07-02,商业百货,https://pdf.dfcfw.com/pdf/H3_AP202407021637479491_1.pdf?1719956352000.pdf
商贸零售行业跟踪周报：高端特色古法黄金品牌老铺黄金上市，全直营模式下盈利能力领先于行业,东吴证券,2024-07-01,商业百货,https://pdf.dfcfw.com/pdf/H3_AP202407011637120108_1.pdf?1719795239000.pdf
商贸零售行业周报：老铺黄金港股上市，关注高端金饰消费国潮崛起,开源证券,2024-06-30,商业百货,https://pdf.dfcfw.com/pdf/H3_AP202406301637109671_1.pdf?1719768447000.pdf
零售周观点：老铺黄金港交所成功上市，NIKE发布FY24Q4财报,民生证券,2024-06-30,商业百货,https://pdf.dfcfw.com/pdf/H3_AP202406301637118310_1.pdf?1719788602000.pdf
新消费周观点：美联储降息概率再提升，日币汇率稳定时A股或出现底部投资机会,信达证券,2024-06-30,商业百货,https://pdf.dfcfw.com/pdf/H3_AP202406301637115300_1.pdf?1719776027000.pdf
成人失禁用品：挖掘银发经济，成人失禁用品市场潜力巨大 头豹词条报告系列,头豹研究院,2024-06-26,商业百货,https://pdf.dfcfw.com/pdf/H3_AP202406261636922895_1.pdf?1719430771000.pdf
MRO行业新闻跟踪点评报告：2024年6月全球MRO重点新闻梳理,东吴证券国际经纪,2024-06-25,商业百货,https://pdf.dfcfw.com/pdf/H3_AP202406251636859692_1.pdf?1719334970000.pdf
美妆行业：618大促整体疲软，部分优质国货品牌逆势而上,东兴证券,2024-06-25,商业百货,https://pdf.dfcfw.com/pdf/H3_AP202406251636865482_1.pdf?1719331387000.pdf
纺服美妆行业周报：618大促收官 国货美妆龙头成绩亮眼,申港证券,2024-06-25,商业百货,https://pdf.dfcfw.com/pdf/H3_AP202406251636881455_1.pdf?1719345327000.pdf
商贸零售行业跟踪周报：24年618整体呈稳健增长，国货美妆品牌表现靓丽、领跑行业,东吴证券,2024-06-24,商业百货,https://pdf.dfcfw.com/pdf/H3_AP202406241636806845_1.pdf?1719196782000.pdf
商贸零售行业周报：胖东来调改永辉首店初见成效，持续关注同店提升效率,上海证券,2024-06-24,商业百货,https://pdf.dfcfw.com/pdf/H3_AP202406241636814607_1.pdf?1719228501000.pdf
2024年中期商贸零售行业投资策略报告：国潮崛起趋势明显，优秀品牌突围,万联证券,2024-06-24,商业百货,https://pdf.dfcfw.com/pdf/H3_AP202406241636836669_1.pdf?1719260780000.pdf
海外周报：积极关注中报前瞻，关注海外中国资产增加股东回报,民生证券,2024-06-24,商业百货,https://pdf.dfcfw.com/pdf/H3_AP202406241636815448_1.pdf?1719240128000.pdf
商贸零售行业动态点评：618宠物食品战报发布，零食礼包品类增速突出,东方财富证券,2024-06-24,商业百货,https://pdf.dfcfw.com/pdf/H3_AP202406241636823125_1.pdf?1719244045000.pdf
商贸零售行业周报：618大促收官，国货美妆龙头表现优于行业大盘,开源证券,2024-06-23,商业百货,https://pdf.dfcfw.com/pdf/H3_AP202406231636800966_1.pdf?1719160343000.pdf
新消费周观点：美联储降息预期扰动市场投资决策,信达证券,2024-06-23,商业百货,https://pdf.dfcfw.com/pdf/H3_AP202406231636802221_1.pdf?1719167540000.pdf
零售周观点：“618”大促收官，美妆类目同比+6.6%，国货美妆龙头持续高增长,民生证券,2024-06-23,商业百货,https://pdf.dfcfw.com/pdf/H3_AP202406231636804182_1.pdf?1719180314000.pdf
2024年5月社零数据跟踪报告：5月社零同比+3.7%，多数品类增速环比回升,万联证券,2024-06-20,商业百货,https://pdf.dfcfw.com/pdf/H3_AP202406201636701903_1.pdf?1718879959000.pdf
商贸零售周报：5月社零小幅回升，限额以上企业增速较上月提升较多,首创证券,2024-06-20,商业百货,https://pdf.dfcfw.com/pdf/H3_AP202406201636701905_1.pdf?1718879657000.pdf
商贸零售行业动态点评：618美护品牌分化加剧，珀莱雅_可复美_韩束势能恒强,东方财富证券,2024-06-20,商业百货,https://pdf.dfcfw.com/pdf/H3_AP202406201636714830_1.pdf?1718908761000.pdf
跨境电商行业深度报告：中国跨境电商产业升级，“四小龙”吹响出海集结号,招商银行,2024-06-20,商业百货,https://pdf.dfcfw.com/pdf/H3_AP202407231638217472_1.pdf?1721745023000.pdf
医美化妆品5月月报：618大促珀莱雅、巨子生物旗下品牌表现亮眼,开源证券,2024-06-19,商业百货,https://pdf.dfcfw.com/pdf/H3_AP202406191636682015_1.pdf?1718806076000.pdf
5月社零报告专题：5月社零维持温和复苏，可选消费显弹性,东海证券,2024-06-19,商业百货,https://pdf.dfcfw.com/pdf/H3_AP202406191636694944_1.pdf?1718833291000.pdf
商贸零售行业2024年中期投资策略：顺势而为，积极拥抱新模式与新变革,民生证券,2024-06-18,商业百货,https://pdf.dfcfw.com/pdf/H3_AP202406171636547338_1.pdf?1718706163000.pdf
商贸零售：5月社零同比+3.7%，同比增速回升,国联证券,2024-06-18,商业百货,https://pdf.dfcfw.com/pdf/H3_AP202406181636588345_1.pdf?1718701942000.pdf
商贸零售行业动态点评：5月社零总额同比+3.7%，618节奏调整下化妆品类+19%,东方财富证券,2024-06-18,商业百货,https://pdf.dfcfw.com/pdf/H3_AP202406181636604983_1.pdf?1718705578000.pdf
2024年5月社零数据点评：五月社零同比增长3.7%，品类结构性分化加剧,国信证券,2024-06-18,商业百货,https://pdf.dfcfw.com/pdf/H3_AP202406181636638606_1.pdf?1718736064000.pdf
美妆&零售板块周报：周大福FY24业绩拆解，同店恢复与展店提效，关注单店效能持续爬升,德邦证券,2024-06-17,商业百货,https://pdf.dfcfw.com/pdf/H3_AP202406171636463265_1.pdf?1718613383000.pdf
消费行业2024年中期展望：期待政策释放驱动内需边际改善,浦银国际证券,2024-06-17,商业百货,https://pdf.dfcfw.com/pdf/H3_AP202406171636465629_1.pdf?1718622562000.pdf
商贸零售行业点评报告：5月社零同比+3.7%，电商大促带动美妆等品类增长,开源证券,2024-06-17,商业百货,https://pdf.dfcfw.com/pdf/H3_AP202406171636488479_1.pdf?1718646727000.pdf
商贸零售行业周报：周大福FY24表现稳健，关注终端动销,上海证券,2024-06-17,商业百货,https://pdf.dfcfw.com/pdf/H3_AP202406171636481620_1.pdf?1718635126000.pdf
商贸零售行业深度报告：品牌系列深度3：为什么烟和酒都有强品牌，茶没有？,东吴证券,2024-06-17,商业百货,https://pdf.dfcfw.com/pdf/H3_AP202406171636484868_1.pdf?1718640366000.pdf
商贸零售行业周报：胖东来帮扶多家超市企业，关注618国货美妆表现,开源证券,2024-06-16,商业百货,https://pdf.dfcfw.com/pdf/H3_AP202406161636456526_1.pdf?1718549406000.pdf
商贸零售行业跟踪周报：出行数据整体持续呈较快增速趋势，关注OTA平台等方向,东吴证券,2024-06-16,商业百货,https://pdf.dfcfw.com/pdf/H3_AP202406161636459925_1.pdf?1718579466000.pdf
零售周观点：5月义乌市出口额同比增长28.7%，景气度持续,民生证券,2024-06-16,商业百货,https://pdf.dfcfw.com/pdf/H3_AP202406161636459979_1.pdf?1718580156000.pdf
新消费周观点：降息预期打开我国政策空间，必选先至，可选可期,信达证券,2024-06-16,商业百货,https://pdf.dfcfw.com/pdf/H3_AP202406161636456924_1.pdf?1718550587000.pdf
商贸零售周报：美团2024Q1营收增速稳定，新业务亏损大幅收窄,首创证券,2024-06-14,商业百货,https://pdf.dfcfw.com/pdf/H3_AP202406141636241903_1.pdf?1718389871000.pdf
大消费行业专题报告：创新驱动消费质变，产品差异引领未来,国金证券,2024-06-13,商业百货,https://pdf.dfcfw.com/pdf/H3_AP202406131636055244_1.pdf?1718271123000.pdf
商贸零售行业专题研究：以Shein为例，看小单快反模式下的柔性供应链机遇,东方财富证券,2024-06-12,商业百货,https://pdf.dfcfw.com/pdf/H3_AP202406121636006734_1.pdf?1718213234000.pdf
零售周观点：零售“标杆”胖东来与被调改企业实现共赢，5月全国出口数据超预期,民生证券,2024-06-11,商业百货,https://pdf.dfcfw.com/pdf/H3_AP202406111635928477_1.pdf?1718079306000.pdf
美妆&零售板块周报：如何解读近期海运费涨价，跨境卖家应对几何？,德邦证券,2024-06-11,商业百货,https://pdf.dfcfw.com/pdf/H3_AP202406111635961426_1.pdf?1718111583000.pdf
商贸零售行业跟踪周报：名创优品出海近况梳理：强品牌、强供应链，品牌出海标杆,东吴证券,2024-06-11,商业百货,https://pdf.dfcfw.com/pdf/H3_AP202406111635962244_1.pdf?1718111259000.pdf
商贸零售行业周报：美团核心本地商业强劲增长，新业务战略减亏,上海证券,2024-06-11,商业百货,https://pdf.dfcfw.com/pdf/H3_AP202406111635962895_1.pdf?1718112221000.pdf
商贸零售行业周报：国货美妆品牌加码自有原料布局，竞争力有望提升,开源证券,2024-06-10,商业百货,https://pdf.dfcfw.com/pdf/H3_AP202406101635915130_1.pdf?1718030219000.pdf
新消费周观点：大类资产龙头配置与整合性,信达证券,2024-06-10,商业百货,https://pdf.dfcfw.com/pdf/H3_AP202406101635918276_1.pdf?1718042942000.pdf
商贸零售：胖东来调改步步高、永辉超市事件思考-零售标杆胖东来是怎么炼成的？,德邦证券,2024-06-06,商业百货,https://pdf.dfcfw.com/pdf/H3_AP202406061635672974_1.pdf?1717666219000.pdf
商业贸易行业周报：618大促国货领跑，新规利好轻医美扩容,海通国际,2024-06-06,商业百货,https://pdf.dfcfw.com/pdf/H3_AP202406061635723402_1.pdf?1717705647000.pdf
商贸零售行业6月投资策略：618大促平台有所分化，国货美妆龙头表现稳中有进,国信证券,2024-06-04,商业百货,https://pdf.dfcfw.com/pdf/H3_AP202406041635336095_1.pdf?1717507228000.pdf
商贸零售行业跟踪周报：国内外品牌防晒新单品全梳理，多元化需求推动新型防晒剂增长，提示科思股份布局机会！,东吴证券,2024-06-03,商业百货,https://pdf.dfcfw.com/pdf/H3_AP202406031635218905_1.pdf?1717406642000.pdf
商贸零售行业周报：胖东来调改后的永辉超市日均单店营收可涨5倍,上海证券,2024-06-03,商业百货,https://pdf.dfcfw.com/pdf/H3_AP202406031635256638_1.pdf?1717427659000.pdf
商贸零售行业周报：美妆&零售板块周报，政策加码海外仓发展，跨境电商必争之地，持续关注出海链公司,德邦证券,2024-06-02,商业百货,https://pdf.dfcfw.com/pdf/H3_AP202406021635196770_1.pdf?1717339555000.pdf
商贸零售行业周报：关注胖东来帮扶永辉超市等超市企业调改,开源证券,2024-06-02,商业百货,https://pdf.dfcfw.com/pdf/H3_AP202406021635197742_1.pdf?1717348236000.pdf
零售周观点：“618”第一阶段收官，国货品牌珀莱雅、可复美表现亮眼，关注第二阶段表现,民生证券,2024-06-02,商业百货,https://pdf.dfcfw.com/pdf/H3_AP202406021635208577_1.pdf?1717357704000.pdf
新消费周观点：地产利好政策频出，或有助,信达证券,2024-06-02,商业百货,https://pdf.dfcfw.com/pdf/H3_AP202406021635199282_1.pdf?1717344213000.pdf
户外行业深度：健康与情绪价值，开启内需新篇章,华福证券,2024-05-31,商业百货,https://pdf.dfcfw.com/pdf/H3_AP202405311635079507_1.pdf?1717186138000.pdf
中国女性敏感肌深度分析与适敏彩妆研究报告,艾瑞股份,2024-05-29,商业百货,https://pdf.dfcfw.com/pdf/H3_AP202405291634804216_1.pdf?1716988940000.pdf
消费数据点评：政策加码，义乌进出口景气度持续,五矿证券,2024-05-29,商业百货,https://pdf.dfcfw.com/pdf/H3_AP202405291634810552_1.pdf?1716999381000.pdf
商贸零售：黄金珠宝年报&一季报总结-24年行业韧性有望持续，看好品牌受益金价上行,天风证券,2024-05-28,商业百货,https://pdf.dfcfw.com/pdf/H3_AP202405281634736021_1.pdf?1716888417000.pdf
美妆&零售行业板块周报：618大促开启，美妆表现几何？,德邦证券,2024-05-27,商业百货,https://pdf.dfcfw.com/pdf/H3_AP202405271634702487_1.pdf?1716795180000.pdf
商贸零售行业跟踪周报：大宗供应链公司Q1业绩环比恢复，关注厦门象屿、苏美达等底部区域布局机会,东吴证券,2024-05-27,商业百货,https://pdf.dfcfw.com/pdf/H3_AP202405271634706127_1.pdf?1716805088000.pdf
零售周观点：政策鼓励下，看好跨境电商和海外仓发展前景,民生证券,2024-05-27,商业百货,https://pdf.dfcfw.com/pdf/H3_AP202405271634707916_1.pdf?1716809216000.pdf
商贸零售行业周报：拼多多营收利润超预期，预计海外业务高速增长,上海证券,2024-05-27,商业百货,https://pdf.dfcfw.com/pdf/H3_AP202405271634710195_1.pdf?1716814492000.pdf
跨境电商产业跟踪：国常会聚焦跨境电商，海外仓“卖水人”重要性再重提,民生证券,2024-05-27,商业百货,https://pdf.dfcfw.com/pdf/H3_AP202405271634706849_1.pdf?1716807073000.pdf
商贸零售行业周报：618大促进行中，重组胶原蛋白热度不减,开源证券,2024-05-26,商业百货,https://pdf.dfcfw.com/pdf/H3_AP202405261634692952_1.pdf?1716801061000.pdf
新消费行业周观点：我国政策空间正在打开，若CPI向上有望带来消费板块投资机遇,信达证券,2024-05-26,商业百货,https://pdf.dfcfw.com/pdf/H3_AP202405261634689595_1.pdf?1716737976000.pdf
2023年报和2024年一季报总结：商贸零售行业：可选消费持续分化，关注细分赛道和行业龙头的结构性机会,东兴证券,2024-05-22,商业百货,https://pdf.dfcfw.com/pdf/H3_AP202405221634329916_1.pdf?1716404006000.pdf
商贸零售行业跟踪报告：4月印度培育钻石毛坯进口额同比跌幅缩小，进口端渗透率提升,万联证券,2024-05-21,商业百货,https://pdf.dfcfw.com/pdf/H3_AP202405211634004575_1.pdf?1716282043000.pdf
美妆行业周度市场观察2024年第19周,艾瑞股份,2024-05-21,商业百货,https://pdf.dfcfw.com/pdf/H3_AP202405211634046652_1.pdf?1716302033000.pdf
4月社零报告专题：假日错月叠加高基数，4月社零弱复苏,东海证券,2024-05-21,商业百货,https://pdf.dfcfw.com/pdf/H3_AP202405211634047853_1.pdf?1716302214000.pdf
商业贸易行业周报：4月社零3.6万亿增2.3%，可选消费品承压,海通国际,2024-05-21,商业百货,https://pdf.dfcfw.com/pdf/H3_AP202405211634051568_1.pdf?1716306164000.pdf
美妆&零售行业板块周报：618大促首次取消预售，看好国货美妆持续抢占份额,德邦证券,2024-05-21,商业百货,https://pdf.dfcfw.com/pdf/H3_AP202405211634055255_1.pdf?1716310002000.pdf
商贸零售行业周报：阿里重回增长轨道，京东净利润超预期增长,上海证券,2024-05-20,商业百货,https://pdf.dfcfw.com/pdf/H3_AP202405201633850351_1.pdf?1716198887000.pdf
商贸零售行业：618预售取消体验升级，国货美妆表现值得期待,华福证券,2024-05-20,商业百货,https://pdf.dfcfw.com/pdf/H3_AP202405201633865764_1.pdf?1716223776000.pdf
商贸零售：4月社零同比+2.3%，增速环比下行,国联证券,2024-05-20,商业百货,https://pdf.dfcfw.com/pdf/H3_AP202405201633855786_1.pdf?1716215719000.pdf
商贸零售行业跟踪周报：2024年618前瞻：取消预售却更早开卖，“规则简化”≠“不卷”,东吴证券,2024-05-20,商业百货,https://pdf.dfcfw.com/pdf/H3_AP202405201633862520_1.pdf?1716220635000.pdf
商贸零售行业点评报告：4月社零同比+2.3%，社会消费整体平稳运行,开源证券,2024-05-19,商业百货,https://pdf.dfcfw.com/pdf/H3_AP202405181633818646_1.pdf?1716113565000.pdf
商贸零售行业周报：618大促在即，关注线上消费恢复及国货美妆表现,开源证券,2024-05-19,商业百货,https://pdf.dfcfw.com/pdf/H3_AP202405191633829756_1.pdf?1716126885000.pdf
零售周观点：1-4月义乌市出口总额同比+20%，培育钻石产业峰会在郑州召开,民生证券,2024-05-19,商业百货,https://pdf.dfcfw.com/pdf/H3_AP202405191633834153_1.pdf?1716141798000.pdf
新消费周观点：美国降息预期增强，我国政,信达证券,2024-05-19,商业百货,https://pdf.dfcfw.com/pdf/H3_AP202405191633834100_1.pdf?1716138958000.pdf
商贸零售行业深度：再论金价上涨对黄金珠宝业绩的影响,东吴证券,2024-05-17,商业百货,https://pdf.dfcfw.com/pdf/H3_AP202405171633706818_1.pdf?1715964062000.pdf
电商行业动态研究：Shopify 2024Q1业绩点评-收入超预期，Q1 GMV同比增长23%,天风证券,2024-05-17,商业百货,https://pdf.dfcfw.com/pdf/H3_AP202405171633717176_1.pdf?1715972245000.pdf
2024年美国零售行业展望：在所有合适的地方寻找忠诚度,德勤,2024-05-16,商业百货,https://pdf.dfcfw.com/pdf/H3_AP202405161633243750_1.pdf?1715873147000.pdf
商贸零售行业财报总结暨5月投资策略：行业平稳龙头增速领先，降本增效驱动盈利优化,国信证券,2024-05-15,商业百货,https://pdf.dfcfw.com/pdf/H3_AP202405151633159154_1.pdf?1715768358000.pdf
商贸零售行业2024Q1业绩综述报告：一季度零售业绩回落，电商迎开门红,万联证券,2024-05-14,商业百货,https://pdf.dfcfw.com/pdf/H3_AP202405141633050687_1.pdf?1715682413000.pdf
商贸零售行业2023年年度业绩综述报告：零售23年营收同比下行，互联网电商业绩改善,万联证券,2024-05-14,商业百货,https://pdf.dfcfw.com/pdf/H3_AP202405141633050686_1.pdf?1715682513000.pdf
零售行业2023年报&2024年一季报综述：零售企业经营显著回暖，关注黄金珠宝、美容护理优质品牌,开源证券,2024-05-14,商业百货,https://pdf.dfcfw.com/pdf/H3_AP202405141633054762_1.pdf?1715695020000.pdf
国产商品出海：物美价廉，国货打开中国第二增长曲线 头豹词条报告系列,头豹研究院,2024-05-14,商业百货,https://pdf.dfcfw.com/pdf/H3_AP202405141633074837_1.pdf?1715715737000.pdf
消费市场周度观察：CPI温和上涨，扩表意愿平淡,国金证券,2024-05-13,商业百货,https://pdf.dfcfw.com/pdf/H3_AP202405131632933862_1.pdf?1715593503000.pdf
商贸零售行业周报：618大促陆续开启，淘天集团取消预售,上海证券,2024-05-13,商业百货,https://pdf.dfcfw.com/pdf/H3_AP202405131632933897_1.pdf?1715592141000.pdf
商贸零售行业跟踪周报：2024Q1总结：“海底捞月”与“再创辉煌”，关注出口，教育，供应链，酒店，美护，黄金等板块,东吴证券,2024-05-13,商业百货,https://pdf.dfcfw.com/pdf/H3_AP202405131632934288_1.pdf?1715593503000.pdf
中国女性吸收性卫生用品行业市场规模测算逻辑模型,头豹研究院,2024-05-12,商业百货,https://pdf.dfcfw.com/pdf/H3_AP202405111632897457_1.pdf?1715504257000.pdf
海外消费周报：携程和同程旅行发布五一假期旅游总结报告,申万宏源研究(香港),2024-05-12,商业百货,https://pdf.dfcfw.com/pdf/H3_AP202405121632915725_1.pdf?1715523836000.pdf
新消费周观点：猪价同比转正拉动CPI兑现，持续验证消费配置长线逻辑,信达证券,2024-05-12,商业百货,https://pdf.dfcfw.com/pdf/H3_AP202405121632918353_1.pdf?1715532013000.pdf
商贸零售行业周报：关注零售行业中期投资策略：顺应趋势、优选龙头,开源证券,2024-05-12,商业百货,https://pdf.dfcfw.com/pdf/H3_AP202405121632918705_1.pdf?1715532861000.pdf
零售周观点：4月为美妆销售淡月，建议关注“618”国货美妆品牌表现,民生证券,2024-05-12,商业百货,https://pdf.dfcfw.com/pdf/H3_AP202405121632924051_1.pdf?1715555251000.pdf
美妆&零售板块财报总结及5月策略：渐进复苏，把握趋势拐点,德邦证券,2024-05-10,商业百货,https://pdf.dfcfw.com/pdf/H3_AP202405101632835068_1.pdf?1715374873000.pdf
2024年零售行业信用风险展望,联合资信,2024-05-09,商业百货,https://pdf.dfcfw.com/pdf/H3_AP202405091632714950_1.pdf?1715249275000.pdf
商贸零售行业2023年年报及2024年一季报业绩综述：美妆国货龙头加速崛起，跨境电商&黄金珠宝&医美龙头增速稳健,民生证券,2024-05-08,商业百货,https://pdf.dfcfw.com/pdf/H3_AP202405071632582161_1.pdf?1715156479000.pdf
商贸零售行业2024年中期投资策略：顺应消费趋势，关注黄金珠宝等景气赛道优质品牌,开源证券,2024-05-08,商业百货,https://pdf.dfcfw.com/pdf/H3_AP202405081632672915_1.pdf?1715197900000.pdf
商贸零售行业研究：美妆把握单品生命周期投资机遇；黄金珠宝稳健、红利股属性突出,国金证券,2024-05-06,商业百货,https://pdf.dfcfw.com/pdf/H3_AP202405061632474779_1.pdf?1715002818000.pdf
消费持仓的信号：估值仓位开始提升，红利属性优势凸显,国金证券,2024-05-06,商业百货,https://pdf.dfcfw.com/pdf/H3_AP202405061632474782_1.pdf?1715005834000.pdf
