研报名称,机构名称,发布时间,行业,研报地址
商贸零售行业跟踪周报：24年618整体呈稳健增长，国货美妆品牌表现靓丽、领跑行业,东吴证券,2024-06-24,商业百货,https://pdf.dfcfw.com/pdf/H3_AP202406241636806845_1.pdf?1719196782000.pdf
商贸零售行业周报：胖东来调改永辉首店初见成效，持续关注同店提升效率,上海证券,2024-06-24,商业百货,https://pdf.dfcfw.com/pdf/H3_AP202406241636814607_1.pdf?1719228501000.pdf
2024年中期商贸零售行业投资策略报告：国潮崛起趋势明显，优秀品牌突围,万联证券,2024-06-24,商业百货,https://pdf.dfcfw.com/pdf/H3_AP202406241636836669_1.pdf?1719260780000.pdf
海外周报：积极关注中报前瞻，关注海外中国资产增加股东回报,民生证券,2024-06-24,商业百货,https://pdf.dfcfw.com/pdf/H3_AP202406241636815448_1.pdf?1719240128000.pdf
商贸零售行业动态点评：618宠物食品战报发布，零食礼包品类增速突出,东方财富证券,2024-06-24,商业百货,https://pdf.dfcfw.com/pdf/H3_AP202406241636823125_1.pdf?1719244045000.pdf
商贸零售行业周报：618大促收官，国货美妆龙头表现优于行业大盘,开源证券,2024-06-23,商业百货,https://pdf.dfcfw.com/pdf/H3_AP202406231636800966_1.pdf?1719160343000.pdf
新消费周观点：美联储降息预期扰动市场投资决策,信达证券,2024-06-23,商业百货,https://pdf.dfcfw.com/pdf/H3_AP202406231636802221_1.pdf?1719167540000.pdf
零售周观点：“618”大促收官，美妆类目同比+6.6%，国货美妆龙头持续高增长,民生证券,2024-06-23,商业百货,https://pdf.dfcfw.com/pdf/H3_AP202406231636804182_1.pdf?1719180314000.pdf
2024年5月社零数据跟踪报告：5月社零同比+3.7%，多数品类增速环比回升,万联证券,2024-06-20,商业百货,https://pdf.dfcfw.com/pdf/H3_AP202406201636701903_1.pdf?1718879959000.pdf
商贸零售周报：5月社零小幅回升，限额以上企业增速较上月提升较多,首创证券,2024-06-20,商业百货,https://pdf.dfcfw.com/pdf/H3_AP202406201636701905_1.pdf?1718879657000.pdf
商贸零售行业动态点评：618美护品牌分化加剧，珀莱雅_可复美_韩束势能恒强,东方财富证券,2024-06-20,商业百货,https://pdf.dfcfw.com/pdf/H3_AP202406201636714830_1.pdf?1718908761000.pdf
医美化妆品5月月报：618大促珀莱雅、巨子生物旗下品牌表现亮眼,开源证券,2024-06-19,商业百货,https://pdf.dfcfw.com/pdf/H3_AP202406191636682015_1.pdf?1718806076000.pdf
5月社零报告专题：5月社零维持温和复苏，可选消费显弹性,东海证券,2024-06-19,商业百货,https://pdf.dfcfw.com/pdf/H3_AP202406191636694944_1.pdf?1718833291000.pdf
商贸零售行业2024年中期投资策略：顺势而为，积极拥抱新模式与新变革,民生证券,2024-06-18,商业百货,https://pdf.dfcfw.com/pdf/H3_AP202406171636547338_1.pdf?1718706163000.pdf
商贸零售：5月社零同比+3.7%，同比增速回升,国联证券,2024-06-18,商业百货,https://pdf.dfcfw.com/pdf/H3_AP202406181636588345_1.pdf?1718701942000.pdf
商贸零售行业动态点评：5月社零总额同比+3.7%，618节奏调整下化妆品类+19%,东方财富证券,2024-06-18,商业百货,https://pdf.dfcfw.com/pdf/H3_AP202406181636604983_1.pdf?1718705578000.pdf
2024年5月社零数据点评：五月社零同比增长3.7%，品类结构性分化加剧,国信证券,2024-06-18,商业百货,https://pdf.dfcfw.com/pdf/H3_AP202406181636638606_1.pdf?1718736064000.pdf
美妆&零售板块周报：周大福FY24业绩拆解，同店恢复与展店提效，关注单店效能持续爬升,德邦证券,2024-06-17,商业百货,https://pdf.dfcfw.com/pdf/H3_AP202406171636463265_1.pdf?1718613383000.pdf
消费行业2024年中期展望：期待政策释放驱动内需边际改善,浦银国际证券,2024-06-17,商业百货,https://pdf.dfcfw.com/pdf/H3_AP202406171636465629_1.pdf?1718622562000.pdf
商贸零售行业点评报告：5月社零同比+3.7%，电商大促带动美妆等品类增长,开源证券,2024-06-17,商业百货,https://pdf.dfcfw.com/pdf/H3_AP202406171636488479_1.pdf?1718646727000.pdf
商贸零售行业周报：周大福FY24表现稳健，关注终端动销,上海证券,2024-06-17,商业百货,https://pdf.dfcfw.com/pdf/H3_AP202406171636481620_1.pdf?1718635126000.pdf
商贸零售行业深度报告：品牌系列深度3：为什么烟和酒都有强品牌，茶没有？,东吴证券,2024-06-17,商业百货,https://pdf.dfcfw.com/pdf/H3_AP202406171636484868_1.pdf?1718640366000.pdf
商贸零售行业周报：胖东来帮扶多家超市企业，关注618国货美妆表现,开源证券,2024-06-16,商业百货,https://pdf.dfcfw.com/pdf/H3_AP202406161636456526_1.pdf?1718549406000.pdf
商贸零售行业跟踪周报：出行数据整体持续呈较快增速趋势，关注OTA平台等方向,东吴证券,2024-06-16,商业百货,https://pdf.dfcfw.com/pdf/H3_AP202406161636459925_1.pdf?1718579466000.pdf
零售周观点：5月义乌市出口额同比增长28.7%，景气度持续,民生证券,2024-06-16,商业百货,https://pdf.dfcfw.com/pdf/H3_AP202406161636459979_1.pdf?1718580156000.pdf
新消费周观点：降息预期打开我国政策空间，必选先至，可选可期,信达证券,2024-06-16,商业百货,https://pdf.dfcfw.com/pdf/H3_AP202406161636456924_1.pdf?1718550587000.pdf
商贸零售周报：美团2024Q1营收增速稳定，新业务亏损大幅收窄,首创证券,2024-06-14,商业百货,https://pdf.dfcfw.com/pdf/H3_AP202406141636241903_1.pdf?1718389871000.pdf
大消费行业专题报告：创新驱动消费质变，产品差异引领未来,国金证券,2024-06-13,商业百货,https://pdf.dfcfw.com/pdf/H3_AP202406131636055244_1.pdf?1718271123000.pdf
商贸零售行业专题研究：以Shein为例，看小单快反模式下的柔性供应链机遇,东方财富证券,2024-06-12,商业百货,https://pdf.dfcfw.com/pdf/H3_AP202406121636006734_1.pdf?1718213234000.pdf
零售周观点：零售“标杆”胖东来与被调改企业实现共赢，5月全国出口数据超预期,民生证券,2024-06-11,商业百货,https://pdf.dfcfw.com/pdf/H3_AP202406111635928477_1.pdf?1718079306000.pdf
美妆&零售板块周报：如何解读近期海运费涨价，跨境卖家应对几何？,德邦证券,2024-06-11,商业百货,https://pdf.dfcfw.com/pdf/H3_AP202406111635961426_1.pdf?1718111583000.pdf
商贸零售行业跟踪周报：名创优品出海近况梳理：强品牌、强供应链，品牌出海标杆,东吴证券,2024-06-11,商业百货,https://pdf.dfcfw.com/pdf/H3_AP202406111635962244_1.pdf?1718111259000.pdf
商贸零售行业周报：美团核心本地商业强劲增长，新业务战略减亏,上海证券,2024-06-11,商业百货,https://pdf.dfcfw.com/pdf/H3_AP202406111635962895_1.pdf?1718112221000.pdf
商贸零售行业周报：国货美妆品牌加码自有原料布局，竞争力有望提升,开源证券,2024-06-10,商业百货,https://pdf.dfcfw.com/pdf/H3_AP202406101635915130_1.pdf?1718030219000.pdf
新消费周观点：大类资产龙头配置与整合性,信达证券,2024-06-10,商业百货,https://pdf.dfcfw.com/pdf/H3_AP202406101635918276_1.pdf?1718042942000.pdf
商贸零售：胖东来调改步步高、永辉超市事件思考-零售标杆胖东来是怎么炼成的？,德邦证券,2024-06-06,商业百货,https://pdf.dfcfw.com/pdf/H3_AP202406061635672974_1.pdf?1717666219000.pdf
商业贸易行业周报：618大促国货领跑，新规利好轻医美扩容,海通国际,2024-06-06,商业百货,https://pdf.dfcfw.com/pdf/H3_AP202406061635723402_1.pdf?1717705647000.pdf
商贸零售行业6月投资策略：618大促平台有所分化，国货美妆龙头表现稳中有进,国信证券,2024-06-04,商业百货,https://pdf.dfcfw.com/pdf/H3_AP202406041635336095_1.pdf?1717507228000.pdf
商贸零售行业跟踪周报：国内外品牌防晒新单品全梳理，多元化需求推动新型防晒剂增长，提示科思股份布局机会！,东吴证券,2024-06-03,商业百货,https://pdf.dfcfw.com/pdf/H3_AP202406031635218905_1.pdf?1717406642000.pdf
商贸零售行业周报：胖东来调改后的永辉超市日均单店营收可涨5倍,上海证券,2024-06-03,商业百货,https://pdf.dfcfw.com/pdf/H3_AP202406031635256638_1.pdf?1717427659000.pdf
商贸零售行业周报：美妆&零售板块周报，政策加码海外仓发展，跨境电商必争之地，持续关注出海链公司,德邦证券,2024-06-02,商业百货,https://pdf.dfcfw.com/pdf/H3_AP202406021635196770_1.pdf?1717339555000.pdf
商贸零售行业周报：关注胖东来帮扶永辉超市等超市企业调改,开源证券,2024-06-02,商业百货,https://pdf.dfcfw.com/pdf/H3_AP202406021635197742_1.pdf?1717348236000.pdf
零售周观点：“618”第一阶段收官，国货品牌珀莱雅、可复美表现亮眼，关注第二阶段表现,民生证券,2024-06-02,商业百货,https://pdf.dfcfw.com/pdf/H3_AP202406021635208577_1.pdf?1717357704000.pdf
新消费周观点：地产利好政策频出，或有助,信达证券,2024-06-02,商业百货,https://pdf.dfcfw.com/pdf/H3_AP202406021635199282_1.pdf?1717344213000.pdf
户外行业深度：健康与情绪价值，开启内需新篇章,华福证券,2024-05-31,商业百货,https://pdf.dfcfw.com/pdf/H3_AP202405311635079507_1.pdf?1717186138000.pdf
中国女性敏感肌深度分析与适敏彩妆研究报告,艾瑞股份,2024-05-29,商业百货,https://pdf.dfcfw.com/pdf/H3_AP202405291634804216_1.pdf?1716988940000.pdf
消费数据点评：政策加码，义乌进出口景气度持续,五矿证券,2024-05-29,商业百货,https://pdf.dfcfw.com/pdf/H3_AP202405291634810552_1.pdf?1716999381000.pdf
商贸零售：黄金珠宝年报&一季报总结-24年行业韧性有望持续，看好品牌受益金价上行,天风证券,2024-05-28,商业百货,https://pdf.dfcfw.com/pdf/H3_AP202405281634736021_1.pdf?1716888417000.pdf
美妆&零售行业板块周报：618大促开启，美妆表现几何？,德邦证券,2024-05-27,商业百货,https://pdf.dfcfw.com/pdf/H3_AP202405271634702487_1.pdf?1716795180000.pdf
商贸零售行业跟踪周报：大宗供应链公司Q1业绩环比恢复，关注厦门象屿、苏美达等底部区域布局机会,东吴证券,2024-05-27,商业百货,https://pdf.dfcfw.com/pdf/H3_AP202405271634706127_1.pdf?1716805088000.pdf
零售周观点：政策鼓励下，看好跨境电商和海外仓发展前景,民生证券,2024-05-27,商业百货,https://pdf.dfcfw.com/pdf/H3_AP202405271634707916_1.pdf?1716809216000.pdf
商贸零售行业周报：拼多多营收利润超预期，预计海外业务高速增长,上海证券,2024-05-27,商业百货,https://pdf.dfcfw.com/pdf/H3_AP202405271634710195_1.pdf?1716814492000.pdf
跨境电商产业跟踪：国常会聚焦跨境电商，海外仓“卖水人”重要性再重提,民生证券,2024-05-27,商业百货,https://pdf.dfcfw.com/pdf/H3_AP202405271634706849_1.pdf?1716807073000.pdf
商贸零售行业周报：618大促进行中，重组胶原蛋白热度不减,开源证券,2024-05-26,商业百货,https://pdf.dfcfw.com/pdf/H3_AP202405261634692952_1.pdf?1716801061000.pdf
新消费行业周观点：我国政策空间正在打开，若CPI向上有望带来消费板块投资机遇,信达证券,2024-05-26,商业百货,https://pdf.dfcfw.com/pdf/H3_AP202405261634689595_1.pdf?1716737976000.pdf
2023年报和2024年一季报总结：商贸零售行业：可选消费持续分化，关注细分赛道和行业龙头的结构性机会,东兴证券,2024-05-22,商业百货,https://pdf.dfcfw.com/pdf/H3_AP202405221634329916_1.pdf?1716404006000.pdf
商贸零售行业跟踪报告：4月印度培育钻石毛坯进口额同比跌幅缩小，进口端渗透率提升,万联证券,2024-05-21,商业百货,https://pdf.dfcfw.com/pdf/H3_AP202405211634004575_1.pdf?1716282043000.pdf
美妆行业周度市场观察2024年第19周,艾瑞股份,2024-05-21,商业百货,https://pdf.dfcfw.com/pdf/H3_AP202405211634046652_1.pdf?1716302033000.pdf
4月社零报告专题：假日错月叠加高基数，4月社零弱复苏,东海证券,2024-05-21,商业百货,https://pdf.dfcfw.com/pdf/H3_AP202405211634047853_1.pdf?1716302214000.pdf
商业贸易行业周报：4月社零3.6万亿增2.3%，可选消费品承压,海通国际,2024-05-21,商业百货,https://pdf.dfcfw.com/pdf/H3_AP202405211634051568_1.pdf?1716306164000.pdf
美妆&零售行业板块周报：618大促首次取消预售，看好国货美妆持续抢占份额,德邦证券,2024-05-21,商业百货,https://pdf.dfcfw.com/pdf/H3_AP202405211634055255_1.pdf?1716310002000.pdf
商贸零售行业周报：阿里重回增长轨道，京东净利润超预期增长,上海证券,2024-05-20,商业百货,https://pdf.dfcfw.com/pdf/H3_AP202405201633850351_1.pdf?1716198887000.pdf
商贸零售行业：618预售取消体验升级，国货美妆表现值得期待,华福证券,2024-05-20,商业百货,https://pdf.dfcfw.com/pdf/H3_AP202405201633865764_1.pdf?1716223776000.pdf
商贸零售：4月社零同比+2.3%，增速环比下行,国联证券,2024-05-20,商业百货,https://pdf.dfcfw.com/pdf/H3_AP202405201633855786_1.pdf?1716215719000.pdf
商贸零售行业跟踪周报：2024年618前瞻：取消预售却更早开卖，“规则简化”≠“不卷”,东吴证券,2024-05-20,商业百货,https://pdf.dfcfw.com/pdf/H3_AP202405201633862520_1.pdf?1716220635000.pdf
商贸零售行业点评报告：4月社零同比+2.3%，社会消费整体平稳运行,开源证券,2024-05-19,商业百货,https://pdf.dfcfw.com/pdf/H3_AP202405181633818646_1.pdf?1716113565000.pdf
商贸零售行业周报：618大促在即，关注线上消费恢复及国货美妆表现,开源证券,2024-05-19,商业百货,https://pdf.dfcfw.com/pdf/H3_AP202405191633829756_1.pdf?1716126885000.pdf
零售周观点：1-4月义乌市出口总额同比+20%，培育钻石产业峰会在郑州召开,民生证券,2024-05-19,商业百货,https://pdf.dfcfw.com/pdf/H3_AP202405191633834153_1.pdf?1716141798000.pdf
新消费周观点：美国降息预期增强，我国政,信达证券,2024-05-19,商业百货,https://pdf.dfcfw.com/pdf/H3_AP202405191633834100_1.pdf?1716138958000.pdf
商贸零售行业深度：再论金价上涨对黄金珠宝业绩的影响,东吴证券,2024-05-17,商业百货,https://pdf.dfcfw.com/pdf/H3_AP202405171633706818_1.pdf?1715964062000.pdf
电商行业动态研究：Shopify 2024Q1业绩点评-收入超预期，Q1 GMV同比增长23%,天风证券,2024-05-17,商业百货,https://pdf.dfcfw.com/pdf/H3_AP202405171633717176_1.pdf?1715972245000.pdf
2024年美国零售行业展望：在所有合适的地方寻找忠诚度,德勤,2024-05-16,商业百货,https://pdf.dfcfw.com/pdf/H3_AP202405161633243750_1.pdf?1715873147000.pdf
商贸零售行业财报总结暨5月投资策略：行业平稳龙头增速领先，降本增效驱动盈利优化,国信证券,2024-05-15,商业百货,https://pdf.dfcfw.com/pdf/H3_AP202405151633159154_1.pdf?1715768358000.pdf
商贸零售行业2024Q1业绩综述报告：一季度零售业绩回落，电商迎开门红,万联证券,2024-05-14,商业百货,https://pdf.dfcfw.com/pdf/H3_AP202405141633050687_1.pdf?1715682413000.pdf
商贸零售行业2023年年度业绩综述报告：零售23年营收同比下行，互联网电商业绩改善,万联证券,2024-05-14,商业百货,https://pdf.dfcfw.com/pdf/H3_AP202405141633050686_1.pdf?1715682513000.pdf
零售行业2023年报&2024年一季报综述：零售企业经营显著回暖，关注黄金珠宝、美容护理优质品牌,开源证券,2024-05-14,商业百货,https://pdf.dfcfw.com/pdf/H3_AP202405141633054762_1.pdf?1715695020000.pdf
国产商品出海：物美价廉，国货打开中国第二增长曲线 头豹词条报告系列,头豹研究院,2024-05-14,商业百货,https://pdf.dfcfw.com/pdf/H3_AP202405141633074837_1.pdf?1715715737000.pdf
消费市场周度观察：CPI温和上涨，扩表意愿平淡,国金证券,2024-05-13,商业百货,https://pdf.dfcfw.com/pdf/H3_AP202405131632933862_1.pdf?1715593503000.pdf
商贸零售行业周报：618大促陆续开启，淘天集团取消预售,上海证券,2024-05-13,商业百货,https://pdf.dfcfw.com/pdf/H3_AP202405131632933897_1.pdf?1715592141000.pdf
商贸零售行业跟踪周报：2024Q1总结：“海底捞月”与“再创辉煌”，关注出口，教育，供应链，酒店，美护，黄金等板块,东吴证券,2024-05-13,商业百货,https://pdf.dfcfw.com/pdf/H3_AP202405131632934288_1.pdf?1715593503000.pdf
中国女性吸收性卫生用品行业市场规模测算逻辑模型,头豹研究院,2024-05-12,商业百货,https://pdf.dfcfw.com/pdf/H3_AP202405111632897457_1.pdf?1715504257000.pdf
海外消费周报：携程和同程旅行发布五一假期旅游总结报告,申万宏源研究(香港),2024-05-12,商业百货,https://pdf.dfcfw.com/pdf/H3_AP202405121632915725_1.pdf?1715523836000.pdf
新消费周观点：猪价同比转正拉动CPI兑现，持续验证消费配置长线逻辑,信达证券,2024-05-12,商业百货,https://pdf.dfcfw.com/pdf/H3_AP202405121632918353_1.pdf?1715532013000.pdf
商贸零售行业周报：关注零售行业中期投资策略：顺应趋势、优选龙头,开源证券,2024-05-12,商业百货,https://pdf.dfcfw.com/pdf/H3_AP202405121632918705_1.pdf?1715532861000.pdf
零售周观点：4月为美妆销售淡月，建议关注“618”国货美妆品牌表现,民生证券,2024-05-12,商业百货,https://pdf.dfcfw.com/pdf/H3_AP202405121632924051_1.pdf?1715555251000.pdf
美妆&零售板块财报总结及5月策略：渐进复苏，把握趋势拐点,德邦证券,2024-05-10,商业百货,https://pdf.dfcfw.com/pdf/H3_AP202405101632835068_1.pdf?1715374873000.pdf
2024年零售行业信用风险展望,联合资信,2024-05-09,商业百货,https://pdf.dfcfw.com/pdf/H3_AP202405091632714950_1.pdf?1715249275000.pdf
商贸零售行业2023年年报及2024年一季报业绩综述：美妆国货龙头加速崛起，跨境电商&黄金珠宝&医美龙头增速稳健,民生证券,2024-05-08,商业百货,https://pdf.dfcfw.com/pdf/H3_AP202405071632582161_1.pdf?1715156479000.pdf
商贸零售行业2024年中期投资策略：顺应消费趋势，关注黄金珠宝等景气赛道优质品牌,开源证券,2024-05-08,商业百货,https://pdf.dfcfw.com/pdf/H3_AP202405081632672915_1.pdf?1715197900000.pdf
商贸零售行业研究：美妆把握单品生命周期投资机遇；黄金珠宝稳健、红利股属性突出,国金证券,2024-05-06,商业百货,https://pdf.dfcfw.com/pdf/H3_AP202405061632474779_1.pdf?1715002818000.pdf
消费持仓的信号：估值仓位开始提升，红利属性优势凸显,国金证券,2024-05-06,商业百货,https://pdf.dfcfw.com/pdf/H3_AP202405061632474782_1.pdf?1715005834000.pdf
新消费周观点：美联储宽松货币政策或将为中国打开政策空间，对A&H股可以更乐观些,信达证券,2024-05-05,商业百货,https://pdf.dfcfw.com/pdf/H3_AP202405051632451532_1.pdf?1714924038000.pdf
商贸零售行业周报：零售企业经营持续恢复，关注高景气优质公司,开源证券,2024-05-05,商业百货,https://pdf.dfcfw.com/pdf/H3_AP202405051632456342_1.pdf?1714943309000.pdf
商贸零售行业跟踪周报：商社板块分红派息梳理：关注大宗供应链、百货、景区、黄金等板块,东吴证券,2024-04-30,商业百货,https://pdf.dfcfw.com/pdf/H3_AP202404301631709819_1.pdf?1714453579000.pdf
洗面奶行业研究报告：中国洗面奶行业监管趋严，未来竞争多元化趋势显著 头豹词条报告系列,头豹研究院,2024-04-29,商业百货,https://pdf.dfcfw.com/pdf/H3_AP202404291631621116_1.pdf?1714424276000.pdf
消费一周看图2024W17：关注保温杯北美火热带来的新投资机会,国投证券,2024-04-28,商业百货,https://pdf.dfcfw.com/pdf/H3_AP202404281631515121_1.pdf?1714300146000.pdf
新消费周观点：日元加速贬破支撑位，低估值的中国资本市场或是全球避险资金的重要选择,信达证券,2024-04-28,商业百货,https://pdf.dfcfw.com/pdf/H3_AP202404281631547660_1.pdf?1714329417000.pdf
商贸零售行业周报：年报一季报陆续披露，关注高景气板块优质公司,开源证券,2024-04-28,商业百货,https://pdf.dfcfw.com/pdf/H3_AP202404281631549661_1.pdf?1714333604000.pdf
零售周观点：进入23年年报及24年一季报密集披露期，关注业绩超预期标的,民生证券,2024-04-28,商业百货,https://pdf.dfcfw.com/pdf/H3_AP202404281631553898_1.pdf?1714345585000.pdf
互联网电商行业专题研究：生成式AI重塑广告营销产业链，商业化落地加速,国联证券,2024-04-28,商业百货,https://pdf.dfcfw.com/pdf/H3_AP202404281631517803_1.pdf?1714307128000.pdf
商贸零售行业周报：把握业绩稳健增长的低估值标的,上海证券,2024-04-28,商业百货,https://pdf.dfcfw.com/pdf/H3_AP202404281631545802_1.pdf?1714326002000.pdf
商贸零售行业点评：华凯易佰：23年归母净利3.32亿元同增53%符合预期，多平台多区域赋能增长,天风证券,2024-04-26,商业百货,https://pdf.dfcfw.com/pdf/H3_AP202404261631375273_1.pdf?1714141727000.pdf
跨境电商行业事件点评：大件品红利&TEMU新模式共振，一体化布局的跨境龙头存非线性增长机遇,民生证券,2024-04-24,商业百货,https://pdf.dfcfw.com/pdf/H3_AP202404241631119254_1.pdf?1713968901000.pdf
商贸零售行业跟踪周报：旅游行业五一前瞻：国内游稳中有增，出境游显著修复,东吴证券,2024-04-22,商业百货,https://pdf.dfcfw.com/pdf/H3_AP202404221630938650_1.pdf?1713745216000.pdf
粉底液行业研究报告：直播电商模式拉动中国粉底液行业增长，未来有望向男性消费者持续渗透 头豹词条报告系列,头豹研究院,2024-04-22,商业百货,https://pdf.dfcfw.com/pdf/H3_AP202404221630986236_1.pdf?1713815270000.pdf
商贸零售行业周报：小商品城主业迈入量价齐升的新发展阶段,上海证券,2024-04-21,商业百货,https://pdf.dfcfw.com/pdf/H3_AP202404211630907674_1.pdf?1713697706000.pdf
零售周观点：珀莱雅计划24H1推出新洗护品牌“惊时”，24年3月社零总额同比+3.1%,民生证券,2024-04-21,商业百货,https://pdf.dfcfw.com/pdf/H3_AP202404211630921039_1.pdf?1713712009000.pdf
商贸零售行业周报：社会消费稳健恢复，关注黄金珠宝和国货美妆龙头,开源证券,2024-04-21,商业百货,https://pdf.dfcfw.com/pdf/H3_AP202404211630932839_1.pdf?1713724144000.pdf
2024年3月社零数据点评：24Q1社零同比增长4.7%，可选消费分化增长,上海证券,2024-04-19,商业百货,https://pdf.dfcfw.com/pdf/H3_AP202404191630636538_1.pdf?1713516050000.pdf
3月社零数据点评：3月社零同比+3.1%，一季度国民经济开局良好,甬兴证券,2024-04-19,商业百货,https://pdf.dfcfw.com/pdf/H3_AP202404191630642702_1.pdf?1713519734000.pdf
中国直播电商行业研究报告,艾瑞股份,2024-04-19,商业百货,https://pdf.dfcfw.com/pdf/H3_AP202404191630646457_1.pdf?1713525904000.pdf
HTI大众品零售价格跟踪：方便食品折扣力度较上月降低，液态奶及软饮料增加,海通国际,2024-04-18,商业百货,https://pdf.dfcfw.com/pdf/H3_AP202404181630498856_1.pdf?1713431157000.pdf
2024年3月社零数据点评：三月社零同比增长3.1%，消费复苏平稳推进,国信证券,2024-04-18,商业百货,https://pdf.dfcfw.com/pdf/H3_AP202404181630505272_1.pdf?1713447667000.pdf
3月社零报告专题：3月社零受季节扰动，未来仍具增长韧性,东海证券,2024-04-18,商业百货,https://pdf.dfcfw.com/pdf/H3_AP202404181630505397_1.pdf?1713447822000.pdf
女性消费力洞察报告2024,JLL,2024-04-18,商业百货,https://pdf.dfcfw.com/pdf/H3_AP202404181630507844_1.pdf?1713457843000.pdf
产业演进视角看“消费降级”：买方时代，零售、品牌结构重塑,中泰证券,2024-04-18,商业百货,https://pdf.dfcfw.com/pdf/H3_AP202404181630514412_1.pdf?1713459539000.pdf
商贸零售行业2024年3月社零数据跟踪报告：3月社零同比+3.1%，必选品更具韧性,万联证券,2024-04-18,商业百货,https://pdf.dfcfw.com/pdf/H3_AP202404181630521902_1.pdf?1713465538000.pdf
商贸零售：低于市场预期，消费修复有所放缓,国联证券,2024-04-17,商业百货,https://pdf.dfcfw.com/pdf/H3_AP202404161630307512_1.pdf?1713339077000.pdf
钻石行业跟踪报告：3月印度培育钻石进出口渗透率均同比提升,万联证券,2024-04-17,商业百货,https://pdf.dfcfw.com/pdf/H3_AP202404171630409211_1.pdf?1713379236000.pdf
消费基础设施公募REITs：回归商业本质 实现资产价值,戴德梁行,2024-04-16,商业百货,https://pdf.dfcfw.com/pdf/H3_AP202404161630272258_1.pdf?1713267476000.pdf
跨境电商：从傲基科技招股书看本轮大件品跨境红利-业务蜕变，再显锋芒,民生证券,2024-04-16,商业百货,https://pdf.dfcfw.com/pdf/H3_AP202404161630272872_1.pdf?1713273514000.pdf
商贸零售行业点评报告：3月社零同增3.1%，持续关注社会消费恢复进程,开源证券,2024-04-16,商业百货,https://pdf.dfcfw.com/pdf/H3_AP202404161630290307_1.pdf?1713294010000.pdf
医美化妆品3月月报：长效动物胶原产品为重组胶原产品明晰方向，抖音对美妆品牌方重要性进一步提升,开源证券,2024-04-15,商业百货,https://pdf.dfcfw.com/pdf/H3_AP202404151630210234_1.pdf?1713166763000.pdf
商贸零售行业周报：金价年内涨幅达18%，持续关注黄金珠宝品牌商终端销售,上海证券,2024-04-15,商业百货,https://pdf.dfcfw.com/pdf/H3_AP202404151630211030_1.pdf?1713174396000.pdf
零售周观点：周大福发布FY24Q4经营数据，一季度跨境电商进出口额维持高增,民生证券,2024-04-14,商业百货,https://pdf.dfcfw.com/pdf/H3_AP202404141630209533_1.pdf?1713122390000.pdf
商贸零售行业周报：需求旺盛叠加格局优化，国货防晒品牌迎来新机遇,开源证券,2024-04-14,商业百货,https://pdf.dfcfw.com/pdf/H3_AP202404141630208246_1.pdf?1713115810000.pdf
