研报名称,机构名称,发布时间,行业,研报地址
零售周观点：多项政策利好落地，关注超跌反弹机会,民生证券,2024-10-01,商业百货,https://pdf.dfcfw.com/pdf/H3_AP202410011640135852_1.pdf?1727809773000.pdf
商贸零售行业周报：零售企业回归本质，线上线下有望进入均衡发展阶段,甬兴证券,2024-09-30,商业百货,https://pdf.dfcfw.com/pdf/H3_AP202409301640096678_1.pdf?1727686813000.pdf
电商行业点评：直播电商迎来规范发展新阶段，预计双11阿里京东GMV增速趋近大盘,国信证券,2024-09-30,商业百货,https://pdf.dfcfw.com/pdf/H3_AP202409301640097857_1.pdf?1727688647000.pdf
商贸零售行业2024年半年报总结：黄金珠宝长期景气度高，线下零售韧性依旧,上海证券,2024-09-29,商业百货,https://pdf.dfcfw.com/pdf/H3_AP202409291640092376_1.pdf?1727608221000.pdf
商贸零售行业周报：名创优品拟63亿入股永辉，协同共进可期,上海证券,2024-09-29,商业百货,https://pdf.dfcfw.com/pdf/H3_AP202409291640094670_1.pdf?1727634761000.pdf
商贸零售行业跟踪周报：名创优品拟收购永辉超市29%股权，看好线下零售格局改善前景。附永辉经营拆解,东吴证券,2024-09-29,商业百货,https://pdf.dfcfw.com/pdf/H3_AP202409291640094687_1.pdf?1727646818000.pdf
商贸零售行业周报：多地再启消费券政策，有望提振终端消费,开源证券,2024-09-29,商业百货,https://pdf.dfcfw.com/pdf/H3_AP202409291640094695_1.pdf?1727646624000.pdf
跨境电商行业：高性价比消费时代，品牌出海大有可为,东兴证券,2024-09-27,商业百货,https://pdf.dfcfw.com/pdf/H3_AP202409271640082522_1.pdf?1727466638000.pdf
零售美妆：消费复苏催化“美丽经济”再起 头豹词条报告系列,头豹研究院,2024-09-27,商业百货,https://pdf.dfcfw.com/pdf/H3_AP202409271640082654_1.pdf?1727467265000.pdf
国产商品东南亚市场出海：东南亚跨境电商新纪元 头豹词条报告系列,头豹研究院,2024-09-26,商业百货,https://pdf.dfcfw.com/pdf/H3_AP202409261640062004_1.pdf?1727381850000.pdf
商业贸易行业周报：“以旧换新”成效初显，补贴类目销售喜人,五矿证券,2024-09-25,商业百货,https://pdf.dfcfw.com/pdf/H3_AP202409251640026279_1.pdf?1727270646000.pdf
跨境电商行业专题：全球电商格局重塑，我国跨境平台御风前行,麦高证券,2024-09-24,商业百货,https://pdf.dfcfw.com/pdf/H3_AP202409241639995534_1.pdf?1727169026000.pdf
钻石行业跟踪报告：8月印度培育钻石进出口端渗透率同比提升,万联证券,2024-09-24,商业百货,https://pdf.dfcfw.com/pdf/H3_AP202409241640008300_1.pdf?1727204282000.pdf
2024中国空间零售发展研究报告：织梦空间，蜕变之旅,亿欧智库,2024-09-23,商业百货,https://pdf.dfcfw.com/pdf/H3_AP202409231639976340_1.pdf?1727091670000.pdf
商贸零售行业跟踪周报：8月社零总额同比+2.1%整体仍承压，关注景气度相对较高的出海、教育、黄金珠宝,东吴证券,2024-09-23,商业百货,https://pdf.dfcfw.com/pdf/H3_AP202409231639976395_1.pdf?1727084457000.pdf
商贸零售行业周报：黄金珠宝板块关注节日催化下终端动销,上海证券,2024-09-23,商业百货,https://pdf.dfcfw.com/pdf/H3_AP202409231639977677_1.pdf?1727092136000.pdf
2024年8月社零数据跟踪报告：8月社零同比+2.10%，较7月略有下降,万联证券,2024-09-23,商业百货,https://pdf.dfcfw.com/pdf/H3_AP202409231639991560_1.pdf?1727126839000.pdf
海外消费行业周更新：降息有望提振工具终端需求，耐克换帅应对业绩疲软,国海证券,2024-09-22,商业百货,https://pdf.dfcfw.com/pdf/H3_AP202409221639974127_1.pdf?1727041484000.pdf
商贸零售行业周报：夸迪进军医用敷料市场，“械+妆”协同或成趋势,开源证券,2024-09-22,商业百货,https://pdf.dfcfw.com/pdf/H3_AP202409221639973723_1.pdf?1727038980000.pdf
零售周观点：美联储降息落地推动金价走强，抖音电商发布全新CORE方法论,民生证券,2024-09-22,商业百货,https://pdf.dfcfw.com/pdf/H3_AP202409221639973944_1.pdf?1727035357000.pdf
医美化妆品8月月报：重组胶原医美市场蓝海待拓，关注香水品牌管理公司颖通控股拟IPO,开源证券,2024-09-20,商业百货,https://pdf.dfcfw.com/pdf/H3_AP202409201639958076_1.pdf?1726846421000.pdf
中国跨境电商ERP行业市场规模测算逻辑模型 头豹词条报告系列,头豹研究院,2024-09-20,商业百货,https://pdf.dfcfw.com/pdf/H3_AP202409201639966054_1.pdf?1726861320000.pdf
中国招聘流程外包（RPO）行业市场规模测算逻辑模型 头豹词条报告系列,头豹研究院,2024-09-20,商业百货,https://pdf.dfcfw.com/pdf/H3_AP202409201639966053_1.pdf?1726861320000.pdf
商社行业周报：8月社零环比表现乏力，舒适、生活感成短途游潮流,首创证券,2024-09-20,商业百货,https://pdf.dfcfw.com/pdf/H3_AP202409201639954686_1.pdf?1726840861000.pdf
8月社零报告专题：8月社零同增2.1%，关注消费政策力度,东海证券,2024-09-19,商业百货,https://pdf.dfcfw.com/pdf/H3_AP202409181639926801_1.pdf?1726728818000.pdf
商业贸易行业周报：8月社零总额增2.1%，可选消费仍承压,海通国际,2024-09-19,商业百货,https://pdf.dfcfw.com/pdf/H3_AP202409191639929151_1.pdf?1726732389000.pdf
商贸零售行业周报：8月社零同比增长2.1%，关注高股息低估值的零售企业,上海证券,2024-09-18,商业百货,https://pdf.dfcfw.com/pdf/H3_AP202409181639912447_1.pdf?1726654885000.pdf
商贸零售行业跟踪周报：中秋假期出行表现平稳，预计国庆铁路日均客流同比+8%,东吴证券,2024-09-18,商业百货,https://pdf.dfcfw.com/pdf/H3_AP202409181639914903_1.pdf?1726669633000.pdf
商贸零售：8月社零同比+2.1%，增速环比回落,国联证券,2024-09-17,商业百货,https://pdf.dfcfw.com/pdf/H3_AP202409171639900541_1.pdf?1726573652000.pdf
互联网行业月报：8月电商：开学采购及以旧换新带动带电品类回暖,交银国际证券,2024-09-17,商业百货,https://pdf.dfcfw.com/pdf/H3_AP202409171639904553_1.pdf?1726592723000.pdf
商贸零售行业周报：社会消费整体稳健，关注黄金珠宝秋季订货会情况,开源证券,2024-09-17,商业百货,https://pdf.dfcfw.com/pdf/H3_AP202409171639907318_1.pdf?1726656456000.pdf
商贸零售行业专题研究：国际四大美妆集团财报综述-中国区销售表现普遍承压，积极采取措施调整应对,民生证券,2024-09-17,商业百货,https://pdf.dfcfw.com/pdf/H3_AP202409171639900760_1.pdf?1726582139000.pdf
零售周观点：国内凉味剂生产龙头中草香料敲钟上市，8月社零总额同比+2.1%,民生证券,2024-09-16,商业百货,https://pdf.dfcfw.com/pdf/H3_AP202409161639892293_1.pdf?1726499208000.pdf
商贸零售行业点评报告：8月社零同比+2.1%，关注中秋、国庆消费表现,开源证券,2024-09-14,商业百货,https://pdf.dfcfw.com/pdf/H3_AP202409141639887122_1.pdf?1726348266000.pdf
消费行业深度报告：探索山姆和奥乐齐逆势成长的奥秘 以及日本高景气长青折扣业态复盘,太平洋,2024-09-13,商业百货,https://pdf.dfcfw.com/pdf/H3_AP202409131639866464_1.pdf?1726234558000.pdf
2024年美妆及日化家清行业网络营销监测报告,艾瑞股份,2024-09-13,商业百货,https://pdf.dfcfw.com/pdf/H3_AP202409131639866771_1.pdf?1726240479000.pdf
商贸零售行业9月投资策略暨中期总结：行业整体表现平淡，关注结构性景气方向,国信证券,2024-09-13,商业百货,https://pdf.dfcfw.com/pdf/H3_AP202409131639875248_1.pdf?1726250315000.pdf
商贸零售点评：市内店新政落地，有望增强国内免税竞争力,国都证券,2024-09-12,商业百货,https://pdf.dfcfw.com/pdf/H3_AP202409121639858942_1.pdf?1726172324000.pdf
商贸零售行业简评报告：商社周报，中秋国庆临近，出境游短途游景气、传统礼品市场承压,首创证券,2024-09-10,商业百货,https://pdf.dfcfw.com/pdf/H3_AP202409101639810667_1.pdf?1725974564000.pdf
中国跨境电商珠宝行业市场规模测算逻辑模型 头豹词条报告系列,头豹研究院,2024-09-09,商业百货,https://pdf.dfcfw.com/pdf/H3_AP202409091639802230_1.pdf?1725914371000.pdf
跨境出海周度市场观察2024年第35周,艾瑞股份,2024-09-09,商业百货,https://pdf.dfcfw.com/pdf/H3_AP202409091639802867_1.pdf?1725915842000.pdf
零售周观点：美国“一元店”二季度业绩不及预期，下调全年预期,民生证券,2024-09-09,商业百货,https://pdf.dfcfw.com/pdf/H3_AP202409091639790419_1.pdf?1725885634000.pdf
商贸零售行业周报：永辉全国首家胖东来式自主调改店恢复营业，关注同店提升效率,上海证券,2024-09-09,商业百货,https://pdf.dfcfw.com/pdf/H3_AP202409091639798388_1.pdf?1725904659000.pdf
商贸零售行业周报：巨子生物XVII型胶原新专利贡献差异化价值，看好重组胶原行业未来发展,开源证券,2024-09-08,商业百货,https://pdf.dfcfw.com/pdf/H3_AP202409081639786329_1.pdf?1725817590000.pdf
商贸零售行业跟踪周报：低位下，黄金珠宝品牌价值或凸显，关注黄金珠宝价值型机会,东吴证券,2024-09-08,商业百货,https://pdf.dfcfw.com/pdf/H3_AP202409081639786137_1.pdf?1725804946000.pdf
胶原蛋白行业深度（二）：重组胶原医美市场蓝海待拓，高端消费人群引领潮流,开源证券,2024-09-06,商业百货,https://pdf.dfcfw.com/pdf/H3_AP202409061639768576_1.pdf?1725630786000.pdf
国产商品欧美市场出海：品质与创新引领全球消费新潮流 头豹词条报告系列,头豹研究院,2024-09-06,商业百货,https://pdf.dfcfw.com/pdf/H3_AP202409061639780249_1.pdf?1725653197000.pdf
卓越电商生态链：现代化供应链金融解决方案与价值创新 头豹词条报告系列,头豹研究院,2024-09-05,商业百货,https://pdf.dfcfw.com/pdf/H3_AP202409051639758986_1.pdf?1725565999000.pdf
商贸零售行业2024年中报业绩综述：24Q2板块表现分化，出海、美妆龙头业绩韧性充足,民生证券,2024-09-04,商业百货,https://pdf.dfcfw.com/pdf/H3_AP202409041639731868_1.pdf?1725464218000.pdf
中国互联网电子商务：Sea Limited近期最被关注的4个问题,海通国际,2024-09-04,商业百货,https://pdf.dfcfw.com/pdf/H3_AP202409041639725602_1.pdf?1725459321000.pdf
2024年商社板块秋季策略：拥抱消费赛道的小确幸,华福证券,2024-09-04,商业百货,https://pdf.dfcfw.com/pdf/H3_AP202409041639737391_1.pdf?1725476663000.pdf
商贸零售：周大生：24Q2业绩略承压，持续强化分红,天风证券,2024-09-03,商业百货,https://pdf.dfcfw.com/pdf/H3_AP202409031639703899_1.pdf?1725353171000.pdf
商贸零售行业周报：中报披露完毕，把握业绩稳健增长的低估值标的,上海证券,2024-09-03,商业百货,https://pdf.dfcfw.com/pdf/H3_AP202409031639706856_1.pdf?1725357761000.pdf
商社行业周报：五部门联合印发通知完善市内免税店政策，政策驱动周度行情,首创证券,2024-09-03,商业百货,https://pdf.dfcfw.com/pdf/H3_AP202409031639708133_1.pdf?1725369828000.pdf
商业贸易行业周报：关注1500亿特别国债对消费的拉动效果,五矿证券,2024-09-03,商业百货,https://pdf.dfcfw.com/pdf/H3_AP202409031639708192_1.pdf?1725371206000.pdf
商贸零售行业跟踪周报：2024Q2总结：消费行业低预期下，关注韧性板块教育，出海，黄金等,东吴证券,2024-09-02,商业百货,https://pdf.dfcfw.com/pdf/H3_AP202409021639684950_1.pdf?1725273155000.pdf
商贸零售：潮宏基：24Q2归母净利同增17%，加盟扩张驱动增长,天风证券,2024-09-01,商业百货,https://pdf.dfcfw.com/pdf/H3_AP202409011639680918_1.pdf?1725224498000.pdf
商贸零售行业周报：零售企业二季度营收稳健，关注高景气优质公司,开源证券,2024-09-01,商业百货,https://pdf.dfcfw.com/pdf/H3_AP202409011639680639_1.pdf?1725211343000.pdf
商社行业周报：中报密集发布，关注结构性机会,首创证券,2024-08-28,商业百货,https://pdf.dfcfw.com/pdf/H3_AP202408281639505431_1.pdf?1724833753000.pdf
商贸零售行业跟踪周报：奢侈品集团24Q2业绩总览：日本地区虹吸延续，Q3有望缓解,东吴证券,2024-08-26,商业百货,https://pdf.dfcfw.com/pdf/H3_AP202408261639445484_1.pdf?1724639499000.pdf
商贸零售行业周报：关注中报业绩兑现强的低估值零售企业,上海证券,2024-08-26,商业百货,https://pdf.dfcfw.com/pdf/H3_AP202408261639447751_1.pdf?1724669519000.pdf
商贸零售行业周报：中报发布进行时，新增重点推荐赛维时代,开源证券,2024-08-25,商业百货,https://pdf.dfcfw.com/pdf/H3_AP202408251639444185_1.pdf?1724622711000.pdf
商贸零售行业专题研究：出海系列之三—挤进美国零售高地意义非凡,国联证券,2024-08-25,商业百货,https://pdf.dfcfw.com/pdf/H3_AP202408251639441376_1.pdf?1724592971000.pdf
零售周观点：雅诗兰黛24财年净销售额下滑，泡泡玛特24H1收入高增62%,民生证券,2024-08-25,商业百货,https://pdf.dfcfw.com/pdf/H3_AP202408251639443545_1.pdf?1724614095000.pdf
7月社零数据点评：7月社零同比+2.7%，消费市场平稳恢复,甬兴证券,2024-08-23,商业百货,https://pdf.dfcfw.com/pdf/H3_AP202408231639415658_1.pdf?1724412456000.pdf
商贸零售行业简评报告-商社周报：7月社零有所恢复，阿里京东业绩、指引靓丽,首创证券,2024-08-23,商业百货,https://pdf.dfcfw.com/pdf/H3_AP202408231639416412_1.pdf?1724423352000.pdf
钻石行业数据跟踪报告：7月印度天然钻石进出口额同比跌幅缩小，培育钻石进出口额同比跌幅扩大,万联证券,2024-08-23,商业百货,https://pdf.dfcfw.com/pdf/H3_AP202408231639434181_1.pdf?1724446322000.pdf
HTI东南亚消费行业7月跟踪报告：印尼及越南经济较乐观，消费板块有所走弱,海通国际,2024-08-22,商业百货,https://pdf.dfcfw.com/pdf/H3_AP202408221639389001_1.pdf?1724323264000.pdf
商业贸易行业周报：7月社零总额增2.7%、2Q25FY沃尔玛中国同店增14%，关注消费市场结构性机会,海通国际,2024-08-20,商业百货,https://pdf.dfcfw.com/pdf/H3_AP202408201639347800_1.pdf?1724151741000.pdf
商贸零售行业跟踪周报：思考乐教育披露2024年中报，需求强劲业绩高增，关注政策趋稳后教培行业投资机会,东吴证券,2024-08-19,商业百货,https://pdf.dfcfw.com/pdf/H3_AP202408191639326521_1.pdf?1724045744000.pdf
海外消费行业周更新：361度H1业绩稳健，ON Q2营收创新高,国海证券,2024-08-19,商业百货,https://pdf.dfcfw.com/pdf/H3_AP202408191639326942_1.pdf?1724060086000.pdf
商贸零售行业周报：阿里稳步增长，淘天市场份额保持稳定,上海证券,2024-08-19,商业百货,https://pdf.dfcfw.com/pdf/H3_AP202408191639329806_1.pdf?1724066730000.pdf
零售周观点：沃尔玛二季度增长超预期，中国区山姆会员店贡献增长,民生证券,2024-08-19,商业百货,https://pdf.dfcfw.com/pdf/H3_AP202408191639330871_1.pdf?1724079038000.pdf
7月社零报告专题：7月社零同比小幅回升，必选好于可选,东海证券,2024-08-19,商业百货,https://pdf.dfcfw.com/pdf/H3_AP202408191639342139_1.pdf?1724097686000.pdf
商贸零售行业周报：进入中报密集披露期，关注黄金珠宝和国货美妆龙头,开源证券,2024-08-18,商业百货,https://pdf.dfcfw.com/pdf/H3_AP202408181639324795_1.pdf?1723995511000.pdf
医美化妆品7月月报：国际美妆大牌中国市场失速，看好国货美妆龙头份额提升,开源证券,2024-08-17,商业百货,https://pdf.dfcfw.com/pdf/H3_AP202408171639323449_1.pdf?1723980032000.pdf
商贸零售：7月社零同比+2.7%，增速环比改善,国联证券,2024-08-16,商业百货,https://pdf.dfcfw.com/pdf/H3_AP202408161639301593_1.pdf?1723801287000.pdf
2024年7月社零数据点评：七月社零同比增长2.7%，可选品类有所承压,国信证券,2024-08-16,商业百货,https://pdf.dfcfw.com/pdf/H3_AP202408161639305102_1.pdf?1723813884000.pdf
商贸零售行业点评报告：7月社零同比+2.7%，期待后续消费潜力逐步释放,开源证券,2024-08-16,商业百货,https://pdf.dfcfw.com/pdf/H3_AP202408161639305591_1.pdf?1723814505000.pdf
商贸零售行业2024年7月社零数据跟踪报告：7月社零同比+2.7%，增速较6月略有回升,万联证券,2024-08-16,商业百货,https://pdf.dfcfw.com/pdf/H3_AP202408161639310904_1.pdf?1723825689000.pdf
企业竞争图谱：2024年品牌营销咨询 头豹词条报告系列,头豹研究院,2024-08-16,商业百货,https://pdf.dfcfw.com/pdf/H3_AP202408161639317637_1.pdf?1723842223000.pdf
穿戴甲：“指尖”掘金30亿，小甲片上的大生意 头豹词条报告系列,头豹研究院,2024-08-16,商业百货,https://pdf.dfcfw.com/pdf/H3_AP202408161639317636_1.pdf?1723842303000.pdf
中国品牌营销咨询行业市场规模测算逻辑模型 头豹词条报告系列,头豹研究院,2024-08-16,商业百货,https://pdf.dfcfw.com/pdf/H3_AP202408161639317640_1.pdf?1723842127000.pdf
花卉经济新潮流：鲜花电商如何通过创新技术满足个性化消费体验 头豹词条报告系列,头豹研究院,2024-08-15,商业百货,https://pdf.dfcfw.com/pdf/H3_AP202408151639295926_1.pdf?1723750750000.pdf
社零数据点评：7月国内消费市场延续偏弱表现，体育娱乐用品当月增速转正,山西证券,2024-08-15,商业百货,https://pdf.dfcfw.com/pdf/H3_AP202408151639296142_1.pdf?1723751379000.pdf
零售业减少食物浪费实施指南,中国连锁经营协会,2024-08-15,商业百货,https://pdf.dfcfw.com/pdf/H3_AP202409161639892681_1.pdf?1726501525000.pdf
商社行业周报：食品带动7月CPI上行，资生堂业绩受核污水拖累,首创证券,2024-08-13,商业百货,https://pdf.dfcfw.com/pdf/H3_AP202408131639257820_1.pdf?1723569551000.pdf
商贸零售行业跟踪周报：医美再生材料景气度向上，期待童颜针等PLA产品放量,东吴证券,2024-08-12,商业百货,https://pdf.dfcfw.com/pdf/H3_AP202408121639233092_1.pdf?1723437978000.pdf
商贸零售行业周报：叮咚买菜Q2业绩超预期，永辉超市第二家胖东来帮扶调改店启动试营业,上海证券,2024-08-12,商业百货,https://pdf.dfcfw.com/pdf/H3_AP202408121639234540_1.pdf?1723454997000.pdf
商贸零售行业周报：永辉超市持续推进门店调改，从1到N变革进行时,开源证券,2024-08-11,商业百货,https://pdf.dfcfw.com/pdf/H3_AP202408111639231338_1.pdf?1723387501000.pdf
商贸社服行业板块周报：从韩国龙头丽珠兰，看三文鱼水光市场空间,德邦证券,2024-08-11,商业百货,https://pdf.dfcfw.com/pdf/H3_AP202408111639231545_1.pdf?1723387986000.pdf
零售周观点：资生堂FY24 H1归母净利润同比-100%，拉夫劳伦FY25 Q1净利润同比+28%,民生证券,2024-08-11,商业百货,https://pdf.dfcfw.com/pdf/H3_AP202408111639232217_1.pdf?1723402918000.pdf
2024年中国消费变迁及科技发展趋势报告：润物有声（消费产业版）,艾瑞股份,2024-08-08,商业百货,https://pdf.dfcfw.com/pdf/H3_AP202408081639204616_1.pdf?1723149234000.pdf
商贸零售行业周报：亚马逊财报显示海外需求回落，餐饮盈利多承压,首创证券,2024-08-06,商业百货,https://pdf.dfcfw.com/pdf/H3_AP202408061639154201_1.pdf?1722930254000.pdf
商贸零售行业跟踪周报：本周新东方&好未来披露最新季度业绩，教培行业终端需求强劲,东吴证券,2024-08-05,商业百货,https://pdf.dfcfw.com/pdf/H3_AP202408051639134186_1.pdf?1722836095000.pdf
商贸零售行业周报：关注下半年季节性因素对国内金饰消费需求的支撑作用,上海证券,2024-08-05,商业百货,https://pdf.dfcfw.com/pdf/H3_AP202408051639138354_1.pdf?1722866042000.pdf
大消费行业2024Q2基金持仓分析：除家电环比增配，其余大消费板块均环比减配,万联证券,2024-08-05,商业百货,https://pdf.dfcfw.com/pdf/H3_AP202408051639145879_1.pdf?1722883926000.pdf
消费行业点评：6月社零同比+2.0%，低于wind一致预期,国都证券,2024-08-05,商业百货,https://pdf.dfcfw.com/pdf/H3_AP202408051639148975_1.pdf?1722889438000.pdf
美妆&零售行业板块周报：欧莱雅财报解读，看美妆四大趋势,德邦证券,2024-08-04,商业百货,https://pdf.dfcfw.com/pdf/H3_AP202408041639132309_1.pdf?1722773668000.pdf
零售周观点：华熙生物获批颈纹适应症，江苏吴中投资水光PDRN婴儿针,民生证券,2024-08-04,商业百货,https://pdf.dfcfw.com/pdf/H3_AP202408041639133802_1.pdf?1722808986000.pdf
商贸零售行业周报：关注医美厂商差异化新品，为行业注入增长新动力,开源证券,2024-08-04,商业百货,https://pdf.dfcfw.com/pdf/H3_AP202408041639132961_1.pdf?1722805645000.pdf
商社行业2024年中期策略：关注国内高性价比消费和品牌出海,东兴证券,2024-08-01,商业百货,https://pdf.dfcfw.com/pdf/H3_AP202408011638804887_1.pdf?1722501529000.pdf
商贸零售行业周报：行业估值进一步下修，董宇辉离职东方甄选,首创证券,2024-08-01,商业百货,https://pdf.dfcfw.com/pdf/H3_AP202408011638807511_1.pdf?1722512210000.pdf
商贸零售行业美妆&零售板块周报：招股书拆解-颖通控股，中国最大的香水品牌管理公司,德邦证券,2024-08-01,商业百货,https://pdf.dfcfw.com/pdf/H3_AP202408011638808363_1.pdf?1722520363000.pdf
HTI中国消费品7月价格报告：飞天批价企稳回升，软饮料折扣力度减小,海通国际,2024-07-31,商业百货,https://pdf.dfcfw.com/pdf/H3_AP202407311638784699_1.pdf?1722438524000.pdf
商贸零售：消费税改或影响利益分配，关注百货、免税机遇,国联证券,2024-07-30,商业百货,https://pdf.dfcfw.com/pdf/H3_AP202407301638456363_1.pdf?1722328494000.pdf
商贸零售行业跟踪周报：美国“加征关税”对消费品出海，影响几何？,东吴证券,2024-07-30,商业百货,https://pdf.dfcfw.com/pdf/H3_AP202407301638459072_1.pdf?1722333460000.pdf
消费行业快评报告：关注政治局会议信号，提振消费扩大内需,万联证券,2024-07-30,商业百货,https://pdf.dfcfw.com/pdf/H3_AP202407301638479194_1.pdf?1722366829000.pdf
商贸零售行业周报：LVMH 2Q24业绩环比略放缓，中国消费者全球购买力坚挺,国金证券,2024-07-29,商业百货,https://pdf.dfcfw.com/pdf/H3_AP202407291638414089_1.pdf?1722241368000.pdf
商贸零售行业8月投资策略：行业增速相对平淡，关注个股投资机会,国信证券,2024-07-29,商业百货,https://pdf.dfcfw.com/pdf/H3_AP202407291638415956_1.pdf?1722244965000.pdf
商贸零售行业周报：24H1全国新开业的商业项目数量达131个，关注购物中心业态创新趋势,上海证券,2024-07-29,商业百货,https://pdf.dfcfw.com/pdf/H3_AP202407291638424242_1.pdf?1722264242000.pdf
商贸零售行业周报：上美股份上半年增长亮眼，红旗连锁主业经营稳健,开源证券,2024-07-28,商业百货,https://pdf.dfcfw.com/pdf/H3_AP202407281638398882_1.pdf?1722263353000.pdf
零售周观点：爱马仕、联合利华发布24年上半年财报，中国市场销售增长放缓,民生证券,2024-07-28,商业百货,https://pdf.dfcfw.com/pdf/H3_AP202407281638403618_1.pdf?1722204666000.pdf
日本可选消费&必需消费：关于《HTI日本消费行业6月跟踪报告：通胀再次升温，入境游拉动可选消费》的错误修订,海通国际,2024-07-25,商业百货,https://pdf.dfcfw.com/pdf/H3_AP202407251638306398_1.pdf?1721942672000.pdf
黄金珠宝系列一：四问四答，金价波动如何影响饰品消费及品牌公司业绩？,德邦证券,2024-07-24,商业百货,https://pdf.dfcfw.com/pdf/H3_AP202407241638247876_1.pdf?1721813732000.pdf
二十届三中全会消费行业跟踪报告：加快培育完整内需体系，关注消费税改革进程,万联证券,2024-07-23,商业百货,https://pdf.dfcfw.com/pdf/H3_AP202407231638209391_1.pdf?1721723288000.pdf
循环电商行业深度报告：性价比消费助推循环电商，闲置消费市场空间广阔,甬兴证券,2024-07-22,商业百货,https://pdf.dfcfw.com/pdf/H3_AP202407211638158284_1.pdf?1721632726000.pdf
商贸零售行业周报：24H1社零同比增长3.7%，6月增速趋缓,上海证券,2024-07-22,商业百货,https://pdf.dfcfw.com/pdf/H3_AP202407221638175189_1.pdf?1721648533000.pdf
美妆&零售行业板块周报：Q3海外零售步入旺季，亚马逊会员日销售同增11%,德邦证券,2024-07-22,商业百货,https://pdf.dfcfw.com/pdf/H3_AP202407221638182428_1.pdf?1721663703000.pdf
商贸零售行业周报：亚马逊Prime Day增长稳健，低价商店项目已在路上,开源证券,2024-07-21,商业百货,https://pdf.dfcfw.com/pdf/H3_AP202407211638147451_1.pdf?1721563901000.pdf
商贸零售行业跟踪周报：金价再创新高利好黄金珠宝行业长期发展，关注低估值下板块配置机会,东吴证券,2024-07-21,商业百货,https://pdf.dfcfw.com/pdf/H3_AP202407211638150745_1.pdf?1721579629000.pdf
零售周观点：24Q2商贸零售&美容护理板块公募基金持仓市值环比下滑,民生证券,2024-07-21,商业百货,https://pdf.dfcfw.com/pdf/H3_AP202407211638156271_1.pdf?1721593821000.pdf
商贸零售行业跟踪报告：6月社零同比+2.0%，增速较5月回落,万联证券,2024-07-18,商业百货,https://pdf.dfcfw.com/pdf/H3_AP202407181638050812_1.pdf?1721328485000.pdf
商贸零售：6月社零同比+2.0%，低于市场预期,国联证券,2024-07-18,商业百货,https://pdf.dfcfw.com/pdf/H3_AP202407181638051878_1.pdf?1721330059000.pdf
6月社零报告专题：6月社零同比+2.0%，可选消费承压,东海证券,2024-07-17,商业百货,https://pdf.dfcfw.com/pdf/H3_AP202407171638002665_1.pdf?1721235240000.pdf
钻石行业跟踪报告：6月印度培育钻石进口端和出口端渗透率均有所提升,万联证券,2024-07-17,商业百货,https://pdf.dfcfw.com/pdf/H3_AP202407171638007139_1.pdf?1721240793000.pdf
