研报名称,机构名称,发布时间,行业,研报地址
金融行业双周报：2025年保险保费收入突破六万亿元,东莞证券,2026-02-08,多元金融,https://pdf.dfcfw.com/pdf/H3_AP202602081819824278_1.pdf?1770569453000.pdf
证监会2026年1号文点评：RWA的严监管时代,国信证券,2026-02-08,多元金融,https://pdf.dfcfw.com/pdf/H3_AP202602081819824353_1.pdf?1770569742000.pdf
非银金融行业机构行为更新专题：理解“平准基金”的三个视角,国信证券,2026-02-06,多元金融,https://pdf.dfcfw.com/pdf/H3_AP202602061819803184_1.pdf?1770371983000.pdf
中国担保行业，2026年2月,中诚信国际,2026-02-05,多元金融,https://pdf.dfcfw.com/pdf/H3_AP202602051819786474_1.pdf?1770304444000.pdf
金融业数据应用发展报告（2024—2025年）,北京金融科技产业联盟,2026-02-03,多元金融,https://pdf.dfcfw.com/pdf/H3_AP202602031819645515_1.pdf?1770150462000.pdf
非银行金融行业研究：拟扩大战略投资者类型，中长期资金入市再迎政策支持,国金证券,2026-02-02,多元金融,https://pdf.dfcfw.com/pdf/H3_AP202602021819361185_1.pdf?1770058951000.pdf
地方AMC行业2026年1月,中诚信国际,2026-01-30,多元金融,https://pdf.dfcfw.com/pdf/H3_AP202601301818572720_1.pdf?1769782944000.pdf
非银行业周报（26年第三期）：2025券商业绩预增，迎来估值业绩双修复,中航证券,2026-01-26,多元金融,https://pdf.dfcfw.com/pdf/H3_AP202601261818417503_1.pdf?1769432988000.pdf
金融行业内部审计监管政策及活动在中国大陆和香港-2025年第四季度,安永(中国)企业咨询,2026-01-22,多元金融,https://pdf.dfcfw.com/pdf/H3_AP202601221818269810_1.pdf?1769098546000.pdf
金融行业：2025年四季度内地与香港地区金融行业内部审计相关监管政策与动态,安永(中国)企业咨询,2026-01-22,多元金融,https://pdf.dfcfw.com/pdf/H3_AP202601221818269815_1.pdf?1769097562000.pdf
寻找中国保险的Alpha系列之四：从保单到数据：新能源车险的价值跃迁,国信证券,2026-01-22,多元金融,https://pdf.dfcfw.com/pdf/H3_AP202601221818285000_1.pdf?1769115195000.pdf
金融产品深度报告：广发中证工程机械ETF（560280.SH）：板块进入复苏阶段，配置兼具稳健性&弹性，助力业绩高涨,东吴证券,2026-01-15,多元金融,https://pdf.dfcfw.com/pdf/H3_AP202601151817039133_1.pdf?1768474135000.pdf
稳定币行业简报_2025_08：市场洞察：稳定币：监管框架完善与机构采用加速下的数字货币新格局,头豹研究院,2026-01-14,多元金融,https://pdf.dfcfw.com/pdf/H3_AP202601141817020658_1.pdf?1768420079000.pdf
非银行业：节奏调节精准发力，助力市场稳健运行,中国银河,2026-01-14,多元金融,https://pdf.dfcfw.com/pdf/H3_AP202601141817020925_1.pdf?1768420503000.pdf
非银金融行业跟踪周报：交投活跃度再提升；保险开门红如约而至；继续看好保险_券商,东吴证券,2026-01-12,多元金融,https://pdf.dfcfw.com/pdf/H3_AP202601121816925632_1.pdf?1768200126000.pdf
REITs行业周报：消费REITs单周表现优异，发行市场保持活跃,开源证券,2026-01-12,多元金融,https://pdf.dfcfw.com/pdf/H3_AP202601121816931076_1.pdf?1768206147000.pdf
消费金融行业信用风险展望（2026年1月）,联合资信评估,2026-01-12,多元金融,https://pdf.dfcfw.com/pdf/H3_AP202601121816947729_1.pdf?1768239919000.pdf
非银行业周报（2026年第一期）：基金降费让利，券商财富管理转型提速,中航证券,2026-01-12,多元金融,https://pdf.dfcfw.com/pdf/H3_AP202601121816949411_1.pdf?1768247533000.pdf
非银金融行业深度报告：金融IT的三大驱动力与投资逻辑总览,东吴证券,2026-01-11,多元金融,https://pdf.dfcfw.com/pdf/H3_AP202601101816905595_1.pdf?1768126401000.pdf
非银金融机构行为更新专题：共识与变化：一季度居民财富再配置新变局,国信证券,2026-01-11,多元金融,https://pdf.dfcfw.com/pdf/H3_AP202601111816918011_1.pdf?1768143101000.pdf
多元行业深度报告：公募基金改革陆续落地，推动行业高质量发展,东吴证券,2026-01-11,多元金融,https://pdf.dfcfw.com/pdf/H3_AP202601111816921327_1.pdf?1768158175000.pdf
2025年中国第三方支付行业研究报告,艾瑞股份,2026-01-10,多元金融,https://pdf.dfcfw.com/pdf/H3_AP202601091816889517_1.pdf?1768037081000.pdf
资本市场聚焦（十二）：公募费改三阶段全面落地，差异化安排持续优化行业生态,东海证券,2026-01-06,多元金融,https://pdf.dfcfw.com/pdf/H3_AP202601061816073330_1.pdf?1767715148000.pdf
REITs行业周报：推动REITs市场发展，提高上市发行效率,开源证券,2026-01-05,多元金融,https://pdf.dfcfw.com/pdf/H3_AP202601051815149653_1.pdf?1767600042000.pdf
融资租赁行业2026年信用风险展望：“去杠杆归本源”，行业尾部承压，信用分化加剧,大公国际资信评估,2026-01-04,多元金融,https://pdf.dfcfw.com/pdf/H3_AP202601041814490566_1.pdf?1767518375000.pdf
金融租赁行业2026年信用风险展望：政策引导下的转型深化与分化加剧,大公国际资信评估,2026-01-04,多元金融,https://pdf.dfcfw.com/pdf/H3_AP202601041814490447_1.pdf?1767520148000.pdf
非银金融行业点评报告：公募基金降费第三阶段落地，引导权益类基金发展，平滑对短债基金的影响,东吴证券,2026-01-04,多元金融,https://pdf.dfcfw.com/pdf/H3_AP202601031813889580_1.pdf?1767511244000.pdf
REITs行业周报：保障房REITs单周表现优异，发行市场保持活跃,开源证券,2025-12-29,多元金融,https://pdf.dfcfw.com/pdf/H3_AP202512291810385403_1.pdf?1766996095000.pdf
2026年投资管理行业展望：把握增长新机，寻求规模扩张,德勤,2025-12-25,多元金融,https://pdf.dfcfw.com/pdf/H3_AP202512251807846181_1.pdf?1766675616000.pdf
全球金融监管动态月刊,毕马威会计师事务所,2025-12-22,多元金融,https://pdf.dfcfw.com/pdf/H3_AP202512211805345562_1.pdf?1766393774000.pdf
REITs行业周报：REITs市场单周各板块均有所回调，发行市场保持活跃,开源证券,2025-12-22,多元金融,https://pdf.dfcfw.com/pdf/H3_AP202512221805592486_1.pdf?1766390569000.pdf
融资租赁公司业务转型研究,联合资信评估,2025-12-22,多元金融,https://pdf.dfcfw.com/pdf/H3_AP202512221805907346_1.pdf?1766429481000.pdf
《资产管理信托管理办法》将重塑行业生态，推动信托业回归本源,大公国际资信评估,2025-12-19,多元金融,https://pdf.dfcfw.com/pdf/H3_AP202512191803574622_1.pdf?1766136322000.pdf
2026年货币政策展望：适度宽松护航“十五五”开局 政策协同赋能高质量发展,大公国际资信评估,2025-12-19,多元金融,https://pdf.dfcfw.com/pdf/H3_AP202512191803575049_1.pdf?1766135896000.pdf
金融行业双周报：监管引导非银“提质”：证券结构优化，险资长投激励,东莞证券,2025-12-19,多元金融,https://pdf.dfcfw.com/pdf/H3_AP202512191803817223_1.pdf?1766164041000.pdf
《金融租赁公司融资租赁业务管理办法》对金租行业信用状况改善具有正向影响，但可能导致行业个体的分化,大公国际资信评估,2025-12-19,多元金融,https://pdf.dfcfw.com/pdf/H3_AP202512191803910121_1.pdf?1766176648000.pdf
非银金融行业点评报告：中金公司吸收合并东兴、信达预案出炉，资产规模将破万亿,东吴证券,2025-12-18,多元金融,https://pdf.dfcfw.com/pdf/H3_AP202512171802612400_1.pdf?1766039548000.pdf
2025半年度社会责任与可持续金融专题报告,工商银行,2025-12-18,多元金融,https://pdf.dfcfw.com/pdf/H3_AP202512181802828007_1.pdf?1766043134000.pdf
金融业：聚焦三大领域、赋能改革筑基：从中央经济工作会议看2026年金融工作重点,大公国际资信评估,2025-12-17,多元金融,https://pdf.dfcfw.com/pdf/H3_AP202512171802450836_1.pdf?1765996112000.pdf
非银金融：公募基金销售行为规范点评-规范销售行为，强化“以投资者为中心”导向,中银证券,2025-12-17,多元金融,https://pdf.dfcfw.com/pdf/H3_AP202512171802557065_1.pdf?1766008791000.pdf
REITs行业周报：提升全社会资源配置效率，保障房REITs单周表现优异,开源证券,2025-12-15,多元金融,https://pdf.dfcfw.com/pdf/H3_AP202512151800764705_1.pdf?1765785738000.pdf
2025消费金融数字化转型主题调研报告,银联数据服务,2025-12-15,多元金融,https://pdf.dfcfw.com/pdf/H3_AP202512151801111673_1.pdf?1765830272000.pdf
非银行金融行业研究：持续深化资本市场投融资综合改革，保险开门红景气度上行，非银经营韧性增强,国金证券,2025-12-14,多元金融,https://pdf.dfcfw.com/pdf/H3_AP202512141800433020_1.pdf?1765743601000.pdf
基金公司绩效考核新规点评：强化薪酬与业绩绑定，健全长效激励约束机制,中银证券,2025-12-11,多元金融,https://pdf.dfcfw.com/pdf/H3_AP202512111798070229_1.pdf?1765438689000.pdf
《关于调整保险公司相关业务风险因子的通知》点评：风险因子优化提升险资长线投资能力，释放市场活力,华龙证券,2025-12-11,多元金融,https://pdf.dfcfw.com/pdf/H3_AP202512111798216337_1.pdf?1765458528000.pdf
资本市场聚焦（十一）：从规模扩张到功能适配，加速一流投行差异化建设,东海证券,2025-12-10,多元金融,https://pdf.dfcfw.com/pdf/H3_AP202512101797629948_1.pdf?1765381551000.pdf
REITs行业周报：稳步发展REITs和资产证券化，发行市场保持活跃,开源证券,2025-12-08,多元金融,https://pdf.dfcfw.com/pdf/H3_AP202512081796108532_1.pdf?1765181250000.pdf
金融业：“十五五”前瞻：金融篇——以金融强国为目标、五篇大文章为抓手，统筹机构优化与市场改革筑牢风险底线,大公国际资信评估,2025-12-07,多元金融,https://pdf.dfcfw.com/pdf/H3_AP202512071795815277_1.pdf?1765146706000.pdf
非银金融行业点评报告：适度提升优质券商的资本空间，聚焦券商高质量发展,东吴证券,2025-12-06,多元金融,https://pdf.dfcfw.com/pdf/H3_AP202512061795248195_1.pdf?1765103297000.pdf
2025年11月全国租赁市场报告,58安居客房产研究院,2025-12-04,多元金融,https://pdf.dfcfw.com/pdf/H3_AP202512041793797352_1.pdf?1764862199000.pdf
全球金融监管动态月刊,毕马威会计师事务所,2025-12-02,多元金融,https://pdf.dfcfw.com/pdf/H3_AP202512011792073505_1.pdf?1764660171000.pdf
亚洲金融观察（2025年年报）,亚洲金融合作协会,2025-11-25,多元金融,https://pdf.dfcfw.com/pdf/H3_AP202511251788213677_1.pdf?1764107333000.pdf
2025金融消费趋势洞察研究报告,财新智库(北京)科技有限公司,2025-11-25,多元金融,https://pdf.dfcfw.com/pdf/H3_AP202511251788213725_1.pdf?1764107091000.pdf
中金公司筹划收购东兴证券、信达证券点评：并购实现资本金跃升，综合实力向国际一流投行迈进,开源证券,2025-11-20,多元金融,https://pdf.dfcfw.com/pdf/H3_AP202511201784780178_1.pdf?1763632863000.pdf
非银金融行业深度报告：财富管理系列报告之三——权益财富管理未来可期，券商分享权益财富管理发展红利,东吴证券,2025-11-13,多元金融,https://pdf.dfcfw.com/pdf/H3_AP202511131780556924_1.pdf?1763048909000.pdf
险企FVOCI投资专题分析：FVOCI是什么？,东吴证券,2025-11-12,多元金融,https://pdf.dfcfw.com/pdf/H3_AP202511121779790033_1.pdf?1762954966000.pdf
非银金融行业周报：非车险“报行合一”指引落地，把握年末风格切换的配置机遇,东海证券,2025-11-11,多元金融,https://pdf.dfcfw.com/pdf/H3_AP202511111779247378_1.pdf?1762872433000.pdf
基础设施投融资行业2025年三季度政策回顾及展望：“化债纵深”与“转型攻坚”协同推进,中诚信国际,2025-11-10,多元金融,https://pdf.dfcfw.com/pdf/H3_AP202511101778689839_1.pdf?1762795546000.pdf
金融行业双周报：央行重启购债操作，有望缓解银行负债压力,东莞证券,2025-11-07,多元金融,https://pdf.dfcfw.com/pdf/H3_AP202511071776902440_1.pdf?1762535930000.pdf
非银行金融：稳步推进多层次资本市场体系改革，行业有望持续受益,东兴证券,2025-11-06,多元金融,https://pdf.dfcfw.com/pdf/H3_AP202511061776078336_1.pdf?1762422331000.pdf
2025年上半年股权投资行业运行分析,联合资信评估,2025-11-06,多元金融,https://pdf.dfcfw.com/pdf/H3_AP202511061776293527_1.pdf?1762453682000.pdf
非银金融行业2026年度投资策略：景气向好，攻守兼备,开源证券,2025-11-05,多元金融,https://pdf.dfcfw.com/pdf/H3_AP202511051775583563_1.pdf?1762353474000.pdf
非银行业点评报告：公募基准新规出炉，加强基准锚定效果,中国银河,2025-11-04,多元金融,https://pdf.dfcfw.com/pdf/H3_AP202511041774868797_1.pdf?1762255252000.pdf
2026年度REITs投资策略：REITs资产债性凸显，关注多元化趋势下板块分化机会,开源证券,2025-11-03,多元金融,https://pdf.dfcfw.com/pdf/H3_AP202511031774459633_1.pdf?1762197783000.pdf
金融科技及EDA行业2025年第三季度板块小结,国金证券,2025-11-02,多元金融,https://pdf.dfcfw.com/pdf/H3_AP202511021773747384_1.pdf?1762109441000.pdf
非银金融行业深度报告：财富管理系列报告之四——财富管理起源欧洲、发展于美国，未来在亚洲（行业篇）,东吴证券,2025-11-02,多元金融,https://pdf.dfcfw.com/pdf/H3_AP202511021773845045_1.pdf?1762119964000.pdf
金融行业：发展普惠金融 扩大金融惠民利民的获得感实惠度,新华财经信息咨询,2025-11-02,多元金融,https://pdf.dfcfw.com/pdf/H3_AP202511021773633155_1.pdf?1762107876000.pdf
金融产品深度报告：广发中证港股通非银ETF：业绩高增筑底，估值修复在途，保险板块景气回升助力港股通非银稳健领跑,东吴证券,2025-10-28,多元金融,https://pdf.dfcfw.com/pdf/H3_AP202510281770749449_1.pdf?1761681976000.pdf
非银行业深度报告：低利率环境下，租赁板块为何有望成为高股息策略重要替代？,民生证券,2025-10-27,多元金融,https://pdf.dfcfw.com/pdf/H3_AP202510261769511401_1.pdf?1761550606000.pdf
非银行业周报（2025年第三十七期）：两融余额创新高，券商迎来新配置机遇,中航证券,2025-10-27,多元金融,https://pdf.dfcfw.com/pdf/H3_AP202510271769780102_1.pdf?1761565363000.pdf
2025年三季度内地与香港地区金融行业内部审计相关监管政策与动态,安永(中国)企业咨询,2025-10-27,多元金融,https://pdf.dfcfw.com/pdf/H3_AP202510271769780155_1.pdf?1761556849000.pdf
金融产品跟踪周报：权益ETF系列：市场开启反攻，继续聚焦泛科技板块,东吴证券,2025-10-26,多元金融,https://pdf.dfcfw.com/pdf/H3_AP202510251768823983_1.pdf?1761471243000.pdf
非银行金融行业研究：三季报业绩陆续出炉，建议关注业绩超预期标的,国金证券,2025-10-26,多元金融,https://pdf.dfcfw.com/pdf/H3_AP202510261769487528_1.pdf?1761512132000.pdf
非银行金融行业周报：上市公司治理准则修订，两融新开账户创新高,山西证券,2025-10-22,多元金融,https://pdf.dfcfw.com/pdf/H3_AP202510221766948522_1.pdf?1761154151000.pdf
非银金融行业周报：上市险企3季报业绩预告超预期，非银板块攻守兼备,开源证券,2025-10-20,多元金融,https://pdf.dfcfw.com/pdf/H3_AP202510201765474819_1.pdf?1760955635000.pdf
金融产品跟踪周报：权益ETF系列：大盘指数达到支撑位，可期待迎来短期的反弹,东吴证券,2025-10-19,多元金融,https://pdf.dfcfw.com/pdf/H3_AP202510191764609626_1.pdf?1760868543000.pdf
2025年三季度金融行业监管政策与处罚分析,安永(中国)企业咨询,2025-10-17,多元金融,https://pdf.dfcfw.com/pdf/H3_AP202510171763662003_1.pdf?1760694327000.pdf
非银金融行业近期投资机会解析：财报预期和市场风险偏好转换或带来投资机会,华源证券,2025-10-16,多元金融,https://pdf.dfcfw.com/pdf/H3_AP202510161763067955_1.pdf?1760610205000.pdf
非银行业周报：板块迎来舒适的配置机会,民生证券,2025-10-13,多元金融,https://pdf.dfcfw.com/pdf/H3_AP202510121760932894_1.pdf?1760339303000.pdf
REITs行业周报：华夏凯德商业REIT上市，环保REITs单周表现优异,开源证券,2025-10-13,多元金融,https://pdf.dfcfw.com/pdf/H3_AP202510131761177007_1.pdf?1760347247000.pdf
金融产品跟踪周报：权益ETF系列：海外对华政策升级，可在市场承压中寻找机会,东吴证券,2025-10-12,多元金融,https://pdf.dfcfw.com/pdf/H3_AP202510111760268930_1.pdf?1760265363000.pdf
金融“一带一路”ESG白皮书,荣续ESG智库研究中心,2025-10-12,多元金融,https://pdf.dfcfw.com/pdf/H3_AP202510121760794262_1.pdf?1760293700000.pdf
2025年中国投融资服务行业市场洞察报告,硕远咨询,2025-10-12,多元金融,https://pdf.dfcfw.com/pdf/H3_AP202510121760637562_1.pdf?1760282251000.pdf
2025年中国网络助贷行业研究报告：人似秋鸿来有信,艾瑞股份,2025-10-09,多元金融,https://pdf.dfcfw.com/pdf/H3_AP202510091758957595_1.pdf?1760031044000.pdf
社保基金2024年年度报告点评：长期投资，复利增长,国信证券,2025-09-30,多元金融,https://pdf.dfcfw.com/pdf/H3_AP202509301753572721_1.pdf?1759268832000.pdf
2025年消费金融行业分析,联合资信评估,2025-09-29,多元金融,https://pdf.dfcfw.com/pdf/H3_AP202509291752650344_1.pdf?1759144001000.pdf
金融产品跟踪周报：权益ETF系列：长假前后，依旧乐观,东吴证券,2025-09-28,多元金融,https://pdf.dfcfw.com/pdf/H3_AP202509281752115207_1.pdf?1759069456000.pdf
REITs行业周报：东北首单公募REIT获批，消费REITs单月表现优异,开源证券,2025-09-28,多元金融,https://pdf.dfcfw.com/pdf/H3_AP202509281752283294_1.pdf?1759091303000.pdf
非银存款增加对金融机构信用风险的双刃剑效应,大公国际资信评估,2025-09-26,多元金融,https://pdf.dfcfw.com/pdf/H3_AP202509261750837306_1.pdf?1758885294000.pdf
金融产品跟踪周报：权益ETF系列：中期趋势良好，短期关注结构变化,东吴证券,2025-09-21,多元金融,https://pdf.dfcfw.com/pdf/H3_AP202509201747434968_1.pdf?1758449719000.pdf
非银行业周报：当前利率环境利好险企,民生证券,2025-09-21,多元金融,https://pdf.dfcfw.com/pdf/H3_AP202509211747918564_1.pdf?1758477507000.pdf
REITs行业周报：仓储物流REIT单周表现优异，做好REITs常态化申报工作,开源证券,2025-09-21,多元金融,https://pdf.dfcfw.com/pdf/H3_AP202509211747952334_1.pdf?1758484938000.pdf
金融租赁行业深度：行业稳中向好，个体差异保持关注,丝路海洋(北京)科技,2025-09-21,多元金融,https://pdf.dfcfw.com/pdf/H3_AP202601221818276711_1.pdf?1769102242000.pdf
2025年PE_VC机构推荐：耐心资本卓越实践机构,头豹研究院,2025-09-17,多元金融,https://pdf.dfcfw.com/pdf/H3_AP202509171745507912_1.pdf?1758138176000.pdf
中国企业供应链金融白皮书（2025）,中国企业改革与发展研究会,2025-09-16,多元金融,https://pdf.dfcfw.com/pdf/H3_AP202509161744585466_1.pdf?1758011877000.pdf
金融行业：山东省金融运行报告（2025）,中国人民银行,2025-09-16,多元金融,https://pdf.dfcfw.com/pdf/H3_AP202509161744585465_1.pdf?1758011658000.pdf
非银行业周报（2025年第三十三期）：券商积极布局国际业务，业务发展多元化,中航证券,2025-09-16,多元金融,https://pdf.dfcfw.com/pdf/H3_AP202509161744955528_1.pdf?1758097509000.pdf
上海市金融运行报告（2025）,中国人民银行,2025-09-16,多元金融,https://pdf.dfcfw.com/pdf/H3_AP202509161744585461_1.pdf?1758020941000.pdf
2025年汽车金融行业分析（终稿）,联合资信,2025-09-15,多元金融,https://pdf.dfcfw.com/pdf/H3_AP202509151744230951_1.pdf?1757961121000.pdf
金融产品跟踪周报：权益ETF系列：算力板块如期反弹，大盘指数再创新高,东吴证券,2025-09-14,多元金融,https://pdf.dfcfw.com/pdf/H3_AP202509141743388512_1.pdf?1757841685000.pdf
非银行业：公募费改持续推进，销售费用迎来优化,中国银河,2025-09-12,多元金融,https://pdf.dfcfw.com/pdf/H3_AP202509121742198441_1.pdf?1757671525000.pdf
非银金融行业资本市场聚焦（八）：公募费改三阶段启动，销售费率优化助推长期投资和权益类发展,东海证券,2025-09-12,多元金融,https://pdf.dfcfw.com/pdf/H3_AP202509121742326803_1.pdf?1757688612000.pdf
券商IT&互联网金融2025H1综述：市场活跃抬升业绩，科技驱动差异竞争,东吴证券,2025-09-10,多元金融,https://pdf.dfcfw.com/pdf/H3_AP202509101740889995_1.pdf?1757488180000.pdf
小微企业融资平台市场洞察：政策赋能与模式创新双轮驱动下的服务升级与增长空间 头豹词条报告系列,头豹研究院,2025-09-09,多元金融,https://pdf.dfcfw.com/pdf/H3_AP202509091740796586_1.pdf?1757448344000.pdf
2025年全球及中国RWA行业及案例分析评估报告（精华版）,头豹研究院,2025-09-09,多元金融,https://pdf.dfcfw.com/pdf/H3_AP202509091740796587_1.pdf?1757448076000.pdf
非银行金融行业研究：费改三阶段：降低基民成本，鼓励长期投资，引导重视保有,国金证券,2025-09-08,多元金融,https://pdf.dfcfw.com/pdf/H3_AP202509081740215225_1.pdf?1757319013000.pdf
非银行业周报：全面调降销售费用，降低投资者交易成本,民生证券,2025-09-08,多元金融,https://pdf.dfcfw.com/pdf/H3_AP202509081740276585_1.pdf?1757331354000.pdf
金融产品跟踪周报：权益ETF系列：波动持续加剧，新能源板块异军突起,东吴证券,2025-09-06,多元金融,https://pdf.dfcfw.com/pdf/H3_AP202509061739592816_1.pdf?1757181648000.pdf
金融行业双周报：上半年上市险企归母净利润“四升一降”，银行业绩边际改善,东莞证券,2025-09-05,多元金融,https://pdf.dfcfw.com/pdf/H3_AP202509051739245332_1.pdf?1757094770000.pdf
2025中国资产管理发展趋势报告：破局与重构——大资管再造竞争力,广东二十一世纪经济报道报社,2025-09-04,多元金融,https://pdf.dfcfw.com/pdf/H3_AP202509041738717996_1.pdf?1756979854000.pdf
金融产品行业深度报告：SHFE黄金复盘与展望：八月跌宕起伏，九月金势初现,东吴证券,2025-09-03,多元金融,https://pdf.dfcfw.com/pdf/H3_AP202509031738198315_1.pdf?1756882621000.pdf
非银金融行业深度报告：纳斯达克100指数复盘与展望：八月震荡徘徊，九月风向渐明,东吴证券,2025-09-03,多元金融,https://pdf.dfcfw.com/pdf/H3_AP202509031738392238_1.pdf?1756906171000.pdf
金融行业大模型应用落地白皮书：AI原生开启金融智能新未来,国际数据,2025-09-02,多元金融,https://pdf.dfcfw.com/pdf/H3_AP202509021737934538_1.pdf?1756804860000.pdf
REITs行业周报：首单外资消费REITs正式获批，保障房REIT单周表现优异,开源证券,2025-09-01,多元金融,https://pdf.dfcfw.com/pdf/H3_AP202508311737374312_1.pdf?1756712248000.pdf
非银金融行业2025年中报要点评述：券商和保险中报向好，非银视角看居民资金动向,开源证券,2025-09-01,多元金融,https://pdf.dfcfw.com/pdf/H3_AP202508311737387284_1.pdf?1756709649000.pdf
金融产品行业深度报告：恒生科技指数复盘与展望：八月波澜浮沉，九月秋声渐起,东吴证券,2025-09-01,多元金融,https://pdf.dfcfw.com/pdf/H3_AP202509011737726205_1.pdf?1756754918000.pdf
金融产品行业深度报告：政金债指数复盘与展望：八月跌宕收官，九月破局可期,东吴证券,2025-09-01,多元金融,https://pdf.dfcfw.com/pdf/H3_AP202509011737727853_1.pdf?1756755400000.pdf
非银行业周报：市场交易量维持高位，中报有望继续催化非银表现,民生证券,2025-08-31,多元金融,https://pdf.dfcfw.com/pdf/H3_AP202508311737268077_1.pdf?1756661720000.pdf
金融产品跟踪周报：权益ETF系列：波动持续加剧，关注阅兵前后市场表现,东吴证券,2025-08-30,多元金融,https://pdf.dfcfw.com/pdf/H3_AP202508301736983097_1.pdf?1756663958000.pdf
2025年全球跨境支付服务行业洞察报告,艾瑞股份,2025-08-29,多元金融,https://pdf.dfcfw.com/pdf/H3_AP202508291736358581_1.pdf?1756474707000.pdf
非银行金融行业研究：市场交投延续活跃，利好券商业绩增长,国金证券,2025-08-24,多元金融,https://pdf.dfcfw.com/pdf/H3_AP202508241733631685_1.pdf?1756064846000.pdf
汽车金融公司2025年中期观察,惠誉博华信用评级,2025-08-22,多元金融,https://pdf.dfcfw.com/pdf/H3_AP202508221732335424_1.pdf?1755881322000.pdf
非银行金融行业周报：半年报陆续披露，关注板块投资价值,山西证券,2025-08-19,多元金融,https://pdf.dfcfw.com/pdf/H3_AP202508191730509125_1.pdf?1755636960000.pdf
非银行金融行业研究：市场交投延续活跃，持续推荐非银板块,国金证券,2025-08-17,多元金融,https://pdf.dfcfw.com/pdf/H3_AP202508171729307690_1.pdf?1755460714000.pdf
REITs行业周报：全国首单产业园持有型ABS落地，发行市场保持活跃,开源证券,2025-08-17,多元金融,https://pdf.dfcfw.com/pdf/H3_AP202508171729307755_1.pdf?1755461801000.pdf
金融产品跟踪周报：权益ETF系列：波动加剧，但仍然健康上涨,东吴证券,2025-08-17,多元金融,https://pdf.dfcfw.com/pdf/H3_AP202508161728649697_1.pdf?1755426169000.pdf
非银行业周报：险资举牌同业，非银板块迎来资金面和基本面共振,民生证券,2025-08-17,多元金融,https://pdf.dfcfw.com/pdf/H3_AP202508171729133366_1.pdf?1755440063000.pdf
