研报名称,机构名称,发布时间,行业,研报地址
轻工制造行业月报：海外浆厂报价上涨，关注纸品价格提升,中原证券,2025-03-04,家用轻工,https://pdf.dfcfw.com/pdf/H3_AP202503041644038436_1.pdf?1741106576000.pdf
先进制造行业周报：Figure机器人快速迭代，北京市率先出台具身智能行动计划,中航证券,2025-03-03,家用轻工,https://pdf.dfcfw.com/pdf/H3_AP202503021643662469_1.pdf?1740994129000.pdf
智能家居行业双周报：巨头借力DeepSeek，竞推“AI+”新品,国元证券,2025-03-03,家用轻工,https://pdf.dfcfw.com/pdf/H3_AP202503031643669899_1.pdf?1740989642000.pdf
装备制造行业周报（2月第4周）：固态电池产业化持续推进,世纪证券,2025-03-03,家用轻工,https://pdf.dfcfw.com/pdf/H3_AP202503031643681530_1.pdf?1740996736000.pdf
周观点：关注景气改善的低位顺周期，继续布局新消费及消费成长,信达证券,2025-03-02,家用轻工,https://pdf.dfcfw.com/pdf/H3_AP202503021643660003_1.pdf?1740946124000.pdf
新兴产业行业研究周报：日本烟草、奥驰亚披露2024年报，新型烟草业务保持增长,天风证券,2025-03-02,家用轻工,https://pdf.dfcfw.com/pdf/H3_AP202503021643660041_1.pdf?1740947976000.pdf
轻工制造行业定期报告：关注政策催化顺周期情绪复苏,华福证券,2025-03-02,家用轻工,https://pdf.dfcfw.com/pdf/H3_AP202503021643657885_1.pdf?1740937064000.pdf
轻工纺服行业周报：AI眼镜迎来新品潮，结合国产大模型加速落地,华安证券,2025-03-02,家用轻工,https://pdf.dfcfw.com/pdf/H3_AP202503021643661686_1.pdf?1740952365000.pdf
出口链深度报告：贸易摩擦下的肌肉记忆：16-19年出口链经营图谱,民生证券,2025-03-01,家用轻工,https://pdf.dfcfw.com/pdf/H3_AP202503011643641878_1.pdf?1740909790000.pdf
轻工制造：家得宝Q4营收超预期，家庭改造需求提升,华福证券,2025-02-26,家用轻工,https://pdf.dfcfw.com/pdf/H3_AP202502261643522401_1.pdf?1740588840000.pdf
轻工行业行业深度：AI应用持续落地，引领业态革新,中国银河,2025-02-25,家用轻工,https://pdf.dfcfw.com/pdf/H3_AP202502251643478931_1.pdf?1740502132000.pdf
轻工纺服行业：关注头部服装制造一季度订单表现,平安证券,2025-02-24,家用轻工,https://pdf.dfcfw.com/pdf/H3_AP202502241643425828_1.pdf?1740394511000.pdf
轻工造纸行业周报：关注新型烟草回调布局机遇，AI眼镜产业化进程有望加速,国金证券,2025-02-23,家用轻工,https://pdf.dfcfw.com/pdf/H3_AP202502231643406970_1.pdf?1740310997000.pdf
轻工制造周观点：造纸涨价，出口稳增，家居国补，跨境、婴护、新型烟草、宠物等结构成长，AI+消费崛起,信达证券,2025-02-23,家用轻工,https://pdf.dfcfw.com/pdf/H3_AP202502231643410754_1.pdf?1740342770000.pdf
轻工纺服行业周报：国际烟草巨头公布财报，新型烟草业务持续发展,华安证券,2025-02-23,家用轻工,https://pdf.dfcfw.com/pdf/H3_AP202502231643411357_1.pdf?1740327826000.pdf
轻工制造行业定期报告：3月浆价再涨小阳春可期，AI催化关注眼镜企业,华福证券,2025-02-23,家用轻工,https://pdf.dfcfw.com/pdf/H3_AP202502231643407905_1.pdf?1740320286000.pdf
服务型制造与商业模式创新,先进制造商学院,2025-02-20,家用轻工,https://pdf.dfcfw.com/pdf/H3_AP202502201643311584_1.pdf?1740063089000.pdf
轻工制造行业事项点评：出口：开年订单乐观，关税初步落地、影响有限,信达证券,2025-02-19,家用轻工,https://pdf.dfcfw.com/pdf/H3_AP202502181643219499_1.pdf?1739949242000.pdf
轻工制造行业2024年业绩预告综述：轻工业绩预告表现平淡，预盈率为53%,万联证券,2025-02-18,家用轻工,https://pdf.dfcfw.com/pdf/H3_AP202502181643199070_1.pdf?1739893862000.pdf
装备制造行业周报（2月第2周）：“天神之眼”发布促行业发展进入快车道,世纪证券,2025-02-17,家用轻工,https://pdf.dfcfw.com/pdf/H3_AP202502171643155446_1.pdf?1739783374000.pdf
轻工纺服行业周报：节后纸企频发涨价函，旺季临近文化纸或率先复苏,华安证券,2025-02-17,家用轻工,https://pdf.dfcfw.com/pdf/H3_AP202502171643166157_1.pdf?1739807508000.pdf
轻工制造行业事项点评：智能眼镜：模型迭代助推产品力提升，Rayban Meta指引乐观，小米AI眼镜或促成国内破圈,信达证券,2025-02-17,家用轻工,https://pdf.dfcfw.com/pdf/H3_AP202502171643178317_1.pdf?1739863271000.pdf
轻工制造周观点：纸价温和反弹，家居补贴徐徐展开，全球无烟发展加速,信达证券,2025-02-16,家用轻工,https://pdf.dfcfw.com/pdf/H3_AP202502161643143089_1.pdf?1739732806000.pdf
轻工制造：文化纸发布3月涨价函，家居新一轮国补开启,华福证券,2025-02-16,家用轻工,https://pdf.dfcfw.com/pdf/H3_AP202502161643143103_1.pdf?1739727234000.pdf
烟草行业：新兴产业英美烟草发布2024年业绩，新型烟草业务实现盈利！,天风证券,2025-02-15,家用轻工,https://pdf.dfcfw.com/pdf/H3_AP202502151643125779_1.pdf?1739646786000.pdf
新型烟草：英美烟草发布年报，加速无烟发展，产品迭代创新,信达证券,2025-02-14,家用轻工,https://pdf.dfcfw.com/pdf/H3_AP202502141643077532_1.pdf?1739537421000.pdf
新型烟草行业研究：英美烟草发布2024年财报，传递新型烟草积极信号,国金证券,2025-02-14,家用轻工,https://pdf.dfcfw.com/pdf/H3_AP202502141643084177_1.pdf?1739548401000.pdf
轻工行业行业月报：静待家居业绩修复，AI+玩具前景广阔,中国银河,2025-02-12,家用轻工,https://pdf.dfcfw.com/pdf/H3_AP202502121643007935_1.pdf?1739355370000.pdf
轻工制造行业月报：家装厨卫“焕新”启动，期待政策落地效果,中原证券,2025-02-11,家用轻工,https://pdf.dfcfw.com/pdf/H3_AP202502111642970447_1.pdf?1739289447000.pdf
轻工纺服行业：关注服装品牌春节动销表现,平安证券,2025-02-10,家用轻工,https://pdf.dfcfw.com/pdf/H3_AP202502101642929108_1.pdf?1739182444000.pdf
轻工造纸行业周报：关注新型烟草重要催化，期待造纸三月小阳春,国金证券,2025-02-10,家用轻工,https://pdf.dfcfw.com/pdf/H3_AP202502101642931511_1.pdf?1739188840000.pdf
轻工制造：出口关税阶段性落地，关注智能眼镜、情绪消费,华福证券,2025-02-09,家用轻工,https://pdf.dfcfw.com/pdf/H3_AP202502091642913591_1.pdf?1739118820000.pdf
新型烟草：菲莫国际发布年报，HNB销量稳健增长，25年预期乐观,信达证券,2025-02-09,家用轻工,https://pdf.dfcfw.com/pdf/H3_AP202502091642911874_1.pdf?1739111208000.pdf
新兴产业行业研究周报：菲莫国际2024年财报，新型烟草产品表现强劲，24Q4收入占比超过40%,天风证券,2025-02-09,家用轻工,https://pdf.dfcfw.com/pdf/H3_AP202502091642914817_1.pdf?1739141296000.pdf
周观点：新消费崛起，逢低布局出口链，浆纸一体企业盈利改善,信达证券,2025-02-09,家用轻工,https://pdf.dfcfw.com/pdf/H3_AP202502091642917059_1.pdf?1739132352000.pdf
谁能笑傲江湖？从金属包装行业一起载入史册的并购案说起,北京韬联科技,2025-02-08,家用轻工,https://pdf.dfcfw.com/pdf/H3_AP202502081642896071_1.pdf?1739039551000.pdf
轻工制造：2月浆纸共振或可期待，优选一体化龙头,华福证券,2025-02-06,家用轻工,https://pdf.dfcfw.com/pdf/H3_AP202502061642836753_1.pdf?1738860603000.pdf
轻工制造行业事项点评：智能眼镜：DeepSeek开源、低成本、高质量，优化智能眼镜堵点,信达证券,2025-02-04,家用轻工,https://pdf.dfcfw.com/pdf/H3_AP202502041642767514_1.pdf?1738677756000.pdf
轻工制造行业事项点评：出口链：关税初步落地，后续如何展望,信达证券,2025-02-04,家用轻工,https://pdf.dfcfw.com/pdf/H3_AP202502041642771451_1.pdf?1738686383000.pdf
轻工制造周观点：浆价持续反弹，浆纸一体企业受益；出口链业绩表现靓丽,信达证券,2025-01-26,家用轻工,https://pdf.dfcfw.com/pdf/H3_AP202501261642566292_1.pdf?1737912058000.pdf
轻工制造行业定期报告：出口12月部分品类景气延续，内需看好国补催化,华福证券,2025-01-26,家用轻工,https://pdf.dfcfw.com/pdf/H3_AP202501261642571797_1.pdf?1737920764000.pdf
2025中国家居家装行业发展研究报告,北京花棉科技,2025-01-24,家用轻工,https://pdf.dfcfw.com/pdf/H3_AP202501241642528277_1.pdf?1737746851000.pdf
轻工制造行业周报：出口链，2024M12漂白纸及纸板高增，弹簧床垫、保温杯双位数增长,太平洋,2025-01-22,家用轻工,https://pdf.dfcfw.com/pdf/H3_AP202501221642428177_1.pdf?1737533949000.pdf
新型烟草行业深度报告：基于路径之争&基因之辨，探讨Hilo产品潜力,民生证券,2025-01-22,家用轻工,https://pdf.dfcfw.com/pdf/H3_AP202501221642440639_1.pdf?1737541896000.pdf
新兴产业：中国企业出海，如何布局东盟？,天风证券,2025-01-22,家用轻工,https://pdf.dfcfw.com/pdf/H3_AP202501221642455567_1.pdf?1737571488000.pdf
家具家居出海：机遇、挑战与应对策略 头豹词条报告系列,头豹研究院,2025-01-22,家用轻工,https://pdf.dfcfw.com/pdf/H3_AP202501221642458112_1.pdf?1737575617000.pdf
轻工制造行业周报（25年第3周）：鉴往知来：五十年日本玩具市场复盘,国信证券,2025-01-21,家用轻工,https://pdf.dfcfw.com/pdf/H3_AP202501211642408987_1.pdf?1737498244000.pdf
2025年巨量引擎日化行业白皮书：日遇新机 破局而上,北京巨量引擎网络技术,2025-01-20,家用轻工,https://pdf.dfcfw.com/pdf/H3_AP202501191642341029_1.pdf?1737366942000.pdf
轻工制造：六问出口链投资机会,信达证券,2025-01-20,家用轻工,https://pdf.dfcfw.com/pdf/H3_AP202501191642343963_1.pdf?1737365754000.pdf
新兴产业行业研究周报：FDA发布2024年度报告，执法力度空前；日本烟草Ploom重返韩国市场,天风证券,2025-01-20,家用轻工,https://pdf.dfcfw.com/pdf/H3_AP202501201642351775_1.pdf?1737360642000.pdf
轻工造纸行业周报：重视FDA对新型烟草科学监管趋势，关注宠物板块业绩超预期,国金证券,2025-01-20,家用轻工,https://pdf.dfcfw.com/pdf/H3_AP202501201642354149_1.pdf?1737366010000.pdf
轻工纺服行业周报：浙江自然推出超预期股权激励目标，彰显发展信心,华安证券,2025-01-20,家用轻工,https://pdf.dfcfw.com/pdf/H3_AP202501201642356877_1.pdf?1737372942000.pdf
轻工制造：12月轻纺品类出口抬升，关注“抢出口”效应,华福证券,2025-01-19,家用轻工,https://pdf.dfcfw.com/pdf/H3_AP202501191642334651_1.pdf?1737292540000.pdf
轻工制造：12月家居社零保持改善，轻纺品类出口抬升,华福证券,2025-01-19,家用轻工,https://pdf.dfcfw.com/pdf/H3_AP202501191642339285_1.pdf?1737314871000.pdf
周观点：出口关税预期弱化，浆价温和反弹，新型烟草加速PMTA审核,信达证券,2025-01-19,家用轻工,https://pdf.dfcfw.com/pdf/H3_AP202501191642343123_1.pdf?1737323331000.pdf
轻工行业行业月报：持续关注新一轮国补对需求的催化作用,中国银河,2025-01-16,家用轻工,https://pdf.dfcfw.com/pdf/H3_AP202501161641946590_1.pdf?1737026073000.pdf
轻工制造行业周报（25年第2周）：周思考：关于布鲁可的三问三答,国信证券,2025-01-15,家用轻工,https://pdf.dfcfw.com/pdf/H3_AP202501151641928361_1.pdf?1736938738000.pdf
轻工制造2025年度策略报告：布局低位顺周期，重视稀缺成长,信达证券,2025-01-14,家用轻工,https://pdf.dfcfw.com/pdf/H3_AP202501141641914218_1.pdf?1736849492000.pdf
新兴产业行业研究周报：英伟达发布Cosmos平台助力机器人开发，中国机器人“军团”联袂登场！,天风证券,2025-01-13,家用轻工,https://pdf.dfcfw.com/pdf/H3_AP202501131641899189_1.pdf?1736763985000.pdf
轻工纺服行业周报：思摩尔发布修订股权激励计划，彰显发展信心,华安证券,2025-01-13,家用轻工,https://pdf.dfcfw.com/pdf/H3_AP202501131641899938_1.pdf?1736770587000.pdf
海外经济韧性超预期，IP经济、新型烟草、智能眼镜加速发展,信达证券,2025-01-12,家用轻工,https://pdf.dfcfw.com/pdf/H3_AP202501121641896301_1.pdf?1736693423000.pdf
轻工制造行业定期报告：电子烟监管合规趋势强化，布鲁可港股上市,华福证券,2025-01-12,家用轻工,https://pdf.dfcfw.com/pdf/H3_AP202501121641896333_1.pdf?1736694273000.pdf
轻工制造行业2025年度策略：周期顺势，向新而行,华福证券,2025-01-10,家用轻工,https://pdf.dfcfw.com/pdf/H3_AP202501101641886158_1.pdf?1736530102000.pdf
轻工制造行业点评：家居补贴以旧换新政策延续，或将持续拉动终端销售回暖,平安证券,2025-01-09,家用轻工,https://pdf.dfcfw.com/pdf/H3_AP202501091641872815_1.pdf?1736444741000.pdf
轻工制造行业月报：加力扩围以旧换新，提振行业需求,中原证券,2025-01-09,家用轻工,https://pdf.dfcfw.com/pdf/H3_AP202501091641872796_1.pdf?1736444818000.pdf
轻工制造行业点评：家居补贴依旧换新政策延续，或将持续拉动终端销售回暖,平安证券,2025-01-08,家用轻工,https://pdf.dfcfw.com/pdf/H3_AP202501081641855861_1.pdf?1736354356000.pdf
轻工制造行业周报（25年第1周）：布鲁可招股书梳理，国内拼搭玩具龙头，乘行业之风而起,国信证券,2025-01-07,家用轻工,https://pdf.dfcfw.com/pdf/H3_AP202501071641834100_1.pdf?1736250405000.pdf
拼搭玩具行业深度：IP+玩法融合，稀缺优质供给高成长,华福证券,2025-01-07,家用轻工,https://pdf.dfcfw.com/pdf/H3_AP202501071641838258_1.pdf?1736267526000.pdf
轻工造纸行业周报：继续把握新型烟草产业机遇，关注3C补贴受益方向,国金证券,2025-01-06,家用轻工,https://pdf.dfcfw.com/pdf/H3_AP202501061641813269_1.pdf?1736152021000.pdf
纺服轻工行业2025年投资展望：内需回暖与外需韧性,东兴证券,2025-01-06,家用轻工,https://pdf.dfcfw.com/pdf/H3_AP202501061641816694_1.pdf?1736175963000.pdf
2025年轻工家居行业投资策略：以旧换新仍可期，出口回暖待时机,甬兴证券,2025-01-06,家用轻工,https://pdf.dfcfw.com/pdf/H3_AP202501061641819236_1.pdf?1736180792000.pdf
轻工制造行业周报：新型烟草&智能眼镜方兴未艾，以旧换新加码，出口链结构成长，国产宠食高端化,信达证券,2025-01-05,家用轻工,https://pdf.dfcfw.com/pdf/H3_AP202501051641812509_1.pdf?1736105279000.pdf
轻工制造行业定期报告：把握顺周期回调布局机会,华福证券,2025-01-05,家用轻工,https://pdf.dfcfw.com/pdf/H3_AP202501051641811900_1.pdf?1736094369000.pdf
新兴产业行业研究周报：中国卷烟出口量增长；电子烟东南亚市场增长显著；新西兰政府为戒烟机构免费提供电子烟,天风证券,2025-01-05,家用轻工,https://pdf.dfcfw.com/pdf/H3_AP202501051641812331_1.pdf?1736110960000.pdf
家居行业专题报告：地产及消费政策支持下，家居板块有望受益,中原证券,2025-01-03,家用轻工,https://pdf.dfcfw.com/pdf/H3_AP202501031641523427_1.pdf?1735901124000.pdf
轻工纺服行业周报：社交电商新突破，微信小店“送礼物”功能赋能商家营销,华安证券,2024-12-31,家用轻工,https://pdf.dfcfw.com/pdf/H3_AP202412311641486744_1.pdf?1735658348000.pdf
轻工制造行业周报：出口链业绩靓丽，重视智能眼镜&新型烟草产业机会,信达证券,2024-12-29,家用轻工,https://pdf.dfcfw.com/pdf/H3_AP202412291641463163_1.pdf?1735504199000.pdf
轻工制造：Suzano宣布1月浆价上涨，思摩尔发布股权激励,华福证券,2024-12-29,家用轻工,https://pdf.dfcfw.com/pdf/H3_AP202412291641462969_1.pdf?1735498428000.pdf
新兴产业行业研究周报：发改委低空司召开推动低空基建座谈会，深圳发布低空标准体系建设指南，重视低空基建投资机会！,天风证券,2024-12-29,家用轻工,https://pdf.dfcfw.com/pdf/H3_AP202412291641462382_1.pdf?1735486198000.pdf
欧洲站：家具行业品类新卖家选品推荐,亚马逊,2024-12-27,家用轻工,https://pdf.dfcfw.com/pdf/H3_AP202412271641444999_1.pdf?1735297975000.pdf
轻工制造行业周报：全国电动自行车以旧换新数量突破100万辆，龙头引领高质量发展,海通国际,2024-12-25,家用轻工,https://pdf.dfcfw.com/pdf/H3_AP202412251641420874_1.pdf?1735115567000.pdf
家居行业：以旧换新补贴政策支撑需求,东兴证券,2024-12-23,家用轻工,https://pdf.dfcfw.com/pdf/H3_AP202412231641399327_1.pdf?1734975510000.pdf
轻工制造行业周报：出口链，2024M11漂白纸及纸板、弹簧床垫、保温杯表现较佳,太平洋,2024-12-23,家用轻工,https://pdf.dfcfw.com/pdf/H3_AP202412231641393837_1.pdf?1734960595000.pdf
轻工纺服行业周报：引领潮流的首发经济，多元化发展的新动力,华安证券,2024-12-23,家用轻工,https://pdf.dfcfw.com/pdf/H3_AP202412231641393850_1.pdf?1734960842000.pdf
轻工造纸行业周报：把握文化纸价格提涨机遇，关注3C补贴受益标的裕同,国金证券,2024-12-22,家用轻工,https://pdf.dfcfw.com/pdf/H3_AP202412221641389853_1.pdf?1734888637000.pdf
轻工制造：11月家具社零亮眼，文化纸迎25年涨价函,华福证券,2024-12-22,家用轻工,https://pdf.dfcfw.com/pdf/H3_AP202412221641389903_1.pdf?1734895566000.pdf
纸价延续温和反弹，以旧换新加码可期轻工制造,信达证券,2024-12-22,家用轻工,https://pdf.dfcfw.com/pdf/H3_AP202412221641389997_1.pdf?1734893206000.pdf
企业竞争图谱：2024年烟草 头豹词条报告系列,头豹研究院,2024-12-20,家用轻工,https://pdf.dfcfw.com/pdf/H3_AP202412201641382594_1.pdf?1734725795000.pdf
延续低位顺周期布局，重视消费成长轻工制造,信达证券,2024-12-17,家用轻工,https://pdf.dfcfw.com/pdf/H3_AP202412171641327441_1.pdf?1734447263000.pdf
轻工制造行业：政策强调促消费，看好内需子板块复苏,华福证券,2024-12-16,家用轻工,https://pdf.dfcfw.com/pdf/H3_AP202412161641309209_1.pdf?1734341352000.pdf
轻工行业：中央表态积极有力，看好家居&造纸顺周期表现,中国银河,2024-12-16,家用轻工,https://pdf.dfcfw.com/pdf/H3_AP202412161641310320_1.pdf?1734348680000.pdf
轻工纺服行业：关注服装面辅料制造订单表现,平安证券,2024-12-16,家用轻工,https://pdf.dfcfw.com/pdf/H3_AP202412161641316799_1.pdf?1734373216000.pdf
轻工制造2025年度策略：传统消费复苏在途，新兴赛道空间可期,华安证券,2024-12-16,家用轻工,https://pdf.dfcfw.com/pdf/H3_AP202412161641311154_1.pdf?1734361008000.pdf
轻工纺服行业周报：培育钻石，从消费向科技的延伸,华安证券,2024-12-16,家用轻工,https://pdf.dfcfw.com/pdf/H3_AP202412161641311259_1.pdf?1734361008000.pdf
新兴产业行业研究周报：中国气象局发布《低空经济气象科技创新工作方案（2024-2030年）》，重视低空气象核心标的纳睿雷达！,天风证券,2024-12-15,家用轻工,https://pdf.dfcfw.com/pdf/H3_AP202412151641306965_1.pdf?1734279643000.pdf
轻工制造行业周报（24年第49周）：北美黑五网一增长强劲，消费品补贴扩容至消费电子,国信证券,2024-12-10,家用轻工,https://pdf.dfcfw.com/pdf/H3_AP202412101641239704_1.pdf?1733828556000.pdf
轻工制造行业月报：纸品需求改善，地产销售回暖,中原证券,2024-12-10,家用轻工,https://pdf.dfcfw.com/pdf/H3_AP202412101641242720_1.pdf?1733846285000.pdf
轻工纺服行业周报：宠物经济崛起，消费升级驱动增长,华安证券,2024-12-09,家用轻工,https://pdf.dfcfw.com/pdf/H3_AP202412091641222859_1.pdf?1733741158000.pdf
轻工造纸行业周报：新型烟草板块再迎催化，关注兴趣消费相关机遇,国金证券,2024-12-08,家用轻工,https://pdf.dfcfw.com/pdf/H3_AP202412081641219992_1.pdf?1733674579000.pdf
轻工制造：纸价略涨盈利将迎修复，关注性价比跨境电商,华福证券,2024-12-08,家用轻工,https://pdf.dfcfw.com/pdf/H3_AP202412081641220056_1.pdf?1733687480000.pdf
新兴产业行业研究周报：中国卷烟出口量增长，东南亚已成为第三大电子烟市场；英美烟草全新HNB产品获市场认可,天风证券,2024-12-08,家用轻工,https://pdf.dfcfw.com/pdf/H3_AP202412081641220367_1.pdf?1733694868000.pdf
轻工周报：“谷子经济”利好商品与玩具制造龙头，岳阳林纸拟以12.78亿元收购骏泰科技100%股权,太平洋,2024-12-03,家用轻工,https://pdf.dfcfw.com/pdf/H3_AP202412031641158218_1.pdf?1733240412000.pdf
轻工制造行业定期报告：浆系纸价略涨，IP衍生消费高景气,华福证券,2024-12-02,家用轻工,https://pdf.dfcfw.com/pdf/H3_AP202412021641131324_1.pdf?1733128271000.pdf
轻工纺服行业周报：二次元IP变现新机遇，“谷子经济”引领消费趋势,华安证券,2024-12-02,家用轻工,https://pdf.dfcfw.com/pdf/H3_AP202412021641147882_1.pdf?1733170515000.pdf
轻工制造行业年度策略：政策提振信心，景气触底回升,中原证券,2024-11-28,家用轻工,https://pdf.dfcfw.com/pdf/H3_AP202411281641105802_1.pdf?1732816073000.pdf
轻工制造行业周报：重视顺周期板块，持续关注家居二轮车,海通国际,2024-11-26,家用轻工,https://pdf.dfcfw.com/pdf/H3_AP202411261641064330_1.pdf?1732613065000.pdf
轻工制造行业周报（24年第47周）：造纸供给短期改善，10月家具出口额同比+3.1%,国信证券,2024-11-25,家用轻工,https://pdf.dfcfw.com/pdf/H3_AP202411251641052593_1.pdf?1732554130000.pdf
轻工制造：造纸限产供给改善，跨境电商政策支持,华福证券,2024-11-24,家用轻工,https://pdf.dfcfw.com/pdf/H3_AP202411241641042830_1.pdf?1732468937000.pdf
轻工纺服行业周报：晨鸣纸业超七成产能停产，部分纸类供需有望好转,华安证券,2024-11-24,家用轻工,https://pdf.dfcfw.com/pdf/H3_AP202411241641042957_1.pdf?1732467194000.pdf
新兴产业行业研究周报：24财年帝国烟草业绩稳步增长，新型烟草市场份额不断提升,天风证券,2024-11-24,家用轻工,https://pdf.dfcfw.com/pdf/H3_AP202411241641043053_1.pdf?1732468937000.pdf
轻工造纸行业周报：重视新型烟草发展趋势，关注白卡_文化纸机停产带动短期供给偏紧,国金证券,2024-11-24,家用轻工,https://pdf.dfcfw.com/pdf/H3_AP202411241641043292_1.pdf?1732478514000.pdf
轻工制造：以旧换新政策持续推进，关注家居估值修复,华安证券,2024-11-22,家用轻工,https://pdf.dfcfw.com/pdf/H3_AP202411221641022498_1.pdf?1732288114000.pdf
轻工制造及纺服服饰行业周报：10月社零同比回升，双11百亚GMV翻倍,中泰证券,2024-11-18,家用轻工,https://pdf.dfcfw.com/pdf/H3_AP202411181640929872_1.pdf?1731921276000.pdf
轻工制造行业周报：M10家具类零售额同比+7.4%，本周白板_箱板_瓦楞纸价环比上行,太平洋,2024-11-18,家用轻工,https://pdf.dfcfw.com/pdf/H3_AP202411181640932804_1.pdf?1731931670000.pdf
轻工纺服行业周报：英美烟草推高端Glo系列，加速布局无烟未来,华安证券,2024-11-18,家用轻工,https://pdf.dfcfw.com/pdf/H3_AP202411181640932914_1.pdf?1731936826000.pdf
新兴产业行业研究周报：珠海航展搭建低空融合平台，行业规范地方政策助力低空经济发展,天风证券,2024-11-17,家用轻工,https://pdf.dfcfw.com/pdf/H3_AP202411171640928475_1.pdf?1731865921000.pdf
轻工制造：10月家居鞋服社零改善，金属包装整合推进,华福证券,2024-11-17,家用轻工,https://pdf.dfcfw.com/pdf/H3_AP202411171640928054_1.pdf?1731865355000.pdf
轻工制造行业2024年三季报综述暨11月投资策略：Q3经营承压、景气筑底，期待以旧换新改善内需,国信证券,2024-11-13,家用轻工,https://pdf.dfcfw.com/pdf/H3_AP202411131640853808_1.pdf?1731510450000.pdf
家居行业：换新时刻，关注需求格局估值共振,华福证券,2024-11-12,家用轻工,https://pdf.dfcfw.com/pdf/H3_AP202411121640832559_1.pdf?1731430060000.pdf
轻工制造行业月报：包装纸价小幅上涨，家居内销边际改善,中原证券,2024-11-12,家用轻工,https://pdf.dfcfw.com/pdf/H3_AP202411121640833768_1.pdf?1731432568000.pdf
新兴产业行业研究周报：24Q3日本烟草PloomX销量大幅增长；奥驰亚持续拓展Njoy渠道,天风证券,2024-11-11,家用轻工,https://pdf.dfcfw.com/pdf/H3_AP202411111640806060_1.pdf?1731310999000.pdf
轻工行业行业月报：“双11”+国补再加码，家居需求有望修复,中国银河,2024-11-11,家用轻工,https://pdf.dfcfw.com/pdf/H3_AP202411111640807852_1.pdf?1731320935000.pdf
轻工制造及纺服服饰行业周报：10月轻纺出口转正，家居内销修复、继续推荐,中泰证券,2024-11-11,家用轻工,https://pdf.dfcfw.com/pdf/H3_AP202411111640808591_1.pdf?1731323742000.pdf
轻工造纸行业周报：重视家具消费补贴政策效果初显，关注国货宠食_个护双11表现,国金证券,2024-11-11,家用轻工,https://pdf.dfcfw.com/pdf/H3_AP202411111640808014_1.pdf?1731322110000.pdf
轻工纺服行业周报：政策驱动下家居板块修复空间探讨,华安证券,2024-11-11,家用轻工,https://pdf.dfcfw.com/pdf/H3_AP202411111640822779_1.pdf?1731366388000.pdf
轻工制造行业定期报告：看好顺周期景气复苏，包装纸价延续小幅提涨,华福证券,2024-11-10,家用轻工,https://pdf.dfcfw.com/pdf/H3_AP202411101640804358_1.pdf?1731240344000.pdf
轻工制造：收储加速以旧换新扩容，关注家居龙头,国联证券,2024-11-10,家用轻工,https://pdf.dfcfw.com/pdf/H3_AP202411101640804393_1.pdf?1731244492000.pdf
造纸轻工行业季报：轻工出口及二轮车收入高增，细分子板块分化明显,海通国际,2024-11-10,家用轻工,https://pdf.dfcfw.com/pdf/H3_AP202411101640804715_1.pdf?1731255707000.pdf
