研报名称,机构名称,发布时间,行业,研报地址
轻工行业行业点评报告：贸易摩擦预期升温，看好出口龙头海外产能优势,中国银河,2024-11-07,家用轻工,https://pdf.dfcfw.com/pdf/H3_AP202411071640759705_1.pdf?1730986745000.pdf
轻工制造行业专题研究：轻工制造行业2024年三季报总结：业绩整体承压，出口相对较好，需求预期改善,中原证券,2024-11-06,家用轻工,https://pdf.dfcfw.com/pdf/H3_AP202411061640747625_1.pdf?1730918524000.pdf
轻工制造及纺服服饰行业周报：关注国补下内销家居基本面修复，奢侈品Q3业绩延续分化,中泰证券,2024-11-05,家用轻工,https://pdf.dfcfw.com/pdf/H3_AP202411051640713741_1.pdf?1730797919000.pdf
轻工制造行业定期报告：补贴推进&10月地产改善，家居上行逻辑依然健康,华福证券,2024-11-03,家用轻工,https://pdf.dfcfw.com/pdf/H3_AP202411031640687900_1.pdf?1730670377000.pdf
轻工纺服行业周报：整体业绩承压，包装企业业绩表现较佳,华安证券,2024-11-03,家用轻工,https://pdf.dfcfw.com/pdf/H3_AP202411031640688089_1.pdf?1730658229000.pdf
轻工造纸行业研究：24Q3业绩综述：多数板块业绩筑底，景气度回升曙光显现,国金证券,2024-11-03,家用轻工,https://pdf.dfcfw.com/pdf/H3_AP202411031640687508_1.pdf?1730649669000.pdf
轻工制造行业快评报告：1-9月消费品制造业保持良好增长，家具行业利润同比涨幅扩大,万联证券,2024-11-01,家用轻工,https://pdf.dfcfw.com/pdf/H3_AP202411011640663631_1.pdf?1730474203000.pdf
2024Q3轻工板块基金持仓点评：造纸重仓比例提升，家居&包装印刷减配,国联证券,2024-10-29,家用轻工,https://pdf.dfcfw.com/pdf/H3_AP202410291640560970_1.pdf?1730207975000.pdf
轻工制造及纺服服饰行业周报：政府补贴叠加双11优惠，关注家装、家居等品牌表现,中泰证券,2024-10-28,家用轻工,https://pdf.dfcfw.com/pdf/H3_AP202410281640531686_1.pdf?1730110307000.pdf
新兴产业行业研究周报：菲莫国际发布24Q3季报，新型烟草收入占比38%，IQOS开始美国试点,天风证券,2024-10-28,家用轻工,https://pdf.dfcfw.com/pdf/H3_AP202410281640532867_1.pdf?1730116850000.pdf
轻工造纸行业研究：家具“以旧换新”消费补贴专题：政策边际“加码”，重视优质企业布局机遇,国金证券,2024-10-28,家用轻工,https://pdf.dfcfw.com/pdf/H3_AP202410281640531184_1.pdf?1730125471000.pdf
2024年9月轻工出口月报：出口大盘回落，床垫两轮车景气度仍存,国联证券,2024-10-27,家用轻工,https://pdf.dfcfw.com/pdf/H3_AP202410271640526380_1.pdf?1730057642000.pdf
轻工制造行业定期报告：家居家纺迎政策补贴，边际改善已现,华福证券,2024-10-27,家用轻工,https://pdf.dfcfw.com/pdf/H3_AP202410271640527777_1.pdf?1730044715000.pdf
轻工纺服行业周报：美国大选“白热化”，关注四季度出海机会,华安证券,2024-10-27,家用轻工,https://pdf.dfcfw.com/pdf/H3_AP202410271640528415_1.pdf?1730063064000.pdf
积木玩具行业白皮书,灼识投资咨询(上海),2024-10-23,家用轻工,https://pdf.dfcfw.com/pdf/H3_AP202410231640430871_1.pdf?1729696829000.pdf
轻工制造行业周报（24年第42周）：9月家具出口额同比下滑9.7%，国内家具类零售同比转正,国信证券,2024-10-22,家用轻工,https://pdf.dfcfw.com/pdf/H3_AP202410221640398859_1.pdf?1729588026000.pdf
轻工纺服行业周报：地产政策加码，关注家居估值修复,华安证券,2024-10-21,家用轻工,https://pdf.dfcfw.com/pdf/H3_AP202410211640375757_1.pdf?1729480325000.pdf
轻工制造及纺服服饰行业周报：关注个护双十一预售，把握以旧换新落地下家居投资机遇,中泰证券,2024-10-21,家用轻工,https://pdf.dfcfw.com/pdf/H3_AP202410211640376560_1.pdf?1729503230000.pdf
轻工制造行业定期报告：家居多地补贴政策推进，废纸系提价落地,华福证券,2024-10-20,家用轻工,https://pdf.dfcfw.com/pdf/H3_AP202410201640374174_1.pdf?1729432808000.pdf
轻工制造：地产政策持续加码，助力家居稳健发展,国联证券,2024-10-18,家用轻工,https://pdf.dfcfw.com/pdf/H3_AP202410181640369245_1.pdf?1729287277000.pdf
轻工制造及纺服服饰行业周报：轻纺Q3前瞻一览，家居以旧换新持续落地需求改善可期,中泰证券,2024-10-16,家用轻工,https://pdf.dfcfw.com/pdf/H3_AP202410161640317145_1.pdf?1729073778000.pdf
轻工行业周度跟踪：促消费政策持续推进，积极配置业绩确定性+景气赛道+低位优质龙头,国海证券,2024-10-15,家用轻工,https://pdf.dfcfw.com/pdf/H3_AP202410151640308455_1.pdf?1729019371000.pdf
轻工制造行业点评报告：河南省内出台地产及以旧换新相关政策，家居板块有望受益,中原证券,2024-10-14,家用轻工,https://pdf.dfcfw.com/pdf/H3_AP202410141640288197_1.pdf?1728925173000.pdf
轻工纺服行业周报：市场情绪改善，板块估值修复,华安证券,2024-10-14,家用轻工,https://pdf.dfcfw.com/pdf/H3_AP202410141640294896_1.pdf?1728944886000.pdf
轻工制造行业周报（24年第42周）：海外浆厂供给扰动，政策提振关注顺周期龙头,国信证券,2024-10-14,家用轻工,https://pdf.dfcfw.com/pdf/H3_AP202410141640286109_1.pdf?1728925173000.pdf
新兴产业行业研究周报：英国或将成为首个电子烟用户超过香烟的国家，欧洲多国将实施一次性电子烟禁令,天风证券,2024-10-13,家用轻工,https://pdf.dfcfw.com/pdf/H3_AP202410131640277367_1.pdf?1728834657000.pdf
轻工制造：市场情绪低点已过，顺周期修复趋势无虞,华福证券,2024-10-13,家用轻工,https://pdf.dfcfw.com/pdf/H3_AP202410131640277058_1.pdf?1728834803000.pdf
轻工行业行业月报：政策利好助力家居行业需求修复,中国银河,2024-10-11,家用轻工,https://pdf.dfcfw.com/pdf/H3_AP202410111640257784_1.pdf?1728644728000.pdf
精享生活：个护家清双11营销解码全指南,行吟信息科技,2024-10-10,家用轻工,https://pdf.dfcfw.com/pdf/H3_AP202410101640241510_1.pdf?1728570575000.pdf
轻工制造行业月报：地产政策及以旧换新带动下，家居板块估值修复可期,中原证券,2024-10-10,家用轻工,https://pdf.dfcfw.com/pdf/H3_AP202410101640245743_1.pdf?1728576936000.pdf
轻工造纸行业周报：家居估值修复望延续，重点关注两轮车二批白名单等政策催化,国金证券,2024-10-09,家用轻工,https://pdf.dfcfw.com/pdf/H3_AP202410091640218210_1.pdf?1728460049000.pdf
轻工制造：政策利好推荐顺周期子板块,华福证券,2024-10-07,家用轻工,https://pdf.dfcfw.com/pdf/H3_AP202410071640185704_1.pdf?1728379378000.pdf
轻工纺服行业周报：地产政策超预期，关注家居板块估值修复,华安证券,2024-10-05,家用轻工,https://pdf.dfcfw.com/pdf/H3_AP202410051640174410_1.pdf?1728087709000.pdf
一次性卫生用品设备行业深度报告：赛道长坡厚雪，结构性机会与增量市场并存,国元证券,2024-09-30,家用轻工,https://pdf.dfcfw.com/pdf/H3_AP202409301640100576_1.pdf?1727707539000.pdf
新兴产业行业研究周报：8月电子烟出口额8.98亿美元，美国FDA拟设电子烟进口新规；8月卷烟出口额同比高增66.3%,天风证券,2024-09-29,家用轻工,https://pdf.dfcfw.com/pdf/H3_AP202409291640092409_1.pdf?1727609634000.pdf
轻工制造：国新会政策集体出台，看好家居估值修复,国联证券,2024-09-25,家用轻工,https://pdf.dfcfw.com/pdf/H3_AP202409251640036580_1.pdf?1727289243000.pdf
轻工制造行业点评报告：美联储降息开启，关注家居出口链,中原证券,2024-09-24,家用轻工,https://pdf.dfcfw.com/pdf/H3_AP202409241640003699_1.pdf?1727194300000.pdf
企业竞争图谱：2024年按摩仪器 头豹词条报告系列,头豹研究院,2024-09-23,家用轻工,https://pdf.dfcfw.com/pdf/H3_AP202409231639989136_1.pdf?1727127152000.pdf
轻工行业周报：8月社零总额同比增长2.1%,申港证券,2024-09-23,家用轻工,https://pdf.dfcfw.com/pdf/H3_AP202409231639991527_1.pdf?1727125813000.pdf
轻工纺服行业周报：美联储超预期降息，关注家具出口机会,华安证券,2024-09-23,家用轻工,https://pdf.dfcfw.com/pdf/H3_AP202409231639991989_1.pdf?1727161960000.pdf
新兴产业行业研究周报：德国多特蒙德国际烟草展会盛大开幕，中国厂商表现亮眼,天风证券,2024-09-22,家用轻工,https://pdf.dfcfw.com/pdf/H3_AP202409221639973035_1.pdf?1727013248000.pdf
”碳中和“深度报告：第三履约周期渐进，碳市场看点几何？,民生证券,2024-09-19,家用轻工,https://pdf.dfcfw.com/pdf/H3_AP202409191639933149_1.pdf?1726754519000.pdf
全球烟草产业链深度剖析：关于底层逻辑与发展启示的详细思考,华安证券,2024-09-19,家用轻工,https://pdf.dfcfw.com/pdf/H3_AP202409191639947650_1.pdf?1726781925000.pdf
轻工制造行业周报（24年第37周）：8月家具累计出口额同比9.9%，9月文化纸发布涨价函,国信证券,2024-09-18,家用轻工,https://pdf.dfcfw.com/pdf/H3_AP202409181639923388_1.pdf?1726688847000.pdf
轻工制造行业定期报告：8月出口景气延续，内需关注估值修复,华福证券,2024-09-17,家用轻工,https://pdf.dfcfw.com/pdf/H3_AP202409171639900572_1.pdf?1726574244000.pdf
轻工纺服行业周报：美国选情焦灼，关注四季度出海机会,华安证券,2024-09-17,家用轻工,https://pdf.dfcfw.com/pdf/H3_AP202409171639905300_1.pdf?1726593538000.pdf
轻工行业周度跟踪：以旧换新政策持续推进，积极关注出口链+必选个护品类,国海证券,2024-09-17,家用轻工,https://pdf.dfcfw.com/pdf/H3_AP202409171639908078_1.pdf?1726650936000.pdf
轻工造纸行业研究：继续重视新型烟草布局主线，8月宠食_个护电商表现靓丽,国金证券,2024-09-16,家用轻工,https://pdf.dfcfw.com/pdf/H3_AP202409161639890556_1.pdf?1726495263000.pdf
轻工制造行业点评报告：河南省加力支持以旧换新，关注家居需求释放,中原证券,2024-09-13,家用轻工,https://pdf.dfcfw.com/pdf/H3_AP202409131639875474_1.pdf?1726250315000.pdf
轻工行业行业月报：家居推进以旧换新，静待造纸旺季改善,中国银河,2024-09-10,家用轻工,https://pdf.dfcfw.com/pdf/H3_AP202409101639809202_1.pdf?1725967683000.pdf
大路灯行业：引领护眼照明新风尚,中国银河,2024-09-10,家用轻工,https://pdf.dfcfw.com/pdf/H3_AP202409101639820126_1.pdf?1725999304000.pdf
轻工行业2024年中报业绩综述：出清，出海,民生证券,2024-09-10,家用轻工,https://pdf.dfcfw.com/pdf/H3_AP202409101639820451_1.pdf?1725998500000.pdf
轻工纺服行业周报：监管新政发布，加强电子烟交易管理,华安证券,2024-09-08,家用轻工,https://pdf.dfcfw.com/pdf/H3_AP202409081639787372_1.pdf?1725835395000.pdf
新兴产业行业研究周报：国家烟草专卖局修订《电子烟交易管理细则》，行业龙头有望受益,天风证券,2024-09-08,家用轻工,https://pdf.dfcfw.com/pdf/H3_AP202409081639786108_1.pdf?1725814931000.pdf
轻工制造行业定期报告：推荐景气出口&稳健包装，内需关注估值修复,华福证券,2024-09-08,家用轻工,https://pdf.dfcfw.com/pdf/H3_AP202409081639786580_1.pdf?1725868155000.pdf
电子烟行业新规落地解读,上海证券,2024-09-06,家用轻工,https://pdf.dfcfw.com/pdf/H3_AP202409061639767988_1.pdf?1725621839000.pdf
