研报名称,机构名称,发布时间,行业,研报地址
勘察设计 头豹词条报告系列,头豹研究院,2024-02-06,工程建设,https://pdf.dfcfw.com/pdf/H3_AP202402061620965970_1.pdf?1707248977000.pdf
建筑装饰行业跟踪周报：新增PSL继续支持“三大工程”建设，实物量落地有望加快,东吴证券,2024-02-05,工程建设,https://pdf.dfcfw.com/pdf/H3_AP202402041620555114_1.pdf?1707121980000.pdf
建筑行业周报：央企市值管理考核拟全面推开，专项借款推动城改提速，持续看好建筑央企和城改板块,国投证券,2024-02-05,工程建设,https://pdf.dfcfw.com/pdf/H3_AP202402051620555929_1.pdf?1707119206000.pdf
中国建筑行业展望，2024年1月,中诚信国际,2024-02-01,工程建设,https://pdf.dfcfw.com/pdf/H3_AP202402011620003688_1.pdf?1706804352000.pdf
建筑装饰行业专题研究：见微知著：从调查问卷展望建筑建材地产后市风格及走向,天风证券,2024-01-31,工程建设,https://pdf.dfcfw.com/pdf/H3_AP202401311619768930_1.pdf?1706690855000.pdf
建筑行业周报：央企市值考核要求重磅发布，城改建设范围迎扩容，看好建筑央企和城改板块表现,国投证券,2024-01-28,工程建设,https://pdf.dfcfw.com/pdf/H3_AP202401281619247486_1.pdf?1706521498000.pdf
建筑：央企市值考核有望落地，看好优质建筑央企表现,国投证券,2024-01-25,工程建设,https://pdf.dfcfw.com/pdf/H3_AP202401251618092392_1.pdf?1706177491000.pdf
中国工程咨询行业市场规模测算逻辑模型 头豹词条报告系列,头豹研究院,2024-01-24,工程建设,https://pdf.dfcfw.com/pdf/H3_AP202401241618002160_1.pdf?1706126001000.pdf
地基工程建设 头豹词条报告系列,头豹研究院,2024-01-24,工程建设,https://pdf.dfcfw.com/pdf/H3_AP202401241617999607_1.pdf?1706126252000.pdf
建筑行业周观点：基建存在预期差，工业建筑回暖可期,国信证券,2024-01-22,工程建设,https://pdf.dfcfw.com/pdf/H3_AP202401221617924551_1.pdf?1705959377000.pdf
建筑装饰行业跟踪周报：12月基建投资端企稳回升，期待政策效果进一步显现,东吴证券,2024-01-22,工程建设,https://pdf.dfcfw.com/pdf/H3_AP202401221617903496_1.pdf?1705923208000.pdf
建筑行业12月数据点评：2023年基建投资增速超8%，地产数据未有明显好转,中银证券,2024-01-22,工程建设,https://pdf.dfcfw.com/pdf/H3_AP202401221617904603_1.pdf?1705932738000.pdf
建筑装饰行业深度报告：基建投资企稳回升，PSL助力三大工程,中国银河,2024-01-22,工程建设,https://pdf.dfcfw.com/pdf/H3_AP202401221617907904_1.pdf?1705944561000.pdf
建筑装饰行业研究周报：基建增速强劲，重点推荐具备出海逻辑和高股息标的,天风证券,2024-01-21,工程建设,https://pdf.dfcfw.com/pdf/H3_AP202401211617886971_1.pdf?1705840580000.pdf
建材新材料动态报告：民爆方向，关注西藏、新疆需求景气,民生证券,2024-01-21,工程建设,https://pdf.dfcfw.com/pdf/H3_AP202401211617887117_1.pdf?1705846595000.pdf
建筑装饰行业报告：重点关注三大工程及水利投资推进节奏,天风证券,2024-01-19,工程建设,https://pdf.dfcfw.com/pdf/H3_AP202401191617726851_1.pdf?1705660835000.pdf
统计局2023年基建数据点评：2023年基建增速年底企稳，2024年持续关注“基建稳增长”,国信证券,2024-01-18,工程建设,https://pdf.dfcfw.com/pdf/H3_AP202401181617681638_1.pdf?1705592802000.pdf
建筑行业周观点：全面推进美丽中国建设，生态园林工程能否受益？,国信证券,2024-01-16,工程建设,https://pdf.dfcfw.com/pdf/H3_AP202401161617509437_1.pdf?1705410470000.pdf
建筑行业周报：央行推出1000亿元租赁住房贷款支持计划,中银证券,2024-01-16,工程建设,https://pdf.dfcfw.com/pdf/H3_AP202401161617507325_1.pdf?1705398617000.pdf
建筑装饰行业跟踪周报：政策继续支持“三大工程”建设，关注资金投放进展,东吴证券,2024-01-15,工程建设,https://pdf.dfcfw.com/pdf/H3_AP202401141617484623_1.pdf?1705306850000.pdf
建筑行业周报：全面推进美丽中国建设，广州城改专项规划获批，看好基建央国企和城改受益板块,国投证券,2024-01-15,工程建设,https://pdf.dfcfw.com/pdf/H3_AP202401151617490141_1.pdf?1705330064000.pdf
建筑行业2024年度策略：基建是稳增长抓手，关注细分赛道投资机会,中银证券,2024-01-11,工程建设,https://pdf.dfcfw.com/pdf/H3_AP202401111617233289_1.pdf?1704966295000.pdf
