研报名称,机构名称,发布时间,行业,研报地址
机械行业周报：中央经济工作会议召开，利好机床、机器人、工程机械板块,太平洋,2024-12-16,工程机械,https://pdf.dfcfw.com/pdf/H3_AP202412161641310454_1.pdf?1734349638000.pdf
机械行业周报：看好人形机器人、工程机械和燃气轮机,国金证券,2024-12-15,工程机械,https://pdf.dfcfw.com/pdf/H3_AP202412151641307145_1.pdf?1734282833000.pdf
机械设备行业周报：工程机械市场持续改善，多方入局人形机器人赛道,上海证券,2024-12-12,工程机械,https://pdf.dfcfw.com/pdf/H3_AP202412121641272350_1.pdf?1733998451000.pdf
机械行业2025年投资展望：中小市值估值持续修复，关注顺周期与高成长,东兴证券,2024-12-11,工程机械,https://pdf.dfcfw.com/pdf/H3_AP202412111641262383_1.pdf?1733939446000.pdf
工程机械系列报告：行业筑底回暖，国产挖机龙头走向全球,甬兴证券,2024-12-09,工程机械,https://pdf.dfcfw.com/pdf/H3_AP202412091641223120_1.pdf?1733743468000.pdf
工程机械行业月度点评：工程机械内外需求同步发力，制造业PMI景气上行,财信证券,2024-12-09,工程机械,https://pdf.dfcfw.com/pdf/H3_AP202412091641223727_1.pdf?1733751967000.pdf
工程机械行业观察及2025年信用风险展望,联合资信,2024-12-08,工程机械,https://pdf.dfcfw.com/pdf/H3_AP202412081641219314_1.pdf?1733674579000.pdf
机械行业周报：特斯拉灵巧手迭代优化，人形机器人商业化落地进程加速,上海证券,2024-12-06,工程机械,https://pdf.dfcfw.com/pdf/H3_AP202412061641202720_1.pdf?1733485182000.pdf
工程机械行业动态跟踪：主要工程机械产品开工率_小时数环比提升，CME预测11月挖掘机销售增长13%,华福证券,2024-12-06,工程机械,https://pdf.dfcfw.com/pdf/H3_AP202412061641215034_1.pdf?1733520398000.pdf
工程机械：国家政策助力拉动内需，挖掘机市场保持景气,财信证券,2024-12-04,工程机械,https://pdf.dfcfw.com/pdf/H3_AP202412041641171107_1.pdf?1733298975000.pdf
2025年度机械行业策略报告：确定性看装备出海，边际改善看内需相关,东吴证券,2024-12-03,工程机械,https://pdf.dfcfw.com/pdf/H3_AP202412031641150798_1.pdf?1733212637000.pdf
机械行业周报：宝马展大放异彩，国产厂商国际化征程加速,太平洋,2024-12-02,工程机械,https://pdf.dfcfw.com/pdf/H3_AP202412021641134433_1.pdf?1733141072000.pdf
工程机械：CME预测11月挖掘机销售增长13%，上海宝马展盛况空前,华福证券,2024-12-02,工程机械,https://pdf.dfcfw.com/pdf/H3_AP202412021641135103_1.pdf?1733147259000.pdf
机械行业周报：看好人形机器人、工程机械与船舶,国金证券,2024-12-01,工程机械,https://pdf.dfcfw.com/pdf/H3_AP202412011641129427_1.pdf?1733059944000.pdf
工程机械行业研究：海外龙头复盘之三：“县城小铁厂”的逆袭，小松模式煜煜生辉,国金证券,2024-11-29,工程机械,https://pdf.dfcfw.com/pdf/H3_AP202411291641115828_1.pdf?1732894493000.pdf
机械行业周报：工程机械市场需求改善，半导体自主可控持续推进,上海证券,2024-11-27,工程机械,https://pdf.dfcfw.com/pdf/H3_AP202411271641084527_1.pdf?1732701457000.pdf
机械行业年度策略：顺周期机械复苏、新质生产力成长,中原证券,2024-11-27,工程机械,https://pdf.dfcfw.com/pdf/H3_AP202411271641085943_1.pdf?1732714775000.pdf
机械行业月报：关注景气度向好的顺周期机械与成长子行业龙头,中原证券,2024-11-27,工程机械,https://pdf.dfcfw.com/pdf/H3_AP202411271641092171_1.pdf?1732733653000.pdf
工程机械行业点评：欧盟高空作业平台终裁结果落地，风险释放,财信证券,2024-11-26,工程机械,https://pdf.dfcfw.com/pdf/H3_AP202411261641069808_1.pdf?1732635237000.pdf
挖掘机月度数据跟踪：10月挖机增长15.1%，开工小时和利用率有所改善,海通国际,2024-11-26,工程机械,https://pdf.dfcfw.com/pdf/H3_AP202411261641074009_1.pdf?1732643652000.pdf
