研报名称,机构名称,发布时间,行业,研报地址
建筑行业周报：PSL时隔一年重启，单月新增规模达到历史第三高,中银证券,2024-01-08,工程建设,https://pdf.dfcfw.com/pdf/H3_AP202401081616764509_1.pdf?1704728469000.pdf
建筑行业周观点：布局高股息蓝筹，把握订单增长潜力强的细分赛道,国信证券,2024-01-08,工程建设,https://pdf.dfcfw.com/pdf/H3_AP202401081616773197_1.pdf?1704740125000.pdf
2023年中国AI基础设施行业概览：构筑AI大底座，引领科技未来,头豹研究院,2024-01-08,工程建设,https://pdf.dfcfw.com/pdf/H3_AP202401081616773028_1.pdf?1704744095000.pdf
建筑装饰行业跟踪周报：央行新增PSL投放，“三大工程”建设实物量落地节奏有望加快,东吴证券,2024-01-08,工程建设,https://pdf.dfcfw.com/pdf/H3_AP202401071616758154_1.pdf?1704700389000.pdf
建筑装饰行业研究周报：“三大工程”提速，重点推荐具备出海逻辑和高股息标的,天风证券,2024-01-08,工程建设,https://pdf.dfcfw.com/pdf/H3_AP202401081616759619_1.pdf?1704706094000.pdf
建筑行业周报：PSL投放重启助力稳增长，深圳城中村改造获重大推进，看好基建央企+出海板块表现,国投证券,2024-01-08,工程建设,https://pdf.dfcfw.com/pdf/H3_AP202401081616759990_1.pdf?1704708151000.pdf
建筑行业1月投资策略：底部布局高股息蓝筹，抢抓细分赛道成长机遇,国信证券,2024-01-03,工程建设,https://pdf.dfcfw.com/pdf/H3_AP202401031616225203_1.pdf?1704304881000.pdf
建筑行业周报：央行要求2024年加大已出台货币政策实施力度,中银证券,2024-01-02,工程建设,https://pdf.dfcfw.com/pdf/H3_AP202401021615918859_1.pdf?1704215909000.pdf
建筑行业周报：多地披露Q1地方债发行计划，深圳首批配套型保障房开工，看好Q1基建板块表现,国投证券,2024-01-02,工程建设,https://pdf.dfcfw.com/pdf/H3_AP202401021615918179_1.pdf?1704215194000.pdf
建筑装饰行业跟踪周报：建筑业PMI持续扩张，关注实物量落地节奏,东吴证券,2024-01-02,工程建设,https://pdf.dfcfw.com/pdf/H3_AP202401011615911290_1.pdf?1704183615000.pdf
建筑装饰行业研究周报：重点推荐高股息和具备出海逻辑的标的,天风证券,2024-01-01,工程建设,https://pdf.dfcfw.com/pdf/H3_AP202401011615910307_1.pdf?1704122466000.pdf
建筑装饰行业2024年度策略报告：横看成岭侧成峰：找寻高质量增长下行业投资机会,华龙证券,2023-12-29,工程建设,https://pdf.dfcfw.com/pdf/H3_AP202312291615464898_1.pdf?1703836355000.pdf
建筑装饰行业研究周报：万亿增发国债开始落地，“三大工程”建设持续发力,天风证券,2023-12-25,工程建设,https://pdf.dfcfw.com/pdf/H3_AP202312251614886482_1.pdf?1703512386000.pdf
建筑行业周报：增发万亿国债大部分已落实到具体项目,中银证券,2023-12-25,工程建设,https://pdf.dfcfw.com/pdf/H3_AP202312251614889407_1.pdf?1703522844000.pdf
建筑装饰：择优顺周期高股息个股，布局专业工程景气赛道,天风证券,2023-12-25,工程建设,https://pdf.dfcfw.com/pdf/H3_AP202312251614882258_1.pdf?1703498737000.pdf
建筑装饰行业跟踪周报：保障房建设持续推进，期待稳增长政策继续发力,东吴证券,2023-12-25,工程建设,https://pdf.dfcfw.com/pdf/H3_AP202312251614882360_1.pdf?1703495833000.pdf
建筑行业周报：万亿国债两批项目清单下达，关注城市更新建设推进力度,国投证券,2023-12-25,工程建设,https://pdf.dfcfw.com/pdf/H3_AP202312241614881349_1.pdf?1703496300000.pdf
