研报名称,机构名称,发布时间,行业,研报地址
工程机械行业点评：工程机械杂志预测9月挖机外销同比增长近9%,国都证券,2024-10-09,工程机械,https://pdf.dfcfw.com/pdf/H3_AP202410091640221061_1.pdf?1728466457000.pdf
机械工业行业信息点评：政策持续加码，9月制造业景气度环比提升；重点关注顺周期、地产基建相关,海通国际,2024-10-08,工程机械,https://pdf.dfcfw.com/pdf/H3_AP202410051640176579_1.pdf?1728384074000.pdf
机械行业月报：珍惜反弹机遇，重点布局严重超跌的成长行业龙头和房地产相关的工程机械、电梯行业龙头,中原证券,2024-09-30,工程机械,https://pdf.dfcfw.com/pdf/H3_AP202409301640101997_1.pdf?1727709688000.pdf
工程机械行业点评报告：政策直接利好基建、房地产行业，工程机械主机厂有望率先受益,东吴证券,2024-09-29,工程机械,https://pdf.dfcfw.com/pdf/H3_AP202409291640095297_1.pdf?1727647531000.pdf
机械行业周报：8月工程机械出口额持续增长，关注该板块投资机会,上海证券,2024-09-27,工程机械,https://pdf.dfcfw.com/pdf/H3_AP202409271640070078_1.pdf?1727436354000.pdf
机械行业：通用设备有望迎顺周期拐点,东兴证券,2024-09-27,工程机械,https://pdf.dfcfw.com/pdf/H3_AP202409271640077212_1.pdf?1727456399000.pdf
机械设备行业：9月挖机销量预计+12%，1X推出世界模型,中国银河,2024-09-26,工程机械,https://pdf.dfcfw.com/pdf/H3_AP202409261640049484_1.pdf?1727343275000.pdf
工程机械行业简评报告：8月挖掘机内销延续增长势头，出口同比增速转正,首创证券,2024-09-25,工程机械,https://pdf.dfcfw.com/pdf/H3_AP202409251640020405_1.pdf?1727251263000.pdf
工程机械行业点评报告：8月叉车销量同比+1%，国内需求磨底,东吴证券,2024-09-20,工程机械,https://pdf.dfcfw.com/pdf/H3_AP202409191639948707_1.pdf?1726815414000.pdf
机械行业周报：下一代特斯拉人形机器Optimus将拥有类人筋骨，持续关注人形机器人产业链,上海证券,2024-09-20,工程机械,https://pdf.dfcfw.com/pdf/H3_AP202409201639953453_1.pdf?1726828353000.pdf
