研报名称,机构名称,发布时间,行业,研报地址
机械行业点评报告：6月挖机内销维持高增长，出口刷新单月历史新高,太平洋,2026-07-08,工程机械,https://pdf.dfcfw.com/pdf/H3_AP202607081826817336_1.pdf?1783532235000.pdf
6月工程机械行业主要产品销售点评：销量延续高增，内外需共振支撑增长,华源证券,2026-07-08,工程机械,https://pdf.dfcfw.com/pdf/H3_AP202607081826821062_1.pdf?1783539043000.pdf
机械行业周报：低空经济边际向好，工程机械发展稳健,国元证券,2026-07-07,工程机械,https://pdf.dfcfw.com/pdf/H3_AP202607071826774179_1.pdf?1783445320000.pdf
机械行业研究：重视半导体设备和零部件，看好机器人、燃气轮机和机床,国金证券,2026-07-05,工程机械,https://pdf.dfcfw.com/pdf/H3_AP202607051826729287_1.pdf?1783273432000.pdf
装备制造行业周报（6月第4周）：中国工程机械出口持续增长,世纪证券,2026-06-30,工程机械,https://pdf.dfcfw.com/pdf/H3_AP202606301826566529_1.pdf?1782810681000.pdf
工程机械行业跟踪点评：5月挖机销量增长延续，出口动能有望持续释放,东莞证券,2026-06-30,工程机械,https://pdf.dfcfw.com/pdf/H3_AP202606301826592876_1.pdf?1782840832000.pdf
机械行业周报：低空应用场景多元，工程机械稳步增长,国元证券,2026-06-29,工程机械,https://pdf.dfcfw.com/pdf/H3_AP202606291826527225_1.pdf?1782735820000.pdf
机械：5月挖机海关出口同比继续向上，海外市场景气度延续,太平洋,2026-06-25,工程机械,https://pdf.dfcfw.com/pdf/H3_AP202606251823828828_1.pdf?1782374632000.pdf
机械行业研究：看好mpo自动化设备，重视半导体后道测试、机器视觉,国金证券,2026-06-21,工程机械,https://pdf.dfcfw.com/pdf/H3_AP202606211823709757_1.pdf?1782062377000.pdf
机械行业2026年中期策略：关注产业升级和工艺迭代的细分方向,东兴证券,2026-06-17,工程机械,https://pdf.dfcfw.com/pdf/H3_AP202606171823626736_1.pdf?1781705856000.pdf
2026年装载机行业：产品更新换代，电动化加速渗透,头豹研究院,2026-06-17,工程机械,https://pdf.dfcfw.com/pdf/H3_AP202606171823640270_1.pdf?1781725028000.pdf
市场洞察：房地产及基建等市场需求端未有明显改善，整体发展承压,头豹研究院,2026-06-17,工程机械,https://pdf.dfcfw.com/pdf/H3_AP202606171823640290_1.pdf?1781725166000.pdf
机械行业周报：低空经济应用多元，工程机械稳步增长,国元证券,2026-06-16,工程机械,https://pdf.dfcfw.com/pdf/H3_AP202606161823599677_1.pdf?1781622850000.pdf
装备制造行业周报（6月第2周）：碳酸锂价格上涨,世纪证券,2026-06-16,工程机械,https://pdf.dfcfw.com/pdf/H3_AP202606161823599718_1.pdf?1781622850000.pdf
机械行业研究：看好MPO自动化设备，关注光纤、六氟化钨涨价,国金证券,2026-06-14,工程机械,https://pdf.dfcfw.com/pdf/H3_AP202606141823550823_1.pdf?1781452375000.pdf
中国叉车行业调研简报：市场洞察：中国叉车行业电动化深拓与全球化破局,头豹研究院,2026-06-12,工程机械,https://pdf.dfcfw.com/pdf/H3_AP202606121823518870_1.pdf?1781293281000.pdf
机械行业周报：低空经济持续发展，看好工程机械增长,国元证券,2026-06-11,工程机械,https://pdf.dfcfw.com/pdf/H3_AP202606111823459471_1.pdf?1781202937000.pdf
机械行业点评报告：5月挖机需求高景气，内外销同比均高增,太平洋,2026-06-10,工程机械,https://pdf.dfcfw.com/pdf/H3_AP202606101823417197_1.pdf?1781097273000.pdf
机械行业研究：中长线看好联讯仪器，关注工程机械、六氟化钨涨价,国金证券,2026-06-07,工程机械,https://pdf.dfcfw.com/pdf/H3_AP202606071823343604_1.pdf?1780862434000.pdf
机械行业2026年5月投资策略：重点关注产业趋势强的液冷及光模块设备产业链,国信证券,2026-06-07,工程机械,https://pdf.dfcfw.com/pdf/H3_AP202606071823344106_1.pdf?1780867146000.pdf
制造行业解决方案：联想算力基础设施白皮书,联想(北京),2026-06-05,工程机械,https://pdf.dfcfw.com/pdf/H3_AP202606051823271737_1.pdf?1780647436000.pdf
机械行业研究：看好CPO设备、燃气轮机、SOFC以及工程机械,国金证券,2026-05-31,工程机械,https://pdf.dfcfw.com/pdf/H3_AP202605311823107102_1.pdf?1780248666000.pdf
机械：4月挖机海关出口数据继续向好，同环比均向上,太平洋,2026-05-26,工程机械,https://pdf.dfcfw.com/pdf/H3_AP202605261822869693_1.pdf?1779783257000.pdf
机械行业研究：重视光模块设备，看好燃气轮机和农机,国金证券,2026-05-24,工程机械,https://pdf.dfcfw.com/pdf/H3_AP202605241822840003_1.pdf?1779649457000.pdf
工程机械行业2025年报&2026年一季报总结：出海逻辑继续演绎，高经营质量周期利好内外需上行提速,东吴证券,2026-05-21,工程机械,https://pdf.dfcfw.com/pdf/H3_AP202605211822525917_1.pdf?1779362403000.pdf
机械行业周报：低空应用场景多元，工程机械稳步推进,国元证券,2026-05-20,工程机械,https://pdf.dfcfw.com/pdf/H3_AP202605201822495966_1.pdf?1779299931000.pdf
工程机械行业运行分析,联合资信评估,2026-05-20,工程机械,https://pdf.dfcfw.com/pdf/H3_AP202605201822495123_1.pdf?1779300132000.pdf
装备制造行业周报（5月第2周）：4月工程机械内外销维持增长,世纪证券,2026-05-19,工程机械,https://pdf.dfcfw.com/pdf/H3_AP202605191822430757_1.pdf?1779184665000.pdf
机械：4月非挖销售整体继续向上，继续看好工程机械板块,太平洋,2026-05-18,工程机械,https://pdf.dfcfw.com/pdf/H3_AP202605181822391037_1.pdf?1779103852000.pdf
工控行业更新报告：工业自动化：订单超预期，开启新周期,东吴证券,2026-05-17,工程机械,https://pdf.dfcfw.com/pdf/H3_AP202605161822377152_1.pdf?1779014301000.pdf
机械行业研究：看好燃气轮机和工程机械,国金证券,2026-05-17,工程机械,https://pdf.dfcfw.com/pdf/H3_AP202605171822384445_1.pdf?1779047317000.pdf
2026年起重机行业词条报告,头豹研究院,2026-05-15,工程机械,https://pdf.dfcfw.com/pdf/H3_AP202605151822353795_1.pdf?1778874166000.pdf
5月工程机械集体涨价全年利润有望继续增长,第一创业,2026-05-14,工程机械,https://pdf.dfcfw.com/pdf/H3_AP202605141822309535_1.pdf?1778767731000.pdf
机械行业点评报告：4月挖机内销超预期，出口维持较高增速,太平洋,2026-05-12,工程机械,https://pdf.dfcfw.com/pdf/H3_AP202605121822217840_1.pdf?1778608015000.pdf
装备制造行业周报（5月第1周）：一线工程机械企业开始涨价,世纪证券,2026-05-11,工程机械,https://pdf.dfcfw.com/pdf/H3_AP202605111822143092_1.pdf?1778492248000.pdf
机械行业研究：看好燃气轮机、商业航天和工程机械,国金证券,2026-05-10,工程机械,https://pdf.dfcfw.com/pdf/H3_AP202605101822123290_1.pdf?1778426134000.pdf
机械行业25年年报及26年一季报总结：船舶、燃机、刀具板块亮眼，工程机械维持高景气,国金证券,2026-05-05,工程机械,https://pdf.dfcfw.com/pdf/H3_AP202605051821967966_1.pdf?1777993940000.pdf
机械行业研究：看好氦气、燃气轮机、光模块设备和农机,国金证券,2026-04-26,工程机械,https://pdf.dfcfw.com/pdf/H3_AP202604261821592916_1.pdf?1777220163000.pdf
机械：3月挖机海关出口保持较高增速，海外市场景气延续,太平洋,2026-04-22,工程机械,https://pdf.dfcfw.com/pdf/H3_AP202604221821467553_1.pdf?1776894822000.pdf
机械行业研究：看好光模块设备、燃气轮机、氦气和机器人,国金证券,2026-04-19,工程机械,https://pdf.dfcfw.com/pdf/H3_AP202604191821322040_1.pdf?1776621134000.pdf
机械行业点评报告：3月非挖内销表现有所分化，出口整体保持较高增速,太平洋,2026-04-17,工程机械,https://pdf.dfcfw.com/pdf/H3_AP202604171821287234_1.pdf?1776431531000.pdf
工程机械行业深度报告：国内&海外同频共振，行业迎来新一轮上行周期,开源证券,2026-04-16,工程机械,https://pdf.dfcfw.com/pdf/H3_AP202604161821257318_1.pdf?1776349018000.pdf
机械行业研究：看好光模块测试仪器，重视燃气轮机出海、工程机械,国金证券,2026-04-12,工程机械,https://pdf.dfcfw.com/pdf/H3_AP202604121821141616_1.pdf?1776022551000.pdf
机械：3 月挖机内销同比实现较高增速，出口销售创新高,太平洋,2026-04-10,工程机械,https://pdf.dfcfw.com/pdf/H3_AP202604101821111290_1.pdf?1775820783000.pdf
工程机械行业点评报告：3月挖机销售超预期，出口创单月历史新高,开源证券,2026-04-10,工程机械,https://pdf.dfcfw.com/pdf/H3_AP202604101821113448_1.pdf?1775832270000.pdf
高端装备制造行业：设备更新政策落地，高端装备制造产业迎来发展新机遇,国新证券股份,2026-04-10,工程机械,https://pdf.dfcfw.com/pdf/H3_AP202606061823322796_1.pdf?1780745732000.pdf
机械行业研究：看好燃气轮机、氦气涨价，重视工程机械,国金证券,2026-04-06,工程机械,https://pdf.dfcfw.com/pdf/H3_AP202604061821031307_1.pdf?1775505011000.pdf
工程机械数据跟踪：出口为核心驱动力,华鑫证券,2026-03-31,工程机械,https://pdf.dfcfw.com/pdf/H3_AP202603311820894776_1.pdf?1774949477000.pdf
机械行业周报：看好油服装备、海工景气度，重视工程机械,国金证券,2026-03-29,工程机械,https://pdf.dfcfw.com/pdf/H3_AP202603291820839673_1.pdf?1774810876000.pdf
机械：1+2月挖机海关出口继续同比高增，海外市场景气度延续,太平洋,2026-03-24,工程机械,https://pdf.dfcfw.com/pdf/H3_AP202603241820727683_1.pdf?1774383314000.pdf
机械行业研究：看好农机、机器人，重视工程机械“黄金坑”,国金证券,2026-03-22,工程机械,https://pdf.dfcfw.com/pdf/H3_AP202603221820687969_1.pdf?1774204645000.pdf
机械：1+2月非挖产品内销受春节影响同比下滑，出口保持较高增速,太平洋,2026-03-20,工程机械,https://pdf.dfcfw.com/pdf/H3_AP202603201820661241_1.pdf?1774000327000.pdf
2025年中国空气压缩机行业概览：外资占据高端市场，中国企业挑战与机遇并存（精华版）,头豹研究院,2026-03-17,工程机械,https://pdf.dfcfw.com/pdf/H3_AP202603171820604177_1.pdf?1773776635000.pdf
高端装备制造产业研究周报：Figure 03完成全自主家务作业，Optimus 3今夏启动生产,国金证券,2026-03-16,工程机械,https://pdf.dfcfw.com/pdf/H3_AP202603161820576411_1.pdf?1773678284000.pdf
机械行业研究：看好农机和油气设备,国金证券,2026-03-15,工程机械,https://pdf.dfcfw.com/pdf/H3_AP202603151820566003_1.pdf?1773599846000.pdf
机械行业点评报告：2月挖机内销受春节影响同比下滑，出口销售超预期,太平洋,2026-03-09,工程机械,https://pdf.dfcfw.com/pdf/H3_AP202603091820400967_1.pdf?1773045002000.pdf
装备制造行业周报（3月第1周）：1-2月挖掘机出口态势良好,世纪证券,2026-03-09,工程机械,https://pdf.dfcfw.com/pdf/H3_AP202603091820402928_1.pdf?1773051150000.pdf
机械行业研究：看好油气设备和工程机械,国金证券,2026-03-08,工程机械,https://pdf.dfcfw.com/pdf/H3_AP202603081820390976_1.pdf?1772993661000.pdf
机械储能行业ESG白皮书,荣续ESG智库研究中心,2026-03-04,工程机械,https://pdf.dfcfw.com/pdf/H3_AP202603031820234633_1.pdf?1772612414000.pdf
工程机械行业深度报告：七十年艰苦奋斗路，两周期寰宇立潮头,华源证券,2026-03-02,工程机械,https://pdf.dfcfw.com/pdf/H3_AP202603021820182178_1.pdf?1772467052000.pdf
机械行业点评报告：商业航天发展前景广阔，利好先进制造,太平洋,2026-03-02,工程机械,https://pdf.dfcfw.com/pdf/H3_AP202603021820190046_1.pdf?1772473290000.pdf
机械行业研究：看好农机、燃气轮机和商业航天,国金证券,2026-03-01,工程机械,https://pdf.dfcfw.com/pdf/H3_AP202603011820158713_1.pdf?1772381475000.pdf
机械行业点评报告：1月工程机械内外销同比实现较高增长，继续看好内外需共振向上,太平洋,2026-02-27,工程机械,https://pdf.dfcfw.com/pdf/H3_AP202602271820084903_1.pdf?1772180619000.pdf
工程机械月报：工程机械1月迎开门红，行业维持高景气,西南证券,2026-02-26,工程机械,https://pdf.dfcfw.com/pdf/H3_AP202602261820065609_1.pdf?1772128426000.pdf
中国工程机械行业展望，2026年2月,中诚信国际,2026-02-11,工程机械,https://pdf.dfcfw.com/pdf/H3_AP202602111819880831_1.pdf?1770831968000.pdf
机械行业2026年投资策略：拥抱科技，聚焦新经济,西南证券,2026-02-10,工程机械,https://pdf.dfcfw.com/pdf/H3_AP202602101819855375_1.pdf?1770740736000.pdf
机械设备行业简评：挖掘机1月内外销大增，龙头公司业绩预增,东海证券,2026-02-09,工程机械,https://pdf.dfcfw.com/pdf/H3_AP202602091819836502_1.pdf?1770658482000.pdf
机械行业研究：重视商业航天火箭链，看好工程机械、机器人,国金证券,2026-02-08,工程机械,https://pdf.dfcfw.com/pdf/H3_AP202602081819824602_1.pdf?1770562765000.pdf
掘进新时代——挖掘机行业周期重构与智能电动化跃迁之路 头豹词条报告系列,头豹研究院,2026-02-05,工程机械,https://pdf.dfcfw.com/pdf/H3_AP202603171820604160_1.pdf?1773776628000.pdf
机械行业周报：2025年工程机械内外需全面回升，继续看好行业需求向上,太平洋,2026-02-02,工程机械,https://pdf.dfcfw.com/pdf/H3_AP202602021819247933_1.pdf?1770020649000.pdf
机械行业研究：重视商业航天火箭链，看好矿山机械机会,国金证券,2026-02-01,工程机械,https://pdf.dfcfw.com/pdf/H3_AP202602011819081199_1.pdf?1769964888000.pdf
机械行业周报：看好商业航天、机器人和农机,国金证券,2026-01-25,工程机械,https://pdf.dfcfw.com/pdf/H3_AP202601251818399240_1.pdf?1769360599000.pdf
机械行业周报：人形机器人产业催化持续，关注板块投资机会,太平洋,2026-01-19,工程机械,https://pdf.dfcfw.com/pdf/H3_AP202601191818090595_1.pdf?1768810533000.pdf
机械行业研究：看好商业航天、工程机械和工业互联网,国金证券,2026-01-18,工程机械,https://pdf.dfcfw.com/pdf/H3_AP202601181818071966_1.pdf?1768755857000.pdf
机械行业周报：低空稳定增长，工程机械预期向好,国元证券,2026-01-14,工程机械,https://pdf.dfcfw.com/pdf/H3_AP202601141817005066_1.pdf?1768386430000.pdf
机械行业周报：12月挖机销售超预期，看好行业需求继续向上,太平洋,2026-01-12,工程机械,https://pdf.dfcfw.com/pdf/H3_AP202601121816931651_1.pdf?1768207915000.pdf
机械设备行业简评：挖机全年内销外销齐增长，龙头全球化持续演绎,东海证券,2026-01-12,工程机械,https://pdf.dfcfw.com/pdf/H3_AP202601121816942738_1.pdf?1768233726000.pdf
