研报名称,机构名称,发布时间,行业,研报地址
机械日报：外骨骼机器人加速商业落地,太平洋,2025-05-23,工程机械,https://pdf.dfcfw.com/pdf/H3_AP202505231677568324_1.pdf?1747989772000.pdf
机械日报：LET2025在广州盛大开幕,太平洋,2025-05-23,工程机械,https://pdf.dfcfw.com/pdf/H3_AP202505231677610575_1.pdf?1747994738000.pdf
机械日报：2025年4月工程机械行业主要产品销售快报,太平洋,2025-05-22,工程机械,https://pdf.dfcfw.com/pdf/H3_AP202505221676999983_1.pdf?1747904716000.pdf
机械行业周报：4月挖机销量延续高增，Optimus展示迭代成果,上海证券,2025-05-22,工程机械,https://pdf.dfcfw.com/pdf/H3_AP202505221677044475_1.pdf?1747910947000.pdf
机械行业：2025年中期策略——盈利能力持续改善，关注新质生产力,东兴证券,2025-05-22,工程机械,https://pdf.dfcfw.com/pdf/H3_AP202505221677099101_1.pdf?1747923358000.pdf
机械行业研究：可控核聚变专题：“十五五”资本开支加速，“人造太阳”渐行渐近,国金证券,2025-05-20,工程机械,https://pdf.dfcfw.com/pdf/H3_AP202505201675810798_1.pdf?1747732585000.pdf
机械行业周报：人形机器人仍是市场焦点，同时关注外骨骼机器人和军用机器人等方向,太平洋,2025-05-19,工程机械,https://pdf.dfcfw.com/pdf/H3_AP202505191675289874_1.pdf?1747653561000.pdf
工程机械行业点评报告：4月销量点评：4月挖机销量同比+18%，工程机械行业有望迎来国内外共振【勘误版】,东吴证券,2025-05-19,工程机械,https://pdf.dfcfw.com/pdf/H3_AP202505191675573636_1.pdf?1747690695000.pdf
机械行业周报：看好燃气轮机、可控核聚变和机器人,国金证券,2025-05-18,工程机械,https://pdf.dfcfw.com/pdf/H3_AP202505181674940379_1.pdf?1747590715000.pdf
机械日报：智元机器人联合香港大学推出的UniVLA入选RSS,太平洋,2025-05-16,工程机械,https://pdf.dfcfw.com/pdf/H3_AP202505161673647844_1.pdf?1747384638000.pdf
机械日报：中证指数公司发布中证科创创业机器人指数,太平洋,2025-05-16,工程机械,https://pdf.dfcfw.com/pdf/H3_AP202505161673647847_1.pdf?1747384443000.pdf
机械行业：2024年报综述——持续关注新质生产力,东兴证券,2025-05-14,工程机械,https://pdf.dfcfw.com/pdf/H3_AP202505141672703949_1.pdf?1747235062000.pdf
机械行业2024年年报及2025年一季报总结：经营整体稳健，积极关注人形机器人等成长板块,国信证券,2025-05-14,工程机械,https://pdf.dfcfw.com/pdf/H3_AP202505141672774600_1.pdf?1747245574000.pdf
机械日报：华为与优必选签署全面合作协议,太平洋,2025-05-13,工程机械,https://pdf.dfcfw.com/pdf/H3_AP202505131672189632_1.pdf?1747153545000.pdf
机械行业周报：4月挖机内外销表现亮眼，继续看好全年国内外需求共振,太平洋,2025-05-13,工程机械,https://pdf.dfcfw.com/pdf/H3_AP202505121671469102_1.pdf?1747131133000.pdf
2025年工程机械行业分析,联合资信,2025-05-12,工程机械,https://pdf.dfcfw.com/pdf/H3_AP202505121671463997_1.pdf?1747041316000.pdf
工程机械行业跟踪点评：4月挖机海内外销量延续同增态势,东莞证券,2025-05-12,工程机械,https://pdf.dfcfw.com/pdf/H3_AP202505121671659004_1.pdf?1747069830000.pdf
机械日报：联想首位人形机器人“硅基员工”亮相,太平洋,2025-05-11,工程机械,https://pdf.dfcfw.com/pdf/H3_AP202505111671002605_1.pdf?1746969565000.pdf
工程机械行业2024年报&2025年一季报总结：内需复苏超预期，工程机械行业有望迎来国内外共振,东吴证券,2025-05-11,工程机械,https://pdf.dfcfw.com/pdf/H3_AP202505111671002567_1.pdf?1746970158000.pdf
机械行业研究：看好工程机械、科学仪器和可控核聚变,国金证券,2025-05-11,工程机械,https://pdf.dfcfw.com/pdf/H3_AP202505111671187961_1.pdf?1746994515000.pdf
机械日报：博雷顿在港交所挂牌上市,太平洋,2025-05-08,工程机械,https://pdf.dfcfw.com/pdf/H3_AP202505081669377430_1.pdf?1746709762000.pdf
机械日报：国产可穿戴仿生手随心而动,太平洋,2025-05-07,工程机械,https://pdf.dfcfw.com/pdf/H3_AP202505071668932707_1.pdf?1746636574000.pdf
机械日报：中国一汽人形机器人亮相上海车展,太平洋,2025-05-05,工程机械,https://pdf.dfcfw.com/pdf/H3_AP202505021666135510_1.pdf?1746454494000.pdf
机械行业24年年报&25年一季报总结：工程机械、船舶表现亮眼，关注新质生产力,国金证券,2025-05-05,工程机械,https://pdf.dfcfw.com/pdf/H3_AP202505041667148726_1.pdf?1746456852000.pdf
机械日报：总书记到访上海“模速空间”大模型创新生态社区,太平洋,2025-04-30,工程机械,https://pdf.dfcfw.com/pdf/H3_AP202504301665049059_1.pdf?1746028093000.pdf
机械日报：Q1中国工业机器人销量同比+11.6%，国产渗透率同比+2pct,太平洋,2025-04-29,工程机械,https://pdf.dfcfw.com/pdf/H3_AP202504291664503937_1.pdf?1745948151000.pdf
机械行业月报：聚焦行业基本面向好的工程机械、机器人、机床、高铁设备等方向,中原证券,2025-04-29,工程机械,https://pdf.dfcfw.com/pdf/H3_AP202504291664256647_1.pdf?1745912856000.pdf
机械行业周报：挖机一季度销售亮眼，关注工程机械公司一季报,太平洋,2025-04-28,工程机械,https://pdf.dfcfw.com/pdf/H3_AP202504281663742138_1.pdf?1745850621000.pdf
机械行业周报：3月部分非挖品类内销改善，关注自主可控、工程机械和机器人,上海证券,2025-04-23,工程机械,https://pdf.dfcfw.com/pdf/H3_AP202504231661099619_1.pdf?1745429660000.pdf
机械行业周报：看好燃气轮机、工程机械和工业母机,国金证券,2025-04-21,工程机械,https://pdf.dfcfw.com/pdf/H3_AP202504211659764707_1.pdf?1745221146000.pdf
机械日报：中国固体动力人工智能大模型平台上线运行,太平洋,2025-04-20,工程机械,https://pdf.dfcfw.com/pdf/H3_AP202504191658965001_1.pdf?1745141859000.pdf
工程机械：智能物流专题报告-AI发展驱动物流智能化升级，无人叉车技术持续发展,财信证券,2025-04-18,工程机械,https://pdf.dfcfw.com/pdf/H3_AP202504181658307731_1.pdf?1744976126000.pdf
机械行业周报：3月挖机内销同比+28.5%，建议关注自主可控、工程机械和机器人,上海证券,2025-04-18,工程机械,https://pdf.dfcfw.com/pdf/H3_AP202504181658357413_1.pdf?1744984838000.pdf
机械：3月挖机、装载机内销延续高景气，出口同比继续向上,太平洋,2025-04-17,工程机械,https://pdf.dfcfw.com/pdf/H3_AP202504171657786253_1.pdf?1744888524000.pdf
机械日报：3月国内新能源重卡同比增183%,太平洋,2025-04-15,工程机械,https://pdf.dfcfw.com/pdf/H3_AP202504151656878312_1.pdf?1744735907000.pdf
机械行业周报：3月挖机内销超预期，继续看好工程机械板块,太平洋,2025-04-14,工程机械,https://pdf.dfcfw.com/pdf/H3_AP202504141656207948_1.pdf?1744630146000.pdf
机械行业周报：看好自主可控、工程机械和机器人,国金证券,2025-04-13,工程机械,https://pdf.dfcfw.com/pdf/H3_AP202504131655897183_1.pdf?1744564012000.pdf
工程机械行业月度报告：3月挖机增长18.5%，开工小时和利用率明显改善,海通国际,2025-04-11,工程机械,https://pdf.dfcfw.com/pdf/H3_AP202504111654889868_1.pdf?1744402442000.pdf
工程机械行业点评报告：工程机械密集回购，继续推荐板块布局机会,东吴证券,2025-04-10,工程机械,https://pdf.dfcfw.com/pdf/H3_AP202504101653976043_1.pdf?1744272613000.pdf
机械日报：财政部办公厅、住房城乡建设部办公厅发布开展2025年度中央财政支持实施城市更新行动的通知,太平洋,2025-04-10,工程机械,https://pdf.dfcfw.com/pdf/H3_AP202504101653976993_1.pdf?1744274798000.pdf
机械行业周报：3月工程机械开工时长同增，关注关税冲击下半导体设备和高端仪器的自主可控机会,上海证券,2025-04-10,工程机械,https://pdf.dfcfw.com/pdf/H3_AP202504101654010466_1.pdf?1744285581000.pdf
“对等关税”对中国工程机械行业的影响,联合资信,2025-04-10,工程机械,https://pdf.dfcfw.com/pdf/H3_AP202504101654203212_1.pdf?1744313682000.pdf
机械日报：央视探厂，三一重机产能全开,太平洋,2025-04-10,工程机械,https://pdf.dfcfw.com/pdf/H3_AP202504101654026327_1.pdf?1744290293000.pdf
工程机械行业点评报告：3月销量点评：3月挖机销量同比+29%超预期，旺季保持高景气,东吴证券,2025-04-08,工程机械,https://pdf.dfcfw.com/pdf/H3_AP202504081653168200_1.pdf?1744112770000.pdf
机械日报：bauma 2025盛大开幕,太平洋,2025-04-08,工程机械,https://pdf.dfcfw.com/pdf/H3_AP202504081653209054_1.pdf?1744121582000.pdf
机械行业周报：高标准农田建设方案发布，利好挖机更新需求释放,太平洋,2025-04-07,工程机械,https://pdf.dfcfw.com/pdf/H3_AP202504071652652777_1.pdf?1744019036000.pdf
机械行业周报：看好工程机械、工业母机、科学仪器和外骨骼机器人,国金证券,2025-04-07,工程机械,https://pdf.dfcfw.com/pdf/H3_AP202504071652623453_1.pdf?1744014560000.pdf
高端制造产业跟踪（3月）：Optimus订单落地，工程机械关税影响可控,五矿证券,2025-04-07,工程机械,https://pdf.dfcfw.com/pdf/H3_AP202504071652782982_1.pdf?1744045087000.pdf
机械日报：3月工程机械主要产品月平均工作90.1小时，同比增长6.53%,太平洋,2025-04-06,工程机械,https://pdf.dfcfw.com/pdf/H3_AP202504051651679729_1.pdf?1743933856000.pdf
工程机械行业点评报告：关税点评：对美敞口小，关注美国_墨西哥工厂布局,东吴证券,2025-04-03,工程机械,https://pdf.dfcfw.com/pdf/H3_AP202504031650931388_1.pdf?1743712724000.pdf
机械行业：低空经济有望迎商业化拐点,东兴证券,2025-04-02,工程机械,https://pdf.dfcfw.com/pdf/H3_AP202504021650210177_1.pdf?1743591365000.pdf
机械行业周报：3月工程机械指数持续扩张，美国或开启人形机器人国家战略,上海证券,2025-04-02,工程机械,https://pdf.dfcfw.com/pdf/H3_AP202504021650382588_1.pdf?1743617572000.pdf
机械行业研究：海洋经济风起，关注海洋高端装备制造,国金证券,2025-04-01,工程机械,https://pdf.dfcfw.com/pdf/H3_AP202504011649808724_1.pdf?1743497627000.pdf
机械日报：具身智能研究院发布人形机器人矩阵,太平洋,2025-04-01,工程机械,https://pdf.dfcfw.com/pdf/H3_AP202504011649883770_1.pdf?1743517847000.pdf
机械行业周报：看好机器人、工程机械和海洋经济,国金证券,2025-03-31,工程机械,https://pdf.dfcfw.com/pdf/H3_AP202503311649459596_1.pdf?1743414610000.pdf
工程机械行业动态跟踪：3月工程机械CMI指数值逼近扩张值，工程机械出口延续增长态势,华福证券,2025-03-31,工程机械,https://pdf.dfcfw.com/pdf/H3_AP202503311649557974_1.pdf?1743438164000.pdf
机械日报：速腾聚创发布“机器人之眼”,太平洋,2025-03-30,工程机械,https://pdf.dfcfw.com/pdf/H3_AP202503301649143762_1.pdf?1743362031000.pdf
机械行业周报：深海经济纳入国家战略，Optimus量产将近,上海证券,2025-03-27,工程机械,https://pdf.dfcfw.com/pdf/H3_AP202503271648167574_1.pdf?1743084853000.pdf
机械日报：SEMICON CHINA（2025）今日开幕,太平洋,2025-03-27,工程机械,https://pdf.dfcfw.com/pdf/H3_AP202503271648234904_1.pdf?1743098175000.pdf
机械行业月报：挖掘机国内销量高增长，人形机器人产品密集发布,中原证券,2025-03-27,工程机械,https://pdf.dfcfw.com/pdf/H3_AP202503271648317358_1.pdf?1743113346000.pdf
机械日报：奥迪一汽首次在生产基地试运行Walker S1,太平洋,2025-03-26,工程机械,https://pdf.dfcfw.com/pdf/H3_AP202503261647607022_1.pdf?1742977238000.pdf
机械：1+2月挖机海关出口同比高增，继续看好工程机械板块,太平洋,2025-03-25,工程机械,https://pdf.dfcfw.com/pdf/H3_AP202503251647171367_1.pdf?1742892696000.pdf
装备制造行业周报（3月第3周）：工程机械出口持续增长,世纪证券,2025-03-24,工程机械,https://pdf.dfcfw.com/pdf/H3_AP202503241646721474_1.pdf?1742809134000.pdf
机械行业周报：看好海洋经济、核聚变、机器人和农机,国金证券,2025-03-23,工程机械,https://pdf.dfcfw.com/pdf/H3_AP202503231646442814_1.pdf?1742750429000.pdf
机械行业：高端装备步入深海,东兴证券,2025-03-21,工程机械,https://pdf.dfcfw.com/pdf/H3_AP202503211645545302_1.pdf?1742572120000.pdf
机械行业周报：Figure、特斯拉机器人边际催化，深海科技首现政府工作报告,上海证券,2025-03-20,工程机械,https://pdf.dfcfw.com/pdf/H3_AP202503201645026962_1.pdf?1742471639000.pdf
工程机械：2月挖机强势复苏，政策驱动国内市场回暖,财信证券,2025-03-20,工程机械,https://pdf.dfcfw.com/pdf/H3_AP202503201645113464_1.pdf?1742488507000.pdf
工程机械行业跟踪点评：1-2月挖掘机内销同比增长51%，外销增长趋势延续,国信证券,2025-03-19,工程机械,https://pdf.dfcfw.com/pdf/H3_AP202503191644692740_1.pdf?1742396792000.pdf
工程机械行业点评报告：1-2月小松开工小时数同比增长13%，板块回调建议重点布局,东吴证券,2025-03-18,工程机械,https://pdf.dfcfw.com/pdf/H3_AP202503181644463970_1.pdf?1742284143000.pdf
机械：1+2月非挖产品内销同比显著改善，出口整体继续向上,太平洋,2025-03-18,工程机械,https://pdf.dfcfw.com/pdf/H3_AP202503181644471652_1.pdf?1742286073000.pdf
工程机械行业点评报告：1-2月叉车行业累计销量同比+9%，内、外销均温和增长,东吴证券,2025-03-16,工程机械,https://pdf.dfcfw.com/pdf/H3_AP202503161644424684_1.pdf?1742156163000.pdf
机械行业周报：看好工程机械、人形机器人与海洋经济,国金证券,2025-03-16,工程机械,https://pdf.dfcfw.com/pdf/H3_AP202503161644419378_1.pdf?1742135520000.pdf
机械行业周报：2月挖机销量表现超预期，智元发布具身基座大模型,上海证券,2025-03-13,工程机械,https://pdf.dfcfw.com/pdf/H3_AP202503131644326998_1.pdf?1741863675000.pdf
机械行业周报：2月挖机销售超预期，继续看好工程机械板块,太平洋,2025-03-10,工程机械,https://pdf.dfcfw.com/pdf/H3_AP202503101644221035_1.pdf?1741598201000.pdf
工程机械行业点评报告：2月销量点评：内销超预期复苏，看好板块利润释放空间,东吴证券,2025-03-10,工程机械,https://pdf.dfcfw.com/pdf/H3_AP202503101644231380_1.pdf?1741622053000.pdf
机械设备行业简评：挖机1-2月内销大幅增长，全年行业复苏或将确立,东海证券,2025-03-10,工程机械,https://pdf.dfcfw.com/pdf/H3_AP202503101644235579_1.pdf?1741630614000.pdf
机械行业周报：看好工程机械、人形机器人与船舶,国金证券,2025-03-09,工程机械,https://pdf.dfcfw.com/pdf/H3_AP202503091644205015_1.pdf?1741527380000.pdf
工程机械行业点评报告：工程机械开工销售旺季即将来临，重视板块春季躁动行情【勘误版】,东吴证券,2025-03-08,工程机械,https://pdf.dfcfw.com/pdf/H3_AP202503081644194657_1.pdf?1741513164000.pdf
工程机械行业动态跟踪：2月挖机内销大幅增长，国内工程机械市场延续复苏趋势,华福证券,2025-03-08,工程机械,https://pdf.dfcfw.com/pdf/H3_AP202503081644190586_1.pdf?1741514659000.pdf
机械行业周报：工程机械内需回暖，人形机器人政策端和产业端催化密集,上海证券,2025-03-06,工程机械,https://pdf.dfcfw.com/pdf/H3_AP202503061644101541_1.pdf?1741254145000.pdf
机械行业：政府工作报告从提振消费、未来产业、有效投资三维度利好机械设备行业,东兴证券,2025-03-06,工程机械,https://pdf.dfcfw.com/pdf/H3_AP202503061644104608_1.pdf?1741266243000.pdf
机械一周解一惑系列：看好工程机械投资机会,民生证券,2025-03-03,工程机械,https://pdf.dfcfw.com/pdf/H3_AP202503031643781187_1.pdf?1740999025000.pdf
机械行业研究：看好工程机械内需复苏与人形机器人产业进展,国金证券,2025-03-03,工程机械,https://pdf.dfcfw.com/pdf/H3_AP202503031643960049_1.pdf?1741003568000.pdf
工程机械行业动态跟踪：CMI指数延续扩张态势，国内工程机械市场进入提速升温节奏,华福证券,2025-03-03,工程机械,https://pdf.dfcfw.com/pdf/H3_AP202503031644005082_1.pdf?1741023643000.pdf
机械行业周报：挖机复苏趋势延续，看好国内外需求共振,太平洋,2025-03-03,工程机械,https://pdf.dfcfw.com/pdf/H3_AP202503031643997088_1.pdf?1741020442000.pdf
工程机械行业点评报告：工程机械开工销售旺季即将来临，重视板块春季躁动行情,东吴证券,2025-02-27,工程机械,https://pdf.dfcfw.com/pdf/H3_AP202502271643554620_1.pdf?1740652320000.pdf
机械行业周报：工程机械需求筑底回暖，Figure AI和1X发布最新进展,上海证券,2025-02-26,工程机械,https://pdf.dfcfw.com/pdf/H3_AP202502261643510191_1.pdf?1740559714000.pdf
机械行业周报：Figure发布大模型Helix，加速人形机器人商业化落地,太平洋,2025-02-24,工程机械,https://pdf.dfcfw.com/pdf/H3_AP202502241643425553_1.pdf?1740388952000.pdf
机械行业周报：看好人形机器人与工程机械,国金证券,2025-02-24,工程机械,https://pdf.dfcfw.com/pdf/H3_AP202502241643430384_1.pdf?1740397073000.pdf
机械行业月报：人工智能主题持续，继续推荐人形机器人、算力设备相关板块,中原证券,2025-02-24,工程机械,https://pdf.dfcfw.com/pdf/H3_AP202502241643447464_1.pdf?1740430676000.pdf
机械行业周报：1月挖机销量保持正增，宇树、Figure等机器人厂商均有重要进展,上海证券,2025-02-20,工程机械,https://pdf.dfcfw.com/pdf/H3_AP202502201643304333_1.pdf?1740047873000.pdf
工程机械行业跟踪点评：1月挖掘机内销同比下降0.3%，外销增长趋势延续,国信证券,2025-02-20,工程机械,https://pdf.dfcfw.com/pdf/H3_AP202502201643326273_1.pdf?1740070833000.pdf
机械行业周报：1月社融数据开门红，建议关注顺周期板块,太平洋,2025-02-17,工程机械,https://pdf.dfcfw.com/pdf/H3_AP202502171643158526_1.pdf?1739788843000.pdf
机械行业周报：看好工程机械、机器人与工业气体,国金证券,2025-02-16,工程机械,https://pdf.dfcfw.com/pdf/H3_AP202502161643145752_1.pdf?1739739317000.pdf
机械设备行业周报：人形机器人产业端迎来密集催化，持续关注人形机器人产业链,上海证券,2025-02-12,工程机械,https://pdf.dfcfw.com/pdf/H3_AP202502121643005371_1.pdf?1739349169000.pdf
机械行业周报：特斯拉招聘工程师、Figure自研AI模型，人形机器人量产渐进,太平洋,2025-02-10,工程机械,https://pdf.dfcfw.com/pdf/H3_AP202502101642930529_1.pdf?1739187657000.pdf
机械行业2月投资策略：1月机械行业表现相对较好，重点关注人形机器人等成长板块,国信证券,2025-02-10,工程机械,https://pdf.dfcfw.com/pdf/H3_AP202502101642941884_1.pdf?1739211697000.pdf
工程机械：国内主机厂开门红超预期，积极财政政策支撑工程机械需求,华福证券,2025-02-10,工程机械,https://pdf.dfcfw.com/pdf/H3_AP202502101642932034_1.pdf?1739192052000.pdf
机械行业研究周报：看好燃气轮机、工程机械与机器人,国金证券,2025-02-09,工程机械,https://pdf.dfcfw.com/pdf/H3_AP202502091642910906_1.pdf?1739109170000.pdf
工程机械海外市场分析之非洲：中资企业对外投资进程加速，矿山+基建需求增长未来可期,东吴证券,2025-02-05,工程机械,https://pdf.dfcfw.com/pdf/H3_AP202502051642787937_1.pdf?1738762262000.pdf
机械行业周报：关注工程机械内需回暖，多家机器人企业进入商业交付阶段,上海证券,2025-01-23,工程机械,https://pdf.dfcfw.com/pdf/H3_AP202501231642472662_1.pdf?1737622630000.pdf
机械行业月报：人形机器人加速落地，持续推荐行业向好的机器人、工程机械、船舶板块,中原证券,2025-01-21,工程机械,https://pdf.dfcfw.com/pdf/H3_AP202501211642387757_1.pdf?1737449419000.pdf
装备制造行业周报（1月第3周）：工程机械12月销量持续向好,世纪证券,2025-01-20,工程机械,https://pdf.dfcfw.com/pdf/H3_AP202501201642352157_1.pdf?1737364717000.pdf
机械行业周报：12月叉车内销同比转正，出口增幅继续维持较高水平,太平洋,2025-01-20,工程机械,https://pdf.dfcfw.com/pdf/H3_AP202501201642356883_1.pdf?1737373042000.pdf
工程机械行业点评报告：12月叉车销量同比+12%，出口引领增长,东吴证券,2025-01-20,工程机械,https://pdf.dfcfw.com/pdf/H3_AP202501201642374657_1.pdf?1737406410000.pdf
机械行业周报：看好燃气轮机、工程机械与船舶,国金证券,2025-01-19,工程机械,https://pdf.dfcfw.com/pdf/H3_AP202501191642338241_1.pdf?1737302079000.pdf
工程机械：全国工程机械数据总体平稳，各项基础设施建设有序推进,华福证券,2025-01-19,工程机械,https://pdf.dfcfw.com/pdf/H3_AP202501191642339283_1.pdf?1737308122000.pdf
机械行业周报：人形机器人产业端迎来密集催化，挖掘机销量实现连续9个月正增长,上海证券,2025-01-15,工程机械,https://pdf.dfcfw.com/pdf/H3_AP202501151641929559_1.pdf?1736933140000.pdf
工程机械行业跟踪点评：12月挖机内、外销增长趋势延续，小松开工小时数同比增长19.5%,国信证券,2025-01-13,工程机械,https://pdf.dfcfw.com/pdf/H3_AP202501131641898056_1.pdf?1736758015000.pdf
工程机械行业月度点评：挖掘机产销稳步回升，2025“两新”政策将纳入更多产品,财信证券,2025-01-13,工程机械,https://pdf.dfcfw.com/pdf/H3_AP202501131641905256_1.pdf?1736791194000.pdf
工程机械行业深度：行业企稳改善，“国际化+电动化”带动发展,财信证券,2025-01-13,工程机械,https://pdf.dfcfw.com/pdf/H3_AP202501131641900567_1.pdf?1736778664000.pdf
工程机械行业点评报告：12月挖掘机销量略超预期，国内景气度持续回升海外市场边际向好,东吴证券,2025-01-12,工程机械,https://pdf.dfcfw.com/pdf/H3_AP202501121641896241_1.pdf?1736689731000.pdf
工程机械行业动态跟踪：12月挖掘机销量同比增长16.0%，12月开工小时数同比增长19.5%,华福证券,2025-01-12,工程机械,https://pdf.dfcfw.com/pdf/H3_AP202501121641896787_1.pdf?1736708267000.pdf
机械行业周报：轨交装备景气持续，11月叉车销量稳增,上海证券,2025-01-09,工程机械,https://pdf.dfcfw.com/pdf/H3_AP202501091641865856_1.pdf?1736414562000.pdf
机械行业1月投资策略：12制造业PMI50.1%，重点关注工程机械、检测服务等板块,国信证券,2025-01-07,工程机械,https://pdf.dfcfw.com/pdf/H3_AP202501071641831721_1.pdf?1736239956000.pdf
机械行业2025年度策略报告：大国图强，制造先行,太平洋,2025-01-06,工程机械,https://pdf.dfcfw.com/pdf/H3_AP202501061641816290_1.pdf?1736170370000.pdf
机械行业周报：人形机器人产业端迎来密集催化，商业化落地进程加速,上海证券,2025-01-03,工程机械,https://pdf.dfcfw.com/pdf/H3_AP202501031641522407_1.pdf?1735896690000.pdf
工程机械：多重因素驱动，我国工程机械行业市场竞争力有望不断提升,国开证券,2025-01-03,工程机械,https://pdf.dfcfw.com/pdf/H3_AP202501031641795495_1.pdf?1735915862000.pdf
机械行业周报：看好燃气轮机、工程机械和农业机械,国金证券,2024-12-29,工程机械,https://pdf.dfcfw.com/pdf/H3_AP202412291641462163_1.pdf?1735479152000.pdf
机械行业周报：工程机械市场内稳外增，持续关注板块投资机会,上海证券,2024-12-26,工程机械,https://pdf.dfcfw.com/pdf/H3_AP202412261641430698_1.pdf?1735201192000.pdf
机械行业月报：人形机器人量产突破，挖掘机、工业机器人产销持续复苏,中原证券,2024-12-24,工程机械,https://pdf.dfcfw.com/pdf/H3_AP202412241641407500_1.pdf?1735027649000.pdf
【工程机械】2025年度策略：看好工程机械2025年国内外共振，矿山&电动化贡献新增长点,东吴证券,2024-12-24,工程机械,https://pdf.dfcfw.com/pdf/H3_AP202412241641420038_1.pdf?1735077567000.pdf
装备制造行业周报（12月第3周）：工程机械持续结构性回暖,世纪证券,2024-12-23,工程机械,https://pdf.dfcfw.com/pdf/H3_AP202412231641391167_1.pdf?1734945369000.pdf
机械行业周报：11月挖机海关出口数据更新，同比增幅继续扩大,太平洋,2024-12-23,工程机械,https://pdf.dfcfw.com/pdf/H3_AP202412231641393839_1.pdf?1734985577000.pdf
机械行业研究周报：看好人形机器人、工程机械与农业机械,国金证券,2024-12-22,工程机械,https://pdf.dfcfw.com/pdf/H3_AP202412221641389141_1.pdf?1734868269000.pdf
工程机械：11月挖掘机销量同比增长17.9%，11月工程机械出口44.85亿美元，同比增长16.3%,华福证券,2024-12-22,工程机械,https://pdf.dfcfw.com/pdf/H3_AP202412221641389907_1.pdf?1734890123000.pdf
工程机械：出口景气度结构性改善，行业出口有望边际向好,海通国际,2024-12-20,工程机械,https://pdf.dfcfw.com/pdf/H3_AP202412201641374153_1.pdf?1734706897000.pdf
机械行业周报：特斯拉更新机器人“盲走”视频，人形机器人商业化落地进程加速,上海证券,2024-12-19,工程机械,https://pdf.dfcfw.com/pdf/H3_AP202412191641364071_1.pdf?1734631264000.pdf
工程机械行业点评报告：11月叉车销量同比+5%，内销降幅收窄,东吴证券,2024-12-18,工程机械,https://pdf.dfcfw.com/pdf/H3_AP202412181641348022_1.pdf?1734545321000.pdf
叉车月度跟踪：11月整体销量同比增长5%，内需景气持续好转，出海继续加速,海通国际,2024-12-17,工程机械,https://pdf.dfcfw.com/pdf/H3_AP202412171641327410_1.pdf?1734445745000.pdf
工程机械：国内L型底部有望确认，出口景气度结构性改善,海通国际,2024-12-17,工程机械,https://pdf.dfcfw.com/pdf/H3_AP202412171641329035_1.pdf?1734450793000.pdf
