研报名称,机构名称,发布时间,行业,研报地址
机械行业周报：人形机器人产业端迎来密集催化，商业化落地进程加速,上海证券,2025-01-03,工程机械,https://pdf.dfcfw.com/pdf/H3_AP202501031641522407_1.pdf?1735896690000.pdf
机械行业周报：看好燃气轮机、工程机械和农业机械,国金证券,2024-12-29,工程机械,https://pdf.dfcfw.com/pdf/H3_AP202412291641462163_1.pdf?1735479152000.pdf
机械行业周报：工程机械市场内稳外增，持续关注板块投资机会,上海证券,2024-12-26,工程机械,https://pdf.dfcfw.com/pdf/H3_AP202412261641430698_1.pdf?1735201192000.pdf
机械行业月报：人形机器人量产突破，挖掘机、工业机器人产销持续复苏,中原证券,2024-12-24,工程机械,https://pdf.dfcfw.com/pdf/H3_AP202412241641407500_1.pdf?1735027649000.pdf
【工程机械】2025年度策略：看好工程机械2025年国内外共振，矿山&电动化贡献新增长点,东吴证券,2024-12-24,工程机械,https://pdf.dfcfw.com/pdf/H3_AP202412241641420038_1.pdf?1735077567000.pdf
装备制造行业周报（12月第3周）：工程机械持续结构性回暖,世纪证券,2024-12-23,工程机械,https://pdf.dfcfw.com/pdf/H3_AP202412231641391167_1.pdf?1734945369000.pdf
机械行业周报：11月挖机海关出口数据更新，同比增幅继续扩大,太平洋,2024-12-23,工程机械,https://pdf.dfcfw.com/pdf/H3_AP202412231641393839_1.pdf?1734985577000.pdf
机械行业研究周报：看好人形机器人、工程机械与农业机械,国金证券,2024-12-22,工程机械,https://pdf.dfcfw.com/pdf/H3_AP202412221641389141_1.pdf?1734868269000.pdf
工程机械：11月挖掘机销量同比增长17.9%，11月工程机械出口44.85亿美元，同比增长16.3%,华福证券,2024-12-22,工程机械,https://pdf.dfcfw.com/pdf/H3_AP202412221641389907_1.pdf?1734890123000.pdf
工程机械：出口景气度结构性改善，行业出口有望边际向好,海通国际,2024-12-20,工程机械,https://pdf.dfcfw.com/pdf/H3_AP202412201641374153_1.pdf?1734706897000.pdf
机械行业周报：特斯拉更新机器人“盲走”视频，人形机器人商业化落地进程加速,上海证券,2024-12-19,工程机械,https://pdf.dfcfw.com/pdf/H3_AP202412191641364071_1.pdf?1734631264000.pdf
工程机械行业点评报告：11月叉车销量同比+5%，内销降幅收窄,东吴证券,2024-12-18,工程机械,https://pdf.dfcfw.com/pdf/H3_AP202412181641348022_1.pdf?1734545321000.pdf
叉车月度跟踪：11月整体销量同比增长5%，内需景气持续好转，出海继续加速,海通国际,2024-12-17,工程机械,https://pdf.dfcfw.com/pdf/H3_AP202412171641327410_1.pdf?1734445745000.pdf
工程机械：国内L型底部有望确认，出口景气度结构性改善,海通国际,2024-12-17,工程机械,https://pdf.dfcfw.com/pdf/H3_AP202412171641329035_1.pdf?1734450793000.pdf
机械行业周报：中央经济工作会议召开，利好机床、机器人、工程机械板块,太平洋,2024-12-16,工程机械,https://pdf.dfcfw.com/pdf/H3_AP202412161641310454_1.pdf?1734349638000.pdf
机械行业周报：看好人形机器人、工程机械和燃气轮机,国金证券,2024-12-15,工程机械,https://pdf.dfcfw.com/pdf/H3_AP202412151641307145_1.pdf?1734282833000.pdf
机械设备行业周报：工程机械市场持续改善，多方入局人形机器人赛道,上海证券,2024-12-12,工程机械,https://pdf.dfcfw.com/pdf/H3_AP202412121641272350_1.pdf?1733998451000.pdf
机械行业2025年投资展望：中小市值估值持续修复，关注顺周期与高成长,东兴证券,2024-12-11,工程机械,https://pdf.dfcfw.com/pdf/H3_AP202412111641262383_1.pdf?1733939446000.pdf
工程机械系列报告：行业筑底回暖，国产挖机龙头走向全球,甬兴证券,2024-12-09,工程机械,https://pdf.dfcfw.com/pdf/H3_AP202412091641223120_1.pdf?1733743468000.pdf
工程机械行业月度点评：工程机械内外需求同步发力，制造业PMI景气上行,财信证券,2024-12-09,工程机械,https://pdf.dfcfw.com/pdf/H3_AP202412091641223727_1.pdf?1733751967000.pdf
工程机械行业观察及2025年信用风险展望,联合资信,2024-12-08,工程机械,https://pdf.dfcfw.com/pdf/H3_AP202412081641219314_1.pdf?1733674579000.pdf
机械行业周报：特斯拉灵巧手迭代优化，人形机器人商业化落地进程加速,上海证券,2024-12-06,工程机械,https://pdf.dfcfw.com/pdf/H3_AP202412061641202720_1.pdf?1733485182000.pdf
工程机械行业动态跟踪：主要工程机械产品开工率_小时数环比提升，CME预测11月挖掘机销售增长13%,华福证券,2024-12-06,工程机械,https://pdf.dfcfw.com/pdf/H3_AP202412061641215034_1.pdf?1733520398000.pdf
工程机械：国家政策助力拉动内需，挖掘机市场保持景气,财信证券,2024-12-04,工程机械,https://pdf.dfcfw.com/pdf/H3_AP202412041641171107_1.pdf?1733298975000.pdf
2025年度机械行业策略报告：确定性看装备出海，边际改善看内需相关,东吴证券,2024-12-03,工程机械,https://pdf.dfcfw.com/pdf/H3_AP202412031641150798_1.pdf?1733212637000.pdf
机械行业周报：宝马展大放异彩，国产厂商国际化征程加速,太平洋,2024-12-02,工程机械,https://pdf.dfcfw.com/pdf/H3_AP202412021641134433_1.pdf?1733141072000.pdf
工程机械：CME预测11月挖掘机销售增长13%，上海宝马展盛况空前,华福证券,2024-12-02,工程机械,https://pdf.dfcfw.com/pdf/H3_AP202412021641135103_1.pdf?1733147259000.pdf
机械行业周报：看好人形机器人、工程机械与船舶,国金证券,2024-12-01,工程机械,https://pdf.dfcfw.com/pdf/H3_AP202412011641129427_1.pdf?1733059944000.pdf
工程机械行业研究：海外龙头复盘之三：“县城小铁厂”的逆袭，小松模式煜煜生辉,国金证券,2024-11-29,工程机械,https://pdf.dfcfw.com/pdf/H3_AP202411291641115828_1.pdf?1732894493000.pdf
机械行业周报：工程机械市场需求改善，半导体自主可控持续推进,上海证券,2024-11-27,工程机械,https://pdf.dfcfw.com/pdf/H3_AP202411271641084527_1.pdf?1732701457000.pdf
机械行业年度策略：顺周期机械复苏、新质生产力成长,中原证券,2024-11-27,工程机械,https://pdf.dfcfw.com/pdf/H3_AP202411271641085943_1.pdf?1732714775000.pdf
机械行业月报：关注景气度向好的顺周期机械与成长子行业龙头,中原证券,2024-11-27,工程机械,https://pdf.dfcfw.com/pdf/H3_AP202411271641092171_1.pdf?1732733653000.pdf
工程机械行业点评：欧盟高空作业平台终裁结果落地，风险释放,财信证券,2024-11-26,工程机械,https://pdf.dfcfw.com/pdf/H3_AP202411261641069808_1.pdf?1732635237000.pdf
挖掘机月度数据跟踪：10月挖机增长15.1%，开工小时和利用率有所改善,海通国际,2024-11-26,工程机械,https://pdf.dfcfw.com/pdf/H3_AP202411261641074009_1.pdf?1732643652000.pdf
机械行业周报：挖机出口提速，内外销有望迎来共振,太平洋,2024-11-25,工程机械,https://pdf.dfcfw.com/pdf/H3_AP202411251641046764_1.pdf?1732542360000.pdf
机械行业周报：看好工程机械与工业缝纫机的出口机会,国金证券,2024-11-24,工程机械,https://pdf.dfcfw.com/pdf/H3_AP202411241641042320_1.pdf?1732448361000.pdf
机械一周解一惑系列：工程机械海外龙头三季报简析,民生证券,2024-11-24,工程机械,https://pdf.dfcfw.com/pdf/H3_AP202411241641042244_1.pdf?1732459170000.pdf
工程机械：10月中国工程机械出口同比增长23.8%，挖掘机国内销量同比增长21.6%,华福证券,2024-11-24,工程机械,https://pdf.dfcfw.com/pdf/H3_AP202411241641042477_1.pdf?1732454150000.pdf
机械行业研究：首推自主可控，关注顺周期及出海,国金证券,2024-11-22,工程机械,https://pdf.dfcfw.com/pdf/H3_AP202411221641018517_1.pdf?1732267135000.pdf
工程机械行业跟踪点评：国内筑底回升，海外持续修复,国信证券,2024-11-20,工程机械,https://pdf.dfcfw.com/pdf/H3_AP202411201640974601_1.pdf?1732089993000.pdf
工程机械行业动态跟踪：10月中国小松挖掘机开工小时数同比增长4.3%，挖掘机国内销量同比增长21.6%,华福证券,2024-11-17,工程机械,https://pdf.dfcfw.com/pdf/H3_AP202411171640928893_1.pdf?1731880667000.pdf
机械行业周报：看好工程机械与科学仪器,国金证券,2024-11-17,工程机械,https://pdf.dfcfw.com/pdf/H3_AP202411171640927791_1.pdf?1731853821000.pdf
工程机械行业点评报告：10月叉车销量同比持平，关注后续内需修复趋势,东吴证券,2024-11-15,工程机械,https://pdf.dfcfw.com/pdf/H3_AP202411151640909133_1.pdf?1731679939000.pdf
工程机械行业简评报告：10月挖掘机内外销维持景气，未来工程机械需求有望持续改善,首创证券,2024-11-15,工程机械,https://pdf.dfcfw.com/pdf/H3_AP202411151640909292_1.pdf?1731681712000.pdf
机械行业2025年度投资策略：顺周期、科技成长与出海,开源证券,2024-11-14,工程机械,https://pdf.dfcfw.com/pdf/H3_AP202411131640870173_1.pdf?1731569056000.pdf
工程机械行业2024年三季报综述：三季度业绩改善明显，内外需共振助力行业景气延续,华龙证券,2024-11-14,工程机械,https://pdf.dfcfw.com/pdf/H3_AP202411141640879127_1.pdf?1731595177000.pdf
机械设备行业周报：化债政策落地，10月挖机销量延续正增,上海证券,2024-11-12,工程机械,https://pdf.dfcfw.com/pdf/H3_AP202411121640826046_1.pdf?1731404265000.pdf
机械行业周报：地方化债“三箭齐发”，提振工程机械设备需求,太平洋,2024-11-11,工程机械,https://pdf.dfcfw.com/pdf/H3_AP202411111640808960_1.pdf?1731326384000.pdf
机械工业行业周报：地方化债“三箭齐发”，10月挖机销量同比+15.1%,海通国际,2024-11-11,工程机械,https://pdf.dfcfw.com/pdf/H3_AP202411111640817838_1.pdf?1731363391000.pdf
工程机械：10月挖掘机国内销量同比增长21.6%，积极财政政策支撑工程机械需求,华福证券,2024-11-10,工程机械,https://pdf.dfcfw.com/pdf/H3_AP202411101640804239_1.pdf?1731246061000.pdf
机械行业研究周报：看好工程机械，关注船舶和工业气体板块,国金证券,2024-11-10,工程机械,https://pdf.dfcfw.com/pdf/H3_AP202411101640804617_1.pdf?1731249247000.pdf
工程机械三季报总结：国内景气度回升，海外降息有望带来需求释放,国联证券,2024-11-10,工程机械,https://pdf.dfcfw.com/pdf/H3_AP202411101640805432_1.pdf?1731265027000.pdf
机械行业周报：人形机器人产业进展频出，持续关注人形机器人产业链,上海证券,2024-11-07,工程机械,https://pdf.dfcfw.com/pdf/H3_AP202411071640757758_1.pdf?1730977536000.pdf
竞争维度提升带来工程机械竞争格局优化：迈向高质量发展,五矿证券,2024-11-07,工程机械,https://pdf.dfcfw.com/pdf/H3_AP202411071640760261_1.pdf?1730991759000.pdf
机械行业深度研究：工程机械超预期，看好顺周期拐点,国金证券,2024-11-04,工程机械,https://pdf.dfcfw.com/pdf/H3_AP202411041640698415_1.pdf?1730735271000.pdf
机械行业周报：人形机器人催化不断，产业化有望加速,太平洋,2024-11-04,工程机械,https://pdf.dfcfw.com/pdf/H3_AP202411041640700380_1.pdf?1730739431000.pdf
机械行业周报：看好工程机械，关注通用机械和自主可控板块,国金证券,2024-11-03,工程机械,https://pdf.dfcfw.com/pdf/H3_AP202411031640686780_1.pdf?1730639440000.pdf
机械行业专题研究：先进工程机械产业链分析之河南概况,中原证券,2024-10-31,工程机械,https://pdf.dfcfw.com/pdf/H3_AP202410311640628314_1.pdf?1730362065000.pdf
机械行业月报：继续布局超跌成长子行业龙头和设备更新板块龙头,中原证券,2024-10-31,工程机械,https://pdf.dfcfw.com/pdf/H3_AP202410311640628316_1.pdf?1730361960000.pdf
机械设备行业周报：10月挖机销量延续正增，关注科技板块投资机会,上海证券,2024-10-31,工程机械,https://pdf.dfcfw.com/pdf/H3_AP202410311640633456_1.pdf?1730375549000.pdf
机械行业周报：国内价格战趋缓+海外投资产能，带动光伏设备需求,太平洋,2024-10-29,工程机械,https://pdf.dfcfw.com/pdf/H3_AP202410291640557585_1.pdf?1730198579000.pdf
工程机械行业动态跟踪：CME预测10月挖掘机国内销量同比增长18%，积极财政政策支撑工程机械需求,华福证券,2024-10-28,工程机械,https://pdf.dfcfw.com/pdf/H3_AP202410281640530122_1.pdf?1730103939000.pdf
机械行业周报：看好工程机械、铁路装备，关注农业机械,国金证券,2024-10-27,工程机械,https://pdf.dfcfw.com/pdf/H3_AP202410271640525763_1.pdf?1730028922000.pdf
工程机械行业简评报告：9月挖掘机内销增速超20%，出口延续增长势头,首创证券,2024-10-25,工程机械,https://pdf.dfcfw.com/pdf/H3_AP202410251640491650_1.pdf?1729848776000.pdf
工程机械行业动态跟踪：9月中国区域挖掘机开工小时数同比增长6.9%，积极财政政策支撑工程机械需求,华福证券,2024-10-22,工程机械,https://pdf.dfcfw.com/pdf/H3_AP202410221640398654_1.pdf?1729584932000.pdf
机械行业研究：机械行业“牛市”复盘与展望,国金证券,2024-10-22,工程机械,https://pdf.dfcfw.com/pdf/H3_AP202410221640402161_1.pdf?1729605871000.pdf
机械行业行业周报：看好工程机械，关注人形机器人板块,国金证券,2024-10-20,工程机械,https://pdf.dfcfw.com/pdf/H3_AP202410201640374009_1.pdf?1729428236000.pdf
工程机械行业点评报告：上海&北京两地陆续发布工程机械设备更新补贴政策，聚焦老旧设备淘汰&电动化趋势,东吴证券,2024-10-18,工程机械,https://pdf.dfcfw.com/pdf/H3_AP202410181640352324_1.pdf?1729238667000.pdf
机械行业周报：货币财政政策信号积极，看好工程机械内需改善,上海证券,2024-10-16,工程机械,https://pdf.dfcfw.com/pdf/H3_AP202410161640316536_1.pdf?1729071110000.pdf
工程机械行业点评报告：9月叉车出口销量同比+28.5%，内销继续承压,东吴证券,2024-10-16,工程机械,https://pdf.dfcfw.com/pdf/H3_AP202410161640327591_1.pdf?1729102927000.pdf
挖掘机月度数据跟踪：9月挖机销量维持增长，财政政策发力有望拉动需求边际改善,海通国际,2024-10-16,工程机械,https://pdf.dfcfw.com/pdf/H3_AP202410161640328691_1.pdf?1729109630000.pdf
机械工业行业周报：财政政策拟周期调节加力；9月挖掘机销量同比+10.8%,海通国际,2024-10-15,工程机械,https://pdf.dfcfw.com/pdf/H3_AP202410151640296649_1.pdf?1728986900000.pdf
工程机械行业动态跟踪：积极财政政策支撑工程机械需求，9月挖掘机内外销延续增长势头,华福证券,2024-10-15,工程机械,https://pdf.dfcfw.com/pdf/H3_AP202410151640296966_1.pdf?1728982406000.pdf
工程机械行业点评报告：北京市发布工程机械报废更新政策，助力工程机械电动化进程,东吴证券,2024-10-14,工程机械,https://pdf.dfcfw.com/pdf/H3_AP202410141640285616_1.pdf?1728919400000.pdf
机械行业周报：看好工程机械、船舶和农机板块,国金证券,2024-10-13,工程机械,https://pdf.dfcfw.com/pdf/H3_AP202410131640277131_1.pdf?1728831667000.pdf
工程机械行业动态跟踪：9月挖掘机内外销延续增长势头，各类政策多箭齐发支撑工程机械需求,华福证券,2024-10-12,工程机械,https://pdf.dfcfw.com/pdf/H3_AP202410121640276070_1.pdf?1728766622000.pdf
工程机械行业动态跟踪：政策支撑房地产市场止跌回稳，工程机械国内需求改善逻辑顺畅,华福证券,2024-10-11,工程机械,https://pdf.dfcfw.com/pdf/H3_AP202410111640265104_1.pdf?1728668081000.pdf
工程机械行业月度点评：行业企稳恢复，电动化和国际化带动盈利持续改善,财信证券,2024-10-10,工程机械,https://pdf.dfcfw.com/pdf/H3_AP202410101640250803_1.pdf?1728588359000.pdf
工程机械行业点评：工程机械杂志预测9月挖机外销同比增长近9%,国都证券,2024-10-09,工程机械,https://pdf.dfcfw.com/pdf/H3_AP202410091640221061_1.pdf?1728466457000.pdf
机械工业行业信息点评：政策持续加码，9月制造业景气度环比提升；重点关注顺周期、地产基建相关,海通国际,2024-10-08,工程机械,https://pdf.dfcfw.com/pdf/H3_AP202410051640176579_1.pdf?1728384074000.pdf
机械行业月报：珍惜反弹机遇，重点布局严重超跌的成长行业龙头和房地产相关的工程机械、电梯行业龙头,中原证券,2024-09-30,工程机械,https://pdf.dfcfw.com/pdf/H3_AP202409301640101997_1.pdf?1727709688000.pdf
工程机械行业点评报告：政策直接利好基建、房地产行业，工程机械主机厂有望率先受益,东吴证券,2024-09-29,工程机械,https://pdf.dfcfw.com/pdf/H3_AP202409291640095297_1.pdf?1727647531000.pdf
机械行业周报：8月工程机械出口额持续增长，关注该板块投资机会,上海证券,2024-09-27,工程机械,https://pdf.dfcfw.com/pdf/H3_AP202409271640070078_1.pdf?1727436354000.pdf
机械行业：通用设备有望迎顺周期拐点,东兴证券,2024-09-27,工程机械,https://pdf.dfcfw.com/pdf/H3_AP202409271640077212_1.pdf?1727456399000.pdf
机械设备行业：9月挖机销量预计+12%，1X推出世界模型,中国银河,2024-09-26,工程机械,https://pdf.dfcfw.com/pdf/H3_AP202409261640049484_1.pdf?1727343275000.pdf
工程机械行业简评报告：8月挖掘机内销延续增长势头，出口同比增速转正,首创证券,2024-09-25,工程机械,https://pdf.dfcfw.com/pdf/H3_AP202409251640020405_1.pdf?1727251263000.pdf
工程机械行业点评报告：8月叉车销量同比+1%，国内需求磨底,东吴证券,2024-09-20,工程机械,https://pdf.dfcfw.com/pdf/H3_AP202409191639948707_1.pdf?1726815414000.pdf
机械行业周报：下一代特斯拉人形机器Optimus将拥有类人筋骨，持续关注人形机器人产业链,上海证券,2024-09-20,工程机械,https://pdf.dfcfw.com/pdf/H3_AP202409201639953453_1.pdf?1726828353000.pdf
工程机械行业中报总结：盈利能力持续改善，看好Q3业绩加速修复,东吴证券,2024-09-18,工程机械,https://pdf.dfcfw.com/pdf/H3_AP202409171639908296_1.pdf?1726650601000.pdf
机械行业周报：看好铁路装备、工程机械行业景气度提升,国金证券,2024-09-17,工程机械,https://pdf.dfcfw.com/pdf/H3_AP202409171639901703_1.pdf?1726582627000.pdf
机械行业周报：8月挖机出口销量转正，看好工程机械板块,上海证券,2024-09-12,工程机械,https://pdf.dfcfw.com/pdf/H3_AP202409121639844558_1.pdf?1726129949000.pdf
详解油服设备、工程机械、光伏设备出海中东新机遇：沙漠里寻找新蓝海,东吴证券,2024-09-11,工程机械,https://pdf.dfcfw.com/pdf/H3_AP202409101639822906_1.pdf?1726040008000.pdf
机械行业2024H1中报综述：全球产业链重构，出口链+周期复苏板块受益,民生证券,2024-09-09,工程机械,https://pdf.dfcfw.com/pdf/H3_AP202409091639787556_1.pdf?1725867696000.pdf
机械行业2024年8月投资策略：关注业绩较好、估值处于历史低位的优质个股,国信证券,2024-09-09,工程机械,https://pdf.dfcfw.com/pdf/H3_AP202409091639803368_1.pdf?1725916852000.pdf
工程机械行业动态跟踪：8月挖机内销外销同时正增，减持难扰行业海内外需求共振逻辑,华福证券,2024-09-09,工程机械,https://pdf.dfcfw.com/pdf/H3_AP202409091639803459_1.pdf?1725917930000.pdf
机械行业周报：看好农机、工程机械景气与轨交船舶盈利提升,国金证券,2024-09-08,工程机械,https://pdf.dfcfw.com/pdf/H3_AP202409081639786091_1.pdf?1725804021000.pdf
一周解一惑系列：工程机械海外龙头二季报简析,民生证券,2024-09-08,工程机械,https://pdf.dfcfw.com/pdf/H3_AP202409081639786628_1.pdf?1725829451000.pdf
机械行业周报：优必选24H1营收增长近9成，1X Technologies发布全新一代家务机器人NEO,上海证券,2024-09-06,工程机械,https://pdf.dfcfw.com/pdf/H3_AP202409061639766763_1.pdf?1725616039000.pdf
工程机械2024半年报总结：行业筑底复苏，看好内外需同步改善,国投证券,2024-09-05,工程机械,https://pdf.dfcfw.com/pdf/H3_AP202409051639746821_1.pdf?1725530400000.pdf
工程机械海外市场分析系列之美国,东吴证券,2024-09-03,工程机械,https://pdf.dfcfw.com/pdf/H3_AP202409031639712779_1.pdf?1725380770000.pdf
出口型消费品设备2024年中报综述：收入趋势向好，2024年H2有望轻装上阵,国投证券,2024-09-03,工程机械,https://pdf.dfcfw.com/pdf/H3_AP202409031639720835_1.pdf?1725437237000.pdf
机械行业研究：看好铁路装备与工业缝纫机,国金证券,2024-09-02,工程机械,https://pdf.dfcfw.com/pdf/H3_AP202409021639684724_1.pdf?1725271693000.pdf
机械行业24年中报总结：业绩总体承压，看好船舶、铁路装备、工程机械、叉车板块,国金证券,2024-09-01,工程机械,https://pdf.dfcfw.com/pdf/H3_AP202409011639681310_1.pdf?1725225234000.pdf
2024年工程机械出海：挑战当前，未来可期：2024年以来，工程机械出口增速进一步放缓，相关企业面临多方面的挑战和不确定性；但当前海外市场仍是重要支柱，且未来仍有较大增长空间，出口表现有望平滑龙头企业的经营稳定性。,中诚信国际,2024-08-30,工程机械,https://pdf.dfcfw.com/pdf/H3_AP202408301639616651_1.pdf?1725033416000.pdf
机械行业周报：挖机销量延续增长，核电核准数量创新高,上海证券,2024-08-29,工程机械,https://pdf.dfcfw.com/pdf/H3_AP202408291639547923_1.pdf?1724940818000.pdf
中资出海专题系列研究（工程机械）：区域表现分化，主机厂驶入产业出海快车道,中国银河,2024-08-29,工程机械,https://pdf.dfcfw.com/pdf/H3_AP202408291639563354_1.pdf?1724959565000.pdf
机械行业月报：聚焦设备更新受益的船舶、工程机械、高铁设备等方向，耐心防守等待机遇,中原证券,2024-08-27,工程机械,https://pdf.dfcfw.com/pdf/H3_AP202408271639485091_1.pdf?1724778281000.pdf
机械行业周报：杰克股份24H1业绩亮眼，智元机器人发布五款商用人形机器人新品,上海证券,2024-08-26,工程机械,https://pdf.dfcfw.com/pdf/H3_AP202408261639447753_1.pdf?1724669519000.pdf
工程机械行业点评报告：CME预测8月挖机出口同比+4%，24年来首次转正,东吴证券,2024-08-25,工程机械,https://pdf.dfcfw.com/pdf/H3_AP202408251639443559_1.pdf?1724612532000.pdf
机械行业周报：看好拖拉机大型化与工程机械、船舶景气提升,国金证券,2024-08-25,工程机械,https://pdf.dfcfw.com/pdf/H3_AP202408251639441827_1.pdf?1724599887000.pdf
工程机械行业点评报告：工程机械海外龙头加码电动化，长期看好电动化大趋势,东吴证券,2024-08-22,工程机械,https://pdf.dfcfw.com/pdf/H3_AP202408221639391933_1.pdf?1724332427000.pdf
工程机械行业简评报告：7月叉车内外销均保持增长，外销同比增加21.6%,首创证券,2024-08-19,工程机械,https://pdf.dfcfw.com/pdf/H3_AP202408191639336942_1.pdf?1724089290000.pdf
机械行业行业月报：7月挖机内销持续改善，静待行业筑底回升,中国银河,2024-08-19,工程机械,https://pdf.dfcfw.com/pdf/H3_AP202408191639343971_1.pdf?1724099903000.pdf
机械行业周报：看好铁路装备、工程机械,国金证券,2024-08-18,工程机械,https://pdf.dfcfw.com/pdf/H3_AP202408181639323650_1.pdf?1723970600000.pdf
工程机械行业跟踪点评：7月挖机内销同比保持增长，出口同比增速大幅缩窄,东莞证券,2024-08-18,工程机械,https://pdf.dfcfw.com/pdf/H3_AP202408181639324798_1.pdf?1723995700000.pdf
工程机械行业点评报告：7月叉车销量同比+11.5%，内外销延续增长趋势,东吴证券,2024-08-16,工程机械,https://pdf.dfcfw.com/pdf/H3_AP202408161639312964_1.pdf?1723828233000.pdf
机械行业周报：工程机械内销延续复苏趋势，Figure 02正式发布,上海证券,2024-08-15,工程机械,https://pdf.dfcfw.com/pdf/H3_AP202408151639282566_1.pdf?1723712343000.pdf
机械行业研究：海外龙头复盘系列之一：工程机械百年老店，卡特彼勒历久弥新,国金证券,2024-08-14,工程机械,https://pdf.dfcfw.com/pdf/H3_AP202408141639271681_1.pdf?1723651914000.pdf
先进制造行业周报：Figure 02软硬件实力全面升级，工业母机政策组合拳密集落地,中航证券,2024-08-12,工程机械,https://pdf.dfcfw.com/pdf/H3_AP202408111639232759_1.pdf?1723449773000.pdf
工程机械出海专题（一）：出口回归稳态增长，把握区域结构机会,国投证券,2024-08-12,工程机械,https://pdf.dfcfw.com/pdf/H3_AP202408121639235801_1.pdf?1723469432000.pdf
机械行业研究：看好铁路装备、工程机械，关注科学仪器景气度回升,国金证券,2024-08-11,工程机械,https://pdf.dfcfw.com/pdf/H3_AP202408111639231040_1.pdf?1723365639000.pdf
工程机械行业简评报告：7月挖掘机内销持续增长，出口跌幅收窄,首创证券,2024-08-09,工程机械,https://pdf.dfcfw.com/pdf/H3_AP202408091639224634_1.pdf?1723237506000.pdf
工程机械行业点评报告：7月挖掘机内销超预期，工程机械电动化趋势明显,东吴证券,2024-08-08,工程机械,https://pdf.dfcfw.com/pdf/H3_AP202408081639194449_1.pdf?1723130132000.pdf
工程机械7月数据点评：挖机内销同比增幅维持20+%，出口下半年有望转正,国联证券,2024-08-08,工程机械,https://pdf.dfcfw.com/pdf/H3_AP202408081639204804_1.pdf?1723149500000.pdf
机械行业2024年8月投资策略：中报行情展开，关注受益设备更新政策和经营稳中向好的方向,国信证券,2024-08-07,工程机械,https://pdf.dfcfw.com/pdf/H3_AP202408071639182035_1.pdf?1723052619000.pdf
机械行业研究周报：看好船舶、工程机械、农业机械,国金证券,2024-08-04,工程机械,https://pdf.dfcfw.com/pdf/H3_AP202408041639132121_1.pdf?1722770939000.pdf
