研报名称,机构名称,发布时间,行业,研报地址
商贸零售行业跟踪周报：两会聚焦提振消费，关注服务消费和新型消费受益方向,东吴证券,2026-03-09,旅游零售Ⅱ,https://pdf.dfcfw.com/pdf/H3_AP202603091820402142_1.pdf?1773047267000.pdf
中国旅游行业信用观察（2026）,远东资信,2026-03-08,旅游零售Ⅱ,https://pdf.dfcfw.com/pdf/H3_AP202603081820383872_1.pdf?1772963929000.pdf
消费行业快评报告（三）：服务消费政策延续升级，新兴赛道蓄势发力,万联证券,2026-03-05,旅游零售Ⅱ,https://pdf.dfcfw.com/pdf/H3_AP202603051820313435_1.pdf?1772746048000.pdf
2025年度乡村旅游业发展情况报告,中国旅游协会休闲农业与乡村旅游分会,2026-03-04,旅游零售Ⅱ,https://pdf.dfcfw.com/pdf/H3_AP202603041820247596_1.pdf?1772620101000.pdf
旅游行业2026年春节黄金周数据快评报告：旅游市场高位运行，消费潜力有效释放,万联证券,2026-02-25,旅游零售Ⅱ,https://pdf.dfcfw.com/pdf/H3_AP202602251820027365_1.pdf?1772034363000.pdf
新消费行业周报：马年春节出行数据亮眼；美妆销售淡季边际改善,华源证券,2026-02-23,旅游零售Ⅱ,https://pdf.dfcfw.com/pdf/H3_AP202602231819984238_1.pdf?1771881365000.pdf
