研报名称,机构名称,发布时间,行业,研报地址
文旅行业研究：供给深化释放需求，文旅赛事打开成长空间,国金证券,2026-03-25,旅游及景区,https://pdf.dfcfw.com/pdf/H3_AP202603251820735119_1.pdf?1774426336000.pdf
博彩运营商体育赞助：英国政府对打击无照运营商体育赞助的咨询,,2026-03-18,旅游及景区,https://pdf.dfcfw.com/pdf/H3_AP202603181820611136_1.pdf?1773830173000.pdf
2025年度中国移动出行&在线旅游投诉数据与典型案例报告,网经社电子商务研究中心,2026-03-18,旅游及景区,https://pdf.dfcfw.com/pdf/H3_AP202603181820611131_1.pdf?1773827907000.pdf
中国温泉旅游行业2025年回顾与2026年展望,中国旅游协会温泉旅游分会,2026-03-10,旅游及景区,https://pdf.dfcfw.com/pdf/H3_AP202603101820433907_1.pdf?1773129935000.pdf
旅游业多元化：沙特阿拉伯和卡塔尔,Strategic Gears,2026-03-06,旅游及景区,https://pdf.dfcfw.com/pdf/H3_AP202603051820314658_1.pdf?1772784508000.pdf
中国研学市场大数据报告2025-2026（部分摘录）,中国旅游协会研学旅行分会,2026-03-04,旅游及景区,https://pdf.dfcfw.com/pdf/H3_AP202603041820272972_1.pdf?1772660972000.pdf
文化旅游基础设施与运营行业2025年信用回顾与2026年展望,新世纪资信评估,2026-02-26,旅游及景区,https://pdf.dfcfw.com/pdf/H3_AP202602261820053918_1.pdf?1772103393000.pdf
旅游综合26年春节假期点评：超长假期刺激出游，景区、入境游表现靓丽,信达证券,2026-02-25,旅游及景区,https://pdf.dfcfw.com/pdf/H3_AP202602251820024700_1.pdf?1772029266000.pdf
