研报名称,机构名称,发布时间,行业,研报地址
社会服务行业2025年度投资策略：内需提振主题下，关注出行链相关行业上行空间,民生证券,2024-12-24,旅游酒店,https://pdf.dfcfw.com/pdf/H3_AP202412241641410672_1.pdf?1735039836000.pdf
微信上线“送礼物”功能，发起电商鏖战的“奇袭时刻”,中航证券,2024-12-23,旅游酒店,https://pdf.dfcfw.com/pdf/H3_AP202412231641390998_1.pdf?1734942014000.pdf
社会服务业行业研究：关注首发经济、冰雪经济概念，茶饮品牌上市重启,国金证券,2024-12-23,旅游酒店,https://pdf.dfcfw.com/pdf/H3_AP202412231641392593_1.pdf?1734947816000.pdf
社会服务行业双周报：“双旦”将至，入境免签迎优化,中银证券,2024-12-23,旅游酒店,https://pdf.dfcfw.com/pdf/H3_AP202412231641393230_1.pdf?1734951967000.pdf
社会服务行业2025年度策略：需求恢复明确，坚定布局信心,中银证券,2024-12-23,旅游酒店,https://pdf.dfcfw.com/pdf/H3_AP202412231641398003_1.pdf?1734974121000.pdf
社会服务行业周报：拼搭和智能或成潮玩新基建，春节假期机票预定火热,开源证券,2024-12-22,旅游酒店,https://pdf.dfcfw.com/pdf/H3_AP202412221641390236_1.pdf?1734947226000.pdf
社会服务：“首发经济”鼓励品牌创新，重塑消费新动力,中航证券,2024-12-20,旅游酒店,https://pdf.dfcfw.com/pdf/H3_AP202412201641370684_1.pdf?1734681892000.pdf
社服与消费视角点评11月国内宏观数据：十一月消费增速回落，过境免签政策再度放宽,中银证券,2024-12-20,旅游酒店,https://pdf.dfcfw.com/pdf/H3_AP202412201641374067_1.pdf?1734702972000.pdf
社会服务行业深度报告：本地生活之存量篇：超级平台重塑线下服务业，赋能高效生活,开源证券,2024-12-18,旅游酒店,https://pdf.dfcfw.com/pdf/H3_AP202412171641336005_1.pdf?1734505678000.pdf
火锅创新发展报告2024,红餐产业研究院,2024-12-18,旅游酒店,https://pdf.dfcfw.com/pdf/H3_AP202412181641344258_1.pdf?1734536489000.pdf
酒店行业：2024年住酒店趋势报告,第一财经,2024-12-18,旅游酒店,https://pdf.dfcfw.com/pdf/H3_AP202412181641344264_1.pdf?1734537808000.pdf
社会服务行业信息更新：扩内需方向明确，服务新消费有望受益,中国银河,2024-12-16,旅游酒店,https://pdf.dfcfw.com/pdf/H3_AP202412161641311278_1.pdf?1734362149000.pdf
社会服务行业2025年年度策略报告：顺应时代：变与应变，体验消费,平安证券,2024-12-15,旅游酒店,https://pdf.dfcfw.com/pdf/H3_AP202412151641306286_1.pdf?1734260881000.pdf
社会服务行业双周报（第96期）：首发经济、冰雪经济、银发经济将成为扩大内需新兴力量,国信证券,2024-12-15,旅游酒店,https://pdf.dfcfw.com/pdf/H3_AP202412151641307684_1.pdf?1734299539000.pdf
社会服务行业·周观点：2025年春节档大片云集，电影大盘表现值得期待,中航证券,2024-12-15,旅游酒店,https://pdf.dfcfw.com/pdf/H3_AP202412151641307756_1.pdf?1734341120000.pdf
社会服务行业周报：把握赛车赛事、剧院等“新潮”机会，欧洲智能潮玩逆势增长,开源证券,2024-12-15,旅游酒店,https://pdf.dfcfw.com/pdf/H3_AP202412151641307812_1.pdf?1734343800000.pdf
消费服务行业双周报：2024年全球国际游客人数有望全面达到2019年水平,东莞证券,2024-12-13,旅游酒店,https://pdf.dfcfw.com/pdf/H3_AP202412131641297447_1.pdf?1734114774000.pdf
社会服务行业·周观点：OpenAI将持续推出新产品，AI应用再迎强催化,中航证券,2024-12-09,旅游酒店,https://pdf.dfcfw.com/pdf/H3_AP202412091641221338_1.pdf?1733736166000.pdf
社服周观点：实施方案为东北地区冰雪经济发展提供指引，冰雪游市场成长空间广阔,民生证券,2024-12-09,旅游酒店,https://pdf.dfcfw.com/pdf/H3_AP202412091641223144_1.pdf?1733743468000.pdf
社会服务行业双周报：冰雪旅游季开启，日本或放宽对我国签证,中银证券,2024-12-09,旅游酒店,https://pdf.dfcfw.com/pdf/H3_AP202412091641231083_1.pdf?1733771482000.pdf
社会服务行业周报：冰雪游预定热度持续升温，二次元汉服催生约妆新行业,开源证券,2024-12-08,旅游酒店,https://pdf.dfcfw.com/pdf/H3_AP202412081641220769_1.pdf?1733735296000.pdf
2024年前三季度旅游行业运行分析,联合资信,2024-12-08,旅游酒店,https://pdf.dfcfw.com/pdf/H3_AP202412081641219323_1.pdf?1733671375000.pdf
休闲服务行业深度：【消费瞭望录】连锁酒店投资框架：如何观测行业周期？,五矿证券,2024-12-06,旅游酒店,https://pdf.dfcfw.com/pdf/H3_AP202412061641203003_1.pdf?1733479640000.pdf
政策明确支持中小学AI教育，教育及出版公司受益,中航证券,2024-12-02,旅游酒店,https://pdf.dfcfw.com/pdf/H3_AP202412021641130888_1.pdf?1733135912000.pdf
社会服务行业行业月报：12月投资前瞻-OTA行业持续占优，关注汽服市场困境反转,中国银河,2024-12-02,旅游酒店,https://pdf.dfcfw.com/pdf/H3_AP202412021641139248_1.pdf?1733160155000.pdf
社会服务行业双周报（第95期）：出入境政策持续优化，降温带热冰雪游及火锅消费,国信证券,2024-12-02,旅游酒店,https://pdf.dfcfw.com/pdf/H3_AP202412021641135128_1.pdf?1733147686000.pdf
社服周观点：美团核心本地商业稳健增长，2030年前中小学基本普及人工智能教育,民生证券,2024-12-02,旅游酒店,https://pdf.dfcfw.com/pdf/H3_AP202412021641135570_1.pdf?1733150953000.pdf
社会服务行业周报：收藏级潮玩催生防伪刚性需求，万亿零食市场大有可“玩”,开源证券,2024-12-01,旅游酒店,https://pdf.dfcfw.com/pdf/H3_AP202412011641130665_1.pdf?1733124004000.pdf
消费服务行业双周报：单方面免签再增9国，入出境游潜力大,东莞证券,2024-11-30,旅游酒店,https://pdf.dfcfw.com/pdf/H3_AP202411301641128926_1.pdf?1732996936000.pdf
休闲服务行业周报：政策红利深度释放，消费市场迎来回暖黄金期,五矿证券,2024-11-28,旅游酒店,https://pdf.dfcfw.com/pdf/H3_AP202411281641100498_1.pdf?1732793354000.pdf
社会服务业行业研究：教培格局望改善，OTA三季报继续靓丽,国金证券,2024-11-25,旅游酒店,https://pdf.dfcfw.com/pdf/H3_AP202411251641043931_1.pdf?1732522504000.pdf
社服2025年度策略：把握困境反转弹性+优质龙头持续性,国金证券,2024-11-25,旅游酒店,https://pdf.dfcfw.com/pdf/H3_AP202411251641043932_1.pdf?1732531252000.pdf
社服周观点：我国免签国家范围进一步扩大，文旅部发布通知促研学游业务健康发展,民生证券,2024-11-25,旅游酒店,https://pdf.dfcfw.com/pdf/H3_AP202411251641046592_1.pdf?1732536402000.pdf
社会服务行业双周报：免签范围再度扩张，25年法定节假日增加,中银证券,2024-11-25,旅游酒店,https://pdf.dfcfw.com/pdf/H3_AP202411251641052328_1.pdf?1732552996000.pdf
疙瘩汤：传承中创新，疙瘩汤市场规模显著增长 头豹词条报告系列,头豹研究院,2024-11-25,旅游酒店,https://pdf.dfcfw.com/pdf/H3_AP202411251641057986_1.pdf?1732564711000.pdf
社会服务行业周报：欧美潮玩大娃二手交易升温，化妆师个人IP赋能美妆品牌,开源证券,2024-11-24,旅游酒店,https://pdf.dfcfw.com/pdf/H3_AP202411241641043466_1.pdf?1732523182000.pdf
社会服务行业·周观点：从“互联网+”到“AI+”，乌镇峰会见证产业变革趋势,中航证券,2024-11-24,旅游酒店,https://pdf.dfcfw.com/pdf/H3_AP202411241641043582_1.pdf?1732525777000.pdf
社会服务行业2024Q3基金持仓分析报告：社服Q3重仓比例维持低位，检测及酒店龙头获得增持,万联证券,2024-11-24,旅游酒店,https://pdf.dfcfw.com/pdf/H3_AP202411241641042524_1.pdf?1732455093000.pdf
社会服务行业会员流量系列专题（一）-出行篇：商业的进阶：从流量到会员,国信证券,2024-11-24,旅游酒店,https://pdf.dfcfw.com/pdf/H3_AP202411241641043312_1.pdf?1732479737000.pdf
消费者服务行业2025年上半年投资策略：板块景气分化，顺周期与成长为先,东莞证券,2024-11-22,旅游酒店,https://pdf.dfcfw.com/pdf/H3_AP202411221641025820_1.pdf?1732292521000.pdf
社会服务行业点评报告：OTA平台2024Q3业绩靓丽，在线旅游中期景气持续验证,开源证券,2024-11-20,旅游酒店,https://pdf.dfcfw.com/pdf/H3_AP202411201640984924_1.pdf?1732125166000.pdf
社服与消费视角点评10月国内宏观数据：“双十一”和以旧换新等政策共促十月社零消费良好增长,中银证券,2024-11-19,旅游酒店,https://pdf.dfcfw.com/pdf/H3_AP202411191640956206_1.pdf?1732029063000.pdf
社会服务行业2024年三季度业绩综述报告：业绩持续向好，行业景气度上行,万联证券,2024-11-18,旅游酒店,https://pdf.dfcfw.com/pdf/H3_AP202411181640931029_1.pdf?1731928111000.pdf
社会服务行业双周报（第94期）：2025年假期调整方案落定，北京、广东发布民办教育新规,国信证券,2024-11-18,旅游酒店,https://pdf.dfcfw.com/pdf/H3_AP202411181640932824_1.pdf?1731931951000.pdf
社会服务行业周报：10月潮玩多品类延续景气，全球大厂争先布局AI教育,开源证券,2024-11-17,旅游酒店,https://pdf.dfcfw.com/pdf/H3_AP202411171640928899_1.pdf?1731885448000.pdf
消费者服务行业双周报：公共节假日假期增加两天，有望释放消费潜力,东莞证券,2024-11-17,旅游酒店,https://pdf.dfcfw.com/pdf/H3_AP202411171640928949_1.pdf?1731883395000.pdf
社会服务行业·周观点：Applovin业绩超预期，AI应用有望加速商业化,中航证券,2024-11-17,旅游酒店,https://pdf.dfcfw.com/pdf/H3_AP202411171640928975_1.pdf?1731921587000.pdf
社服周观点：10月餐饮收入同比增3.2%，四川多景区开启铁路旅游专线模式,民生证券,2024-11-17,旅游酒店,https://pdf.dfcfw.com/pdf/H3_AP202411171640928778_1.pdf?1731875697000.pdf
OTA行业深度报告：市场规模、竞争格局及增速展望,东吴证券,2024-11-14,旅游酒店,https://pdf.dfcfw.com/pdf/H3_AP202411141640878234_1.pdf?1731582976000.pdf
社服行业周报：24Q3板块业绩承压，关注冰雪游表现,甬兴证券,2024-11-14,旅游酒店,https://pdf.dfcfw.com/pdf/H3_AP202411141640887585_1.pdf?1731607252000.pdf
消费者服务行业事件点评：25年起节假日天数增加，旅游行业迎来新催化,民生证券,2024-11-13,旅游酒店,https://pdf.dfcfw.com/pdf/H3_AP202411131640843381_1.pdf?1731482858000.pdf
社会服务业行业研究：25年法定假期延长，看好旅游板块弹性,国金证券,2024-11-13,旅游酒店,https://pdf.dfcfw.com/pdf/H3_AP202411131640849927_1.pdf?1731486346000.pdf
社会服务行业点评研究：增加法定假日，假日经济有望激发消费潜力,国联证券,2024-11-13,旅游酒店,https://pdf.dfcfw.com/pdf/H3_AP202411131640851209_1.pdf?1731490377000.pdf
社会服务行业行业信息更新：法定公共假期增加，影响几何？,中国银河,2024-11-13,旅游酒店,https://pdf.dfcfw.com/pdf/H3_AP202411131640852518_1.pdf?1731495224000.pdf
社会服务行业法定节假日修订快评：假期优化落地，促内需政策加码,国信证券,2024-11-13,旅游酒店,https://pdf.dfcfw.com/pdf/H3_AP202411131640852541_1.pdf?1731495569000.pdf
社会服务行业2025年年度投资策略：潮流时尚全球联动，新兴体验加速进击,开源证券,2024-11-13,旅游酒店,https://pdf.dfcfw.com/pdf/H3_AP202411131640852790_1.pdf?1731496339000.pdf
消费者服务行业事件点评：公共假期延长，释放旅游消费潜力,东莞证券,2024-11-13,旅游酒店,https://pdf.dfcfw.com/pdf/H3_AP202411131640852993_1.pdf?1731503005000.pdf
社会服务行业点评：冰雪经济规划出台，长远发展可期,甬兴证券,2024-11-13,旅游酒店,https://pdf.dfcfw.com/pdf/H3_AP202411131640859386_1.pdf?1731517978000.pdf
社服行业周报：发展冰雪经济，国内旅游消费再添动力,甬兴证券,2024-11-13,旅游酒店,https://pdf.dfcfw.com/pdf/H3_AP202411131640859822_1.pdf?1731518841000.pdf
自然景区行业深度报告：二次消费项目带动景区内生增长，多元客流贡献未来业绩,山西证券,2024-11-13,旅游酒店,https://pdf.dfcfw.com/pdf/H3_AP202411131640860131_1.pdf?1731519630000.pdf
社会服务行业双周报：冰雪游需求热度增长，产业迎政策利好,中银证券,2024-11-12,旅游酒店,https://pdf.dfcfw.com/pdf/H3_AP202411121640827247_1.pdf?1731410181000.pdf
2024年中国银发经济市场概览：银发经济“加快崛起”，文旅市场“热辣滚烫”,头豹研究院,2024-11-12,旅游酒店,https://pdf.dfcfw.com/pdf/H3_AP202411121640837859_1.pdf?1731440298000.pdf
社会服务行业点评报告：多因素催化消费级AI智能眼镜普及，把握产业变革机会,开源证券,2024-11-12,旅游酒店,https://pdf.dfcfw.com/pdf/H3_AP202411121640838114_1.pdf?1731440824000.pdf
社会服务行业点评报告：2025年新增2天法定节假日，关注文旅消费景气度持续性,东吴证券,2024-11-12,旅游酒店,https://pdf.dfcfw.com/pdf/H3_AP202411121640840127_1.pdf?1731448130000.pdf
社会服务业行业研究：高教选营望加快、激发冰雪游经济，关注三季报触底板块回升弹性,国金证券,2024-11-11,旅游酒店,https://pdf.dfcfw.com/pdf/H3_AP202411111640808012_1.pdf?1731322183000.pdf
社服周观点：冰雪游有望成为旅游市场规模上行新动能，持续推荐文旅主线,民生证券,2024-11-11,旅游酒店,https://pdf.dfcfw.com/pdf/H3_AP202411111640809268_1.pdf?1731332428000.pdf
社会服务行业周报：“三箭齐发”化解地方债务，重视内需消费,平安证券,2024-11-11,旅游酒店,https://pdf.dfcfw.com/pdf/H3_AP202411111640810067_1.pdf?1731336642000.pdf
社会服务行业·周观点：冰雪游&免签政策+消费券，旅游经济活力再提振,中航证券,2024-11-10,旅游酒店,https://pdf.dfcfw.com/pdf/H3_AP202411101640805844_1.pdf?1731312121000.pdf
社会服务行业周报：冰雪游升温，冰雪产业迎政策利好,上海证券,2024-11-10,旅游酒店,https://pdf.dfcfw.com/pdf/H3_AP202411101640805170_1.pdf?1731256754000.pdf
社服行业24年三季报总结：24Q3业绩压力显现，未来稳健增长可期,甬兴证券,2024-11-08,旅游酒店,https://pdf.dfcfw.com/pdf/H3_AP202411081640781840_1.pdf?1731061927000.pdf
旅游及景区行业点评报告：冰雪经济：旅游旺季+亚冬会赛事催化不断，政策吹响产业地位,开源证券,2024-11-08,旅游酒店,https://pdf.dfcfw.com/pdf/H3_AP202411081640783024_1.pdf?1731074310000.pdf
2024Q3社服零售财报综述：出入境、人服为亮点，关注高质量龙头,国联证券,2024-11-08,旅游酒店,https://pdf.dfcfw.com/pdf/H3_AP202411081640788864_1.pdf?1731086074000.pdf
社会服务行业财报总结暨11月投资策略：把脉消费趋势大方向，适度关注顺周期赛道,国信证券,2024-11-08,旅游酒店,https://pdf.dfcfw.com/pdf/H3_AP202411081640789083_1.pdf?1731086501000.pdf
社会服务业行业点评：征求意见稿发布，关注后续学科类牌照审批情况,国金证券,2024-11-07,旅游酒店,https://pdf.dfcfw.com/pdf/H3_AP202411071640756084_1.pdf?1730966185000.pdf
社服行业周报：国内消费逐步向好,甬兴证券,2024-11-06,旅游酒店,https://pdf.dfcfw.com/pdf/H3_AP202411061640737536_1.pdf?1730889111000.pdf
社会服务行业2024年三季报业绩综述：社服板块收入略降利润下滑，K12培训、出境游、人服行业表现亮眼,民生证券,2024-11-06,旅游酒店,https://pdf.dfcfw.com/pdf/H3_AP202411061640738881_1.pdf?1730892808000.pdf
24年前三季度国内旅游数据点评：国内旅游消费表现良好,甬兴证券,2024-11-06,旅游酒店,https://pdf.dfcfw.com/pdf/H3_AP202411061640738928_1.pdf?1730893842000.pdf
社会服务11月投资前瞻：Q3行业环比下行，关注政策催化落地,中国银河,2024-11-05,旅游酒店,https://pdf.dfcfw.com/pdf/H3_AP202411051640716047_1.pdf?1730815996000.pdf
社会服务行业周报：Q3重点公司经营受宏观环境影响；生育支持若干措施出台、免签进一步扩大,平安证券,2024-11-04,旅游酒店,https://pdf.dfcfw.com/pdf/H3_AP202411041640696429_1.pdf?1730734181000.pdf
消费服务行业双周报：单方面免签名单再扩大，入境游有望受益,东莞证券,2024-11-04,旅游酒店,https://pdf.dfcfw.com/pdf/H3_AP202411041640702054_1.pdf?1730740430000.pdf
酒店餐饮行业专题报告：以邻为鉴，从日本酒店业成长轨迹展望中国酒店业发展方向,华福证券,2024-11-04,旅游酒店,https://pdf.dfcfw.com/pdf/H3_AP202411041640707823_1.pdf?1730750200000.pdf
社会服务行业双周报（第93期）：三季报密集披露关注绩优个股，豆神教育发布AI导师,国信证券,2024-11-04,旅游酒店,https://pdf.dfcfw.com/pdf/H3_AP202411041640692220_1.pdf?1730713760000.pdf
社服行业周报：离岛免税承压，关注市内店落地新增量,上海证券,2024-11-04,旅游酒店,https://pdf.dfcfw.com/pdf/H3_AP202411041640695067_1.pdf?1730729732000.pdf
贺岁电影陆续定档，看好2025年大盘预期改善,中航证券,2024-11-03,旅游酒店,https://pdf.dfcfw.com/pdf/H3_AP202411031640688390_1.pdf?1730663016000.pdf
社会服务行业周报：双十一OTA平台“囤旅游”热度高涨，FY2025Q2三丽鸥业绩延续高增,开源证券,2024-11-03,旅游酒店,https://pdf.dfcfw.com/pdf/H3_AP202411031640689346_1.pdf?1730711316000.pdf
社服出行链三季报总结：高基数下触底，关注顺周期弹性,国金证券,2024-11-03,旅游酒店,https://pdf.dfcfw.com/pdf/H3_AP202411031640687501_1.pdf?1730659638000.pdf
社服行业周报：政策效果显现，社零数据改善,甬兴证券,2024-11-01,旅游酒店,https://pdf.dfcfw.com/pdf/H3_AP202411011640657677_1.pdf?1730450268000.pdf
社会服务行业专题研究：24Q3商社板块持仓增加，持续看好强α龙头,国联证券,2024-10-31,旅游酒店,https://pdf.dfcfw.com/pdf/H3_AP202410311640634384_1.pdf?1730383158000.pdf
社服行业周报：潮玩出海势头强劲，银发人群撬动旅游市场,上海证券,2024-10-28,旅游酒店,https://pdf.dfcfw.com/pdf/H3_AP202410281640535038_1.pdf?1730129561000.pdf
社会服务行业双周报：入境游持续火热，关注Q3业绩兑现情况,中银证券,2024-10-28,旅游酒店,https://pdf.dfcfw.com/pdf/H3_AP202410281640551951_1.pdf?1730152674000.pdf
社会服务行业周报：IP捏捏有望带动潮玩行业扩容，AI引领教育行业变革新浪潮,开源证券,2024-10-27,旅游酒店,https://pdf.dfcfw.com/pdf/H3_AP202410271640528657_1.pdf?1730114933000.pdf
社服周观点：北京将推广AI学伴和AI导学应用，豆神教育进入24Q3基金重仓股,民生证券,2024-10-27,旅游酒店,https://pdf.dfcfw.com/pdf/H3_AP202410271640528369_1.pdf?1730055829000.pdf
社会服务行业深度报告：美丽消费专题：从海外三大美妆集团中报看大众国货β机会,平安证券,2024-10-23,旅游酒店,https://pdf.dfcfw.com/pdf/H3_AP202410231640434849_1.pdf?1729698836000.pdf
社会服务行业周报：从东南亚民俗看潮流IP创意表达，多品牌加码即时零售闪电仓,开源证券,2024-10-21,旅游酒店,https://pdf.dfcfw.com/pdf/H3_AP202410201640375564_1.pdf?1729499630000.pdf
社会服务行业·周观点：抢抓政策东风，科技人才教育引领新趋势,中航证券,2024-10-21,旅游酒店,https://pdf.dfcfw.com/pdf/H3_AP202410211640375940_1.pdf?1729502197000.pdf
社服行业周报：关注政策推动下的业绩增量,上海证券,2024-10-21,旅游酒店,https://pdf.dfcfw.com/pdf/H3_AP202410211640378101_1.pdf?1729507555000.pdf
社会服务行业周报：互换便利操作细则出炉，三季度板块经营受环境影响,平安证券,2024-10-21,旅游酒店,https://pdf.dfcfw.com/pdf/H3_AP202410211640377783_1.pdf?1729505864000.pdf
消费服务行业双周报：国庆人均消费略有增长，银发经济与出入境游或为新的增长点,东莞证券,2024-10-21,旅游酒店,https://pdf.dfcfw.com/pdf/H3_AP202410211640386967_1.pdf?1729530563000.pdf
社会服务行业双周报（第92期）2025年公考跟踪：国考招录人数稳中有升，赛道景气度延续,国信证券,2024-10-21,旅游酒店,https://pdf.dfcfw.com/pdf/H3_AP202410211640392358_1.pdf?1729542020000.pdf
中国市场2024_2025酒店运营商信心指数调研,JLL,2024-10-17,旅游酒店,https://pdf.dfcfw.com/pdf/H3_AP202410171640337931_1.pdf?1729175598000.pdf
旅游行业全面复苏，总体向好且增长可期,大公国际,2024-10-17,旅游酒店,https://pdf.dfcfw.com/pdf/H3_AP202410171640341134_1.pdf?1729181399000.pdf
餐饮行业月度观察报告,红餐产业研究院,2024-10-15,旅游酒店,https://pdf.dfcfw.com/pdf/H3_AP202410151640309298_1.pdf?1729023657000.pdf
2024年中国银龄旅游行业专题报告：乐享银龄，探讨中老年旅游消费趋势,灼识投资咨询(上海),2024-10-15,旅游酒店,https://pdf.dfcfw.com/pdf/H3_AP202410151640309389_1.pdf?1729028843000.pdf
社会服务行业·周观点：十一假期旅游经济维持稳健，年内积极关注出境游机会,中航证券,2024-10-14,旅游酒店,https://pdf.dfcfw.com/pdf/H3_AP202410131640278417_1.pdf?1728891161000.pdf
社服周观点：财政部国新办新闻会提及“促消费”发力方向，消费行业有望进一步持续催化,民生证券,2024-10-14,旅游酒店,https://pdf.dfcfw.com/pdf/H3_AP202410141640281569_1.pdf?1728903631000.pdf
社服行业周报：假日出行需求升级，消费能级提高,上海证券,2024-10-14,旅游酒店,https://pdf.dfcfw.com/pdf/H3_AP202410141640281753_1.pdf?1728904022000.pdf
社会服务行业双周报：国庆消费数据稳中有升，旅游市场高景气,中银证券,2024-10-14,旅游酒店,https://pdf.dfcfw.com/pdf/H3_AP202410141640287353_1.pdf?1728923047000.pdf
连锁餐饮行业系列深度（七）：促消费政策接踵而至，板块优选高效能龙头,国信证券,2024-10-14,旅游酒店,https://pdf.dfcfw.com/pdf/H3_AP202410141640290090_1.pdf?1728928522000.pdf
预制菜行业深度报告：新规重构行业标准，再看市场格局演化,华鑫证券,2024-10-13,旅游酒店,https://pdf.dfcfw.com/pdf/H3_AP202410131640276687_1.pdf?1728817448000.pdf
社会服务行业10月投资策略暨三季报前瞻：线上龙头景气延续，政策积极助力预期改善,国信证券,2024-10-13,旅游酒店,https://pdf.dfcfw.com/pdf/H3_AP202410131640278142_1.pdf?1728855520000.pdf
社会服务行业周报：银发族旅游、教育消费潜能释放，关注潮玩线上运营服务商,开源证券,2024-10-13,旅游酒店,https://pdf.dfcfw.com/pdf/H3_AP202410131640278255_1.pdf?1728857031000.pdf
“塌房”的民宿，为什么还有这么多资本在投？,深圳来觅数据信息科技,2024-10-12,旅游酒店,https://pdf.dfcfw.com/pdf/H3_AP202410121640273720_1.pdf?1728739740000.pdf
社会服务行业专题研究：社服零售美护中报总结,天风证券,2024-10-11,旅游酒店,https://pdf.dfcfw.com/pdf/H3_AP202410111640255579_1.pdf?1728638143000.pdf
2024年全球旅行应用与品牌市场洞察,Sensor Tower,2024-10-11,旅游酒店,https://pdf.dfcfw.com/pdf/H3_AP202410111640255483_1.pdf?1728639722000.pdf
国庆出游点评：新“慢充式旅游”消费习惯正形成,五矿证券,2024-10-11,旅游酒店,https://pdf.dfcfw.com/pdf/H3_AP202410111640257577_1.pdf?1728642381000.pdf
团餐：激烈的市场竞争格局下，团餐行业未来将向多元化、定制化发展 头豹词条报告系列,头豹研究院,2024-10-11,旅游酒店,https://pdf.dfcfw.com/pdf/H3_AP202410111640268290_1.pdf?1728680261000.pdf
餐饮品招发展报告2024,红餐产业研究院,2024-10-10,旅游酒店,https://pdf.dfcfw.com/pdf/H3_AP202410101640238294_1.pdf?1728553369000.pdf
国庆假期文旅数据点评：出境游增长强劲，旅游消费力环比回升,中国银河,2024-10-10,旅游酒店,https://pdf.dfcfw.com/pdf/H3_AP202410101640241017_1.pdf?1728559537000.pdf
国庆消费数据点评：国庆假期出游符合预期,东海证券,2024-10-09,旅游酒店,https://pdf.dfcfw.com/pdf/H3_AP202410091640222600_1.pdf?1728482809000.pdf
2024年国庆假期旅游数据点评：国庆出游市场高景气，政策保障提振消费信心,中银证券,2024-10-09,旅游酒店,https://pdf.dfcfw.com/pdf/H3_AP202410091640228642_1.pdf?1728493269000.pdf
旅游行业2024年“十一”黄金周数据跟踪报告：旅游市场活力持续复苏，市内免税新政开始施行,万联证券,2024-10-09,旅游酒店,https://pdf.dfcfw.com/pdf/H3_AP202410091640230214_1.pdf?1728496645000.pdf
2024湖南美食旅游发展报告,中国旅游研究院,2024-10-09,旅游酒店,https://pdf.dfcfw.com/pdf/H3_AP202410091640234382_1.pdf?1728505923000.pdf
社会服务行业专题研究：国内游量增价稳，出入境继续高增,国联证券,2024-10-09,旅游酒店,https://pdf.dfcfw.com/pdf/H3_AP202410091640235166_1.pdf?1728509282000.pdf
社会服务业行业研究：国庆出行持续旺盛，关注弹性&绩优两条主线,国金证券,2024-10-08,旅游酒店,https://pdf.dfcfw.com/pdf/H3_AP202410081640191678_1.pdf?1728395659000.pdf
社会服务行业2024年国庆黄金周跟踪：服务消费景气提升，继续看好高效能细分龙头,国信证券,2024-10-08,旅游酒店,https://pdf.dfcfw.com/pdf/H3_AP202410081640204114_1.pdf?1728416739000.pdf
社服周观点：底部政策超预期，关注社服顺周期主线及旅游主线本轮反弹,民生证券,2024-10-08,旅游酒店,https://pdf.dfcfw.com/pdf/H3_AP202410081640207175_1.pdf?1728419007000.pdf
社会服务行业周报：国庆出游火热，政策刺激下风险偏好提升,平安证券,2024-10-08,旅游酒店,https://pdf.dfcfw.com/pdf/H3_AP202410081640193762_1.pdf?1728399052000.pdf
社会服务行业双周报（第91期）：增量政策助力改善服务消费预期，国庆出行及餐饮消费火爆,国信证券,2024-10-07,旅游酒店,https://pdf.dfcfw.com/pdf/H3_AP202410071640177235_1.pdf?1728289893000.pdf
