研报名称,机构名称,发布时间,行业,研报地址
景区行业专题二：长视角探讨自然景区增长动能,国信证券,2024-07-16,旅游酒店,https://pdf.dfcfw.com/pdf/H3_AP202407161637952532_1.pdf?1721125352000.pdf
社会服务行业周报：暑期出游热度延续，跨境游加速复苏,华龙证券,2024-07-16,旅游酒店,https://pdf.dfcfw.com/pdf/H3_AP202407161637966355_1.pdf?1721163720000.pdf
出入境游双向复苏，行业景气度持续抬升,中航证券,2024-07-15,旅游酒店,https://pdf.dfcfw.com/pdf/H3_AP202407151637905371_1.pdf?1721028331000.pdf
社会服务行业双周报：暑期出行旺季已至，入境游便利度持续优化,中银证券,2024-07-15,旅游酒店,https://pdf.dfcfw.com/pdf/H3_AP202407151637907141_1.pdf?1721033356000.pdf
社会服务行业双周报（第85期）：新一轮财税体系改革临近，关注暑期出游旺季机会,国信证券,2024-07-15,旅游酒店,https://pdf.dfcfw.com/pdf/H3_AP202407151637908267_1.pdf?1721034974000.pdf
社会服务行业周报：入境游市场持续升温，关注Z世代新型社交消费,上海证券,2024-07-15,旅游酒店,https://pdf.dfcfw.com/pdf/H3_AP202407151637910266_1.pdf?1721038646000.pdf
社会服务行业周报：入境游高热度，消费税改革备受关注,平安证券,2024-07-15,旅游酒店,https://pdf.dfcfw.com/pdf/H3_AP202407151637924190_1.pdf?1721062787000.pdf
社服周观点：暑期文旅消费规模环比增超20%，奥运赛事显著拉动赴欧游热情,民生证券,2024-07-14,旅游酒店,https://pdf.dfcfw.com/pdf/H3_AP202407141637889337_1.pdf?1720973732000.pdf
社会服务行业周报：6月潮玩市场高景气，本地生活平台加速出海,开源证券,2024-07-14,旅游酒店,https://pdf.dfcfw.com/pdf/H3_AP202407141637895933_1.pdf?1721037728000.pdf
【消费瞭望录】新消费格局：从商品迈向服务消费,五矿证券,2024-07-12,旅游酒店,https://pdf.dfcfw.com/pdf/H3_AP202407121637822715_1.pdf?1720783142000.pdf
消费者服务行业2024年下半年投资策略：坚守初心，稳中求进,东莞证券,2024-07-12,旅游酒店,https://pdf.dfcfw.com/pdf/H3_AP202407121637833491_1.pdf?1720803511000.pdf
2024年6月博彩数据跟踪点评：6月博收大幅回落，不及市场预期,中泰证券,2024-07-09,旅游酒店,https://pdf.dfcfw.com/pdf/H3_AP202407091637704574_1.pdf?1720516777000.pdf
社会服务行业周报：抖音、淘宝布局即时零售，餐饮市场供给仍在增加,开源证券,2024-07-08,旅游酒店,https://pdf.dfcfw.com/pdf/H3_AP202407071637653740_1.pdf?1720432886000.pdf
新一轮财税改革推进，有望激活消费新动能,中航证券,2024-07-08,旅游酒店,https://pdf.dfcfw.com/pdf/H3_AP202407081637664305_1.pdf?1720425984000.pdf
社会服务行业周报：免签红利显著，入境游迎来政策+市场双轮驱动,上海证券,2024-07-08,旅游酒店,https://pdf.dfcfw.com/pdf/H3_AP202407081637666177_1.pdf?1720430281000.pdf
社服周观点：武陵源、九寨沟、黄山签署战略合作协议，推进业态互补提升竞争力,民生证券,2024-07-08,旅游酒店,https://pdf.dfcfw.com/pdf/H3_AP202407081637669621_1.pdf?1720437975000.pdf
社服周观点：武陵源、九寨沟、黄龙签署战略合作协议，推进业态互补提升竞争力,民生证券,2024-07-08,旅游酒店,https://pdf.dfcfw.com/pdf/H3_AP202407081637689985_1.pdf?1720472969000.pdf
消费者服务行业周报：出入境旅游客流恢复旺盛,山西证券,2024-07-08,旅游酒店,https://pdf.dfcfw.com/pdf/H3_AP202407081637692093_1.pdf?1720519465000.pdf
消费者服务行业双周报：出入境游利好不断，关注暑期自然景区表现,东莞证券,2024-07-07,旅游酒店,https://pdf.dfcfw.com/pdf/H3_AP202407071637651024_1.pdf?1720379538000.pdf
社会服务行业专题研究：酒店板块财报总结,天风证券,2024-07-05,旅游酒店,https://pdf.dfcfw.com/pdf/H3_AP202407051637587674_1.pdf?1720193318000.pdf
旅游服务业行业周报：社服板块2024年中报前瞻,海通国际,2024-07-04,旅游酒店,https://pdf.dfcfw.com/pdf/H3_AP202407041637539763_1.pdf?1720124090000.pdf
社会服务行业2024年中期策略：需求分层、理性消费、体验为王，文旅新玩法促进旅游消费释放,山西证券,2024-07-04,旅游酒店,https://pdf.dfcfw.com/pdf/H3_AP202407041637547847_1.pdf?1720098827000.pdf
社会服务行业月报：暑期旅游量升价跌趋势延续，重点关注西北旅游目的地,中国银河,2024-07-03,旅游酒店,https://pdf.dfcfw.com/pdf/H3_AP202407031637502358_1.pdf?1720016689000.pdf
消费行业月报：服务消费“正升级”,五矿证券,2024-07-03,旅游酒店,https://pdf.dfcfw.com/pdf/H3_AP202407031637498699_1.pdf?1720006084000.pdf
社会服务行业双周报（第84期）：免签入境国家范围继续扩大，海底捞宣布管理层调整,国信证券,2024-07-02,旅游酒店,https://pdf.dfcfw.com/pdf/H3_AP202407021637449078_1.pdf?1719904421000.pdf
社会服务行业·周观点：新政助力旅游景气度提升，暑期游产品供给丰富,中航证券,2024-07-01,旅游酒店,https://pdf.dfcfw.com/pdf/H3_AP202407011637127054_1.pdf?1719821919000.pdf
社服行业周报：自港澳进境免税额度提高，关注旺季文旅消费,上海证券,2024-07-01,旅游酒店,https://pdf.dfcfw.com/pdf/H3_AP202407011637125374_1.pdf?1719818040000.pdf
社会服务行业双周报：板块近期回调明显，免签利好仍在持续,中银证券,2024-07-01,旅游酒店,https://pdf.dfcfw.com/pdf/H3_AP202407011637133792_1.pdf?1719841720000.pdf
社服周观点：开封137家文艺类校外培训机构获办学资质，港澳进境居民行李免税额度提升,民生证券,2024-06-30,旅游酒店,https://pdf.dfcfw.com/pdf/H3_AP202406301637063884_1.pdf?1719709160000.pdf
社会服务行业周报：IP毛绒治愈需求全球升温，即时零售服务持续繁荣,开源证券,2024-06-30,旅游酒店,https://pdf.dfcfw.com/pdf/H3_AP202406301637118290_1.pdf?1719788505000.pdf
现制饮品行业深度报告：掘金新茶饮时代：聚焦供应链、高坪效与强品牌,万联证券,2024-06-28,旅游酒店,https://pdf.dfcfw.com/pdf/H3_AP202406281636995325_1.pdf?1719570883000.pdf
