研报名称,机构名称,发布时间,行业,研报地址
有色金属行业海外研究系列深度报告：印度：金属需求增量的主战场,民生证券,2024-01-16,有色金属,https://pdf.dfcfw.com/pdf/H3_AP202401161617514530_1.pdf?1705424715000.pdf
增量资金投资确定性：铜等工业金属需求韧性叠加低库存造就价格维持高位，估值修复可期,东吴证券,2024-01-16,有色金属,https://pdf.dfcfw.com/pdf/H3_AP202401161617513616_1.pdf?1705423219000.pdf
钨精矿 头豹词条报告系列,头豹研究院,2024-01-16,有色金属,https://pdf.dfcfw.com/pdf/H3_AP202401161617522473_1.pdf?1705441754000.pdf
金属与材料行业研究周报：避险情绪升温，金价有所上涨,天风证券,2024-01-15,有色金属,https://pdf.dfcfw.com/pdf/H3_AP202401151617485909_1.pdf?1705315891000.pdf
有色金属行业点评报告：最差预期时刻已过，锂矿板块酝酿反弹,中国银河,2024-01-15,有色金属,https://pdf.dfcfw.com/pdf/H3_AP202401151617485509_1.pdf?1705308178000.pdf
能源：2023年12月中国新屋开工面积为4898万平方米，同比下降1.73%，环比上升67.57%,海通国际,2024-01-15,有色金属,https://pdf.dfcfw.com/pdf/H3_AP202401151617486860_1.pdf?1705336497000.pdf
有色金属周报：避险情绪和通胀数据对冲，金价震荡上行,德邦证券,2024-01-15,有色金属,https://pdf.dfcfw.com/pdf/H3_AP202401151617487321_1.pdf?1705314950000.pdf
有色金属行业周报：节前备库推升锑价,中泰证券,2024-01-15,有色金属,https://pdf.dfcfw.com/pdf/H3_AP202401151617487404_1.pdf?1705312042000.pdf
有色金属行业周报：美国通胀保持粘性，大宗整体承压，避险驱动下贵金属获得支撑,中泰证券,2024-01-15,有色金属,https://pdf.dfcfw.com/pdf/H3_AP202401151617487425_1.pdf?1705313818000.pdf
有色金属行业周报：从区域看有色：四川：资源富集 前景可期,爱建证券,2024-01-15,有色金属,https://pdf.dfcfw.com/pdf/H3_AP202401151617487522_1.pdf?1705313598000.pdf
有色金属行业周报：美国CPI略超预期，不改贵金属长牛逻辑,华鑫证券,2024-01-15,有色金属,https://pdf.dfcfw.com/pdf/H3_AP202401151617489071_1.pdf?1705318491000.pdf
有色金属与钢铁行业双周报：澳矿停产叠加智利盐湖扰动，锂盐价格下跌速度趋缓,东莞证券,2024-01-15,有色金属,https://pdf.dfcfw.com/pdf/H3_AP202401151617484888_1.pdf?1705339752000.pdf
有色金属行业研究：大宗及贵金属周报：美国CPI不改降息预期，关注黄金股右侧配置期,国金证券,2024-01-15,有色金属,https://pdf.dfcfw.com/pdf/H3_AP202401151617485106_1.pdf?1705315994000.pdf
有色金属行业周报：美国CPI、PPI数据超预期，看好金价上涨长逻辑,华金证券,2024-01-15,有色金属,https://pdf.dfcfw.com/pdf/H3_AP202401151617485458_1.pdf?1705311010000.pdf
有色金属行业周报：通胀预期反复不改降息预期，22年以来首次战略性看多锂板块的反转机会,华福证券,2024-01-15,有色金属,https://pdf.dfcfw.com/pdf/H3_AP202401151617485861_1.pdf?1705313294000.pdf
有色与新材料周报：高成本锂矿开启出清，建议关注锂资源估值修复行情,平安证券,2024-01-15,有色金属,https://pdf.dfcfw.com/pdf/H3_AP202401151617485884_1.pdf?1705313459000.pdf
有色金属周度报告：美国通胀反复不改降息预期，黄金配置价值仍然凸显,信达证券,2024-01-15,有色金属,https://pdf.dfcfw.com/pdf/H3_AP202401141617484422_1.pdf?1705312847000.pdf
有色金属行业周报：国内流动性宽松预期持续，锂价磨底阶段关注节后需求,国投证券,2024-01-15,有色金属,https://pdf.dfcfw.com/pdf/H3_AP202401141617484446_1.pdf?1705308789000.pdf
工业金属：锡价有望上行，聚焦行业龙头,国联证券,2024-01-15,有色金属,https://pdf.dfcfw.com/pdf/H3_AP202401151617503299_1.pdf?1705354664000.pdf
2024年有色金属年度策略：良时正可用,国投证券,2024-01-14,有色金属,https://pdf.dfcfw.com/pdf/H3_AP202401131617440395_1.pdf?1705228395000.pdf
有色金属行业跟踪周报：美国通胀预期反复扰动，但不改经济降温趋势，黄金及工业金属价格有所回落,东吴证券,2024-01-14,有色金属,https://pdf.dfcfw.com/pdf/H3_AP202401131617482757_1.pdf?1705225811000.pdf
有色金属周报：降息预期反复，商品价格涨跌不一,民生证券,2024-01-14,有色金属,https://pdf.dfcfw.com/pdf/H3_AP202401141617483392_1.pdf?1705245341000.pdf
有色金属2023年报业绩前瞻：铜铝板块表现或更优,国联证券,2024-01-14,有色金属,https://pdf.dfcfw.com/pdf/H3_AP202401141617483409_1.pdf?1705248456000.pdf
有色金属行业周报：美国通胀高于预期，锂矿供应扰动频频,华安证券,2024-01-14,有色金属,https://pdf.dfcfw.com/pdf/H3_AP202401141617483957_1.pdf?1705252896000.pdf
有色金属行业点评报告：智利盐湖是全球锂矿供给基石，关注抗议活动影响,开源证券,2024-01-12,有色金属,https://pdf.dfcfw.com/pdf/H3_AP202401121617296959_1.pdf?1705047660000.pdf
新材料系列报告（一）：固态电池潜力获验证，关注动力电池金属新需求,国投证券,2024-01-12,有色金属,https://pdf.dfcfw.com/pdf/H3_AP202401121617337048_1.pdf?1705091496000.pdf
铝系列专题一：氧化铝供给趋紧，关注高自给率铝企,华安证券,2024-01-11,有色金属,https://pdf.dfcfw.com/pdf/H3_AP202401111617257920_1.pdf?1704992132000.pdf
小金属行业点评报告：Finniss锂矿宣布采矿停止，首个澳矿减停产出现,华鑫证券,2024-01-11,有色金属,https://pdf.dfcfw.com/pdf/H3_AP202401111617260572_1.pdf?1704995470000.pdf
有色金属行业周报：不必纠结短期内的降息博弈，看好黄金,上海证券,2024-01-11,有色金属,https://pdf.dfcfw.com/pdf/H3_AP202401111617233787_1.pdf?1704964353000.pdf
稀土行业深度报告：供需格局重塑，稀土战略价值持续提升,华福证券,2024-01-10,有色金属,https://pdf.dfcfw.com/pdf/H3_AP202401101616987112_1.pdf?1704878913000.pdf
稀土铝中间合金 头豹词条报告系列,头豹研究院,2024-01-10,有色金属,https://pdf.dfcfw.com/pdf/H3_AP202401101617064780_1.pdf?1704916963000.pdf
铜行业深度报告（二）：铜的刺激价格,开源证券,2024-01-09,有色金属,https://pdf.dfcfw.com/pdf/H3_AP202401091616858823_1.pdf?1704788690000.pdf
有色金属行业周报：美联储再放鹰派言论，压制工业金属价格,华金证券,2024-01-08,有色金属,https://pdf.dfcfw.com/pdf/H3_AP202401081616762860_1.pdf?1704715126000.pdf
有色与新材料周报：重视工业金属原料端紧缺行情演绎,平安证券,2024-01-08,有色金属,https://pdf.dfcfw.com/pdf/H3_AP202401081616764344_1.pdf?1704726625000.pdf
有色金属：有色板块有哪些静态高分红+动态景气周期向上的标的？,中泰证券,2024-01-08,有色金属,https://pdf.dfcfw.com/pdf/H3_AP202401081616764348_1.pdf?1704727153000.pdf
有色金属1月周专题：稀土永磁：资源整合稳步推进，下游需求保持高增,国联证券,2024-01-08,有色金属,https://pdf.dfcfw.com/pdf/H3_AP202401081616769234_1.pdf?1704735978000.pdf
钕铁硼永磁材料 头豹词条报告系列,头豹研究院,2024-01-08,有色金属,https://pdf.dfcfw.com/pdf/H3_AP202401081616773023_1.pdf?1704744459000.pdf
稀土第三代永磁材料 头豹词条报告系列,头豹研究院,2024-01-08,有色金属,https://pdf.dfcfw.com/pdf/H3_AP202401081616773024_1.pdf?1704744371000.pdf
铝电解电容器 头豹词条报告系列,头豹研究院,2024-01-08,有色金属,https://pdf.dfcfw.com/pdf/H3_AP202401081616773027_1.pdf?1704743222000.pdf
有色金属行业周报：美国就业市场韧性仍存，关注氧化铝供给异动,华安证券,2024-01-08,有色金属,https://pdf.dfcfw.com/pdf/H3_AP202401071616757731_1.pdf?1704702382000.pdf
有色金属行业报告：锑价创去年4月以来新高，有望开启新一轮上涨,中邮证券,2024-01-08,有色金属,https://pdf.dfcfw.com/pdf/H3_AP202401071616758081_1.pdf?1704703527000.pdf
有色金属行业周报：美元指数反弹金属价格承压，PSL支持重启政策驱动积极,国投证券,2024-01-08,有色金属,https://pdf.dfcfw.com/pdf/H3_AP202401071616758290_1.pdf?1704711284000.pdf
2024年国内铜企增量一览,中邮证券,2024-01-08,有色金属,https://pdf.dfcfw.com/pdf/H3_AP202401071616758300_1.pdf?1704710970000.pdf
有色金属行业周报：关于降息的交易拉扯影响短期金属价格，长期仍看好金铝铜,华福证券,2024-01-08,有色金属,https://pdf.dfcfw.com/pdf/H3_AP202401081616758750_1.pdf?1704701101000.pdf
金属与材料行业研究周报：电机系列之四：碳纤维转子匹配电机高速化需求，产业密集推进,天风证券,2024-01-08,有色金属,https://pdf.dfcfw.com/pdf/H3_AP202401081616758921_1.pdf?1704708449000.pdf
有色金属周报：非农超预期，维持黄金慢牛判断,德邦证券,2024-01-08,有色金属,https://pdf.dfcfw.com/pdf/H3_AP202401081616759576_1.pdf?1704702766000.pdf
有色行业周报：高股息受追捧，持续推铜铝高股息标的,西南证券,2024-01-08,有色金属,https://pdf.dfcfw.com/pdf/H3_AP202401081616760177_1.pdf?1704707533000.pdf
有色金属行业周报：美联储激进降息预期减弱引发金价回调，建议关注高股息有色个股,中国银河,2024-01-08,有色金属,https://pdf.dfcfw.com/pdf/H3_AP202401081616759988_1.pdf?1704707439000.pdf
有色金属行业周报：澳大利亚锂矿出现减产信号,中泰证券,2024-01-08,有色金属,https://pdf.dfcfw.com/pdf/H3_AP202401081616761344_1.pdf?1704709017000.pdf
2024金属&新材料年度策略报告：加息末期，金属走强,信达证券,2024-01-08,有色金属,https://pdf.dfcfw.com/pdf/H3_AP202401081616761454_1.pdf?1704710077000.pdf
有色金属行业周报：怎么看2023年个股涨跌幅？,爱建证券,2024-01-08,有色金属,https://pdf.dfcfw.com/pdf/H3_AP202401081616761664_1.pdf?1704709446000.pdf
金属与材料行业研究周报：氧化铝价格高位回调，驱动铝价回落,天风证券,2024-01-07,有色金属,https://pdf.dfcfw.com/pdf/H3_AP202401071616757329_1.pdf?1704636749000.pdf
金属行业1月投资策略：供给侧扰动频发，看好工业金属和黄金,国信证券,2024-01-07,有色金属,https://pdf.dfcfw.com/pdf/H3_AP202401071616757640_1.pdf?1704652628000.pdf
大宗及贵金属周报：非农超预期，黄金股右侧布局期,国金证券,2024-01-07,有色金属,https://pdf.dfcfw.com/pdf/H3_AP202401071616757637_1.pdf?1704646448000.pdf
有色金属行业跟踪周报：美国就业市场超预期火热，降息预期有所缓和，工业金属价格表现不佳,东吴证券,2024-01-07,有色金属,https://pdf.dfcfw.com/pdf/H3_AP202401071616756944_1.pdf?1704626757000.pdf
有色金属周报：央行重启投放PSL，重视海外基建对金属需求的提升,民生证券,2024-01-07,有色金属,https://pdf.dfcfw.com/pdf/H3_AP202401071616756951_1.pdf?1704633021000.pdf
有色金属行业月报：美联储继续暂停加息，金属价格区间震荡,中原证券,2024-01-05,有色金属,https://pdf.dfcfw.com/pdf/H3_AP202401051616540730_1.pdf?1704447355000.pdf
有色金属2024年度策略报告：经济温和复苏，静待上行周期,财信证券,2024-01-04,有色金属,https://pdf.dfcfw.com/pdf/H3_AP202401041616342991_1.pdf?1704387361000.pdf
金属与材料行业年度策略,天风证券,2024-01-03,有色金属,https://pdf.dfcfw.com/pdf/H3_AP202401031616127110_1.pdf?1704275270000.pdf
铝行业周报：基本面持续向好，关注板块投资机会,国海证券,2024-01-02,有色金属,https://pdf.dfcfw.com/pdf/H3_AP202401021615919306_1.pdf?1704214628000.pdf
有色与新材料周报：建议关注稀土产业底部机会,平安证券,2024-01-02,有色金属,https://pdf.dfcfw.com/pdf/H3_AP202401021615912916_1.pdf?1704191337000.pdf
有色金属周报：行业领涨，顺周期机会显现,德邦证券,2024-01-02,有色金属,https://pdf.dfcfw.com/pdf/H3_AP202401021615913075_1.pdf?1704183705000.pdf
有色金属行业周报：降息预期延续，宏观利好推动金属价格普涨，国内金铜铝股仍处于底部强推补涨机会,华福证券,2024-01-02,有色金属,https://pdf.dfcfw.com/pdf/H3_AP202401021615913792_1.pdf?1704188040000.pdf
有色金属行业周报：河北、河南地区再生铜杆企业被迫停产，1-11月电解铝进口总量同比增加,海通国际,2024-01-02,有色金属,https://pdf.dfcfw.com/pdf/H3_AP202401021615913826_1.pdf?1704237340000.pdf
有色金属行业周报：锂价继续磨底，板块逐渐进入左侧布局阶段,中泰证券,2024-01-02,有色金属,https://pdf.dfcfw.com/pdf/H3_AP202401021615914597_1.pdf?1704190471000.pdf
有色金属行业周报：美联储降息预期进一步升温，板块上行再获支撑,中泰证券,2024-01-02,有色金属,https://pdf.dfcfw.com/pdf/H3_AP202401021615914593_1.pdf?1704190167000.pdf
有色金属行业周报：从区域看有色：陕西：资源丰特色强产业兴,爱建证券,2024-01-02,有色金属,https://pdf.dfcfw.com/pdf/H3_AP202401021615915005_1.pdf?1704192499000.pdf
有色金属12月行业动态报告：多重利好齐聚，推动年底有色金属价格上行,中国银河,2024-01-02,有色金属,https://pdf.dfcfw.com/pdf/H3_AP202401021615918178_1.pdf?1704212418000.pdf
有色金属行业报告：美联储降息或将提前，下游需求进入淡季,中邮证券,2024-01-02,有色金属,https://pdf.dfcfw.com/pdf/H3_AP202401011615911148_1.pdf?1704184133000.pdf
金属与材料行业研究周报：宏观情绪偏暖叠加事件催化，铝价延续涨势,天风证券,2024-01-02,有色金属,https://pdf.dfcfw.com/pdf/H3_AP202401021615911905_1.pdf?1704188219000.pdf
有色金属行业周报：降息预期升温叠加国内流动性宽松，金属震荡偏强,国投证券,2024-01-02,有色金属,https://pdf.dfcfw.com/pdf/H3_AP202401011615911057_1.pdf?1704183705000.pdf
有色金属与钢铁行业双周报：美联储放缓加息背景下，金属价格上涨具备动力,东莞证券,2024-01-01,有色金属,https://pdf.dfcfw.com/pdf/H3_AP202401011615910601_1.pdf?1704124130000.pdf
有色金属周报：降息预期持续走强，金属价格继续吹响进攻号角,民生证券,2024-01-01,有色金属,https://pdf.dfcfw.com/pdf/H3_AP202312311615849053_1.pdf?1704101822000.pdf
有色行业周报：分母端扩张可期，持续推荐黄金铜铝,西南证券,2024-01-01,有色金属,https://pdf.dfcfw.com/pdf/H3_AP202401011615910806_1.pdf?1704127358000.pdf
有色金属行业跟踪周报：红海局势扰动能源价格，氧化铝供给收缩预期推动铝价上行,东吴证券,2023-12-31,有色金属,https://pdf.dfcfw.com/pdf/H3_AP202312311615848631_1.pdf?1704105346000.pdf
有色金属2024年度投资策略：顺周期金属积极可为，新能源钴锂否极泰来,国联证券,2023-12-29,有色金属,https://pdf.dfcfw.com/pdf/H3_AP202312291615469852_1.pdf?1703846405000.pdf
2024年度有色金属行业策略报告：加息尾声坚守黄金，需求复苏左侧布局顺周期,华福证券,2023-12-29,有色金属,https://pdf.dfcfw.com/pdf/H3_AP202312291615472890_1.pdf?1703855819000.pdf
有色金属行业双周报：基本金属需求预期在改善,国泰君安证券(香港),2023-12-28,有色金属,https://pdf.dfcfw.com/pdf/H3_AP202312281615149030_1.pdf?1703773455000.pdf
有色周汇报：碳酸锂期货波动加剧，铜铝价格小幅回落,南京证券,2023-12-28,有色金属,https://pdf.dfcfw.com/pdf/H3_AP202312281615149067_1.pdf?1703774517000.pdf
有色金属行业周报：铜铝供给扰动，黄金受益于地缘政治冲突,上海证券,2023-12-27,有色金属,https://pdf.dfcfw.com/pdf/H3_AP202312271614995070_1.pdf?1703662559000.pdf
有色金属行业专题：锗-重要卫星金属之一，我国星链计划有望为锗带来较大需求增量,德邦证券,2023-12-27,有色金属,https://pdf.dfcfw.com/pdf/H3_AP202312271614997680_1.pdf?1703666381000.pdf
液冷板行业深度报告：“一体两翼”，液冷板需求放量,民生证券,2023-12-27,有色金属,https://pdf.dfcfw.com/pdf/H3_AP202312271615023350_1.pdf?1703695355000.pdf
铝行业周报：去库与涨价持续，关注板块投资机会,国海证券,2023-12-26,有色金属,https://pdf.dfcfw.com/pdf/H3_AP202312261614901196_1.pdf?1703584949000.pdf
有色金属周报：美核心PCE超预期降温，持续布局贵金属,德邦证券,2023-12-25,有色金属,https://pdf.dfcfw.com/pdf/H3_AP202312251614885321_1.pdf?1703501472000.pdf
有色金属行业周报：从区域看有色：安徽：资源丰富产业集群,爱建证券,2023-12-25,有色金属,https://pdf.dfcfw.com/pdf/H3_AP202312251614885341_1.pdf?1703511461000.pdf
有色金属12月周专题：铝：从供需、盈利、估值角度分析行业预期差,国联证券,2023-12-25,有色金属,https://pdf.dfcfw.com/pdf/H3_AP202312251614885491_1.pdf?1703506918000.pdf
有色金属：资源为王：全球锂矿23年三季报更新,国投证券,2023-12-25,有色金属,https://pdf.dfcfw.com/pdf/H3_AP202312251614885553_1.pdf?1703511115000.pdf
稀土镁合金 头豹词条报告系列,头豹研究院,2023-12-25,有色金属,https://pdf.dfcfw.com/pdf/H3_AP202312251614893607_1.pdf?1703533528000.pdf
金属与材料行业研究周报：库存去化叠加几内亚铝土矿事件催化，铝价大涨,天风证券,2023-12-25,有色金属,https://pdf.dfcfw.com/pdf/H3_AP202312251614882259_1.pdf?1706284999000.pdf
有色与新材料周报：PEEK材料符合轻量化趋势，需求空间有望打开,平安证券,2023-12-25,有色金属,https://pdf.dfcfw.com/pdf/H3_AP202312251614882597_1.pdf?1703514062000.pdf
有色金属行业周报：美国通胀持续降温，铀价触及周期高点,中邮证券,2023-12-25,有色金属,https://pdf.dfcfw.com/pdf/H3_AP202312251614884405_1.pdf?1703514999000.pdf
有色金属：2023年11月全球原铝产量为589.3万吨，同比上升4.15%，环比下降3.65%,海通国际,2023-12-25,有色金属,https://pdf.dfcfw.com/pdf/H3_AP202312251614884445_1.pdf?1703518822000.pdf
金属与材料行业研究周报：电机系列之三：薄型化+自粘结成为驱动电机硅钢片发展趋势,天风证券,2023-12-25,有色金属,https://pdf.dfcfw.com/pdf/H3_AP202312251614885223_1.pdf?1703513647000.pdf
有色金属行业周报：美国通胀再降温，继续推荐黄金,华福证券,2023-12-25,有色金属,https://pdf.dfcfw.com/pdf/H3_AP202312251614885256_1.pdf?1703501387000.pdf
有色行业周报：持续推荐黄金铜铝配置机会,西南证券,2023-12-25,有色金属,https://pdf.dfcfw.com/pdf/H3_AP202312251614885215_1.pdf?1703525465000.pdf
有色金属行业周报：几内亚供给扰动铝价走强，美元指数走弱提振金属价格,国投证券,2023-12-25,有色金属,https://pdf.dfcfw.com/pdf/H3_AP202312241614881232_1.pdf?1703495951000.pdf
有色金属周度报告：加息周期结束，政策托底下金属价格有望上行,信达证券,2023-12-25,有色金属,https://pdf.dfcfw.com/pdf/H3_AP202312241614881265_1.pdf?1703496683000.pdf
大宗及贵金属周报：几内亚能源问题发酵，成本端或支撑铝价上行,国金证券,2023-12-25,有色金属,https://pdf.dfcfw.com/pdf/H3_AP202312251614882214_1.pdf?1703515971000.pdf
有色金属行业周报：国内政策持续发力，美联储降息预期进一步升温，板块上行再获支撑,中泰证券,2023-12-24,有色金属,https://pdf.dfcfw.com/pdf/H3_AP202312241614880785_1.pdf?1703435470000.pdf
有色金属行业周报：供需双弱，锂价继续下行,中泰证券,2023-12-24,有色金属,https://pdf.dfcfw.com/pdf/H3_AP202312241614880786_1.pdf?1703435677000.pdf
有色金属行业跟踪周报：美国软着陆预期被进一步强化，日本维持宽松利率环境，海内外黄金价格上涨,东吴证券,2023-12-24,有色金属,https://pdf.dfcfw.com/pdf/H3_AP202312231614873285_1.pdf?1703414218000.pdf
有色金属行业：锑月度数据跟踪：11月锑品出口弱势依旧，进口锑矿回落明显,华福证券,2023-12-24,有色金属,https://pdf.dfcfw.com/pdf/H3_AP202312241614880444_1.pdf?1703429117000.pdf
有色金属行业：锡月度数据跟踪：精矿进口符合预期，国内精锡表观消费量创年内新高,华福证券,2023-12-24,有色金属,https://pdf.dfcfw.com/pdf/H3_AP202312241614880445_1.pdf?1703429228000.pdf
有色金属周报：加息周期结束金属价格走强，关注红海航线中断冲击,民生证券,2023-12-24,有色金属,https://pdf.dfcfw.com/pdf/H3_AP202312241614880392_1.pdf?1703423490000.pdf
锂产业链月度追踪：11月碳酸锂进口激增致锂价承压，锂价不乐观股票不悲观,华福证券,2023-12-22,有色金属,https://pdf.dfcfw.com/pdf/H3_AP202312221614810205_1.pdf?1703235174000.pdf
有色金属行业周报：降息渐进，有色板块有望上涨,上海证券,2023-12-22,有色金属,https://pdf.dfcfw.com/pdf/H3_AP202312221614811798_1.pdf?1703235419000.pdf
铜月度数据跟踪：矿端扰动加剧，供需偏紧提振铜价,华福证券,2023-12-22,有色金属,https://pdf.dfcfw.com/pdf/H3_AP202312221614811811_1.pdf?1703236456000.pdf
有色周汇报：美联储再次暂停加息，稀土指标超预期增加,南京证券,2023-12-22,有色金属,https://pdf.dfcfw.com/pdf/H3_AP202312221614817709_1.pdf?1703257304000.pdf
铝月度数据跟踪：淡季强去库，支撑高位铝价,华福证券,2023-12-22,有色金属,https://pdf.dfcfw.com/pdf/H3_AP202312221614811812_1.pdf?1703236240000.pdf
有色金属行业2024年度策略：外降息内复苏，黄金牛途在望，铜铝机会显现,德邦证券,2023-12-22,有色金属,https://pdf.dfcfw.com/pdf/H3_AP202312221614824528_1.pdf?1703268877000.pdf
黄金行业专题研究系列一：美联储本轮加息或已结束，2024年有望开启降息周期，黄金价格预期持续上行,源达信息,2023-12-21,有色金属,https://pdf.dfcfw.com/pdf/H3_AP202312211614650364_1.pdf?1703181862000.pdf
2024年工业金属铜年度策略：短镇痛、长双赢,东吴证券,2023-12-21,有色金属,https://pdf.dfcfw.com/pdf/H3_AP202312211614662211_1.pdf?1703188349000.pdf
有色金属行业周报：国内铝锭库存创年内新低，美联储24年或降息,海通国际,2023-12-20,有色金属,https://pdf.dfcfw.com/pdf/H3_AP202312201614557224_1.pdf?1703069797000.pdf
基本金属年度策略：供给弱弹性下的新旧需求动能转换,国金证券,2023-12-20,有色金属,https://pdf.dfcfw.com/pdf/H3_AP202312201614569214_1.pdf?1703060387000.pdf
有色金属行业周报：从中央经济工作会议看有色,爱建证券,2023-12-20,有色金属,https://pdf.dfcfw.com/pdf/H3_AP202312201614577995_1.pdf?1703068922000.pdf
中国钨制品行业市场规模测算逻辑模型 头豹词条报告系列,头豹研究院,2023-12-20,有色金属,https://pdf.dfcfw.com/pdf/H3_AP202312201614600042_1.pdf?1703100992000.pdf
有色金属行业周报：美联储降息提上讨论日程，黄金长期上涨逻辑或将开启,华鑫证券,2023-12-19,有色金属,https://pdf.dfcfw.com/pdf/H3_AP202312191614505222_1.pdf?1702976525000.pdf
有色金属行业2024年度策略：莫道浮云终蔽日，总有云开雾散时,中邮证券,2023-12-19,有色金属,https://pdf.dfcfw.com/pdf/H3_AP202312191614516418_1.pdf?1702984541000.pdf
金属与材料：新产品_新技术引领电子＆电力新材料增量空间,天风证券,2023-12-19,有色金属,https://pdf.dfcfw.com/pdf/H3_AP202312191614531912_1.pdf?1702999151000.pdf
2024年全球铜供给格局,中邮证券,2023-12-19,有色金属,https://pdf.dfcfw.com/pdf/H3_AP202312191614543915_1.pdf?1703019860000.pdf
有色金属12月周专题：锡：供给维持偏紧，需求多点开花,国联证券,2023-12-19,有色金属,https://pdf.dfcfw.com/pdf/H3_AP202312191614539254_1.pdf?1703009877000.pdf
有色金属周报：CPI增速放缓，持续看好贵金属投资机会,德邦证券,2023-12-19,有色金属,https://pdf.dfcfw.com/pdf/H3_AP202312191614504385_1.pdf?1702974193000.pdf
有色金属行业周报：黄金：短期的波动与长期的相对确定性,上海证券,2023-12-18,有色金属,https://pdf.dfcfw.com/pdf/H3_AP202312181614436203_1.pdf?1702905725000.pdf
金属与材料行业研究周报：联储态度转鸽，大宗金属价格大涨,天风证券,2023-12-18,有色金属,https://pdf.dfcfw.com/pdf/H3_AP202312181614436221_1.pdf?1702897990000.pdf
有色金属行业研究：大宗及贵金属周报：美联储释放宽松预期，持续去库支撑铝价,国金证券,2023-12-18,有色金属,https://pdf.dfcfw.com/pdf/H3_AP202312181614436732_1.pdf?1704129212000.pdf
有色金属与钢铁行业双周报：美联储释放偏鸽信号，金价引领有色金属价格上涨,东莞证券,2023-12-18,有色金属,https://pdf.dfcfw.com/pdf/H3_AP202312181614436743_1.pdf?1702895365000.pdf
有色金属行业周报：美联储态度转鸽，贵金属和基本金属普涨,华福证券,2023-12-18,有色金属,https://pdf.dfcfw.com/pdf/H3_AP202312181614436162_1.pdf?1702895680000.pdf
有色金属周度报告：美联储继续暂停加息，流动性宽松支撑金属价格上行,信达证券,2023-12-18,有色金属,https://pdf.dfcfw.com/pdf/H3_AP202312171614435172_1.pdf?1702885281000.pdf
有色金属行业报告：美联储“鸽派”表态，对俄制裁限制铀供应,中邮证券,2023-12-18,有色金属,https://pdf.dfcfw.com/pdf/H3_AP202312171614435207_1.pdf?1702888590000.pdf
有色金属行业周报：美联储释放降息预期，推动金价走高,华安证券,2023-12-18,有色金属,https://pdf.dfcfw.com/pdf/H3_AP202312171614435398_1.pdf?1702893761000.pdf
有色金属行业周报：降息预期渐浓，贵金属及工业金属企稳反弹,国投证券,2023-12-18,有色金属,https://pdf.dfcfw.com/pdf/H3_AP202312171614435566_1.pdf?1702893559000.pdf
有色金属行业投资策略：长宜为锚丘壑逢时，周期底位拥抱资源,开源证券,2023-12-18,有色金属,https://pdf.dfcfw.com/pdf/H3_AP202312181614439745_1.pdf?1702907082000.pdf
