研报名称,机构名称,发布时间,行业,研报地址
有色金属行业跟踪周报：供给端持续有效缩减，氧化铝价格拐点已至，电解铝利润端或开启上行,东吴证券,2024-12-28,有色金属,https://pdf.dfcfw.com/pdf/H3_AP202412281641461728_1.pdf?1735413940000.pdf
金属行业2025年投资展望：流动性周期切换叠加库存周期开启或催化金属行业强势周期再现,东兴证券,2024-12-26,有色金属,https://pdf.dfcfw.com/pdf/H3_AP202412261641438189_1.pdf?1735238146000.pdf
金属新材料行业2025年度策略：材料赋能新质生产力,天风证券,2024-12-26,有色金属,https://pdf.dfcfw.com/pdf/H3_AP202412261641440670_1.pdf?1735249644000.pdf
有色金属行业周报：美联储降息预期转鹰，贵金属短期价格波动可能加剧,华龙证券,2024-12-25,有色金属,https://pdf.dfcfw.com/pdf/H3_AP202412251641422411_1.pdf?1735120341000.pdf
有色金属脉动跟踪：矿业并购时代，交易方式如何选择？,五矿证券,2024-12-25,有色金属,https://pdf.dfcfw.com/pdf/H3_AP202412251641422113_1.pdf?1735120161000.pdf
有色金属行业专题：中资矿企风险勘查之路：破局与寻向,五矿证券,2024-12-24,有色金属,https://pdf.dfcfw.com/pdf/H3_AP202412241641408628_1.pdf?1735033570000.pdf
有色金属行业报告：12月议息会议后黄金有望重拾上涨动能,中邮证券,2024-12-24,有色金属,https://pdf.dfcfw.com/pdf/H3_AP202412241641410029_1.pdf?1735033153000.pdf
碳酸锂价震荡筑底，关注增量企业配置机会,华源证券,2024-12-23,有色金属,https://pdf.dfcfw.com/pdf/H3_AP202412231641390716_1.pdf?1734939552000.pdf
有色金属行业研究：大宗&贵金属周报：美元冲高回落，金属金融属性有望修复,国金证券,2024-12-23,有色金属,https://pdf.dfcfw.com/pdf/H3_AP202412231641392588_1.pdf?1734951967000.pdf
有色金属行业周报：美12月点阵图中值显示降息或放缓，多家矿企确定2025年铜精矿长单TC,华福证券,2024-12-23,有色金属,https://pdf.dfcfw.com/pdf/H3_AP202412231641392899_1.pdf?1734948449000.pdf
化工新材料行业周报：地缘冲突缓和，油价再度走跌,平安证券,2024-12-23,有色金属,https://pdf.dfcfw.com/pdf/H3_AP202412231641393183_1.pdf?1734951306000.pdf
有色金属与新材料周报：美联储降息符合市场预期，金价或进入震荡格局,平安证券,2024-12-23,有色金属,https://pdf.dfcfw.com/pdf/H3_AP202412231641393184_1.pdf?1734952372000.pdf
有色金属：美联储鹰派降息，国内宏观向好支撑金属价格,海通国际,2024-12-23,有色金属,https://pdf.dfcfw.com/pdf/H3_AP202412231641396620_1.pdf?1734973643000.pdf
铝金属行业运营情况跟踪及展望,大公国际,2024-12-23,有色金属,https://pdf.dfcfw.com/pdf/H3_AP202412231641397169_1.docx?1734972823000.docx
有色金属行业周报：鹰派降息落地，金属价格弱势震荡,太平洋,2024-12-23,有色金属,https://pdf.dfcfw.com/pdf/H3_AP202412231641393838_1.pdf?1734961316000.pdf
有色金属行业周报：美联储降息节奏将放缓，金属价格短期承压,中国银河,2024-12-23,有色金属,https://pdf.dfcfw.com/pdf/H3_AP202412231641393446_1.pdf?1734962151000.pdf
有色金属周报：降息节奏放缓，金属价格短期或偏震荡,民生证券,2024-12-22,有色金属,https://pdf.dfcfw.com/pdf/H3_AP202412211641388874_1.pdf?1734861741000.pdf
有色金属行业研究：稀土＆小金属周报：11月锑品出口有所恢复，继续关注钼去库,国金证券,2024-12-22,有色金属,https://pdf.dfcfw.com/pdf/H3_AP202412211641388869_1.pdf?1734865827000.pdf
有色金属大宗金属周报：美联储“鹰派降息” ，金价调整,华源证券,2024-12-22,有色金属,https://pdf.dfcfw.com/pdf/H3_AP202412221641389897_1.pdf?1734895162000.pdf
金属与材料行业研究周报：美联储鹰派降息，金银价格有所回落,天风证券,2024-12-22,有色金属,https://pdf.dfcfw.com/pdf/H3_AP202412221641389959_1.pdf?1734898981000.pdf
有色金属行业跟踪周报：美联储鹰派降息大幅削减25年利率下行空间，有色金属价格震荡弱势运行,东吴证券,2024-12-21,有色金属,https://pdf.dfcfw.com/pdf/H3_AP202412211641388850_1.pdf?1734818211000.pdf
有色金属行业研究：美国关税对我国铜铝出口影响几何？,国金证券,2024-12-21,有色金属,https://pdf.dfcfw.com/pdf/H3_AP202412211641388872_1.pdf?1734861866000.pdf
有色金属脉动跟踪：仍需关注降息预期+“特朗普交易”,五矿证券,2024-12-20,有色金属,https://pdf.dfcfw.com/pdf/H3_AP202412201641374370_1.pdf?1734707367000.pdf
铜金属行业运营情况跟踪及展望,大公国际,2024-12-20,有色金属,https://pdf.dfcfw.com/pdf/H3_AP202412201641376028_1.docx?1734713470000.docx
有色金属行业2025年投资策略：首推铝铜，长期看好黄金,西南证券,2024-12-20,有色金属,https://pdf.dfcfw.com/pdf/H3_AP202412201641376325_1.pdf?1734713021000.pdf
有色金属行业点评报告：美联储降息预期转鹰，贵金属价格震荡幅度或加剧,华龙证券,2024-12-20,有色金属,https://pdf.dfcfw.com/pdf/H3_AP202412201641380622_1.pdf?1734720048000.pdf
铝行业深度报告：这边风景独好，看好国内铝业持续成长,东海证券,2024-12-19,有色金属,https://pdf.dfcfw.com/pdf/H3_AP202412181641352078_1.pdf?1734590269000.pdf
金属行业2025年度投资策略系列报告之贵金属篇：金价牛市仍在途,民生证券,2024-12-19,有色金属,https://pdf.dfcfw.com/pdf/H3_AP202412181641352502_1.pdf?1734590950000.pdf
天然铀行业专题：沉寂已久的能源金属，周期来临,国信证券,2024-12-19,有色金属,https://pdf.dfcfw.com/pdf/H3_AP202412191641366319_1.pdf?1734639276000.pdf
有色金属行业点评报告：政策持续发力，关注工业金属需求回暖,华龙证券,2024-12-18,有色金属,https://pdf.dfcfw.com/pdf/H3_AP202412181641338979_1.pdf?1734509082000.pdf
2025年工业金属年度策略：供需基本面持续改善，财政扩张背景下关注上游资源品,东吴证券,2024-12-17,有色金属,https://pdf.dfcfw.com/pdf/H3_AP202412171641321874_1.pdf?1734421730000.pdf
有色金属行业周报：中央经济工作会议明确政策发力方向，关注工业金属需求回暖,华龙证券,2024-12-17,有色金属,https://pdf.dfcfw.com/pdf/H3_AP202412171641326527_1.pdf?1734435138000.pdf
有色金属行业周报：基本金属价格震荡回落，静待内需验证,太平洋,2024-12-17,有色金属,https://pdf.dfcfw.com/pdf/H3_AP202412171641332133_1.pdf?1734457425000.pdf
金属行业2025年度投资策略系列报告之工业金属篇：金石难摧，乾坤不易,民生证券,2024-12-17,有色金属,https://pdf.dfcfw.com/pdf/H3_AP202412171641335973_1.pdf?1734505495000.pdf
有色金属行业周报：美11月通胀符合预期增加降息概率，欧洲央行降息25个基点,华福证券,2024-12-16,有色金属,https://pdf.dfcfw.com/pdf/H3_AP202412161641308320_1.pdf?1734336398000.pdf
有色金属行业周报：国内经济政策定调积极，利好金属价格回升,中国银河,2024-12-16,有色金属,https://pdf.dfcfw.com/pdf/H3_AP202412161641309783_1.pdf?1734344824000.pdf
医药生物行业报告：12月议息会议后黄金有望重拾上涨动能,中邮证券,2024-12-16,有色金属,https://pdf.dfcfw.com/pdf/H3_AP202412161641310150_1.pdf?1734347149000.pdf
有色金属行业：中央经济工作会议点评——政策表态积极，利好有色金属景气向上,中国银河,2024-12-16,有色金属,https://pdf.dfcfw.com/pdf/H3_AP202412161641312954_1.pdf?1734365836000.pdf
非金属新材料行业深度研究：光刻胶材料攻坚：国产替代进行时，色浆最具预期差,天风证券,2024-12-16,有色金属,https://pdf.dfcfw.com/pdf/H3_AP202412161641315057_1.pdf?1734368735000.pdf
化工新材料行业周报：市场担忧俄罗斯石油受欧美新一轮制裁，油价应声上涨,平安证券,2024-12-16,有色金属,https://pdf.dfcfw.com/pdf/H3_AP202412161641316312_1.pdf?1734371105000.pdf
有色金属行业：澳洲锂矿，降本减产中求生存,海通国际,2024-12-16,有色金属,https://pdf.dfcfw.com/pdf/H3_AP202412161641311286_1.pdf?1734362456000.pdf
有色金属行业跟踪周报：美元指数携美债收益率录得大幅上行，黄金价格冲高回落重回整理区间,东吴证券,2024-12-15,有色金属,https://pdf.dfcfw.com/pdf/H3_AP202412151641306086_1.pdf?1734221474000.pdf
有色金属与新材料周报：氧化铝或临拐点，电解铝利润有望逐步修复,平安证券,2024-12-15,有色金属,https://pdf.dfcfw.com/pdf/H3_AP202412151641307434_1.pdf?1734291673000.pdf
有色金属行业周报：美国CPI符合预期，美联储进一步降息预期强化支撑金价,华鑫证券,2024-12-15,有色金属,https://pdf.dfcfw.com/pdf/H3_AP202412151641307774_1.pdf?1734301516000.pdf
大宗&贵金属周报：成本高企再致减产，国内政策利好铝价表现,国金证券,2024-12-15,有色金属,https://pdf.dfcfw.com/pdf/H3_AP202412151641306500_1.pdf?1734275609000.pdf
稀土&小金属周报：内外锑价分化空间或有限，关注锡、钼价格回升,国金证券,2024-12-15,有色金属,https://pdf.dfcfw.com/pdf/H3_AP202412151641306502_1.pdf?1734275714000.pdf
金属与材料行业研究周报：市场降息预期强烈，金银价格再次走高,天风证券,2024-12-15,有色金属,https://pdf.dfcfw.com/pdf/H3_AP202412151641306438_1.pdf?1734272716000.pdf
金属与材料行业专题研究：氧化物半固态电池需要多少锆？,天风证券,2024-12-15,有色金属,https://pdf.dfcfw.com/pdf/H3_AP202412151641306439_1.pdf?1734271461000.pdf
有色金属周报：美国通胀升温，金属价格短期或偏震荡,民生证券,2024-12-15,有色金属,https://pdf.dfcfw.com/pdf/H3_AP202412151641306615_1.pdf?1734284988000.pdf
有色金属年度策略：千帆过尽，向新而行,华安证券,2024-12-15,有色金属,https://pdf.dfcfw.com/pdf/H3_AP202412151641307006_1.pdf?1734285277000.pdf
有色金属 大宗金属周报：地缘政治反复，金价宽幅震荡,华源证券,2024-12-15,有色金属,https://pdf.dfcfw.com/pdf/H3_AP202412151641307178_1.pdf?1734299652000.pdf
能源金属&新材料周报：碳酸锂价震荡筑底，重点关注25年增量企业,华源证券,2024-12-15,有色金属,https://pdf.dfcfw.com/pdf/H3_AP202412151641307220_1.pdf?1734299973000.pdf
有色金属脉动跟踪：中国优势金属品种，谁主沉浮？,五矿证券,2024-12-13,有色金属,https://pdf.dfcfw.com/pdf/H3_AP202412131641286987_1.pdf?1734080763000.pdf
"有色金属行业研究：中国镓、锗、锑产业地位突出, 管制两用物项对美出口",源达信息,2024-12-13,有色金属,https://pdf.dfcfw.com/pdf/H3_AP202412131641297066_1.pdf?1734114774000.pdf
有色与新材料行业2025年年度策略报告：贵金属应势而上，顺周期恰逢其时,平安证券,2024-12-12,有色金属,https://pdf.dfcfw.com/pdf/H3_AP202412121641270898_1.pdf?1733994739000.pdf
有色金属行业周报：卫星相关的锗产业空间有多大？,五矿证券,2024-12-11,有色金属,https://pdf.dfcfw.com/pdf/H3_AP202412111641256599_1.pdf?1733916062000.pdf
有色行业周报：美国非农数据超预期，铜铝低库存支撑价格,甬兴证券,2024-12-10,有色金属,https://pdf.dfcfw.com/pdf/H3_AP202412101641239644_1.pdf?1733826125000.pdf
金属行业2025年投资策略：供稳需增，行情可期,国信证券,2024-12-10,有色金属,https://pdf.dfcfw.com/pdf/H3_AP202412101641250504_1.pdf?1733865379000.pdf
有色金属行业报告：央行增持黄金，继续看涨,中邮证券,2024-12-09,有色金属,https://pdf.dfcfw.com/pdf/H3_AP202412091641223088_1.pdf?1733742434000.pdf
有色金属：《关于加强相关两用物项对美国出口管制的公告》点评-出口管制升级，关键资源战略价值凸显,甬兴证券,2024-12-09,有色金属,https://pdf.dfcfw.com/pdf/H3_AP202412091641223107_1.pdf?1733742833000.pdf
铜行业快评：铜精矿长单加工费创历史新低，冶炼利润承压,国信证券,2024-12-09,有色金属,https://pdf.dfcfw.com/pdf/H3_AP202412091641225834_1.pdf?1733760283000.pdf
有色金属行业周报：降息预期再起，金属价格看涨,太平洋,2024-12-09,有色金属,https://pdf.dfcfw.com/pdf/H3_AP202412091641226705_1.pdf?1733762044000.pdf
有色金属行业周报：中国央行重启黄金购买，金价支撑边际变强,华鑫证券,2024-12-09,有色金属,https://pdf.dfcfw.com/pdf/H3_AP202412091641232188_1.pdf?1733774144000.pdf
有色金属行业周报：国内政策或将继续加码，金属价格有望上行,中国银河,2024-12-09,有色金属,https://pdf.dfcfw.com/pdf/H3_AP202412091641222895_1.pdf?1733752858000.pdf
有色金属行业周报：人民银行时隔6个月增持黄金，金价高位震荡,华龙证券,2024-12-09,有色金属,https://pdf.dfcfw.com/pdf/H3_AP202412091641233779_1.pdf?1733780118000.pdf
有色金属周报：中美重要会议临近，金属价格蓄势待发,民生证券,2024-12-08,有色金属,https://pdf.dfcfw.com/pdf/H3_AP202412071641219048_1.pdf?1733652648000.pdf
有色金属行业跟踪周报：中国央行时隔6个月再度买入黄金，看好黄金后续震荡上行走势,东吴证券,2024-12-08,有色金属,https://pdf.dfcfw.com/pdf/H3_AP202412081641219271_1.pdf?1733618235000.pdf
有色金属行业周报：中国央行11月增持黄金，安托法斯塔与江铜签订25年长单TC,华福证券,2024-12-08,有色金属,https://pdf.dfcfw.com/pdf/H3_AP202412081641220604_1.pdf?1733694197000.pdf
有色金属行业研究：大宗&贵金属周报：铜矿长单TC大幅回落，内需回升驱动铜价表现,国金证券,2024-12-08,有色金属,https://pdf.dfcfw.com/pdf/H3_AP202412081641219653_1.pdf?1733665484000.pdf
有色金属行业研究：稀土＆小金属周报：锑品对美出口收紧，继续关注战略金属价值重估,国金证券,2024-12-08,有色金属,https://pdf.dfcfw.com/pdf/H3_AP202412081641219654_1.pdf?1733665586000.pdf
有色金属 大宗金属周报：美国11月非农略超预期，金价窄幅震荡,华源证券,2024-12-08,有色金属,https://pdf.dfcfw.com/pdf/H3_AP202412081641220168_1.pdf?1733680382000.pdf
化工新材料行业周报：OPEC+再次延长减产计划，托底油价意愿较强,平安证券,2024-12-08,有色金属,https://pdf.dfcfw.com/pdf/H3_AP202412081641220185_1.pdf?1733681065000.pdf
金属与材料行业研究周报：非农就业数据提升降息预期，金价中枢有望进一步走高,天风证券,2024-12-08,有色金属,https://pdf.dfcfw.com/pdf/H3_AP202412081641219598_1.pdf?1733668320000.pdf
有色行业周报：美国核心通胀压力依然存在，三大白电需求向好,甬兴证券,2024-12-06,有色金属,https://pdf.dfcfw.com/pdf/H3_AP202412051641199155_1.pdf?1733473875000.pdf
有色金属脉动跟踪：并购与勘探，谁是矿业公司资源增长的主力军？,五矿证券,2024-12-06,有色金属,https://pdf.dfcfw.com/pdf/H3_AP202412061641203009_1.pdf?1733479225000.pdf
有色金属行业11月行业动态报告：宏观政策扰动有色金属行业景气度,中国银河,2024-12-05,有色金属,https://pdf.dfcfw.com/pdf/H3_AP202412051641189960_1.pdf?1733411261000.pdf
有色金属周度观察,国新证券股份,2024-12-05,有色金属,https://pdf.dfcfw.com/pdf/H3_AP202412051641190323_1.pdf?1733422211000.pdf
有色金属行业2025年度策略报告：新年启幕 欣然迎变,国开证券,2024-12-04,有色金属,https://pdf.dfcfw.com/pdf/H3_AP202412041641173373_1.pdf?1733307169000.pdf
有色金属行业2025年度投资策略报告：黄金或震荡上行，关注工业金属需求回暖,华龙证券,2024-12-04,有色金属,https://pdf.dfcfw.com/pdf/H3_AP202412041641174683_1.pdf?1733318369000.pdf
有色金属行业事件点评：出口管制趋严，小金属战略地位凸显,东莞证券,2024-12-04,有色金属,https://pdf.dfcfw.com/pdf/H3_AP202412041641178214_1.pdf?1733331328000.pdf
中国白银行业市场规模测算逻辑模型 头豹词条报告系列,头豹研究院,2024-12-04,有色金属,https://pdf.dfcfw.com/pdf/H3_AP202412041641182722_1.pdf?1733340893000.pdf
有色金属脉动跟踪：地缘冲突升级，金价走强,五矿证券,2024-12-03,有色金属,https://pdf.dfcfw.com/pdf/H3_AP202412031641155637_1.pdf?1733221577000.pdf
有色金属行业：国内制造业回暖有望助推工业金属需求,海通国际,2024-12-03,有色金属,https://pdf.dfcfw.com/pdf/H3_AP202412031641160363_1.pdf?1733241859000.pdf
稀土：历尽千帆，迎接新周期,海通国际,2024-12-03,有色金属,https://pdf.dfcfw.com/pdf/H3_AP202412031641160370_1.pdf?1733242128000.pdf
有色金属行业周报：短期事件催化，主要金属价格震荡,华龙证券,2024-12-03,有色金属,https://pdf.dfcfw.com/pdf/H3_AP202412031641163425_1.pdf?1733253446000.pdf
海外黄金股观察系列之十一：伊格尔矿业：并购成功典范，实现跨越发展,民生证券,2024-12-03,有色金属,https://pdf.dfcfw.com/pdf/H3_AP202412031641163548_1.pdf?1733247139000.pdf
中国高速铜连接行业市场规模测算逻辑模型 头豹词条报告系列,头豹研究院,2024-12-03,有色金属,https://pdf.dfcfw.com/pdf/H3_AP202412031641167001_1.pdf?1733257003000.pdf
有色金属行业周报：美元高位回落，金属价格有望反弹,太平洋,2024-12-02,有色金属,https://pdf.dfcfw.com/pdf/H3_AP202412021641137468_1.pdf?1733154192000.pdf
有色金属行业周报：供需较好，短期铜价有向上修复空间,华鑫证券,2024-12-02,有色金属,https://pdf.dfcfw.com/pdf/H3_AP202412021641137471_1.pdf?1733154192000.pdf
有色金属行业投资策略：把握有色供需转折，聚焦黑色供给变革,开源证券,2024-12-02,有色金属,https://pdf.dfcfw.com/pdf/H3_AP202412021641138533_1.pdf?1733156922000.pdf
有色金属行业报告：氧化铝紧缺状态或缓解，看好电解铝利润修复,中邮证券,2024-12-02,有色金属,https://pdf.dfcfw.com/pdf/H3_AP202412021641141346_1.pdf?1733172540000.pdf
中国AI+金属材料行业市场规模测算逻辑模型 头豹词条报告系列,头豹研究院,2024-12-02,有色金属,https://pdf.dfcfw.com/pdf/H3_AP202412021641146927_1.pdf?1733169065000.pdf
基本金属2025年度策略：供改红利兑现，铝业长牛可期,国金证券,2024-12-02,有色金属,https://pdf.dfcfw.com/pdf/H3_AP202412021641136366_1.pdf?1733153519000.pdf
有色金属2024年三季报业绩分析报告：黄金、铜、铝、铅锌、锡板块前三季度归母净利润同比均增长,甬兴证券,2024-12-01,有色金属,https://pdf.dfcfw.com/pdf/H3_AP202411301641128878_1.pdf?1733046225000.pdf
有色金属周报：美元高位回落，期待金属价格反弹,民生证券,2024-12-01,有色金属,https://pdf.dfcfw.com/pdf/H3_AP202412011641129210_1.pdf?1733052890000.pdf
大宗&贵金属周报：短期废铜供应再趋紧，原料支撑铜价表现,国金证券,2024-12-01,有色金属,https://pdf.dfcfw.com/pdf/H3_AP202412011641130138_1.pdf?1733075222000.pdf
化工新材料行业周报：强美元预期和高利率环境延续或对油价形成一定压制,平安证券,2024-12-01,有色金属,https://pdf.dfcfw.com/pdf/H3_AP202412011641130427_1.pdf?1733080723000.pdf
有色金属行业周报：宏观扰动加剧波动，供需紧缺支撑氧化铝价格,华福证券,2024-12-01,有色金属,https://pdf.dfcfw.com/pdf/H3_AP202412011641130519_1.pdf?1733084483000.pdf
有色金属 大宗金属周报：地缘政治反复，金价震荡,华源证券,2024-12-01,有色金属,https://pdf.dfcfw.com/pdf/H3_AP202412011641130615_1.pdf?1733091816000.pdf
有色行业周报：俄乌战事升级黄金价格反弹，强美元压制商品价格,甬兴证券,2024-12-01,有色金属,https://pdf.dfcfw.com/pdf/H3_AP202412011641130622_1.pdf?1733131367000.pdf
澳大利亚铝委提倡将铝土矿等纳入《关键矿产清单》点评：铝资源战略价值将得到进一步提高,甬兴证券,2024-12-01,有色金属,https://pdf.dfcfw.com/pdf/H3_AP202412011641130624_1.pdf?1733091161000.pdf
金属与材料行业研究周报：俄乌紧张局势加剧特朗普关税威胁，金银价格震荡调整,天风证券,2024-12-01,有色金属,https://pdf.dfcfw.com/pdf/H3_AP202412011641130384_1.pdf?1733080625000.pdf
有色金属与新材料周报：铜铝基本面支撑坚强，待宏观进一步驱动,平安证券,2024-12-01,有色金属,https://pdf.dfcfw.com/pdf/H3_AP202412011641130533_1.pdf?1733085558000.pdf
有色金属行业研究：稀土＆小金属周报：关注钼去库，继续看好锑价上行趋势,国金证券,2024-12-01,有色金属,https://pdf.dfcfw.com/pdf/H3_AP202412011641129424_1.pdf?1733061483000.pdf
电解铝行业专题：供不应求的矛盾即将凸显,国信证券,2024-12-01,有色金属,https://pdf.dfcfw.com/pdf/H3_AP202412011641129498_1.pdf?1733061371000.pdf
有色金属行业跟踪周报：市场开始交易海外通胀回落，贵金属资产价格回落，工业金属录得环比上涨,东吴证券,2024-11-30,有色金属,https://pdf.dfcfw.com/pdf/H3_AP202411301641129036_1.pdf?1733007790000.pdf
铝土矿及氧化铝行业专题报告：海内外供应干扰加剧，铝土矿资源价值凸显,华鑫证券,2024-11-29,有色金属,https://pdf.dfcfw.com/pdf/H3_AP202411281641110273_1.pdf?1732865413000.pdf
有色金属行业研究：战略金属2025年度策略：价格价值双牛市，百般红紫斗芳菲,国金证券,2024-11-29,有色金属,https://pdf.dfcfw.com/pdf/H3_AP202411291641119808_1.pdf?1732903356000.pdf
中国冶金级氧化铝行业市场规模测算逻辑模型 头豹词条报告系列,头豹研究院,2024-11-29,有色金属,https://pdf.dfcfw.com/pdf/H3_AP202411291641122576_1.pdf?1732909405000.pdf
铜月报（202411）：10月铜矿进口环比回落，加工费持稳处于低位,华福证券,2024-11-28,有色金属,https://pdf.dfcfw.com/pdf/H3_AP202411281641098411_1.pdf?1732781525000.pdf
铝月报（202411）：矿端复产仍有阻力，铝价中长期乐观预期不改,华福证券,2024-11-28,有色金属,https://pdf.dfcfw.com/pdf/H3_AP202411281641101029_1.pdf?1732799601000.pdf
海外黄金股观察系列之十：金罗斯黄金：后起之秀,民生证券,2024-11-28,有色金属,https://pdf.dfcfw.com/pdf/H3_AP202411281641109238_1.pdf?1732824935000.pdf
企业竞争图谱：2024年灵巧手 头豹词条报告系列,头豹研究院,2024-11-27,有色金属,https://pdf.dfcfw.com/pdf/H3_AP202411271641093621_1.pdf?1732740023000.pdf
有色金属行业周报：地缘冲突加剧，金价显著回升,太平洋,2024-11-26,有色金属,https://pdf.dfcfw.com/pdf/H3_AP202411261641066011_1.pdf?1732616339000.pdf
镁行业月度报告：镁锭价格震荡下滑，下游终端需求除汽车行业外有所回落,华宝证券,2024-11-26,有色金属,https://pdf.dfcfw.com/pdf/H3_AP202411261641071924_1.pdf?1732639147000.pdf
有色金属行业周报：黄金价格反弹，关注美国“再通胀”预期,华龙证券,2024-11-26,有色金属,https://pdf.dfcfw.com/pdf/H3_AP202411261641072197_1.pdf?1732641220000.pdf
化工新材料行业周报：短期西欧供应扰动和俄乌冲突升级推高油价,平安证券,2024-11-25,有色金属,https://pdf.dfcfw.com/pdf/H3_AP202411251641044256_1.pdf?1732523701000.pdf
有色金属行业报告：俄乌冲突升级，黄金王者归来,中邮证券,2024-11-25,有色金属,https://pdf.dfcfw.com/pdf/H3_AP202411251641046101_1.pdf?1732533524000.pdf
有色金属与新材料周报：避险情绪短期推升金价，短期强美元交易压制工业金属价格,平安证券,2024-11-25,有色金属,https://pdf.dfcfw.com/pdf/H3_AP202411251641047232_1.pdf?1732544721000.pdf
有色金属行业周报：多头重新主导定价，黄金价格快速反弹,华鑫证券,2024-11-25,有色金属,https://pdf.dfcfw.com/pdf/H3_AP202411251641050579_1.pdf?1732549799000.pdf
有色金属周度观察,国新证券股份,2024-11-25,有色金属,https://pdf.dfcfw.com/pdf/H3_AP202411251641055899_1.pdf?1732561170000.pdf
有色金属行业周报：地缘局势再度紧张，周内金价明显走强,华福证券,2024-11-24,有色金属,https://pdf.dfcfw.com/pdf/H3_AP202411241641043339_1.pdf?1732480439000.pdf
金属与材料行业研究周报：降息预期削减叠加俄乌紧张局势加剧，金银价格先抑后扬,天风证券,2024-11-24,有色金属,https://pdf.dfcfw.com/pdf/H3_AP202411241641043403_1.pdf?1732522903000.pdf
有色行业周报：中国取消部分铜铝制品出口退税，缅甸稀土再添变数,甬兴证券,2024-11-24,有色金属,https://pdf.dfcfw.com/pdf/H3_AP202411241641042203_1.pdf?1732455299000.pdf
大宗&贵金属周报：地缘冲突再升温，金价重回2700美元以上,国金证券,2024-11-24,有色金属,https://pdf.dfcfw.com/pdf/H3_AP202411241641042318_1.pdf?1732455742000.pdf
稀土＆小金属周报：关注稀土战略属性提升和锑出口恢复情况,国金证券,2024-11-24,有色金属,https://pdf.dfcfw.com/pdf/H3_AP202411241641042319_1.pdf?1732455844000.pdf
有色金属行业跟踪周报：美元高位盘整后突破再破阶段新高，工业金属价格冲高回落维持弱势整理,东吴证券,2024-11-24,有色金属,https://pdf.dfcfw.com/pdf/H3_AP202411241641042430_1.pdf?1732450792000.pdf
能源金属＆新材料周报：碳酸锂价格冲高回落，稀土永磁板块震荡偏强,华源证券,2024-11-24,有色金属,https://pdf.dfcfw.com/pdf/H3_AP202411241641042464_1.pdf?1732455467000.pdf
有色金属大宗金属周报：避险属性提升叠加通胀预期交易回归，金价大幅反弹,华源证券,2024-11-24,有色金属,https://pdf.dfcfw.com/pdf/H3_AP202411241641042468_1.pdf?1732455649000.pdf
有色金属周报：美元强势商品承压，继续关注锂行业出清信号,民生证券,2024-11-24,有色金属,https://pdf.dfcfw.com/pdf/H3_AP202411241641042588_1.pdf?1732468190000.pdf
