研报名称,机构名称,发布时间,行业,研报地址
白银行业深度Ⅱ：全球白银需求已进入结构性扩张阶段,东兴证券,2025-02-25,有色金属,https://pdf.dfcfw.com/pdf/H3_AP202502251643475318_1.pdf?1740492693000.pdf
有色金属行业周报：美国多项政策变动推动黄金逼近3000美元，金价或高位震荡,华龙证券,2025-02-25,有色金属,https://pdf.dfcfw.com/pdf/H3_AP202502251643484814_1.pdf?1740515037000.pdf
有色金属行业点评报告：刚果（金）执行临时出口禁令，或有望提振钴价,开源证券,2025-02-25,有色金属,https://pdf.dfcfw.com/pdf/H3_AP202502251643486819_1.pdf?1740509674000.pdf
有色金属行业点评报告：俄罗斯计划恢复对美出口铝或将加剧中国原铝供应紧张,开源证券,2025-02-25,有色金属,https://pdf.dfcfw.com/pdf/H3_AP202502251643487127_1.pdf?1740510434000.pdf
有色金属与新材料周报：供给约束渐显，关注工业金属“硬商品”定价逻辑,平安证券,2025-02-24,有色金属,https://pdf.dfcfw.com/pdf/H3_AP202502241643423755_1.pdf?1740384767000.pdf
有色金属：工信部拟出台稀土开采新规，稀土价格或开启新一轮上涨,中邮证券,2025-02-24,有色金属,https://pdf.dfcfw.com/pdf/H3_AP202502241643434995_1.pdf?1740410374000.pdf
有色金属行业周报：仍需关注国内节后复工情况，铜铝价格震荡为主,华鑫证券,2025-02-24,有色金属,https://pdf.dfcfw.com/pdf/H3_AP202502241643434167_1.pdf?1740409088000.pdf
有色金属行业周报：美关税威胁继续支撑金价，稀土管控再加强,中国银河,2025-02-24,有色金属,https://pdf.dfcfw.com/pdf/H3_AP202502241643425850_1.pdf?1740403300000.pdf
有色金属行业周报：基本面偏紧预期仍在演绎，价格易涨难跌,华福证券,2025-02-23,有色金属,https://pdf.dfcfw.com/pdf/H3_AP202502231643411391_1.pdf?1740329883000.pdf
稀土&小金属周报：坚定看多稀土供改和锑价二轮上涨,国金证券,2025-02-23,有色金属,https://pdf.dfcfw.com/pdf/H3_AP202502231643406967_1.pdf?1740321570000.pdf
有色金属行业跟踪周报：海外市场交易转向，滞胀交易背景下工业金属价格料将承压,东吴证券,2025-02-23,有色金属,https://pdf.dfcfw.com/pdf/H3_AP202502231643407043_1.pdf?1740313864000.pdf
有色金属周报：国内政策表态积极，继续看好春季行情,民生证券,2025-02-23,有色金属,https://pdf.dfcfw.com/pdf/H3_AP202502231643407926_1.pdf?1740317479000.pdf
金属与材料行业研究周报：铝价淡季表现韧性较强，看好电解铝旺季行情,天风证券,2025-02-23,有色金属,https://pdf.dfcfw.com/pdf/H3_AP202502231643408591_1.pdf?1740323216000.pdf
有色金属 大宗金属周报：铜价或进入宽幅震荡，氧化铝价格短期止跌,华源证券,2025-02-23,有色金属,https://pdf.dfcfw.com/pdf/H3_AP202502231643413017_1.pdf?1740349426000.pdf
稀土行业政策点评：政策层面加强管控力度，供需格局改善稀土迎来底部回升,中国银河,2025-02-21,有色金属,https://pdf.dfcfw.com/pdf/H3_AP202502211643351782_1.pdf?1740136611000.pdf
稀土：供改预期逐步兑现，全面看多稀土永磁板块！,国金证券,2025-02-20,有色金属,https://pdf.dfcfw.com/pdf/H3_AP202502201643304331_1.pdf?1740048032000.pdf
有色金属及产业链月报（2025年2月）：金属铜、铝价小幅走低 生产需求持续缓慢回暖,东海证券,2025-02-19,有色金属,https://pdf.dfcfw.com/pdf/H3_AP202502181643220360_1.pdf?1739949437000.pdf
有色金属周度观察,国新证券股份,2025-02-19,有色金属,https://pdf.dfcfw.com/pdf/H3_AP202502191643252016_1.pdf?1739963749000.pdf
有色金属与新材料周报：金价中枢攀升下，关注工业金属“硬商品”定价逻辑,平安证券,2025-02-18,有色金属,https://pdf.dfcfw.com/pdf/H3_AP202502181643184517_1.pdf?1739864466000.pdf
有色金属：《铜产业高质量发展实施方案（2025-2027）》有哪些新看点？,五矿证券,2025-02-18,有色金属,https://pdf.dfcfw.com/pdf/H3_AP202502181643187327_1.pdf?1739871722000.pdf
有色金属行业报告：滞胀可能性提升，做多金银比和金铜比,中邮证券,2025-02-18,有色金属,https://pdf.dfcfw.com/pdf/H3_AP202502181643193611_1.pdf?1739887694000.pdf
有色金属行业周报：国内节后复工，铜铝价格走强,华鑫证券,2025-02-17,有色金属,https://pdf.dfcfw.com/pdf/H3_AP202502171643162138_1.pdf?1739801526000.pdf
有色金属行业周报：全球贸易战担忧发酵，黄金价格继续上行,中国银河,2025-02-17,有色金属,https://pdf.dfcfw.com/pdf/H3_AP202502171643159507_1.pdf?1739797700000.pdf
有色金属行业跟踪周报：黄金续创历史新高，需警惕短期支撑逻辑松动后的回调风险,东吴证券,2025-02-16,有色金属,https://pdf.dfcfw.com/pdf/H3_AP202502161643136954_1.pdf?1739702315000.pdf
有色金属周报：金属价格维持强势，继续看好春季行情,民生证券,2025-02-16,有色金属,https://pdf.dfcfw.com/pdf/H3_AP202502161643140054_1.pdf?1739721946000.pdf
黄金：继续看涨至3500美金以上,中邮证券,2025-02-16,有色金属,https://pdf.dfcfw.com/pdf/H3_AP202502161643142471_1.pdf?1739724650000.pdf
大宗&贵金属周报：关注铜价相对金价的向上修复机遇,国金证券,2025-02-16,有色金属,https://pdf.dfcfw.com/pdf/H3_AP202502161643137818_1.pdf?1739718067000.pdf
有色金属大宗金属周报：铜价或进入宽幅震荡，电解铝盈利持续走阔,华源证券,2025-02-16,有色金属,https://pdf.dfcfw.com/pdf/H3_AP202502161643139978_1.pdf?1739715310000.pdf
有色金属行业研究：稀土＆小金属周报：缅甸矿高成本推涨稀土价格，锑价受益出口恢复,国金证券,2025-02-16,有色金属,https://pdf.dfcfw.com/pdf/H3_AP202502161643140000_1.pdf?1739714092000.pdf
金属与材料行业研究周报：持续定价通胀，金银价格上涨,天风证券,2025-02-16,有色金属,https://pdf.dfcfw.com/pdf/H3_AP202502161643140020_1.pdf?1739716523000.pdf
有色金属：全球贸易战扩大的担忧加剧，避险属性支撑黄金价格震荡走高,华福证券,2025-02-16,有色金属,https://pdf.dfcfw.com/pdf/H3_AP202502161643143097_1.pdf?1739726823000.pdf
黄金行业研究：黄金价格不断创新高，中长期预计仍处上升通道,国新证券股份,2025-02-14,有色金属,https://pdf.dfcfw.com/pdf/H3_AP202502141643086291_1.pdf?1739551376000.pdf
中国有色金属：2月10日特朗普正式签署行政命令，加征关税,海通国际,2025-02-12,有色金属,https://pdf.dfcfw.com/pdf/H3_AP202502121643004848_1.pdf?1739349811000.pdf
有色金属行业动态跟踪：主线明确，金价有望延续上行,平安证券,2025-02-12,有色金属,https://pdf.dfcfw.com/pdf/H3_AP202502121643006936_1.pdf?1739352433000.pdf
锑金属行业专题：矿端紧俏，供需矛盾持续,国信证券,2025-02-12,有色金属,https://pdf.dfcfw.com/pdf/H3_AP202502121643017669_1.pdf?1739379678000.pdf
有色金属行业周报：多重利好推动金价续创新高，国内工业金属需求预期向好,华龙证券,2025-02-11,有色金属,https://pdf.dfcfw.com/pdf/H3_AP202502111642971344_1.pdf?1739307059000.pdf
有色金属行业行业点评报告：地方两会点评-地方两会政策信号积极，有望提振有色需求,中国银河,2025-02-11,有色金属,https://pdf.dfcfw.com/pdf/H3_AP202502111642973348_1.pdf?1739295113000.pdf
有色金属周度观察,国新证券股份,2025-02-11,有色金属,https://pdf.dfcfw.com/pdf/H3_AP202502111642976248_1.pdf?1739298582000.pdf
有色金属行业周报：中国央行持续购金，强劲买盘支撑金价,华鑫证券,2025-02-10,有色金属,https://pdf.dfcfw.com/pdf/H3_AP202502101642933194_1.pdf?1739201867000.pdf
有色金属行业报告：黄金新高，伦敦金有望破3000美金,中邮证券,2025-02-10,有色金属,https://pdf.dfcfw.com/pdf/H3_AP202502101642932630_1.pdf?1739194243000.pdf
有色金属行业跟踪周报：关税政策下，价差交易与再通胀交易成为市场主线，有色金属价格全线上涨,东吴证券,2025-02-09,有色金属,https://pdf.dfcfw.com/pdf/H3_AP202502091642901264_1.pdf?1739095959000.pdf
有色金属 大宗金属周报：受关税政策催化美铜大涨，电解铝盈利持续走阔,华源证券,2025-02-09,有色金属,https://pdf.dfcfw.com/pdf/H3_AP202502091642917156_1.pdf?1739142697000.pdf
大宗&贵金属周报：供给扰动再现，关注铜金比价的修复性机遇,国金证券,2025-02-09,有色金属,https://pdf.dfcfw.com/pdf/H3_AP202502091642910904_1.pdf?1739110060000.pdf
金属与材料行业研究周报：特朗普加征关税，推动金银价格上行,天风证券,2025-02-09,有色金属,https://pdf.dfcfw.com/pdf/H3_AP202502091642910925_1.pdf?1739112060000.pdf
有色金属周报：金价再创新高，看好春季行情启动,民生证券,2025-02-09,有色金属,https://pdf.dfcfw.com/pdf/H3_AP202502091642913002_1.pdf?1739115864000.pdf
有色金属行业周报：中国1月继续增持黄金，中长期配置价值不改,华福证券,2025-02-09,有色金属,https://pdf.dfcfw.com/pdf/H3_AP202502091642915790_1.pdf?1739127729000.pdf
有色金属与新材料周报：美国关税政策扰动边际走弱，金属价格抬升,平安证券,2025-02-09,有色金属,https://pdf.dfcfw.com/pdf/H3_AP202502091642916327_1.pdf?1739132052000.pdf
有色金属行业：存在资产重组预期上市公司梳理,中邮证券,2025-02-07,有色金属,https://pdf.dfcfw.com/pdf/H3_AP202502071642859422_1.pdf?1738931907000.pdf
有色金属行业1月行业动态报告：宏观政策变量扰动价格，全球金价创新高,中国银河,2025-02-06,有色金属,https://pdf.dfcfw.com/pdf/H3_AP202502061642827489_1.pdf?1738839440000.pdf
中国电解铝行业市场规模测算逻辑模型 头豹词条报告系列,头豹研究院,2025-02-06,有色金属,https://pdf.dfcfw.com/pdf/H3_AP202502061642841931_1.pdf?1738870523000.pdf
有色金属行业事件点评：出口管制再升级，战略金属地位持续提升,东莞证券,2025-02-05,有色金属,https://pdf.dfcfw.com/pdf/H3_AP202502051642807671_1.pdf?1738780323000.pdf
铜行业专题报告：缺矿共识下，价格中枢有望上行,华源证券,2025-02-03,有色金属,https://pdf.dfcfw.com/pdf/H3_AP202502021642724413_1.pdf?1738579170000.pdf
A股有色金属行业2024Q4基金持仓分析：基金大幅减持有色行业，仓位降至较低水平,中国银河,2025-02-03,有色金属,https://pdf.dfcfw.com/pdf/H3_AP202502021642724403_1.pdf?1738592638000.pdf
有色金属行业专题报告：过剩幅度收窄，25年锂价或震荡磨底,华源证券,2025-01-28,有色金属,https://pdf.dfcfw.com/pdf/H3_AP202501281642616000_1.pdf?1738065084000.pdf
有色金属行业周报：特朗普政策倾向利好，国内金价再创新高,中国银河,2025-01-27,有色金属,https://pdf.dfcfw.com/pdf/H3_AP202501271642601455_1.pdf?1738007449000.pdf
有色金属行业专题报告：氧化铝拐点或来临，电解铝开启长周期叙事,华源证券,2025-01-26,有色金属,https://pdf.dfcfw.com/pdf/H3_AP202501251642548731_1.pdf?1737884862000.pdf
有色金属周报：特朗普政策基调缓解市场担忧，金属价格震荡,民生证券,2025-01-26,有色金属,https://pdf.dfcfw.com/pdf/H3_AP202501261642555966_1.pdf?1737885452000.pdf
有色金属行业研究：稀土＆小金属周报：锑品出口恢复近50%，稀土进口走弱持续兑现,国金证券,2025-01-26,有色金属,https://pdf.dfcfw.com/pdf/H3_AP202501261642562213_1.pdf?1737882558000.pdf
有色金属 大宗金属周报：铜价宽幅震荡等待FOMC催化，电解铝盈利持续走阔,华源证券,2025-01-26,有色金属,https://pdf.dfcfw.com/pdf/H3_AP202501261642564548_1.pdf?1737903560000.pdf
大宗&贵金属周报：金价逼近前高，板块相对收益明显,国金证券,2025-01-26,有色金属,https://pdf.dfcfw.com/pdf/H3_AP202501261642569539_1.pdf?1737906735000.pdf
金属与材料行业研究周报：鸽派政策押注加强，金价再上涨,天风证券,2025-01-26,有色金属,https://pdf.dfcfw.com/pdf/H3_AP202501261642572677_1.pdf?1737915664000.pdf
有色金属与新材料周报：特朗普政策弱于市场预期，有色金属价格抬升,平安证券,2025-01-26,有色金属,https://pdf.dfcfw.com/pdf/H3_AP202501261642574173_1.pdf?1737922346000.pdf
工业金属2025年度策略报告：基本面偏紧预期不变，铜铝上涨可期,华福证券,2025-01-26,有色金属,https://pdf.dfcfw.com/pdf/H3_AP202501261642556030_1.pdf?1737900537000.pdf
锑行业月报（2024.12）2024年需求增长带动去库，锑价大涨69.23%,华福证券,2025-01-24,有色金属,https://pdf.dfcfw.com/pdf/H3_AP202501241642505438_1.pdf?1737716917000.pdf
2025年有色行业年度策略报告：金铜共舞，拾级而上,甬兴证券,2025-01-24,有色金属,https://pdf.dfcfw.com/pdf/H3_AP202501241642507955_1.pdf?1737710795000.pdf
中国有色金属行业展望，2025年1月,中诚信国际,2025-01-24,有色金属,https://pdf.dfcfw.com/pdf/H3_AP202501241642521949_1.pdf?1737738812000.pdf
中国黄金行业展望，2025年1月,中诚信国际,2025-01-24,有色金属,https://pdf.dfcfw.com/pdf/H3_AP202501241642522159_1.pdf?1737739769000.pdf
锡行业月报：2024年供给小于需求带动大幅去库，锡价震荡上行,华福证券,2025-01-23,有色金属,https://pdf.dfcfw.com/pdf/H3_AP202501231642485412_1.pdf?1737651655000.pdf
AI液冷行业深度报告：液冷进入新纪元,民生证券,2025-01-23,有色金属,https://pdf.dfcfw.com/pdf/H3_AP202501231642496101_1.pdf?1737672276000.pdf
锂产业链月度追踪（202412）：2024年碳酸锂库存累积，价格下降22.6%,华福证券,2025-01-22,有色金属,https://pdf.dfcfw.com/pdf/H3_AP202501221642428187_1.pdf?1737538647000.pdf
有色金属脉动跟踪：再通胀预期升温，金属价格普遍走强,五矿证券,2025-01-21,有色金属,https://pdf.dfcfw.com/pdf/H3_AP202501211642388990_1.pdf?1737451431000.pdf
有色金属行业：基于特朗普1.0的复盘-特朗普2.0铜金价格前瞻,五矿证券,2025-01-21,有色金属,https://pdf.dfcfw.com/pdf/H3_AP202501211642389025_1.pdf?1737451431000.pdf
有色金属行业周报：降息预期回升，金属价格上涨,太平洋,2025-01-21,有色金属,https://pdf.dfcfw.com/pdf/H3_AP202501211642398973_1.pdf?1737466502000.pdf
有色金属与新材料周报：美通胀预期交易延续，有色金属价格抬升,平安证券,2025-01-20,有色金属,https://pdf.dfcfw.com/pdf/H3_AP202501201642351525_1.pdf?1737363759000.pdf
金属与材料行业研究周报：定价再通胀，推动铜价金价再上涨,天风证券,2025-01-20,有色金属,https://pdf.dfcfw.com/pdf/H3_AP202501201642351785_1.pdf?1737373042000.pdf
有色金属行业报告：美债利率下移，金价持续上行,中邮证券,2025-01-20,有色金属,https://pdf.dfcfw.com/pdf/H3_AP202501201642355671_1.pdf?1737369751000.pdf
有色金属行业周报：美联储宽松预期改善，电解铝利润有望走扩,中国银河,2025-01-20,有色金属,https://pdf.dfcfw.com/pdf/H3_AP202501201642362319_1.pdf?1737388643000.pdf
有色金属新材料2025年度策略报告：“铝”创辉煌，黄金长牛,华源证券,2025-01-20,有色金属,https://pdf.dfcfw.com/pdf/H3_AP202501201642371789_1.pdf?1737409158000.pdf
有色金属周报：美国通胀预期回落，金属价格走强,民生证券,2025-01-19,有色金属,https://pdf.dfcfw.com/pdf/H3_AP202501191642334615_1.pdf?1737292362000.pdf
有色金属：美联储降息预期回升，黄金价格震荡上行,华福证券,2025-01-19,有色金属,https://pdf.dfcfw.com/pdf/H3_AP202501191642336357_1.pdf?1737306616000.pdf
大宗&贵金属周报：金属逆季节性去库，重视旺季前布局机遇,国金证券,2025-01-19,有色金属,https://pdf.dfcfw.com/pdf/H3_AP202501191642338238_1.pdf?1737318207000.pdf
稀土＆小金属周报：大矿发现强化战略地位，重视稀土供改行情,国金证券,2025-01-19,有色金属,https://pdf.dfcfw.com/pdf/H3_AP202501191642338240_1.pdf?1737318414000.pdf
有色金属行业跟踪周报：美元现高位筑顶迹象，有色金属普涨,东吴证券,2025-01-18,有色金属,https://pdf.dfcfw.com/pdf/H3_AP202501181642325673_1.pdf?1737242846000.pdf
有色金属：低轨卫星结构拆解：单一价值量最大的组件在哪里？,五矿证券,2025-01-17,有色金属,https://pdf.dfcfw.com/pdf/H3_AP202501171641965394_1.pdf?1737110776000.pdf
锂电材料行业景气有望见底回升,第一创业,2025-01-15,有色金属,https://pdf.dfcfw.com/pdf/H3_AP202501151641937853_1.pdf?1736967395000.pdf
有色金属行业周报：二次通胀预期上升，金属价格回升,太平洋,2025-01-14,有色金属,https://pdf.dfcfw.com/pdf/H3_AP202501141641915392_1.pdf?1736856140000.pdf
有色金属行业月报：1月坚定看多黄金投资机会,开源证券,2025-01-13,有色金属,https://pdf.dfcfw.com/pdf/H3_AP202501121641897300_1.pdf?1736753323000.pdf
有色金属行业周报：中国12月继续增持黄金，美非农超预期显示美经济韧性,华福证券,2025-01-13,有色金属,https://pdf.dfcfw.com/pdf/H3_AP202501131641897761_1.pdf?1736755140000.pdf
有色金属行业报告：非农数据超预期，黄金如期上行,中邮证券,2025-01-13,有色金属,https://pdf.dfcfw.com/pdf/H3_AP202501131641909726_1.pdf?1736806296000.pdf
有色金属行业周报：再通胀交易发酵，有色金属价格走强,中国银河,2025-01-13,有色金属,https://pdf.dfcfw.com/pdf/H3_AP202501131641900701_1.pdf?1736783330000.pdf
有色金属周报：二次通胀预期再起，金属价格走强,民生证券,2025-01-12,有色金属,https://pdf.dfcfw.com/pdf/H3_AP202501111641894877_1.pdf?1736680852000.pdf
大宗&贵金属周报：通胀及关税预期推动金属价格走高,国金证券,2025-01-12,有色金属,https://pdf.dfcfw.com/pdf/H3_AP202501121641896681_1.pdf?1736707768000.pdf
金属与材料行业研究周报：铜价反弹上涨明显，现货升水坚挺,天风证券,2025-01-12,有色金属,https://pdf.dfcfw.com/pdf/H3_AP202501121641896164_1.pdf?1736703434000.pdf
稀土＆小金属周报：关注锑品海外市场再平衡，内外价差有望修复,国金证券,2025-01-12,有色金属,https://pdf.dfcfw.com/pdf/H3_AP202501121641896197_1.pdf?1736692856000.pdf
有色金属与新材料周报：美联储降息预期下修，二次通胀交易推高金价,平安证券,2025-01-12,有色金属,https://pdf.dfcfw.com/pdf/H3_AP202501121641896927_1.pdf?1736715555000.pdf
有色金属大宗金属周报：氧化铝价格加速下跌，持续看好电解铝盈利修复,华源证券,2025-01-12,有色金属,https://pdf.dfcfw.com/pdf/H3_AP202501121641897005_1.pdf?1736721503000.pdf
有色金属行业跟踪周报：强非农衍生美国再通胀叙事逻辑，有色金属价格普遍走强,东吴证券,2025-01-11,有色金属,https://pdf.dfcfw.com/pdf/H3_AP202501111641894768_1.pdf?1736633513000.pdf
金属与材料2025年度策略：资源为王—宽货币周期下的大国博弈,天风证券,2025-01-10,有色金属,https://pdf.dfcfw.com/pdf/H3_AP202501101641885206_1.pdf?1736528578000.pdf
有色金属行业周报：年末需求趋弱，静待加关税预期落地,太平洋,2025-01-09,有色金属,https://pdf.dfcfw.com/pdf/H3_AP202501091641864844_1.pdf?1736409570000.pdf
2024年有色金属行业信用回顾与2025年展望,新世纪资信评估,2025-01-09,有色金属,https://pdf.dfcfw.com/pdf/H3_AP202501091641866149_1.pdf?1736420459000.pdf
有色金属脉动跟踪：复盘全球央行购金，趋势仍将持续,五矿证券,2025-01-09,有色金属,https://pdf.dfcfw.com/pdf/H3_AP202501091641866246_1.pdf?1736417055000.pdf
有色金属脉动跟踪：降息预期降温，美元走强压制金属价格,五矿证券,2025-01-09,有色金属,https://pdf.dfcfw.com/pdf/H3_AP202501091641866249_1.pdf?1736417055000.pdf
2025年我国原材料工业发展形势展望,赛迪智库电子信息研究所,2025-01-08,有色金属,https://pdf.dfcfw.com/pdf/H3_AP202501081641850057_1.pdf?1736345020000.pdf
有色金属行业周报：黄金价格波动或加剧，政策发力支撑工业金属需求,华龙证券,2025-01-08,有色金属,https://pdf.dfcfw.com/pdf/H3_AP202501081641856006_1.pdf?1736365381000.pdf
有色金属行业12月行业动态报告：政策发力有望拉动有色行业预期回升,中国银河,2025-01-07,有色金属,https://pdf.dfcfw.com/pdf/H3_AP202501071641834822_1.pdf?1736261118000.pdf
有色金属2025年年度策略：降息周期，金铜行情仍将持续,华鑫证券,2025-01-07,有色金属,https://pdf.dfcfw.com/pdf/H3_AP202501071641838242_1.pdf?1736267526000.pdf
有色金属行业报告：氧化铝拐点出现，电解铝利润有望缓解,中邮证券,2025-01-06,有色金属,https://pdf.dfcfw.com/pdf/H3_AP202501061641821662_1.pdf?1736197232000.pdf
有色金属周报：美元强势，金属价格震荡,民生证券,2025-01-05,有色金属,https://pdf.dfcfw.com/pdf/H3_AP202501051641811412_1.pdf?1736076732000.pdf
有色金属与新材料周报：氧化铝价格回落，电解铝利润持续修复,平安证券,2025-01-05,有色金属,https://pdf.dfcfw.com/pdf/H3_AP202501051641812495_1.pdf?1736104583000.pdf
有色金属 大宗金属周报：氧化铝价格拐点已至，看好电解铝盈利修复,华源证券,2025-01-05,有色金属,https://pdf.dfcfw.com/pdf/H3_AP202501051641812681_1.pdf?1736113162000.pdf
有色金属：继国内铜库存两周连增之后有望出现反转，宏观面或将继续压制铜价,华福证券,2025-01-05,有色金属,https://pdf.dfcfw.com/pdf/H3_AP202501051641811890_1.pdf?1736096303000.pdf
有色金属行业跟踪周报：海内外宏观风险偏好有所下行，工业金属维持弱势走势,东吴证券,2025-01-05,有色金属,https://pdf.dfcfw.com/pdf/H3_AP202501051641811696_1.pdf?1736088732000.pdf
金属与材料行业研究周报：铜价持续走跌，节后升水回升明显,天风证券,2025-01-05,有色金属,https://pdf.dfcfw.com/pdf/H3_AP202501051641812025_1.pdf?1736151354000.pdf
化工新材料行业周报：特朗普政府拟推动石油增产过程或面临阻碍,平安证券,2025-01-05,有色金属,https://pdf.dfcfw.com/pdf/H3_AP202501051641812347_1.pdf?1736100236000.pdf
镍钴系列报告·开篇：周期谷底探寻，镍成本支撑何在？,五矿证券,2025-01-03,有色金属,https://pdf.dfcfw.com/pdf/H3_AP202501031641522756_1.pdf?1735897490000.pdf
2025年有色金属年度策略：金_铝_银_铜,中邮证券,2025-01-02,有色金属,https://pdf.dfcfw.com/pdf/H3_AP202501021641503320_1.pdf?1735808284000.pdf
矿业巨头启示录系列之一：以终为始，跨越周期——嘉能可和洛钼解密,五矿证券,2024-12-31,有色金属,https://pdf.dfcfw.com/pdf/H3_AP202412311641486601_1.pdf?1735648315000.pdf
锂产业链月度追踪：11月终端需求超预期锂价短期修复，12月需求支撑库存连续微增,华福证券,2024-12-31,有色金属,https://pdf.dfcfw.com/pdf/H3_AP202412311641489830_1.pdf?1735661658000.pdf
有色金属行业2025年年度策略：拐点至反转成，迎接新一轮上行周期,中国银河,2024-12-31,有色金属,https://pdf.dfcfw.com/pdf/H3_AP202412311641492075_1.pdf?1735668281000.pdf
有色金属与新材料周报：强美元持续叠加需求淡季，有色金属价格或进入震荡阶段,平安证券,2024-12-30,有色金属,https://pdf.dfcfw.com/pdf/H3_AP202412291641463326_1.pdf?1735544451000.pdf
有色金属行业周报：CSPT小组敲定25年Q1铜精矿加工费TC为25美金，矿端偏紧逻辑继续演绎,华福证券,2024-12-30,有色金属,https://pdf.dfcfw.com/pdf/H3_AP202412301641463953_1.pdf?1735546861000.pdf
有色金属行业周报：需求季节性趋弱，金属价格维持震荡,太平洋,2024-12-30,有色金属,https://pdf.dfcfw.com/pdf/H3_AP202412301641465865_1.pdf?1735556059000.pdf
锑行业月报（2024.11）：锑矿供应充足，出口博弈延续,华福证券,2024-12-30,有色金属,https://pdf.dfcfw.com/pdf/H3_AP202412301641465640_1.pdf?1735556726000.pdf
有色金属行业：冬季步入严寒期，春暖花开或在望,海通国际,2024-12-30,有色金属,https://pdf.dfcfw.com/pdf/H3_AP202412301641466485_1.pdf?1735564822000.pdf
有色金属行业报告：美债务上限临近或引发黄金和利率同向上行,中邮证券,2024-12-30,有色金属,https://pdf.dfcfw.com/pdf/H3_AP202412301641466482_1.pdf?1735564617000.pdf
能源金属＆新材料周报：碳酸锂价低位震荡，关注增量企业配置机会,华源证券,2024-12-29,有色金属,https://pdf.dfcfw.com/pdf/H3_AP202412291641463189_1.pdf?1735508271000.pdf
锡行业月报（2024.11）锡矿趋紧，供需回暖库存下降，锡价有支撑,华福证券,2024-12-29,有色金属,https://pdf.dfcfw.com/pdf/H3_AP202412291641463268_1.pdf?1735508003000.pdf
化工新材料行业周报：中东局势升温，油价震荡上涨,平安证券,2024-12-29,有色金属,https://pdf.dfcfw.com/pdf/H3_AP202412291641463325_1.pdf?1735510215000.pdf
金属与材料行业研究周报：铜价重心小幅上移，国内社库延续去化,天风证券,2024-12-29,有色金属,https://pdf.dfcfw.com/pdf/H3_AP202412291641462292_1.pdf?1735490553000.pdf
有色金属周报：降息预期放缓美元强势，金属价格短期或偏震荡,民生证券,2024-12-29,有色金属,https://pdf.dfcfw.com/pdf/H3_AP202412291641462331_1.pdf?1735485185000.pdf
大宗&贵金属周报：废铜供给逐步收缩，贸易库存大幅下降,国金证券,2024-12-29,有色金属,https://pdf.dfcfw.com/pdf/H3_AP202412291641462159_1.pdf?1735482062000.pdf
有色金属 大宗金属周报：需求淡季，铜铝价格震荡偏弱,华源证券,2024-12-29,有色金属,https://pdf.dfcfw.com/pdf/H3_AP202412291641462065_1.pdf?1735486821000.pdf
稀土&小金属周报：锑产成品去库兑现，关注稀土、钼、锡等节前备货行情,国金证券,2024-12-29,有色金属,https://pdf.dfcfw.com/pdf/H3_AP202412291641462160_1.pdf?1735480931000.pdf
