研报名称,机构名称,发布时间,行业,研报地址
有色金属行业跟踪周报美国政府对俄铝制裁力度不及预期，电解铝价格冲高回落,东吴证券,2024-02-25,有色金属,https://pdf.dfcfw.com/pdf/H3_AP202402251623563031_1.pdf?1708858053000.pdf
有色金属行业周报：金属价格维持震荡，关注节后开工节奏,南京证券,2024-02-22,有色金属,https://pdf.dfcfw.com/pdf/H3_AP202402221622753129_1.pdf?1708593209000.pdf
有色金属行业双周报：美联储降息预期反复,国泰君安证券(香港),2024-02-22,有色金属,https://pdf.dfcfw.com/pdf/H3_AP202402221622818551_1.pdf?1708610361000.pdf
小金属行业深度报告：锂价寻底之旅，全球锂资源供应最新盘点,华鑫证券,2024-02-22,有色金属,https://pdf.dfcfw.com/pdf/H3_AP202402221622822431_1.pdf?1708617897000.pdf
真“锂”探寻系列11：澳矿23Q4跟踪：扩产爬坡+控本是“关键词”,民生证券,2024-02-21,有色金属,https://pdf.dfcfw.com/pdf/H3_AP202402211622505287_1.pdf?1708532257000.pdf
金属钠 头豹词条报告系列,头豹研究院,2024-02-21,有色金属,https://pdf.dfcfw.com/pdf/H3_AP202402211622516739_1.pdf?1708548275000.pdf
有色金属行业周报：23Q4澳洲锂矿经营状况梳理，格林布什产量环比下滑,海通国际,2024-02-20,有色金属,https://pdf.dfcfw.com/pdf/H3_AP202402201622404840_1.pdf?1708435546000.pdf
有色金属行业周报：全球制造业PMI超预期恢复，大宗金属价格整体回升,中泰证券,2024-02-19,有色金属,https://pdf.dfcfw.com/pdf/H3_AP202402191622380038_1.pdf?1708329504000.pdf
有色金属周报：节前强势反弹，节后美CPI数据打压降息预期,德邦证券,2024-02-19,有色金属,https://pdf.dfcfw.com/pdf/H3_AP202402191622381976_1.pdf?1708331549000.pdf
有色金属行业跟踪周报：海外通胀反复不改全年宽松预期，海外工业金属价格走势良好,东吴证券,2024-02-19,有色金属,https://pdf.dfcfw.com/pdf/H3_AP202402191622382139_1.pdf?1708332297000.pdf
金属与材料行业研究周报：长假期间海外CPI数据超预期，金属价格有所走弱,天风证券,2024-02-19,有色金属,https://pdf.dfcfw.com/pdf/H3_AP202402191622382511_1.pdf?1708337361000.pdf
有色金属行业周报：稀土指标增速放缓，供需有所改善,中泰证券,2024-02-19,有色金属,https://pdf.dfcfw.com/pdf/H3_AP202402191622383381_1.pdf?1708336181000.pdf
有色金属行业周报：海外工业金属震荡偏强，美通胀数据超预期压制金价,华福证券,2024-02-19,有色金属,https://pdf.dfcfw.com/pdf/H3_AP202402191622384129_1.pdf?1708336278000.pdf
有色金属行业周报：通胀粘性下降息路径曲折，关注节后内需复苏,国投证券,2024-02-19,有色金属,https://pdf.dfcfw.com/pdf/H3_AP202402181622378492_1.pdf?1708330722000.pdf
铜春节事项一览：LME铜价及海外铜股上行，全球扰动持续,五矿证券,2024-02-19,有色金属,https://pdf.dfcfw.com/pdf/H3_AP202402191622386893_1.pdf?1708352572000.pdf
碳酸稀土 头豹词条报告系列,头豹研究院,2024-02-19,有色金属,https://pdf.dfcfw.com/pdf/H3_AP202402191622400904_1.pdf?1708372241000.pdf
有色金属行业周报：春节假期海外金属价格普涨，美国通胀超预期引发金价回调,中国银河,2024-02-19,有色金属,https://pdf.dfcfw.com/pdf/H3_AP202402191622402651_1.pdf?1708377065000.pdf
有色与新材料周报：铜库存持续低位，重点关注节后需求复苏节奏,平安证券,2024-02-19,有色金属,https://pdf.dfcfw.com/pdf/H3_AP202402191622386403_1.pdf?1708348585000.pdf
有色金属：2024 年春节假期有色金属市场回顾,国投证券,2024-02-18,有色金属,https://pdf.dfcfw.com/pdf/H3_AP202402171622207706_1.pdf?1708246976000.pdf
海外铜企专题2-自由港麦克莫兰（FCX.N）：全球铜矿巨头，并拥有优质金钼资源,国信证券,2024-02-18,有色金属,https://pdf.dfcfw.com/pdf/H3_AP202402181622305307_1.pdf?1708256332000.pdf
有色金属2月周报：近期金银比值为何持续高位运行？,国联证券,2024-02-18,有色金属,https://pdf.dfcfw.com/pdf/H3_AP202402181622305453_1.pdf?1708248691000.pdf
有色金属行业快报：2024年春节假期有色金属市场回顾,国投证券,2024-02-18,有色金属,https://pdf.dfcfw.com/pdf/H3_AP202402181622305656_1.pdf?1708252886000.pdf
有色金属行业报告：美联储降息预期降温，海外锂企业底部反弹,中邮证券,2024-02-18,有色金属,https://pdf.dfcfw.com/pdf/H3_AP202402181622315048_1.pdf?1708255864000.pdf
有色金属周报：春节假期消费走弱，商品价格回落,民生证券,2024-02-18,有色金属,https://pdf.dfcfw.com/pdf/H3_AP202402181622326993_1.pdf?1708261168000.pdf
有色金属行业大宗及贵金属周报：春节期间大宗金属价格普涨,国金证券,2024-02-18,有色金属,https://pdf.dfcfw.com/pdf/H3_AP202402181622335920_1.pdf?1708263961000.pdf
能源金属＆小金属周报：关注稀土格局优化和锑持续涨价,国金证券,2024-02-18,有色金属,https://pdf.dfcfw.com/pdf/H3_AP202402181622335992_1.pdf?1708264276000.pdf
有色金属周度报告：美国经济数据超预期压制贵金属价格，工业金属春节期间震荡偏强,信达证券,2024-02-18,有色金属,https://pdf.dfcfw.com/pdf/H3_AP202402181622347194_1.pdf?1708270130000.pdf
工业金属：海外铜企专题1-南方铜业（SCCO.N）-坐拥优质铜资源，低成本、高成长,国信证券,2024-02-15,有色金属,https://pdf.dfcfw.com/pdf/H3_AP202402151621783939_1.pdf?1707995215000.pdf
有色金属行业海外研究系列深度报告：墨西哥：北美制造业“后花园”冉冉升起,民生证券,2024-02-15,有色金属,https://pdf.dfcfw.com/pdf/H3_AP202402141621708742_1.pdf?1707988164000.pdf
能源金属行业+公司首次覆盖：成本为盾、需求为锚，锂价底部区间将至——全球锂资源供给梳理,东吴证券,2024-02-14,有色金属,https://pdf.dfcfw.com/pdf/H3_AP202402091621205765_1.pdf?1707905461000.pdf
2024年金属投资策略：千磨万击还坚劲,海通国际,2024-02-08,有色金属,https://pdf.dfcfw.com/pdf/H3_AP202402081621124872_1.pdf?1707399246000.pdf
有色金属行业点评报告：2024年首批稀土指标增速放缓，行业供需格局有望改善,中国银河,2024-02-08,有色金属,https://pdf.dfcfw.com/pdf/H3_AP202402081621127735_1.pdf?1707399488000.pdf
有色金属行业海外研究系列深度报告：越南：“供应链重构”的受益者,民生证券,2024-02-08,有色金属,https://pdf.dfcfw.com/pdf/H3_AP202402081621140742_1.pdf?1707423686000.pdf
稀土行业点评：24年首批配额增量低于预期，供需格局有望改善,国金证券,2024-02-07,有色金属,https://pdf.dfcfw.com/pdf/H3_AP202402071621012948_1.pdf?1707302233000.pdf
稀土行业点评：2024年第一批指标增速收缩，中重稀土首次出现负增长，弱供给利好稀土价格,德邦证券,2024-02-07,有色金属,https://pdf.dfcfw.com/pdf/H3_AP202402071621008203_1.pdf?1707295139000.pdf
铝：行业格局稳定，关注上游及高股息标的,国联证券,2024-02-07,有色金属,https://pdf.dfcfw.com/pdf/H3_AP202402071621016010_1.pdf?1707310128000.pdf
月酝知风之有色与新材料产业：关注淡季后的基本面长逻辑,平安证券,2024-02-07,有色金属,https://pdf.dfcfw.com/pdf/H3_AP202402071621022030_1.pdf?1707321876000.pdf
铀金属 头豹词条报告系列,头豹研究院,2024-02-06,有色金属,https://pdf.dfcfw.com/pdf/H3_AP202402061620966009_1.pdf?1707248792000.pdf
有色金属：第一批稀土指标公布，轻稀土供给端持续宽松,华安证券,2024-02-06,有色金属,https://pdf.dfcfw.com/pdf/H3_AP202402061620970644_1.pdf?1707253433000.pdf
金属行业2月投资策略：看好供给侧受限的上游品种-铜、铝、黄金,国信证券,2024-02-05,有色金属,https://pdf.dfcfw.com/pdf/H3_AP202402051620559362_1.pdf?1707130176000.pdf
有色金属行业周报：美国非农就业超预期，短期压制贵金属和基本金属,华鑫证券,2024-02-05,有色金属,https://pdf.dfcfw.com/pdf/H3_AP202402051620559634_1.pdf?1707125631000.pdf
有色与新材料行业周报：ODS、HFCs配额正式核发，供应趋紧预期推涨制冷剂价格,平安证券,2024-02-05,有色金属,https://pdf.dfcfw.com/pdf/H3_AP202402051620559369_1.pdf?1707125631000.pdf
有色金属行业周报：美联储鹰派信号打压市场降息预期，大宗金属短期承压,中泰证券,2024-02-05,有色金属,https://pdf.dfcfw.com/pdf/H3_AP202402051620560063_1.pdf?1707126538000.pdf
金属与材料行业研究周报：兼具金属与陶瓷性能优势，金属陶瓷应用前景广阔,天风证券,2024-02-05,有色金属,https://pdf.dfcfw.com/pdf/H3_AP202402051620560125_1.pdf?1707127291000.pdf
有色金属行业周报：240205美国非农就业超预期，短期压制贵金属和基本金属,华鑫证券,2024-02-05,有色金属,https://pdf.dfcfw.com/pdf/H3_AP202402051620560127_1.pdf?1707126614000.pdf
有色金属行业周报：中东紧张局势加剧，黄金仍有相对,华福证券,2024-02-05,有色金属,https://pdf.dfcfw.com/pdf/H3_AP202402051620560134_1.pdf?1707126614000.pdf
有色金属行业周报：铜精矿紧张格局持续，非农偏强市场降息预期调整,国投证券,2024-02-05,有色金属,https://pdf.dfcfw.com/pdf/H3_AP202402041620555036_1.pdf?1707122102000.pdf
钢铁有色2024年1月月报：金、铜配置贯穿全年，高股息建议关注钼、铝板块,开源证券,2024-02-05,有色金属,https://pdf.dfcfw.com/pdf/H3_AP202402051620557305_1.pdf?1707124863000.pdf
有色金属周报：非农超预期，金价呈稳态,德邦证券,2024-02-05,有色金属,https://pdf.dfcfw.com/pdf/H3_AP202402051620557910_1.pdf?1707119390000.pdf
有色行业周报：黄金股迎来买点,西南证券,2024-02-05,有色金属,https://pdf.dfcfw.com/pdf/H3_AP202402051620557443_1.pdf?1707119306000.pdf
有色金属行业周报：从区域看有色：云南：资源、成本优势突出,爱建证券,2024-02-05,有色金属,https://pdf.dfcfw.com/pdf/H3_AP202402051620564696_1.pdf?1707153554000.pdf
有色金属行业报告：市场预期美联储5月降息，金属价格高位震荡,中邮证券,2024-02-05,有色金属,https://pdf.dfcfw.com/pdf/H3_AP202402051620580485_1.pdf?1707169795000.pdf
工业金属铜行业系列报告（一）：铜矿增速放缓，定价之锚切换,平安证券,2024-02-05,有色金属,https://pdf.dfcfw.com/pdf/H3_AP202402051620562743_1.pdf?1707140286000.pdf
有色金属1月行业动态报告：美联储降息短期落空但中期更为明确，建议关注黄金板块的配置机会,中国银河,2024-02-05,有色金属,https://pdf.dfcfw.com/pdf/H3_AP202402051620563180_1.pdf?1707153554000.pdf
有色金属行业跟踪周报：美国大小非农数据矛盾，降息预期被修正，海内外黄金价格冲高回落,东吴证券,2024-02-04,有色金属,https://pdf.dfcfw.com/pdf/H3_AP202402041620269262_1.pdf?1707039974000.pdf
有色金属周报：非农数据超预期，商品价格整体回落,民生证券,2024-02-04,有色金属,https://pdf.dfcfw.com/pdf/H3_AP202402041620269299_1.pdf?1707043215000.pdf
有色金属行业大宗及贵金属周报：1月非农超预期，持续关注黄金股右侧配置期,国金证券,2024-02-04,有色金属,https://pdf.dfcfw.com/pdf/H3_AP202402041620273488_1.pdf?1707041209000.pdf
有色金属与钢铁行业双周报：美国1月非农数据超预期，黄金价格或将承压,东莞证券,2024-02-04,有色金属,https://pdf.dfcfw.com/pdf/H3_AP202402041620551987_1.pdf?1707068670000.pdf
有色金属行业周度报告：美国经济数据超预期，降息预期回落,信达证券,2024-02-04,有色金属,https://pdf.dfcfw.com/pdf/H3_AP202402041620551995_1.pdf?1707062717000.pdf
有色金属行业周报：供需双弱，节前锂价窄幅震荡,中泰证券,2024-02-04,有色金属,https://pdf.dfcfw.com/pdf/H3_AP202402041620552127_1.pdf?1707068501000.pdf
中国铜行业展望，2024年1月,中诚信国际,2024-02-04,有色金属,https://pdf.dfcfw.com/pdf/H3_AP202402041620552616_1.pdf?1707066478000.pdf
有色金属行业月报：美联储表态偏鹰，金属价格区间震荡,中原证券,2024-02-04,有色金属,https://pdf.dfcfw.com/pdf/H3_AP202402041620551308_1.pdf?1707056404000.pdf
金属与材料行业研究周报：联储决议偏中性，就业市场走弱催化金价上涨,天风证券,2024-02-04,有色金属,https://pdf.dfcfw.com/pdf/H3_AP202402041620551922_1.pdf?1707061845000.pdf
有色金属行业跟踪周报美国大小非农数据矛盾，降息预期被修正，海内外黄金价格冲高回落,东吴证券,2024-02-03,有色金属,https://pdf.dfcfw.com/pdf/H3_AP202402031620264078_1.pdf?1706989813000.pdf
有色金属行业周报：美经济超预期贵金属承压，国内通缩预期减缓关注顺周期,上海证券,2024-02-02,有色金属,https://pdf.dfcfw.com/pdf/H3_AP202402021620067190_1.pdf?1706872329000.pdf
有色金属行业深度报告：新消费助力旧消费托底，锡矿供给侧持续紧张,开源证券,2024-02-02,有色金属,https://pdf.dfcfw.com/pdf/H3_AP202402021620095332_1.pdf?1706908789000.pdf
有色行业央企控股上市公司梳理,中邮证券,2024-02-02,有色金属,https://pdf.dfcfw.com/pdf/H3_AP202402021620068334_1.pdf?1706880057000.pdf
中国稀土功能材料行业市场规模测算逻辑模型 头豹词条报告系列,头豹研究院,2024-02-02,有色金属,https://pdf.dfcfw.com/pdf/H3_AP202402021620081552_1.pdf?1706903125000.pdf
稀土产业链月度追踪：12月稀土矿进口继续增加，展望24年阶段性过剩压力仍存,华福证券,2024-02-01,有色金属,https://pdf.dfcfw.com/pdf/H3_AP202402011620000024_1.pdf?1706786415000.pdf
有色金属行业动态点评：锂矿板块缘何大跌？,东方财富证券,2024-02-01,有色金属,https://pdf.dfcfw.com/pdf/H3_AP202402011620002236_1.pdf?1706796256000.pdf
中国黄金行业展望，2024年1月,中诚信国际,2024-02-01,有色金属,https://pdf.dfcfw.com/pdf/H3_AP202402011620005908_1.pdf?1706804235000.pdf
工业金属之铜行业深度报告：工业金属中流砥柱，震荡格局下稳中求进,东莞证券,2024-01-31,有色金属,https://pdf.dfcfw.com/pdf/H3_AP202401311619776145_1.pdf?1706694152000.pdf
有色金属行业双周报：金属价格在淡季或将区间震荡,国泰君安证券(香港),2024-01-31,有色金属,https://pdf.dfcfw.com/pdf/H3_AP202401311619784317_1.pdf?1706711603000.pdf
有色金属行业专题报告：2023Q4基金重仓持股超配有色，继续推荐有色布局,华福证券,2024-01-31,有色金属,https://pdf.dfcfw.com/pdf/H3_AP202401311619782788_1.pdf?1706707104000.pdf
钨制品 头豹词条报告系列,头豹研究院,2024-01-31,有色金属,https://pdf.dfcfw.com/pdf/H3_AP202401311619801124_1.pdf?1706731050000.pdf
中国氢氧化铝行业市场规模测算逻辑模型 头豹词条报告系列,头豹研究院,2024-01-30,有色金属,https://pdf.dfcfw.com/pdf/H3_AP202401301619525483_1.pdf?1706643908000.pdf
精密铜带 头豹词条报告系列,头豹研究院,2024-01-30,有色金属,https://pdf.dfcfw.com/pdf/H3_AP202401301619525486_1.pdf?1706646167000.pdf
有色金属行业周报：国内降准叠加美国软着陆预期维持，工业金属普涨,国投证券,2024-01-29,有色金属,https://pdf.dfcfw.com/pdf/H3_AP202401291619253893_1.pdf?1706534796000.pdf
有色行业周报：央国企新增考核，继续推荐铜铝黄金,西南证券,2024-01-29,有色金属,https://pdf.dfcfw.com/pdf/H3_AP202401291619254559_1.pdf?1706519391000.pdf
有色金属行业周报：国内宏观利好进一步释放，大宗板块企稳回升,中泰证券,2024-01-29,有色金属,https://pdf.dfcfw.com/pdf/H3_AP202401291619258755_1.pdf?1706534796000.pdf
有色金属行业周报：节前锂价振幅趋缓，静待年后需求变化,中泰证券,2024-01-29,有色金属,https://pdf.dfcfw.com/pdf/H3_AP202401291619258944_1.pdf?1706527476000.pdf
有色金属行业周报：从区域看有色：内蒙古：战略资源丰富产业集群蓄势,爱建证券,2024-01-29,有色金属,https://pdf.dfcfw.com/pdf/H3_AP202401291619261156_1.pdf?1706526038000.pdf
有色金属行业周报：宏观利好提振金属价格，关注有色央企价值修复,中国银河,2024-01-29,有色金属,https://pdf.dfcfw.com/pdf/H3_AP202401291619263376_1.pdf?1706525941000.pdf
有色金属周报：央行释放流动性，持续推荐金铜,德邦证券,2024-01-29,有色金属,https://pdf.dfcfw.com/pdf/H3_AP202401291619251601_1.pdf?1706611610000.pdf
有色金属与钢铁行业双周报：稳金融增量政策加码，钢铁、工业金属迎来上涨,东莞证券,2024-01-29,有色金属,https://pdf.dfcfw.com/pdf/H3_AP202401291619251613_1.pdf?1706528627000.pdf
有色金属行业周报：美联储降息升温叠加国内超预期降准，工业金属价格反弹,华福证券,2024-01-29,有色金属,https://pdf.dfcfw.com/pdf/H3_AP202401291619251715_1.pdf?1706511737000.pdf
有色金属行业周报：战争交易步入尾声，铀价再度冲高,上海证券,2024-01-29,有色金属,https://pdf.dfcfw.com/pdf/H3_AP202401291619251737_1.pdf?1706511737000.pdf
有色与新材料周报：铜精矿加工费加速下跌，原料短缺持续发酵,平安证券,2024-01-29,有色金属,https://pdf.dfcfw.com/pdf/H3_AP202401291619252558_1.pdf?1706537106000.pdf
金属与材料行业专题研究：AI算力时代下，哪些金属材料受益？,天风证券,2024-01-29,有色金属,https://pdf.dfcfw.com/pdf/H3_AP202401291619252572_1.pdf?1706525534000.pdf
有色金属行业周报：现货铜精矿TC进一步下行，铜精矿偏紧值得关注,华鑫证券,2024-01-29,有色金属,https://pdf.dfcfw.com/pdf/H3_AP202401291619253762_1.pdf?1706621345000.pdf
有色金属：地产政策进一步放松，积极关注地产链金属,国联证券,2024-01-29,有色金属,https://pdf.dfcfw.com/pdf/H3_AP202401281619248667_1.pdf?1706522975000.pdf
有色金属行业跟踪周报：美国“软着陆”概率增加叠加国内超预期降准释放流动性，海内外工业金属价格上涨,东吴证券,2024-01-28,有色金属,https://pdf.dfcfw.com/pdf/H3_AP202401271619235924_1.pdf?1706446861000.pdf
能源金属＆小金属周报：去库加速、减产开启，继续看好锑价上涨,国金证券,2024-01-28,有色金属,https://pdf.dfcfw.com/pdf/H3_AP202401281619241615_1.pdf?1706461559000.pdf
有色金属周报：央行降准提振市场信心，工业金属价格大幅反弹,民生证券,2024-01-28,有色金属,https://pdf.dfcfw.com/pdf/H3_AP202401281619243253_1.pdf?1706452431000.pdf
大宗及贵金属周报：宏观政策提振，铜铝价格回升,国金证券,2024-01-28,有色金属,https://pdf.dfcfw.com/pdf/H3_AP202401281619243987_1.pdf?1706608306000.pdf
有色金属行业周报：政策提振铜铝价格回升，钴锂节前价格承压,华安证券,2024-01-28,有色金属,https://pdf.dfcfw.com/pdf/H3_AP202401281619244026_1.pdf?1706463936000.pdf
有色金属行业报告：市场调低美联储3月降息预期，国内节前需求偏弱,中邮证券,2024-01-28,有色金属,https://pdf.dfcfw.com/pdf/H3_AP202401281619246808_1.pdf?1706518646000.pdf
有色金属周度报告：超预期降准提振宏观预期，金属价格回升,信达证券,2024-01-28,有色金属,https://pdf.dfcfw.com/pdf/H3_AP202401281619246464_1.pdf?1706463749000.pdf
有色金属1月周专题：有色金属2023Q4基金持仓分析-配置比例继续提升，铜、锂获增配显著,国联证券,2024-01-27,有色金属,https://pdf.dfcfw.com/pdf/H3_AP202401271619229471_1.pdf?1706447988000.pdf
锂产业链月度追踪：12月锂盐因季节性淡季大幅累库，静待需求回暖，推荐锂板块底部反转机会,华福证券,2024-01-26,有色金属,https://pdf.dfcfw.com/pdf/H3_AP202401261618278098_1.pdf?1706261694000.pdf
贵金属行业研究：掘“金”系列（五）：美联储或提前放缓缩表，黄金股主升浪时点渐近,国金证券,2024-01-26,有色金属,https://pdf.dfcfw.com/pdf/H3_AP202401261618285054_1.pdf?1706261694000.pdf
有色金属行业2023Q4基金持仓分析：主动权益类基金小幅增持有色行业，连续两季度重点加仓铜板块,中国银河,2024-01-26,有色金属,https://pdf.dfcfw.com/pdf/H3_AP202401261618317977_1.pdf?1706290054000.pdf
有色行业周报：降息预期受压制，铜金价格小幅回调,甬兴证券,2024-01-25,有色金属,https://pdf.dfcfw.com/pdf/H3_AP202401251618102659_1.pdf?1706188825000.pdf
有色金属：TC价格跌至低位，铜冶炼厂该何去何从,五矿证券,2024-01-25,有色金属,https://pdf.dfcfw.com/pdf/H3_AP202401251618102989_1.pdf?1706190605000.pdf
2024年有色金属年度策略：降息周期，看好金铜铝,华鑫证券,2024-01-25,有色金属,https://pdf.dfcfw.com/pdf/H3_AP202401251618148679_1.pdf?1706218431000.pdf
铜月度数据跟踪：23年原料供给宽松，低库存+降息预期支撑铜价高位运行,华福证券,2024-01-24,有色金属,https://pdf.dfcfw.com/pdf/H3_AP202401241617987187_1.pdf?1706086966000.pdf
钛材行业深度报告一：钛矿-钛渣-海绵钛供给特性决定环节利润分配，用电价格成就企业盈利差异,华宝证券,2024-01-23,有色金属,https://pdf.dfcfw.com/pdf/H3_AP202401231617941535_1.pdf?1706002491000.pdf
锑月度数据跟踪：2023年锑供需双增，价格再冲高,华福证券,2024-01-23,有色金属,https://pdf.dfcfw.com/pdf/H3_AP202401231617943813_1.pdf?1706003672000.pdf
铜合金线材 头豹词条报告系列,头豹研究院,2024-01-23,有色金属,https://pdf.dfcfw.com/pdf/H3_AP202401231617958676_1.pdf?1706050193000.pdf
有色金属行业周报：美国3月不降息概率提升，短期压制贵金属,华鑫证券,2024-01-22,有色金属,https://pdf.dfcfw.com/pdf/H3_AP202401211617888930_1.pdf?1705912547000.pdf
有色金属行业周报：淡季小幅累库，锂价持稳运行,中泰证券,2024-01-22,有色金属,https://pdf.dfcfw.com/pdf/H3_AP202401221617898732_1.pdf?1705918325000.pdf
有色金属行业周报：美联储降息预期减弱，大宗板块短期超调,中泰证券,2024-01-22,有色金属,https://pdf.dfcfw.com/pdf/H3_AP202401221617898729_1.pdf?1705918789000.pdf
有色金属行业周报：从区域看有色：山东：黄金矿大省 新材料强链,爱建证券,2024-01-22,有色金属,https://pdf.dfcfw.com/pdf/H3_AP202401221617898589_1.pdf?1705918446000.pdf
有色金属行业周报：激进降息预期回调下，黄金板块合理估值下的配置窗口将再次打开,中国银河,2024-01-22,有色金属,https://pdf.dfcfw.com/pdf/H3_AP202401221617905344_1.pdf?1705935312000.pdf
大宗及贵金属周报：降息预期波动，关注黄金股右侧配置期,国金证券,2024-01-22,有色金属,https://pdf.dfcfw.com/pdf/H3_AP202401221617890095_1.pdf?1705920543000.pdf
有色金属行业周报：美联储降息预期回落，锂板块触底反弹,华福证券,2024-01-22,有色金属,https://pdf.dfcfw.com/pdf/H3_AP202401221617890155_1.pdf?1705911628000.pdf
有色金属周报：降息预期延后，周期行业承压，中长期看或筑底,德邦证券,2024-01-22,有色金属,https://pdf.dfcfw.com/pdf/H3_AP202401221617891003_1.pdf?1705915388000.pdf
有色与新材料行业周报：COP材料海外供应重大扰动，或推进其国产化突破,平安证券,2024-01-22,有色金属,https://pdf.dfcfw.com/pdf/H3_AP202401221617891041_1.pdf?1705915856000.pdf
金属与材料行业研究周报：电磁悬挂：汽车悬架智能化的重要发展方向,天风证券,2024-01-22,有色金属,https://pdf.dfcfw.com/pdf/H3_AP202401221617891051_1.pdf?1705918963000.pdf
有色金属行业周报：铜供给端硬约束持续，降息预期调整关注黄金配置价值,国投证券,2024-01-22,有色金属,https://pdf.dfcfw.com/pdf/H3_AP202401221617891617_1.pdf?1705917255000.pdf
有色金属周报：降息预期降温，商品价格短期承压,民生证券,2024-01-21,有色金属,https://pdf.dfcfw.com/pdf/H3_AP202401211617886890_1.pdf?1705834615000.pdf
有色金属行业周报：降息预期短波动，节前需求承压价格震荡,华安证券,2024-01-21,有色金属,https://pdf.dfcfw.com/pdf/H3_AP202401211617887261_1.pdf?1705850352000.pdf
有色金属行业周报：锑价突破去年高点，供需矛盾仍将维持,中邮证券,2024-01-21,有色金属,https://pdf.dfcfw.com/pdf/H3_AP202401211617887297_1.pdf?1705855906000.pdf
有色金属周度报告：降息预期摇摆，贵金属价格短期承压,信达证券,2024-01-21,有色金属,https://pdf.dfcfw.com/pdf/H3_AP202401211617887302_1.pdf?1705856405000.pdf
有色金属行业跟踪周报：海外“降息交易”正在被修正，工业金属价格表现不佳,东吴证券,2024-01-21,有色金属,https://pdf.dfcfw.com/pdf/H3_AP202401201617885528_1.pdf?1705832403000.pdf
有色行业周报：短期降息预期有所回落但长期趋势仍不变,甬兴证券,2024-01-19,有色金属,https://pdf.dfcfw.com/pdf/H3_AP202401191617735931_1.pdf?1705682788000.pdf
2023年中国镓金属行业概览（摘要版）,头豹研究院,2024-01-19,有色金属,https://pdf.dfcfw.com/pdf/H3_AP202401191617744773_1.pdf?1705693754000.pdf
氟化铝 头豹词条报告系列,头豹研究院,2024-01-19,有色金属,https://pdf.dfcfw.com/pdf/H3_AP202401191617744765_1.pdf?1705702760000.pdf
矿产资源综合利用 头豹词条报告系列,头豹研究院,2024-01-18,有色金属,https://pdf.dfcfw.com/pdf/H3_AP202401181617692769_1.pdf?1705607428000.pdf
2023年中国氧化铝行业概览（摘要版）,头豹研究院,2024-01-17,有色金属,https://pdf.dfcfw.com/pdf/H3_AP202401171617593365_1.pdf?1705520966000.pdf
有色行业周报：铜金价格延续强势表现，铝价受益于供给扰动,甬兴证券,2024-01-17,有色金属,https://pdf.dfcfw.com/pdf/H3_AP202401171617582562_1.pdf?1705496674000.pdf
