研报名称,机构名称,发布时间,行业,研报地址
有色金属周度报告：锂价反弹告一段落，地缘冲突驱动贵金属价格上行,信达证券,2023-10-23,有色金属,https://pdf.dfcfw.com/pdf/H3_AP202310221602716520_1.pdf?1698057018000.pdf
铝行业周报：铝价止跌反弹，经济数据回暖,国海证券,2023-10-23,有色金属,https://pdf.dfcfw.com/pdf/H3_AP202310221602716657_1.pdf?1698058295000.pdf
有色金属行业周报：避险需求继续带动贵金属价格上行，继续看多黄金股,华福证券,2023-10-23,有色金属,https://pdf.dfcfw.com/pdf/H3_AP202310231602717878_1.pdf?1698058148000.pdf
有色与新材料周报：电子特气供需暂稳，看好电子耗材量价上行,平安证券,2023-10-23,有色金属,https://pdf.dfcfw.com/pdf/H3_AP202310231602717891_1.pdf?1698071387000.pdf
有色金属行业周报：地缘摩擦催化避险情绪，国内经济企稳向好预期持续,安信证券,2023-10-23,有色金属,https://pdf.dfcfw.com/pdf/H3_AP202310221602716682_1.pdf?1698067232000.pdf
有色金属：黄金：中东局势影响金价的两条脉络,中泰证券,2023-10-23,有色金属,https://pdf.dfcfw.com/pdf/H3_AP202310231602717930_1.pdf?1698073685000.pdf
锑月度数据跟踪：原料供给环比增加，锑品出口继续改善，锑价震荡偏强,华福证券,2023-10-23,有色金属,https://pdf.dfcfw.com/pdf/H3_AP202310231602717877_1.pdf?1698074275000.pdf
有色金属行业跟踪周报：避险情绪推动美债利率走高，黄金价格维持涨势,东吴证券,2023-10-22,有色金属,https://pdf.dfcfw.com/pdf/H3_AP202310211602714484_1.pdf?1697967504000.pdf
有色金属周报：工业金属震荡，避险需求驱动贵金属价格上行,民生证券,2023-10-22,有色金属,https://pdf.dfcfw.com/pdf/H3_AP202310221602714493_1.pdf?1697966967000.pdf
有色金属行业周报：避险情绪升温，贵金属延续涨势,国联证券,2023-10-22,有色金属,https://pdf.dfcfw.com/pdf/H3_AP202310221602714504_1.pdf?1697965368000.pdf
金属与材料行业研究周报：兼具液体流动性与金属特性，镓基液态金属应用前景广阔,天风证券,2023-10-22,有色金属,https://pdf.dfcfw.com/pdf/H3_AP202310221602714540_1.pdf?1697973988000.pdf
金属与材料行业深度研究：科研院所系材料企业：高掌远跖，乘风破浪,天风证券,2023-10-22,有色金属,https://pdf.dfcfw.com/pdf/H3_AP202310221602714541_1.pdf?1697974060000.pdf
有色金属行业周报：鲍威尔态度偏鸽，黄金价格持续走高,中邮证券,2023-10-22,有色金属,https://pdf.dfcfw.com/pdf/H3_AP202310221602715102_1.pdf?1697987207000.pdf
稀土铝合金 头豹词条报告系列,头豹研究院,2023-10-20,有色金属,https://pdf.dfcfw.com/pdf/H3_AP202310201602189394_1.pdf?1697979138000.pdf
能源金属：钴：供给端加速释放，关注具有增量的公司,国联证券,2023-10-20,有色金属,https://pdf.dfcfw.com/pdf/H3_AP202310191602133669_1.pdf?1697788200000.pdf
有色金属行业周报：锂价小幅回升，关注下游需求变化,山西证券,2023-10-20,有色金属,https://pdf.dfcfw.com/pdf/H3_AP202310201602162854_1.pdf?1697814977000.pdf
铜箔 头豹词条报告系列,头豹研究院,2023-10-20,有色金属,https://pdf.dfcfw.com/pdf/H3_AP202310201602189393_1.pdf?1697831352000.pdf
球形氧化铝 头豹词条报告系列,头豹研究院,2023-10-20,有色金属,https://pdf.dfcfw.com/pdf/H3_AP202310201602189391_1.pdf?1697831250000.pdf
有色周汇报：避险情绪升温带动金价回暖,南京证券,2023-10-19,有色金属,https://pdf.dfcfw.com/pdf/H3_AP202310191602085258_1.pdf?1697727423000.pdf
有色周汇报：美国非农就业数据超预期，商品价格承压,南京证券,2023-10-19,有色金属,https://pdf.dfcfw.com/pdf/H3_AP202310191602085259_1.pdf?1697726267000.pdf
铜行业深度：铜价仍存进一步修复的动能,德邦证券,2023-10-19,有色金属,https://pdf.dfcfw.com/pdf/H3_AP202310191602094996_1.pdf?1697741312000.pdf
有色金属2023年四季度策略：继续关注电解铝和黄金板块,南京证券,2023-10-19,有色金属,https://pdf.dfcfw.com/pdf/H3_AP202310191602085257_1.pdf?1697723892000.pdf
锂行业专题研究：南美锂盐湖：智利仍主导南美锂供给，未来阿根廷将接力继续拉动锂供给提升,华福证券,2023-10-19,有色金属,https://pdf.dfcfw.com/pdf/H3_AP202310191602072429_1.pdf?1697708443000.pdf
铜行业深度报告（一）：2024下半年为增量关注节点，供需错配矛盾渐近,开源证券,2023-10-19,有色金属,https://pdf.dfcfw.com/pdf/H3_AP202310191602072437_1.pdf?1697708947000.pdf
有色行业周报：电解铝供给弹性低 铝价料偏强运行,首创证券,2023-10-17,有色金属,https://pdf.dfcfw.com/pdf/H3_AP202310171601751496_1.pdf?1697536207000.pdf
有色金属&钢铁行业周报：碳酸锂价格止跌回升，锂矿板块表现亮眼,东莞证券,2023-10-16,有色金属,https://pdf.dfcfw.com/pdf/H3_AP202310161601476310_1.pdf?1697451901000.pdf
能源金属周报：碳酸锂期货大涨，锂价短期见底,国金证券,2023-10-16,有色金属,https://pdf.dfcfw.com/pdf/H3_AP202310161601476343_1.pdf?1697450948000.pdf
金属与材料行业研究周报：避险情绪升温，贵金属价格阶段性触底反弹,天风证券,2023-10-16,有色金属,https://pdf.dfcfw.com/pdf/H3_AP202310161601476435_1.pdf?1697453301000.pdf
有色金属行业周报：锂盐供应收缩，碳酸锂价格大幅反弹,中泰证券,2023-10-16,有色金属,https://pdf.dfcfw.com/pdf/H3_AP202310161601476576_1.pdf?1697450376000.pdf
有色金属行业周报：美国9月CPI高于市场预期，铜库存大幅提升,华金证券,2023-10-16,有色金属,https://pdf.dfcfw.com/pdf/H3_AP202310161601478411_1.pdf?1697453076000.pdf
有色金属周度报告：锂价短期见底反弹，避险情绪下金价大幅上行,信达证券,2023-10-16,有色金属,https://pdf.dfcfw.com/pdf/H3_AP202310151601475743_1.pdf?1697449758000.pdf
有色金属行业周报：巴以冲突刺激金价，碳酸锂价格强势反弹,中国银河,2023-10-16,有色金属,https://pdf.dfcfw.com/pdf/H3_AP202310161601478427_1.pdf?1697450296000.pdf
有色金属行业周报：碳酸锂短期震荡走强，避险情绪升温金价上涨,华安证券,2023-10-16,有色金属,https://pdf.dfcfw.com/pdf/H3_AP202310151601475290_1.pdf?1697446041000.pdf
有色金属周报：加息或结束，黄金正当时,德邦证券,2023-10-16,有色金属,https://pdf.dfcfw.com/pdf/H3_AP202310161601479544_1.pdf?1697454846000.pdf
有色金属行业周报：避险需求激增致金价暴涨，继续推荐金铝,华福证券,2023-10-16,有色金属,https://pdf.dfcfw.com/pdf/H3_AP202310161601479707_1.pdf?1697455428000.pdf
有色行业周报：锂价反弹仍需磨底，重点推荐黄金铜铝,西南证券,2023-10-16,有色金属,https://pdf.dfcfw.com/pdf/H3_AP202310161601479756_1.pdf?1697454745000.pdf
有色金属行业周报：方向不改：国内经济延续修复趋势，地缘局势升级推动贵金属上涨趋势加速,中泰证券,2023-10-16,有色金属,https://pdf.dfcfw.com/pdf/H3_AP202310161601479797_1.pdf?1697463386000.pdf
有色金属行业周报：锂价节后触底反弹，金价基于避险升温反转上行,开源证券,2023-10-16,有色金属,https://pdf.dfcfw.com/pdf/H3_AP202310161601481397_1.pdf?1697468582000.pdf
有色与新材料周报：碳酸锂短期供给缩紧，价格反弹或有限,平安证券,2023-10-16,有色金属,https://pdf.dfcfw.com/pdf/H3_AP202310161601481403_1.pdf?1697469682000.pdf
有色金属行业周报：美联储转鸽叠加地缘冲突，金价大幅反弹,华鑫证券,2023-10-16,有色金属,https://pdf.dfcfw.com/pdf/H3_AP202310161601512239_1.pdf?1697487060000.pdf
铝行业周报：短期累库冲击价格，关注需求恢复及开工提升,国海证券,2023-10-16,有色金属,https://pdf.dfcfw.com/pdf/H3_AP202310161601633929_1.pdf?1697529876000.pdf
有色金属行业周报：地缘冲突升级，避险需求推升贵金属价格,国联证券,2023-10-15,有色金属,https://pdf.dfcfw.com/pdf/H3_AP202310141601473995_1.pdf?1697363523000.pdf
有色金属行业跟踪周报：地缘政治风险引发避险情绪，黄金价格上涨,东吴证券,2023-10-15,有色金属,https://pdf.dfcfw.com/pdf/H3_AP202310151601474204_1.pdf?1697372118000.pdf
电解铝：全球增量有限，国际铝价预期上行,德邦证券,2023-10-15,有色金属,https://pdf.dfcfw.com/pdf/H3_AP202310151601474606_1.pdf?1697380751000.pdf
有色金属行业周报：地缘冲突加剧，金价强势回升,中邮证券,2023-10-15,有色金属,https://pdf.dfcfw.com/pdf/H3_AP202310151601474235_1.pdf?1697375677000.pdf
金属与材料行业研究周报：光学性能优异，量子点材料应用前景值得期待,天风证券,2023-10-15,有色金属,https://pdf.dfcfw.com/pdf/H3_AP202310151601474718_1.pdf?1697386562000.pdf
有色金属周报：巴以冲突驱动避险需求，贵金属价格大幅上行,民生证券,2023-10-15,有色金属,https://pdf.dfcfw.com/pdf/H3_AP202310151601475140_1.pdf?1697391913000.pdf
有色金属行业23年Q4投资策略：咬定“大宗”不放松,中泰证券,2023-10-15,有色金属,https://pdf.dfcfw.com/pdf/H3_AP202310151601474629_1.pdf?1697383864000.pdf
锂行业专题研究：非洲锂辉石：非洲锂正式进入全球锂赛道,华福证券,2023-10-13,有色金属,https://pdf.dfcfw.com/pdf/H3_AP202310131601409567_1.pdf?1697210442000.pdf
有色金属行业：“碳中和”背景下电解铝供需格局重构，高盈利持续下铝板块迎来价值重估,华福证券,2023-10-13,有色金属,https://pdf.dfcfw.com/pdf/H3_AP202310131601409568_1.pdf?1697210643000.pdf
有色金属行业周报：碳酸锂价格再次反弹，长期偏弱趋势未变,山西证券,2023-10-13,有色金属,https://pdf.dfcfw.com/pdf/H3_AP202310131601415820_1.pdf?1697218971000.pdf
钕铁硼 头豹词条报告系列,头豹研究院,2023-10-12,有色金属,https://pdf.dfcfw.com/pdf/H3_AP202310121601272719_1.pdf?1697140431000.pdf
高纯氧化铝 头豹词条报告系列,头豹研究院,2023-10-11,有色金属,https://pdf.dfcfw.com/pdf/H3_AP202310111601227173_1.pdf?1697053797000.pdf
金属与材料行业研究周报：海外宏观压制金属价格，或提供较好低位布局时点,天风证券,2023-10-10,有色金属,https://pdf.dfcfw.com/pdf/H3_AP202310101601122852_1.pdf?1696946394000.pdf
有色金属行业月报：美联储释放信号偏鹰，贵金属价格承压,中原证券,2023-10-10,有色金属,https://pdf.dfcfw.com/pdf/H3_AP202310101601129909_1.pdf?1696964200000.pdf
铝行业周报：铝价上涨，盈利提升，关注节后需求情况,国海证券,2023-10-10,有色金属,https://pdf.dfcfw.com/pdf/H3_AP202310091601115320_1.pdf?1696926925000.pdf
有色金属行业研究报告：第二批稀土指标增速放缓,申港证券,2023-10-10,有色金属,https://pdf.dfcfw.com/pdf/H3_AP202310101601120276_1.pdf?1696929493000.pdf
有色金属行业周报：美国经济数据普遍超预期，强美元压制金属,国联证券,2023-10-09,有色金属,https://pdf.dfcfw.com/pdf/H3_AP202310081601093713_1.pdf?1696843476000.pdf
有色金属&钢铁行业周报：双节前夕市场情绪较弱，静待四季度消费需求验证,东莞证券,2023-10-09,有色金属,https://pdf.dfcfw.com/pdf/H3_AP202310091601094959_1.pdf?1696843367000.pdf
大宗及贵金属周报：美债收益率上行，有色金属价格承压,国金证券,2023-10-09,有色金属,https://pdf.dfcfw.com/pdf/H3_AP202310091601094980_1.pdf?1696848330000.pdf
有色与新材料周报：稀土指标增幅有限，需求回暖或推动稀土价格回升,平安证券,2023-10-09,有色金属,https://pdf.dfcfw.com/pdf/H3_AP202310091601095025_1.pdf?1696844202000.pdf
金属与材料行业研究周报：3D打印革故鼎新，有望持续提振钛合金需求,天风证券,2023-10-09,有色金属,https://pdf.dfcfw.com/pdf/H3_AP202310091601095044_1.pdf?1696844938000.pdf
有色金属行业周报：假期期间海外能源金属股票普遍承压,中泰证券,2023-10-09,有色金属,https://pdf.dfcfw.com/pdf/H3_AP202310091601095071_1.pdf?1696845602000.pdf
有色金属行业周报：美联储加息表态超预期，贵金属趋势不改,开源证券,2023-10-09,有色金属,https://pdf.dfcfw.com/pdf/H3_AP202310091601095289_1.pdf?1696842455000.pdf
有色金属行业周报：全球制造业景气回升，美元指数波动加大，大宗金属配置逻辑不变,中泰证券,2023-10-09,有色金属,https://pdf.dfcfw.com/pdf/H3_AP202310091601095322_1.pdf?1696848330000.pdf
有色金属行业点评报告：我国发现战略性新矿物 铌金属研究迎新方向,国开证券,2023-10-09,有色金属,https://pdf.dfcfw.com/pdf/H3_AP202310091601096506_1.pdf?1696849521000.pdf
有色金属行业周报：美联储再度释放鹰派讯号，金九需求表现不及预期,中邮证券,2023-10-09,有色金属,https://pdf.dfcfw.com/pdf/H3_AP202310091601096874_1.pdf?1696847835000.pdf
有色金属行业周报：哪些有色转债值得关注？,爱建证券,2023-10-09,有色金属,https://pdf.dfcfw.com/pdf/H3_AP202310091601096873_1.pdf?1696849346000.pdf
有色金属周度报告：加息预期回升致金属价格承压，供给刚性支撑铝价高位,信达证券,2023-10-09,有色金属,https://pdf.dfcfw.com/pdf/H3_AP202310081601091701_1.pdf?1696842754000.pdf
有色行业周报：海外利率上行压制金价，中长期继续推荐黄金和铜铝,西南证券,2023-10-09,有色金属,https://pdf.dfcfw.com/pdf/H3_AP202310091601106763_1.pdf?1696873643000.pdf
中国钛合金材料行业概览：稀有金属发展迎合国家战略，应用领域广阔,头豹研究院,2023-10-09,有色金属,https://pdf.dfcfw.com/pdf/H3_AP202310091601109797_1.pdf?1696881245000.pdf
有色金属行业跟踪周报：美债长端利率突破4.8%，金属价格短期承压,东吴证券,2023-10-08,有色金属,https://pdf.dfcfw.com/pdf/H3_AP202310071601017509_1.pdf?1696756156000.pdf
9月行业动态报告：经济复苏顺周期铝价利齐升，黄金配置窗口或再度打开,中国银河,2023-10-08,有色金属,https://pdf.dfcfw.com/pdf/H3_AP202310081601020575_1.pdf?1696766000000.pdf
有色金属周报：非农数据大超预期，商品价格短期承压,民生证券,2023-10-08,有色金属,https://pdf.dfcfw.com/pdf/H3_AP202310081601020747_1.pdf?1696770417000.pdf
有色金属行业周报：假期美非农超预期及美债上涨致大宗普跌，继续推荐金铝,华福证券,2023-10-08,有色金属,https://pdf.dfcfw.com/pdf/H3_AP202310081601090378_1.pdf?1696781983000.pdf
有色金属行业周报：美债利率维持高位，贵金属价格承压回落,华安证券,2023-10-08,有色金属,https://pdf.dfcfw.com/pdf/H3_AP202310081601091685_1.pdf?1696787025000.pdf
有色金属行业点评报告：国际金价明显下挫 短期或震荡加剧,国开证券,2023-10-07,有色金属,https://pdf.dfcfw.com/pdf/H3_AP202310071601016752_1.pdf?1696702207000.pdf
汇添富中证细分有色金属产业主题ETF投资价值分析：供需格局改善，布局顺周期品种,国信证券,2023-10-06,有色金属,https://pdf.dfcfw.com/pdf/H3_AP202310061600936056_1.pdf?1696610229000.pdf
金属行业10月投资策略：利好不断推进，看好电解铝和铜,国信证券,2023-10-05,有色金属,https://pdf.dfcfw.com/pdf/H3_AP202310051600908965_1.pdf?1696518990000.pdf
有色金属行业深度分析：资源为王：全球锂矿23年二季报更新,安信证券,2023-09-28,有色金属,https://pdf.dfcfw.com/pdf/H3_AP202309281600189886_1.pdf?1695906959000.pdf
有色金属：指标增量符合预期，中重稀土继续严控,中泰证券,2023-09-27,有色金属,https://pdf.dfcfw.com/pdf/H3_AP202309271599989297_1.pdf?1695803876000.pdf
稀土行业点评：2023年第二批指标增速收缩，弱供给下稀土价格有望回升,德邦证券,2023-09-27,有色金属,https://pdf.dfcfw.com/pdf/H3_AP202309271600003582_1.pdf?1695802225000.pdf
有色行业周报：美联储暗示加息未止 金价回落,首创证券,2023-09-27,有色金属,https://pdf.dfcfw.com/pdf/H3_AP202309271599989293_1.pdf?1695801321000.pdf
有色金属行业周报：黄金承压，铀价上行,上海证券,2023-09-27,有色金属,https://pdf.dfcfw.com/pdf/H3_AP202309271600003589_1.pdf?1695801116000.pdf
有色金属行业：第二批稀土开采分离指标下达，指标增量符合预期,华福证券,2023-09-27,有色金属,https://pdf.dfcfw.com/pdf/H3_AP202309271600006892_1.pdf?1695809263000.pdf
有色金属行业点评报告：第二批稀土开采指标增速放缓，供需格局改善稀土价格有望转强,中国银河,2023-09-27,有色金属,https://pdf.dfcfw.com/pdf/H3_AP202309271600006929_1.pdf?1695809791000.pdf
有色金属行业月度点评：美元走强有色承压，不改黄金长期配置价值,财信证券,2023-09-27,有色金属,https://pdf.dfcfw.com/pdf/H3_AP202309271600009140_1.pdf?1695828510000.pdf
锂鉴系列2：全球盐湖23Q2总结：量增价减业绩承压，扩产项目产能释放在即,信达证券,2023-09-27,有色金属,https://pdf.dfcfw.com/pdf/H3_AP202309271600012554_1.pdf?1695832324000.pdf
有色金属行业研究：第二批稀土开采冶炼指标发布，增量符合预期,国金证券,2023-09-26,有色金属,https://pdf.dfcfw.com/pdf/H3_AP202309261599879974_1.pdf?1695720838000.pdf
钛合金材料 头豹词条报告系列,头豹研究院,2023-09-26,有色金属,https://pdf.dfcfw.com/pdf/H3_AP202309261599902204_1.pdf?1695761577000.pdf
铝行业周报：旺季铝价持续上涨，盈利进一步走阔,国海证券,2023-09-25,有色金属,https://pdf.dfcfw.com/pdf/H3_AP202309241599752915_1.pdf?1695628996000.pdf
有色金属行业周报：美联储偏鹰情绪压制，后续基本面或支撑金属价格,安信证券,2023-09-25,有色金属,https://pdf.dfcfw.com/pdf/H3_AP202309241599753083_1.pdf?1695636683000.pdf
有色金属行业周报：美联储表现鹰派，节前补货需求上升,华安证券,2023-09-25,有色金属,https://pdf.dfcfw.com/pdf/H3_AP202309241599753099_1.pdf?1695635595000.pdf
有色金属行业周报：美联储宣布9月暂停加息，铝锭铝棒库存处近年低位,华金证券,2023-09-25,有色金属,https://pdf.dfcfw.com/pdf/H3_AP202309251599753147_1.pdf?1695648562000.pdf
有色金属_金属新材料行业深度：新能源拉动稀土永磁需求，机器人打开远期需求天花板,德邦证券,2023-09-25,有色金属,https://pdf.dfcfw.com/pdf/H3_AP202309251599757189_1.pdf?1695638071000.pdf
锂行业专题研究：澳洲锂辉石：未来仍将拉动全球锂供给提升，远期潜力需等待进一步勘探发掘,华福证券,2023-09-25,有色金属,https://pdf.dfcfw.com/pdf/H3_AP202309251599757263_1.pdf?1695638438000.pdf
锂产业链月度跟踪：8月锂需求预期落空致锂价下跌，供需博弈下锂价压力仍存,华福证券,2023-09-25,有色金属,https://pdf.dfcfw.com/pdf/H3_AP202309251599757264_1.pdf?1695649101000.pdf
有色金属周度报告：美联储9月暂停加息，持续看好黄金配置价值,信达证券,2023-09-25,有色金属,https://pdf.dfcfw.com/pdf/H3_AP202309241599752940_1.pdf?1695635262000.pdf
有色金属周报：美联储加息尾声，持续推荐顺周期金属,德邦证券,2023-09-25,有色金属,https://pdf.dfcfw.com/pdf/H3_AP202309251599758484_1.pdf?1695635652000.pdf
金属与材料行业研究周报：一体化压铸迎来新突破，免热铝合金为关键材料,天风证券,2023-09-25,有色金属,https://pdf.dfcfw.com/pdf/H3_AP202309251599757321_1.pdf?1695649467000.pdf
有色金属行业研究：大宗及贵金属周报：积极政策持续提振铝价,国金证券,2023-09-25,有色金属,https://pdf.dfcfw.com/pdf/H3_AP202309251599758542_1.pdf?1695650338000.pdf
能源金属周报：节前备货需求释放，小金属钒、镓等价格上涨,国金证券,2023-09-25,有色金属,https://pdf.dfcfw.com/pdf/H3_AP202309251599758543_1.pdf?1695652916000.pdf
有色与新材料周报：制冷剂配额落地在即，氟化工或开启长景气周期,平安证券,2023-09-25,有色金属,https://pdf.dfcfw.com/pdf/H3_AP202309251599758797_1.pdf?1695650527000.pdf
金属与材料行业研究周报：供应刚性叠加低库存支撑，铝价强势运行,天风证券,2023-09-25,有色金属,https://pdf.dfcfw.com/pdf/H3_AP202309251599758816_1.pdf?1695651354000.pdf
有色行业周报：市场底部，重视锂矿等超跌反弹机会,西南证券,2023-09-25,有色金属,https://pdf.dfcfw.com/pdf/H3_AP202309251599758820_1.pdf?1695641576000.pdf
新材料行业周报：碳纤维军品龙头项目验收通过，设备龙头订单再获突破,中泰证券,2023-09-25,有色金属,https://pdf.dfcfw.com/pdf/H3_AP202309251599758843_1.pdf?1695651670000.pdf
有色金属行业周报：短期波动不改板块上行逻辑，美联储如期暂停加息，但指引偏鹰,中泰证券,2023-09-25,有色金属,https://pdf.dfcfw.com/pdf/H3_AP202309251599758847_1.pdf?1695651049000.pdf
有色金属行业周报：节前补货需求，锡库存环比减少6%,中泰证券,2023-09-25,有色金属,https://pdf.dfcfw.com/pdf/H3_AP202309251599758846_1.pdf?1695650063000.pdf
有色金属行业周报：美国利率或维持高位，贵金属长期趋势不改,开源证券,2023-09-25,有色金属,https://pdf.dfcfw.com/pdf/H3_AP202309251599761636_1.pdf?1695639826000.pdf
有色金属行业点评：第二批稀土指标公布，中重稀土资源端持续整合,华安证券,2023-09-25,有色金属,https://pdf.dfcfw.com/pdf/H3_AP202309251599799638_1.pdf?1695714423000.pdf
有色金属行业周报：从中报看赛道：黄金中长期配置价值持续显现,爱建证券,2023-09-25,有色金属,https://pdf.dfcfw.com/pdf/H3_AP202309251599761889_1.pdf?1695652131000.pdf
有色金属行业周报：美元反弹大宗普跌，继续看多金铝铜锡,华福证券,2023-09-25,有色金属,https://pdf.dfcfw.com/pdf/H3_AP202309251599763424_1.pdf?1695647493000.pdf
金属磁粉芯 头豹词条报告系列,头豹研究院,2023-09-25,有色金属,https://pdf.dfcfw.com/pdf/H3_AP202309251599774754_1.pdf?1695672512000.pdf
有色金属行业跟踪周报：美联储释放鹰派言论，金属价格涨跌不一,东吴证券,2023-09-24,有色金属,https://pdf.dfcfw.com/pdf/H3_AP202309241599740093_1.pdf?1695555653000.pdf
有色金属行业周报：节前补货意愿较强，美联储再放鹰派讯号,中邮证券,2023-09-24,有色金属,https://pdf.dfcfw.com/pdf/H3_AP202309241599740149_1.pdf?1695565628000.pdf
有色金属行业周报：加息暂停但鹰派立场强化，顺周期预期受压制,国联证券,2023-09-24,有色金属,https://pdf.dfcfw.com/pdf/H3_AP202309241599740136_1.pdf?1695565061000.pdf
有色金属周报：联储态度鹰派压制价格，期待国内需求“银十”来临,民生证券,2023-09-24,有色金属,https://pdf.dfcfw.com/pdf/H3_AP202309241599752403_1.pdf?1695572279000.pdf
电解铝行业深度报告：利多齐聚价格与成本共振，开启电解铝利润走阔的价值重塑行情,中国银河,2023-09-23,有色金属,https://pdf.dfcfw.com/pdf/H3_AP202309231599720243_1.pdf?1695552436000.pdf
有色金属行业周报：美国8月CPI数据基本符合预期，继续关注黄金,上海证券,2023-09-22,有色金属,https://pdf.dfcfw.com/pdf/H3_AP202309221599688084_1.pdf?1695369302000.pdf
锂鉴系列1：全球锂矿23Q2总结：产能持续释放，下半年锂价承压,信达证券,2023-09-22,有色金属,https://pdf.dfcfw.com/pdf/H3_AP202309221599699547_1.pdf?1695377140000.pdf
锡月度数据跟踪：短期供需矛盾不明显，中长期矿端预期仍偏紧,华福证券,2023-09-22,有色金属,https://pdf.dfcfw.com/pdf/H3_AP202309221599708632_1.pdf?1695402540000.pdf
铜月度数据跟踪：国内利好政策频出，终端消费改善或将推动铜价上行,华福证券,2023-09-22,有色金属,https://pdf.dfcfw.com/pdf/H3_AP202309221599708633_1.pdf?1695403031000.pdf
锑月度数据跟踪：锑品出口改善明显，短期价格预期偏强,华福证券,2023-09-22,有色金属,https://pdf.dfcfw.com/pdf/H3_AP202309221599708634_1.pdf?1695403808000.pdf
铝月度数据跟踪：8月电解铝去库态势不改，看好后市铝价,华福证券,2023-09-22,有色金属,https://pdf.dfcfw.com/pdf/H3_AP202309221599708635_1.pdf?1695402375000.pdf
金属跟踪：宏观与需求结构看铜价,五矿证券,2023-09-21,有色金属,https://pdf.dfcfw.com/pdf/H3_AP202309211599660051_1.pdf?1695302320000.pdf
有色周汇报：降准落地，国内金属需求旺季有望回暖,南京证券,2023-09-20,有色金属,https://pdf.dfcfw.com/pdf/H3_AP202309201599424161_1.pdf?1695196107000.pdf
有色金属行业：锑：“光伏金属”实至名归，供给不足凸显战略属性,华福证券,2023-09-20,有色金属,https://pdf.dfcfw.com/pdf/H3_AP202309201599429072_1.pdf?1695201202000.pdf
锂业寻踪系列1：出海掘锂时不我待，海外锂资源开发一览,五矿证券,2023-09-19,有色金属,https://pdf.dfcfw.com/pdf/H3_AP202309191599282770_1.pdf?1695137709000.pdf
金属行业周度市场观察,国信证券,2023-09-19,有色金属,https://pdf.dfcfw.com/pdf/H3_AP202309191599290055_1.pdf?1695152153000.pdf
有色金属行业周报：产业链负反馈加剧，锂价加速回落,中泰证券,2023-09-18,有色金属,https://pdf.dfcfw.com/pdf/H3_AP202309181599030065_1.pdf?1695047592000.pdf
有色金属行业周报：国内经济超预期修复，美国通胀超预期抬升，大宗金属配置逻辑不改,中泰证券,2023-09-18,有色金属,https://pdf.dfcfw.com/pdf/H3_AP202309181599030067_1.pdf?1695035750000.pdf
有色金属&钢铁行业周报：黄金投资热情高涨，沪金价格再创新高,东莞证券,2023-09-18,有色金属,https://pdf.dfcfw.com/pdf/H3_AP202309181599031810_1.pdf?1695045242000.pdf
铝行业周报：需求稳中向好，铝价持续上涨,国海证券,2023-09-18,有色金属,https://pdf.dfcfw.com/pdf/H3_AP202309181599032952_1.pdf?1695033093000.pdf
