研报名称,机构名称,发布时间,行业,研报地址
深海采矿：一种有前景的关键矿物解决方案-海底采矿如何缩小某些关键矿物的供需缺口,罗兰贝格,2025-06-20,有色金属,https://pdf.dfcfw.com/pdf/H3_AP202506201694183512_1.pdf?1750410994000.pdf
白银行业专题报告：低估的贵金属，金银比亟待修复,中邮证券,2025-06-20,有色金属,https://pdf.dfcfw.com/pdf/H3_AP202506201694225896_1.pdf?1750410704000.pdf
全球十五大铜矿企业一季报汇总：海外铜矿企业有两家产量下滑多，增长主要依靠中资企业,华鑫证券,2025-06-20,有色金属,https://pdf.dfcfw.com/pdf/H3_AP202506201694395357_1.pdf?1750435261000.pdf
有色金属行业双周报：美联储维持利率区间不变，金价短期小幅承压,东莞证券,2025-06-20,有色金属,https://pdf.dfcfw.com/pdf/H3_AP202506201694430328_1.pdf?1750440637000.pdf
有色金属：澳矿2025Q1财报梳理分析-降本不可持续,五矿证券,2025-06-20,有色金属,https://pdf.dfcfw.com/pdf/H3_AP202506201694444933_1.pdf?1750442161000.pdf
金属行业2025年中期投资策略系列报告之钢铁篇：底部涅槃，曙光渐近,民生证券,2025-06-20,有色金属,https://pdf.dfcfw.com/pdf/H3_AP202506201694501294_1.pdf?1750450233000.pdf
铀行业点评：SPUT或将重启采购，铀板块三季度有望持续催化,华源证券,2025-06-19,有色金属,https://pdf.dfcfw.com/pdf/H3_AP202506191693810986_1.pdf?1750350897000.pdf
有色金属：2024中国地勘投资出炉，多元勘查战略探索破解资源困局,五矿证券,2025-06-17,有色金属,https://pdf.dfcfw.com/pdf/H3_AP202506171692442299_1.pdf?1750154739000.pdf
有色金属行业报告：地缘风险推动黄金脉冲式上涨,中邮证券,2025-06-17,有色金属,https://pdf.dfcfw.com/pdf/H3_AP202506171692551926_1.pdf?1750171665000.pdf
有色金属：中印大合同签订，钾肥价格重心上移,五矿证券,2025-06-17,有色金属,https://pdf.dfcfw.com/pdf/H3_AP202506171692564811_1.pdf?1750172639000.pdf
有色金属周报：中东局势升温，金价大幅上行,国金证券,2025-06-16,有色金属,https://pdf.dfcfw.com/pdf/H3_AP202506161691780124_1.pdf?1750060619000.pdf
有色新材料行业周报：多数金属价格稳定，黄金和稀土热度高,太平洋,2025-06-16,有色金属,https://pdf.dfcfw.com/pdf/H3_AP202506161691858845_1.pdf?1750071704000.pdf
有色金属行业周报：中东冲突升级，风险偏好下降刺激金价走强,中国银河,2025-06-16,有色金属,https://pdf.dfcfw.com/pdf/H3_AP202506161692006939_1.pdf?1750092235000.pdf
有色金属行业2025年下半年投资策略：有色华章领风骚，重器峥嵘贯九霄,东莞证券,2025-06-16,有色金属,https://pdf.dfcfw.com/pdf/H3_AP202506161692019209_1.pdf?1750093039000.pdf
有色金属行业周报：地缘军事冲突引爆资金涌入，贵金属强势上行,华鑫证券,2025-06-16,有色金属,https://pdf.dfcfw.com/pdf/H3_AP202506161691953117_1.pdf?1750084357000.pdf
有色金属大宗金属周报：库存持续去化，铝价强势运行,华源证券,2025-06-15,有色金属,https://pdf.dfcfw.com/pdf/H3_AP202506151691511664_1.pdf?1750020933000.pdf
有色金属行业跟踪周报：美元指数下行叠加地缘冲突加剧，黄金录得环比大幅上行,东吴证券,2025-06-15,有色金属,https://pdf.dfcfw.com/pdf/H3_AP202506151691566720_1.pdf?1750062206000.pdf
有色金属周报：地缘冲突升级，贵金属价格走强,民生证券,2025-06-15,有色金属,https://pdf.dfcfw.com/pdf/H3_AP202506151691346424_1.pdf?1749998764000.pdf
金属与材料行业研究周报：地缘冲突加剧，黄金避险属性凸显推升金价上行,天风证券,2025-06-15,有色金属,https://pdf.dfcfw.com/pdf/H3_AP202506151691371461_1.pdf?1750003345000.pdf
能源及稀有金属周度观察,国新证券股份,2025-06-13,有色金属,https://pdf.dfcfw.com/pdf/H3_AP202506131690029061_1.pdf?1749804080000.pdf
有色金属行业点评报告：近期白银价格上涨较快 持续性面临矛盾因素影响,国开证券,2025-06-13,有色金属,https://pdf.dfcfw.com/pdf/H3_AP202506131690173039_1.pdf?1749826073000.pdf
矿业巨头启示录系列之三：百年基业，必和必拓矿业帝国缔造史,五矿证券,2025-06-12,有色金属,https://pdf.dfcfw.com/pdf/H3_AP202506121689326107_1.pdf?1749727244000.pdf
有色新材料：稀土产业链优势在我，持续关注,太平洋,2025-06-12,有色金属,https://pdf.dfcfw.com/pdf/H3_AP202506121689558953_1.pdf?1749745620000.pdf
稀土行业动态跟踪：下游需求旺盛，中国产业链优势明显,源达信息,2025-06-12,有色金属,https://pdf.dfcfw.com/pdf/H3_AP202506121689647798_1.pdf?1749748810000.pdf
有色金属：钼价创年内新高，短期有望继续上涨,五矿证券,2025-06-11,有色金属,https://pdf.dfcfw.com/pdf/H3_AP202506111688744171_1.pdf?1749642037000.pdf
金属行业2025半年度展望（Ⅲ）：供需结构持续改善—小金属板块或显现底部抬升,东兴证券,2025-06-10,有色金属,https://pdf.dfcfw.com/pdf/H3_AP202506101688213567_1.pdf?1749565667000.pdf
矿业巨头启示录系列之二：跨越时空的成长，打造一流铜企——FCX和紫金,五矿证券,2025-06-10,有色金属,https://pdf.dfcfw.com/pdf/H3_AP202506101688291194_1.pdf?1749575968000.pdf
有色金属与新材料周报：宏观预期边际转好，工业金属价格中枢有望抬升,平安证券,2025-06-09,有色金属,https://pdf.dfcfw.com/pdf/H3_AP202506081687237711_1.pdf?1749453957000.pdf
金属与材料行业研究周报：小非农惨淡推升降息预期，地缘冲突共振利好金价上行,天风证券,2025-06-09,有色金属,https://pdf.dfcfw.com/pdf/H3_AP202506091687473628_1.pdf?1749460089000.pdf
有色金属行业周报：中美关税谈判缓和，稀土磁材反制作用凸显,中国银河,2025-06-09,有色金属,https://pdf.dfcfw.com/pdf/H3_AP202506091687531513_1.pdf?1749467435000.pdf
有色金属行业报告：滞胀交易的演进——贵金属蓄势待发,中邮证券,2025-06-09,有色金属,https://pdf.dfcfw.com/pdf/H3_AP202506091687551870_1.pdf?1749469637000.pdf
有色金属行业双周报：贵金属价格走高，战略小金属价格分化,国元证券,2025-06-09,有色金属,https://pdf.dfcfw.com/pdf/H3_AP202506091687715616_1.pdf?1749502215000.pdf
有色金属行业周报：中美领导人通电话，经贸会谈持续推进,华龙证券,2025-06-09,有色金属,https://pdf.dfcfw.com/pdf/H3_AP202506091687785367_1.pdf?1749505623000.pdf
有色金属行业跟踪周报：美国非农数据“涉险过关”，工业金属环比上涨,东吴证券,2025-06-09,有色金属,https://pdf.dfcfw.com/pdf/H3_AP202506091687830304_1.pdf?1749509729000.pdf
黄金避险属性强化与主权信用危机发酵,国新证券股份,2025-06-08,有色金属,https://pdf.dfcfw.com/pdf/H3_AP202506081687170369_1.pdf?1749414192000.pdf
有色金属周报：关税缓和，工业金属价格震荡走强,民生证券,2025-06-08,有色金属,https://pdf.dfcfw.com/pdf/H3_AP202506081687060387_1.pdf?1749398632000.pdf
有色金属 大宗金属周报：关税催化，铜价上涨,华源证券,2025-06-08,有色金属,https://pdf.dfcfw.com/pdf/H3_AP202506081687148949_1.pdf?1749418913000.pdf
金属行业2025半年度展望（Ⅱ）：供需结构强化叠加流动性周期切换—贵金属行业进入强景气周期,东兴证券,2025-06-06,有色金属,https://pdf.dfcfw.com/pdf/H3_AP202506061685968241_1.pdf?1749237730000.pdf
金属行业2025半年度展望（Ⅰ）：弱供给周期下的行业配置属性探讨—工业金属板块高景气度延续,东兴证券,2025-06-06,有色金属,https://pdf.dfcfw.com/pdf/H3_AP202506061685887601_1.pdf?1749226241000.pdf
2025年有色金属行业信用风险展望,东方金诚,2025-06-04,有色金属,https://pdf.dfcfw.com/pdf/H3_AP202506041684684117_1.pdf?1749065148000.pdf
有色金属：钼价持续上涨，建议底部布局,中邮证券,2025-06-03,有色金属,https://pdf.dfcfw.com/pdf/H3_AP202506021683594603_1.pdf?1748939148000.pdf
有色金属行业报告：关税预期扰动不改黄金上行趋势,中邮证券,2025-06-03,有色金属,https://pdf.dfcfw.com/pdf/H3_AP202506031683962891_1.pdf?1748943434000.pdf
有色金属行业跟踪周报：特朗普关税政策或上诉法院支持，贸易战出现升级信号，黄金具备再度走牛基础,东吴证券,2025-06-03,有色金属,https://pdf.dfcfw.com/pdf/H3_AP202506031684007036_1.pdf?1748950689000.pdf
有色金属与新材料周报：铜铝维持库存相对低位，重视基本面带来的价格支撑,平安证券,2025-06-03,有色金属,https://pdf.dfcfw.com/pdf/H3_AP202506031684050017_1.pdf?1748958301000.pdf
有色金属行业周报：美国关税政策反复，利好黄金价格上行,中国银河,2025-06-03,有色金属,https://pdf.dfcfw.com/pdf/H3_AP202506031684257447_1.pdf?1748987423000.pdf
有色金属周报：美国关税不确定性仍存，继续看好金价,民生证券,2025-06-02,有色金属,https://pdf.dfcfw.com/pdf/H3_AP202506021683131432_1.pdf?1748858345000.pdf
金属与材料行业研究周报：基本金属震荡上行，小金属分化关注权益机会,天风证券,2025-06-02,有色金属,https://pdf.dfcfw.com/pdf/H3_AP202506021683357387_1.pdf?1748853725000.pdf
有色金属周报：铜TC长单超预期，冶炼减产渐近,国金证券,2025-06-02,有色金属,https://pdf.dfcfw.com/pdf/H3_AP202506021683489188_1.pdf?1748875675000.pdf
有色金属 大宗金属周报：库存持续去化，铝价维持震荡,华源证券,2025-06-02,有色金属,https://pdf.dfcfw.com/pdf/H3_AP202506021683539509_1.pdf?1748881629000.pdf
有色金属行业周报：美联储货币政策纪要担忧通胀和经济不确定性，短期金价震荡为主,华鑫证券,2025-06-02,有色金属,https://pdf.dfcfw.com/pdf/H3_AP202506021683560141_1.pdf?1748883078000.pdf
多晶硅行业：价格继续探底，后续下行空间有限,国元国际控股,2025-05-30,有色金属,https://pdf.dfcfw.com/pdf/H3_AP202505301681696149_1.pdf?1748612149000.pdf
铀行业专题报告：从政策预期到执行兑现：铀产业链迎来系统性重估,华源证券,2025-05-29,有色金属,https://pdf.dfcfw.com/pdf/H3_AP202505291681143322_1.pdf?1748525130000.pdf
有色金属行业双周报：近一周贵金属价格回升，需关注锑价下行风险,国元证券,2025-05-27,有色金属,https://pdf.dfcfw.com/pdf/H3_AP202505271679923433_1.pdf?1748341893000.pdf
新材料行业2025Q1财报开门红：关注确立困境反转的稀土磁材行业,五矿证券,2025-05-27,有色金属,https://pdf.dfcfw.com/pdf/H3_AP202505271679991936_1.pdf?1748355013000.pdf
有色月跟踪：24年有色行业盈利改善，“资源为王”特征进一步凸显,五矿证券,2025-05-27,有色金属,https://pdf.dfcfw.com/pdf/H3_AP202505271680134416_1.pdf?1748372274000.pdf
工业金属行业专题报告：政策赋能供给优化，需求结构持续升级,东莞证券,2025-05-27,有色金属,https://pdf.dfcfw.com/pdf/H3_AP202505271680072088_1.pdf?1748363018000.pdf
有色金属行业报告：黄金上行开始，持续关注黄金股投资机会,中邮证券,2025-05-26,有色金属,https://pdf.dfcfw.com/pdf/H3_AP202505261679349924_1.pdf?1748255943000.pdf
有色金属：近期黄金价格波动解析与市场展望,国新证券股份,2025-05-26,有色金属,https://pdf.dfcfw.com/pdf/H3_AP202505261679359467_1.pdf?1748257009000.pdf
有色金属行业周报：美国减税法案通过，财政赤字担忧推高金价,中国银河,2025-05-26,有色金属,https://pdf.dfcfw.com/pdf/H3_AP202505261679359537_1.pdf?1748259150000.pdf
有色金属行业研究：有色金属周报：欧美关税或再升级，金价再度上行,国金证券,2025-05-26,有色金属,https://pdf.dfcfw.com/pdf/H3_AP202505261679373459_1.pdf?1748259252000.pdf
有色金属：美国财政纪律松散，风险偏好回摆金价上行驱动有望回归,天风证券,2025-05-26,有色金属,https://pdf.dfcfw.com/pdf/H3_AP202505261679392846_1.pdf?1748264812000.pdf
有色金属行业周报：特朗普再次宣布将对欧盟征收关税，避险情绪升温推升金价,华鑫证券,2025-05-26,有色金属,https://pdf.dfcfw.com/pdf/H3_AP202505261679545032_1.pdf?1748284043000.pdf
有色金属行业周报：未来一周金属价格或持续波动,华龙证券,2025-05-26,有色金属,https://pdf.dfcfw.com/pdf/H3_AP202505261679617307_1.pdf?1748295656000.pdf
金属与材料行业研究周报：黄金重回升势，关注权益板块配置机会,天风证券,2025-05-25,有色金属,https://pdf.dfcfw.com/pdf/H3_AP202505251678900036_1.pdf?1748190287000.pdf
有色金属周报：美债信用弱化+地缘局势升温，看好金价表现,民生证券,2025-05-25,有色金属,https://pdf.dfcfw.com/pdf/H3_AP202505251678972244_1.pdf?1748201175000.pdf
有色金属 大宗金属周报：关税威胁再起，美铜大涨,华源证券,2025-05-25,有色金属,https://pdf.dfcfw.com/pdf/H3_AP202505251678972250_1.pdf?1748206363000.pdf
有色行业深度：金价回调后的风险和机遇,联储证券,2025-05-25,有色金属,https://pdf.dfcfw.com/pdf/H3_AP202505251678766977_1.pdf?1748181204000.pdf
有色金属行业跟踪周报：关税政策反复叠加美债拍卖遇冷，美国财政恶化驱使黄金价格再度走牛,东吴证券,2025-05-25,有色金属,https://pdf.dfcfw.com/pdf/H3_AP202505251678899987_1.pdf?1748188793000.pdf
有色金属：特朗普拟签核电命令，关注产业链个股,中邮证券,2025-05-23,有色金属,https://pdf.dfcfw.com/pdf/H3_AP202505231677808031_1.pdf?1748023083000.pdf
有色金属周度观察,国新证券股份,2025-05-23,有色金属,https://pdf.dfcfw.com/pdf/H3_AP202505231677831335_1.pdf?1748027204000.pdf
A股锂矿行业2024年报及2025年Q1财报梳理分析：拒绝停产,五矿证券,2025-05-22,有色金属,https://pdf.dfcfw.com/pdf/H3_AP202505221677221393_1.pdf?1747936610000.pdf
有色金属板块2024和25Q1业绩总结：金铜铝板块盈利大增，能源金属板块盈利大幅下滑,华源证券,2025-05-21,有色金属,https://pdf.dfcfw.com/pdf/H3_AP202505211676523000_1.pdf?1747836447000.pdf
钨行业专题报告：供给指标收紧，出口管制凸显战略属性,中邮证券,2025-05-20,有色金属,https://pdf.dfcfw.com/pdf/H3_AP202505201675818117_1.pdf?1747729126000.pdf
有色金属行业周报：中美贸易和谈超预期，有助于有色金属反弹,中国银河,2025-05-20,有色金属,https://pdf.dfcfw.com/pdf/H3_AP202505201675869613_1.pdf?1747739029000.pdf
有色金属行业报告：指标收紧叠加环保督察，钨价继续上涨,中邮证券,2025-05-19,有色金属,https://pdf.dfcfw.com/pdf/H3_AP202505191675311889_1.pdf?1747662954000.pdf
金属与材料行业研究周报：宏观情绪回暖，看好基本金属向上修复,天风证券,2025-05-19,有色金属,https://pdf.dfcfw.com/pdf/H3_AP202505191675311912_1.pdf?1747663167000.pdf
有色金属行业点评报告：海外稀土价格猛涨 中国重塑战略资源话语权,国开证券,2025-05-19,有色金属,https://pdf.dfcfw.com/pdf/H3_AP202505191675331797_1.pdf?1747654161000.pdf
解码新材料行业2024年报，探寻稀土磁材、航空航天拐点机遇,五矿证券,2025-05-19,有色金属,https://pdf.dfcfw.com/pdf/H3_AP202505191675473841_1.pdf?1747675068000.pdf
A股有色金属行业2024年年报&2025年一季报业绩回顾：行业业绩反转上行趋势已经形成,中国银河,2025-05-19,有色金属,https://pdf.dfcfw.com/pdf/H3_AP202505191675479218_1.pdf?1747675601000.pdf
铜产业链深度报告：矿端短缺、冶炼出清与需求动能切换,国新证券股份,2025-05-19,有色金属,https://pdf.dfcfw.com/pdf/H3_AP202505191675496698_1.pdf?1747678498000.pdf
有色金属周报：稀土内外同涨逻辑加速，全面看多战略金属,国金证券,2025-05-19,有色金属,https://pdf.dfcfw.com/pdf/H3_AP202505191675278975_1.pdf?1747646435000.pdf
有色金属周报：中美关税摩擦缓和，工业金属价格上行,民生证券,2025-05-18,有色金属,https://pdf.dfcfw.com/pdf/H3_AP202505181674804397_1.pdf?1747582034000.pdf
有色金属 大宗金属周报：中美关税“降级”催化，成本支撑叠加库存去化，铝价大涨,华源证券,2025-05-18,有色金属,https://pdf.dfcfw.com/pdf/H3_AP202505181675020168_1.pdf?1747603545000.pdf
有色金属行业跟踪周报：中美发布日内瓦经贸会谈联合声明，避险情绪大幅回落，工业金属环比走强,东吴证券,2025-05-18,有色金属,https://pdf.dfcfw.com/pdf/H3_AP202505181675062397_1.pdf?1747653257000.pdf
钨行业跟踪报告：战略金属，价值重估,民生证券,2025-05-16,有色金属,https://pdf.dfcfw.com/pdf/H3_AP202505161673830894_1.pdf?1747411190000.pdf
黄金短期利空暴跌，或为长期投资者提供入场买点,国新证券股份,2025-05-16,有色金属,https://pdf.dfcfw.com/pdf/H3_AP202505161673931961_1.pdf?1747427393000.pdf
金属行业2024年报综述：行业利润质量已现质变，板块配置属性显现增强,东兴证券,2025-05-16,有色金属,https://pdf.dfcfw.com/pdf/H3_AP202505161673639782_1.pdf?1747382491000.pdf
金属与材料行业深度研究：24&25Q1总结：资源端金&铜领涨，材料端盈利大幅提升,天风证券,2025-05-14,有色金属,https://pdf.dfcfw.com/pdf/H3_AP202505141672548747_1.pdf?1747210795000.pdf
有色金属行业2024年年报及2025年一季报综述：贵金属主升浪带动业绩大增，工业金属静待需求复苏,华龙证券,2025-05-14,有色金属,https://pdf.dfcfw.com/pdf/H3_AP202505141672624297_1.pdf?1747227898000.pdf
有色金属行业双周报：贵金属价格小幅回调，进一步加强战略矿产出口管制,国元证券,2025-05-13,有色金属,https://pdf.dfcfw.com/pdf/H3_AP202505131672144280_1.pdf?1747146249000.pdf
金属与材料行业研究周报：宏观情绪扰动，有色震荡运行,天风证券,2025-05-12,有色金属,https://pdf.dfcfw.com/pdf/H3_AP202505121671571588_1.pdf?1747131329000.pdf
有色金属行业周报：宏观预期扰动，有色金属价格波动,中国银河,2025-05-12,有色金属,https://pdf.dfcfw.com/pdf/H3_AP202505121671571618_1.pdf?1747065181000.pdf
有色金属行业报告：钨价持续上涨，供紧需强趋势明显,中邮证券,2025-05-12,有色金属,https://pdf.dfcfw.com/pdf/H3_AP202505121671611472_1.pdf?1747131416000.pdf
有色金属：中美关键矿产的新焦点-美国关键矿产232调查,五矿证券,2025-05-12,有色金属,https://pdf.dfcfw.com/pdf/H3_AP202505121671624397_1.pdf?1747066632000.pdf
有色金属行业2024年及2025Q1业绩综述：板块业绩表现分化，2024年有色金属行业稳中有升,东莞证券,2025-05-12,有色金属,https://pdf.dfcfw.com/pdf/H3_AP202505121671657432_1.pdf?1747070049000.pdf
有色金属周报：宏观风险降温，金属价格震荡,民生证券,2025-05-11,有色金属,https://pdf.dfcfw.com/pdf/H3_AP202505111671002590_1.pdf?1746973866000.pdf
有色金属 大宗金属周报：供给端存收紧预期，氧化铝价格底部反弹,华源证券,2025-05-11,有色金属,https://pdf.dfcfw.com/pdf/H3_AP202505111671151958_1.pdf?1746995627000.pdf
有色金属行业跟踪周报：市场延续上周非农交易，美联储鹰派发言压制工业金属上行空间,东吴证券,2025-05-11,有色金属,https://pdf.dfcfw.com/pdf/H3_AP202505111671173147_1.pdf?1746995206000.pdf
有色金属周报：继续看好稀土内外同涨,国金证券,2025-05-11,有色金属,https://pdf.dfcfw.com/pdf/H3_AP202505111671211182_1.pdf?1746999773000.pdf
中国金属锑行业市场规模测算逻辑模型 头豹词条报告系列,头豹研究院,2025-05-09,有色金属,https://pdf.dfcfw.com/pdf/H3_AP202505091670099461_1.pdf?1746820153000.pdf
有色金属行业2024年和2025年一季度点评：营收净利同步攀升 经营稳健效率上扬,国开证券,2025-05-09,有色金属,https://pdf.dfcfw.com/pdf/H3_AP202505091669849964_1.pdf?1746781637000.pdf
航天新材料系列报告之一：低轨卫星的商业逻辑,五矿证券,2025-05-09,有色金属,https://pdf.dfcfw.com/pdf/H3_AP202505091669982574_1.pdf?1746801858000.pdf
金属锑行业剖析：稀缺属性铸就的巨大市场潜力 头豹词条报告系列,头豹研究院,2025-05-08,有色金属,https://pdf.dfcfw.com/pdf/H3_AP202505081669547227_1.pdf?1747135593000.pdf
