研报名称,机构名称,发布时间,行业,研报地址
有色金属行业动态点评：锂矿股价和锂盐价格的领先滞后关系,东方财富证券,2023-12-18,有色金属,https://pdf.dfcfw.com/pdf/H3_AP202312181614441333_1.pdf?1702916676000.pdf
有色与新材料周报：稀土供应指标增加，年同比增速持稳,平安证券,2023-12-18,有色金属,https://pdf.dfcfw.com/pdf/H3_AP202312181614436920_1.pdf?1702899261000.pdf
金属与材料行业研究周报：电机系列之二：轴向磁通电机有望推动汽车电动革命,天风证券,2023-12-18,有色金属,https://pdf.dfcfw.com/pdf/H3_AP202312181614436898_1.pdf?1702907791000.pdf
铝行业周报：去库持续超预期，政策利好释放提振市场,国海证券,2023-12-18,有色金属,https://pdf.dfcfw.com/pdf/H3_AP202312181614438359_1.pdf?1702908764000.pdf
有色金属行业周报：国内定调稳中求进、美联储释放偏鸽信号，板块上行逻辑不变,中泰证券,2023-12-18,有色金属,https://pdf.dfcfw.com/pdf/H3_AP202312181614439599_1.pdf?1702908480000.pdf
有色金属行业周报：工信部公布第三批稀土指标，供给增速超预期,中泰证券,2023-12-18,有色金属,https://pdf.dfcfw.com/pdf/H3_AP202312181614439645_1.pdf?1702909362000.pdf
有色行业周报：降息预期打开，推荐黄金和铜,西南证券,2023-12-18,有色金属,https://pdf.dfcfw.com/pdf/H3_AP202312181614439541_1.pdf?1702907875000.pdf
金属行业2024年度策略系列报告之工业金属&能源金属篇：千红万紫安排著，只待新雷第一声,民生证券,2023-12-17,有色金属,https://pdf.dfcfw.com/pdf/H3_AP202312161614433889_1.pdf?1702809240000.pdf
有色金属周报：海外鸽声嘹亮，国内政策驱动金属价格上行,民生证券,2023-12-17,有色金属,https://pdf.dfcfw.com/pdf/H3_AP202312171614434644_1.pdf?1702833527000.pdf
有色金属行业跟踪周报：美联储点阵图暗示降息节奏，工业金属价格全线反弹,东吴证券,2023-12-16,有色金属,https://pdf.dfcfw.com/pdf/H3_AP202312161614358551_1.pdf?1702807809000.pdf
锡行业深度（一）：全球资源供应格局重塑，新增供给释放或将低于预期,华福证券,2023-12-15,有色金属,https://pdf.dfcfw.com/pdf/H3_AP202312151614259063_1.pdf?1702633085000.pdf
锡行业深度（二）：“新”消费带来新“锡”望，期待传统需求修复,华福证券,2023-12-15,有色金属,https://pdf.dfcfw.com/pdf/H3_AP202312151614259083_1.pdf?1702631725000.pdf
有色金属周专题：历史上美联储降息前后金、铜如何演绎？,国联证券,2023-12-15,有色金属,https://pdf.dfcfw.com/pdf/H3_AP202312151614275791_1.pdf?1702649786000.pdf
硬质合金及刀具系列一：制胜高端制造，中国硬势力崛起,五矿证券,2023-12-15,有色金属,https://pdf.dfcfw.com/pdf/H3_AP202312151614276930_1.pdf?1702655759000.pdf
电解铝行业2024年度策略：宏观压制因素趋缓，需求变化决定弹性空间,东吴证券,2023-12-15,有色金属,https://pdf.dfcfw.com/pdf/H3_AP202312151614276943_1.pdf?1702656742000.pdf
中国稀土铁合金行业市场规模测算逻辑模型 头豹词条报告系列,头豹研究院,2023-12-14,有色金属,https://pdf.dfcfw.com/pdf/H3_AP202312141614146612_1.pdf?1702583219000.pdf
锂行业深度报告：全球锂资源理论成本,中邮证券,2023-12-13,有色金属,https://pdf.dfcfw.com/pdf/H3_AP202312131614091112_1.pdf?1702503879000.pdf
金属行业2024年年度策略系列报告之新材料篇：满眼生机转化钧，天工人巧日争“新”,民生证券,2023-12-13,有色金属,https://pdf.dfcfw.com/pdf/H3_AP202312131614084247_1.pdf?1702496322000.pdf
有色金属周报：非农强于预期，金价承压,德邦证券,2023-12-13,有色金属,https://pdf.dfcfw.com/pdf/H3_AP202312131614064595_1.pdf?1702455726000.pdf
有色行业周报：金价短期震荡，长牛预期仍存,甬兴证券,2023-12-13,有色金属,https://pdf.dfcfw.com/pdf/H3_AP202312131614064642_1.pdf?1702457831000.pdf
有色行业周报：关注锂板块阶段反弹机会,西南证券,2023-12-11,有色金属,https://pdf.dfcfw.com/pdf/H3_AP202312111613696040_1.pdf?1702303273000.pdf
金属与材料行业研究周报：巴斯夫携手沃莱新材，或将加速光伏复材边框应用进程,天风证券,2023-12-11,有色金属,https://pdf.dfcfw.com/pdf/H3_AP202312111613696046_1.pdf?1702294119000.pdf
有色与新材料周报：持续看好电子材料国产替代主线行情,平安证券,2023-12-11,有色金属,https://pdf.dfcfw.com/pdf/H3_AP202312111613696164_1.pdf?1702299262000.pdf
有色金属新材料年度策略：技术引领材料发展，看好未来七大方向,德邦证券,2023-12-11,有色金属,https://pdf.dfcfw.com/pdf/H3_AP202312111613696675_1.pdf?1702291039000.pdf
大宗及贵金属周报：铜矿端供应扰动加剧，非农超预期致金价下跌,国金证券,2023-12-11,有色金属,https://pdf.dfcfw.com/pdf/H3_AP202312111613696717_1.pdf?1702300328000.pdf
2024年铜精矿长单加工费点评：铜冶炼利润尚可，铜矿供应并不十分充裕,国信证券,2023-12-11,有色金属,https://pdf.dfcfw.com/pdf/H3_AP202312111613696743_1.pdf?1702301002000.pdf
金属与材料行业研究周报：美就业数据强于预期，金价短线高位回调,天风证券,2023-12-11,有色金属,https://pdf.dfcfw.com/pdf/H3_AP202312111613696808_1.pdf?1702301393000.pdf
有色金属行业周报：政治局会议定调明年“稳中求进”，利好顺周期有色金属,中国银河,2023-12-11,有色金属,https://pdf.dfcfw.com/pdf/H3_AP202312111613698152_1.pdf?1702304482000.pdf
有色金属行业报告：贵金属价格站上高位，半导体下游超预期复苏,中邮证券,2023-12-11,有色金属,https://pdf.dfcfw.com/pdf/H3_AP202312111613698215_1.pdf?1702302190000.pdf
有色金属行业周报：美国就业数据超预期短期压制金属价格，不改板块上行逻辑,中泰证券,2023-12-11,有色金属,https://pdf.dfcfw.com/pdf/H3_AP202312111613698619_1.pdf?1702303899000.pdf
有色金属行业研究：能源金属与小金属年度策略：分化延续，静待反转,国金证券,2023-12-11,有色金属,https://pdf.dfcfw.com/pdf/H3_AP202312111613698627_1.pdf?1702320030000.pdf
金属新材料年度策略：AI大时代下，核心材料有望受益,国金证券,2023-12-11,有色金属,https://pdf.dfcfw.com/pdf/H3_AP202312111613698628_1.pdf?1702303585000.pdf
有色金属行业周报：如何看待碳酸锂市场的“两个背离”？,中泰证券,2023-12-11,有色金属,https://pdf.dfcfw.com/pdf/H3_AP202312111613698661_1.pdf?1702293732000.pdf
有色金属行业周报：美劳动力市场韧性仍存扰动市场降息预期，见底预期增强锂板块迎来反弹，继续推荐黄金,华福证券,2023-12-11,有色金属,https://pdf.dfcfw.com/pdf/H3_AP202312111613698715_1.pdf?1702303131000.pdf
有色金属行业周报：从区域看有色：湖南：资源丰 潜力大 前景好,爱建证券,2023-12-11,有色金属,https://pdf.dfcfw.com/pdf/H3_AP202312111613700175_1.pdf?1702308463000.pdf
有色金属周度报告：出口数据改善，金属价格仍有支撑,信达证券,2023-12-11,有色金属,https://pdf.dfcfw.com/pdf/H3_AP202312101613694869_1.pdf?1702285739000.pdf
金属行业2024年投资展望：把握周期与成长,东兴证券,2023-12-11,有色金属,https://pdf.dfcfw.com/pdf/H3_AP202312111613695327_1.pdf?1702290256000.pdf
铝行业周报：铝价偏弱，库存持续去化，关注年底补库,国海证券,2023-12-11,有色金属,https://pdf.dfcfw.com/pdf/H3_AP202312101613694913_1.pdf?1702287914000.pdf
2024年有色金属行业策略：拨云见日,海通国际,2023-12-11,有色金属,https://pdf.dfcfw.com/pdf/H3_AP202312111613695476_1.pdf?1702309376000.pdf
2024年有色金属行业策略报告：拐点终至，周期归来,中国银河,2023-12-10,有色金属,https://pdf.dfcfw.com/pdf/H3_AP202312091613670844_1.pdf?1702207798000.pdf
有色金属行业跟踪周报：美国降息预期混乱，黄金价格震荡,东吴证券,2023-12-10,有色金属,https://pdf.dfcfw.com/pdf/H3_AP202312101613693572_1.pdf?1702206985000.pdf
有色金属周报：制造业PMI重回扩张区间，将带动金属价格上行,民生证券,2023-12-10,有色金属,https://pdf.dfcfw.com/pdf/H3_AP202312101613693660_1.pdf?1702217608000.pdf
有色金属行业周报：美国就业市场仍具韧性，短期贵金属价格震荡运行,华安证券,2023-12-10,有色金属,https://pdf.dfcfw.com/pdf/H3_AP202312101613695090_1.pdf?1702288218000.pdf
贵金属行业研究：右侧配置期，布局主升浪,国金证券,2023-12-08,有色金属,https://pdf.dfcfw.com/pdf/H3_AP202312081613632023_1.pdf?1702042620000.pdf
有色行业周报：鲍威尔发言引发市场乐观预期，金价逼近历史新高,甬兴证券,2023-12-08,有色金属,https://pdf.dfcfw.com/pdf/H3_AP202312081613632028_1.pdf?1702042210000.pdf
有色金属行业2024年投资策略：分子端稳中求进，分母端扩张可期,西南证券,2023-12-07,有色金属,https://pdf.dfcfw.com/pdf/H3_AP202312071613529829_1.pdf?1701936845000.pdf
有色金属行业周报：黄金持续上涨，等待下周非农数据确认拐点,上海证券,2023-12-06,有色金属,https://pdf.dfcfw.com/pdf/H3_AP202312061613422678_1.pdf?1701854156000.pdf
有色金属11月行业动态报告：美联储加息周期或已终结，降息预期渐起利好有色金属价格,中国银河,2023-12-06,有色金属,https://pdf.dfcfw.com/pdf/H3_AP202312061613424932_1.pdf?1701859896000.pdf
有色金属行业2024年度策略报告：分化演绎 驭变求新,国开证券,2023-12-06,有色金属,https://pdf.dfcfw.com/pdf/H3_AP202312061613478179_1.pdf?1701862008000.pdf
有色金属之工业金属2024年度策略报告：分化演绎 掌控节奏,国开证券,2023-12-06,有色金属,https://pdf.dfcfw.com/pdf/H3_AP202312061613478575_1.pdf?1701869422000.pdf
有色金属行业周报：美国降息预期再升温，黄金价格有望上涨,海通国际,2023-12-06,有色金属,https://pdf.dfcfw.com/pdf/H3_AP202312061613479991_1.pdf?1701877717000.pdf
有色金属周度报告：加息尾声渐行渐近，看好金属价格上行,信达证券,2023-12-06,有色金属,https://pdf.dfcfw.com/pdf/H3_AP202312061613483318_1.pdf?1701883875000.pdf
中国铝土矿行业市场规模测算逻辑模型 头豹词条报告系列,头豹研究院,2023-12-05,有色金属,https://pdf.dfcfw.com/pdf/H3_AP202312051613384876_1.pdf?1701806899000.pdf
3D打印材料之金属材料 头豹词条报告系列,头豹研究院,2023-12-05,有色金属,https://pdf.dfcfw.com/pdf/H3_AP202312051613384881_1.pdf?1701807567000.pdf
钒专题报告：工业味精增效+绿色价值凸显，钒需求迎来快速增长,华宝证券,2023-12-05,有色金属,https://pdf.dfcfw.com/pdf/H3_AP202312051613366388_1.pdf?1701771444000.pdf
有色金属行业月报：地缘冲突叠加美联储转鸽，贵金属价格大涨,中原证券,2023-12-05,有色金属,https://pdf.dfcfw.com/pdf/H3_AP202312051613366568_1.pdf?1701767310000.pdf
金属行业12月投资策略：实际利率回落，看好黄金和工业金属,国信证券,2023-12-05,有色金属,https://pdf.dfcfw.com/pdf/H3_AP202312051613368807_1.pdf?1701775704000.pdf
金属与材料行业研究周报：核心PCE回落符合预期，金价向上突破,天风证券,2023-12-05,有色金属,https://pdf.dfcfw.com/pdf/H3_AP202312051613366418_1.pdf?1701771888000.pdf
有色金属行业周报：降息预期升温金价上涨，供应端干扰铜价走高,安信证券,2023-12-04,有色金属,https://pdf.dfcfw.com/pdf/H3_AP202312031613221702_1.pdf?1701683295000.pdf
铝行业周报：供需双弱，库存去化，铝价震荡下行,国海证券,2023-12-04,有色金属,https://pdf.dfcfw.com/pdf/H3_AP202312031613221781_1.pdf?1701683549000.pdf
有色金属年度策略：破浪有时，静待风起,华安证券,2023-12-04,有色金属,https://pdf.dfcfw.com/pdf/H3_AP202312031613221798_1.pdf?1701683645000.pdf
金属与材料行业研究周报：苹果引领3C新“钛”势，产业链浪潮迭起,天风证券,2023-12-04,有色金属,https://pdf.dfcfw.com/pdf/H3_AP202312041613222308_1.pdf?1701683730000.pdf
有色金属行业周报：产业链负反馈加剧锂价下行,中泰证券,2023-12-04,有色金属,https://pdf.dfcfw.com/pdf/H3_AP202312041613222513_1.pdf?1701677805000.pdf
有色金属行业周报：美联储鸽声嘹亮，板块已进入上行加速期,中泰证券,2023-12-04,有色金属,https://pdf.dfcfw.com/pdf/H3_AP202312041613222514_1.pdf?1701685217000.pdf
有色金属&钢铁行业双周报：海外加息周期有望转向，国际金价格突破2000美元,东莞证券,2023-12-04,有色金属,https://pdf.dfcfw.com/pdf/H3_AP202312041613222879_1.pdf?1701685020000.pdf
能源金属周报：原料价格上行，钼价持续走高,国金证券,2023-12-04,有色金属,https://pdf.dfcfw.com/pdf/H3_AP202312041613222887_1.pdf?1701695334000.pdf
有色金属行业周报：美国通胀放缓，金价创新高，继续推荐黄金,华福证券,2023-12-04,有色金属,https://pdf.dfcfw.com/pdf/H3_AP202312041613222909_1.pdf?1701683186000.pdf
有色与新材料周报：两种二代制冷剂被禁产，供应管控政策持续落地,平安证券,2023-12-04,有色金属,https://pdf.dfcfw.com/pdf/H3_AP202312041613222521_1.pdf?1701684059000.pdf
能源金属：锂：供给持续放量，锂价中枢下移,国联证券,2023-12-04,有色金属,https://pdf.dfcfw.com/pdf/H3_AP202312041613224250_1.pdf?1701693401000.pdf
有色金属行业周报：从区域看有色：新疆：兼具区位、资源、成本等优势,爱建证券,2023-12-04,有色金属,https://pdf.dfcfw.com/pdf/H3_AP202312041613224467_1.pdf?1701702584000.pdf
有色金属：Cobre铜矿关停，铜矿供应格局或发生改变,华金证券,2023-12-04,有色金属,https://pdf.dfcfw.com/pdf/H3_AP202312041613231654_1.pdf?1701711493000.pdf
盐矿型稀土 头豹词条报告系列,头豹研究院,2023-12-04,有色金属,https://pdf.dfcfw.com/pdf/H3_AP202312041613237296_1.pdf?1701723892000.pdf
有色金属周报：联储“放鸽”，黄金拉升,德邦证券,2023-12-04,有色金属,https://pdf.dfcfw.com/pdf/H3_AP202312041613224901_1.pdf?1701687937000.pdf
有色金属行业周报：美联储降息预期提高，金价表现强势,开源证券,2023-12-04,有色金属,https://pdf.dfcfw.com/pdf/H3_AP202312041613224957_1.pdf?1701686238000.pdf
钛行业专题报告：为什么是“钛”？,中航证券,2023-12-04,有色金属,https://pdf.dfcfw.com/pdf/H3_AP202312041613225047_1.pdf?1701702182000.pdf
有色行业周报：推荐黄金，关注碳酸锂触底反弹机会,西南证券,2023-12-04,有色金属,https://pdf.dfcfw.com/pdf/H3_AP202312041613227092_1.pdf?1701697328000.pdf
有色金属周报：加息周期有望终结，金属价格或将全线上行,民生证券,2023-12-03,有色金属,https://pdf.dfcfw.com/pdf/H3_AP202312031613220155_1.pdf?1701597681000.pdf
有色金属行业周报：当前金价上涨具备可持续性吗？,国联证券,2023-12-03,有色金属,https://pdf.dfcfw.com/pdf/H3_AP202312031613220481_1.pdf?1701598913000.pdf
有色金属行业周报：黄金价格逼近历史高点，锂企业减产或调整生产,中邮证券,2023-12-03,有色金属,https://pdf.dfcfw.com/pdf/H3_AP202312031613221222_1.pdf?1701623743000.pdf
有色金属行业周报：美债利率下行金价走高，关注海外铜矿供给扰动,华安证券,2023-12-03,有色金属,https://pdf.dfcfw.com/pdf/H3_AP202312031613221255_1.pdf?1701625538000.pdf
有色金属行业跟踪周报：海外利率宽松预期叠加衰退预期，黄金价格易涨难跌,东吴证券,2023-12-02,有色金属,https://pdf.dfcfw.com/pdf/H3_AP202312021613220094_1.pdf?1701597865000.pdf
有色金属行业月度点评：有色板块持续走弱，黄金价格小幅回升,财信证券,2023-12-01,有色金属,https://pdf.dfcfw.com/pdf/H3_AP202312011613161470_1.pdf?1701442393000.pdf
中国氢氧化铝行业市场规模测算逻辑模型 头豹词条报告系列,头豹研究院,2023-12-01,有色金属,https://pdf.dfcfw.com/pdf/H3_AP202312011613172913_1.pdf?1701460164000.pdf
有色金属行业周报：渐进衰退预期利好的黄金与持续高位的铀,上海证券,2023-11-29,有色金属,https://pdf.dfcfw.com/pdf/H3_AP202311291612735565_1.pdf?1701279006000.pdf
真“锂”探寻系列10：海外盐湖23Q3跟踪：业绩下滑，阿根廷增量将显现,民生证券,2023-11-28,有色金属,https://pdf.dfcfw.com/pdf/H3_AP202311281612494321_1.pdf?1701194022000.pdf
有色行业周报：美国10月通胀数据影响延续，铜金价格或震荡上行,甬兴证券,2023-11-28,有色金属,https://pdf.dfcfw.com/pdf/H3_AP202311281612494825_1.pdf?1701197039000.pdf
有色金属11月周专题：锂价何时止跌？,国联证券,2023-11-27,有色金属,https://pdf.dfcfw.com/pdf/H3_AP202311261612383283_1.pdf?1701080809000.pdf
有色金属行业周报：市场预期美联储加息结束，黄金站上2000美元,中邮证券,2023-11-27,有色金属,https://pdf.dfcfw.com/pdf/H3_AP202311261612383311_1.pdf?1701076534000.pdf
有色金属周度报告：欧盟斥资四万亿升级电网，金属价格仍有支撑,信达证券,2023-11-27,有色金属,https://pdf.dfcfw.com/pdf/H3_AP202311261612383323_1.pdf?1701080322000.pdf
铝行业周报：限产超预期，库存持续去化,国海证券,2023-11-27,有色金属,https://pdf.dfcfw.com/pdf/H3_AP202311261612383340_1.pdf?1701079306000.pdf
有色行业周报：锂盐加速探底，关注反弹机会,西南证券,2023-11-27,有色金属,https://pdf.dfcfw.com/pdf/H3_AP202311271612386179_1.pdf?1701083010000.pdf
有色金属行业周报：需求平淡，锂价继续下行,中泰证券,2023-11-27,有色金属,https://pdf.dfcfw.com/pdf/H3_AP202311271612386216_1.pdf?1701082623000.pdf
有色金属行业周报：美联储释放鸽派信号，板块上行趋势进一步增强,中泰证券,2023-11-27,有色金属,https://pdf.dfcfw.com/pdf/H3_AP202311271612386222_1.pdf?1701082039000.pdf
有色金属行业周报：乐观预期延续推动国际金价走强，继续推荐黄金,华福证券,2023-11-27,有色金属,https://pdf.dfcfw.com/pdf/H3_AP202311271612386234_1.pdf?1701081548000.pdf
有色与新材料周报：看好半导体复苏在即，驱动电子化学品需求上行,平安证券,2023-11-27,有色金属,https://pdf.dfcfw.com/pdf/H3_AP202311271612386241_1.pdf?1701081725000.pdf
有色金属行业周报：从区域看有色：江西省新旧并举 延链升级,爱建证券,2023-11-27,有色金属,https://pdf.dfcfw.com/pdf/H3_AP202311271612386697_1.pdf?1701092680000.pdf
有色金属行业周报：Markit制造业PMI指数不及预期，黄金价格获支撑,华鑫证券,2023-11-27,有色金属,https://pdf.dfcfw.com/pdf/H3_AP202311271612389268_1.pdf?1701095931000.pdf
有色金属周报：人民币升值，金价短期承压,德邦证券,2023-11-27,有色金属,https://pdf.dfcfw.com/pdf/H3_AP202311271612384696_1.pdf?1701074380000.pdf
金属与材料行业研究周报：高功率密度时代到来，开启新型电机铁芯材料机遇之门,天风证券,2023-11-27,有色金属,https://pdf.dfcfw.com/pdf/H3_AP202311271612384871_1.pdf?1701083928000.pdf
有色金属行业周报：地产政策支持积极，美元指数下行提振金属价格,安信证券,2023-11-27,有色金属,https://pdf.dfcfw.com/pdf/H3_AP202311271612384909_1.pdf?1701084075000.pdf
有色金属行业周报：欧盟电网改造计划推出，工业金属需求有望提振,开源证券,2023-11-27,有色金属,https://pdf.dfcfw.com/pdf/H3_AP202311271612385791_1.pdf?1701078464000.pdf
大宗及贵金属周报：美国经济韧性尚存，金价维持强势,国金证券,2023-11-26,有色金属,https://pdf.dfcfw.com/pdf/H3_AP202311261612382250_1.pdf?1701012066000.pdf
能源金属周报：悲观预期演绎，碳酸锂期货价格大幅下调,国金证券,2023-11-26,有色金属,https://pdf.dfcfw.com/pdf/H3_AP202311261612382251_1.pdf?1701014723000.pdf
金属与材料行业研究周报：乐观预期驱动，国际金价走势偏强,天风证券,2023-11-26,有色金属,https://pdf.dfcfw.com/pdf/H3_AP202311261612382272_1.pdf?1701007626000.pdf
有色金属行业周报：金价走势偏强，钴、锂需求仍待修复,华安证券,2023-11-26,有色金属,https://pdf.dfcfw.com/pdf/H3_AP202311261612382349_1.pdf?1701010441000.pdf
有色金属周报：欧盟推四万亿电网升级计划，金属价格稳步回升,民生证券,2023-11-26,有色金属,https://pdf.dfcfw.com/pdf/H3_AP202311261612381910_1.pdf?1700987759000.pdf
有色金属行业跟踪周报：海外经济数据持续恶化，衰退情绪显现，海外黄金价格上涨,东吴证券,2023-11-26,有色金属,https://pdf.dfcfw.com/pdf/H3_AP202311261612382204_1.pdf?1701000666000.pdf
钛的新时代（二）：消费电子新驱动，钛材+加工持续受益,中邮证券,2023-11-24,有色金属,https://pdf.dfcfw.com/pdf/H3_AP202311241612223093_1.pdf?1700833938000.pdf
有色金属：钛合金切入3C领域，关注原料及加工领域优质标的,华安证券,2023-11-24,有色金属,https://pdf.dfcfw.com/pdf/H3_AP202311241612224717_1.pdf?1700839618000.pdf
稀土精密加工 头豹词条报告系列,头豹研究院,2023-11-24,有色金属,https://pdf.dfcfw.com/pdf/H3_AP202311241612232335_1.pdf?1700855676000.pdf
有色金属行业年度策略：拨云见雾配黄金，心无旁骛选择铝，守得云开握稀土,中原证券,2023-11-24,有色金属,https://pdf.dfcfw.com/pdf/H3_AP202311241612247856_1.pdf?1700860080000.pdf
稀土镍合金 头豹词条报告系列,头豹研究院,2023-11-24,有色金属,https://pdf.dfcfw.com/pdf/H3_AP202311241612232337_1.pdf?1700855560000.pdf
有色金属行业深度：新能源发展对铜需求的影响,五矿证券,2023-11-23,有色金属,https://pdf.dfcfw.com/pdf/H3_AP202311231612203666_1.pdf?1700747075000.pdf
有色行业周报：美国10月通胀延续下行，铜金有望受益,甬兴证券,2023-11-23,有色金属,https://pdf.dfcfw.com/pdf/H3_AP202311231612204247_1.pdf?1700750046000.pdf
有色行业周报：美联储偏鹰发言压制金价，工业金属供需格局有望好转,甬兴证券,2023-11-22,有色金属,https://pdf.dfcfw.com/pdf/H3_AP202311221611846177_1.pdf?1700638547000.pdf
铜月度数据跟踪：宏观压制减轻，铜价或将反弹,华福证券,2023-11-22,有色金属,https://pdf.dfcfw.com/pdf/H3_AP202311221612023731_1.pdf?1700679508000.pdf
锑月度数据跟踪：原料进口增加，锑品出口季节性回落，锑价短期缺乏上行动力,华福证券,2023-11-22,有色金属,https://pdf.dfcfw.com/pdf/H3_AP202311221612027758_1.pdf?1700680053000.pdf
铝月度数据跟踪：云南减产落地，支撑高位铝价,华福证券,2023-11-22,有色金属,https://pdf.dfcfw.com/pdf/H3_AP202311221611846169_1.pdf?1700640562000.pdf
有色行业周报：美国通胀数据放缓 继续看多金价,首创证券,2023-11-21,有色金属,https://pdf.dfcfw.com/pdf/H3_AP202311211611754769_1.pdf?1700558456000.pdf
锂产业链月度追踪：10月供给收缩带动锂价反弹，11月进口激增致锂价承压下跌,华福证券,2023-11-21,有色金属,https://pdf.dfcfw.com/pdf/H3_AP202311211611762504_1.pdf?1700583673000.pdf
有色金属行业：锡月度数据跟踪：10月精矿进口符合预期，矿端紧张局面或于12月份开始凸显,华福证券,2023-11-21,有色金属,https://pdf.dfcfw.com/pdf/H3_AP202311211611769729_1.pdf?1700595081000.pdf
有色金属行业周报：从区域看有色：福建省扬优成势 强链提质,爱建证券,2023-11-20,有色金属,https://pdf.dfcfw.com/pdf/H3_AP202311201611682294_1.pdf?1700475598000.pdf
有色金属行业周报：需求弱势供给增加，锂价进一步下行,中泰证券,2023-11-20,有色金属,https://pdf.dfcfw.com/pdf/H3_AP202311201611683268_1.pdf?1700478126000.pdf
有色金属行业周报：美国通胀超预期下行，大宗板块上行逻辑再获增强,中泰证券,2023-11-20,有色金属,https://pdf.dfcfw.com/pdf/H3_AP202311201611683270_1.pdf?1700481774000.pdf
有色金属行业周报：加息尾声临近，黄金或将迎来战略配置佳点,开源证券,2023-11-20,有色金属,https://pdf.dfcfw.com/pdf/H3_AP202311201611683335_1.pdf?1700479925000.pdf
有色金属周报：CPI低于预期，金铜上行开启，新材料多点开花,德邦证券,2023-11-20,有色金属,https://pdf.dfcfw.com/pdf/H3_AP202311201611683415_1.pdf?1700478391000.pdf
有色金属：2023年10月中国社会融资规模为1845.2亿元，同比上升102.01%，环比下降55.33%,海通国际,2023-11-20,有色金属,https://pdf.dfcfw.com/pdf/H3_AP202311201611685297_1.pdf?1700491509000.pdf
铝行业周报：限产落地，库存去化,国海证券,2023-11-20,有色金属,https://pdf.dfcfw.com/pdf/H3_AP202311201611684192_1.pdf?1700486150000.pdf
金属行业2024年度投资策略：长宜为锚丘壑逢时，周期底位拥抱资源,开源证券,2023-11-20,有色金属,https://pdf.dfcfw.com/pdf/H3_AP202311201611688908_1.pdf?1700497135000.pdf
钛的新时代（一）：产能持续扩张，向高端化迈进,中邮证券,2023-11-20,有色金属,https://pdf.dfcfw.com/pdf/H3_AP202311201611687099_1.pdf?1700499350000.pdf
中国氧化铝行业市场规模测算逻辑模型 头豹词条报告系列,头豹研究院,2023-11-20,有色金属,https://pdf.dfcfw.com/pdf/H3_AP202311201611699766_1.pdf?1700509983000.pdf
有色金属周度报告：美国加息或临近尾声，金属价格有望企稳上行,信达证券,2023-11-20,有色金属,https://pdf.dfcfw.com/pdf/H3_AP202311191611679382_1.pdf?1700471320000.pdf
有色金属行业深度报告：“底部掘金”系列之一：能源金属投资手册,民生证券,2023-11-20,有色金属,https://pdf.dfcfw.com/pdf/H3_AP202311191611679628_1.pdf?1700473277000.pdf
大宗及贵金属周报：美国通胀回落，停止加息预期推涨金价,国金证券,2023-11-20,有色金属,https://pdf.dfcfw.com/pdf/H3_AP202311201611680397_1.pdf?1700486270000.pdf
