研报名称,机构名称,发布时间,行业,研报地址
有色金属行业周报：关注锂钴等能源金属的投资机遇,中邮证券,2025-08-12,有色金属,https://pdf.dfcfw.com/pdf/H3_AP202508121726178683_1.pdf?1755019037000.pdf
有色新材料行业周报：金属价格回暖，有色领涨,太平洋,2025-08-11,有色金属,https://pdf.dfcfw.com/pdf/H3_AP202508111725663303_1.pdf?1754947313000.pdf
有色金属行业周报：预期美联储年内3次降息，看好黄金股,华鑫证券,2025-08-11,有色金属,https://pdf.dfcfw.com/pdf/H3_AP202508111725687714_1.pdf?1754987981000.pdf
有色金属行业周报：锂矿供应收缩，美联储降息预期升温,中国银河,2025-08-11,有色金属,https://pdf.dfcfw.com/pdf/H3_AP202508111725453892_1.pdf?1754923593000.pdf
有色金属行业跟踪周报：中国央行连续9个月购金，Stephen-Miran获联储理事提名，降息预期升温助推金价上行,东吴证券,2025-08-11,有色金属,https://pdf.dfcfw.com/pdf/H3_AP202508111725502140_1.pdf?1754944844000.pdf
有色金属周报：重视锂大矿停产，稀土错杀布局机会,国金证券,2025-08-10,有色金属,https://pdf.dfcfw.com/pdf/H3_AP202508101724924562_1.pdf?1754846208000.pdf
有色金属周报：宏观因子共振，商品价格上涨动力强,民生证券,2025-08-10,有色金属,https://pdf.dfcfw.com/pdf/H3_AP202508101724944933_1.pdf?1754848336000.pdf
美国黄金需求趋势2025年Q2,世界黄金协会,2025-08-10,有色金属,https://pdf.dfcfw.com/pdf/H3_AP202508101724987597_1.pdf?1754861817000.pdf
金属与材料行业研究周报：宁德锂矿停产靴子落地，碳酸锂或迎价值重估,天风证券,2025-08-10,有色金属,https://pdf.dfcfw.com/pdf/H3_AP202508101725017257_1.pdf?1754856771000.pdf
有色金属大宗金属周报：矿端扰动，碳酸锂期货价格大涨,华源证券,2025-08-10,有色金属,https://pdf.dfcfw.com/pdf/H3_AP202508101725043724_1.pdf?1754896830000.pdf
2025年有色金属标杆企业组织效能报告：价格周期上行 资源瓶颈凸显 智造转型深化 全球产业布局,北京顺为人和企业咨询,2025-08-08,有色金属,https://pdf.dfcfw.com/pdf/H3_AP202508081723543582_1.pdf?1754648000000.pdf
有色金属行业深度：日本财团资源布局分析-矿业巨头启示录系列之四：广积粮，筑高墙,五矿证券,2025-08-07,有色金属,https://pdf.dfcfw.com/pdf/H3_AP202508071723317949_1.pdf?1754639989000.pdf
有色金属行业报告：美国就业数据下滑刺激贵金属价格上行,中邮证券,2025-08-07,有色金属,https://pdf.dfcfw.com/pdf/H3_AP202508071723092010_1.pdf?1754577163000.pdf
有色新材料行业周报：绩优股分红在即，关注稀土涨价,太平洋,2025-08-06,有色金属,https://pdf.dfcfw.com/pdf/H3_AP202508061722342457_1.pdf?1754467692000.pdf
有色金属行业专题研究：锑出口修复在望，边际需求反转有望拉动锑价上行,天风证券,2025-08-05,有色金属,https://pdf.dfcfw.com/pdf/H3_AP202508051721982187_1.pdf?1754415426000.pdf
有色金属：非农下修+人事变动，黄金迎金融、货币属性共振,天风证券,2025-08-05,有色金属,https://pdf.dfcfw.com/pdf/H3_AP202508051721982182_1.pdf?1754415426000.pdf
有色金属行业双周报：能源金属与轻稀土领涨，市场呈现结构性分化,国元证券,2025-08-05,有色金属,https://pdf.dfcfw.com/pdf/H3_AP202508051721949357_1.pdf?1754423818000.pdf
2025年上半年有色金属行业信用风险总结及展望,联合资信,2025-08-04,有色金属,https://pdf.dfcfw.com/pdf/H3_AP202508041721493919_1.pdf?1754379825000.pdf
有色金属行业周报：美就业数据走弱，降息预期升温利好金属价格,中国银河,2025-08-04,有色金属,https://pdf.dfcfw.com/pdf/H3_AP202508041721292889_1.pdf?1754321797000.pdf
有色金属行业跟踪周报：美国7月非农就业数据大幅遇冷，“避险交易”回归黄金新一轮涨势开启,东吴证券,2025-08-04,有色金属,https://pdf.dfcfw.com/pdf/H3_AP202508041721298536_1.pdf?1754318447000.pdf
有色金属大宗金属周报：铜232关税范围不包含精炼铜，美铜大跌,华源证券,2025-08-03,有色金属,https://pdf.dfcfw.com/pdf/H3_AP202508031720842360_1.pdf?1754250752000.pdf
金属与材料行业研究周报：非农下修衰退预期再起，看好金价上行,天风证券,2025-08-03,有色金属,https://pdf.dfcfw.com/pdf/H3_AP202508031720842430_1.pdf?1754253031000.pdf
有色金属行业周报：非农数据大幅低于预期，贵金属上行动力再次增强,华鑫证券,2025-08-03,有色金属,https://pdf.dfcfw.com/pdf/H3_AP202508031720910326_1.pdf?1754264279000.pdf
有色金属行业首席联盟培训框架,天风证券,2025-08-03,有色金属,https://pdf.dfcfw.com/pdf/H3_AP202508021720223508_1.pdf?1754227756000.pdf
钴行业动态报告：原料进口大幅下降，钴价第二轮上涨启动,民生证券,2025-08-03,有色金属,https://pdf.dfcfw.com/pdf/H3_AP202508021720319365_1.pdf?1754229362000.pdf
有色金属周报：稀土、钼价继续看多，锑价或迎拐点,国金证券,2025-08-03,有色金属,https://pdf.dfcfw.com/pdf/H3_AP202508031720624597_1.pdf?1754240646000.pdf
有色金属周报：降息概率大增，工业金属+贵金属价格齐飞,民生证券,2025-08-03,有色金属,https://pdf.dfcfw.com/pdf/H3_AP202508031720738131_1.pdf?1754236673000.pdf
有色金属行业双周报：美联储表态偏鹰，年内降息预期弱化,东莞证券,2025-08-01,有色金属,https://pdf.dfcfw.com/pdf/H3_AP202508011719471784_1.pdf?1754049796000.pdf
稀土行业深度：稀土产业链，优势在我,太平洋,2025-08-01,有色金属,https://pdf.dfcfw.com/pdf/H3_AP202508011719561920_1.pdf?1754062614000.pdf
铀行业专题报告：政策催化与地缘脱钩共振，推动浓缩铀环节战略价值重估,华源证券,2025-07-31,有色金属,https://pdf.dfcfw.com/pdf/H3_AP202507301718546671_1.pdf?1753948510000.pdf
有色金属：关税纠偏后，铜价的可能走向,联储证券,2025-07-31,有色金属,https://pdf.dfcfw.com/pdf/H3_AP202507311719012867_1.pdf?1753984058000.pdf
有色金属行业周报：美联储降息或再有变动，关注铜关税带来的库存变化,华龙证券,2025-07-29,有色金属,https://pdf.dfcfw.com/pdf/H3_AP202507291717819066_1.pdf?1753812004000.pdf
有色金属行业跟踪周报：国内“反内卷”正从情绪推动走向政策落地验证期，工业金属走势料将分化,东吴证券,2025-07-28,有色金属,https://pdf.dfcfw.com/pdf/H3_AP202507281716792264_1.pdf?1753687751000.pdf
有色金属周报：缅甸矿扰动或进一步推涨稀土价格，钼价新高可期,国金证券,2025-07-28,有色金属,https://pdf.dfcfw.com/pdf/H3_AP202507281716967235_1.pdf?1753690356000.pdf
有色金属行业研究：铜物质流跟踪报告：2025H1铜需求透支几何,国金证券,2025-07-28,有色金属,https://pdf.dfcfw.com/pdf/H3_AP202507281716994026_1.pdf?1753695025000.pdf
有色金属行业周报：黄金仍未突破震荡区间，伦银进一步上涨,华鑫证券,2025-07-28,有色金属,https://pdf.dfcfw.com/pdf/H3_AP202507281716996344_1.pdf?1753694750000.pdf
有色金属行业报告：供需失衡催化小金属牛市，钨、钴、稀土价格有望继续上涨,中邮证券,2025-07-28,有色金属,https://pdf.dfcfw.com/pdf/H3_AP202507281717055532_1.pdf?1753704176000.pdf
有色金属：美国锑产业支持政策是否会复刻稀土产业政策趋势？,五矿证券,2025-07-28,有色金属,https://pdf.dfcfw.com/pdf/H3_AP202507281717187085_1.pdf?1753722443000.pdf
有色金属行业周报：“反内卷”情绪持续发酵，锂价底部强势反弹,中国银河,2025-07-28,有色金属,https://pdf.dfcfw.com/pdf/H3_AP202507281717307020_1.pdf?1753739379000.pdf
有色金属大宗金属周报：国内矿端扰动加剧，锂价底部回升,华源证券,2025-07-27,有色金属,https://pdf.dfcfw.com/pdf/H3_AP202507271716691764_1.pdf?1753650766000.pdf
金属与材料行业研究周报：供给收缩预期叠加反内卷催化，碳酸锂波动率放大,天风证券,2025-07-27,有色金属,https://pdf.dfcfw.com/pdf/H3_AP202507271716691795_1.pdf?1753650564000.pdf
有色金属周报：国内“反内卷”持续升温，能源金属涨幅亮眼,民生证券,2025-07-27,有色金属,https://pdf.dfcfw.com/pdf/H3_AP202507271716563225_1.pdf?1753632197000.pdf
有色金属：碳酸锂底部区间明确，供需边际改善,中邮证券,2025-07-25,有色金属,https://pdf.dfcfw.com/pdf/H3_AP202507251715254757_1.pdf?1753439377000.pdf
工业金属周度观察,国新证券股份,2025-07-25,有色金属,https://pdf.dfcfw.com/pdf/H3_AP202507251715439649_1.pdf?1753466425000.pdf
A股有色金属行业2025Q2基金持仓分析：基金小幅增持，子行业持仓结构调整,中国银河,2025-07-24,有色金属,https://pdf.dfcfw.com/pdf/H3_AP202507241714769819_1.pdf?1753372095000.pdf
铝行业深度：资源全球配套，绿电铝产业链有潜力,太平洋,2025-07-24,有色金属,https://pdf.dfcfw.com/pdf/H3_AP202507241714776238_1.pdf?1753371234000.pdf
有色金属：稀土行业点评：战略地位凸显，板块迎来戴维斯双击,中航证券,2025-07-23,有色金属,https://pdf.dfcfw.com/pdf/H3_AP202507231714186569_1.pdf?1753287430000.pdf
能源及有色行业2025下半年投资策略：透视商品周期，看好下游高质量发展驱动,东海证券,2025-07-23,有色金属,https://pdf.dfcfw.com/pdf/H3_AP202507231714218835_1.pdf?1753290412000.pdf
2025年中国液态金属行业概览：液态金属赋能工业新变革（精华版）,头豹研究院,2025-07-23,有色金属,https://pdf.dfcfw.com/pdf/H3_AP202507231714284246_1.pdf?1753303231000.pdf
有色金属行业双周报：反内卷行情持续发酵，金属价格普涨,国元证券,2025-07-22,有色金属,https://pdf.dfcfw.com/pdf/H3_AP202507221713395279_1.pdf?1753171840000.pdf
有色新材料行业周报（7_14-7_20）：板块盈利向好，涨价品种热度高,太平洋,2025-07-22,有色金属,https://pdf.dfcfw.com/pdf/H3_AP202507221713642078_1.pdf?1753206494000.pdf
有色金属 大宗金属周报：反内卷行情扩散，商品价格普涨,华源证券,2025-07-21,有色金属,https://pdf.dfcfw.com/pdf/H3_AP202507201712521010_1.pdf?1753083101000.pdf
金属与材料行业研究周报：从“反内卷”到“稳增长”，强政策预期下重视有色行情,天风证券,2025-07-21,有色金属,https://pdf.dfcfw.com/pdf/H3_AP202507211712791740_1.pdf?1753086647000.pdf
有色金属行业事件点评：金属价格涨跌互现，关注细分领域投资机遇,东莞证券,2025-07-21,有色金属,https://pdf.dfcfw.com/pdf/H3_AP202507211712874500_1.pdf?1753097294000.pdf
有色金属行业周报：“反内卷”政策预期强化催生底部金属机遇,中国银河,2025-07-21,有色金属,https://pdf.dfcfw.com/pdf/H3_AP202507211712920615_1.pdf?1753106814000.pdf
有色金属行业报告：宏观预期向好叠加“反内卷”交易，金属价格普涨,中邮证券,2025-07-21,有色金属,https://pdf.dfcfw.com/pdf/H3_AP202507211713007524_1.pdf?1753115664000.pdf
有色金属行业周报：仍然看好金银比向下修复，白银价格潜力大,华鑫证券,2025-07-21,有色金属,https://pdf.dfcfw.com/pdf/H3_AP202507211713143429_1.pdf?1753135424000.pdf
有色金属周报：国内“反内卷”叠加美国财政扩张，金属价格普涨,民生证券,2025-07-20,有色金属,https://pdf.dfcfw.com/pdf/H3_AP202507191711903926_1.pdf?1753008425000.pdf
有色金属周报：坚定看好稀土板块业绩估值共振,国金证券,2025-07-20,有色金属,https://pdf.dfcfw.com/pdf/H3_AP202507201712412703_1.pdf?1753032884000.pdf
有色金属行业跟踪周报：美国通胀率走高压制估值，国内弱现实强预期背景下，工业金属价格震荡偏弱,东吴证券,2025-07-20,有色金属,https://pdf.dfcfw.com/pdf/H3_AP202507201712521050_1.pdf?1753052736000.pdf
有色金属行业2025年中期投资策略：中长期看好金铜铝，重视战略金属,西南证券,2025-07-18,有色金属,https://pdf.dfcfw.com/pdf/H3_AP202507181711244186_1.pdf?1752859591000.pdf
能源及稀有金属周度观察,国新证券股份,2025-07-18,有色金属,https://pdf.dfcfw.com/pdf/H3_AP202507181711309310_1.pdf?1752869526000.pdf
有色金属行业双周报：业绩预告报喜，催化小金属板块上扬,东莞证券,2025-07-18,有色金属,https://pdf.dfcfw.com/pdf/H3_AP202507181711372589_1.pdf?1752877649000.pdf
贵金属周度观察,国新证券股份,2025-07-17,有色金属,https://pdf.dfcfw.com/pdf/H3_AP202507171710498231_1.pdf?1752770537000.pdf
有色新材料周报：多数公司业绩向好，部分小金属涨价,太平洋,2025-07-17,有色金属,https://pdf.dfcfw.com/pdf/H3_AP202507171710582821_1.pdf?1752785561000.pdf
有色月跟踪：掘金亚欧大陆腹地，中亚金属矿产资源全景解析,五矿证券,2025-07-16,有色金属,https://pdf.dfcfw.com/pdf/H3_AP202507161709869619_1.pdf?1752665042000.pdf
工业金属行业2025年中期报告：下行有限 震荡待变,国开证券,2025-07-16,有色金属,https://pdf.dfcfw.com/pdf/H3_AP202507161709983845_1.pdf?1752680447000.pdf
铜行业：特朗普拟征收50%铜关税：或将引发全球铜价格波动和供应链重构,大公国际,2025-07-14,有色金属,https://pdf.dfcfw.com/pdf/H3_AP202507141708562715_1.pdf?1752487037000.pdf
有色金属行业报告：下游招标频繁，看好氧化镨钕供需改善,中邮证券,2025-07-14,有色金属,https://pdf.dfcfw.com/pdf/H3_AP202507141708623542_1.pdf?1752493420000.pdf
有色金属行业周报：黄金&稀土迎来贸易战与中报业绩的双重催化,中国银河,2025-07-14,有色金属,https://pdf.dfcfw.com/pdf/H3_AP202507141708693867_1.pdf?1752503235000.pdf
有色行业点评：美国加征50％铜关税的市场震荡与全球产业重塑,国新证券股份,2025-07-14,有色金属,https://pdf.dfcfw.com/pdf/H3_AP202507141708721958_1.pdf?1752507930000.pdf
能源及稀有金属周度观察,国新证券股份,2025-07-14,有色金属,https://pdf.dfcfw.com/pdf/H3_AP202507141708721957_1.pdf?1752507592000.pdf
有色金属行业周报：白银价格大幅上行，金银比或迎来向下修复期,华鑫证券,2025-07-14,有色金属,https://pdf.dfcfw.com/pdf/H3_AP202507141708744729_1.pdf?1752509547000.pdf
有色金属周报：美铜关税加征在即，关注铜长逻辑配置机会,平安证券,2025-07-13,有色金属,https://pdf.dfcfw.com/pdf/H3_AP202507131708306139_1.pdf?1752448312000.pdf
金属与材料行业研究周报：战略重估，MP价格下限或打开稀土价格天花板,天风证券,2025-07-13,有色金属,https://pdf.dfcfw.com/pdf/H3_AP202507131708308560_1.pdf?1752449717000.pdf
有色金属周报：美进口关税扰动铜价，金银价格企稳上行,民生证券,2025-07-13,有色金属,https://pdf.dfcfw.com/pdf/H3_AP202507131708150129_1.pdf?1752425551000.pdf
有色金属 大宗金属周报：关税落地，铜价承压,华源证券,2025-07-13,有色金属,https://pdf.dfcfw.com/pdf/H3_AP202507131708218748_1.pdf?1752440635000.pdf
有色金属周报：稀土“海外底价”定出，内外同涨逐步兑现,国金证券,2025-07-13,有色金属,https://pdf.dfcfw.com/pdf/H3_AP202507131708295444_1.pdf?1752446144000.pdf
有色金属周期组：“反内卷”政策对周期子行业的影响探讨,东兴证券,2025-07-11,有色金属,https://pdf.dfcfw.com/pdf/H3_AP202507111706808787_1.pdf?1752227884000.pdf
有色金属行业：印尼镍产业园区低碳转型,中央财经大学绿色金融国际研究院,2025-07-11,有色金属,https://pdf.dfcfw.com/pdf/H3_AP202507111706812988_1.pdf?1752228377000.pdf
有色金属行业深度：战略性矿产系列报告—钾：粮食保障，资源为王,五矿证券,2025-07-10,有色金属,https://pdf.dfcfw.com/pdf/H3_AP202507101706250843_1.pdf?1752147420000.pdf
有色金属：新疆维吾尔自治区“找矿行动”聚焦南疆，国内锑资源接续有望提速,五矿证券,2025-07-10,有色金属,https://pdf.dfcfw.com/pdf/H3_AP202507101706428754_1.pdf?1752171506000.pdf
工业金属周度观察,国新证券股份,2025-07-10,有色金属,https://pdf.dfcfw.com/pdf/H3_AP202507101706435869_1.pdf?1752173025000.pdf
有色金属行业周报：大美丽法案通过推升美国赤字，金价震荡回升,中国银河,2025-07-08,有色金属,https://pdf.dfcfw.com/pdf/H3_AP202507081705147765_1.pdf?1752009697000.pdf
2025年7月中国上市矿业与金属公司2024年回顾及未来展望,安永(中国)企业咨询,2025-07-07,有色金属,https://pdf.dfcfw.com/pdf/H3_AP202507071704408482_1.pdf?1751880715000.pdf
有色金属行业双周报：新能源金属反弹，受供给端钴价持续上涨,国元证券,2025-07-07,有色金属,https://pdf.dfcfw.com/pdf/H3_AP202507071704629614_1.pdf?1751921170000.pdf
有色金属行业周报：需求淡季，铜铝价格走高后或以高位震荡为主,华鑫证券,2025-07-07,有色金属,https://pdf.dfcfw.com/pdf/H3_AP202507071704736594_1.pdf?1751926515000.pdf
有色新材料行业周报：有色金属供需旺盛，新材料带动新变化,太平洋,2025-07-07,有色金属,https://pdf.dfcfw.com/pdf/H3_AP202507071704716510_1.pdf?1751924944000.pdf
绿色氢能及相关商品贸易的潜力,国际可再生能源署,2025-07-06,有色金属,https://pdf.dfcfw.com/pdf/H3_AP202507051703239351_1.pdf?1751796045000.pdf
有色金属行业：AI驱动行业市场发展，铜缆也有高端应用,深圳汉鼎智库咨询服务,2025-07-06,有色金属,https://pdf.dfcfw.com/pdf/H3_AP202507051703239355_1.pdf?1751795651000.pdf
美国减税法案落地，铜金共振,民生证券,2025-07-06,有色金属,https://pdf.dfcfw.com/pdf/H3_AP202507061703867723_1.pdf?1751804632000.pdf
有色金属周报：大美丽法案推升美国财政赤字，看好金价长期走势,国金证券,2025-07-06,有色金属,https://pdf.dfcfw.com/pdf/H3_AP202507061704035196_1.pdf?1751828058000.pdf
金属与材料行业研究周报：宏观定价主导，铜铝高位震荡,天风证券,2025-07-06,有色金属,https://pdf.dfcfw.com/pdf/H3_AP202507061704043384_1.pdf?1751833947000.pdf
有色金属行业跟踪周报：联储7月降息预期被修正，工业金属价格维持震荡走势,东吴证券,2025-07-06,有色金属,https://pdf.dfcfw.com/pdf/H3_AP202507061704097727_1.pdf?1751877352000.pdf
有色金属行业报告：滞胀交易驱动金属价格上行,中邮证券,2025-07-06,有色金属,https://pdf.dfcfw.com/pdf/H3_AP202507061704161899_1.pdf?1751875860000.pdf
有色金属 大宗金属周报：232调查和降息预期交织催化，铜价震荡偏强,华源证券,2025-07-06,有色金属,https://pdf.dfcfw.com/pdf/H3_AP202507061703991061_1.pdf?1751820521000.pdf
有色金属行业2025年中期策略报告：新秩序、新经济，金属的重新锚定与价值重估,华龙证券,2025-07-04,有色金属,https://pdf.dfcfw.com/pdf/H3_AP202507041702930977_1.pdf?1751662249000.pdf
有色金属行业双周报：出口审批有望加快，稀土行业或将延续景气,东莞证券,2025-07-04,有色金属,https://pdf.dfcfw.com/pdf/H3_AP202507041702821000_1.pdf?1751654196000.pdf
工业金属周度观察,国新证券股份,2025-07-03,有色金属,https://pdf.dfcfw.com/pdf/H3_AP202507031702314064_1.pdf?1751574312000.pdf
金属行业中期投资策略：供给收缩需求稳增，逆全球化下金属价值重估,国信证券,2025-07-02,有色金属,https://pdf.dfcfw.com/pdf/H3_AP202507021701495153_1.pdf?1751461662000.pdf
有色金属：钨价创出历史新高，短期回调不改长期向好,五矿证券,2025-07-02,有色金属,https://pdf.dfcfw.com/pdf/H3_AP202507021701595801_1.pdf?1751472560000.pdf
央行黄金储备调查2025年6月,世界黄金协会,2025-07-01,有色金属,https://pdf.dfcfw.com/pdf/H3_AP202507011700782569_1.pdf?1751357345000.pdf
有色金属行业周报：美联储表态鸽派，降息预期升温利好金价,中国银河,2025-07-01,有色金属,https://pdf.dfcfw.com/pdf/H3_AP202507011701029668_1.pdf?1751393164000.pdf
有色金属：海外锑资源热点新项目进度几何？,五矿证券,2025-07-01,有色金属,https://pdf.dfcfw.com/pdf/H3_AP202507011701137579_1.pdf?1751405922000.pdf
推进清洁金属印尼镍和铝工业中的自备发电脱碳,落基山脉研究所,2025-06-30,有色金属,https://pdf.dfcfw.com/pdf/H3_AP202506301700155236_1.pdf?1751280054000.pdf
有色金属周报：伦铜铝库存持续下行，关注基本金属机会,国金证券,2025-06-30,有色金属,https://pdf.dfcfw.com/pdf/H3_AP202506301700174134_1.pdf?1751272117000.pdf
有色新材料行业周报：工业金属价格强劲，固态电池材料热度高,太平洋,2025-06-30,有色金属,https://pdf.dfcfw.com/pdf/H3_AP202506301700262893_1.pdf?1751283773000.pdf
金属与材料行业研究周报：美元弱势叠加降息交易预期再起，有色偏强运行,天风证券,2025-06-30,有色金属,https://pdf.dfcfw.com/pdf/H3_AP202506301700273423_1.pdf?1751285156000.pdf
有色金属行业报告：美经济软着陆可能性提升拉动工业金属价格,中邮证券,2025-06-30,有色金属,https://pdf.dfcfw.com/pdf/H3_AP202506301700332052_1.pdf?1751295420000.pdf
有色金属周报：宏观情绪修复叠加基本面驱动渐强，关注工业金属行情,平安证券,2025-06-30,有色金属,https://pdf.dfcfw.com/pdf/H3_AP202506301700465211_1.pdf?1751323520000.pdf
有色金属：易涨难跌的铜价，降息预期打开上行空间,五矿证券,2025-06-30,有色金属,https://pdf.dfcfw.com/pdf/H3_AP202506301700466604_1.pdf?1751310868000.pdf
有色金属周报：降息预期升温，金属价格走强,民生证券,2025-06-29,有色金属,https://pdf.dfcfw.com/pdf/H3_AP202506291699348213_1.pdf?1751192634000.pdf
有色金属行业跟踪周报：中东战争结束叠加特朗普拟提前公布下任联储主席人选，市场全面转向Risk On,东吴证券,2025-06-29,有色金属,https://pdf.dfcfw.com/pdf/H3_AP202506291699868116_1.pdf?1751236572000.pdf
有色金属大宗金属周报：库存大幅去化或引发挤仓行情，铜价强势运行,华源证券,2025-06-29,有色金属,https://pdf.dfcfw.com/pdf/H3_AP202506291699868126_1.pdf?1751232801000.pdf
有色金属行业2025年中期策略报告：从黄金独秀到百花齐放,平安证券,2025-06-27,有色金属,https://pdf.dfcfw.com/pdf/H3_AP202506271698432320_1.pdf?1751018831000.pdf
钨业系列一：或跃在渊，钨产业变局中的出海机遇,五矿证券,2025-06-27,有色金属,https://pdf.dfcfw.com/pdf/H3_AP202506271698458030_1.pdf?1751023329000.pdf
有色月跟踪：小金属涨价周期已至，重视战略矿产资源价值评估,五矿证券,2025-06-25,有色金属,https://pdf.dfcfw.com/pdf/H3_AP202506251697390394_1.pdf?1750869917000.pdf
2025年有色中期策略：稀缺性裂变时代：供应瓶颈主导价格新秩序,国金证券,2025-06-25,有色金属,https://pdf.dfcfw.com/pdf/H3_AP202506251697418313_1.pdf?1750873911000.pdf
有色金属行业双周报：避险情绪支撑金价，刚果钴临时禁令延长,国元证券,2025-06-25,有色金属,https://pdf.dfcfw.com/pdf/H3_AP202506251697436056_1.pdf?1750879912000.pdf
稀土矿物及其在能源转型中的作用,德勤,2025-06-24,有色金属,https://pdf.dfcfw.com/pdf/H3_AP202506241696583259_1.pdf?1750756443000.pdf
有色金属行业周报：中东冲突升级或刺激金价，刚果（金）延长钴禁令,中国银河,2025-06-24,有色金属,https://pdf.dfcfw.com/pdf/H3_AP202506241696780106_1.pdf?1750783194000.pdf
有色金属行业跟踪周报：美国滞胀担忧或重回市场主线，工业金属本周表现不佳,东吴证券,2025-06-23,有色金属,https://pdf.dfcfw.com/pdf/H3_AP202506231695772460_1.pdf?1750669552000.pdf
有色新材料行业周报：受国际关系影响，有色金属价格有望延续强势,太平洋,2025-06-23,有色金属,https://pdf.dfcfw.com/pdf/H3_AP202506231696008073_1.pdf?1750678424000.pdf
有色金属行业报告：铀价有望重启上涨,中邮证券,2025-06-23,有色金属,https://pdf.dfcfw.com/pdf/H3_AP202506231696059358_1.pdf?1750679525000.pdf
有色金属行业周报：美联储点阵图显示年内仍会降息，金价上涨动力仍存,华鑫证券,2025-06-23,有色金属,https://pdf.dfcfw.com/pdf/H3_AP202506231696271758_1.pdf?1750709473000.pdf
有色金属行业2025年中期策略：筑底向上，渐入佳境,中国银河,2025-06-23,有色金属,https://pdf.dfcfw.com/pdf/H3_AP202506231696130444_1.pdf?1750691130000.pdf
有色金属及新材料行业半年度策略：周期与成长共舞，稳中求进,中原证券,2025-06-22,有色金属,https://pdf.dfcfw.com/pdf/H3_AP202506211695143960_1.pdf?1750585765000.pdf
有色金属周报：商品价格偏强震荡，钴或迎变局,民生证券,2025-06-22,有色金属,https://pdf.dfcfw.com/pdf/H3_AP202506221695144015_1.pdf?1750586701000.pdf
有色金属 大宗金属周报：年中长单谈判悬而未决，铜价震荡,华源证券,2025-06-22,有色金属,https://pdf.dfcfw.com/pdf/H3_AP202506221695657827_1.pdf?1750623895000.pdf
有色金属行业周报：铜铝库存均现低位，金属价格中枢有望抬升,平安证券,2025-06-22,有色金属,https://pdf.dfcfw.com/pdf/H3_AP202506221695657796_1.pdf?1750623895000.pdf
钴行业专题：供需失衡背景下，刚果（金）政策调整主导钴价,国信证券,2025-06-22,有色金属,https://pdf.dfcfw.com/pdf/H3_AP202506221695447939_1.pdf?1750599371000.pdf
金属与材料行业研究周报：社库持续去化，支撑铝价短期偏强运行,天风证券,2025-06-22,有色金属,https://pdf.dfcfw.com/pdf/H3_AP202506221695515363_1.pdf?1750605684000.pdf
有色金属周报：刚果金再延3月钴出口禁令，价格或迎来上涨,国金证券,2025-06-22,有色金属,https://pdf.dfcfw.com/pdf/H3_AP202506221695515400_1.pdf?1750604184000.pdf
