研报名称,机构名称,发布时间,行业,研报地址
海外十二大铜矿企业三季报汇总：海外企业铜矿供应增速较低,华鑫证券,2024-11-22,有色金属,https://pdf.dfcfw.com/pdf/H3_AP202411221641028740_1.pdf?1732296343000.pdf
有色金属脉动跟踪：铜铝材出口退税取消，美元走强主要金属价格承压,五矿证券,2024-11-21,有色金属,https://pdf.dfcfw.com/pdf/H3_AP202411211641000508_1.pdf?1732186285000.pdf
有色金属：下游需求超预期，锂价反弹动能仍在,华安证券,2024-11-21,有色金属,https://pdf.dfcfw.com/pdf/H3_AP202411211641000898_1.pdf?1732194377000.pdf
工业金属行业点评：铝材出口退税取消，成本或将转嫁,天风证券,2024-11-21,有色金属,https://pdf.dfcfw.com/pdf/H3_AP202411211641012816_1.pdf?1732216452000.pdf
有色金属：财政部取消铜材、铝材出口退税，加工贸易的“供给侧改革”,五矿证券,2024-11-20,有色金属,https://pdf.dfcfw.com/pdf/H3_AP202411201640977831_1.pdf?1732110625000.pdf
有色金属：十倍增长潜力来袭：镁合金耐蚀性突破开启市场增量新蓝海,五矿证券,2024-11-20,有色金属,https://pdf.dfcfw.com/pdf/H3_AP202411201640978332_1.pdf?1732113548000.pdf
有色金属行业行业深度报告：国企改革系列研究-国企改革助力有色央国企估值重塑,中国银河,2024-11-20,有色金属,https://pdf.dfcfw.com/pdf/H3_AP202411201640982150_1.pdf?1732121896000.pdf
有色金属行业周报：降息预期走弱美元走强，金属价格调整,太平洋,2024-11-19,有色金属,https://pdf.dfcfw.com/pdf/H3_AP202411191640951908_1.pdf?1732004120000.pdf
海外黄金股观察系列之九：科尔黛伦：历史悠久，步履蹒跚,民生证券,2024-11-19,有色金属,https://pdf.dfcfw.com/pdf/H3_AP202411191640953413_1.pdf?1732014516000.pdf
有色金属：Bald Hill 矿山关停，锂矿产能继续出清,中泰证券,2024-11-19,有色金属,https://pdf.dfcfw.com/pdf/H3_AP202411191640953580_1.pdf?1732011980000.pdf
有色金属行业十倍股分析,海通国际,2024-11-19,有色金属,https://pdf.dfcfw.com/pdf/H3_AP202411191640964098_1.pdf?1732041175000.pdf
有色金属行业2025年上半年投资策略：黄金压舱铸辉煌，铜铝稀金映日长,东莞证券,2024-11-18,有色金属,https://pdf.dfcfw.com/pdf/H3_AP202411171640928948_1.pdf?1731912333000.pdf
工业金属框架系列（一）：有色行业深度研究：铝：面向未来的金属,国海证券,2024-11-18,有色金属,https://pdf.dfcfw.com/pdf/H3_AP202411181640929066_1.pdf?1731913694000.pdf
有色金属行业报告：短期利空出尽，金属价格有望反弹,中邮证券,2024-11-18,有色金属,https://pdf.dfcfw.com/pdf/H3_AP202411181640930445_1.pdf?1731923607000.pdf
有色金属行业：2025年是锂电新周期的起点,海通国际,2024-11-18,有色金属,https://pdf.dfcfw.com/pdf/H3_AP202411181640942103_1.pdf?1731963537000.pdf
有色金属行业周报：美联储降息预期波动叠加出口限制，主要金属价格震荡,华龙证券,2024-11-18,有色金属,https://pdf.dfcfw.com/pdf/H3_AP202411181640945849_1.pdf?1731964609000.pdf
铝行业周报：铝材出口退税将取消，氧化铝价格继续上扬,国海证券,2024-11-18,有色金属,https://pdf.dfcfw.com/pdf/H3_AP202411181640932862_1.pdf?1731935102000.pdf
有色金属行业周报：财税总局取消铜材、铝材出口退税，或影响铜铝内外盘价差,华鑫证券,2024-11-18,有色金属,https://pdf.dfcfw.com/pdf/H3_AP202411181640934403_1.pdf?1731942885000.pdf
有色金属行业周报：铜铝材出口退税取消，锂中期供需预期改善,中国银河,2024-11-18,有色金属,https://pdf.dfcfw.com/pdf/H3_AP202411181640938986_1.pdf?1731948634000.pdf
有色金属行业跟踪周报：鹰派的联储表态叠加通胀数据抬头，强美元压制有色金属走势,东吴证券,2024-11-17,有色金属,https://pdf.dfcfw.com/pdf/H3_AP202411171640927357_1.pdf?1731804932000.pdf
有色金属行业：美联储降息+国内化债组合拳，战略看多大宗不变,中泰证券,2024-11-17,有色金属,https://pdf.dfcfw.com/pdf/H3_AP202411171640927553_1.pdf?1731842244000.pdf
有色金属行业周报：美元指数走强，压制金属短期运行,华福证券,2024-11-17,有色金属,https://pdf.dfcfw.com/pdf/H3_AP202411171640928799_1.pdf?1731876361000.pdf
有色金属周报：强美元致商品承压，期待金属价格反弹,民生证券,2024-11-17,有色金属,https://pdf.dfcfw.com/pdf/H3_AP202411171640927570_1.pdf?1731856469000.pdf
海外黄金股观察系列之八：B2Gold：低成本黄金矿企的扩张之路,民生证券,2024-11-17,有色金属,https://pdf.dfcfw.com/pdf/H3_AP202411171640927586_1.pdf?1731857391000.pdf
有色金属与新材料周报：两部门取消铝材出口退税，电解铝内外价差或调整,平安证券,2024-11-17,有色金属,https://pdf.dfcfw.com/pdf/H3_AP202411171640928499_1.pdf?1731872371000.pdf
金属与材料24Q3总结：资源端铜价下跌、材料端季节性调整致盈利回落,天风证券,2024-11-17,有色金属,https://pdf.dfcfw.com/pdf/H3_AP202411171640927771_1.pdf?1731864043000.pdf
大宗&贵金属周报：出口退税取消不改中长期出口优势,国金证券,2024-11-17,有色金属,https://pdf.dfcfw.com/pdf/H3_AP202411171640927777_1.pdf?1731864043000.pdf
有色金属大宗金属周报：铜铝材出口退税取消，内盘铜铝价格承压,华源证券,2024-11-17,有色金属,https://pdf.dfcfw.com/pdf/H3_AP202411171640928379_1.pdf?1731879742000.pdf
稀土＆小金属周报：锑品纳入两用物项，缅甸新征资源费抬升稀土成本曲线,国金证券,2024-11-17,有色金属,https://pdf.dfcfw.com/pdf/H3_AP202411171640927787_1.pdf?1731864990000.pdf
能源金属＆新材料周报：碳酸锂价格冲高回落，稀土永磁板块震荡调整,华源证券,2024-11-17,有色金属,https://pdf.dfcfw.com/pdf/H3_AP202411171640928674_1.pdf?1731881666000.pdf
化工新材料行业周报：美元指数走强，国际油价承压,平安证券,2024-11-17,有色金属,https://pdf.dfcfw.com/pdf/H3_AP202411171640928691_1.pdf?1731872192000.pdf
金属与材料行业研究周报：美债收益率维持高位，金银价格承压,天风证券,2024-11-17,有色金属,https://pdf.dfcfw.com/pdf/H3_AP202411171640928757_1.pdf?1731885665000.pdf
有色金属行业周报：海内外政策持续发力，金价高位震荡,太平洋,2024-11-17,有色金属,https://pdf.dfcfw.com/pdf/H3_AP202411171640928752_1.pdf?1731874712000.pdf
铀行业专题报告：AI时代的关键资源品，全球核电复兴，铀矿景气反转,华源证券,2024-11-15,有色金属,https://pdf.dfcfw.com/pdf/H3_AP202411151640904094_1.pdf?1731657469000.pdf
有色行业周报：电解铝价格大涨 碳酸锂价格反弹,首创证券,2024-11-15,有色金属,https://pdf.dfcfw.com/pdf/H3_AP202411151640909288_1.pdf?1731698548000.pdf
有色金属行业2024年三季报综述：主要金属价格维持高位，贵金属板块先行复苏,华龙证券,2024-11-15,有色金属,https://pdf.dfcfw.com/pdf/H3_AP202411151640912299_1.pdf?1731686389000.pdf
有色金属脉动跟踪：废钨产业效益显著，再生业务薄利待解,五矿证券,2024-11-14,有色金属,https://pdf.dfcfw.com/pdf/H3_AP202411141640875928_1.pdf?1731576167000.pdf
有色行业周报：美国大选落地，美联储降息符合预期，金属价格震荡,甬兴证券,2024-11-14,有色金属,https://pdf.dfcfw.com/pdf/H3_AP202411141640886901_1.pdf?1731606919000.pdf
有色与新材料：特朗普执政对国际原油影响研究：整体弊大于利，基本面定价逻辑未变,平安证券,2024-11-14,有色金属,https://pdf.dfcfw.com/pdf/H3_AP202411141640889614_1.pdf?1731610252000.pdf
铜行业深度报告：供需视角：历史新高或是起点，看好未来长期表现,甬兴证券,2024-11-13,有色金属,https://pdf.dfcfw.com/pdf/H3_AP202411131640852796_1.pdf?1731496339000.pdf
有色金属行业周报：财政化债落地，有望提振有色金属价格,中国银河,2024-11-13,有色金属,https://pdf.dfcfw.com/pdf/H3_AP202411131640852817_1.pdf?1731496789000.pdf
有色金属行业镁合金板块上市公司2024Q3业绩点评：受镁价波动影响短期盈利能力承压，降费增研有望提升镁合金竞争力,华宝证券,2024-11-13,有色金属,https://pdf.dfcfw.com/pdf/H3_AP202411131640859982_1.pdf?1731519242000.pdf
上游原材料领域央企2024年三季报分析,国新证券股份,2024-11-13,有色金属,https://pdf.dfcfw.com/pdf/H3_AP202411131640860476_1.pdf?1731520390000.pdf
金属行业2025年度投资策略：把握有色供需转折，聚焦黑色供给变革,开源证券,2024-11-13,有色金属,https://pdf.dfcfw.com/pdf/H3_AP202411131640867822_1.pdf?1731534927000.pdf
有色金属行业周报：重磅政策出台支持地方政府化债，实体经济回暖利好工业金属,华龙证券,2024-11-12,有色金属,https://pdf.dfcfw.com/pdf/H3_AP202411121640827246_1.pdf?1731410181000.pdf
有色金属行业：继能源转型后，下一个刺激铜消费增长的因素是什么？,五矿证券,2024-11-12,有色金属,https://pdf.dfcfw.com/pdf/H3_AP202411121640833455_1.pdf?1731431881000.pdf
有色金属与新材料周报：海内外宏观预期落地，看好顺周期金属品种,平安证券,2024-11-11,有色金属,https://pdf.dfcfw.com/pdf/H3_AP202411111640806352_1.pdf?1731313490000.pdf
有色金属行业报告：美国大选落地，黄金避险情绪走弱,中邮证券,2024-11-11,有色金属,https://pdf.dfcfw.com/pdf/H3_AP202411111640806481_1.pdf?1731314707000.pdf
有色金属行业：需求超预期，锂价反弹,中泰证券,2024-11-11,有色金属,https://pdf.dfcfw.com/pdf/H3_AP202411111640808024_1.pdf?1731322183000.pdf
有色金属行业周报：特朗普赢得美国大选，美联储11月谨慎降息25BP,华福证券,2024-11-11,有色金属,https://pdf.dfcfw.com/pdf/H3_AP202411111640811051_1.pdf?1731338164000.pdf
铝行业周报：万亿元化债方案落地，铝价创年内新高,国海证券,2024-11-11,有色金属,https://pdf.dfcfw.com/pdf/H3_AP202411111640816966_1.pdf?1731347819000.pdf
有色金属行业跟踪周报：美国大选落地，短期内美元指数和美债收益率的上升将对有色金属形成压力,东吴证券,2024-11-10,有色金属,https://pdf.dfcfw.com/pdf/H3_AP202411101640804022_1.pdf?1731235665000.pdf
化工新材料行业周报：特朗普执政偏空油价，OPEC+延长减产缓解供应压力,平安证券,2024-11-10,有色金属,https://pdf.dfcfw.com/pdf/H3_AP202411101640805624_1.pdf?1731270504000.pdf
有色金属与钢铁行业双周报：美国大选、11月降息双双落地，美元走强施压有色金属,东莞证券,2024-11-10,有色金属,https://pdf.dfcfw.com/pdf/H3_AP202411101640805817_1.pdf?1731324187000.pdf
有色金属行业周报：美联储如期降息25BP，支撑贵金属价格,华鑫证券,2024-11-10,有色金属,https://pdf.dfcfw.com/pdf/H3_AP202411101640805826_1.pdf?1731280041000.pdf
有色金属周报：化债新政托底国内经济，看好工业金属价格,民生证券,2024-11-10,有色金属,https://pdf.dfcfw.com/pdf/H3_AP202411101640805289_1.pdf?1731260772000.pdf
金属与材料行业研究周报：超级宏观周靴子落地，持续看好有色顺周期板块,天风证券,2024-11-10,有色金属,https://pdf.dfcfw.com/pdf/H3_AP202411101640805140_1.pdf?1731259853000.pdf
稀土&小金属周报：国内锑价逐步修复，关注供给扰动下的稀土涨价兑现,国金证券,2024-11-10,有色金属,https://pdf.dfcfw.com/pdf/H3_AP202411101640804616_1.pdf?1731250522000.pdf
能源金属&新材料周报：稀土永磁板块表现亮眼，碳酸锂强势反弹,华源证券,2024-11-10,有色金属,https://pdf.dfcfw.com/pdf/H3_AP202411101640804627_1.pdf?1731250624000.pdf
有色金属 大宗金属周报：金价承压回调，氧化铝持续大涨,华源证券,2024-11-10,有色金属,https://pdf.dfcfw.com/pdf/H3_AP202411101640804634_1.pdf?1731255527000.pdf
大宗&贵金属周报：氧化铝价持续上行，一体化铝企优势凸显,国金证券,2024-11-10,有色金属,https://pdf.dfcfw.com/pdf/H3_AP202411101640804615_1.pdf?1731250417000.pdf
海外黄金股观察系列之七：沙尘暴黄金：优秀的矿业投资者,民生证券,2024-11-09,有色金属,https://pdf.dfcfw.com/pdf/H3_AP202411091640803849_1.pdf?1731235133000.pdf
有色金属行业10月行业动态报告：国内政策将持续出台，利好有色景气上行,中国银河,2024-11-08,有色金属,https://pdf.dfcfw.com/pdf/H3_AP202411081640787826_1.pdf?1731084417000.pdf
海外黄金股观察系列之六：哈莫尼：稳健经营的南非金矿巨头,民生证券,2024-11-07,有色金属,https://pdf.dfcfw.com/pdf/H3_AP202411071640757817_1.pdf?1730973837000.pdf
有色金属脉动跟踪：大选交易金铜震荡，四重因素看好稀土产业链价值回归,五矿证券,2024-11-07,有色金属,https://pdf.dfcfw.com/pdf/H3_AP202411071640758108_1.pdf?1730974298000.pdf
有色行业周报：缅甸动乱的影响或将持续，关注美国大选,甬兴证券,2024-11-07,有色金属,https://pdf.dfcfw.com/pdf/H3_AP202411071640759120_1.pdf?1730978256000.pdf
有色金属行业2024年三季度业绩点评：三季度股价表现较差 盈利有边际放缓迹象,国开证券,2024-11-07,有色金属,https://pdf.dfcfw.com/pdf/H3_AP202411071640759396_1.pdf?1730985595000.pdf
A股有色金属行业2024年三季报业绩回顾：业绩增速小有波动，行业向好趋势不改,中国银河,2024-11-07,有色金属,https://pdf.dfcfw.com/pdf/H3_AP202411071640760444_1.pdf?1730992325000.pdf
有色金属行业行业点评报告：美国总统大选点评-特朗普当选，对有色金属行业影响几何,中国银河,2024-11-07,有色金属,https://pdf.dfcfw.com/pdf/H3_AP202411071640766093_1.pdf?1731000344000.pdf
有色金属行业2024Q3总结：Q3盈利环比回落，国内外宏观即将共振,民生证券,2024-11-07,有色金属,https://pdf.dfcfw.com/pdf/H3_AP202411071640773128_1.pdf?1731013479000.pdf
金属行业11月投资策略：宏观政策刺激下，看好金属价格走强,国信证券,2024-11-06,有色金属,https://pdf.dfcfw.com/pdf/H3_AP202411061640737529_1.pdf?1730889467000.pdf
海外黄金股观察系列之五：埃尔拉多黄金：资产优化不断，发展潜力可期,民生证券,2024-11-06,有色金属,https://pdf.dfcfw.com/pdf/H3_AP202411061640739225_1.pdf?1730900329000.pdf
有色金属行业研究：锑：出口恢复确立价格拐点，重视板块二轮布局机会,国金证券,2024-11-06,有色金属,https://pdf.dfcfw.com/pdf/H3_AP202411061640742747_1.pdf?1730908286000.pdf
有色金属行业周报：美就业数据不及预期+选情焦灼，金价或震荡上行,华龙证券,2024-11-05,有色金属,https://pdf.dfcfw.com/pdf/H3_AP202411051640713355_1.pdf?1730794534000.pdf
稀土：缅甸供给扰动超预期叠加“供改”整合，重视底部布局机会,国金证券,2024-11-05,有色金属,https://pdf.dfcfw.com/pdf/H3_AP202411051640713429_1.pdf?1730796380000.pdf
有色金属2024Q3基金持仓分析：Q3持仓比例环比下降，机构小幅减持工业金属,国联证券,2024-11-05,有色金属,https://pdf.dfcfw.com/pdf/H3_AP202411051640716535_1.pdf?1730812948000.pdf
有色金属行业周度观察,国新证券股份,2024-11-05,有色金属,https://pdf.dfcfw.com/pdf/H3_AP202411051640718556_1.pdf?1730821461000.pdf
有色金属行业点评报告：海关恢复氧化锑出口编码，国内锑价有望上行,开源证券,2024-11-05,有色金属,https://pdf.dfcfw.com/pdf/H3_AP202411051640730481_1.pdf?1730838010000.pdf
金属与材料行业研究周报：非农新增就业人数巩固降息预期，有望持续支撑金价,天风证券,2024-11-04,有色金属,https://pdf.dfcfw.com/pdf/H3_AP202411031640687753_1.pdf?1730712468000.pdf
铝行业周报：环保政策影响铝加工开工率，氧化铝维持强势,国海证券,2024-11-04,有色金属,https://pdf.dfcfw.com/pdf/H3_AP202411031640689726_1.pdf?1730707608000.pdf
有色金属行业周报：海外核心通胀韧性较强，看好金属价格上涨,太平洋,2024-11-04,有色金属,https://pdf.dfcfw.com/pdf/H3_AP202411041640693846_1.pdf?1730721217000.pdf
有色金属：北方稀土挂牌价环比继续提升,中泰证券,2024-11-04,有色金属,https://pdf.dfcfw.com/pdf/H3_AP202411041640695366_1.pdf?1730734708000.pdf
有色金属与新材料周报：供应扰动与宏观预期共振，关注有色金属板块机会,平安证券,2024-11-04,有色金属,https://pdf.dfcfw.com/pdf/H3_AP202411041640698389_1.pdf?1730735103000.pdf
有色金属行业周报：PMI升至荣枯线之上，铜铝或迎来偏强走势,华鑫证券,2024-11-04,有色金属,https://pdf.dfcfw.com/pdf/H3_AP202411041640699799_1.pdf?1730738094000.pdf
有色金属2024Q3业绩总结：工业金属利润环比收缩，贵金属业绩持续兑现,国联证券,2024-11-04,有色金属,https://pdf.dfcfw.com/pdf/H3_AP202411041640709185_1.pdf?1730757656000.pdf
有色金属：海外供应端扰动，或将提升稀土价格,华安证券,2024-11-04,有色金属,https://pdf.dfcfw.com/pdf/H3_AP202411041640693861_1.pdf?1730725485000.pdf
2024年H2有色行业总结与展望,中邮证券,2024-11-04,有色金属,https://pdf.dfcfw.com/pdf/H3_AP202411041640694058_1.pdf?1730735187000.pdf
有色金属行业报告：临近美国大选，稀土等优势战略小金属重要性凸显,中邮证券,2024-11-04,有色金属,https://pdf.dfcfw.com/pdf/H3_AP202411041640694067_1.pdf?1730729842000.pdf
有色金属行业跟踪周报：市场等待美国大选结果及国内财政政策细则公布，工业金属维持震荡走势,东吴证券,2024-11-03,有色金属,https://pdf.dfcfw.com/pdf/H3_AP202411031640686002_1.pdf?1730627428000.pdf
有色行业周报：美国大选进入白热化阶段，金价续创新高,甬兴证券,2024-11-03,有色金属,https://pdf.dfcfw.com/pdf/H3_AP202411031640686456_1.pdf?1730631135000.pdf
有色金属 大宗金属周报：“特朗普交易”逆转，金价高位调整,华源证券,2024-11-03,有色金属,https://pdf.dfcfw.com/pdf/H3_AP202411031640687714_1.pdf?1730671275000.pdf
能源金属＆新材料周报：碳酸锂价格底部反弹，稀土永磁板块涨幅领先,华源证券,2024-11-03,有色金属,https://pdf.dfcfw.com/pdf/H3_AP202411031640687716_1.pdf?1730709997000.pdf
战略看多系列：铝-供应刚性、资源重估,中泰证券,2024-11-03,有色金属,https://pdf.dfcfw.com/pdf/H3_AP202411021640684819_1.pdf?1730645612000.pdf
有色行业三季报总结：资源端企业盈利能力继续提升,国金证券,2024-11-03,有色金属,https://pdf.dfcfw.com/pdf/H3_AP202411031640686775_1.pdf?1730644593000.pdf
有色金属行业研究：大宗&贵金属周报：成本及需求驱动铝价，一体化铝企有望受益,国金证券,2024-11-03,有色金属,https://pdf.dfcfw.com/pdf/H3_AP202411031640686777_1.pdf?1730646708000.pdf
稀土＆小金属周报：供给扰动加剧叠加政策催化，整体看多稀土、战略小金属,国金证券,2024-11-03,有色金属,https://pdf.dfcfw.com/pdf/H3_AP202411031640686778_1.pdf?1730646608000.pdf
化工新材料行业周报：原油基本面边际好转，下周重点聚焦美国大选,平安证券,2024-11-03,有色金属,https://pdf.dfcfw.com/pdf/H3_AP202411031640688338_1.pdf?1730661952000.pdf
有色金属周报：工业金属价格高位震荡，金价续创新高,民生证券,2024-11-02,有色金属,https://pdf.dfcfw.com/pdf/H3_AP202411021640685791_1.pdf?1730630706000.pdf
有色金属行业周报：工信部、国家发改委两部门部署建设新材料中试平台,五矿证券,2024-11-01,有色金属,https://pdf.dfcfw.com/pdf/H3_AP202411011640662546_1.pdf?1730472803000.pdf
中国稀土铝合金行业市场规模测算逻辑模型 头豹词条报告系列,头豹研究院,2024-11-01,有色金属,https://pdf.dfcfw.com/pdf/H3_AP202411011640676473_1.pdf?1730492370000.pdf
有色金属：以史为镜，再迎稀土磁材布局机会,海通国际,2024-11-01,有色金属,https://pdf.dfcfw.com/pdf/H3_AP202411011640677162_1.pdf?1730494838000.pdf
有色金属脉动跟踪：核电新时代，小金属锆有大作为,五矿证券,2024-10-31,有色金属,https://pdf.dfcfw.com/pdf/H3_AP202410311640639704_1.pdf?1730390649000.pdf
有色行业周报：电解铝价格继续强势 金价震荡上行,首创证券,2024-10-30,有色金属,https://pdf.dfcfw.com/pdf/H3_AP202410301640598096_1.pdf?1730309087000.pdf
有色金属行业周报：金价续创新高，期待财政政策落地效果,华龙证券,2024-10-29,有色金属,https://pdf.dfcfw.com/pdf/H3_AP202410291640571033_1.pdf?1730235775000.pdf
有色金属行业深度报告：铝制合金提质增效，终端应用蓄势待发,东莞证券,2024-10-29,有色金属,https://pdf.dfcfw.com/pdf/H3_AP202410291640571106_1.pdf?1730223612000.pdf
有色金属行业周报：供弱需强氧化铝持续上行，地缘局势升级凸显黄金避险属性,华福证券,2024-10-28,有色金属,https://pdf.dfcfw.com/pdf/H3_AP202410281640530121_1.pdf?1730103838000.pdf
化工新材料行业周报：多国推进降息政策，有望刺激原油需求,平安证券,2024-10-28,有色金属,https://pdf.dfcfw.com/pdf/H3_AP202410281640530282_1.pdf?1730105246000.pdf
有色金属行业：缅甸供应不确定性增大，稀土价格回升,中泰证券,2024-10-28,有色金属,https://pdf.dfcfw.com/pdf/H3_AP202410281640532606_1.pdf?1730115017000.pdf
有色金属行业定期报告：增量政策有望持续出台，继续战略看多大宗板块,中泰证券,2024-10-28,有色金属,https://pdf.dfcfw.com/pdf/H3_AP202410281640531681_1.pdf?1730114731000.pdf
有色金属行业周报：避险属性带来支撑，看好黄金长牛走势,太平洋,2024-10-28,有色金属,https://pdf.dfcfw.com/pdf/H3_AP202410281640533277_1.pdf?1730122371000.pdf
有色金属行业周报：再通胀预期升温，黄金价格继续上行,中国银河,2024-10-28,有色金属,https://pdf.dfcfw.com/pdf/H3_AP202410281640533830_1.pdf?1730128021000.pdf
有色金属与钢铁行业双周报：市场静待美国大选到来， 贵金属价格得到明显支撑,东莞证券,2024-10-28,有色金属,https://pdf.dfcfw.com/pdf/H3_AP202410281640542071_1.pdf?1730155798000.pdf
铜月报（202410）：等待宏观局势明朗，通胀预期反弹或将再度驱动铜价上行,华福证券,2024-10-28,有色金属,https://pdf.dfcfw.com/pdf/H3_AP202410281640532175_1.pdf?1730127113000.pdf
有色金属行业跟踪周报：市场定价中期通胀及利率中枢上移，黄金维持震荡向上走势,东吴证券,2024-10-27,有色金属,https://pdf.dfcfw.com/pdf/H3_AP202410271640525805_1.pdf?1730031087000.pdf
铝行业周报：铝价震荡，氧化铝继续上扬，关注需求变化,国海证券,2024-10-27,有色金属,https://pdf.dfcfw.com/pdf/H3_AP202410271640529327_1.pdf?1730100628000.pdf
大宗&贵金属周报：氧化铝强势，重点关注一体化铝企,国金证券,2024-10-27,有色金属,https://pdf.dfcfw.com/pdf/H3_AP202410271640525757_1.pdf?1730040400000.pdf
有色金属大宗金属周报：氧化铝供给端持续扰动，11月金价波动率预计放大,华源证券,2024-10-27,有色金属,https://pdf.dfcfw.com/pdf/H3_AP202410271640525901_1.pdf?1730040184000.pdf
能源金属＆新材料周报：碳酸锂震荡运行，关注软磁材料配置机会,华源证券,2024-10-27,有色金属,https://pdf.dfcfw.com/pdf/H3_AP202410271640525903_1.pdf?1730040400000.pdf
有色金属周报：工业金属涨跌不一，黄金价格创新高,民生证券,2024-10-27,有色金属,https://pdf.dfcfw.com/pdf/H3_AP202410271640526399_1.pdf?1730057972000.pdf
金属与材料行业研究周报：宏观政策提振，铝价持续上涨,天风证券,2024-10-27,有色金属,https://pdf.dfcfw.com/pdf/H3_AP202410271640527992_1.pdf?1730048720000.pdf
稀土&小金属周报：缅甸供给扰动加剧，继续看多稀土磁材板块,国金证券,2024-10-27,有色金属,https://pdf.dfcfw.com/pdf/H3_AP202410271640528045_1.pdf?1730059454000.pdf
有色行业周报：国内经济政策提振工业金属需求预期 金价再创新高,首创证券,2024-10-25,有色金属,https://pdf.dfcfw.com/pdf/H3_AP202410251640491189_1.pdf?1729854407000.pdf
有色金属脉动跟踪：白银工业属性何时凸显,五矿证券,2024-10-25,有色金属,https://pdf.dfcfw.com/pdf/H3_AP202410251640497235_1.pdf?1729864321000.pdf
镁合金能否成为新的汽车轻量化材料：价格腰斩,五矿证券,2024-10-25,有色金属,https://pdf.dfcfw.com/pdf/H3_AP202410251640507207_1.pdf?1729882720000.pdf
海外黄金股观察系列之三：盎格鲁黄金：迟暮英雄，尚能饭否？,民生证券,2024-10-25,有色金属,https://pdf.dfcfw.com/pdf/H3_AP202410251640508986_1.pdf?1729879272000.pdf
2024年中国钨金属行业概览,头豹研究院,2024-10-24,有色金属,https://pdf.dfcfw.com/pdf/H3_AP202410241640469707_1.pdf?1729799176000.pdf
中国铜导体材料行业市场规模测算逻辑模型 头豹词条报告系列,头豹研究院,2024-10-24,有色金属,https://pdf.dfcfw.com/pdf/H3_AP202410241640469730_1.pdf?1729798549000.pdf
有色金属：“金九”钢招量再创新高，钼行业持续向好,五矿证券,2024-10-23,有色金属,https://pdf.dfcfw.com/pdf/H3_AP202410231640430033_1.pdf?1729683357000.pdf
有色行业周报：美国9月CPI超预期，金价高位震荡,甬兴证券,2024-10-23,有色金属,https://pdf.dfcfw.com/pdf/H3_AP202410231640437472_1.pdf?1729703173000.pdf
有色行业周报：全球降息潮来临叠加局部冲突升级，金价再创新高,甬兴证券,2024-10-23,有色金属,https://pdf.dfcfw.com/pdf/H3_AP202410231640441001_1.pdf?1729709289000.pdf
铝行业周报：铝价高位震荡，氧化铝仍然强势,国海证券,2024-10-22,有色金属,https://pdf.dfcfw.com/pdf/H3_AP202410221640397647_1.pdf?1729585249000.pdf
