研报名称,机构名称,发布时间,行业,研报地址
化工行业周报：通用股份柬埔寨二期首胎下线，三氯蔗糖价格明显上涨,信达证券,2024-08-31,橡胶制品,https://pdf.dfcfw.com/pdf/H3_AP202408311639676863_1.pdf?1725131534000.pdf
化工行业周报：维生素持续涨价，制冷剂R32配额调整政策落地,华龙证券,2024-08-27,橡胶制品,https://pdf.dfcfw.com/pdf/H3_AP202408271639488204_1.pdf?1724782561000.pdf
化工行业周报：维生素A、维生素E价格震荡回落,信达证券,2024-08-16,橡胶制品,https://pdf.dfcfw.com/pdf/H3_AP202408161639319477_1.pdf?1723846184000.pdf
化工行业周报：巴斯夫德国装置火灾影响生产，维生素A、维生素E等价格上扬,信达证券,2024-08-09,橡胶制品,https://pdf.dfcfw.com/pdf/H3_AP202408091639224857_1.pdf?1723239764000.pdf
天然橡胶专题报告二：十问胶市,中泰证券,2024-08-08,橡胶制品,https://pdf.dfcfw.com/pdf/H3_AP202408081639190296_1.pdf?1723114360000.pdf
化工行业周报：原油价格持续波动，巴斯夫装置事故引发维生素价格跳涨,华龙证券,2024-08-06,橡胶制品,https://pdf.dfcfw.com/pdf/H3_AP202408061639156216_1.pdf?1722939899000.pdf
化工行业周报：固特异等胎企上半年业绩明显改善，维生素价格继续上涨,信达证券,2024-08-04,橡胶制品,https://pdf.dfcfw.com/pdf/H3_AP202408041639132499_1.pdf?1722782625000.pdf
化工行业周报：政策加力支持设备更新和以旧换新，维生素等产品涨幅居前,信达证券,2024-07-27,橡胶制品,https://pdf.dfcfw.com/pdf/H3_AP202407271638377396_1.pdf?1722111817000.pdf
橡胶和塑料制造系列：材料革新，探索中国高分子改性材料行业的潜力与前景（精简版）,头豹研究院,2024-07-25,橡胶制品,https://pdf.dfcfw.com/pdf/H3_AP202407251638308701_1.pdf?1721936236000.pdf
轮胎行业月报（2024年6月）：需求保持稳健，成本端或将改善,东海证券,2024-07-24,橡胶制品,https://pdf.dfcfw.com/pdf/H3_AP202407241638256222_1.pdf?1721831445000.pdf
化工行业周报：赛轮联合央视新闻推出特别直播节目，维生素等价格有所上涨,信达证券,2024-07-21,橡胶制品,https://pdf.dfcfw.com/pdf/H3_AP202407211638147561_1.pdf?1721564314000.pdf
化工行业周报：氟化工、磷化工、轮胎、食品添加剂板块中报业绩突出，景气有望延续,华龙证券,2024-07-15,橡胶制品,https://pdf.dfcfw.com/pdf/H3_AP202407151637926325_1.pdf?1721080920000.pdf
化工行业周报：2024年中国、印度钾肥进口大合同相继落地，赛轮等公司披露业绩预告,信达证券,2024-07-14,橡胶制品,https://pdf.dfcfw.com/pdf/H3_AP202407141637886153_1.pdf?1720963668000.pdf
化工行业周报：赛轮液体黄金轮胎再出新品赛轮等上榜“2024全球轮胎品牌价值”排行榜,信达证券,2024-07-07,橡胶制品,https://pdf.dfcfw.com/pdf/H3_AP202407061637623919_1.pdf?1720348427000.pdf
化工行业周报：通用股份国内半钢二期项目与泰国二期项目成功投产,信达证券,2024-06-30,橡胶制品,https://pdf.dfcfw.com/pdf/H3_AP202406301637092814_1.pdf?1719746598000.pdf
化工行业周报：赛轮等轮胎品牌登上中国品牌500强,信达证券,2024-06-23,橡胶制品,https://pdf.dfcfw.com/pdf/H3_AP202406231636800096_1.pdf?1719155972000.pdf
化工行业周报：丁二烯、硫酸等周涨幅居前,信达证券,2024-06-14,橡胶制品,https://pdf.dfcfw.com/pdf/H3_AP202406141636302737_1.pdf?1718396757000.pdf
化工行业行业周报：化工行业周报：赛轮轮胎等国产轮胎品牌亮相德国科隆展,信达证券,2024-06-09,橡胶制品,https://pdf.dfcfw.com/pdf/H3_AP202406091635914030_1.pdf?1717950747000.pdf
化工行业周报：节能降碳行动方案出台；OPEC+分阶段延长减产,中泰证券,2024-06-04,橡胶制品,https://pdf.dfcfw.com/pdf/H3_AP202406041635326396_1.pdf?1717497772000.pdf
化工行业行业周报：化工行业周报：液氯、氯化钾等价格上扬,信达证券,2024-06-01,橡胶制品,https://pdf.dfcfw.com/pdf/H3_AP202406011635152306_1.pdf?1717273835000.pdf
化工行业周报：北美MDI装置再次扰动；长丝市场报价重心上移,中泰证券,2024-05-27,橡胶制品,https://pdf.dfcfw.com/pdf/H3_AP202405271634705636_1.pdf?1716808905000.pdf
化工行业行业周报：化工行业周报：通用股份柬埔寨基地全面达产，尿素等价格上扬,信达证券,2024-05-26,橡胶制品,https://pdf.dfcfw.com/pdf/H3_AP202405261634686002_1.pdf?1716725407000.pdf
天然橡胶投资框架及热点问题探究,中泰证券,2024-05-22,橡胶制品,https://pdf.dfcfw.com/pdf/H3_AP202405221634312070_1.pdf?1716387559000.pdf
基础化工行业2023年报与2024年一季报总结：高产能释放趋近尾声，细分子行业景气回暖,中泰证券,2024-05-20,橡胶制品,https://pdf.dfcfw.com/pdf/H3_AP202405201633855961_1.pdf?1716211905000.pdf
化工行业行业周报：化工行业周报：赛轮墨西哥轮胎项目奠基，美国发布对泰国卡客车轮胎反倾销初裁结果,信达证券,2024-05-19,橡胶制品,https://pdf.dfcfw.com/pdf/H3_AP202405191633829728_1.pdf?1716125929000.pdf
化工行业行业周报：化工行业周报：合成氨、醋酸、制冷剂、纯碱等价格上扬,信达证券,2024-05-12,橡胶制品,https://pdf.dfcfw.com/pdf/H3_AP202405121632916310_1.pdf?1715525116000.pdf
化工行业2024年中期投资策略：化工周期新起点，看好中国化工稳定供应全球,开源证券,2024-05-07,橡胶制品,https://pdf.dfcfw.com/pdf/H3_AP202405071632509023_1.pdf?1715071183000.pdf
化工行业2024年5月投资策略：化工景气有所复苏，推荐行业景气方向,国信证券,2024-04-30,橡胶制品,https://pdf.dfcfw.com/pdf/H3_AP202404301632060692_1.pdf?1714498389000.pdf
化工行业行业周报：化工行业周报：赛轮等胎企业绩向好，纯碱、制冷剂等价格上行,信达证券,2024-04-28,橡胶制品,https://pdf.dfcfw.com/pdf/H3_AP202404281631521542_1.pdf?1714316255000.pdf
化工行业行业周报：化工行业周报：甲醇、尿素、制冷剂等价格上扬,信达证券,2024-04-21,橡胶制品,https://pdf.dfcfw.com/pdf/H3_AP202404211630920127_1.pdf?1713706153000.pdf
化工行业行业周报：尿素、R32盈利上行，推荐周期弹性与成长确定性板块,中国银河,2024-04-21,橡胶制品,https://pdf.dfcfw.com/pdf/H3_AP202404211630929724_1.pdf?1713715036000.pdf
化工行业周报：仪征化纤PTA项目投产，延长石油控股成立榆能清洁能源,德邦证券,2024-04-15,橡胶制品,https://pdf.dfcfw.com/pdf/H3_AP202404151630210834_1.pdf?1713170280000.pdf
化工行业行业周报：己内酰胺、涤纶长丝价差改善，关注周期弹性与成长性机会,中国银河,2024-04-15,橡胶制品,https://pdf.dfcfw.com/pdf/H3_AP202404151630212657_1.pdf?1713172149000.pdf
化工行业行业周报：化工行业周报：赛轮液体黄金轮胎成功配套比亚迪元PLUS,信达证券,2024-04-14,橡胶制品,https://pdf.dfcfw.com/pdf/H3_AP202404141630208016_1.pdf?1713102664000.pdf
基础化工行业研究：米其林：从全球轮胎行业标杆企业看中国轮胎企业出海之路,国金证券,2024-04-14,橡胶制品,https://pdf.dfcfw.com/pdf/H3_AP202404141630208035_1.pdf?1713104862000.pdf
化工系列研究（十九）：合成生物产业化加速，生物基材料有望推动化工行业绿色发展,东海证券,2024-04-12,橡胶制品,https://pdf.dfcfw.com/pdf/H3_AP202404121630175605_1.pdf?1712929717000.pdf
轮胎行业行业专题：需求稳健，3月下旬原材料价格回落,信达证券,2024-04-10,橡胶制品,https://pdf.dfcfw.com/pdf/H3_AP202404101630109484_1.pdf?1712765735000.pdf
化工行业周报：中石化与道达尔合作建23万吨生物航煤工厂，金陵石化百亿高端日化品项目开工,德邦证券,2024-04-01,橡胶制品,https://pdf.dfcfw.com/pdf/H3_AP202404011629199232_1.pdf?1711987274000.pdf
化工行业行业周报：化工行业周报：轮胎原材料价格下行，制冷剂、氢氟酸等价格上扬,信达证券,2024-03-30,橡胶制品,https://pdf.dfcfw.com/pdf/H3_AP202403301629183719_1.pdf?1711830437000.pdf
特种轮胎 头豹词条报告系列,头豹研究院,2024-03-26,橡胶制品,https://pdf.dfcfw.com/pdf/H3_AP202403261628191957_1.pdf?1711483198000.pdf
化工行业周报：中国海油勘探发现亿吨级油田，泰州石化产业升级项目签约,德邦证券,2024-03-25,橡胶制品,https://pdf.dfcfw.com/pdf/H3_AP202403251628066556_1.pdf?1711352542000.pdf
化工行业行业周报：化工行业周报：制冷剂、橡胶、甲醇等价格上扬,信达证券,2024-03-23,橡胶制品,https://pdf.dfcfw.com/pdf/H3_AP202403231628062896_1.pdf?1711225737000.pdf
化工行业周报：碳酸锂价格中枢上移，橡胶市场挺价情绪不减,华龙证券,2024-03-19,橡胶制品,https://pdf.dfcfw.com/pdf/H3_AP202403191627212693_1.pdf?1710884822000.pdf
