研报名称,机构名称,发布时间,行业,研报地址
建筑材料行业周报：国常会聚焦城市更新，北新建材股权激励发布彰显发展信心,上海证券,2025-01-07,水泥建材,https://pdf.dfcfw.com/pdf/H3_AP202501071641832652_1.pdf?1736241287000.pdf
建筑材料行业跟踪周报：多地家居家电补贴政策延续,东吴证券,2025-01-06,水泥建材,https://pdf.dfcfw.com/pdf/H3_AP202501061641816147_1.pdf?1736168671000.pdf
建筑材料行业研究周报：年初关注周期品燥动行情，中长期看好涂料、非洲出海等成长方向,天风证券,2025-01-05,水泥建材,https://pdf.dfcfw.com/pdf/H3_AP202501051641812733_1.pdf?1736113782000.pdf
建筑材料行业周报：稳楼市工作持续推进，重视建材布局机会,开源证券,2025-01-05,水泥建材,https://pdf.dfcfw.com/pdf/H3_AP202501051641812764_1.pdf?1736148143000.pdf
建材建筑行业点评：1月问道光伏玻璃——库存拐点出现,国金证券,2025-01-03,水泥建材,https://pdf.dfcfw.com/pdf/H3_AP202501031641796001_1.pdf?1735918247000.pdf
建筑材料行业周报：水泥和玻璃价格有所下跌,国都证券,2025-01-02,水泥建材,https://pdf.dfcfw.com/pdf/H3_AP202501021641516799_1.pdf?1735850066000.pdf
建筑材料行业周报：水泥和玻璃价格继续略有下跌,国都证券,2025-01-02,水泥建材,https://pdf.dfcfw.com/pdf/H3_AP202501021641518385_1.pdf?1735855144000.pdf
建材行业周报：持续用力推动地产止跌回稳，优化政策有望持续完善,甬兴证券,2025-01-01,水泥建材,https://pdf.dfcfw.com/pdf/H3_AP202501011641502326_1.pdf?1735749156000.pdf
建筑材料行业定期报告：培育发展绿色建筑，25年城改值得期待,华福证券,2024-12-31,水泥建材,https://pdf.dfcfw.com/pdf/H3_AP202412311641483499_1.pdf?1735638176000.pdf
建筑材料行业+公司首次覆盖：房地产周期拐点可期，有望激活建筑设计与地产链需求,东吴证券,2024-12-31,水泥建材,https://pdf.dfcfw.com/pdf/H3_AP202412311641487891_1.pdf?1735658669000.pdf
建筑材料行业12月动态报告：市场逐步收尾，静待政策提振需求复苏,中国银河,2024-12-31,水泥建材,https://pdf.dfcfw.com/pdf/H3_AP202412311641489027_1.pdf?1735659452000.pdf
建筑材料行业周报：部署2025年稳楼市工作，重视建材布局机会,开源证券,2024-12-29,水泥建材,https://pdf.dfcfw.com/pdf/H3_AP202412291641463309_1.pdf?1735545767000.pdf
建筑材料行业跟踪周报：政策预期再起，消费方向受青睐,东吴证券,2024-12-29,水泥建材,https://pdf.dfcfw.com/pdf/H3_AP202412291641463382_1.pdf?1735512640000.pdf
装修建材行业深度报告：地产销售止跌回稳叠加消费支持政策，预计装修建材需求将逐步改善,东莞证券,2024-12-27,水泥建材,https://pdf.dfcfw.com/pdf/H3_AP202412271641451501_1.pdf?1735319703000.pdf
建筑建材行业2025年投资展望：内需之重下行稳致远,东兴证券,2024-12-27,水泥建材,https://pdf.dfcfw.com/pdf/H3_AP202412271641454272_1.pdf?1735325417000.pdf
建材行业2025年度策略报告：政策提振预期，供给优化扭转行业困境,中国银河,2024-12-26,水泥建材,https://pdf.dfcfw.com/pdf/H3_AP202412261641436978_1.pdf?1735234387000.pdf
建筑材料行业周报：零售端改善，静待需求进一步恢复,中国银河,2024-12-24,水泥建材,https://pdf.dfcfw.com/pdf/H3_AP202412231641405081_1.pdf?1735032182000.pdf
建筑材料行业定期报告：11月地产销售止跌回稳，建材需求改善可期,华福证券,2024-12-24,水泥建材,https://pdf.dfcfw.com/pdf/H3_AP202412241641407595_1.pdf?1735027052000.pdf
建筑材料行业周报：国常会定调专项债用于土地储备，化债形成一揽子政策,上海证券,2024-12-24,水泥建材,https://pdf.dfcfw.com/pdf/H3_AP202412241641415617_1.pdf?1735061036000.pdf
建筑材料行业跟踪周报：复苏之路曲折向上,东吴证券,2024-12-23,水泥建材,https://pdf.dfcfw.com/pdf/H3_AP202412231641390480_1.pdf?1734912499000.pdf
建筑材料行业研究周报：建材各板块四季度业绩如何展望？,天风证券,2024-12-23,水泥建材,https://pdf.dfcfw.com/pdf/H3_AP202412231641390984_1.pdf?1734941805000.pdf
建材建筑行业周观点：关注央企市值管理进展，开年逢低布局消费建材,国金证券,2024-12-23,水泥建材,https://pdf.dfcfw.com/pdf/H3_AP202412231641392586_1.pdf?1734952474000.pdf
建筑材料行业2025年年度策略：重视供给侧积极变化，静待需求回暖,天风证券,2024-12-23,水泥建材,https://pdf.dfcfw.com/pdf/H3_AP202412231641404049_1.pdf?1734988755000.pdf
建筑材料行业周报：各地持续发力稳楼市，重视建材布局机会,开源证券,2024-12-22,水泥建材,https://pdf.dfcfw.com/pdf/H3_AP202412221641390327_1.pdf?1734950243000.pdf
建筑材料行业周报：水泥和玻璃全国均价都略有下跌,国都证券,2024-12-20,水泥建材,https://pdf.dfcfw.com/pdf/H3_AP202412201641371263_1.pdf?1734688738000.pdf
建筑材料行业11月月报：淡季将至需求下行，关注供给侧积极变化,华龙证券,2024-12-20,水泥建材,https://pdf.dfcfw.com/pdf/H3_AP202412201641380611_1.pdf?1734719949000.pdf
建筑材料行业周报：中央经济工作会议推动房地产市场止跌回稳，关注企业出海布局,上海证券,2024-12-18,水泥建材,https://pdf.dfcfw.com/pdf/H3_AP202412181641341335_1.pdf?1734516057000.pdf
非金属建材行业2024年12月投资策略：会议定调更加积极，继续看好板块机会,国信证券,2024-12-17,水泥建材,https://pdf.dfcfw.com/pdf/H3_AP202412171641335764_1.pdf?1734471196000.pdf
建筑材料行业研究周报：中央经济工作会议释放积极信号，布局春季躁动+困境反转方向,天风证券,2024-12-16,水泥建材,https://pdf.dfcfw.com/pdf/H3_AP202412161641308364_1.pdf?1734337056000.pdf
建筑材料行业跟踪周报：政策落地，重视财政加杠杆方向,东吴证券,2024-12-16,水泥建材,https://pdf.dfcfw.com/pdf/H3_AP202412161641310153_1.pdf?1734347149000.pdf
建筑材料行业周报：如何理解政策发力？,华源证券,2024-12-16,水泥建材,https://pdf.dfcfw.com/pdf/H3_AP202412161641310366_1.pdf?1734348888000.pdf
建筑材料行业：中央经济工作会议点评-政策积极定调明年，关注建材细分板块机会,中国银河,2024-12-16,水泥建材,https://pdf.dfcfw.com/pdf/H3_AP202412161641310952_1.pdf?1734361008000.pdf
建材行业2025年年度策略报告：弱现实与强预期，关注供给侧变化,平安证券,2024-12-15,水泥建材,https://pdf.dfcfw.com/pdf/H3_AP202412151641307671_1.pdf?1734301412000.pdf
建筑材料行业周报：中央会议定调稳楼市，重视建材布局机会,开源证券,2024-12-15,水泥建材,https://pdf.dfcfw.com/pdf/H3_AP202412151641307819_1.pdf?1734335505000.pdf
建筑材料：中央定调“稳住楼市”，重视建材板块配置机会,华福证券,2024-12-15,水泥建材,https://pdf.dfcfw.com/pdf/H3_AP202412151641306798_1.pdf?1734278800000.pdf
2024年水泥行业信用风险总结与展望,联合资信,2024-12-13,水泥建材,https://pdf.dfcfw.com/pdf/H3_AP202412131641301340_1.pdf?1734124211000.pdf
惠誉博华2025年信用展望：水泥,惠誉博华信用评级,2024-12-13,水泥建材,https://pdf.dfcfw.com/pdf/H3_AP202412171641328105_1.pdf?1734449742000.pdf
建筑材料行业周报：韧性城市驱动建筑智能转型，关注建材行业并购重组,上海证券,2024-12-11,水泥建材,https://pdf.dfcfw.com/pdf/H3_AP202412111641255477_1.pdf?1733908334000.pdf
建筑材料行业11月动态报告：政策有望继续发力，供需结构逐步优化,中国银河,2024-12-10,水泥建材,https://pdf.dfcfw.com/pdf/H3_AP202412091641235004_1.pdf?1733822707000.pdf
2025年建筑、周期建材年度策略：财政扩张、供给侧优化下国内景气有望改善，出海机遇可期,东吴证券,2024-12-10,水泥建材,https://pdf.dfcfw.com/pdf/H3_AP202412101641242520_1.pdf?1733847734000.pdf
建筑材料行业深度研究：水泥供给侧改革逐渐迈入第二阶段，行业利润有望走出相对底部,天风证券,2024-12-10,水泥建材,https://pdf.dfcfw.com/pdf/H3_AP202412101641244042_1.pdf?1733849182000.pdf
建筑材料行业跟踪周报：期待新一轮刺激政策,东吴证券,2024-12-09,水泥建材,https://pdf.dfcfw.com/pdf/H3_AP202412091641221043_1.pdf?1733746412000.pdf
建筑材料行业研究周报：行业进入政策窗口期，关注建材机会,天风证券,2024-12-09,水泥建材,https://pdf.dfcfw.com/pdf/H3_AP202412091641221290_1.pdf?1733731996000.pdf
建筑材料：推进新型城市基础设施建设，利好建材需求改善,华福证券,2024-12-09,水泥建材,https://pdf.dfcfw.com/pdf/H3_AP202412091641225604_1.pdf?1733759895000.pdf
水泥行业周期性研究：下行何时结束，水泥行业路在何方,联合资信,2024-12-08,水泥建材,https://pdf.dfcfw.com/pdf/H3_AP202412081641219306_1.pdf?1733671562000.pdf
建筑材料行业周报：政策助楼市加速回暖，重视建材布局机会,开源证券,2024-12-08,水泥建材,https://pdf.dfcfw.com/pdf/H3_AP202412081641220216_1.pdf?1733685305000.pdf
2024年中国艺术涂料市场白皮书,艾瑞股份,2024-12-05,水泥建材,https://pdf.dfcfw.com/pdf/H3_AP202412041641184348_1.pdf?1733389949000.pdf
建筑材料行业周报：玻纤再迎复价，对冲出口退税下调压力,上海证券,2024-12-03,水泥建材,https://pdf.dfcfw.com/pdf/H3_AP202412031641157538_1.pdf?1733226495000.pdf
建筑材料：政策延续，收储推进，重视建材板块配置机会,华福证券,2024-12-03,水泥建材,https://pdf.dfcfw.com/pdf/H3_AP202412031641163461_1.pdf?1733246831000.pdf
建筑材料行业跟踪周报：PMI环比回升，建筑业相对平淡,东吴证券,2024-12-02,水泥建材,https://pdf.dfcfw.com/pdf/H3_AP202412021641131093_1.pdf?1733125816000.pdf
建筑材料：玻纤再发复价通知，关注需求恢复情况,中国银河,2024-12-02,水泥建材,https://pdf.dfcfw.com/pdf/H3_AP202412021641137444_1.pdf?1733157020000.pdf
建筑材料行业点评报告：玻纤年内二次复价，行业盈利能力有望进一步改善,华龙证券,2024-12-02,水泥建材,https://pdf.dfcfw.com/pdf/H3_AP202412021641134410_1.pdf?1733144894000.pdf
建筑材料行业2025年度投资策略：政策利好持续出台，供需格局预期向好,华龙证券,2024-12-02,水泥建材,https://pdf.dfcfw.com/pdf/H3_AP202412021641135334_1.pdf?1733149433000.pdf
建筑材料行业周报：地产利好政策密集出台，关注政策落地带来的基本面改善,华龙证券,2024-12-02,水泥建材,https://pdf.dfcfw.com/pdf/H3_AP202412021641135314_1.pdf?1733149194000.pdf
建筑材料行业研究周报：如何看待此轮玻纤涨价,天风证券,2024-12-01,水泥建材,https://pdf.dfcfw.com/pdf/H3_AP202412011641130561_1.pdf?1733086651000.pdf
建筑材料行业周报：多项楼市政策执行，重视建材布局机会,开源证券,2024-12-01,水泥建材,https://pdf.dfcfw.com/pdf/H3_AP202412011641130313_1.pdf?1733084270000.pdf
建材行业周报：10月核心城市二手房成交回暖，多项支持政策有望加速落地,甬兴证券,2024-11-27,水泥建材,https://pdf.dfcfw.com/pdf/H3_AP202411271641092342_1.pdf?1732734176000.pdf
建筑材料行业周报：一线城市取消普宅及非普宅标准，有望助力楼市企稳,上海证券,2024-11-26,水泥建材,https://pdf.dfcfw.com/pdf/H3_AP202411261641065529_1.pdf?1732613429000.pdf
建筑材料行业周报：政策有望推动需求回暖，供给优化将加速,中国银河,2024-11-26,水泥建材,https://pdf.dfcfw.com/pdf/H3_AP202411261641066400_1.pdf?1732619987000.pdf
建筑材料行业研究周报：水泥供给侧优化预期增强，市值管理新政利好破净水泥龙头,天风证券,2024-11-25,水泥建材,https://pdf.dfcfw.com/pdf/H3_AP202411251641044146_1.pdf?1732531313000.pdf
建筑材料行业跟踪周报：转型不易，适当关注并购重组方向,东吴证券,2024-11-25,水泥建材,https://pdf.dfcfw.com/pdf/H3_AP202411251641047446_1.pdf?1732546606000.pdf
建筑材料行业周报：一线城市楼市政策接力，重视建材布局机会,开源证券,2024-11-24,水泥建材,https://pdf.dfcfw.com/pdf/H3_AP202411241641043269_1.pdf?1732486686000.pdf
建筑材料行业行业深度报告：央国企引领专题-践行国企担当，引领产业升级,中国银河,2024-11-22,水泥建材,https://pdf.dfcfw.com/pdf/H3_AP202411221641023882_1.pdf?1732290472000.pdf
建筑材料行业周报：房地产契税下调，玻璃玻纤等出口退税政策调整鼓励提高产品附加值,上海证券,2024-11-20,水泥建材,https://pdf.dfcfw.com/pdf/H3_AP202411201640977602_1.pdf?1732103045000.pdf
建筑材料行业专题研究：并购潮再袭，建材盈利承压或加大并购动能，四条路径探标的,天风证券,2024-11-19,水泥建材,https://pdf.dfcfw.com/pdf/H3_AP202411191640951890_1.pdf?1732004013000.pdf
建筑材料行业10月月报：供需格局改善价格回升，关注利好政策的落地情况,华龙证券,2024-11-19,水泥建材,https://pdf.dfcfw.com/pdf/H3_AP202411191640954538_1.pdf?1732020161000.pdf
建材行业周报：优化地产税收政策落地，城中村改造政策支持扩至300城,甬兴证券,2024-11-19,水泥建材,https://pdf.dfcfw.com/pdf/H3_AP202411191640963992_1.pdf?1732038848000.pdf
建筑材料行业跟踪周报：逢低加仓财政发力的方向,东吴证券,2024-11-18,水泥建材,https://pdf.dfcfw.com/pdf/H3_AP202411181640931045_1.pdf?1731923490000.pdf
建材行业2025年投资策略：经济政策发力，建材预期反转,开源证券,2024-11-18,水泥建材,https://pdf.dfcfw.com/pdf/H3_AP202411181640932447_1.pdf?1731928958000.pdf
中国地板行业市场规模测算逻辑模型 头豹词条报告系列,头豹研究院,2024-11-18,水泥建材,https://pdf.dfcfw.com/pdf/H3_AP202411181640944692_1.pdf?1731967097000.pdf
建筑材料行业周报：政策助楼市企稳，重视建材布局机会,开源证券,2024-11-17,水泥建材,https://pdf.dfcfw.com/pdf/H3_AP202411171640928441_1.pdf?1731881920000.pdf
追寻建材行业蓝海，挖掘高股东回报,海通国际,2024-11-17,水泥建材,https://pdf.dfcfw.com/pdf/H3_AP202411171640927850_1.pdf?1731867427000.pdf
建筑材料行业周报：房地产税三箭齐发，回调才是赚“认知差”的机会,华源证券,2024-11-17,水泥建材,https://pdf.dfcfw.com/pdf/H3_AP202411171640928672_1.pdf?1731881844000.pdf
建筑材料行业研究周报：水泥PB仍存较大修复空间，关注华南水泥龙头,天风证券,2024-11-17,水泥建材,https://pdf.dfcfw.com/pdf/H3_AP202411171640928749_1.pdf?1731874513000.pdf
建筑材料行业简评报告：玻璃价格多地上涨，行业表现稳中向好,首创证券,2024-11-15,水泥建材,https://pdf.dfcfw.com/pdf/H3_AP202411151640909286_1.pdf?1731681431000.pdf
建筑材料行业专题研究：Q3建材业绩继续下行，看好政策驱动顺周期板块复苏行情,天风证券,2024-11-15,水泥建材,https://pdf.dfcfw.com/pdf/H3_AP202411151640922222_1.pdf?1731705422000.pdf
企业竞争图谱：2024年地板 头豹词条报告系列,头豹研究院,2024-11-14,水泥建材,https://pdf.dfcfw.com/pdf/H3_AP202411141640892001_1.pdf?1731613085000.pdf
建筑材料行业周报：化债组合拳公布，关注受益于市政类资金改善方向,上海证券,2024-11-13,水泥建材,https://pdf.dfcfw.com/pdf/H3_AP202411131640851224_1.pdf?1731497276000.pdf
建材行业周报：大力度推动化债，专项债收储有望加快落地,甬兴证券,2024-11-13,水泥建材,https://pdf.dfcfw.com/pdf/H3_AP202411131640859380_1.pdf?1731517898000.pdf
建筑材料行业：10月动态报告-三季报业绩承压，供给侧迎积极信号,中国银河,2024-11-13,水泥建材,https://pdf.dfcfw.com/pdf/H3_AP202411131640864731_1.pdf?1731527137000.pdf
装修建材24Q3经营表现探讨：多数规模降幅扩大，部分经营质量提升,国联证券,2024-11-12,水泥建材,https://pdf.dfcfw.com/pdf/H3_AP202411121640824744_1.pdf?1731402267000.pdf
建筑材料：化债政策力度超预期；水泥价格近期持续推,中泰证券,2024-11-11,水泥建材,https://pdf.dfcfw.com/pdf/H3_AP202411111640817697_1.pdf?1731366276000.pdf
建筑材料行业简评报告：水泥玻璃价格上涨，建材行业整体表现稳健,首创证券,2024-11-11,水泥建材,https://pdf.dfcfw.com/pdf/H3_AP202411111640821572_1.pdf?1731359070000.pdf
建筑材料行业深度报告：2024年三季报综述：景气和盈利仍承压，政策预期改善,东吴证券,2024-11-11,水泥建材,https://pdf.dfcfw.com/pdf/H3_AP202411111640822434_1.pdf?1731399233000.pdf
水泥24Q3经营表现探讨：水泥“淡季不淡”，价格中枢或持续提升,国联证券,2024-11-11,水泥建材,https://pdf.dfcfw.com/pdf/H3_AP202411111640809179_1.pdf?1731330628000.pdf
建筑材料行业跟踪周报：2025年有望实施更给力的财政政策,东吴证券,2024-11-10,水泥建材,https://pdf.dfcfw.com/pdf/H3_AP202411101640805856_1.pdf?1731282403000.pdf
建筑材料行业周报：化债政策再明确稳经济，重视建材布局机会,开源证券,2024-11-10,水泥建材,https://pdf.dfcfw.com/pdf/H3_AP202411101640804766_1.pdf?1731259035000.pdf
建筑材料行业周报：如何理解此轮化债？,华源证券,2024-11-10,水泥建材,https://pdf.dfcfw.com/pdf/H3_AP202411101640805526_1.pdf?1731273545000.pdf
建筑材料行业研究周报：化债“组合拳”落地，华南资金到位率及水泥价格显著提升，关注化债省份企业较好弹性,天风证券,2024-11-10,水泥建材,https://pdf.dfcfw.com/pdf/H3_AP202411101640805564_1.pdf?1731268566000.pdf
建筑材料行业2024年三季报综述：建材行业需求筑底，利好政策推动业绩边际改善,华龙证券,2024-11-08,水泥建材,https://pdf.dfcfw.com/pdf/H3_AP202411081640783441_1.pdf?1731077161000.pdf
建筑材料行业行业周报：产能置换新规发布，供给优化促进行业升级,中国银河,2024-11-05,水泥建材,https://pdf.dfcfw.com/pdf/H3_AP202411051640725875_1.pdf?1730831183000.pdf
建筑材料行业研究周报：水泥产能置换新规有望加快供给格局优化，关注华东水泥企业利润改善弹性,天风证券,2024-11-04,水泥建材,https://pdf.dfcfw.com/pdf/H3_AP202411041640690710_1.pdf?1730709421000.pdf
建筑材料行业专题研究：24Q3水泥等有亮点，关注Q4供需共振机会,国联证券,2024-11-04,水泥建材,https://pdf.dfcfw.com/pdf/H3_AP202411041640695144_1.pdf?1730731017000.pdf
建筑材料行业深度报告：居住产业链2024Q3获公募基金减仓，重仓持股市值占A股比继续处于历史低位,东吴证券,2024-11-04,水泥建材,https://pdf.dfcfw.com/pdf/H3_AP202411041640708928_1.pdf?1730755602000.pdf
建筑材料行业周报：楼市止跌回稳政策密集，重视建材布局机会,开源证券,2024-11-03,水泥建材,https://pdf.dfcfw.com/pdf/H3_AP202411031640689193_1.pdf?1730704047000.pdf
建筑材料行业跟踪周报：政策博弈仍在继续,东吴证券,2024-11-03,水泥建材,https://pdf.dfcfw.com/pdf/H3_AP202411031640689413_1.pdf?1730673204000.pdf
建筑材料行业周报：化债或导致房地产被动见底,华源证券,2024-11-03,水泥建材,https://pdf.dfcfw.com/pdf/H3_AP202411031640687713_1.pdf?1730710103000.pdf
建材建筑周观点：关注水泥、光伏玻璃供给侧积极变化，顺周期同步关注玻纤板块,民生证券,2024-11-03,水泥建材,https://pdf.dfcfw.com/pdf/H3_AP202411031640688048_1.pdf?1730711428000.pdf
水泥、玻璃产能置换新规点评：推动水泥备案与实际产能统一，鼓励光伏压延玻璃采取置换新增,民生证券,2024-10-31,水泥建材,https://pdf.dfcfw.com/pdf/H3_AP202410311640652339_1.pdf?1730414195000.pdf
建筑材料行业周报：LPR下降带动房贷利率延续宽松，继续关注化债主线,上海证券,2024-10-30,水泥建材,https://pdf.dfcfw.com/pdf/H3_AP202410301640591028_1.pdf?1730296758000.pdf
建筑材料行业周报：水泥涨价持续落地，旺季需求回升盈利改善,华龙证券,2024-10-30,水泥建材,https://pdf.dfcfw.com/pdf/H3_AP202410301640596278_1.pdf?1730326057000.pdf
建筑材料行业简评报告：行业个股大面积上涨，板块整体稳中向好,首创证券,2024-10-30,水泥建材,https://pdf.dfcfw.com/pdf/H3_AP202410301640598094_1.pdf?1730305748000.pdf
建材行业周报：年内5年期LPR第三次下调，关注地产链细分龙头,甬兴证券,2024-10-30,水泥建材,https://pdf.dfcfw.com/pdf/H3_AP202410301640603728_1.pdf?1730317808000.pdf
建筑材料：财政政策发力助推需求恢复；光伏行业迎多重利好,中泰证券,2024-10-29,水泥建材,https://pdf.dfcfw.com/pdf/H3_AP202410291640559152_1.pdf?1730201245000.pdf
建筑材料行业跟踪周报：等待刺激政策的进一步落地,东吴证券,2024-10-28,水泥建材,https://pdf.dfcfw.com/pdf/H3_AP202410281640532901_1.pdf?1730117287000.pdf
建筑材料行业研究周报：Q3建材持仓环比提升，重视周期底部配置机会,天风证券,2024-10-27,水泥建材,https://pdf.dfcfw.com/pdf/H3_AP202410271640528859_1.pdf?1730099943000.pdf
建筑材料行业周报：牛市仍需房地产产业链表现,华源证券,2024-10-27,水泥建材,https://pdf.dfcfw.com/pdf/H3_AP202410271640528827_1.pdf?1730115086000.pdf
建筑材料行业周报,华源证券,2024-10-27,水泥建材,https://pdf.dfcfw.com/pdf/H3_AP202410271640525936_1.pdf?1730064573000.pdf
建筑材料行业周报：各地积极落实楼市政策，重视建材布局机会,开源证券,2024-10-27,水泥建材,https://pdf.dfcfw.com/pdf/H3_AP202410271640528007_1.pdf?1730062788000.pdf
建筑材料行业简评报告：行业整体表现良好，预计后市将保持稳定,首创证券,2024-10-25,水泥建材,https://pdf.dfcfw.com/pdf/H3_AP202410251640495923_1.pdf?1729854684000.pdf
建筑材料行业9月月报：利好政策频发叠加旺季需求改善，行业估值有望修复,华龙证券,2024-10-23,水泥建材,https://pdf.dfcfw.com/pdf/H3_AP202410231640433855_1.pdf?1729696754000.pdf
建筑材料：1017住建部新闻发布会点评-地产政策“组合拳”，我们关注哪些,上海证券,2024-10-22,水泥建材,https://pdf.dfcfw.com/pdf/H3_AP202410221640400400_1.pdf?1729590281000.pdf
建筑材料行业周报：水泥偏强运行，关注高股息建筑建材个股,上海证券,2024-10-22,水泥建材,https://pdf.dfcfw.com/pdf/H3_AP202410221640400715_1.pdf?1729592161000.pdf
建材行业报告：如何看待近期水泥的持续提价？,东兴证券,2024-10-22,水泥建材,https://pdf.dfcfw.com/pdf/H3_AP202410221640414180_1.pdf?1729623189000.pdf
建筑材料行业研究周报：地产政策“组合拳”落地，水泥价格继续上涨,天风证券,2024-10-21,水泥建材,https://pdf.dfcfw.com/pdf/H3_AP202410211640376055_1.pdf?1729501801000.pdf
建筑材料行业周报：住建部会议被低估，重申“进攻”,华源证券,2024-10-21,水泥建材,https://pdf.dfcfw.com/pdf/H3_AP202410211640376200_1.pdf?1729502623000.pdf
建筑材料行业跟踪周报：化债之后的加杠杆方向或是新基建和西部旧基建,东吴证券,2024-10-21,水泥建材,https://pdf.dfcfw.com/pdf/H3_AP202410211640378482_1.pdf?1729509144000.pdf
建筑材料：政策组合拳加速落地；华东水泥价格近期涨幅明显,中泰证券,2024-10-21,水泥建材,https://pdf.dfcfw.com/pdf/H3_AP202410211640393531_1.pdf?1729546736000.pdf
建材建筑周观点：如果地方扩表，“低空”会是优选吗？,民生证券,2024-10-21,水泥建材,https://pdf.dfcfw.com/pdf/H3_AP202410211640379391_1.pdf?1729521831000.pdf
住建部发布会点评：地产政策由B端拓展至C端，进一步增量政策可期,华源证券,2024-10-20,水泥建材,https://pdf.dfcfw.com/pdf/H3_AP202410201640373961_1.pdf?1729430497000.pdf
建筑材料行业周报：各部门政策持续跟进，重视建材布局机会,开源证券,2024-10-20,水泥建材,https://pdf.dfcfw.com/pdf/H3_AP202410201640374323_1.pdf?1729443755000.pdf
建材行业周报：严控地产增量，止跌回稳可期,甬兴证券,2024-10-17,水泥建材,https://pdf.dfcfw.com/pdf/H3_AP202410171640334133_1.pdf?1729155195000.pdf
非金属建材行业2024年10月投资策略：政策底部转向，关注建材估值修复机会,国信证券,2024-10-17,水泥建材,https://pdf.dfcfw.com/pdf/H3_AP202410171640345896_1.pdf?1729188186000.pdf
建筑材料行业周报：财政加大逆周期调节力度，支持房地产止跌回稳,上海证券,2024-10-15,水泥建材,https://pdf.dfcfw.com/pdf/H3_AP202410151640299291_1.pdf?1728991956000.pdf
建筑材料：浙赣粤运河项目点评-开工在即，江西民爆及水泥增量可观,华源证券,2024-10-15,水泥建材,https://pdf.dfcfw.com/pdf/H3_AP202410151640302677_1.pdf?1729005716000.pdf
建筑材料行业跟踪周报：财政政策方向明确，板块估值修复可期,东吴证券,2024-10-14,水泥建材,https://pdf.dfcfw.com/pdf/H3_AP202410141640278485_1.pdf?1728865104000.pdf
建筑材料行业研究周报：财政政策发力，看好基建预期提升下水泥涨价行情,天风证券,2024-10-14,水泥建材,https://pdf.dfcfw.com/pdf/H3_AP202410141640286110_1.pdf?1728920416000.pdf
建材建筑周观点：如何看待化债“及时雨”对建筑股的影响,民生证券,2024-10-13,水泥建材,https://pdf.dfcfw.com/pdf/H3_AP202410131640278424_1.pdf?1728904135000.pdf
建筑材料行业周报：财政政策陆续跟进，重视建材布局机会,开源证券,2024-10-13,水泥建材,https://pdf.dfcfw.com/pdf/H3_AP202410131640277905_1.pdf?1728851835000.pdf
牛市复盘：建材建筑表现及启示,国联证券,2024-10-08,水泥建材,https://pdf.dfcfw.com/pdf/H3_AP202410071640185861_1.pdf?1728380396000.pdf
