研报名称,机构名称,发布时间,行业,研报地址
建筑材料行业研究周报：地产链积极态势持续，关注政策催化及基本面改善,天风证券,2023-11-27,水泥建材,https://pdf.dfcfw.com/pdf/H3_AP202311271612385783_1.pdf?1701079707000.pdf
建材建筑周观点：建材继续“跟地走”，关注碳纤维提价,民生证券,2023-11-26,水泥建材,https://pdf.dfcfw.com/pdf/H3_AP202311261612382891_1.pdf?1701018454000.pdf
建筑建材行业周报：水利建设投资超预期，有望迎来更景气周期,东莞证券,2023-11-26,水泥建材,https://pdf.dfcfw.com/pdf/H3_AP202311261612382877_1.pdf?1701017496000.pdf
2023年建材行业三季报总结：板块修复分化，静待总量回升,中泰证券,2023-11-23,水泥建材,https://pdf.dfcfw.com/pdf/H3_AP202311231612201129_1.pdf?1700735453000.pdf
建筑材料行业跟踪报告：渠道转型效果渐显，龙头企业业绩回升,万联证券,2023-11-22,水泥建材,https://pdf.dfcfw.com/pdf/H3_AP202311221612011620_1.pdf?1700653845000.pdf
建筑材料行业周报：地产链信心有待提振，关注“三大工程”构建房地产发展新模式,上海证券,2023-11-21,水泥建材,https://pdf.dfcfw.com/pdf/H3_AP202311211611754772_1.pdf?1700558456000.pdf
建筑材料行业周报：地产竣工增速仍处高位，广州优化公积金贷款细则,华安证券,2023-11-21,水泥建材,https://pdf.dfcfw.com/pdf/H3_AP202311211611761696_1.pdf?1700579548000.pdf
【德邦建材】城中村改造蓄势而发，万亿规模助力地产链深蹲起跳,德邦证券,2023-11-21,水泥建材,https://pdf.dfcfw.com/pdf/H3_AP202311211611762502_1.pdf?1700583481000.pdf
建筑材料及新材料行业周报：关注地产融资积极政策效果,国联证券,2023-11-20,水泥建材,https://pdf.dfcfw.com/pdf/H3_AP202311201611682264_1.pdf?1700473038000.pdf
水泥行业研究周报：供给收缩推动价格上涨，后期或震荡调整为主,天风证券,2023-11-20,水泥建材,https://pdf.dfcfw.com/pdf/H3_AP202311201611683314_1.pdf?1700483321000.pdf
建筑材料行业研究周报：关注城中村_保障房积极变化，传统建材或迎转机,天风证券,2023-11-20,水泥建材,https://pdf.dfcfw.com/pdf/H3_AP202311201611683316_1.pdf?1700478058000.pdf
建筑材料行业周报：基建城中村仍有政策发力，关注建材底部机会,开源证券,2023-11-20,水泥建材,https://pdf.dfcfw.com/pdf/H3_AP202311201611683341_1.pdf?1700479643000.pdf
建筑材料周观点：加快“三大工程”建设，提振信心带来新的机遇,德邦证券,2023-11-20,水泥建材,https://pdf.dfcfw.com/pdf/H3_AP202311201611683422_1.pdf?1700478682000.pdf
建材行业周报：地产数据偏弱，建材景气度磨底,中银证券,2023-11-20,水泥建材,https://pdf.dfcfw.com/pdf/H3_AP202311201611683452_1.pdf?1700479847000.pdf
建筑材料行业周观点：水泥延续小幅上涨，10月产量同比仍下滑,万联证券,2023-11-20,水泥建材,https://pdf.dfcfw.com/pdf/H3_AP202311201611691037_1.pdf?1700498848000.pdf
建筑材料行业周报：短期需求波动，中长期趋势向好,中国银河,2023-11-20,水泥建材,https://pdf.dfcfw.com/pdf/H3_AP202311201611696435_1.pdf?1700506813000.pdf
建筑材料行业跟踪周报：地产底部企稳，宏观环境回暖,东吴证券,2023-11-20,水泥建材,https://pdf.dfcfw.com/pdf/H3_AP202311191611679401_1.pdf?1700465411000.pdf
建材建筑周观点：“三大工程”预期渐浓，持续推荐生态修复方向,民生证券,2023-11-19,水泥建材,https://pdf.dfcfw.com/pdf/H3_AP202311191611679057_1.pdf?1700414089000.pdf
建筑材料行业周报：10月百城房价环比改善，郑州7个城中村项目集中开工,上海证券,2023-11-16,水泥建材,https://pdf.dfcfw.com/pdf/H3_AP202311161611020207_1.pdf?1700128140000.pdf
建筑材料10月行业数据点评：销售再次走弱，期待自上而下总量政策发力,德邦证券,2023-11-16,水泥建材,https://pdf.dfcfw.com/pdf/H3_AP202311161611038993_1.pdf?1700161897000.pdf
建筑材料行业周报：政策利好叠加基本面改善，关注建材龙头企业估值修复,华龙证券,2023-11-14,水泥建材,https://pdf.dfcfw.com/pdf/H3_AP202311141610694885_1.pdf?1699967217000.pdf
建筑材料行业周观点：熟料价格环比上涨，沥青价格回落,万联证券,2023-11-14,水泥建材,https://pdf.dfcfw.com/pdf/H3_AP202311141610633304_1.pdf?1699947483000.pdf
建材行业23年三季报总结：需求景气或已触底，重视政策积极催化,天风证券,2023-11-13,水泥建材,https://pdf.dfcfw.com/pdf/H3_AP202311131609918878_1.pdf?1699866511000.pdf
建材行业周报：深圳国资委表态支持万科，建材行业信心增强,中银证券,2023-11-13,水泥建材,https://pdf.dfcfw.com/pdf/H3_AP202311131609919810_1.pdf?1699871589000.pdf
建筑材料周观点：关注城中村改造带来的新机遇,德邦证券,2023-11-13,水泥建材,https://pdf.dfcfw.com/pdf/H3_AP202311131609921443_1.pdf?1699874155000.pdf
水泥行业研究周报：需求逐渐进入淡季，部分地区以涨促稳,天风证券,2023-11-13,水泥建材,https://pdf.dfcfw.com/pdf/H3_AP202311131609921552_1.pdf?1699884034000.pdf
建筑材料行业跟踪周报：宏观政策面继续回暖，继续看好地产链,东吴证券,2023-11-13,水泥建材,https://pdf.dfcfw.com/pdf/H3_AP202311121609917244_1.pdf?1699861734000.pdf
建筑材料行业研究周报：继续推荐新材料及传统建材龙头品种,天风证券,2023-11-13,水泥建材,https://pdf.dfcfw.com/pdf/H3_AP202311131609918779_1.pdf?1699866414000.pdf
建筑材料行业周报：政策仍有望持续出新，关注建材底部机会,开源证券,2023-11-13,水泥建材,https://pdf.dfcfw.com/pdf/H3_AP202311131609922181_1.pdf?1699881414000.pdf
建筑建材行业周报：建筑材料Q3板块业绩持续分化,东莞证券,2023-11-12,水泥建材,https://pdf.dfcfw.com/pdf/H3_AP202311121609916887_1.pdf?1706880794000.pdf
水泥行业跟踪报告：行业整体业绩承压，龙头个股韧性较强,万联证券,2023-11-12,水泥建材,https://pdf.dfcfw.com/pdf/H3_AP202311121609916136_1.pdf?1699789567000.pdf
建筑材料行业2023年三季报业绩总结：子行业表现分化，消费建材龙头企业韧性较强,中国银河,2023-11-12,水泥建材,https://pdf.dfcfw.com/pdf/H3_AP202311121609916326_1.pdf?1699795229000.pdf
建筑材料及新材料：多地继续地产松绑政策，继续建议“双主线”,国联证券,2023-11-12,水泥建材,https://pdf.dfcfw.com/pdf/H3_AP202311121609916338_1.pdf?1699796982000.pdf
建材行业2024年度投资策略：拨云见月，政策发力凸显底部价值,开源证券,2023-11-09,水泥建材,https://pdf.dfcfw.com/pdf/H3_AP202311091609781155_1.pdf?1699544538000.pdf
建筑材料行业2023年三季报业绩综述：行业Q3业绩分化持续，消费建材龙头强者恒强,东莞证券,2023-11-08,水泥建材,https://pdf.dfcfw.com/pdf/H3_AP202311081609339321_1.pdf?1699465089000.pdf
建筑材料行业周观点：水泥价格短期延续上行趋势,万联证券,2023-11-07,水泥建材,https://pdf.dfcfw.com/pdf/H3_AP202311071609224429_1.pdf?1699344018000.pdf
建筑材料行业周报：消费建材前三季度盈利保持高增,中国银河,2023-11-07,水泥建材,https://pdf.dfcfw.com/pdf/H3_AP202311071609224442_1.pdf?1699346379000.pdf
建筑材料行业周报：政策组合拳持续加码，关注建材底部机会,开源证券,2023-11-06,水泥建材,https://pdf.dfcfw.com/pdf/H3_AP202311061609026164_1.pdf?1699269413000.pdf
建筑材料及新材料行业周报：优质公司陆续回购，继续“双主线”布局,国联证券,2023-11-06,水泥建材,https://pdf.dfcfw.com/pdf/H3_AP202311061609026784_1.pdf?1699262575000.pdf
建筑材料周观点：10月份百强房企销售走弱，Q3基金建材持仓略增,德邦证券,2023-11-06,水泥建材,https://pdf.dfcfw.com/pdf/H3_AP202311061609028857_1.pdf?1699278633000.pdf
水泥行业研究周报：需求南强北弱，南方地区价格积极推涨,天风证券,2023-11-06,水泥建材,https://pdf.dfcfw.com/pdf/H3_AP202311061609028972_1.pdf?1699280643000.pdf
建筑材料行业周报：二手房交易活跃度提升，多地执行公积金新政,华安证券,2023-11-06,水泥建材,https://pdf.dfcfw.com/pdf/H3_AP202311061609030040_1.pdf?1699282835000.pdf
建筑材料行业跟踪周报：地产链中期底部来临,东吴证券,2023-11-06,水泥建材,https://pdf.dfcfw.com/pdf/H3_AP202311051609024159_1.pdf?1699255837000.pdf
建筑材料行业周报：“银十”楼市稳步修复；建材龙头陆续推回购计划,中泰证券,2023-11-06,水泥建材,https://pdf.dfcfw.com/pdf/H3_AP202311061609034785_1.pdf?1699298350000.pdf
建筑材料：2023Q3公募持仓点评：建材行业占比提升，顺周期加仓明显,华安证券,2023-11-06,水泥建材,https://pdf.dfcfw.com/pdf/H3_AP202311061609044968_1.pdf?1699303037000.pdf
大国重材系列十一：纯碱和玻璃的周期属性探讨,民生证券,2023-11-03,水泥建材,https://pdf.dfcfw.com/pdf/H3_AP202311031608297615_1.pdf?1699006130000.pdf
解读基建地产链2023年三季报：盈利能力低位波动，下游现金流紧张制约资产负债表修复速度,东吴证券,2023-11-02,水泥建材,https://pdf.dfcfw.com/pdf/H3_AP202311021607967170_1.pdf?1698959081000.pdf
非金属建材周报（23年第43周）：国债增发提振需求，稳增长有望持续发力,国信证券,2023-10-31,水泥建材,https://pdf.dfcfw.com/pdf/H3_AP202310311607003627_1.pdf?1698762810000.pdf
建筑材料周观点：三季报利空出尽，万亿国债加强逆周期调节,德邦证券,2023-10-31,水泥建材,https://pdf.dfcfw.com/pdf/H3_AP202310311607030789_1.pdf?1698763990000.pdf
水泥行业周报：部分水泥Q3业绩同比开始转正，减水剂仍承压,天风证券,2023-10-30,水泥建材,https://pdf.dfcfw.com/pdf/H3_AP202310301605646432_1.pdf?1698678685000.pdf
建筑材料行业研究周报：保障房+城中村，应重视G端对建材需求的提振,天风证券,2023-10-30,水泥建材,https://pdf.dfcfw.com/pdf/H3_AP202310301605646435_1.pdf?1698676199000.pdf
建筑材料行业周报：万亿国债+政策工具箱发力，关注建材底部机会,开源证券,2023-10-30,水泥建材,https://pdf.dfcfw.com/pdf/H3_AP202310301605646647_1.pdf?1698678685000.pdf
建筑材料行业周报：新一轮房改政策即将落地，保障房为行业发展主力,华安证券,2023-10-30,水泥建材,https://pdf.dfcfw.com/pdf/H3_AP202310301605647772_1.pdf?1698682141000.pdf
建材行业周报：三季报龙头业绩表现较强，稳增长预期增强,中银证券,2023-10-30,水泥建材,https://pdf.dfcfw.com/pdf/H3_AP202310301605660133_1.pdf?1698690178000.pdf
建筑材料及新材料行业周报：重视“万亿国债”积极信号，23q3业绩延续分化,国联证券,2023-10-29,水泥建材,https://pdf.dfcfw.com/pdf/H3_AP202310291605637649_1.pdf?1698604601000.pdf
建筑材料行业周报：9月百城住宅均价回升，“一带一路”继续推进基础设施联通,上海证券,2023-10-25,水泥建材,https://pdf.dfcfw.com/pdf/H3_AP202310251603469122_1.pdf?1698239207000.pdf
非金属建材周报（23年第42周）：地产竣工增速保持高位，逢低配置地产链优质企业,国信证券,2023-10-24,水泥建材,https://pdf.dfcfw.com/pdf/H3_AP202310241602905665_1.pdf?1698159769000.pdf
建筑材料行业周报：行业需求维持回暖趋势,中国银河,2023-10-24,水泥建材,https://pdf.dfcfw.com/pdf/H3_AP202310241602905671_1.pdf?1698161062000.pdf
建筑材料及新材料行业周报：“自下而上”为主，关注地产_经济改善动能,国联证券,2023-10-23,水泥建材,https://pdf.dfcfw.com/pdf/H3_AP202310221602715946_1.pdf?1698056045000.pdf
建筑建材行业周报：第三届“一带一路”国际合作高峰论坛成功举办，各方形成458项成果,东莞证券,2023-10-23,水泥建材,https://pdf.dfcfw.com/pdf/H3_AP202310231602718153_1.pdf?1698055117000.pdf
建筑材料行业研究周报：历史上上证超跌后建筑建材板块的表现如何？,天风证券,2023-10-23,水泥建材,https://pdf.dfcfw.com/pdf/H3_AP202310231602718759_1.pdf?1698055117000.pdf
建筑材料行业周报：地产竣工持续改善，关注建材底部机会,开源证券,2023-10-23,水泥建材,https://pdf.dfcfw.com/pdf/H3_AP202310231602719904_1.pdf?1698058488000.pdf
建筑材料行业专题报告：曙光已现，乍暖还寒,海通国际,2023-10-23,水泥建材,https://pdf.dfcfw.com/pdf/H3_AP202310231602720153_1.pdf?1698084269000.pdf
建材行业周报：山东药玻价值再发现，新增箭牌家居首次覆盖,中银证券,2023-10-23,水泥建材,https://pdf.dfcfw.com/pdf/H3_AP202310221602716467_1.pdf?1698057529000.pdf
建材建筑周观点：地产新平衡下，产业链应正确预期、提前适应,民生证券,2023-10-23,水泥建材,https://pdf.dfcfw.com/pdf/H3_AP202310221602716519_1.pdf?1698060129000.pdf
建筑材料行业跟踪周报：强二线地产放松，白马估值下落,东吴证券,2023-10-23,水泥建材,https://pdf.dfcfw.com/pdf/H3_AP202310221602716533_1.pdf?1698052705000.pdf
水泥行业研究周报：水泥价格继续上涨，看好板块相对收益,天风证券,2023-10-23,水泥建材,https://pdf.dfcfw.com/pdf/H3_AP202310231602717903_1.pdf?1698051333000.pdf
建筑材料行业周报：竣工增速保持高位，建材社零降幅扩大,华安证券,2023-10-22,水泥建材,https://pdf.dfcfw.com/pdf/H3_AP202310221602716313_1.pdf?1698057330000.pdf
2023年1-9月建材行业数据跟踪：基建有望发力，竣工高增速，静待需求底部回升,中国银河,2023-10-19,水泥建材,https://pdf.dfcfw.com/pdf/H3_AP202310191602085266_1.pdf?1697724144000.pdf
建材行业9月数据点评：地产数据呈现环比动能，周期建材旺季不旺,中银证券,2023-10-19,水泥建材,https://pdf.dfcfw.com/pdf/H3_AP202310191602106254_1.pdf?1697752463000.pdf
非金属建材周报（23年第41周）：旺季水泥供需边际改善，库存回落价格上行,国信证券,2023-10-17,水泥建材,https://pdf.dfcfw.com/pdf/H3_AP202310171601746943_1.pdf?1697529079000.pdf
2023年新材料系列：中国低碳水泥行业概览,头豹研究院,2023-10-17,水泥建材,https://pdf.dfcfw.com/pdf/H3_AP202310171601770791_1.pdf?1697572784000.pdf
建筑材料行业跟踪周报：经济企稳，中期看好成长,东吴证券,2023-10-16,水泥建材,https://pdf.dfcfw.com/pdf/H3_AP202310151601475555_1.pdf?1697445867000.pdf
建材行业周报：关注板块三季报业绩,中银证券,2023-10-16,水泥建材,https://pdf.dfcfw.com/pdf/H3_AP202310161601478980_1.pdf?1697450948000.pdf
建筑材料周观点：9月居民长贷明显改善，静待需求触底回暖,德邦证券,2023-10-16,水泥建材,https://pdf.dfcfw.com/pdf/H3_AP202310161601479540_1.pdf?1697454545000.pdf
建筑建材行业周报：第三届“一带一路”国际合作高峰论坛即将举办,东莞证券,2023-10-16,水泥建材,https://pdf.dfcfw.com/pdf/H3_AP202310161601479658_1.pdf?1697461959000.pdf
建筑材料行业周报：居民信贷同比多增，关注高频地产销售数据,开源证券,2023-10-16,水泥建材,https://pdf.dfcfw.com/pdf/H3_AP202310161601481390_1.pdf?1697469314000.pdf
建筑材料行业研究周报：重视四季度宏观调控发力带来的基建_地产机会,天风证券,2023-10-16,水泥建材,https://pdf.dfcfw.com/pdf/H3_AP202310161601481430_1.pdf?1697469508000.pdf
水泥行业研究周报：需求环比继续提升，价格维持小幅提涨走势,天风证券,2023-10-16,水泥建材,https://pdf.dfcfw.com/pdf/H3_AP202310161601481434_1.pdf?1697469899000.pdf
建筑材料行业周报：节后市场回暖，静待行业底部回升,中国银河,2023-10-16,水泥建材,https://pdf.dfcfw.com/pdf/H3_AP202310161601485151_1.pdf?1697473635000.pdf
建筑材料行业周观点：玻璃水泥价格小幅上涨，关注下游需求情况,万联证券,2023-10-16,水泥建材,https://pdf.dfcfw.com/pdf/H3_AP202310161601496947_1.pdf?1697662493000.pdf
建筑材料及新材料行业周报：关注旺季地产及工程需求改善动能,国联证券,2023-10-15,水泥建材,https://pdf.dfcfw.com/pdf/H3_AP202310151601474213_1.pdf?1697373067000.pdf
OLED材料深度报告：供需双轮驱动，国产如日方升,中泰证券,2023-10-15,水泥建材,https://pdf.dfcfw.com/pdf/H3_AP202310151601474627_1.pdf?1697384070000.pdf
建筑材料行业跟踪周报：经济企稳迹象明显，重点关注成长,东吴证券,2023-10-09,水泥建材,https://pdf.dfcfw.com/pdf/H3_AP202310081601093665_1.pdf?1696840122000.pdf
建筑建材行业周报：九月逾六成百强房企销售环比增长，地产链景气度有望逐步回升,东莞证券,2023-10-09,水泥建材,https://pdf.dfcfw.com/pdf/H3_AP202310091601094650_1.pdf?1696843367000.pdf
建筑材料行业研究周报：二手房领先新房回暖，油价下跌或利好消费建材成本端,天风证券,2023-10-09,水泥建材,https://pdf.dfcfw.com/pdf/H3_AP202310091601095043_1.pdf?1696841222000.pdf
建筑材料行业周观点：广深地产政策持续优化，关注后续三季报绩优股,德邦证券,2023-10-09,水泥建材,https://pdf.dfcfw.com/pdf/H3_AP202310091601095265_1.pdf?1696844842000.pdf
建筑材料行业周报：国庆假期一线地产销售亮眼，政策效果逐步显现,开源证券,2023-10-09,水泥建材,https://pdf.dfcfw.com/pdf/H3_AP202310091601095284_1.pdf?1696841847000.pdf
建筑材料行业周报：地产政策加码有望带来行业需求提升,中国银河,2023-10-09,水泥建材,https://pdf.dfcfw.com/pdf/H3_AP202310091601098595_1.pdf?1696862137000.pdf
建筑材料行业周观点：传统旺季下水泥价格持续上涨,万联证券,2023-10-09,水泥建材,https://pdf.dfcfw.com/pdf/H3_AP202310091601107556_1.pdf?1696879831000.pdf
水泥行业研究周报：节前水泥价格继续推涨，出货率环比提升,天风证券,2023-10-08,水泥建材,https://pdf.dfcfw.com/pdf/H3_AP202310081601090926_1.pdf?1696785972000.pdf
建筑材料行业+公司首次覆盖：城中村专题：聚焦超大特大城市，有效补充建筑设计与地产链需求,东吴证券,2023-09-28,水泥建材,https://pdf.dfcfw.com/pdf/H3_AP202309281600190724_1.pdf?1695913161000.pdf
2023年建材行业中报总结：行业底部龙头彰显强阿尔法，静待总量需求回升,中泰证券,2023-09-28,水泥建材,https://pdf.dfcfw.com/pdf/H3_AP202309281600185287_1.pdf?1695893825000.pdf
建筑材料行业周报：存量房贷利率正式下调，华东水泥价格底部回升,上海证券,2023-09-27,水泥建材,https://pdf.dfcfw.com/pdf/H3_AP202309271599989291_1.pdf?1695801320000.pdf
建筑材料行业事件点评：央行货币政策委员会例会召开，关注开工端建材品种弹性,东莞证券,2023-09-27,水泥建材,https://pdf.dfcfw.com/pdf/H3_AP202309271600024637_1.pdf?1695851457000.pdf
建筑材料行业周报：短期继续聚焦政策催化，同时关注性价比特色标的,国联证券,2023-09-25,水泥建材,https://pdf.dfcfw.com/pdf/H3_AP202309241599752947_1.pdf?1695635482000.pdf
建筑材料行业跟踪周报：中美加强协调，重点关注成长,东吴证券,2023-09-25,水泥建材,https://pdf.dfcfw.com/pdf/H3_AP202309241599753096_1.pdf?1695646762000.pdf
建材建筑周观点：水泥成长看华新、基建看新疆西藏、周期见底看海螺,民生证券,2023-09-25,水泥建材,https://pdf.dfcfw.com/pdf/H3_AP202309251599753141_1.pdf?1695629351000.pdf
建筑建材行业周报：地产调控政策逐步落地，建材行业迎来回暖契机,东莞证券,2023-09-25,水泥建材,https://pdf.dfcfw.com/pdf/H3_AP202309251599758500_1.pdf?1695633582000.pdf
建筑材料行业研究周报：城中村资金端迎政策支持，继续看好地产开工链,天风证券,2023-09-25,水泥建材,https://pdf.dfcfw.com/pdf/H3_AP202309251599758814_1.pdf?1695639661000.pdf
水泥行业研究周报：华东水泥价格开启上涨,天风证券,2023-09-25,水泥建材,https://pdf.dfcfw.com/pdf/H3_AP202309251599758817_1.pdf?1695634637000.pdf
建筑材料周观点：一线城市限购继续优化，城中村改造加大资金支持,德邦证券,2023-09-25,水泥建材,https://pdf.dfcfw.com/pdf/H3_AP202309251599761563_1.pdf?1695640454000.pdf
建筑材料行业周报：基本面改善+低估值，重点关注水泥和药玻板块,开源证券,2023-09-25,水泥建材,https://pdf.dfcfw.com/pdf/H3_AP202309251599761632_1.pdf?1695640185000.pdf
建材行业周报：水泥价格虽迟但涨，看好居住需要的升级,中银证券,2023-09-25,水泥建材,https://pdf.dfcfw.com/pdf/H3_AP202309251599762551_1.pdf?1695647396000.pdf
非金属建材周报（23年第38周）：水泥价格企稳改善，地产链仍可积极做多,国信证券,2023-09-25,水泥建材,https://pdf.dfcfw.com/pdf/H3_AP202309251599763408_1.pdf?1695652131000.pdf
建筑材料行业周观点：水泥价格有所回升,万联证券,2023-09-25,水泥建材,https://pdf.dfcfw.com/pdf/H3_AP202309251599799574_1.pdf?1695676865000.pdf
水泥：估值_基本面历史相对底部，看好城中村改造增量弹性,天风证券,2023-09-21,水泥建材,https://pdf.dfcfw.com/pdf/H3_AP202309211599623137_1.pdf?1695284351000.pdf
水泥行业跟踪报告：行业整体业绩承压，龙头个股韧性较强,万联证券,2023-09-21,水泥建材,https://pdf.dfcfw.com/pdf/H3_AP202309211599678955_1.pdf?1695330885000.pdf
建筑材料行业周报：看好城中村改造积极推进，地产政策继续密集落地,上海证券,2023-09-21,水泥建材,https://pdf.dfcfw.com/pdf/H3_AP202309211599511142_1.pdf?1695282016000.pdf
非金属建材周报（23年第37周）：政策利好持续，关注旺季需求释放,国信证券,2023-09-20,水泥建材,https://pdf.dfcfw.com/pdf/H3_AP202309201599450695_1.pdf?1695206388000.pdf
建筑材料行业周观点：玻璃价格稳中有涨,万联证券,2023-09-19,水泥建材,https://pdf.dfcfw.com/pdf/H3_AP202309191599268778_1.pdf?1695116882000.pdf
建筑材料行业周观点：降准释放流动性，后续地产政策催化仍可期,德邦证券,2023-09-18,水泥建材,https://pdf.dfcfw.com/pdf/H3_AP202309181599039780_1.pdf?1695038348000.pdf
建材行业周报：看多消费建材与药用玻璃，保持耐心,中银证券,2023-09-18,水泥建材,https://pdf.dfcfw.com/pdf/H3_AP202309181599039821_1.pdf?1695042756000.pdf
建筑建材行业报告：8月地产新开工降幅收窄，持续关注地产链消费建材,中邮证券,2023-09-18,水泥建材,https://pdf.dfcfw.com/pdf/H3_AP202309181599041085_1.pdf?1695044440000.pdf
建筑材料行业周报：行业需求略有波动不改向上预期,中国银河,2023-09-18,水泥建材,https://pdf.dfcfw.com/pdf/H3_AP202309181599042845_1.pdf?1695049078000.pdf
建筑材料行业周报：关注政策组合拳效果，细分继续首选消费建材,国联证券,2023-09-18,水泥建材,https://pdf.dfcfw.com/pdf/H3_AP202309171599025627_1.pdf?1695030315000.pdf
建筑材料：8月行业数据点评：政策优化落地，进入复苏验证期，年底翘尾有望再现,德邦证券,2023-09-18,水泥建材,https://pdf.dfcfw.com/pdf/H3_AP202309181599026274_1.pdf?1695031871000.pdf
非金属建材行业2023年9月投资策略：多重政策加速落地，积极把握地产链配置机会,国信证券,2023-09-18,水泥建材,https://pdf.dfcfw.com/pdf/H3_AP202309181599026351_1.pdf?1695043532000.pdf
建筑材料行业研究周报：地产单周销售有所好转，继续看好开工端建材及新材料,天风证券,2023-09-18,水泥建材,https://pdf.dfcfw.com/pdf/H3_AP202309181599026442_1.pdf?1695033672000.pdf
建筑建材行业周报：竣工端持续向好，建材需求有望得到支撑,东莞证券,2023-09-18,水泥建材,https://pdf.dfcfw.com/pdf/H3_AP202309181599027474_1.pdf?1695028017000.pdf
建筑材料行业周报：降息空间犹存，有望催化建材投资机会,开源证券,2023-09-18,水泥建材,https://pdf.dfcfw.com/pdf/H3_AP202309181599027543_1.pdf?1695045603000.pdf
水泥行业研究周报：需求环比缓慢提升，局部供需关系仍待改善,天风证券,2023-09-18,水泥建材,https://pdf.dfcfw.com/pdf/H3_AP202309181599027577_1.pdf?1695031968000.pdf
建筑材料行业周报：存量房贷利率下调，关注板块做多机会,上海证券,2023-09-14,水泥建材,https://pdf.dfcfw.com/pdf/H3_AP202309141598452706_1.pdf?1694678015000.pdf
建材行业2023半年报综述：消费建材正走出谷底，周期建材仍探底,中银证券,2023-09-13,水泥建材,https://pdf.dfcfw.com/pdf/H3_AP202309131598363674_1.pdf?1694597769000.pdf
建筑建材行业报告：行业复苏趋势已现，消费建材盈利率先改善,中邮证券,2023-09-13,水泥建材,https://pdf.dfcfw.com/pdf/H3_AP202309121598333238_1.pdf?1694590338000.pdf
水泥行业研究周报：水泥需求旺季不旺，价格底部震荡为主,天风证券,2023-09-11,水泥建材,https://pdf.dfcfw.com/pdf/H3_AP202309111598196821_1.pdf?1694441530000.pdf
建筑材料行业周观点：政策效果逐步显现，板块迎做多窗口,德邦证券,2023-09-11,水泥建材,https://pdf.dfcfw.com/pdf/H3_AP202309111598197424_1.pdf?1694428548000.pdf
建材行业周报：政策明牌，保持耐心,中银证券,2023-09-11,水泥建材,https://pdf.dfcfw.com/pdf/H3_AP202309111598197591_1.pdf?1694427189000.pdf
建筑材料行业跟踪周报：楼市政策暖风吹，科技自强乾坤定,东吴证券,2023-09-11,水泥建材,https://pdf.dfcfw.com/pdf/H3_AP202309101598194358_1.pdf?1694420662000.pdf
建筑行业周报：多国家代表已确认出席“一带一路”论坛，关注一带一路+城改+地产链投资机会,安信证券,2023-09-11,水泥建材,https://pdf.dfcfw.com/pdf/H3_AP202309101598194443_1.pdf?1694427866000.pdf
建材行业动态跟踪报告：中报业绩分化，消费建材盈利修复,平安证券,2023-09-11,水泥建材,https://pdf.dfcfw.com/pdf/H3_AP202309111598195604_1.pdf?1694425036000.pdf
