研报名称,机构名称,发布时间,行业,研报地址
建筑材料行业周报：央行地产金融政策超预期，看好建材底部反弹,开源证券,2024-05-20,水泥建材,https://pdf.dfcfw.com/pdf/H3_AP202405201633840214_1.pdf?1716172222000.pdf
建筑材料行业研究周报：地产预期或迎反转，继续推荐消费建材一线优质龙头及二线弹性品种,天风证券,2024-05-20,水泥建材,https://pdf.dfcfw.com/pdf/H3_AP202405201633845347_1.pdf?1716198798000.pdf
建筑材料行业周报：央行发布贷款优化政策，板块估值有望修复,华安证券,2024-05-20,水泥建材,https://pdf.dfcfw.com/pdf/H3_AP202405201633866900_1.pdf?1716224983000.pdf
建筑材料行业跟踪周报：重磅政策齐发，看高一线,东吴证券,2024-05-20,水泥建材,https://pdf.dfcfw.com/pdf/H3_AP202405201633867535_1.pdf?1716225573000.pdf
非金属建材周报（24年第20周）：地产政策持续加码，继续看好建材板块机会,国信证券,2024-05-20,水泥建材,https://pdf.dfcfw.com/pdf/H3_AP202405201633871462_1.pdf?1716239554000.pdf
建材：房地产新政多箭齐发，国资收储有望加快，持续看好地产链建材表现,国投证券,2024-05-20,水泥建材,https://pdf.dfcfw.com/pdf/H3_AP202405201633857084_1.pdf?1716214670000.pdf
建筑材料行业专题研究：水泥盈利或近底部位置，重视积极变化,国联证券,2024-05-17,水泥建材,https://pdf.dfcfw.com/pdf/H3_AP202405171633714045_1.pdf?1715971814000.pdf
建材行业基金持仓专题：建材持仓处于历史低位，24Q1环比仍有下降,国信证券,2024-05-15,水泥建材,https://pdf.dfcfw.com/pdf/H3_AP202405151633157470_1.pdf?1715766917000.pdf
建筑材料行业周报：各地接连取消全面限购，带动地产链反弹,上海证券,2024-05-15,水泥建材,https://pdf.dfcfw.com/pdf/H3_AP202405151633157471_1.pdf?1715766603000.pdf
建材行业周报：杭州西安全面放开限购，继续看多地产链反弹,甬兴证券,2024-05-14,水泥建材,https://pdf.dfcfw.com/pdf/H3_AP202405141633043646_1.pdf?1715671669000.pdf
建材建筑周观点：5月新增专项债发行加快，多地地产限购松绑，建材率先受益,民生证券,2024-05-13,水泥建材,https://pdf.dfcfw.com/pdf/H3_AP202405121632921754_1.pdf?1715588728000.pdf
建筑材料行业周观点：地产链可以乐观点，玻纤持续提价Q2弹性显现,德邦证券,2024-05-13,水泥建材,https://pdf.dfcfw.com/pdf/H3_AP202405131632932534_1.pdf?1715589957000.pdf
建筑材料行业研究周报：二季度建材基本面有望改善，看好估值继续修复,天风证券,2024-05-13,水泥建材,https://pdf.dfcfw.com/pdf/H3_AP202405131632933917_1.pdf?1715592212000.pdf
建筑材料行业跟踪周报：反弹或将持续,东吴证券,2024-05-13,水泥建材,https://pdf.dfcfw.com/pdf/H3_AP202405131632941250_1.pdf?1715621552000.pdf
建筑材料行业周报：多城全面取消住房限购，相关建材板块估值有望修复,华龙证券,2024-05-13,水泥建材,https://pdf.dfcfw.com/pdf/H3_AP202405131632940462_1.pdf?1715617604000.pdf
建筑材料行业周报：政治局会议再对经济部署，关注建材底部机会,开源证券,2024-05-12,水泥建材,https://pdf.dfcfw.com/pdf/H3_AP202405121632924408_1.pdf?1715556509000.pdf
基建地产链2023年报&2024年一季报总结：景气继续筑底，估值底部区间，关注结构亮点,东吴证券,2024-05-11,水泥建材,https://pdf.dfcfw.com/pdf/H3_AP202405111632881901_1.pdf?1715432835000.pdf
建材行业2023年报&2024一季报综述：业绩周期底部承压，玻纤提价静待回暖,上海证券,2024-05-10,水泥建材,https://pdf.dfcfw.com/pdf/H3_AP202405101632808568_1.pdf?1715337900000.pdf
建筑材料：4月动态报告-行业业绩承压，玻纤提价有望带动利润修复,中国银河,2024-05-08,水泥建材,https://pdf.dfcfw.com/pdf/H3_AP202405081632676442_1.pdf?1715202061000.pdf
建材行业2023年报及2024一季报综述：玻纤底部信号明确，消费建材减值影响高峰已过,华安证券,2024-05-08,水泥建材,https://pdf.dfcfw.com/pdf/H3_AP202405081632675463_1.pdf?1715202061000.pdf
建筑材料及新材料行业2023FY&2024Q1：玻纤_耐材及部分细分龙头有积极变化,国联证券,2024-05-07,水泥建材,https://pdf.dfcfw.com/pdf/H3_AP202405071632562363_1.pdf?1715099733000.pdf
建筑材料行业跟踪周报基建或加速,东吴证券,2024-05-06,水泥建材,https://pdf.dfcfw.com/pdf/H3_AP202405061632474725_1.pdf?1715000385000.pdf
建筑材料行业研究周报：地产政策催化预期修复，哪些品种弹性更大？,天风证券,2024-05-06,水泥建材,https://pdf.dfcfw.com/pdf/H3_AP202405061632474922_1.pdf?1715000487000.pdf
建筑材料行业周报：增发国债加快开工建设，项目资金改善支撑下游建材需求,上海证券,2024-05-06,水泥建材,https://pdf.dfcfw.com/pdf/H3_AP202405061632467905_1.pdf?1714986168000.pdf
建筑材料行业深度报告：居住产业链2024Q1获公募基金减仓，重仓持股市值占A股比为10年来最低,东吴证券,2024-05-06,水泥建材,https://pdf.dfcfw.com/pdf/H3_AP202405061632471167_1.pdf?1714992918000.pdf
建筑材料行业+公司首次覆盖：智能卫浴快速渗透期，国产品牌加速崛起,东吴证券,2024-05-03,水泥建材,https://pdf.dfcfw.com/pdf/H3_AP202405021632283985_1.pdf?1714730027000.pdf
建筑材料行业周报：核心城市地产政策持续优化，成都全面解除限购,华安证券,2024-04-30,水泥建材,https://pdf.dfcfw.com/pdf/H3_AP202404301632095832_1.pdf?1714512735000.pdf
建材行业周报：玻纤粗砂价格继续上涨，关注玻纤龙头企业,甬兴证券,2024-04-30,水泥建材,https://pdf.dfcfw.com/pdf/H3_AP202404301632032196_1.pdf?1714483427000.pdf
建筑材料行业研究周报：24Q1板块配置比例环比继续下跌，重视预期修复机会,天风证券,2024-04-29,水泥建材,https://pdf.dfcfw.com/pdf/H3_AP202404291631567169_1.pdf?1714386382000.pdf
建筑材料行业跟踪周报：行业需求疲弱凸显个体增长,东吴证券,2024-04-29,水泥建材,https://pdf.dfcfw.com/pdf/H3_AP202404291631637661_1.pdf?1714425532000.pdf
建筑材料行业周报：2024Q1基金建材持仓减少，关注建材底部机会,开源证券,2024-04-28,水泥建材,https://pdf.dfcfw.com/pdf/H3_AP202404281631552930_1.pdf?1714342957000.pdf
建筑材料行业周观点：Q1基金建材持仓降至历史低位，玻纤粗纱价格继续上涨,德邦证券,2024-04-28,水泥建材,https://pdf.dfcfw.com/pdf/H3_AP202404281631520732_1.pdf?1714313681000.pdf
建筑材料行业周报：去库支撑玻璃短期企稳，关注玻纤二次提价,上海证券,2024-04-25,水泥建材,https://pdf.dfcfw.com/pdf/H3_AP202404251631256884_1.pdf?1714034672000.pdf
建材行业周报：电子纱需求边际修复，价格或延续上涨趋势,甬兴证券,2024-04-25,水泥建材,https://pdf.dfcfw.com/pdf/H3_AP202404251631262322_1.pdf?1714043183000.pdf
建材行业基金持仓点评：24Q1地产链预期偏弱， 建材板块基金持仓持续探底,德邦证券,2024-04-25,水泥建材,https://pdf.dfcfw.com/pdf/H3_AP202404251631320730_1.pdf?1714079932000.pdf
建筑材料行业月报：水泥、玻纤迎来涨价，有望改善行业盈利水平,华龙证券,2024-04-24,水泥建材,https://pdf.dfcfw.com/pdf/H3_AP202404241631109866_1.pdf?1713947575000.pdf
建筑材料行业周报：各地加快推进落后产能淘汰，有望带动行业供需格局改善,华龙证券,2024-04-24,水泥建材,https://pdf.dfcfw.com/pdf/H3_AP202404241631118402_1.pdf?1713967563000.pdf
建筑材料行业周报：关注玻纤底部机会,中国银河,2024-04-23,水泥建材,https://pdf.dfcfw.com/pdf/H3_AP202404231631034450_1.pdf?1713864210000.pdf
建筑材料行业周观点：继续看好玻纤底部反转行情，短期地产链依旧承压,德邦证券,2024-04-22,水泥建材,https://pdf.dfcfw.com/pdf/H3_AP202404221630945583_1.pdf?1713775991000.pdf
建筑材料行业研究周报：大宗品Q2有望走出盈利相对底部，C端建材需求仍较优,天风证券,2024-04-22,水泥建材,https://pdf.dfcfw.com/pdf/H3_AP202404221630945797_1.pdf?1713776505000.pdf
建筑材料行业跟踪周报：玻纤价格继续上涨,东吴证券,2024-04-22,水泥建材,https://pdf.dfcfw.com/pdf/H3_AP202404221630962022_1.pdf?1713807915000.pdf
建筑材料行业周报：专项债发行有望加速，玻纤价格持续调涨,华安证券,2024-04-22,水泥建材,https://pdf.dfcfw.com/pdf/H3_AP202404221630977282_1.pdf?1713809951000.pdf
建筑材料行业周报：增发国债加速落地，关注建材底部机会,开源证券,2024-04-21,水泥建材,https://pdf.dfcfw.com/pdf/H3_AP202404211630936725_1.pdf?1713738740000.pdf
建材建筑周观点：苏州低空经济加码，玻纤价格弹性可期,民生证券,2024-04-21,水泥建材,https://pdf.dfcfw.com/pdf/H3_AP202404211630933336_1.pdf?1713771417000.pdf
建材行业周报：3月二手住宅以价换量，坚定看多消费建材龙头,甬兴证券,2024-04-19,水泥建材,https://pdf.dfcfw.com/pdf/H3_AP202404191630642703_1.pdf?1713519157000.pdf
建筑材料3月行业数据点评：销售及新开工降幅边际收窄，持续性仍依赖政策发力,德邦证券,2024-04-18,水泥建材,https://pdf.dfcfw.com/pdf/H3_AP202404181630497901_1.pdf?1713429552000.pdf
建筑材料行业周报：国常会聚焦账款拖欠问题，关注各地上调水泥价格,上海证券,2024-04-18,水泥建材,https://pdf.dfcfw.com/pdf/H3_AP202404181630501112_1.pdf?1713433815000.pdf
建筑材料行业周报：电子纱小幅提价，公积金新政支持绿色建筑,华安证券,2024-04-17,水泥建材,https://pdf.dfcfw.com/pdf/H3_AP202404171630383217_1.pdf?1713347778000.pdf
建材行业点评：玻纤电子布“复价”，中游制造环节稀缺的供给减少品种,民生证券,2024-04-16,水泥建材,https://pdf.dfcfw.com/pdf/H3_AP202404151630243514_1.pdf?1713253897000.pdf
建筑材料行业周报：玻纤价格继续上涨，行业有望底部回升,中国银河,2024-04-16,水泥建材,https://pdf.dfcfw.com/pdf/H3_AP202404161630270198_1.pdf?1713259698000.pdf
建筑材料行业周观点：玻纤粗纱细纱相继提价，重视行业反转机会,德邦证券,2024-04-15,水泥建材,https://pdf.dfcfw.com/pdf/H3_AP202404151630210836_1.pdf?1713170280000.pdf
建筑材料行业研究周报：华东水泥开启涨价，关注供给端积极信号,天风证券,2024-04-15,水泥建材,https://pdf.dfcfw.com/pdf/H3_AP202404151630211047_1.pdf?1713170426000.pdf
建筑材料行业跟踪周报：大宗品价格底部反弹，适当关注,东吴证券,2024-04-15,水泥建材,https://pdf.dfcfw.com/pdf/H3_AP202404151630214563_1.pdf?1713179785000.pdf
建材建筑周观点：提价频发，水泥&玻纤龙头利润预期修复,民生证券,2024-04-15,水泥建材,https://pdf.dfcfw.com/pdf/H3_AP202404141630209732_1.pdf?1713167099000.pdf
建筑材料行业周报：长三角水泥熟料提价，关注建材底部机会,开源证券,2024-04-15,水泥建材,https://pdf.dfcfw.com/pdf/H3_AP202404151630210179_1.pdf?1713143236000.pdf
建筑材料：玻纤行业至暗时刻已过，龙头安全边际或已建立,德邦证券,2024-04-14,水泥建材,https://pdf.dfcfw.com/pdf/H3_AP202404141630208017_1.pdf?1713102745000.pdf
建材行业周报：光伏玻璃下游需求升温，4月价格上调,甬兴证券,2024-04-12,水泥建材,https://pdf.dfcfw.com/pdf/H3_AP202404121630174281_1.pdf?1712915467000.pdf
建筑材料行业周报：郑州推进住房“以旧换新”，有望促进存量房置换,上海证券,2024-04-11,水泥建材,https://pdf.dfcfw.com/pdf/H3_AP202404111630140209_1.pdf?1712832515000.pdf
建材行业点评：长三角水泥熟料提价点评：预期见底，重视4月反弹窗口,民生证券,2024-04-11,水泥建材,https://pdf.dfcfw.com/pdf/H3_AP202404111630148777_1.pdf?1712856636000.pdf
建筑材料行业周报：玻纤提价有望带动盈利改善，低空经济碳纤维受益,上海证券,2024-04-10,水泥建材,https://pdf.dfcfw.com/pdf/H3_AP202404101630104942_1.pdf?1712756683000.pdf
建材行业周报：玻纤和光伏玻璃价格有望上涨，需求边际改善带来投资机会,甬兴证券,2024-04-10,水泥建材,https://pdf.dfcfw.com/pdf/H3_AP202404101630104963_1.pdf?1712756763000.pdf
建筑材料行业周报：顺周期大宗品涨价，多地开展住房“以旧换新”,华安证券,2024-04-09,水泥建材,https://pdf.dfcfw.com/pdf/H3_AP202404091630068958_1.pdf?1712656723000.pdf
建筑材料行业周观点：3月百强房企销售同比依旧疲软，光伏玻璃4月报价上涨,德邦证券,2024-04-08,水泥建材,https://pdf.dfcfw.com/pdf/H3_AP202404081630040453_1.pdf?1712564097000.pdf
建筑材料行业跟踪周报：基本面处于中期底部，短期看出口受益品类,东吴证券,2024-04-08,水泥建材,https://pdf.dfcfw.com/pdf/H3_AP202404081630043277_1.pdf?1712576100000.pdf
建筑材料行业研究周报：建材各板块一季度业绩如何展望？,天风证券,2024-04-08,水泥建材,https://pdf.dfcfw.com/pdf/H3_AP202404081630040578_1.pdf?1712591117000.pdf
建筑材料行业周报：玻纤提价释放拐点信号，关注建材底部机会,开源证券,2024-04-07,水泥建材,https://pdf.dfcfw.com/pdf/H3_AP202404071630039385_1.pdf?1712526315000.pdf
建材建筑周观点：光伏玻璃+玻纤顺利提价，PMI修复带动顺周期预期,民生证券,2024-04-07,水泥建材,https://pdf.dfcfw.com/pdf/H3_AP202404071630034600_1.pdf?1712499034000.pdf
建筑材料行业研究周报：玻纤涨价对各企业带来多少利润弹性？,天风证券,2024-04-03,水泥建材,https://pdf.dfcfw.com/pdf/H3_AP202404031629694069_1.pdf?1712160349000.pdf
建筑材料行业周报：粗纱价格调涨，玻纤底部信号显现,中国银河,2024-04-02,水泥建材,https://pdf.dfcfw.com/pdf/H3_AP202404021629415838_1.pdf?1712064176000.pdf
建筑材料行业动态点评：玻纤恢复性调价，需求边际改善,甬兴证券,2024-04-02,水泥建材,https://pdf.dfcfw.com/pdf/H3_AP202404021629418356_1.pdf?1712071430000.pdf
企业竞争图谱：2024年蒸压加气混凝土装备 头豹词条报告系列,头豹研究院,2024-04-02,水泥建材,https://pdf.dfcfw.com/pdf/H3_AP202404021629501222_1.pdf?1712087269000.pdf
建筑材料行业周观点：关注低空经济发展为碳纤维带来新增量,德邦证券,2024-04-01,水泥建材,https://pdf.dfcfw.com/pdf/H3_AP202404011629195289_1.pdf?1711970369000.pdf
建筑材料行业周报：地产限购政策再松绑，3月PMI数值超预期,华安证券,2024-04-01,水泥建材,https://pdf.dfcfw.com/pdf/H3_AP202404011629199515_1.pdf?1711987662000.pdf
非金属建材周报（24年第13周）：光伏玻璃持续去库，玻纤企业集体提价,国信证券,2024-04-01,水泥建材,https://pdf.dfcfw.com/pdf/H3_AP202404011629216987_1.pdf?1712008883000.pdf
建筑材料行业跟踪周报：经济季节性回暖，地产链底部徘徊,东吴证券,2024-04-01,水泥建材,https://pdf.dfcfw.com/pdf/H3_AP202404011629196183_1.pdf?1711978532000.pdf
建材建筑周观点：关注低空经济催化碳纤维+设计，关注板块内资源品重估价值,民生证券,2024-03-31,水泥建材,https://pdf.dfcfw.com/pdf/H3_AP202403311629189265_1.pdf?1711956623000.pdf
建筑材料行业周报：基建投资增速稳健，关注建材底部机会,开源证券,2024-03-31,水泥建材,https://pdf.dfcfw.com/pdf/H3_AP202403311629189801_1.pdf?1711925295000.pdf
建材行业周报：地产政策边际优化，光伏玻璃持续降库,甬兴证券,2024-03-28,水泥建材,https://pdf.dfcfw.com/pdf/H3_AP202403281628432936_1.pdf?1711631357000.pdf
建筑材料行业周报：3月二手房成交回升，关注中央预算类资金下达进度对建材需求拉动,上海证券,2024-03-26,水泥建材,https://pdf.dfcfw.com/pdf/H3_AP202403261628174395_1.pdf?1711447230000.pdf
建筑材料行业研究周报：当前玻纤实际需求及24年行业供需怎么看？,天风证券,2024-03-25,水泥建材,https://pdf.dfcfw.com/pdf/H3_AP202403251628067531_1.pdf?1711357399000.pdf
建筑材料行业跟踪周报：国常会再提优化地产政策,东吴证券,2024-03-25,水泥建材,https://pdf.dfcfw.com/pdf/H3_AP202403251628066168_1.pdf?1711327950000.pdf
建筑材料行业周观点：弱现实需更多政策呵护，关注一季报的绩优股,德邦证券,2024-03-25,水泥建材,https://pdf.dfcfw.com/pdf/H3_AP202403251628066285_1.pdf?1711350620000.pdf
建筑材料行业周报：国常会再提优化房地产政策，关注建材底部机会,开源证券,2024-03-25,水泥建材,https://pdf.dfcfw.com/pdf/H3_AP202403241628065673_1.pdf?1711350716000.pdf
建筑材料行业周报：政策助力需求恢复，关注行业底部机会,中国银河,2024-03-25,水泥建材,https://pdf.dfcfw.com/pdf/H3_AP202403251628076522_1.pdf?1711387539000.pdf
建筑材料行业周报：关注基建政策落地带来的建材行业需求改善,华龙证券,2024-03-25,水泥建材,https://pdf.dfcfw.com/pdf/H3_AP202403251628084902_1.pdf?1711399561000.pdf
非金属建材周报（24年第12周）：国常会再提优化房地产政策，后续支持有望进一步加码,国信证券,2024-03-25,水泥建材,https://pdf.dfcfw.com/pdf/H3_AP202403251628092444_1.pdf?1711399862000.pdf
建筑材料行业周报：年初地产投资仍处弱势，国常会再提优化政策,华安证券,2024-03-25,水泥建材,https://pdf.dfcfw.com/pdf/H3_AP202403251628070629_1.pdf?1711376193000.pdf
建材建筑周观点：关注低空经济催化碳纤维+设计，关注水泥发货环比改善,民生证券,2024-03-24,水泥建材,https://pdf.dfcfw.com/pdf/H3_AP202403241628065172_1.pdf?1711303069000.pdf
建材行业周报：下游需求好转，光伏玻璃行情转暖,甬兴证券,2024-03-21,水泥建材,https://pdf.dfcfw.com/pdf/H3_AP202403211627431764_1.pdf?1711027040000.pdf
建筑材料行业周报：杭州放开二手房限购，推动二手房市场活跃,上海证券,2024-03-20,水泥建材,https://pdf.dfcfw.com/pdf/H3_AP202403201627307007_1.pdf?1710930208000.pdf
建筑材料行业月报：房地产市场短期承压，关注基建政策落地带来的建材需求改善,华龙证券,2024-03-20,水泥建材,https://pdf.dfcfw.com/pdf/H3_AP202403201627320165_1.pdf?1710955294000.pdf
建筑材料行业1-2月行业数据点评：高基数下地产销售降幅扩大，基本面修复仍待政策持续呵护,德邦证券,2024-03-19,水泥建材,https://pdf.dfcfw.com/pdf/H3_AP202403191627111394_1.pdf?1710839640000.pdf
建筑材料行业跟踪周报：金融数据回落，继续关注海外,东吴证券,2024-03-18,水泥建材,https://pdf.dfcfw.com/pdf/H3_AP202403181626956073_1.pdf?1710722265000.pdf
建筑材料行业周观点：1-2月新增居民长贷同增，光伏玻璃预期向好,德邦证券,2024-03-18,水泥建材,https://pdf.dfcfw.com/pdf/H3_AP202403181626959139_1.pdf?1710751893000.pdf
建筑材料行业报告：二手房成交升温，关注玻纤涨价进展,天风证券,2024-03-18,水泥建材,https://pdf.dfcfw.com/pdf/H3_AP202403181626965507_1.pdf?1710771849000.pdf
建材建筑行业开复工专题研究：开复工成色看建材建筑需求，关注二手房与C端,国海证券,2024-03-17,水泥建材,https://pdf.dfcfw.com/pdf/H3_AP202403161626948943_1.pdf?1710670528000.pdf
建材建筑周观点：关注板块内资源品重估价值，关注药玻、出口两类需求景气,民生证券,2024-03-17,水泥建材,https://pdf.dfcfw.com/pdf/H3_AP202403171626952840_1.pdf?1710684647000.pdf
建筑材料行业周报：70城房价环比降幅继续收窄，关注建材底部机会,开源证券,2024-03-17,水泥建材,https://pdf.dfcfw.com/pdf/H3_AP202403171626955139_1.pdf?1710714226000.pdf
建筑材料行业周报：拟发行万亿超长期特别国债，有望拉动建材需求改善,上海证券,2024-03-13,水泥建材,https://pdf.dfcfw.com/pdf/H3_AP202403131626573628_1.pdf?1710323766000.pdf
建材行业周报：标本兼治化风险，构建地产新模式,甬兴证券,2024-03-12,水泥建材,https://pdf.dfcfw.com/pdf/H3_AP202403121626422587_1.pdf?1710236122000.pdf
建筑材料行业跟踪周报：两会政策落地，地产信用风险可控,东吴证券,2024-03-12,水泥建材,https://pdf.dfcfw.com/pdf/H3_AP202403121626422649_1.pdf?1710236408000.pdf
建筑材料行业周报：推动城市更新重点工程，相关建材行业需求有望改善,华龙证券,2024-03-12,水泥建材,https://pdf.dfcfw.com/pdf/H3_AP202403121626443842_1.pdf?1710239624000.pdf
建筑材料行业专题研究：过去十年建材板块春季表现带给我们哪些启示？,天风证券,2024-03-12,水泥建材,https://pdf.dfcfw.com/pdf/H3_AP202403121626445264_1.pdf?1710244760000.pdf
建筑材料行业报告：政策推动大规模设备更新及消费品以旧换新，关注水泥相关领域及C端消费建材投资机会,天风证券,2024-03-11,水泥建材,https://pdf.dfcfw.com/pdf/H3_AP202403111626208711_1.pdf?1710142752000.pdf
建材行业周报（3.4-3.10）超长期特别国债支撑基建投资强度,中银证券,2024-03-11,水泥建材,https://pdf.dfcfw.com/pdf/H3_AP202403111626211914_1.pdf?1710150908000.pdf
建筑材料行业周报：两会提振下游恢复信心，需求将进一步改善,中国银河,2024-03-11,水泥建材,https://pdf.dfcfw.com/pdf/H3_AP202403111626230750_1.pdf?1710192621000.pdf
建筑材料行业周观点：特别国债续发，支撑基建投资增速,万联证券,2024-03-11,水泥建材,https://pdf.dfcfw.com/pdf/H3_AP202403111626253336_1.pdf?1710185130000.pdf
建筑材料行业周报：万亿特别国债超预期，“三大工程”仍为发展重心,华安证券,2024-03-11,水泥建材,https://pdf.dfcfw.com/pdf/H3_AP202403111626307952_1.pdf?1710226477000.pdf
建筑材料行业周观点：开年复工复产缓慢，“两会”再提信心,德邦证券,2024-03-11,水泥建材,https://pdf.dfcfw.com/pdf/H3_AP202403111626210140_1.pdf?1710147153000.pdf
建筑材料行业周报：两会再提地产支持政策，关注建材底部机会,开源证券,2024-03-10,水泥建材,https://pdf.dfcfw.com/pdf/H3_AP202403101626202621_1.pdf?1710142438000.pdf
建材行业周报：百强房企2月销售承压，边际影响递减,甬兴证券,2024-03-07,水泥建材,https://pdf.dfcfw.com/pdf/H3_AP202403071625929861_1.pdf?1709818926000.pdf
建筑材料行业周报：元宵前后开复工进度偏缓，关注后续修复,上海证券,2024-03-06,水泥建材,https://pdf.dfcfw.com/pdf/H3_AP202403061625658060_1.pdf?1709717471000.pdf
建材行业周报：5年期LPR下调，行业龙头性价比凸出,甬兴证券,2024-03-06,水泥建材,https://pdf.dfcfw.com/pdf/H3_AP202403061625659301_1.pdf?1709719843000.pdf
建筑材料行业周报：需求有望逐步回升,中国银河,2024-03-05,水泥建材,https://pdf.dfcfw.com/pdf/H3_AP202403051625452904_1.pdf?1709629493000.pdf
建筑材料行业周观点：2月百强房企销售额大幅下降，下游需求有待进一步修复,万联证券,2024-03-05,水泥建材,https://pdf.dfcfw.com/pdf/H3_AP202403051625452908_1.pdf?1709629493000.pdf
建筑材料行业周报：城市融资协调机制落地持续加快，关注建材底部机会,开源证券,2024-03-04,水泥建材,https://pdf.dfcfw.com/pdf/H3_AP202403041625232947_1.pdf?1709545486000.pdf
建材行业周报：关注两会“稳增长”相关内容,中银证券,2024-03-04,水泥建材,https://pdf.dfcfw.com/pdf/H3_AP202403041625313691_1.pdf?1709554273000.pdf
建筑材料行业周观点：1-2月百强房企销售疲软，期待政策催化下的“金三银四”,德邦证券,2024-03-04,水泥建材,https://pdf.dfcfw.com/pdf/H3_AP202403041625214760_1.pdf?1709538025000.pdf
建筑材料行业报告：建材消费量同比下滑，继续推荐攻守兼备的水泥板块,天风证券,2024-03-04,水泥建材,https://pdf.dfcfw.com/pdf/H3_AP202403041625214777_1.pdf?1709538128000.pdf
建筑材料行业跟踪周报基本面低位徘徊，反弹仍有空间,东吴证券,2024-03-03,水泥建材,https://pdf.dfcfw.com/pdf/H3_AP202403031625209740_1.pdf?1709486773000.pdf
非金属建材周报（24年第8周）：地产相关利好政策持续，关注节后需求恢复,国信证券,2024-03-01,水泥建材,https://pdf.dfcfw.com/pdf/H3_AP202403011624793099_1.pdf?1709284350000.pdf
建材行业基金持仓专题：Q4建材持仓比例降至历史低位，主要板块均减持明显,国信证券,2024-03-01,水泥建材,https://pdf.dfcfw.com/pdf/H3_AP202403011624793100_1.pdf?1709283631000.pdf
建筑材料行业周观点：年后复工进展较慢，LPR调降有助于提振地产需求,万联证券,2024-02-27,水泥建材,https://pdf.dfcfw.com/pdf/H3_AP202402271623723591_1.pdf?1709024651000.pdf
建筑材料行业周报：年后首周开复工率优于去年，关注开工端需求回升,上海证券,2024-02-27,水泥建材,https://pdf.dfcfw.com/pdf/H3_AP202402271623726046_1.pdf?1709027612000.pdf
建材行业周报：楼市政策持续发力，碳交易市场升级扩容,甬兴证券,2024-02-27,水泥建材,https://pdf.dfcfw.com/pdf/H3_AP202402271623731588_1.pdf?1709045111000.pdf
建筑材料行业周报：城中村改造在沪首单落地，关注建材底部机会,开源证券,2024-02-26,水泥建材,https://pdf.dfcfw.com/pdf/H3_AP202402261623574044_1.pdf?1708938774000.pdf
建筑材料行业研究周报：节后复工缓慢推进，继续看好短期躁动行情,天风证券,2024-02-26,水泥建材,https://pdf.dfcfw.com/pdf/H3_AP202402261623574065_1.pdf?1708938774000.pdf
建筑材料行业跟踪周报：地产链跟随市场反弹,东吴证券,2024-02-26,水泥建材,https://pdf.dfcfw.com/pdf/H3_AP202402261623574143_1.pdf?1708940207000.pdf
行业研究_行业周报：五年期LPR迎最大降幅，地产白名单项目获银行融资,华安证券,2024-02-26,水泥建材,https://pdf.dfcfw.com/pdf/H3_AP202402261623574342_1.pdf?1708940510000.pdf
