研报名称,机构名称,发布时间,行业,研报地址
建筑材料行业周报：政策加码促底部估值修复；长三角水泥开启大幅提价,中泰证券,2024-10-08,水泥建材,https://pdf.dfcfw.com/pdf/H3_AP202410081640189600_1.pdf?1728376381000.pdf
2024年第四季度水泥行业展望：需求整体弱势 价格反弹动力不足,大公国际,2024-10-08,水泥建材,https://pdf.dfcfw.com/pdf/H3_AP202410081640191353_1.pdf?1728400319000.pdf
建材行业周报：政治局会议定调“促进地产止跌回稳”，推动构建地产新模式,甬兴证券,2024-10-08,水泥建材,https://pdf.dfcfw.com/pdf/H3_AP202410081640192481_1.pdf?1728398292000.pdf
建材建筑周观点：水泥板块对财政政策的敏感性梳理,民生证券,2024-10-08,水泥建材,https://pdf.dfcfw.com/pdf/H3_AP202410081640195923_1.pdf?1728408045000.pdf
建筑材料行业周报：政策利好密集落地，关注超跌建材板块,上海证券,2024-10-07,水泥建材,https://pdf.dfcfw.com/pdf/H3_AP202410071640177706_1.pdf?1728299759000.pdf
建筑材料行业9月动态报告：政策加码助推需求恢复，关注建材修复机会,中国银河,2024-10-07,水泥建材,https://pdf.dfcfw.com/pdf/H3_AP202410051640176620_1.pdf?1728302069000.pdf
建筑材料行业跟踪周报：国内政策大幅转向，看好板块估值修复,东吴证券,2024-10-07,水泥建材,https://pdf.dfcfw.com/pdf/H3_AP202410071640185331_1.pdf?1728329336000.pdf
建筑材料行业周报：宏观和地产政策力度大，建材超跌反弹空间大,开源证券,2024-10-07,水泥建材,https://pdf.dfcfw.com/pdf/H3_AP202410071640186550_1.pdf?1728375372000.pdf
水泥：长三角第五轮提价幅度超预期，吹响进攻号角,中泰证券,2024-10-07,水泥建材,https://pdf.dfcfw.com/pdf/H3_AP202410071640177293_1.pdf?1728315512000.pdf
建筑材料行业周报：重磅利好政策密集发布，有望带动行业估值回升,华龙证券,2024-09-30,水泥建材,https://pdf.dfcfw.com/pdf/H3_AP202409301640099431_1.pdf?1727717345000.pdf
建筑建材行业：行业长期历史低位波动，等待供给优化和政策量变到质变,东兴证券,2024-09-30,水泥建材,https://pdf.dfcfw.com/pdf/H3_AP202409301640100550_1.pdf?1727706746000.pdf
建筑材料行业研究周报：政策刺激加码，沿江熟料大幅涨价，关注建材底部反转机会,天风证券,2024-09-29,水泥建材,https://pdf.dfcfw.com/pdf/H3_AP202409291640095250_1.pdf?1727647319000.pdf
建筑材料行业周报：上调板块评级，布局进攻机会,华源证券,2024-09-29,水泥建材,https://pdf.dfcfw.com/pdf/H3_AP202409291640095312_1.pdf?1727681056000.pdf
建筑材料行业周报：多重政策利多地产和股市，建材预期改善,开源证券,2024-09-29,水泥建材,https://pdf.dfcfw.com/pdf/H3_AP202409291640095326_1.pdf?1727691697000.pdf
建材行业点评：政治局会议强调逆周期调节，建材板块修复可期,平安证券,2024-09-27,水泥建材,https://pdf.dfcfw.com/pdf/H3_AP202409271640066824_1.pdf?1727421697000.pdf
建材行业点评：港股建材的投资机会梳理,民生证券,2024-09-26,水泥建材,https://pdf.dfcfw.com/pdf/H3_AP202409261640058428_1.pdf?1727372217000.pdf
建筑材料行业周报：美联储降息落地，政策预期增强有望带动地产链企稳,上海证券,2024-09-25,水泥建材,https://pdf.dfcfw.com/pdf/H3_AP202409251640021576_1.pdf?1727253615000.pdf
大国重材系列：石膏板出海：非洲&中亚，下一个高增长市场,民生证券,2024-09-25,水泥建材,https://pdf.dfcfw.com/pdf/H3_AP202409251640035410_1.pdf?1727286178000.pdf
建筑材料行业跟踪周报：美元降息落地，中国外贸环境或改善,东吴证券,2024-09-23,水泥建材,https://pdf.dfcfw.com/pdf/H3_AP202409231639974411_1.pdf?1727051268000.pdf
建筑材料行业研究周报：关注降准降息政策预期下建材板块修复行情，弹性首选消费建材,天风证券,2024-09-23,水泥建材,https://pdf.dfcfw.com/pdf/H3_AP202409231639974721_1.pdf?1727085317000.pdf
建材行业周报：地产持续寻底，水泥即将纳入碳排放交易市场,甬兴证券,2024-09-23,水泥建材,https://pdf.dfcfw.com/pdf/H3_AP202409231639976441_1.pdf?1727084917000.pdf
2024年建材行业中报总结：顺周期探底修复，关注药玻等成长性兑现,中泰证券,2024-09-23,水泥建材,https://pdf.dfcfw.com/pdf/H3_AP202409231639975083_1.pdf?1727083829000.pdf
建筑材料行业周报：美国降息有望打开国内降息空间，建材预期改善,开源证券,2024-09-22,水泥建材,https://pdf.dfcfw.com/pdf/H3_AP202409221639973876_1.pdf?1727040743000.pdf
水泥行业专题研究：2024Q2水泥继续筑底，期待积极变化,国联证券,2024-09-19,水泥建材,https://pdf.dfcfw.com/pdf/H3_AP202409191639940789_1.pdf?1726765983000.pdf
建筑材料行业研究周报：水泥纳入碳交易方案初步落地，关注旺季涨价行情,天风证券,2024-09-18,水泥建材,https://pdf.dfcfw.com/pdf/H3_AP202409181639910703_1.pdf?1726654733000.pdf
建筑材料行业周报：新疆民爆逻辑被低估，重申左侧关注浙赣粤运河,华源证券,2024-09-18,水泥建材,https://pdf.dfcfw.com/pdf/H3_AP202409181639919542_1.pdf?1726678409000.pdf
建筑材料行业跟踪周报：关注利率下调之后的微观反应,东吴证券,2024-09-17,水泥建材,https://pdf.dfcfw.com/pdf/H3_AP202409171639907499_1.pdf?1726610229000.pdf
大国重材系列报告：复盘：从立邦看涂料世界（一）,民生证券,2024-09-16,水泥建材,https://pdf.dfcfw.com/pdf/H3_AP202409161639897063_1.pdf?1726567038000.pdf
建筑材料行业专题研究：2024年中报总结：营收利润下滑，期待下半年顺周期板块修复,天风证券,2024-09-15,水泥建材,https://pdf.dfcfw.com/pdf/H3_AP202409151639888507_1.pdf?1726479288000.pdf
建筑材料行业周报：政策叠加房企助力推动“金九银十”，建材预期改善,开源证券,2024-09-15,水泥建材,https://pdf.dfcfw.com/pdf/H3_AP202409151639888978_1.pdf?1726440510000.pdf
建筑材料行业周报：水泥略有上涨，玻璃继续下跌,国都证券,2024-09-13,水泥建材,https://pdf.dfcfw.com/pdf/H3_AP202409131639863384_1.pdf?1726219093000.pdf
建筑材料行业周报：水泥和玻璃价格继续下跌,国都证券,2024-09-12,水泥建材,https://pdf.dfcfw.com/pdf/H3_AP202409121639858869_1.pdf?1726178909000.pdf
建材行业点评：水泥拟纳入碳交易市场，头部企业相对受益,平安证券,2024-09-10,水泥建材,https://pdf.dfcfw.com/pdf/H3_AP202409101639809158_1.pdf?1725966162000.pdf
建筑材料行业周报：“金九”水泥推涨，关注旺季需求改善,上海证券,2024-09-10,水泥建材,https://pdf.dfcfw.com/pdf/H3_AP202409101639810209_1.pdf?1725972458000.pdf
2024上半年建材行业总结：民爆、药玻、石膏板表现突出,民生证券,2024-09-10,水泥建材,https://pdf.dfcfw.com/pdf/H3_AP202409101639818455_1.pdf?1725997194000.pdf
建筑材料行业专题研究：弱需求竞争加剧，关注供给侧变化,国联证券,2024-09-09,水泥建材,https://pdf.dfcfw.com/pdf/H3_AP202409091639787938_1.pdf?1725872062000.pdf
建筑材料行业周报：大运河关注度提升，三折屏关注基本面验证,华源证券,2024-09-09,水泥建材,https://pdf.dfcfw.com/pdf/H3_AP202409091639803090_1.pdf?1725916441000.pdf
建筑材料行业跟踪周报：中非论坛召开，出海关注度提升,东吴证券,2024-09-09,水泥建材,https://pdf.dfcfw.com/pdf/H3_AP202409091639790506_1.pdf?1725889322000.pdf
建筑材料行业研究周报：水泥价格环比开始好转，关注旺季窗口需求恢复节奏,天风证券,2024-09-08,水泥建材,https://pdf.dfcfw.com/pdf/H3_AP202409081639786935_1.pdf?1725830462000.pdf
建筑材料8月动态报告：业绩筑底，期待“金九银十”需求复苏,中国银河,2024-09-08,水泥建材,https://pdf.dfcfw.com/pdf/H3_AP202409081639786998_1.pdf?1725827947000.pdf
建筑材料行业周报：各地政策配合“金九银十”旺季，建材预期改善,开源证券,2024-09-08,水泥建材,https://pdf.dfcfw.com/pdf/H3_AP202409081639786683_1.pdf?1725830462000.pdf
建材行业周报：百强房企销售8月延续下滑，静待地产链拐点,甬兴证券,2024-09-05,水泥建材,https://pdf.dfcfw.com/pdf/H3_AP202409051639748902_1.pdf?1725544966000.pdf
建筑材料行业深度报告：2024年中报综述：板块承压延续，景气仍待筑底，关注出海、水利等方向,东吴证券,2024-09-05,水泥建材,https://pdf.dfcfw.com/pdf/H3_AP202409051639755785_1.pdf?1725557470000.pdf
建筑材料行业周报：存量房贷利率有望下调，房屋养老金新举措试点,上海证券,2024-09-03,水泥建材,https://pdf.dfcfw.com/pdf/H3_AP202409031639708108_1.pdf?1725369411000.pdf
建筑材料行业周报：持续推动楼市高质量发展，建材预期改善,开源证券,2024-09-02,水泥建材,https://pdf.dfcfw.com/pdf/H3_AP202409021639682334_1.pdf?1725235508000.pdf
建筑材料行业研究周报：中报利空或出尽，推荐C端消费建材及海外水泥龙头,天风证券,2024-09-02,水泥建材,https://pdf.dfcfw.com/pdf/H3_AP202409021639685971_1.pdf?1725278860000.pdf
建筑材料行业跟踪周报：景气仍有压力，关注地产政策,东吴证券,2024-09-02,水泥建材,https://pdf.dfcfw.com/pdf/H3_AP202409021639686182_1.pdf?1725281495000.pdf
建材建筑周观点：9月重视地产链+基建，继续推荐运河、西藏、新疆景气机会,民生证券,2024-09-01,水泥建材,https://pdf.dfcfw.com/pdf/H3_AP202409011639682174_1.pdf?1725272866000.pdf
建筑材料行业周观点：供给端变化或决定“金九银十”旺季成色,德邦证券,2024-09-01,水泥建材,https://pdf.dfcfw.com/pdf/H3_AP202409011639681035_1.pdf?1725215572000.pdf
建材行业周报：住建部明确保交房任务落实到户，有望推动地产高质量发展,甬兴证券,2024-08-28,水泥建材,https://pdf.dfcfw.com/pdf/H3_AP202408281639505421_1.pdf?1724838243000.pdf
建筑材料行业周报：西部大开发再出政策支持，关注基建受益板块,上海证券,2024-08-28,水泥建材,https://pdf.dfcfw.com/pdf/H3_AP202408281639508022_1.pdf?1724844314000.pdf
建筑材料行业周报：西部基建投资预期升温，主题性机会值得关注,华源证券,2024-08-27,水泥建材,https://pdf.dfcfw.com/pdf/H3_AP202408271639471358_1.pdf?1724764580000.pdf
建筑材料行业周观点：积极推进保交楼，北新建材中报亮眼,德邦证券,2024-08-26,水泥建材,https://pdf.dfcfw.com/pdf/H3_AP202408261639446036_1.pdf?1724659843000.pdf
建筑材料行业研究周报：西部大开发若干政策措施发布，关注基础材料_民爆受益龙头,天风证券,2024-08-26,水泥建材,https://pdf.dfcfw.com/pdf/H3_AP202408261639446126_1.pdf?1724660937000.pdf
水泥行业专题研究：多省水泥协会密集倡议，行业“淡季不淡”,国联证券,2024-08-26,水泥建材,https://pdf.dfcfw.com/pdf/H3_AP202408261639446143_1.pdf?1724664065000.pdf
建筑材料行业跟踪周报：住房养老金试点，老旧小区改造有望加快,东吴证券,2024-08-26,水泥建材,https://pdf.dfcfw.com/pdf/H3_AP202408261639449260_1.pdf?1724682696000.pdf
建材行业周报：7月地产销售延续下滑，耐心等待右侧机会来临,甬兴证券,2024-08-25,水泥建材,https://pdf.dfcfw.com/pdf/H3_AP202408241639439914_1.pdf?1724581124000.pdf
建材行业点评：新时代西部大开发受益方向梳理,民生证券,2024-08-25,水泥建材,https://pdf.dfcfw.com/pdf/H3_AP202408241639440009_1.pdf?1724580951000.pdf
建材建筑周观点：跨海大桥的契机,民生证券,2024-08-25,水泥建材,https://pdf.dfcfw.com/pdf/H3_AP202408251639443167_1.pdf?1724609205000.pdf
建筑材料行业周报：保交房持续推进，建材预期改善,开源证券,2024-08-25,水泥建材,https://pdf.dfcfw.com/pdf/H3_AP202408251639443202_1.pdf?1724613773000.pdf
建筑材料行业行业周报：基建回落、地产筑底，静待旺季需求复苏,中国银河,2024-08-20,水泥建材,https://pdf.dfcfw.com/pdf/H3_AP202408201639347838_1.pdf?1724147293000.pdf
建筑材料行业周报：加快全面绿色转型，关注西南水电建设,上海证券,2024-08-20,水泥建材,https://pdf.dfcfw.com/pdf/H3_AP202408201639364017_1.pdf?1724181650000.pdf
建筑材料行业：“收储”行动继续扩围，市场情绪有望加速修复,中泰证券,2024-08-19,水泥建材,https://pdf.dfcfw.com/pdf/H3_AP202408191639328240_1.pdf?1724060291000.pdf
非金属建材周报（24年第33周）：市场修复仍待政策扶持，关注淡旺季切换和西藏板块,国信证券,2024-08-19,水泥建材,https://pdf.dfcfw.com/pdf/H3_AP202408191639338433_1.pdf?1724097569000.pdf
建筑材料行业周报：传统淡季需求疲软价格下行，关注供给侧变动情况,华龙证券,2024-08-19,水泥建材,https://pdf.dfcfw.com/pdf/H3_AP202408191639339003_1.pdf?1724100526000.pdf
建筑材料行业跟踪周报：投资数据低迷，继续关注财政释放力度,东吴证券,2024-08-19,水泥建材,https://pdf.dfcfw.com/pdf/H3_AP202408191639330173_1.pdf?1724072721000.pdf
建筑材料行业周报：多地楼市新政频出，建材预期持续改善,开源证券,2024-08-18,水泥建材,https://pdf.dfcfw.com/pdf/H3_AP202408181639325791_1.pdf?1724019955000.pdf
建材建筑周观点：提示新基建：运河与核建,民生证券,2024-08-18,水泥建材,https://pdf.dfcfw.com/pdf/H3_AP202408181639325879_1.pdf?1724056158000.pdf
建筑材料行业周观点：7月居民长贷依旧疲软，需求季节性回落仍待新的催化,德邦证券,2024-08-18,水泥建材,https://pdf.dfcfw.com/pdf/H3_AP202408181639324814_1.pdf?1723996002000.pdf
建筑材料行业月报：传统淡季需求回落，底部布局静待旺季反弹,华龙证券,2024-08-18,水泥建材,https://pdf.dfcfw.com/pdf/H3_AP202408181639324185_1.pdf?1723987126000.pdf
建材行业2024年中期策略：长风破浪会有时,中银证券,2024-08-16,水泥建材,https://pdf.dfcfw.com/pdf/H3_AP202408161639304563_1.pdf?1723805869000.pdf
建筑材料行业7月行业数据点评：高基数下房地产需求短期承压，期待金九银十再度修复,德邦证券,2024-08-15,水泥建材,https://pdf.dfcfw.com/pdf/H3_AP202408151639297553_1.pdf?1723753994000.pdf
建材行业2024年中期策略：曙光渐至，静待花开,天风证券,2024-08-15,水泥建材,https://pdf.dfcfw.com/pdf/H3_AP202408151639297773_1.pdf?1723755493000.pdf
建筑材料行业周报：开工投资额环比改善，关注后续专项债提速对建材拉动,上海证券,2024-08-14,水泥建材,https://pdf.dfcfw.com/pdf/H3_AP202408141639268521_1.pdf?1723637431000.pdf
建材行业基金持仓专题：24Q2建材持仓继续承压，红利和涨价逻辑成为主要配置方向,国信证券,2024-08-14,水泥建材,https://pdf.dfcfw.com/pdf/H3_AP202408141639268675_1.pdf?1723640828000.pdf
建筑材料行业行业周报：加速“收储”去库，带动建材需求恢复,中国银河,2024-08-13,水泥建材,https://pdf.dfcfw.com/pdf/H3_AP202408131639248365_1.pdf?1723534864000.pdf
建筑材料行业周报：收储加速提升产业链关注，华为三折屏新机值得重视,华源证券,2024-08-13,水泥建材,https://pdf.dfcfw.com/pdf/H3_AP202408131639251928_1.pdf?1723556057000.pdf
建材行业点评：聚焦“西南水电”+“沿海核电”,民生证券,2024-08-12,水泥建材,https://pdf.dfcfw.com/pdf/H3_AP202408121639235597_1.pdf?1723470083000.pdf
建筑材料行业跟踪周报：关注地产收储进展,东吴证券,2024-08-12,水泥建材,https://pdf.dfcfw.com/pdf/H3_AP202408121639239101_1.pdf?1723477549000.pdf
建筑材料行业周观点：深圳加入收储行列，新一轮政策或可期加速去库存,德邦证券,2024-08-11,水泥建材,https://pdf.dfcfw.com/pdf/H3_AP202408111639232595_1.pdf?1723413050000.pdf
建筑材料行业周报：一线城市收储力度加大，建材预期持续改善,开源证券,2024-08-11,水泥建材,https://pdf.dfcfw.com/pdf/H3_AP202408111639232395_1.pdf?1723413949000.pdf
建材建筑周观点：收储催化地产链，民爆整合加快、景气区域看西藏+新疆,民生证券,2024-08-11,水泥建材,https://pdf.dfcfw.com/pdf/H3_AP202408111639232555_1.pdf?1723413553000.pdf
建筑材料行业研究周报：深圳收储新政落地，关注消费建材弹性品种及水泥高股息品种,天风证券,2024-08-11,水泥建材,https://pdf.dfcfw.com/pdf/H3_AP202408111639232365_1.pdf?1723413949000.pdf
建材行业周报：1-7月百强房企销售同比降幅收窄，收储有望提速,甬兴证券,2024-08-10,水泥建材,https://pdf.dfcfw.com/pdf/H3_AP202408101639230822_1.pdf?1723382706000.pdf
建筑材料行业7月动态报告：需求季节性回落，新型城镇化助力需求恢复,中国银河,2024-08-09,水泥建材,https://pdf.dfcfw.com/pdf/H3_AP202408091639219585_1.pdf?1723225509000.pdf
建材行业周报：LPR再下调，继续关注地产链细分龙头,甬兴证券,2024-08-08,水泥建材,https://pdf.dfcfw.com/pdf/H3_AP202408081639191853_1.pdf?1723111113000.pdf
建筑材料行业周报：推动新型城镇化，关注城市更新建材受益方向,上海证券,2024-08-07,水泥建材,https://pdf.dfcfw.com/pdf/H3_AP202408071639175262_1.pdf?1723038959000.pdf
建筑材料行业周报：新型城镇化战略计划发布，7月重点城市二手房成交改善,华安证券,2024-08-06,水泥建材,https://pdf.dfcfw.com/pdf/H3_AP202408061639161992_1.pdf?1722959936000.pdf
建筑材料行业研究周报：政治局会议首提防止“内卷式”恶性竞争，有望加快水泥供给端协同关系重塑,天风证券,2024-08-05,水泥建材,https://pdf.dfcfw.com/pdf/H3_AP202408051639137803_1.pdf?1722858031000.pdf
建筑材料行业跟踪周报：关注内需和新兴国家需求,东吴证券,2024-08-05,水泥建材,https://pdf.dfcfw.com/pdf/H3_AP202408051639138670_1.pdf?1722866441000.pdf
建筑材料：新型城镇化提升建材恢复预期,中国银河,2024-08-05,水泥建材,https://pdf.dfcfw.com/pdf/H3_AP202408051639148018_1.pdf?1722891172000.pdf
建筑材料行业周观点：7月百强房企销售季节性回落，期待新一轮政策迎接下半年旺季,德邦证券,2024-08-04,水泥建材,https://pdf.dfcfw.com/pdf/H3_AP202408041639132563_1.pdf?1722783905000.pdf
建筑材料行业周报：保险负债成本降低或导致红利开启质地战，重视高切低交易,华源证券,2024-08-04,水泥建材,https://pdf.dfcfw.com/pdf/H3_AP202408041639133518_1.pdf?1722804185000.pdf
建材建筑周观点：水泥倡议“反内卷”，从“红利衍生”走向“复苏驱动”,民生证券,2024-08-04,水泥建材,https://pdf.dfcfw.com/pdf/H3_AP202408041639133626_1.pdf?1722806513000.pdf
建筑材料行业周报：政治局会议继续定调房地产，建材预期改善,开源证券,2024-08-04,水泥建材,https://pdf.dfcfw.com/pdf/H3_AP202408041639133625_1.pdf?1722806326000.pdf
建筑材料行业周观点：LPR再下调10bp，降成本提信心,德邦证券,2024-08-01,水泥建材,https://pdf.dfcfw.com/pdf/H3_AP202408011638804953_1.pdf?1722501768000.pdf
建材行业点评：城镇化目标明确，城市更新有望提速,民生证券,2024-08-01,水泥建材,https://pdf.dfcfw.com/pdf/H3_AP202408011638816709_1.pdf?1722534869000.pdf
建筑材料行业周报：5年期LPR年内二次调降，继续引导房贷利率下调,上海证券,2024-07-31,水泥建材,https://pdf.dfcfw.com/pdf/H3_AP202407311638787578_1.pdf?1722441398000.pdf
建筑材料行业周报：市场供需博弈加剧，水泥价格震荡调整,中国银河,2024-07-30,水泥建材,https://pdf.dfcfw.com/pdf/H3_AP202407301638462833_1.pdf?1722345249000.pdf
建筑材料行业研究周报：当前建材板块外资配置情况如何？,天风证券,2024-07-29,水泥建材,https://pdf.dfcfw.com/pdf/H3_AP202407291638414876_1.pdf?1722243264000.pdf
当前时点看水泥：错峰是手段，信心是关键,天风证券,2024-07-29,水泥建材,https://pdf.dfcfw.com/pdf/H3_AP202407291638414878_1.pdf?1722243359000.pdf
建筑建材行业2024年半年度宏观展望：内需之重下静待新平衡,东兴证券,2024-07-29,水泥建材,https://pdf.dfcfw.com/pdf/H3_AP202407291638423041_1.pdf?1722265552000.pdf
建筑材料行业跟踪周报：货币政策小步开走，财政加码推动以旧换新,东吴证券,2024-07-29,水泥建材,https://pdf.dfcfw.com/pdf/H3_AP202407291638407904_1.pdf?1722219462000.pdf
建筑材料行业周报：三中全会定调房地产发展方向，建材预期改善,开源证券,2024-07-28,水泥建材,https://pdf.dfcfw.com/pdf/H3_AP202407281638404236_1.pdf?1722206713000.pdf
建筑材料行业周报：弱现实+弱预期，基金重仓比例仍在历史低位,华源证券,2024-07-28,水泥建材,https://pdf.dfcfw.com/pdf/H3_AP202407281638402176_1.pdf?1722200235000.pdf
建筑行业之绿色建筑篇（上）：绿色建材：聚焦传统产能技改与新型节能建材,招商银行,2024-07-28,水泥建材,https://pdf.dfcfw.com/pdf/H3_AP202407281638396192_1.pdf?1722186058000.pdf
建筑材料行业周报：三中全会定调地产，保障性住房战略新高度,上海证券,2024-07-26,水泥建材,https://pdf.dfcfw.com/pdf/H3_AP202407261638328188_1.pdf?1721986693000.pdf
建材行业2024年中期策略：地产政策持续发酵，底部布局静待反弹,华龙证券,2024-07-25,水泥建材,https://pdf.dfcfw.com/pdf/H3_AP202407251638285980_1.pdf?1721898143000.pdf
建筑材料行业：二十届三中全会专题：深化改革开启建材发展新征程,中国银河,2024-07-23,水泥建材,https://pdf.dfcfw.com/pdf/H3_AP202407231638221433_1.pdf?1721756178000.pdf
建材行业周报：6月地产销售降幅收窄，三中全会强调地产稳中求进,甬兴证券,2024-07-23,水泥建材,https://pdf.dfcfw.com/pdf/H3_AP202407231638218702_1.pdf?1721747376000.pdf
建材行业点评：建材建筑视角看《决定》，期待新需求、新格局,民生证券,2024-07-22,水泥建材,https://pdf.dfcfw.com/pdf/H3_AP202407221638173106_1.pdf?1721643162000.pdf
建筑材料行业跟踪周报：国内市场一体化，海外市场碎片化,东吴证券,2024-07-22,水泥建材,https://pdf.dfcfw.com/pdf/H3_AP202407221638173630_1.pdf?1721644212000.pdf
建筑材料行业周报：建立“久期”思维，关注DCF价值重估,华源证券,2024-07-22,水泥建材,https://pdf.dfcfw.com/pdf/H3_AP202407221638196132_1.pdf?1721684630000.pdf
建筑材料行业周报：上半年地产数据持续探底，加快建立租购并举制度,华安证券,2024-07-22,水泥建材,https://pdf.dfcfw.com/pdf/H3_AP202407221638198129_1.pdf?1721721113000.pdf
建材洞察系列之一：水泥淡季积极提价，关注供给端变化,平安证券,2024-07-22,水泥建材,https://pdf.dfcfw.com/pdf/H3_AP202407221638182623_1.pdf?1721664326000.pdf
建材行业动态报告：“一带一路”系列报告（五）-平陆运河的启示：向海图强，重塑格局,民生证券,2024-07-21,水泥建材,https://pdf.dfcfw.com/pdf/H3_AP202407201638130818_1.pdf?1721573477000.pdf
建材行业基金持仓点评：建材板块基金持仓环比再下降，持仓比例再探新低,德邦证券,2024-07-21,水泥建材,https://pdf.dfcfw.com/pdf/H3_AP202407211638147947_1.pdf?1721574134000.pdf
建筑材料行业研究周报：24Q2玻纤、水泥配置金额环比提升，继续推荐水泥板块,天风证券,2024-07-21,水泥建材,https://pdf.dfcfw.com/pdf/H3_AP202407211638153629_1.pdf?1721584422000.pdf
建筑材料行业周报：超一线城市“以旧换新”举措出齐，建材预期改善,开源证券,2024-07-21,水泥建材,https://pdf.dfcfw.com/pdf/H3_AP202407211638154781_1.pdf?1721587963000.pdf
建筑材料行业周观点：Q2建材基金持仓仍维持低位，静待政策落地后的底部反转机会,德邦证券,2024-07-21,水泥建材,https://pdf.dfcfw.com/pdf/H3_AP202407211638156649_1.pdf?1721594141000.pdf
建筑材料及新材料2024Q2业绩预告点评：符合预期，需求支撑偏弱,国联证券,2024-07-19,水泥建材,https://pdf.dfcfw.com/pdf/H3_AP202407191638094334_1.pdf?1721409599000.pdf
建材行业周报：水泥淡季提价，土拍市场热度边际改善,甬兴证券,2024-07-17,水泥建材,https://pdf.dfcfw.com/pdf/H3_AP202407171637989223_1.pdf?1721208345000.pdf
建筑材料行业周报：保障性再贷款加速投放，有望带动地产链预期改善,上海证券,2024-07-17,水泥建材,https://pdf.dfcfw.com/pdf/H3_AP202407171637989381_1.pdf?1721207827000.pdf
建筑材料行业周报：业绩预告密集发布，广州放松外籍购房限制,华安证券,2024-07-17,水泥建材,https://pdf.dfcfw.com/pdf/H3_AP202407171637990765_1.pdf?1721212075000.pdf
建筑材料行业月报：水泥行业加大错峰力度，淡季逆势提价带动盈利能力提升,华龙证券,2024-07-17,水泥建材,https://pdf.dfcfw.com/pdf/H3_AP202407171638008589_1.pdf?1721243390000.pdf
建筑材料行业6月行业数据点评：地产销售环比改善明显，高能级城市市场情绪修复,德邦证券,2024-07-16,水泥建材,https://pdf.dfcfw.com/pdf/H3_AP202407161637948672_1.pdf?1721119714000.pdf
非金属建材周报（24年第28周）：6月宏观数据略有回暖，淡季水泥价格继续推涨,国信证券,2024-07-16,水泥建材,https://pdf.dfcfw.com/pdf/H3_AP202407161637948869_1.pdf?1721125450000.pdf
建材行业2024年第28周周报：地产政策关注度高，板块配置价值提升,华源证券,2024-07-16,水泥建材,https://pdf.dfcfw.com/pdf/H3_AP202407161637953943_1.pdf?1721129371000.pdf
建筑材料行业周报：华东水泥价格同比转正，水泥行业下半年业绩改善空间较大,天风证券,2024-07-15,水泥建材,https://pdf.dfcfw.com/pdf/H3_AP202407151637907084_1.pdf?1721033168000.pdf
建筑材料行业周报：淡季继续推进错峰生产，关注水泥价格变动情况,华龙证券,2024-07-15,水泥建材,https://pdf.dfcfw.com/pdf/H3_AP202407151637915811_1.pdf?1721056442000.pdf
