研报名称,机构名称,发布时间,行业,研报地址
汽车行业事件点评：华为鸿蒙智行年度收官之作，问界M9如期而至,东莞证券,2023-12-27,汽车整车,https://pdf.dfcfw.com/pdf/H3_AP202312271615018927_1.pdf?1703682912000.pdf
2024年整车年度策略：柳暗花明，智驾+出海！,东吴证券,2023-12-26,汽车整车,https://pdf.dfcfw.com/pdf/H3_AP202312261614902708_1.pdf?1703596991000.pdf
新能源乘用车出海 头豹词条报告系列,头豹研究院,2023-12-26,汽车整车,https://pdf.dfcfw.com/pdf/H3_AP202312261614910339_1.pdf?1703620242000.pdf
新能源汽车电驱动 头豹词条报告系列,头豹研究院,2023-12-26,汽车整车,https://pdf.dfcfw.com/pdf/H3_AP202312261614910341_1.pdf?1703620127000.pdf
汽车行业周报（23年第52周）：蔚来举办2023NIODAY，百度发布Apollo开放平台9.0,国信证券,2023-12-26,汽车整车,https://pdf.dfcfw.com/pdf/H3_AP202312261614898718_1.pdf?1703578605000.pdf
汽车行业年度投资策略：把握出海和产业升级机遇,国信证券,2023-12-25,汽车整车,https://pdf.dfcfw.com/pdf/H3_AP202312251614882228_1.pdf?1703500660000.pdf
汽车行业行业周报：12月销量继续向上，全年车市零售量增速有望超过5%,中国银河,2023-12-25,汽车整车,https://pdf.dfcfw.com/pdf/H3_AP202312251614882563_1.pdf?1703499375000.pdf
汽车行业周报：多家车企获L3测试牌照，智驾升级加速推进,西南证券,2023-12-25,汽车整车,https://pdf.dfcfw.com/pdf/H3_AP202312251614882589_1.pdf?1703494966000.pdf
汽车行业2024年投资策略：智驾驱动成长，创新打开空间,国联证券,2023-12-25,汽车整车,https://pdf.dfcfw.com/pdf/H3_AP202312241614880995_1.pdf?1703496048000.pdf
汽车及汽车零部件行业研究：受益轻量化需求，PEEK材料空间广阔,国金证券,2023-12-25,汽车整车,https://pdf.dfcfw.com/pdf/H3_AP202312251614882213_1.pdf?1703499009000.pdf
新能源汽车产业链双周报：产业链价格延续弱稳运行,东莞证券,2023-12-24,汽车整车,https://pdf.dfcfw.com/pdf/H3_AP202312241614880761_1.pdf?1703433401000.pdf
汽车12月周专题：“新能源化”有望重塑硬派越野车市场,国联证券,2023-12-24,汽车整车,https://pdf.dfcfw.com/pdf/H3_AP202312241614880777_1.pdf?1703434310000.pdf
汽车行业跟踪：中国首批L3车型公布，华为成为其中两大品牌智驾供应商,信达证券,2023-12-24,汽车整车,https://pdf.dfcfw.com/pdf/H3_AP202312241614880780_1.pdf?1703434599000.pdf
汽车行业月报：11月乘用车销量稳步复苏，新能源汽车快速增长,中银证券,2023-12-21,汽车整车,https://pdf.dfcfw.com/pdf/H3_AP202312211614648624_1.pdf?1703178057000.pdf
乘用车终端跟踪：12月折扣普遍放大，待上市新车关注度较高,东吴证券,2023-12-20,汽车整车,https://pdf.dfcfw.com/pdf/H3_AP202312191614548293_1.pdf?1703055273000.pdf
新能源11月月报：11月产批零表现符合预期，新能源渗透率达38%,东吴证券,2023-12-19,汽车整车,https://pdf.dfcfw.com/pdf/H3_AP202312191614516441_1.pdf?1702986195000.pdf
行泊一体 头豹词条报告系列,头豹研究院,2023-12-19,汽车整车,https://pdf.dfcfw.com/pdf/H3_AP202312191614541700_1.pdf?1703018792000.pdf
汽车行业年度策略：智驾升级，布局全球,东海证券,2023-12-18,汽车整车,https://pdf.dfcfw.com/pdf/H3_AP202312181614435593_1.pdf?1702893559000.pdf
汽车行业双周报：车市景气延续，11月产销超预期增长,东莞证券,2023-12-18,汽车整车,https://pdf.dfcfw.com/pdf/H3_AP202312181614436747_1.pdf?1702890516000.pdf
汽车行业跟踪：新能源车购税门槛指标调整，中央经济工作会议提出提振新能源汽车等大宗消费,信达证券,2023-12-18,汽车整车,https://pdf.dfcfw.com/pdf/H3_AP202312171614435223_1.pdf?1702892779000.pdf
汽车行业周报：新能源汽车政策温和延续，新势力高阶智驾功能集中落地,东海证券,2023-12-18,汽车整车,https://pdf.dfcfw.com/pdf/H3_AP202312181614444482_1.pdf?1702918585000.pdf
汽车发动机 头豹词条报告系列,头豹研究院,2023-12-18,汽车整车,https://pdf.dfcfw.com/pdf/H3_AP202312181614449213_1.pdf?1702929955000.pdf
汽车周观点：华为_小米新车发布会值得期待，看好【AI智能化+出海】主线,东吴证券,2023-12-18,汽车整车,https://pdf.dfcfw.com/pdf/H3_AP202312181614447087_1.pdf?1702922108000.pdf
2024年整车策略：智能化&全球化加速变革，行业格局向好,国投证券,2023-12-18,汽车整车,https://pdf.dfcfw.com/pdf/H3_AP202312181614438431_1.pdf?1702908097000.pdf
汽车与零部件行业周报：11月汽车产量创新高，新能源月度产销首次双超百万辆,上海证券,2023-12-14,汽车整车,https://pdf.dfcfw.com/pdf/H3_AP202312141614124936_1.pdf?1702547867000.pdf
汽车行业研究周报：11月产销保持强势,申港证券,2023-12-13,汽车整车,https://pdf.dfcfw.com/pdf/H3_AP202312131614064628_1.pdf?1702458958000.pdf
汽车整车行业深度：华为自动驾驶技术详解-功力深厚显真章,德邦证券,2023-12-13,汽车整车,https://pdf.dfcfw.com/pdf/H3_AP202312131614065092_1.pdf?1702459979000.pdf
汽车行业2024年年度策略报告：巨头双线出击，高端格局重塑,平安证券,2023-12-13,汽车整车,https://pdf.dfcfw.com/pdf/H3_AP202312131614073321_1.pdf?1702479363000.pdf
11月乘用车销量点评：11月乘用车销量同比+25.3%，年末冲量行业景气延续,信达证券,2023-12-13,汽车整车,https://pdf.dfcfw.com/pdf/H3_AP202312131614072598_1.pdf?1702476473000.pdf
汽车行业跟踪点评：11月车市景气延续，产销超预期增长,东莞证券,2023-12-12,汽车整车,https://pdf.dfcfw.com/pdf/H3_AP202312121614032794_1.pdf?1702401951000.pdf
造车新势力系列二十七：11月销量同比稳健增长，蔚来与多家车企开展换电合作,国信证券,2023-12-12,汽车整车,https://pdf.dfcfw.com/pdf/H3_AP202312121613747292_1.pdf?1702373715000.pdf
汽车行业周报（23年第50周）：11月乘用车销量同比增长25%，持续关注智能驾驶、华为及小米汽车产业链,国信证券,2023-12-12,汽车整车,https://pdf.dfcfw.com/pdf/H3_AP202312121613747293_1.pdf?1702375068000.pdf
新能源汽车产业链双周报：11月新能源乘用车销量同环比双增长,东莞证券,2023-12-11,汽车整车,https://pdf.dfcfw.com/pdf/H3_AP202312111613696689_1.pdf?1702300155000.pdf
汽车行业行业周报：购车需求市场驱动11月车市销量继续向上，零售新能源渗透率首破40%,中国银河,2023-12-11,汽车整车,https://pdf.dfcfw.com/pdf/H3_AP202312111613698230_1.pdf?1702304377000.pdf
汽车行业周报：明年新能源乘用车批发破千万辆，新能源渗透率达40%,西南证券,2023-12-11,汽车整车,https://pdf.dfcfw.com/pdf/H3_AP202312111613700233_1.pdf?1702311290000.pdf
汽车周观点：华为M9_小鹏X9新车上市可期，看好【AI智能化+出海】主线,东吴证券,2023-12-11,汽车整车,https://pdf.dfcfw.com/pdf/H3_AP202312111613700462_1.pdf?1702309079000.pdf
汽车行业周报：华为与江淮正式签署合作协议，蔚来发布2023Q3财报,华鑫证券,2023-12-11,汽车整车,https://pdf.dfcfw.com/pdf/H3_AP202312111613700499_1.pdf?1702307118000.pdf
新能源汽车景气度跟踪：M11交付明显优于订单，车企E订单再创新高,天风证券,2023-12-11,汽车整车,https://pdf.dfcfw.com/pdf/H3_AP202312111613695458_1.pdf?1702301081000.pdf
汽车行业跟踪：11月乘用车零售同环比维持增长,信达证券,2023-12-11,汽车整车,https://pdf.dfcfw.com/pdf/H3_AP202312101613695117_1.pdf?1702289185000.pdf
汽车行业点评报告：11月行业产批表现符合预期，新能源渗透率为38%,东吴证券,2023-12-11,汽车整车,https://pdf.dfcfw.com/pdf/H3_AP202312111613709557_1.pdf?1702327964000.pdf
汽车行业报告：汽车出海系列二：复盘日本汽车全球化之路,国海证券,2023-12-10,汽车整车,https://pdf.dfcfw.com/pdf/H3_AP202312101613693629_1.pdf?1702218171000.pdf
汽车：从华为看智能汽车系列（二）-高速连接器加速，国产替代正当时,国联证券,2023-12-09,汽车整车,https://pdf.dfcfw.com/pdf/H3_AP202312091613693160_1.pdf?1702214514000.pdf
新能源汽车行业投资手册系列报告（九）：中国新能源车的百花齐放,浦银国际证券,2023-12-08,汽车整车,https://pdf.dfcfw.com/pdf/H3_AP202312081613636109_1.pdf?1702058231000.pdf
新能源汽车传感器 头豹词条报告系列,头豹研究院,2023-12-07,汽车整车,https://pdf.dfcfw.com/pdf/H3_AP202312071613566814_1.pdf?1701978783000.pdf
新能源汽车电机 头豹词条报告系列,头豹研究院,2023-12-07,汽车整车,https://pdf.dfcfw.com/pdf/H3_AP202312071613566816_1.pdf?1701980031000.pdf
汽车行业简评报告：11月多家新势力保持高增速，车企开启年终促销,首创证券,2023-12-06,汽车整车,https://pdf.dfcfw.com/pdf/H3_AP202312061613422682_1.pdf?1701854237000.pdf
汽车行业周报：11月新势力销量高增，华为江淮就智新汽车开展合作,甬兴证券,2023-12-05,汽车整车,https://pdf.dfcfw.com/pdf/H3_AP202312051613373497_1.pdf?1701782559000.pdf
汽车及汽车零部件行业研究：“华为汽车圈”推进合作，IRA法案更新FEOC细则,国金证券,2023-12-05,汽车整车,https://pdf.dfcfw.com/pdf/H3_AP202312051613366371_1.pdf?1701772883000.pdf
汽车行业点评报告：新势力跟踪之11月销量点评：8家新势力合计交付环比+4%，理想+蔚来+极氪交付创新高,东吴证券,2023-12-05,汽车整车,https://pdf.dfcfw.com/pdf/H3_AP202312051613368815_1.pdf?1701785005000.pdf
汽车周观点：华为汽车概念进一步扩大覆盖面，看好【AI智能化+出海】主线,东吴证券,2023-12-04,汽车整车,https://pdf.dfcfw.com/pdf/H3_AP202312041613221834_1.pdf?1701686701000.pdf
汽车：11月新势力交付量环比普遍提升，智能驾驶进展加速,德邦证券,2023-12-04,汽车整车,https://pdf.dfcfw.com/pdf/H3_AP202312041613222871_1.pdf?1701681212000.pdf
汽车行业周报：新能源车企公布11月交付数据，问界环比大幅提升,东海证券,2023-12-04,汽车整车,https://pdf.dfcfw.com/pdf/H3_AP202312041613229216_1.pdf?1701711317000.pdf
汽车行业周报：特斯拉Cybertruck正式交付，引领电动皮卡市场新变革,华鑫证券,2023-12-04,汽车整车,https://pdf.dfcfw.com/pdf/H3_AP202312041613231562_1.pdf?1701711703000.pdf
新能源汽车行业系列点评一：新势力：11月交付持续向上 新品周期开启,民生证券,2023-12-04,汽车整车,https://pdf.dfcfw.com/pdf/H3_AP202312041613225277_1.pdf?1701688734000.pdf
汽车行业深度报告：2023-10海外重点市场新能源汽车跟踪月报,太平洋,2023-12-04,汽车整车,https://pdf.dfcfw.com/pdf/H3_AP202312041613227078_1.pdf?1701698602000.pdf
汽车行业研究周报：Cybertruck正式交付 关注特斯拉产业链,申港证券,2023-12-04,汽车整车,https://pdf.dfcfw.com/pdf/H3_AP202312041613227131_1.pdf?1701697864000.pdf
汽车行业行业周报：自品牌公布11月新能源销量成绩单，终端12月销量预期大幅改善,中国银河,2023-12-04,汽车整车,https://pdf.dfcfw.com/pdf/H3_AP202312041613227948_1.pdf?1701705598000.pdf
汽车行业跟踪：华为车BU携手长安汽车成立合资公司,信达证券,2023-12-03,汽车整车,https://pdf.dfcfw.com/pdf/H3_AP202312031613221440_1.pdf?1701688372000.pdf
2024年汽车行业年度策略：自主爆款增加推动乘用车需求向上、零部件全球化值得期待,德邦证券,2023-11-30,汽车整车,https://pdf.dfcfw.com/pdf/H3_AP202311301612972127_1.pdf?1701335454000.pdf
汽车：华为、小米新品相继亮相，智能汽车市场迎新格局重塑,中国银河,2023-11-30,汽车整车,https://pdf.dfcfw.com/pdf/H3_AP202311301613043393_1.pdf?1701371816000.pdf
数据研究·专题：新能源汽车景气度跟踪：部分车企订单表现超预期，新势力整体表现优于自主品牌,天风证券,2023-11-29,汽车整车,https://pdf.dfcfw.com/pdf/H3_AP202311291612721697_1.pdf?1701249692000.pdf
汽车与零部件行业周报：长安与华为签署《投资合作备忘录》，比亚迪限时促销加速油转电,上海证券,2023-11-29,汽车整车,https://pdf.dfcfw.com/pdf/H3_AP202311291612721715_1.pdf?1701247511000.pdf
汽车行业点评：华为拟成立新公司，助力汽车智能化发展,甬兴证券,2023-11-29,汽车整车,https://pdf.dfcfw.com/pdf/H3_AP202311291612730205_1.pdf?1701263308000.pdf
汽车行业周报：优质供给释放，智驾加速,甬兴证券,2023-11-29,汽车整车,https://pdf.dfcfw.com/pdf/H3_AP202311291612730206_1.pdf?1701263592000.pdf
汽车行业周报：长安汽车与华为签署《投资合作备忘录》，拟入股华为智能汽车新公司,首创证券,2023-11-29,汽车整车,https://pdf.dfcfw.com/pdf/H3_AP202311291612732233_1.pdf?1701276291000.pdf
汽车行业点评报告：华为与长安签署投资合作备忘录，推动自主品牌智能化节奏加快,华鑫证券,2023-11-28,汽车整车,https://pdf.dfcfw.com/pdf/H3_AP202311271612402848_1.pdf?1701156944000.pdf
汽车行业周报（23年第48周）：长安汽车与华为签署投资合作备忘录，持续看好智能驾驶及华为汽车产业链,国信证券,2023-11-28,汽车整车,https://pdf.dfcfw.com/pdf/H3_AP202311281612479753_1.pdf?1701162341000.pdf
从华为看智能汽车系列（一）：成像技术持续升级，开启智慧光源新时代,国联证券,2023-11-28,汽车整车,https://pdf.dfcfw.com/pdf/H3_AP202311281612487852_1.pdf?1701182578000.pdf
2023年广州车展调研速览：中国新能源车的自主化、高端化与智能化,浦银国际证券,2023-11-28,汽车整车,https://pdf.dfcfw.com/pdf/H3_AP202311281612487851_1.pdf?1701181589000.pdf
汽车行业周报：预计11月乘用车零售208万辆，新能源渗透率达39%,西南证券,2023-11-27,汽车整车,https://pdf.dfcfw.com/pdf/H3_AP202311271612387845_1.pdf?1701095108000.pdf
汽车行业周报：长安汽车与华为合作升级，特斯拉中国推进FSD在华落地,东海证券,2023-11-27,汽车整车,https://pdf.dfcfw.com/pdf/H3_AP202311271612392930_1.pdf?1701104490000.pdf
新能源汽车产业链双周报：乘联会预估11月新能源车维持快速增长,东莞证券,2023-11-26,汽车整车,https://pdf.dfcfw.com/pdf/H3_AP202311261612382880_1.pdf?1701017774000.pdf
汽车与零部件行业周报：小米汽车亮相工信部，关注相关产业链标的,上海证券,2023-11-23,汽车整车,https://pdf.dfcfw.com/pdf/H3_AP202311231612201071_1.pdf?1700734633000.pdf
汽车行业专题：新能源越野：行业从0到1，重点车企加速布局,安信证券,2023-11-22,汽车整车,https://pdf.dfcfw.com/pdf/H3_AP202311221612026773_1.pdf?1700776523000.pdf
汽车行业月报：10月乘用车销量稳步复苏，新能源汽车快速增长,中银证券,2023-11-21,汽车整车,https://pdf.dfcfw.com/pdf/H3_AP202311211611762770_1.pdf?1700587122000.pdf
小米汽车系列一：首款纯电轿车公示，参考华为看小米汽车的比较优势,国信证券,2023-11-21,汽车整车,https://pdf.dfcfw.com/pdf/H3_AP202311211611773860_1.pdf?1700598596000.pdf
汽车行业周报：广州车展开幕，多款新车型获消费者关注,德邦证券,2023-11-20,汽车整车,https://pdf.dfcfw.com/pdf/H3_AP202311201611683418_1.pdf?1700478767000.pdf
汽车周观点：车展新车频出&智驾政策催化，看好【AI智能化+出海】主线,东吴证券,2023-11-20,汽车整车,https://pdf.dfcfw.com/pdf/H3_AP202311201611685316_1.pdf?1700488168000.pdf
汽车行业周报：广州车展开启新一轮新车型集中上市期，小米首款车型亮相工信部目录,东海证券,2023-11-20,汽车整车,https://pdf.dfcfw.com/pdf/H3_AP202311201611699847_1.pdf?1700513997000.pdf
汽车行业跟踪：小米汽车亮相工信部公告，MEGA广州车展预售订单旺盛,信达证券,2023-11-20,汽车整车,https://pdf.dfcfw.com/pdf/H3_AP202311191611679421_1.pdf?1700486338000.pdf
汽车行业事项点评：理想汽车Q3点评：Q3营收、净利再创新高，纯电&智能化打开新格局,信达证券,2023-11-19,汽车整车,https://pdf.dfcfw.com/pdf/H3_AP202311191611678838_1.pdf?1700413030000.pdf
汽车：近期多款重磅新能源车型上市，十月车市维持高景气,首创证券,2023-11-16,汽车整车,https://pdf.dfcfw.com/pdf/H3_AP202311161611020203_1.pdf?1700127113000.pdf
汽车行业11月报：新能源汽车累计产销超2022年全年，多个品牌刷新多项记录,联储证券,2023-11-16,汽车整车,https://pdf.dfcfw.com/pdf/H3_AP202311161610996118_1.pdf?1700126313000.pdf
智能汽车_智能化系列一：智能驾驶：新技术，新认知，新机会,天风证券,2023-11-15,汽车整车,https://pdf.dfcfw.com/pdf/H3_AP202311151610957135_1.pdf?1700057675000.pdf
乘用车终端跟踪：11月上旬折扣放大，新车订单持续性较佳,东吴证券,2023-11-14,汽车整车,https://pdf.dfcfw.com/pdf/H3_AP202311141610701344_1.pdf?1699981311000.pdf
明星主机厂产业链系列深度之一：华为汽车深度解读-高壁垒、广生态、强联合,华安证券,2023-11-14,汽车整车,https://pdf.dfcfw.com/pdf/H3_AP202311141610709283_1.pdf?1699992802000.pdf
造车新势力系列二十六：多款MPV即将亮相，广州车展11月开幕,国信证券,2023-11-13,汽车整车,https://pdf.dfcfw.com/pdf/H3_AP202311131609918868_1.pdf?1699883957000.pdf
新能源汽车景气度跟踪：M10多家车企月订单创新高，年末车市有望持续走强,天风证券,2023-11-13,汽车整车,https://pdf.dfcfw.com/pdf/H3_AP202311131609918879_1.pdf?1699885036000.pdf
新兴产业行业研究周报：本期新股速递：建议关注上海汽配,天风证券,2023-11-13,汽车整车,https://pdf.dfcfw.com/pdf/H3_AP202311131609918783_1.pdf?1699886509000.pdf
汽车行业周报：华为汽车产业链的机遇和挑战,华鑫证券,2023-11-13,汽车整车,https://pdf.dfcfw.com/pdf/H3_AP202311131609921078_1.pdf?1699871910000.pdf
汽车行业点评报告：10月新能源渗透率为36.1%，出口创新高,东吴证券,2023-11-13,汽车整车,https://pdf.dfcfw.com/pdf/H3_AP202311131609921711_1.pdf?1699874722000.pdf
新能源汽车景气度跟踪：M11W1订单有所回落，交付较10月同期回升明显,天风证券,2023-11-13,汽车整车,https://pdf.dfcfw.com/pdf/H3_AP202311131609922197_1.pdf?1699883460000.pdf
汽车行业周报：智界S7开启预售、阿维塔12正式上市，智驾车型不断丰富,东海证券,2023-11-13,汽车整车,https://pdf.dfcfw.com/pdf/H3_AP202311131609922555_1.pdf?1699884928000.pdf
新能源汽车行业2023年三季报总结及投资机会展望：从季报见产业周期，重视中期底部机会,太平洋,2023-11-13,汽车整车,https://pdf.dfcfw.com/pdf/H3_AP202311131609923167_1.pdf?1699891270000.pdf
新能源汽车产业链跟踪点评：10月销量再创新高，年末冲量有望持续走强,东莞证券,2023-11-13,汽车整车,https://pdf.dfcfw.com/pdf/H3_AP202311131609933283_1.pdf?1699902416000.pdf
汽车行业跟踪：智界S7、阿维塔12有望带动华为产业链竞争力延续，广州车展开幕在即,信达证券,2023-11-12,汽车整车,https://pdf.dfcfw.com/pdf/H3_AP202311121609916555_1.pdf?1699805888000.pdf
汽车行业：“银十”乘用车市场热度延续，国内新能源渗透率突破35%,中国银河,2023-11-12,汽车整车,https://pdf.dfcfw.com/pdf/H3_AP202311121609917166_1.pdf?1699810811000.pdf
汽车行业行业周报：临近广州车展，多款新车型密集推出，提振年底销量,中国银河,2023-11-12,汽车整车,https://pdf.dfcfw.com/pdf/H3_AP202311121609917184_1.pdf?1699810984000.pdf
汽车行业周报：工信部印发《人形机器人创新发展指导意见》，看好相关产业链发展,甬兴证券,2023-11-10,汽车整车,https://pdf.dfcfw.com/pdf/H3_AP202311101609861816_1.pdf?1699606623000.pdf
汽车行业2023年三季报综述：Q3行业景气延续，乘用车业绩超预期,东莞证券,2023-11-10,汽车整车,https://pdf.dfcfw.com/pdf/H3_AP202311101609879931_1.pdf?1699610053000.pdf
汽车行业深度报告：纯电动车型全景图-高端EV上新，入局即破局,平安证券,2023-11-09,汽车整车,https://pdf.dfcfw.com/pdf/H3_AP202311091609756924_1.pdf?1699518072000.pdf
汽车：智能驾驶基石：AEB渗透率持续向上,国联证券,2023-11-08,汽车整车,https://pdf.dfcfw.com/pdf/H3_AP202311081609306363_1.pdf?1699435633000.pdf
汽车行业研究系列二：电动智能化趋势明确，汽车轻量化势在必行,源达信息,2023-11-08,汽车整车,https://pdf.dfcfw.com/pdf/H3_AP202311081609344291_1.pdf?1699471164000.pdf
汽车行业简评报告：23年前三季度申万汽车板块约八成公司盈利,首创证券,2023-11-07,汽车整车,https://pdf.dfcfw.com/pdf/H3_AP202311071609229789_1.pdf?1699350618000.pdf
汽车行业周报：10月多家新能源车企销量表现亮眼,东莞证券,2023-11-06,汽车整车,https://pdf.dfcfw.com/pdf/H3_AP202311061609025302_1.pdf?1699266454000.pdf
理想汽车23Q3业绩前瞻：单车利润或有下滑，冲刺4万销量和加速智能化推进与投入,天风证券,2023-11-06,汽车整车,https://pdf.dfcfw.com/pdf/H3_AP202311061609025450_1.pdf?1699288216000.pdf
汽车细分市场专题研究（二）：皮卡——商乘两用，增量可期,太平洋,2023-11-06,汽车整车,https://pdf.dfcfw.com/pdf/H3_AP202311061609026182_1.pdf?1699287410000.pdf
汽车行业点评报告：5.5G元年将至，助力XR、车路协同等多业态发展,开源证券,2023-11-06,汽车整车,https://pdf.dfcfw.com/pdf/H3_AP202311061609028950_1.pdf?1699279884000.pdf
汽车行业周报：新能源汽车销量超预期，问界新M7单月交付突破万辆,东海证券,2023-11-06,汽车整车,https://pdf.dfcfw.com/pdf/H3_AP202311061609029325_1.pdf?1699281431000.pdf
汽车周观点：10月自主新能源销量超预期向上，AI智能化+出海主线持续,东吴证券,2023-11-06,汽车整车,https://pdf.dfcfw.com/pdf/H3_AP202311061609030041_1.pdf?1699287200000.pdf
汽车行业2023三季报综述：自主龙头增长显著，畅销车型引领电动智能化零部件增量释放,东海证券,2023-11-06,汽车整车,https://pdf.dfcfw.com/pdf/H3_AP202311061609031397_1.pdf?1699287120000.pdf
汽车行业跟踪：问界新M7 10月交付破万，智界S7即将开启预售,信达证券,2023-11-05,汽车整车,https://pdf.dfcfw.com/pdf/H3_AP202311051609023161_1.pdf?1699199686000.pdf
汽车行业点评报告：新势力跟踪之10月销量点评：10家新势力合计交付环比+4.2%，表现超预期！,东吴证券,2023-11-03,汽车整车,https://pdf.dfcfw.com/pdf/H3_AP202311031608171230_1.pdf?1699001600000.pdf
汽车行业2023年三季报综述：产销两旺推动业绩向上,国联证券,2023-11-03,汽车整车,https://pdf.dfcfw.com/pdf/H3_AP202311031608300149_1.pdf?1699007841000.pdf
汽车行业三季报点评：行业基本面积极向好，车企盈利出现分化,五矿证券,2023-11-03,汽车整车,https://pdf.dfcfw.com/pdf/H3_AP202311031608340172_1.pdf?1699037750000.pdf
EV观察系列149：9月欧洲新能车市场趋势稳定，销量实现同环双增,民生证券,2023-11-02,汽车整车,https://pdf.dfcfw.com/pdf/H3_AP202311021607923393_1.pdf?1698951556000.pdf
汽车行业简评报告：10月前三周车市热度温和延续，Stellantis计划15亿欧元入股零跑汽车,首创证券,2023-11-01,汽车整车,https://pdf.dfcfw.com/pdf/H3_AP202311011607612650_1.pdf?1698831393000.pdf
汽车行业周报：预计10月乘用车销量202万辆，新能源渗透率超37%,西南证券,2023-10-31,汽车整车,https://pdf.dfcfw.com/pdf/H3_AP202310311606672893_1.pdf?1698742715000.pdf
汽车周观点：华为汽车概念泛化，AI智能化+出海主线持续,东吴证券,2023-10-31,汽车整车,https://pdf.dfcfw.com/pdf/H3_AP202310311606672954_1.pdf?1698768546000.pdf
汽车行业周报：AITO问界M9订单接棒，关注华为造车主题外溢机会,太平洋,2023-10-31,汽车整车,https://pdf.dfcfw.com/pdf/H3_AP202310311607035526_1.pdf?1698786727000.pdf
2023年Q4新车盘点：各品牌高端化发展，进军MPV打造第二增长极,天风证券,2023-10-31,汽车整车,https://pdf.dfcfw.com/pdf/H3_AP202310311607035534_1.pdf?1698767288000.pdf
汽车行业周报：10月车市有望延续9月热度，华为汽车产业链景气上行,东莞证券,2023-10-30,汽车整车,https://pdf.dfcfw.com/pdf/H3_AP202310301605639901_1.pdf?1698653322000.pdf
新能源汽车电动助力转向系统（EPS） 头豹词条报告系列,头豹研究院,2023-10-27,汽车整车,https://pdf.dfcfw.com/pdf/H3_AP202310271605185912_1.pdf?1698437252000.pdf
新能源汽车行业景气度跟踪：M10W3订&交环比均增长，4季度MPV密集推出,天风证券,2023-10-26,汽车整车,https://pdf.dfcfw.com/pdf/H3_AP202310261603985510_1.pdf?1698313325000.pdf
汽车细分市场专题研究（一）：硬派越野：小众市场开启新能源征程,太平洋,2023-10-26,汽车整车,https://pdf.dfcfw.com/pdf/H3_AP202310261603995518_1.pdf?1698332861000.pdf
"汽车行业周报（23年第42周）：9月汽车销量同比增长10%,建议关注三季报行情",国信证券,2023-10-26,汽车整车,https://pdf.dfcfw.com/pdf/H3_AP202310261604019512_1.pdf?1698348291000.pdf
汽车行业简评报告：降价拖累毛利率，特斯拉三季报营收利润皆下滑,首创证券,2023-10-25,汽车整车,https://pdf.dfcfw.com/pdf/H3_AP202310251603399540_1.pdf?1698226343000.pdf
小鹏汽车1024科技日：城市智驾，落地在即,浦银国际证券,2023-10-25,汽车整车,https://pdf.dfcfw.com/pdf/H3_AP202310251603479099_1.pdf?1698255148000.pdf
汽车：特斯拉系列之二十八-盈利能力短期承压，Cybertruck有望年底交付,国信证券,2023-10-24,汽车整车,https://pdf.dfcfw.com/pdf/H3_AP202310241602894990_1.pdf?1706283978000.pdf
