研报名称,机构名称,发布时间,行业,研报地址
汽车行业周报：多家车企降价，猛士科技与华为达成合作,德邦证券,2024-02-25,汽车整车,https://pdf.dfcfw.com/pdf/H3_AP202402251623564547_1.pdf?1708873212000.pdf
汽车行业周报：中央财经委会议提出要鼓励汽车以旧换新，珍惜板块向上窗口期,国海证券,2024-02-25,汽车整车,https://pdf.dfcfw.com/pdf/H3_AP202402251623566839_1.pdf?1708937117000.pdf
汽车：2月狭义乘用车零售预计约115万辆，多家车企启动降价,德邦证券,2024-02-23,汽车整车,https://pdf.dfcfw.com/pdf/H3_AP202402231623245277_1.pdf?1708714564000.pdf
汽车行业新春展望：新一轮产品周期开启,太平洋,2024-02-22,汽车整车,https://pdf.dfcfw.com/pdf/H3_AP202402221622761548_1.pdf?1708599707000.pdf
汽车：1月重卡销量9.7万辆，同比+99%，环比+86%,德邦证券,2024-02-22,汽车整车,https://pdf.dfcfw.com/pdf/H3_AP202402221622772317_1.pdf?1708600128000.pdf
汽车行业2月报：2024车市迎开门红，比亚迪等多个自主品牌开启新一轮降价潮,联储证券,2024-02-22,汽车整车,https://pdf.dfcfw.com/pdf/H3_AP202402221622820057_1.pdf?1708613602000.pdf
汽车行业深度报告：汽车外观造型系列：重点新车型造型趋势,国海证券,2024-02-21,汽车整车,https://pdf.dfcfw.com/pdf/H3_AP202402211622486159_1.pdf?1708520750000.pdf
汽车行业动态点评：1月出口延续快速增长态势，新能源VS燃油车竞争加剧。,东方财富证券,2024-02-20,汽车整车,https://pdf.dfcfw.com/pdf/H3_AP202402201622410439_1.pdf?1708441136000.pdf
汽车行业周报：1月赛力斯表现亮眼，销量持续爬升,甬兴证券,2024-02-20,汽车整车,https://pdf.dfcfw.com/pdf/H3_AP202402201622410473_1.pdf?1708441362000.pdf
汽车行业周报：主流车企对2024年销量较为乐观，新势力有望快速增长,德邦证券,2024-02-19,汽车整车,https://pdf.dfcfw.com/pdf/H3_AP202402191622381124_1.pdf?1708328828000.pdf
汽车行业周报：1月新能源渗透率达32.6%，政策护航新能源出海,西南证券,2024-02-19,汽车整车,https://pdf.dfcfw.com/pdf/H3_AP202402191622387156_1.pdf?1708354300000.pdf
汽车行业周报：中汽协公布2024年1月数据，理想新车将密集登场,华鑫证券,2024-02-19,汽车整车,https://pdf.dfcfw.com/pdf/H3_AP202402191622387578_1.pdf?1708356016000.pdf
汽车行业跟踪点评：1月汽车产销同比高增长，环比季节性遇冷,东莞证券,2024-02-19,汽车整车,https://pdf.dfcfw.com/pdf/H3_AP202402191622394664_1.pdf?1708361748000.pdf
汽车行业行业周报：汽车出口延续高景气度，自主品牌加速推进出海进程,中国银河,2024-02-19,汽车整车,https://pdf.dfcfw.com/pdf/H3_AP202402191622396722_1.pdf?1708422966000.pdf
汽车行业点评报告：1月行业产批略低预期，新能源渗透率为33%,东吴证券,2024-02-19,汽车整车,https://pdf.dfcfw.com/pdf/H3_AP202402191622403003_1.pdf?1708380303000.pdf
汽车周观点：重视乘用车及零部件板块触底反弹机会，看好Q1【商用车+AI智能化】主线,东吴证券,2024-02-19,汽车整车,https://pdf.dfcfw.com/pdf/H3_AP202402191622386674_1.pdf?1708351706000.pdf
汽车行业周报：积极参与节后汽车机会,国海证券,2024-02-18,汽车整车,https://pdf.dfcfw.com/pdf/H3_AP202402181622340034_1.pdf?1708269426000.pdf
汽车行业跟踪：春节假期汽车消费热度不减，龙年重磅新车有望陆续发布,信达证券,2024-02-18,汽车整车,https://pdf.dfcfw.com/pdf/H3_AP202402181622343810_1.pdf?1708268092000.pdf
汽车行业双周报：1月汽车产销季节性遇冷，长期发展主线不变,东莞证券,2024-02-18,汽车整车,https://pdf.dfcfw.com/pdf/H3_AP202402181622354015_1.pdf?1708274261000.pdf
汽车行业2月投资策略暨2023年业绩前瞻：2023年业绩预告多数公司预增，板块估值有望触底回升,国信证券,2024-02-15,汽车整车,https://pdf.dfcfw.com/pdf/H3_AP202402151621783938_1.pdf?1707996030000.pdf
汽车行业行业点评报告：1月销量淡季不淡，出口维持高景气度,中国银河,2024-02-08,汽车整车,https://pdf.dfcfw.com/pdf/H3_AP202402081621127720_1.pdf?1707399161000.pdf
汽车行业周报：1月问界新车交付超3万辆，首夺新势力销量冠军,西南证券,2024-02-08,汽车整车,https://pdf.dfcfw.com/pdf/H3_AP202402081621127681_1.pdf?1707397520000.pdf
中汽协1月销量点评：1月销量开门红，全年增长可期,国联证券,2024-02-08,汽车整车,https://pdf.dfcfw.com/pdf/H3_AP202402081621128709_1.pdf?1707406489000.pdf
汽车与零部件行业周报：比亚迪23年归母净利润同比预增74%-86%,上海证券,2024-02-07,汽车整车,https://pdf.dfcfw.com/pdf/H3_AP202402071621026970_1.pdf?1707327061000.pdf
汽车行业周报：新势力发布2024年首月交付数据，问界交付量持续攀升,东海证券,2024-02-06,汽车整车,https://pdf.dfcfw.com/pdf/H3_AP202402051620601038_1.pdf?1707206460000.pdf
汽车行业周报：2024年1月问界销量逆势增长,首创证券,2024-02-06,汽车整车,https://pdf.dfcfw.com/pdf/H3_AP202402061620909696_1.pdf?1707208986000.pdf
汽车行业行业周报：1月自主品牌取得销量“开门红”，节前库存情况稳定,中国银河,2024-02-05,汽车整车,https://pdf.dfcfw.com/pdf/H3_AP202402051620561643_1.pdf?1707131518000.pdf
汽车和汽车零部件行业周报：1月新势力销量分化，问界无图NCA全国推送,民生证券,2024-02-05,汽车整车,https://pdf.dfcfw.com/pdf/H3_AP202402051620560068_1.pdf?1707126538000.pdf
汽车行业周报：问界拔得1月中国新势力交付量头筹，华为发布2024充电网络产业十大趋势,华鑫证券,2024-02-05,汽车整车,https://pdf.dfcfw.com/pdf/H3_AP202402041620555046_1.pdf?1707116938000.pdf
汽车周观点：1月需求符合预期，看好Q1【商用车+AI智能化】主线,东吴证券,2024-02-05,汽车整车,https://pdf.dfcfw.com/pdf/H3_AP202402041620555392_1.pdf?1707119306000.pdf
汽车行业周报：部分车企公布2024年1月销量，2023汽车制造业利润同比+5.9%,国海证券,2024-02-05,汽车整车,https://pdf.dfcfw.com/pdf/H3_AP202402051620555931_1.pdf?1707122639000.pdf
汽车行业研究周报：板块处于底部区间，估值有望修复,申港证券,2024-02-05,汽车整车,https://pdf.dfcfw.com/pdf/H3_AP202402051620569087_1.pdf?1707153554000.pdf
汽车行业点评报告：新势力跟踪之1月销量点评：10家新势力合计交付环比-35%，行业表现符合预期,东吴证券,2024-02-05,汽车整车,https://pdf.dfcfw.com/pdf/H3_AP202402051620574536_1.pdf?1707158464000.pdf
汽车行业周报（24年第4周）：1月新能源乘用车厂商预计批发70万辆，2023年业绩预告多数预增,国信证券,2024-02-05,汽车整车,https://pdf.dfcfw.com/pdf/H3_AP202402051620562758_1.pdf?1707153554000.pdf
汽车智能化配置渗透率追踪2023：智能化普及率提升，25w及以下价位段积极搭载,华安证券,2024-02-04,汽车整车,https://pdf.dfcfw.com/pdf/H3_AP202402031620262778_1.pdf?1707038025000.pdf
新势力系列点评三：1月新势力分化 智驾奇点已至,民生证券,2024-02-04,汽车整车,https://pdf.dfcfw.com/pdf/H3_AP202402041620269292_1.pdf?1707044928000.pdf
汽车行业周报：华为推送覆盖全国的高阶智驾，小鹏明年将研发全球范围XNGP,德邦证券,2024-02-04,汽车整车,https://pdf.dfcfw.com/pdf/H3_AP202402041620551885_1.pdf?1707061168000.pdf
汽车行业跟踪：问界OTA升级全国范围城区NCA，1月首夺新势力交付月冠,信达证券,2024-02-04,汽车整车,https://pdf.dfcfw.com/pdf/H3_AP202402041620551954_1.pdf?1707062261000.pdf
2024年度汽车策略报告：竞争变化中孕育机会,首创证券,2024-02-02,汽车整车,https://pdf.dfcfw.com/pdf/H3_AP202402021620063765_1.pdf?1706873057000.pdf
汽车：1月新势力交付量同比普遍提升，问界新M7单月交付破3万,德邦证券,2024-02-02,汽车整车,https://pdf.dfcfw.com/pdf/H3_AP202402021620068308_1.pdf?1706879726000.pdf
汽车周报：特斯拉4Q23汽车业务毛利率环比向好,首创证券,2024-02-01,汽车整车,https://pdf.dfcfw.com/pdf/H3_AP202402011619996162_1.pdf?1706784004000.pdf
汽车行业点评报告：车企年末销量总冲刺，12月新能源车渗透率破40%,开源证券,2024-02-01,汽车整车,https://pdf.dfcfw.com/pdf/H3_AP202402011619994264_1.pdf?1706776056000.pdf
中国汽车行业展望，2024年1月,中诚信国际,2024-02-01,汽车整车,https://pdf.dfcfw.com/pdf/H3_AP202402011620003555_1.pdf?1706802694000.pdf
汽车与零部件行业周报：特斯拉23年净利润同比增长19%，比亚迪乌兹别克斯坦工厂投产,上海证券,2024-01-31,汽车整车,https://pdf.dfcfw.com/pdf/H3_AP202401311619776143_1.pdf?1706693541000.pdf
汽车行业周报：特斯拉2023年业绩增速下滑，新车型有望2025年年中生产,甬兴证券,2024-01-31,汽车整车,https://pdf.dfcfw.com/pdf/H3_AP202401311619778172_1.pdf?1706695976000.pdf
汽车行业周报：特斯拉公布2023Q4财报，FSD V12开启推送,东海证券,2024-01-30,汽车整车,https://pdf.dfcfw.com/pdf/H3_AP202401301619501379_1.pdf?1706609994000.pdf
特斯拉系列之二十九：2023年营收同比增长19%，新车型预计明年量产,国信证券,2024-01-29,汽车整车,https://pdf.dfcfw.com/pdf/H3_AP202401291619253773_1.pdf?1706524872000.pdf
汽车：筑底企稳，坚定看好整车板块！,东吴证券,2024-01-29,汽车整车,https://pdf.dfcfw.com/pdf/H3_AP202401291619263377_1.pdf?1706526977000.pdf
汽车周观点：坚定信心，看好Q1【商用车+AI智能化】主线,东吴证券,2024-01-29,汽车整车,https://pdf.dfcfw.com/pdf/H3_AP202401291619270762_1.pdf?1706534291000.pdf
汽车行业周报：新一轮降价促销开启，利好1月销量增长,西南证券,2024-01-29,汽车整车,https://pdf.dfcfw.com/pdf/H3_AP202401291619270760_1.pdf?1706624097000.pdf
汽车行业周报：两次增长浪潮之间，特斯拉产业链的投资机会何在？,华鑫证券,2024-01-29,汽车整车,https://pdf.dfcfw.com/pdf/H3_AP202401291619270851_1.pdf?1706534796000.pdf
汽车行业研究周报：汽车行业2023Q4基金持仓环比微降,申港证券,2024-01-29,汽车整车,https://pdf.dfcfw.com/pdf/H3_AP202401291619272301_1.pdf?1706540024000.pdf
汽车行业周报：市场进入业绩预告披露期，汽车市场高景气度驱动板块业绩继续向上,中国银河,2024-01-29,汽车整车,https://pdf.dfcfw.com/pdf/H3_AP202401291619280452_1.pdf?1706564907000.pdf
汽车行业点评报告：Q4汽车板块公募基金持仓环比微降，投资者情绪较去年同期好转,中国银河,2024-01-29,汽车整车,https://pdf.dfcfw.com/pdf/H3_AP202401291619282232_1.pdf?1706563093000.pdf
汽车行业周报：特斯拉预计于2025年下半年生产下一代电动汽车，东风岚图与华为达成合作,德邦证券,2024-01-29,汽车整车,https://pdf.dfcfw.com/pdf/H3_AP202401291619251599_1.pdf?1706511621000.pdf
汽车行业双周报：牵手东风岚图汽车，华为汽车“朋友圈”再扩充,东莞证券,2024-01-29,汽车整车,https://pdf.dfcfw.com/pdf/H3_AP202401291619251608_1.pdf?1706511621000.pdf
新能源汽车行业专题报告：大功率超充加速渗透，看好高压架构迭代机会,西南证券,2024-01-29,汽车整车,https://pdf.dfcfw.com/pdf/H3_AP202401291619251744_1.pdf?1706538492000.pdf
汽车及汽车零部件行业研究：特斯拉发布Q4业绩，华为朋友圈持续扩容,国金证券,2024-01-29,汽车整车,https://pdf.dfcfw.com/pdf/H3_AP202401291619253764_1.pdf?1706523077000.pdf
汽车行业跟踪：特斯拉FSD V12在美推送，端到端模型上车,信达证券,2024-01-28,汽车整车,https://pdf.dfcfw.com/pdf/H3_AP202401281619246807_1.pdf?1706518441000.pdf
汽车和汽车零部件行业周报：特斯拉FSD V12推送2024智驾群雄逐鹿,民生证券,2024-01-28,汽车整车,https://pdf.dfcfw.com/pdf/H3_AP202401281619247795_1.pdf?1706519871000.pdf
汽车行业周报：特斯拉发布2023年财报，东风岚图与华为签署战略合作协议,国海证券,2024-01-28,汽车整车,https://pdf.dfcfw.com/pdf/H3_AP202401281619248655_1.pdf?1706520269000.pdf
汽车：人形机器人系列（五）六维力传感器产业化加速,国联证券,2024-01-26,汽车整车,https://pdf.dfcfw.com/pdf/H3_AP202401261618237600_1.pdf?1706253864000.pdf
谁在时代的浪花上？乘用车结构化复盘与竞争格局剖析,华安证券,2024-01-26,汽车整车,https://pdf.dfcfw.com/pdf/H3_AP202401261618257836_1.pdf?1706256072000.pdf
新能源汽车景气度跟踪：年末冲刺后车市遇冷，M1W3自主车企订单持续走低,天风证券,2024-01-26,汽车整车,https://pdf.dfcfw.com/pdf/H3_AP202401261618278103_1.pdf?1706263921000.pdf
汽车与零部件行业周报：比亚迪、特斯拉等车企在德国降价,上海证券,2024-01-26,汽车整车,https://pdf.dfcfw.com/pdf/H3_AP202401261618316869_1.pdf?1706274288000.pdf
汽车行业点评：东风岚图加入，华为智能车解决方案推进提速,平安证券,2024-01-26,汽车整车,https://pdf.dfcfw.com/pdf/H3_AP202401261618317619_1.pdf?1706280076000.pdf
造纸轻工行业周报：23年大排量摩托车出口高增，关注春风动力,海通国际,2024-01-26,汽车整车,https://pdf.dfcfw.com/pdf/H3_AP202401261618317780_1.pdf?1706281069000.pdf
汽车行业点评报告：特斯拉Q4汽车毛利率环比提升，看好相关产业链,东吴证券,2024-01-26,汽车整车,https://pdf.dfcfw.com/pdf/H3_AP202401261618318870_1.pdf?1706285288000.pdf
汽车行业23Q4基金持仓分析：Q4重仓环比微降，聚焦机器人+智能化赛道,国联证券,2024-01-26,汽车整车,https://pdf.dfcfw.com/pdf/H3_AP202401261618319695_1.pdf?1706287135000.pdf
汽车行业动态跟踪报告：静待三月花开时,平安证券,2024-01-25,汽车整车,https://pdf.dfcfw.com/pdf/H3_AP202401251618081792_1.pdf?1706171306000.pdf
汽车行业周报：比亚迪梦想日，发布全新一代智能化电子电气架构“璇玑”,甬兴证券,2024-01-25,汽车整车,https://pdf.dfcfw.com/pdf/H3_AP202401251618091182_1.pdf?1706173924000.pdf
汽车智能化月报系列（十一）：比亚迪发布璇玑智能架构，岚图汽车与华为签署战略合作协议,国信证券,2024-01-25,汽车整车,https://pdf.dfcfw.com/pdf/H3_AP202401251618104705_1.pdf?1706199422000.pdf
汽车行业点评：特斯拉23年交付目标达成，24年增速放缓,平安证券,2024-01-25,汽车整车,https://pdf.dfcfw.com/pdf/H3_AP202401251618124314_1.pdf?1706216329000.pdf
汽车行业周报（24年第3周）：2023年中国汽车批发销量增长12%，出口全球第一,国信证券,2024-01-23,汽车整车,https://pdf.dfcfw.com/pdf/H3_AP202401231617941518_1.pdf?1706002156000.pdf
摩托车行业2023年12月销售数据更新,天风证券,2024-01-23,汽车整车,https://pdf.dfcfw.com/pdf/H3_AP202401231617941568_1.pdf?1705999663000.pdf
新能源汽车：预计2024年全球新能源汽车销量将达到1750万辆，同比增长27%,海通国际,2024-01-23,汽车整车,https://pdf.dfcfw.com/pdf/H3_AP202401231617944612_1.pdf?1706022284000.pdf
汽车行业深度报告：汽车行业周报：2024年1月汽车销量有望同比高增,首创证券,2024-01-23,汽车整车,https://pdf.dfcfw.com/pdf/H3_AP202401231617944492_1.pdf?1706000361000.pdf
汽车行业周报：比亚迪发布智能化战略，小米汽车采用“1+N”渠道模式,华鑫证券,2024-01-22,汽车整车,https://pdf.dfcfw.com/pdf/H3_AP202401221617892059_1.pdf?1705918241000.pdf
汽车：2023年12月中美欧电动车总计销量为1615279辆，同比上升34.49%，环比上升14.00%,海通国际,2024-01-22,汽车整车,https://pdf.dfcfw.com/pdf/H3_AP202401221617892739_1.pdf?1705938270000.pdf
汽车行业月报：12月乘用车销量稳步复苏，新能源汽车快速增长,中银证券,2024-01-22,汽车整车,https://pdf.dfcfw.com/pdf/H3_AP202401221617907072_1.pdf?1705940155000.pdf
汽车行业周报：23年重卡出口29.5万辆，同比增长79.3%,西南证券,2024-01-22,汽车整车,https://pdf.dfcfw.com/pdf/H3_AP202401221617908941_1.pdf?1705941036000.pdf
2024年汽车行业策略报告：配置确定性高增长：国际化和智能化,国金证券,2024-01-22,汽车整车,https://pdf.dfcfw.com/pdf/H3_AP202401221617890109_1.pdf?1705920219000.pdf
汽车与汽车零部件行业周报：电池降价销量无忧，智能网联蓬勃发展,国元证券,2024-01-22,汽车整车,https://pdf.dfcfw.com/pdf/H3_AP202401221617890118_1.pdf?1705920447000.pdf
新能源汽车景气度跟踪：M1W2交付表现优于订单，4家自主车企订单环比走弱,天风证券,2024-01-22,汽车整车,https://pdf.dfcfw.com/pdf/H3_AP202401221617890161_1.pdf?1705932167000.pdf
汽车行业周报：春节旺季作用1月零售景气向上，汽车板块进入底部布局区间,国海证券,2024-01-21,汽车整车,https://pdf.dfcfw.com/pdf/H3_AP202401211617885969_1.pdf?1705833211000.pdf
商用车2024年度策略：结构向上，乘风而起,东吴证券,2024-01-21,汽车整车,https://pdf.dfcfw.com/pdf/H3_AP202401211617886520_1.pdf?1705832824000.pdf
汽车和汽车零部件行业周报：2024智驾群雄逐鹿全球化从1到100,民生证券,2024-01-21,汽车整车,https://pdf.dfcfw.com/pdf/H3_AP202401211617887318_1.pdf?1705857466000.pdf
汽车行业2024年度策略：持续看好汽车出海及智能化,中银证券,2024-01-21,汽车整车,https://pdf.dfcfw.com/pdf/H3_AP202401211617888742_1.pdf?1705916123000.pdf
乘用车终端跟踪：1月新能源车折扣普遍放大，待上市新车关注度较高,东吴证券,2024-01-21,汽车整车,https://pdf.dfcfw.com/pdf/H3_AP202401201617819794_1.pdf?1705831027000.pdf
新能源12月月报：12月产批零表现符合预期，新能源渗透率达41%,东吴证券,2024-01-21,汽车整车,https://pdf.dfcfw.com/pdf/H3_AP202401201617819797_1.pdf?1705831187000.pdf
客车1月月报：12月产批零整体回暖,东吴证券,2024-01-21,汽车整车,https://pdf.dfcfw.com/pdf/H3_AP202401201617819792_1.pdf?1705830718000.pdf
新能源板块行业周报：12月公桩新增同比+51.2%，蔚来上海首批V2G目充站正式投运,海通国际,2024-01-19,汽车整车,https://pdf.dfcfw.com/pdf/H3_AP202401191617729957_1.pdf?1705673958000.pdf
新能车：特斯拉储能超级工厂项目正式启动,南京证券,2024-01-19,汽车整车,https://pdf.dfcfw.com/pdf/H3_AP202401191617730858_1.pdf?1705679185000.pdf
汽车：比亚迪梦想日：璇玑架构暗藏玄机，整车智能引领智能化发展方向,五矿证券,2024-01-18,汽车整车,https://pdf.dfcfw.com/pdf/H3_AP202401181617682010_1.pdf?1705594528000.pdf
新能源汽车景气度跟踪：M1W1订&交较12月同期双位数下滑，23年回顾车企I_F订单进一步提速,天风证券,2024-01-17,汽车整车,https://pdf.dfcfw.com/pdf/H3_AP202401171617578759_1.pdf?1705483767000.pdf
2024Q1汽车投资策略：看好商用车周期复苏趋势机会！,东吴证券,2024-01-17,汽车整车,https://pdf.dfcfw.com/pdf/H3_AP202401171617582079_1.pdf?1705490567000.pdf
汽车：竞争要素转变，高压快充、智能驾驶加速渗透,南京证券,2024-01-17,汽车整车,https://pdf.dfcfw.com/pdf/H3_AP202401171617582559_1.pdf?1705513108000.pdf
汽车行业点评报告：12月行业产批表现符合预期，新能源渗透率为41%,东吴证券,2024-01-16,汽车整车,https://pdf.dfcfw.com/pdf/H3_AP202401161617509184_1.pdf?1705407762000.pdf
汽车行业周报：预计2024年汽车总销量超3100万辆，同比增长超3%,西南证券,2024-01-15,汽车整车,https://pdf.dfcfw.com/pdf/H3_AP202401151617489510_1.pdf?1705324928000.pdf
汽车行业周报：悲观预期已较大程度反应，积极布局汽车超跌机会,国海证券,2024-01-15,汽车整车,https://pdf.dfcfw.com/pdf/H3_AP202401141617484591_1.pdf?1705309001000.pdf
汽车行业跟踪点评：12月销量同环比双增长，全年产销创新高,东莞证券,2024-01-15,汽车整车,https://pdf.dfcfw.com/pdf/H3_AP202401151617484864_1.pdf?1705315274000.pdf
汽车行业双周报：23年汽车产销创新高，看好新能源+出海增长点,东莞证券,2024-01-15,汽车整车,https://pdf.dfcfw.com/pdf/H3_AP202401151617485813_1.pdf?1705316838000.pdf
"汽车行业周报：我国汽车产销首次突破3,000万辆，特斯拉中国多款车型降价",华鑫证券,2024-01-15,汽车整车,https://pdf.dfcfw.com/pdf/H3_AP202401151617491507_1.pdf?1705335048000.pdf
汽车行业行业点评报告：全年产销突破3000万辆，中国成为全球第一大汽车出口国,中国银河,2024-01-14,汽车整车,https://pdf.dfcfw.com/pdf/H3_AP202401131617440420_1.pdf?1705257014000.pdf
汽车行业事项点评：特斯拉以价换量，关注产业链弹性,信达证券,2024-01-14,汽车整车,https://pdf.dfcfw.com/pdf/H3_AP202401141617483183_1.pdf?1705238186000.pdf
汽车行业周报（24年第1周）：12月国内乘用车批发同比预增24%，小鹏XNGP总覆盖城市数量达243城,国信证券,2024-01-14,汽车整车,https://pdf.dfcfw.com/pdf/H3_AP202401141617483486_1.pdf?1705246391000.pdf
汽车行业1月投资策略：12月国内乘用车批发同比预增24%，关注新车订单及车企智能化进展,国信证券,2024-01-14,汽车整车,https://pdf.dfcfw.com/pdf/H3_AP202401141617483483_1.pdf?1705246497000.pdf
电动车12月月报：国内外电车销量和电池装机,中邮证券,2024-01-14,汽车整车,https://pdf.dfcfw.com/pdf/H3_AP202401141617483960_1.pdf?1705253002000.pdf
汽车行业周报：特斯拉全球交付量超过180万辆，奇瑞集团销量创历史新高,华鑫证券,2024-01-09,汽车整车,https://pdf.dfcfw.com/pdf/H3_AP202401091616867415_1.pdf?1706108714000.pdf
汽车行业周报：预计24年新能源渗透率达40%，重卡销量达105万辆,西南证券,2024-01-08,汽车整车,https://pdf.dfcfw.com/pdf/H3_AP202401081616762234_1.pdf?1704713413000.pdf
汽车行业跟踪：2023年各车企年度销量出炉，智能电动化持续提速,信达证券,2024-01-07,汽车整车,https://pdf.dfcfw.com/pdf/H3_AP202401071616758071_1.pdf?1704709206000.pdf
汽车行业专题研究：各家纷纷入局MPV市场，高端新能源MPV有望打开新成长空间,东方财富证券,2024-01-05,汽车整车,https://pdf.dfcfw.com/pdf/H3_AP202401051616655065_1.pdf?1704475990000.pdf
新能源汽车：新能源汽车存量持续增长，锂离子电池回收行业迎契机,深圳汉鼎智库咨询服务,2024-01-05,汽车整车,https://pdf.dfcfw.com/pdf/H3_AP202403211627438430_1.pdf?1711045070000.pdf
汽车：12月新势力交付量环比普遍提升，产品矩阵不断拓宽,德邦证券,2024-01-03,汽车整车,https://pdf.dfcfw.com/pdf/H3_AP202401031616090173_1.pdf?1704266530000.pdf
汽车行业点评报告：新势力跟踪之12月销量点评：10家新势力合计交付环比+11%，多款重磅新车上市,东吴证券,2024-01-03,汽车整车,https://pdf.dfcfw.com/pdf/H3_AP202401031616217735_1.pdf?1704293988000.pdf
新能源汽车行业系列点评二：新势力2023智能领航 再登高峰,民生证券,2024-01-02,汽车整车,https://pdf.dfcfw.com/pdf/H3_AP202401021615922765_1.pdf?1704224190000.pdf
汽车行业周报：小米发布会正式公布汽车五大核心技术，2023年新势力业绩亮眼,华鑫证券,2024-01-02,汽车整车,https://pdf.dfcfw.com/pdf/H3_AP202401021615928778_1.pdf?1704225596000.pdf
汽车行业周报：继续积极看待汽车新年机会！,国海证券,2024-01-02,汽车整车,https://pdf.dfcfw.com/pdf/H3_AP202401021615928779_1.pdf?1704225374000.pdf
汽车行业月报：重磅车型陆续推出，全年销量有望超预期,中原证券,2024-01-02,汽车整车,https://pdf.dfcfw.com/pdf/H3_AP202401021615912963_1.pdf?1704191337000.pdf
汽车行业行业周报：问界M9、小米SU7亮相市场，推动电动化、轻量化、智能化发展提速,中国银河,2024-01-02,汽车整车,https://pdf.dfcfw.com/pdf/H3_AP202401021615917208_1.pdf?1704202699000.pdf
汽车行业2024年度投资策略：看好智驾爆款潜力，自主品牌出海增量可期,华龙证券,2024-01-02,汽车整车,https://pdf.dfcfw.com/pdf/H3_AP202401021615918292_1.pdf?1704212812000.pdf
汽车：极氪007正式发布，全系标配800V+自研系统，纯电豪华轿车再迎升级,海通国际,2023-12-29,汽车整车,https://pdf.dfcfw.com/pdf/H3_AP202312291615469685_1.pdf?1703847465000.pdf
2023年中国半挂车行业概览：中国重卡市场温和复苏，多领域需求驱动半挂车市场增长（摘要版）,头豹研究院,2023-12-29,汽车整车,https://pdf.dfcfw.com/pdf/H3_AP202312291615488754_1.pdf?1703879188000.pdf
汽车行业事件点评：小米跨界造车成果亮相，核心技术守正出奇,东莞证券,2023-12-29,汽车整车,https://pdf.dfcfw.com/pdf/H3_AP202312291615495183_1.pdf?1703878819000.pdf
2023年汽车行业网络营销监测报告,艾瑞股份,2023-12-29,汽车整车,https://pdf.dfcfw.com/pdf/H3_AP202312291615479396_1.pdf?1703869508000.pdf
2023年汽车行业网络营销监测报告,艾瑞股份,2023-12-29,汽车整车,https://pdf.dfcfw.com/pdf/H3_AP202312291615464892_1.pdf?1703843044000.pdf
汽车行业周报：12月狭义乘用车零售销量预计同环比正增长,甬兴证券,2023-12-29,汽车整车,https://pdf.dfcfw.com/pdf/H3_AP202312291615465335_1.pdf?1703841152000.pdf
2023中国智能电动汽车品牌竞争格局研究报告,亿欧智库,2023-12-28,汽车整车,https://pdf.dfcfw.com/pdf/H3_AP202312281615148994_1.pdf?1703776156000.pdf
汽车行业2024年度策略：电动化持续渗透，智能化加速落地,财信证券,2023-12-28,汽车整车,https://pdf.dfcfw.com/pdf/H3_AP202312281615153958_1.pdf?1703782304000.pdf
汽车：问界M9上市，科技铸就智慧SUV,国联证券,2023-12-28,汽车整车,https://pdf.dfcfw.com/pdf/H3_AP202312281615156665_1.pdf?1703784176000.pdf
