研报名称,机构名称,发布时间,行业,研报地址
商用车：总量符合预期，出口和天然气高增长,国联证券,2024-04-02,汽车整车,https://pdf.dfcfw.com/pdf/H3_AP202404011629256056_1.pdf?1712043452000.pdf
汽车行业月报：华为鸿蒙生态圈不断扩展，小米SU7大定超预期,中原证券,2024-04-01,汽车整车,https://pdf.dfcfw.com/pdf/H3_AP202404011629191922_1.pdf?1711960351000.pdf
汽车行业报告：关于低空经济的十问十答,国海证券,2024-04-01,汽车整车,https://pdf.dfcfw.com/pdf/H3_AP202403311629188731_1.pdf?1711957008000.pdf
2024Q2汽车投资策略：优选商用车+华为_小米链,东吴证券,2024-04-01,汽车整车,https://pdf.dfcfw.com/pdf/H3_AP202403311629189679_1.pdf?1711961459000.pdf
汽车行业周报：小米SU7上市订单超预期，关注小米汽车产业链机会,华龙证券,2024-04-01,汽车整车,https://pdf.dfcfw.com/pdf/H3_AP202404011629198375_1.pdf?1711989979000.pdf
小米SU7上市点评：小米汽车破圈，突围20万元纯电市场,五矿证券,2024-04-01,汽车整车,https://pdf.dfcfw.com/pdf/H3_AP202404011629202136_1.pdf?1711991707000.pdf
汽车及汽车零部件行业研究：比亚迪财报表现强势，小米SU7大超预期,国金证券,2024-04-01,汽车整车,https://pdf.dfcfw.com/pdf/H3_AP202404011629195345_1.pdf?1711978821000.pdf
电动车行业点评：磐石底盘首发落地阿维塔，CTC技术加速应用,民生证券,2024-03-31,汽车整车,https://pdf.dfcfw.com/pdf/H3_AP202403301629183925_1.pdf?1711880959000.pdf
海外周报：继续看好汽车后市场连锁品牌,民生证券,2024-03-31,汽车整车,https://pdf.dfcfw.com/pdf/H3_AP202403311629189913_1.pdf?1711963684000.pdf
智能汽车行业系列报告之一：城区NOA快速落地，产业迎来“iPhone4时刻”,中泰证券,2024-03-29,汽车整车,https://pdf.dfcfw.com/pdf/H3_AP202403291629024895_1.pdf?1711711698000.pdf
汽车：小米汽车正式上市，智能化、小米生态造就核心竞争力,信达证券,2024-03-29,汽车整车,https://pdf.dfcfw.com/pdf/H3_AP202403291629034190_1.pdf?1711719325000.pdf
新国潮系列：小米SU7亮相三年之约，智能生态优势强大,平安证券,2024-03-29,汽车整车,https://pdf.dfcfw.com/pdf/H3_AP202403291629043011_1.pdf?1711731863000.pdf
汽车：小米SU7正式上市，27分钟大定破5万,德邦证券,2024-03-29,汽车整车,https://pdf.dfcfw.com/pdf/H3_AP202403291629047936_1.pdf?1711735686000.pdf
新能源汽车景气度跟踪：车企D有望创历史新高，车企J主力车型订单逐周回暖,天风证券,2024-03-28,汽车整车,https://pdf.dfcfw.com/pdf/H3_AP202403281628419000_1.pdf?1711617601000.pdf
汽车行业深度报告：我国成全球最大汽车出口国，本土化供应未来可期,开源证券,2024-03-27,汽车整车,https://pdf.dfcfw.com/pdf/H3_AP202403271628295579_1.pdf?1711531837000.pdf
汽车行业点评报告：车市2月有所承压，以旧换新政策刺激下回暖可期,开源证券,2024-03-26,汽车整车,https://pdf.dfcfw.com/pdf/H3_AP202403261628177396_1.pdf?1711466382000.pdf
汽车及汽车零部件行业研究：整车边际变化亮眼，英伟达开启人形机器人项目,国金证券,2024-03-25,汽车整车,https://pdf.dfcfw.com/pdf/H3_AP202403251628066939_1.pdf?1711355033000.pdf
汽车行业周报：小米SU7等新车上市在即，3月新能源渗透率有望达45.5%,华龙证券,2024-03-25,汽车整车,https://pdf.dfcfw.com/pdf/H3_AP202403251628084900_1.pdf?1711399351000.pdf
汽车行业2024年信用风险展望,大公国际,2024-03-25,汽车整车,https://pdf.dfcfw.com/pdf/H3_AP202403251628069775_1.docx?1711379764000.docx
汽车行业跟踪：飞行汽车商业化逐步落地，万亿级市场蓄势待发,信达证券,2024-03-24,汽车整车,https://pdf.dfcfw.com/pdf/H3_AP202403241628064840_1.pdf?1711302213000.pdf
汽车行业周报：新品牌新车型公布，车企竞争加剧，英伟达召开2024GTC大会,华鑫证券,2024-03-24,汽车整车,https://pdf.dfcfw.com/pdf/H3_AP202403241628064886_1.pdf?1711302002000.pdf
汽车行业动态研究：2024年中国电动汽车百人会论坛核心观点梳理,国海证券,2024-03-21,汽车整车,https://pdf.dfcfw.com/pdf/H3_AP202403211627432150_1.pdf?1711030286000.pdf
中国电动汽车百人会论坛系列1：双智城市与新能源车技术共促行业创新变革,海通国际,2024-03-20,汽车整车,https://pdf.dfcfw.com/pdf/H3_AP202403201627291436_1.pdf?1710929716000.pdf
汽车行业动态：培育新质生产力，低空经济扬帆起航,上海证券,2024-03-20,汽车整车,https://pdf.dfcfw.com/pdf/H3_AP202403201627307002_1.pdf?1710930208000.pdf
汽车行业月报新能源2月月报：2月产批表现符合预期，新能源渗透率35%,东吴证券,2024-03-19,汽车整车,https://pdf.dfcfw.com/pdf/H3_AP202403181626999900_1.pdf?1710835139000.pdf
汽车智能化月报系列（十三）：小鹏推送无限XNGP智能辅助驾驶功能，禾赛科技2023年经营现金流转正,国信证券,2024-03-19,汽车整车,https://pdf.dfcfw.com/pdf/H3_AP202403191627109754_1.pdf?1710837753000.pdf
摩托车行业系列点评二：优质供给加速驱动 中大排出口逆势增长,民生证券,2024-03-19,汽车整车,https://pdf.dfcfw.com/pdf/H3_AP202403191627112123_1.pdf?1710840693000.pdf
汽车行业点评报告：英伟达召开2024GTC大会，见证AI变革时刻,华鑫证券,2024-03-19,汽车整车,https://pdf.dfcfw.com/pdf/H3_AP202403191627138307_1.pdf?1710867523000.pdf
新能源汽车景气度跟踪：车企D有望创历史新高，车企J新车订单回落,天风证券,2024-03-19,汽车整车,https://pdf.dfcfw.com/pdf/H3_AP202403191627141934_1.pdf?1710875600000.pdf
新兴成长行业周报：禾赛科技2023营收同比增长超50%，交付量增长约2倍,国海证券,2024-03-19,汽车整车,https://pdf.dfcfw.com/pdf/H3_AP202403191627142599_1.pdf?1710873302000.pdf
汽车：低空经济政策加持，产业链蓄势待发,信达证券,2024-03-19,汽车整车,https://pdf.dfcfw.com/pdf/H3_AP202403191627211660_1.pdf?1710880415000.pdf
汽车行业周报：汽车以旧换新方案发布，政策优化保障销量增长,华龙证券,2024-03-19,汽车整车,https://pdf.dfcfw.com/pdf/H3_AP202403191627212696_1.pdf?1710884822000.pdf
汽车行业周报：eVTOL快速发展，国内主机厂有望充分受益,德邦证券,2024-03-18,汽车整车,https://pdf.dfcfw.com/pdf/H3_AP202403181626958256_1.pdf?1710747507000.pdf
汽车行业周报：北汽享界S9正式亮相工信部，Figure推出OpenAI大模型加持人形机器人,华鑫证券,2024-03-18,汽车整车,https://pdf.dfcfw.com/pdf/H3_AP202403181626958963_1.pdf?1710751134000.pdf
汽车行业点评报告：以旧换新政策再次明确，看好汽车板块主线投资机会,东吴证券,2024-03-18,汽车整车,https://pdf.dfcfw.com/pdf/H3_AP202403171626955585_1.pdf?1710746592000.pdf
汽车行业周报：以旧换新行动方案正式印发，车企置换补贴相继落地,东海证券,2024-03-18,汽车整车,https://pdf.dfcfw.com/pdf/H3_AP202403181626996718_1.pdf?1710801010000.pdf
汽车行业周报：政策加码和供给发力共振，看好汽车消费需求,甬兴证券,2024-03-18,汽车整车,https://pdf.dfcfw.com/pdf/H3_AP202403181626964430_1.pdf?1710767552000.pdf
汽车行业周报：政策鼓励以旧换新，存量市场有望焕发活力,西南证券,2024-03-18,汽车整车,https://pdf.dfcfw.com/pdf/H3_AP202403181626964610_1.pdf?1710770634000.pdf
汽车周观点：继续看好汽车板块！商用车+电动化+智能化_全球化！,东吴证券,2024-03-18,汽车整车,https://pdf.dfcfw.com/pdf/H3_AP202403181626965412_1.pdf?1710774415000.pdf
汽车行业点评报告：以旧换新政策再次明确，坚定重卡向上趋势,东吴证券,2024-03-18,汽车整车,https://pdf.dfcfw.com/pdf/H3_AP202403181626965913_1.pdf?1710773748000.pdf
汽车行业行业周报：《以旧换新行动方案》正式发布，多方位支持汽车消费,中国银河,2024-03-18,汽车整车,https://pdf.dfcfw.com/pdf/H3_AP202403181626967928_1.pdf?1710781050000.pdf
汽车行业周报：以旧换新政策加速推进，华为车BU智选模式开始盈利,太平洋,2024-03-18,汽车整车,https://pdf.dfcfw.com/pdf/H3_AP202403181626970993_1.pdf?1710781532000.pdf
汽车行业专题研究：如何看待手机板对板连接器国产化趋势？,国联证券,2024-03-17,汽车整车,https://pdf.dfcfw.com/pdf/H3_AP202403171626952778_1.pdf?1710669347000.pdf
汽车行业跟踪：享界S9现身工信部目录，小米SU7发布定档3月28日,信达证券,2024-03-17,汽车整车,https://pdf.dfcfw.com/pdf/H3_AP202403171626954263_1.pdf?1710695125000.pdf
汽车行业周报：政策支持+事件催化，当前仍是汽车布局窗口期,国海证券,2024-03-17,汽车整车,https://pdf.dfcfw.com/pdf/H3_AP202403171626955062_1.pdf?1710756159000.pdf
新能车：行业龙头停产检修，六氟有望盈利企稳,南京证券,2024-03-15,汽车整车,https://pdf.dfcfw.com/pdf/H3_AP202403151626826608_1.pdf?1710511044000.pdf
汽车行业3月报：车企价格竞争趋于激烈，预计两会后汽车产业相关促进政策将陆续推出,联储证券,2024-03-15,汽车整车,https://pdf.dfcfw.com/pdf/H3_AP202403151626834335_1.pdf?1710523979000.pdf
汽车行业周报：汽车央企新能源单独考核，地方汽车消费补贴逐步落地,华龙证券,2024-03-14,汽车整车,https://pdf.dfcfw.com/pdf/H3_AP202403141626722052_1.pdf?1710414332000.pdf
汽车以旧换新行动方案点评：政策呵护支持，汽车销售总量增长确定性提升,国海证券,2024-03-14,汽车整车,https://pdf.dfcfw.com/pdf/H3_AP202403141626724779_1.pdf?1710428939000.pdf
华为行业专题：三种模式赋能车企，打造中国智能汽车品牌,国信证券,2024-03-14,汽车整车,https://pdf.dfcfw.com/pdf/H3_AP202403141626727490_1.pdf?1710433840000.pdf
乘用车行业动态研究报告：新势力二月成绩单公布，车企推出多款新车型,华鑫证券,2024-03-14,汽车整车,https://pdf.dfcfw.com/pdf/H3_AP202403141626729683_1.pdf?1710437055000.pdf
汽车行业点评：鼓励以旧换新，优质供给与政策春风共振,平安证券,2024-03-14,汽车整车,https://pdf.dfcfw.com/pdf/H3_AP202403141626727484_1.pdf?1710433276000.pdf
新能源汽车景气度跟踪：车企D订单有望创历史新高，车企I单周订单同比增速近800%,天风证券,2024-03-14,汽车整车,https://pdf.dfcfw.com/pdf/H3_AP202403141626753243_1.pdf?1710441981000.pdf
汽车行业周报：智能电动车&汽车出口成为两会焦点,首创证券,2024-03-13,汽车整车,https://pdf.dfcfw.com/pdf/H3_AP202403131626550542_1.pdf?1710320967000.pdf
汽车行业点评报告：2月行业产批表现符合预期，新能源渗透率为34.5%,东吴证券,2024-03-13,汽车整车,https://pdf.dfcfw.com/pdf/H3_AP202403131626604700_1.pdf?1710335053000.pdf
新能源汽车产业链跟踪点评：1-2月新能源汽车销量延续良好增长态势,东莞证券,2024-03-13,汽车整车,https://pdf.dfcfw.com/pdf/H3_AP202403131626615592_1.pdf?1710350134000.pdf
汽车行业月度点评：1-2月汽车累计产销量同比微增，国常会通过汽车以旧换新行动方案,财信证券,2024-03-13,汽车整车,https://pdf.dfcfw.com/pdf/H3_AP202403131626608844_1.pdf?1710335906000.pdf
汽车行业周报：多家车企加入价格竞争，奇瑞汽车2月销量同比约+45.9%,甬兴证券,2024-03-12,汽车整车,https://pdf.dfcfw.com/pdf/H3_AP202403121626422586_1.pdf?1710236122000.pdf
汽车和汽车零部件行业周报,天风证券,2024-03-12,汽车整车,https://pdf.dfcfw.com/pdf/H3_AP202403121626448335_1.pdf?1710257013000.pdf
汽车行业事项点评：中央鼓励汽车“以旧换新”，政策加持+新车周期，看好行业β向上,信达证券,2024-03-12,汽车整车,https://pdf.dfcfw.com/pdf/H3_AP202403121626455224_1.pdf?1710265253000.pdf
豪华车市场：总量有支撑，自主品牌供给全面开花,东吴证券,2024-03-12,汽车整车,https://pdf.dfcfw.com/pdf/H3_AP202403121626492743_1.pdf?1710321883000.pdf
新兴成长行业周报：低空经济写入政府工作报告，飞行汽车商业化落地提速,国海证券,2024-03-12,汽车整车,https://pdf.dfcfw.com/pdf/H3_AP202403121626361787_1.pdf?1710238648000.pdf
汽车行业点评报告：汽车行研札记01期，2024年业绩＞估值,东吴证券,2024-03-11,汽车整车,https://pdf.dfcfw.com/pdf/H3_AP202403111626210933_1.pdf?1710151508000.pdf
汽车行业周报：两会汽车观察,太平洋,2024-03-11,汽车整车,https://pdf.dfcfw.com/pdf/H3_AP202403111626212468_1.pdf?1710153389000.pdf
汽车行业周报（24年第10周）：1-2月乘用车累计批发销量同比增长11%，关注理想及华为产业链机遇,国信证券,2024-03-11,汽车整车,https://pdf.dfcfw.com/pdf/H3_AP202403111626212471_1.pdf?1710153389000.pdf
汽车行业周报：新一轮产品周期开启，看好汽车销量增长,西南证券,2024-03-11,汽车整车,https://pdf.dfcfw.com/pdf/H3_AP202403111626212838_1.pdf?1710154629000.pdf
2月乘用车销量点评：2月销量同比-20%，看好三月增速回升,信达证券,2024-03-11,汽车整车,https://pdf.dfcfw.com/pdf/H3_AP202403111626215410_1.pdf?1710165478000.pdf
汽车行业周报：乘用车市场2月销量公布，自主品牌份额延续同比提升趋势,东海证券,2024-03-11,汽车整车,https://pdf.dfcfw.com/pdf/H3_AP202403111626226467_1.pdf?1710191789000.pdf
汽车行业周报：江淮中高端电动乘用车项目发布公示，汽车央企将重点考核新能源汽车销量和技术,华鑫证券,2024-03-11,汽车整车,https://pdf.dfcfw.com/pdf/H3_AP202403111626264059_1.pdf?1710192778000.pdf
汽车周观点：重视国企资产重估机会,东吴证券,2024-03-11,汽车整车,https://pdf.dfcfw.com/pdf/H3_AP202403111626294076_1.pdf?1710193140000.pdf
汽车行业行业点评报告：2月车市处于传统淡季，供给端、政策端全力促进汽车消费,中国银河,2024-03-11,汽车整车,https://pdf.dfcfw.com/pdf/H3_AP202403111626294212_1.pdf?1710193317000.pdf
中汽协2月销量点评：1-2月合计销量同比高增长，自主份额近60%,国联证券,2024-03-11,汽车整车,https://pdf.dfcfw.com/pdf/H3_AP202403111626323106_1.pdf?1710230464000.pdf
汽车行业周报：两会明确促进新能源汽车消费，拉动新质生产力,中国银河,2024-03-11,汽车整车,https://pdf.dfcfw.com/pdf/H3_AP202403111626213737_1.pdf?1710168008000.pdf
汽车行业周报：1-2月乘用车零售313.3万辆，同比增长17.0%,德邦证券,2024-03-10,汽车整车,https://pdf.dfcfw.com/pdf/H3_AP202403101626200721_1.pdf?1710086232000.pdf
汽车：1-2月乘用车批发累计同比+10.7%，新能源渗透率为33.5%,德邦证券,2024-03-10,汽车整车,https://pdf.dfcfw.com/pdf/H3_AP202403101626200720_1.pdf?1710095736000.pdf
汽车行业跟踪：三家汽车央企新能源汽车业务将迎单独考核，看好华为智能化赋能机遇,信达证券,2024-03-10,汽车整车,https://pdf.dfcfw.com/pdf/H3_AP202403101626200938_1.pdf?1710089510000.pdf
汽车行业周报：政策预期+事件催化，继续布局汽车,国海证券,2024-03-10,汽车整车,https://pdf.dfcfw.com/pdf/H3_AP202403101626202709_1.pdf?1710150605000.pdf
汽车行业3月投资策略：1-2月新能源车累计销量同比增长36%，关注理想及华为产业链机遇,国信证券,2024-03-08,汽车整车,https://pdf.dfcfw.com/pdf/H3_AP202403081626018716_1.pdf?1709886563000.pdf
新能源汽车景气度跟踪：车企I同比增速超500%，车企D重点新车单周订单近2w,天风证券,2024-03-08,汽车整车,https://pdf.dfcfw.com/pdf/H3_AP202403081626020948_1.pdf?1709890032000.pdf
中国汽车周报：巩固优势，扩大消费-《政府工作报告》汽车领域解读,海通国际,2024-03-08,汽车整车,https://pdf.dfcfw.com/pdf/H3_AP202403081626021102_1.pdf?1709892485000.pdf
汽车重构系列1：车企的电池控制权之争,五矿证券,2024-03-08,汽车整车,https://pdf.dfcfw.com/pdf/H3_AP202403081626030014_1.pdf?1709913742000.pdf
汽车行业周报：理想2023年财报表现亮眼，MPV车型3月1日上市,甬兴证券,2024-03-07,汽车整车,https://pdf.dfcfw.com/pdf/H3_AP202403071625929943_1.pdf?1709818926000.pdf
汽车行业周报：上海发布新一轮补贴政策，有望拉动汽车消费,首创证券,2024-03-05,汽车整车,https://pdf.dfcfw.com/pdf/H3_AP202403051625452456_1.pdf?1709629184000.pdf
汽车与零部件行业周报：苹果取消造车计划，比亚迪推出汉／唐／宋荣耀版,上海证券,2024-03-05,汽车整车,https://pdf.dfcfw.com/pdf/H3_AP202403051625455218_1.pdf?1709632517000.pdf
商用车：春节影响2月销量，政策有望带动行业向上,国联证券,2024-03-05,汽车整车,https://pdf.dfcfw.com/pdf/H3_AP202403051625514186_1.pdf?1709654535000.pdf
汽车行业动态点评：新能源汽车保有量呈高速增长态势，新规落地后检测行业有望逐步回暖,东方财富证券,2024-03-05,汽车整车,https://pdf.dfcfw.com/pdf/H3_AP202403051625514245_1.pdf?1709654813000.pdf
汽车新国潮系列：从MEGA看理想对于纯电车的思考,平安证券,2024-03-05,汽车整车,https://pdf.dfcfw.com/pdf/H3_AP202403051625515264_1.pdf?1709656988000.pdf
摩托车行业系列点评一：优质供给加速驱动 出口创月度新高,民生证券,2024-03-05,汽车整车,https://pdf.dfcfw.com/pdf/H3_AP202403051625519443_1.pdf?1709659238000.pdf
汽车行业周报：理想MEGA发布开启新周期，新能源车竞争进入深水区,华龙证券,2024-03-05,汽车整车,https://pdf.dfcfw.com/pdf/H3_AP202403051625526913_1.pdf?1709671251000.pdf
科技行业：理想汽车2024春季发布会：高压纯电正式发车，开启新产品周期,浦银国际证券,2024-03-05,汽车整车,https://pdf.dfcfw.com/pdf/H3_AP202403051625503606_1.pdf?1709652022000.pdf
汽车行业周报：新一轮以旧换新政策有望带动万亿汽车消费增量,太平洋,2024-03-05,汽车整车,https://pdf.dfcfw.com/pdf/H3_AP202403051625505250_1.pdf?1709644839000.pdf
汽车：以旧换新政策助推内需向上,国联证券,2024-03-05,汽车整车,https://pdf.dfcfw.com/pdf/H3_AP202403051625513656_1.pdf?1709653687000.pdf
汽车行业周报：汽车进入事件催化密集期，继续布局行业相关机会,国海证券,2024-03-04,汽车整车,https://pdf.dfcfw.com/pdf/H3_AP202403041625215412_1.pdf?1709540080000.pdf
汽车行业周报：理想发布全新MPV Mega，多家车企推出焕新车型，机会与挑战并存,华鑫证券,2024-03-04,汽车整车,https://pdf.dfcfw.com/pdf/H3_AP202403031625210340_1.pdf?1709537526000.pdf
汽车行业点评报告：新势力跟踪之2月销量点评：15家车企新能源车合计交付环比-42%，表现符合预期,东吴证券,2024-03-04,汽车整车,https://pdf.dfcfw.com/pdf/H3_AP202403041625212451_1.pdf?1709541167000.pdf
汽车行业双周报：比亚迪开启新一轮价格战，行业马太效应将加剧,东莞证券,2024-03-04,汽车整车,https://pdf.dfcfw.com/pdf/H3_AP202403041625214607_1.pdf?1709537526000.pdf
汽车和汽车零部件行业周报,天风证券,2024-03-04,汽车整车,https://pdf.dfcfw.com/pdf/H3_AP202403041625214788_1.pdf?1709538128000.pdf
汽车行业周报：以旧换新政策持续落地，理想Mega正式上市,东海证券,2024-03-04,汽车整车,https://pdf.dfcfw.com/pdf/H3_AP202403041625379540_1.pdf?1709565174000.pdf
汽车行业周报：多家车企官宣降价促销，车市增长预期迎政策强化,西南证券,2024-03-04,汽车整车,https://pdf.dfcfw.com/pdf/H3_AP202403041625384343_1.pdf?1709570255000.pdf
汽车周观点：看好理想汽车及产业链投资机会，看好Q1【商用车+AI智能化】主线,东吴证券,2024-03-04,汽车整车,https://pdf.dfcfw.com/pdf/H3_AP202403041625402950_1.pdf?1709624021000.pdf
理想汽车2024年春季发布会点评：理想产品大年，销量增长可期,西南证券,2024-03-04,汽车整车,https://pdf.dfcfw.com/pdf/H3_AP202403041625377377_1.pdf?1709558639000.pdf
汽车行业周报：自主品牌产品力持续提升，以旧换新政策驱动行业景气度回升,中国银河,2024-03-04,汽车整车,https://pdf.dfcfw.com/pdf/H3_AP202403041625377802_1.pdf?1709561786000.pdf
商用车：如何看待当下商用车分红水平提升？,国联证券,2024-03-03,汽车整车,https://pdf.dfcfw.com/pdf/H3_AP202403021625199946_1.pdf?1709460290000.pdf
汽车行业点评报告：乘用车行业迎来开门红，比亚迪引领龙年首场降价潮,开源证券,2024-03-03,汽车整车,https://pdf.dfcfw.com/pdf/H3_AP202403031625208573_1.pdf?1709472305000.pdf
汽车行业跟踪： ：政策预期渐强+新车周期开启，持续看好汽车右侧机会,信达证券,2024-03-03,汽车整车,https://pdf.dfcfw.com/pdf/H3_AP202403031625209643_1.pdf?1709482503000.pdf
新能源汽车景气度跟踪：车企I同比增速超400%，车企D重点新车单周订单大增,天风证券,2024-03-01,汽车整车,https://pdf.dfcfw.com/pdf/H3_AP202403011624847199_1.pdf?1709320079000.pdf
中国汽车周报：比亚迪“电比油低”剑指10万元级市场，苹果传放弃造车聚焦生成式AI,海通国际,2024-02-29,汽车整车,https://pdf.dfcfw.com/pdf/H3_AP202402291624092652_1.pdf?1709205240000.pdf
客车2月月报：1月国内及出口销量超预期,东吴证券,2024-02-29,汽车整车,https://pdf.dfcfw.com/pdf/H3_AP202402291624100579_1.pdf?1709205626000.pdf
2024年中国新能源乘用车销量将超千万辆，渗透率或增至40%,CINNO Research,2024-02-29,汽车整车,https://pdf.dfcfw.com/pdf/H3_AP202402291624095305_1.docx?1709200681000.docx
汽车行业周报：年度行情，只是开始,太平洋,2024-02-29,汽车整车,https://pdf.dfcfw.com/pdf/H3_AP202402291624103895_1.pdf?1709213518000.pdf
客车系列深度三：客车出口年度复盘及展望,东吴证券,2024-02-28,汽车整车,https://pdf.dfcfw.com/pdf/H3_AP202402271623894575_1.pdf?1709105227000.pdf
汽车行业点评报告：政策刺激格局向好，中高端产业链发力,国元证券,2024-02-28,汽车整车,https://pdf.dfcfw.com/pdf/H3_AP202402281623922097_1.pdf?1709110944000.pdf
新能源1月月报：1月零售表现略好于预期，新能源渗透率33%,东吴证券,2024-02-28,汽车整车,https://pdf.dfcfw.com/pdf/H3_AP202402281623987675_1.pdf?1709141597000.pdf
汽车和汽车零部件行业周报,天风证券,2024-02-28,汽车整车,https://pdf.dfcfw.com/pdf/H3_AP202402281623994189_1.pdf?1709147754000.pdf
汽车行业周报：春节假期扰动短期增速，以旧换新政策有望提振汽车消费,东海证券,2024-02-27,汽车整车,https://pdf.dfcfw.com/pdf/H3_AP202402271623723070_1.pdf?1709024403000.pdf
汽车行业周报：优质供给叠加智能化加速，节后销量有望持续高增速,华龙证券,2024-02-27,汽车整车,https://pdf.dfcfw.com/pdf/H3_AP202402271623726051_1.pdf?1709030019000.pdf
汽车行业周报：2024年1月国内新能源汽车销量约73万辆，同比+78.8%,甬兴证券,2024-02-27,汽车整车,https://pdf.dfcfw.com/pdf/H3_AP202402271623730914_1.pdf?1709039651000.pdf
新能车：价格竞争进入深水区,南京证券,2024-02-27,汽车整车,https://pdf.dfcfw.com/pdf/H3_AP202402271623730924_1.pdf?1709048262000.pdf
汽车行业周报（24年第8周）：以旧换新政策刺激，关注华为汽车、智能化及机器人,国信证券,2024-02-27,汽车整车,https://pdf.dfcfw.com/pdf/H3_AP202402271623734134_1.pdf?1709047943000.pdf
汽车行业周报：年前车市销量承压，节后改善动能强,首创证券,2024-02-27,汽车整车,https://pdf.dfcfw.com/pdf/H3_AP202402271623745461_1.pdf?1709055951000.pdf
汽车：理想汽车2023年报点评：Q4盈利远超预期，新车周期即将开启,信达证券,2024-02-27,汽车整车,https://pdf.dfcfw.com/pdf/H3_AP202402271623748979_1.pdf?1709062282000.pdf
EV观察系列157：1月欧洲新能车市场增势稳定，销量同比增长明显,民生证券,2024-02-27,汽车整车,https://pdf.dfcfw.com/pdf/H3_AP202402271623791991_1.pdf?1709065294000.pdf
乘用车整车行业2024年投资策略：智电重塑秩序 自主海阔天空,民生证券,2024-02-27,汽车整车,https://pdf.dfcfw.com/pdf/H3_AP202402271623818042_1.pdf?1709069286000.pdf
汽车行业跟踪：新车周期或带动汽车3月拐点将至，板块有望迎来布局窗口,信达证券,2024-02-26,汽车整车,https://pdf.dfcfw.com/pdf/H3_AP202402261623573162_1.pdf?1708934981000.pdf
汽车行业周报：人形机器人进展顺利，“价格战”与“新伙伴”并存,华鑫证券,2024-02-26,汽车整车,https://pdf.dfcfw.com/pdf/H3_AP202402261623580681_1.pdf?1708963337000.pdf
汽车行业：2月车市平稳过渡，新能源市场价格战有所延续,中国银河,2024-02-26,汽车整车,https://pdf.dfcfw.com/pdf/H3_AP202402261623583987_1.pdf?1709022565000.pdf
中小盘行业周报：中小盘行业研究2023年禾赛科技交付飙升与密集合作布局,国海证券,2024-02-26,汽车整车,https://pdf.dfcfw.com/pdf/H3_AP202402261623577974_1.pdf?1708960427000.pdf
汽车周观点：继续看好汽车Q1行情，看好Q1【商用车+AI智能化】主线,东吴证券,2024-02-26,汽车整车,https://pdf.dfcfw.com/pdf/H3_AP202402261623578016_1.pdf?1708955553000.pdf
汽车行业周报：政策预期值得期待，重卡存量市场或迎新机遇,西南证券,2024-02-26,汽车整车,https://pdf.dfcfw.com/pdf/H3_AP202402261623578019_1.pdf?1708952651000.pdf
汽车行业事项点评：中央鼓励汽车“以旧换新”，政策加持+新车周期，看好行业β向上,信达证券,2024-02-26,汽车整车,https://pdf.dfcfw.com/pdf/H3_AP202402261623579487_1.pdf?1708958470000.pdf
从华为看智能汽车（四）：如何看待线控制动的技术演进和格局变化？,国联证券,2024-02-25,汽车整车,https://pdf.dfcfw.com/pdf/H3_AP202402251623563208_1.pdf?1708864889000.pdf
