研报名称,机构名称,发布时间,行业,研报地址
汽车零部件&机器人主线周报：Optimus再获马斯克高度评价，智元将举办机器人晚会,东吴证券,2026-02-08,汽车服务,https://pdf.dfcfw.com/pdf/H3_AP202602071819822988_1.pdf?1770569079000.pdf
洞察小型电动汽车市场竞争态势（2026）：低利润、高销量的小型电动电动汽车使汽车制造商获得丰厚收益,易车,2026-02-05,汽车服务,https://pdf.dfcfw.com/pdf/H3_AP202602051819786191_1.pdf?1770303774000.pdf
市场洞察：2025年中国二手车市场动态追踪-全国车源加速流动，区域梯度与数字化共振扩散,头豹研究院,2026-02-04,汽车服务,https://pdf.dfcfw.com/pdf/H3_AP202602041819774405_1.pdf?1770234773000.pdf
中国二手车行业出口分析及各国进口政策影响白皮书,上海特易信息科技,2026-01-08,汽车服务,https://pdf.dfcfw.com/pdf/H3_AP202601071816825674_1.pdf?1767859070000.pdf
智能网联汽车网络技术路线图（2025-2030）,中国通信工业协会,2025-11-14,汽车服务,https://pdf.dfcfw.com/pdf/H3_AP202511141781018104_1.pdf?1763115948000.pdf
2025中国汽车租赁行业现状与发展报告,上海嘉世营销咨询,2025-10-11,汽车服务,https://pdf.dfcfw.com/pdf/H3_AP202510111759945107_1.pdf?1760173239000.pdf
