研报名称,机构名称,发布时间,行业,研报地址
煤炭行业周报：经济基本面预期改善，行业风险偏好提升,山西证券,2024-10-08,煤炭行业,https://pdf.dfcfw.com/pdf/H3_AP202410081640201045_1.pdf?1728413566000.pdf
煤炭行业周报：政策力度空前，强化周期弹性，重视煤炭股布局,开源证券,2024-10-07,煤炭行业,https://pdf.dfcfw.com/pdf/H3_AP202410071640186894_1.pdf?1728379495000.pdf
煤炭开采行业周报：煤价偏强运行，终端需求存在持续补库需求,国海证券,2024-09-30,煤炭行业,https://pdf.dfcfw.com/pdf/H3_AP202409301640103335_1.pdf?1727711352000.pdf
煤炭行业双周报：节前下游快速补库，关注非电需求改善,东莞证券,2024-09-30,煤炭行业,https://pdf.dfcfw.com/pdf/H3_AP202409301640105884_1.pdf?1727730843000.pdf
煤炭行业周报：需求预期好转获政策加持，煤价稳中上涨,华龙证券,2024-09-30,煤炭行业,https://pdf.dfcfw.com/pdf/H3_AP202409301640108720_1.pdf?1727731452000.pdf
煤炭行业周报：政治局会议释放积极有为信号，煤炭顺周期属性显现,海通国际,2024-09-30,煤炭行业,https://pdf.dfcfw.com/pdf/H3_AP202409301640107466_1.pdf?1727718655000.pdf
煤炭开采行业跟踪周报：相关封航导致港口库存累积，难挡旺季来临煤价上涨趋势形成,东吴证券,2024-09-29,煤炭行业,https://pdf.dfcfw.com/pdf/H3_AP202409281640090471_1.pdf?1727598986000.pdf
煤炭行业周报：等待预期照进现实，优选确定性交易机会,中泰证券,2024-09-29,煤炭行业,https://pdf.dfcfw.com/pdf/H3_AP202409291640092686_1.pdf?1727617598000.pdf
煤炭行业周报：政策组合拳力度空前，重视煤炭股布局,开源证券,2024-09-29,煤炭行业,https://pdf.dfcfw.com/pdf/H3_AP202409291640092672_1.pdf?1727617321000.pdf
煤炭：政策改善预期，看好焦煤估值修复及基本面改善,华福证券,2024-09-29,煤炭行业,https://pdf.dfcfw.com/pdf/H3_AP202409291640095140_1.pdf?1727647143000.pdf
煤炭周报：基本面与政策面共振，高股息价值凸显，加强配置,民生证券,2024-09-28,煤炭行业,https://pdf.dfcfw.com/pdf/H3_AP202409281640090510_1.pdf?1727551891000.pdf
稳经济政策连续加码，重点提示炼焦煤配置机遇,信达证券,2024-09-28,煤炭行业,https://pdf.dfcfw.com/pdf/H3_AP202409281640090615_1.pdf?1727561977000.pdf
煤炭行业周报：动力煤价格延续上涨，港口库存持续下降,华龙证券,2024-09-24,煤炭行业,https://pdf.dfcfw.com/pdf/H3_AP202409241639995753_1.pdf?1727171355000.pdf
煤炭：动力煤价延续反弹，煤炭板块再迎布局良机,华福证券,2024-09-24,煤炭行业,https://pdf.dfcfw.com/pdf/H3_AP202409241639997641_1.pdf?1727174326000.pdf
煤炭行业周报：短期反弹进行时 长期走势仍待观察,大同证券,2024-09-24,煤炭行业,https://pdf.dfcfw.com/pdf/H3_AP202409241640006666_1.pdf?1727214352000.pdf
煤炭行业周报：煤价维持涨势，宏观预期修复,中泰证券,2024-09-23,煤炭行业,https://pdf.dfcfw.com/pdf/H3_AP202409231639975295_1.pdf?1727081469000.pdf
煤炭行业周报：供给收缩需求释放，港口煤价继续回升,山西证券,2024-09-23,煤炭行业,https://pdf.dfcfw.com/pdf/H3_AP202409231639988298_1.pdf?1727125495000.pdf
煤炭开采行业周报：动力煤继续去库存、涨价格，基本面向好,国海证券,2024-09-23,煤炭行业,https://pdf.dfcfw.com/pdf/H3_AP202409231639981031_1.pdf?1727109418000.pdf
煤炭月度供需数据点评：符合预期，制造业投资延续高增,山西证券,2024-09-22,煤炭行业,https://pdf.dfcfw.com/pdf/H3_AP202409201639968858_1.pdf?1727000783000.pdf
煤炭开采行业跟踪周报：铁路、港口积极组织上下游拉运煤炭，促使交易活跃煤价企稳,东吴证券,2024-09-22,煤炭行业,https://pdf.dfcfw.com/pdf/H3_AP202409221639972712_1.pdf?1727002077000.pdf
煤炭行业周报：煤价淡季连续四周反弹，重视煤炭股布局,开源证券,2024-09-22,煤炭行业,https://pdf.dfcfw.com/pdf/H3_AP202409221639972715_1.pdf?1726996994000.pdf
煤炭周报：化工需求同环比提升明显，煤价持续上涨,民生证券,2024-09-21,煤炭行业,https://pdf.dfcfw.com/pdf/H3_AP202409211639972379_1.pdf?1726932081000.pdf
煤炭行业2024半年报业绩综述：煤价回落行业业绩承压，长期价值仍在,华龙证券,2024-09-21,煤炭行业,https://pdf.dfcfw.com/pdf/H3_AP202409211639972455_1.pdf?1726999639000.pdf
煤炭开采行业动态研究：8月动力煤行业大幅去库存，火力发电增速转正,国海证券,2024-09-20,煤炭行业,https://pdf.dfcfw.com/pdf/H3_AP202409201639954161_1.pdf?1726832921000.pdf
煤炭行业：国内动力煤下游继续去库存但放缓，火力发电量增,东兴证券,2024-09-20,煤炭行业,https://pdf.dfcfw.com/pdf/H3_AP202409201639959232_1.pdf?1726848625000.pdf
煤炭行业：炼焦煤价继续探底，库存量涨,东兴证券,2024-09-20,煤炭行业,https://pdf.dfcfw.com/pdf/H3_AP202409201639959248_1.pdf?1726848726000.pdf
煤炭行业2024年中报综述：上市公司产销好于行业，关注非电需求回升,山西证券,2024-09-19,煤炭行业,https://pdf.dfcfw.com/pdf/H3_AP202409191639943441_1.pdf?1726770975000.pdf
煤炭行业周报：补库需求有所释放，港口煤价震荡回升,山西证券,2024-09-18,煤炭行业,https://pdf.dfcfw.com/pdf/H3_AP202409181639918996_1.pdf?1726677035000.pdf
煤炭开采行业周报：动力煤价格小幅上涨，逆市上涨,国海证券,2024-09-17,煤炭行业,https://pdf.dfcfw.com/pdf/H3_AP202409171639907796_1.pdf?1726653434000.pdf
煤炭行业周报：补库需求释放，煤价稳中探涨,中泰证券,2024-09-16,煤炭行业,https://pdf.dfcfw.com/pdf/H3_AP202409161639890557_1.pdf?1726494338000.pdf
煤炭行业双周报：电厂日耗维持高位，关注“金九银十”非电需求改善,东莞证券,2024-09-16,煤炭行业,https://pdf.dfcfw.com/pdf/H3_AP202409161639890586_1.pdf?1726496162000.pdf
动力煤价格如期上涨，炼焦煤价格亦望企稳筑底,信达证券,2024-09-16,煤炭行业,https://pdf.dfcfw.com/pdf/H3_AP202409161639897133_1.pdf?1726529415000.pdf
煤炭行业周报：煤价淡季反弹，为煤炭重新布局提振信心,开源证券,2024-09-15,煤炭行业,https://pdf.dfcfw.com/pdf/H3_AP202409151639888205_1.pdf?1726384513000.pdf
中国煤炭行业中期信用观察—供给宽松延续及价格下行的压力,中诚信国际,2024-09-14,煤炭行业,https://pdf.dfcfw.com/pdf/H3_AP202409141639885302_1.pdf?1726312937000.pdf
煤炭开采行业跟踪周报：非电力港口库存骤降，支撑煤价维持高位,东吴证券,2024-09-14,煤炭行业,https://pdf.dfcfw.com/pdf/H3_AP202409141639888078_1.pdf?1726354249000.pdf
煤炭周报：煤价如期上涨，供需格局持续改善,民生证券,2024-09-14,煤炭行业,https://pdf.dfcfw.com/pdf/H3_AP202409141639886255_1.pdf?1726339815000.pdf
煤企深度剖析系列（一）：从弹性和粘性对比煤企投资价值,平安证券,2024-09-12,煤炭行业,https://pdf.dfcfw.com/pdf/H3_AP202409121639847267_1.pdf?1726140008000.pdf
煤炭开采行业专题研究：煤炭板块2024半年报总结：盈利回归合理水平，资产负债率进一步回落,国海证券,2024-09-12,煤炭行业,https://pdf.dfcfw.com/pdf/H3_AP202409121639848460_1.pdf?1726151485000.pdf
中国炼焦煤行业市场规模测算逻辑模型 头豹词条报告系列,头豹研究院,2024-09-11,煤炭行业,https://pdf.dfcfw.com/pdf/H3_AP202409111639839376_1.pdf?1726086669000.pdf
煤炭行业周报：中下游港口库存回落，煤价窄幅震荡,山西证券,2024-09-10,煤炭行业,https://pdf.dfcfw.com/pdf/H3_AP202409101639804974_1.pdf?1725952359000.pdf
煤炭行业周报：需求边际好转，预期有望改善,中泰证券,2024-09-09,煤炭行业,https://pdf.dfcfw.com/pdf/H3_AP202409091639788265_1.pdf?1725872062000.pdf
煤炭行业周报：传统需求淡季，煤价震荡运行,华龙证券,2024-09-09,煤炭行业,https://pdf.dfcfw.com/pdf/H3_AP202409091639797293_1.pdf?1725905165000.pdf
煤炭行业周报：动力煤下行趋势或缓解，焦煤预期兑现或成未来走势主要看点,大同证券,2024-09-09,煤炭行业,https://pdf.dfcfw.com/pdf/H3_AP202409091639798758_1.pdf?1725905198000.pdf
煤炭开采行业周报：动力煤产业链持续去库存，打消市场对价格过度调整担忧,国海证券,2024-09-08,煤炭行业,https://pdf.dfcfw.com/pdf/H3_AP202409081639786884_1.pdf?1725830462000.pdf
煤炭行业周报：日耗高位持续去库，煤炭高股息且底部价值凸显,开源证券,2024-09-08,煤炭行业,https://pdf.dfcfw.com/pdf/H3_AP202409081639786373_1.pdf?1725817671000.pdf
煤炭行业2024年半年报总结：煤价回落致业绩环比下滑，持仓市值环比提升,民生证券,2024-09-08,煤炭行业,https://pdf.dfcfw.com/pdf/H3_AP202409081639786023_1.pdf?1725802898000.pdf
煤炭行业周报：破解“近忧远虑”，又一煤企探索“煤电联营”,国投证券,2024-09-08,煤炭行业,https://pdf.dfcfw.com/pdf/H3_AP202409081639786747_1.pdf?1725821896000.pdf
海外资本积极布局焦煤资源，看好其长期战略投资价值,信达证券,2024-09-07,煤炭行业,https://pdf.dfcfw.com/pdf/H3_AP202409071639785366_1.pdf?1725733846000.pdf
煤炭开采行业跟踪周报：传统淡季来临煤炭需求堪忧，但库存下降有利于支撑煤价,东吴证券,2024-09-07,煤炭行业,https://pdf.dfcfw.com/pdf/H3_AP202409071639785386_1.pdf?1725789490000.pdf
煤炭周报：火电高位叠加化工向好，动力煤开启涨价周期,民生证券,2024-09-07,煤炭行业,https://pdf.dfcfw.com/pdf/H3_AP202409071639785384_1.pdf?1725734608000.pdf
煤炭行业2024年中报业绩综述：业绩同比承压，动力煤板块表现较好,东莞证券,2024-09-06,煤炭行业,https://pdf.dfcfw.com/pdf/H3_AP202409061639778581_1.pdf?1725650908000.pdf
煤炭开采2024中报综述：煤企向合理且可持续高盈利转型，煤炭价值仍凸显,开源证券,2024-09-04,煤炭行业,https://pdf.dfcfw.com/pdf/H3_AP202409041639735983_1.pdf?1725472633000.pdf
煤炭行业周报：供需继续改善，煤价整体企稳回升,山西证券,2024-09-03,煤炭行业,https://pdf.dfcfw.com/pdf/H3_AP202409031639703197_1.pdf?1725350567000.pdf
煤炭行业周报：整体预期短期向好，行业有望触底反弹,大同证券,2024-09-03,煤炭行业,https://pdf.dfcfw.com/pdf/H3_AP202409031639712135_1.pdf?1725378452000.pdf
煤炭行业周报：钢材市场成交转好，焦煤开启触底反弹,华龙证券,2024-09-03,煤炭行业,https://pdf.dfcfw.com/pdf/H3_AP202409031639718207_1.pdf?1725396930000.pdf
煤炭行业周报：中期分红渐成趋势，煤炭高股息且底部价值凸显行业周报,开源证券,2024-09-02,煤炭行业,https://pdf.dfcfw.com/pdf/H3_AP202409021639683249_1.pdf?1725267092000.pdf
煤炭行业：秋季开工需求边际好转，煤炭价格有望重拾升势,中泰证券,2024-09-02,煤炭行业,https://pdf.dfcfw.com/pdf/H3_AP202409021639684089_1.pdf?1725269123000.pdf
煤炭开采行业周报：动力煤延续去库；焦煤价格探底回升；低位煤炭股值得把握,国海证券,2024-09-02,煤炭行业,https://pdf.dfcfw.com/pdf/H3_AP202409021639689014_1.pdf?1725296839000.pdf
焦煤价格有望止跌企稳，长期看优质主焦煤供应仍稀缺,信达证券,2024-09-01,煤炭行业,https://pdf.dfcfw.com/pdf/H3_AP202409011639679368_1.pdf?1725192720000.pdf
煤炭行业双周报：电厂日耗见顶下行，关注非电需求,东莞证券,2024-09-01,煤炭行业,https://pdf.dfcfw.com/pdf/H3_AP202409011639681861_1.pdf?1725229710000.pdf
煤炭开采行业跟踪周报：沿海上下游库存数据同比持平，有利于支撑煤价,东吴证券,2024-09-01,煤炭行业,https://pdf.dfcfw.com/pdf/H3_AP202409011639679420_1.pdf?1725202689000.pdf
煤炭周报：港口库存去化，动力煤止跌反弹,德邦证券,2024-09-01,煤炭行业,https://pdf.dfcfw.com/pdf/H3_AP202409011639681037_1.pdf?1725274328000.pdf
煤炭周报：煤价企稳，板块延续业绩稳健+高回报,民生证券,2024-08-31,煤炭行业,https://pdf.dfcfw.com/pdf/H3_AP202408311639678074_1.pdf?1725146910000.pdf
煤炭行业2024年中期策略：复苏打破供需双弱格局，新时代煤炭估值体系渐成,德邦证券,2024-08-29,煤炭行业,https://pdf.dfcfw.com/pdf/H3_AP202408291639581403_1.pdf?1724967965000.pdf
煤炭行业周报：行业表现相对平稳，红利属性依然占优,大同证券,2024-08-28,煤炭行业,https://pdf.dfcfw.com/pdf/H3_AP202408281639505086_1.pdf?1724831400000.pdf
煤炭进口数据拆解：7月进口继续补缺，分煤种表现结构性分化,山西证券,2024-08-28,煤炭行业,https://pdf.dfcfw.com/pdf/H3_AP202408281639531246_1.pdf?1724874957000.pdf
煤炭行业周报：下游价格回升，关注产业链需求共振,山西证券,2024-08-26,煤炭行业,https://pdf.dfcfw.com/pdf/H3_AP202408251639445198_1.pdf?1724663345000.pdf
煤炭开采行业周报：动力煤产业链继续去库存；焦煤价格有望探底；低位煤炭股值得把握,国海证券,2024-08-26,煤炭行业,https://pdf.dfcfw.com/pdf/H3_AP202408261639445451_1.pdf?1724658555000.pdf
煤炭开采行业跟踪周报：环渤海港口供需双升，市场交易改善利好煤价筑底,东吴证券,2024-08-25,煤炭行业,https://pdf.dfcfw.com/pdf/H3_AP202408251639441458_1.pdf?1724595053000.pdf
煤炭周报：板块底部渐明，重视底部布局,德邦证券,2024-08-25,煤炭行业,https://pdf.dfcfw.com/pdf/H3_AP202408251639441664_1.pdf?1724597930000.pdf
煤炭行业周报：中煤系中期分红方案落地，煤炭高股息属性凸显,开源证券,2024-08-25,煤炭行业,https://pdf.dfcfw.com/pdf/H3_AP202408251639443116_1.pdf?1724606677000.pdf
煤炭行业周报：非电需求预期改善，煤价止跌企稳在即,中泰证券,2024-08-25,煤炭行业,https://pdf.dfcfw.com/pdf/H3_AP202408251639443335_1.pdf?1724609690000.pdf
产地倒挂&库存去化，谨慎乐观看待煤价,信达证券,2024-08-24,煤炭行业,https://pdf.dfcfw.com/pdf/H3_AP202408241639439881_1.pdf?1724536837000.pdf
煤炭周报：煤价震荡偏稳，板块回调提供配置良机,民生证券,2024-08-24,煤炭行业,https://pdf.dfcfw.com/pdf/H3_AP202408241639439667_1.pdf?1724527811000.pdf
煤炭行业周报：金九银十临近，关注非电需求恢复,山西证券,2024-08-20,煤炭行业,https://pdf.dfcfw.com/pdf/H3_AP202408191639345838_1.pdf?1724139947000.pdf
煤炭月度供需数据点评：供给符合预期，制造业投资延续高增,山西证券,2024-08-20,煤炭行业,https://pdf.dfcfw.com/pdf/H3_AP202408201639359299_1.pdf?1724173135000.pdf
煤炭开采行业周报：电厂继续去库存；高度重视低位煤炭股,国海证券,2024-08-19,煤炭行业,https://pdf.dfcfw.com/pdf/H3_AP202408191639326481_1.pdf?1724053217000.pdf
煤炭行业周报：7月原煤产量增速略有下滑，关注夏末秋初水电出力情况,国投证券,2024-08-19,煤炭行业,https://pdf.dfcfw.com/pdf/H3_AP202408191639326500_1.pdf?1724059450000.pdf
煤炭开采行业动态研究：原煤日产量环比回落，火力发电降幅收窄,国海证券,2024-08-19,煤炭行业,https://pdf.dfcfw.com/pdf/H3_AP202408181639326355_1.pdf?1724055444000.pdf
煤炭开采行业跟踪周报：国内煤炭供需双弱，进口冲击导致煤价走弱,东吴证券,2024-08-18,煤炭行业,https://pdf.dfcfw.com/pdf/H3_AP202408181639323487_1.pdf?1723977276000.pdf
煤价短期承压勿忧，核心资产潜力可期,信达证券,2024-08-18,煤炭行业,https://pdf.dfcfw.com/pdf/H3_AP202408181639323918_1.pdf?1723974122000.pdf
煤炭行业周报：煤炭已处于价值底部，可积极布局,开源证券,2024-08-18,煤炭行业,https://pdf.dfcfw.com/pdf/H3_AP202408181639324906_1.pdf?1724008059000.pdf
煤炭行业周报：煤价底部有支撑，建议板块逢低配置,德邦证券,2024-08-18,煤炭行业,https://pdf.dfcfw.com/pdf/H3_AP202408181639325247_1.pdf?1724020746000.pdf
煤炭周报：业绩期将临，关注板块股息价值,民生证券,2024-08-17,煤炭行业,https://pdf.dfcfw.com/pdf/H3_AP202408171639323250_1.pdf?1723925695000.pdf
煤炭行业月报：供给增速放缓，需求预期改善,德邦证券,2024-08-16,煤炭行业,https://pdf.dfcfw.com/pdf/H3_AP202408161639311034_1.pdf?1723825981000.pdf
煤炭行业点评：能源行业产融动态报告,川财证券,2024-08-16,煤炭行业,https://pdf.dfcfw.com/pdf/H3_AP202408161639312089_1.pdf?1723827027000.pdf
煤炭行业点评：能源行业产融动态报告,川财证券,2024-08-15,煤炭行业,https://pdf.dfcfw.com/pdf/H3_AP202408151639284110_1.pdf?1723717885000.pdf
“煤电联营”专题报告：政策催化不断，煤企迎来机遇,中泰证券,2024-08-12,煤炭行业,https://pdf.dfcfw.com/pdf/H3_AP202408121639234616_1.pdf?1723456681000.pdf
煤炭行业周报：需求预期不悲观，超跌布局再提示,中泰证券,2024-08-12,煤炭行业,https://pdf.dfcfw.com/pdf/H3_AP202408121639234617_1.pdf?1723455417000.pdf
煤炭行业周报：电厂日耗或季节性见顶，焦炭三轮提降迅速落地,华福证券,2024-08-12,煤炭行业,https://pdf.dfcfw.com/pdf/H3_AP202408121639243128_1.pdf?1723490152000.pdf
煤炭开采行业周报：动力煤继续去库存；高度重视低位煤炭股,国海证券,2024-08-12,煤炭行业,https://pdf.dfcfw.com/pdf/H3_AP202408121639243137_1.pdf?1723490431000.pdf
煤炭开采行业跟踪周报：产地暴雨影响煤炭供给，对煤价行成一定支撑,东吴证券,2024-08-11,煤炭行业,https://pdf.dfcfw.com/pdf/H3_AP202408111639231011_1.pdf?1723368058000.pdf
煤炭行业周报：胜率优于赔率,山西证券,2024-08-11,煤炭行业,https://pdf.dfcfw.com/pdf/H3_AP202408111639231331_1.pdf?1723387411000.pdf
煤炭行业周报：基本面震荡磨底，建议逢低布局,德邦证券,2024-08-11,煤炭行业,https://pdf.dfcfw.com/pdf/H3_AP202408111639231479_1.pdf?1723386902000.pdf
煤炭行业周报：产业资本入局，重视煤炭股底部布局,开源证券,2024-08-11,煤炭行业,https://pdf.dfcfw.com/pdf/H3_AP202408111639232082_1.pdf?1723399314000.pdf
国际煤价创今年新高，有望支撑国内煤价企稳回升,信达证券,2024-08-10,煤炭行业,https://pdf.dfcfw.com/pdf/H3_AP202408101639230838_1.pdf?1723323954000.pdf
煤炭周报：火电增速转正，动力煤拐点将临,民生证券,2024-08-10,煤炭行业,https://pdf.dfcfw.com/pdf/H3_AP202408101639230817_1.pdf?1723322702000.pdf
煤炭行业点评报告：增持和回购，产业资本认可煤炭底部或将来临,开源证券,2024-08-09,煤炭行业,https://pdf.dfcfw.com/pdf/H3_AP202408081639206015_1.pdf?1723190928000.pdf
煤炭行业点评：能源行业产融动态报告,川财证券,2024-08-09,煤炭行业,https://pdf.dfcfw.com/pdf/H3_AP202408091639217546_1.pdf?1723220770000.pdf
企业竞争图谱：2024年智能化采矿 头豹词条报告系列,头豹研究院,2024-08-09,煤炭行业,https://pdf.dfcfw.com/pdf/H3_AP202408091639223694_1.pdf?1723233077000.pdf
中国智能化采矿行业市场规模测算逻辑模型 头豹词条报告系列,头豹研究院,2024-08-08,煤炭行业,https://pdf.dfcfw.com/pdf/H3_AP202408081639203472_1.pdf?1723146256000.pdf
煤炭行业：动力煤价上调，下游去库存明显,东兴证券,2024-08-06,煤炭行业,https://pdf.dfcfw.com/pdf/H3_AP202408061639160090_1.pdf?1722957925000.pdf
煤炭行业：独立焦企产能利用率提高，焦炭月产量增,东兴证券,2024-08-06,煤炭行业,https://pdf.dfcfw.com/pdf/H3_AP202408061639163346_1.pdf?1722962502000.pdf
煤炭行业点评：能源行业产融动态报告,川财证券,2024-08-06,煤炭行业,https://pdf.dfcfw.com/pdf/H3_AP202408061639165860_1.pdf?1722969456000.pdf
煤炭行业周报：降息叠加设备更新计划实施，关注双焦需求恢复,山西证券,2024-08-05,煤炭行业,https://pdf.dfcfw.com/pdf/H3_AP202408051639134163_1.pdf?1722843677000.pdf
煤炭行业周报：宏观预期有望改善，重视超跌布局机会,中泰证券,2024-08-05,煤炭行业,https://pdf.dfcfw.com/pdf/H3_AP202408051639138285_1.pdf?1722863572000.pdf
煤炭行业周报：高温需求带来动力煤去库希望，焦煤需求或迎来底部反弹,大同证券,2024-08-05,煤炭行业,https://pdf.dfcfw.com/pdf/H3_AP202408051639145801_1.pdf?1722880840000.pdf
煤炭行业周报：电厂日耗攀升旺季不旺，关注库存消耗情况,华福证券,2024-08-05,煤炭行业,https://pdf.dfcfw.com/pdf/H3_AP202408051639147272_1.pdf?1722891172000.pdf
煤炭行业周报：正视煤企合理可持续高盈利，煤油价格有望高位行业周报,开源证券,2024-08-04,煤炭行业,https://pdf.dfcfw.com/pdf/H3_AP202408041639133724_1.pdf?1722809933000.pdf
煤炭开采行业周报：日耗震荡库存继续去化；高度重视低位煤炭股,国海证券,2024-08-04,煤炭行业,https://pdf.dfcfw.com/pdf/H3_AP202408041639133926_1.pdf?1722849526000.pdf
煤炭开采行业跟踪周报：持续高温天气快速拉动需求，警惕进口增量降低煤价上涨动能,东吴证券,2024-08-04,煤炭行业,https://pdf.dfcfw.com/pdf/H3_AP202408041639132486_1.pdf?1722779851000.pdf
煤炭开采行业周报：煤炭板块回调迎来配置良机，重点关注炼焦煤投资机遇,信达证券,2024-08-04,煤炭行业,https://pdf.dfcfw.com/pdf/H3_AP202408041639132839_1.pdf?1722805532000.pdf
煤炭周报：日耗延续高位，板块调整后价值凸显,德邦证券,2024-08-04,煤炭行业,https://pdf.dfcfw.com/pdf/H3_AP202408041639132925_1.pdf?1722805645000.pdf
煤炭行业周报：煤、电利润分配回归至各半水平，煤电联营方向依旧值得关注,国投证券,2024-08-04,煤炭行业,https://pdf.dfcfw.com/pdf/H3_AP202408041639133361_1.pdf?1722799251000.pdf
煤炭周报：至暗时刻已过，板块迎来加仓时机,民生证券,2024-08-03,煤炭行业,https://pdf.dfcfw.com/pdf/H3_AP202408031639131730_1.pdf?1722724577000.pdf
煤炭周报：设备更新政策加码，重视焦煤底部布局,德邦证券,2024-08-01,煤炭行业,https://pdf.dfcfw.com/pdf/H3_AP202408011638808389_1.pdf?1722526774000.pdf
煤炭行业：煤价承压，下游焦企的产能利用率继续提升,东兴证券,2024-08-01,煤炭行业,https://pdf.dfcfw.com/pdf/H3_AP202408011638811357_1.pdf?1722527216000.pdf
煤炭行业点评报告：特朗普能源政策，或难以对油气煤价格产生大影响,开源证券,2024-07-31,煤炭行业,https://pdf.dfcfw.com/pdf/H3_AP202407311638787692_1.pdf?1722441951000.pdf
煤炭行业2024年半年度投资展望：低估值与高分红兼备，核心价值资产有望再起,东兴证券,2024-07-30,煤炭行业,https://pdf.dfcfw.com/pdf/H3_AP202407301638466698_1.pdf?1722352172000.pdf
煤炭行业周报：螺纹规格切换引发短期下杀，旺季价格上行值得期待,中泰证券,2024-07-29,煤炭行业,https://pdf.dfcfw.com/pdf/H3_AP202407291638416026_1.pdf?1722244656000.pdf
煤炭行业周报：高温再袭动力煤仍有上涨动力，焦炭开启首轮提降,华福证券,2024-07-29,煤炭行业,https://pdf.dfcfw.com/pdf/H3_AP202407291638419265_1.pdf?1722261502000.pdf
煤炭开采行业周报：动力煤基本面边际继续向好；高度重视低位煤炭股,国海证券,2024-07-29,煤炭行业,https://pdf.dfcfw.com/pdf/H3_AP202407281638401395_1.pdf?1722260472000.pdf
煤炭行业点评：能源行业产融动态报告,川财证券,2024-07-29,煤炭行业,https://pdf.dfcfw.com/pdf/H3_AP202407291638435426_1.pdf?1722281066000.pdf
煤炭行业周报：欧洲动力煤价格回涨,山西证券,2024-07-28,煤炭行业,https://pdf.dfcfw.com/pdf/H3_AP202407281638398612_1.pdf?1722260201000.pdf
煤炭行业周报：电厂日耗持续上行，合理可持续高盈利支持高股息行业周报,开源证券,2024-07-28,煤炭行业,https://pdf.dfcfw.com/pdf/H3_AP202407281638399216_1.pdf?1722193377000.pdf
煤炭开采行业周报：全球煤炭需求有望小幅增长，煤价中枢高位趋势未变,信达证券,2024-07-28,煤炭行业,https://pdf.dfcfw.com/pdf/H3_AP202407281638393829_1.pdf?1722259690000.pdf
煤炭开采行业跟踪周报：需求持续兑现但下游采购仍旧消极，煤价震荡运行,东吴证券,2024-07-27,煤炭行业,https://pdf.dfcfw.com/pdf/H3_AP202407271638380619_1.pdf?1722123328000.pdf
煤炭周报：压力时刻已过，动力煤价格企稳反弹,民生证券,2024-07-27,煤炭行业,https://pdf.dfcfw.com/pdf/H3_AP202407271638380873_1.pdf?1722124324000.pdf
煤炭行业点评：能源行业产融动态报告,川财证券,2024-07-26,煤炭行业,https://pdf.dfcfw.com/pdf/H3_AP202407261638327404_1.pdf?1721987002000.pdf
煤炭进口数据拆解：6月进口继续补缺，关注政策方向变化,山西证券,2024-07-26,煤炭行业,https://pdf.dfcfw.com/pdf/H3_AP202407261638332008_1.pdf?1721999084000.pdf
煤炭行业月报：煤矿复产原煤产量回升，水电出力提升压制火电,华福证券,2024-07-26,煤炭行业,https://pdf.dfcfw.com/pdf/H3_AP202407261638345440_1.pdf?1722018941000.pdf
煤炭开采行业深度报告：煤炭黄金时代2.0，向合理且可持续高盈利转型,开源证券,2024-07-25,煤炭行业,https://pdf.dfcfw.com/pdf/H3_AP202407251638287137_1.pdf?1721898047000.pdf
煤炭行业点评：能源行业产融动态报告,川财证券,2024-07-25,煤炭行业,https://pdf.dfcfw.com/pdf/H3_AP202407251638287075_1.pdf?1721899880000.pdf
煤炭行业点评：能源行业产融动态报告,川财证券,2024-07-25,煤炭行业,https://pdf.dfcfw.com/pdf/H3_AP202407251638288892_1.pdf?1721901737000.pdf
煤炭开采板块上半年总结及下半年展望：继续关注盈利能力好和股息率高的标的,川财证券,2024-07-25,煤炭行业,https://pdf.dfcfw.com/pdf/H3_AP202407251638291000_1.pdf?1721905335000.pdf
煤炭行业基金持仓分析：2024Q2持股数量、市值皆提升，低配幅度收窄,德邦证券,2024-07-24,煤炭行业,https://pdf.dfcfw.com/pdf/H3_AP202407241638247877_1.pdf?1721808929000.pdf
