研报名称,机构名称,发布时间,行业,研报地址
煤炭行业周报：供给收缩需求刚性，煤价震荡运行,大同证券,2026-02-10,煤炭行业,https://pdf.dfcfw.com/pdf/H3_AP202602101819849581_1.pdf?1770719149000.pdf
煤炭行业周报：印尼进口煤价中枢有望提高，稳煤价逻辑依旧,开源证券,2026-02-09,煤炭行业,https://pdf.dfcfw.com/pdf/H3_AP202602091819827545_1.pdf?1770624470000.pdf
煤炭行业周报：临近春节供应量收缩，印尼暂停现货出口催化海外煤价,山西证券,2026-02-09,煤炭行业,https://pdf.dfcfw.com/pdf/H3_AP202602091819834453_1.pdf?1770655240000.pdf
煤炭行业周报：弱法币致实物定价权提升，关注短期事件驱动影响,山西证券,2026-02-08,煤炭行业,https://pdf.dfcfw.com/pdf/H3_AP202602081819824029_1.pdf?1770545596000.pdf
煤炭月度供需数据点评：12月：政策托底煤价，供应或受约束,山西证券,2026-02-08,煤炭行业,https://pdf.dfcfw.com/pdf/H3_AP202602081819824026_1.pdf?1770547901000.pdf
煤炭行业周报：寒潮来袭，焦煤以涨为主,山西证券,2026-02-08,煤炭行业,https://pdf.dfcfw.com/pdf/H3_AP202602081819824028_1.pdf?1770545596000.pdf
煤炭开采行业2026年度策略报告：供给看政策需求看天气，紧随去库主线布局红利龙头,华源证券,2026-02-08,煤炭行业,https://pdf.dfcfw.com/pdf/H3_AP202602071819822844_1.pdf?1770559209000.pdf
煤炭开采行业：海外煤炭潜在供给收缩或不止印尼,信达证券,2026-02-08,煤炭行业,https://pdf.dfcfw.com/pdf/H3_AP202602081819825334_1.pdf?1770575951000.pdf
煤炭开采行业跟踪周报：供给现货趋紧，港口煤价小幅上涨,东吴证券,2026-02-07,煤炭行业,https://pdf.dfcfw.com/pdf/H3_AP202602071819822709_1.pdf?1770490743000.pdf
煤炭进口数据拆解：25年12月进口煤“量价齐升”，全年进口煤“量价齐跌”,山西证券,2026-02-06,煤炭行业,https://pdf.dfcfw.com/pdf/H3_AP202602061819804030_1.pdf?1770376661000.pdf
2025年四季度煤炭债复盘：财务表现仍有改善空间，供应链风险可控,山西证券,2026-02-06,煤炭行业,https://pdf.dfcfw.com/pdf/H3_AP202602061819805384_1.pdf?1770385231000.pdf
煤炭行业周报：供需格局基本稳定，价格维稳运行,山西证券,2026-02-06,煤炭行业,https://pdf.dfcfw.com/pdf/H3_AP202602061819808692_1.pdf?1770394433000.pdf
煤炭行业事件点评：印尼矿商暂停现货出口，减产落地超市场预期,山西证券,2026-02-06,煤炭行业,https://pdf.dfcfw.com/pdf/H3_AP202602061819808552_1.pdf?1770394639000.pdf
中国煤炭行业展望，2026年2月,中诚信国际,2026-02-05,煤炭行业,https://pdf.dfcfw.com/pdf/H3_AP202602051819785816_1.pdf?1770300734000.pdf
煤炭行业周报：煤价稳中有升，板块跑赢沪深300,大同证券,2026-02-03,煤炭行业,https://pdf.dfcfw.com/pdf/H3_AP202602031819536650_1.pdf?1770111314000.pdf
煤炭行业周报：煤价回归合理才是常态，稳煤价逻辑依旧,开源证券,2026-02-02,煤炭行业,https://pdf.dfcfw.com/pdf/H3_AP202602021819244105_1.pdf?1770019477000.pdf
煤炭开采行业周报：节前市场趋稳运行，全年中枢看涨可期,信达证券,2026-02-02,煤炭行业,https://pdf.dfcfw.com/pdf/H3_AP202602021819245219_1.pdf?1770019771000.pdf
煤炭开采行业跟踪周报：供给年前略有收缩，港口煤价小幅上涨,东吴证券,2026-02-01,煤炭行业,https://pdf.dfcfw.com/pdf/H3_AP202602011819031035_1.pdf?1769948210000.pdf
煤炭行业周报：动力煤价震荡回调，炼焦煤价延续上涨,大同证券,2026-01-27,煤炭行业,https://pdf.dfcfw.com/pdf/H3_AP202601271818457395_1.pdf?1769514929000.pdf
煤炭行业点评报告：2025Q4煤价环比改善，重视周期弹性,开源证券,2026-01-27,煤炭行业,https://pdf.dfcfw.com/pdf/H3_AP202601271818465573_1.pdf?1769531993000.pdf
煤炭开采行业跟踪周报：工业需求临近年关有所走弱，港口煤价下行,东吴证券,2026-01-26,煤炭行业,https://pdf.dfcfw.com/pdf/H3_AP202601261818405431_1.pdf?1769389964000.pdf
煤炭2025年四季度业绩前瞻：均价回升业绩或环比续增 供给政策持续煤价弹性可期,华源证券,2026-01-26,煤炭行业,https://pdf.dfcfw.com/pdf/H3_AP202601261818432608_1.pdf?1769453442000.pdf
煤炭行业周报：煤价动态波动中寻求合理点位，稳字是核心,开源证券,2026-01-25,煤炭行业,https://pdf.dfcfw.com/pdf/H3_AP202601251818400727_1.pdf?1769367372000.pdf
煤炭开采行业：重视优质煤化工资产带来的煤炭板块配置机遇,信达证券,2026-01-25,煤炭行业,https://pdf.dfcfw.com/pdf/H3_AP202601251818401476_1.pdf?1769370292000.pdf
煤炭行业周报：冬需旺季叠加库存去化，煤价向合理区间修复预期增强,大同证券,2026-01-22,煤炭行业,https://pdf.dfcfw.com/pdf/H3_AP202601221818263292_1.pdf?1769085850000.pdf
煤炭行业深度：弱化并非恶化，穆迪下调不改市场预期,丝路海洋(北京)科技,2026-01-22,煤炭行业,https://pdf.dfcfw.com/pdf/H3_AP202601221818276710_1.pdf?1769101934000.pdf
煤炭行业周报：2025年用电量超10万亿kwh，需求开启上行周期,海通国际,2026-01-20,煤炭行业,https://pdf.dfcfw.com/pdf/H3_AP202601201818146678_1.pdf?1768917324000.pdf
煤炭行业周报：煤价上行回归合理价格，坚定稳煤价逻辑,开源证券,2026-01-19,煤炭行业,https://pdf.dfcfw.com/pdf/H3_AP202601191818091125_1.pdf?1768818765000.pdf
煤炭开采行业跟踪周报：供增需弱，港口煤价下行,东吴证券,2026-01-18,煤炭行业,https://pdf.dfcfw.com/pdf/H3_AP202601181818070076_1.pdf?1768750240000.pdf
煤炭开采行业周报：库存去化&寒潮来临，短期煤价有望平稳偏强,信达证券,2026-01-18,煤炭行业,https://pdf.dfcfw.com/pdf/H3_AP202601181818073949_1.pdf?1768761662000.pdf
煤炭行业2026年度策略：改善可期，价值重塑,国信证券,2026-01-13,煤炭行业,https://pdf.dfcfw.com/pdf/H3_AP202601131816965601_1.pdf?1768294936000.pdf
煤炭行业周报：供给收缩叠加进口收紧，煤价反弹态势延续,大同证券,2026-01-13,煤炭行业,https://pdf.dfcfw.com/pdf/H3_AP202601131816971091_1.pdf?1768305286000.pdf
煤炭行业周报：供给收缩，关注板块补涨机会,山西证券,2026-01-13,煤炭行业,https://pdf.dfcfw.com/pdf/H3_AP202601131816982023_1.pdf?1768324432000.pdf
煤炭行业：国内炼焦煤现货价格下降，炼焦煤库存量上升,东兴证券,2026-01-13,煤炭行业,https://pdf.dfcfw.com/pdf/H3_AP202601131816982541_1.pdf?1768325154000.pdf
煤炭开采行业周报：供给约束再起，重视煤炭景气回暖与价值重估,信达证券,2026-01-12,煤炭行业,https://pdf.dfcfw.com/pdf/H3_AP202601121816932433_1.pdf?1768208760000.pdf
煤炭行业周报：反内卷再起，需求端预计26年开启上行周期,海通国际,2026-01-12,煤炭行业,https://pdf.dfcfw.com/pdf/H3_AP202601121816952167_1.pdf?1768249985000.pdf
煤炭开采行业跟踪周报：库存边际下行，煤价探涨,东吴证券,2026-01-11,煤炭行业,https://pdf.dfcfw.com/pdf/H3_AP202601111816922741_1.pdf?1768165442000.pdf
煤炭行业2026年策略报告：将反内卷进行到底,山西证券,2026-01-07,煤炭行业,https://pdf.dfcfw.com/pdf/H3_AP202601071816738934_1.pdf?1767801147000.pdf
煤炭行业周报：安监趋严+需求回暖，开年煤价迎修复行情,大同证券,2026-01-06,煤炭行业,https://pdf.dfcfw.com/pdf/H3_AP202601061815907174_1.pdf?1767694322000.pdf
煤炭进口数据拆解：25年11月进口煤价继续提升,山西证券,2025-12-30,煤炭行业,https://pdf.dfcfw.com/pdf/H3_AP202512301811221751_1.pdf?1767100053000.pdf
煤炭行业周报：年末供应收缩叠加需求回暖，价格底部区间逐步确认,大同证券,2025-12-30,煤炭行业,https://pdf.dfcfw.com/pdf/H3_AP202512301811452117_1.pdf?1767127909000.pdf
煤炭开采行业：煤炭长协与市场价倒挂，底部区间或再确认,信达证券,2025-12-29,煤炭行业,https://pdf.dfcfw.com/pdf/H3_AP202512291810402953_1.pdf?1766998180000.pdf
煤炭行业周报：11月用电量继续加速增长，需求端预计26年开启上行周期,海通国际,2025-12-29,煤炭行业,https://pdf.dfcfw.com/pdf/H3_AP202512291810690943_1.pdf?1767040811000.pdf
煤炭开采行业跟踪周报：库存持续上涨，煤价延续下行走势,东吴证券,2025-12-28,煤炭行业,https://pdf.dfcfw.com/pdf/H3_AP202512281809872153_1.pdf?1766930096000.pdf
煤炭行业周度观察,国新证券股份,2025-12-27,煤炭行业,https://pdf.dfcfw.com/pdf/H3_AP202512271809096190_1.pdf?1766831580000.pdf
煤炭行业：国内动力煤价跌，六大发电集团日均耗煤量上升,东兴证券,2025-12-24,煤炭行业,https://pdf.dfcfw.com/pdf/H3_AP202512241807316987_1.pdf?1766606200000.pdf
煤炭行业周报：政策托底+需求旺季支撑，煤价回调后具备修复空间,大同证券,2025-12-23,煤炭行业,https://pdf.dfcfw.com/pdf/H3_AP202512231806430069_1.pdf?1766495527000.pdf
煤炭行业周报：煤价有底，预计26年开启需求上行周期,海通国际,2025-12-23,煤炭行业,https://pdf.dfcfw.com/pdf/H3_AP202512231806452047_1.pdf?1766499336000.pdf
煤炭行业2026年度信用风险展望（2025年12月）,联合资信评估,2025-12-23,煤炭行业,https://pdf.dfcfw.com/pdf/H3_AP202512231806565382_1.pdf?1766515293000.pdf
煤炭行业周报：重视煤价合理才是常态，稳煤价逻辑依旧,开源证券,2025-12-22,煤炭行业,https://pdf.dfcfw.com/pdf/H3_AP202512221805593949_1.pdf?1766390642000.pdf
煤炭行业2026年策略：“反内卷”催化产能收缩，高分红彰显中期投资价值,东兴证券,2025-12-22,煤炭行业,https://pdf.dfcfw.com/pdf/H3_AP202512221805714259_1.pdf?1766406416000.pdf
煤炭开采行业跟踪周报：气温偏高需求疲弱，煤价延续下行走势,东吴证券,2025-12-21,煤炭行业,https://pdf.dfcfw.com/pdf/H3_AP202512211805087222_1.pdf?1766327052000.pdf
煤炭开采行业周报：市场延续弱势，筑底预期趋强,信达证券,2025-12-21,煤炭行业,https://pdf.dfcfw.com/pdf/H3_AP202512211805241083_1.pdf?1766346404000.pdf
环保行业点评报告：煤炭清洁高效利用新标准出台，产业链或迎“结构优化，质效升级”阶段,信达证券,2025-12-20,煤炭行业,https://pdf.dfcfw.com/pdf/H3_AP202512201804495937_1.pdf?1766251186000.pdf
煤炭行业周报：动力煤价回调待企稳，炼焦煤价稳中有支撑,大同证券,2025-12-18,煤炭行业,https://pdf.dfcfw.com/pdf/H3_AP202512181802915177_1.pdf?1766053517000.pdf
煤炭月度供需数据点评：11月：煤价环比上涨，反内卷初心未变,山西证券,2025-12-17,煤炭行业,https://pdf.dfcfw.com/pdf/H3_AP202512171802256201_1.pdf?1765973152000.pdf
煤炭行业周报：AI缺电瓶颈日益突出，关注全球能源格局下煤炭资产价值重估,海通国际,2025-12-16,煤炭行业,https://pdf.dfcfw.com/pdf/H3_AP202512161801457376_1.pdf?1765876432000.pdf
