研报名称,机构名称,发布时间,行业,研报地址
煤炭中期策略报告：稳中求进,山西证券,2024-06-27,煤炭行业,https://pdf.dfcfw.com/pdf/H3_AP202406271636960474_1.pdf?1719511466000.pdf
煤炭2024中期策略报告：新疆煤炭产业发展形势与机遇,信达证券,2024-06-26,煤炭行业,https://pdf.dfcfw.com/pdf/H3_AP202406261636906071_1.pdf?1719408488000.pdf
煤炭行业点评：能源行业产融动态报告,川财证券,2024-06-25,煤炭行业,https://pdf.dfcfw.com/pdf/H3_AP202406251636862052_1.pdf?1719331706000.pdf
煤炭进口数据拆解：5月进口继续补缺，关注山西复产进度,山西证券,2024-06-25,煤炭行业,https://pdf.dfcfw.com/pdf/H3_AP202406251636863885_1.pdf?1719320565000.pdf
煤炭行业周报：煤焦弱稳运行，关注经济与度峰需求拐点,山西证券,2024-06-24,煤炭行业,https://pdf.dfcfw.com/pdf/H3_AP202406241636806896_1.pdf?1719226978000.pdf
煤炭行业周报：高温来袭煤价易涨难跌，板块向好趋势不改,德邦证券,2024-06-24,煤炭行业,https://pdf.dfcfw.com/pdf/H3_AP202406241636809524_1.pdf?1719228227000.pdf
煤炭行业周报：南北气温分化高库存压制动力煤，需求淡季铁水高位炼焦煤涨跌两难,华福证券,2024-06-24,煤炭行业,https://pdf.dfcfw.com/pdf/H3_AP202406241636814618_1.pdf?1719229759000.pdf
煤炭行业周报：电厂日耗提升延续，煤炭价格支撑较强,中泰证券,2024-06-24,煤炭行业,https://pdf.dfcfw.com/pdf/H3_AP202406241636809593_1.pdf?1719214901000.pdf
煤炭行业周报：5月原煤产量恢复仍不理想，静待旺季需求抬升,海通国际,2024-06-24,煤炭行业,https://pdf.dfcfw.com/pdf/H3_AP202406241636819457_1.pdf?1719245259000.pdf
煤炭开采行业跟踪周报：梅雨季华东气温偏低，抑制旺季煤炭需求，煤价上涨时间延后,东吴证券,2024-06-23,煤炭行业,https://pdf.dfcfw.com/pdf/H3_AP202406231636803192_1.pdf?1719173706000.pdf
煤炭行业周报：“稳产保供”仍在路上，迎峰度夏静待电煤需求释放,国投证券,2024-06-23,煤炭行业,https://pdf.dfcfw.com/pdf/H3_AP202406231636803721_1.pdf?1719177323000.pdf
煤炭行业周报（6月第4周）：电煤消费环比改善，同比仍偏低,国信证券,2024-06-23,煤炭行业,https://pdf.dfcfw.com/pdf/H3_AP202406231636798314_1.pdf?1719147703000.pdf
煤炭行业周报：电厂日耗及铁水日均产量续涨，煤价有望筑底反弹,开源证券,2024-06-23,煤炭行业,https://pdf.dfcfw.com/pdf/H3_AP202406231636800837_1.pdf?1719161392000.pdf
煤炭开采行业周报：日耗缓慢提升，煤价求稳,国海证券,2024-06-23,煤炭行业,https://pdf.dfcfw.com/pdf/H3_AP202406231636805023_1.pdf?1719223238000.pdf
煤炭开采行业周报：电煤日耗环比改善，煤价易涨难跌,信达证券,2024-06-22,煤炭行业,https://pdf.dfcfw.com/pdf/H3_AP202406221636789997_1.pdf?1719137377000.pdf
煤炭周报：供给延续收缩，迎峰度夏有望开启煤价加速上涨行情,民生证券,2024-06-22,煤炭行业,https://pdf.dfcfw.com/pdf/H3_AP202406221636789552_1.pdf?1719082460000.pdf
煤炭行业点评：能源行业产融动态报告,川财证券,2024-06-21,煤炭行业,https://pdf.dfcfw.com/pdf/H3_AP202406211636745139_1.pdf?1718966897000.pdf
煤炭行业点评：能源行业产融动态报告,川财证券,2024-06-21,煤炭行业,https://pdf.dfcfw.com/pdf/H3_AP202406211636749506_1.pdf?1718962405000.pdf
煤炭月度供需数据点评：价格环比上涨，制造业投资延续高增,山西证券,2024-06-19,煤炭行业,https://pdf.dfcfw.com/pdf/H3_AP202406181636658508_1.pdf?1718780622000.pdf
5月煤炭供需数据全面解读：原煤生产降幅继续收窄，规上工业电力生产保持稳定，火力发电由增转降,国海证券,2024-06-19,煤炭行业,https://pdf.dfcfw.com/pdf/H3_AP202406181636668619_1.pdf?1718780337000.pdf
煤炭行业月报：国内供给维持弱势，需求有望加速释放,德邦证券,2024-06-18,煤炭行业,https://pdf.dfcfw.com/pdf/H3_AP202406181636588355_1.pdf?1718700756000.pdf
煤炭行业周报：高温持续催化，板块上行可期,中泰证券,2024-06-17,煤炭行业,https://pdf.dfcfw.com/pdf/H3_AP202406171636463145_1.pdf?1718613202000.pdf
煤炭周报：铁水产量年内新高，看好焦煤价格反弹,德邦证券,2024-06-17,煤炭行业,https://pdf.dfcfw.com/pdf/H3_AP202406171636463273_1.pdf?1718616606000.pdf
煤炭行业周报：高温天气回归，迎峰煤炭需求仍将可期,山西证券,2024-06-17,煤炭行业,https://pdf.dfcfw.com/pdf/H3_AP202406171636465610_1.pdf?1718620617000.pdf
煤炭开采行业周报：北方高温拉动电厂日耗，迎峰度夏需求有强支撑,国海证券,2024-06-17,煤炭行业,https://pdf.dfcfw.com/pdf/H3_AP202406171636460271_1.pdf?1718616830000.pdf
煤炭行业周报（6月第3周）：日耗环比回升，关注库存变化,国信证券,2024-06-17,煤炭行业,https://pdf.dfcfw.com/pdf/H3_AP202406171636462360_1.pdf?1718619688000.pdf
煤炭行业周报：需求改善动力煤稳中向好，多空交织炼焦煤维稳运行,华福证券,2024-06-17,煤炭行业,https://pdf.dfcfw.com/pdf/H3_AP202406171636481625_1.pdf?1718642237000.pdf
煤炭行业2024年中期投资策略：供给扰动，动力煤需求缺口扩大,民生证券,2024-06-16,煤炭行业,https://pdf.dfcfw.com/pdf/H3_AP202406151636452847_1.pdf?1718532880000.pdf
煤炭开采行业周报：电煤日耗环比上升，煤价有望稳中偏强,信达证券,2024-06-16,煤炭行业,https://pdf.dfcfw.com/pdf/H3_AP202406161636456586_1.pdf?1718546682000.pdf
煤炭行业周报：动力煤价窄幅震荡，“纠结”时点下继,国投证券,2024-06-16,煤炭行业,https://pdf.dfcfw.com/pdf/H3_AP202406161636457505_1.pdf?1718553981000.pdf
煤炭行业周报：迎峰度夏致日耗大涨，铁水日均产量上行凸显韧性,开源证券,2024-06-16,煤炭行业,https://pdf.dfcfw.com/pdf/H3_AP202406161636457548_1.pdf?1718561109000.pdf
煤炭开采行业跟踪周报：拉尼娜气候双刃剑，前期导致华南气温偏低，抑制旺季煤炭需求，煤价上涨时间延后,东吴证券,2024-06-16,煤炭行业,https://pdf.dfcfw.com/pdf/H3_AP202406161636458242_1.pdf?1718560727000.pdf
煤炭周报：高温加持煤价易涨难跌，看好迎峰度夏旺季需求,民生证券,2024-06-15,煤炭行业,https://pdf.dfcfw.com/pdf/H3_AP202406151636451729_1.pdf?1718478863000.pdf
煤炭行业周报：北方高温来袭，5月进口量如期下降,海通国际,2024-06-12,煤炭行业,https://pdf.dfcfw.com/pdf/H3_AP202406121635989003_1.pdf?1718197611000.pdf
煤炭行业周报（6月第2周）：煤价维持高位震荡，旺季日耗逐步回升,国信证券,2024-06-11,煤炭行业,https://pdf.dfcfw.com/pdf/H3_AP202406111635940836_1.pdf?1718091765000.pdf
煤炭行业周报：海外煤价上行，国内迎峰煤炭需求增量可期,山西证券,2024-06-11,煤炭行业,https://pdf.dfcfw.com/pdf/H3_AP202406111635949255_1.pdf?1718105242000.pdf
煤炭行业周报：迎峰度夏开启，看好弹性标的,德邦证券,2024-06-11,煤炭行业,https://pdf.dfcfw.com/pdf/H3_AP202406111635961425_1.pdf?1718103515000.pdf
煤炭行业周报：6月煤价有望走强，煤炭股迎新一轮上行周期布局机会,华福证券,2024-06-11,煤炭行业,https://pdf.dfcfw.com/pdf/H3_AP202406111635957919_1.pdf?1718120906000.pdf
煤炭开采行业周报：传统消费旺季逐渐临近，煤炭价格有望震荡,信达证券,2024-06-10,煤炭行业,https://pdf.dfcfw.com/pdf/H3_AP202406101635914911_1.pdf?1718020829000.pdf
煤炭开采行业跟踪周报：迎峰度夏旺季来临，静待旺季煤价上涨,东吴证券,2024-06-10,煤炭行业,https://pdf.dfcfw.com/pdf/H3_AP202406101635914913_1.pdf?1718020682000.pdf
煤炭行业周报：节能降碳下钢铁成本刚性望增强，高温来袭日耗抬升提振动煤价格,中泰证券,2024-06-10,煤炭行业,https://pdf.dfcfw.com/pdf/H3_AP202406101635916069_1.pdf?1718033191000.pdf
煤炭开采行业周报：煤价平稳，重视两个投资方向,国海证券,2024-06-10,煤炭行业,https://pdf.dfcfw.com/pdf/H3_AP202406101635920705_1.pdf?1718095588000.pdf
煤炭行业周报：小煤种（无烟和喷吹）持续大涨，晋陕蒙开工率仍低,开源证券,2024-06-10,煤炭行业,https://pdf.dfcfw.com/pdf/H3_AP202406101635921946_1.pdf?1718092280000.pdf
煤炭周报：煤价延续震荡，进口煤量环比下降拐点已现,民生证券,2024-06-08,煤炭行业,https://pdf.dfcfw.com/pdf/H3_AP202406081635913637_1.pdf?1717879621000.pdf
煤炭行业周报：供需紧平衡延续，煤价将震荡上行,中泰证券,2024-06-03,煤炭行业,https://pdf.dfcfw.com/pdf/H3_AP202406031635235323_1.pdf?1717407724000.pdf
煤炭行业月报（6月第1周）：关注旺季兑现，气温和水电是核心变量,国信证券,2024-06-03,煤炭行业,https://pdf.dfcfw.com/pdf/H3_AP202406031635239055_1.pdf?1717405842000.pdf
煤炭周报：能耗政策不改煤炭股长期价值逻辑,德邦证券,2024-06-03,煤炭行业,https://pdf.dfcfw.com/pdf/H3_AP202406031635239061_1.pdf?1717407922000.pdf
煤炭行业周报：迎峰度夏囤煤或实质启动，煤价有望再度走强,华福证券,2024-06-03,煤炭行业,https://pdf.dfcfw.com/pdf/H3_AP202406031635256610_1.pdf?1717431783000.pdf
煤炭行业周报：节能降碳方案利好煤电一体化，中煤新分红方案彰显央企价值,山西证券,2024-06-02,煤炭行业,https://pdf.dfcfw.com/pdf/H3_AP202406021635196766_1.pdf?1717339855000.pdf
煤炭开采行业周报：中煤能源拟派特别分红，煤炭股具备高投资价值,国海证券,2024-06-02,煤炭行业,https://pdf.dfcfw.com/pdf/H3_AP202406021635201180_1.pdf?1717348997000.pdf
煤炭开采行业跟踪周报：迎峰度夏旺季临近，静待旺季煤价上涨,东吴证券,2024-06-02,煤炭行业,https://pdf.dfcfw.com/pdf/H3_AP202406021635206604_1.pdf?1717399899000.pdf
煤炭行业周报：煤价震荡盘整，“纠结”的时点下，“煤电一体化”或依旧是优质选择,国投证券,2024-06-02,煤炭行业,https://pdf.dfcfw.com/pdf/H3_AP202406021635206628_1.pdf?1717356323000.pdf
煤炭行业周报：炼焦煤大涨和无烟煤续涨，中煤能源预告特别派息行业周报,开源证券,2024-06-02,煤炭行业,https://pdf.dfcfw.com/pdf/H3_AP202406021635211245_1.pdf?1717400182000.pdf
煤炭周报：煤价震荡盘整，涨价有望提前启动,民生证券,2024-06-01,煤炭行业,https://pdf.dfcfw.com/pdf/H3_AP202406011635152286_1.pdf?1717271334000.pdf
煤炭开采：国务院印发节能降碳方案，严格合理控制煤炭消费,信达证券,2024-06-01,煤炭行业,https://pdf.dfcfw.com/pdf/H3_AP202406011635152301_1.pdf?1717327618000.pdf
煤炭行业月报：原煤产量降幅收窄，关注山西增产进程,华福证券,2024-05-30,煤炭行业,https://pdf.dfcfw.com/pdf/H3_AP202405301634933490_1.pdf?1717076763000.pdf
2024年4月煤炭行业月度数据,国信证券,2024-05-30,煤炭行业,https://pdf.dfcfw.com/pdf/H3_AP202405301634958383_1.pdf?1717099843000.pdf
煤炭行业周报：港口煤价年内同比首次转正，煤焦短期或稳中偏强,海通国际,2024-05-28,煤炭行业,https://pdf.dfcfw.com/pdf/H3_AP202405281634735788_1.pdf?1716888073000.pdf
煤炭行业周报：南方大范围出现降雨，焦炭第一轮提降落地,华福证券,2024-05-28,煤炭行业,https://pdf.dfcfw.com/pdf/H3_AP202405281634735985_1.pdf?1716895341000.pdf
煤炭行业周报：运价先行，迎峰度夏用煤需求提升,山西证券,2024-05-27,煤炭行业,https://pdf.dfcfw.com/pdf/H3_AP202405261634693982_1.pdf?1716801262000.pdf
煤炭行业周报：需求如期释放，煤价启动上涨,中泰证券,2024-05-27,煤炭行业,https://pdf.dfcfw.com/pdf/H3_AP202405271634705638_1.pdf?1716804135000.pdf
煤炭行业点评：供需两侧政策加持，重点看好山西煤炭股,德邦证券,2024-05-26,煤炭行业,https://pdf.dfcfw.com/pdf/H3_AP202405261634684375_1.pdf?1716716579000.pdf
煤炭开采行业周报：煤价如期上涨，基本面持续向好,信达证券,2024-05-26,煤炭行业,https://pdf.dfcfw.com/pdf/H3_AP202405261634684408_1.pdf?1716719440000.pdf
煤炭开采行业跟踪周报：迎峰度夏旺季临近，煤价震荡上行,东吴证券,2024-05-26,煤炭行业,https://pdf.dfcfw.com/pdf/H3_AP202405261634685620_1.pdf?1716722437000.pdf
煤炭开采行业周报：供应紧，旺季需求有望上行，动力煤预期向好,国海证券,2024-05-26,煤炭行业,https://pdf.dfcfw.com/pdf/H3_AP202405261634695834_1.pdf?1716801462000.pdf
煤炭行业周报：重视小煤种（喷吹和无烟）涨价，高股息和周期兼具行业周报,开源证券,2024-05-26,煤炭行业,https://pdf.dfcfw.com/pdf/H3_AP202405261634688505_1.pdf?1716737352000.pdf
煤炭行业周报（5月第4周）：旺季预期支撑下游采购，煤价仍有空间,国信证券,2024-05-26,煤炭行业,https://pdf.dfcfw.com/pdf/H3_AP202405261634687790_1.pdf?1716732607000.pdf
煤炭周报：需求预期升温，煤价震荡偏强,德邦证券,2024-05-26,煤炭行业,https://pdf.dfcfw.com/pdf/H3_AP202405261634690701_1.pdf?1716744129000.pdf
煤炭周报：量价齐升，重点配置板块山西煤企,民生证券,2024-05-25,煤炭行业,https://pdf.dfcfw.com/pdf/H3_AP202405251634674249_1.pdf?1716673628000.pdf
煤炭进口数据拆解：4月内需改善，进口补缺,山西证券,2024-05-23,煤炭行业,https://pdf.dfcfw.com/pdf/H3_AP202405231634393697_1.pdf?1716488929000.pdf
煤炭行业点评报告：供给克制，需求共振，攻守兼备买煤炭,中泰证券,2024-05-22,煤炭行业,https://pdf.dfcfw.com/pdf/H3_AP202405221634278809_1.pdf?1716369572000.pdf
煤炭行业周报：地产新政出台，需求预期改善,德邦证券,2024-05-20,煤炭行业,https://pdf.dfcfw.com/pdf/H3_AP202405201633849915_1.pdf?1716198698000.pdf
煤炭行业周报：地产放松进一步提振非电用煤需求，供需结构性矛盾凸显煤价预期乐观,中泰证券,2024-05-20,煤炭行业,https://pdf.dfcfw.com/pdf/H3_AP202405201633850075_1.pdf?1716198698000.pdf
煤炭行业周报（5月第3周）：地产政策发力，煤炭需求预期转好,国信证券,2024-05-20,煤炭行业,https://pdf.dfcfw.com/pdf/H3_AP202405201633850152_1.pdf?1716199093000.pdf
煤炭行业周报：山西复产，顺势而为,山西证券,2024-05-20,煤炭行业,https://pdf.dfcfw.com/pdf/H3_AP202405201633850890_1.pdf?1716199540000.pdf
煤炭月度供需数据点评：供给收缩，制造业投资延续高增,山西证券,2024-05-20,煤炭行业,https://pdf.dfcfw.com/pdf/H3_AP202405191633835922_1.pdf?1716196800000.pdf
煤炭开采行业周报：地产链政策利好频发，上游炼焦煤资源或更受益,信达证券,2024-05-20,煤炭行业,https://pdf.dfcfw.com/pdf/H3_AP202405191633829663_1.pdf?1716196582000.pdf
煤炭行业周报：“稳产保供”是主要思路，旺季来临关注电厂需求释放力度,国投证券,2024-05-20,煤炭行业,https://pdf.dfcfw.com/pdf/H3_AP202405191633838521_1.pdf?1716201525000.pdf
煤炭开采行业动态研究：煤炭供应继续收缩，火电增速提升，供需依然紧平衡,国海证券,2024-05-20,煤炭行业,https://pdf.dfcfw.com/pdf/H3_AP202405191633838542_1.pdf?1716190146000.pdf
煤炭行业周报：矿山开工有所恢复，“迎峰度夏”有望提前,华福证券,2024-05-20,煤炭行业,https://pdf.dfcfw.com/pdf/H3_AP202405201633845337_1.pdf?1716198698000.pdf
煤炭开采行业跟踪周报：煤价旺季反弹，看好煤炭板块进攻属性,东吴证券,2024-05-19,煤炭行业,https://pdf.dfcfw.com/pdf/H3_AP202405191633829659_1.pdf?1716120835000.pdf
煤炭开采行业深度报告：“疆煤外运”筑牢能源安全“压舱石”,东吴证券,2024-05-19,煤炭行业,https://pdf.dfcfw.com/pdf/H3_AP202405191633829150_1.pdf?1716121802000.pdf
煤炭开采行业周报：4月国内产量降幅收窄，火电增速加快，旺季动力煤价格预期向好,国海证券,2024-05-19,煤炭行业,https://pdf.dfcfw.com/pdf/H3_AP202405191633838538_1.pdf?1716160073000.pdf
煤炭行业周报：央行地产政策超预期，煤炭高股息与周期弹性凸显行业周报,开源证券,2024-05-19,煤炭行业,https://pdf.dfcfw.com/pdf/H3_AP202405191633831273_1.pdf?1716195462000.pdf
煤炭周报：供给收缩仍为主基调，7月中旬后煤价或迎加速上涨,民生证券,2024-05-18,煤炭行业,https://pdf.dfcfw.com/pdf/H3_AP202405181633816000_1.pdf?1716066219000.pdf
无烟煤行业研究：从地下瑰宝到清洁能源王者，引领能源革命新潮流 头豹词条报告系列,头豹研究院,2024-05-17,煤炭行业,https://pdf.dfcfw.com/pdf/H3_AP202405171633719985_1.pdf?1715974737000.pdf
煤炭开采：印尼及东南亚煤炭供需展望,信达证券,2024-05-14,煤炭行业,https://pdf.dfcfw.com/pdf/H3_AP202405141633049076_1.pdf?1715679118000.pdf
煤炭行业点评报告：煤价加速上涨，高股息与周期弹性双逻辑凸显,开源证券,2024-05-14,煤炭行业,https://pdf.dfcfw.com/pdf/H3_AP202405141633058362_1.pdf?1715705131000.pdf
煤炭周报：市场情绪转暖，煤价企稳回升,德邦证券,2024-05-13,煤炭行业,https://pdf.dfcfw.com/pdf/H3_AP202405131632930928_1.pdf?1715591053000.pdf
煤炭开采行业跟踪周报：煤价旺季反弹，看好板块进攻属性,东吴证券,2024-05-12,煤炭行业,https://pdf.dfcfw.com/pdf/H3_AP202405121632902087_1.pdf?1715506571000.pdf
煤炭行业周报：利空消退，把握煤炭配置时点,中泰证券,2024-05-12,煤炭行业,https://pdf.dfcfw.com/pdf/H3_AP202405121632915046_1.pdf?1715521094000.pdf
煤炭行业周报：备煤和非电需求集中释放，焦炭第五轮提涨搁置,华福证券,2024-05-12,煤炭行业,https://pdf.dfcfw.com/pdf/H3_AP202405121632916968_1.pdf?1715528404000.pdf
煤炭行业周报：本周煤市情绪高涨，5月关注终端需求,国投证券,2024-05-12,煤炭行业,https://pdf.dfcfw.com/pdf/H3_AP202405121632917821_1.pdf?1715531897000.pdf
煤炭行业周报：迎峰度夏补库需求启动，动力煤价上涨,山西证券,2024-05-12,煤炭行业,https://pdf.dfcfw.com/pdf/H3_AP202405121632918274_1.pdf?1715531897000.pdf
煤炭行业周报（5月第2周）：下游需求持续转好，煤价继续反弹,国信证券,2024-05-12,煤炭行业,https://pdf.dfcfw.com/pdf/H3_AP202405121632918990_1.pdf?1715533781000.pdf
煤炭开采行业周报：煤价有底，但短期仍是拉锯战,国海证券,2024-05-12,煤炭行业,https://pdf.dfcfw.com/pdf/H3_AP202405121632923565_1.pdf?1715552428000.pdf
煤炭开采行业周报： 煤价企稳回升仍具上涨趋势，供需基本面持续向好,信达证券,2024-05-12,煤炭行业,https://pdf.dfcfw.com/pdf/H3_AP202405121632916336_1.pdf?1715526675000.pdf
煤炭周报：煤价进入上行通道，7月中旬后有望加速上涨,民生证券,2024-05-11,煤炭行业,https://pdf.dfcfw.com/pdf/H3_AP202405111632901143_1.pdf?1715470836000.pdf
煤炭2023年报及2024年一季报综述：煤企盈利维持高位，分红率提升,山西证券,2024-05-10,煤炭行业,https://pdf.dfcfw.com/pdf/H3_AP202405101632824022_1.pdf?1715365718000.pdf
煤炭行业周报：电煤淡季修复焦煤提振确定，关注煤价企稳估值提升机会,华龙证券,2024-05-09,煤炭行业,https://pdf.dfcfw.com/pdf/H3_AP202405091632758910_1.pdf?1715273237000.pdf
能源开采行业2023年年报及2024年一季报总结：煤价回落致业绩短期受损，后续将迎改善,民生证券,2024-05-09,煤炭行业,https://pdf.dfcfw.com/pdf/H3_AP202405091632766186_1.pdf?1715274236000.pdf
煤炭行业2024年中期投资策略：高股息和周期弹性，煤炭核心价值再发现,开源证券,2024-05-08,煤炭行业,https://pdf.dfcfw.com/pdf/H3_AP202405081632682302_1.pdf?1715241125000.pdf
煤炭行业周报：政策预期向好，煤价易涨难跌,中泰证券,2024-05-06,煤炭行业,https://pdf.dfcfw.com/pdf/H3_AP202405061632474983_1.pdf?1715000587000.pdf
煤炭开采行业跟踪周报：煤价旺季反弹可期，看好板块进攻属性,东吴证券,2024-05-06,煤炭行业,https://pdf.dfcfw.com/pdf/H3_AP202405061632459523_1.pdf?1715002596000.pdf
煤炭行业月度策略（5月第1周）：假期港口去库加快，5月煤价震荡偏强,国信证券,2024-05-06,煤炭行业,https://pdf.dfcfw.com/pdf/H3_AP202405061632467863_1.pdf?1714988175000.pdf
煤炭行业周报：终端需求提振，双焦震荡偏强,德邦证券,2024-05-06,煤炭行业,https://pdf.dfcfw.com/pdf/H3_AP202405061632474705_1.pdf?1715003528000.pdf
煤炭开采行业2023年报及2024年一季报综述：淡化短期盈利波动，把握板块长期价值,国海证券,2024-05-06,煤炭行业,https://pdf.dfcfw.com/pdf/H3_AP202405061632491832_1.pdf?1715024593000.pdf
2023年报及2024一季报综述：煤价回调是向合理可持续高盈利转型，煤炭仍可期,开源证券,2024-05-05,煤炭行业,https://pdf.dfcfw.com/pdf/H3_AP202405051632456806_1.pdf?1714985048000.pdf
2024年煤炭行业二季度展望,大公国际,2024-04-30,煤炭行业,https://pdf.dfcfw.com/pdf/H3_AP202404301631757676_1.pdf?1714475347000.pdf
煤炭行业周报：需求边际持续改善，焦煤继续偏强运行,国投证券,2024-04-29,煤炭行业,https://pdf.dfcfw.com/pdf/H3_AP202404291631555563_1.pdf?1714381846000.pdf
煤炭行业周报：年报逐步收官，关注下游需求恢复,山西证券,2024-04-29,煤炭行业,https://pdf.dfcfw.com/pdf/H3_AP202404291631565588_1.pdf?1714389026000.pdf
2024年3月煤炭行业月度数据,国信证券,2024-04-29,煤炭行业,https://pdf.dfcfw.com/pdf/H3_AP202404291631568579_1.pdf?1714389819000.pdf
煤炭行业深度报告：火电碳达峰时间或比预期来的更晚,开源证券,2024-04-29,煤炭行业,https://pdf.dfcfw.com/pdf/H3_AP202404291631674436_1.pdf?1714430750000.pdf
煤炭周报：节前补库释放，煤炭价格反弹,德邦证券,2024-04-29,煤炭行业,https://pdf.dfcfw.com/pdf/H3_AP202404291631573646_1.pdf?1714407115000.pdf
煤炭周报：煤价可能节后启动，重视板块回调机会,民生证券,2024-04-28,煤炭行业,https://pdf.dfcfw.com/pdf/H3_AP202404281631515875_1.pdf?1714299639000.pdf
煤炭行业周报：大秦线提前结束检修，焦炭第三轮提涨落地,华福证券,2024-04-28,煤炭行业,https://pdf.dfcfw.com/pdf/H3_AP202404281631547367_1.pdf?1714329631000.pdf
煤炭开采行业周报：铁水产量稳增，焦煤行业终端补库需求较强,国海证券,2024-04-28,煤炭行业,https://pdf.dfcfw.com/pdf/H3_AP202404281631552951_1.pdf?1714378771000.pdf
煤炭行业周报（4月第5周）：下游需求明显好转，焦煤有望继续补库,国信证券,2024-04-28,煤炭行业,https://pdf.dfcfw.com/pdf/H3_AP202404281631519212_1.pdf?1714311194000.pdf
煤炭行业周报：多重利好因素共振，焦煤价格持续走强,中泰证券,2024-04-28,煤炭行业,https://pdf.dfcfw.com/pdf/H3_AP202404281631519380_1.pdf?1714310378000.pdf
煤炭开采行业跟踪周报：静待煤价旺季反弹，看好板块进攻属性,东吴证券,2024-04-28,煤炭行业,https://pdf.dfcfw.com/pdf/H3_AP202404281631519402_1.pdf?1714316320000.pdf
煤企一季报利空落地，底部机会值得重点布局煤炭开采,信达证券,2024-04-28,煤炭行业,https://pdf.dfcfw.com/pdf/H3_AP202404281631539746_1.pdf?1714323553000.pdf
煤炭行业周报：煤价维持向好态势，煤炭核心价值资产有望再起,开源证券,2024-04-28,煤炭行业,https://pdf.dfcfw.com/pdf/H3_AP202404281631542877_1.pdf?1714325222000.pdf
煤炭开采行业专题研究：2024Q1主动型基金在煤炭行业持仓比例进一步提升,国海证券,2024-04-26,煤炭行业,https://pdf.dfcfw.com/pdf/H3_AP202404261631368413_1.pdf?1714124208000.pdf
传统能源产业链周报：4月第二周山西省煤炭价格环比下跌,川财证券,2024-04-26,煤炭行业,https://pdf.dfcfw.com/pdf/H3_AP202404261631394402_1.pdf?1714158457000.pdf
煤炭行业基金持仓分析：2024Q1配置小幅提升，低配幅度扩大,德邦证券,2024-04-25,煤炭行业,https://pdf.dfcfw.com/pdf/H3_AP202404251631265235_1.pdf?1714053362000.pdf
煤炭进口数据拆解：3月煤炭进口显著放缓,山西证券,2024-04-25,煤炭行业,https://pdf.dfcfw.com/pdf/H3_AP202404251631316952_1.pdf?1714078579000.pdf
煤炭行业报告：动力煤增加进口量，炼焦煤开始去库存,东兴证券,2024-04-24,煤炭行业,https://pdf.dfcfw.com/pdf/H3_AP202404241631117557_1.pdf?1713964204000.pdf
煤炭行业月报：煤炭供给收缩，需求有待启动,华福证券,2024-04-23,煤炭行业,https://pdf.dfcfw.com/pdf/H3_AP202404231631034444_1.pdf?1713865303000.pdf
能源周观点：伊朗低调回应袭击，油价风险溢价缩小,国金证券,2024-04-23,煤炭行业,https://pdf.dfcfw.com/pdf/H3_AP202404231631067381_1.pdf?1713902883000.pdf
煤炭行业周报：一季度煤炭内产降幅明显，供给约束下板块投资机会持续凸显,国投证券,2024-04-22,煤炭行业,https://pdf.dfcfw.com/pdf/H3_AP202404221630938774_1.pdf?1713747667000.pdf
煤炭行业周报（4月第4周）：动力煤价底部确认，焦煤空间取决于需求,国信证券,2024-04-22,煤炭行业,https://pdf.dfcfw.com/pdf/H3_AP202404221630945645_1.pdf?1713776869000.pdf
煤炭行业周报：基建预期提振叠加低库存，炼焦煤价格如期反弹,山西证券,2024-04-22,煤炭行业,https://pdf.dfcfw.com/pdf/H3_AP202404221630955158_1.pdf?1713781437000.pdf
煤炭行业周报：焦炭开启提涨，关注钢厂复产节奏,华福证券,2024-04-22,煤炭行业,https://pdf.dfcfw.com/pdf/H3_AP202404221630958582_1.pdf?1713793034000.pdf
煤炭周报：煤价底部区域探明，看好5月下旬上涨行情,民生证券,2024-04-21,煤炭行业,https://pdf.dfcfw.com/pdf/H3_AP202404211630836082_1.pdf?1713661159000.pdf
煤炭行业周报：基建开工或将加速，煤价有望震荡走高,中泰证券,2024-04-21,煤炭行业,https://pdf.dfcfw.com/pdf/H3_AP202404211630932017_1.pdf?1713719611000.pdf
