研报名称,机构名称,发布时间,行业,研报地址
煤炭行业定期报告：供给有望边际减少，煤价已至底部区域,华福证券,2024-12-22,煤炭行业,https://pdf.dfcfw.com/pdf/H3_AP202412221641389136_1.pdf?1734868269000.pdf
煤炭开采行业跟踪周报：需求略显疲弱，库存绝对值较高，煤价持续承压,东吴证券,2024-12-22,煤炭行业,https://pdf.dfcfw.com/pdf/H3_AP202412211641388889_1.pdf?1734864256000.pdf
煤炭周报：央国企市值管理加码，弱需求下高股息资产价值更高,民生证券,2024-12-21,煤炭行业,https://pdf.dfcfw.com/pdf/H3_AP202412211641388595_1.pdf?1734797583000.pdf
行业研究-周报：悲观中孕育机会,信达证券,2024-12-21,煤炭行业,https://pdf.dfcfw.com/pdf/H3_AP202412211641388902_1.pdf?1734824277000.pdf
煤炭行业2025年信用风险展望：行业盈利企稳 信用风险可控,大公国际,2024-12-19,煤炭行业,https://pdf.dfcfw.com/pdf/H3_AP202412191641357100_1.docx?1734604490000.docx
煤炭月度供需数据点评：11月供给持续回升，制造业投资延续高增,山西证券,2024-12-18,煤炭行业,https://pdf.dfcfw.com/pdf/H3_AP202412181641342152_1.pdf?1734516427000.pdf
煤炭行业2025年投资展望：政策加码，低估值与高分红兼备，核心资产具配置价值,东兴证券,2024-12-18,煤炭行业,https://pdf.dfcfw.com/pdf/H3_AP202412181641339032_1.pdf?1734509856000.pdf
煤炭行业周报：短期回落无需过多担心，中长期煤炭板块不悲观,大同证券,2024-12-17,煤炭行业,https://pdf.dfcfw.com/pdf/H3_AP202412171641333425_1.pdf?1734462079000.pdf
煤炭行业周报：港口继续去库，关注红利价值回归,山西证券,2024-12-16,煤炭行业,https://pdf.dfcfw.com/pdf/H3_AP202412161641320141_1.pdf?1734381974000.pdf
煤炭开采行业跟踪周报：冷空气来袭促需求修复，叠加环渤海港口库存逐步去化有利于煤价企稳,东吴证券,2024-12-15,煤炭行业,https://pdf.dfcfw.com/pdf/H3_AP202412151641306091_1.pdf?1734256384000.pdf
煤炭：高库存下煤价承压，关注高股息标的提估值机会,华福证券,2024-12-15,煤炭行业,https://pdf.dfcfw.com/pdf/H3_AP202412151641306238_1.pdf?1734257026000.pdf
煤炭行业2025年度投资策略：稳稳的幸福,民生证券,2024-12-15,煤炭行业,https://pdf.dfcfw.com/pdf/H3_AP202412141641305884_1.pdf?1734258560000.pdf
煤炭行业周报：中央会议释放积极信号，煤炭双逻辑攻守兼备,开源证券,2024-12-15,煤炭行业,https://pdf.dfcfw.com/pdf/H3_AP202412151641307296_1.pdf?1734300272000.pdf
煤炭周报：成本有支撑，弱需求下高股息资产价值更高,民生证券,2024-12-14,煤炭行业,https://pdf.dfcfw.com/pdf/H3_AP202412141641305738_1.pdf?1734199656000.pdf
终端库存&产地供给边际下降，煤价预期可乐观些,信达证券,2024-12-14,煤炭行业,https://pdf.dfcfw.com/pdf/H3_AP202412141641305941_1.pdf?1734212095000.pdf
煤炭行业双周报：高库存压力持续，煤价继续承压,东莞证券,2024-12-13,煤炭行业,https://pdf.dfcfw.com/pdf/H3_AP202412131641297442_1.pdf?1734122823000.pdf
煤炭周度数据点评,国新证券股份,2024-12-11,煤炭行业,https://pdf.dfcfw.com/pdf/H3_AP202412111641263289_1.pdf?1733941943000.pdf
煤炭行业周报：气温降低库存下降，年底存宏观利好预期,山西证券,2024-12-10,煤炭行业,https://pdf.dfcfw.com/pdf/H3_AP202412101641235712_1.pdf?1733817360000.pdf
2025年煤炭行业投资策略：煤炭供给紧缺导致煤价上行趋势走强，“能源安全”成为行业投资主逻辑,东吴证券,2024-12-09,煤炭行业,https://pdf.dfcfw.com/pdf/H3_AP202412081641220665_1.pdf?1733732631000.pdf
煤炭行业周报：全国煤炭交易会开幕，继续关注12月气温及重要会议情况,海通国际,2024-12-09,煤炭行业,https://pdf.dfcfw.com/pdf/H3_AP202412091641221279_1.pdf?1733732312000.pdf
煤炭开采行业跟踪周报：环渤海港口库存逐步去化，气温偏暖煤价短期承压,东吴证券,2024-12-08,煤炭行业,https://pdf.dfcfw.com/pdf/H3_AP202412081641219270_1.pdf?1733655243000.pdf
煤炭：供给有望边际减少，煤价不必悲观,华福证券,2024-12-08,煤炭行业,https://pdf.dfcfw.com/pdf/H3_AP202412081641219579_1.pdf?1733675074000.pdf
日耗边际改善，可以更乐观些,信达证券,2024-12-08,煤炭行业,https://pdf.dfcfw.com/pdf/H3_AP202412081641219983_1.pdf?1733674292000.pdf
煤炭行业周报：电厂日耗上行库存有望消纳，煤炭双逻辑攻守兼备,开源证券,2024-12-08,煤炭行业,https://pdf.dfcfw.com/pdf/H3_AP202412081641220156_1.pdf?1733686444000.pdf
煤炭报告：动力煤月度进口量下降明显，国内海运费显著上涨,东兴证券,2024-12-08,煤炭行业,https://pdf.dfcfw.com/pdf/H3_AP202412081641220227_1.pdf?1733686247000.pdf
煤炭周报：煤价调整接近尾声，高胜率属性助力板块估值提升,民生证券,2024-12-07,煤炭行业,https://pdf.dfcfw.com/pdf/H3_AP202412071641218732_1.pdf?1733580412000.pdf
煤炭行业2025年度投资策略报告：行业攻守兼备，锚定确定性价值,华龙证券,2024-12-05,煤炭行业,https://pdf.dfcfw.com/pdf/H3_AP202412051641189058_1.pdf?1733396719000.pdf
煤炭行业定期报告：动力煤全产业链去库持续，煤价不必悲观,华福证券,2024-12-03,煤炭行业,https://pdf.dfcfw.com/pdf/H3_AP202412031641153543_1.pdf?1733215003000.pdf
煤炭周度数据点评,国新证券股份,2024-12-02,煤炭行业,https://pdf.dfcfw.com/pdf/H3_AP202412021641143780_1.pdf?1733166791000.pdf
煤炭行业周报：煤价仍有支撑，板块红利价值待显,山西证券,2024-12-02,煤炭行业,https://pdf.dfcfw.com/pdf/H3_AP202412021641148685_1.pdf?1733176150000.pdf
煤炭2025年展望：重视供给结构变化,天风证券,2024-12-01,煤炭行业,https://pdf.dfcfw.com/pdf/H3_AP202411301641128887_1.pdf?1733048305000.pdf
煤炭行业周报：供暖旺季煤价具备韧性，煤炭双逻辑攻守兼备,开源证券,2024-12-01,煤炭行业,https://pdf.dfcfw.com/pdf/H3_AP202412011641130033_1.pdf?1733080299000.pdf
煤炭行业双周报：高库存背景下煤价承压，关注宏观政策落地力度,东莞证券,2024-11-30,煤炭行业,https://pdf.dfcfw.com/pdf/H3_AP202411301641128932_1.pdf?1732997144000.pdf
煤炭开采行业跟踪周报：封航导致库存攀升，大范围降温促煤价企稳反弹,东吴证券,2024-11-30,煤炭行业,https://pdf.dfcfw.com/pdf/H3_AP202411301641128979_1.pdf?1733044853000.pdf
煤炭周报：煤价调整接近尾声，关注板块估值提升,民生证券,2024-11-30,煤炭行业,https://pdf.dfcfw.com/pdf/H3_AP202411301641128998_1.pdf?1733003524000.pdf
去库渐启，煤价趋稳，拐点将至,信达证券,2024-11-30,煤炭行业,https://pdf.dfcfw.com/pdf/H3_AP202411301641129001_1.pdf?1733003843000.pdf
煤炭进口数据拆解：10月进口量延续增长，分煤种结构性分化,山西证券,2024-11-28,煤炭行业,https://pdf.dfcfw.com/pdf/H3_AP202411281641109515_1.pdf?1732827514000.pdf
煤炭行业周报：25年电煤中长期合同签订工作开启，利好龙头优质煤企盈利中枢提升,海通国际,2024-11-26,煤炭行业,https://pdf.dfcfw.com/pdf/H3_AP202411261641064327_1.pdf?1732611551000.pdf
煤炭行业周报：政策带来长期机会，红利板块支撑煤炭平稳运行,大同证券,2024-11-26,煤炭行业,https://pdf.dfcfw.com/pdf/H3_AP202411261641072110_1.pdf?1732639427000.pdf
传统能源行业周报：新疆年内绿电交易电量突破50亿千瓦时,川财证券,2024-11-25,煤炭行业,https://pdf.dfcfw.com/pdf/H3_AP202411251641046064_1.pdf?1732533639000.pdf
煤炭行业周报：气温走低运价高企，关注度冬煤炭需求增加,山西证券,2024-11-25,煤炭行业,https://pdf.dfcfw.com/pdf/H3_AP202411251641057445_1.pdf?1732563655000.pdf
煤炭月度供需数据点评：10月供给持续回升，制造业投资延续高增,山西证券,2024-11-25,煤炭行业,https://pdf.dfcfw.com/pdf/H3_AP202411251641060051_1.pdf?1732568459000.pdf
煤炭行业政策点评：长协机制稳中有进，市场化程度有所提高,山西证券,2024-11-25,煤炭行业,https://pdf.dfcfw.com/pdf/H3_AP202411251641046843_1.pdf?1732542861000.pdf
煤炭行业事件点评：2025长协比例略降，价格有望略增,民生证券,2024-11-25,煤炭行业,https://pdf.dfcfw.com/pdf/H3_AP202411251641047175_1.pdf?1732543075000.pdf
2025年电煤长协任务量下降，煤企综合售价或边际抬升,信达证券,2024-11-24,煤炭行业,https://pdf.dfcfw.com/pdf/H3_AP202411241641042186_1.pdf?1732443028000.pdf
煤炭行业2025年上半年投资策略：供给趋稳增量有限，需求有望迎来复苏,东莞证券,2024-11-24,煤炭行业,https://pdf.dfcfw.com/pdf/H3_AP202411241641043482_1.pdf?1732520941000.pdf
煤炭行业定期报告：气温降低电厂开启去库，煤价不必悲观,华福证券,2024-11-24,煤炭行业,https://pdf.dfcfw.com/pdf/H3_AP202411241641042976_1.pdf?1732469641000.pdf
煤炭行业周报：新长协公布和日耗大涨，煤炭双逻辑攻守兼备,开源证券,2024-11-24,煤炭行业,https://pdf.dfcfw.com/pdf/H3_AP202411241641043180_1.pdf?1732479300000.pdf
煤炭周度数据点评,国新证券股份,2024-11-22,煤炭行业,https://pdf.dfcfw.com/pdf/H3_AP202411221641028055_1.pdf?1732295438000.pdf
煤炭行业周报：指数回调煤炭红利价值有望回归,山西证券,2024-11-19,煤炭行业,https://pdf.dfcfw.com/pdf/H3_AP202411191640949295_1.pdf?1732000614000.pdf
煤炭行业周报：动力煤需求有所提振，板块短期市场有利因素叠加,大同证券,2024-11-19,煤炭行业,https://pdf.dfcfw.com/pdf/H3_AP202411191640963724_1.pdf?1732042721000.pdf
煤炭行业2024年三季报综述：一体化及规模化公司盈利仍强，煤炭红利仍然可期,山西证券,2024-11-19,煤炭行业,https://pdf.dfcfw.com/pdf/H3_AP202411191640966305_1.pdf?1732042898000.pdf
煤炭行业周报：日耗大幅提升+进口倒挂加大，港口煤价有望企稳,海通国际,2024-11-18,煤炭行业,https://pdf.dfcfw.com/pdf/H3_AP202411181640929248_1.pdf?1731915931000.pdf
传统能源行业周报：准格尔旗“蒙煤外运”添新途外送25个省份,川财证券,2024-11-18,煤炭行业,https://pdf.dfcfw.com/pdf/H3_AP202411181640938021_1.pdf?1731947000000.pdf
煤炭行业双周报：煤价短期承压，密切关注宏观政策落地力度,东莞证券,2024-11-17,煤炭行业,https://pdf.dfcfw.com/pdf/H3_AP202411171640928954_1.pdf?1731884502000.pdf
煤炭开采行业跟踪周报：环渤海港口库存高企煤价承压，亟待需求反弹,东吴证券,2024-11-17,煤炭行业,https://pdf.dfcfw.com/pdf/H3_AP202411171640927598_1.pdf?1731856021000.pdf
煤炭行业：北方寒潮预警来临，日耗爬坡有望加速,中泰证券,2024-11-17,煤炭行业,https://pdf.dfcfw.com/pdf/H3_AP202411171640927762_1.pdf?1731884604000.pdf
煤炭行业周报：一揽子增量政策效果初显，煤炭双逻辑攻守兼备,开源证券,2024-11-17,煤炭行业,https://pdf.dfcfw.com/pdf/H3_AP202411171640927816_1.pdf?1731884919000.pdf
旺季来临日耗边际改善，关注煤炭板块估值抬升,信达证券,2024-11-17,煤炭行业,https://pdf.dfcfw.com/pdf/H3_AP202411171640928248_1.pdf?1731858905000.pdf
煤炭：供暖范围扩大叠加寒潮，动力煤价有望反弹,华福证券,2024-11-17,煤炭行业,https://pdf.dfcfw.com/pdf/H3_AP202411171640928380_1.pdf?1731879817000.pdf
煤炭开采行业周报：电厂日耗逐步提升，关注后续港口库存去化情况,国海证券,2024-11-17,煤炭行业,https://pdf.dfcfw.com/pdf/H3_AP202411171640928668_1.pdf?1731881666000.pdf
煤炭开采行业动态研究：10 月原煤供给同比提速， 火力发电增速放缓,国海证券,2024-11-17,煤炭行业,https://pdf.dfcfw.com/pdf/H3_AP202411171640928744_1.pdf?1731874414000.pdf
煤炭周报：日耗提升旺季特征初显，关注板块估值提升,民生证券,2024-11-16,煤炭行业,https://pdf.dfcfw.com/pdf/H3_AP202411161640927148_1.pdf?1731790756000.pdf
煤炭行业2025年度投资策略：煤炭周期与红利双逻辑，再筑黄金时代2.0,开源证券,2024-11-14,煤炭行业,https://pdf.dfcfw.com/pdf/H3_AP202411141640881037_1.pdf?1731600677000.pdf
能源周观点：美国大选对油价影响有限，维持基本面看跌观点,国金证券,2024-11-12,煤炭行业,https://pdf.dfcfw.com/pdf/H3_AP202411121640828152_1.pdf?1731425339000.pdf
煤炭行业：化债方案公布，需求回暖可期,中泰证券,2024-11-11,煤炭行业,https://pdf.dfcfw.com/pdf/H3_AP202411111640808500_1.pdf?1731322865000.pdf
煤炭行业2024年三季报综述：动力煤环比盈利改善，焦煤承压静待拐点,华龙证券,2024-11-11,煤炭行业,https://pdf.dfcfw.com/pdf/H3_AP202411111640811055_1.pdf?1731338383000.pdf
煤炭行业周报：电煤日耗环比提升，库存仍维持较高水平,华龙证券,2024-11-11,煤炭行业,https://pdf.dfcfw.com/pdf/H3_AP202411111640811056_1.pdf?1731338926000.pdf
煤炭：政策加持下焦煤配置价值逐步显现,华福证券,2024-11-11,煤炭行业,https://pdf.dfcfw.com/pdf/H3_AP202411111640815658_1.pdf?1731347589000.pdf
煤炭开采行业专题研究：煤炭板块2024三季报总结：三季度业绩环比上升，负债率持续降低,国海证券,2024-11-11,煤炭行业,https://pdf.dfcfw.com/pdf/H3_AP202411111640822729_1.pdf?1731399542000.pdf
煤炭行业周报：新增6万亿债务限额用于化债，关注旺季日耗恢复情况,海通国际,2024-11-11,煤炭行业,https://pdf.dfcfw.com/pdf/H3_AP202411111640809325_1.pdf?1731333565000.pdf
煤炭行业周报：宏观利好持续发布，静待现实正反馈,山西证券,2024-11-11,煤炭行业,https://pdf.dfcfw.com/pdf/H3_AP202411111640810136_1.pdf?1731338256000.pdf
煤炭开采行业跟踪周报：铁路部门积极组织煤炭拉运，港口库存累积,东吴证券,2024-11-10,煤炭行业,https://pdf.dfcfw.com/pdf/H3_AP202411101640804018_1.pdf?1731235558000.pdf
9月煤炭进口量环比下降，旺季来临煤价有望企稳,信达证券,2024-11-10,煤炭行业,https://pdf.dfcfw.com/pdf/H3_AP202411101640804164_1.pdf?1731235863000.pdf
煤炭行业周报：一揽子化债组合拳推出，煤炭双逻辑且四主线布局行业周报,开源证券,2024-11-10,煤炭行业,https://pdf.dfcfw.com/pdf/H3_AP202411101640804553_1.pdf?1731255342000.pdf
煤炭开采行业周报：冬季需求值得期待，关注电厂日耗提升与政策落地对产业链提振效果,国海证券,2024-11-10,煤炭行业,https://pdf.dfcfw.com/pdf/H3_AP202411101640805345_1.pdf?1731262794000.pdf
煤炭周报：日耗进入上行通道，关注板块估值提升,民生证券,2024-11-09,煤炭行业,https://pdf.dfcfw.com/pdf/H3_AP202411091640803600_1.pdf?1731174971000.pdf
煤炭进口数据拆解：9月进口量增长，分煤种结构性分化,山西证券,2024-11-08,煤炭行业,https://pdf.dfcfw.com/pdf/H3_AP202411081640776414_1.pdf?1731054092000.pdf
煤炭专题报告：煤炭红利价值演绎与套息交易,山西证券,2024-11-08,煤炭行业,https://pdf.dfcfw.com/pdf/H3_AP202411081640789065_1.pdf?1731086291000.pdf
煤炭行业三季报综述：行业指数偏弱，煤企量增价减、降幅收窄,平安证券,2024-11-07,煤炭行业,https://pdf.dfcfw.com/pdf/H3_AP202411071640756291_1.pdf?1730967221000.pdf
煤炭行业周报：煤价短期震荡，静待需求释放,华龙证券,2024-11-05,煤炭行业,https://pdf.dfcfw.com/pdf/H3_AP202411051640716674_1.pdf?1730807415000.pdf
煤炭开采行业深度报告：Q3业绩环比改善，煤炭双逻辑四主线布局,开源证券,2024-11-05,煤炭行业,https://pdf.dfcfw.com/pdf/H3_AP202411051640717186_1.pdf?1730814172000.pdf
煤炭开采行业周报：冬季旺季即将启动，关注下周会议改善宏观情绪,国海证券,2024-11-04,煤炭行业,https://pdf.dfcfw.com/pdf/H3_AP202411031640689183_1.pdf?1730712753000.pdf
煤炭周度数据点评,国新证券股份,2024-11-04,煤炭行业,https://pdf.dfcfw.com/pdf/H3_AP202411041640690634_1.pdf?1730711944000.pdf
煤炭行业周报：宏观变化扰动需求预期，优选确定性标的,中泰证券,2024-11-04,煤炭行业,https://pdf.dfcfw.com/pdf/H3_AP202411041640692421_1.pdf?1730714552000.pdf
煤炭行业定期报告：供暖陆续开启产地先行上涨，关注后续增量政策,华福证券,2024-11-04,煤炭行业,https://pdf.dfcfw.com/pdf/H3_AP202411041640692766_1.pdf?1730715345000.pdf
煤炭行业周报：迎峰度冬煤炭需求在即，关注煤价表现,山西证券,2024-11-04,煤炭行业,https://pdf.dfcfw.com/pdf/H3_AP202411041640695216_1.pdf?1730732511000.pdf
传统能源行业周报：山西深化矿业权市场改革 预计新增煤炭产能2400万吨,川财证券,2024-11-04,煤炭行业,https://pdf.dfcfw.com/pdf/H3_AP202411041640702064_1.pdf?1730741794000.pdf
煤炭行业周报：中电联预计全社会用电量增速7%，煤炭需求韧性持续超预期,海通国际,2024-11-04,煤炭行业,https://pdf.dfcfw.com/pdf/H3_AP202411041640705475_1.pdf?1730747911000.pdf
煤炭行业双周报：冬季将至动力煤稳中向好，关注“煤-焦-钢”下游情况,东莞证券,2024-11-04,煤炭行业,https://pdf.dfcfw.com/pdf/H3_AP202411041640694640_1.pdf?1730730498000.pdf
煤炭行业周报：Q3季结束迎接Q4旺季，煤炭双逻辑且四主线布局行业周报,开源证券,2024-11-03,煤炭行业,https://pdf.dfcfw.com/pdf/H3_AP202411031640687759_1.pdf?1730710405000.pdf
煤炭周报：旺季将临煤价稳中向好，关注板块估值提升,民生证券,2024-11-02,煤炭行业,https://pdf.dfcfw.com/pdf/H3_AP202411021640685365_1.pdf?1730556006000.pdf
煤炭开采行业跟踪周报：煤炭消费旺季来临，港口吞吐量增长明显,东吴证券,2024-11-02,煤炭行业,https://pdf.dfcfw.com/pdf/H3_AP202411021640685459_1.pdf?1730626369000.pdf
非电需求边际改善，煤价震荡趋稳，坚定看多煤炭资产,信达证券,2024-11-02,煤炭行业,https://pdf.dfcfw.com/pdf/H3_AP202411021640685821_1.pdf?1730586567000.pdf
煤炭开采行业专题研究：2024Q3主动型基金在煤炭行业持仓比例环比下降0.36pct，延续低配状态,国海证券,2024-10-31,煤炭行业,https://pdf.dfcfw.com/pdf/H3_AP202410311640637972_1.pdf?1730389391000.pdf
煤炭行业周报：动力煤企稳，煤炭板块长期不悲观,大同证券,2024-10-29,煤炭行业,https://pdf.dfcfw.com/pdf/H3_AP202410291640561979_1.pdf?1730213146000.pdf
煤炭行业周报：供暖范围即将扩大，价格有望震荡探涨,华龙证券,2024-10-29,煤炭行业,https://pdf.dfcfw.com/pdf/H3_AP202410291640562001_1.pdf?1730220587000.pdf
煤炭行业：宏观预期再度强化，冬储将临煤价易涨难跌,中泰证券,2024-10-28,煤炭行业,https://pdf.dfcfw.com/pdf/H3_AP202410281640530065_1.pdf?1730103401000.pdf
煤炭行业周报：主要公司三季报业绩改善,山西证券,2024-10-28,煤炭行业,https://pdf.dfcfw.com/pdf/H3_AP202410281640532173_1.pdf?1730113291000.pdf
煤炭行业周报：Q3业绩向好重整旗鼓，煤炭双逻辑且四主线布局行业周报,开源证券,2024-10-27,煤炭行业,https://pdf.dfcfw.com/pdf/H3_AP202410271640525649_1.pdf?1730028723000.pdf
煤炭开采行业周报：需求短期承压，但冬季旺季有望逐步启动,国海证券,2024-10-27,煤炭行业,https://pdf.dfcfw.com/pdf/H3_AP202410271640529322_1.pdf?1730114731000.pdf
煤炭矿业权高溢价转让，进一步打开板块估值空间,信达证券,2024-10-27,煤炭行业,https://pdf.dfcfw.com/pdf/H3_AP202410271640526227_1.pdf?1730039019000.pdf
煤炭：动力煤企稳反弹，关注三季报超预期标的,华福证券,2024-10-27,煤炭行业,https://pdf.dfcfw.com/pdf/H3_AP202410271640528106_1.pdf?1730059905000.pdf
煤炭开采行业跟踪周报：消费旺季来临，价格上涨动能趋强,东吴证券,2024-10-26,煤炭行业,https://pdf.dfcfw.com/pdf/H3_AP202410261640525116_1.pdf?1729981694000.pdf
煤炭周报：看好后市煤价上涨，动力煤板块业绩环比表现亮眼,民生证券,2024-10-26,煤炭行业,https://pdf.dfcfw.com/pdf/H3_AP202410261640525306_1.pdf?1729984145000.pdf
煤炭行业：国内动力煤价微跌，火力发电量占比继续提升,东兴证券,2024-10-23,煤炭行业,https://pdf.dfcfw.com/pdf/H3_AP202410231640429243_1.pdf?1729677065000.pdf
2024年三季度煤炭债复盘：存量煤炭债平均期限已超供改时期水平,山西证券,2024-10-23,煤炭行业,https://pdf.dfcfw.com/pdf/H3_AP202410231640429035_1.pdf?1729676990000.pdf
煤炭行业：炼焦煤价格上涨明显，下游需求端月度产量继续下降,东兴证券,2024-10-23,煤炭行业,https://pdf.dfcfw.com/pdf/H3_AP202410231640436445_1.pdf?1729702016000.pdf
煤炭行业周报：煤价短期小幅波动，静待政策刺激落地于用煤需求,华龙证券,2024-10-22,煤炭行业,https://pdf.dfcfw.com/pdf/H3_AP202410221640401327_1.pdf?1729597189000.pdf
煤炭行业周报：煤炭板块短期承压，冬储或成为关键因素,大同证券,2024-10-22,煤炭行业,https://pdf.dfcfw.com/pdf/H3_AP202410221640398631_1.pdf?1729584409000.pdf
煤炭开采行业动态研究：原煤日产量环比提升，火力发电加速,国海证券,2024-10-21,煤炭行业,https://pdf.dfcfw.com/pdf/H3_AP202410201640375617_1.pdf?1729496172000.pdf
煤炭行业周报：9月供需淡季不淡，煤价短期或窄幅震荡,海通国际,2024-10-21,煤炭行业,https://pdf.dfcfw.com/pdf/H3_AP202410211640376210_1.pdf?1729499094000.pdf
煤炭开采行业周报：煤价窄幅波动，关注冬储补库与宏观预期变化,国海证券,2024-10-21,煤炭行业,https://pdf.dfcfw.com/pdf/H3_AP202410211640379007_1.pdf?1729513459000.pdf
煤炭行业周报：淡季震荡，关注冬季需求提振,山西证券,2024-10-21,煤炭行业,https://pdf.dfcfw.com/pdf/H3_AP202410211640384731_1.pdf?1729527740000.pdf
煤炭月度供需数据点评：9月供给回升，制造业投资延续高增,山西证券,2024-10-21,煤炭行业,https://pdf.dfcfw.com/pdf/H3_AP202410211640386713_1.pdf?1729530438000.pdf
煤炭行业双周报：利好政策持续加码，煤炭价格具备向上动能,东莞证券,2024-10-21,煤炭行业,https://pdf.dfcfw.com/pdf/H3_AP202410211640386962_1.pdf?1729540868000.pdf
煤炭开采行业跟踪周报：封航导致港口库存累积，难改旺季煤价上涨趋势,东吴证券,2024-10-20,煤炭行业,https://pdf.dfcfw.com/pdf/H3_AP202410201640373609_1.pdf?1729420839000.pdf
煤炭行业周报：一揽子增量政策加力，煤炭双逻辑且四主线布局,开源证券,2024-10-20,煤炭行业,https://pdf.dfcfw.com/pdf/H3_AP202410201640373822_1.pdf?1729421808000.pdf
煤炭：动力煤静待冬储释放，政策加持下焦煤仍可补涨,华福证券,2024-10-20,煤炭行业,https://pdf.dfcfw.com/pdf/H3_AP202410201640374168_1.pdf?1729441456000.pdf
煤炭：强预期＞弱现实，把握确定性交易机会,中泰证券,2024-10-20,煤炭行业,https://pdf.dfcfw.com/pdf/H3_AP202410201640374210_1.pdf?1729434676000.pdf
煤炭周报：节后调整基本结束，看好后续煤价上涨,民生证券,2024-10-19,煤炭行业,https://pdf.dfcfw.com/pdf/H3_AP202410191640373309_1.pdf?1729355249000.pdf
钢材库存持续下降，补库需求有望支撑焦煤价格,信达证券,2024-10-19,煤炭行业,https://pdf.dfcfw.com/pdf/H3_AP202410191640373567_1.pdf?1729378629000.pdf
煤炭：财政政策加码预期强化，把握确定性交易机会,中泰证券,2024-10-16,煤炭行业,https://pdf.dfcfw.com/pdf/H3_AP202410161640314804_1.pdf?1729072802000.pdf
煤炭行业点评报告：回购增持再贷款和互换便利，强化煤炭红利逻辑,开源证券,2024-10-15,煤炭行业,https://pdf.dfcfw.com/pdf/H3_AP202410141640295316_1.pdf?1728976077000.pdf
煤炭行业周报：政策释放叠加冬储支撑，煤炭价格易涨难跌,华龙证券,2024-10-15,煤炭行业,https://pdf.dfcfw.com/pdf/H3_AP202410151640303026_1.pdf?1729006505000.pdf
煤炭开采行业周报：国际动力煤价走强，煤炭板块依旧攻守兼备,国海证券,2024-10-15,煤炭行业,https://pdf.dfcfw.com/pdf/H3_AP202410151640299691_1.pdf?1729005928000.pdf
煤炭行业定期报告：冬储将起动力煤无忧，焦煤反弹仍在持续,华福证券,2024-10-14,煤炭行业,https://pdf.dfcfw.com/pdf/H3_AP202410141640279077_1.pdf?1728903942000.pdf
煤炭行业周报：财政发力，煤炭套息,山西证券,2024-10-14,煤炭行业,https://pdf.dfcfw.com/pdf/H3_AP202410141640290196_1.pdf?1728944194000.pdf
煤炭行业周报：政策持续出台，煤炭周期弹性与稳健红利双逻辑,开源证券,2024-10-13,煤炭行业,https://pdf.dfcfw.com/pdf/H3_AP202410131640276660_1.pdf?1728815531000.pdf
煤炭周报：冬储释放叠加政策利好提振非电需求，煤价易涨难跌,民生证券,2024-10-13,煤炭行业,https://pdf.dfcfw.com/pdf/H3_AP202410131640276877_1.pdf?1728828356000.pdf
煤炭开采行业跟踪周报：需求旺季临近，动力煤价格上涨动能持续加强,东吴证券,2024-10-12,煤炭行业,https://pdf.dfcfw.com/pdf/H3_AP202410121640276364_1.pdf?1728810876000.pdf
终归行业基本面，景气周期延续，逢低加配煤炭板块,信达证券,2024-10-12,煤炭行业,https://pdf.dfcfw.com/pdf/H3_AP202410121640276155_1.pdf?1728775493000.pdf
煤炭周度数据点评,国新证券股份,2024-10-11,煤炭行业,https://pdf.dfcfw.com/pdf/H3_AP202410111640255825_1.pdf?1728635410000.pdf
煤炭行业周报：黑色产业链强势上涨，继续关注煤炭顺周期机会,海通国际,2024-10-10,煤炭行业,https://pdf.dfcfw.com/pdf/H3_AP202410101640238569_1.pdf?1728547060000.pdf
企业竞争图谱：2024年炼焦煤 头豹词条报告系列,头豹研究院,2024-10-10,煤炭行业,https://pdf.dfcfw.com/pdf/H3_AP202410101640250938_1.pdf?1728589113000.pdf
煤炭进口数据拆解：8月进口量价环比下降，分煤种表现结构性分化,山西证券,2024-10-08,煤炭行业,https://pdf.dfcfw.com/pdf/H3_AP202410081640198523_1.pdf?1728408510000.pdf
