研报名称,机构名称,发布时间,行业,研报地址
煤炭行业周报：中期分红渐成趋势，煤炭高股息且底部价值凸显行业周报,开源证券,2024-09-02,煤炭行业,https://pdf.dfcfw.com/pdf/H3_AP202409021639683249_1.pdf?1725267092000.pdf
煤炭行业：秋季开工需求边际好转，煤炭价格有望重拾升势,中泰证券,2024-09-02,煤炭行业,https://pdf.dfcfw.com/pdf/H3_AP202409021639684089_1.pdf?1725269123000.pdf
焦煤价格有望止跌企稳，长期看优质主焦煤供应仍稀缺,信达证券,2024-09-01,煤炭行业,https://pdf.dfcfw.com/pdf/H3_AP202409011639679368_1.pdf?1725192720000.pdf
煤炭行业双周报：电厂日耗见顶下行，关注非电需求,东莞证券,2024-09-01,煤炭行业,https://pdf.dfcfw.com/pdf/H3_AP202409011639681861_1.pdf?1725229710000.pdf
煤炭开采行业跟踪周报：沿海上下游库存数据同比持平，有利于支撑煤价,东吴证券,2024-09-01,煤炭行业,https://pdf.dfcfw.com/pdf/H3_AP202409011639679420_1.pdf?1725202689000.pdf
煤炭周报：港口库存去化，动力煤止跌反弹,德邦证券,2024-09-01,煤炭行业,https://pdf.dfcfw.com/pdf/H3_AP202409011639681037_1.pdf?1725274328000.pdf
煤炭周报：煤价企稳，板块延续业绩稳健+高回报,民生证券,2024-08-31,煤炭行业,https://pdf.dfcfw.com/pdf/H3_AP202408311639678074_1.pdf?1725146910000.pdf
煤炭行业2024年中期策略：复苏打破供需双弱格局，新时代煤炭估值体系渐成,德邦证券,2024-08-29,煤炭行业,https://pdf.dfcfw.com/pdf/H3_AP202408291639581403_1.pdf?1724967965000.pdf
煤炭行业周报：行业表现相对平稳，红利属性依然占优,大同证券,2024-08-28,煤炭行业,https://pdf.dfcfw.com/pdf/H3_AP202408281639505086_1.pdf?1724831400000.pdf
煤炭进口数据拆解：7月进口继续补缺，分煤种表现结构性分化,山西证券,2024-08-28,煤炭行业,https://pdf.dfcfw.com/pdf/H3_AP202408281639531246_1.pdf?1724874957000.pdf
煤炭行业周报：下游价格回升，关注产业链需求共振,山西证券,2024-08-26,煤炭行业,https://pdf.dfcfw.com/pdf/H3_AP202408251639445198_1.pdf?1724663345000.pdf
煤炭开采行业周报：动力煤产业链继续去库存；焦煤价格有望探底；低位煤炭股值得把握,国海证券,2024-08-26,煤炭行业,https://pdf.dfcfw.com/pdf/H3_AP202408261639445451_1.pdf?1724658555000.pdf
煤炭开采行业跟踪周报：环渤海港口供需双升，市场交易改善利好煤价筑底,东吴证券,2024-08-25,煤炭行业,https://pdf.dfcfw.com/pdf/H3_AP202408251639441458_1.pdf?1724595053000.pdf
煤炭周报：板块底部渐明，重视底部布局,德邦证券,2024-08-25,煤炭行业,https://pdf.dfcfw.com/pdf/H3_AP202408251639441664_1.pdf?1724597930000.pdf
煤炭行业周报：中煤系中期分红方案落地，煤炭高股息属性凸显,开源证券,2024-08-25,煤炭行业,https://pdf.dfcfw.com/pdf/H3_AP202408251639443116_1.pdf?1724606677000.pdf
煤炭行业周报：非电需求预期改善，煤价止跌企稳在即,中泰证券,2024-08-25,煤炭行业,https://pdf.dfcfw.com/pdf/H3_AP202408251639443335_1.pdf?1724609690000.pdf
产地倒挂&库存去化，谨慎乐观看待煤价,信达证券,2024-08-24,煤炭行业,https://pdf.dfcfw.com/pdf/H3_AP202408241639439881_1.pdf?1724536837000.pdf
煤炭周报：煤价震荡偏稳，板块回调提供配置良机,民生证券,2024-08-24,煤炭行业,https://pdf.dfcfw.com/pdf/H3_AP202408241639439667_1.pdf?1724527811000.pdf
煤炭行业周报：金九银十临近，关注非电需求恢复,山西证券,2024-08-20,煤炭行业,https://pdf.dfcfw.com/pdf/H3_AP202408191639345838_1.pdf?1724139947000.pdf
煤炭月度供需数据点评：供给符合预期，制造业投资延续高增,山西证券,2024-08-20,煤炭行业,https://pdf.dfcfw.com/pdf/H3_AP202408201639359299_1.pdf?1724173135000.pdf
煤炭开采行业周报：电厂继续去库存；高度重视低位煤炭股,国海证券,2024-08-19,煤炭行业,https://pdf.dfcfw.com/pdf/H3_AP202408191639326481_1.pdf?1724053217000.pdf
煤炭行业周报：7月原煤产量增速略有下滑，关注夏末秋初水电出力情况,国投证券,2024-08-19,煤炭行业,https://pdf.dfcfw.com/pdf/H3_AP202408191639326500_1.pdf?1724059450000.pdf
煤炭开采行业动态研究：原煤日产量环比回落，火力发电降幅收窄,国海证券,2024-08-19,煤炭行业,https://pdf.dfcfw.com/pdf/H3_AP202408181639326355_1.pdf?1724055444000.pdf
煤炭开采行业跟踪周报：国内煤炭供需双弱，进口冲击导致煤价走弱,东吴证券,2024-08-18,煤炭行业,https://pdf.dfcfw.com/pdf/H3_AP202408181639323487_1.pdf?1723977276000.pdf
煤价短期承压勿忧，核心资产潜力可期,信达证券,2024-08-18,煤炭行业,https://pdf.dfcfw.com/pdf/H3_AP202408181639323918_1.pdf?1723974122000.pdf
煤炭行业周报：煤炭已处于价值底部，可积极布局,开源证券,2024-08-18,煤炭行业,https://pdf.dfcfw.com/pdf/H3_AP202408181639324906_1.pdf?1724008059000.pdf
煤炭行业周报：煤价底部有支撑，建议板块逢低配置,德邦证券,2024-08-18,煤炭行业,https://pdf.dfcfw.com/pdf/H3_AP202408181639325247_1.pdf?1724020746000.pdf
煤炭周报：业绩期将临，关注板块股息价值,民生证券,2024-08-17,煤炭行业,https://pdf.dfcfw.com/pdf/H3_AP202408171639323250_1.pdf?1723925695000.pdf
煤炭行业月报：供给增速放缓，需求预期改善,德邦证券,2024-08-16,煤炭行业,https://pdf.dfcfw.com/pdf/H3_AP202408161639311034_1.pdf?1723825981000.pdf
煤炭行业点评：能源行业产融动态报告,川财证券,2024-08-16,煤炭行业,https://pdf.dfcfw.com/pdf/H3_AP202408161639312089_1.pdf?1723827027000.pdf
煤炭行业点评：能源行业产融动态报告,川财证券,2024-08-15,煤炭行业,https://pdf.dfcfw.com/pdf/H3_AP202408151639284110_1.pdf?1723717885000.pdf
“煤电联营”专题报告：政策催化不断，煤企迎来机遇,中泰证券,2024-08-12,煤炭行业,https://pdf.dfcfw.com/pdf/H3_AP202408121639234616_1.pdf?1723456681000.pdf
煤炭行业周报：需求预期不悲观，超跌布局再提示,中泰证券,2024-08-12,煤炭行业,https://pdf.dfcfw.com/pdf/H3_AP202408121639234617_1.pdf?1723455417000.pdf
煤炭行业周报：电厂日耗或季节性见顶，焦炭三轮提降迅速落地,华福证券,2024-08-12,煤炭行业,https://pdf.dfcfw.com/pdf/H3_AP202408121639243128_1.pdf?1723490152000.pdf
煤炭开采行业周报：动力煤继续去库存；高度重视低位煤炭股,国海证券,2024-08-12,煤炭行业,https://pdf.dfcfw.com/pdf/H3_AP202408121639243137_1.pdf?1723490431000.pdf
煤炭开采行业跟踪周报：产地暴雨影响煤炭供给，对煤价行成一定支撑,东吴证券,2024-08-11,煤炭行业,https://pdf.dfcfw.com/pdf/H3_AP202408111639231011_1.pdf?1723368058000.pdf
煤炭行业周报：胜率优于赔率,山西证券,2024-08-11,煤炭行业,https://pdf.dfcfw.com/pdf/H3_AP202408111639231331_1.pdf?1723387411000.pdf
煤炭行业周报：基本面震荡磨底，建议逢低布局,德邦证券,2024-08-11,煤炭行业,https://pdf.dfcfw.com/pdf/H3_AP202408111639231479_1.pdf?1723386902000.pdf
煤炭行业周报：产业资本入局，重视煤炭股底部布局,开源证券,2024-08-11,煤炭行业,https://pdf.dfcfw.com/pdf/H3_AP202408111639232082_1.pdf?1723399314000.pdf
国际煤价创今年新高，有望支撑国内煤价企稳回升,信达证券,2024-08-10,煤炭行业,https://pdf.dfcfw.com/pdf/H3_AP202408101639230838_1.pdf?1723323954000.pdf
煤炭周报：火电增速转正，动力煤拐点将临,民生证券,2024-08-10,煤炭行业,https://pdf.dfcfw.com/pdf/H3_AP202408101639230817_1.pdf?1723322702000.pdf
煤炭行业点评报告：增持和回购，产业资本认可煤炭底部或将来临,开源证券,2024-08-09,煤炭行业,https://pdf.dfcfw.com/pdf/H3_AP202408081639206015_1.pdf?1723190928000.pdf
煤炭行业点评：能源行业产融动态报告,川财证券,2024-08-09,煤炭行业,https://pdf.dfcfw.com/pdf/H3_AP202408091639217546_1.pdf?1723220770000.pdf
企业竞争图谱：2024年智能化采矿 头豹词条报告系列,头豹研究院,2024-08-09,煤炭行业,https://pdf.dfcfw.com/pdf/H3_AP202408091639223694_1.pdf?1723233077000.pdf
中国智能化采矿行业市场规模测算逻辑模型 头豹词条报告系列,头豹研究院,2024-08-08,煤炭行业,https://pdf.dfcfw.com/pdf/H3_AP202408081639203472_1.pdf?1723146256000.pdf
煤炭行业：动力煤价上调，下游去库存明显,东兴证券,2024-08-06,煤炭行业,https://pdf.dfcfw.com/pdf/H3_AP202408061639160090_1.pdf?1722957925000.pdf
煤炭行业：独立焦企产能利用率提高，焦炭月产量增,东兴证券,2024-08-06,煤炭行业,https://pdf.dfcfw.com/pdf/H3_AP202408061639163346_1.pdf?1722962502000.pdf
煤炭行业点评：能源行业产融动态报告,川财证券,2024-08-06,煤炭行业,https://pdf.dfcfw.com/pdf/H3_AP202408061639165860_1.pdf?1722969456000.pdf
煤炭行业周报：降息叠加设备更新计划实施，关注双焦需求恢复,山西证券,2024-08-05,煤炭行业,https://pdf.dfcfw.com/pdf/H3_AP202408051639134163_1.pdf?1722843677000.pdf
煤炭行业周报：宏观预期有望改善，重视超跌布局机会,中泰证券,2024-08-05,煤炭行业,https://pdf.dfcfw.com/pdf/H3_AP202408051639138285_1.pdf?1722863572000.pdf
煤炭行业周报：高温需求带来动力煤去库希望，焦煤需求或迎来底部反弹,大同证券,2024-08-05,煤炭行业,https://pdf.dfcfw.com/pdf/H3_AP202408051639145801_1.pdf?1722880840000.pdf
煤炭行业周报：电厂日耗攀升旺季不旺，关注库存消耗情况,华福证券,2024-08-05,煤炭行业,https://pdf.dfcfw.com/pdf/H3_AP202408051639147272_1.pdf?1722891172000.pdf
煤炭行业周报：正视煤企合理可持续高盈利，煤油价格有望高位行业周报,开源证券,2024-08-04,煤炭行业,https://pdf.dfcfw.com/pdf/H3_AP202408041639133724_1.pdf?1722809933000.pdf
煤炭开采行业周报：日耗震荡库存继续去化；高度重视低位煤炭股,国海证券,2024-08-04,煤炭行业,https://pdf.dfcfw.com/pdf/H3_AP202408041639133926_1.pdf?1722849526000.pdf
煤炭开采行业跟踪周报：持续高温天气快速拉动需求，警惕进口增量降低煤价上涨动能,东吴证券,2024-08-04,煤炭行业,https://pdf.dfcfw.com/pdf/H3_AP202408041639132486_1.pdf?1722779851000.pdf
煤炭开采行业周报：煤炭板块回调迎来配置良机，重点关注炼焦煤投资机遇,信达证券,2024-08-04,煤炭行业,https://pdf.dfcfw.com/pdf/H3_AP202408041639132839_1.pdf?1722805532000.pdf
煤炭周报：日耗延续高位，板块调整后价值凸显,德邦证券,2024-08-04,煤炭行业,https://pdf.dfcfw.com/pdf/H3_AP202408041639132925_1.pdf?1722805645000.pdf
煤炭行业周报：煤、电利润分配回归至各半水平，煤电联营方向依旧值得关注,国投证券,2024-08-04,煤炭行业,https://pdf.dfcfw.com/pdf/H3_AP202408041639133361_1.pdf?1722799251000.pdf
煤炭周报：至暗时刻已过，板块迎来加仓时机,民生证券,2024-08-03,煤炭行业,https://pdf.dfcfw.com/pdf/H3_AP202408031639131730_1.pdf?1722724577000.pdf
煤炭周报：设备更新政策加码，重视焦煤底部布局,德邦证券,2024-08-01,煤炭行业,https://pdf.dfcfw.com/pdf/H3_AP202408011638808389_1.pdf?1722526774000.pdf
煤炭行业：煤价承压，下游焦企的产能利用率继续提升,东兴证券,2024-08-01,煤炭行业,https://pdf.dfcfw.com/pdf/H3_AP202408011638811357_1.pdf?1722527216000.pdf
煤炭行业点评报告：特朗普能源政策，或难以对油气煤价格产生大影响,开源证券,2024-07-31,煤炭行业,https://pdf.dfcfw.com/pdf/H3_AP202407311638787692_1.pdf?1722441951000.pdf
煤炭行业2024年半年度投资展望：低估值与高分红兼备，核心价值资产有望再起,东兴证券,2024-07-30,煤炭行业,https://pdf.dfcfw.com/pdf/H3_AP202407301638466698_1.pdf?1722352172000.pdf
煤炭行业周报：螺纹规格切换引发短期下杀，旺季价格上行值得期待,中泰证券,2024-07-29,煤炭行业,https://pdf.dfcfw.com/pdf/H3_AP202407291638416026_1.pdf?1722244656000.pdf
煤炭行业周报：高温再袭动力煤仍有上涨动力，焦炭开启首轮提降,华福证券,2024-07-29,煤炭行业,https://pdf.dfcfw.com/pdf/H3_AP202407291638419265_1.pdf?1722261502000.pdf
煤炭开采行业周报：动力煤基本面边际继续向好；高度重视低位煤炭股,国海证券,2024-07-29,煤炭行业,https://pdf.dfcfw.com/pdf/H3_AP202407281638401395_1.pdf?1722260472000.pdf
煤炭行业点评：能源行业产融动态报告,川财证券,2024-07-29,煤炭行业,https://pdf.dfcfw.com/pdf/H3_AP202407291638435426_1.pdf?1722281066000.pdf
煤炭行业周报：欧洲动力煤价格回涨,山西证券,2024-07-28,煤炭行业,https://pdf.dfcfw.com/pdf/H3_AP202407281638398612_1.pdf?1722260201000.pdf
煤炭行业周报：电厂日耗持续上行，合理可持续高盈利支持高股息行业周报,开源证券,2024-07-28,煤炭行业,https://pdf.dfcfw.com/pdf/H3_AP202407281638399216_1.pdf?1722193377000.pdf
煤炭开采行业周报：全球煤炭需求有望小幅增长，煤价中枢高位趋势未变,信达证券,2024-07-28,煤炭行业,https://pdf.dfcfw.com/pdf/H3_AP202407281638393829_1.pdf?1722259690000.pdf
煤炭开采行业跟踪周报：需求持续兑现但下游采购仍旧消极，煤价震荡运行,东吴证券,2024-07-27,煤炭行业,https://pdf.dfcfw.com/pdf/H3_AP202407271638380619_1.pdf?1722123328000.pdf
煤炭周报：压力时刻已过，动力煤价格企稳反弹,民生证券,2024-07-27,煤炭行业,https://pdf.dfcfw.com/pdf/H3_AP202407271638380873_1.pdf?1722124324000.pdf
煤炭行业点评：能源行业产融动态报告,川财证券,2024-07-26,煤炭行业,https://pdf.dfcfw.com/pdf/H3_AP202407261638327404_1.pdf?1721987002000.pdf
煤炭进口数据拆解：6月进口继续补缺，关注政策方向变化,山西证券,2024-07-26,煤炭行业,https://pdf.dfcfw.com/pdf/H3_AP202407261638332008_1.pdf?1721999084000.pdf
煤炭行业月报：煤矿复产原煤产量回升，水电出力提升压制火电,华福证券,2024-07-26,煤炭行业,https://pdf.dfcfw.com/pdf/H3_AP202407261638345440_1.pdf?1722018941000.pdf
煤炭开采行业深度报告：煤炭黄金时代2.0，向合理且可持续高盈利转型,开源证券,2024-07-25,煤炭行业,https://pdf.dfcfw.com/pdf/H3_AP202407251638287137_1.pdf?1721898047000.pdf
煤炭行业点评：能源行业产融动态报告,川财证券,2024-07-25,煤炭行业,https://pdf.dfcfw.com/pdf/H3_AP202407251638287075_1.pdf?1721899880000.pdf
煤炭行业点评：能源行业产融动态报告,川财证券,2024-07-25,煤炭行业,https://pdf.dfcfw.com/pdf/H3_AP202407251638288892_1.pdf?1721901737000.pdf
煤炭开采板块上半年总结及下半年展望：继续关注盈利能力好和股息率高的标的,川财证券,2024-07-25,煤炭行业,https://pdf.dfcfw.com/pdf/H3_AP202407251638291000_1.pdf?1721905335000.pdf
煤炭行业基金持仓分析：2024Q2持股数量、市值皆提升，低配幅度收窄,德邦证券,2024-07-24,煤炭行业,https://pdf.dfcfw.com/pdf/H3_AP202407241638247877_1.pdf?1721808929000.pdf
煤炭开采行业专题研究：2024Q2主动型基金在煤炭行业持仓比例持续提升,国海证券,2024-07-23,煤炭行业,https://pdf.dfcfw.com/pdf/H3_AP202407231638211113_1.pdf?1721726429000.pdf
能源周观点：是时候关注原油需求端积累的风险了,国金证券,2024-07-23,煤炭行业,https://pdf.dfcfw.com/pdf/H3_AP202407231638216927_1.pdf?1721743722000.pdf
煤炭行业周报：上半年煤矿安监趋严，生产端供给收缩,国投证券,2024-07-22,煤炭行业,https://pdf.dfcfw.com/pdf/H3_AP202407211638160113_1.pdf?1721632021000.pdf
煤炭周报：板块逻辑未变，调整即为布局良机,德邦证券,2024-07-22,煤炭行业,https://pdf.dfcfw.com/pdf/H3_AP202407221638168389_1.pdf?1721644823000.pdf
煤炭行业周报：三中全会利好供需基本面，煤炭板块超跌布局在当下,中泰证券,2024-07-22,煤炭行业,https://pdf.dfcfw.com/pdf/H3_AP202407221638169462_1.pdf?1721637182000.pdf
煤炭行业周报：高温持续情绪提振，电厂高日耗支撑煤价,华福证券,2024-07-22,煤炭行业,https://pdf.dfcfw.com/pdf/H3_AP202407221638171741_1.pdf?1721647629000.pdf
2024年二季度煤炭债复盘：行业策略纵深有所突破,山西证券,2024-07-22,煤炭行业,https://pdf.dfcfw.com/pdf/H3_AP202407221638175842_1.pdf?1721650562000.pdf
煤炭开采行业周报：去库加速或将催涨煤价，再度建议逢低配置煤炭,信达证券,2024-07-21,煤炭行业,https://pdf.dfcfw.com/pdf/H3_AP202407211638145477_1.pdf?1721557335000.pdf
煤炭开采行业跟踪周报：供需双弱，库存略有去化促煤价筑底,东吴证券,2024-07-21,煤炭行业,https://pdf.dfcfw.com/pdf/H3_AP202407211638147603_1.pdf?1721564418000.pdf
能源开采行业2024H动力煤策略：价格波澜不惊，红利仍为主线,天风证券,2024-07-21,煤炭行业,https://pdf.dfcfw.com/pdf/H3_AP202407211638156776_1.pdf?1721594746000.pdf
煤炭开采行业周报：日耗延续上升，港口及电厂库存去化明显,国海证券,2024-07-21,煤炭行业,https://pdf.dfcfw.com/pdf/H3_AP202407211638159590_1.pdf?1721643838000.pdf
24Q2煤炭行业基金持仓分析：市值推动持仓份额提升，看好迎峰度夏旺季需求,民生证券,2024-07-21,煤炭行业,https://pdf.dfcfw.com/pdf/H3_AP202407201638135261_1.pdf?1721573842000.pdf
煤炭行业周报：电厂日耗水平创年内新高，铁水日均产量上行行业周报,开源证券,2024-07-21,煤炭行业,https://pdf.dfcfw.com/pdf/H3_AP202407211638149909_1.pdf?1721575402000.pdf
煤炭行业周报：供需双弱终端去库，动力煤价格以稳为主,山西证券,2024-07-21,煤炭行业,https://pdf.dfcfw.com/pdf/H3_AP202407211638152743_1.pdf?1721582642000.pdf
煤炭周报：煤价震荡偏稳运行，看好迎峰度夏旺季需求,民生证券,2024-07-20,煤炭行业,https://pdf.dfcfw.com/pdf/H3_AP202407201638133335_1.pdf?1721511071000.pdf
煤炭行业：六大发电集团日均耗煤需求量增大，全样本独立焦企的产能利用率提升,东兴证券,2024-07-19,煤炭行业,https://pdf.dfcfw.com/pdf/H3_AP202407191638095966_1.pdf?1721411651000.pdf
6月煤炭供需数据全面解读：原煤生产由降转增，水电大增，火力发电阶段性降幅明显,国海证券,2024-07-17,煤炭行业,https://pdf.dfcfw.com/pdf/H3_AP202407161637976009_1.pdf?1721199398000.pdf
煤炭行业月报：国内生产逐步恢复，旺季需求值得期待,德邦证券,2024-07-16,煤炭行业,https://pdf.dfcfw.com/pdf/H3_AP202407161637961106_1.pdf?1721144190000.pdf
煤炭月度供需数据点评：动力煤价格环比改善，制造业投资延续高增,山西证券,2024-07-16,煤炭行业,https://pdf.dfcfw.com/pdf/H3_AP202407161637967158_1.pdf?1721153238000.pdf
煤炭行业周报：后市预期并不悲观，逢低布局良机再现,中泰证券,2024-07-15,煤炭行业,https://pdf.dfcfw.com/pdf/H3_AP202407151637909161_1.pdf?1721036765000.pdf
煤炭行业周报：入伏在即，动力煤向好趋势不变，等待下游库存拐点,华福证券,2024-07-15,煤炭行业,https://pdf.dfcfw.com/pdf/H3_AP202407151637909353_1.pdf?1721037408000.pdf
煤炭行业周报：高温延续动煤探涨，关注稳经济政策,山西证券,2024-07-15,煤炭行业,https://pdf.dfcfw.com/pdf/H3_AP202407151637922201_1.pdf?1721060562000.pdf
煤炭行业周报：煤企向合理且可持续的高盈利回归，高股息的基础,开源证券,2024-07-14,煤炭行业,https://pdf.dfcfw.com/pdf/H3_AP202407141637886303_1.pdf?1720965352000.pdf
煤炭开采行业跟踪周报：夏季高温拉动煤炭需求快速增长，煤价筑底反弹,东吴证券,2024-07-14,煤炭行业,https://pdf.dfcfw.com/pdf/H3_AP202407141637887168_1.pdf?1720967196000.pdf
煤炭周报：高温抬升日耗，煤价止跌反弹,德邦证券,2024-07-14,煤炭行业,https://pdf.dfcfw.com/pdf/H3_AP202407141637887232_1.pdf?1720968979000.pdf
煤炭开采行业周报：再显恐慌之良机，再明煤炭之大势,信达证券,2024-07-14,煤炭行业,https://pdf.dfcfw.com/pdf/H3_AP202407141637886919_1.pdf?1720969703000.pdf
煤炭行业周报（7月第2周）：需求转好，库存回落，短期有望反弹,国信证券,2024-07-14,煤炭行业,https://pdf.dfcfw.com/pdf/H3_AP202407141637891696_1.pdf?1720981944000.pdf
煤炭开采行业周报：日耗上升、行业去库；煤炭板块短期调整不改大方向,国海证券,2024-07-14,煤炭行业,https://pdf.dfcfw.com/pdf/H3_AP202407141637894883_1.pdf?1721039555000.pdf
煤炭周报：煤价企稳反弹，静待旺季需求兑现,民生证券,2024-07-13,煤炭行业,https://pdf.dfcfw.com/pdf/H3_AP202407131637870300_1.pdf?1720905112000.pdf
煤炭板块点评,第一上海证券,2024-07-12,煤炭行业,https://pdf.dfcfw.com/pdf/H3_AP202407121637825956_1.pdf?1720797665000.pdf
煤炭行业周报：多因素压制致24H1动力煤价中枢温和回落，后续旺季来临电煤需求即将释放,国投证券,2024-07-08,煤炭行业,https://pdf.dfcfw.com/pdf/H3_AP202407081637663491_1.pdf?1720423873000.pdf
煤炭行业周报：旺季已至，板块企稳反弹在即,德邦证券,2024-07-08,煤炭行业,https://pdf.dfcfw.com/pdf/H3_AP202407081637664068_1.pdf?1720425273000.pdf
煤炭行业周报：夏季日耗抬升，煤价反弹在即,中泰证券,2024-07-08,煤炭行业,https://pdf.dfcfw.com/pdf/H3_AP202407081637665089_1.pdf?1720428329000.pdf
煤炭行业周报：高温提振电煤需求，港口库存继续下行,山西证券,2024-07-08,煤炭行业,https://pdf.dfcfw.com/pdf/H3_AP202407081637668554_1.pdf?1720438869000.pdf
煤炭行业周报：南方高温持续，动力煤价格或完成筑底，短期高库存限制涨幅,华福证券,2024-07-08,煤炭行业,https://pdf.dfcfw.com/pdf/H3_AP202407081637668954_1.pdf?1720436598000.pdf
煤炭周报：电厂日耗提升明显，静待旺季需求兑现,民生证券,2024-07-07,煤炭行业,https://pdf.dfcfw.com/pdf/H3_AP202407071637631663_1.pdf?1720311971000.pdf
煤炭行业周报：日耗大涨带动库存下行，铁水日均产量仍存韧性行业周报,开源证券,2024-07-07,煤炭行业,https://pdf.dfcfw.com/pdf/H3_AP202407071637651004_1.pdf?1720424496000.pdf
煤炭行业周报（7月第1周）：电煤消费同比偏低，动力煤价短期企稳,国信证券,2024-07-07,煤炭行业,https://pdf.dfcfw.com/pdf/H3_AP202407071637651168_1.pdf?1720427078000.pdf
煤炭开采行业周报：电厂日耗全面迅速提升；澳洲焦煤矿井事故推升海外煤价,国海证券,2024-07-07,煤炭行业,https://pdf.dfcfw.com/pdf/H3_AP202407071637645482_1.pdf?1720373179000.pdf
煤炭开采行业跟踪周报：高温天气拉动需求，促煤炭高库存有效去化筑底煤价,东吴证券,2024-07-06,煤炭行业,https://pdf.dfcfw.com/pdf/H3_AP202407061637626980_1.pdf?1720294775000.pdf
煤炭开采行业周报：煤炭价格止跌企稳，提示关注炼焦煤配置机遇,信达证券,2024-07-06,煤炭行业,https://pdf.dfcfw.com/pdf/H3_AP202407061637627174_1.pdf?1720344672000.pdf
2024年度中期煤炭行业策略报告：坚如磐石，手摘星辰,华福证券,2024-07-04,煤炭行业,https://pdf.dfcfw.com/pdf/H3_AP202407041637540013_1.pdf?1720082042000.pdf
煤炭行业周报：主产区县政府被约谈，低日耗致煤价回调,海通国际,2024-07-04,煤炭行业,https://pdf.dfcfw.com/pdf/H3_AP202407041637547513_1.pdf?1720101284000.pdf
煤炭行业周报：“三伏”天将临，煤价有望企稳回升,中泰证券,2024-07-01,煤炭行业,https://pdf.dfcfw.com/pdf/H3_AP202407011637130121_1.pdf?1719828799000.pdf
煤炭行业深度报告：海外煤系列二：俄罗斯，量价视角分析俄煤流向,开源证券,2024-07-01,煤炭行业,https://pdf.dfcfw.com/pdf/H3_AP202407011637131460_1.pdf?1719833314000.pdf
煤炭行业周报：终端日耗延续回升，建议板块逢低加配,德邦证券,2024-07-01,煤炭行业,https://pdf.dfcfw.com/pdf/H3_AP202407011637128252_1.pdf?1719824350000.pdf
煤炭行业周报：气温回升在即动力煤有望止跌，焦炭首轮提涨落地炼焦煤暂稳运行,华福证券,2024-07-01,煤炭行业,https://pdf.dfcfw.com/pdf/H3_AP202407011637124603_1.pdf?1719827555000.pdf
煤炭行业月报（7月第1周）：下游库存高位，关注旺季需求兑现程度,国信证券,2024-07-01,煤炭行业,https://pdf.dfcfw.com/pdf/H3_AP202407011637124616_1.pdf?1719818040000.pdf
煤炭行业周报：港口库存降低，度峰需求仍存空间,山西证券,2024-07-01,煤炭行业,https://pdf.dfcfw.com/pdf/H3_AP202406301637116712_1.pdf?1719823777000.pdf
煤价跌幅或有限且仍具上涨空间煤炭开采,信达证券,2024-06-30,煤炭行业,https://pdf.dfcfw.com/pdf/H3_AP202406301637075324_1.pdf?1719740821000.pdf
煤炭行业周报：电厂日耗持续上行，铁水日均产量仍存韧性,开源证券,2024-06-30,煤炭行业,https://pdf.dfcfw.com/pdf/H3_AP202406301637101130_1.pdf?1719759476000.pdf
煤炭开采行业周报：动煤价格震荡；焦炭落实第一波涨价,国海证券,2024-06-30,煤炭行业,https://pdf.dfcfw.com/pdf/H3_AP202406301637115296_1.pdf?1719776027000.pdf
煤炭开采行业跟踪周报：高温天气拉动煤炭需求增加，旺季来临促煤价企稳,东吴证券,2024-06-29,煤炭行业,https://pdf.dfcfw.com/pdf/H3_AP202406291637062557_1.pdf?1719704233000.pdf
煤炭周报：煤价短期波动无虞，7月中旬行情有望启动,民生证券,2024-06-29,煤炭行业,https://pdf.dfcfw.com/pdf/H3_AP202406291637062543_1.pdf?1719704124000.pdf
煤炭行业月报（2024.05）：煤价阶段性承压，迎峰度夏旺季虽迟但到,华福证券,2024-06-28,煤炭行业,https://pdf.dfcfw.com/pdf/H3_AP202406281636995334_1.pdf?1719570883000.pdf
2024年5月煤炭行业月度数据,国信证券,2024-06-28,煤炭行业,https://pdf.dfcfw.com/pdf/H3_AP202406281637023206_1.pdf?1719601152000.pdf
