研报名称,机构名称,发布时间,行业,研报地址
煤炭开采行业跟踪周报：静待煤价旺季反弹，板块进攻属性开启在即,东吴证券,2024-04-21,煤炭行业,https://pdf.dfcfw.com/pdf/H3_AP202404211630920408_1.pdf?1713725370000.pdf
煤炭周报：需求企稳回升，煤价偏强运行,德邦证券,2024-04-21,煤炭行业,https://pdf.dfcfw.com/pdf/H3_AP202404211630920986_1.pdf?1713725586000.pdf
煤炭开采行业周报：3月原煤产量持续收缩，供给约束下煤价震荡有底,信达证券,2024-04-21,煤炭行业,https://pdf.dfcfw.com/pdf/H3_AP202404211630929726_1.pdf?1713725698000.pdf
煤炭行业周报：黑色产业链引领煤价反弹，煤炭核心价值资产再起,开源证券,2024-04-21,煤炭行业,https://pdf.dfcfw.com/pdf/H3_AP202404211630933293_1.pdf?1713776584000.pdf
煤炭开采行业周报：全国3月煤炭产量维持负增长；煤炭价格全方面上涨,国海证券,2024-04-21,煤炭行业,https://pdf.dfcfw.com/pdf/H3_AP202404211630934296_1.pdf?1713730271000.pdf
煤炭行业3月数据全面解读：煤炭产量维持负增长，火电增速回落,国海证券,2024-04-18,煤炭行业,https://pdf.dfcfw.com/pdf/H3_AP202404181630496101_1.pdf?1713426740000.pdf
煤炭行业周报：山西省上调煤炭资源税率，焦煤价格或将触底反弹,上海证券,2024-04-18,煤炭行业,https://pdf.dfcfw.com/pdf/H3_AP202404181630510922_1.pdf?1713457520000.pdf
煤炭信用专题报告：冀中化债启示录,山西证券,2024-04-18,煤炭行业,https://pdf.dfcfw.com/pdf/H3_AP202404181630524074_1.pdf?1713466279000.pdf
煤炭月度供需数据点评：3月原煤供给收缩，制造业投资高增,山西证券,2024-04-17,煤炭行业,https://pdf.dfcfw.com/pdf/H3_AP202404171630392513_1.pdf?1713350799000.pdf
煤炭行业月报：供给维持弱势，需求震荡筑底,德邦证券,2024-04-17,煤炭行业,https://pdf.dfcfw.com/pdf/H3_AP202404171630437584_1.pdf?1713389041000.pdf
煤炭行业点评报告：黑色产业链全面梳理：炼焦煤否极泰来？,开源证券,2024-04-16,煤炭行业,https://pdf.dfcfw.com/pdf/H3_AP202404161630273677_1.pdf?1713276686000.pdf
煤炭行业周报：动力煤价止跌反弹，黑色利润开启修复,德邦证券,2024-04-15,煤炭行业,https://pdf.dfcfw.com/pdf/H3_AP202404151630210837_1.pdf?1713180454000.pdf
煤炭行业周报：新“国九条”要求强化上市公司现金分红监管，持续看好煤炭板块投资机会,国投证券,2024-04-15,煤炭行业,https://pdf.dfcfw.com/pdf/H3_AP202404151630210930_1.pdf?1713170346000.pdf
煤炭行业周报（4月第3周）：煤炭价格反弹，需求决定空间,国信证券,2024-04-15,煤炭行业,https://pdf.dfcfw.com/pdf/H3_AP202404151630210935_1.pdf?1713172149000.pdf
煤炭行业周报：供需格局持续改善，焦煤价格反弹在即,中泰证券,2024-04-15,煤炭行业,https://pdf.dfcfw.com/pdf/H3_AP202404151630211097_1.pdf?1713170426000.pdf
煤炭行业事件点评：煤矿产能储备落地，增加供给弹性,民生证券,2024-04-14,煤炭行业,https://pdf.dfcfw.com/pdf/H3_AP202404121630196168_1.pdf?1713086554000.pdf
煤炭开采行业跟踪周报：淡季需求延续弱势，煤价企稳震荡,东吴证券,2024-04-14,煤炭行业,https://pdf.dfcfw.com/pdf/H3_AP202404141630207495_1.pdf?1713054043000.pdf
煤炭行业点评：山西省煤炭资源税上调落地，焦煤价格支撑更强,德邦证券,2024-04-14,煤炭行业,https://pdf.dfcfw.com/pdf/H3_AP202404141630208018_1.pdf?1713102866000.pdf
煤炭行业周报：焦炭八轮提降落地，下游需求逐渐明确,华福证券,2024-04-14,煤炭行业,https://pdf.dfcfw.com/pdf/H3_AP202404141630208076_1.pdf?1713115701000.pdf
煤炭开采行业周报：煤炭产能储备政策落地，供给约束仍是板块配置的底层逻辑,信达证券,2024-04-14,煤炭行业,https://pdf.dfcfw.com/pdf/H3_AP202404141630208164_1.pdf?1713115402000.pdf
煤炭行业周报：炼焦煤可以乐观起来,山西证券,2024-04-14,煤炭行业,https://pdf.dfcfw.com/pdf/H3_AP202404141630208179_1.pdf?1713115483000.pdf
煤炭行业周报：煤价已有企稳迹象，煤炭核心价值资产再起,开源证券,2024-04-14,煤炭行业,https://pdf.dfcfw.com/pdf/H3_AP202404141630209174_1.pdf?1713116841000.pdf
煤炭开采行业周报：焦煤行情如期回暖；山西省上调煤炭资源税如期落地,国海证券,2024-04-14,煤炭行业,https://pdf.dfcfw.com/pdf/H3_AP202404141630209819_1.pdf?1713168081000.pdf
煤炭周报：煤价企稳，基本面边际向好加速板块估值提升,民生证券,2024-04-13,煤炭行业,https://pdf.dfcfw.com/pdf/H3_AP202404131630207037_1.pdf?1713025207000.pdf
煤炭行业点评报告：从提高煤炭资源税，探讨地方财政和煤价走势,开源证券,2024-04-13,煤炭行业,https://pdf.dfcfw.com/pdf/H3_AP202404131630207354_1.pdf?1713086554000.pdf
煤炭行业深度报告：海外煤系列一：印度，全球及中国煤炭格局的新变量,开源证券,2024-04-11,煤炭行业,https://pdf.dfcfw.com/pdf/H3_AP202404111630142051_1.pdf?1712845275000.pdf
煤炭行业事件点评：山西资源税税率提升落地，对业绩影响相对有限,民生证券,2024-04-11,煤炭行业,https://pdf.dfcfw.com/pdf/H3_AP202404111630163088_1.pdf?1712870862000.pdf
煤炭行业周报：海外煤价上涨，1-2月煤炭累计进口再创新高,上海证券,2024-04-10,煤炭行业,https://pdf.dfcfw.com/pdf/H3_AP202404101630104794_1.pdf?1712755210000.pdf
2024年一季度煤炭债复盘：融资环境改善，行业或迎发债窗口期,山西证券,2024-04-10,煤炭行业,https://pdf.dfcfw.com/pdf/H3_AP202404101630109077_1.pdf?1712764261000.pdf
煤炭行业点评报告：铁水和原油利多变化，煤炭高股息与周期弹性共振,开源证券,2024-04-09,煤炭行业,https://pdf.dfcfw.com/pdf/H3_AP202404081630062870_1.pdf?1712647505000.pdf
煤炭行业点评报告：山西减产显著，煤炭生产与进口收缩利多煤价,开源证券,2024-04-09,煤炭行业,https://pdf.dfcfw.com/pdf/H3_AP202404091630074377_1.pdf?1712679870000.pdf
煤炭周报：淡季煤价磨底，关注复苏斜率,德邦证券,2024-04-08,煤炭行业,https://pdf.dfcfw.com/pdf/H3_AP202404081630040454_1.pdf?1712567270000.pdf
煤炭行业周报（4月第2周）：二季度焦煤长协确定，关注焦煤基本面改善,国信证券,2024-04-08,煤炭行业,https://pdf.dfcfw.com/pdf/H3_AP202404081630040512_1.pdf?1712566072000.pdf
煤炭行业23年业绩总结及24年Q1业绩前瞻：2023年业绩下降、分红提升，2024Q1业绩仍有压力,国信证券,2024-04-08,煤炭行业,https://pdf.dfcfw.com/pdf/H3_AP202404081630040511_1.pdf?1712566072000.pdf
煤炭行业周报：原油价格强势延续，全球煤价或将上涨,中泰证券,2024-04-08,煤炭行业,https://pdf.dfcfw.com/pdf/H3_AP202404081630041983_1.pdf?1712569621000.pdf
煤炭开采行业周报：黑色系预期边际改善值得重视,国海证券,2024-04-08,煤炭行业,https://pdf.dfcfw.com/pdf/H3_AP202404081630062968_1.pdf?1712647599000.pdf
煤炭开采行业简评报告：淡季煤价触底在即，重视当前配置机会,首创证券,2024-04-07,煤炭行业,https://pdf.dfcfw.com/pdf/H3_AP202404071630033168_1.pdf?1712484878000.pdf
煤价震荡有底，再度提示板块逢低配置煤炭开采,信达证券,2024-04-07,煤炭行业,https://pdf.dfcfw.com/pdf/H3_AP202404071630033569_1.pdf?1712489485000.pdf
煤炭行业周报：动力煤淡季需求提振乏力，关注炼焦煤下游持续复苏,华福证券,2024-04-07,煤炭行业,https://pdf.dfcfw.com/pdf/H3_AP202404071630034345_1.pdf?1712496673000.pdf
煤炭行业周报：高股息与周期弹性兼备，煤炭核心价值资产或再起,开源证券,2024-04-07,煤炭行业,https://pdf.dfcfw.com/pdf/H3_AP202404071630036909_1.pdf?1712511709000.pdf
煤炭开采行业跟踪周报：淡季需求表现疲弱，港口煤价震荡运行,东吴证券,2024-04-06,煤炭行业,https://pdf.dfcfw.com/pdf/H3_AP202404061630032178_1.pdf?1712479870000.pdf
煤炭周报：库存加速去化或致煤价见底企稳，看好煤炭板块估值提升,民生证券,2024-04-06,煤炭行业,https://pdf.dfcfw.com/pdf/H3_AP202404061630032220_1.pdf?1712444520000.pdf
能源周观点：美国天然气减产规模继续扩大,国金证券,2024-04-03,煤炭行业,https://pdf.dfcfw.com/pdf/H3_AP202404031629688760_1.pdf?1712144007000.pdf
煤炭行业深度报告：“双碳”角度煤炭行业中长期发展前瞻,山西证券,2024-04-02,煤炭行业,https://pdf.dfcfw.com/pdf/H3_AP202404021629427404_1.pdf?1712084731000.pdf
煤炭行业周报：大秦线春季检修降至影响煤炭运量，焦炭第七轮提降落地降价空间有限,华福证券,2024-04-01,煤炭行业,https://pdf.dfcfw.com/pdf/H3_AP202404011629191805_1.pdf?1711967544000.pdf
煤炭行业周报：坑口煤价突围探涨，港口煤价止跌在即,中泰证券,2024-04-01,煤炭行业,https://pdf.dfcfw.com/pdf/H3_AP202404011629191911_1.pdf?1711959965000.pdf
煤炭行业周报：PMI回升释放积极信号，关注需求恢复力度,国投证券,2024-04-01,煤炭行业,https://pdf.dfcfw.com/pdf/H3_AP202404011629195373_1.pdf?1711970369000.pdf
煤炭行业月报（4月第1周）：动力煤价跌势趋缓，焦煤价格有望反弹,国信证券,2024-04-01,煤炭行业,https://pdf.dfcfw.com/pdf/H3_AP202404011629195378_1.pdf?1711970931000.pdf
煤炭周报：煤价震荡偏弱，静待需求复苏,德邦证券,2024-04-01,煤炭行业,https://pdf.dfcfw.com/pdf/H3_AP202404011629191708_1.pdf?1711961662000.pdf
煤炭周报：供需紧格局不改，把握短期回调机会,民生证券,2024-03-31,煤炭行业,https://pdf.dfcfw.com/pdf/H3_AP202403311629186667_1.pdf?1711884626000.pdf
煤炭行业周报：煤价筑底及新逻辑显现，煤炭核心价值资产或再起,开源证券,2024-03-31,煤炭行业,https://pdf.dfcfw.com/pdf/H3_AP202403311629187404_1.pdf?1711898836000.pdf
煤炭开采行业周报：2024财年印度冶金煤进口预计增长5%，关注炼焦煤配置煤炭开采,信达证券,2024-03-31,煤炭行业,https://pdf.dfcfw.com/pdf/H3_AP202403311629187495_1.pdf?1711899506000.pdf
煤炭开采行业跟踪周报：淡季需求维持弱势，港口煤价企稳震荡,东吴证券,2024-03-31,煤炭行业,https://pdf.dfcfw.com/pdf/H3_AP202403311629187529_1.pdf?1711898104000.pdf
煤炭开采行业周报：主产区部分煤矿上调价格，大秦线检修在即，港口库存有望进一步回落,国海证券,2024-03-31,煤炭行业,https://pdf.dfcfw.com/pdf/H3_AP202403311629189024_1.pdf?1711956414000.pdf
煤炭行业周报：多部门发文督促、倡议长协履约，3月PMI大幅回升,山西证券,2024-03-31,煤炭行业,https://pdf.dfcfw.com/pdf/H3_AP202403311629189924_1.pdf?1711957724000.pdf
煤炭行业周报：煤企业绩陆续发布，高分红彰显板块价值,上海证券,2024-03-29,煤炭行业,https://pdf.dfcfw.com/pdf/H3_AP202403291629026681_1.pdf?1711708289000.pdf
煤炭开采行业简评报告：煤价有望触底，看好当前再次配置时机,首创证券,2024-03-28,煤炭行业,https://pdf.dfcfw.com/pdf/H3_AP202403281628430644_1.pdf?1711619401000.pdf
2024年1-2月煤炭行业月度数据,国信证券,2024-03-27,煤炭行业,https://pdf.dfcfw.com/pdf/H3_AP202403271628289737_1.pdf?1711531642000.pdf
煤炭行业：国际海运费明显上涨，动力煤进口量减少,东兴证券,2024-03-26,煤炭行业,https://pdf.dfcfw.com/pdf/H3_AP202403261628184644_1.pdf?1711475564000.pdf
煤炭行业周报（3月第4周）：下游采购致煤价反弹，关注需求持续性,国信证券,2024-03-25,煤炭行业,https://pdf.dfcfw.com/pdf/H3_AP202403251628066554_1.pdf?1711354677000.pdf
煤炭行业周报：产量同比下滑，静待需求复苏；年报陆续发布，分红强化价值,国投证券,2024-03-25,煤炭行业,https://pdf.dfcfw.com/pdf/H3_AP202403251628067037_1.pdf?1711355596000.pdf
煤炭行业周报：下游呈现复苏迹象，双焦需求兑现难以一蹴而就，库存已至历史低位,华福证券,2024-03-25,煤炭行业,https://pdf.dfcfw.com/pdf/H3_AP202403251628067597_1.pdf?1711364356000.pdf
煤炭行业周报：库存低位下行，双焦期价反弹,山西证券,2024-03-25,煤炭行业,https://pdf.dfcfw.com/pdf/H3_AP202403251628069002_1.pdf?1711362614000.pdf
煤炭行业周报：产量同比下滑，静待需求复苏；年报陆领先大市-A续发布，分红强化价值,国投证券,2024-03-25,煤炭行业,https://pdf.dfcfw.com/pdf/H3_AP202403251628066173_1.pdf?1711329954000.pdf
煤炭行业周报：中国神华高比例分红提振板块信心，港口煤价止跌企稳缓释悲观情绪,中泰证券,2024-03-25,煤炭行业,https://pdf.dfcfw.com/pdf/H3_AP202403251628071075_1.pdf?1711379471000.pdf
动力煤 头豹词条报告系列,头豹研究院,2024-03-25,煤炭行业,https://pdf.dfcfw.com/pdf/H3_AP202403251628092511_1.pdf?1711396718000.pdf
煤炭开采：煤价趋稳且仍具上涨弹性，煤炭配置正当时,信达证券,2024-03-24,煤炭行业,https://pdf.dfcfw.com/pdf/H3_AP202403241628064035_1.pdf?1711355135000.pdf
能源开采行业深度研究：煤炭股波段运行节奏复盘及展望：2021-2024,天风证券,2024-03-24,煤炭行业,https://pdf.dfcfw.com/pdf/H3_AP202403241628064077_1.pdf?1711286677000.pdf
煤炭周报：煤价止跌企稳，板块价值凸显,德邦证券,2024-03-24,煤炭行业,https://pdf.dfcfw.com/pdf/H3_AP202403241628064317_1.pdf?1711293919000.pdf
煤炭开采行业周报：煤炭市场情绪有所好转，建材钢材需求环比持续回升,国海证券,2024-03-24,煤炭行业,https://pdf.dfcfw.com/pdf/H3_AP202403241628065583_1.pdf?1711364071000.pdf
煤炭行业周报：煤价或企稳，煤炭核心价值资产有望再起,开源证券,2024-03-24,煤炭行业,https://pdf.dfcfw.com/pdf/H3_AP202403241628065709_1.pdf?1711350921000.pdf
煤炭开采行业跟踪周报：淡季需求维持弱势，煤价短期承压震荡,东吴证券,2024-03-23,煤炭行业,https://pdf.dfcfw.com/pdf/H3_AP202403231628062947_1.pdf?1711234478000.pdf
煤炭周报：煤价跌幅收窄，板块业绩发布催化估值提升行情,民生证券,2024-03-23,煤炭行业,https://pdf.dfcfw.com/pdf/H3_AP202403231628062979_1.pdf?1711236947000.pdf
煤炭行业深度报告系列（二）：炼焦煤：供需关系或进一步收紧，多重因素对价格形成支撑,华福证券,2024-03-22,煤炭行业,https://pdf.dfcfw.com/pdf/H3_AP202403221627608481_1.pdf?1711115259000.pdf
煤炭进口数据拆解：海外价差收窄，进口煤预期下修,山西证券,2024-03-22,煤炭行业,https://pdf.dfcfw.com/pdf/H3_AP202403221627608976_1.pdf?1711114675000.pdf
煤炭行业深度报告系列（一）：动力煤，2023年供需过剩逐步减轻，2024年供需或将回到紧平衡,华福证券,2024-03-21,煤炭行业,https://pdf.dfcfw.com/pdf/H3_AP202403211627427551_1.pdf?1711009823000.pdf
煤炭行业周报：短期供需错配致煤价下行，静待需求回暖,上海证券,2024-03-21,煤炭行业,https://pdf.dfcfw.com/pdf/H3_AP202403211627428541_1.pdf?1711012682000.pdf
煤炭行业月报：产量收缩开启，静待需求复苏,德邦证券,2024-03-20,煤炭行业,https://pdf.dfcfw.com/pdf/H3_AP202403201627279239_1.pdf?1710923043000.pdf
海外煤炭行业月报：海外煤炭供需形势报告,第一上海证券,2024-03-20,煤炭行业,https://pdf.dfcfw.com/pdf/H3_AP202403201627310864_1.pdf?1710942048000.pdf
煤炭开采行业简评报告：不惧淡季调整，静待需求风起,首创证券,2024-03-19,煤炭行业,https://pdf.dfcfw.com/pdf/H3_AP202403191627110036_1.pdf?1710837644000.pdf
煤炭月度供需数据点评：供给增速放缓，火电需求超预期,山西证券,2024-03-19,煤炭行业,https://pdf.dfcfw.com/pdf/H3_AP202403191627140112_1.pdf?1710870357000.pdf
煤炭行业周报：需求短期不及预期，关注两会后经济复苏情况,海通国际,2024-03-19,煤炭行业,https://pdf.dfcfw.com/pdf/H3_AP202403191627141943_1.pdf?1710873052000.pdf
煤炭行业1-2月数据全面解读：产量下降，火电需求高增,国海证券,2024-03-19,煤炭行业,https://pdf.dfcfw.com/pdf/H3_AP202403191627142596_1.pdf?1710873157000.pdf
煤炭行业周报（3月第3周）：动力煤支撑较弱，焦煤看蒙煤成本与铁水量,国信证券,2024-03-18,煤炭行业,https://pdf.dfcfw.com/pdf/H3_AP202403181626958297_1.pdf?1710748420000.pdf
煤炭行业周报：需求偏弱致价格下行，短期波动不改长期价值,国投证券,2024-03-18,煤炭行业,https://pdf.dfcfw.com/pdf/H3_AP202403181626958741_1.pdf?1710749636000.pdf
煤炭周报：淡旺季切换煤价偏弱，关注需求复苏节奏,德邦证券,2024-03-18,煤炭行业,https://pdf.dfcfw.com/pdf/H3_AP202403181626959142_1.pdf?1710752295000.pdf
2024年1-2月煤炭行业供需数据解读：供给收缩，火电需求超预期,民生证券,2024-03-18,煤炭行业,https://pdf.dfcfw.com/pdf/H3_AP202403181626977931_1.pdf?1710787752000.pdf
金融“碳”索系列（五）：全国碳市场扩容在即，绿电需求值得关注,平安证券,2024-03-18,煤炭行业,https://pdf.dfcfw.com/pdf/H3_AP202403181626965513_1.pdf?1710773078000.pdf
煤炭开采行业周报：动力煤价下行但有支撑，仍看好煤炭核心资产价值,开源证券,2024-03-17,煤炭行业,https://pdf.dfcfw.com/pdf/H3_AP202403171626952804_1.pdf?1710676582000.pdf
煤炭开采行业周报：客观看待煤价淡旺季波动，重点把握现阶段煤炭配置机遇煤炭开采,信达证券,2024-03-17,煤炭行业,https://pdf.dfcfw.com/pdf/H3_AP202403171626952841_1.pdf?1710691830000.pdf
煤炭开采行业跟踪周报：淡季需求弱势运行，煤价短期承压震荡,东吴证券,2024-03-17,煤炭行业,https://pdf.dfcfw.com/pdf/H3_AP202403171626953539_1.pdf?1710687198000.pdf
煤炭行业周报：焦炭第五轮提降落地，关注需求恢复进展,华福证券,2024-03-17,煤炭行业,https://pdf.dfcfw.com/pdf/H3_AP202403171626954009_1.pdf?1710701015000.pdf
煤炭行业周报：两大探矿权拍出高价，价值重估有望开启,中泰证券,2024-03-17,煤炭行业,https://pdf.dfcfw.com/pdf/H3_AP202403171626954048_1.pdf?1710691294000.pdf
煤炭开采行业周报：山西以总价超200亿元成交两笔探矿权，二级市场的煤炭资源价值亟待重估,国海证券,2024-03-17,煤炭行业,https://pdf.dfcfw.com/pdf/H3_AP202403171626954166_1.pdf?1710700600000.pdf
煤炭行业周报：炼焦煤库存持续低位，关注后期库存变化,山西证券,2024-03-17,煤炭行业,https://pdf.dfcfw.com/pdf/H3_AP202403171626955065_1.pdf?1710756061000.pdf
煤炭周报：需求弱势叠加贸易商出货致煤价下行，后市有望企稳,民生证券,2024-03-16,煤炭行业,https://pdf.dfcfw.com/pdf/H3_AP202403161626948940_1.pdf?1710611216000.pdf
煤炭开采行业简评报告：供需双弱价格短期承压，预计下行空间有限,首创证券,2024-03-12,煤炭行业,https://pdf.dfcfw.com/pdf/H3_AP202403121626418502_1.pdf?1710232637000.pdf
煤炭行业复盘报告：2003年以来煤炭股五阶段深度历史复盘,国海证券,2024-03-12,煤炭行业,https://pdf.dfcfw.com/pdf/H3_AP202403121626462110_1.pdf?1710273061000.pdf
煤炭周报：两会释放积极信号，非电需求预期向好,德邦证券,2024-03-11,煤炭行业,https://pdf.dfcfw.com/pdf/H3_AP202403111626210126_1.pdf?1710149585000.pdf
煤炭行业周报：“以稳为主”成2024年煤炭生产主要思路，“强安监”或持续限制产能释放,国投证券,2024-03-11,煤炭行业,https://pdf.dfcfw.com/pdf/H3_AP202403111626210717_1.pdf?1710150161000.pdf
煤炭开采行业跟踪周报：安监高压态势延续，煤价维持震荡运行,东吴证券,2024-03-10,煤炭行业,https://pdf.dfcfw.com/pdf/H3_AP202403101626199325_1.pdf?1710073136000.pdf
海外煤价持续上涨，有望支撑国内煤价企稳回升煤炭开采,信达证券,2024-03-10,煤炭行业,https://pdf.dfcfw.com/pdf/H3_AP202403101626199360_1.pdf?1710073821000.pdf
煤炭开采行业周报：关注开工及双碳政策，重视煤炭核心资产价值,开源证券,2024-03-10,煤炭行业,https://pdf.dfcfw.com/pdf/H3_AP202403101626199827_1.pdf?1710085909000.pdf
煤炭行业周报（3月第2周）：海外煤价和电厂采购支撑煤价,国信证券,2024-03-10,煤炭行业,https://pdf.dfcfw.com/pdf/H3_AP202403101626200757_1.pdf?1710086921000.pdf
煤炭行业周报：供需错配煤价承压下行，关注炼焦煤低库存和需求恢复预期,华福证券,2024-03-10,煤炭行业,https://pdf.dfcfw.com/pdf/H3_AP202403101626200783_1.pdf?1710093203000.pdf
煤炭行业周报：安检预期收紧，煤价降幅有限,中泰证券,2024-03-10,煤炭行业,https://pdf.dfcfw.com/pdf/H3_AP202403101626200804_1.pdf?1710086331000.pdf
煤炭开采行业周报：进口动力煤呈现倒挂，国内港口煤价迎来强支撑,国海证券,2024-03-10,煤炭行业,https://pdf.dfcfw.com/pdf/H3_AP202403101626200913_1.pdf?1710093554000.pdf
煤炭行业周报：进入“金三银四”，关注下游需求增加,山西证券,2024-03-10,煤炭行业,https://pdf.dfcfw.com/pdf/H3_AP202403101626202465_1.pdf?1710142340000.pdf
煤炭周报：煤价短期波动无虞，资源中长期紧缺下行业投资价值凸显,民生证券,2024-03-09,煤炭行业,https://pdf.dfcfw.com/pdf/H3_AP202403091626187119_1.pdf?1709998934000.pdf
海外煤炭专题之一：印度—能源和钢铁消费有望带动煤炭需求持续增长,海通国际,2024-03-08,煤炭行业,https://pdf.dfcfw.com/pdf/H3_AP202403081626049882_1.pdf?1709928876000.pdf
煤炭行业周报：23年煤炭消费量同比增长5.6%，后市关注非电需求,上海证券,2024-03-07,煤炭行业,https://pdf.dfcfw.com/pdf/H3_AP202403071625929915_1.pdf?1709820709000.pdf
