研报名称,机构名称,发布时间,行业,研报地址
煤炭开采行业专题研究：2024Q2主动型基金在煤炭行业持仓比例持续提升,国海证券,2024-07-23,煤炭行业,https://pdf.dfcfw.com/pdf/H3_AP202407231638211113_1.pdf?1721726429000.pdf
能源周观点：是时候关注原油需求端积累的风险了,国金证券,2024-07-23,煤炭行业,https://pdf.dfcfw.com/pdf/H3_AP202407231638216927_1.pdf?1721743722000.pdf
煤炭行业周报：上半年煤矿安监趋严，生产端供给收缩,国投证券,2024-07-22,煤炭行业,https://pdf.dfcfw.com/pdf/H3_AP202407211638160113_1.pdf?1721632021000.pdf
煤炭周报：板块逻辑未变，调整即为布局良机,德邦证券,2024-07-22,煤炭行业,https://pdf.dfcfw.com/pdf/H3_AP202407221638168389_1.pdf?1721644823000.pdf
煤炭行业周报：三中全会利好供需基本面，煤炭板块超跌布局在当下,中泰证券,2024-07-22,煤炭行业,https://pdf.dfcfw.com/pdf/H3_AP202407221638169462_1.pdf?1721637182000.pdf
煤炭行业周报：高温持续情绪提振，电厂高日耗支撑煤价,华福证券,2024-07-22,煤炭行业,https://pdf.dfcfw.com/pdf/H3_AP202407221638171741_1.pdf?1721647629000.pdf
2024年二季度煤炭债复盘：行业策略纵深有所突破,山西证券,2024-07-22,煤炭行业,https://pdf.dfcfw.com/pdf/H3_AP202407221638175842_1.pdf?1721650562000.pdf
煤炭开采行业周报：去库加速或将催涨煤价，再度建议逢低配置煤炭,信达证券,2024-07-21,煤炭行业,https://pdf.dfcfw.com/pdf/H3_AP202407211638145477_1.pdf?1721557335000.pdf
煤炭开采行业跟踪周报：供需双弱，库存略有去化促煤价筑底,东吴证券,2024-07-21,煤炭行业,https://pdf.dfcfw.com/pdf/H3_AP202407211638147603_1.pdf?1721564418000.pdf
能源开采行业2024H动力煤策略：价格波澜不惊，红利仍为主线,天风证券,2024-07-21,煤炭行业,https://pdf.dfcfw.com/pdf/H3_AP202407211638156776_1.pdf?1721594746000.pdf
煤炭开采行业周报：日耗延续上升，港口及电厂库存去化明显,国海证券,2024-07-21,煤炭行业,https://pdf.dfcfw.com/pdf/H3_AP202407211638159590_1.pdf?1721643838000.pdf
24Q2煤炭行业基金持仓分析：市值推动持仓份额提升，看好迎峰度夏旺季需求,民生证券,2024-07-21,煤炭行业,https://pdf.dfcfw.com/pdf/H3_AP202407201638135261_1.pdf?1721573842000.pdf
煤炭行业周报：电厂日耗水平创年内新高，铁水日均产量上行行业周报,开源证券,2024-07-21,煤炭行业,https://pdf.dfcfw.com/pdf/H3_AP202407211638149909_1.pdf?1721575402000.pdf
煤炭行业周报：供需双弱终端去库，动力煤价格以稳为主,山西证券,2024-07-21,煤炭行业,https://pdf.dfcfw.com/pdf/H3_AP202407211638152743_1.pdf?1721582642000.pdf
煤炭周报：煤价震荡偏稳运行，看好迎峰度夏旺季需求,民生证券,2024-07-20,煤炭行业,https://pdf.dfcfw.com/pdf/H3_AP202407201638133335_1.pdf?1721511071000.pdf
煤炭行业：六大发电集团日均耗煤需求量增大，全样本独立焦企的产能利用率提升,东兴证券,2024-07-19,煤炭行业,https://pdf.dfcfw.com/pdf/H3_AP202407191638095966_1.pdf?1721411651000.pdf
6月煤炭供需数据全面解读：原煤生产由降转增，水电大增，火力发电阶段性降幅明显,国海证券,2024-07-17,煤炭行业,https://pdf.dfcfw.com/pdf/H3_AP202407161637976009_1.pdf?1721199398000.pdf
煤炭行业月报：国内生产逐步恢复，旺季需求值得期待,德邦证券,2024-07-16,煤炭行业,https://pdf.dfcfw.com/pdf/H3_AP202407161637961106_1.pdf?1721144190000.pdf
煤炭月度供需数据点评：动力煤价格环比改善，制造业投资延续高增,山西证券,2024-07-16,煤炭行业,https://pdf.dfcfw.com/pdf/H3_AP202407161637967158_1.pdf?1721153238000.pdf
煤炭行业周报：后市预期并不悲观，逢低布局良机再现,中泰证券,2024-07-15,煤炭行业,https://pdf.dfcfw.com/pdf/H3_AP202407151637909161_1.pdf?1721036765000.pdf
煤炭行业周报：入伏在即，动力煤向好趋势不变，等待下游库存拐点,华福证券,2024-07-15,煤炭行业,https://pdf.dfcfw.com/pdf/H3_AP202407151637909353_1.pdf?1721037408000.pdf
煤炭行业周报：高温延续动煤探涨，关注稳经济政策,山西证券,2024-07-15,煤炭行业,https://pdf.dfcfw.com/pdf/H3_AP202407151637922201_1.pdf?1721060562000.pdf
煤炭行业周报：煤企向合理且可持续的高盈利回归，高股息的基础,开源证券,2024-07-14,煤炭行业,https://pdf.dfcfw.com/pdf/H3_AP202407141637886303_1.pdf?1720965352000.pdf
煤炭开采行业跟踪周报：夏季高温拉动煤炭需求快速增长，煤价筑底反弹,东吴证券,2024-07-14,煤炭行业,https://pdf.dfcfw.com/pdf/H3_AP202407141637887168_1.pdf?1720967196000.pdf
煤炭周报：高温抬升日耗，煤价止跌反弹,德邦证券,2024-07-14,煤炭行业,https://pdf.dfcfw.com/pdf/H3_AP202407141637887232_1.pdf?1720968979000.pdf
煤炭开采行业周报：再显恐慌之良机，再明煤炭之大势,信达证券,2024-07-14,煤炭行业,https://pdf.dfcfw.com/pdf/H3_AP202407141637886919_1.pdf?1720969703000.pdf
煤炭行业周报（7月第2周）：需求转好，库存回落，短期有望反弹,国信证券,2024-07-14,煤炭行业,https://pdf.dfcfw.com/pdf/H3_AP202407141637891696_1.pdf?1720981944000.pdf
煤炭开采行业周报：日耗上升、行业去库；煤炭板块短期调整不改大方向,国海证券,2024-07-14,煤炭行业,https://pdf.dfcfw.com/pdf/H3_AP202407141637894883_1.pdf?1721039555000.pdf
煤炭周报：煤价企稳反弹，静待旺季需求兑现,民生证券,2024-07-13,煤炭行业,https://pdf.dfcfw.com/pdf/H3_AP202407131637870300_1.pdf?1720905112000.pdf
煤炭板块点评,第一上海证券,2024-07-12,煤炭行业,https://pdf.dfcfw.com/pdf/H3_AP202407121637825956_1.pdf?1720797665000.pdf
煤炭行业周报：多因素压制致24H1动力煤价中枢温和回落，后续旺季来临电煤需求即将释放,国投证券,2024-07-08,煤炭行业,https://pdf.dfcfw.com/pdf/H3_AP202407081637663491_1.pdf?1720423873000.pdf
煤炭行业周报：旺季已至，板块企稳反弹在即,德邦证券,2024-07-08,煤炭行业,https://pdf.dfcfw.com/pdf/H3_AP202407081637664068_1.pdf?1720425273000.pdf
煤炭行业周报：夏季日耗抬升，煤价反弹在即,中泰证券,2024-07-08,煤炭行业,https://pdf.dfcfw.com/pdf/H3_AP202407081637665089_1.pdf?1720428329000.pdf
煤炭行业周报：高温提振电煤需求，港口库存继续下行,山西证券,2024-07-08,煤炭行业,https://pdf.dfcfw.com/pdf/H3_AP202407081637668554_1.pdf?1720438869000.pdf
煤炭行业周报：南方高温持续，动力煤价格或完成筑底，短期高库存限制涨幅,华福证券,2024-07-08,煤炭行业,https://pdf.dfcfw.com/pdf/H3_AP202407081637668954_1.pdf?1720436598000.pdf
煤炭周报：电厂日耗提升明显，静待旺季需求兑现,民生证券,2024-07-07,煤炭行业,https://pdf.dfcfw.com/pdf/H3_AP202407071637631663_1.pdf?1720311971000.pdf
煤炭行业周报：日耗大涨带动库存下行，铁水日均产量仍存韧性行业周报,开源证券,2024-07-07,煤炭行业,https://pdf.dfcfw.com/pdf/H3_AP202407071637651004_1.pdf?1720424496000.pdf
煤炭行业周报（7月第1周）：电煤消费同比偏低，动力煤价短期企稳,国信证券,2024-07-07,煤炭行业,https://pdf.dfcfw.com/pdf/H3_AP202407071637651168_1.pdf?1720427078000.pdf
煤炭开采行业周报：电厂日耗全面迅速提升；澳洲焦煤矿井事故推升海外煤价,国海证券,2024-07-07,煤炭行业,https://pdf.dfcfw.com/pdf/H3_AP202407071637645482_1.pdf?1720373179000.pdf
煤炭开采行业跟踪周报：高温天气拉动需求，促煤炭高库存有效去化筑底煤价,东吴证券,2024-07-06,煤炭行业,https://pdf.dfcfw.com/pdf/H3_AP202407061637626980_1.pdf?1720294775000.pdf
煤炭开采行业周报：煤炭价格止跌企稳，提示关注炼焦煤配置机遇,信达证券,2024-07-06,煤炭行业,https://pdf.dfcfw.com/pdf/H3_AP202407061637627174_1.pdf?1720344672000.pdf
2024年度中期煤炭行业策略报告：坚如磐石，手摘星辰,华福证券,2024-07-04,煤炭行业,https://pdf.dfcfw.com/pdf/H3_AP202407041637540013_1.pdf?1720082042000.pdf
煤炭行业周报：主产区县政府被约谈，低日耗致煤价回调,海通国际,2024-07-04,煤炭行业,https://pdf.dfcfw.com/pdf/H3_AP202407041637547513_1.pdf?1720101284000.pdf
煤炭行业周报：“三伏”天将临，煤价有望企稳回升,中泰证券,2024-07-01,煤炭行业,https://pdf.dfcfw.com/pdf/H3_AP202407011637130121_1.pdf?1719828799000.pdf
煤炭行业深度报告：海外煤系列二：俄罗斯，量价视角分析俄煤流向,开源证券,2024-07-01,煤炭行业,https://pdf.dfcfw.com/pdf/H3_AP202407011637131460_1.pdf?1719833314000.pdf
煤炭行业周报：终端日耗延续回升，建议板块逢低加配,德邦证券,2024-07-01,煤炭行业,https://pdf.dfcfw.com/pdf/H3_AP202407011637128252_1.pdf?1719824350000.pdf
煤炭行业周报：气温回升在即动力煤有望止跌，焦炭首轮提涨落地炼焦煤暂稳运行,华福证券,2024-07-01,煤炭行业,https://pdf.dfcfw.com/pdf/H3_AP202407011637124603_1.pdf?1719827555000.pdf
煤炭行业月报（7月第1周）：下游库存高位，关注旺季需求兑现程度,国信证券,2024-07-01,煤炭行业,https://pdf.dfcfw.com/pdf/H3_AP202407011637124616_1.pdf?1719818040000.pdf
煤炭行业周报：港口库存降低，度峰需求仍存空间,山西证券,2024-07-01,煤炭行业,https://pdf.dfcfw.com/pdf/H3_AP202406301637116712_1.pdf?1719823777000.pdf
煤价跌幅或有限且仍具上涨空间煤炭开采,信达证券,2024-06-30,煤炭行业,https://pdf.dfcfw.com/pdf/H3_AP202406301637075324_1.pdf?1719740821000.pdf
煤炭行业周报：电厂日耗持续上行，铁水日均产量仍存韧性,开源证券,2024-06-30,煤炭行业,https://pdf.dfcfw.com/pdf/H3_AP202406301637101130_1.pdf?1719759476000.pdf
煤炭开采行业周报：动煤价格震荡；焦炭落实第一波涨价,国海证券,2024-06-30,煤炭行业,https://pdf.dfcfw.com/pdf/H3_AP202406301637115296_1.pdf?1719776027000.pdf
煤炭开采行业跟踪周报：高温天气拉动煤炭需求增加，旺季来临促煤价企稳,东吴证券,2024-06-29,煤炭行业,https://pdf.dfcfw.com/pdf/H3_AP202406291637062557_1.pdf?1719704233000.pdf
煤炭周报：煤价短期波动无虞，7月中旬行情有望启动,民生证券,2024-06-29,煤炭行业,https://pdf.dfcfw.com/pdf/H3_AP202406291637062543_1.pdf?1719704124000.pdf
煤炭行业月报（2024.05）：煤价阶段性承压，迎峰度夏旺季虽迟但到,华福证券,2024-06-28,煤炭行业,https://pdf.dfcfw.com/pdf/H3_AP202406281636995334_1.pdf?1719570883000.pdf
2024年5月煤炭行业月度数据,国信证券,2024-06-28,煤炭行业,https://pdf.dfcfw.com/pdf/H3_AP202406281637023206_1.pdf?1719601152000.pdf
煤炭中期策略报告：稳中求进,山西证券,2024-06-27,煤炭行业,https://pdf.dfcfw.com/pdf/H3_AP202406271636960474_1.pdf?1719511466000.pdf
煤炭2024中期策略报告：新疆煤炭产业发展形势与机遇,信达证券,2024-06-26,煤炭行业,https://pdf.dfcfw.com/pdf/H3_AP202406261636906071_1.pdf?1719408488000.pdf
煤炭行业点评：能源行业产融动态报告,川财证券,2024-06-25,煤炭行业,https://pdf.dfcfw.com/pdf/H3_AP202406251636862052_1.pdf?1719331706000.pdf
煤炭进口数据拆解：5月进口继续补缺，关注山西复产进度,山西证券,2024-06-25,煤炭行业,https://pdf.dfcfw.com/pdf/H3_AP202406251636863885_1.pdf?1719320565000.pdf
