研报名称,机构名称,发布时间,行业,研报地址
交运24年度复盘及25Q1总结：交运整体稳健，看好物流发展,信达证券,2025-05-11,物流行业,https://pdf.dfcfw.com/pdf/H3_AP202505111670945212_1.pdf?1746964704000.pdf
快递行业2024年年报及2025年一季报综述：24年及25Q1申通呈现较强成长性，中通龙头地位稳固,民生证券,2025-05-09,物流行业,https://pdf.dfcfw.com/pdf/H3_AP202505091670023115_1.pdf?1746808415000.pdf
交通运输行业跟踪报告：交运行业25Q1公募基金持仓跟踪报告,万联证券,2025-05-08,物流行业,https://pdf.dfcfw.com/pdf/H3_AP202505081669568598_1.pdf?1746736574000.pdf
交通运输行业周报：中远海特一季报收入同比增长51.47%，圆通速递2024年业务量同比增长25.32%,中银证券,2025-05-07,物流行业,https://pdf.dfcfw.com/pdf/H3_AP202505071668759320_1.pdf?1746614084000.pdf
交通运输产业行业研究：年报一季报总结：航运板块利润改善，航空板块短暂承压,国金证券,2025-05-06,物流行业,https://pdf.dfcfw.com/pdf/H3_AP202505051667926547_1.pdf?1746530724000.pdf
交通运输行业快评报告：3月快递行业数据跟踪点评,万联证券,2025-05-05,物流行业,https://pdf.dfcfw.com/pdf/H3_AP202505021666077817_1.pdf?1746454381000.pdf
交通运输产业行业研究：五一假期出行需求旺盛，国际油价继续保持低位,国金证券,2025-05-05,物流行业,https://pdf.dfcfw.com/pdf/H3_AP202505051667673631_1.pdf?1746445257000.pdf
交通运输行业5月投资策略：“五一”民航旅客运输量预计同比增长8%，关注OPEC产量对油运价格影响,国信证券,2025-04-30,物流行业,https://pdf.dfcfw.com/pdf/H3_AP202504301664912196_1.pdf?1746011444000.pdf
交通运输行业深度报告：交运板块新思,东莞证券,2025-04-30,物流行业,https://pdf.dfcfw.com/pdf/H3_AP202504301664920477_1.pdf?1746011334000.pdf
交通运输行业周报：安通控股2025年一季报净利同比大增，申通快递2024年净利增长超200%,中银证券,2025-04-29,物流行业,https://pdf.dfcfw.com/pdf/H3_AP202504291664339644_1.pdf?1745938915000.pdf
交通运输行业周报：内需政策再度加码，五一旺季需求可期,中国银河,2025-04-29,物流行业,https://pdf.dfcfw.com/pdf/H3_AP202504291664516181_1.pdf?1745953946000.pdf
快递3月数据点评：顺丰件量增速超预期，通达系价格竞争依旧激烈,东兴证券,2025-04-28,物流行业,https://pdf.dfcfw.com/pdf/H3_AP202504281663938157_1.pdf?1745866041000.pdf
交通运输产业行业研究：交运重仓股市值环比下降，港口吞吐量同比增长,国金证券,2025-04-28,物流行业,https://pdf.dfcfw.com/pdf/H3_AP202504281663676025_1.pdf?1745839177000.pdf
大数据驱动的数智化仓储物流服务平台,四川物联亿达科技,2025-04-28,物流行业,https://pdf.dfcfw.com/pdf/H3_AP202504281663725666_1.pdf?1745852117000.pdf
交通运输行业专题研究：交运平台高增长，进入利润兑现期,天风证券,2025-04-27,物流行业,https://pdf.dfcfw.com/pdf/H3_AP202504271663429375_1.pdf?1745787935000.pdf
交通运输行业周报：关注交运行业中的内需方向,华源证券,2025-04-27,物流行业,https://pdf.dfcfw.com/pdf/H3_AP202504271663412852_1.pdf?1745787935000.pdf
交通运输行业周报：美国启动港口费用和建造限制措施，东航物流2024年度业绩稳健增长,中银证券,2025-04-22,物流行业,https://pdf.dfcfw.com/pdf/H3_AP202504221660380817_1.pdf?1745319909000.pdf
交通运输行业2025年3月快递数据点评：3月快递行业件量增速达20.3%，需求增长韧性强,民生证券,2025-04-22,物流行业,https://pdf.dfcfw.com/pdf/H3_AP202504221660482214_1.pdf?1745335808000.pdf
脱碳物流：推动更绿色、更具盈利能力的供应链的技术与策略,哲禹普(上海)企业管理咨询,2025-04-21,物流行业,https://pdf.dfcfw.com/pdf/H3_AP202504191658808633_1.pdf?1745230544000.pdf
快递行业月度专题：顺丰件量超预期增长25.4%，行业价格博弈延续,信达证券,2025-04-20,物流行业,https://pdf.dfcfw.com/pdf/H3_AP202504191658964986_1.pdf?1745144252000.pdf
交通运输行业周报：国产飞机出海加速，快递保持快速增长,华源证券,2025-04-20,物流行业,https://pdf.dfcfw.com/pdf/H3_AP202504201659469000_1.pdf?1745170889000.pdf
交通运输产业行业研究：快递业务量高增长，国际油价维持低位,国金证券,2025-04-20,物流行业,https://pdf.dfcfw.com/pdf/H3_AP202504201659495404_1.pdf?1745178823000.pdf
跨境出海周度市场观察第15周,艾瑞股份,2025-04-18,物流行业,https://pdf.dfcfw.com/pdf/H3_AP202504181658520528_1.pdf?1745008257000.pdf
跨境物流专题系列第二期：海外仓需求激增背后驱动因素与机遇,罗戈研究,2025-04-16,物流行业,https://pdf.dfcfw.com/pdf/H3_AP202504161657207836_1.pdf?1744796497000.pdf
交通运输行业周报：中美关税或对集运格局造成冲击，建议关注内需与高股息板块,国信证券,2025-04-15,物流行业,https://pdf.dfcfw.com/pdf/H3_AP202504151656733808_1.pdf?1744716564000.pdf
交通运输物流行业动态报告：关税落地，关注交运防御资产和顺周期超跌机会,民生证券,2025-04-15,物流行业,https://pdf.dfcfw.com/pdf/H3_AP202504151656866471_1.pdf?1744732631000.pdf
交通运输行业周报：关税风波致国际贸易与运输秩序混乱，极兔速递一季包裹量同比增长31.2%,中银证券,2025-04-15,物流行业,https://pdf.dfcfw.com/pdf/H3_AP202504151656878293_1.pdf?1744743857000.pdf
交通运输行业周报：持续关注关税影响下的贸易流变化,华源证券,2025-04-14,物流行业,https://pdf.dfcfw.com/pdf/H3_AP202504141656243020_1.pdf?1744626349000.pdf
交通运输产业行业研究：3月快递业务量预计同比增长18%，国际油价维持低位利好航空,国金证券,2025-04-13,物流行业,https://pdf.dfcfw.com/pdf/H3_AP202504131655937751_1.pdf?1744580494000.pdf
中国物流地产回顾与展望,第一太平戴维斯,2025-04-10,物流行业,https://pdf.dfcfw.com/pdf/H3_AP202504101653979053_1.pdf?1744283211000.pdf
交通运输行业周报：美对等关税落地，关注贸易流重构,中国银河,2025-04-08,物流行业,https://pdf.dfcfw.com/pdf/H3_AP202504081653143266_1.pdf?1744110165000.pdf
交通运输行业周报：中美关税博弈升级，航运市场短期或迎来抢运潮,中银证券,2025-04-08,物流行业,https://pdf.dfcfw.com/pdf/H3_AP202504081653143352_1.pdf?1744109846000.pdf
2024年全国物流地产行业市场报告,四川物联亿达科技,2025-04-07,物流行业,https://pdf.dfcfw.com/pdf/H3_AP202504061652296316_1.pdf?1744018541000.pdf
交通运输产业行业周报：美国加征关税影响物流，国际油价环比大跌利好航空,国金证券,2025-04-07,物流行业,https://pdf.dfcfw.com/pdf/H3_AP202504071652615779_1.pdf?1744012817000.pdf
交通运输行业周报：关税对交运影响：内需与供应链重构迎来机遇,华源证券,2025-04-07,物流行业,https://pdf.dfcfw.com/pdf/H3_AP202504071652648888_1.pdf?1744018324000.pdf
交通运输行业：关税战导致进出口货运承压，建议关注内需板块,东兴证券,2025-04-07,物流行业,https://pdf.dfcfw.com/pdf/H3_AP202504071652792360_1.pdf?1744045766000.pdf
快递行业电动化转型与运输效率优化的减排潜力,绿色和平组织,2025-04-04,物流行业,https://pdf.dfcfw.com/pdf/H3_AP202504041651199047_1.pdf?1743768454000.pdf
2025年1-2月快递行业数据点评：2025年M1-M2行业件量同比持续提升，需求仍具韧性,华福证券,2025-04-03,物流行业,https://pdf.dfcfw.com/pdf/H3_AP202504031650884477_1.pdf?1743709331000.pdf
交通运输：低空经济行业二季度投资策略-两会热议建言献策，低空基建乘势而起,金元证券,2025-04-01,物流行业,https://pdf.dfcfw.com/pdf/H3_AP202504011649817569_1.pdf?1743499018000.pdf
低空产业：全球首张eVTOL运营证书落地，商业化试运营跨过最后一道槛,东兴证券,2025-04-01,物流行业,https://pdf.dfcfw.com/pdf/H3_AP202504011649852063_1.pdf?1743513644000.pdf
交通运输行业4月投资策略：快递物流业绩韧性强，关注OPEC扩产对油运需求的拉动,国信证券,2025-04-01,物流行业,https://pdf.dfcfw.com/pdf/H3_AP202504011649859280_1.pdf?1743512624000.pdf
交通运输行业周报：物流企业经营韧性，民航2024年业绩减亏,华源证券,2025-03-31,物流行业,https://pdf.dfcfw.com/pdf/H3_AP202503301649213747_1.pdf?1743406734000.pdf
交通运输产业行业周报：BDTI指数环比增长，清明假期预计民航量增,国金证券,2025-03-31,物流行业,https://pdf.dfcfw.com/pdf/H3_AP202503311649461027_1.pdf?1743414812000.pdf
交通运输行业周报：中远海特2024年业绩创历史新高，顺丰2024年归母净利润突破100亿元,中银证券,2025-03-31,物流行业,https://pdf.dfcfw.com/pdf/H3_AP202503311649614802_1.pdf?1743441140000.pdf
交运&新消费：服务制造出海，跨境电商大步前行,中邮证券,2025-03-31,物流行业,https://pdf.dfcfw.com/pdf/H3_AP202503311649520623_1.pdf?1743427600000.pdf
交通运输行业快评报告：1-2月快递行业数据跟踪点评,万联证券,2025-03-26,物流行业,https://pdf.dfcfw.com/pdf/H3_AP202503261647766621_1.pdf?1743007566000.pdf
交通运输行业周报：航空港口升级加速，快递安全与创新并进,中国银河,2025-03-26,物流行业,https://pdf.dfcfw.com/pdf/H3_AP202503261647776719_1.pdf?1743018957000.pdf
