研报名称,机构名称,发布时间,行业,研报地址
交通运输行业周报：持续看好油运大周期，快递进入全面提价,华源证券,2026-04-07,物流,https://pdf.dfcfw.com/pdf/H3_AP202604061821031837_1.pdf?1775548466000.pdf
交通运输产业行业研究：美湾货盘释放支撑油运景气，清明假期机票预定同比增长,国金证券,2026-04-07,物流,https://pdf.dfcfw.com/pdf/H3_AP202604071821037766_1.pdf?1775558565000.pdf
2026年3月中国通用仓储市场动态报告,四川物联亿达科技,2026-04-07,物流,https://pdf.dfcfw.com/pdf/H3_AP202604071821049553_1.pdf?1775633465000.pdf
交通运输行业周报：霍尔木兹海峡受限后货盘转向替代装港，中东航线与大西洋航线运价差距收窄,中银证券,2026-04-06,物流,https://pdf.dfcfw.com/pdf/H3_AP202604061821030808_1.pdf?1775496792000.pdf
交通运输行业周报：地缘对油运影响深化，快递全面提价开启,华源证券,2026-03-30,物流,https://pdf.dfcfw.com/pdf/H3_AP202603301820852639_1.pdf?1774878512000.pdf
交通运输产业行业研究：化工物流景气度有望改善 唐山港2025年业绩同比增长,国金证券,2026-03-29,物流,https://pdf.dfcfw.com/pdf/H3_AP202603291820838059_1.pdf?1774803957000.pdf
交通运输行业周报：霍尔木兹海峡船舶通行量依旧处于低位，油运价格有望持续维持高位运行,中银证券,2026-03-29,物流,https://pdf.dfcfw.com/pdf/H3_AP202603291820840972_1.pdf?1774819143000.pdf
快递行业2026年1-2月数据点评：反内卷持续发力，通达系单票收入同比提升明显,东兴证券,2026-03-25,物流,https://pdf.dfcfw.com/pdf/H3_AP202603251820739265_1.pdf?1774452973000.pdf
交通运输行业周报：重申油运战略价值，快递“反内卷”再深化,华源证券,2026-03-23,物流,https://pdf.dfcfw.com/pdf/H3_AP202603231820694285_1.pdf?1774266921000.pdf
交通运输产业行业研究：1-2月快递业务量同比增长7%，中东地缘扰动持续影响航运,国金证券,2026-03-22,物流,https://pdf.dfcfw.com/pdf/H3_AP202603221820687961_1.pdf?1774204645000.pdf
交通运输行业周报：霍尔木兹通航受阻下VLCC转向延布红海通道，短期替代方案情景催生投资机会值得关注,中银证券,2026-03-22,物流,https://pdf.dfcfw.com/pdf/H3_AP202603221820688162_1.pdf?1774207124000.pdf
印度的新时代物流革命：无人机配送，冷链，和超本地化解决方案,印度品牌资产基金会,2026-03-16,物流,https://pdf.dfcfw.com/pdf/H3_AP202603151820564707_1.pdf?1773652704000.pdf
交通运输行业周报：地缘支撑油运运价高位，多地上调快递价格,华源证券,2026-03-16,物流,https://pdf.dfcfw.com/pdf/H3_AP202603161820583738_1.pdf?1773692924000.pdf
交通运输产业行业研究：两会反内卷利好快递，地缘扰动下关注航运、铁路运输,国金证券,2026-03-15,物流,https://pdf.dfcfw.com/pdf/H3_AP202603151820565846_1.pdf?1773597683000.pdf
交通运输行业周报：曹操出行Robotaxi计划2030年投放10万辆，霍尔木兹海峡船舶通行量仍处于低位水平,中银证券,2026-03-15,物流,https://pdf.dfcfw.com/pdf/H3_AP202603151820566372_1.pdf?1773605110000.pdf
2026年1月中国通用仓储市场动态报告,四川物联亿达科技,2026-03-13,物流,https://pdf.dfcfw.com/pdf/H3_AP202603121820527452_1.pdf?1773389132000.pdf
2026年2月中国通用仓储市场动态报告,四川物联亿达科技,2026-03-12,物流,https://pdf.dfcfw.com/pdf/H3_AP202603121820527458_1.pdf?1773388355000.pdf
低空经济周报（第10周）：低空经济连续三年写入中央政府工作报告，定位新兴支柱产业,金元证券,2026-03-11,物流,https://pdf.dfcfw.com/pdf/H3_AP202603111820482076_1.pdf?1773227742000.pdf
交通运输行业周报：地缘带动油运运价创纪录，快递“反内卷”持续,华源证券,2026-03-09,物流,https://pdf.dfcfw.com/pdf/H3_AP202603091820412512_1.pdf?1773072748000.pdf
交通运输行业周报：两会明确因地制宜发展新质生产力，把握低空经济与Robotaxi等主题趋势性投资机会,中银证券,2026-03-08,物流,https://pdf.dfcfw.com/pdf/H3_AP202603081820390645_1.pdf?1772992552000.pdf
交通运输产业行业研究：美伊僵持下油运运价维持高位，两会再提反内卷,国金证券,2026-03-08,物流,https://pdf.dfcfw.com/pdf/H3_AP202603081820390953_1.pdf?1772993661000.pdf
航空物流行业ESG白皮书,荣续ESG智库研究中心,2026-03-04,物流,https://pdf.dfcfw.com/pdf/H3_AP202603031820234682_1.pdf?1772612097000.pdf
零碳物流园区发展白皮书,荣续ESG智库研究中心,2026-03-04,物流,https://pdf.dfcfw.com/pdf/H3_AP202603031820234749_1.pdf?1772612884000.pdf
交通运输行业行业深度报告：eVTOL动力篇-低空“心脏”：eVTOL电驱系统详解,金元证券,2026-03-04,物流,https://pdf.dfcfw.com/pdf/H3_AP202603041820255981_1.pdf?1772623070000.pdf
物流及航运物流行业ESG白皮书,荣续ESG智库研究中心,2026-03-03,物流,https://pdf.dfcfw.com/pdf/H3_AP202603031820234654_1.pdf?1772611237000.pdf
CIC灼识咨询2025中国跨境电商物流行业研究,灼识投资咨询(上海),2026-03-02,物流,https://pdf.dfcfw.com/pdf/H3_AP202603021820180364_1.pdf?1772464006000.pdf
交通运输行业周报：中东冲突或引爆油运市场，快递开年“反内卷”持续,华源证券,2026-03-02,物流,https://pdf.dfcfw.com/pdf/H3_AP202603021820183169_1.pdf?1772466969000.pdf
交通运输行业周报：以美对伊朗发动军事打击，霍尔木兹海峡关闭对全球油运市场造成深远影响,中银证券,2026-03-01,物流,https://pdf.dfcfw.com/pdf/H3_AP202603011820161048_1.pdf?1772390992000.pdf
交通运输产业行业研究：伊朗封锁霍尔木兹海峡利好油运，化工涨价看好化工物流,国金证券,2026-03-01,物流,https://pdf.dfcfw.com/pdf/H3_AP202603011820161829_1.pdf?1772394547000.pdf
市场洞察：从“最后一公里”到“城市级运力”，无人物流车迎来产业化窗口期,头豹研究院,2026-02-28,物流,https://pdf.dfcfw.com/pdf/H3_AP202602281820142591_1.pdf?1772307558000.pdf
交通运输行业周报：2026春运客运量同比全线增长，持续推荐出行板块投资机会,中银证券,2026-02-23,物流,https://pdf.dfcfw.com/pdf/H3_AP202602231819981001_1.pdf?1771860245000.pdf
交通运输产业行业研究：春运人员流动量同比+5.1%，TD3C运价涨至15万美元以上,国金证券,2026-02-23,物流,https://pdf.dfcfw.com/pdf/H3_AP202602231819981987_1.pdf?1771862843000.pdf
