研报名称,机构名称,发布时间,行业,研报地址
交通运输行业2025年8月快递数据点评：快递反内卷成效显著，8月圆通和申通单票收入环比分别涨7分和9分,民生证券,2025-09-22,物流行业,https://pdf.dfcfw.com/pdf/H3_AP202509211748039422_1.pdf?1758525733000.pdf
交通运输产业行业研究：8月顺丰业务量增速领跑，春秋航空RPK增速领跑,国金证券,2025-09-22,物流行业,https://pdf.dfcfw.com/pdf/H3_AP202509221748298669_1.pdf?1758531188000.pdf
交运行业周报,国新证券股份,2025-09-17,物流行业,https://pdf.dfcfw.com/pdf/H3_AP202509171745480574_1.pdf?1758133978000.pdf
交通运输行业周报：原油运价大幅上涨，小鹏汇天eVTOL获阿联酋哈伊马角颁发特许飞行证,中银证券,2025-09-16,物流行业,https://pdf.dfcfw.com/pdf/H3_AP202509161744683268_1.pdf?1758023144000.pdf
2025年中国智能物流车行业研究报告：场景应用持续渗透，智能化升级加速落地,头豹研究院,2025-09-16,物流行业,https://pdf.dfcfw.com/pdf/H3_AP202509161744889038_1.pdf?1758051534000.pdf
交通运输产业行业研究：预计8月快递业务量同比+12%，油运景气稳健向上,国金证券,2025-09-14,物流行业,https://pdf.dfcfw.com/pdf/H3_AP202509141743611721_1.pdf?1757882342000.pdf
交通运输行业周报：快递提价弹性有望验证，油运运价持续上涨,华源证券,2025-09-14,物流行业,https://pdf.dfcfw.com/pdf/H3_AP202509141743637216_1.pdf?1757876798000.pdf
交通运输行业周报：原油运价先跌后涨，前7个月我国快递业务量同比增长18.7%,中银证券,2025-09-10,物流行业,https://pdf.dfcfw.com/pdf/H3_AP202509101741001214_1.pdf?1757493599000.pdf
货运公共补贴的经济成本,美国信息产业与创新基金会,2025-09-10,物流行业,https://pdf.dfcfw.com/pdf/H3_AP202509101741007282_1.pdf?1757496094000.pdf
交通运输行业周报：再添绿色物流新通道，中欧班列跑出加速度,中国银河,2025-09-09,物流行业,https://pdf.dfcfw.com/pdf/H3_AP202509081740445047_1.pdf?1757402595000.pdf
交通运输行业周报：快递迎来全面提价，关注油运旺季表现,华源证券,2025-09-08,物流行业,https://pdf.dfcfw.com/pdf/H3_AP202509081740397440_1.pdf?1757359213000.pdf
交通运输产业行业研究：暑运民航旅客量增长3.6%，BDTI环比增长,国金证券,2025-09-07,物流行业,https://pdf.dfcfw.com/pdf/H3_AP202509071739943138_1.pdf?1757272528000.pdf
快递业反内卷，部分地区开启涨价,国新证券股份,2025-09-04,物流行业,https://pdf.dfcfw.com/pdf/H3_AP202509041738805011_1.pdf?1757015499000.pdf
快递行业2025年7月月报：快递单价降幅收窄，反内卷持续扩散,海通国际,2025-09-03,物流行业,https://pdf.dfcfw.com/pdf/H3_AP202509031738419860_1.pdf?1756912625000.pdf
交运2025年度半年报总结：基础设施类稳健运营类略低预期，看好物流发展,信达证券,2025-09-03,物流行业,https://pdf.dfcfw.com/pdf/H3_AP202509031738470248_1.pdf?1756921668000.pdf
交通运输行业周报：沃兰特获农银金租120架天行采购订单，极兔速递上半年东南亚市占率提升至32.8%,中银证券,2025-09-02,物流行业,https://pdf.dfcfw.com/pdf/H3_AP202509021738045471_1.pdf?1756826617000.pdf
交通运输行业行业深度报告：中国智慧交通新时代-车路云一体化,金元证券,2025-09-02,物流行业,https://pdf.dfcfw.com/pdf/H3_AP202509021738067607_1.pdf?1756832079000.pdf
2025年上半年中国高标仓物流市场报告,JLL,2025-09-01,物流行业,https://pdf.dfcfw.com/pdf/H3_AP202509011737545238_1.pdf?1756719447000.pdf
交通运输产业行业研究：半年报总结：Q2航空减亏明显，快递物流表现分化,国金证券,2025-09-01,物流行业,https://pdf.dfcfw.com/pdf/H3_AP202509011737679380_1.pdf?1756744620000.pdf
交通运输产业行业研究：危化品水运价格企稳，原油运输指数环比增长,国金证券,2025-08-31,物流行业,https://pdf.dfcfw.com/pdf/H3_AP202508311737244487_1.pdf?1756665302000.pdf
交通运输行业周报：原油运价持续回暖，白云机场上半年净利润同比大幅增长,中银证券,2025-08-27,物流行业,https://pdf.dfcfw.com/pdf/H3_AP202508271735367928_1.pdf?1756307659000.pdf
交通运输产业行业研究：7月顺丰业务量增速领跑，油运景气度拐点向上,国金证券,2025-08-25,物流行业,https://pdf.dfcfw.com/pdf/H3_AP202508241733673159_1.pdf?1756106434000.pdf
交通运输行业周报：快递提价范围扩大，航空低位重视布局,华源证券,2025-08-25,物流行业,https://pdf.dfcfw.com/pdf/H3_AP202508251734010240_1.pdf?1756118604000.pdf
交通运输行业周报：“武鄂”首条低空货运航线开通，上海口岸暑运出入境客流持续高位,中银证券,2025-08-22,物流行业,https://pdf.dfcfw.com/pdf/H3_AP202508221732363891_1.pdf?1755883843000.pdf
快递7月数据点评：反内卷力度超预期，助力价格战逐步缓和,东兴证券,2025-08-21,物流行业,https://pdf.dfcfw.com/pdf/H3_AP202508211731688974_1.pdf?1755791244000.pdf
2025年1-7月快递行业跟踪点评：监管施压产粮区提价，关注高业绩弹性龙头,东莞证券,2025-08-20,物流行业,https://pdf.dfcfw.com/pdf/H3_AP202508201731070150_1.pdf?1755705449000.pdf
交运行业周报,国新证券股份,2025-08-20,物流行业,https://pdf.dfcfw.com/pdf/H3_AP202508201731171136_1.pdf?1755723704000.pdf
交通运输行业2025年7月快递数据点评：顺丰控股件量增速持续领跑，件量和份额分别同比+33.7%和+1.2pct,民生证券,2025-08-20,物流行业,https://pdf.dfcfw.com/pdf/H3_AP202508201731180228_1.pdf?1755719875000.pdf
交通运输行业周报：航空自律条约发布，长江干线港口再传捷报,中国银河,2025-08-19,物流行业,https://pdf.dfcfw.com/pdf/H3_AP202508191730484923_1.pdf?1755623485000.pdf
交通运输行业周报：全国快递反内卷趋势正在形成,华源证券,2025-08-18,物流行业,https://pdf.dfcfw.com/pdf/H3_AP202508181729725669_1.pdf?1755523451000.pdf
交通运输行业周报：航协发布自律公约，网约车平台降佣曹操出行个股梳理,民生证券,2025-08-17,物流行业,https://pdf.dfcfw.com/pdf/H3_AP202508171729262920_1.pdf?1755454982000.pdf
交通运输产业行业研究：危化品水运价格企稳回升，航协发布公约反内卷,国金证券,2025-08-17,物流行业,https://pdf.dfcfw.com/pdf/H3_AP202508171729307678_1.pdf?1755472369000.pdf
交通运输行业周报：广东快递底价集体上调，深圳eVTOL首穿150公里海域,中银证券,2025-08-12,物流行业,https://pdf.dfcfw.com/pdf/H3_AP202508121725937763_1.pdf?1754985828000.pdf
交通运输行业周报：新藏铁路公司成立，空中丝绸之路初形成,中国银河,2025-08-12,物流行业,https://pdf.dfcfw.com/pdf/H3_AP202508121726024434_1.pdf?1754998227000.pdf
从货架到消费者：无缝物流的艺术,深圳市能者物流,2025-08-10,物流行业,https://pdf.dfcfw.com/pdf/H3_AP202508101724772847_1.pdf?1754856598000.pdf
交通运输产业行业研究：广东地区快递已提价，韩国拟对中国团队游实施临时免签,国金证券,2025-08-10,物流行业,https://pdf.dfcfw.com/pdf/H3_AP202508101724924569_1.pdf?1754854327000.pdf
交通运输行业周报：广东快递涨价落地，关注更多地区推进,华源证券,2025-08-10,物流行业,https://pdf.dfcfw.com/pdf/H3_AP202508101725043734_1.pdf?1754862203000.pdf
交通运输行业周报：鄂州机场三年货运枢纽高速成长，百度无人车出海提速,中银证券,2025-08-05,物流行业,https://pdf.dfcfw.com/pdf/H3_AP202508051721797452_1.pdf?1754390320000.pdf
低空经济周报：低空物流发展加速，峰飞、亿航等机型试飞，低空基础设施建设体系标准逐渐成型,金元证券,2025-08-05,物流行业,https://pdf.dfcfw.com/pdf/H3_AP202508051721949429_1.pdf?1754411475000.pdf
交通运输行业周报：监管推动下的快递反内卷持续落地,华源证券,2025-08-03,物流行业,https://pdf.dfcfw.com/pdf/H3_AP202508031720842364_1.pdf?1754251856000.pdf
交通运输产业行业研究：快递“反内卷”持续进行，PDCI指数环比回升,国金证券,2025-08-03,物流行业,https://pdf.dfcfw.com/pdf/H3_AP202508031720779732_1.pdf?1754256466000.pdf
交通运输行业行业深度报告：低空经济下的通感解决方案-卫星互联网,金元证券,2025-08-01,物流行业,https://pdf.dfcfw.com/pdf/H3_AP202508011719651984_1.pdf?1754080868000.pdf
智能物流仓储：智算驱动下的物流革命，仓储系统进入跃迁期 头豹词条报告系列,头豹研究院,2025-08-01,物流行业,https://pdf.dfcfw.com/pdf/H3_AP202508011719664618_1.pdf?1754077156000.pdf
交运行业2025年中期投资策略：商品牛市初现，反内卷关注上游供应链,西南证券,2025-07-30,物流行业,https://pdf.dfcfw.com/pdf/H3_AP202507301718488218_1.pdf?1753908727000.pdf
交通运输行业周报：自贸港封关日期已定，首架三证eVTOL交付,中国银河,2025-07-29,物流行业,https://pdf.dfcfw.com/pdf/H3_AP202507291717718569_1.pdf?1753801233000.pdf
交通运输行业周报：快递“反内卷”有望促使竞争趋缓，申通快递拟收购丹鸟物流,国信证券,2025-07-29,物流行业,https://pdf.dfcfw.com/pdf/H3_AP202507291717813922_1.pdf?1753811412000.pdf
交通运输行业周报：雅鲁藏布江电站建设有望带动西部交通需求，沃兰特航空获17.5亿美元eVTOL大单,中银证券,2025-07-29,物流行业,https://pdf.dfcfw.com/pdf/H3_AP202507291717616089_1.pdf?1753784141000.pdf
快递行业反内卷专题报告：快递反内卷大势所趋，价值重估正当时,华源证券,2025-07-28,物流行业,https://pdf.dfcfw.com/pdf/H3_AP202507281717294380_1.pdf?1753736854000.pdf
交通运输行业周报：申通快递拟收购丹鸟物流，快递反内卷再推进,华源证券,2025-07-28,物流行业,https://pdf.dfcfw.com/pdf/H3_AP202507281717294428_1.pdf?1753737268000.pdf
交通运输产业行业研究：Q2交运板块持仓市值及占比提升，快递板块增幅明显,国金证券,2025-07-27,物流行业,https://pdf.dfcfw.com/pdf/H3_AP202507271716611013_1.pdf?1753640431000.pdf
交通运输行业跟踪报告：交运行业25Q2公募基金持仓跟踪报告,万联证券,2025-07-25,物流行业,https://pdf.dfcfw.com/pdf/H3_AP202507251715402639_1.pdf?1753461245000.pdf
快递6月数据点评：业务量增速分化明显，关注反内卷后续影响,东兴证券,2025-07-23,物流行业,https://pdf.dfcfw.com/pdf/H3_AP202507231713986594_1.pdf?1753257672000.pdf
2025年上半年快递行业跟踪点评：反内卷背景下行业竞争放缓,东莞证券,2025-07-22,物流行业,https://pdf.dfcfw.com/pdf/H3_AP202507221713619747_1.pdf?1753203905000.pdf
交通运输行业周报：快递6月数据明显分化，关注行业反内卷进程,华源证券,2025-07-21,物流行业,https://pdf.dfcfw.com/pdf/H3_AP202507211712858197_1.pdf?1753094990000.pdf
交通运输行业周报：上半年国内快递业务量同比增长19.3%，时的科技获中东10亿美元eVTOL订单,中银证券,2025-07-21,物流行业,https://pdf.dfcfw.com/pdf/H3_AP202507211713181619_1.pdf?1753141349000.pdf
交通运输产业行业研究：顺丰快递业务量增速领跑，春秋东航RPK增速较快,国金证券,2025-07-20,物流行业,https://pdf.dfcfw.com/pdf/H3_AP202507201712412697_1.pdf?1753049502000.pdf
交通运输行业2025年6月快递数据点评：顺丰控股件量维持高增，件量和份额同比分别+31.8%和0.1pct,民生证券,2025-07-20,物流行业,https://pdf.dfcfw.com/pdf/H3_AP202507201712471642_1.pdf?1753039140000.pdf
快递行业月度专题：顺丰业务量增速持续领先，关注后续行业“反内卷”实质进展,信达证券,2025-07-20,物流行业,https://pdf.dfcfw.com/pdf/H3_AP202507201712521049_1.pdf?1753082437000.pdf
2025年海运行业分析,联合资信,2025-07-18,物流行业,https://pdf.dfcfw.com/pdf/H3_AP202507181711003110_1.pdf?1752830168000.pdf
交运行业周报,国新证券股份,2025-07-17,物流行业,https://pdf.dfcfw.com/pdf/H3_AP202507171710498226_1.pdf?1752757668000.pdf
交通运输行业7月投资策略：快递和航空有望受益“反内卷”，关注东南亚快递市场机会,国信证券,2025-07-16,物流行业,https://pdf.dfcfw.com/pdf/H3_AP202507161709869650_1.pdf?1752665042000.pdf
交通运输行业周报：中国巴西签署备忘录，无人车赋能快递物流,中国银河,2025-07-16,物流行业,https://pdf.dfcfw.com/pdf/H3_AP202507161709874538_1.pdf?1752666123000.pdf
交通运输行业周报：极兔Q2东南亚包裹量同比大增65.9%，合肥打造全国首个无人机共享机场网络,中银证券,2025-07-15,物流行业,https://pdf.dfcfw.com/pdf/H3_AP202507151709216485_1.pdf?1752577812000.pdf
交通运输产业行业研究：全国快递业务量突破1000亿件，南航开通首条第五航权货运航线,国金证券,2025-07-14,物流行业,https://pdf.dfcfw.com/pdf/H3_AP202507141708534478_1.pdf?1752483035000.pdf
交通运输行业周报：反内卷或引导快递行业高质量发展,华源证券,2025-07-14,物流行业,https://pdf.dfcfw.com/pdf/H3_AP202507141708693870_1.pdf?1752503358000.pdf
交运行业首席联盟培训：供给主导大周期，技术催生新平台,天风证券,2025-07-13,物流行业,https://pdf.dfcfw.com/pdf/H3_AP202507131708308559_1.pdf?1752449129000.pdf
低空经济行业周报：亿民航局成立通用航空和低空经济工作领导小组，江苏发布全国首个省级低空基础设施规划布设指南团体标准,金元证券,2025-07-09,物流行业,https://pdf.dfcfw.com/pdf/H3_AP202507091705636617_1.pdf?1752057267000.pdf
交通运输行业周报：伊以局势逐步缓和油轮运价回调，民航局成立低空经济领导小组,中银证券,2025-07-08,物流行业,https://pdf.dfcfw.com/pdf/H3_AP202507081705064789_1.pdf?1751974494000.pdf
交通运输行业周报：低空经济持续发展，菜鸟加速海外仓布局,中国银河,2025-07-08,物流行业,https://pdf.dfcfw.com/pdf/H3_AP202507081705179477_1.pdf?1751991429000.pdf
交通运输2025年中期策略报告：“确定性”多点开花，业绩估值各有看点,信达证券,2025-07-07,物流行业,https://pdf.dfcfw.com/pdf/H3_AP202507071704605285_1.pdf?1751908359000.pdf
交通运输行业周报：关注东南亚电商快递，民航迎暑运旺季,华源证券,2025-07-07,物流行业,https://pdf.dfcfw.com/pdf/H3_AP202507071704537073_1.pdf?1751899863000.pdf
交通运输产业行业研究：C919发动机恢复出口，暑运机票预售价格降幅缩窄,国金证券,2025-07-06,物流行业,https://pdf.dfcfw.com/pdf/H3_AP202507061703964373_1.pdf?1751822056000.pdf
低空经济专题系列报告四：无人机与低空物流：拥抱无人物流时代,金元证券,2025-07-04,物流行业,https://pdf.dfcfw.com/pdf/H3_AP202507041702704522_1.pdf?1751634465000.pdf
交通运输行业周报：顺丰拟配售H股以及发行可转债，逢低布局油运静待旺季,国信证券,2025-07-01,物流行业,https://pdf.dfcfw.com/pdf/H3_AP202507011700831667_1.pdf?1751367497000.pdf
交通运输行业周报：中东局势缓和油轮运价回调，最新发布亮相的朱雀eVTOL航程达600公里,中银证券,2025-07-01,物流行业,https://pdf.dfcfw.com/pdf/H3_AP202507011700864563_1.pdf?1751368618000.pdf
交通运输行业周报：顺丰港股募资，民航号召反内卷,华源证券,2025-07-01,物流行业,https://pdf.dfcfw.com/pdf/H3_AP202506301700568383_1.pdf?1751352837000.pdf
企业竞争图谱：2025年E-bike头豹词条报告系列,头豹研究院,2025-06-30,物流行业,https://pdf.dfcfw.com/pdf/H3_AP202506301700475589_1.pdf?1751313735000.pdf
交通运输产业行业研究：京东物流拟开展外卖业务，民航局拟综合整治“内卷式”竞争,国金证券,2025-06-29,物流行业,https://pdf.dfcfw.com/pdf/H3_AP202506291699770035_1.pdf?1751220305000.pdf
2025中国低碳供应链&物流创新发展报告,罗戈研究,2025-06-26,物流行业,https://pdf.dfcfw.com/pdf/H3_AP202506261697809503_1.pdf?1750930304000.pdf
快递行业2025年5月数据点评：顺丰“激活经营”促增速领先，电商快递趋势向好,中邮证券,2025-06-25,物流行业,https://pdf.dfcfw.com/pdf/H3_AP202506251697235602_1.pdf?1750848252000.pdf
交通运输行业2025中期策略报告：供给加速出行反转，科技重塑物流格局,中国银河,2025-06-25,物流行业,https://pdf.dfcfw.com/pdf/H3_AP202506251697235614_1.pdf?1750849896000.pdf
2025年西南区域物流地产市场报告,四川物联亿达科技,2025-06-25,物流行业,https://pdf.dfcfw.com/pdf/H3_AP202506251697298432_1.pdf?1750874910000.pdf
交通运输行业周报：中东局势升温油运运价和保费上涨，前5月国内快递业务量同比增长20.1%,中银证券,2025-06-24,物流行业,https://pdf.dfcfw.com/pdf/H3_AP202506241696673450_1.pdf?1750778545000.pdf
交通运输行业周报：顺丰增速领跑快递同行，油运运价持续上涨,华源证券,2025-06-23,物流行业,https://pdf.dfcfw.com/pdf/H3_AP202506221695721902_1.pdf?1750663233000.pdf
快递5月数据点评：顺丰增速继续领跑，价格竞争烈度维持较高水平,东兴证券,2025-06-23,物流行业,https://pdf.dfcfw.com/pdf/H3_AP202506231696122281_1.pdf?1750689145000.pdf
交通运输产业行业研究：顺丰业务量增速领跑，油运景气加速向上,国金证券,2025-06-22,物流行业,https://pdf.dfcfw.com/pdf/H3_AP202506221695545076_1.pdf?1750610945000.pdf
交通运输行业2025年5月快递数据点评：顺丰控股件量增速持续领跑行业，件量和份额同比分别+32%和0.3pct,民生证券,2025-06-20,物流行业,https://pdf.dfcfw.com/pdf/H3_AP202506201694295829_1.pdf?1750424334000.pdf
交通运输行业2025年中期投资策略：重视新交运、新物流机会,民生证券,2025-06-19,物流行业,https://pdf.dfcfw.com/pdf/H3_AP202506191693938396_1.pdf?1750369175000.pdf
交通运输行业周报：中东冲突升级关注油运市场风险溢价，国航5月旅客周转量同比上升8.4%,中银证券,2025-06-16,物流行业,https://pdf.dfcfw.com/pdf/H3_AP202506161692002690_1.pdf?1750093162000.pdf
交通运输行业周报：顺丰同城上调关联交易上限，油运地缘期权或将兑现,华源证券,2025-06-16,物流行业,https://pdf.dfcfw.com/pdf/H3_AP202506161692099561_1.pdf?1750104743000.pdf
交通运输行业2025年中期投资展望：重视周期底部行业的价格弹性,东兴证券,2025-06-13,物流行业,https://pdf.dfcfw.com/pdf/H3_AP202506131690029067_1.pdf?1749804081000.pdf
无人车行业深度：物流无人车浪潮起，产业变革新机遇,华源证券,2025-06-13,物流行业,https://pdf.dfcfw.com/pdf/H3_AP202506131690215354_1.pdf?1749831314000.pdf
交通运输产业行业研究：无人物流车：重构快递物流成本格局，落地应用迎来爆发,国金证券,2025-06-12,物流行业,https://pdf.dfcfw.com/pdf/H3_AP202506121689391911_1.pdf?1749738469000.pdf
交通运输：公路和港口高股息，并购和平台公司高增长,天风证券,2025-06-11,物流行业,https://pdf.dfcfw.com/pdf/H3_AP202506111688772970_1.pdf?1749647244000.pdf
2025年5月中国通用仓储市场动态报告,四川物联亿达科技,2025-06-10,物流行业,https://pdf.dfcfw.com/pdf/H3_AP202506101688106725_1.pdf?1749550770000.pdf
交通运输行业周报：亚洲-巴西航线集运运费周环比上涨100%，端午假期全国快递业包裹量同比增长15.4%,中银证券,2025-06-10,物流行业,https://pdf.dfcfw.com/pdf/H3_AP202506101688229082_1.pdf?1749578252000.pdf
2025Q1中国主要城市交通分析报告,高德地图,2025-06-10,物流行业,https://pdf.dfcfw.com/pdf/H3_AP202506101688281393_1.pdf?1749575032000.pdf
低空经济双周报07：国家推动邮政业无人机发展，沃飞长空获颁CCAR-135部运行合格证,华龙证券,2025-06-10,物流行业,https://pdf.dfcfw.com/pdf/H3_AP202506101688249851_1.pdf?1749570796000.pdf
交通运输行业6月投资策略：无人物流车助力快递末端降本增效，美线抢运带动集运运价反弹,国信证券,2025-06-09,物流行业,https://pdf.dfcfw.com/pdf/H3_AP202506091687544704_1.pdf?1749469145000.pdf
交通运输行业周报：SCFI环比大涨30.68%创历史第二大单周涨幅，国内航线旅客运输燃油附加费下调,中银证券,2025-06-05,物流行业,https://pdf.dfcfw.com/pdf/H3_AP202506051685108164_1.pdf?1749113455000.pdf
交通运输行业周报：无人车配送快速发展，看好物流产业升级,华源证券,2025-06-03,物流行业,https://pdf.dfcfw.com/pdf/H3_AP202506021683693615_1.pdf?1748939882000.pdf
快递2025年一季报综述：价格战进入深水区，行业盈利短期承压，市场预期降至低位,东兴证券,2025-05-29,物流行业,https://pdf.dfcfw.com/pdf/H3_AP202505291681026011_1.pdf?1748505225000.pdf
2025年华东区域物流地产报告,四川物联亿达科技,2025-05-28,物流行业,https://pdf.dfcfw.com/pdf/H3_AP202505281680461130_1.pdf?1748424197000.pdf
交通运输行业周报：美线抢运带动集运运价反弹，顺丰收入增速企稳回升,国信证券,2025-05-28,物流行业,https://pdf.dfcfw.com/pdf/H3_AP202505281680485077_1.pdf?1748427575000.pdf
交运行业周报,国新证券股份,2025-05-28,物流行业,https://pdf.dfcfw.com/pdf/H3_AP202505281680752539_1.pdf?1748463758000.pdf
2025中国外卖市场现状报告,上海嘉世营销咨询,2025-05-27,物流行业,https://pdf.dfcfw.com/pdf/H3_AP202505271679824005_1.pdf?1748337252000.pdf
交通运输行业周报：Frontline一季度收入和净利润同比下降，4月民航旅客运输量同比增长8.9%,中银证券,2025-05-27,物流行业,https://pdf.dfcfw.com/pdf/H3_AP202505271679900766_1.pdf?1748337559000.pdf
交运行业2024年年报及2025年一季报综述：油散承压静待回暖，三大航与廉航表现分化，快递量增价减趋势不变,中银证券,2025-05-26,物流行业,https://pdf.dfcfw.com/pdf/H3_AP202505261679373537_1.pdf?1748260043000.pdf
交通运输产业行业研究：4月顺丰业务量增速较快，民航国际地区线旅客量超2019年,国金证券,2025-05-26,物流行业,https://pdf.dfcfw.com/pdf/H3_AP202505261679436642_1.pdf?1748281077000.pdf
交通运输行业周报：快递需求维持高增，集运运价上涨,华源证券,2025-05-25,物流行业,https://pdf.dfcfw.com/pdf/H3_AP202505251678987757_1.pdf?1748200860000.pdf
快递行业2025年4月月报：4月件量维持较高增速，各快递份额分化,海通国际,2025-05-23,物流行业,https://pdf.dfcfw.com/pdf/H3_AP202505231677753540_1.pdf?1748015957000.pdf
快递行业月度专题：顺丰单量增长超预期，电商快递价格继续承压,信达证券,2025-05-23,物流行业,https://pdf.dfcfw.com/pdf/H3_AP202505231677777798_1.pdf?1748018991000.pdf
2025年1-4月快递行业跟踪点评：件量保持高增，份额争夺暂时放松,东莞证券,2025-05-23,物流行业,https://pdf.dfcfw.com/pdf/H3_AP202505231677785623_1.pdf?1748019996000.pdf
2025年4月中国通用仓储市场动态报告,四川物联亿达科技,2025-05-23,物流行业,https://pdf.dfcfw.com/pdf/H3_AP202505231677833702_1.pdf?1748027529000.pdf
快递4月数据点评：通达系单价继续下探，但“以价换量”效果或开始减退,东兴证券,2025-05-21,物流行业,https://pdf.dfcfw.com/pdf/H3_AP202505211676396723_1.pdf?1747816646000.pdf
交通运输行业2025年4月快递数据点评：4月全行业件量维持高增，顺丰控股件量增速领先,民生证券,2025-05-21,物流行业,https://pdf.dfcfw.com/pdf/H3_AP202505211676573840_1.pdf?1747841194000.pdf
交通运输行业周报0519：中美互降关税，跨境航运持续回暖,中国银河,2025-05-20,物流行业,https://pdf.dfcfw.com/pdf/H3_AP202505201675831942_1.pdf?1747732892000.pdf
交通运输行业周报：中美关税协议后美线集运运价大幅上涨，前四月快递业务量同比增长20.9%,中银证券,2025-05-20,物流行业,https://pdf.dfcfw.com/pdf/H3_AP202505201675839944_1.pdf?1747740582000.pdf
快递：快递单量保持高增，顺丰增速领跑,中邮证券,2025-05-20,物流行业,https://pdf.dfcfw.com/pdf/H3_AP202505201676021712_1.pdf?1747760144000.pdf
交通运输行业周报：美线抢运拉动航运景气，内需物流保持稳健,华源证券,2025-05-18,物流行业,https://pdf.dfcfw.com/pdf/H3_AP202505181674886170_1.pdf?1747583172000.pdf
交通运输产业行业研究：4月快递业务量同比增长19.1%，免签国家范围新增5个,国金证券,2025-05-18,物流行业,https://pdf.dfcfw.com/pdf/H3_AP202505181674940368_1.pdf?1747601233000.pdf
交通运输行业一季报总结：内需量增价减，红利保持稳健,华源证券,2025-05-15,物流行业,https://pdf.dfcfw.com/pdf/H3_AP202505151673311580_1.pdf?1747329538000.pdf
航空业年报及一季报点评：客座率持续提升，旺季弹性值得期待,东兴证券,2025-05-13,物流行业,https://pdf.dfcfw.com/pdf/H3_AP202505131672276179_1.pdf?1747166415000.pdf
交通运输行业周报：马士基一季报EBITDA同比增长70.4%，顺丰同城“五一”业务单量同比增长87%,中银证券,2025-05-13,物流行业,https://pdf.dfcfw.com/pdf/H3_AP202505131672313231_1.pdf?1747173361000.pdf
交通运输行业周报：美国港口货量暴跌，物流领域合作深化,中国银河,2025-05-13,物流行业,https://pdf.dfcfw.com/pdf/H3_AP202505131672004352_1.pdf?1747128162000.pdf
交通运输行业研究：五一假期快递业务量创同期新高，申通快递发布股票激励计划,国金证券,2025-05-11,物流行业,https://pdf.dfcfw.com/pdf/H3_AP202505111671090401_1.pdf?1746984620000.pdf
交通运输行业周报：国内客货运平稳增长，油运受益地缘催化,华源证券,2025-05-11,物流行业,https://pdf.dfcfw.com/pdf/H3_AP202505111671151960_1.pdf?1746989089000.pdf
