研报名称,机构名称,发布时间,行业,研报地址
新能源之生物柴油行业展望：市场需求广阔国际化布局和打通内循环为发展着力点,大公国际,2024-12-27,环保行业,https://pdf.dfcfw.com/pdf/H3_AP202412271641446153_1.docx?1735311440000.docx
环保行业周度观察,国新证券股份,2024-12-25,环保行业,https://pdf.dfcfw.com/pdf/H3_AP202412251641428439_1.pdf?1735154245000.pdf
公用环保202412第4期：1-11月全社会用电量同比+7.1%，11月工业及混合油（UCO）出口量创历史新高,国信证券,2024-12-23,环保行业,https://pdf.dfcfw.com/pdf/H3_AP202412231641391087_1.pdf?1734950609000.pdf
环保行业跟踪周报：国债收益率下行重视水务固废红利资产，持续关注化债、成长、重组三大主线,东吴证券,2024-12-23,环保行业,https://pdf.dfcfw.com/pdf/H3_AP202412231641391236_1.pdf?1734944047000.pdf
生物柴油行业周报：国内餐厨废油市场运行显露分歧,民生证券,2024-12-23,环保行业,https://pdf.dfcfw.com/pdf/H3_AP202412231641393467_1.pdf?1734954615000.pdf
环保行业周度观察,国新证券股份,2024-12-18,环保行业,https://pdf.dfcfw.com/pdf/H3_AP202412181641349766_1.pdf?1734551353000.pdf
环保行业跟踪周报：中央经济工作会议明确降碳减污扩绿增长目标，固废综合治理行动计划值得期待,东吴证券,2024-12-16,环保行业,https://pdf.dfcfw.com/pdf/H3_AP202412161641317574_1.pdf?1734375238000.pdf
环保行业2025年年度策略：环保公用“化债”系列报告之一：应收账款重生：政府化债如何影响环保公用行业？,天风证券,2024-12-13,环保行业,https://pdf.dfcfw.com/pdf/H3_AP202412131641300862_1.pdf?1734122188000.pdf
生物柴油行业周报：国内废弃油脂价格回升，市场博弈继续,民生证券,2024-12-11,环保行业,https://pdf.dfcfw.com/pdf/H3_AP202412111641257094_1.pdf?1733923240000.pdf
【东吴环保公用】2025年环保行业年度策略：揽星衔月，扶摇可接：化债、成长、重组共振，环保市场化新生！,东吴证券,2024-12-10,环保行业,https://pdf.dfcfw.com/pdf/H3_AP202412101641240210_1.pdf?1733835992000.pdf
环保行业周度观察,国新证券股份,2024-12-10,环保行业,https://pdf.dfcfw.com/pdf/H3_AP202412101641250428_1.pdf?1733862908000.pdf
环保行业2025年度投资策略：纲举目张，节能减排,华福证券,2024-12-10,环保行业,https://pdf.dfcfw.com/pdf/H3_AP202412101641243990_1.pdf?1733914325000.pdf
环保行业跟踪周报：UCO出口退税取消生柴利润上行，长期SAF需求空间大，关注化债下成长_运营重估_弹性,东吴证券,2024-12-09,环保行业,https://pdf.dfcfw.com/pdf/H3_AP202412091641223110_1.pdf?1733742833000.pdf
2024年水务行业回顾及展望报告：全国水利建设投资规模再创新高，经济稳增长背景下水务行业投资或将继续增长,联合资信,2024-12-08,环保行业,https://pdf.dfcfw.com/pdf/H3_AP202412081641219349_1.pdf?1733669632000.pdf
环保行业周度观察,国新证券股份,2024-12-05,环保行业,https://pdf.dfcfw.com/pdf/H3_AP202412051641190318_1.pdf?1733412522000.pdf
环保行业跟踪周报：UCO退税取消生柴利润上行，长期SAF需求空间大，关注化债下成长_运营重估_弹性,东吴证券,2024-12-02,环保行业,https://pdf.dfcfw.com/pdf/H3_AP202412021641150410_1.pdf?1733210542000.pdf
环保行业周度观察,国新证券股份,2024-11-26,环保行业,https://pdf.dfcfw.com/pdf/H3_AP202411261641074625_1.pdf?1732644171000.pdf
环保行业跟踪周报：光伏制造行业规范及管理办法发布，环保受益化债关注成长_运营重估_弹性,东吴证券,2024-11-25,环保行业,https://pdf.dfcfw.com/pdf/H3_AP202411251641046646_1.pdf?1732537253000.pdf
环保行业周度观察,国新证券股份,2024-11-20,环保行业,https://pdf.dfcfw.com/pdf/H3_AP202411201640985886_1.pdf?1732128600000.pdf
环保行业跟踪周报：COP29通过《巴黎协定》第6.4条，环保受益化债关注成长_运营重估_弹性,东吴证券,2024-11-19,环保行业,https://pdf.dfcfw.com/pdf/H3_AP202411191640949862_1.pdf?1732003805000.pdf
环保行业跟踪周报：大力实施可再生能源替代行动，继续关注优质运营_弹性_成长三大方向,东吴证券,2024-11-04,环保行业,https://pdf.dfcfw.com/pdf/H3_AP202411041640695399_1.pdf?1730739431000.pdf
环保行业跟踪周报：《完善碳排放统计核算体系工作方案》发布继续关注优质运营_弹性_成长三大方向,东吴证券,2024-10-28,环保行业,https://pdf.dfcfw.com/pdf/H3_AP202410281640532160_1.pdf?1730113095000.pdf
环保行业跟踪周报：中办国办印发《关于解决拖欠企业账款问题的意见》 ，关注优质运营_弹性_成长三大方向,东吴证券,2024-10-21,环保行业,https://pdf.dfcfw.com/pdf/H3_AP202410211640377228_1.pdf?1729503342000.pdf
中国建筑垃圾资源化利用行业市场规模测算逻辑模型 头豹词条报告系列,头豹研究院,2024-10-16,环保行业,https://pdf.dfcfw.com/pdf/H3_AP202410161640329758_1.pdf?1729107246000.pdf
环保行业深度报告：环保受益化债：现金流_资产质量_估值，关注优质运营_弹性_成长三大方向,东吴证券,2024-10-16,环保行业,https://pdf.dfcfw.com/pdf/H3_AP202410161640330024_1.pdf?1729108832000.pdf
碳市场月报（202409）：钢铁、水泥、电解铝三大行业纳入全国碳市场，市场活跃度有望进一步提升,五矿证券,2024-10-15,环保行业,https://pdf.dfcfw.com/pdf/H3_AP202410151640298046_1.pdf?1728984615000.pdf
废旧塑料的再利用——新的发展机会,罗兰贝格,2024-10-15,环保行业,https://pdf.dfcfw.com/pdf/H3_AP202410151640309390_1.pdf?1729023042000.pdf
环保行业跟踪周报：地方化债环保受益：现金流_资产质量_估值，关注优质运营_弹性_成长三大方向,东吴证券,2024-10-14,环保行业,https://pdf.dfcfw.com/pdf/H3_AP202410141640295106_1.pdf?1728993016000.pdf
绿色税收（十六）：塑料制品企业环境与税收观察报告,苏州工业园区绿色江南公众环境关注中心,2024-10-10,环保行业,https://pdf.dfcfw.com/pdf/H3_AP202410101640241517_1.pdf?1728572276000.pdf
2024版数字能源2030：构建万物互联的智能世界,华为,2024-10-09,环保行业,https://pdf.dfcfw.com/pdf/H3_AP202410091640226930_1.pdf?1728491079000.pdf
前沿产业发展现状、挑战及机遇系列报告之—可持续燃料篇,Environmental Defense Fund,2024-10-08,环保行业,https://pdf.dfcfw.com/pdf/H3_AP202410071640177314_1.pdf?1728383457000.pdf
环保行业跟踪周报：财政政策发力解决运营现金流痛点，持续推荐运营资产+优质成长龙头,东吴证券,2024-10-08,环保行业,https://pdf.dfcfw.com/pdf/H3_AP202410081640188089_1.pdf?1728376742000.pdf
生物柴油行业深度研究：关注SAF发展前景，重视亚洲生物柴油市场潜力,民生证券,2024-10-08,环保行业,https://pdf.dfcfw.com/pdf/H3_AP202410081640190499_1.pdf?1728380962000.pdf
氢能洞察系列研究之一：绿氨掺烧—煤改新政有望打开绿氢绿氨发展空间,中泰证券,2024-10-07,环保行业,https://pdf.dfcfw.com/pdf/H3_AP202410061640176908_1.pdf?1728314873000.pdf
环保行业跟踪周报：生态环境部以高水平保护促进中部地区加快崛起，寻找固废及燃气板块alpha,东吴证券,2024-09-30,环保行业,https://pdf.dfcfw.com/pdf/H3_AP202409301640100588_1.pdf?1727716845000.pdf
环保行业跟踪周报：我国启动可持续航空燃料应用试点，寻找固废及燃气板块alpha,东吴证券,2024-09-23,环保行业,https://pdf.dfcfw.com/pdf/H3_AP202409231639983647_1.pdf?1727109628000.pdf
环保行业跟踪周报：工信部支持推进移动物联网在市政、环保等领域规模化应用，寻找固废及燃气板块alpha,东吴证券,2024-09-18,环保行业,https://pdf.dfcfw.com/pdf/H3_AP202409181639923519_1.pdf?1726688526000.pdf
环保行业跟踪周报：首批CCER挂网公示，海风减排量占比超九成，寻找固废及燃气板块alpha,东吴证券,2024-09-09,环保行业,https://pdf.dfcfw.com/pdf/H3_AP202409091639787598_1.pdf?1725880085000.pdf
环保行业2024年中报业绩综述：运营资产整体稳中向好，设备韧性凸显，EPC有所改善,华福证券,2024-09-08,环保行业,https://pdf.dfcfw.com/pdf/H3_AP202409081639785988_1.pdf?1725800239000.pdf
环保行业跟踪周报：《中国的能源转型》白皮书双碳目标不改，寻找固废及燃气板块alpha,东吴证券,2024-09-03,环保行业,https://pdf.dfcfw.com/pdf/H3_AP202409031639718176_1.pdf?1725396930000.pdf
【东吴环保公用】市场化改革系列深度：要素市场化改革中，滞后30年的公用要素改革启航！,东吴证券,2024-08-31,环保行业,https://pdf.dfcfw.com/pdf/H3_AP202408311639656078_1.pdf?1725101485000.pdf
环保行业跟踪周报：两部门印发《能源重点领域大规模设备更新实施方案》，寻找固废及燃气板块alpha,东吴证券,2024-08-28,环保行业,https://pdf.dfcfw.com/pdf/H3_AP202408281639514654_1.pdf?1724861259000.pdf
企业竞争图谱：2024年废水处理ESG 头豹词条报告系列,头豹研究院,2024-08-23,环保行业,https://pdf.dfcfw.com/pdf/H3_AP202408231639431730_1.pdf?1724448356000.pdf
环保行业跟踪周报：系统部署全面绿色转型，推进水固电价格改革，寻找固废及燃气板块alpha,东吴证券,2024-08-20,环保行业,https://pdf.dfcfw.com/pdf/H3_AP202408201639346121_1.pdf?1724137180000.pdf
环保行业动态研究：明确2030年目标，加速全面绿色转型,国海证券,2024-08-15,环保行业,https://pdf.dfcfw.com/pdf/H3_AP202408141639279604_1.pdf?1723707027000.pdf
环保行业跟踪周报：中央层面首次系统部署全面绿色转型，重申市场化改革，寻找固废及燃气板块alpha,东吴证券,2024-08-14,环保行业,https://pdf.dfcfw.com/pdf/H3_AP202408141639263608_1.pdf?1723618263000.pdf
环保行业点评报告：系统部署全面绿色转型，22-30年节能环保产业规模复增目标8%，推进水固电价格改革,东吴证券,2024-08-13,环保行业,https://pdf.dfcfw.com/pdf/H3_AP202408131639261638_1.pdf?1723582289000.pdf
环保行业跟踪周报：持续完善碳排放体系，市场化改革下寻找固废及燃气板块alpha,东吴证券,2024-08-06,环保行业,https://pdf.dfcfw.com/pdf/H3_AP202408061639151699_1.pdf?1722934840000.pdf
环保行业金融“碳”索系列（七）：推动“能耗双控”向“碳排放双控”转型,平安证券,2024-08-05,环保行业,https://pdf.dfcfw.com/pdf/H3_AP202408051639134819_1.pdf?1722851705000.pdf
2024年中国工业污水行业概览：处理量被低估，政策监管推动行业发展,头豹研究院,2024-07-30,环保行业,https://pdf.dfcfw.com/pdf/H3_AP202407301638480681_1.pdf?1722368484000.pdf
环保行业点评报告：设备更新与消费品以旧换新“3000亿”就位，汽车、废电拆解需求激发+模式优化,东吴证券,2024-07-29,环保行业,https://pdf.dfcfw.com/pdf/H3_AP202407291638407088_1.pdf?1722235347000.pdf
环保行业跟踪周报：设备更新与消费品以旧换新“3000亿”就位，市场化改革下寻找固废及燃气板块alpha,东吴证券,2024-07-29,环保行业,https://pdf.dfcfw.com/pdf/H3_AP202407291638440800_1.pdf?1722290908000.pdf
环保行业前瞻研究：生物多样性：我国政策与金融支持现状,国联证券,2024-07-24,环保行业,https://pdf.dfcfw.com/pdf/H3_AP202407241638248363_1.pdf?1721814821000.pdf
环保行业点评报告：进一步全面深化改革，公用要素价格改革推进&生态环保多维受益,东吴证券,2024-07-24,环保行业,https://pdf.dfcfw.com/pdf/H3_AP202407241638255741_1.pdf?1721828862000.pdf
环保行业跟踪周报：市场化改革推进，寻找固废及燃气板块alpha,东吴证券,2024-07-24,环保行业,https://pdf.dfcfw.com/pdf/H3_AP202407241638275684_1.pdf?1721893851000.pdf
环保行业跟踪周报：财政部下达2024年城市管网及污水处理补助资金预算，产业资本锚定固废价值底,东吴证券,2024-07-15,环保行业,https://pdf.dfcfw.com/pdf/H3_AP202407151637912190_1.pdf?1721042260000.pdf
环保行业跟踪周报：瀚蓝环境拟私有化粤丰环保，从红利进入价格市场化阶段寻找alpha,东吴证券,2024-07-10,环保行业,https://pdf.dfcfw.com/pdf/H3_AP202407101637749007_1.pdf?1720616881000.pdf
