研报名称,机构名称,发布时间,行业,研报地址
环保行业之核污染防治领域深度报告：核电之光下的绿色保障,东莞证券,2024-01-31,环保行业,https://pdf.dfcfw.com/pdf/H3_AP202401311619789195_1.pdf?1706717043000.pdf
环保公用高股息配置策略：拥抱高股息，穿越下行周期,德邦证券,2024-01-30,环保行业,https://pdf.dfcfw.com/pdf/H3_AP202401301619512285_1.pdf?1706650737000.pdf
环保行业双周报：全国生态环境保护工作会议确定八大重点任务,东莞证券,2024-01-29,环保行业,https://pdf.dfcfw.com/pdf/H3_AP202401291619251604_1.pdf?1706533827000.pdf
低碳研究行业周报：市值管理纳入考核提振估值，初探23年公司业绩,华福证券,2024-01-29,环保行业,https://pdf.dfcfw.com/pdf/H3_AP202401291619252421_1.pdf?1706523897000.pdf
环保行业跟踪周报：九丰能源能服特气打开局面，超低排放促仕净科技加速增长，CCER交易开启林业碳汇绿电受益,东吴证券,2024-01-29,环保行业,https://pdf.dfcfw.com/pdf/H3_AP202401291619248973_1.pdf?1706520165000.pdf
环保2024年行业策略报告：卓越运营，创新赋能,首创证券,2024-01-28,环保行业,https://pdf.dfcfw.com/pdf/H3_AP202401281619244022_1.pdf?1706458901000.pdf
环保&专精特新周报：发改委就PPP特许经营方案公开征求意见,国海证券,2024-01-28,环保行业,https://pdf.dfcfw.com/pdf/H3_AP202401281619247841_1.pdf?1706519959000.pdf
中国水务行业，2024年1月,中诚信国际,2024-01-26,环保行业,https://pdf.dfcfw.com/pdf/H3_AP202401261618317996_1.pdf?1706290747000.pdf
中国环保运营行业，2024年1月,中诚信国际,2024-01-26,环保行业,https://pdf.dfcfw.com/pdf/H3_AP202401261618318071_1.pdf?1706289851000.pdf
生物质炉 头豹词条报告系列,头豹研究院,2024-01-25,环保行业,https://pdf.dfcfw.com/pdf/H3_AP202401251618113066_1.pdf?1706212813000.pdf
环保&专精特新周报：五部门推进水泥、焦化行业超低排放改造,国海证券,2024-01-24,环保行业,https://pdf.dfcfw.com/pdf/H3_AP202401231617977653_1.pdf?1706081541000.pdf
环保行业点评报告：CCER交易正式开启&首批审定核查资质开展审批，期待CCER增量收益兑现,东吴证券,2024-01-23,环保行业,https://pdf.dfcfw.com/pdf/H3_AP202401231617931003_1.pdf?1705994139000.pdf
环保行业跟踪周报：重视分红提升背后原因：现金流改善！从CPI角度看水价均值回归趋势！叠加政策力度加大，环保板块从股息定价到真实现金增长！,东吴证券,2024-01-23,环保行业,https://pdf.dfcfw.com/pdf/H3_AP202401231617949782_1.pdf?1706025219000.pdf
垃圾资源化利用 头豹词条报告系列,头豹研究院,2024-01-23,环保行业,https://pdf.dfcfw.com/pdf/H3_AP202401231617958681_1.pdf?1706040037000.pdf
水质监测 头豹词条报告系列,头豹研究院,2024-01-22,环保行业,https://pdf.dfcfw.com/pdf/H3_AP202401221617916080_1.pdf?1705953668000.pdf
环保行业月报：2023年环卫新能源渗透率同增2.18pct至8.12%，政策加码环卫新能源放量有望加速,东吴证券,2024-01-22,环保行业,https://pdf.dfcfw.com/pdf/H3_AP202401221617892066_1.pdf?1705914579000.pdf
环保行业点评报告：水泥、焦化超低排放正式出台，环保政策加码助力美丽中国建设,东吴证券,2024-01-22,环保行业,https://pdf.dfcfw.com/pdf/H3_AP202401221617904160_1.pdf?1705924624000.pdf
环保与公用事业周报：2023年用电量同比+6.7%，第三产业用电高增,德邦证券,2024-01-22,环保行业,https://pdf.dfcfw.com/pdf/H3_AP202401221617890993_1.pdf?1705915388000.pdf
低碳研究行业周报：铀价创新高，关注全球核电提速发展新机遇,华福证券,2024-01-22,环保行业,https://pdf.dfcfw.com/pdf/H3_AP202401221617891024_1.pdf?1705919576000.pdf
环保及公用事业行业周报：2023年电力需求增长6.7%，持续看好红利低波投资机会,国投证券,2024-01-22,环保行业,https://pdf.dfcfw.com/pdf/H3_AP202401211617888536_1.pdf?1705915388000.pdf
环保行业专题报告：寻找下一个“水务”：探寻垃圾焚烧发电分红潜力,民生证券,2024-01-17,环保行业,https://pdf.dfcfw.com/pdf/H3_AP202401161617543036_1.pdf?1705475836000.pdf
环保行业跟踪周报：中共中央、国务院关于全面推进美丽中国建设的意见，“无废城市”目标加速，全面推荐优质环保资产,东吴证券,2024-01-16,环保行业,https://pdf.dfcfw.com/pdf/H3_AP202401161617510517_1.pdf?1705419598000.pdf
环保行业点评报告：美丽中国进入落地阶段，绿色循环&污染防治等领域多维受益,东吴证券,2024-01-15,环保行业,https://pdf.dfcfw.com/pdf/H3_AP202401151617484632_1.pdf?1705306239000.pdf
环保及公用事业行业周报：市场震荡延续，持续推荐低波红利精选标的,国投证券,2024-01-15,环保行业,https://pdf.dfcfw.com/pdf/H3_AP202401141617484586_1.pdf?1705312847000.pdf
环保行业双周报：全面建设美丽中国意见出台，碳排放交易市场持续推进,东莞证券,2024-01-15,环保行业,https://pdf.dfcfw.com/pdf/H3_AP202401151617485809_1.pdf?1705310503000.pdf
低碳研究行业周报：煤价中枢下移+盈利模式转变，资产减值风险或有望降低,华福证券,2024-01-15,环保行业,https://pdf.dfcfw.com/pdf/H3_AP202401151617485848_1.pdf?1705318315000.pdf
《全面推进美丽中国建设的意见》点评：完善碳市场交易体系，构建资源节约集约型社会,民生证券,2024-01-12,环保行业,https://pdf.dfcfw.com/pdf/H3_AP202401121617269248_1.pdf?1705043542000.pdf
环保行业事件点评：全面推进美丽中国建设，降碳减污协同并进,东莞证券,2024-01-12,环保行业,https://pdf.dfcfw.com/pdf/H3_AP202401121617316344_1.pdf?1705072688000.pdf
新能源板块行业信息点评：宁东基地发布5.6元_公斤绿氢补贴，补贴后成本对比煤制氢有竞争力,海通国际,2024-01-10,环保行业,https://pdf.dfcfw.com/pdf/H3_AP202401101617014699_1.pdf?1704879782000.pdf
环保行业专题报告：水务行业全景图,民生证券,2024-01-08,环保行业,https://pdf.dfcfw.com/pdf/H3_AP202401081616772990_1.pdf?1704739869000.pdf
低碳研究行业周报：可控核聚变加速突破，资本和企业入局推动商业化进展,华福证券,2024-01-08,环保行业,https://pdf.dfcfw.com/pdf/H3_AP202401081616758756_1.pdf?1704709365000.pdf
环保行业跟踪周报：却喜晒谷天晴——迎接环保3.0！从利润表到真实增长：现金流&优质成长&双碳驱动,东吴证券,2024-01-08,环保行业,https://pdf.dfcfw.com/pdf/H3_AP202401081616761377_1.pdf?1704708267000.pdf
环保及公用事业行业周报：长期看好高股息投资逻辑，重申精选高分红、低波动标的投资机遇,国投证券,2024-01-07,环保行业,https://pdf.dfcfw.com/pdf/H3_AP202401071616757661_1.pdf?1704643957000.pdf
低碳研究行业：车网互动新政出台，虚拟电厂迎来利好,华福证券,2024-01-05,环保行业,https://pdf.dfcfw.com/pdf/H3_AP202401051616658020_1.pdf?1704479764000.pdf
中国垃圾资源化利用行业市场规模测算逻辑模型 头豹词条报告系列,头豹研究院,2024-01-05,环保行业,https://pdf.dfcfw.com/pdf/H3_AP202401051616683282_1.pdf?1704484365000.pdf
环保行业2024年年度策略：却喜晒谷天晴——迎接环保3.0！-从利润表到真实增长：现金流＆优质成长&双碳驱动,东吴证券,2024-01-03,环保行业,https://pdf.dfcfw.com/pdf/H3_AP202401031616018250_1.pdf?1704274119000.pdf
环保&专精特新周报：八部委发文推动传统制造业转型升级,国海证券,2024-01-03,环保行业,https://pdf.dfcfw.com/pdf/H3_AP202401031616217709_1.pdf?1704293054000.pdf
