研报名称,机构名称,发布时间,行业,研报地址
环保行业跟踪周报：SAF扩产+能源价值中枢上行，持续关注UCO端山高、朗坤，重视矿业双碳,东吴证券,2026-03-03,环境治理,https://pdf.dfcfw.com/pdf/H3_AP202603031820219182_1.pdf?1772543321000.pdf
环保行业周报：光伏组件回收迎来“退役潮”，新国标出台助力行业步入“正规化”,信达证券,2026-02-28,环境治理,https://pdf.dfcfw.com/pdf/H3_AP202602281820143569_1.pdf?1772312591000.pdf
环保行业跟踪周报：海螺集团拟对海螺创业增持10.61%；重视矿山双碳；持续关注UCO端山高、朗坤,东吴证券,2026-02-24,环境治理,https://pdf.dfcfw.com/pdf/H3_AP202602241819991636_1.pdf?1771942673000.pdf
环保行业周报：截至2025年底，环保行业基金持仓市值58亿元，环比规模有所提升,信达证券,2026-02-23,环境治理,https://pdf.dfcfw.com/pdf/H3_AP202602231819979236_1.pdf?1771835371000.pdf
环保行业深度报告：矿业双碳：绿能、装备、资源&再生资源！,东吴证券,2026-02-14,环境治理,https://pdf.dfcfw.com/pdf/H3_AP202602141819927639_1.pdf?1771062937000.pdf
环保行业深度报告：解决航天核心资源瓶颈的钥匙，“铼”自资源卡位与提取技术突破,东吴证券,2026-02-14,环境治理,https://pdf.dfcfw.com/pdf/H3_AP202602141819933072_1.pdf?1771065626000.pdf
