研报名称,机构名称,发布时间,行业,研报地址
中空玻璃 头豹词条报告系列,头豹研究院,2024-01-22,玻璃玻纤,https://pdf.dfcfw.com/pdf/H3_AP202401221617916078_1.pdf?1705953447000.pdf
建筑材料及新材料行业专题研究：肖特药包：持续创新及全球化成就玻璃药包龙头,国联证券,2024-01-14,玻璃玻纤,https://pdf.dfcfw.com/pdf/H3_AP202401141617483358_1.pdf?1705242839000.pdf
建材行业周报：住房租赁“金融17条”出炉，行业进入需求淡季,甬兴证券,2024-01-10,玻璃玻纤,https://pdf.dfcfw.com/pdf/H3_AP202401101617031248_1.pdf?1704881664000.pdf
建筑材料行业点评报告：深圳城中村细则叠加PSL重启，关注建材底部机会,开源证券,2024-01-08,玻璃玻纤,https://pdf.dfcfw.com/pdf/H3_AP202401081616761337_1.pdf?1704708373000.pdf
建筑材料行业周报：深圳首批配售型保障性住房集中开工，有望带来地产投资增量,上海证券,2024-01-05,玻璃玻纤,https://pdf.dfcfw.com/pdf/H3_AP202401051616538317_1.pdf?1704445565000.pdf
