研报名称,机构名称,发布时间,行业,研报地址
企业竞争图谱：2024年光学玻璃 头豹词条报告系列,头豹研究院,2024-10-31,玻璃玻纤,https://pdf.dfcfw.com/pdf/H3_AP202410311640648821_1.pdf?1730406733000.pdf
建筑建材：如何看待浮法玻璃价格的变化？,东兴证券,2024-10-25,玻璃玻纤,https://pdf.dfcfw.com/pdf/H3_AP202410251640496724_1.pdf?1729862257000.pdf
中国平板玻璃行业市场规模测算逻辑模型 头豹词条报告系列,头豹研究院,2024-10-22,玻璃玻纤,https://pdf.dfcfw.com/pdf/H3_AP202410221640418136_1.pdf?1729626136000.pdf
玻纤行业深度报告：竞争格局优异，价格底部回升,平安证券,2024-09-20,玻璃玻纤,https://pdf.dfcfw.com/pdf/H3_AP202409201639960864_1.pdf?1726851780000.pdf
建筑材料及新材料2024Q2末基金重仓点评：重仓略增，加仓优质基建地产链企业,国联证券,2024-07-24,玻璃玻纤,https://pdf.dfcfw.com/pdf/H3_AP202407241638248550_1.pdf?1721810688000.pdf
中国工程玻璃行业市场规模测算逻辑模型 头豹词条报告系列,头豹研究院,2024-07-15,玻璃玻纤,https://pdf.dfcfw.com/pdf/H3_AP202407151637931293_1.pdf?1721077213000.pdf
建筑材料及新材料24Q2前瞻：需求支撑预计较弱,国联证券,2024-07-08,玻璃玻纤,https://pdf.dfcfw.com/pdf/H3_AP202407081637682781_1.pdf?1720461469000.pdf
真空玻璃行业：隔热节能先锋，真空玻璃技术的革新与应用 头豹词条报告系列,头豹研究院,2024-06-26,玻璃玻纤,https://pdf.dfcfw.com/pdf/H3_AP202406261636922896_1.pdf?1719430878000.pdf
建材行业2024年度中期投资策略：地产链静待曙光，非地产关注玻纤_药包材等,国联证券,2024-06-19,玻璃玻纤,https://pdf.dfcfw.com/pdf/H3_AP202406191636677682_1.pdf?1718788707000.pdf
非金属新材料行业专题研究：玻璃基板1：从有机到无机，不断延续摩尔定律,天风证券,2024-06-17,玻璃玻纤,https://pdf.dfcfw.com/pdf/H3_AP202406171636462429_1.pdf?1718619513000.pdf
玻璃纤维行业深度报告：周期拐点已现，看好电子布景气继续上行,东吴证券,2024-06-04,玻璃玻纤,https://pdf.dfcfw.com/pdf/H3_AP202406041635360131_1.pdf?1717528116000.pdf
建筑材料及新材料：建材等节能降碳或加速，多方面积极前景可期,国联证券,2024-05-31,玻璃玻纤,https://pdf.dfcfw.com/pdf/H3_AP202405311635020696_1.pdf?1717147362000.pdf
