研报名称,机构名称,发布时间,行业,研报地址
医药生物：门诊统筹有望带动处方外流至零售药店,国联证券,2024-04-21,生物制品,https://pdf.dfcfw.com/pdf/H3_AP202404211630908960_1.pdf?1713698335000.pdf
2023年中国胃黏膜保护药物行业概览：慢性胃炎成消化健康问题主要元凶，超9成居民治疗需求带动用药市场加速扩张,头豹研究院,2024-04-19,生物制品,https://pdf.dfcfw.com/pdf/H3_AP202404191630690472_1.pdf?1713556357000.pdf
中国眼科治疗类透明质酸终端产品行业市场规模测算逻辑模型 头豹词条报告系列,头豹研究院,2024-04-18,生物制品,https://pdf.dfcfw.com/pdf/H3_AP202404181630528203_1.pdf?1713469130000.pdf
医药生物行业重大事件快评：胰岛素国采接续规则发布，关注相关公司中选情况,国信证券,2024-04-17,生物制品,https://pdf.dfcfw.com/pdf/H3_AP202404171630409205_1.pdf?1713379328000.pdf
医药生物行业双周报2024年第8期总第106期：2023年医疗保障事业发展统计快报发布 多地出台政策支持创新药发展,长城国瑞证券,2024-04-16,生物制品,https://pdf.dfcfw.com/pdf/H3_AP202404161630270362_1.pdf?1713261278000.pdf
中国抗高血压药物行业市场规模测算逻辑模型 头豹词条报告系列,头豹研究院,2024-04-16,生物制品,https://pdf.dfcfw.com/pdf/H3_AP202404161630292343_1.pdf?1713296202000.pdf
医药生物行业周报：医保基金合理结余，为创新药械腾挪空间,上海证券,2024-04-15,生物制品,https://pdf.dfcfw.com/pdf/H3_AP202404151630211033_1.pdf?1713170426000.pdf
医药行业周报：建议布局医药底部个股,西南证券,2024-04-15,生物制品,https://pdf.dfcfw.com/pdf/H3_AP202404151630214017_1.pdf?1713180552000.pdf
中国β受体阻滞剂行业市场规模测算逻辑模型 头豹词条报告系列,头豹研究院,2024-04-15,生物制品,https://pdf.dfcfw.com/pdf/H3_AP202404151630231545_1.pdf?1713210681000.pdf
医药行业创新药周报：2024年4月第二周创新药周报（附小专题靶向Nectin-4 ADC研发概况）,西南证券,2024-04-15,生物制品,https://pdf.dfcfw.com/pdf/H3_AP202404151630231636_1.pdf?1713212587000.pdf
AACR 2024：SKB-264肺癌数据亮眼，展现泛瘤种治疗潜力,国联证券,2024-04-14,生物制品,https://pdf.dfcfw.com/pdf/H3_AP202404141630207869_1.pdf?1713096079000.pdf
政策支持叠加技术创新，小分子药物获批数量创新高 词条报告系列,头豹研究院,2024-04-12,生物制品,https://pdf.dfcfw.com/pdf/H3_AP202404121630191621_1.pdf?1712950725000.pdf
疫苗行业更新：儿童苗批签发维持平稳，带疱疫苗有望快速放量,中邮证券,2024-04-11,生物制品,https://pdf.dfcfw.com/pdf/H3_AP202404111630145887_1.pdf?1712852179000.pdf
医药生物行业月度报告：创新支持政策频出，重点关注创新药及其产业链,财信证券,2024-04-11,生物制品,https://pdf.dfcfw.com/pdf/H3_AP202404111630146087_1.pdf?1712852763000.pdf
2023年脑膜炎用药行业概览：10万人中脑膜炎患病人数降至5人以内，中国消除脑膜炎工作进展如何？,头豹研究院,2024-04-10,生物制品,https://pdf.dfcfw.com/pdf/H3_AP202404101630121836_1.pdf?1712777663000.pdf
中国呼吸道疾病检测行业市场规模测算逻辑模型 头豹词条报告系列,头豹研究院,2024-04-09,生物制品,https://pdf.dfcfw.com/pdf/H3_AP202404091630085837_1.pdf?1712691245000.pdf
医药行业周报：胰岛素续约政策逐步温和化,西南证券,2024-04-08,生物制品,https://pdf.dfcfw.com/pdf/H3_AP202404081630040585_1.pdf?1712565972000.pdf
生物医药行业：仑卡奈单抗AD治疗新适应症，在美递交上市申请,平安证券,2024-04-08,生物制品,https://pdf.dfcfw.com/pdf/H3_AP202404081630044625_1.pdf?1712588189000.pdf
血制品行业3月报：血制品板块个股行情分化，关注一季报发布,万联证券,2024-04-08,生物制品,https://pdf.dfcfw.com/pdf/H3_AP202404081630046822_1.pdf?1712591717000.pdf
医药行业创新药周报：2024年4月第一周创新药周报（附小专题BCMA CAR-T治疗研发概况）,西南证券,2024-04-08,生物制品,https://pdf.dfcfw.com/pdf/H3_AP202404081630052465_1.pdf?1712599384000.pdf
2023年中国流感病毒裂解疫苗行业概览：百万需求疫苗产品更替，赛道企业注重四价布局,头豹研究院,2024-04-08,生物制品,https://pdf.dfcfw.com/pdf/H3_AP202404081630057377_1.pdf?1712605021000.pdf
医药生物：创新药械政策进一步落地，持续看好创新药行情,国联证券,2024-04-08,生物制品,https://pdf.dfcfw.com/pdf/H3_AP202404081630060725_1.pdf?1712609914000.pdf
70岁以上老龄人口患病风险陡增，获得性血友病国产药物研发进展如何？ 词条报告系列,头豹研究院,2024-04-08,生物制品,https://pdf.dfcfw.com/pdf/H3_AP202404081630057365_1.pdf?1712605250000.pdf
医药生物行业研究周报：积极关注脑机接口作为医药新质生产力的主题投资机会,天风证券,2024-04-07,生物制品,https://pdf.dfcfw.com/pdf/H3_AP202404071630032735_1.pdf?1712483765000.pdf
医药生物行业周报：胰岛素集采接续启动，中标产品有望享“量价齐升”,上海证券,2024-04-07,生物制品,https://pdf.dfcfw.com/pdf/H3_AP202404071630034348_1.pdf?1712495796000.pdf
医药生物：医保政策推动辅助生殖行业快速发展,国联证券,2024-04-07,生物制品,https://pdf.dfcfw.com/pdf/H3_AP202404071630034548_1.pdf?1712498274000.pdf
医药月报：一季报预期增长放缓，关注成长性和价值投资,中国银河,2024-04-03,生物制品,https://pdf.dfcfw.com/pdf/H3_AP202404031629688229_1.pdf?1712141100000.pdf
2023年中国RSV药物行业概览：国际巨头重金布局，国产药企新秀发力紧追,头豹研究院,2024-04-03,生物制品,https://pdf.dfcfw.com/pdf/H3_AP202404031629712807_1.pdf?1712173131000.pdf
生物医药行业深度：代谢相关脂肪肝炎（MASH_NASH）：无药可治局面被打破，巨大市场需求待挖掘,德邦证券,2024-04-03,生物制品,https://pdf.dfcfw.com/pdf/H3_AP202404031629713294_1.pdf?1712173895000.pdf
中国种植牙行业市场规模测算逻辑模型 头豹词条报告系列,头豹研究院,2024-04-03,生物制品,https://pdf.dfcfw.com/pdf/H3_AP202404031629712806_1.pdf?1712173039000.pdf
生物制品行业跟踪报告：2024Q1血制品批签发：各品种上市公司分化大，华兰、派林、上海莱士表现突出,万联证券,2024-04-02,生物制品,https://pdf.dfcfw.com/pdf/H3_AP202404021629500091_1.pdf?1712087188000.pdf
2023年中国医药级透明质酸行业概览：市场规模超100亿，医疗与消费双轮驱动前景可期,头豹研究院,2024-04-02,生物制品,https://pdf.dfcfw.com/pdf/H3_AP202404021629501531_1.pdf?1712087087000.pdf
中国肿瘤PCR检测行业市场规模测算逻辑模型 头豹词条报告系列,头豹研究院,2024-04-02,生物制品,https://pdf.dfcfw.com/pdf/H3_AP202404021629501313_1.pdf?1712087087000.pdf
医药生物行业周报：全新机制口服降压药获FDA批准上市，关注心血管药物赛道,上海证券,2024-04-01,生物制品,https://pdf.dfcfw.com/pdf/H3_AP202404011629191845_1.pdf?1711959952000.pdf
医药行业周报：持续看好AI医疗方向和底部个股,西南证券,2024-04-01,生物制品,https://pdf.dfcfw.com/pdf/H3_AP202404011629191872_1.pdf?1711966880000.pdf
生物医药行业周报：创新药企多数实现2023盈利或减亏,平安证券,2024-04-01,生物制品,https://pdf.dfcfw.com/pdf/H3_AP202404011629201396_1.pdf?1711991115000.pdf
医药生物行业周报：关注创新药支持政策催化和央国企改革,信达证券,2024-04-01,生物制品,https://pdf.dfcfw.com/pdf/H3_AP202404011629201744_1.pdf?1711992883000.pdf
生物医药Ⅱ行业周报：低浓度阿托品滴眼液获批，儿童近视防控市场空间广阔,太平洋,2024-04-01,生物制品,https://pdf.dfcfw.com/pdf/H3_AP202404011629196586_1.pdf?1711980282000.pdf
2024年3月第四周创新药周报（附小专题Syk靶点研发概况）,西南证券,2024-03-25,生物制品,https://pdf.dfcfw.com/pdf/H3_AP202403251628066534_1.pdf?1711364749000.pdf
医药行业周报：关注AI医疗方向,西南证券,2024-03-25,生物制品,https://pdf.dfcfw.com/pdf/H3_AP202403251628066663_1.pdf?1711364071000.pdf
医药生物行业周报：医疗AI赋能医药产业新发展,国联证券,2024-03-25,生物制品,https://pdf.dfcfw.com/pdf/H3_AP202403251628068554_1.pdf?1711360723000.pdf
生物医药Ⅱ行业周报：全球首款THR-β激动剂获批，领跑NASH大单品赛道,太平洋,2024-03-25,生物制品,https://pdf.dfcfw.com/pdf/H3_AP202403251628071137_1.pdf?1711380197000.pdf
医药生物行业周报：AI赋能医药全产业链，积极把握行业投资机会,上海证券,2024-03-24,生物制品,https://pdf.dfcfw.com/pdf/H3_AP202403241628064294_1.pdf?1711291985000.pdf
医药行业周报：儿童近视防控重磅药品首发上市，大规模设备更新方案利好国产医疗设备,首创证券,2024-03-22,生物制品,https://pdf.dfcfw.com/pdf/H3_AP202403221627631140_1.pdf?1711138996000.pdf
医药生物行业报告：创新药板块有望迎来全产业链高景气发展，院内设备更新有望提速,中邮证券,2024-03-18,生物制品,https://pdf.dfcfw.com/pdf/H3_AP202403181626961078_1.pdf?1710763518000.pdf
医药生物：从阿托品看近视防控市场,西南证券,2024-03-15,生物制品,https://pdf.dfcfw.com/pdf/H3_AP202403151626826453_1.pdf?1710515855000.pdf
疫苗行业全景图系列二：RSV上市首年便为十亿美元重磅单品，市场空间广阔,平安证券,2024-02-22,生物制品,https://pdf.dfcfw.com/pdf/H3_AP202402221622821429_1.pdf?1708615797000.pdf
胰岛素行业深度报告：国产替代+开拓欧美市场，国产胰岛素进入新阶段,国海证券,2024-02-21,生物制品,https://pdf.dfcfw.com/pdf/H3_AP202402211622485425_1.pdf?1708520643000.pdf
呼吸道合胞病毒（RSV）药物 头豹词条报告系列,头豹研究院,2024-02-05,生物制品,https://pdf.dfcfw.com/pdf/H3_AP202402041620554449_1.pdf?1707128307000.pdf
医药行业周报：面向国内市场，继续看好仿制药CXO,华鑫证券,2024-01-29,生物制品,https://pdf.dfcfw.com/pdf/H3_AP202401291619260292_1.pdf?1706524151000.pdf
医药行业周报：关注医药23年业绩前瞻,西南证券,2024-01-22,生物制品,https://pdf.dfcfw.com/pdf/H3_AP202401221617891624_1.pdf?1705918112000.pdf
医药生物行业周报：老龄化需求刚性，医药板块机会明确、性价比突出,中泰证券,2024-01-22,生物制品,https://pdf.dfcfw.com/pdf/H3_AP202401221617891052_1.pdf?1705918963000.pdf
医药生物行业周报：仑卡奈单抗注射液国内获批，关注AD产业链投资机会,甬兴证券,2024-01-18,生物制品,https://pdf.dfcfw.com/pdf/H3_AP202401181617684469_1.pdf?1705595518000.pdf
医药行业周报：医药无需悲观,西南证券,2024-01-15,生物制品,https://pdf.dfcfw.com/pdf/H3_AP202401151617485899_1.pdf?1705316187000.pdf
生物医药II行业周报：冠脉钙化治疗推陈出新，乐普医疗IVL产品获批,太平洋,2024-01-15,生物制品,https://pdf.dfcfw.com/pdf/H3_AP202401151617486101_1.pdf?1705315891000.pdf
医药行业周报：进入年报预告期，关注业绩或可超预期方向,德邦证券,2024-01-15,生物制品,https://pdf.dfcfw.com/pdf/H3_AP202401151617487320_1.pdf?1705315060000.pdf
医药行业周报：国产创新药出海势头正盛，为医药企业带来新机会,平安证券,2024-01-15,生物制品,https://pdf.dfcfw.com/pdf/H3_AP202401151617487395_1.pdf?1705327798000.pdf
血制品行业专题报告：内生外延双改善，供给需求齐共振,中邮证券,2024-01-15,生物制品,https://pdf.dfcfw.com/pdf/H3_AP202401141617484014_1.pdf?1705310333000.pdf
生物制品行业深度报告：过敏类疾病：2型免疫通路失衡带来的百亿蓝海市场,开源证券,2024-01-11,生物制品,https://pdf.dfcfw.com/pdf/H3_AP202401111617230099_1.pdf?1704958621000.pdf
生物制品行业深度报告：掘金蓝海市场，RSV疫苗前景广阔,开源证券,2024-01-08,生物制品,https://pdf.dfcfw.com/pdf/H3_AP202401081616759614_1.pdf?1704707340000.pdf
直觉外科（ISRG）：手术革命发起者，全球手术机器人龙头,德邦证券,2024-01-05,生物制品,https://pdf.dfcfw.com/pdf/H3_AP202401051616647815_1.pdf?1704462332000.pdf
医药生物行业周报：海尔集团拟收购上海莱士控股权，血制品板块价值有望重构,开源证券,2024-01-03,生物制品,https://pdf.dfcfw.com/pdf/H3_AP202401031616220906_1.pdf?1704299551000.pdf
医药生物行业周报：全年主线紧抓“中药+创新药械”，兼顾出海标的,华安证券,2024-01-02,生物制品,https://pdf.dfcfw.com/pdf/H3_AP202401021615924387_1.pdf?1704217765000.pdf
2024年医药生物行业投资策略报告：创新和出海是主旋律，拥抱医药行业新机遇,国元证券,2024-01-02,生物制品,https://pdf.dfcfw.com/pdf/H3_AP202401021615914463_1.pdf?1704205622000.pdf
2024年医药行业投资策略：创新为帆，蓝海启航,太平洋,2024-01-02,生物制品,https://pdf.dfcfw.com/pdf/H3_AP202401021615912448_1.pdf?1704193379000.pdf
医药与健康护理行业信息点评：江西牵头肾功心肌酶生化类试剂集采开标，IVD领域集采落地加速,海通国际,2024-01-02,生物制品,https://pdf.dfcfw.com/pdf/H3_AP202401021615912834_1.pdf?1704193839000.pdf
医药与健康护理行业信息点评：众生药业甲流创新药上市申请获受理,海通国际,2023-12-29,生物制品,https://pdf.dfcfw.com/pdf/H3_AP202312291615473534_1.pdf?1703859277000.pdf
医药与健康护理行业信息点评：国家卫生健康委发布《产前筛查和产前诊断质量控制指标》，提升优生优育服务水平,海通国际,2023-12-28,生物制品,https://pdf.dfcfw.com/pdf/H3_AP202312281615149142_1.pdf?1703773455000.pdf
医药与健康护理行业信息点评：阿斯利康收购亘喜生物，布局CAR-T肿瘤及自免赛道,海通国际,2023-12-28,生物制品,https://pdf.dfcfw.com/pdf/H3_AP202312281615156631_1.pdf?1703783969000.pdf
轮状病毒疫苗 头豹词条报告系列,头豹研究院,2023-12-28,生物制品,https://pdf.dfcfw.com/pdf/H3_AP202312281615160615_1.pdf?1703792658000.pdf
医药生物行业周报：大型医院巡查方案公布,国开证券,2023-12-27,生物制品,https://pdf.dfcfw.com/pdf/H3_AP202312271615019836_1.pdf?1703689933000.pdf
医药与健康护理行业信息点评：国家卫健委印发大型医院巡查工作方案（2023-2026年度）,海通国际,2023-12-26,生物制品,https://pdf.dfcfw.com/pdf/H3_AP202312261614901571_1.pdf?1703604004000.pdf
2023年中国肝炎疫苗行业概览报告,头豹研究院,2023-12-25,生物制品,https://pdf.dfcfw.com/pdf/H3_AP202312251614893605_1.pdf?1703533594000.pdf
医药与健康护理行业信息点评：《新药临床安全性评价技术指导原则》发布，为新药风险评估提供科学性技术指导,海通国际,2023-12-21,生物制品,https://pdf.dfcfw.com/pdf/H3_AP202312211614650390_1.pdf?1703180336000.pdf
医药生物：2023年医保目录出炉，关注中药创新&解限双线索,华安证券,2023-12-18,生物制品,https://pdf.dfcfw.com/pdf/H3_AP202312181614440174_1.pdf?1702914435000.pdf
中国消化道出血用药行业市场规模测算逻辑模型 头豹词条报告系列,头豹研究院,2023-12-15,生物制品,https://pdf.dfcfw.com/pdf/H3_AP202312151614287962_1.pdf?1702670483000.pdf
医药行业行业研究：2023年医保平均降价62%，七成创新药原价续约,国金证券,2023-12-14,生物制品,https://pdf.dfcfw.com/pdf/H3_AP202312141614137801_1.pdf?1702562701000.pdf
医药月报：集采稳步推进，重点关注化学发光,中国银河,2023-12-14,生物制品,https://pdf.dfcfw.com/pdf/H3_AP202312141614139509_1.pdf?1702572098000.pdf
医药行业：医保谈判结果符合预期，创新支持政策落到实处,中国银河,2023-12-14,生物制品,https://pdf.dfcfw.com/pdf/H3_AP202312141614139514_1.pdf?1702572200000.pdf
海外CXO行业专题研究：2023年Q3回顾：需求整体稳定，静待行业拐点,民生证券,2023-12-13,生物制品,https://pdf.dfcfw.com/pdf/H3_AP202312131614087365_1.pdf?1702499694000.pdf
医药生物行业投资策略报告：否极泰来，创新引领新周期,万联证券,2023-12-12,生物制品,https://pdf.dfcfw.com/pdf/H3_AP202312121613747326_1.pdf?1702371847000.pdf
医药与健康护理行业信息点评：《干扰素省际联盟集中带量采购文件（征求意见稿）》发布，独家品种降幅优惠,海通国际,2023-12-12,生物制品,https://pdf.dfcfw.com/pdf/H3_AP202312121613761974_1.pdf?1702392626000.pdf
右佐匹克隆 头豹词条报告系列,头豹研究院,2023-12-11,生物制品,https://pdf.dfcfw.com/pdf/H3_AP202312111613711747_1.pdf?1702328239000.pdf
医药生物行业2024年上半年投资策略：反腐规范行业发展 探寻细分景气方向,东莞证券,2023-12-04,生物制品,https://pdf.dfcfw.com/pdf/H3_AP202312041613234755_1.pdf?1701717026000.pdf
医药生物行业周报：关注国内老龄化需求，积极拥抱创新和出海,信达证券,2023-12-04,生物制品,https://pdf.dfcfw.com/pdf/H3_AP202312041613229208_1.pdf?1701717096000.pdf
医药行业周报：基因检测行业渐趋成熟，关注产业链投资机会,华金证券,2023-11-27,生物制品,https://pdf.dfcfw.com/pdf/H3_AP202311271612385970_1.pdf?1701078367000.pdf
血制品板块2023Q3总结：静丙驱动高增，业绩有所分化,中泰证券,2023-11-20,生物制品,https://pdf.dfcfw.com/pdf/H3_AP202311201611683274_1.pdf?1700485506000.pdf
疫苗板块2023Q3总结：大品种驱动成长，常规业务逐渐恢复,中泰证券,2023-11-17,生物制品,https://pdf.dfcfw.com/pdf/H3_AP202311171611360412_1.pdf?1700237366000.pdf
生物制品行业点评报告：带状疱疹疫苗目标人群需求较大，市场长期可期,开源证券,2023-11-14,生物制品,https://pdf.dfcfw.com/pdf/H3_AP202311141610633296_1.pdf?1699948091000.pdf
医药与健康护理行业周报：上海市人民政府办公厅发布《上海市加快合成生物创新策源打造高端生物制造产业集群行动方案（2023-2025年）》,海通国际,2023-11-07,生物制品,https://pdf.dfcfw.com/pdf/H3_AP202311071609229969_1.pdf?1699364591000.pdf
医药行业点评报告：GSK接手JNJ-3989，巩固其乙肝治疗领域的领先优势,太平洋,2023-11-06,生物制品,https://pdf.dfcfw.com/pdf/H3_AP202311061609025447_1.pdf?1699278743000.pdf
医药板块三报总结：资金、政策、基本面共振，上行大周期来临,国金证券,2023-11-06,生物制品,https://pdf.dfcfw.com/pdf/H3_AP202311061609028891_1.pdf?1699277962000.pdf
新药周观点：国产ADC接连出海，专利问题或将不再成为国际化阻碍,安信证券,2023-11-06,生物制品,https://pdf.dfcfw.com/pdf/H3_AP202311061609028548_1.pdf?1699362341000.pdf
医药生物行业周报：三季报披露完毕，医药表现重归强势（附局限性小细胞肺癌研究专题）,太平洋,2023-11-06,生物制品,https://pdf.dfcfw.com/pdf/H3_AP202311061609030352_1.pdf?1699286347000.pdf
医药生物行业周报：医药板块回暖，三条主线把握投资机会,华福证券,2023-11-06,生物制品,https://pdf.dfcfw.com/pdf/H3_AP202311061609030333_1.pdf?1699362341000.pdf
2023年中国升白口服制剂行业概览,头豹研究院,2023-10-31,生物制品,https://pdf.dfcfw.com/pdf/H3_AP202310311606788729_1.pdf?1698768040000.pdf
医药生物：公募基金医药板块2023Q3持仓分析-2023Q3医药持仓稳步上升，医疗服务仓位增加,华安证券,2023-10-30,生物制品,https://pdf.dfcfw.com/pdf/H3_AP202310301605643437_1.pdf?1698680171000.pdf
医药生物行业跟踪周报：医疗反腐艰难时刻已过，全面战略布局2024年,东吴证券,2023-10-30,生物制品,https://pdf.dfcfw.com/pdf/H3_AP202310291605638488_1.pdf?1698661542000.pdf
医药生物行业点评报告：医药板块涨幅居子行业第一，医药外包领先,太平洋,2023-10-29,生物制品,https://pdf.dfcfw.com/pdf/H3_AP202310291605634306_1.pdf?1698593923000.pdf
医药生物周观点：情绪持续缓和，板块仍处于反弹趋势中,天风证券,2023-10-29,生物制品,https://pdf.dfcfw.com/pdf/H3_AP202310291605634308_1.pdf?1698594070000.pdf
医药生物行业点评报告：NMPA发布仿制药参比制剂目录,太平洋,2023-10-27,生物制品,https://pdf.dfcfw.com/pdf/H3_AP202310271605162832_1.pdf?1698417801000.pdf
中国脑膜炎疫苗行业市场规模测算逻辑模型 头豹词条报告系列,头豹研究院,2023-10-27,生物制品,https://pdf.dfcfw.com/pdf/H3_AP202403061625695942_1.pdf?1709754716000.pdf
疫苗行业系列报告（5）：带状疱疹疫苗是全球重磅品种，国内商业化空间广阔,国信证券,2023-10-24,生物制品,https://pdf.dfcfw.com/pdf/H3_AP202310241602903278_1.pdf?1698145294000.pdf
