研报名称,机构名称,发布时间,行业,研报地址
新能源板块行业周报：浙江建立电网侧储能示范项目奖补机制，山东推动多元新型储能发展,海通国际,2024-03-06,电力行业,https://pdf.dfcfw.com/pdf/H3_AP202403061625681118_1.pdf?1709745789000.pdf
电力及公用事业《政府工作报告》点评：积极稳妥推进“双碳”，构建资源节约集约型社会,民生证券,2024-03-05,电力行业,https://pdf.dfcfw.com/pdf/H3_AP202403051625534456_1.pdf?1709674007000.pdf
发电及电网行业点评：国网发布2024年第一批电表招标公告，行业持续保持高景气度,太平洋,2024-03-04,电力行业,https://pdf.dfcfw.com/pdf/H3_AP202403041625216020_1.pdf?1709543930000.pdf
煤电一体化：孕育红利低波的摇篮,国投证券,2024-03-04,电力行业,https://pdf.dfcfw.com/pdf/H3_AP202403041625253476_1.pdf?1709546919000.pdf
公用事业行业周报（2024年第9周）：政策聚焦电网侧消纳，首个生活垃圾制氢项目落地,民生证券,2024-03-04,电力行业,https://pdf.dfcfw.com/pdf/H3_AP202403041625289003_1.pdf?1709549246000.pdf
公用事业行业周报：ESG周报，我国建成全球覆盖温室气体排放量最大碳市场；欧盟推出新计划大力发展氢能,德邦证券,2024-03-04,电力行业,https://pdf.dfcfw.com/pdf/H3_AP202403041625214755_1.pdf?1709538025000.pdf
环保与公用事业周报：山东省率先免征氢能车高速通行费，氢能车物流成本进一步降低,德邦证券,2024-03-04,电力行业,https://pdf.dfcfw.com/pdf/H3_AP202403041625214764_1.pdf?1709538128000.pdf
电力及公用事业：配网发展迎新政策机遇，配网设备投资有望加速,国投证券,2024-03-04,电力行业,https://pdf.dfcfw.com/pdf/H3_AP202403031625210973_1.pdf?1709544672000.pdf
公用事业及环保产业行业研究：再提配电网改造，分布式新能源受益,国金证券,2024-03-04,电力行业,https://pdf.dfcfw.com/pdf/H3_AP202403041625377612_1.pdf?1709559398000.pdf
新型电力系统专题（04）：顶层文件出台指导，配电网明确阶段性建设目标,民生证券,2024-03-03,电力行业,https://pdf.dfcfw.com/pdf/H3_AP202403021625198989_1.pdf?1709458452000.pdf
公用事业—电力天然气周报：辅助服务政策再加码，卡塔尔宣布远期天然气扩产计划,信达证券,2024-03-02,电力行业,https://pdf.dfcfw.com/pdf/H3_AP202403021625199881_1.pdf?1709459843000.pdf
新型电力系统月报24M1：多省峰谷价差下降，1月核准煤电装机2.7GW,华福证券,2024-02-27,电力行业,https://pdf.dfcfw.com/pdf/H3_AP202402271623730920_1.pdf?1709048044000.pdf
公用事业行业ESG周报：充分发挥生态环境保护对绿色低碳转型的引领、优化和倒逼作用,德邦证券,2024-02-26,电力行业,https://pdf.dfcfw.com/pdf/H3_AP202402261623574061_1.pdf?1708942699000.pdf
环保与公用事业周报：电力辅助服务市场价格机制出台，火电及灵活性改造有望受益,德邦证券,2024-02-26,电力行业,https://pdf.dfcfw.com/pdf/H3_AP202402261623574049_1.pdf?1708938774000.pdf
公用环保202402第3期：初步建立工业领域碳达峰碳中和标准体系，各省电力市场化交易结果陆续公布,国信证券,2024-02-26,电力行业,https://pdf.dfcfw.com/pdf/H3_AP202402261623576475_1.pdf?1708945725000.pdf
公用事业行业跟踪周报内蒙古绿电交易试点获批，绿电政策频出持续发力,东吴证券,2024-02-26,电力行业,https://pdf.dfcfw.com/pdf/H3_AP202402261623576808_1.pdf?1708948449000.pdf
公用事业与环保行业周报：健全电力辅助服务市场价格机制，促进高效电力市场体系建设,西南证券,2024-02-26,电力行业,https://pdf.dfcfw.com/pdf/H3_AP202402261623578022_1.pdf?1708960745000.pdf
公用事业及环保产业行业研究：用电量增速和GDP增速的关系如何？,国金证券,2024-02-26,电力行业,https://pdf.dfcfw.com/pdf/H3_AP202402261623579507_1.pdf?1708962702000.pdf
公用事业行业周报（2024年第8周）：海风蓄势待发，资源再生利用政策持续加码,民生证券,2024-02-25,电力行业,https://pdf.dfcfw.com/pdf/H3_AP202402251623563782_1.pdf?1708868098000.pdf
公用事业行业周报：国家发改委批复内蒙古自治区电力市场绿色电力交易试点方案,东莞证券,2024-02-25,电力行业,https://pdf.dfcfw.com/pdf/H3_AP202402251623566590_1.pdf?1708881082000.pdf
公用事业—电力天然气周报：陕北-安徽±800千伏特高压直流输电工程获准，美国天然气生产商计划减产,信达证券,2024-02-24,电力行业,https://pdf.dfcfw.com/pdf/H3_AP202402241623552564_1.pdf?1708800438000.pdf
储能月度跟踪：2024年1月国内储能招标2.54GW_5.11GWh，同比高增,国投证券,2024-02-20,电力行业,https://pdf.dfcfw.com/pdf/H3_AP202402201622408529_1.pdf?1708427453000.pdf
公用事业行业研究周报：2024年四川电力年度交易有什么变化和亮点？,天风证券,2024-02-20,电力行业,https://pdf.dfcfw.com/pdf/H3_AP202402201622409783_1.pdf?1708440351000.pdf
公用事业行业跟踪周报：电力辅助服务价格机制出台，经济科学合理促进绿电消纳,东吴证券,2024-02-19,电力行业,https://pdf.dfcfw.com/pdf/H3_AP202402191622382137_1.pdf?1708332297000.pdf
环保与公用事业行业周报：《碳排放权交易管理暂行条例》公布，碳市场建设进一步完善,德邦证券,2024-02-18,电力行业,https://pdf.dfcfw.com/pdf/H3_AP202402181622305391_1.pdf?1708248691000.pdf
公用事业行业报告：火电Q4业绩之忧或已出清，看好24年经营向好,天风证券,2024-02-18,电力行业,https://pdf.dfcfw.com/pdf/H3_AP202402181622305452_1.pdf?1708248691000.pdf
公用事业行业周报（2024年第7周）：发现辅助服务市场价格，碳市场法律制度再进一步,民生证券,2024-02-18,电力行业,https://pdf.dfcfw.com/pdf/H3_AP202402181622322709_1.pdf?1708257391000.pdf
公用事业—电力天然气周报：国家发改委、能源局联合印发《关于建立健全电力辅助服务市场价格机制的通知》,信达证券,2024-02-17,电力行业,https://pdf.dfcfw.com/pdf/H3_AP202402171622213054_1.pdf?1708197993000.pdf
电力：《关于建立健全电力辅助服务市场价格机制的通知》点评-发现辅助服务市场价格，补齐电力商品价格体系,民生证券,2024-02-09,电力行业,https://pdf.dfcfw.com/pdf/H3_AP202402081621145867_1.pdf?1707470704000.pdf
公用事业一月行业动态报告：2023年电力企业业绩整体增长，关注高股息央国企投资机会,中国银河,2024-02-07,电力行业,https://pdf.dfcfw.com/pdf/H3_AP202402071621026599_1.pdf?1707326867000.pdf
环保与公用事业周报：中电联预计24年用电量增长6%，能源局再强调可再生能源消纳,德邦证券,2024-02-06,电力行业,https://pdf.dfcfw.com/pdf/H3_AP202402061620909676_1.pdf?1707208986000.pdf
公用事业行业简评报告：绿证最新政策发布，大力促进非化石能源消费,首创证券,2024-02-06,电力行业,https://pdf.dfcfw.com/pdf/H3_AP202402061620909694_1.pdf?1707209149000.pdf
电力行业12月月报：23年电力消费需求同比实现高增，辅助服务市场基本政策有望落地,信达证券,2024-02-06,电力行业,https://pdf.dfcfw.com/pdf/H3_AP202402061620984684_1.pdf?1707256902000.pdf
公用事业行业周报(2024年第5周)：超7成业绩预告向好，大件垃圾资源化受到重视,民生证券,2024-02-05,电力行业,https://pdf.dfcfw.com/pdf/H3_AP202402051620560070_1.pdf?1707126538000.pdf
行业跟踪：公用事业产业链核心数据跟踪,川财证券,2024-02-05,电力行业,https://pdf.dfcfw.com/pdf/H3_AP202402051620560998_1.pdf?1707130506000.pdf
公用事业及环保产业行业研究周报：12月用电创四季度新高，居民用电需求大幅提升,国金证券,2024-02-05,电力行业,https://pdf.dfcfw.com/pdf/H3_AP202402051620560431_1.pdf?1707127493000.pdf
公用事业行业跟踪周报：加强绿证衔接节能降碳政策激发需求，预计2024年电力供需紧平衡用电量同增6%,东吴证券,2024-02-05,电力行业,https://pdf.dfcfw.com/pdf/H3_AP202402051620561557_1.pdf?1707130713000.pdf
环保及公用事业行业周报：继续推荐“低波红利”及“中股息+确定性成长”环保公用稳健资产,国投证券,2024-02-05,电力行业,https://pdf.dfcfw.com/pdf/H3_AP202402051620557878_1.pdf?1707119390000.pdf
电力月谈2024年2月期,民生证券,2024-02-05,电力行业,https://pdf.dfcfw.com/pdf/H3_AP202402051620568055_1.pdf?1707153554000.pdf
新能源电力行业周报：硅料价格企稳回升，风电装机有望高增,东海证券,2024-02-05,电力行业,https://pdf.dfcfw.com/pdf/H3_AP202402051620563232_1.pdf?1707141783000.pdf
公用事业行业-电力天然气周报：发改委发布加强绿色电力证书与节能降碳政策衔接、大力促进非化石能源消费的通知,信达证券,2024-02-04,电力行业,https://pdf.dfcfw.com/pdf/H3_AP202402041620334766_1.pdf?1707044024000.pdf
公用事业行业研究周报：央企上市公司市值管理考核对公用事业板块影响如何？,天风证券,2024-02-04,电力行业,https://pdf.dfcfw.com/pdf/H3_AP202402041620269303_1.pdf?1707040080000.pdf
公用事业行业周报（2024年第5周）：超7成业绩预告向好，大件垃圾资源化受到重视,民生证券,2024-02-04,电力行业,https://pdf.dfcfw.com/pdf/H3_AP202402041620552727_1.pdf?1707065327000.pdf
电力：丹麦和德国新能源变迁对我国借鉴意义,国联证券,2024-02-04,电力行业,https://pdf.dfcfw.com/pdf/H3_AP202402041620551603_1.pdf?1707059759000.pdf
公用事业—电力天然气周报：发改委发布加强绿色电力证书与节能降碳政策衔接、大力促进非化石能源消费的通知,信达证券,2024-02-03,电力行业,https://pdf.dfcfw.com/pdf/H3_AP202402031620263982_1.pdf?1706984027000.pdf
"公用事业行业周报：ESG周报：CCER市场重启,中海油完成首单交易；联合国秘书长强调逐步淘汰化石燃料",德邦证券,2024-01-31,电力行业,https://pdf.dfcfw.com/pdf/H3_AP202401311619773540_1.pdf?1706696637000.pdf
新型电力系统月报：风光装机全年分别累计新增76、217GW，12月多地执行尖峰电价拉大峰谷价差,华福证券,2024-01-31,电力行业,https://pdf.dfcfw.com/pdf/H3_AP202401311619773633_1.pdf?1706693428000.pdf
电力及公用事业行业月报,中原证券,2024-01-31,电力行业,https://pdf.dfcfw.com/pdf/H3_AP202401311619781524_1.pdf?1706706657000.pdf
中国电力生产行业展望，2024年1月,中诚信国际,2024-01-31,电力行业,https://pdf.dfcfw.com/pdf/H3_AP202401311619795122_1.pdf?1706723881000.pdf
公用事业行业简评报告：国资委推进央企市值管理，利好电力央企估值提升,首创证券,2024-01-30,电力行业,https://pdf.dfcfw.com/pdf/H3_AP202401301619500259_1.pdf?1706606571000.pdf
公用环保202401第4期：全国温室气体自愿减排交易正式启动，2023Q4公用事业板块公募持仓市值增加,国信证券,2024-01-29,电力行业,https://pdf.dfcfw.com/pdf/H3_AP202401291619254436_1.pdf?1706524473000.pdf
环保与公用事业周报：全国温室气体自愿减排交易市场启动，期待CCER新征程,德邦证券,2024-01-29,电力行业,https://pdf.dfcfw.com/pdf/H3_AP202401291619252398_1.pdf?1706613962000.pdf
公用事业及环保产业行业研究：哪些类型的火电资产具备高分红潜力？,国金证券,2024-01-29,电力行业,https://pdf.dfcfw.com/pdf/H3_AP202401291619253453_1.pdf?1706621260000.pdf
储能月度跟踪：2023年全国新增装机规模约22.60GW_48.70GWh,国投证券,2024-01-29,电力行业,https://pdf.dfcfw.com/pdf/H3_AP202401291619248972_1.pdf?1706535958000.pdf
公用事业行业周报（2024年第4周）：央企改革考虑市值管理，PPP新机制加快推进中,民生证券,2024-01-28,电力行业,https://pdf.dfcfw.com/pdf/H3_AP202401281619246827_1.pdf?1706468705000.pdf
环保及公用事业行业周报：重视“中股息+确定性成长”标的投资机遇,国投证券,2024-01-28,电力行业,https://pdf.dfcfw.com/pdf/H3_AP202401281619247836_1.pdf?1706521754000.pdf
公用事业行业跟踪周报：动力煤旺季不旺，预计2024年火电板块盈利继续增长，九丰能源业绩预告能服特气启航,东吴证券,2024-01-28,电力行业,https://pdf.dfcfw.com/pdf/H3_AP202401281619248650_1.pdf?1706519959000.pdf
公用事业—电力天然气周报：2023年我国风电光伏新增装机292.8GW，12月天然气表观消费量同比增长9.5%,信达证券,2024-01-27,电力行业,https://pdf.dfcfw.com/pdf/H3_AP202401271619229995_1.pdf?1706384243000.pdf
电力行业2024年度策略报告：电改引领电源侧价值再升级,国联证券,2024-01-26,电力行业,https://pdf.dfcfw.com/pdf/H3_AP202401251618227452_1.pdf?1706257940000.pdf
中央企业高质量发展新闻发布会点评：央企改革考虑市值管理，公用事业价值重估,民生证券,2024-01-24,电力行业,https://pdf.dfcfw.com/pdf/H3_AP202401241618004455_1.pdf?1706132833000.pdf
核电行业深度：四代核电加速发展，可控核聚变稳步前行,海通国际,2024-01-22,电力行业,https://pdf.dfcfw.com/pdf/H3_AP202401221617892738_1.pdf?1705938486000.pdf
新能源板块行业周报：浙江拟统一大工业和一般工商业电价用户峰谷时段，23年12月储能中标规模维持高位,海通国际,2024-01-19,电力行业,https://pdf.dfcfw.com/pdf/H3_AP202401191617730235_1.pdf?1705675023000.pdf
绿电 头豹词条报告系列,头豹研究院,2024-01-15,电力行业,https://pdf.dfcfw.com/pdf/H3_AP202401151617499321_1.pdf?1706377576000.pdf
电力行业11月月报：23年11月用电量增速创当年新高，煤电容量电价具体分摊情况出炉,信达证券,2024-01-09,电力行业,https://pdf.dfcfw.com/pdf/H3_AP202401091616863787_1.pdf?1704794489000.pdf
公用事业—电力天然气周报：河北省优化调整分时电价政策，2023年美国成为全球最大LNG出口国,信达证券,2024-01-07,电力行业,https://pdf.dfcfw.com/pdf/H3_AP202401061616756724_1.pdf?1706113449000.pdf
电力及公用事业：四部委发布加强新能源汽车与电网融合互动的实施意见，车网互动与虚拟电厂再迎催化,国投证券,2024-01-07,电力行业,https://pdf.dfcfw.com/pdf/H3_AP202401071616756931_1.pdf?1704625487000.pdf
低碳研究行业行业事件点评：输氢管道建设提速，关注配套环节投资机遇,华福证券,2024-01-05,电力行业,https://pdf.dfcfw.com/pdf/H3_AP202401051616652125_1.pdf?1704474530000.pdf
公用事业—电力天然气周报：广东电力现货市场转入正式运行，11月我国天然气表观消费量同比增长9.5%,信达证券,2024-01-01,电力行业,https://pdf.dfcfw.com/pdf/H3_AP202312311615849021_1.pdf?1704100706000.pdf
欧美能源市场跟踪周报：欧洲天然气期货价格回升，美国大储11月装机环比回升,海通国际,2023-12-29,电力行业,https://pdf.dfcfw.com/pdf/H3_AP202312291615469692_1.pdf?1703848039000.pdf
公用事业与环保行业周报：广东24年长协电价下滑，符合市场化交易结果,西南证券,2023-12-25,电力行业,https://pdf.dfcfw.com/pdf/H3_AP202312251614885216_1.pdf?1706284261000.pdf
新型电力系统月报：M11用电量同比增长11.6%，用电需求强劲,华福证券,2023-12-25,电力行业,https://pdf.dfcfw.com/pdf/H3_AP202312251614885258_1.pdf?1703503529000.pdf
电力及公用事业行业月报：11月用电量同比增长11.6%，创2023年单月增速最好水平,中原证券,2023-12-24,电力行业,https://pdf.dfcfw.com/pdf/H3_AP202312241614880457_1.pdf?1703429645000.pdf
电力及公用事业行业周报：山西电力现货市场转入正式运行，电力市场化体制建设更进一步,国投证券,2023-12-24,电力行业,https://pdf.dfcfw.com/pdf/H3_AP202312241614880847_1.pdf?1703440311000.pdf
电力月谈2023年12月期,民生证券,2023-12-24,电力行业,https://pdf.dfcfw.com/pdf/H3_AP202312231614858942_1.pdf?1703415192000.pdf
电力天然气周报：江苏2024年电力交易均价较基准上浮15.8%，11月天然气进口量同比增长6.1%,信达证券,2023-12-23,电力行业,https://pdf.dfcfw.com/pdf/H3_AP202312231614873277_1.pdf?1706286261000.pdf
ESG&电新&公用：欧盟电力市场设计达成协议，应对能源价格波动,海通国际,2023-12-22,电力行业,https://pdf.dfcfw.com/pdf/H3_AP202312221614810199_1.pdf?1703252951000.pdf
2024年新型电力系统年度策略：长期聚焦电力消纳和保供问题,华福证券,2023-12-18,电力行业,https://pdf.dfcfw.com/pdf/H3_AP202312181614436160_1.pdf?1702898382000.pdf
2024年电力行业策略报告：不确定中寻找确定性，聚焦高分红_稳健运营资产,国海证券,2023-12-17,电力行业,https://pdf.dfcfw.com/pdf/H3_AP202312171614434623_1.pdf?1702831556000.pdf
电力及公用事业：宁夏发布虚拟电厂运营管理细则，推动虚拟电厂健康有序发展,国投证券,2023-12-13,电力行业,https://pdf.dfcfw.com/pdf/H3_AP202312121614046913_1.pdf?1702459590000.pdf
能源行业：国务院《空气质量持续改善行动计划》能源相关要点解读,信达证券,2023-12-11,电力行业,https://pdf.dfcfw.com/pdf/H3_AP202312111613696013_1.pdf?1702298312000.pdf
公用事业—电力天然气周报：《空气质量持续改善行动计划》出台，10月天然气表观消费量同比增长4.5%,信达证券,2023-12-09,电力行业,https://pdf.dfcfw.com/pdf/H3_AP202312091613693171_1.pdf?1706194298000.pdf
2024年电力行业投资策略：电改深化，估值重塑与成长交辉,中国银河,2023-12-08,电力行业,https://pdf.dfcfw.com/pdf/H3_AP202312081613631122_1.pdf?1702035282000.pdf
电力行业10月月报：二三产电力消费稳定高增，新能源消纳问题正在逐步显现,信达证券,2023-12-07,电力行业,https://pdf.dfcfw.com/pdf/H3_AP202312071613557794_1.pdf?1701945990000.pdf
新能源电力行业周报：《联合国气候变化框架公约》COP28举行，海风出海再下一城,东海证券,2023-12-04,电力行业,https://pdf.dfcfw.com/pdf/H3_AP202312041613227918_1.pdf?1701706318000.pdf
电力天然气周报：陕皖直流工程将于年内核准开工，国内LNG出厂价周环比涨势显著,信达证券,2023-12-03,电力行业,https://pdf.dfcfw.com/pdf/H3_AP202312021613220113_1.pdf?1706026370000.pdf
电力及公用事业行业2024年度策略：二产用电量逐步回升，看好两大主线,中原证券,2023-11-30,电力行业,https://pdf.dfcfw.com/pdf/H3_AP202311301612972129_1.pdf?1701335610000.pdf
液冷服务器 头豹词条报告系列,头豹研究院,2023-11-30,电力行业,https://pdf.dfcfw.com/pdf/H3_AP202311301613047458_1.pdf?1701373909000.pdf
低碳研究行业：23年累计核准10台机组，核力全开延续高景气,华福证券,2023-11-29,电力行业,https://pdf.dfcfw.com/pdf/H3_AP202401021615911892_1.pdf?1704193556000.pdf
电力及公用事业行业深度分析：新型电力系统建设新阶段，电网各环节作用持续提高,安信证券,2023-11-27,电力行业,https://pdf.dfcfw.com/pdf/H3_AP202311261612383195_1.pdf?1701078464000.pdf
电力月谈2023年11月期,民生证券,2023-11-27,电力行业,https://pdf.dfcfw.com/pdf/H3_AP202311261612383316_1.pdf?1701077837000.pdf
新型电力系统月报：储能项目中标均价1.13元_Wh，步入Q4风核10月单月利用小时数环比提升,华福证券,2023-11-26,电力行业,https://pdf.dfcfw.com/pdf/H3_AP202311261612382293_1.pdf?1701006961000.pdf
电力行业跟踪点评：10月份全社会用电量同比增长8.4%,东莞证券,2023-11-21,电力行业,https://pdf.dfcfw.com/pdf/H3_AP202311211611765722_1.pdf?1700587011000.pdf
电力现货市场投资框架,中邮证券,2023-11-20,电力行业,https://pdf.dfcfw.com/pdf/H3_AP202311191611679406_1.pdf?1700473554000.pdf
公用事业-电力天然气周报：10月全社会用电量同比增长8.4%，欧盟天然气消费量同比上升10%,信达证券,2023-11-19,电力行业,https://pdf.dfcfw.com/pdf/H3_AP202311181611678082_1.pdf?1706026260000.pdf
电力行业9月月报：电力消费需求持续高增，市场化改革政策接连出台,信达证券,2023-11-16,电力行业,https://pdf.dfcfw.com/pdf/H3_AP202311161611028108_1.pdf?1700140640000.pdf
电力行业事项点评：容量电价政策正式落地，煤电压舱石地位明确,信达证券,2023-11-13,电力行业,https://pdf.dfcfw.com/pdf/H3_AP202311131609918328_1.pdf?1699871910000.pdf
智能水表 头豹词条报告系列,头豹研究院,2023-11-13,电力行业,https://pdf.dfcfw.com/pdf/H3_AP202311131609933334_1.pdf?1699904970000.pdf
电力及公用事业：煤电容量电价机制落地，电力市场改革更进一步,安信证券,2023-11-12,电力行业,https://pdf.dfcfw.com/pdf/H3_AP202311121609916860_1.pdf?1699805888000.pdf
《关于建立煤电容量电价机制的通知》点评：千呼万唤始出来,民生证券,2023-11-10,电力行业,https://pdf.dfcfw.com/pdf/H3_AP202311101609907324_1.pdf?1699643374000.pdf
虚拟电厂行业系列报告（2）：海外虚拟电厂接入电力市场，国内电力市场化改革催化商业模式落地,安信证券,2023-11-07,电力行业,https://pdf.dfcfw.com/pdf/H3_AP202311071609248389_1.pdf?1699392398000.pdf
新能源电力行业周报：光伏技术迭代突破不断，海上风电建设持续推进,东海证券,2023-11-06,电力行业,https://pdf.dfcfw.com/pdf/H3_AP202311061609030281_1.pdf?1699290622000.pdf
电力板块2023年三季报业绩总结：火电业绩环比大增，水电业绩同比修复明显,国海证券,2023-11-03,电力行业,https://pdf.dfcfw.com/pdf/H3_AP202311031608329518_1.pdf?1699019943000.pdf
电力行业2023年三季报业绩综述：更上一层楼,民生证券,2023-11-02,电力行业,https://pdf.dfcfw.com/pdf/H3_AP202311021607915691_1.pdf?1698936518000.pdf
电力现货市场系列报告2：价格逐步反应位置信号，“增强版隔墙售电”，虚拟电厂优势逐步体现,中邮证券,2023-10-31,电力行业,https://pdf.dfcfw.com/pdf/H3_AP202310301606049180_1.pdf?1698748996000.pdf
新型电力系统月报：储能项目中标均价1.01元_Wh，水电出力环比持续改善,华福证券,2023-10-30,电力行业,https://pdf.dfcfw.com/pdf/H3_AP202310301605646657_1.pdf?1698683981000.pdf
电力月谈2023年10月期,民生证券,2023-10-30,电力行业,https://pdf.dfcfw.com/pdf/H3_AP202310291605637611_1.pdf?1698660018000.pdf
《关于加强新形势下电力系统稳定工作的指导意见》点评,信达证券,2023-10-27,电力行业,https://pdf.dfcfw.com/pdf/H3_AP202310271604403488_1.pdf?1698395320000.pdf
户用储能 头豹词条报告系列,头豹研究院,2023-10-26,电力行业,https://pdf.dfcfw.com/pdf/H3_AP202310261604026512_1.pdf?1698350105000.pdf
中国新型电力系统行业市场规模测算逻辑模型,头豹研究院,2023-10-25,电力行业,https://pdf.dfcfw.com/pdf/H3_AP202310251603480953_1.pdf?1698266220000.pdf
核电站建设和运营 头豹词条报告系列,头豹研究院,2023-10-23,电力行业,https://pdf.dfcfw.com/pdf/H3_AP202310231602850019_1.pdf?1698090427000.pdf
电力及公用事业行业周报：两部委再发文加快电力现货市场建设工作，绿电有望加快入市,安信证券,2023-10-22,电力行业,https://pdf.dfcfw.com/pdf/H3_AP202310221602714888_1.pdf?1697974426000.pdf
海上风力发电设施建设和运营 头豹词条报告系列,头豹研究院,2023-10-16,电力行业,https://pdf.dfcfw.com/pdf/H3_AP202310161601512167_1.pdf?1697487320000.pdf
新能源电力行业周报：硅料价格继续上升，大宗商品价格走势分化,东海证券,2023-10-10,电力行业,https://pdf.dfcfw.com/pdf/H3_AP202310101601128754_1.pdf?1696963454000.pdf
新型电力系统周报：第二履约期碳价创新高，衔接机制完善绿电收益率有望提升,国海证券,2023-10-09,电力行业,https://pdf.dfcfw.com/pdf/H3_AP202310081601093728_1.pdf?1696843577000.pdf
掘金新型电力系统系列报告二：电改政策驱动下的信息化投资机会,国金证券,2023-10-09,电力行业,https://pdf.dfcfw.com/pdf/H3_AP202310091601094977_1.pdf?1706026467000.pdf
电力行业8月月报：居民电力消费疲软，现货电价持续走低,信达证券,2023-10-09,电力行业,https://pdf.dfcfw.com/pdf/H3_AP202310091601104311_1.pdf?1696870768000.pdf
各省电网代理购电价格月报（2023年10月）：10月代购电价格有所下降，各省峰谷价差有涨有跌,国联证券,2023-10-08,电力行业,https://pdf.dfcfw.com/pdf/H3_AP202310071601017529_1.pdf?1696756378000.pdf
电价行业深度报告：从电力体制改革趋势看产业投资机会,东吴证券,2023-10-08,电力行业,https://pdf.dfcfw.com/pdf/H3_AP202310081601090447_1.pdf?1696782171000.pdf
电力及公用事业：电力现货规则落地，容量电价机制有望推出，彰显灵活性电力资源价值,安信证券,2023-09-26,电力行业,https://pdf.dfcfw.com/pdf/H3_AP202309261599888373_1.pdf?1695744348000.pdf
环保公用行业行业动态报告：电力现货顶层规则出台，电力市场化改革进程加速,中国银河,2023-09-25,电力行业,https://pdf.dfcfw.com/pdf/H3_AP202309241599752742_1.pdf?1695656930000.pdf
新型电力系统月报：储能项目中标均价1.09元_Wh，水电出力同比增加改善明显,华福证券,2023-09-25,电力行业,https://pdf.dfcfw.com/pdf/H3_AP202309251599761626_1.pdf?1695641252000.pdf
电力月谈2023年9月期,民生证券,2023-09-24,电力行业,https://pdf.dfcfw.com/pdf/H3_AP202309231599737370_1.pdf?1695553878000.pdf
电力及公用事业：《电力现货市场基本规则（试行）》发布，电力现货市场建设规范化推进,安信证券,2023-09-20,电力行业,https://pdf.dfcfw.com/pdf/H3_AP202309201599459597_1.pdf?1695235669000.pdf
