研报名称,机构名称,发布时间,行业,研报地址
《电力现货市场基本规则（试行）》点评：千呼万唤始出来，电力现货扬帆启,民生证券,2023-09-19,电力行业,https://pdf.dfcfw.com/pdf/H3_AP202309181599179565_1.pdf?1695114660000.pdf
新型电力系统周报：辅助服务市场有望扩容，现货市场建设有望提速,国海证券,2023-09-18,电力行业,https://pdf.dfcfw.com/pdf/H3_AP202309181599035742_1.pdf?1695036368000.pdf
电力天然气周报：8月全社会用电量同比增长3.9%，天然气产量同比增长6.3%,信达证券,2023-09-17,电力行业,https://pdf.dfcfw.com/pdf/H3_AP202309171599024788_1.pdf?1694947268000.pdf
电力行业7月月报：容量电价重塑火电估值逻辑，来水恢复带动水电出力抬升,信达证券,2023-09-15,电力行业,https://pdf.dfcfw.com/pdf/H3_AP202309151598720329_1.pdf?1694786822000.pdf
新型电力系统专题之美国变压器市场研究：供需矛盾日渐突出，国产变压器海外空间广阔,国信证券,2023-09-13,电力行业,https://pdf.dfcfw.com/pdf/H3_AP202309131598369171_1.pdf?1694605498000.pdf
电力及公用事业：储能月度跟踪：8月国内储能电池报价环比降低,安信证券,2023-09-11,电力行业,https://pdf.dfcfw.com/pdf/H3_AP202309101598194366_1.pdf?1694425812000.pdf
新型电力系统周报：容量电价有望重塑火电估值,国海证券,2023-09-11,电力行业,https://pdf.dfcfw.com/pdf/H3_AP202309101598194473_1.pdf?1694425645000.pdf
新能源消纳系列报告（三）：虚拟电厂：电力交易多样化，促进消纳的新模式,天风证券,2023-09-11,电力行业,https://pdf.dfcfw.com/pdf/H3_AP202309111598195616_1.pdf?1694440935000.pdf
