研报名称,机构名称,发布时间,行业,研报地址
纺织品和服装行业研究：江南布衣业绩超预期，运动服饰新品集中上市,国金证券,2024-03-04,纺织服装,https://pdf.dfcfw.com/pdf/H3_AP202403041625248088_1.pdf?1709546835000.pdf
纺织服饰行业周报：PUMA FY2024营收指引中单增长，需求稳步复苏,开源证券,2024-03-04,纺织服装,https://pdf.dfcfw.com/pdf/H3_AP202403041625214798_1.pdf?1709538128000.pdf
纺织服装品牌力跟踪月报202402期：2月运动品牌虎扑热度提升，识货平台折扣收窄,国信证券,2024-03-04,纺织服装,https://pdf.dfcfw.com/pdf/H3_AP202403041625381073_1.pdf?1709567526000.pdf
纺织服装3月投资策略：1-2月越南纺织出口大幅转正，品牌消费表现稳健,国信证券,2024-03-04,纺织服装,https://pdf.dfcfw.com/pdf/H3_AP202403041625395324_1.pdf?1709581054000.pdf
纺织服装行业周报：PUMA预计2024年汇率中性收入中单增长，本周外棉价格环比上涨,山西证券,2024-03-03,纺织服装,https://pdf.dfcfw.com/pdf/H3_AP202403031625210431_1.pdf?1709538344000.pdf
服饰行业周度市场观察2024年第6周,艾瑞股份,2024-03-03,纺织服装,https://pdf.dfcfw.com/pdf/H3_AP202404101630104812_1.pdf?1712755488000.pdf
纺织与服装海外信息点评：亚马逊促销季创历史新高，提供工具服务中国卖家,海通国际,2024-03-01,纺织服装,https://pdf.dfcfw.com/pdf/H3_AP202403011624830219_1.pdf?1709303042000.pdf
纺织服装行业深度报告：供应链为基，向外生长,东海证券,2024-02-27,纺织服装,https://pdf.dfcfw.com/pdf/H3_AP202402271623747391_1.pdf?1709059885000.pdf
纺织服饰行业周报：1月出口低基数下如期改善，各品类电商表现亮眼,开源证券,2024-02-26,纺织服装,https://pdf.dfcfw.com/pdf/H3_AP202402261623573097_1.pdf?1708943690000.pdf
纺织服饰行业周报：23年我国纱线进口同增13.2%，央行大幅度降息利好家居行业发展,上海证券,2024-02-26,纺织服装,https://pdf.dfcfw.com/pdf/H3_AP202402261623574054_1.pdf?1708938774000.pdf
纺服&零售行业周报：海外运动品牌最新财季梳理，关注38节大促的消费催化,太平洋,2024-02-26,纺织服装,https://pdf.dfcfw.com/pdf/H3_AP202402261623576315_1.pdf?1708945153000.pdf
纺织服装行业周报：安德玛预计FY2024末存货下降约15%，春节黄金珠宝消费表现靓丽,山西证券,2024-02-26,纺织服装,https://pdf.dfcfw.com/pdf/H3_AP202402261623569106_1.pdf?1708937021000.pdf
纺织服饰行业周报：疫后结婚需求陆续释放，龙年迎生育小高峰，或将利好家纺和童装,东海证券,2024-02-26,纺织服装,https://pdf.dfcfw.com/pdf/H3_AP202402261623621074_1.pdf?1709018688000.pdf
服饰行业周度市场观察第5周,艾瑞股份,2024-02-25,纺织服装,https://pdf.dfcfw.com/pdf/H3_AP202404101630105519_1.pdf?1712761417000.pdf
纺织服装双周报（2402期）：国内春节消费较景气，代工台企数据改善,国信证券,2024-02-20,纺织服装,https://pdf.dfcfw.com/pdf/H3_AP202402201622408044_1.pdf?1708425348000.pdf
纺织与服装行业周报：制造台企1月多数环比改善，1月美国TSA出行较23Q4加速,海通国际,2024-02-19,纺织服装,https://pdf.dfcfw.com/pdf/H3_AP202402191622382024_1.pdf?1708341259000.pdf
轻工纺服行业周报：商务部确定24年为“消费促进年”，多家纺服公司业绩预喜,上海证券,2024-02-19,纺织服装,https://pdf.dfcfw.com/pdf/H3_AP202402191622382125_1.pdf?1708332297000.pdf
纺服&零售周报：春节消费活力释放，台企制造商收入增速回暖,太平洋,2024-02-19,纺织服装,https://pdf.dfcfw.com/pdf/H3_AP202402191622402355_1.pdf?1708423260000.pdf
轻工纺服行业周报：23年纺织行业利润总额增长7.2%，亚马逊23Q4业绩优于预期,上海证券,2024-02-08,纺织服装,https://pdf.dfcfw.com/pdf/H3_AP202402081621127878_1.pdf?1707401921000.pdf
纺织服饰专题研究系列一：纺织服饰行业估值处于底部区域，行业利润率稳步提升,源达信息,2024-02-08,纺织服装,https://pdf.dfcfw.com/pdf/H3_AP202402081621129748_1.pdf?1707408404000.pdf
服饰行业周度市场观察2024年第4周,艾瑞股份,2024-02-08,纺织服装,https://pdf.dfcfw.com/pdf/H3_AP202404101630105459_1.pdf?1712761228000.pdf
国际品牌财报总结专题：品牌库存去化进展明显，看好供应商订单恢复确定性,国信证券,2024-02-07,纺织服装,https://pdf.dfcfw.com/pdf/H3_AP202402071621031276_1.pdf?1707334331000.pdf
2023年中国少女发育内衣行业发展白皮书,艾瑞股份,2024-02-06,纺织服装,https://pdf.dfcfw.com/pdf/H3_AP202402061620955992_1.pdf?1707240148000.pdf
纺织服装2月投资策略暨2023年业绩前瞻：优质公司业绩预告亮眼，制造出口延续回暖,国信证券,2024-02-05,纺织服装,https://pdf.dfcfw.com/pdf/H3_AP202402051620560938_1.pdf?1707128504000.pdf
纺织服饰行业周报：2023年业绩预增品牌表现亮眼，Adidas业绩超预期,开源证券,2024-02-05,纺织服装,https://pdf.dfcfw.com/pdf/H3_AP202402051620557301_1.pdf?1707117265000.pdf
纺织服饰行业周报：2023年服装出口受新兴经济体拉动明显，四季度趋势向好,东海证券,2024-02-05,纺织服装,https://pdf.dfcfw.com/pdf/H3_AP202402051620563158_1.pdf?1707142151000.pdf
纺服&零售周报：亚玛芬体育登陆纽交所，Deckers上调业绩指引,太平洋,2024-02-05,纺织服装,https://pdf.dfcfw.com/pdf/H3_AP202402051620563217_1.pdf?1707153554000.pdf
数码印花 头豹词条报告系列,头豹研究院,2024-02-04,纺织服装,https://pdf.dfcfw.com/pdf/H3_AP202402041620554452_1.pdf?1707124669000.pdf
纺织服装行业周报：Deckers再度上调FY2024业绩预期，AMER SPORTS完成上市,山西证券,2024-02-04,纺织服装,https://pdf.dfcfw.com/pdf/H3_AP202402041620553764_1.pdf?1707122445000.pdf
纺织服装行业：业绩预告情况乐观，服装与纺织Q4迎改善,东兴证券,2024-02-01,纺织服装,https://pdf.dfcfw.com/pdf/H3_AP202402011619992022_1.pdf?1706779475000.pdf
纺织服装品牌力跟踪月报202401期：1月品牌发力新春新品，运动品牌折扣收窄,国信证券,2024-01-31,纺织服装,https://pdf.dfcfw.com/pdf/H3_AP202401311619768862_1.pdf?1706692748000.pdf
轻工纺服行业周报：LVMH23年业绩创新高，家居出口企业订单排产向好,上海证券,2024-01-29,纺织服装,https://pdf.dfcfw.com/pdf/H3_AP202401291619271615_1.pdf?1706538012000.pdf
纺织服饰行业月报：行业跟踪：品牌服饰23Q4业绩高弹性兑现，关注24年需求回暖下制造龙头基本面修复机会,东吴证券,2024-01-29,纺织服装,https://pdf.dfcfw.com/pdf/H3_AP202401291619276855_1.pdf?1706549557000.pdf
纺织服饰行业周报：波司登ESG再获A评级，全年业绩有望超预期,东海证券,2024-01-29,纺织服装,https://pdf.dfcfw.com/pdf/H3_AP202401291619280947_1.pdf?1706568707000.pdf
纺织服饰行业周报：2023年业绩预告陆续披露，品牌板块业绩亮眼,开源证券,2024-01-29,纺织服装,https://pdf.dfcfw.com/pdf/H3_AP202401291619251723_1.pdf?1706511737000.pdf
纺织服装行业周报：波司登旺季销售表现靓丽，Lululemon上调FY23Q4业绩预期,山西证券,2024-01-28,纺织服装,https://pdf.dfcfw.com/pdf/H3_AP202401281619248648_1.pdf?1706520165000.pdf
纺服行业23Q4公募重仓数据跟踪：持仓占比略有提升，仍低于历史均值,太平洋,2024-01-26,纺织服装,https://pdf.dfcfw.com/pdf/H3_AP202401261618314679_1.pdf?1706267956000.pdf
纺织制造行业深度报告：一文读懂再生尼龙产业链，强调台华稀缺产能价值,中泰证券,2024-01-25,纺织服装,https://pdf.dfcfw.com/pdf/H3_AP202401251618091194_1.pdf?1706173749000.pdf
迪森特切入儿童运动赛道，始祖鸟母公司或下周登陆纽交所,上海证券,2024-01-25,纺织服装,https://pdf.dfcfw.com/pdf/H3_AP202401251618092169_1.pdf?1706178994000.pdf
轻工纺服行业周报：服装社零加速增长，跨境电商探索第三方平台模式,上海证券,2024-01-22,纺织服装,https://pdf.dfcfw.com/pdf/H3_AP202401221617903354_1.pdf?1705920048000.pdf
纺织品和服装行业研究周报：2023年报业绩前瞻：制造持续修复，品牌弹性可期,国金证券,2024-01-22,纺织服装,https://pdf.dfcfw.com/pdf/H3_AP202401221617903788_1.pdf?1705922629000.pdf
纺织服饰行业周报：太平鸟和锦泓集团业绩预增，关注业绩拐点,东海证券,2024-01-22,纺织服装,https://pdf.dfcfw.com/pdf/H3_AP202401221617905354_1.pdf?1705936351000.pdf
纺织服饰行业周报：12月服装零售数据释放，关注优质服装龙头,中银证券,2024-01-22,纺织服装,https://pdf.dfcfw.com/pdf/H3_AP202401221617907095_1.pdf?1705940959000.pdf
纺织服装行业周报：名创优品发布未来五年战略规划，361度23Q4零售流水延续靓丽增长,山西证券,2024-01-22,纺织服装,https://pdf.dfcfw.com/pdf/H3_AP202401221617889084_1.pdf?1705921635000.pdf
纺织服饰行业周报：12月服装社零增长加速，优选具有α的运动&性价比龙头,开源证券,2024-01-22,纺织服装,https://pdf.dfcfw.com/pdf/H3_AP202401221617890142_1.pdf?1705914005000.pdf
服装行业周度市场观察,艾瑞股份,2024-01-19,纺织服装,https://pdf.dfcfw.com/pdf/H3_AP202401191617730857_1.pdf?1705679407000.pdf
纺织服装双周报（2401期）：十二月服装社零增长加速，出口制造进一步回暖,国信证券,2024-01-18,纺织服装,https://pdf.dfcfw.com/pdf/H3_AP202401181617680182_1.pdf?1705585119000.pdf
纺织服装行业周报：优衣库库存优化，出口延续回暖,中银证券,2024-01-16,纺织服装,https://pdf.dfcfw.com/pdf/H3_AP202401161617533801_1.pdf?1705440503000.pdf
轻工纺服行业周报：纺织出口企稳向好，家居制造产业持续升级,上海证券,2024-01-15,纺织服装,https://pdf.dfcfw.com/pdf/H3_AP202401151617485885_1.pdf?1705313702000.pdf
纺织服饰行业周报：特步国际2023年流水健康，新品牌增长强劲,东海证券,2024-01-15,纺织服装,https://pdf.dfcfw.com/pdf/H3_AP202401151617489384_1.pdf?1705325131000.pdf
服装行业周度市场观察,艾瑞股份,2024-01-15,纺织服装,https://pdf.dfcfw.com/pdf/H3_AP202401151617484850_1.pdf?1705328634000.pdf
纺织服饰行业周报：12月鞋出口量同比转正，优衣库大中华区FY2024Q1亮眼,开源证券,2024-01-15,纺织服装,https://pdf.dfcfw.com/pdf/H3_AP202401151617485865_1.pdf?1705313997000.pdf
纺织服装行业周报：迅销集团FY24Q1收入同增13%，丰泰&裕元公布23年12月营收数据,山西证券,2024-01-15,纺织服装,https://pdf.dfcfw.com/pdf/H3_AP202401141617484445_1.pdf?1705310824000.pdf
纺织与服装行业周报：Amer Sports招股书梳理,海通国际,2024-01-10,纺织服装,https://pdf.dfcfw.com/pdf/H3_AP202401101617014698_1.pdf?1704878703000.pdf
2024年纺服&商贸策略报告——品牌求新求变，制造迎来拐点,太平洋,2024-01-10,纺织服装,https://pdf.dfcfw.com/pdf/H3_AP202401101617055955_1.pdf?1704900637000.pdf
纺织服饰行业2024年度策略：关注精细化运营的优质品牌，出口拐点在即,中银证券,2024-01-10,纺织服装,https://pdf.dfcfw.com/pdf/H3_AP202401101617106319_1.pdf?1704921607000.pdf
纺织服装行业2024年度投资策略报告：困境反转，变中求进,首创证券,2024-01-09,纺织服装,https://pdf.dfcfw.com/pdf/H3_AP202401091616859360_1.pdf?1704791759000.pdf
纺织服饰行业周报：安踏旗下亚玛芬体育冲刺美股IPO，加速全球化布局,东海证券,2024-01-08,纺织服装,https://pdf.dfcfw.com/pdf/H3_AP202401081616764199_1.pdf?1704726241000.pdf
轻工纺服行业周报：户外行业空间大、崛起快，国产扫地机出海正当时,上海证券,2024-01-08,纺织服装,https://pdf.dfcfw.com/pdf/H3_AP202401081616764569_1.pdf?1704727402000.pdf
纺织服装行业周报：越南出口回暖&Q4流水靓丽，优选高股息优质龙头,开源证券,2024-01-08,纺织服装,https://pdf.dfcfw.com/pdf/H3_AP202401081616758873_1.pdf?1704704464000.pdf
纺织服饰行业2024年度策略：高ROE&高股息寻找性价比，关注制造订单拐点与品牌消费机遇,山西证券,2024-01-05,纺织服装,https://pdf.dfcfw.com/pdf/H3_AP202401041616352536_1.pdf?1704439130000.pdf
纺织服装1月投资策略：12月出口制造进一步回暖，元旦消费景气度高,国信证券,2024-01-04,纺织服装,https://pdf.dfcfw.com/pdf/H3_AP202401041616339331_1.pdf?1704381792000.pdf
纺织服装行业快评：2023冬季降温明显，关注品牌景气度向上机遇,国信证券,2024-01-04,纺织服装,https://pdf.dfcfw.com/pdf/H3_AP202401041616347376_1.pdf?1704400096000.pdf
纺织服装品牌力跟踪月报202312期：12月旺季积极营销推新，本土品牌热度同比提升,国信证券,2024-01-03,纺织服装,https://pdf.dfcfw.com/pdf/H3_AP202401031616217178_1.pdf?1704288018000.pdf
革基布（人造革合成革基层材料） 头豹词条报告系列,头豹研究院,2024-01-03,纺织服装,https://pdf.dfcfw.com/pdf/H3_AP202401031616226809_1.pdf?1704309999000.pdf
纺织服装行业2024年度策略：制造订单修复确定性较强，品牌结构性机会持续,东吴证券,2024-01-02,纺织服装,https://pdf.dfcfw.com/pdf/H3_AP202401021615925888_1.pdf?1704236810000.pdf
中国棉纺织行业市场规模测算逻辑模型 头豹词条报告系列,头豹研究院,2024-01-02,纺织服装,https://pdf.dfcfw.com/pdf/H3_AP202401021615929518_1.pdf?1704225084000.pdf
轻工纺服行业周报：我国纺服出口持续回暖，家居企业加大海外供应链布局,上海证券,2024-01-02,纺织服装,https://pdf.dfcfw.com/pdf/H3_AP202401021615917284_1.pdf?1704202077000.pdf
纺织服饰：国际品牌季报总结：品牌库存去化进展明显，看好供应商订单恢复确定性,国信证券,2024-01-02,纺织服装,https://pdf.dfcfw.com/pdf/H3_AP202401021615911861_1.pdf?1704193221000.pdf
纺织服装行业：运动龙头季报解读，展望谨慎但库存健康,东兴证券,2023-12-29,纺织服装,https://pdf.dfcfw.com/pdf/H3_AP202312291615465376_1.pdf?1703840861000.pdf
新消费行业月度观察报告：服装时尚-10月篇,亿欧智库,2023-12-28,纺织服装,https://pdf.dfcfw.com/pdf/H3_AP202312281615149013_1.pdf?1703775764000.pdf
服装行业周度市场观察,艾瑞股份,2023-12-28,纺织服装,https://pdf.dfcfw.com/pdf/H3_AP202312281615149118_1.pdf?1703776936000.pdf
纺织服装行业点评：Nike去库存顺利推进，下调全年收入预期,中银证券,2023-12-26,纺织服装,https://pdf.dfcfw.com/pdf/H3_AP202312261614903350_1.pdf?1703601901000.pdf
轻工纺服行业周报：运动品牌加速国际化布局，亚马逊欧洲站优化佣金物流,上海证券,2023-12-25,纺织服装,https://pdf.dfcfw.com/pdf/H3_AP202312251614886484_1.pdf?1703514263000.pdf
纺织服装海外跟踪系列三十六：耐克二季度库存同比下降14%，下调全年收入指引,国信证券,2023-12-25,纺织服装,https://pdf.dfcfw.com/pdf/H3_AP202312251614886508_1.pdf?1703513231000.pdf
纺织服饰行业周报：Nike下调FY2024全年指引，全国性低温利好板块,开源证券,2023-12-25,纺织服装,https://pdf.dfcfw.com/pdf/H3_AP202312251614882244_1.pdf?1703497972000.pdf
纺织服装行业周报：耐克期末库存同比继续下降，下调FY2024报表收入指引至同比增长1%,山西证券,2023-12-25,纺织服装,https://pdf.dfcfw.com/pdf/H3_AP202312241614881301_1.pdf?1703497215000.pdf
新消费行业月度观察报告：服装时尚-11月篇,亿欧智库,2023-12-21,纺织服装,https://pdf.dfcfw.com/pdf/H3_AP202312211614644814_1.pdf?1703171364000.pdf
纺服行业2024年度策略：把握制造景气拐点，品牌分化遴选龙头,中泰证券,2023-12-21,纺织服装,https://pdf.dfcfw.com/pdf/H3_AP202312211614644949_1.pdf?1703167545000.pdf
纺织与服装行业周报：美国11月零售数据向好，台企鞋类制造环比改善,海通国际,2023-12-21,纺织服装,https://pdf.dfcfw.com/pdf/H3_AP202312211614640219_1.pdf?1703151582000.pdf
东兴轻纺&商社：京沪地产政策放宽，同时关注家居外销改善,东兴证券,2023-12-20,纺织服装,https://pdf.dfcfw.com/pdf/H3_AP202312201614569202_1.pdf?1703064848000.pdf
纺织服饰行业月报：低基数下11月流水弹性如期释放，制造端整体趋势持续向好,东吴证券,2023-12-20,纺织服装,https://pdf.dfcfw.com/pdf/H3_AP202312201614589726_1.pdf?1703077655000.pdf
纺织服饰行业2024年投资策略：制造迎拐点，品牌景气分化,西南证券,2023-12-20,纺织服装,https://pdf.dfcfw.com/pdf/H3_AP202312201614589742_1.pdf?1703078313000.pdf
纺织服饰行业周报：海外品牌假日旺季消费强劲，优选具有α的运动&制造龙头,开源证券,2023-12-18,纺织服装,https://pdf.dfcfw.com/pdf/H3_AP202312181614436182_1.pdf?1702886784000.pdf
纺织服装行业周报：11月社零增速低于市场预期，Lululemon上调全年收入指引,山西证券,2023-12-18,纺织服装,https://pdf.dfcfw.com/pdf/H3_AP202312171614435374_1.pdf?1702892669000.pdf
纺织服饰行业周报：内外需共振，关注头部纺织制造企业,东海证券,2023-12-18,纺织服装,https://pdf.dfcfw.com/pdf/H3_AP202312181614443964_1.pdf?1702918049000.pdf
纺织服装行业周报：11月服装零售数据迎来释放，出口向好趋势不变,中银证券,2023-12-18,纺织服装,https://pdf.dfcfw.com/pdf/H3_AP202312181614456362_1.pdf?1702934380000.pdf
轻工纺服行业周报：京沪优化地产政策，关注家居需求改善,上海证券,2023-12-18,纺织服装,https://pdf.dfcfw.com/pdf/H3_AP202312181614436890_1.pdf?1702898742000.pdf
纺织服装双周报（2316期）：制造订单改善趋势明朗，品牌估值性价比凸显,国信证券,2023-12-18,纺织服装,https://pdf.dfcfw.com/pdf/H3_AP202312181614439527_1.pdf?1702908764000.pdf
纺织服装社零数据点评：11月社零同比增长10.1%，限上体育_娱乐用品消费韧性较强,山西证券,2023-12-15,纺织服装,https://pdf.dfcfw.com/pdf/H3_AP202312151614280407_1.pdf?1702659245000.pdf
纺织服饰行业跟踪报告：Q3需求端恢复偏弱，但盈利水平同比好转,万联证券,2023-12-14,纺织服装,https://pdf.dfcfw.com/pdf/H3_AP202312141614129057_1.pdf?1702549615000.pdf
轻纺&商社周观点：东兴轻纺&商社：整装模式持续拓展，家具出口有望向好,东兴证券,2023-12-14,纺织服装,https://pdf.dfcfw.com/pdf/H3_AP202312141614128156_1.pdf?1702550125000.pdf
纺织服装行业：出口数据呈现改善，关注纺织制造龙头,东兴证券,2023-12-14,纺织服装,https://pdf.dfcfw.com/pdf/H3_AP202312141614137796_1.pdf?1702562879000.pdf
轻纺美妆行业周报：羽绒服市场持续扩张 波司登FY24H1业绩增长,申港证券,2023-12-13,纺织服装,https://pdf.dfcfw.com/pdf/H3_AP202312131614072996_1.pdf?1702479448000.pdf
纺织与服装行业周报：Lululemon Q3财报显假日消费强劲，纺服出口环比改善,海通国际,2023-12-12,纺织服装,https://pdf.dfcfw.com/pdf/H3_AP202312121613881876_1.pdf?1702397381000.pdf
纺织服装海外跟踪系列三十三：露露乐檬第三季度收入增长19%，库存同比下降4%,国信证券,2023-12-11,纺织服装,https://pdf.dfcfw.com/pdf/H3_AP202312111613696740_1.pdf?1702319745000.pdf
纺织服饰行业周报：11月低基数下品牌及出口均改善，优选具有α的龙头标的,开源证券,2023-12-11,纺织服装,https://pdf.dfcfw.com/pdf/H3_AP202312111613696766_1.pdf?1702285522000.pdf
纺织服装行业周报：11月丰泰企业营收增速转正，我国纺织服装出口降幅收窄,山西证券,2023-12-11,纺织服装,https://pdf.dfcfw.com/pdf/H3_AP202312111613698077_1.pdf?1702302190000.pdf
轻工制造及纺织服装行业周报：外发2024轻工年度策略，重视龙头价值重估与细分alpha,中泰证券,2023-12-11,纺织服装,https://pdf.dfcfw.com/pdf/H3_AP202312111613698659_1.pdf?1702303131000.pdf
纺织服饰行业周报：lululemonQ3单季超预期，中国市场增长强劲,东海证券,2023-12-11,纺织服装,https://pdf.dfcfw.com/pdf/H3_AP202312111613700495_1.pdf?1702310393000.pdf
纺织服装行业周报：11月服装出口降幅收窄、纺织龙头企业营收改善,中银证券,2023-12-11,纺织服装,https://pdf.dfcfw.com/pdf/H3_AP202312111613700552_1.pdf?1702308980000.pdf
轻工纺服行业周报：户外&国货羽绒服表现优异，亚马逊降佣跨境供应链受益,上海证券,2023-12-11,纺织服装,https://pdf.dfcfw.com/pdf/H3_AP202312111613695979_1.pdf?1702301485000.pdf
印染 头豹词条报告系列,头豹研究院,2023-12-07,纺织服装,https://pdf.dfcfw.com/pdf/H3_AP202312071613566815_1.pdf?1701980131000.pdf
