研报名称,机构名称,发布时间,行业,研报地址
硅胶隆胸 头豹词条报告系列,头豹研究院,2023-12-05,美容护理,https://pdf.dfcfw.com/pdf/H3_AP202312051613384880_1.pdf?1701807489000.pdf
美容护理行业周报：华东医药自研减肥药获新进展，短剧赋能美妆营销,上海证券,2023-12-04,美容护理,https://pdf.dfcfw.com/pdf/H3_AP202312041613222920_1.pdf?1701684366000.pdf
美护行业专题系列之一：乔雅登直播破价事件的延伸思考,信达证券,2023-11-30,美容护理,https://pdf.dfcfw.com/pdf/H3_AP202311301613037223_1.pdf?1701361483000.pdf
重组胶原蛋白行业深度系列（一）：重组胶原蛋白商业化提速，中国成分踏入“黄金时代”,国金证券,2023-11-28,美容护理,https://pdf.dfcfw.com/pdf/H3_AP202311281612484630_1.pdf?1701167555000.pdf
美妆：锦波生物重组XVII型胶原蛋白具备先发优势，未来可期,首创证券,2023-11-28,美容护理,https://pdf.dfcfw.com/pdf/H3_AP202311281612481623_1.pdf?1701165026000.pdf
美容护理行业周观点：爱美客围绕美后护肤发布三大护肤新品牌,万联证券,2023-11-28,美容护理,https://pdf.dfcfw.com/pdf/H3_AP202311281612484631_1.pdf?1701165730000.pdf
美容护理行业周报：爱美客“医美+护肤”协同发展，引领美护发展新趋势,东海证券,2023-11-27,美容护理,https://pdf.dfcfw.com/pdf/H3_AP202311271612386374_1.pdf?1701081725000.pdf
美容护理行业深度报告：23Q3季报总结：医美化妆品头部企业稳健，盈利能力提升,首创证券,2023-11-27,美容护理,https://pdf.dfcfw.com/pdf/H3_AP202311271612384164_1.pdf?1701084567000.pdf
美容护理行业周报：科思股份开启生产国际化，爱美客关注医美术后需求,上海证券,2023-11-26,美容护理,https://pdf.dfcfw.com/pdf/H3_AP202311261612382337_1.pdf?1701077029000.pdf
脉冲光能量医美 头豹词条报告系列,头豹研究院,2023-11-24,美容护理,https://pdf.dfcfw.com/pdf/H3_AP202311241612232333_1.pdf?1700855358000.pdf
中国牙膏行业市场规模测算逻辑模型 头豹词条报告系列,头豹研究院,2023-11-22,美容护理,https://pdf.dfcfw.com/pdf/H3_AP202311221612027801_1.pdf?1700683342000.pdf
调Q激光医美 头豹词条报告系列,头豹研究院,2023-11-22,美容护理,https://pdf.dfcfw.com/pdf/H3_AP202311221612027804_1.pdf?1700683244000.pdf
美容护理：美妆：医美后市场生机勃发，爱美客医美+护肤品全新联动,首创证券,2023-11-21,美容护理,https://pdf.dfcfw.com/pdf/H3_AP202311211611741714_1.pdf?1700558149000.pdf
美容护理行业周观点：科思股份拟投建防晒项目，贝泰妮法国研究中心成立,万联证券,2023-11-21,美容护理,https://pdf.dfcfw.com/pdf/H3_AP202311211611755491_1.pdf?1700560037000.pdf
美妆行业周度市场观察第43周,艾瑞股份,2023-11-21,美容护理,https://pdf.dfcfw.com/pdf/H3_AP202311211611761684_1.pdf?1700586217000.pdf
彩妆 头豹词条报告系列,头豹研究院,2023-11-21,美容护理,https://pdf.dfcfw.com/pdf/H3_AP202311211611769738_1.pdf?1700595387000.pdf
美容护理行业月度点评：10月化妆品社零增速再度放缓，国产品牌势能持续向上,财信证券,2023-11-20,美容护理,https://pdf.dfcfw.com/pdf/H3_AP202311201611690974_1.pdf?1700498325000.pdf
美护行业：双十一大促表现尚可，部分国货美妆品牌赶超国际大牌,东兴证券,2023-11-20,美容护理,https://pdf.dfcfw.com/pdf/H3_AP202311201611691040_1.pdf?1700498848000.pdf
医美化妆品10月月报：三季报披露完毕，关注双11大促表现亮眼的国货美妆龙头品牌,开源证券,2023-11-20,美容护理,https://pdf.dfcfw.com/pdf/H3_AP202311201611687076_1.pdf?1700495409000.pdf
美容护理：商社周专题：双十一看美妆品牌格局变化,国联证券,2023-11-19,美容护理,https://pdf.dfcfw.com/pdf/H3_AP202311181611678096_1.pdf?1700384197000.pdf
美容护理行业周报：国货品牌大促表现亮眼，医美龙头加速拓宽产品矩阵,上海证券,2023-11-19,美容护理,https://pdf.dfcfw.com/pdf/H3_AP202311191611678638_1.pdf?1700408000000.pdf
美护行业专题：2023“双11”复盘：渠道&品牌表现分化，优质国货龙头加速崛起,民生证券,2023-11-17,美容护理,https://pdf.dfcfw.com/pdf/H3_AP202311161611047615_1.pdf?1700215600000.pdf
专业皮肤护理产品 头豹词条报告系列,头豹研究院,2023-11-17,美容护理,https://pdf.dfcfw.com/pdf/H3_AP202311171611379860_1.pdf?1700252103000.pdf
2023年化妆品双十一点评：双十一表现略显平淡，海外美妆品牌承压、国货龙头逆势突围,德邦证券,2023-11-17,美容护理,https://pdf.dfcfw.com/pdf/H3_AP202311171611399998_1.pdf?1700256033000.pdf
美容护理行业跟踪报告：10月化妆品整体表现平淡，限额以上单位化妆品零售额同比+1.10%,万联证券,2023-11-16,美容护理,https://pdf.dfcfw.com/pdf/H3_AP202311161611041666_1.pdf?1700164899000.pdf
美容护理：双十一大促平稳落幕，国货美妆逆势突围,财信证券,2023-11-15,美容护理,https://pdf.dfcfw.com/pdf/H3_AP202311151610958669_1.pdf?1700061885000.pdf
美妆：双十一国货龙头品牌表现亮眼，爱美客牵手韩国Jeisys进军光电抗衰赛道,首创证券,2023-11-14,美容护理,https://pdf.dfcfw.com/pdf/H3_AP202311141610694877_1.pdf?1699958457000.pdf
美妆行业周度市场观察第45周,艾瑞股份,2023-11-13,美容护理,https://pdf.dfcfw.com/pdf/H3_AP202311131609918245_1.pdf?1699890492000.pdf
美容护理行业周观点：爱美客投资美丽健康产业化创新建设项目,万联证券,2023-11-13,美容护理,https://pdf.dfcfw.com/pdf/H3_AP202311131609933322_1.pdf?1699904053000.pdf
美容护理行业周报：国货美妆双十一表现亮眼，爱美客布局光电医美赛道,上海证券,2023-11-12,美容护理,https://pdf.dfcfw.com/pdf/H3_AP202311121609916471_1.pdf?1699801541000.pdf
新消费周观点：短期关注消费反弹行情，24年优选消费龙头以及低渗透率高端产品赛道,信达证券,2023-11-12,美容护理,https://pdf.dfcfw.com/pdf/H3_AP202311121609917230_1.pdf?1699868838000.pdf
化妆品行业2023年三季报综述：个股业绩表现分化，静候需求端修复,万联证券,2023-11-10,美容护理,https://pdf.dfcfw.com/pdf/H3_AP202311101609901836_1.pdf?1699635256000.pdf
