研报名称,机构名称,发布时间,行业,研报地址
美容护理行业月度点评：政策支持叠加消费预期改善，期待板块持续向好,财信证券,2025-03-14,美容护理,https://pdf.dfcfw.com/pdf/H3_AP202503141644365892_1.pdf?1741962104000.pdf
美妆行业周度市场观察第11周,艾瑞股份,2025-03-13,美容护理,https://pdf.dfcfw.com/pdf/H3_AP202503131644343888_1.pdf?1741899225000.pdf
美容护理行业周报：国货龙头38大促表现亮眼，上美24业绩高增,上海证券,2025-03-11,美容护理,https://pdf.dfcfw.com/pdf/H3_AP202503111644257534_1.pdf?1741687546000.pdf
美容护理行业周报：AI+医美，技术创新与个性化定制引领行业发展,华龙证券,2025-03-11,美容护理,https://pdf.dfcfw.com/pdf/H3_AP202503111644266410_1.pdf?1741713317000.pdf
2025年防晒市场洞察及趋势前瞻,杭州知衣科技,2025-03-10,美容护理,https://pdf.dfcfw.com/pdf/H3_AP202503101644224198_1.pdf?1741616476000.pdf
成人牙膏：口腔的守护神，专业与舒适兼备的日常之选 头豹词条报告系列,头豹研究院,2025-03-05,美容护理,https://pdf.dfcfw.com/pdf/H3_AP202503051644082312_1.pdf?1741203871000.pdf
美妆行业周度市场观察第9周,艾瑞股份,2025-03-04,美容护理,https://pdf.dfcfw.com/pdf/H3_AP202503041644048508_1.pdf?1741126101000.pdf
美容护理行业周报：国内首款CaHA面部填充剂获批，关注美护新品发布情况,上海证券,2025-03-03,美容护理,https://pdf.dfcfw.com/pdf/H3_AP202503031643834690_1.pdf?1740999315000.pdf
2025科学洗护专家共识,青眼网络科技(武汉),2025-03-03,美容护理,https://pdf.dfcfw.com/pdf/H3_AP202503031644010591_1.pdf?1741083527000.pdf
医美化妆品1月月报：高端医美市场再添新活力，个护家清迎来“需求刚性+体验升级”的双轮驱动,开源证券,2025-02-27,美容护理,https://pdf.dfcfw.com/pdf/H3_AP202502271643558418_1.pdf?1740665464000.pdf
彩妆新大陆航海图：妆有引力,北京巨量引擎网络技术,2025-02-26,美容护理,https://pdf.dfcfw.com/pdf/H3_AP202502261643511687_1.pdf?1740564736000.pdf
美白牙膏：笑容的秘密武器，开启闪耀美白新时代 头豹词条报告系列,头豹研究院,2025-02-25,美容护理,https://pdf.dfcfw.com/pdf/H3_AP202502251643488331_1.pdf?1740512340000.pdf
化妆品与日化行业周报：老铺黄金24年业绩预告超预期，周大生转珠阁加速开店,国金证券,2025-02-24,美容护理,https://pdf.dfcfw.com/pdf/H3_AP202502241643426339_1.pdf?1740391248000.pdf
2024年头发养护市场洞察、消费者行为分析及2025年新品趋势预判,海南鲲元生活科技,2025-02-21,美容护理,https://pdf.dfcfw.com/pdf/H3_AP202502211643351374_1.pdf?1740149922000.pdf
2025年头发护理消费者调研报告,上海库润信息技术,2025-02-21,美容护理,https://pdf.dfcfw.com/pdf/H3_AP202502211643361477_1.pdf?1740157921000.pdf
2024抖音护肤行业白皮书,第一财经商业数据中心,2025-02-20,美容护理,https://pdf.dfcfw.com/pdf/H3_AP202502191643278584_1.pdf?1740034983000.pdf
美容护理行业周报：中国医美技术加速创新，关注市场前景,华龙证券,2025-02-18,美容护理,https://pdf.dfcfw.com/pdf/H3_AP202502181643185378_1.pdf?1739869438000.pdf
美妆个护行业：2025中国流行成分和原料消费趋势洞察,厦门蝉羽网络科技,2025-02-18,美容护理,https://pdf.dfcfw.com/pdf/H3_AP202502181643208478_1.pdf?1739906185000.pdf
美容护理行业周报：1月抖音美妆同比+6%，淘天头发清洁等细分品类表现亮眼,上海证券,2025-02-17,美容护理,https://pdf.dfcfw.com/pdf/H3_AP202502171643158532_1.pdf?1739788843000.pdf
美容护理行业月度点评：春节前置叠加季节性因素，1月美妆线上销售相对平淡,财信证券,2025-02-17,美容护理,https://pdf.dfcfw.com/pdf/H3_AP202502171643162110_1.pdf?1739800571000.pdf
美妆行业：抗衰老功效护肤趋势白皮书,杭州猫悦企业管理,2025-02-17,美容护理,https://pdf.dfcfw.com/pdf/H3_AP202502171643162095_1.pdf?1739806350000.pdf
控油洁面产品：深层清洁的革命，开启零油光新时代篇章 头豹词条报告系列,头豹研究院,2025-02-17,美容护理,https://pdf.dfcfw.com/pdf/H3_AP202502171643173155_1.pdf?1739824448000.pdf
美妆行业周度市场观察第7周,艾瑞股份,2025-02-15,美容护理,https://pdf.dfcfw.com/pdf/H3_AP202502151643125788_1.pdf?1739717538000.pdf
美容护理行业2024年业绩预告综述：美护行业预盈率72%，子板块表现较为稳定,万联证券,2025-02-12,美容护理,https://pdf.dfcfw.com/pdf/H3_AP202502121643019003_1.pdf?1739381899000.pdf
化妆品与日化行业研究：国际美妆巨头欧莱雅经营韧性，高端古法黄金春节延续高景气,国金证券,2025-02-10,美容护理,https://pdf.dfcfw.com/pdf/H3_AP202502101642928034_1.pdf?1739181496000.pdf
美容护理行业周报：巨子生物重组人Ⅳ型胶原蛋白专利获批，医美行业迎来新突破,华龙证券,2025-02-10,美容护理,https://pdf.dfcfw.com/pdf/H3_AP202502101642941250_1.pdf?1739209857000.pdf
美容护理行业周报：关注国际美妆集团业绩表现,上海证券,2025-02-10,美容护理,https://pdf.dfcfw.com/pdf/H3_AP202502101642932633_1.pdf?1739194064000.pdf
美容护理行业周报：24年业绩预告陆续披露，关注业绩兑现能力,上海证券,2025-01-27,美容护理,https://pdf.dfcfw.com/pdf/H3_AP202501271642586073_1.pdf?1737970087000.pdf
美容护理行业2025年度策略：稳中求变，守正出奇,财信证券,2025-01-24,美容护理,https://pdf.dfcfw.com/pdf/H3_AP202501241642513186_1.pdf?1737724131000.pdf
2025美妆行业细分市场机会：增长求同存异,任拓数据科技(上海),2025-01-24,美容护理,https://pdf.dfcfw.com/pdf/H3_AP202501241642521989_1.pdf?1737739061000.pdf
新春看消费之美容护理：但闻新人笑，亦闻旧人哭,北京韬联科技,2025-01-24,美容护理,https://pdf.dfcfw.com/pdf/H3_AP202501241642525506_1.pdf?1737743275000.pdf
2024年全球重组人源化胶原蛋白行业产品对比报告,头豹研究院,2025-01-24,美容护理,https://pdf.dfcfw.com/pdf/H3_AP202501241642528484_1.pdf?1737747345000.pdf
化妆品与日化行业研究：化妆品24年平稳收官，黄金珠宝Q4降幅收窄、关注春节催化,国金证券,2025-01-20,美容护理,https://pdf.dfcfw.com/pdf/H3_AP202501201642354120_1.pdf?1737365935000.pdf
美容护理行业周报：2024年社零同比增长3.5%,东海证券,2025-01-20,美容护理,https://pdf.dfcfw.com/pdf/H3_AP202501201642367709_1.pdf?1737394020000.pdf
美容护理行业周报：行业迎创新突破，植发机器人获批与减肥新药进展,华龙证券,2025-01-20,美容护理,https://pdf.dfcfw.com/pdf/H3_AP202501201642374663_1.pdf?1737410080000.pdf
美容护理行业周报：12月社零同比+3.7%,上海证券,2025-01-19,美容护理,https://pdf.dfcfw.com/pdf/H3_AP202501191642340552_1.pdf?1737312142000.pdf
RED CHAMBER——“成为地球上最好的纯净美妆”,杭州灰豚科技,2025-01-17,美容护理,https://pdf.dfcfw.com/pdf/H3_AP202501171641963824_1.pdf?1737112433000.pdf
二叉眉笔：精准描绘，塑造时尚眉形新潮流 头豹词条报告系列,头豹研究院,2025-01-17,美容护理,https://pdf.dfcfw.com/pdf/H3_AP202501171642299861_1.pdf?1737143673000.pdf
美妆行业周度市场观察第3周,艾瑞股份,2025-01-16,美容护理,https://pdf.dfcfw.com/pdf/H3_AP202501161641954770_1.pdf?1737055413000.pdf
化妆品行业深度报告：国风妆容潮流与专业审美双向奔赴，燃起东方美,开源证券,2025-01-13,美容护理,https://pdf.dfcfw.com/pdf/H3_AP202501131641904372_1.pdf?1736788015000.pdf
美容护理行业周报：2024年化妆品品牌榜公布,东海证券,2025-01-13,美容护理,https://pdf.dfcfw.com/pdf/H3_AP202501131641904220_1.pdf?1736787827000.pdf
美容护理行业周报：加码美妆科技领域，建议关注AI美妆,华龙证券,2025-01-13,美容护理,https://pdf.dfcfw.com/pdf/H3_AP202501131641907334_1.pdf?1736796692000.pdf
美容护理行业周报：2024抖音美妆GMV快速增长，关注年货场景营销,上海证券,2025-01-12,美容护理,https://pdf.dfcfw.com/pdf/H3_AP202501121641896541_1.pdf?1736701329000.pdf
美妆大促节奏和价格战全面升级：如何在存量生意中寻求细分市场的突破口,任拓数据科技(上海),2025-01-08,美容护理,https://pdf.dfcfw.com/pdf/H3_AP202501081641849695_1.pdf?1736335489000.pdf
化妆品与日化行业研究：积木人本土龙头布鲁可1.10港股上市，关注黄金珠宝旺季催化,国金证券,2025-01-05,美容护理,https://pdf.dfcfw.com/pdf/H3_AP202501051641812542_1.pdf?1736111670000.pdf
美妆大促节奏和价格战全面升级：如何在存量生意中寻求细分市场的突破口,任拓数据科技(上海),2025-01-03,美容护理,https://pdf.dfcfw.com/pdf/H3_AP202501031641521567_1.pdf?1735900962000.pdf
美妆行业周度市场观察第53周,艾瑞股份,2025-01-03,美容护理,https://pdf.dfcfw.com/pdf/H3_AP202501031641523370_1.pdf?1735900804000.pdf
颜值革命：解锁家用美容仪市场的增长密码,杭州灰豚科技,2025-01-03,美容护理,https://pdf.dfcfw.com/pdf/H3_AP202501031641521515_1.pdf?1735915469000.pdf
化妆品行业2025年度投资策略：国货替代逻辑持续兑现，弱复苏背景下凸显强α,华源证券,2025-01-03,美容护理,https://pdf.dfcfw.com/pdf/H3_AP202501031641799735_1.pdf?1735923090000.pdf
医美专题系列一：重组胶原蛋白赛道高景气延续，先行者前景可期,财信证券,2025-01-02,美容护理,https://pdf.dfcfw.com/pdf/H3_AP202501021641512921_1.pdf?1735840030000.pdf
美容护理行业周报：摩漾生物医美产品墨西哥获批，吴中美学三个产品获批二类械,上海证券,2024-12-29,美容护理,https://pdf.dfcfw.com/pdf/H3_AP202412291641462490_1.pdf?1735487125000.pdf
美国美护行业梳理：零售增速表现较稳定，重点关注大众品牌,西南证券,2024-12-26,美容护理,https://pdf.dfcfw.com/pdf/H3_AP202412261641435315_1.pdf?1735229649000.pdf
美护行业25年年度策略报告：强者恒强，小而美赛道值得期待,中邮证券,2024-12-25,美容护理,https://pdf.dfcfw.com/pdf/H3_AP202412251641423390_1.pdf?1735137923000.pdf
美容护理行业月度点评：美妆大盘回落，重组胶原蛋白市场热度持续攀升,财信证券,2024-12-25,美容护理,https://pdf.dfcfw.com/pdf/H3_AP202412251641423426_1.pdf?1735140025000.pdf
美容护理行业周报：微信小店开启“送礼物”功能灰测，巨子生物骨修复材料III类证获批,上海证券,2024-12-23,美容护理,https://pdf.dfcfw.com/pdf/H3_AP202412231641392433_1.pdf?1734945851000.pdf
美容护理行业周报：微信小店开启“送礼物”功能,东海证券,2024-12-23,美容护理,https://pdf.dfcfw.com/pdf/H3_AP202412231641398354_1.pdf?1734984324000.pdf
美妆行业动态报告：微信小店开启“送礼”灰度测试，关注社交裂变浪潮带来的投资机会,民生证券,2024-12-22,美容护理,https://pdf.dfcfw.com/pdf/H3_AP202412211641388628_1.pdf?1734862607000.pdf
化妆品与日化行业周报：微信小店“送礼物”功能开发新礼赠场景，潮玩_化妆品望优先受益,国金证券,2024-12-22,美容护理,https://pdf.dfcfw.com/pdf/H3_AP202412221641389850_1.pdf?1734888533000.pdf
美妆行业周度市场观察第51周,艾瑞股份,2024-12-20,美容护理,https://pdf.dfcfw.com/pdf/H3_AP202412201641374117_1.pdf?1734703395000.pdf
美容护理行业点评：11月化妆品类社零同比回落，期待政策持续发力,财信证券,2024-12-20,美容护理,https://pdf.dfcfw.com/pdf/H3_AP202412201641384329_1.pdf?1734729030000.pdf
医美化妆品11月月报：巨子生物医美管线获优先审批，高端国货美妆毛戈平熠熠生辉,开源证券,2024-12-18,美容护理,https://pdf.dfcfw.com/pdf/H3_AP202412181641351808_1.pdf?1734557137000.pdf
美容护理行业周报：毛戈平登陆港交所，关注国货高端美妆品牌,上海证券,2024-12-16,美容护理,https://pdf.dfcfw.com/pdf/H3_AP202412161641310097_1.pdf?1734346931000.pdf
防晒护肤品：阳光下的美丽守护者，全方位防护每一寸肌肤 头豹词条报告系列,头豹研究院,2024-12-12,美容护理,https://pdf.dfcfw.com/pdf/H3_AP202412121641281804_1.pdf?1734033760000.pdf
青少年护肤品：纯净成分，专为年轻肌肤打造的呵护方案 头豹词条报告系列,头豹研究院,2024-12-11,美容护理,https://pdf.dfcfw.com/pdf/H3_AP202412111641265750_1.pdf?1733948295000.pdf
美妆行业周度市场观察2024年第49周,艾瑞股份,2024-12-09,美容护理,https://pdf.dfcfw.com/pdf/H3_AP202412091641235013_1.pdf?1733824550000.pdf
化妆品与日化行业研究：大促前置致11月抖音美妆大盘增速放缓，优质国货势能持续释放,国金证券,2024-12-09,美容护理,https://pdf.dfcfw.com/pdf/H3_AP202412091641222458_1.pdf?1733752149000.pdf
美容护理行业2025年投资策略：行业需求稳增，关注高景气赛道,东海证券,2024-12-09,美容护理,https://pdf.dfcfw.com/pdf/H3_AP202412091641223646_1.pdf?1733750928000.pdf
【华福商社】毛戈平招股说明书整理：高成长高端美妆龙头，港股上市开启新纪元,华福证券,2024-12-05,美容护理,https://pdf.dfcfw.com/pdf/H3_AP202412051641186923_1.pdf?1733392741000.pdf
美容护理行业周报：首批射频美容仪获证，新氧布局医美全产业链,上海证券,2024-12-02,美容护理,https://pdf.dfcfw.com/pdf/H3_AP202412021641138598_1.pdf?1733156922000.pdf
美容护理行业周报：优质国货品牌崛起，关注重组III型胶原蛋白赛道,华龙证券,2024-11-27,美容护理,https://pdf.dfcfw.com/pdf/H3_AP202411271641085693_1.pdf?1732707854000.pdf
美妆行业周度市场观察第47周,艾瑞股份,2024-11-25,美容护理,https://pdf.dfcfw.com/pdf/H3_AP202411241641043590_1.pdf?1732526484000.pdf
美容护理行业月度点评：美妆大盘回暖，消费信心或将持续修复,财信证券,2024-11-22,美容护理,https://pdf.dfcfw.com/pdf/H3_AP202411221641022141_1.pdf?1732286866000.pdf
港股医美行业动态点评：双十一落下帷幕，港股美妆名列前茅,国证国际证券,2024-11-22,美容护理,https://pdf.dfcfw.com/pdf/H3_AP202411221641031999_1.pdf?1732305931000.pdf
美护行业专题：2024年“双11”复盘：美妆板块销售表现亮眼，国货品牌分化加剧,民生证券,2024-11-21,美容护理,https://pdf.dfcfw.com/pdf/H3_AP202411211641005500_1.pdf?1732206312000.pdf
美容护理2024年双十一总结：双十一美妆大盘显著回暖，国货美妆龙头成绩亮眼,财信证券,2024-11-21,美容护理,https://pdf.dfcfw.com/pdf/H3_AP202411211641008914_1.pdf?1732211485000.pdf
美容护理行业快评报告：“双11”大盘增长强劲，国货美妆品牌表现持续亮眼,万联证券,2024-11-19,美容护理,https://pdf.dfcfw.com/pdf/H3_AP202411191640955519_1.pdf?1732027554000.pdf
美容护理行业周报：双十一大促收官，美妆表现良好,上海证券,2024-11-18,美容护理,https://pdf.dfcfw.com/pdf/H3_AP202411181640932591_1.pdf?1731929150000.pdf
美容护理行业周报：双十一战报出炉，龙头表现亮眼,东海证券,2024-11-18,美容护理,https://pdf.dfcfw.com/pdf/H3_AP202411181640940133_1.pdf?1731950414000.pdf
美妆双十一总结：平台之争，品牌之争，谁主沉浮,中泰证券,2024-11-17,美容护理,https://pdf.dfcfw.com/pdf/H3_AP202411171640927763_1.pdf?1731863933000.pdf
中国化妆品行业：“双11”销售增长良好，国产品牌高基数下表现稳定？史上最长的“双11”收官，个护美妆销售增长喜人：根据星图,浦银国际证券,2024-11-13,美容护理,https://pdf.dfcfw.com/pdf/H3_AP202411131640852811_1.pdf?1731496679000.pdf
美容护理行业周报：诺和盈亮相进博会，开启国内肥胖症治疗的新格局,华龙证券,2024-11-11,美容护理,https://pdf.dfcfw.com/pdf/H3_AP202411111640821185_1.pdf?1731366857000.pdf
化妆品与日化行业研究周报：大促前置致美妆品牌10月线上增速亮眼，可复美、丸美等领跑,国金证券,2024-11-11,美容护理,https://pdf.dfcfw.com/pdf/H3_AP202411111640809289_1.pdf?1731332626000.pdf
美妆行业周度市场观察第45周,艾瑞股份,2024-11-10,美容护理,https://pdf.dfcfw.com/pdf/H3_AP202411101640804747_1.pdf?1731252569000.pdf
美护行业24年三季报总结：分化加剧，稳健细分龙头值得期待,中邮证券,2024-11-08,美容护理,https://pdf.dfcfw.com/pdf/H3_AP202411081640795703_1.pdf?1731099537000.pdf
美容护理行业周报：肽源生物获全链长胶原蛋白专利授权，创重组胶原新突破,华龙证券,2024-11-05,美容护理,https://pdf.dfcfw.com/pdf/H3_AP202411051640713395_1.pdf?1730794534000.pdf
美容护理行业周报：美妆业绩分化加剧，医美稳健增长,上海证券,2024-11-04,美容护理,https://pdf.dfcfw.com/pdf/H3_AP202411041640695069_1.pdf?1730729732000.pdf
美容护理行业专题研究：增长稀缺，分化加剧，关注业绩确定性,国联证券,2024-11-03,美容护理,https://pdf.dfcfw.com/pdf/H3_AP202411031640689057_1.pdf?1730678266000.pdf
美容护理行业周报：关注业绩表现亮眼标的,上海证券,2024-10-28,美容护理,https://pdf.dfcfw.com/pdf/H3_AP202410281640535040_1.pdf?1730129561000.pdf
化妆品与日化行业周报：天猫双11抢先购珀莱雅蝉联美妆第一，美护三季报延续分化,国金证券,2024-10-28,美容护理,https://pdf.dfcfw.com/pdf/H3_AP202410281640550101_1.pdf?1730147039000.pdf
新消费三季报专场：医美行业迎新品迭代，国产宠物品牌初露锋芒！,北京韬联科技,2024-10-25,美容护理,https://pdf.dfcfw.com/pdf/H3_AP202410251640510155_1.pdf?1729893549000.pdf
美妆行业周度市场观察第43周,艾瑞股份,2024-10-25,美容护理,https://pdf.dfcfw.com/pdf/H3_AP202410251640515727_1.pdf?1729891050000.pdf
医美行业研究框架专题报告：关注上游高景气赛道,东海证券,2024-10-24,美容护理,https://pdf.dfcfw.com/pdf/H3_AP202410241640463599_1.pdf?1729790170000.pdf
化妆品与日化行业研究：“双11”抖音抢先期品牌表现分化，可复美_丸美_润本等增速靓丽,国金证券,2024-10-22,美容护理,https://pdf.dfcfw.com/pdf/H3_AP202410221640406205_1.pdf?1729611176000.pdf
四大化妆品集团财报跟踪：宝洁FY25Q1：大中华区销售额下滑，SK-II持续承压,民生证券,2024-10-22,美容护理,https://pdf.dfcfw.com/pdf/H3_AP202410221640422004_1.pdf?1729634125000.pdf
美容护理行业周报：国货双十一表现亮眼，水羊收购美国高奢品牌RéVive,上海证券,2024-10-21,美容护理,https://pdf.dfcfw.com/pdf/H3_AP202410211640378106_1.pdf?1729507672000.pdf
2023年中国射频类医美行业概览报告,头豹研究院,2024-10-21,美容护理,https://pdf.dfcfw.com/pdf/H3_AP202410211640391571_1.pdf?1729539376000.pdf
化妆品与日化行业研究：润致上新，产品矩阵化，专注“用户价值”,国金证券,2024-10-20,美容护理,https://pdf.dfcfw.com/pdf/H3_AP202410191640373402_1.pdf?1729416421000.pdf
新消费纺服&美护行业梳理：美妆关注双十一催化，纺服品牌端修复持续,华源证券,2024-10-20,美容护理,https://pdf.dfcfw.com/pdf/H3_AP202410201640373990_1.pdf?1729430594000.pdf
美护行业：超长双十一大促开启，龙头美妆品牌开门红,东兴证券,2024-10-18,美容护理,https://pdf.dfcfw.com/pdf/H3_AP202410181640353930_1.pdf?1729245103000.pdf
美容护理行业月度点评：大促提前开启，期待国货龙头“双十一”表现,财信证券,2024-10-18,美容护理,https://pdf.dfcfw.com/pdf/H3_AP202410181640357281_1.pdf?1729260972000.pdf
美容护理行业周报：司美格鲁肽注射液临床试验批准，助力体重管理市场发展,华龙证券,2024-10-15,美容护理,https://pdf.dfcfw.com/pdf/H3_AP202410151640306717_1.pdf?1729015326000.pdf
美容护理行业周报：“双11”大促来临，关注美妆品牌表现,上海证券,2024-10-14,美容护理,https://pdf.dfcfw.com/pdf/H3_AP202410141640281749_1.pdf?1728904022000.pdf
美容护理行业周报：爱美客新产品获批，觅光射频美容仪取得三类证,东海证券,2024-10-14,美容护理,https://pdf.dfcfw.com/pdf/H3_AP202410141640285612_1.pdf?1728919194000.pdf
抖音电商“肤感”护肤趋势洞察：即时满足 肤感当道,厦门蝉羽网络科技,2024-10-10,美容护理,https://pdf.dfcfw.com/pdf/H3_AP202410101640253086_1.pdf?1728642663000.pdf
东风聚势：中国美妆双11营销解码全指南,行吟信息科技,2024-10-09,美容护理,https://pdf.dfcfw.com/pdf/H3_AP202410091640224936_1.pdf?1728491399000.pdf
中国医疗美容健康行业深度研究报告,北京和君咨询,2024-10-09,美容护理,https://pdf.dfcfw.com/pdf/H3_AP202410091640236151_1.pdf?1728555764000.pdf
皮肤光损伤研究白皮书,金华丽声网信网络科技,2024-10-08,美容护理,https://pdf.dfcfw.com/pdf/H3_AP202410051640176391_1.pdf?1728394920000.pdf
2024小红书全球美护行业趋势报告,行吟信息科技,2024-10-07,美容护理,https://pdf.dfcfw.com/pdf/H3_AP202410071640183888_1.pdf?1728385807000.pdf
2024全球美护行业趋势报告,行吟信息科技,2024-10-07,美容护理,https://pdf.dfcfw.com/pdf/H3_AP202410051640176390_1.pdf?1728313661000.pdf
美容护理行业周报：华东医药V20获批，润本股份投资打造未来工厂,东海证券,2024-09-30,美容护理,https://pdf.dfcfw.com/pdf/H3_AP202409301640099360_1.pdf?1727700472000.pdf
美容护理行业周报：消费悲观情绪改善，建议关注美护板块估值修复,上海证券,2024-09-29,美容护理,https://pdf.dfcfw.com/pdf/H3_AP202409291640094672_1.pdf?1727634761000.pdf
美妆行业周度市场观察第37周,艾瑞股份,2024-09-26,美容护理,https://pdf.dfcfw.com/pdf/H3_AP202409261640050679_1.pdf?1727348075000.pdf
美容护理行业周报：华熙生物携手蒙牛推出“玻尿酸多维牛奶”,华龙证券,2024-09-25,美容护理,https://pdf.dfcfw.com/pdf/H3_AP202409251640031805_1.pdf?1727284567000.pdf
美容护理行业周报：美妆品牌积极推新，持续丰富品类、功效,上海证券,2024-09-23,美容护理,https://pdf.dfcfw.com/pdf/H3_AP202409231639977682_1.pdf?1727092136000.pdf
美容护理行业月度点评：需求环比改善，但板块整体持续性承压,财信证券,2024-09-23,美容护理,https://pdf.dfcfw.com/pdf/H3_AP202409231639977737_1.pdf?1727092951000.pdf
美容护理行业周报：国内首个“丝素蛋白复合凝胶”正式获批，产品端不断创新,华龙证券,2024-09-19,美容护理,https://pdf.dfcfw.com/pdf/H3_AP202409191639942322_1.pdf?1726769898000.pdf
美容护理行业周报：珀莱雅管理层换届落地，复锐肉毒素产品中国获批,上海证券,2024-09-18,美容护理,https://pdf.dfcfw.com/pdf/H3_AP202409181639914906_1.pdf?1726669741000.pdf
化妆品行业专题：国内外美妆品牌中报梳理，探析国货崛起之势,国信证券,2024-09-18,美容护理,https://pdf.dfcfw.com/pdf/H3_AP202409181639921613_1.pdf?1726684988000.pdf
