研报名称,机构名称,发布时间,行业,研报地址
美护行业23年&24Q1财报总结：格局优化，盈利改善，龙头更具增长韧性,中邮证券,2024-05-07,美容护理,https://pdf.dfcfw.com/pdf/H3_AP202405071632563468_1.pdf?1715100730000.pdf
美妆行业点评：24Q1美护板块业绩双位数增长，“618”大促临近，重点关注美护板块配置机会,民生证券,2024-05-06,美容护理,https://pdf.dfcfw.com/pdf/H3_AP202405061632497905_1.pdf?1715031846000.pdf
美容护理行业2023年与2024Q1财报总结：关注重组胶原蛋白赛道与美妆618大促催化,国联证券,2024-05-05,美容护理,https://pdf.dfcfw.com/pdf/H3_AP202405051632436699_1.pdf?1714908969000.pdf
美容护理&纺织服饰周报：多家公司24Q1业绩靓丽，全球奢侈品巨头24Q1亚太市场表现分化,中邮证券,2024-04-29,美容护理,https://pdf.dfcfw.com/pdf/H3_AP202404291631574262_1.pdf?1714408004000.pdf
美容护理行业周报：关注业绩兑现能力强的美护标的,上海证券,2024-04-28,美容护理,https://pdf.dfcfw.com/pdf/H3_AP202404281631519241_1.pdf?1714310378000.pdf
美妆行业周度市场观察2024年第17周,艾瑞股份,2024-04-24,美容护理,https://pdf.dfcfw.com/pdf/H3_AP202404241631109645_1.pdf?1713950678000.pdf
美容护理行业周报：多家公司披露业绩，珀莱雅表现亮眼,东海证券,2024-04-22,美容护理,https://pdf.dfcfw.com/pdf/H3_AP202404221630957710_1.pdf?1713787574000.pdf
美容护理行业周观点：消费呈现缓复苏态势，3月化妆品零售额同比+2.2%,万联证券,2024-04-22,美容护理,https://pdf.dfcfw.com/pdf/H3_AP202404221630972627_1.pdf?1713806909000.pdf
美容护理&纺织服饰周报：化妆品服装24Q1社零弱增长，欧莱雅中国24Q1同增6%,中邮证券,2024-04-22,美容护理,https://pdf.dfcfw.com/pdf/H3_AP202404221630996086_1.pdf?1713819687000.pdf
美容护理行业周报：锦波24Q1延续高增，珀莱雅业绩超预期,上海证券,2024-04-21,美容护理,https://pdf.dfcfw.com/pdf/H3_AP202404211630920424_1.pdf?1713708388000.pdf
新消费周观点：全球回调或是美联储降息前必要之举，光明来临前价值洼地的A股将是避险资金的选择之一,信达证券,2024-04-21,美容护理,https://pdf.dfcfw.com/pdf/H3_AP202404211630930764_1.pdf?1713715715000.pdf
美容护理行业月度点评：业绩催化市场情绪升温，关注超预期表现,财信证券,2024-04-19,美容护理,https://pdf.dfcfw.com/pdf/H3_AP202404191630645408_1.pdf?1713523426000.pdf
美妆行业周度市场观察第16周,艾瑞股份,2024-04-19,美容护理,https://pdf.dfcfw.com/pdf/H3_AP202404191630648343_1.pdf?1713536118000.pdf
美容护理：如何看待儿童防晒市场？,国联证券,2024-04-17,美容护理,https://pdf.dfcfw.com/pdf/H3_AP202404171630433856_1.pdf?1713387640000.pdf
美容护理行业周观点：金价创历史新高，爱美客发布业绩预告,万联证券,2024-04-16,美容护理,https://pdf.dfcfw.com/pdf/H3_AP202404161630270356_1.pdf?1713260377000.pdf
美容护理行业周报：爱美客Q1业绩符合预期，毛戈平递交港股招股书,上海证券,2024-04-15,美容护理,https://pdf.dfcfw.com/pdf/H3_AP202404151630211028_1.pdf?1713170426000.pdf
美容护理行业周报：毛戈平转战港股上市,东海证券,2024-04-15,美容护理,https://pdf.dfcfw.com/pdf/H3_AP202404151630215381_1.pdf?1713182251000.pdf
美容护理&纺织服饰周报：毛戈平提交港股IPO，丰泰24Q1收入高单增长,中邮证券,2024-04-15,美容护理,https://pdf.dfcfw.com/pdf/H3_AP202404141630209776_1.pdf?1713168800000.pdf
新消费周观点：持续关注输入型通膨预期叠加股市财富效应对消费的影响,信达证券,2024-04-14,美容护理,https://pdf.dfcfw.com/pdf/H3_AP202404141630209042_1.pdf?1713111809000.pdf
美妆行业周度市场观察2024年第8周,艾瑞股份,2024-04-10,美容护理,https://pdf.dfcfw.com/pdf/H3_AP202404101630104783_1.pdf?1712756471000.pdf
美妆行业周度市场观察第14周,艾瑞股份,2024-04-10,美容护理,https://pdf.dfcfw.com/pdf/H3_AP202404101630104897_1.pdf?1712761326000.pdf
美护行业专题系列之六：合规监管趋势下关注射频增长机会商业贸易,信达证券,2024-04-10,美容护理,https://pdf.dfcfw.com/pdf/H3_AP202404101630108943_1.pdf?1712764261000.pdf
美容护理行业周观点：黄金价格持续上涨，关注黄金珠宝产业链投资机会,万联证券,2024-04-08,美容护理,https://pdf.dfcfw.com/pdf/H3_AP202404081630052334_1.pdf?1712598670000.pdf
美容护理&纺织服饰周报：3月天猫美妆恢复双位数增长，3月越南鞋类出口增长10%,中邮证券,2024-04-07,美容护理,https://pdf.dfcfw.com/pdf/H3_AP202404071630039355_1.pdf?1712573501000.pdf
美容护理行业周报：3月天猫美妆同比+13%，芭薇股份正式登陆北交所,上海证券,2024-04-07,美容护理,https://pdf.dfcfw.com/pdf/H3_AP202404071630034534_1.pdf?1712498274000.pdf
新消费周观点：清明出游数据体现居民消费力持续恢复，黄金石油大涨或推动我国CPI温和复苏,信达证券,2024-04-07,美容护理,https://pdf.dfcfw.com/pdf/H3_AP202404071630036205_1.pdf?1712507307000.pdf
美护行业专题系列之五：如何看待未来防晒剂的发展趋势？,信达证券,2024-04-03,美容护理,https://pdf.dfcfw.com/pdf/H3_AP202404031629739958_1.pdf?1712180056000.pdf
美容护理行业周观点：芭薇股份在北交所上市，美丽田园战投奈瑞儿,万联证券,2024-04-02,美容护理,https://pdf.dfcfw.com/pdf/H3_AP202404021629412328_1.pdf?1712052897000.pdf
美容护理行业周报：巨子、美丽田园业绩亮眼，江苏吴中艾塑菲蓄势启航,上海证券,2024-04-01,美容护理,https://pdf.dfcfw.com/pdf/H3_AP202404011629195440_1.pdf?1711970445000.pdf
美容护理行业周报：AestheFill中文名官宣，巨子生物业绩表现亮眼,东海证券,2024-04-01,美容护理,https://pdf.dfcfw.com/pdf/H3_AP202404011629196252_1.pdf?1711979345000.pdf
中国脱毛医美服务行业市场规模测算逻辑模型 头豹词条报告系列,头豹研究院,2024-03-28,美容护理,https://pdf.dfcfw.com/pdf/H3_AP202403281628474260_1.pdf?1711657132000.pdf
美容护理&纺织服饰周报：24M1-2化妆品服装社零弱增长，NIKEFY24Q3收入微增库存改善，爱美客福瑞达等披露年报,中邮证券,2024-03-25,美容护理,https://pdf.dfcfw.com/pdf/H3_AP202403251628067156_1.pdf?1711356786000.pdf
美容护理行业周报：业绩披露期来临，关注超预期表现企业,东海证券,2024-03-25,美容护理,https://pdf.dfcfw.com/pdf/H3_AP202403251628071145_1.pdf?1711378766000.pdf
美容护理行业周观点：多家美护公司利润高增，关注业绩超预期个股,万联证券,2024-03-25,美容护理,https://pdf.dfcfw.com/pdf/H3_AP202403251628072519_1.pdf?1711382522000.pdf
美容护理行业周报：23年报密集披露，美护龙头业绩兑现能力强,上海证券,2024-03-24,美容护理,https://pdf.dfcfw.com/pdf/H3_AP202403241628064291_1.pdf?1711291985000.pdf
美容护理行业月度点评：品牌推陈出新加速，叠加春季出游场景催化，市场回暖可期,财信证券,2024-03-22,美容护理,https://pdf.dfcfw.com/pdf/H3_AP202403221627620808_1.pdf?1711128455000.pdf
美容护理行业周观点：天猫38焕新周美妆GMV达70亿元，珀莱雅位列天猫美容护肤类目第1,万联证券,2024-03-19,美容护理,https://pdf.dfcfw.com/pdf/H3_AP202403191627112098_1.pdf?1710840406000.pdf
美容护理&纺织服饰周报：美妆三八靓丽表现带动板块反弹，华利23Q4收入业绩双位数增长超预期,中邮证券,2024-03-18,美容护理,https://pdf.dfcfw.com/pdf/H3_AP202403181626961162_1.pdf?1710755221000.pdf
2023年中国吸脂行业概览,头豹研究院,2024-03-18,美容护理,https://pdf.dfcfw.com/pdf/H3_AP202403181626981301_1.pdf?1710790961000.pdf
美容护理行业周报：关注重组胶原蛋白赛道,东海证券,2024-03-18,美容护理,https://pdf.dfcfw.com/pdf/H3_AP202403181626996550_1.pdf?1710800612000.pdf
美容护理行业周报：步入业绩披露期，关注超预期及边际改善标的,上海证券,2024-03-17,美容护理,https://pdf.dfcfw.com/pdf/H3_AP202403171626954023_1.pdf?1710691293000.pdf
化妆品与日化行业前沿：巨子生物在全球先后持续率先突破3类具三螺旋的重组胶原蛋白,国金证券,2024-03-14,美容护理,https://pdf.dfcfw.com/pdf/H3_AP202403141626727739_1.pdf?1710434870000.pdf
美护行业专题系列之四：防晒趋于“必选”，国货份额有望继续增长,信达证券,2024-03-13,美容护理,https://pdf.dfcfw.com/pdf/H3_AP202403131626657980_1.pdf?1710362078000.pdf
美容护理行业周观点：金价进一步上涨创下新高，多家公司公告回购进展,万联证券,2024-03-12,美容护理,https://pdf.dfcfw.com/pdf/H3_AP202403121626361762_1.pdf?1710228155000.pdf
中国毛发健康管理行业研究报告：从“头”开始，“发”现健康,艾瑞股份,2024-03-12,美容护理,https://pdf.dfcfw.com/pdf/H3_AP202403121626361753_1.pdf?1710238754000.pdf
38大促国货表现优，贝泰妮开启薇诺娜2.0时代,东海证券,2024-03-11,美容护理,https://pdf.dfcfw.com/pdf/H3_AP202403111626213741_1.pdf?1710157172000.pdf
美容护理行业周报：38大促收官，关注优质国货品牌,上海证券,2024-03-10,美容护理,https://pdf.dfcfw.com/pdf/H3_AP202403101626199111_1.pdf?1710070222000.pdf
美妆行业周度市场观察2024年第7周,艾瑞股份,2024-03-10,美容护理,https://pdf.dfcfw.com/pdf/H3_AP202404101630104799_1.pdf?1712756249000.pdf
美容护理行业2023Q4基金持仓分析：个护重仓保持稳定，化妆品、医美重仓比例持续下滑,万联证券,2024-03-08,美容护理,https://pdf.dfcfw.com/pdf/H3_AP202403081626034263_1.pdf?1709916491000.pdf
美护行业专题系列之三：从e.l.f. Beauty海外成功经验看国货化妆品品牌的发展机遇,信达证券,2024-03-07,美容护理,https://pdf.dfcfw.com/pdf/H3_AP202403061625778611_1.pdf?1709802970000.pdf
美容护理行业专题研究：如何看待重组胶原蛋白在美容护理领域的应用？,国联证券,2024-03-05,美容护理,https://pdf.dfcfw.com/pdf/H3_AP202403051625509823_1.pdf?1709650242000.pdf
美容护理行业周观点：上美股份发布业绩预告，38节日大促来临,万联证券,2024-03-05,美容护理,https://pdf.dfcfw.com/pdf/H3_AP202403051625505255_1.pdf?1709644839000.pdf
化妆品与日化行业研究：3.8大促前瞻：美妆品牌商备战情况如何？,国金证券,2024-03-04,美容护理,https://pdf.dfcfw.com/pdf/H3_AP202403041625215400_1.pdf?1709548334000.pdf
美容护理行业周报：锦波生物业绩亮眼，关注38大促表现,东海证券,2024-03-04,美容护理,https://pdf.dfcfw.com/pdf/H3_AP202403041625319147_1.pdf?1709551359000.pdf
美容护理&纺织服饰周报：上美股份23年业绩高增，三八大促在即关注头部品牌动销,中邮证券,2024-03-03,美容护理,https://pdf.dfcfw.com/pdf/H3_AP202403031625210971_1.pdf?1709544335000.pdf
美容护理行业周报：锦波重组胶原蛋白持续放量，关注医美新品上市进展,上海证券,2024-03-03,美容护理,https://pdf.dfcfw.com/pdf/H3_AP202403031625209432_1.pdf?1709479051000.pdf
美妆行业周度市场观察2024年第6周,艾瑞股份,2024-03-03,美容护理,https://pdf.dfcfw.com/pdf/H3_AP202404101630104813_1.pdf?1712755406000.pdf
医美系列之：从米诺地尔看防脱发药物市场,西南证券,2024-03-01,美容护理,https://pdf.dfcfw.com/pdf/H3_AP202403011624859919_1.pdf?1709322206000.pdf
美容护理行业周报：创健医疗发布重磅重组胶原蛋白，医美合规化趋严,东海证券,2024-02-27,美容护理,https://pdf.dfcfw.com/pdf/H3_AP202402271623722924_1.pdf?1709024229000.pdf
2023年中国重医美行业概览报告,头豹研究院,2024-02-27,美容护理,https://pdf.dfcfw.com/pdf/H3_AP202402271623749928_1.pdf?1709063954000.pdf
美容护理&纺织服饰周报：多美妆品牌加快推新，美护监管加严,中邮证券,2024-02-26,美容护理,https://pdf.dfcfw.com/pdf/H3_AP202402251623568176_1.pdf?1708939403000.pdf
美容护理行业周观点：创健医疗成功研发III型重组人胶原蛋白,万联证券,2024-02-26,美容护理,https://pdf.dfcfw.com/pdf/H3_AP202402261623584674_1.pdf?1709022783000.pdf
美容护理行业周报：创健医疗发布重组人胶原蛋白，关注38大促催化,上海证券,2024-02-25,美容护理,https://pdf.dfcfw.com/pdf/H3_AP202402251623566597_1.pdf?1708880768000.pdf
美妆行业周度市场观察2024年第5周,艾瑞股份,2024-02-25,美容护理,https://pdf.dfcfw.com/pdf/H3_AP202404101630105520_1.pdf?1712760740000.pdf
美容护理行业周观点：多家美护上市公司提议回购股份,万联证券,2024-02-21,美容护理,https://pdf.dfcfw.com/pdf/H3_AP202402211622474470_1.pdf?1708504919000.pdf
重组胶原蛋白行业研究：创健医疗首破Ⅲ型重组人胶原蛋白量产技术、加快拓宽商用领域,国金证券,2024-02-21,美容护理,https://pdf.dfcfw.com/pdf/H3_AP202402211622475649_1.pdf?1708506032000.pdf
消费出海系列研究（一）：国货美妆扬帆起航,东海证券,2024-02-21,美容护理,https://pdf.dfcfw.com/pdf/H3_AP202402211622503245_1.pdf?1708530645000.pdf
美容护理行业周报：国际美妆品牌业绩发布，关注国货龙头推新进展,上海证券,2024-02-19,美容护理,https://pdf.dfcfw.com/pdf/H3_AP202402191622382126_1.pdf?1708332297000.pdf
非手术类减脂 头豹词条报告系列,头豹研究院,2024-02-19,美容护理,https://pdf.dfcfw.com/pdf/H3_AP202402191622400903_1.pdf?1708372032000.pdf
美容护理&纺织服饰周报：鞋履制造龙头1月订单双位数增长，外资美妆巨头23Q4增长乏力,中邮证券,2024-02-18,美容护理,https://pdf.dfcfw.com/pdf/H3_AP202402181622378493_1.pdf?1708333857000.pdf
美容护理行业深度：国内美妆如何乘风而行,平安证券,2024-02-08,美容护理,https://pdf.dfcfw.com/pdf/H3_AP202402081621124904_1.pdf?1707386821000.pdf
美妆行业周度市场观察2024年第4周,艾瑞股份,2024-02-08,美容护理,https://pdf.dfcfw.com/pdf/H3_AP202404101630105461_1.pdf?1712761127000.pdf
美容护理行业周报：医美增长韧性持续验证，美妆1月销售同比高增,上海证券,2024-02-05,美容护理,https://pdf.dfcfw.com/pdf/H3_AP202402051620557449_1.pdf?1707119306000.pdf
美容护理行业周报：珀莱雅源力面霜2.0上线,东海证券,2024-02-05,美容护理,https://pdf.dfcfw.com/pdf/H3_AP202402051620563717_1.pdf?1707145067000.pdf
美容护理&纺织服饰周报：1月美护抖音高增长，超跌行情龙头具备性价比,中邮证券,2024-02-04,美容护理,https://pdf.dfcfw.com/pdf/H3_AP202402041620551193_1.pdf?1707058964000.pdf
美护行业报告：业绩预告陆续披露，重点把握兑现性和强边际改善,东兴证券,2024-02-02,美容护理,https://pdf.dfcfw.com/pdf/H3_AP202402021620058096_1.pdf?1706857870000.pdf
热玛吉医美服务 头豹词条报告系列,头豹研究院,2024-02-01,美容护理,https://pdf.dfcfw.com/pdf/H3_AP202402011620018510_1.pdf?1706817175000.pdf
胶原蛋白行业专题报告：以研发为基石，多向发展共迎蓝海,东莞证券,2024-01-30,美容护理,https://pdf.dfcfw.com/pdf/H3_AP202401301619518316_1.pdf?1706635666000.pdf
美容护理行业周观点：多家公司发布业绩预告，关注业绩超预期个股,万联证券,2024-01-30,美容护理,https://pdf.dfcfw.com/pdf/H3_AP202401301619499038_1.pdf?1706626289000.pdf
美容护理行业周报：关注新品上市催化及业绩超预期标的,上海证券,2024-01-29,美容护理,https://pdf.dfcfw.com/pdf/H3_AP202401291619271612_1.pdf?1706538012000.pdf
美容护理行业周报：江苏吴中再生类医美产品AsetheFill获批,东海证券,2024-01-29,美容护理,https://pdf.dfcfw.com/pdf/H3_AP202401291619273217_1.pdf?1706625512000.pdf
轻纺美妆行业周报：轻纺美妆多家企业发布23年度业绩预告,申港证券,2024-01-25,美容护理,https://pdf.dfcfw.com/pdf/H3_AP202401251618073190_1.pdf?1706175668000.pdf
美容护理行业跟踪报告：12月化妆品零售额同比由负转正，但需求端恢复仍需时间,万联证券,2024-01-23,美容护理,https://pdf.dfcfw.com/pdf/H3_AP202401231617941555_1.pdf?1705994862000.pdf
美容护理行业周观点：限额以上单位金银珠宝零售额同比涨幅持续扩大,万联证券,2024-01-23,美容护理,https://pdf.dfcfw.com/pdf/H3_AP202401231617941569_1.pdf?1705997413000.pdf
美容护理行业周报：2023年化妆品社零同比增长5.1%,东海证券,2024-01-22,美容护理,https://pdf.dfcfw.com/pdf/H3_AP202401221617904157_1.pdf?1705924827000.pdf
美容护理：国货美妆品牌2023年实现“量”到“质”的突破,国联证券,2024-01-22,美容护理,https://pdf.dfcfw.com/pdf/H3_AP202401221617905564_1.pdf?1705936523000.pdf
美容护理行业周报：23年报预告陆续发布，美护板块业绩兑现能力强,上海证券,2024-01-22,美容护理,https://pdf.dfcfw.com/pdf/H3_AP202401221617890159_1.pdf?1705914579000.pdf
美容护理行业月度点评：12月化妆品社零同比+9.7%，持续关注板块结构性机会,财信证券,2024-01-21,美容护理,https://pdf.dfcfw.com/pdf/H3_AP202401211617886746_1.pdf?1705840044000.pdf
美妆行业周度市场观察2023年第52周,艾瑞股份,2024-01-19,美容护理,https://pdf.dfcfw.com/pdf/H3_AP202401191617730864_1.pdf?1705679185000.pdf
2023年中国医美再生注射剂行业概览,头豹研究院,2024-01-18,美容护理,https://pdf.dfcfw.com/pdf/H3_AP202401181617676185_1.pdf?1705577080000.pdf
轻纺美妆行业周报：染发剂第一股鼎龙科技上市,申港证券,2024-01-18,美容护理,https://pdf.dfcfw.com/pdf/H3_AP202401181617684467_1.pdf?1705595901000.pdf
皮秒激光医美 头豹词条报告系列,头豹研究院,2024-01-18,美容护理,https://pdf.dfcfw.com/pdf/H3_AP202401181617692768_1.pdf?1705607721000.pdf
激光类医美 头豹词条报告系列,头豹研究院,2024-01-18,美容护理,https://pdf.dfcfw.com/pdf/H3_AP202401181617692767_1.pdf?1705607606000.pdf
LED光疗医美 头豹词条报告系列,头豹研究院,2024-01-16,美容护理,https://pdf.dfcfw.com/pdf/H3_AP202401161617522467_1.pdf?1705436166000.pdf
美容护理行业周观点：重组胶原蛋白企业创健医疗启动IPO,万联证券,2024-01-16,美容护理,https://pdf.dfcfw.com/pdf/H3_AP202401161617505577_1.pdf?1705388693000.pdf
美容护理行业周报：创健医疗启动上市辅导，丸美官宣防窜控价令,上海证券,2024-01-15,美容护理,https://pdf.dfcfw.com/pdf/H3_AP202401151617484977_1.pdf?1705312042000.pdf
胶原蛋白注射类医美服务 头豹词条报告系列,头豹研究院,2024-01-15,美容护理,https://pdf.dfcfw.com/pdf/H3_AP202401151617499319_1.pdf?1705348631000.pdf
肉毒素注射类医美服务 头豹词条报告系列,头豹研究院,2024-01-15,美容护理,https://pdf.dfcfw.com/pdf/H3_AP202401151617499320_1.pdf?1705349031000.pdf
化妆品级珠光材料 头豹词条报告系列,头豹研究院,2024-01-12,美容护理,https://pdf.dfcfw.com/pdf/H3_AP202401121617325421_1.pdf?1705088698000.pdf
美容护理行业周观点：多家公司公告股份回购进展，爱美客2023年归母净利润预计增长43%-50%,万联证券,2024-01-09,美容护理,https://pdf.dfcfw.com/pdf/H3_AP202401091616863867_1.pdf?1704793993000.pdf
美容护理行业周报：韩束迈入全渠道进阶时代，爱美客23年业绩表现亮眼,上海证券,2024-01-08,美容护理,https://pdf.dfcfw.com/pdf/H3_AP202401081616761232_1.pdf?1704707270000.pdf
美容护理行业周报：2023化妆品整体规模达7972亿元，国产表现亮眼,东海证券,2024-01-07,美容护理,https://pdf.dfcfw.com/pdf/H3_AP202401071616757685_1.pdf?1704647104000.pdf
水光针 头豹词条报告系列,头豹研究院,2024-01-05,美容护理,https://pdf.dfcfw.com/pdf/H3_AP202401051616683277_1.pdf?1704484051000.pdf
重睑术（双眼皮手术）头豹词条报告系列,头豹研究院,2024-01-04,美容护理,https://pdf.dfcfw.com/pdf/H3_AP202401041616347619_1.pdf?1704397873000.pdf
美容护理行业周观点：珀莱雅首次回购股份，华熙生物公告回购进展,万联证券,2024-01-03,美容护理,https://pdf.dfcfw.com/pdf/H3_AP202401031616090280_1.pdf?1704266605000.pdf
美容护理2024年度投资策略：分化中寻找确定性,上海证券,2024-01-03,美容护理,https://pdf.dfcfw.com/pdf/H3_AP202401031616127114_1.pdf?1704274119000.pdf
美容护理行业2024年度策略：蹄疾步稳，静待风来,财信证券,2024-01-03,美容护理,https://pdf.dfcfw.com/pdf/H3_AP202401031616218284_1.pdf?1704295991000.pdf
美妆：珀莱雅能量系列再添新品，巨子生物授出股权强化增长信心,首创证券,2024-01-03,美容护理,https://pdf.dfcfw.com/pdf/H3_AP202401031616226052_1.pdf?1704307240000.pdf
轻纺美妆行业周报：众鑫股份上交所IPO提交注册待发行,申港证券,2024-01-02,美容护理,https://pdf.dfcfw.com/pdf/H3_AP202401021615917290_1.pdf?1704201868000.pdf
美容护理行业周报：关注“头等大事”，防脱洗护市场升温,上海证券,2024-01-02,美容护理,https://pdf.dfcfw.com/pdf/H3_AP202401021615911887_1.pdf?1704187581000.pdf
美容护理行业深度报告：功能蛋白下游需求广泛，行业先驱锦波生物高速成长,万联证券,2024-01-02,美容护理,https://pdf.dfcfw.com/pdf/H3_AP202401021615912472_1.pdf?1704190268000.pdf
射频微针 头豹词条报告系列,头豹研究院,2023-12-29,美容护理,https://pdf.dfcfw.com/pdf/H3_AP202312291615488753_1.pdf?1703878978000.pdf
美护行业报告：多品牌布局胶原蛋白成分，看好胶原蛋白赛道加速扩容,东兴证券,2023-12-28,美容护理,https://pdf.dfcfw.com/pdf/H3_AP202312281615139447_1.pdf?1703749241000.pdf
美妆行业周度市场观察第51周,艾瑞股份,2023-12-28,美容护理,https://pdf.dfcfw.com/pdf/H3_AP202312281615149119_1.pdf?1703777462000.pdf
美妆行业周度市场观察第50周,艾瑞股份,2023-12-28,美容护理,https://pdf.dfcfw.com/pdf/H3_AP202312281615149111_1.pdf?1703776936000.pdf
美妆：鸿星尔克投资携手聚源生物，加码重组胶原蛋白赛道,首创证券,2023-12-27,美容护理,https://pdf.dfcfw.com/pdf/H3_AP202312271614995082_1.pdf?1703663731000.pdf
中国热玛吉医美服务行业市场规模测算逻辑模型 头豹词条报告系列,头豹研究院,2023-12-27,美容护理,https://pdf.dfcfw.com/pdf/H3_AP202312271615027517_1.pdf?1703706168000.pdf
美容护理行业周观点：深圳市罗湖区发布“医美十条”新政，助力医美产业发展,万联证券,2023-12-26,美容护理,https://pdf.dfcfw.com/pdf/H3_AP202312261614898761_1.pdf?1703579201000.pdf
轻纺美妆行业周报：特步收购索康尼相关资产 有望强化品牌间协同效应,申港证券,2023-12-26,美容护理,https://pdf.dfcfw.com/pdf/H3_AP202312261614902699_1.pdf?1703596991000.pdf
美容护理行业周报：海龟爸爸获LCatterton投资，关注婴童护肤赛道,上海证券,2023-12-24,美容护理,https://pdf.dfcfw.com/pdf/H3_AP202312241614880809_1.pdf?1703437862000.pdf
11月化妆品行业跟踪：11月化妆品整体表现平淡，需求端恢复仍需时间,万联证券,2023-12-24,美容护理,https://pdf.dfcfw.com/pdf/H3_AP202312241614880449_1.pdf?1703428323000.pdf
美容护理&社会服务年度策略：渐进复苏，把握强α及细分β机遇,东海证券,2023-12-21,美容护理,https://pdf.dfcfw.com/pdf/H3_AP202312211614641005_1.pdf?1703503529000.pdf
美容护理行业2024年投资策略：产品势能为王，新供给释放活力,中邮证券,2023-12-21,美容护理,https://pdf.dfcfw.com/pdf/H3_AP202312211614651152_1.pdf?1703184305000.pdf
美容护理行业月度点评：11月化妆品社零同比-3.5%，国货品牌增长动能有所减弱,财信证券,2023-12-21,美容护理,https://pdf.dfcfw.com/pdf/H3_AP202312211614645544_1.pdf?1703170896000.pdf
美容护理行业2024年度投资策略：需求侧静待拐点，供给侧寻找增量,国联证券,2023-12-20,美容护理,https://pdf.dfcfw.com/pdf/H3_AP202312201614589692_1.pdf?1703077534000.pdf
美容护理：11月社零同比增长10.1%，消费持续修复,财信证券,2023-12-20,美容护理,https://pdf.dfcfw.com/pdf/H3_AP202312201614602821_1.pdf?1703103326000.pdf
美容护理行业简评报告：美妆：福瑞达发布医美品牌珂谧，构筑公司第二成长曲线,首创证券,2023-12-19,美容护理,https://pdf.dfcfw.com/pdf/H3_AP202312191614507957_1.pdf?1702979335000.pdf
美妆行业点评：欧莱雅、福瑞达推出重组胶原产品，中国成分的下游商业化应用持续提速,民生证券,2023-12-18,美容护理,https://pdf.dfcfw.com/pdf/H3_AP202312181614449177_1.pdf?1702927442000.pdf
美容护理行业周报：中央经济工作会议鼓励国货“潮品”发展，胶原蛋白赛道加速扩容,上海证券,2023-12-18,美容护理,https://pdf.dfcfw.com/pdf/H3_AP202312181614436891_1.pdf?1702896963000.pdf
吸脂手术 头豹词条报告系列,头豹研究院,2023-12-13,美容护理,https://pdf.dfcfw.com/pdf/H3_AP202312131614087371_1.pdf?1702499489000.pdf
中国化妆品行业：披荆斩棘，国产化妆品如何再创辉煌？,浦银国际证券,2023-12-12,美容护理,https://pdf.dfcfw.com/pdf/H3_AP202312121613817448_1.pdf?1702400991000.pdf
美容护理行业周报：11月美妆大盘环比回暖，关注光电赛道新品,上海证券,2023-12-11,美容护理,https://pdf.dfcfw.com/pdf/H3_AP202312111613696789_1.pdf?1702291226000.pdf
医美专题系列一：医美注射类产品之玻尿酸&肉毒素,西南证券,2023-12-07,美容护理,https://pdf.dfcfw.com/pdf/H3_AP202312071613558642_1.pdf?1701955574000.pdf
美容护理行业简评报告：美妆：爱美客强化减重领域业务布局，锦波生物再推胶原蛋白针剂新品,首创证券,2023-12-06,美容护理,https://pdf.dfcfw.com/pdf/H3_AP202312061613422689_1.pdf?1701854452000.pdf
