研报名称,机构名称,发布时间,行业,研报地址
化妆品：2025年新品年度十大趋势,深圳伊则科技,2026-02-11,美容护理,https://pdf.dfcfw.com/pdf/H3_AP202602111819877357_1.pdf?1770825592000.pdf
美妆行业周度市场观察第7周,艾瑞股份,2026-02-11,美容护理,https://pdf.dfcfw.com/pdf/H3_AP202602111819880803_1.pdf?1770831752000.pdf
商社美护行业周报：春运火热启幕，泡泡玛特25年销量超4亿只,国元证券,2026-02-11,美容护理,https://pdf.dfcfw.com/pdf/H3_AP202602111819884253_1.pdf?1770841499000.pdf
美容护理行业双周报：行业景气度有望改善,东莞证券,2026-02-08,美容护理,https://pdf.dfcfw.com/pdf/H3_AP202602081819824274_1.pdf?1770567514000.pdf
医美化妆品1月月报：美丽田园发布盈喜公告，美护迎来上市潮，半亩花田与HBN母公司均递表港交所,开源证券,2026-02-05,美容护理,https://pdf.dfcfw.com/pdf/H3_AP202602051819784184_1.pdf?1770292100000.pdf
美容护理行业周报：贝泰妮集团旗下品牌薇诺娜正式进入中东市场，海外版图持续扩容,华龙证券,2026-02-03,美容护理,https://pdf.dfcfw.com/pdf/H3_AP202602031819522911_1.pdf?1770107303000.pdf
美妆行业周度市场观察第5周,艾瑞股份,2026-02-01,美容护理,https://pdf.dfcfw.com/pdf/H3_AP202602011819001656_1.pdf?1769965488000.pdf
美容护理行业跟踪报告：25Q4美护基金配置比例环比下滑，个护、化妆品处于低配区间,万联证券,2026-01-30,美容护理,https://pdf.dfcfw.com/pdf/H3_AP202601301818585868_1.pdf?1769794357000.pdf
2025年美妆微信视频号数据点评：微信视频号或成为美妆品牌差异化竞争的新阵地,华源证券,2026-01-28,美容护理,https://pdf.dfcfw.com/pdf/H3_AP202601271818475987_1.pdf?1769583895000.pdf
知行数据观察：洗发护发品类,宁波知行合一信息技术咨询服务,2026-01-28,美容护理,https://pdf.dfcfw.com/pdf/H3_AP202601281818514062_1.pdf?1769636288000.pdf
美容护理行业周报：科笛集团CU-20101国内III期临床试验取得积极顶线结果，改善中度至重度眉间纹,华龙证券,2026-01-27,美容护理,https://pdf.dfcfw.com/pdf/H3_AP202601271818469209_1.pdf?1769536398000.pdf
美妆行业：公私域融合经营白皮书,腾讯营销洞察,2026-01-25,美容护理,https://pdf.dfcfw.com/pdf/H3_AP202601251818394904_1.pdf?1769353482000.pdf
