研报名称,机构名称,发布时间,行业,研报地址
能源金属＆小金属周报：节前交投平淡，看好节后锑价进一步上涨,国金证券,2024-02-04,能源金属,https://pdf.dfcfw.com/pdf/H3_AP202402041620273512_1.pdf?1707042293000.pdf
有色金属：并购对价“稀奇事”：金诚信以2美元对价并购非洲铜矿,五矿证券,2024-01-24,能源金属,https://pdf.dfcfw.com/pdf/H3_AP202401241617989243_1.pdf?1706090612000.pdf
铝月度数据跟踪：电解铝23年表观消费增长6.4%，低库存支撑高位铝价,华福证券,2024-01-23,能源金属,https://pdf.dfcfw.com/pdf/H3_AP202401231617943814_1.pdf?1706003778000.pdf
锂思系列1：碳酸锂价格会超跌么？,五矿证券,2024-01-23,能源金属,https://pdf.dfcfw.com/pdf/H3_AP202401231617963046_1.pdf?1706047904000.pdf
有色行业周报：黄金买入机会显现，铜标的继续持有,西南证券,2024-01-22,能源金属,https://pdf.dfcfw.com/pdf/H3_AP202401221617904911_1.pdf?1705933003000.pdf
能源金属行业专题研究：本轮锂周期复盘：资源为王静待风起，关注相对底部机会,天风证券,2024-01-21,能源金属,https://pdf.dfcfw.com/pdf/H3_AP202401211617887187_1.pdf?1705846808000.pdf
有色金属行业双周报：美国通胀再次上升，但金属价格保持韧性,国泰君安证券(香港),2024-01-19,能源金属,https://pdf.dfcfw.com/pdf/H3_AP202401191617731187_1.pdf?1705678106000.pdf
有色行业周报：锂矿短期反弹，中长期仍需磨底,西南证券,2024-01-15,能源金属,https://pdf.dfcfw.com/pdf/H3_AP202401151617486102_1.pdf?1705315788000.pdf
能源金属＆小金属周报：春节窗口期临近，继续看好锑涨价,国金证券,2024-01-15,能源金属,https://pdf.dfcfw.com/pdf/H3_AP202401151617485837_1.pdf?1705327798000.pdf
