研报名称,机构名称,发布时间,行业,研报地址
军工行业2024年年报与2025年一季报综述：或是本轮军工周期最后一波利空，军工行业比较优势将逐步凸显,中航证券,2025-05-09,航天航空,https://pdf.dfcfw.com/pdf/H3_AP202505091669853787_1.pdf?1746789924000.pdf
国防军工：业绩短期承压，“十四五”收官行业有望否极泰来,中邮证券,2025-05-09,航天航空,https://pdf.dfcfw.com/pdf/H3_AP202505091670001606_1.pdf?1746804763000.pdf
军工行业2025年一季度公募基金持仓分析：1Q25机构低配军工；持仓“底部特征”明确,民生证券,2025-05-08,航天航空,https://pdf.dfcfw.com/pdf/H3_AP202505081669486938_1.pdf?1746723672000.pdf
军工行业2024年年报及2025年一季报业绩回顾：收入和利润“非线性”变化；行业“业绩底”基本确立,民生证券,2025-05-08,航天航空,https://pdf.dfcfw.com/pdf/H3_AP202505081669499000_1.pdf?1746725327000.pdf
印巴空战助力中国军工外贸景气,第一创业,2025-05-08,航天航空,https://pdf.dfcfw.com/pdf/H3_AP202505081669292549_1.pdf?1746694760000.pdf
国防军工：论印巴冲突对军工行业的影响-内外兼修，左右逢源,中航证券,2025-05-08,航天航空,https://pdf.dfcfw.com/pdf/H3_AP202505081669335814_1.pdf?1746711747000.pdf
国防军工：印巴冲突下，关注军贸市场投资机会,中邮证券,2025-05-08,航天航空,https://pdf.dfcfw.com/pdf/H3_AP202505081669377407_1.pdf?1746709023000.pdf
国防军工行业点评：可控核聚变进入发展关键期；SMR或适配AIDC,民生证券,2025-05-07,航天航空,https://pdf.dfcfw.com/pdf/H3_AP202505071668911966_1.pdf?1746633460000.pdf
军工行业周报：全球军费开支创冷战结束以来最大增幅,太平洋,2025-05-06,航天航空,https://pdf.dfcfw.com/pdf/H3_AP202505061668324463_1.pdf?1746550399000.pdf
商业航天行业事件点评：《终端设备直连卫星服务管理规定》发布，卫星应用将提速,民生证券,2025-05-05,航天航空,https://pdf.dfcfw.com/pdf/H3_AP202505031666620194_1.pdf?1746455349000.pdf
军工行业24年年报及25年一季报业绩综述：业绩阶段性承压，行业景气复苏已至,国金证券,2025-05-05,航天航空,https://pdf.dfcfw.com/pdf/H3_AP202505031666795328_1.pdf?1746455761000.pdf
军工行业双周报：基金持仓阶段性回落，Q2回升动能积聚,中国银河,2025-04-30,航天航空,https://pdf.dfcfw.com/pdf/H3_AP202504301664904323_1.pdf?1746023786000.pdf
国防军工行业专题研究：主动基金持仓超配比例修复，军工电子系配置反弹先锋,天风证券,2025-04-29,航天航空,https://pdf.dfcfw.com/pdf/H3_AP202504291664395255_1.pdf?1745934916000.pdf
低空经济周报：广州低空经济产业发展公司登记成立，美团获全国首张低空物流全境覆盖OC,金元证券,2025-04-29,航天航空,https://pdf.dfcfw.com/pdf/H3_AP202504291664585710_1.pdf?1745959606000.pdf
军工行业周报：基本面回暖在望，主题侧利好频现,中航证券,2025-04-28,航天航空,https://pdf.dfcfw.com/pdf/H3_AP202504281663679086_1.pdf?1745835823000.pdf
国防军工行业报告：62家军工上市公司披露2025年一季报，20家业绩同比增长,中邮证券,2025-04-28,航天航空,https://pdf.dfcfw.com/pdf/H3_AP202504281663910225_1.pdf?1745861766000.pdf
中央政治局会议军工行业点评：军工产业拓维升级：新质筑基，自主破局,中国银河,2025-04-27,航天航空,https://pdf.dfcfw.com/pdf/H3_AP202504261662746948_1.pdf?1745765465000.pdf
国防军工行业周度观察,国新证券股份,2025-04-25,航天航空,https://pdf.dfcfw.com/pdf/H3_AP202504251662001636_1.pdf?1745567341000.pdf
军工行业周报：国产C909飞机开启越南商业运营,太平洋,2025-04-23,航天航空,https://pdf.dfcfw.com/pdf/H3_AP202504231660891268_1.pdf?1745404841000.pdf
国防军工行业报告：60家军工上市公司披露2024年年报，9家公司披露2025年一季度业绩预告,中邮证券,2025-04-21,航天航空,https://pdf.dfcfw.com/pdf/H3_AP202504211659826625_1.pdf?1745230834000.pdf
军工行业周报：或是本轮军工周期最后一波利空,中航证券,2025-04-21,航天航空,https://pdf.dfcfw.com/pdf/H3_AP202504211659924825_1.pdf?1745257052000.pdf
低空经济双周报04：消博会设立低空经济展区，中航成飞无人机续航破纪录,华龙证券,2025-04-21,航天航空,https://pdf.dfcfw.com/pdf/H3_AP202504211659958756_1.pdf?1745252393000.pdf
中国低空经济应用场景研究报告（2025）,赛迪智库电子信息研究所,2025-04-20,航天航空,https://pdf.dfcfw.com/pdf/H3_AP202504191658808634_1.pdf?1745158984000.pdf
国防军工行业点评：关税风暴之下，波音的困局和空客_商飞的机遇,民生证券,2025-04-19,航天航空,https://pdf.dfcfw.com/pdf/H3_AP202504191658870539_1.pdf?1745081235000.pdf
低空经济周报：《海南省提振和扩大消费三年行动方案》正式印发，明确有序发展低空消费，海南消博会多款新型飞行器亮相,金元证券,2025-04-18,航天航空,https://pdf.dfcfw.com/pdf/H3_AP202504171658060283_1.pdf?1744962046000.pdf
国防军工：关税冲击下，航材国产化趋势加强,中邮证券,2025-04-18,航天航空,https://pdf.dfcfw.com/pdf/H3_AP202504181658283947_1.pdf?1744970593000.pdf
军工行业双周报：北斗自主筑基，军工国产突围,中国银河,2025-04-17,航天航空,https://pdf.dfcfw.com/pdf/H3_AP202504161657548293_1.pdf?1744881581000.pdf
低空经济行业专题系列二：eVTOL动力系统的市场空间、技术趋势和产业链机遇,国信证券,2025-04-17,航天航空,https://pdf.dfcfw.com/pdf/H3_AP202504171657759676_1.pdf?1744885468000.pdf
国防军工行业周度观察,国新证券股份,2025-04-17,航天航空,https://pdf.dfcfw.com/pdf/H3_AP202504171657778902_1.pdf?1744886778000.pdf
商业航天产业4月月报：动荡时局下的稳步发展,中航证券,2025-04-17,航天航空,https://pdf.dfcfw.com/pdf/H3_AP202504171657872567_1.pdf?1744901750000.pdf
国防军工：大飞机产业链自主可控或迫在眉睫，市场空间广阔,天风证券,2025-04-16,航天航空,https://pdf.dfcfw.com/pdf/H3_AP202504161657228484_1.pdf?1744794078000.pdf
低空经济月报：低空百舸争流时—从亿航首证到合肥“天空之城”的竞速突围,中航证券,2025-04-15,航天航空,https://pdf.dfcfw.com/pdf/H3_AP202504151656984632_1.pdf?1744754393000.pdf
军工行业景气度见底回升,第一创业,2025-04-15,航天航空,https://pdf.dfcfw.com/pdf/H3_AP202504151656761742_1.pdf?1744726083000.pdf
航空2.0：机器人如何重新定义天空,北京即联即用创业投资,2025-04-15,航天航空,https://pdf.dfcfw.com/pdf/H3_AP202504151656721441_1.pdf?1744720118000.pdf
军工行业周报：中国交付全球最大“人造太阳”重要部件,太平洋,2025-04-14,航天航空,https://pdf.dfcfw.com/pdf/H3_AP202504141656207943_1.pdf?1744620208000.pdf
军工行业周报：解析美国“关税战”对军工行业影响,中航证券,2025-04-14,航天航空,https://pdf.dfcfw.com/pdf/H3_AP202504141656197926_1.pdf?1744618440000.pdf
国防军工行业报告：48家军工上市公司披露2024年年报，多家上市公司公告回购或控股股东增持计划,中邮证券,2025-04-14,航天航空,https://pdf.dfcfw.com/pdf/H3_AP202504141656269363_1.pdf?1744630244000.pdf
中国低空经济城市发展指数（LCDI）2025（发布版）,中国人民大学,2025-04-10,航天航空,https://pdf.dfcfw.com/pdf/H3_AP202504101653978975_1.pdf?1744283430000.pdf
军工：需求、技术、政策共振，无人化物流发展正当时,中邮证券,2025-04-10,航天航空,https://pdf.dfcfw.com/pdf/H3_AP202504101654156901_1.pdf?1744310175000.pdf
再论军工行业、行情与市值管理：早已森严壁垒，更加众志成城,中航证券,2025-04-09,航天航空,https://pdf.dfcfw.com/pdf/H3_AP202504081653383734_1.pdf?1744190152000.pdf
军工行业点评：中美关税升级，军工板块影响几何？,中国银河,2025-04-09,航天航空,https://pdf.dfcfw.com/pdf/H3_AP202504091653801808_1.pdf?1744277839000.pdf
军工行业周报：关税背景下，看好军工板块独立行情,中航证券,2025-04-07,航天航空,https://pdf.dfcfw.com/pdf/H3_AP202504071652623422_1.pdf?1744014041000.pdf
军工行业周报：东部战区位台岛周边开展“海峡雷霆-2025A”演练,太平洋,2025-04-07,航天航空,https://pdf.dfcfw.com/pdf/H3_AP202504071652652794_1.pdf?1744019112000.pdf
国防军工行业报告：39家军工上市公司披露2024年年报，智明达发布一季度业绩预盈公告,中邮证券,2025-04-07,航天航空,https://pdf.dfcfw.com/pdf/H3_AP202504071652713951_1.pdf?1744054205000.pdf
国防军工：军工本周观点：内需及自主可控,华福证券,2025-04-06,航天航空,https://pdf.dfcfw.com/pdf/H3_AP202504061652318541_1.pdf?1743975449000.pdf
国防军工行业周度观察,国新证券股份,2025-04-03,航天航空,https://pdf.dfcfw.com/pdf/H3_AP202504031650867156_1.pdf?1743709235000.pdf
国防军工行业深度报告：深海科技六问六答，深海开发始于海洋探测，信息化与工具载体先行,东吴证券,2025-04-01,航天航空,https://pdf.dfcfw.com/pdf/H3_AP202504011649849372_1.pdf?1743506995000.pdf
国防军工行业点评：山东（威海）大力发展低空产业；亿航获取全球首张OC证,民生证券,2025-03-31,航天航空,https://pdf.dfcfw.com/pdf/H3_AP202503301649249106_1.pdf?1743410313000.pdf
军工行业周报：千红万紫安排著，只待新雷第一声,中航证券,2025-03-31,航天航空,https://pdf.dfcfw.com/pdf/H3_AP202503311649406197_1.pdf?1743406129000.pdf
国防军工行业报告：多家军工上市公司披露2024年年报，载人民用无人驾驶航空器首批OC证落地,中邮证券,2025-03-31,航天航空,https://pdf.dfcfw.com/pdf/H3_AP202503311649599363_1.pdf?1743498059000.pdf
军工行业周报：中国可控核聚变技术取得重大进展,太平洋,2025-03-31,航天航空,https://pdf.dfcfw.com/pdf/H3_AP202503311649618041_1.pdf?1743498261000.pdf
军工本周观点：关注一季报业绩表现较好标的,华福证券,2025-03-31,航天航空,https://pdf.dfcfw.com/pdf/H3_AP202503311649538367_1.pdf?1743442311000.pdf
国防军工行业专题：部分文献视角下新兴领域中碳纤维可能存在的应用,华安证券,2025-03-30,航天航空,https://pdf.dfcfw.com/pdf/H3_AP202503301649143796_1.pdf?1743363593000.pdf
国防军工行业专题研究：航空航天及卫星应用产业链分析之河南概况,中原证券,2025-03-28,航天航空,https://pdf.dfcfw.com/pdf/H3_AP202503281648511181_1.pdf?1743151194000.pdf
低空经济专题之eVTOL研究：eVTOL商业进程提速，多元场景驱动开拓千亿市场,源达信息,2025-03-28,航天航空,https://pdf.dfcfw.com/pdf/H3_AP202503281648689225_1.pdf?1743187251000.pdf
军工行业培训框架,国金证券,2025-03-27,航天航空,https://pdf.dfcfw.com/pdf/H3_AP202503271648108849_1.pdf?1743074035000.pdf
国防军工行业周度观察,国新证券股份,2025-03-27,航天航空,https://pdf.dfcfw.com/pdf/H3_AP202503271648167601_1.pdf?1743086706000.pdf
军工行业双周报：向海图强，“深蓝战略”加速推进,中国银河,2025-03-26,航天航空,https://pdf.dfcfw.com/pdf/H3_AP202503261647760983_1.pdf?1743011295000.pdf
军工电子月报：需求修复带动军工电子重回“主线”,中航证券,2025-03-26,航天航空,https://pdf.dfcfw.com/pdf/H3_AP202503261647822682_1.pdf?1743020395000.pdf
国防军工：国家战略加码深海科技，产业化提速开辟海洋经济新蓝海,天风证券,2025-03-25,航天航空,https://pdf.dfcfw.com/pdf/H3_AP202503251647171423_1.pdf?1742892954000.pdf
低空经济双周报03：低空消费纳入《提振消费行动方案》，美团无人机在港完成低空配送,华龙证券,2025-03-25,航天航空,https://pdf.dfcfw.com/pdf/H3_AP202503251647269882_1.pdf?1742912299000.pdf
军工行业周报：军工二重奏--主题活跃和业绩提振,中航证券,2025-03-24,航天航空,https://pdf.dfcfw.com/pdf/H3_AP202503241646707011_1.pdf?1742812983000.pdf
军工行业周报：美国选定波音公司执行生产第六代战机F-47项目,太平洋,2025-03-24,航天航空,https://pdf.dfcfw.com/pdf/H3_AP202503241646721543_1.pdf?1742806989000.pdf
国防军工行业报告：中国商飞供应商大会成功召开，C919规模化商运有望加速,中邮证券,2025-03-24,航天航空,https://pdf.dfcfw.com/pdf/H3_AP202503241646804740_1.pdf?1742823936000.pdf
低空经济月报：政策法规筑基，探寻商业闭环,中航证券,2025-03-24,航天航空,https://pdf.dfcfw.com/pdf/H3_AP202503241646859220_1.pdf?1742834303000.pdf
军工行业本周观点：十四五任务加速推进,华福证券,2025-03-23,航天航空,https://pdf.dfcfw.com/pdf/H3_AP202503231646502803_1.pdf?1742804767000.pdf
国防军工行业周度观察,国新证券股份,2025-03-21,航天航空,https://pdf.dfcfw.com/pdf/H3_AP202503211645602050_1.pdf?1742582761000.pdf
国防军工行业专题研究：世界百年大变局下的中国军贸：改革→突破→崛起,天风证券,2025-03-20,航天航空,https://pdf.dfcfw.com/pdf/H3_AP202503201645143296_1.pdf?1742496289000.pdf
国防军工：民机产业月报：国产民机产能提速在即，“出海”获得新进展,中航证券,2025-03-17,航天航空,https://pdf.dfcfw.com/pdf/H3_AP202503161644426589_1.pdf?1742210648000.pdf
商业航天产业3月月报：商业航天已经步入快速发展期,中航证券,2025-03-17,航天航空,https://pdf.dfcfw.com/pdf/H3_AP202503161644426591_1.pdf?1742204281000.pdf
军工材料月报：需求有望由下向上释放,中航证券,2025-03-17,航天航空,https://pdf.dfcfw.com/pdf/H3_AP202503161644426581_1.pdf?1742203814000.pdf
国防军工行业报告：“深海科技”首次写入政府工作报告，水下装备产业迎来重要发展机遇,中邮证券,2025-03-17,航天航空,https://pdf.dfcfw.com/pdf/H3_AP202503171644440453_1.pdf?1742212982000.pdf
军工行业周报：走向星辰大海，卫星互联网与深海科技,中航证券,2025-03-16,航天航空,https://pdf.dfcfw.com/pdf/H3_AP202503161644425954_1.pdf?1742200273000.pdf
国防军工行业点评报告：政府工作报告首次提及深海科技，新兴领域正式上升为国家战略,东吴证券,2025-03-16,航天航空,https://pdf.dfcfw.com/pdf/H3_AP202503161644416974_1.pdf?1742127542000.pdf
军工本周观点：继续乐观,华福证券,2025-03-16,航天航空,https://pdf.dfcfw.com/pdf/H3_AP202503161644421454_1.pdf?1742152735000.pdf
