研报名称,机构名称,发布时间,行业,研报地址
军事智能化：新质战斗力核心，掌握制智权关键,中航证券,2025-09-12,航天航空,https://pdf.dfcfw.com/pdf/H3_AP202509121742207000_1.pdf?1757672455000.pdf
军工增材制造深度报告：由“可选”到“必选”，由“配角”到“主角”,中航证券,2025-09-11,航天航空,https://pdf.dfcfw.com/pdf/H3_AP202509111741743839_1.pdf?1757607582000.pdf
低空经济周报（第三十六周）：重庆召开2025低空产业生态大会,金元证券,2025-09-10,航天航空,https://pdf.dfcfw.com/pdf/H3_AP202509101741144699_1.pdf?1757523102000.pdf
商业航天行业点评：中国星网一月内六次发射互联网卫星，抢占太空低轨,国信证券,2025-09-09,航天航空,https://pdf.dfcfw.com/pdf/H3_AP202509091740636213_1.pdf?1757412241000.pdf
国防军工：新时代的中国航天：卫星互联网产业——以星织网路，天堑变通途,中航证券,2025-09-08,航天航空,https://pdf.dfcfw.com/pdf/H3_AP202509071740063311_1.pdf?1757317905000.pdf
军工行业周报：“九三”阅兵后看军工,中航证券,2025-09-08,航天航空,https://pdf.dfcfw.com/pdf/H3_AP202509081740309424_1.pdf?1757343353000.pdf
2025中国军工行业现状报告,上海嘉世营销咨询,2025-09-07,航天航空,https://pdf.dfcfw.com/pdf/H3_AP202509071739927735_1.pdf?1757256455000.pdf
信达军工E周刊第195期：重器列阵扬国威，科技强军铸辉煌,信达证券,2025-09-07,航天航空,https://pdf.dfcfw.com/pdf/H3_AP202509071739989800_1.pdf?1757267011000.pdf
军工行业研究：阅兵专题：新质战斗力集中亮相，装备体系化发展趋势明确,国金证券,2025-09-05,航天航空,https://pdf.dfcfw.com/pdf/H3_AP202509051739085985_1.pdf?1757061256000.pdf
国防军工行业2025年半年报业绩回顾：“业绩底”筑基，上游环节和兵器板块实现增长,民生证券,2025-09-04,航天航空,https://pdf.dfcfw.com/pdf/H3_AP202509041738875934_1.pdf?1757011242000.pdf
2025中国UAM商业潜力研究报告,亿欧智库,2025-09-03,航天航空,https://pdf.dfcfw.com/pdf/H3_AP202509031738334777_1.pdf?1756892912000.pdf
军工行业周报：2025半年报回顾及展望,中航证券,2025-09-01,航天航空,https://pdf.dfcfw.com/pdf/H3_AP202509011737545248_1.pdf?1756716703000.pdf
军工行业25年中报业绩综述：行业景气呈现复苏，导弹和军工电子改善明显,国金证券,2025-09-01,航天航空,https://pdf.dfcfw.com/pdf/H3_AP202509011737679968_1.pdf?1756745411000.pdf
信达军工E周刊第194期：大国重器齐亮剑，共筑科技强军梦,信达证券,2025-08-31,航天航空,https://pdf.dfcfw.com/pdf/H3_AP202508311737345503_1.pdf?1756671700000.pdf
国防军工行业点评报告：军工行情或不止于阅兵,开源证券,2025-08-28,航天航空,https://pdf.dfcfw.com/pdf/H3_AP202508281735965444_1.pdf?1756392358000.pdf
低空经济周报（第三十四周）：广东省省长王伟中主持召开省政府常务会议研究低空经济高质量发展等工作,金元证券,2025-08-26,航天航空,https://pdf.dfcfw.com/pdf/H3_AP202508261734770214_1.pdf?1756222675000.pdf
国防军工行业专题研究：市场即底气：国产大飞机的产业突围与广阔空间,天风证券,2025-08-26,航天航空,https://pdf.dfcfw.com/pdf/H3_AP202508261734814830_1.pdf?1756229058000.pdf
军工行业周报：抗战胜利80周年阅兵准备工作进展顺利,太平洋,2025-08-25,航天航空,https://pdf.dfcfw.com/pdf/H3_AP202508251733958143_1.pdf?1756111311000.pdf
军工行业周报：“九三”阅兵前看军工,中航证券,2025-08-25,航天航空,https://pdf.dfcfw.com/pdf/H3_AP202508251733949952_1.pdf?1756110282000.pdf
信达军工E周刊第193期,信达证券,2025-08-25,航天航空,https://pdf.dfcfw.com/pdf/H3_AP202508251734062154_1.pdf?1756128230000.pdf
商业航天行业点评：我国卫星进入高峰发射期，关注商业航天下半年投资机会,民生证券,2025-08-21,航天航空,https://pdf.dfcfw.com/pdf/H3_AP202508211731706762_1.pdf?1755793603000.pdf
2025西部地区低空经济发展研究报告,新华网,2025-08-20,航天航空,https://pdf.dfcfw.com/pdf/H3_AP202508201730917163_1.pdf?1755691151000.pdf
低空经济周报（第三十三周）：低空司在深圳开展低空经济高质量发展专题培训,金元证券,2025-08-20,航天航空,https://pdf.dfcfw.com/pdf/H3_AP202508201730927673_1.pdf?1755685611000.pdf
军工电子月报：关注估值修复后的结构性机会,中航证券,2025-08-19,航天航空,https://pdf.dfcfw.com/pdf/H3_AP202508191730492726_1.pdf?1755624741000.pdf
军工行业周报：我国载人月球探测工程研制工作取得新进展,太平洋,2025-08-18,航天航空,https://pdf.dfcfw.com/pdf/H3_AP202508181729882118_1.pdf?1755542382000.pdf
军工行业周报：当军机掠过阿拉斯加上空,中航证券,2025-08-18,航天航空,https://pdf.dfcfw.com/pdf/H3_AP202508181729687949_1.pdf?1755535354000.pdf
信达军工E周刊第192期：军工热点不断，重点关注新质战斗力,信达证券,2025-08-17,航天航空,https://pdf.dfcfw.com/pdf/H3_AP202508171729412073_1.pdf?1755474358000.pdf
军工材料月报：关注半年报披露,中航证券,2025-08-14,航天航空,https://pdf.dfcfw.com/pdf/H3_AP202508131726932339_1.pdf?1755158555000.pdf
国防军工：低空经济月报：快与慢，变局与新局,中航证券,2025-08-14,航天航空,https://pdf.dfcfw.com/pdf/H3_AP202508131726941889_1.pdf?1755157916000.pdf
军工行业双周报：星网建设加速，产业进入“SpaceX时刻”,中国银河,2025-08-12,航天航空,https://pdf.dfcfw.com/pdf/H3_AP202508121726273780_1.pdf?1755032969000.pdf
军工行业周报：我国载人航天器地外天体着陆起飞试验圆满成功,太平洋,2025-08-11,航天航空,https://pdf.dfcfw.com/pdf/H3_AP202508111725320694_1.pdf?1754917241000.pdf
万亿蓝海启航：解码中国低空经济的爆发式增长密码！,深圳汉鼎智库咨询服务,2025-08-11,航天航空,https://pdf.dfcfw.com/pdf/H3_AP202508111725453953_1.pdf?1754925224000.pdf
国防军工行业专题研究：“阅兵”主题下的军工板块投资机会和发展透视,民生证券,2025-08-07,航天航空,https://pdf.dfcfw.com/pdf/H3_AP202508071723298180_1.pdf?1754637422000.pdf
军工行业研究：持续看好阅兵和新质战斗力的主线行情,国金证券,2025-08-06,航天航空,https://pdf.dfcfw.com/pdf/H3_AP202508061722337158_1.pdf?1754467382000.pdf
商业航天行业事件点评：海南发射场“双工位”接力；卫星互联网加速发射,民生证券,2025-08-05,航天航空,https://pdf.dfcfw.com/pdf/H3_AP202508051721902941_1.pdf?1754405180000.pdf
国防军工行业报告：中俄“海上联合-2025”联合演习开幕,中邮证券,2025-08-04,航天航空,https://pdf.dfcfw.com/pdf/H3_AP202508041721163868_1.pdf?1754307146000.pdf
军工行业周报：行业月成交额创新高后再看军工,中航证券,2025-08-03,航天航空,https://pdf.dfcfw.com/pdf/H3_AP202508031720890841_1.pdf?1754298182000.pdf
国防军工行业报告：美军17年来首次在英国本土部署核武器，泰国与柬埔寨边境地区交火持续,中邮证券,2025-07-30,航天航空,https://pdf.dfcfw.com/pdf/H3_AP202507301718191353_1.pdf?1753891922000.pdf
低空经济周报：市场监管总局与中国民航局签订数据共享合作协议，国际低空经济博览会在沪召开,金元证券,2025-07-29,航天航空,https://pdf.dfcfw.com/pdf/H3_AP202507291717811311_1.pdf?1753811822000.pdf
军工行业周报：Q2公募持仓规模大幅提升，新质装备强化军贸逻辑,中航证券,2025-07-28,航天航空,https://pdf.dfcfw.com/pdf/H3_AP202507281716941056_1.pdf?1753688920000.pdf
商业航天产业7月月报：上半年回顾与下半年展望,中航证券,2025-07-28,航天航空,https://pdf.dfcfw.com/pdf/H3_AP202507281716985189_1.pdf?1753694111000.pdf
国防军工行业点评报告：垣信卫星采购7次一箭多星火箭发射服务，总预算达13.36亿元,东吴证券,2025-07-28,航天航空,https://pdf.dfcfw.com/pdf/H3_AP202507281717106784_1.pdf?1753710766000.pdf
军工行业双周报：军工持仓环比提升，垣信卫星发射加速,中国银河,2025-07-28,航天航空,https://pdf.dfcfw.com/pdf/H3_AP202507281717299578_1.pdf?1753738322000.pdf
国防军工：核聚变行业简析,华安证券,2025-07-28,航天航空,https://pdf.dfcfw.com/pdf/H3_AP202507281717312219_1.pdf?1753739743000.pdf
军工行业2025年二季度公募基金持仓分析：2Q25机构增配军工；行业拐点已经出现,民生证券,2025-07-27,航天航空,https://pdf.dfcfw.com/pdf/H3_AP202507271716563255_1.pdf?1753632307000.pdf
国防军工行业点评报告：泰柬冲突升级，军贸有望持续受益,开源证券,2025-07-25,航天航空,https://pdf.dfcfw.com/pdf/H3_AP202507251715327261_1.pdf?1753450319000.pdf
火炮深度：战争之神，王者归来,中邮证券,2025-07-25,航天航空,https://pdf.dfcfw.com/pdf/H3_AP202507251715420427_1.pdf?1753463130000.pdf
军用含能材料：武器发挥作战效能的关键，以第二代为主力、第三代走向量产,中邮证券,2025-07-25,航天航空,https://pdf.dfcfw.com/pdf/H3_AP202507251715456291_1.pdf?1753467970000.pdf
国防军工2025年中期策略：国际局势动荡加剧，我国军贸大有可为,山西证券,2025-07-24,航天航空,https://pdf.dfcfw.com/pdf/H3_AP202507241714844859_1.pdf?1753379821000.pdf
国防军工行业点评报告：中国聚变能源有限公司挂牌成立，核聚变项目建设有望迎来订单放量,东吴证券,2025-07-23,航天航空,https://pdf.dfcfw.com/pdf/H3_AP202507231714224507_1.pdf?1753291237000.pdf
低空经济周报：国家发展改革委召开推动低空经济安全健康发展专题会议，再次强调安全为先的发展理念,金元证券,2025-07-22,航天航空,https://pdf.dfcfw.com/pdf/H3_AP202507221713634728_1.pdf?1753206201000.pdf
军工行业周报：天舟九号货运飞船发射任务取得圆满成功,太平洋,2025-07-22,航天航空,https://pdf.dfcfw.com/pdf/H3_AP202507221713638841_1.pdf?1753220039000.pdf
军工行业周报：从中航沈飞和JOBY等股价创历史新高看军工行业,中航证券,2025-07-21,航天航空,https://pdf.dfcfw.com/pdf/H3_AP202507201712521004_1.pdf?1753086436000.pdf
航天装备行业研究周报：欧洲启动新一轮弹药备货，弹药产业链景气上行,天风证券,2025-07-21,航天航空,https://pdf.dfcfw.com/pdf/H3_AP202507211712856549_1.pdf?1753094252000.pdf
国防军工行业报告：37家军工上市公司披露2025H1业绩预告，船舶和国防信息化板块相关标的业绩高增长,中邮证券,2025-07-21,航天航空,https://pdf.dfcfw.com/pdf/H3_AP202507211713038171_1.pdf?1753125171000.pdf
国防军工：海洋攻防装备建设加速，海洋资源勘采蓄势待发,天风证券,2025-07-19,航天航空,https://pdf.dfcfw.com/pdf/H3_AP202507191711833965_1.pdf?1753007103000.pdf
军工行业双周报：他山之石：SpaceX成美最高估值私企,中国银河,2025-07-16,航天航空,https://pdf.dfcfw.com/pdf/H3_AP202507161710139091_1.pdf?1752703108000.pdf
国防军工行业报告：16家军工上市公司披露2025H1业绩预告，船舶和国防信息化板块相关标的业绩高增长,中邮证券,2025-07-15,航天航空,https://pdf.dfcfw.com/pdf/H3_AP202507151709157104_1.pdf?1752577275000.pdf
军工材料月报：半年度行情分析及展望,中航证券,2025-07-14,航天航空,https://pdf.dfcfw.com/pdf/H3_AP202507131708295396_1.pdf?1752481283000.pdf
军工行业周报：我国天然铀生产迎来新突破,太平洋,2025-07-14,航天航空,https://pdf.dfcfw.com/pdf/H3_AP202507141708611631_1.pdf?1752491154000.pdf
军工行业周报：三季度展望,中航证券,2025-07-13,航天航空,https://pdf.dfcfw.com/pdf/H3_AP202507131708264207_1.pdf?1752483446000.pdf
国防军工行业周度观察,国新证券股份,2025-07-11,航天航空,https://pdf.dfcfw.com/pdf/H3_AP202507111707055315_1.pdf?1752261637000.pdf
军工行业周报：美国暂停对乌克兰的部分军援,太平洋,2025-07-09,航天航空,https://pdf.dfcfw.com/pdf/H3_AP202507091705584660_1.pdf?1752049370000.pdf
美国航空航天与国防：决定性催化剂：解析“大而美法案”对欧美A&D板块的冲击与机遇,海通国际,2025-07-09,航天航空,https://pdf.dfcfw.com/pdf/H3_AP202507091705693635_1.pdf?1752070299000.pdf
国防军工行业报告：中央财经委员会第六次会议强调推动海洋经济高质量发展,中邮证券,2025-07-08,航天航空,https://pdf.dfcfw.com/pdf/H3_AP202507081705010171_1.pdf?1751966335000.pdf
军贸专题：中国军贸体系化、高端化提速，突破军工市场天花板,国金证券,2025-07-07,航天航空,https://pdf.dfcfw.com/pdf/H3_AP202507071704373367_1.pdf?1751874650000.pdf
低空经济双周报09：民航法首次系统性修订，倍飞智航签署超10亿eVTOL订单,华龙证券,2025-07-07,航天航空,https://pdf.dfcfw.com/pdf/H3_AP202507071704469023_1.pdf?1751893755000.pdf
军工行业周报：军工“关注热度”创历史新高，“两船合并”进入收官阶段,中航证券,2025-07-07,航天航空,https://pdf.dfcfw.com/pdf/H3_AP202507061704130325_1.pdf?1751873862000.pdf
国防军工：谷歌与CFS签署200MW购电协议，聚变能源加速商业化,中邮证券,2025-07-03,航天航空,https://pdf.dfcfw.com/pdf/H3_AP202507031702184722_1.pdf?1751556008000.pdf
The质量进化在航空航天和国防加速的时代,Capgemini,2025-07-02,航天航空,https://pdf.dfcfw.com/pdf/H3_AP202507021701436323_1.pdf?1751450530000.pdf
军工行业周报：北约宣布2035年前将成员国军费开支提高至GDP的5%,太平洋,2025-07-01,航天航空,https://pdf.dfcfw.com/pdf/H3_AP202507011700904626_1.pdf?1751397560000.pdf
国防军工行业报告：9月3日天安门将举行阅兵，传统主战力量和新域新质力量均将参阅,中邮证券,2025-07-01,航天航空,https://pdf.dfcfw.com/pdf/H3_AP202507011701042630_1.pdf?1751392352000.pdf
军工行业周报：军工行业上半年总结，下半年展望,中航证券,2025-06-30,航天航空,https://pdf.dfcfw.com/pdf/H3_AP202506291699928264_1.pdf?1751269553000.pdf
国防军工：航空工业召开人工智能大会，军工AI发展有望加速,中邮证券,2025-06-30,航天航空,https://pdf.dfcfw.com/pdf/H3_AP202506301700214731_1.pdf?1751277386000.pdf
国防军工：1-5月硝化棉出口同比翻倍，6月价格有望继续上涨,中邮证券,2025-06-30,航天航空,https://pdf.dfcfw.com/pdf/H3_AP202506301700199936_1.pdf?1751274531000.pdf
2025中国低空经济市场现状报告,上海嘉世营销咨询,2025-06-29,航天航空,https://pdf.dfcfw.com/pdf/H3_AP202506281699113105_1.pdf?1751193305000.pdf
国防军工行业报告：美国介入以伊冲突空袭伊朗核设施，歼35A首次海外亮相巴黎航展,中邮证券,2025-06-27,航天航空,https://pdf.dfcfw.com/pdf/H3_AP202506271698409114_1.pdf?1751015246000.pdf
国防军工2025年中期策略报告：“十四五”收官红利释放，新域战力增量突围,中国银河,2025-06-25,航天航空,https://pdf.dfcfw.com/pdf/H3_AP202506251696977073_1.pdf?1750837396000.pdf
军工行业2025年度中期策略：内销外贸景气双升，军工资产价值重估,国金证券,2025-06-24,航天航空,https://pdf.dfcfw.com/pdf/H3_AP202506241696578413_1.pdf?1750756147000.pdf
军工行业周报：巴黎航展引爆军贸关注，商业航天或迎高密度发射潮,中航证券,2025-06-23,航天航空,https://pdf.dfcfw.com/pdf/H3_AP202506231695939448_1.pdf?1750669847000.pdf
军工行业周报：美国袭击伊朗三处核设施,太平洋,2025-06-23,航天航空,https://pdf.dfcfw.com/pdf/H3_AP202506231695978581_1.pdf?1750677688000.pdf
国防军工低空经济月报：顶层定调低空场景发展原则，eVTOL成国际低空竞争焦点领域,中航证券,2025-06-22,航天航空,https://pdf.dfcfw.com/pdf/H3_AP202506201694567656_1.pdf?1750585164000.pdf
一个研究者的指南：微重力材料研究,美国航空航天局,2025-06-20,航天航空,https://pdf.dfcfw.com/pdf/H3_AP202506201694183519_1.pdf?1750413319000.pdf
国防军工行业点评：地缘局势趋于复杂；先进战机或成为中国军贸崛起的战略支点,天风证券,2025-06-20,航天航空,https://pdf.dfcfw.com/pdf/H3_AP202506201694251136_1.pdf?1750416468000.pdf
国防军工行业深度报告：CJ-1000A突破国际技术封锁，助力C919实现航空中国心,东吴证券,2025-06-18,航天航空,https://pdf.dfcfw.com/pdf/H3_AP202506181693270203_1.pdf?1750272352000.pdf
国防军工行业周度观察,国新证券股份,2025-06-18,航天航空,https://pdf.dfcfw.com/pdf/H3_AP202506181693279388_1.pdf?1750273813000.pdf
国防军工行业报告：以伊战争持续，军贸行情有望扩散,中邮证券,2025-06-17,航天航空,https://pdf.dfcfw.com/pdf/H3_AP202506171692442260_1.pdf?1750153969000.pdf
军工行业周报：全球地缘风险加剧，军工比较优势凸显,中航证券,2025-06-16,航天航空,https://pdf.dfcfw.com/pdf/H3_AP202506161691818873_1.pdf?1750064549000.pdf
商业航天产业6月月报：我国商业航天将迎来高密度发射期,中航证券,2025-06-16,航天航空,https://pdf.dfcfw.com/pdf/H3_AP202506161691828705_1.pdf?1750067988000.pdf
军工行业周报：中国双航母编队首次在西太演练,太平洋,2025-06-16,航天航空,https://pdf.dfcfw.com/pdf/H3_AP202506161691858843_1.pdf?1750071704000.pdf
国防军工行业2025年中期投资策略：底部反转趋势确定，“双新质”或引领行情,民生证券,2025-06-16,航天航空,https://pdf.dfcfw.com/pdf/H3_AP202506161691993321_1.pdf?1750089566000.pdf
低空经济周报：发改委《关于深入推进深圳综合改革试点深化改革创新扩大开放的意见》重点提及深圳低空经济发展,金元证券,2025-06-16,航天航空,https://pdf.dfcfw.com/pdf/H3_AP202506161692019242_1.pdf?1750093471000.pdf
低空经济研究之总览篇：【粤开新能源】低空经济总体特征、发展态势与未来趋势,粤开证券,2025-06-15,航天航空,https://pdf.dfcfw.com/pdf/H3_AP202506151691432656_1.pdf?1750011240000.pdf
国防军工行业专题报告：海外启示录3：中国军贸的“DeepSeek”时刻是否来临？,民生证券,2025-06-13,航天航空,https://pdf.dfcfw.com/pdf/H3_AP202506131690279540_1.pdf?1749839324000.pdf
低空经济周报：香港首条常态化无人机配送航线起航，美团无人机负责运营,金元证券,2025-06-12,航天航空,https://pdf.dfcfw.com/pdf/H3_AP202506121689235016_1.pdf?1749715653000.pdf
军工行业周报：欧盟批准英意日合资开发第六代战斗机,太平洋,2025-06-09,航天航空,https://pdf.dfcfw.com/pdf/H3_AP202506091687473577_1.pdf?1749458545000.pdf
军工行业周报：导致变化的变化,中航证券,2025-06-09,航天航空,https://pdf.dfcfw.com/pdf/H3_AP202506091687481182_1.pdf?1749459605000.pdf
国防军工：美国据报暂停向商飞出售部分技术，航材国产化需求迫切,中邮证券,2025-06-09,航天航空,https://pdf.dfcfw.com/pdf/H3_AP202506091687485298_1.pdf?1749461043000.pdf
国防军工行业报告：河北一硝化棉厂商煮洗釜爆炸，硝化棉供应紧张或进一步加剧,中邮证券,2025-06-09,航天航空,https://pdf.dfcfw.com/pdf/H3_AP202506091687511125_1.pdf?1749464722000.pdf
国防军工行业点评：硝化棉需求旺盛，出口量价齐升,中邮证券,2025-06-09,航天航空,https://pdf.dfcfw.com/pdf/H3_AP202506091687583582_1.pdf?1749475516000.pdf
国防军工行业报告：印尼考虑采购中国歼-10战斗机，有望带动军贸市场景气度提升,中邮证券,2025-06-09,航天航空,https://pdf.dfcfw.com/pdf/H3_AP202506091687616432_1.pdf?1749491363000.pdf
国防军工行业周度观察,国新证券股份,2025-06-08,航天航空,https://pdf.dfcfw.com/pdf/H3_AP202506081687170367_1.pdf?1749413979000.pdf
国产大型客机专题报告：全球市场格局发生剧变，中国客机迎来历史机遇,山西证券,2025-06-06,航天航空,https://pdf.dfcfw.com/pdf/H3_AP202506061685887559_1.pdf?1749226037000.pdf
低空经济周报：新闻发布会解读《国家邮政局关于加快邮政业科技发展的意见》，鼓励无人机在支、末端的规模化运输和配送,金元证券,2025-06-05,航天航空,https://pdf.dfcfw.com/pdf/H3_AP202506051685248459_1.pdf?1749136389000.pdf
军工行业周报：天问二号发射任务取得圆满成功,太平洋,2025-06-03,航天航空,https://pdf.dfcfw.com/pdf/H3_AP202506031684006996_1.pdf?1748950127000.pdf
军工行业周报：机遇大于挑战、动力大于压力,中航证券,2025-06-03,航天航空,https://pdf.dfcfw.com/pdf/H3_AP202506031684123120_1.pdf?1748971639000.pdf
国防军工：民机行业点评：困局、破局、新局--从美国“关税战”看我国民机产业的历史性机遇,中航证券,2025-05-30,航天航空,https://pdf.dfcfw.com/pdf/H3_AP202505301681667643_1.pdf?1748605044000.pdf
为可持续航空加油：可持续航空燃料和氢能航空燃料对技术、经济和环境的影响,霍尼韦尔(中国),2025-05-28,航天航空,https://pdf.dfcfw.com/pdf/H3_AP202505281680461150_1.pdf?1748425237000.pdf
军工行业周报：特朗普宣布打造“金穹”导弹防御系统,太平洋,2025-05-28,航天航空,https://pdf.dfcfw.com/pdf/H3_AP202505281680787768_1.pdf?1748506939000.pdf
军工行业周报：需求分化、预期重塑,中航证券,2025-05-26,航天航空,https://pdf.dfcfw.com/pdf/H3_AP202505261679280069_1.pdf?1748245059000.pdf
军工材料月报：军工材料上市公司2024年&2025Q1财报综述,中航证券,2025-05-26,航天航空,https://pdf.dfcfw.com/pdf/H3_AP202505261679298096_1.pdf?1748253760000.pdf
国防军工行业报告：美国防预算将达1万亿美元，创历史新高,中邮证券,2025-05-26,航天航空,https://pdf.dfcfw.com/pdf/H3_AP202505261679416028_1.pdf?1748272309000.pdf
低空经济双周报06：国际低空经济合作联盟成立，沃飞长空签署120架eVTOL订单,华龙证券,2025-05-26,航天航空,https://pdf.dfcfw.com/pdf/H3_AP202505261679475040_1.pdf?1748274515000.pdf
国防军工2024A&2025Q1报表分析：困境突围，曙光渐现,天风证券,2025-05-23,航天航空,https://pdf.dfcfw.com/pdf/H3_AP202505231677803480_1.pdf?1748022491000.pdf
军工AI深度：AI迎来奥本海默时刻，将改变未来战争形态,中邮证券,2025-05-22,航天航空,https://pdf.dfcfw.com/pdf/H3_AP202505221677027201_1.pdf?1747909328000.pdf
国防军工：低空经济月报：从规划到落地，从低空到经济,中航证券,2025-05-22,航天航空,https://pdf.dfcfw.com/pdf/H3_AP202505221677234990_1.pdf?1747939147000.pdf
2024年民航行业发展统计公报,中国民用航空局,2025-05-22,航天航空,https://pdf.dfcfw.com/pdf/H3_AP202505221676993592_1.pdf?1747908175000.pdf
商业航天产业5月月报：商业航天上市公司2024年&2025Q1财报综述,中航证券,2025-05-20,航天航空,https://pdf.dfcfw.com/pdf/H3_AP202505201676010509_1.pdf?1747757917000.pdf
国防军工行业周度观察,国新证券股份,2025-05-20,航天航空,https://pdf.dfcfw.com/pdf/H3_AP202505201676066879_1.pdf?1747766032000.pdf
军工行业周报：明确新时代“总体国家安全观”，我国发布首部国家安全白皮书,中航证券,2025-05-19,航天航空,https://pdf.dfcfw.com/pdf/H3_AP202505191675319062_1.pdf?1747652266000.pdf
国防军工行业报告：我国首部国家安全白皮书发布,中邮证券,2025-05-19,航天航空,https://pdf.dfcfw.com/pdf/H3_AP202505191675455510_1.pdf?1747682257000.pdf
军工行业周报：我国成功发射太空计算卫星星座,太平洋,2025-05-19,航天航空,https://pdf.dfcfw.com/pdf/H3_AP202505191675461172_1.pdf?1747683711000.pdf
新兴产业：印巴空战展现国产雷达装备实力，重点推荐纳睿雷达！,天风证券,2025-05-19,航天航空,https://pdf.dfcfw.com/pdf/H3_AP202505191675568869_1.pdf?1747691715000.pdf
印巴冲突专题：中国军工的DEEPSEEK时刻，关注军贸投资机遇,国金证券,2025-05-16,航天航空,https://pdf.dfcfw.com/pdf/H3_AP202505161673639796_1.pdf?1747382788000.pdf
低空经济周报：印巴战场我国军事武器设备表现优异，引发市场对航空航天板块价值重估,金元证券,2025-05-15,航天航空,https://pdf.dfcfw.com/pdf/H3_AP202505151673114752_1.pdf?1747300268000.pdf
国防军工行业报告：中国装备在印巴冲突中表现突出，主机厂比上游企业更受益于军贸增长,中邮证券,2025-05-13,航天航空,https://pdf.dfcfw.com/pdf/H3_AP202505131672019676_1.pdf?1747126898000.pdf
国防军工行业动态追踪：国产装备市场竞争力增强，地缘政治因素驱动市场扩容,源达信息,2025-05-13,航天航空,https://pdf.dfcfw.com/pdf/H3_AP202505131672221453_1.pdf?1747158947000.pdf
军工行业双周报：印巴冲突实战淬火，重构全球军贸版图,中国银河,2025-05-13,航天航空,https://pdf.dfcfw.com/pdf/H3_AP202505131672036692_1.pdf?1747130190000.pdf
军工行业周报：印巴冲突如何演绎，军工大涨后何去何从,中航证券,2025-05-12,航天航空,https://pdf.dfcfw.com/pdf/H3_AP202505121671453845_1.pdf?1747039045000.pdf
军工行业周报：印巴同意立即停火,太平洋,2025-05-12,航天航空,https://pdf.dfcfw.com/pdf/H3_AP202505121671469076_1.pdf?1747040135000.pdf
低空经济双周报05：低空经济入选国家数据示范场景，峰飞航空百架eVTOL订单签署,华龙证券,2025-05-12,航天航空,https://pdf.dfcfw.com/pdf/H3_AP202505121671604242_1.pdf?1747066049000.pdf
2025Q1国防军工板块业绩及基金持仓分析：2024年业绩承压筑底，景气反转在即,中国银河,2025-05-12,航天航空,https://pdf.dfcfw.com/pdf/H3_AP202505121671643513_1.pdf?1747069004000.pdf
