研报名称,机构名称,发布时间,行业,研报地址
航运船舶行业专题（三）：美对伊俄油制裁升级，油运景气度锦上添花,华源证券,2025-01-18,航运港口,https://pdf.dfcfw.com/pdf/H3_AP202501181642321746_1.pdf?1737297611000.pdf
交通运输：油轮制裁升级，合规运输市场需求看涨,华福证券,2025-01-14,航运港口,https://pdf.dfcfw.com/pdf/H3_AP202501141641914237_1.pdf?1736850256000.pdf
交通运输行业重大事项点评报告：美国对俄油采取史上最严厉制裁，原油市场“合规化”趋势明确，看好油运市场机会,民生证券,2025-01-13,航运港口,https://pdf.dfcfw.com/pdf/H3_AP202501131641898803_1.pdf?1736761009000.pdf
航运行业事件点评：俄油制裁升级，相关油轮约占行业运力2.4%,信达证券,2025-01-12,航运港口,https://pdf.dfcfw.com/pdf/H3_AP202501121641896453_1.pdf?1736699466000.pdf
油运行业事件点评：中远集团进入美国“黑名单”，或刺激油运运价上涨,东莞证券,2025-01-08,航运港口,https://pdf.dfcfw.com/pdf/H3_AP202501081641853375_1.pdf?1736349832000.pdf
交通运输周报：大连长海跨海大桥2025年开建,海通国际,2024-12-25,航运港口,https://pdf.dfcfw.com/pdf/H3_AP202412251641420872_1.pdf?1735121541000.pdf
中国集装箱船行业市场规模测算逻辑模型 头豹词条报告系列,头豹研究院,2024-12-06,航运港口,https://pdf.dfcfw.com/pdf/H3_AP202412061641213364_1.pdf?1733514077000.pdf
2025年航运船舶投资策略：八面来风，御风远航,华源证券,2024-12-01,航运港口,https://pdf.dfcfw.com/pdf/H3_AP202411301641129016_1.pdf?1733048198000.pdf
干散货运行业深度报告：远距离矿石运输需求释放，有效运力增长放缓,西南证券,2024-11-18,航运港口,https://pdf.dfcfw.com/pdf/H3_AP202411181640937439_1.pdf?1731946792000.pdf
交通运输行业专题研究：特朗普当选，交运投资机会,天风证券,2024-11-15,航运港口,https://pdf.dfcfw.com/pdf/H3_AP202411151640904669_1.pdf?1731658578000.pdf
公铁港链11月投资策略：经营分化，稳健占优,中泰证券,2024-11-05,航运港口,https://pdf.dfcfw.com/pdf/H3_AP202411051640724862_1.pdf?1730827986000.pdf
交通运输周报：港珠澳大桥六年迎客超6230万人次,海通国际,2024-10-29,航运港口,https://pdf.dfcfw.com/pdf/H3_AP202410291640557396_1.pdf?1730191790000.pdf
交运行业观点：航道上的黄金时代，航运造船欣欣向龙,西南证券,2024-10-07,航运港口,https://pdf.dfcfw.com/pdf/H3_AP202410031640162988_1.pdf?1728310558000.pdf
航运船舶市场系列点评一：沙特对油价态度转变，增产利好油运运价,华源证券,2024-09-29,航运港口,https://pdf.dfcfw.com/pdf/H3_AP202409281640090591_1.pdf?1727601365000.pdf
航运港口：美东码头或罢工在即，警惕供应链再次紊乱,国联证券,2024-09-25,航运港口,https://pdf.dfcfw.com/pdf/H3_AP202409251640031719_1.pdf?1727280686000.pdf
交通运输行业周报：散运需求或受陆运焦煤影响，7月快递业务量同比增长超两成,中银证券,2024-08-19,航运港口,https://pdf.dfcfw.com/pdf/H3_AP202408191639343998_1.pdf?1724102176000.pdf
航运：红海危机为航运派发傥来之利 外贸景气增厚行业信用缓冲,惠誉博华信用评级,2024-08-09,航运港口,https://pdf.dfcfw.com/pdf/H3_AP202408091639218496_1.pdf?1723222573000.pdf
港口专题报告：集装箱吞吐量维持高增，干散货吞吐量出现分化,信达证券,2024-07-30,航运港口,https://pdf.dfcfw.com/pdf/H3_AP202407301638463401_1.pdf?1722345418000.pdf
