研报名称,机构名称,发布时间,行业,研报地址
交通运输行业周报：油运运价持续上行，旺季业绩弹性可期,中国银河,2025-09-15,航运港口,https://pdf.dfcfw.com/pdf/H3_AP202509151744108624_1.pdf?1757946065000.pdf
航运行业事件点评：油运市场近况分析：供需紧俏加剧，全球原油油轮加权平均TCE同比高增83%,信达证券,2025-09-08,航运港口,https://pdf.dfcfw.com/pdf/H3_AP202509081740309431_1.pdf?1757340515000.pdf
航运港口2025年8月专题：原油、干散货吞吐量稳步复苏，集装箱吞吐量稳增,信达证券,2025-09-03,航运港口,https://pdf.dfcfw.com/pdf/H3_AP202509031738414949_1.pdf?1756911833000.pdf
航运港口2025年7月专题：原油吞吐量6月同比转正，干散货吞吐量复苏,信达证券,2025-08-06,航运港口,https://pdf.dfcfw.com/pdf/H3_AP202508061722502594_1.pdf?1754492597000.pdf
交通运输行业周报：长和港口交易新进展，跨境绿通中越直达,中国银河,2025-08-04,航运港口,https://pdf.dfcfw.com/pdf/H3_AP202508041721319524_1.pdf?1754321797000.pdf
港口行业专题报告：从财务指标出发看港口分红提升潜力,东兴证券,2025-08-03,航运港口,https://pdf.dfcfw.com/pdf/H3_AP202508031720593367_1.pdf?1754231117000.pdf
2025年港口行业分析,联合资信,2025-07-16,航运港口,https://pdf.dfcfw.com/pdf/H3_AP202507161709812338_1.pdf?1752657547000.pdf
航运港口2025年6月专题：集装箱吞吐量稳增，干散货吞吐量企稳,信达证券,2025-07-01,航运港口,https://pdf.dfcfw.com/pdf/H3_AP202507011701112118_1.pdf?1751402896000.pdf
跨境出海周度市场观察第23周,艾瑞股份,2025-06-13,航运港口,https://pdf.dfcfw.com/pdf/H3_AP202506131690129150_1.pdf?1749824210000.pdf
航运港口2025年5月专题：集装箱吞吐量增速稳健，散杂货吞吐量逐步企稳,信达证券,2025-06-11,航运港口,https://pdf.dfcfw.com/pdf/H3_AP202506111688729230_1.pdf?1749640815000.pdf
投资银行业务：航空服务行业动态,威廉博莱,2025-06-06,航运港口,https://pdf.dfcfw.com/pdf/H3_AP202506061685698506_1.pdf?1749202236000.pdf
2025年港口行业信用风险展望,东方金诚,2025-06-04,航运港口,https://pdf.dfcfw.com/pdf/H3_AP202506041684684121_1.pdf?1749053794000.pdf
航运船舶市场系列（十五）：OPEC+持续超预期增产，VLCC需求迎增量,华源证券,2025-05-08,航运港口,https://pdf.dfcfw.com/pdf/H3_AP202505081669482478_1.pdf?1746722906000.pdf
港口行业深度系列一：供应链陆海枢纽，格局趋稳重视红利,华源证券,2025-05-07,航运港口,https://pdf.dfcfw.com/pdf/H3_AP202505071668969032_1.pdf?1746646468000.pdf
航运港口2025年3月专题：集装箱吞吐量维持稳增，散杂货吞吐量阶段性承压,信达证券,2025-04-07,航运港口,https://pdf.dfcfw.com/pdf/H3_AP202504071652652793_1.pdf?1744020540000.pdf
长江和记海外港口资产交易点评：海外港口资产“高价”交易，关注价值重估,华源证券,2025-03-25,航运港口,https://pdf.dfcfw.com/pdf/H3_AP202503251647258427_1.pdf?1742909711000.pdf
