研报名称,机构名称,发布时间,行业,研报地址
机械行业周报：7月工程机械内外销景气持续，关注机器人、可控核聚变边际变化,上海证券,2025-08-14,通用设备,https://pdf.dfcfw.com/pdf/H3_AP202508141727393634_1.pdf?1755188869000.pdf
人形机器人行业观点报告：PEEK材料下游广泛应用于各高端场景，PEEK材料市场有望迎来快速增长,上海证券,2025-08-14,通用设备,https://pdf.dfcfw.com/pdf/H3_AP202508141727393621_1.pdf?1755189259000.pdf
爱建智能制造周报：2025世界机器人大会：人形机器人应用多元化全面提速,爱建证券,2025-08-13,通用设备,https://pdf.dfcfw.com/pdf/H3_AP202508131726823362_1.pdf?1755120156000.pdf
高端装备制造行业：工信部启动“智能制造标准领航行动”，标准化建设加速产业升级,国新证券股份,2025-08-13,通用设备,https://pdf.dfcfw.com/pdf/H3_AP202508131726825513_1.pdf?1755111116000.pdf
智慧养老设备：智能化、个性化引领养老设备产业新风向 头豹词条报告系列,头豹研究院,2025-08-13,通用设备,https://pdf.dfcfw.com/pdf/H3_AP202508131726856491_1.pdf?1755113853000.pdf
人形机器人行业事件点评：2025世界机器人大会顺利召开，看好人形机器人产业链,上海证券,2025-08-12,通用设备,https://pdf.dfcfw.com/pdf/H3_AP202508121725985451_1.pdf?1754993007000.pdf
机械行业月报：7月挖机内外销增速超预期；小松预计FY25全球需求微降,中国银河,2025-08-12,通用设备,https://pdf.dfcfw.com/pdf/H3_AP202508121726161627_1.pdf?1755017380000.pdf
人形机器人行业快评报告：世界机器人大会于北京亦庄开幕,万联证券,2025-08-12,通用设备,https://pdf.dfcfw.com/pdf/H3_AP202508121726184043_1.pdf?1755019944000.pdf
人形机器人行业周报-周观点：人形机器人产业端利好不断，持续关注人形机器人板块,上海证券,2025-08-12,通用设备,https://pdf.dfcfw.com/pdf/H3_AP202508121726212388_1.pdf?1755023559000.pdf
机器人行业周报：2025世界机器人大会召开，政策推动行业发展加速,西南证券,2025-08-11,通用设备,https://pdf.dfcfw.com/pdf/H3_AP202508111725497187_1.pdf?1755017280000.pdf
制造成长周报（第26期）：2025世界机器人大会开幕，多家企业发布人形机器人新品,国信证券,2025-08-11,通用设备,https://pdf.dfcfw.com/pdf/H3_AP202508111725505187_1.pdf?1754930448000.pdf
机器人大模型深度报告：我们距离真正的具身智能大模型还有多远？,东吴证券,2025-08-10,通用设备,https://pdf.dfcfw.com/pdf/H3_AP202508091724252221_1.pdf?1754816055000.pdf
机械设备行业跟踪周报：推荐高景气的工程机械和油服设备；关注人形机器人具身模型进展投资机会,东吴证券,2025-08-10,通用设备,https://pdf.dfcfw.com/pdf/H3_AP202508101724859899_1.pdf?1754836177000.pdf
具身智能行业研究：《上海市具身智能产业发展实施方案》发布，全天候自动驾驶加速落地,国金证券,2025-08-10,通用设备,https://pdf.dfcfw.com/pdf/H3_AP202508101724924571_1.pdf?1754847945000.pdf
机器人研究-机器人前瞻技术专题（一）：电机：高扭高温需求驱动，谐波磁场电机迎曙光,国金证券,2025-08-10,通用设备,https://pdf.dfcfw.com/pdf/H3_AP202508101724924598_1.pdf?1754850235000.pdf
中国空压机行业市场规模及行业分析,武汉问渠汇知信息科技,2025-08-10,通用设备,https://pdf.dfcfw.com/pdf/H3_AP202508101724987612_1.pdf?1754864388000.pdf
机械设备行业周报：尼得科：机器人旋转关节王者，国产合作伙伴迎来机遇,开源证券,2025-08-10,通用设备,https://pdf.dfcfw.com/pdf/H3_AP202508101725059869_1.pdf?1754863826000.pdf
机械设备行业简评：7月挖机内外销增速扩大，雅江水电站开工提振内需,东海证券,2025-08-10,通用设备,https://pdf.dfcfw.com/pdf/H3_AP202508091723975892_1.pdf?1754815246000.pdf
2025年中国人形机器人六维力传感器市场调研报告书,北京铂睿德佳信息服务,2025-08-08,通用设备,https://pdf.dfcfw.com/pdf/H3_AP202508081723543589_1.pdf?1754650536000.pdf
机械行业周报：6月工程机械出口额同增10.2%，关注可控核聚变、机器人板块,上海证券,2025-08-08,通用设备,https://pdf.dfcfw.com/pdf/H3_AP202508081723728778_1.pdf?1754666686000.pdf
机械设备行业2025Q2基金持仓分析报告：2025Q2机械设备行业基金重仓配置比例有所下降,万联证券,2025-08-08,通用设备,https://pdf.dfcfw.com/pdf/H3_AP202508081723799312_1.pdf?1754676808000.pdf
机械设备行业点评报告：《上海市具身智能产业发展实施方案》发布，助推产业迈向能力跃迁新阶段,东吴证券,2025-08-07,通用设备,https://pdf.dfcfw.com/pdf/H3_AP202508071722758274_1.pdf?1754549824000.pdf
人形机器人行业周报-周观点：人形机器人利好不断，持续关注人形机器人板块,上海证券,2025-08-07,通用设备,https://pdf.dfcfw.com/pdf/H3_AP202508071723033988_1.pdf?1754567753000.pdf
机械行业8月投资策略：中报行情展开，重点关注AI基建、人形机器人等成长板块,国信证券,2025-08-07,通用设备,https://pdf.dfcfw.com/pdf/H3_AP202508071723144556_1.pdf?1754583196000.pdf
机械设备行业制造成长周报（第25期）：国常会推进深入实施“人工智能+”行动，湖北设立百亿元人形机器人母基金,国信证券,2025-08-06,通用设备,https://pdf.dfcfw.com/pdf/H3_AP202508061722382578_1.pdf?1754473802000.pdf
机械设备行业深度研究：摩托车海外市场：十倍广袤待驰骋，品牌出海1→10开启加速,天风证券,2025-08-05,通用设备,https://pdf.dfcfw.com/pdf/H3_AP202508051721982201_1.pdf?1754415608000.pdf
低空经济行业双周报：各地低空配套政策陆续发布，沃兰特航空获海外17.5亿美金订单,西南证券,2025-08-05,通用设备,https://pdf.dfcfw.com/pdf/H3_AP202508041721258340_1.pdf?1754416732000.pdf
2025中国离散自动化（FA）市场白皮书,北京格物致胜咨询,2025-08-05,通用设备,https://pdf.dfcfw.com/pdf/H3_AP202508051721756242_1.pdf?1754386411000.pdf
2025中国自动化仪表行业市场白皮书,北京格物致胜咨询,2025-08-05,通用设备,https://pdf.dfcfw.com/pdf/H3_AP202508051721756243_1.pdf?1754387101000.pdf
核聚变系列报告—超导磁体：可控核聚变商业化加速实现，超导磁体未来应用前景广阔,中银证券,2025-08-05,通用设备,https://pdf.dfcfw.com/pdf/H3_AP202508051721773916_1.pdf?1754388042000.pdf
机械行业周报：出口稳中有升，低空稳步推进,国元证券,2025-08-05,通用设备,https://pdf.dfcfw.com/pdf/H3_AP202508051721807122_1.pdf?1754392106000.pdf
机械设备行业专题研究：锂电设备——从宏工、理奇、尚水招股书看锂电设备复苏、前段设备格局与固态电池布局,天风证券,2025-08-04,通用设备,https://pdf.dfcfw.com/pdf/H3_AP202508041721384818_1.pdf?1754329679000.pdf
机械设备行业周报：轻量化，机器人商业化落地必答题,开源证券,2025-08-04,通用设备,https://pdf.dfcfw.com/pdf/H3_AP202508031720910294_1.pdf?1754292778000.pdf
装备制造行业周报（8月第1周）：高效率光伏电池景气度上升,世纪证券,2025-08-04,通用设备,https://pdf.dfcfw.com/pdf/H3_AP202508041721146447_1.pdf?1754299030000.pdf
机械设备行业深度报告：机器人成为智能大会焦点，产业关注应用场景落地,开源证券,2025-08-04,通用设备,https://pdf.dfcfw.com/pdf/H3_AP202508041721292901_1.pdf?1754318001000.pdf
机器人行业周报：2025世界机器人大会即将开幕，逐级动力发布人形机器人新品,西南证券,2025-08-04,通用设备,https://pdf.dfcfw.com/pdf/H3_AP202508041721314802_1.pdf?1754319742000.pdf
智能制造行业周报：宇树科技加速产品降本与应用场景扩展,爱建证券,2025-08-04,通用设备,https://pdf.dfcfw.com/pdf/H3_AP202508041721344879_1.pdf?1754323940000.pdf
人形机器人产业周报：宇树联动巨星传奇、涛涛车业，合肥零次方完成融资,国元证券,2025-08-04,通用设备,https://pdf.dfcfw.com/pdf/H3_AP202508041721360289_1.pdf?1754326418000.pdf
机械设备行业跟踪周报：看好催化频出的固态电池设备和机器人行业；推荐估值低点景气向上的工程机械和半导体设备,东吴证券,2025-08-03,通用设备,https://pdf.dfcfw.com/pdf/H3_AP202508031720662363_1.pdf?1754224228000.pdf
机械设备行业跟踪报告：6月工业机器人产量同比延续高增长，服务机器人产量同比增速再提升,万联证券,2025-08-01,通用设备,https://pdf.dfcfw.com/pdf/H3_AP202508011719645657_1.pdf?1754074159000.pdf
人形机器人应用场景有望加速落地，基建项目支撑国内工程机械需求,东莞证券,2025-08-01,通用设备,https://pdf.dfcfw.com/pdf/H3_AP202508011719607961_1.pdf?1754068684000.pdf
工程机械行业2025年中期投资策略：内销筑底回升，出口韧性延续,东莞证券,2025-07-31,通用设备,https://pdf.dfcfw.com/pdf/H3_AP202507311718928496_1.pdf?1753972645000.pdf
2025年上半年机械制造行业信用风险总结及展望,联合资信,2025-07-30,通用设备,https://pdf.dfcfw.com/pdf/H3_AP202507301718191346_1.pdf?1753868633000.pdf
智能制造行业周报：如何从水电站全建设期，看工程机械投资节奏？,爱建证券,2025-07-30,通用设备,https://pdf.dfcfw.com/pdf/H3_AP202507301718480711_1.pdf?1753907277000.pdf
装备制造行业周报（7月第4周）：光伏组件报价短期上行,世纪证券,2025-07-28,通用设备,https://pdf.dfcfw.com/pdf/H3_AP202507281716978411_1.pdf?1753694111000.pdf
特斯拉业绩说明会有哪些重要更新？,中邮证券,2025-07-28,通用设备,https://pdf.dfcfw.com/pdf/H3_AP202507281717022968_1.pdf?1753698467000.pdf
特斯拉明确人形机器人量产预期，中美贸易谈判在即机械设备,信达证券,2025-07-28,通用设备,https://pdf.dfcfw.com/pdf/H3_AP202507281717126460_1.pdf?1753712935000.pdf
先进制造行业周报：宇树发布第三款人形机器人，优必选WalkerS2正式亮相,中航证券,2025-07-28,通用设备,https://pdf.dfcfw.com/pdf/H3_AP202507281717170215_1.pdf?1753720253000.pdf
机械设备行业制造成长周报（第24期）：上海举行2025世界人工智能大会，白宫发布AI行动计划,国信证券,2025-07-28,通用设备,https://pdf.dfcfw.com/pdf/H3_AP202507281717281162_1.pdf?1753734647000.pdf
机械设备行业跟踪周报：雅下项目托底内需，看好工程机械迎历史性机遇,东吴证券,2025-07-27,通用设备,https://pdf.dfcfw.com/pdf/H3_AP202507271716487964_1.pdf?1753619748000.pdf
机器人行业周报：2025世界人工智能大会召开，Optimus Gen-3预计明年量产,西南证券,2025-07-27,通用设备,https://pdf.dfcfw.com/pdf/H3_AP202507271716633806_1.pdf?1753641533000.pdf
机械行业2025Q2基金持仓分析：基金环比减配，配置集中度下降,中国银河,2025-07-25,通用设备,https://pdf.dfcfw.com/pdf/H3_AP202507251715242705_1.pdf?1753439258000.pdf
中东天然气设备深度报告：发电+能源转型加速中东天然气开发，中东装备出海正当时,东吴证券,2025-07-25,通用设备,https://pdf.dfcfw.com/pdf/H3_AP202507251715436417_1.pdf?1753465346000.pdf
人形机器人行业观点报告：看好宇树机器人产业链,上海证券,2025-07-24,通用设备,https://pdf.dfcfw.com/pdf/H3_AP202507241714645304_1.pdf?1753354020000.pdf
机械设备行业周报：上半年装备制造业蓬勃发展，关注后续稳增长方案,东海证券,2025-07-24,通用设备,https://pdf.dfcfw.com/pdf/H3_AP202507241714663267_1.pdf?1753354345000.pdf
可控核聚变行业动态点评：聚变公司在沪挂牌成立，我国可控核聚变发展进入新阶段,中银证券,2025-07-24,通用设备,https://pdf.dfcfw.com/pdf/H3_AP202507241714737625_1.pdf?1753365359000.pdf
高端装备制造行业：迈向全球创新增长极-上海高端装备产业发展蓝图发布,国新证券股份,2025-07-24,通用设备,https://pdf.dfcfw.com/pdf/H3_AP202507241714875638_1.pdf?1753384796000.pdf
机械行业周报：政策加码低空经济，工程机械持续增长,国元证券,2025-07-23,通用设备,https://pdf.dfcfw.com/pdf/H3_AP202507231713986625_1.pdf?1753257993000.pdf
工程机械行业动态：雅鲁藏布江下水电工程正式开工，关注上游设备投资机会,上海证券,2025-07-23,通用设备,https://pdf.dfcfw.com/pdf/H3_AP202507231714006975_1.pdf?1753259730000.pdf
人形机器人行业周报-周观点：人形机器人进展频出，持续关注人形机器人板块,上海证券,2025-07-23,通用设备,https://pdf.dfcfw.com/pdf/H3_AP202507231714044730_1.pdf?1753266243000.pdf
人形机器人行业观点报告：关注机器人万向节方向,上海证券,2025-07-23,通用设备,https://pdf.dfcfw.com/pdf/H3_AP202507231714044731_1.pdf?1753266345000.pdf
机械设备行业制造成长周报（第23期）：宇树科技开启上市辅导，黄仁勋称机器人将成AI下一波浪潮,国信证券,2025-07-22,通用设备,https://pdf.dfcfw.com/pdf/H3_AP202507221713491535_1.pdf?1753187343000.pdf
机械设备行业深度报告：宇树科技：从机器狗到人形机器人的中国范式，“科技顶流”开启新篇章,开源证券,2025-07-22,通用设备,https://pdf.dfcfw.com/pdf/H3_AP202507221713626528_1.pdf?1753204988000.pdf
机械设备行业周报：关注工程机械、叉车等板块投资机会,华龙证券,2025-07-22,通用设备,https://pdf.dfcfw.com/pdf/H3_AP202507221713638826_1.pdf?1753206318000.pdf
人形机器人行业专题研究周报：宇树开启上市辅导，优必选中标千万级大单,华龙证券,2025-07-22,通用设备,https://pdf.dfcfw.com/pdf/H3_AP202507221713638821_1.pdf?1753206397000.pdf
先进制造行业周报：机器人利好频出，商业化加速落地,中航证券,2025-07-21,通用设备,https://pdf.dfcfw.com/pdf/H3_AP202507201712520989_1.pdf?1753085856000.pdf
特斯拉新品蓄势待发,中邮证券,2025-07-21,通用设备,https://pdf.dfcfw.com/pdf/H3_AP202507211712920595_1.pdf?1753104788000.pdf
人形机器产业周报：智元携手德马科技展示作业，宇树开启IPO辅导,国元证券,2025-07-21,通用设备,https://pdf.dfcfw.com/pdf/H3_AP202507211712960828_1.pdf?1753111318000.pdf
工程机械行业跟踪点评：6月挖机内销同比增速回正，出口同环比双增,东莞证券,2025-07-21,通用设备,https://pdf.dfcfw.com/pdf/H3_AP202507211713015685_1.pdf?1753116804000.pdf
智能制造行业周报：宇树科技启动IPO辅导，机器人资本化进程再进一步,爱建证券,2025-07-21,通用设备,https://pdf.dfcfw.com/pdf/H3_AP202507211713033038_1.pdf?1753119085000.pdf
2025年中国智能养老设备白皮书：智能浪潮下，如何破解养老需求“密码”（精华版）,头豹研究院,2025-07-21,通用设备,https://pdf.dfcfw.com/pdf/H3_AP202507211713082538_1.pdf?1753126936000.pdf
人形机器人行业观点报告：看好机器人轻量化PEEK材料产业链,上海证券,2025-07-20,通用设备,https://pdf.dfcfw.com/pdf/H3_AP202507201712425569_1.pdf?1753033165000.pdf
机器人行业周报：宇树科技启动IPO，优必选Walker S2全球首个实现自主换电,西南证券,2025-07-20,通用设备,https://pdf.dfcfw.com/pdf/H3_AP202507201712358629_1.pdf?1753025346000.pdf
低空经济行业双周报：时的科技斩获350架海外订单，国际低空经济博览会召开在即,西南证券,2025-07-20,通用设备,https://pdf.dfcfw.com/pdf/H3_AP202507201712358627_1.pdf?1753025259000.pdf
机械设备行业跟踪周报：推荐AI投资加速利好的机器人&半导体设备&AIDC设备投资机会,东吴证券,2025-07-20,通用设备,https://pdf.dfcfw.com/pdf/H3_AP202507201712381248_1.pdf?1753029772000.pdf
