研报名称,机构名称,发布时间,行业,研报地址
低空经济行业双周报：《苏州市低空经济促进条例》正式施行，沃飞长空商业化再提速,西南证券,2025-10-13,通用设备,https://pdf.dfcfw.com/pdf/H3_AP202510131761323291_1.pdf?1760365656000.pdf
机器人行业周报：Figure 03发布，C端进一步突破,西南证券,2025-10-13,通用设备,https://pdf.dfcfw.com/pdf/H3_AP202510131761323302_1.pdf?1760365656000.pdf
机械设备行业跟踪周报：短期回调强推油服设备&锂电设备；重视半导体设备国产化率提高的历史性机遇,东吴证券,2025-10-12,通用设备,https://pdf.dfcfw.com/pdf/H3_AP202510121760794264_1.pdf?1760290571000.pdf
机械储能行业ESG白皮书,荣续ESG智库研究中心,2025-10-12,通用设备,https://pdf.dfcfw.com/pdf/H3_AP202510121760727672_1.pdf?1760285924000.pdf
机械设备行业简评：Figure03发布，感知能力升级,东海证券,2025-10-11,通用设备,https://pdf.dfcfw.com/pdf/H3_AP202510101759707098_1.pdf?1760166741000.pdf
机械设备行业点评报告：Figure 03发布，面向家居场景进一步迭代升级,东吴证券,2025-10-11,通用设备,https://pdf.dfcfw.com/pdf/H3_AP202510101759696984_1.pdf?1760166741000.pdf
机械行业10月投资策略暨三季报前瞻：三季报行情展开，把握AI基建、人形机器人等成长主线投资机会,国信证券,2025-10-10,通用设备,https://pdf.dfcfw.com/pdf/H3_AP202510101759592543_1.pdf?1760121260000.pdf
机械一周解一惑系列：全球AI数据指引视角，北美有望成为机器人率先落地市场,民生证券,2025-10-09,通用设备,https://pdf.dfcfw.com/pdf/H3_AP202510091759001590_1.pdf?1760037038000.pdf
机械设备行业十五五专题报告：AI时代，寻“机”智能,中国银河,2025-10-09,通用设备,https://pdf.dfcfw.com/pdf/H3_AP202510091758937133_1.pdf?1760028768000.pdf
无人环卫专题：商业化项目持续落地，行业迅速扩容,中邮证券,2025-10-07,通用设备,https://pdf.dfcfw.com/pdf/H3_AP202510071757487040_1.pdf?1759831748000.pdf
机械设备行业2025年半年报总结：业绩持续改善，AI+新技术孕育新机,中国银河,2025-10-07,通用设备,https://pdf.dfcfw.com/pdf/H3_AP202510071757683817_1.pdf?1759854076000.pdf
2025中国工业机器人行业白皮书,北京格物致胜咨询,2025-09-30,通用设备,https://pdf.dfcfw.com/pdf/H3_AP202509301753255046_1.pdf?1759228197000.pdf
智能制造行业周报：持续看好消费电子升级推动上游设备需求释放,爱建证券,2025-09-30,通用设备,https://pdf.dfcfw.com/pdf/H3_AP202509301753316331_1.pdf?1759237616000.pdf
机械设备行业制造成长周报（第30期）：英伟达计划最高投资OpenAI千亿美元，开普勒获得数亿人形订单,国信证券,2025-09-30,通用设备,https://pdf.dfcfw.com/pdf/H3_AP202509301753397661_1.pdf?1759244143000.pdf
机械设备行业简评：8月内外销持续增长，多款新能源及智能化产品亮相展会,东海证券,2025-09-30,通用设备,https://pdf.dfcfw.com/pdf/H3_AP202509301753397737_1.pdf?1759245251000.pdf
可控核聚变产业数据跟踪（一）：优先布局磁体系统供应商，把握CFEDR中长期机遇,爱建证券,2025-09-29,通用设备,https://pdf.dfcfw.com/pdf/H3_AP202509291752590250_1.pdf?1759133589000.pdf
丝杠专题：行星滚柱丝杠赋能汽车线控底盘,天风证券,2025-09-29,通用设备,https://pdf.dfcfw.com/pdf/H3_AP202509291752604233_1.pdf?1759136307000.pdf
装备制造行业周报（9月第4周）：工信部积极推进智能网联新能源汽车产业,世纪证券,2025-09-29,通用设备,https://pdf.dfcfw.com/pdf/H3_AP202509291752618656_1.pdf?1759138095000.pdf
机器人行业周报：阿里巴巴与英伟达达成Physical AI合作，工博会展示多家人形机器人,西南证券,2025-09-29,通用设备,https://pdf.dfcfw.com/pdf/H3_AP202509291752669520_1.pdf?1759145464000.pdf
人形机器人产业周报：宇树H2将推出新品，新时达人形机器人于海尔工厂完成部署,国元证券,2025-09-29,通用设备,https://pdf.dfcfw.com/pdf/H3_AP202509291752809277_1.pdf?1759163429000.pdf
机械设备行业快评报告：8月挖掘机和装载机销量同比双位数增长,万联证券,2025-09-29,通用设备,https://pdf.dfcfw.com/pdf/H3_AP202509291752841977_1.pdf?1759167598000.pdf
低空经济行业双周报：亿航智能联合Allur开拓中亚市场，头部厂商订单批量落地中,西南证券,2025-09-29,通用设备,https://pdf.dfcfw.com/pdf/H3_AP202509291752732407_1.pdf?1759154538000.pdf
机械设备行业跟踪周报：推荐AI设备（PCBS设备&耗材+碳化硅材料）；持续强推油服设备,东吴证券,2025-09-28,通用设备,https://pdf.dfcfw.com/pdf/H3_AP202509281752115221_1.pdf?1759070234000.pdf
机械行业：固态电池设备公司梳理,中邮证券,2025-09-26,通用设备,https://pdf.dfcfw.com/pdf/H3_AP202509261750815946_1.pdf?1758884138000.pdf
2025Q4机器人催化密集,东莞证券,2025-09-26,通用设备,https://pdf.dfcfw.com/pdf/H3_AP202509261750996694_1.pdf?1758906536000.pdf
海外零部件巨头系列七：住友电工：汽车线束巨头并购整合、全产业链协同,民生证券,2025-09-25,通用设备,https://pdf.dfcfw.com/pdf/H3_AP202509241749906731_1.pdf?1758785315000.pdf
人形机器人行业周报-周观点：机器人本体催化频出，持续关注人形机器人板块,上海证券,2025-09-24,通用设备,https://pdf.dfcfw.com/pdf/H3_AP202509241749575697_1.pdf?1758709138000.pdf
机械设备行业制造成长周报（第29期）：Figure融资超10亿美元，微软300亿美元投资英国AI基建,国信证券,2025-09-23,通用设备,https://pdf.dfcfw.com/pdf/H3_AP202509231749103140_1.pdf?1758643139000.pdf
2025深海科技产业链研究报告：科技赋能深蓝空间开发，万亿新兴产业扬帆起航,深企投产业研究(深圳),2025-09-22,通用设备,https://pdf.dfcfw.com/pdf/H3_AP202509211747938251_1.pdf?1758525339000.pdf
机械设备行业周报：Figure 390亿美金估值和马斯克“万亿美金薪酬计划”的背后：全球资本对机器人定价,开源证券,2025-09-22,通用设备,https://pdf.dfcfw.com/pdf/H3_AP202509221748077573_1.pdf?1758524717000.pdf
具身智能行业研究：辅助驾驶征求意见发布，Figure完成10亿美金融资,国金证券,2025-09-22,通用设备,https://pdf.dfcfw.com/pdf/H3_AP202509221748298692_1.pdf?1758532513000.pdf
机器人行业周报：华为云公布具身智能R2C协议，Figure再获超10亿美元融资,西南证券,2025-09-22,通用设备,https://pdf.dfcfw.com/pdf/H3_AP202509221748428917_1.pdf?1758553406000.pdf
机械设备2025年半年报业绩综述：行业整体业绩改善，关注细分赛道结构性机会,华龙证券,2025-09-22,通用设备,https://pdf.dfcfw.com/pdf/H3_AP202509221748557515_1.pdf?1758566705000.pdf
智能制造行业周报：消费电子AI化，看好检测设备景气上行,爱建证券,2025-09-22,通用设备,https://pdf.dfcfw.com/pdf/H3_AP202509221748578806_1.pdf?1758569792000.pdf
工程机械行业2025年半年报业绩综述：业绩持续改善，经营质量显著提升,华龙证券,2025-09-21,通用设备,https://pdf.dfcfw.com/pdf/H3_AP202509211747748076_1.pdf?1758453911000.pdf
机械设备行业跟踪周报：推荐非挖超预期确定向上的工程机械；国产算力芯片加速发展利好国产半导体设备,东吴证券,2025-09-21,通用设备,https://pdf.dfcfw.com/pdf/H3_AP202509211747952336_1.pdf?1758484712000.pdf
机械一周解一惑系列：AI驱动PCB设备需求提升,民生证券,2025-09-21,通用设备,https://pdf.dfcfw.com/pdf/H3_AP202509211747977947_1.pdf?1758490445000.pdf
大公国际：从“十四五”新型工业化发展成就看制造业企业信用根基重塑,大公国际资信评估,2025-09-21,通用设备,https://pdf.dfcfw.com/pdf/H3_AP202509211747845386_1.pdf?1758470329000.pdf
机械行业周报：工程机械板块景气延续，关注Optimus V3定型量产进度,上海证券,2025-09-19,通用设备,https://pdf.dfcfw.com/pdf/H3_AP202509191746540893_1.pdf?1758282396000.pdf
机械设备：摩托车行业2025年8月销售数据更新,天风证券,2025-09-18,通用设备,https://pdf.dfcfw.com/pdf/H3_AP202509181745829370_1.pdf?1758193525000.pdf
机械设备行业点评报告：沙特阿美拟三年启动85个重大项目，油服设备产业链有望受益,东吴证券,2025-09-18,通用设备,https://pdf.dfcfw.com/pdf/H3_AP202509181745915630_1.pdf?1758199337000.pdf
可控核聚变行业深度报告：能源领域终极畅享，行业卖铲人率先受益,中航证券,2025-09-18,通用设备,https://pdf.dfcfw.com/pdf/H3_AP202509181746164311_1.pdf?1758229468000.pdf
机械设备：无人叉车：智造升级引擎，物流变革新支点,天风证券,2025-09-17,通用设备,https://pdf.dfcfw.com/pdf/H3_AP202509171745215806_1.pdf?1758098188000.pdf
机械设备行业制造成长周报（第28期）：甲骨文RPO增至4550亿美元，特斯拉正敲定Optimus V3设计,国信证券,2025-09-17,通用设备,https://pdf.dfcfw.com/pdf/H3_AP202509171745472690_1.pdf?1758132234000.pdf
人形机器人产业周报：马斯克签订对赌协议，傅利叶GR-3人形机器人开启预售,国元证券,2025-09-16,通用设备,https://pdf.dfcfw.com/pdf/H3_AP202509161744591035_1.pdf?1758011295000.pdf
机器人行业周报（0908-0914）：特斯拉透露Optimus V2.5，再次强调灵巧手的重要性和难点,西南证券,2025-09-16,通用设备,https://pdf.dfcfw.com/pdf/H3_AP202509161744634867_1.pdf?1758016208000.pdf
船舶行业8月点评：新造船价格指数维持高位，南北船合并步入收官,东吴证券,2025-09-16,通用设备,https://pdf.dfcfw.com/pdf/H3_AP202509161744699817_1.pdf?1758026967000.pdf
机械设备行业点评报告：灵巧手： 特斯拉机器人迭代最重要的方向，量产落地的“最后一厘米”,开源证券,2025-09-16,通用设备,https://pdf.dfcfw.com/pdf/H3_AP202509161744721733_1.pdf?1758030343000.pdf
机械设备行业跟踪报告：7月工业机器人与服务机器人产量延续增长趋势,万联证券,2025-09-16,通用设备,https://pdf.dfcfw.com/pdf/H3_AP202509161744846206_1.pdf?1758045179000.pdf
一周解一惑系列：8.6代OLED产线建设加速，车载、IT等需求逐步释放,民生证券,2025-09-16,通用设备,https://pdf.dfcfw.com/pdf/H3_AP202509161744819230_1.pdf?1758041895000.pdf
智能制造行业周报：人形机器人加速渗透工业应用场景,爱建证券,2025-09-16,通用设备,https://pdf.dfcfw.com/pdf/H3_AP202509161744850163_1.pdf?1758045696000.pdf
机械行业周报：低空经济稳中有升，看好工程机械发展,国元证券,2025-09-16,通用设备,https://pdf.dfcfw.com/pdf/H3_AP202509161744919184_1.pdf?1758055669000.pdf
装备制造行业周报（9月第2周）：硅料景气度有所下行,世纪证券,2025-09-15,通用设备,https://pdf.dfcfw.com/pdf/H3_AP202509151743985983_1.pdf?1757926142000.pdf
低空经济行业双周报：各地国资陆续成立低空经济公司，小鹏汇天X3-F获阿联酋特许飞行证,西南证券,2025-09-15,通用设备,https://pdf.dfcfw.com/pdf/H3_AP202509151744089854_1.pdf?1757942814000.pdf
人形机器人行业周报-周观点：人形机器人板块催化不断，持续关注人形机器人板块,上海证券,2025-09-15,通用设备,https://pdf.dfcfw.com/pdf/H3_AP202509151744157494_1.pdf?1757950255000.pdf
人形机器人行业观点报告：看好乐聚机器人产业链,上海证券,2025-09-15,通用设备,https://pdf.dfcfw.com/pdf/H3_AP202509151744157496_1.pdf?1757950446000.pdf
机械行业9月投资策略：行情轮动，把握成长板块中有基本面业绩支撑、卡位好的标的,国信证券,2025-09-14,通用设备,https://pdf.dfcfw.com/pdf/H3_AP202509141743597009_1.pdf?1757871131000.pdf
机械设备行业周报：持续看好人形机器人、PCB设备和工程机械,信达证券,2025-09-14,通用设备,https://pdf.dfcfw.com/pdf/H3_AP202509141743680661_1.pdf?1757882453000.pdf
机械设备行业跟踪周报：持续推荐PCB设备进口替代逻辑；建议关注固态电池设备和人形机器人持续产业催化,东吴证券,2025-09-14,通用设备,https://pdf.dfcfw.com/pdf/H3_AP202509141743465921_1.pdf?1757854652000.pdf
机械设备行业双周报：8月挖机内销同环比双增，Optimus Gen3灵活度提升,东莞证券,2025-09-12,通用设备,https://pdf.dfcfw.com/pdf/H3_AP202509121742326817_1.pdf?1757688829000.pdf
人形机器人行业周报-周观点：人形机器人板块催化频出，持续关注人形机器人板块,上海证券,2025-09-11,通用设备,https://pdf.dfcfw.com/pdf/H3_AP202509111741641971_1.pdf?1757592697000.pdf
机械设备行业快评报告：7月挖掘机与装载机销量延续增长趋势,万联证券,2025-09-11,通用设备,https://pdf.dfcfw.com/pdf/H3_AP202509111741787545_1.pdf?1757612771000.pdf
先进制造行业周报：国内智算生态走向开放、开源，相关产业链或迎“安卓模式”创新征途,中航证券,2025-09-10,通用设备,https://pdf.dfcfw.com/pdf/H3_AP202509101741011100_1.pdf?1757496213000.pdf
机械设备行业简评：8月挖掘机内外销齐增长，半年报龙头盈利能力提升,东海证券,2025-09-09,通用设备,https://pdf.dfcfw.com/pdf/H3_AP202509091740636204_1.pdf?1757411751000.pdf
智能制造行业周报：半导体设备国产替代进程提速,爱建证券,2025-09-09,通用设备,https://pdf.dfcfw.com/pdf/H3_AP202509091740672489_1.pdf?1757422597000.pdf
机械行业周报：低空经济发展向好，工程机械稳步增长,国元证券,2025-09-09,通用设备,https://pdf.dfcfw.com/pdf/H3_AP202509091740778756_1.pdf?1757443192000.pdf
机械设备行业事项点评：AI硬件需求景气，关注PCB专用设备,信达证券,2025-09-08,通用设备,https://pdf.dfcfw.com/pdf/H3_AP202509081740257106_1.pdf?1757327432000.pdf
机器人行业周报：“机器狼”亮相陆上无人作战方队，优必选获2.5亿人形机器人订单,西南证券,2025-09-08,通用设备,https://pdf.dfcfw.com/pdf/H3_AP202509081740301285_1.pdf?1757342929000.pdf
机械设备行业点评报告：人形机器人：准备迎接Q4开启的大行情,开源证券,2025-09-08,通用设备,https://pdf.dfcfw.com/pdf/H3_AP202509081740351990_1.pdf?1757348126000.pdf
高端装备制造行业：美的全球首发智能体工厂，中国智造跃升定义者,国新证券股份,2025-09-08,通用设备,https://pdf.dfcfw.com/pdf/H3_AP202509081740395459_1.pdf?1757358786000.pdf
2025年具身智能产业链分析：从实验室到市场的商业化探索,头豹研究院,2025-09-08,通用设备,https://pdf.dfcfw.com/pdf/H3_AP202509081740408885_1.pdf?1757362665000.pdf
人口老龄化与劳动力结构化调整背景下，服务机器人行业趋势深度解读（精简版）,头豹研究院,2025-09-08,通用设备,https://pdf.dfcfw.com/pdf/H3_AP202509081740408903_1.pdf?1757362298000.pdf
机械设备行业跟踪周报：推荐PCB设备进口替代&技术迭代&景气扩张逻辑；推荐固态电池设备产业化加速,东吴证券,2025-09-07,通用设备,https://pdf.dfcfw.com/pdf/H3_AP202509071739927724_1.pdf?1757253870000.pdf
人形机器人行业周报-周观点：人形机器人产业链催化不断，持续关注人形机器人板块,上海证券,2025-09-07,通用设备,https://pdf.dfcfw.com/pdf/H3_AP202509071740046464_1.pdf?1757278847000.pdf
机械设备行业2025半年报业绩综述：出口加速助发展，科技成长迎突破,东莞证券,2025-09-05,通用设备,https://pdf.dfcfw.com/pdf/H3_AP202509051739198903_1.pdf?1757084523000.pdf
中国通用机械出海国别机会洞察报告：发动机、空压机、发电机产品,亿欧智库,2025-09-04,通用设备,https://pdf.dfcfw.com/pdf/H3_AP202509041738768766_1.pdf?1756992561000.pdf
高端装备制造行业：四川高端装备“1+N”行动方案出台，掘金国产替代与新赛道机遇,国新证券股份,2025-09-04,通用设备,https://pdf.dfcfw.com/pdf/H3_AP202509041738805022_1.pdf?1756997054000.pdf
机械行业周报：工程机械板块景气延续，关注半导体设备、人形机器人板块,上海证券,2025-09-03,通用设备,https://pdf.dfcfw.com/pdf/H3_AP202509031738372646_1.pdf?1756902415000.pdf
机械设备行业点评报告：大阅兵即将举行，无人智能倍受关注,开源证券,2025-09-02,通用设备,https://pdf.dfcfw.com/pdf/H3_AP202509011737776604_1.pdf?1756796379000.pdf
2025数控机床市场简析报告,上海嘉世营销咨询,2025-09-02,通用设备,https://pdf.dfcfw.com/pdf/H3_AP202509021737934540_1.pdf?1756804471000.pdf
装备制造行业周报（8月第5周）：关注欧洲逆变器市场趋势向好,世纪证券,2025-09-01,通用设备,https://pdf.dfcfw.com/pdf/H3_AP202509011737545182_1.pdf?1756716420000.pdf
先进制造行业周报：华为鸿蒙生态迈向新阶段，9月全球发布会助力生态扩张,中航证券,2025-09-01,通用设备,https://pdf.dfcfw.com/pdf/H3_AP202509011737555631_1.pdf?1756724720000.pdf
低空经济行业双周报（0818-0831）：合肥18.6亿低空经济专项债落地，沃兰特再获120架eVTOL订单,西南证券,2025-09-01,通用设备,https://pdf.dfcfw.com/pdf/H3_AP202509011737597562_1.pdf?1756726882000.pdf
机器人行业周报（0825-0831）：NVIDIA Jetson Thor正式发售，推动通用机器人大脑进化,西南证券,2025-09-01,通用设备,https://pdf.dfcfw.com/pdf/H3_AP202509011737597564_1.pdf?1756726998000.pdf
人形机器人产业周报：国务院发布深入实施“人工智能+”行动的意见，英伟达推出Jetson Thor,国元证券,2025-09-01,通用设备,https://pdf.dfcfw.com/pdf/H3_AP202509011737682636_1.pdf?1756746091000.pdf
人形机器人行业观点报告：全球特种机器人产业快速发展，中国特种机器人市场规模不断扩大,上海证券,2025-08-31,通用设备,https://pdf.dfcfw.com/pdf/H3_AP202508311737285916_1.pdf?1756658968000.pdf
看好人形机器人、PCB设备和业绩兑现板块机械设备,信达证券,2025-08-31,通用设备,https://pdf.dfcfw.com/pdf/H3_AP202508311737394707_1.pdf?1756684348000.pdf
机械设备行业跟踪周报：强推PCB设备高景气投资机会；推荐业绩兑现低估值高增速的工程机械,东吴证券,2025-08-31,通用设备,https://pdf.dfcfw.com/pdf/H3_AP202508311737244464_1.pdf?1756647542000.pdf
3D打印（增材制造）行业专题报告：工业消费双驱动，多领域仍有海量空间,东莞证券,2025-08-29,通用设备,https://pdf.dfcfw.com/pdf/H3_AP202508291736413939_1.pdf?1756478810000.pdf
机械设备行业双周报：关注工程机械电动化及机器人技术发展,东莞证券,2025-08-29,通用设备,https://pdf.dfcfw.com/pdf/H3_AP202508291736474001_1.pdf?1756487824000.pdf
机械设备行业周报：美元降息预期增强，建议关注出口链、人形机器人,上海证券,2025-08-28,通用设备,https://pdf.dfcfw.com/pdf/H3_AP202508281735880559_1.pdf?1756379240000.pdf
人形机器人行业观点报告：看好富士康机器人产业链,上海证券,2025-08-28,通用设备,https://pdf.dfcfw.com/pdf/H3_AP202508281735972819_1.pdf?1756393569000.pdf
机械设备行业简评：7月内外销均实现双位数增长，国内龙头海外销量创新高,东海证券,2025-08-27,通用设备,https://pdf.dfcfw.com/pdf/H3_AP202508271735496032_1.pdf?1756324728000.pdf
人形机器人产业周报：智元机器人全系产品正式开售，关注宇树新品发布,国元证券,2025-08-26,通用设备,https://pdf.dfcfw.com/pdf/H3_AP202508261734553556_1.pdf?1756193431000.pdf
人形机器人行业周报：周观点，人形机器人板块利好不断，持续关注人形机器人板块,上海证券,2025-08-26,通用设备,https://pdf.dfcfw.com/pdf/H3_AP202508261734736061_1.pdf?1756217269000.pdf
机械行业周报：持续看好出口，低空储备人才,国元证券,2025-08-26,通用设备,https://pdf.dfcfw.com/pdf/H3_AP202508261734799160_1.pdf?1756226435000.pdf
先进制造行业周报：智元预计明年出货量数万台，天太机器人to C应用取得重大突破,中航证券,2025-08-25,通用设备,https://pdf.dfcfw.com/pdf/H3_AP202508251733949929_1.pdf?1756118225000.pdf
装备制造行业周报（8月第4周）：7月工程机械出口增速提升,世纪证券,2025-08-25,通用设备,https://pdf.dfcfw.com/pdf/H3_AP202508251733943324_1.pdf?1756113214000.pdf
机器人行业周报：智元机器人举办首届合作伙伴大会，宇树发布新款机器人预告,西南证券,2025-08-25,通用设备,https://pdf.dfcfw.com/pdf/H3_AP202508251734087613_1.pdf?1756129521000.pdf
人形机器人行业观点报告：人形机器人有望打开摆线针轮减速器应用空间,上海证券,2025-08-25,通用设备,https://pdf.dfcfw.com/pdf/H3_AP202508251734104823_1.pdf?1756131616000.pdf
智能制造周报：物理AI有望开启万亿美元市场空间,爱建证券,2025-08-25,通用设备,https://pdf.dfcfw.com/pdf/H3_AP202508251734292836_1.pdf?1756155283000.pdf
机械设备行业跟踪周报：看好业绩持续兑现的工程机械&油服设备；推荐PCB设备高景气&进口替代&技术迭代逻辑,东吴证券,2025-08-24,通用设备,https://pdf.dfcfw.com/pdf/H3_AP202508241733578850_1.pdf?1756058108000.pdf
机械设备行业制造成长周报（第27期）：全球首个人形机器人运动会开幕，OpenAI拟筹划万亿级AI基建,国信证券,2025-08-21,通用设备,https://pdf.dfcfw.com/pdf/H3_AP202508211731502081_1.pdf?1755765719000.pdf
2025全球无人机清洗系统市场应用发展白皮书,亿欧智库,2025-08-21,通用设备,https://pdf.dfcfw.com/pdf/H3_AP202508211731630909_1.pdf?1755785686000.pdf
工程机械行业跟踪点评：7月挖机内外销同比双增，重大工程有效拉动需求,东莞证券,2025-08-21,通用设备,https://pdf.dfcfw.com/pdf/H3_AP202508211731734641_1.pdf?1755797245000.pdf
机械设备行业专题报告：深海科技，下一个国家级战略主线,华源证券,2025-08-21,通用设备,https://pdf.dfcfw.com/pdf/H3_AP202508201731246752_1.pdf?1755760048000.pdf
机械设备行业行业点评报告：210组动车招标落地，持续看好铁路装备,中国银河,2025-08-20,通用设备,https://pdf.dfcfw.com/pdf/H3_AP202508201730907785_1.pdf?1755683224000.pdf
机械行业周报：7月工程机械销量整体表现亮眼，世界机器人运动大会在京成功召开,上海证券,2025-08-20,通用设备,https://pdf.dfcfw.com/pdf/H3_AP202508201730917182_1.pdf?1755683932000.pdf
机械行业周报：机械出口增长稳健，低空经济政策托底,国元证券,2025-08-20,通用设备,https://pdf.dfcfw.com/pdf/H3_AP202508201731036398_1.pdf?1755701116000.pdf
摩托车行业2025年7月销售数据更新,天风证券,2025-08-20,通用设备,https://pdf.dfcfw.com/pdf/H3_AP202508201731079366_1.pdf?1755707231000.pdf
人形机器人行业周报-周观点：人形机器人产业端催化不断，持续关注人形机器人板块,上海证券,2025-08-20,通用设备,https://pdf.dfcfw.com/pdf/H3_AP202508201731127590_1.pdf?1755712539000.pdf
人形机器人行业观点报告：MIM工艺受益于人形机器人等高端制造行业或迎来蓝海市场,上海证券,2025-08-20,通用设备,https://pdf.dfcfw.com/pdf/H3_AP202508201731127603_1.pdf?1755712640000.pdf
3C行业2025年H1趋势分析,北京击壤科技,2025-08-19,通用设备,https://pdf.dfcfw.com/pdf/H3_AP202508191730246548_1.pdf?1755592823000.pdf
智能制造周报：宇树机器人运动会表现突出，硬件自研与产业链协同优势凸显,爱建证券,2025-08-19,通用设备,https://pdf.dfcfw.com/pdf/H3_AP202508191730342268_1.pdf?1755609213000.pdf
机械设备行业点评报告：覆铜板涨价映射PCB行业景气度高，看好设备端资本开支延续性,东吴证券,2025-08-18,通用设备,https://pdf.dfcfw.com/pdf/H3_AP202508181729899559_1.pdf?1755541609000.pdf
装备制造行业周报（8月第3周）：关注光伏政策落地,世纪证券,2025-08-18,通用设备,https://pdf.dfcfw.com/pdf/H3_AP202508181729637756_1.pdf?1755507120000.pdf
机器人行业周报：宇树机器人运动会已斩获3枚金牌，京东宣布智能机器人领域投入超百亿,西南证券,2025-08-18,通用设备,https://pdf.dfcfw.com/pdf/H3_AP202508181729746003_1.pdf?1755522758000.pdf
低空经济行业双周报：各地陆续发布低空经济发展规划，Joby加速构建空中出租车网络,西南证券,2025-08-18,通用设备,https://pdf.dfcfw.com/pdf/H3_AP202508181729746004_1.pdf?1755522881000.pdf
机械设备行业点评报告：视触觉传感：特斯拉灵巧手“最后一块拼图”,开源证券,2025-08-18,通用设备,https://pdf.dfcfw.com/pdf/H3_AP202508181729768327_1.pdf?1755525466000.pdf
关注科技成长方向和低估值板块修复机会机械设备,信达证券,2025-08-17,通用设备,https://pdf.dfcfw.com/pdf/H3_AP202508171729288473_1.pdf?1755456039000.pdf
机械设备行业跟踪周报：持续推荐内外需共振的工程机械和叉车；看好PCB设备和人形机器人景气向上机会,东吴证券,2025-08-17,通用设备,https://pdf.dfcfw.com/pdf/H3_AP202508171729155024_1.pdf?1755439845000.pdf
机械设备行业周报：金融支持新型工业化，人形机器人运动会促进行业交流,东海证券,2025-08-16,通用设备,https://pdf.dfcfw.com/pdf/H3_AP202508161728239384_1.pdf?1755306004000.pdf
机械设备行业点评报告：算力需求上行+新工艺涌现，看好PCB设备需求持续向好,东吴证券,2025-08-15,通用设备,https://pdf.dfcfw.com/pdf/H3_AP202508151727907608_1.pdf?1755261054000.pdf
机械设备行业简评：创新成果亮相展会，机器人产业加速场景落地,东海证券,2025-08-15,通用设备,https://pdf.dfcfw.com/pdf/H3_AP202508151727932473_1.pdf?1755264823000.pdf
机械设备行业双周报：7月挖机销量呈淡季不淡趋势,东莞证券,2025-08-15,通用设备,https://pdf.dfcfw.com/pdf/H3_AP202508151728007667_1.pdf?1755273432000.pdf
