研报名称,机构名称,发布时间,行业,研报地址
机械行业2026年1月投资策略：看好人形机器人、AI基建及商业航天板块的成长性机会,国信证券,2026-01-15,通用设备,https://pdf.dfcfw.com/pdf/H3_AP202601151817033672_1.pdf?1768467518000.pdf
高端装备制造产业研究周报：上纬启元Q1正式亮相，宇树与腾讯战略合作落地,国金证券,2026-01-14,通用设备,https://pdf.dfcfw.com/pdf/H3_AP202601141817000409_1.pdf?1768378670000.pdf
人形机器人产业周报：小鹏今年将规模量产人形机器人，新剑传动冲刺IPO,国元证券,2026-01-14,通用设备,https://pdf.dfcfw.com/pdf/H3_AP202601141817000428_1.pdf?1768378750000.pdf
2025年中激光加工设备行业研究报告,硕远咨询,2026-01-14,通用设备,https://pdf.dfcfw.com/pdf/H3_AP202601141817004064_1.pdf?1768384964000.pdf
制造成长周报（第42期）：中国新增20万颗卫星申请，Meta达成数GW数据中心核能供电协议,国信证券,2026-01-14,通用设备,https://pdf.dfcfw.com/pdf/H3_AP202601141817018588_1.pdf?1768414873000.pdf
装备制造行业周报（1月第1周）：光伏产业重心转向高质量发展,世纪证券,2026-01-13,通用设备,https://pdf.dfcfw.com/pdf/H3_AP202601131816971558_1.pdf?1768307577000.pdf
高端制造业：技术升级、产业重构与发展路径研究,先见AI,2026-01-13,通用设备,https://pdf.dfcfw.com/pdf/H3_AP202601131816972344_1.pdf?1768318148000.pdf
机械设备行业周报：《“人工智能+制造”专项行动实施意见》发布，多家中国企业亮相CES展会,东海证券,2026-01-13,通用设备,https://pdf.dfcfw.com/pdf/H3_AP202601131816978609_1.pdf?1768320781000.pdf
磁力重构未来——透视变压器行业高增长背后的政策红利与技术升级逻辑 头豹词条报告系列,头豹研究院,2026-01-13,通用设备,https://pdf.dfcfw.com/pdf/H3_AP202601131816986568_1.pdf?1768333422000.pdf
工程机械行业月报：挖机内外销：12月+10.9%_+26.9%，25年+18%_+16%,中国银河,2026-01-12,通用设备,https://pdf.dfcfw.com/pdf/H3_AP202601121816925076_1.pdf?1768201948000.pdf
机械设备行业周报：新剑传动启动上市辅导，特斯拉供应链核心资产迎来价值重估,开源证券,2026-01-12,通用设备,https://pdf.dfcfw.com/pdf/H3_AP202601121816931087_1.pdf?1768206147000.pdf
机械设备行业周报：商业航天加速发展，AI基建景气持续,信达证券,2026-01-12,通用设备,https://pdf.dfcfw.com/pdf/H3_AP202601121816932424_1.pdf?1768208646000.pdf
机器人行业周报：机器人本体企业加速上市，波士顿动力发布新一代Atlas,西南证券,2026-01-12,通用设备,https://pdf.dfcfw.com/pdf/H3_AP202601121816939249_1.pdf?1768228699000.pdf
高端装备制造行业产业研究深度：人形机器人产业趋势展望,国金证券,2026-01-11,通用设备,https://pdf.dfcfw.com/pdf/H3_AP202601111816916770_1.pdf?1768137641000.pdf
机械设备行业跟踪周报：推荐光伏设备的太空算力机遇；看好液冷&光模块设备高增速快迭代机会,东吴证券,2026-01-11,通用设备,https://pdf.dfcfw.com/pdf/H3_AP202601111816917177_1.pdf?1768138053000.pdf
燃气轮机行业报告（一）：数据中心用电需求激增，燃气轮机供不应求,西南证券,2026-01-11,通用设备,https://pdf.dfcfw.com/pdf/H3_AP202601111816918360_1.pdf?1768146696000.pdf
商业航天系列专题之卫星篇（1）：梳理中国星座计划,中邮证券,2026-01-09,通用设备,https://pdf.dfcfw.com/pdf/H3_AP202601091816876229_1.pdf?1767970327000.pdf
燃气轮机专题报告：行业高景气&供需错配，看好国产集成&零部件供应商优先受益,东吴证券,2026-01-09,通用设备,https://pdf.dfcfw.com/pdf/H3_AP202601091816881457_1.pdf?1767980109000.pdf
人形机器人产业周报：稚晖君发布启元Q1，新时达发布轮式工规级机器人,国元证券,2026-01-07,通用设备,https://pdf.dfcfw.com/pdf/H3_AP202601071816615280_1.pdf?1767791197000.pdf
机械行业周报：出口稳步增长，低空加速发展,国元证券,2026-01-07,通用设备,https://pdf.dfcfw.com/pdf/H3_AP202601071816727538_1.pdf?1767799616000.pdf
机械设备行业周报：部分出口链公司发布年报预增公告,东海证券,2026-01-07,通用设备,https://pdf.dfcfw.com/pdf/H3_AP202601071816730485_1.pdf?1767799927000.pdf
企业报告：2025年汇川技术企业分析：工控领域龙头，产品及盈利能力优势保障增长,头豹研究院,2026-01-07,通用设备,https://pdf.dfcfw.com/pdf/H3_AP202601071816823002_1.pdf?1767817988000.pdf
机械设备行业2026年度策略：聚焦科技成长，掘金智造新纪元,中银证券,2026-01-06,通用设备,https://pdf.dfcfw.com/pdf/H3_AP202601061815913429_1.pdf?1767695345000.pdf
机械设备行业周报：马斯克宏图的下一个篇章，脑机接口，2026年将启动大规模量产，有望解锁人机协同终极形态,开源证券,2026-01-05,通用设备,https://pdf.dfcfw.com/pdf/H3_AP202601051815150154_1.pdf?1767599817000.pdf
商业航天专题：商业火箭运力如“算力”，看好火箭铲子股及新技术,国金证券,2026-01-05,通用设备,https://pdf.dfcfw.com/pdf/H3_AP202601051815159241_1.pdf?1767601375000.pdf
低空经济行业双周报：新修订的《民用航空法》正式发布，国家创业投资引导基金赋能低空经济,西南证券,2026-01-05,通用设备,https://pdf.dfcfw.com/pdf/H3_AP202601051815410903_1.pdf?1767632130000.pdf
机器人行业周报：上纬启元发布小尺寸人形机器人启元Q1，哈工大联合博实股份发布人形机器人最新成果,西南证券,2026-01-05,通用设备,https://pdf.dfcfw.com/pdf/H3_AP202601051815411235_1.pdf?1767632326000.pdf
机械设备行业制造成长周报（第41期）：软银完成对Open AI的400亿美元投资，蓝箭航天IPO获受理,国信证券,2026-01-05,通用设备,https://pdf.dfcfw.com/pdf/H3_AP202601051815473220_1.pdf?1767639605000.pdf
2025人形机器人行业白皮书：躯体觉醒，叩响具身智能纪元奇点,华夏幸福,2026-01-04,通用设备,https://pdf.dfcfw.com/pdf/H3_AP202601041814491111_1.pdf?1767519370000.pdf
2025年中国人形机器人腱绳行业概览：钨丝绳PK超高分子量聚乙烯纤维，谁主沉浮？,头豹研究院,2026-01-04,通用设备,https://pdf.dfcfw.com/pdf/H3_AP202601041814804782_1.pdf?1767560723000.pdf
机械设备行业跟踪周报：看好半导体设备高景气&国产化率提高历史性机遇；推荐催化加速落地的人形机器人,东吴证券,2026-01-04,通用设备,https://pdf.dfcfw.com/pdf/H3_AP202601041814860508_1.pdf?1767562382000.pdf
2026年世界制造业发展形势展望,赛迪智库电子信息研究所,2025-12-31,通用设备,https://pdf.dfcfw.com/pdf/H3_AP202512311811776106_1.pdf?1767173520000.pdf
智体觉醒：中国人形机器人理论重构与范式跃迁,NotebookLM,2025-12-31,通用设备,https://pdf.dfcfw.com/pdf/H3_AP202512311811814947_1.pdf?1767178932000.pdf
制冷设备行业2026年度投资策略：产业并购活跃，布局全球化与前沿冷却技术,东海证券,2025-12-31,通用设备,https://pdf.dfcfw.com/pdf/H3_AP202512301811515362_1.pdf?1767167118000.pdf
高端装备制造产业研究周报：人形机器人标委会成立，优必选16亿收购锋龙股份,国金证券,2025-12-31,通用设备,https://pdf.dfcfw.com/pdf/H3_AP202512311812026029_1.pdf?1767199969000.pdf
人形机器人行业跟踪点评：量产元年，海内外共振,中国银河,2025-12-31,通用设备,https://pdf.dfcfw.com/pdf/H3_AP202512311812067532_1.pdf?1767204696000.pdf
机械设备行业：持续看好人形机器人、AI基建及工程机械,信达证券,2025-12-30,通用设备,https://pdf.dfcfw.com/pdf/H3_AP202512301811068381_1.pdf?1767080763000.pdf
机械设备行业点评报告：技术进化的2025，走向量产的2026，人形机器人“黄金十年”启幕,开源证券,2025-12-30,通用设备,https://pdf.dfcfw.com/pdf/H3_AP202512301811074286_1.pdf?1767081567000.pdf
人形机器人产业周报：优必选再中标近6000万项目，云深处科技启动IPO辅导,国元证券,2025-12-30,通用设备,https://pdf.dfcfw.com/pdf/H3_AP202512301811281230_1.pdf?1767107491000.pdf
机械设备行业制造成长周报（第40期）：工信部人形机器人与具身智能标准化技术委员会成立，字节计划2026年斥资230亿美元投资人工智能,国信证券,2025-12-30,通用设备,https://pdf.dfcfw.com/pdf/H3_AP202512301811361427_1.pdf?1767116647000.pdf
机器人行业周报：人形机器人与具身智能标委会成立，优必选收购锋龙股份,西南证券,2025-12-29,通用设备,https://pdf.dfcfw.com/pdf/H3_AP202512291810491492_1.pdf?1767008927000.pdf
人形机器人行业专题研究周报：优必选或将A+H上市，云深处正式启动IPO,华龙证券,2025-12-29,通用设备,https://pdf.dfcfw.com/pdf/H3_AP202512291810568364_1.pdf?1767018727000.pdf
2026年机械行业投资策略：拥抱制造强国大时代,诚通证券,2025-12-29,通用设备,https://pdf.dfcfw.com/pdf/H3_AP202512291810704488_1.pdf?1767035023000.pdf
高端装备制造产业研究深度：灵巧手：结构向高承载发展，四缸数量或倍增,国金证券,2025-12-28,通用设备,https://pdf.dfcfw.com/pdf/H3_AP202512281809747496_1.pdf?1766916178000.pdf
机械设备行业事项点评：AIDC景气度带来燃机发展机遇，关注赛道竞争优势企业,信达证券,2025-12-28,通用设备,https://pdf.dfcfw.com/pdf/H3_AP202512281809783097_1.pdf?1766920890000.pdf
机械设备深度报告：钻石散热专题-高效散热材料，商业化进程持续推进,中邮证券,2025-12-28,通用设备,https://pdf.dfcfw.com/pdf/H3_AP202512281809913319_1.pdf?1766935531000.pdf
机械设备行业跟踪周报：推荐工程机械开门红机遇；持续推荐燃气轮机&光模块设备,东吴证券,2025-12-28,通用设备,https://pdf.dfcfw.com/pdf/H3_AP202512281809879538_1.pdf?1766931014000.pdf
机械设备行业简评：11月叉车销量内销大增，国内龙头全球化持续渗透,东海证券,2025-12-26,通用设备,https://pdf.dfcfw.com/pdf/H3_AP202512261808230243_1.pdf?1766733632000.pdf
机械行业研究：科技自强、出海深化,国金证券,2025-12-26,通用设备,https://pdf.dfcfw.com/pdf/H3_AP202512261808510396_1.pdf?1766756384000.pdf
加强关注机器人板块回调机遇,东莞证券,2025-12-26,通用设备,https://pdf.dfcfw.com/pdf/H3_AP202512261808623451_1.pdf?1766770290000.pdf
机械设备行业点评报告：算力服务器出货高增拉动光模块需求，海外扩产自动化设备成为必选项,东吴证券,2025-12-25,通用设备,https://pdf.dfcfw.com/pdf/H3_AP202512251807878590_1.pdf?1766676639000.pdf
2025年中国船用发动机研究报告：碳中和背景下的船用发动机产业观察,头豹研究院,2025-12-25,通用设备,https://pdf.dfcfw.com/pdf/H3_AP202512251807999192_1.pdf?1766691427000.pdf
装备制造行业周报（12月第3周）：工程机械11月内外销均持续增长,世纪证券,2025-12-24,通用设备,https://pdf.dfcfw.com/pdf/H3_AP202512241807051373_1.pdf?1766572769000.pdf
机械设备行业2026年投资策略报告：把握“AI+机器人”成长主线与低估值全球化的投资机遇,华龙证券,2025-12-24,通用设备,https://pdf.dfcfw.com/pdf/H3_AP202512241806985300_1.pdf?1766564695000.pdf
机械行业周报：出口稳健增长，低空稳步发展,国元证券,2025-12-24,通用设备,https://pdf.dfcfw.com/pdf/H3_AP202512241807221660_1.pdf?1766594288000.pdf
2025年中国机器人行业洞察：人机协奏新篇章：AI驱动下的机器人产业新范式,头豹研究院,2025-12-24,通用设备,https://pdf.dfcfw.com/pdf/H3_AP202512241807309227_1.pdf?1766605603000.pdf
机械设备行业点评报告：“结构件”与“手套”：特斯拉Optimus机器人轻量化的“关键一环”,开源证券,2025-12-23,通用设备,https://pdf.dfcfw.com/pdf/H3_AP202512231806281726_1.pdf?1766477023000.pdf
机械设备行业制造成长周报（第39期）：何小鹏称人形机器人是巨头竞争，持续关注AI基建燃机及液冷投资机会,国信证券,2025-12-23,通用设备,https://pdf.dfcfw.com/pdf/H3_AP202512231806384143_1.pdf?1766489604000.pdf
新能源智造行业行业周报：具身智能产业链跟踪（27）-银河通用官宣完成3亿美元融资,中国银河,2025-12-23,通用设备,https://pdf.dfcfw.com/pdf/H3_AP202512231806377149_1.pdf?1766503785000.pdf
人形机器人行业专题研究周报：银河通用完成3亿美元融资，智元组建机器人租赁平台,华龙证券,2025-12-23,通用设备,https://pdf.dfcfw.com/pdf/H3_AP202512231806524433_1.pdf?1766507598000.pdf
低空经济系列报告一：农业无人机：智慧农业新引擎，制造出海新名片,西南证券,2025-12-23,通用设备,https://pdf.dfcfw.com/pdf/H3_AP202512231806561419_1.pdf?1766514455000.pdf
2025年中国流体控制设备白皮书：国产企业崛起，市场迎来新机遇,头豹研究院,2025-12-23,通用设备,https://pdf.dfcfw.com/pdf/H3_AP202512231806615698_1.pdf?1766519003000.pdf
机械设备行业点评报告：银河通用完成新一轮3亿美元融资，重视模型端推动机器人产业化加速,东吴证券,2025-12-22,通用设备,https://pdf.dfcfw.com/pdf/H3_AP202512221805644933_1.pdf?1766397053000.pdf
低空经济行业双周报：地方“十五五”规划陆续发布，推动低空经济多路径发展,西南证券,2025-12-22,通用设备,https://pdf.dfcfw.com/pdf/H3_AP202512221805745520_1.pdf?1766409642000.pdf
2025年中国机器狗行业概览：智能四足新时代，国产机器狗能否引领全球竞赛？（精华版）,头豹研究院,2025-12-22,通用设备,https://pdf.dfcfw.com/pdf/H3_AP202512221805927010_1.pdf?1766432254000.pdf
机器人行业周报：逐际动力推出具身机器人TRON 2，实现一机三态,西南证券,2025-12-22,通用设备,https://pdf.dfcfw.com/pdf/H3_AP202512221805745904_1.pdf?1766409718000.pdf
机械设备行业周报：关注半导体设备、人形机器人、核聚变及工程机械,华龙证券,2025-12-22,通用设备,https://pdf.dfcfw.com/pdf/H3_AP202512221805880858_1.pdf?1766426201000.pdf
机械设备行业跟踪周报：持续推荐AI+的液冷和PCB设备；银河通用成功融资建议关注人形机器人模型端进展加速,东吴证券,2025-12-21,通用设备,https://pdf.dfcfw.com/pdf/H3_AP202512211805041409_1.pdf?1766321293000.pdf
装备制造行业周报（12月第2周）：硅料平台公司成立稳定市场预期,世纪证券,2025-12-20,通用设备,https://pdf.dfcfw.com/pdf/H3_AP202512191803990640_1.pdf?1766222794000.pdf
中国工业机器人行业研究报告,大公国际资信评估,2025-12-19,通用设备,https://pdf.dfcfw.com/pdf/H3_AP202512191803574661_1.pdf?1766137423000.pdf
人形机器人动力之源，电机应用要求与变革方向,华鑫证券,2025-12-19,通用设备,https://pdf.dfcfw.com/pdf/H3_AP202512191803622430_1.pdf?1766140055000.pdf
机械设备行业点评报告：维谛华东研发制造基地落地，龙头扩产看好行业潜力,东吴证券,2025-12-19,通用设备,https://pdf.dfcfw.com/pdf/H3_AP202512191803708571_1.pdf?1766150519000.pdf
机械设备行业点评报告：西门子海南总装基地落地，协同国产零部件扩产缓解燃机交付压力,东吴证券,2025-12-19,通用设备,https://pdf.dfcfw.com/pdf/H3_AP202512191803778281_1.pdf?1766159058000.pdf
高端制造行业ETF月报：商业航天司设立，可回收火箭迎来集中发射期,金融街证券,2025-12-19,通用设备,https://pdf.dfcfw.com/pdf/H3_AP202512191803907494_1.pdf?1766175576000.pdf
高端制造行业ETF双周报：短板现象仍未根本改观，关注机床产业链国产替代,金融街证券,2025-12-19,通用设备,https://pdf.dfcfw.com/pdf/H3_AP202512191803908516_1.pdf?1766176271000.pdf
机床行业深度报告：“十五五”规划中机床地位突出，国产替代进程加速,金融街证券,2025-12-18,通用设备,https://pdf.dfcfw.com/pdf/H3_AP202512181802831770_1.pdf?1766043864000.pdf
机械行业周报：低空增长稳定，看好工程机械发展,国元证券,2025-12-17,通用设备,https://pdf.dfcfw.com/pdf/H3_AP202512171802141735_1.pdf?1765958963000.pdf
机器人行业周报：七腾机器人入主胜通能源，智元第5000台机器人下线,西南证券,2025-12-17,通用设备,https://pdf.dfcfw.com/pdf/H3_AP202512171802143263_1.pdf?1765958740000.pdf
机械设备行业周报：关注具身智能机器人商业化进展，期待行业标准与生态共建,东海证券,2025-12-17,通用设备,https://pdf.dfcfw.com/pdf/H3_AP202512171802417723_1.pdf?1765991964000.pdf
机械设备：中央经济工作会议点评——看好工程机械与能源装备需求，关注智能装备扩大应用,万和证券,2025-12-17,通用设备,https://pdf.dfcfw.com/pdf/H3_AP202512171802330585_1.pdf?1765982153000.pdf
机械设备行业专题：工程机械下游需求提振可期，关注电动化智能化趋势,万和证券,2025-12-16,通用设备,https://pdf.dfcfw.com/pdf/H3_AP202512161801433816_1.pdf?1765869378000.pdf
机械设备行业周报：关注核聚变、AI基建、高端机床等板块投资机会,华龙证券,2025-12-16,通用设备,https://pdf.dfcfw.com/pdf/H3_AP202512161801526085_1.pdf?1765880723000.pdf
机械设备2026年投资策略：布局围绕AI基建相关设备领域成长机遇,东海证券,2025-12-16,通用设备,https://pdf.dfcfw.com/pdf/H3_AP202512161801573838_1.pdf?1765890703000.pdf
机械行业2026年策略：聚焦新市场、新场景、新周期,东兴证券,2025-12-16,通用设备,https://pdf.dfcfw.com/pdf/H3_AP202512161801631096_1.pdf?1765894205000.pdf
2025年中国储能设备行业市场研究报告,硕远咨询,2025-12-16,通用设备,https://pdf.dfcfw.com/pdf/H3_AP202512161801646066_1.pdf?1765896437000.pdf
AI PCB钻孔工艺专题：PCB升级+孔径微小化，钻孔设备&耗材需求量价齐升,东吴证券,2025-12-16,通用设备,https://pdf.dfcfw.com/pdf/H3_AP202512161801751958_1.pdf?1765909153000.pdf
机械设备行业点评报告：GEV上调扩产&业绩目标，看好燃气轮机行业持续上行,东吴证券,2025-12-15,通用设备,https://pdf.dfcfw.com/pdf/H3_AP202512151800546487_1.pdf?1765780555000.pdf
机械设备行业周报：看好人形机器人、AI基建及流程工业,信达证券,2025-12-15,通用设备,https://pdf.dfcfw.com/pdf/H3_AP202512151800857770_1.pdf?1765797075000.pdf
人形机器人产业周报：智元机器人实现5000台量产规模，众擎机器人完成A1+轮与A2轮融资,国元证券,2025-12-15,通用设备,https://pdf.dfcfw.com/pdf/H3_AP202512151800991088_1.pdf?1765813878000.pdf
机械设备行业周报：商业航天发展步入快车道，重视人形机器人,华安证券,2025-12-15,通用设备,https://pdf.dfcfw.com/pdf/H3_AP202512151801009637_1.pdf?1765816210000.pdf
机械设备行业制造成长周报（第38期）：智元第5000台机器人正式下线，GEV再度上修燃机订单指引与扩产规划,国信证券,2025-12-15,通用设备,https://pdf.dfcfw.com/pdf/H3_AP202512151801156386_1.pdf?1765833687000.pdf
机械设备行业跟踪周报：看好AI设备高景气带来的设备投资机会；看好出海持续超预期的油服设备,东吴证券,2025-12-14,通用设备,https://pdf.dfcfw.com/pdf/H3_AP202512141800309852_1.pdf?1765726675000.pdf
高端装备制造产业研究周报：具身智能纳入多省级“十五五”规划，智元第5000台机器人下线,国金证券,2025-12-14,通用设备,https://pdf.dfcfw.com/pdf/H3_AP202512141800433105_1.pdf?1765743447000.pdf
机械设备行业双周报：政策助推机器人加速产业化落地，11月挖机同环比双增,东莞证券,2025-12-12,通用设备,https://pdf.dfcfw.com/pdf/H3_AP202512121798941032_1.pdf?1765551482000.pdf
通用设备月报：通用设备需求继续磨底，把握刀具等结构性机会,西南证券,2025-12-11,通用设备,https://pdf.dfcfw.com/pdf/H3_AP202512111798217586_1.pdf?1765458528000.pdf
2024年中国工业机器人市场研究简报,华项永达咨询(北京),2025-12-11,通用设备,https://pdf.dfcfw.com/pdf/H3_AP202512111798267980_1.pdf?1765465756000.pdf
工程机械行业跟踪点评：11月挖机销量增速亮眼，海外地区需求修复,东莞证券,2025-12-11,通用设备,https://pdf.dfcfw.com/pdf/H3_AP202512111798335025_1.pdf?1765472850000.pdf
人工智能行业：企业人工智能的现状,"OpenAI, Inc.",2025-12-10,通用设备,https://pdf.dfcfw.com/pdf/H3_AP202512101797435639_1.pdf?1765359109000.pdf
机械行业周报：出口稳定增长，低空持续推进,国元证券,2025-12-10,通用设备,https://pdf.dfcfw.com/pdf/H3_AP202512101797641613_1.pdf?1765382898000.pdf
低空经济行业双周报：中央空管办加强规范低空管理系统建设，影石创新发布全景无人机,西南证券,2025-12-09,通用设备,https://pdf.dfcfw.com/pdf/H3_AP202512091796754569_1.pdf?1765267347000.pdf
机械设备行业制造成长周报（第37期）：特朗普政府聚焦机器人行业，Tiktok拟投资380亿美元建数据中心,国信证券,2025-12-09,通用设备,https://pdf.dfcfw.com/pdf/H3_AP202512091796811147_1.pdf?1765274848000.pdf
人形机器人产业周报：特朗普政府或加速机器人产业发展，众擎发布T800,国元证券,2025-12-09,通用设备,https://pdf.dfcfw.com/pdf/H3_AP202512091796972102_1.pdf?1765296239000.pdf
人形机器人行业专题研究周报：美政府或发布机器人产业政策，国产整机厂商产品密集发布,华龙证券,2025-12-09,通用设备,https://pdf.dfcfw.com/pdf/H3_AP202512091797019689_1.pdf?1765302496000.pdf
TMT行业周报（12月第1周）：国内AI端侧产品迎来新进展,世纪证券,2025-12-09,通用设备,https://pdf.dfcfw.com/pdf/H3_AP202512091797021636_1.pdf?1765302685000.pdf
机械设备行业周报：关注AI基建、人形机器人、工程机械等板块投资机会,华龙证券,2025-12-08,通用设备,https://pdf.dfcfw.com/pdf/H3_AP202512081796373700_1.pdf?1765215717000.pdf
装备制造行业周报（12月第1周）：钙钛矿电池产业持续推进,世纪证券,2025-12-08,通用设备,https://pdf.dfcfw.com/pdf/H3_AP202512081796369926_1.pdf?1765215306000.pdf
工程机械销量数据点评报告：11月挖机销量同比+13.9%，内销数据改善明显,华龙证券,2025-12-08,通用设备,https://pdf.dfcfw.com/pdf/H3_AP202512081796373427_1.pdf?1765216024000.pdf
【工程机械】2026年度策略：国内外共振向上，重点关注海外行业景气度复苏,东吴证券,2025-12-08,通用设备,https://pdf.dfcfw.com/pdf/H3_AP202512081796383044_1.pdf?1765220988000.pdf
机器人行业周报（1201-1207）：特斯拉发布Optimus跑步视频，特朗普政府有望推出机器人支持政策,西南证券,2025-12-08,通用设备,https://pdf.dfcfw.com/pdf/H3_AP202512081796474848_1.pdf?1765229242000.pdf
机械设备行业跟踪周报：持续推荐内外需共振的工程机械；关注燃气轮机出海加速的设备商机遇,东吴证券,2025-12-07,通用设备,https://pdf.dfcfw.com/pdf/H3_AP202512071795568683_1.pdf?1765106734000.pdf
高端装备制造产业研究周报：智元机器人发布灵心平台，优必选再获1.43亿元大单,国金证券,2025-12-07,通用设备,https://pdf.dfcfw.com/pdf/H3_AP202512071795685118_1.pdf?1765125864000.pdf
机械设备行业周报：人形机器人的“起跑时刻”，把握低位布局窗口,开源证券,2025-12-07,通用设备,https://pdf.dfcfw.com/pdf/H3_AP202512071795721577_1.pdf?1765127919000.pdf
具身智能产业跟踪（24）：优必选中标广西、江西合计4亿元项目,中国银河,2025-12-07,通用设备,https://pdf.dfcfw.com/pdf/H3_AP202512071795778458_1.pdf?1765136795000.pdf
具身智能行业研究：美国或发布机器人行政命令，众擎机器人T800发布,国金证券,2025-12-07,通用设备,https://pdf.dfcfw.com/pdf/H3_AP202512071795830556_1.pdf?1765146193000.pdf
机械设备行业2025年三季报复盘,华安证券,2025-12-07,通用设备,https://pdf.dfcfw.com/pdf/H3_AP202512071795844152_1.pdf?1765145484000.pdf
机械行业2026年度投资策略：成长引领，周期价值共振,信达证券,2025-12-06,通用设备,https://pdf.dfcfw.com/pdf/H3_AP202512061794944818_1.pdf?1765016918000.pdf
液冷行业深度：千亿液冷元年已至，看好国产供应链加速入局,东吴证券,2025-12-05,通用设备,https://pdf.dfcfw.com/pdf/H3_AP202512051794386645_1.pdf?1764941353000.pdf
2025年可穿戴医疗设备品牌推荐：智能设备定义医疗新范式，实时数据驱动慢病管理,头豹研究院,2025-12-05,通用设备,https://pdf.dfcfw.com/pdf/H3_AP202512051794563512_1.pdf?1764963821000.pdf
机械设备行业制造成长周报（第36期）：智元上线灵心平台，工信部公示人形机器人标准化技术委员会委员名单,国信证券,2025-12-03,通用设备,https://pdf.dfcfw.com/pdf/H3_AP202512031792981816_1.pdf?1764753019000.pdf
第二届智能制造科技50报告,毕马威会计师事务所,2025-12-03,通用设备,https://pdf.dfcfw.com/pdf/H3_AP202512021792724194_1.pdf?1764748530000.pdf
智能制造行业周报：晶圆产能持续扩张，看好薄膜沉积设备需求上行,爱建证券,2025-12-02,通用设备,https://pdf.dfcfw.com/pdf/H3_AP202512021792395725_1.pdf?1764675107000.pdf
未来独角兽_毕马威中国长三角高端装备：新质领袖榜单,毕马威会计师事务所,2025-12-02,通用设备,https://pdf.dfcfw.com/pdf/H3_AP202512011792066081_1.pdf?1764659892000.pdf
周一晚8点 _【人形机器人板块（下）】财务数据背后，谁在掌握利润分配权？,浙江大学国际校区隐形冠军国际研究中心,2025-12-02,通用设备,https://pdf.dfcfw.com/pdf/H3_AP202512021792498829_1.pdf?1764689118000.pdf
机械设备行业周报：人形机器人进入量产准备的关键阶段，建议积极布局,华龙证券,2025-12-02,通用设备,https://pdf.dfcfw.com/pdf/H3_AP202512021792566792_1.pdf?1764696760000.pdf
