研报名称,机构名称,发布时间,行业,研报地址
食品饮料行业周报：三季报整体承压，企业分化加大,开源证券,2024-11-03,酿酒行业,https://pdf.dfcfw.com/pdf/H3_AP202411031640688129_1.pdf?1730658617000.pdf
食品饮料：从精神消费的维度，看茅台定价权和长期增长中枢,中邮证券,2024-10-29,酿酒行业,https://pdf.dfcfw.com/pdf/H3_AP202410291640557539_1.pdf?1730195086000.pdf
食品饮料行业周报：茅台三季报稳健，大众品利润弹性显现,东海证券,2024-10-29,酿酒行业,https://pdf.dfcfw.com/pdf/H3_AP202410291640559424_1.pdf?1730196333000.pdf
食品饮料行业周报：三季报密集披露，业绩分化加剧,华龙证券,2024-10-29,酿酒行业,https://pdf.dfcfw.com/pdf/H3_AP202410291640561990_1.pdf?1730220587000.pdf
食品饮料周报（24年第44周）：秋糖会反馈平淡，茅台第三季度兑现稳健增长,国信证券,2024-10-28,酿酒行业,https://pdf.dfcfw.com/pdf/H3_AP202410281640531987_1.pdf?1730115511000.pdf
食品饮料行业周报：淡季基本面平稳，三季报窗口期关注兑现,国金证券,2024-10-28,酿酒行业,https://pdf.dfcfw.com/pdf/H3_AP202410281640532357_1.pdf?1730113694000.pdf
茅台Q3业绩稳健，关注三季报反馈,东莞证券,2024-10-28,酿酒行业,https://pdf.dfcfw.com/pdf/H3_AP202410281640542067_1.pdf?1730135801000.pdf
食品饮料行业周报：秋糖平淡，Q3板块机构持仓环比下降,国海证券,2024-10-28,酿酒行业,https://pdf.dfcfw.com/pdf/H3_AP202410281640553643_1.pdf?1730198267000.pdf
食品饮料行业月度点评：政策东风已至，基本面改善可期,财信证券,2024-10-27,酿酒行业,https://pdf.dfcfw.com/pdf/H3_AP202410271640525643_1.pdf?1730028723000.pdf
食品饮料行业周报：秋糖气氛平淡，三季报行情开启,开源证券,2024-10-27,酿酒行业,https://pdf.dfcfw.com/pdf/H3_AP202410271640528767_1.pdf?1730064037000.pdf
食品饮料周报：茅台业绩稳健增长，提振行业信心,平安证券,2024-10-27,酿酒行业,https://pdf.dfcfw.com/pdf/H3_AP202410271640528299_1.pdf?1730062959000.pdf
食品饮料行业酒水饮料周报：短期关注季报兑现，后续关注政策落地效果,天风证券,2024-10-25,酿酒行业,https://pdf.dfcfw.com/pdf/H3_AP202410251640500060_1.pdf?1729868805000.pdf
食品饮料行业周报：短期关注三季报业绩兑现，中长期关注基本面持续改善,华龙证券,2024-10-23,酿酒行业,https://pdf.dfcfw.com/pdf/H3_AP202410231640433553_1.pdf?1729704407000.pdf
食品饮料行业周报：板块震荡回调，关注复苏进程,国海证券,2024-10-22,酿酒行业,https://pdf.dfcfw.com/pdf/H3_AP202410221640400907_1.pdf?1729593341000.pdf
食品饮料行业报告：增量政策持续发力推动市场信心回暖，关注需求改善,东兴证券,2024-10-22,酿酒行业,https://pdf.dfcfw.com/pdf/H3_AP202410221640409978_1.pdf?1729617586000.pdf
食品饮料行业周报：秋糖召开在即，关注需求恢复,上海证券,2024-10-21,酿酒行业,https://pdf.dfcfw.com/pdf/H3_AP202410211640378108_1.pdf?1729507672000.pdf
食品饮料行业周报：消费复苏预期持续，重视三季报业绩表现,东海证券,2024-10-21,酿酒行业,https://pdf.dfcfw.com/pdf/H3_AP202410211640389313_1.pdf?1729533788000.pdf
食品饮料周报（24年第43周）：政策加码预期修复，建议关注秋季糖酒会,国信证券,2024-10-21,酿酒行业,https://pdf.dfcfw.com/pdf/H3_AP202410211640392156_1.pdf?1729544701000.pdf
食品饮料：多家管理层变更，继续关注三季报,华金证券,2024-10-20,酿酒行业,https://pdf.dfcfw.com/pdf/H3_AP202410201640375245_1.pdf?1729458929000.pdf
食品饮料行业周报：政策端持续利好，季报披露进行时,华鑫证券,2024-10-20,酿酒行业,https://pdf.dfcfw.com/pdf/H3_AP202410201640375628_1.pdf?1729464748000.pdf
食品饮料行业周报：关注秋糖反馈及业绩期兑现，中期景气拐点可期,国金证券,2024-10-20,酿酒行业,https://pdf.dfcfw.com/pdf/H3_AP202410201640374271_1.pdf?1729435852000.pdf
食品饮料行业周报：短期需求平淡，关注三季报催化,开源证券,2024-10-20,酿酒行业,https://pdf.dfcfw.com/pdf/H3_AP202410201640374975_1.pdf?1729447447000.pdf
食品饮料行业点评报告：酒类线上销售较好，大众品表现有所分化,开源证券,2024-10-16,酿酒行业,https://pdf.dfcfw.com/pdf/H3_AP202410161640318171_1.pdf?1729079228000.pdf
食品饮料行业周报：步入季报验证期，细分领域龙头经营稳健,中银证券,2024-10-15,酿酒行业,https://pdf.dfcfw.com/pdf/H3_AP202410151640298965_1.pdf?1728989839000.pdf
食品饮料行业周报：政策预期向好，关注内需改善,东海证券,2024-10-15,酿酒行业,https://pdf.dfcfw.com/pdf/H3_AP202410151640301885_1.pdf?1729003663000.pdf
食品饮料行业研究周报：节后茅台批价回落，餐饮供应链低位修复空间大,申港证券,2024-10-15,酿酒行业,https://pdf.dfcfw.com/pdf/H3_AP202410151640312949_1.pdf?1729034528000.pdf
食品饮料行业跟踪周报：24Q3季报前瞻：白酒降速去库，大众品分化待突围,东吴证券,2024-10-14,酿酒行业,https://pdf.dfcfw.com/pdf/H3_AP202410141640280426_1.pdf?1728898785000.pdf
政策提振，预期提升,东莞证券,2024-10-14,酿酒行业,https://pdf.dfcfw.com/pdf/H3_AP202410141640288689_1.pdf?1728925750000.pdf
食品饮料行业周报：政策托底，板块经营稳步向好,上海证券,2024-10-14,酿酒行业,https://pdf.dfcfw.com/pdf/H3_AP202410141640289531_1.pdf?1728926975000.pdf
食品饮料行业10月投资策略及三季报前瞻：双节动销平淡，白酒渠道进入去库存阶段,国信证券,2024-10-14,酿酒行业,https://pdf.dfcfw.com/pdf/H3_AP202410141640282340_1.pdf?1728911856000.pdf
