研报名称,机构名称,发布时间,行业,研报地址
食品饮料周报（25年第2周）：头部酒企重视价格维护，春节动销环比加快,国信证券,2025-01-13,酿酒行业,https://pdf.dfcfw.com/pdf/H3_AP202501131641900170_1.pdf?1736783204000.pdf
食品饮料行业周报：头部酒企稳中求进，春节动销有序推进,东海证券,2025-01-13,酿酒行业,https://pdf.dfcfw.com/pdf/H3_AP202501131641900698_1.pdf?1736780365000.pdf
食品饮料行业周报：渠道的变革，时代的红利,开源证券,2025-01-12,酿酒行业,https://pdf.dfcfw.com/pdf/H3_AP202501121641896717_1.pdf?1736706728000.pdf
食品饮料行业周报：飞天批价环比回暖，关注旺季动销,平安证券,2025-01-12,酿酒行业,https://pdf.dfcfw.com/pdf/H3_AP202501121641896931_1.pdf?1736713231000.pdf
食品饮料行业周报：贵州茅台顺利收官，关注春节备货节奏,东海证券,2025-01-07,酿酒行业,https://pdf.dfcfw.com/pdf/H3_AP202501071641833328_1.pdf?1736245689000.pdf
食品饮料行业周报：春节旺季来临，建议关注零食板块,华龙证券,2025-01-07,酿酒行业,https://pdf.dfcfw.com/pdf/H3_AP202501071641840604_1.pdf?1736272939000.pdf
食品饮料行业周报：茅台稳健收官，微信小店送礼催化零食销售,平安证券,2025-01-06,酿酒行业,https://pdf.dfcfw.com/pdf/H3_AP202501061641813328_1.pdf?1736152551000.pdf
食品饮料行业周报：茅台行稳致远，大众品齐头并进,上海证券,2025-01-06,酿酒行业,https://pdf.dfcfw.com/pdf/H3_AP202501061641815344_1.pdf?1736160334000.pdf
食品饮料周报（25年第1周）：贵州茅台2024年顺利完成目标，关注春节备货窗口期,国信证券,2025-01-06,酿酒行业,https://pdf.dfcfw.com/pdf/H3_AP202501061641817944_1.pdf?1736181780000.pdf
食品饮料行业周报：看好零食板块成长性，重视西麦食品红利期,开源证券,2025-01-05,酿酒行业,https://pdf.dfcfw.com/pdf/H3_AP202501051641811611_1.pdf?1736074663000.pdf
食品饮料行业跟踪周报：微信小店迎来爆发点，“送礼物”功能催化零食,东吴证券,2025-01-05,酿酒行业,https://pdf.dfcfw.com/pdf/H3_AP202501051641812644_1.pdf?1736109182000.pdf
食品饮料行业周报：茅台24年顺利收官，重视微信小店概念催化,天风证券,2025-01-05,酿酒行业,https://pdf.dfcfw.com/pdf/H3_AP202501051641812743_1.pdf?1736114065000.pdf
食品饮料行业周报：茅台圆满收官，关注开门红回款,华鑫证券,2025-01-05,酿酒行业,https://pdf.dfcfw.com/pdf/H3_AP202501051641811841_1.pdf?1736089080000.pdf
食品饮料行业周报：零食受益微信小店新渠道催化，茅台24年规划圆满达成,国金证券,2025-01-05,酿酒行业,https://pdf.dfcfw.com/pdf/H3_AP202501051641812306_1.pdf?1736098974000.pdf
酒行业周度市场观察第53周,艾瑞股份,2025-01-03,酿酒行业,https://pdf.dfcfw.com/pdf/H3_AP202501031641523371_1.pdf?1735900962000.pdf
茅台2024年顺利收官，关注春节旺季备货,东莞证券,2025-01-03,酿酒行业,https://pdf.dfcfw.com/pdf/H3_AP202501031641800683_1.pdf?1735924424000.pdf
食品饮料行业周报：短期大众品有催化，25年行业拐点可期,国都证券,2025-01-02,酿酒行业,https://pdf.dfcfw.com/pdf/H3_AP202501021641516788_1.pdf?1735850960000.pdf
食品饮料行业周报：酒企25年降速，渠道反馈仍偏谨慎,国都证券,2025-01-02,酿酒行业,https://pdf.dfcfw.com/pdf/H3_AP202501021641516797_1.pdf?1735851126000.pdf
食品饮料行业周报：经销商大会密集召开，关注旺季批价与动销反馈,华鑫证券,2024-12-31,酿酒行业,https://pdf.dfcfw.com/pdf/H3_AP202412311641484930_1.pdf?1735637109000.pdf
食品饮料行业：白酒经销商大会密集召开，酒企更加注重稳健发展,东兴证券,2024-12-31,酿酒行业,https://pdf.dfcfw.com/pdf/H3_AP202412311641485885_1.pdf?1735641823000.pdf
食品饮料行业周报：透过年底会议，看酒企2025年趋势,信达证券,2024-12-31,酿酒行业,https://pdf.dfcfw.com/pdf/H3_AP202412311641487109_1.pdf?1735677793000.pdf
12月白酒板块月报：行业调整期，酒企定力精耕,中国银河,2024-12-31,酿酒行业,https://pdf.dfcfw.com/pdf/H3_AP202412311641490230_1.pdf?1735663191000.pdf
2025年食品饮料行业策略报告：需求主导，价值重估,信达证券,2024-12-31,酿酒行业,https://pdf.dfcfw.com/pdf/H3_AP202412311641493744_1.pdf?1735669476000.pdf
12月啤酒板块月报：静待啤酒行业景气度回升,中国银河,2024-12-31,酿酒行业,https://pdf.dfcfw.com/pdf/H3_AP202412311641497398_1.pdf?1735676975000.pdf
食品饮料行业周报：茅台经销商大会召开，青岛啤酒换届落地,天风证券,2024-12-30,酿酒行业,https://pdf.dfcfw.com/pdf/H3_AP202412301641465886_1.pdf?1735556354000.pdf
食品饮料行业周报：酒企密集经销商大会承上启下，微信小店助力年货概念,上海证券,2024-12-30,酿酒行业,https://pdf.dfcfw.com/pdf/H3_AP202412301641465848_1.pdf?1735555727000.pdf
食品饮料行业周报：贵州茅台稳步前行，青岛啤酒换届落地,东海证券,2024-12-30,酿酒行业,https://pdf.dfcfw.com/pdf/H3_AP202412301641467183_1.pdf?1735571366000.pdf
食品饮料行业周报：微信小店“送礼物”功能上线，有望快速铺开,中银证券,2024-12-30,酿酒行业,https://pdf.dfcfw.com/pdf/H3_AP202412301641473581_1.pdf?1735580104000.pdf
继300亿分红后，再掷30亿-60亿回购注销！贵州茅台：白酒行业最后的堡垒,北京韬联科技,2024-12-30,酿酒行业,https://pdf.dfcfw.com/pdf/H3_AP202412301641475477_1.pdf?1735586148000.pdf
食品饮料行业：茅台全年顺利收官，夯实市场信心,平安证券,2024-12-29,酿酒行业,https://pdf.dfcfw.com/pdf/H3_AP202412291641463110_1.pdf?1735501175000.pdf
食品饮料行业周报：酒企经销商大会陆续召开，关注各板块春季旺销季催化,国金证券,2024-12-29,酿酒行业,https://pdf.dfcfw.com/pdf/H3_AP202412291641462658_1.pdf?1735488338000.pdf
食品饮料行业周报：贵州茅台明确战略方向，青岛啤酒有望再续新篇,开源证券,2024-12-29,酿酒行业,https://pdf.dfcfw.com/pdf/H3_AP202412291641462733_1.pdf?1735489723000.pdf
食品饮料行业周观点更新,华福证券,2024-12-29,酿酒行业,https://pdf.dfcfw.com/pdf/H3_AP202412291641462965_1.pdf?1735497899000.pdf
食品饮料行业周报：五粮液经销商大会定调积极，微信小店增加新场景,东海证券,2024-12-24,酿酒行业,https://pdf.dfcfw.com/pdf/H3_AP202412241641411875_1.pdf?1735051759000.pdf
食品饮料行业周报：蓄力春节，把握消费需求,上海证券,2024-12-23,酿酒行业,https://pdf.dfcfw.com/pdf/H3_AP202412231641392415_1.pdf?1734945851000.pdf
食品饮料行业周报：头部酒企召开经销商大会，定调高质量发展,平安证券,2024-12-23,酿酒行业,https://pdf.dfcfw.com/pdf/H3_AP202412231641392944_1.pdf?1734948956000.pdf
食品饮料行业周报（24年第52周）：五粮液传递稳健增长预期，关注春节备货窗口期,国信证券,2024-12-23,酿酒行业,https://pdf.dfcfw.com/pdf/H3_AP202412231641393690_1.pdf?1734954907000.pdf
食品饮料行业点评报告：11月社零增速环比回落，政策支持性品类增速较好,开源证券,2024-12-23,酿酒行业,https://pdf.dfcfw.com/pdf/H3_AP202412231641394379_1.pdf?1734965486000.pdf
食品饮料行业周报：飞天茅台近期批价回暖，大众品迎备货催化,天风证券,2024-12-23,酿酒行业,https://pdf.dfcfw.com/pdf/H3_AP202412231641394424_1.pdf?1734966481000.pdf
食品饮料行业2025年度策略：把握景气回升下的结构性机会，精选优质个股,中银证券,2024-12-22,酿酒行业,https://pdf.dfcfw.com/pdf/H3_AP202412211641385862_1.pdf?1734861866000.pdf
白酒行业2025年投资策略：梅花香自苦寒中，柳暗花明又一年,华鑫证券,2024-12-22,酿酒行业,https://pdf.dfcfw.com/pdf/H3_AP202412221641389055_1.pdf?1734864149000.pdf
食品饮料行业周报：经销商大会陆续召开，关注微信小店受益标的,华鑫证券,2024-12-22,酿酒行业,https://pdf.dfcfw.com/pdf/H3_AP202412221641389626_1.pdf?1734883279000.pdf
食品饮料行业周报：微信小店开辟新渠道，关注春节备货事件催化,国金证券,2024-12-22,酿酒行业,https://pdf.dfcfw.com/pdf/H3_AP202412221641389854_1.pdf?1734888533000.pdf
食品饮料行业周观点更新,华福证券,2024-12-22,酿酒行业,https://pdf.dfcfw.com/pdf/H3_AP202412221641389900_1.pdf?1734889762000.pdf
食品饮料行业周报：五粮液释放积极信号，微信小店催生新型消费场景,开源证券,2024-12-22,酿酒行业,https://pdf.dfcfw.com/pdf/H3_AP202412221641389629_1.pdf?1734883279000.pdf
食品饮料行业2025年度投资策略（酒饮篇）：预期先行，关注流速,民生证券,2024-12-20,酿酒行业,https://pdf.dfcfw.com/pdf/H3_AP202412201641373236_1.pdf?1734692916000.pdf
食品饮料行业双周报：政策表态积极，关注修复进程,东莞证券,2024-12-20,酿酒行业,https://pdf.dfcfw.com/pdf/H3_AP202412201641373894_1.pdf?1734697165000.pdf
酒行业周度市场观察第51周,艾瑞股份,2024-12-20,酿酒行业,https://pdf.dfcfw.com/pdf/H3_AP202412201641374119_1.pdf?1734706994000.pdf
食品饮料2025年投资策略：梯次探底迎共振，蛇年见龙在田,东吴证券,2024-12-20,酿酒行业,https://pdf.dfcfw.com/pdf/H3_AP202412201641385604_1.pdf?1734861065000.pdf
食品饮料行业研究周报：政策提振消费，年节销售有望带动细分板块行情,申港证券,2024-12-19,酿酒行业,https://pdf.dfcfw.com/pdf/H3_AP202412191641358383_1.pdf?1734615956000.pdf
11月电商数据分析：多品类线上延续良好销售表现，关注酒类及休闲零食,开源证券,2024-12-19,酿酒行业,https://pdf.dfcfw.com/pdf/H3_AP202412191641363784_1.pdf?1734630502000.pdf
食品饮料行业研究周报：大众品重视复苏行情，酒企关注开门红政策,天风证券,2024-12-18,酿酒行业,https://pdf.dfcfw.com/pdf/H3_AP202412181641351608_1.pdf?1734556728000.pdf
食品饮料行业周报：政策定调积极，内需预期向好,东海证券,2024-12-17,酿酒行业,https://pdf.dfcfw.com/pdf/H3_AP202412171641326134_1.pdf?1734431275000.pdf
啤酒&饮料总结：量价利仍有压力，期待企稳改善,天风证券,2024-12-17,酿酒行业,https://pdf.dfcfw.com/pdf/H3_AP202412171641326543_1.pdf?1734435430000.pdf
食品饮料周报（24年第51周）：宏观政策着力扩大内需，食品饮料板块改善在即,国信证券,2024-12-17,酿酒行业,https://pdf.dfcfw.com/pdf/H3_AP202412171641331956_1.pdf?1734457621000.pdf
食品饮料行业周报：政策托底提振信心，关注需求修复,上海证券,2024-12-16,酿酒行业,https://pdf.dfcfw.com/pdf/H3_AP202412161641310098_1.pdf?1734346931000.pdf
食品饮料行业周报：强化扩内需预期，关注弹性释放,华鑫证券,2024-12-16,酿酒行业,https://pdf.dfcfw.com/pdf/H3_AP202412161641310332_1.pdf?1734348367000.pdf
食品饮料行业报告：扩内需放在首要位置，关注政策重点提及方向,中邮证券,2024-12-16,酿酒行业,https://pdf.dfcfw.com/pdf/H3_AP202412161641313763_1.pdf?1734374386000.pdf
食品饮料行业周报：消费政策表述积极，关注顺周期修复,平安证券,2024-12-15,酿酒行业,https://pdf.dfcfw.com/pdf/H3_AP202412151641307436_1.pdf?1734290739000.pdf
食品饮料：政策预期反复强化，消费机会需阶段演绎,华福证券,2024-12-15,酿酒行业,https://pdf.dfcfw.com/pdf/H3_AP202412151641306504_1.pdf?1734275824000.pdf
食品饮料行业周报：经济会议表态积极，内需关注度提升,开源证券,2024-12-15,酿酒行业,https://pdf.dfcfw.com/pdf/H3_AP202412151641307054_1.pdf?1734281275000.pdf
食品饮料行业周报：扩内需下重视大众品成长性，白酒分化中持续磨底,国金证券,2024-12-15,酿酒行业,https://pdf.dfcfw.com/pdf/H3_AP202412151641307198_1.pdf?1734284072000.pdf
食品饮料行业中央经济工作会议解读：提振消费是亮点，明年政策将继续落地,东兴证券,2024-12-15,酿酒行业,https://pdf.dfcfw.com/pdf/H3_AP202412151641306486_1.pdf?1734275508000.pdf
食品饮料行业年度策略报告：白酒篇：筑牢基石，坐看云起,平安证券,2024-12-13,酿酒行业,https://pdf.dfcfw.com/pdf/H3_AP202412131641294191_1.pdf?1734111564000.pdf
食品饮料行业周报：白酒春节预热，大众食品新品频出,上海证券,2024-12-09,酿酒行业,https://pdf.dfcfw.com/pdf/H3_AP202412091641223073_1.pdf?1733742257000.pdf
酒行业周度市场观察第49周,艾瑞股份,2024-12-09,酿酒行业,https://pdf.dfcfw.com/pdf/H3_AP202412091641235016_1.pdf?1733822431000.pdf
食品饮料周报：经销商大会召开，定调高质量发展,平安证券,2024-12-08,酿酒行业,https://pdf.dfcfw.com/pdf/H3_AP202412081641220427_1.pdf?1733694965000.pdf
食品饮料行业周报：旺季备货期，关注政策催化,华鑫证券,2024-12-08,酿酒行业,https://pdf.dfcfw.com/pdf/H3_AP202412081641220499_1.pdf?1733688243000.pdf
食品饮料行业酒水饮料周报：释压期稳定压倒一切，关注酒企开门红政策,天风证券,2024-12-08,酿酒行业,https://pdf.dfcfw.com/pdf/H3_AP202412081641220531_1.pdf?1733689998000.pdf
食品饮料行业周报：餐饮链边际改善修复估值，白酒仍待催化,国金证券,2024-12-08,酿酒行业,https://pdf.dfcfw.com/pdf/H3_AP202412081641219660_1.pdf?1733664971000.pdf
食品饮料行业周报：汾酒战略新布局，看好啤酒复苏表现,开源证券,2024-12-08,酿酒行业,https://pdf.dfcfw.com/pdf/H3_AP202412081641220191_1.pdf?1733681065000.pdf
食品饮料行业双周报：分红提振信心，期待复苏改善,东莞证券,2024-12-06,酿酒行业,https://pdf.dfcfw.com/pdf/H3_AP202412061641211922_1.pdf?1733509795000.pdf
食品饮料行业研究周报：酒企年底大会陆续召开，关注乳企盈利修复,申港证券,2024-12-05,酿酒行业,https://pdf.dfcfw.com/pdf/H3_AP202412051641199290_1.pdf?1733438634000.pdf
食品饮料行业周报（24年第49周）：茅台主动解决供需适配问题，大众品板块关注需求恢复节奏,国信证券,2024-12-04,酿酒行业,https://pdf.dfcfw.com/pdf/H3_AP202412041641175668_1.pdf?1733326610000.pdf
食品饮料行业周报：白酒龙头加大分红，静待需求回暖,华龙证券,2024-12-03,酿酒行业,https://pdf.dfcfw.com/pdf/H3_AP202412031641163438_1.pdf?1733253554000.pdf
食品饮料行业周报：政策预期催化，茅五如期分红回报,华鑫证券,2024-12-02,酿酒行业,https://pdf.dfcfw.com/pdf/H3_AP202412021641134536_1.pdf?1733141945000.pdf
食品饮料行业周报：龙头白酒积极分红，食品公司加快产品布局,上海证券,2024-12-02,酿酒行业,https://pdf.dfcfw.com/pdf/H3_AP202412021641138606_1.pdf?1733156922000.pdf
食品饮料行业周报：龙头酒企坚定信心，关注旺季备货节奏,东海证券,2024-12-02,酿酒行业,https://pdf.dfcfw.com/pdf/H3_AP202412021641142607_1.pdf?1733162425000.pdf
食品饮料周报：注重良性发展，分红回馈股东,平安证券,2024-12-02,酿酒行业,https://pdf.dfcfw.com/pdf/H3_AP202412021641143769_1.pdf?1733172314000.pdf
食品饮料行业11月月报：板块微幅反弹，行情呈上下拉锯状,中原证券,2024-12-02,酿酒行业,https://pdf.dfcfw.com/pdf/H3_AP202412021641143852_1.pdf?1733166443000.pdf
食品饮料行业周报：关注酒企经销商大会定调，底部持续推荐,国金证券,2024-12-01,酿酒行业,https://pdf.dfcfw.com/pdf/H3_AP202412011641130140_1.pdf?1733073094000.pdf
食品饮料行业周报：茅台增厚股东回报，糖蜜价格持续回落,开源证券,2024-12-01,酿酒行业,https://pdf.dfcfw.com/pdf/H3_AP202412011641130353_1.pdf?1733078380000.pdf
酒水饮料周报：淡季行业主动释压，关注24年收官&新年度规划,天风证券,2024-11-28,酿酒行业,https://pdf.dfcfw.com/pdf/H3_AP202411281641109489_1.pdf?1732863534000.pdf
酒行业周度市场观察第47周,艾瑞股份,2024-11-25,酿酒行业,https://pdf.dfcfw.com/pdf/H3_AP202411241641043591_1.pdf?1732530340000.pdf
食品饮料行业周报（24年第48周）：白酒进入回款收官阶段，大众品板块关注需求恢复节奏,国信证券,2024-11-25,酿酒行业,https://pdf.dfcfw.com/pdf/H3_AP202411251641046070_1.pdf?1732532718000.pdf
食品饮料行业周报：酒行业缩量竞争，关注龙头企业表现,上海证券,2024-11-25,酿酒行业,https://pdf.dfcfw.com/pdf/H3_AP202411251641047254_1.pdf?1732544783000.pdf
食品饮料行业周报：基本面筑底，静待政策催化,东海证券,2024-11-25,酿酒行业,https://pdf.dfcfw.com/pdf/H3_AP202411251641053985_1.pdf?1732556044000.pdf
食品饮料行业：名酒批价涨跌互现，地产酒价格更平稳,东兴证券,2024-11-25,酿酒行业,https://pdf.dfcfw.com/pdf/H3_AP202411251641057446_1.pdf?1732563655000.pdf
食品饮料行业双周报：社零数据回暖，关注复苏进程,东莞证券,2024-11-24,酿酒行业,https://pdf.dfcfw.com/pdf/H3_AP202411241641043497_1.pdf?1732487963000.pdf
食品饮料行业周报：销售淡季表现平稳，关注酒企目标制定,华鑫证券,2024-11-24,酿酒行业,https://pdf.dfcfw.com/pdf/H3_AP202411241641042813_1.pdf?1732463094000.pdf
食品饮料行业周报：底部静候顺周期催化，关注个股禀赋性机会,国金证券,2024-11-24,酿酒行业,https://pdf.dfcfw.com/pdf/H3_AP202411241641042822_1.pdf?1732463367000.pdf
食品饮料行业研究：政策催化预期改善，重视底部配置机会,国金证券,2024-11-24,酿酒行业,https://pdf.dfcfw.com/pdf/H3_AP202411241641042325_1.pdf?1732455534000.pdf
食品饮料行业周报：威士忌新品首发，关注大众品修复机会,开源证券,2024-11-24,酿酒行业,https://pdf.dfcfw.com/pdf/H3_AP202411241641043288_1.pdf?1732478307000.pdf
食品饮料行业酒水饮料周报：白酒控货挺价为主，经营相对平稳,天风证券,2024-11-21,酿酒行业,https://pdf.dfcfw.com/pdf/H3_AP202411211641000827_1.pdf?1732188363000.pdf
食品饮料行业研究周报：白酒淡季维护市场秩序，餐饮社零仍待复苏,申港证券,2024-11-21,酿酒行业,https://pdf.dfcfw.com/pdf/H3_AP202411211641001413_1.pdf?1732199227000.pdf
食品饮料行业2025年上半年投资策略：复苏在途，期待改善,东莞证券,2024-11-21,酿酒行业,https://pdf.dfcfw.com/pdf/H3_AP202411211641005733_1.pdf?1732206840000.pdf
食品饮料行业点评报告：10月电商数据分析：大促带动线上销售额增长，关注白酒龙头及休闲零食,开源证券,2024-11-20,酿酒行业,https://pdf.dfcfw.com/pdf/H3_AP202411201640984509_1.pdf?1732124263000.pdf
食品饮料行业：餐饮呈现平稳增长，餐饮产业链有望持续复苏,东兴证券,2024-11-20,酿酒行业,https://pdf.dfcfw.com/pdf/H3_AP202411201640984900_1.pdf?1732124947000.pdf
食品饮料行业：社零数据回暖，关注板块分化,平安证券,2024-11-18,酿酒行业,https://pdf.dfcfw.com/pdf/H3_AP202411181640929627_1.pdf?1731919433000.pdf
食品饮料行业周报：10月餐饮类零售额表现平淡，提振内需背景下优先关注大众消费,中银证券,2024-11-18,酿酒行业,https://pdf.dfcfw.com/pdf/H3_AP202411181640931183_1.pdf?1731923907000.pdf
食品饮料行业点评报告：以旧换新政策成效较好，10月社零增速延续回升,开源证券,2024-11-18,酿酒行业,https://pdf.dfcfw.com/pdf/H3_AP202411181640931595_1.pdf?1731924905000.pdf
食品饮料行业周报：社零回暖，双十一拉动消费增长,上海证券,2024-11-18,酿酒行业,https://pdf.dfcfw.com/pdf/H3_AP202411181640932577_1.pdf?1731928958000.pdf
食品饮料行业周报：10月社零增速超预期，关注年末备货节奏,东海证券,2024-11-18,酿酒行业,https://pdf.dfcfw.com/pdf/H3_AP202411181640940600_1.pdf?1731951298000.pdf
食品饮料行业周报：十月社零数据环比回暖，政策积极预期改善,华龙证券,2024-11-18,酿酒行业,https://pdf.dfcfw.com/pdf/H3_AP202411181640945842_1.pdf?1731964459000.pdf
食品饮料行业周报：双十一板块稳增，大众品开启密集备货,华鑫证券,2024-11-17,酿酒行业,https://pdf.dfcfw.com/pdf/H3_AP202411171640928844_1.pdf?1731877625000.pdf
食品饮料行业周报：推荐板块顺周期配置，关注个股禀赋性机会,国金证券,2024-11-17,酿酒行业,https://pdf.dfcfw.com/pdf/H3_AP202411171640928617_1.pdf?1731869471000.pdf
食品饮料行业定期报告：短期预期博弈或有扰动，长期向好趋势明晰,华福证券,2024-11-17,酿酒行业,https://pdf.dfcfw.com/pdf/H3_AP202411171640928320_1.pdf?1731862725000.pdf
食品饮料行业周报：10月社零数据回暖，关注复调行业修复机会,开源证券,2024-11-17,酿酒行业,https://pdf.dfcfw.com/pdf/H3_AP202411171640928782_1.pdf?1731875894000.pdf
食品饮料行业2024年三季报分析：收入增长回落，业绩表现进一步分化,中原证券,2024-11-16,酿酒行业,https://pdf.dfcfw.com/pdf/H3_AP202411161640926962_1.pdf?1731839937000.pdf
食品饮料行业2025年度投资策略：预期改善，枯木逢春,开源证券,2024-11-14,酿酒行业,https://pdf.dfcfw.com/pdf/H3_AP202411131640870201_1.pdf?1731569752000.pdf
食品饮料行业酒水饮料周报：政策催化持续，把握板块顺周期弹性,天风证券,2024-11-13,酿酒行业,https://pdf.dfcfw.com/pdf/H3_AP202411131640853215_1.pdf?1731504235000.pdf
食品饮料行业跟踪周报：分红与回购，更上层楼,东吴证券,2024-11-13,酿酒行业,https://pdf.dfcfw.com/pdf/H3_AP202411131640856833_1.pdf?1731513195000.pdf
食品饮料行业周报：头部酒企兑现分红，内需提振预期增强,东海证券,2024-11-12,酿酒行业,https://pdf.dfcfw.com/pdf/H3_AP202411121640830952_1.pdf?1731426685000.pdf
食品饮料行业2024年三季报综述：白酒增速趋缓，零食和软饮料业绩较优,华龙证券,2024-11-12,酿酒行业,https://pdf.dfcfw.com/pdf/H3_AP202411121640834264_1.pdf?1731433086000.pdf
食品饮料行业周报：政策落地，提振内需,国海证券,2024-11-11,酿酒行业,https://pdf.dfcfw.com/pdf/H3_AP202411111640806421_1.pdf?1731314039000.pdf
食品饮料行业周报：飞天批价回暖，分红回馈股东,平安证券,2024-11-11,酿酒行业,https://pdf.dfcfw.com/pdf/H3_AP202411111640806576_1.pdf?1731315351000.pdf
食品饮料行业周报：政策积极，国内需求复苏预期提升,华龙证券,2024-11-11,酿酒行业,https://pdf.dfcfw.com/pdf/H3_AP202411111640821197_1.pdf?1731366573000.pdf
食品饮料行业周报：政策托底，关注内需复苏,上海证券,2024-11-11,酿酒行业,https://pdf.dfcfw.com/pdf/H3_AP202411111640809350_1.pdf?1731333565000.pdf
白酒行业2024年三季报总结报告：业绩降速渠道减压，底部调整静待拐点,华鑫证券,2024-11-10,酿酒行业,https://pdf.dfcfw.com/pdf/H3_AP202411091640803908_1.pdf?1731229088000.pdf
食品饮料行业定期报告：政策改善逐步发力，消费恢复静待花开,华福证券,2024-11-10,酿酒行业,https://pdf.dfcfw.com/pdf/H3_AP202411101640805627_1.pdf?1731270504000.pdf
食品饮料行业点评报告：季末政策刺激催化，食品饮料持仓仍在低位,开源证券,2024-11-10,酿酒行业,https://pdf.dfcfw.com/pdf/H3_AP202411101640805694_1.pdf?1731273935000.pdf
食品饮料行业双周报：茅台中期分红落地，关注需求复苏进程,东莞证券,2024-11-10,酿酒行业,https://pdf.dfcfw.com/pdf/H3_AP202411101640805821_1.pdf?1731279461000.pdf
食品饮料行业研究周报：板块受益顺周期偏好回暖，强禀赋龙头持续推荐,国金证券,2024-11-10,酿酒行业,https://pdf.dfcfw.com/pdf/H3_AP202411101640804618_1.pdf?1731249247000.pdf
食品饮料行业周报：内需重要性提升，板块迎来催化,开源证券,2024-11-10,酿酒行业,https://pdf.dfcfw.com/pdf/H3_AP202411101640804709_1.pdf?1731251536000.pdf
酒行业周度市场观察第45周,艾瑞股份,2024-11-10,酿酒行业,https://pdf.dfcfw.com/pdf/H3_AP202411101640804748_1.pdf?1731252670000.pdf
食品饮料行业周报：外围靴子终落地，茅台发布中期分红,华鑫证券,2024-11-10,酿酒行业,https://pdf.dfcfw.com/pdf/H3_AP202411101640805329_1.pdf?1731259853000.pdf
食品饮料行业：白酒三季报承压，复苏趋势静待春节旺季验证,东兴证券,2024-11-08,酿酒行业,https://pdf.dfcfw.com/pdf/H3_AP202411081640789136_1.pdf?1731086602000.pdf
酒水饮料周报：弱需求下酒企主动释压，业绩增速放缓明显,天风证券,2024-11-05,酿酒行业,https://pdf.dfcfw.com/pdf/H3_AP202411051640717026_1.pdf?1730883529000.pdf
食品饮料行业周报：茅台业绩稳健，板块三季报不乏亮点,上海证券,2024-11-05,酿酒行业,https://pdf.dfcfw.com/pdf/H3_AP202411051640717586_1.pdf?1730817676000.pdf
食品饮料行业周报：酒企主动降速控节奏，大众品进一步分化,华鑫证券,2024-11-05,酿酒行业,https://pdf.dfcfw.com/pdf/H3_AP202411051640732460_1.pdf?1730846551000.pdf
食品饮料周报：需求整体承压，三季报环比降速,平安证券,2024-11-04,酿酒行业,https://pdf.dfcfw.com/pdf/H3_AP202411041640690615_1.pdf?1730711203000.pdf
调味品&乳制品2024Q3总结：盈利拐点先行，需求改善见曙光,东吴证券,2024-11-04,酿酒行业,https://pdf.dfcfw.com/pdf/H3_AP202411041640691581_1.pdf?1730718330000.pdf
食品综合2024年三季报总结：零食领跑，龙头韧性更佳,东吴证券,2024-11-04,酿酒行业,https://pdf.dfcfw.com/pdf/H3_AP202411041640692803_1.pdf?1730718615000.pdf
食品饮料行业周报：白酒三季报增速放缓，大众品成本改善,东海证券,2024-11-04,酿酒行业,https://pdf.dfcfw.com/pdf/H3_AP202411041640703775_1.pdf?1730743311000.pdf
白酒行业研究：表观降速以对渠道舒压，梳理阵脚亟待景气复苏,国金证券,2024-11-03,酿酒行业,https://pdf.dfcfw.com/pdf/H3_AP202411031640686830_1.pdf?1730649191000.pdf
