研报名称,机构名称,发布时间,行业,研报地址
食品饮料行业双周报：预制菜国标公开征求意见，关注春节需求表现,东莞证券,2026-02-13,酿酒行业,https://pdf.dfcfw.com/pdf/H3_AP202602131819918267_1.pdf?1770996381000.pdf
食品饮料行业研究周报：名酒节前动销超预期，预制菜新国标推动市场集中,申港证券,2026-02-11,酿酒行业,https://pdf.dfcfw.com/pdf/H3_AP202602111819880793_1.pdf?1770830742000.pdf
2025新酒饮行业发展报告,泰安尚道网络科技,2026-02-09,酿酒行业,https://pdf.dfcfw.com/pdf/H3_AP202602071819822666_1.pdf?1770620241000.pdf
食品饮料行业周报（26年第6周）：白酒春节动销渐起，预制菜国标公开征求意见,国信证券,2026-02-09,酿酒行业,https://pdf.dfcfw.com/pdf/H3_AP202602091819830792_1.pdf?1770644348000.pdf
中国酒类行业展望，2026年2月,中诚信国际,2026-02-09,酿酒行业,https://pdf.dfcfw.com/pdf/H3_AP202602091819836510_1.pdf?1770658994000.pdf
食品饮料行业跟踪报告：线上i茅台数据亮眼，线下茅台量价超预期,爱建证券,2026-02-09,酿酒行业,https://pdf.dfcfw.com/pdf/H3_AP202602091819833716_1.pdf?1770653200000.pdf
食品饮料行业研究：动销支撑茅台批价再上行，关注餐饮链改善催化,国金证券,2026-02-08,酿酒行业,https://pdf.dfcfw.com/pdf/H3_AP202602081819824512_1.pdf?1770560942000.pdf
食品饮料行业周报：复苏态势明朗，板块预期乐观,开源证券,2026-02-08,酿酒行业,https://pdf.dfcfw.com/pdf/H3_AP202602081819824595_1.pdf?1770562529000.pdf
食品饮料行业点评报告：修复趋势确立，坚定板块布局,开源证券,2026-02-06,酿酒行业,https://pdf.dfcfw.com/pdf/H3_AP202602061819800352_1.pdf?1770366067000.pdf
食品饮料行业周报：旺季预期积极，关注春节备货行情,东海证券,2026-02-03,酿酒行业,https://pdf.dfcfw.com/pdf/H3_AP202602031819617377_1.pdf?1770136402000.pdf
食品饮料行业周报：茅台春节需求韧性超预期，大众品底部改善趋势明确,开源证券,2026-02-02,酿酒行业,https://pdf.dfcfw.com/pdf/H3_AP202602021819257615_1.pdf?1770023626000.pdf
食品饮料行业跟踪报告：茅台春节需求韧性超预期，批价加速修复,爱建证券,2026-02-02,酿酒行业,https://pdf.dfcfw.com/pdf/H3_AP202602021819356059_1.pdf?1770053709000.pdf
食品饮料行业行业动态更新：茅台飞天批价回暖，关注春节动销催化,中国银河,2026-01-31,酿酒行业,https://pdf.dfcfw.com/pdf/H3_AP202601301818629288_1.pdf?1769854679000.pdf
食品饮料行业双周报：市场波动短期增加，关注春节需求表现,东莞证券,2026-01-30,酿酒行业,https://pdf.dfcfw.com/pdf/H3_AP202601301818583712_1.pdf?1769791424000.pdf
食品饮料行业研究周报：白酒名酒大单品批价有所回升，关注传统消费品类或底部改善机会,申港证券,2026-01-30,酿酒行业,https://pdf.dfcfw.com/pdf/H3_AP202601301818585307_1.pdf?1769793161000.pdf
食品饮料行业点评报告：2025Q4食品饮料持仓回落，布局窗口渐行渐近,开源证券,2026-01-28,酿酒行业,https://pdf.dfcfw.com/pdf/H3_AP202601281818486967_1.pdf?1769587693000.pdf
食品饮料行业2025Q4基金持仓分析：食饮重仓比例持续下降，除酒类外的细分板块重仓比例回升,万联证券,2026-01-28,酿酒行业,https://pdf.dfcfw.com/pdf/H3_AP202601281818487362_1.pdf?1769587792000.pdf
食品饮料行业跟踪周报：大众品迎春季躁动，茅台动销两旺先触底,东吴证券,2026-01-27,酿酒行业,https://pdf.dfcfw.com/pdf/H3_AP202601271818439343_1.pdf?1769473208000.pdf
食品饮料行业周报：奶价持续磨底，餐饮边际改善,东海证券,2026-01-27,酿酒行业,https://pdf.dfcfw.com/pdf/H3_AP202601271818453586_1.pdf?1769509105000.pdf
食品饮料行业周报：板块阶段性底部，关注春节备货催化,太平洋,2026-01-27,酿酒行业,https://pdf.dfcfw.com/pdf/H3_AP202601271818449602_1.pdf?1769502841000.pdf
食品饮料行业周报（26年第4周）：各品类春节备货有序进行，预制菜国标将征求意见,国信证券,2026-01-26,酿酒行业,https://pdf.dfcfw.com/pdf/H3_AP202601261818417423_1.pdf?1769426152000.pdf
食品饮料行业跟踪报告：茅台批价回暖，关注春节动销催化,爱建证券,2026-01-26,酿酒行业,https://pdf.dfcfw.com/pdf/H3_AP202601261818433639_1.pdf?1769455031000.pdf
食品饮料行业研究：飞天茅台动销逐步起势，关注子板块春节备货催化,国金证券,2026-01-25,酿酒行业,https://pdf.dfcfw.com/pdf/H3_AP202601251818396624_1.pdf?1769350884000.pdf
食品饮料行业周报：春节旺季备货催化，大众品迎来布局窗口,开源证券,2026-01-25,酿酒行业,https://pdf.dfcfw.com/pdf/H3_AP202601251818399312_1.pdf?1769361046000.pdf
食品饮料行业专题：为何关注食饮消费底部反转？,华安证券,2026-01-22,酿酒行业,https://pdf.dfcfw.com/pdf/H3_AP202601221818258600_1.pdf?1769077306000.pdf
食品饮料行业观点更新报告：茅台发布《市场化运营方案》，大众品关注细分板块龙头,华龙证券,2026-01-22,酿酒行业,https://pdf.dfcfw.com/pdf/H3_AP202601221818270391_1.pdf?1769095980000.pdf
食品饮料行业周报：茅台深化市场改革，百润股份价值显现,开源证券,2026-01-19,酿酒行业,https://pdf.dfcfw.com/pdf/H3_AP202601191818091317_1.pdf?1768812081000.pdf
食品饮料行业跟踪报告：茅台重塑价格体系，推进市场化改革,爱建证券,2026-01-19,酿酒行业,https://pdf.dfcfw.com/pdf/H3_AP202601191818113047_1.pdf?1768845005000.pdf
食品饮料行业周报：春节备货启动，肉奶周期共振,东海证券,2026-01-19,酿酒行业,https://pdf.dfcfw.com/pdf/H3_AP202601191818117716_1.pdf?1768852247000.pdf
