研报名称,机构名称,发布时间,行业,研报地址
白酒板块4月投资策略及第二季度展望：淡季需求回落，提振内需预期加强,国信证券,2025-04-10,酿酒行业,https://pdf.dfcfw.com/pdf/H3_AP202504101654169191_1.pdf?1744306636000.pdf
食品饮料行业：预期内需政策或进一步加码，关注食品饮料防守配置,东兴证券,2025-04-09,酿酒行业,https://pdf.dfcfw.com/pdf/H3_AP202504091653822289_1.pdf?1744224301000.pdf
食品饮料行业3月月报：食饮行情回暖，要素价格延续回落态势,中原证券,2025-04-09,酿酒行业,https://pdf.dfcfw.com/pdf/H3_AP202504091653862589_1.pdf?1744227888000.pdf
食品饮料行业周报：关税影响下内需配置价值凸显，关注基本面企稳绩优个股,太平洋,2025-04-08,酿酒行业,https://pdf.dfcfw.com/pdf/H3_AP202504081653105978_1.pdf?1744101818000.pdf
食品饮料行业：关税加码，关注内需主线,平安证券,2025-04-07,酿酒行业,https://pdf.dfcfw.com/pdf/H3_AP202504071652629055_1.pdf?1744015527000.pdf
食品饮料周报：茅台25年目标稳健奠定行业增长主基调，关注内需消费行情,天风证券,2025-04-07,酿酒行业,https://pdf.dfcfw.com/pdf/H3_AP202504071652733441_1.pdf?1744046172000.pdf
食品饮料行业周报：关税波动加剧，重视内需改善,东海证券,2025-04-07,酿酒行业,https://pdf.dfcfw.com/pdf/H3_AP202504071652898316_1.pdf?1744064332000.pdf
食品饮料行业周报：白酒板块攻守兼备，关注软饮等子板块旺季催化,国金证券,2025-04-06,酿酒行业,https://pdf.dfcfw.com/pdf/H3_AP202504061652157639_1.pdf?1743936516000.pdf
食品饮料行业周报：关税靴子落地，白酒韧性凸显,华鑫证券,2025-04-06,酿酒行业,https://pdf.dfcfw.com/pdf/H3_AP202504061652413904_1.pdf?1743979457000.pdf
食品饮料行业定期报告：国际环境局势震荡，内需促进或为市场主线,华福证券,2025-04-06,酿酒行业,https://pdf.dfcfw.com/pdf/H3_AP202504061652311475_1.pdf?1743957986000.pdf
食品饮料行业周报：酒企目标低调务实，零食多线发力值得关注,开源证券,2025-04-06,酿酒行业,https://pdf.dfcfw.com/pdf/H3_AP202504061652366989_1.pdf?1743969561000.pdf
食品饮料行业研究周报：财报验证下板块有望迎来修复,申港证券,2025-04-03,酿酒行业,https://pdf.dfcfw.com/pdf/H3_AP202504031650716801_1.pdf?1743676437000.pdf
食品饮料：糖酒会反馈基本符合预期，平稳中有亮点,东兴证券,2025-04-03,酿酒行业,https://pdf.dfcfw.com/pdf/H3_AP202504031650819556_1.pdf?1743695990000.pdf
食品饮料行业周报：基本面企稳，01业绩窗口期临近，关注低估值绩优个股,太平洋,2025-04-01,酿酒行业,https://pdf.dfcfw.com/pdf/H3_AP202504011649817610_1.pdf?1743497850000.pdf
食品饮料行业周报：细分赛道业绩优异，关注结构性机会,上海证券,2025-04-01,酿酒行业,https://pdf.dfcfw.com/pdf/H3_AP202504011649843783_1.pdf?1743505248000.pdf
食品饮料行业周报：年报陆续发布，关注基本面表现,东海证券,2025-04-01,酿酒行业,https://pdf.dfcfw.com/pdf/H3_AP202504011649913406_1.pdf?1743525757000.pdf
食品饮料行业周报：业绩期优选稳健配置，关注软饮等子板块旺季催化,国金证券,2025-03-31,酿酒行业,https://pdf.dfcfw.com/pdf/H3_AP202503311649459651_1.pdf?1743414610000.pdf
食品饮料行业周报：舍得股权激励落地，关注财报季催化,天风证券,2025-03-31,酿酒行业,https://pdf.dfcfw.com/pdf/H3_AP202503311649682822_1.pdf?1743452739000.pdf
食品饮料行业周报：白酒基本面平稳，优选绩优公司,平安证券,2025-03-31,酿酒行业,https://pdf.dfcfw.com/pdf/H3_AP202503311649538410_1.pdf?1743429348000.pdf
食品饮料行业周报：业绩密集披露期，关注结构性机会,华鑫证券,2025-03-30,酿酒行业,https://pdf.dfcfw.com/pdf/H3_AP202503301649186969_1.pdf?1743363147000.pdf
食品饮料行业周报：板块进入业绩披露期，建议低点加配布局,开源证券,2025-03-30,酿酒行业,https://pdf.dfcfw.com/pdf/H3_AP202503301649198029_1.pdf?1743368213000.pdf
食品饮料行业定期报告：信心持续修复，消费向上可期,华福证券,2025-03-30,酿酒行业,https://pdf.dfcfw.com/pdf/H3_AP202503301649141767_1.pdf?1743341702000.pdf
企业竞争图谱：2025年全球威士忌 头豹词条报告系列,头豹研究院,2025-03-28,酿酒行业,https://pdf.dfcfw.com/pdf/H3_AP202503281648737627_1.pdf?1743194355000.pdf
食品饮料行业双周报：春糖反馈平淡，期待需求改善,东莞证券,2025-03-28,酿酒行业,https://pdf.dfcfw.com/pdf/H3_AP202503281648683169_1.pdf?1743180150000.pdf
2025年春糖白酒观察：务实求变,信达证券,2025-03-28,酿酒行业,https://pdf.dfcfw.com/pdf/H3_AP202503281648747220_1.pdf?1743192314000.pdf
春糖总结：氛围平稳符合预期，看好潜在修复机会,天风证券,2025-03-27,酿酒行业,https://pdf.dfcfw.com/pdf/H3_AP202503271648108853_1.pdf?1743073938000.pdf
食品饮料行业：春糖反馈平稳，经销商利润改善,平安证券,2025-03-25,酿酒行业,https://pdf.dfcfw.com/pdf/H3_AP202503251647139532_1.pdf?1742887301000.pdf
食品饮料行业周报：糖酒会符合预期，关注底部机会,东海证券,2025-03-25,酿酒行业,https://pdf.dfcfw.com/pdf/H3_AP202503251647096884_1.pdf?1742877699000.pdf
2025年春季糖酒会反馈：白酒：平淡中的一些亮点,中国银河,2025-03-25,酿酒行业,https://pdf.dfcfw.com/pdf/H3_AP202503251647258435_1.pdf?1742910211000.pdf
食品饮料行业跟踪周报：业绩前瞻，白酒加速探底，大众品梯次复苏,东吴证券,2025-03-25,酿酒行业,https://pdf.dfcfw.com/pdf/H3_AP202503251647269859_1.pdf?1742911304000.pdf
食品饮料行业周报：板块进入业绩验证期，春季糖酒会反馈平淡，品牌之间分化加剧,中银证券,2025-03-25,酿酒行业,https://pdf.dfcfw.com/pdf/H3_AP202503251647383639_1.pdf?1742932516000.pdf
食品饮料行业周报：春糖反馈符合预期，关注一季度绩优个股,太平洋,2025-03-24,酿酒行业,https://pdf.dfcfw.com/pdf/H3_AP202503241646721532_1.pdf?1742806136000.pdf
食品饮料行业周报：春糖反馈平稳，关注需求复苏,上海证券,2025-03-24,酿酒行业,https://pdf.dfcfw.com/pdf/H3_AP202503241646782033_1.pdf?1742817738000.pdf
食品饮料行业周报：春糖会反馈符合预期，政策端持续加码消费,华鑫证券,2025-03-24,酿酒行业,https://pdf.dfcfw.com/pdf/H3_AP202503241646872255_1.pdf?1742834657000.pdf
食品饮料行业周报：糖酒会反馈平稳，关注估值修复机会,天风证券,2025-03-24,酿酒行业,https://pdf.dfcfw.com/pdf/H3_AP202503241646891936_1.pdf?1742838099000.pdf
食品饮料行业周报：糖酒会反馈：平淡中孕育新机,开源证券,2025-03-23,酿酒行业,https://pdf.dfcfw.com/pdf/H3_AP202503231646489796_1.pdf?1742760218000.pdf
食品饮料行业定期报告：底部区间夯实，积极布局消费复苏机遇,华福证券,2025-03-23,酿酒行业,https://pdf.dfcfw.com/pdf/H3_AP202503231646389672_1.pdf?1742742062000.pdf
食品饮料行业周报：底部企稳分化，春糖反馈符合预期,国金证券,2025-03-23,酿酒行业,https://pdf.dfcfw.com/pdf/H3_AP202503231646442790_1.pdf?1742750035000.pdf
食品饮料行业研究周报：提振消费政策持续加码，大众品修复机会凸显,申港证券,2025-03-22,酿酒行业,https://pdf.dfcfw.com/pdf/H3_AP202503221646091860_1.pdf?1742679258000.pdf
食品饮料行业周报：育儿补贴政策催化，关注乳品估值修复,华龙证券,2025-03-18,酿酒行业,https://pdf.dfcfw.com/pdf/H3_AP202503181644475580_1.pdf?1742294627000.pdf
食品饮料行业周报：政策力度加码，板块情绪回暖,东海证券,2025-03-18,酿酒行业,https://pdf.dfcfw.com/pdf/H3_AP202503181644482148_1.pdf?1742311628000.pdf
食品饮料行业周报：消费政策提振预期，看好白酒后续估值表现,天风证券,2025-03-18,酿酒行业,https://pdf.dfcfw.com/pdf/H3_AP202503181644489135_1.pdf?1742320778000.pdf
食品饮料行业跟踪周报：周专题：政策春风至，加快乳业复苏,东吴证券,2025-03-17,酿酒行业,https://pdf.dfcfw.com/pdf/H3_AP202503171644428072_1.pdf?1742202307000.pdf
食品饮料行业：生育补贴提振信心，关注糖酒会反馈,平安证券,2025-03-17,酿酒行业,https://pdf.dfcfw.com/pdf/H3_AP202503171644434262_1.pdf?1742198735000.pdf
食品饮料行业周报：消费政策预期提振，关注估值修复机会,太平洋,2025-03-17,酿酒行业,https://pdf.dfcfw.com/pdf/H3_AP202503171644434996_1.pdf?1742201404000.pdf
食品饮料行业周报：政策刺激提振信心，板块情绪回暖，关注低估值下的配置机会,中银证券,2025-03-17,酿酒行业,https://pdf.dfcfw.com/pdf/H3_AP202503171644447927_1.pdf?1742228552000.pdf
食品饮料行业周报：政策加码提振信心，把握布局机会,上海证券,2025-03-17,酿酒行业,https://pdf.dfcfw.com/pdf/H3_AP202503171644447756_1.pdf?1742228231000.pdf
白酒行业行业研究：复盘专题：如何看待转折期时白酒配置价值？,国金证券,2025-03-17,酿酒行业,https://pdf.dfcfw.com/pdf/H3_AP202503171644442355_1.pdf?1742220335000.pdf
食品饮料行业周报：地方促生育政策发布，有效提振消费信心,华鑫证券,2025-03-16,酿酒行业,https://pdf.dfcfw.com/pdf/H3_AP202503161644419421_1.pdf?1742138164000.pdf
食品饮料行业周报：政策催化内需风起，持续推荐各子板块禀赋型公司,国金证券,2025-03-16,酿酒行业,https://pdf.dfcfw.com/pdf/H3_AP202503161644419379_1.pdf?1742135520000.pdf
食品饮料行业周报：底部区间板块回暖，生育补贴政策催化显著,开源证券,2025-03-16,酿酒行业,https://pdf.dfcfw.com/pdf/H3_AP202503161644419374_1.pdf?1742135413000.pdf
食品饮料行业定期报告：复苏预期持续强化，白酒进入估值修复阶段,华福证券,2025-03-16,酿酒行业,https://pdf.dfcfw.com/pdf/H3_AP202503161644422789_1.pdf?1742148702000.pdf
食品饮料行业双周报：两会积极定调，关注需求复苏进程,东莞证券,2025-03-14,酿酒行业,https://pdf.dfcfw.com/pdf/H3_AP202503141644369628_1.pdf?1741967364000.pdf
白酒板块3月投资策略及25Q1前瞻：板块进入估值修复阶段，优质公司已浮出水面,国信证券,2025-03-14,酿酒行业,https://pdf.dfcfw.com/pdf/H3_AP202503141644380912_1.pdf?1741982847000.pdf
食品饮料行业2025年度策略：至暗已过，柳暗花明,山西证券,2025-03-12,酿酒行业,https://pdf.dfcfw.com/pdf/H3_AP202503121644280279_1.pdf?1741763592000.pdf
食品饮料行业周报：稳步经营，把握结构性机会,上海证券,2025-03-11,酿酒行业,https://pdf.dfcfw.com/pdf/H3_AP202503111644258604_1.pdf?1741691639000.pdf
食品饮料行业研究：白酒淡季动销平稳，软饮景气红利仍上行,国金证券,2025-03-10,酿酒行业,https://pdf.dfcfw.com/pdf/H3_AP202503101644222532_1.pdf?1741598845000.pdf
食品饮料行业周报：基本面筑底企稳，把握重估机会,平安证券,2025-03-10,酿酒行业,https://pdf.dfcfw.com/pdf/H3_AP202503101644225924_1.pdf?1741608896000.pdf
食品饮料行业周报：两会定调积极，关注板块估值修复机会,天风证券,2025-03-10,酿酒行业,https://pdf.dfcfw.com/pdf/H3_AP202503101644228440_1.pdf?1741618124000.pdf
食品饮料行业周报：扩内需促消费，政策催化持续,东海证券,2025-03-10,酿酒行业,https://pdf.dfcfw.com/pdf/H3_AP202503101644233767_1.pdf?1741625864000.pdf
食品饮料行业周报：两会强化扩内需，消费环境持续改善,华鑫证券,2025-03-09,酿酒行业,https://pdf.dfcfw.com/pdf/H3_AP202503091644210089_1.pdf?1741546957000.pdf
食品饮料行业周报：政策积极乐观，底部重视消费,开源证券,2025-03-09,酿酒行业,https://pdf.dfcfw.com/pdf/H3_AP202503091644212793_1.pdf?1741558378000.pdf
食品饮料行业周报：2025年政府工作报告强调扩内需、促消费，关注当前位置消费板块估值修复机会,中银证券,2025-03-09,酿酒行业,https://pdf.dfcfw.com/pdf/H3_AP202503091644204982_1.pdf?1741526110000.pdf
食品饮料行业定期报告：边际改善方向明确，静待需求稳步恢复,华福证券,2025-03-09,酿酒行业,https://pdf.dfcfw.com/pdf/H3_AP202503091644206882_1.pdf?1741533605000.pdf
白酒行业专题研究：投资体系探讨：白酒周期复盘，拨云见日或可期,天风证券,2025-03-07,酿酒行业,https://pdf.dfcfw.com/pdf/H3_AP202503071644146095_1.pdf?1741361558000.pdf
食品饮料行业研究周报：消费预期有望逐步回升，关注大众品修复机会,申港证券,2025-03-06,酿酒行业,https://pdf.dfcfw.com/pdf/H3_AP202503061644104558_1.pdf?1741261598000.pdf
食品饮料行业周报：淡季基本面平淡，仍以配置为主线,国都证券,2025-03-05,酿酒行业,https://pdf.dfcfw.com/pdf/H3_AP202503051644062862_1.pdf?1741164229000.pdf
食品饮料行业周报：白酒控货挺价，短期或具补涨行情,国都证券,2025-03-05,酿酒行业,https://pdf.dfcfw.com/pdf/H3_AP202503051644062863_1.pdf?1741164163000.pdf
食品饮料渠道变革系列报告（一）：白酒线上化风起，挑战与机会并行,平安证券,2025-03-05,酿酒行业,https://pdf.dfcfw.com/pdf/H3_AP202503051644076963_1.pdf?1741194608000.pdf
食品饮料行业周报：两会临近，关注板块估值修复机会,天风证券,2025-03-04,酿酒行业,https://pdf.dfcfw.com/pdf/H3_AP202503041644025792_1.pdf?1741076359000.pdf
食品饮料行业跟踪周报：周专题：乳业上游出清加速，预期方向带动个股表现,东吴证券,2025-03-03,酿酒行业,https://pdf.dfcfw.com/pdf/H3_AP202503031643663320_1.pdf?1740962164000.pdf
食品饮料行业周报：具备经营韧性，板块有望逐步修复,上海证券,2025-03-03,酿酒行业,https://pdf.dfcfw.com/pdf/H3_AP202503031643835293_1.pdf?1740999316000.pdf
食品饮料行业研究：企稳向好的基本面支撑情绪修复，把握低位配置契机,国金证券,2025-03-03,酿酒行业,https://pdf.dfcfw.com/pdf/H3_AP202503031643962160_1.pdf?1741003679000.pdf
食品饮料周报（25年第9周）：政策预期升温，板块估值修复,国信证券,2025-03-03,酿酒行业,https://pdf.dfcfw.com/pdf/H3_AP202503031644000056_1.pdf?1741023643000.pdf
食品饮料行业点评报告：供需正在趋于平衡，原奶价格有望企稳,中原证券,2025-03-03,酿酒行业,https://pdf.dfcfw.com/pdf/H3_AP202503031644002877_1.pdf?1741021217000.pdf
食品饮料行业周报：底部反弹，预期回暖,东海证券,2025-03-03,酿酒行业,https://pdf.dfcfw.com/pdf/H3_AP202503031644008029_1.pdf?1741028260000.pdf
食品饮料行业报告：估值底部、安全边际充足，关注两会内需相关政策,中邮证券,2025-03-03,酿酒行业,https://pdf.dfcfw.com/pdf/H3_AP202503031644006803_1.pdf?1741039248000.pdf
食品饮料行业周报：基本面企稳向好，行业配置价值凸显,平安证券,2025-03-02,酿酒行业,https://pdf.dfcfw.com/pdf/H3_AP202503021643659271_1.pdf?1740941728000.pdf
食品饮料行业定期报告：情绪回暖，复苏可期,华福证券,2025-03-02,酿酒行业,https://pdf.dfcfw.com/pdf/H3_AP202503021643653684_1.pdf?1740919845000.pdf
食品饮料行业周报：政策催化消费，蜜雪申购超预期,华鑫证券,2025-03-02,酿酒行业,https://pdf.dfcfw.com/pdf/H3_AP202503021643654991_1.pdf?1740926187000.pdf
食品饮料行业周报：市场风格切换，板块预期回暖,开源证券,2025-03-02,酿酒行业,https://pdf.dfcfw.com/pdf/H3_AP202503021643657088_1.pdf?1740934342000.pdf
食品饮料行业双周报：白酒淡季控货挺价，大众品关注景气细分,东莞证券,2025-02-28,酿酒行业,https://pdf.dfcfw.com/pdf/H3_AP202502281643605978_1.pdf?1740758020000.pdf
食品饮料行业周报：酒企积极停货稳价，政策驱动内需复苏,东海证券,2025-02-25,酿酒行业,https://pdf.dfcfw.com/pdf/H3_AP202502251643470265_1.pdf?1740475679000.pdf
食品饮料行业：酒厂密集停货，加大供给侧管控,平安证券,2025-02-24,酿酒行业,https://pdf.dfcfw.com/pdf/H3_AP202502241643423756_1.pdf?1740384346000.pdf
食品饮料行业周报：板块分化，关注结构性机会,上海证券,2025-02-24,酿酒行业,https://pdf.dfcfw.com/pdf/H3_AP202502241643441272_1.pdf?1740419910000.pdf
食品饮料行业周报：白酒淡季密集控货，关注入通标的机会,天风证券,2025-02-24,酿酒行业,https://pdf.dfcfw.com/pdf/H3_AP202502241643442118_1.pdf?1740421018000.pdf
食品饮料行业周报：白酒控货稳价，原奶价格寻底,开源证券,2025-02-23,酿酒行业,https://pdf.dfcfw.com/pdf/H3_AP202502231643411371_1.pdf?1740328650000.pdf
食品饮料行业定期报告：消费利好政策频发，市场预期逐步改善,华福证券,2025-02-23,酿酒行业,https://pdf.dfcfw.com/pdf/H3_AP202502231643407894_1.pdf?1740315525000.pdf
食品饮料行业周报：酒企节后密集停货，关注软饮等入通催化,国金证券,2025-02-23,酿酒行业,https://pdf.dfcfw.com/pdf/H3_AP202502231643412341_1.pdf?1740334086000.pdf
食品饮料行业研究周报：提振消费政策预期有望带动板块行情,申港证券,2025-02-20,酿酒行业,https://pdf.dfcfw.com/pdf/H3_AP202502201643327090_1.pdf?1740071630000.pdf
食品饮料：关注经济复苏带来的白酒消费复苏,东兴证券,2025-02-19,酿酒行业,https://pdf.dfcfw.com/pdf/H3_AP202502191643242495_1.pdf?1739953118000.pdf
食品饮料行业周报：市场预期回暖，静待需求修复,东海证券,2025-02-18,酿酒行业,https://pdf.dfcfw.com/pdf/H3_AP202502181643194652_1.pdf?1739891532000.pdf
食品饮料行业：政策预期回暖，白酒估值修复,平安证券,2025-02-17,酿酒行业,https://pdf.dfcfw.com/pdf/H3_AP202502171643155137_1.pdf?1739780509000.pdf
食品饮料行业周报：淡季白酒表现平稳，关注乳制品25年机会,天风证券,2025-02-17,酿酒行业,https://pdf.dfcfw.com/pdf/H3_AP202502171643161316_1.pdf?1739798773000.pdf
食品饮料行业周报：政策托底助力情绪修复，静待花开,上海证券,2025-02-17,酿酒行业,https://pdf.dfcfw.com/pdf/H3_AP202502171643162087_1.pdf?1739799686000.pdf
食品饮料周报（25年第7周）：白酒政策预期升温，本周板块估值修复,国信证券,2025-02-17,酿酒行业,https://pdf.dfcfw.com/pdf/H3_AP202502171643163548_1.pdf?1739814388000.pdf
食品饮料行业周报：促消费政策积极，关注需求修复边际改善,华龙证券,2025-02-17,酿酒行业,https://pdf.dfcfw.com/pdf/H3_AP202502171643169996_1.pdf?1739826675000.pdf
食品饮料行业周报：顺周期催化白酒板块反弹，配置价值仍看好,国金证券,2025-02-16,酿酒行业,https://pdf.dfcfw.com/pdf/H3_AP202502161643145754_1.pdf?1739739317000.pdf
食品饮料行业周报：白酒筑底具备配置价值，大众品成长性思路选股,开源证券,2025-02-16,酿酒行业,https://pdf.dfcfw.com/pdf/H3_AP202502161643146470_1.pdf?1739739866000.pdf
酒行业周度市场观察第7周,艾瑞股份,2025-02-16,酿酒行业,https://pdf.dfcfw.com/pdf/H3_AP202502151643125789_1.pdf?1739719281000.pdf
食品饮料：春节旺季平稳度过，把握顺周期回升机会,华福证券,2025-02-16,酿酒行业,https://pdf.dfcfw.com/pdf/H3_AP202502161643143099_1.pdf?1739726915000.pdf
食品饮料行业周报：政策催化板块上涨，关注后续落地情况,华鑫证券,2025-02-16,酿酒行业,https://pdf.dfcfw.com/pdf/H3_AP202502161643143126_1.pdf?1739736235000.pdf
国常会再提消费，关注节后需求复苏进程,东莞证券,2025-02-14,酿酒行业,https://pdf.dfcfw.com/pdf/H3_AP202502141643089534_1.pdf?1739553861000.pdf
白酒板块2月投资策略：春节动销延续“弱需求、强分化”，酒企重视秩序维护,国信证券,2025-02-13,酿酒行业,https://pdf.dfcfw.com/pdf/H3_AP202502131643046261_1.pdf?1739454964000.pdf
食品饮料行业2025年1月月报：春节消费支撑有限，节后板块下跌较多,中原证券,2025-02-11,酿酒行业,https://pdf.dfcfw.com/pdf/H3_AP202502111642970441_1.pdf?1739289547000.pdf
食品饮料行业报告：春节跟踪：白酒动销略好于预期，酵母需求韧性强,中邮证券,2025-02-10,酿酒行业,https://pdf.dfcfw.com/pdf/H3_AP202502101642940180_1.pdf?1739210313000.pdf
食品饮料行业周报：春节动销符合预期，关注渠道变革,东海证券,2025-02-10,酿酒行业,https://pdf.dfcfw.com/pdf/H3_AP202502101642945219_1.pdf?1739215599000.pdf
食品饮料行业周报：春节表现平稳，聚焦高质量发展,上海证券,2025-02-10,酿酒行业,https://pdf.dfcfw.com/pdf/H3_AP202502101642932636_1.pdf?1739194064000.pdf
食品饮料行业周报：白酒动销表现分化，大众品需求回暖,华鑫证券,2025-02-09,酿酒行业,https://pdf.dfcfw.com/pdf/H3_AP202502091642918509_1.pdf?1739140966000.pdf
食品饮料行业周报：春节动销符合预期，大众品机会更显著,开源证券,2025-02-09,酿酒行业,https://pdf.dfcfw.com/pdf/H3_AP202502091642913625_1.pdf?1739118580000.pdf
食品饮料行业周报：板块春节动销符合预期，关注顺周期及新渠道催化,国金证券,2025-02-09,酿酒行业,https://pdf.dfcfw.com/pdf/H3_AP202502091642913965_1.pdf?1739119165000.pdf
食品饮料行业周报：春节平稳过度，供给持续优化,平安证券,2025-02-09,酿酒行业,https://pdf.dfcfw.com/pdf/H3_AP202502091642916323_1.pdf?1739131128000.pdf
食品饮料行业研究周报：春节消费平稳回升，龙头酒企控货显理性,申港证券,2025-02-07,酿酒行业,https://pdf.dfcfw.com/pdf/H3_AP202502071642855743_1.pdf?1738918866000.pdf
春节白酒渠道反馈：需求平稳，供给理性,平安证券,2025-02-06,酿酒行业,https://pdf.dfcfw.com/pdf/H3_AP202502061642835871_1.pdf?1738859526000.pdf
食品饮料行业周报：春节白酒动销符合预期，零食量贩品类逐步完善,华鑫证券,2025-02-04,酿酒行业,https://pdf.dfcfw.com/pdf/H3_AP202502041642770500_1.pdf?1738683651000.pdf
食品饮料行业周报：龙头公司业绩优异，关注春节表现,上海证券,2025-01-27,酿酒行业,https://pdf.dfcfw.com/pdf/H3_AP202501271642586075_1.pdf?1737970087000.pdf
食品饮料行业周报：食品饮料仓位回落，春节白酒平淡大众品较好,开源证券,2025-01-26,酿酒行业,https://pdf.dfcfw.com/pdf/H3_AP202501261642568055_1.pdf?1737905251000.pdf
食品饮料行业研究：白酒重仓持股持续回落，大众品子板块禀赋优势推荐重视,国金证券,2025-01-26,酿酒行业,https://pdf.dfcfw.com/pdf/H3_AP202501261642569542_1.pdf?1737907983000.pdf
食品饮料行业周报：大众品动销向好，关注白酒动销情况,华鑫证券,2025-01-26,酿酒行业,https://pdf.dfcfw.com/pdf/H3_AP202501261642574223_1.pdf?1737924187000.pdf
食品饮料行业周报：临近春节白酒动销回款逐步改善，大众价格带韧性充足,太平洋,2025-01-24,酿酒行业,https://pdf.dfcfw.com/pdf/H3_AP202501241642519960_1.pdf?1737735563000.pdf
食品饮料行业周报：春节出货期已近，关注各赛道动销情况,国金证券,2025-01-20,酿酒行业,https://pdf.dfcfw.com/pdf/H3_AP202501201642354153_1.pdf?1737366010000.pdf
食品饮料行业跟踪周报：白酒春节前瞻：降速筑底，破而后立,东吴证券,2025-01-20,酿酒行业,https://pdf.dfcfw.com/pdf/H3_AP202501201642356354_1.pdf?1737372626000.pdf
食品饮料行业：宴席回补明显，大众价格带表现更优,平安证券,2025-01-20,酿酒行业,https://pdf.dfcfw.com/pdf/H3_AP202501201642357906_1.pdf?1737376400000.pdf
食品饮料行业周报：头部企业赴港上市助力全球化发展，关注国内需求表现,上海证券,2025-01-20,酿酒行业,https://pdf.dfcfw.com/pdf/H3_AP202501201642361575_1.pdf?1737387111000.pdf
食品饮料行业周报：12月社零提速，积极验证旺季动销,东海证券,2025-01-20,酿酒行业,https://pdf.dfcfw.com/pdf/H3_AP202501201642363148_1.pdf?1737387889000.pdf
食品饮料行业周报：社零数据好于预期，茅台1935坐稳百亿单品,华鑫证券,2025-01-19,酿酒行业,https://pdf.dfcfw.com/pdf/H3_AP202501191642338652_1.pdf?1737304732000.pdf
食品饮料行业周报：关注白酒旺季中档价位表现，看好低估值修复机会,天风证券,2025-01-19,酿酒行业,https://pdf.dfcfw.com/pdf/H3_AP202501191642342013_1.pdf?1737319210000.pdf
中国酒类行业展望，2025年1月,中诚信国际,2025-01-17,酿酒行业,https://pdf.dfcfw.com/pdf/H3_AP202501171642011401_1.pdf?1737130271000.pdf
关注春节旺季备货情况,东莞证券,2025-01-17,酿酒行业,https://pdf.dfcfw.com/pdf/H3_AP202501171642157300_1.pdf?1737134316000.pdf
食品饮料行业研究周报：宴席预定量增长或支撑白酒春节消费,申港证券,2025-01-16,酿酒行业,https://pdf.dfcfw.com/pdf/H3_AP202501161641947821_1.pdf?1737038847000.pdf
白酒板块1月投资策略：春节动销逐步起量，渠道演绎强者恒强,国信证券,2025-01-15,酿酒行业,https://pdf.dfcfw.com/pdf/H3_AP202501151641936109_1.pdf?1736962075000.pdf
食品饮料周报：软饮短期表现居前，关注旺季白酒动销&发货,天风证券,2025-01-14,酿酒行业,https://pdf.dfcfw.com/pdf/H3_AP202501141641912459_1.pdf?1736854240000.pdf
食品饮料周报：五粮液暂停供货，春节旺季逐渐开启,东兴证券,2025-01-14,酿酒行业,https://pdf.dfcfw.com/pdf/H3_AP202501141641921858_1.pdf?1736881468000.pdf
食品饮料行业周报：旺销已近，关注各赛道备货及消费反馈的催化,国金证券,2025-01-13,酿酒行业,https://pdf.dfcfw.com/pdf/H3_AP202501131641897653_1.pdf?1736755037000.pdf
食品饮料行业周报：五粮液珍酒停货，关注年货节催化,华鑫证券,2025-01-13,酿酒行业,https://pdf.dfcfw.com/pdf/H3_AP202501131641898030_1.pdf?1736757632000.pdf
食品饮料行业周报：春节预热，关注动销表现,上海证券,2025-01-13,酿酒行业,https://pdf.dfcfw.com/pdf/H3_AP202501131641899071_1.pdf?1736762739000.pdf
