研报名称,机构名称,发布时间,行业,研报地址
食品饮料行业周报：茅台批价止跌回升，休闲零食景气颇高,华金证券,2024-04-14,食品饮料,https://pdf.dfcfw.com/pdf/H3_AP202404141630209951_1.pdf?1713167856000.pdf
食品饮料行业深度研究：春糖略超预期，行业信心回暖,天风证券,2024-04-12,食品饮料,https://pdf.dfcfw.com/pdf/H3_AP202404121630172250_1.pdf?1712910763000.pdf
食品饮料：春糖反馈略超预期 关注龙头韧性再认知,南京证券,2024-04-12,食品饮料,https://pdf.dfcfw.com/pdf/H3_AP202404121630175752_1.pdf?1712928425000.pdf
食品饮料行业：茅台批价还会跌吗？,东兴证券,2024-04-12,食品饮料,https://pdf.dfcfw.com/pdf/H3_AP202404121630180042_1.pdf?1712938691000.pdf
行业升级趋势下，传统品类如何讲好新故事？ 词条报告系列,头豹研究院,2024-04-12,食品饮料,https://pdf.dfcfw.com/pdf/H3_AP202404121630191617_1.pdf?1712950847000.pdf
食品饮料行业研究报告：白酒淡季表现平稳 关注财报季超预期机会,南京证券,2024-04-11,食品饮料,https://pdf.dfcfw.com/pdf/H3_AP202404111630140202_1.pdf?1712833180000.pdf
食品饮料行业专题：24Q1业绩分析与前瞻：需求有韧性，节日效应凸显，关注结构性成长机会,国投证券,2024-04-11,食品饮料,https://pdf.dfcfw.com/pdf/H3_AP202404111630142997_1.pdf?1712848542000.pdf
中国食品级透明质酸终端产品（透明质酸食品）行业市场规模测算逻辑模型 头豹词条报告系列,头豹研究院,2024-04-11,食品饮料,https://pdf.dfcfw.com/pdf/H3_AP202404111630158166_1.pdf?1712864168000.pdf
食品行业周报：清明假期国内旅游出游人次较19年同比增长11.5%,海通国际,2024-04-10,食品饮料,https://pdf.dfcfw.com/pdf/H3_AP202404101630101059_1.pdf?1712738030000.pdf
食品饮料行业周度市场观察2024年第8周,艾瑞股份,2024-04-10,食品饮料,https://pdf.dfcfw.com/pdf/H3_AP202404101630104782_1.pdf?1712756577000.pdf
酒行业周度市场观察第8周,艾瑞股份,2024-04-10,食品饮料,https://pdf.dfcfw.com/pdf/H3_AP202404101630104781_1.pdf?1712761417000.pdf
酒行业周度市场观察第14周,艾瑞股份,2024-04-10,食品饮料,https://pdf.dfcfw.com/pdf/H3_AP202404101630104896_1.pdf?1712761417000.pdf
食品饮料行业周度市场观察第14周,艾瑞股份,2024-04-10,食品饮料,https://pdf.dfcfw.com/pdf/H3_AP202404101630104898_1.pdf?1712761326000.pdf
食品饮料行业周报：茅台分红再创历史新高，关注业绩确定性标的,华龙证券,2024-04-09,食品饮料,https://pdf.dfcfw.com/pdf/H3_AP202404091630067726_1.pdf?1712659506000.pdf
食品饮料行业研究周报：白酒关注淡季批价和库存 休闲食品高景气验证,申港证券,2024-04-09,食品饮料,https://pdf.dfcfw.com/pdf/H3_AP202404091630078070_1.pdf?1712694283000.pdf
产品还是渠道，同质化困局下的思变与突围 词条报告系列,头豹研究院,2024-04-09,食品饮料,https://pdf.dfcfw.com/pdf/H3_AP202404091630085831_1.pdf?1712691353000.pdf
食品饮料行业4月月度策略及一季度前瞻：渠道信心逐步恢复，板块一季度有望实现开门红,国信证券,2024-04-08,食品饮料,https://pdf.dfcfw.com/pdf/H3_AP202404081630057956_1.pdf?1712605452000.pdf
食品饮料行业周报：清明出游热度高涨，餐饮市场活力迸发,德邦证券,2024-04-08,食品饮料,https://pdf.dfcfw.com/pdf/H3_AP202404081630040456_1.pdf?1712567148000.pdf
中国白糖行业市场规模测算逻辑模型 头豹词条报告系列,头豹研究院,2024-04-08,食品饮料,https://pdf.dfcfw.com/pdf/H3_AP202404081630057367_1.pdf?1712605100000.pdf
消费行业4月投资策略：高股息主线暂歇，资金面经济面预期升温,海通国际,2024-04-07,食品饮料,https://pdf.dfcfw.com/pdf/H3_AP202404071630032784_1.pdf?1712484183000.pdf
食品饮料行业周报：清明消费逐步恢复，茅台24年稳中求进,华金证券,2024-04-07,食品饮料,https://pdf.dfcfw.com/pdf/H3_AP202404071630039877_1.pdf?1712562572000.pdf
24Q1酒类前瞻：白酒分化加速，宏观复苏在途,国联证券,2024-04-07,食品饮料,https://pdf.dfcfw.com/pdf/H3_AP202404071630034512_1.pdf?1712498370000.pdf
大众品2024Q1前瞻：消费需求平稳，业绩分化明显,国联证券,2024-04-07,食品饮料,https://pdf.dfcfw.com/pdf/H3_AP202404071630034875_1.pdf?1712503514000.pdf
法规审批对于食品配料的发展至关重要,信达证券,2024-04-07,食品饮料,https://pdf.dfcfw.com/pdf/H3_AP202404071630037001_1.pdf?1712511156000.pdf
白酒思考系列报告：从茅五批价看需求结构性和市场特征,国投证券,2024-04-05,食品饮料,https://pdf.dfcfw.com/pdf/H3_AP202404041629852060_1.pdf?1712310563000.pdf
HTI大众品零售价格跟踪：方便食品折扣力度较3月初明显减小，啤酒明显增加,海通国际,2024-04-05,食品饮料,https://pdf.dfcfw.com/pdf/H3_AP202404051629949692_1.pdf?1712323791000.pdf
食品饮料酒类行业点评：白酒优势公司市占率加速提升，啤酒结构升级趋势确定,中银证券,2024-04-03,食品饮料,https://pdf.dfcfw.com/pdf/H3_AP202404031629688493_1.pdf?1712141633000.pdf
餐饮出海专题之一：中式餐饮出海机遇,华福证券,2024-04-03,食品饮料,https://pdf.dfcfw.com/pdf/H3_AP202404031629690592_1.pdf?1712153952000.pdf
HTI消费品3月需求月报：需求弱增长，基数仍高位,海通国际,2024-04-03,食品饮料,https://pdf.dfcfw.com/pdf/H3_AP202404031629710298_1.pdf?1712171454000.pdf
食品饮料行业点评报告：预制菜新规出台，助推行业高质量发展,华鑫证券,2024-04-02,食品饮料,https://pdf.dfcfw.com/pdf/H3_AP202404021629376641_1.pdf?1712046182000.pdf
中国食品饮料：白酒批发价格跟踪：飞天批价连续下行，淡季优先控货稳价,海通国际,2024-04-02,食品饮料,https://pdf.dfcfw.com/pdf/H3_AP202404021629387596_1.pdf?1712050556000.pdf
食品饮料行业周报：关注年报业绩表现，分化下仍有亮点,德邦证券,2024-04-01,食品饮料,https://pdf.dfcfw.com/pdf/H3_AP202404011629191709_1.pdf?1711961878000.pdf
食品饮料行业周报：良之隆热度依旧，高性价比颇受关注,华金证券,2024-04-01,食品饮料,https://pdf.dfcfw.com/pdf/H3_AP202404011629212194_1.pdf?1712000549000.pdf
食品饮料：1-2月社零略超预期 预制菜行业进一步规范,南京证券,2024-03-29,食品饮料,https://pdf.dfcfw.com/pdf/H3_AP202403291629034247_1.pdf?1711719814000.pdf
白糖行业研究：低糖低脂，传统白糖如何破局？头豹词条报告系列,头豹研究院,2024-03-29,食品饮料,https://pdf.dfcfw.com/pdf/H3_AP202403291629061926_1.pdf?1711745404000.pdf
苏式月饼行业研究：电商渠道普及，苏式月饼或焕“新生”头豹词条报告系列,头豹研究院,2024-03-28,食品饮料,https://pdf.dfcfw.com/pdf/H3_AP202403281628474238_1.pdf?1711656869000.pdf
休闲零食行业深度报告：把握机遇，乘势而上,东莞证券,2024-03-27,食品饮料,https://pdf.dfcfw.com/pdf/H3_AP202403271628303883_1.pdf?1711557583000.pdf
2024年春季糖酒会专题：春糖总结—产业回归平常心，积极寻求结构性机会,民生证券,2024-03-26,食品饮料,https://pdf.dfcfw.com/pdf/H3_AP202403261628175453_1.pdf?1711458519000.pdf
食品饮料行业周报：消费类社零数据回暖，国家层面明确预制菜范围,德邦证券,2024-03-25,食品饮料,https://pdf.dfcfw.com/pdf/H3_AP202403251628066661_1.pdf?1711365404000.pdf
食品饮料行业点评报告：2月电商数据分析：白酒需求韧性较好，大众品有所,开源证券,2024-03-25,食品饮料,https://pdf.dfcfw.com/pdf/H3_AP202403241628065635_1.pdf?1711353998000.pdf
食品饮料行业周报：春季糖酒会闭幕，新品加码大众价格带,华金证券,2024-03-25,食品饮料,https://pdf.dfcfw.com/pdf/H3_AP202403241628065975_1.pdf?1711363863000.pdf
食品饮料行业周报：春糖反馈稳中向好，预制菜新政策落地助力规范化发展,华龙证券,2024-03-25,食品饮料,https://pdf.dfcfw.com/pdf/H3_AP202403251628084899_1.pdf?1711399561000.pdf
食品饮料行业：糖酒会酒企反馈积极，悲观预期修复,东兴证券,2024-03-25,食品饮料,https://pdf.dfcfw.com/pdf/H3_AP202403251628084908_1.pdf?1711393596000.pdf
食品饮料行业点评：预制菜新规颁布，行业迎规范化发展,甬兴证券,2024-03-25,食品饮料,https://pdf.dfcfw.com/pdf/H3_AP202403251628095217_1.pdf?1711399351000.pdf
食品饮料行业月度点评：拥抱确定性,财信证券,2024-03-25,食品饮料,https://pdf.dfcfw.com/pdf/H3_AP202403251628070734_1.pdf?1711376891000.pdf
食品饮料事件点评：六部门联合发文，预制菜再迎政策支持,国海证券,2024-03-24,食品饮料,https://pdf.dfcfw.com/pdf/H3_AP202403221627662174_1.pdf?1711272299000.pdf
食品饮料行业周报：烟酒增速更有韧性，关注饮料和啤酒旺季,国海证券,2024-03-24,食品饮料,https://pdf.dfcfw.com/pdf/H3_AP202403241628065426_1.pdf?1711363757000.pdf
食品饮料：春糖反馈略超预期 头部酒企展现韧性,南京证券,2024-03-22,食品饮料,https://pdf.dfcfw.com/pdf/H3_AP202403221627608466_1.pdf?1711114598000.pdf
食品饮料行业点评报告：预制菜出台国家新标准，行业将向规范化发展,开源证券,2024-03-22,食品饮料,https://pdf.dfcfw.com/pdf/H3_AP202403221627616306_1.pdf?1711125235000.pdf
啤酒行业动态点评：行业结构升级趋势明确，华润啤酒持续推进高端化,中银证券,2024-03-22,食品饮料,https://pdf.dfcfw.com/pdf/H3_AP202403221627618010_1.pdf?1711126277000.pdf
食品饮料行业快评报告：行业规范化进程加速，利好预制菜龙头发展,万联证券,2024-03-22,食品饮料,https://pdf.dfcfw.com/pdf/H3_AP202403221627620799_1.pdf?1711128249000.pdf
食品加工预制菜行业更新：六部门联合印发规范文件,天风证券,2024-03-22,食品饮料,https://pdf.dfcfw.com/pdf/H3_AP202403221627622760_1.pdf?1711130164000.pdf
食品饮料行业点评：六部门联合发文，规范预制菜行业发展,平安证券,2024-03-22,食品饮料,https://pdf.dfcfw.com/pdf/H3_AP202403221627622761_1.pdf?1711130261000.pdf
白酒行业专题研究：24年春节仍存三大超预期点,天风证券,2024-03-21,食品饮料,https://pdf.dfcfw.com/pdf/H3_AP202403211627427532_1.pdf?1711009522000.pdf
中国食品饮料：HTI大众品零售价格跟踪：液态奶及软饮料折扣力度较2月下旬明显减小,海通国际,2024-03-21,食品饮料,https://pdf.dfcfw.com/pdf/H3_AP202403211627429473_1.pdf?1711014416000.pdf
折扣零售起势，零食垂类先行,信达证券,2024-03-21,食品饮料,https://pdf.dfcfw.com/pdf/H3_AP202403211627431021_1.pdf?1711019282000.pdf
食品饮料行业点评报告：1-2月社零增速环比回落，大众消费稳步复苏,开源证券,2024-03-19,食品饮料,https://pdf.dfcfw.com/pdf/H3_AP202403181626997315_1.pdf?1710835255000.pdf
白酒批发价格跟踪：高端价格小幅下行，普五批价维持坚挺,海通国际,2024-03-19,食品饮料,https://pdf.dfcfw.com/pdf/H3_AP202403191627113240_1.pdf?1710842769000.pdf
食品饮料行业跟踪周报：零添加势能强劲，龙头千禾潜力可期,东吴证券,2024-03-19,食品饮料,https://pdf.dfcfw.com/pdf/H3_AP202403191627113399_1.pdf?1710843424000.pdf
食品饮料周报（24年第10周）：春季糖酒会反馈好于此前预期，渠道信心明显修复,国信证券,2024-03-19,食品饮料,https://pdf.dfcfw.com/pdf/H3_AP202403191627212692_1.pdf?1710884718000.pdf
食品饮料行业周报：春糖反馈符合预期，分化中仍有亮点,德邦证券,2024-03-18,食品饮料,https://pdf.dfcfw.com/pdf/H3_AP202403181626959144_1.pdf?1710756610000.pdf
食品饮料行业周报：春糖反馈较积极，关注业绩超预期标的,平安证券,2024-03-18,食品饮料,https://pdf.dfcfw.com/pdf/H3_AP202403181626977422_1.pdf?1710787213000.pdf
非酒板块2024年春季糖酒会点评：健康化、功能化等方向为新的增长点,中国银河,2024-03-18,食品饮料,https://pdf.dfcfw.com/pdf/H3_AP202403181626988075_1.pdf?1710796105000.pdf
食品饮料行业周报：糖酒会开启，板块情绪回暖,东海证券,2024-03-18,食品饮料,https://pdf.dfcfw.com/pdf/H3_AP202403181626997132_1.pdf?1710833562000.pdf
食品饮料行业周报：春糖反馈：淡季批价坚挺，酒企更加重视产品矩阵和品牌文化,国海证券,2024-03-18,食品饮料,https://pdf.dfcfw.com/pdf/H3_AP202403181626998136_1.pdf?1710833958000.pdf
食品饮料行业周报：春糖拉开序幕，热闹的会场，分化的厂商,华金证券,2024-03-18,食品饮料,https://pdf.dfcfw.com/pdf/H3_AP202403181626965927_1.pdf?1710775656000.pdf
食品饮料行业周报：业绩期逐步开启，板块经营韧性强,上海证券,2024-03-18,食品饮料,https://pdf.dfcfw.com/pdf/H3_AP202403181626977421_1.pdf?1710787213000.pdf
2023年中国食品包装机行业白皮书,头豹研究院,2024-03-17,食品饮料,https://pdf.dfcfw.com/pdf/H3_AP202403171626952799_1.pdf?1710673469000.pdf
食品饮料行业周报：糖酒会反馈：积极的变化，理性的市场,开源证券,2024-03-17,食品饮料,https://pdf.dfcfw.com/pdf/H3_AP202403171626954062_1.pdf?1710691396000.pdf
食品饮料行业周报：春糖反馈相对平稳，市场信心仍在恢复途中,华鑫证券,2024-03-17,食品饮料,https://pdf.dfcfw.com/pdf/H3_AP202403171626954663_1.pdf?1710702404000.pdf
食品饮料行业周报：白酒春糖反馈平稳，仍关注批价&业绩兑现,国金证券,2024-03-17,食品饮料,https://pdf.dfcfw.com/pdf/H3_AP202403171626953987_1.pdf?1710691293000.pdf
食品饮料：CPI环比改善 关注春糖催化,南京证券,2024-03-15,食品饮料,https://pdf.dfcfw.com/pdf/H3_AP202403151626826604_1.pdf?1710510729000.pdf
食品饮料行业周报：酒企加大投资者回报，大众食品细分赛道景气度向上,上海证券,2024-03-14,食品饮料,https://pdf.dfcfw.com/pdf/H3_AP202403141626721601_1.pdf?1710411415000.pdf
食品饮料行业周报：进入消费淡季，关注春糖催化和酒企提价潮,华龙证券,2024-03-14,食品饮料,https://pdf.dfcfw.com/pdf/H3_AP202403141626722044_1.pdf?1710414332000.pdf
消费品成本指数跟踪：棕榈油升势强劲，蔬菜价格继续回落,海通国际,2024-03-14,食品饮料,https://pdf.dfcfw.com/pdf/H3_AP202403141626703610_1.pdf?1710422376000.pdf
食品饮料行业2024年度策略：风雨临溪舟自渡——关注需求侧变化下的行业新趋势,中邮证券,2024-03-13,食品饮料,https://pdf.dfcfw.com/pdf/H3_AP202403131626611825_1.pdf?1710346372000.pdf
食品饮料行业：食品饮料视角看政府工作报告,东兴证券,2024-03-13,食品饮料,https://pdf.dfcfw.com/pdf/H3_AP202403131626652792_1.pdf?1710355920000.pdf
食品饮料行业周观点：白酒价格稳定，企业聚焦两会逐步开展新年工作,万联证券,2024-03-12,食品饮料,https://pdf.dfcfw.com/pdf/H3_AP202403121626361765_1.pdf?1710228155000.pdf
食品饮料：蜜雪冰城招股书专题：国内现制饮料龙头，乘行业东风顺势而起,华福证券,2024-03-12,食品饮料,https://pdf.dfcfw.com/pdf/H3_AP202403121626417210_1.pdf?1710233038000.pdf
食品行业周报：24年2月CPI同比上升0.7%,海通国际,2024-03-12,食品饮料,https://pdf.dfcfw.com/pdf/H3_AP202403121626422937_1.pdf?1710237553000.pdf
食品饮料行业跟踪周报：加盟潮起，连锁餐企的下一个风口？,东吴证券,2024-03-11,食品饮料,https://pdf.dfcfw.com/pdf/H3_AP202403111626203545_1.pdf?1710140490000.pdf
食品饮料行业双周报：步入消费淡季，关注淡季补货情况,东莞证券,2024-03-11,食品饮料,https://pdf.dfcfw.com/pdf/H3_AP202403111626208963_1.pdf?1710143779000.pdf
食品饮料行业周报：消费向好态势有望巩固，近期关注春糖催化,德邦证券,2024-03-11,食品饮料,https://pdf.dfcfw.com/pdf/H3_AP202403111626210120_1.pdf?1710150908000.pdf
食品饮料行业周报：淡季稳价盘，关注春糖反馈,平安证券,2024-03-11,食品饮料,https://pdf.dfcfw.com/pdf/H3_AP202403111626210138_1.pdf?1710147153000.pdf
食品饮料行业周思考（第11周） ：白酒关注淡季价盘，大众品受益餐饮修复,中泰证券,2024-03-11,食品饮料,https://pdf.dfcfw.com/pdf/H3_AP202403111626210941_1.pdf?1710149668000.pdf
食品饮料周报（24年第9周）：糖酒会及年报披露期临近，酒企分红率或存在潜在上修空间,国信证券,2024-03-11,食品饮料,https://pdf.dfcfw.com/pdf/H3_AP202403111626212475_1.pdf?1710153389000.pdf
食品饮料行业周报：酒企密集提价，关注春糖催化,东海证券,2024-03-11,食品饮料,https://pdf.dfcfw.com/pdf/H3_AP202403111626215513_1.pdf?1710167660000.pdf
酒水饮料周报：春节后表现良好，春糖反馈或超预期,天风证券,2024-03-11,食品饮料,https://pdf.dfcfw.com/pdf/H3_AP202403111626215540_1.pdf?1710170406000.pdf
火锅底料 头豹词条报告系列,头豹研究院,2024-03-11,食品饮料,https://pdf.dfcfw.com/pdf/H3_AP202403111626259339_1.pdf?1710185977000.pdf
食品行业周报：24年1月消费者信心指数环比改善,海通国际,2024-03-11,食品饮料,https://pdf.dfcfw.com/pdf/H3_AP202403111626210709_1.pdf?1710166263000.pdf
食品饮料2月月报：春节带动线下全品类高增,国联证券,2024-03-10,食品饮料,https://pdf.dfcfw.com/pdf/H3_AP202403081626065093_1.pdf?1710066160000.pdf
食品饮料行业周报：动销表现平稳，等待春糖催化情绪,华鑫证券,2024-03-10,食品饮料,https://pdf.dfcfw.com/pdf/H3_AP202403101626198241_1.pdf?1710065941000.pdf
食品饮料行业周报：关注糖酒会反馈，重视零食业态红利,开源证券,2024-03-10,食品饮料,https://pdf.dfcfw.com/pdf/H3_AP202403101626201787_1.pdf?1710141558000.pdf
食品饮料行业3月月度报告：白酒春节旺季动销平稳，渠道较为健康,国信证券,2024-03-10,食品饮料,https://pdf.dfcfw.com/pdf/H3_AP202403101626199097_1.pdf?1710077467000.pdf
食品饮料行业周报：如何看待春糖窗口期催化？,国金证券,2024-03-10,食品饮料,https://pdf.dfcfw.com/pdf/H3_AP202403101626200744_1.pdf?1710086331000.pdf
食品饮料行业2月月报：食饮板块全面反弹，核心资产表现突出,中原证券,2024-03-10,食品饮料,https://pdf.dfcfw.com/pdf/H3_AP202403101626200807_1.pdf?1710086771000.pdf
食品饮料行业周报：休闲零食景气度高，行业进入春糖时刻,国海证券,2024-03-10,食品饮料,https://pdf.dfcfw.com/pdf/H3_AP202403101626200914_1.pdf?1710093680000.pdf
食品饮料行业周报：多家酒企或提价，关注糖酒会催化,华金证券,2024-03-10,食品饮料,https://pdf.dfcfw.com/pdf/H3_AP202403101626202660_1.pdf?1710150431000.pdf
食品饮料行业周报：折扣业态兴起，品牌商需正视,信达证券,2024-03-10,食品饮料,https://pdf.dfcfw.com/pdf/H3_AP202403101626201773_1.pdf?1710141558000.pdf
食品饮料行业周度市场观察2024年第7周,艾瑞股份,2024-03-10,食品饮料,https://pdf.dfcfw.com/pdf/H3_AP202404101630104798_1.pdf?1712756249000.pdf
酒行业周度市场观察2024年第7周,艾瑞股份,2024-03-10,食品饮料,https://pdf.dfcfw.com/pdf/H3_AP202404101630104800_1.pdf?1712755617000.pdf
2024年食品饮料行业年度策略：尘埃落定，食饮机会几何？,联储证券,2024-03-08,食品饮料,https://pdf.dfcfw.com/pdf/H3_AP202404101630104940_1.pdf?1712764334000.pdf
HTI大众品零售价格跟踪：软饮料及液态奶折扣力度较2月初有所减小,海通国际,2024-03-07,食品饮料,https://pdf.dfcfw.com/pdf/H3_AP202403071625925409_1.pdf?1709823507000.pdf
食品饮料行业周报：名优酒企接连提价彰显品牌力，关注行业细分赛道发展机遇,上海证券,2024-03-07,食品饮料,https://pdf.dfcfw.com/pdf/H3_AP202403071625929870_1.pdf?1709818926000.pdf
食品饮料行业专题研究：现阶段如何看待啤酒行业的量价问题？,国联证券,2024-03-07,食品饮料,https://pdf.dfcfw.com/pdf/H3_AP202403071625964551_1.pdf?1709846316000.pdf
食品饮料：白酒龙头节后提价 关注春糖走向,南京证券,2024-03-07,食品饮料,https://pdf.dfcfw.com/pdf/H3_AP202403071625929880_1.pdf?1709819768000.pdf
啤酒行业动态点评：4Q23百威亚太吨价快速修复，行业结构升级趋势不改,中银证券,2024-03-06,食品饮料,https://pdf.dfcfw.com/pdf/H3_AP202403061625669612_1.pdf?1709732965000.pdf
食品饮料行业点评报告：白酒淡季提价潮至，重视板块积极变化,开源证券,2024-03-06,食品饮料,https://pdf.dfcfw.com/pdf/H3_AP202403061625760179_1.pdf?1709761828000.pdf
食品饮料行业周报：节后酒企提价，关注结构性机会,东海证券,2024-03-05,食品饮料,https://pdf.dfcfw.com/pdf/H3_AP202403051625446956_1.pdf?1709623620000.pdf
光瓶酒行业专题报告：千亿光瓶酒市场空间广阔，行业龙头盈利能力有望改善,德邦证券,2024-03-05,食品饮料,https://pdf.dfcfw.com/pdf/H3_AP202403051625451528_1.pdf?1709631934000.pdf
食品饮料行业周观点：食饮业绩报告数据亮眼，企业动员大会彰显新年志气,万联证券,2024-03-05,食品饮料,https://pdf.dfcfw.com/pdf/H3_AP202403051625455212_1.pdf?1709632517000.pdf
食品饮料行业周报：多家酒企宣布提价，关注召开在即的春季糖酒会,华龙证券,2024-03-05,食品饮料,https://pdf.dfcfw.com/pdf/H3_AP202403051625526961_1.pdf?1709670990000.pdf
食品饮料行业周报：白酒淡季提价，提振渠道信心,国海证券,2024-03-04,食品饮料,https://pdf.dfcfw.com/pdf/H3_AP202403041625215966_1.pdf?1709541071000.pdf
食品饮料行业周报：白酒价稳叠加提价催化，关注板块配置价值,国金证券,2024-03-04,食品饮料,https://pdf.dfcfw.com/pdf/H3_AP202403041625215397_1.pdf?1709539969000.pdf
白酒行业策略报告：K型复苏分化加剧，优选高端和地产酒龙头,太平洋,2024-03-04,食品饮料,https://pdf.dfcfw.com/pdf/H3_AP202403041625216027_1.pdf?1709543930000.pdf
食品饮料行业周思考（第10周）：白酒淡季仍有亮点，看好啤酒高端化和销量修复,中泰证券,2024-03-04,食品饮料,https://pdf.dfcfw.com/pdf/H3_AP202403041625216701_1.pdf?1709543646000.pdf
食品饮料行业周报：春节消费热潮涌动，复苏态势有望延续,德邦证券,2024-03-04,食品饮料,https://pdf.dfcfw.com/pdf/H3_AP202403041625232459_1.pdf?1709545486000.pdf
食品饮料行业周报：这个淡季有点儿不一样,国投证券,2024-03-04,食品饮料,https://pdf.dfcfw.com/pdf/H3_AP202403041625248364_1.pdf?1709546527000.pdf
食品饮料周报（24年第8周）：多家酒企淡季提价蓄能中秋，近期关注春季糖酒会,国信证券,2024-03-04,食品饮料,https://pdf.dfcfw.com/pdf/H3_AP202403041625247821_1.pdf?1709546527000.pdf
食品饮料行业跟踪周报：酒企调价动作频频，重构格局操作主动,东吴证券,2024-03-04,食品饮料,https://pdf.dfcfw.com/pdf/H3_AP202403041625212454_1.pdf?1709546835000.pdf
食品饮料行业周报：节后白酒提价，关注春糖反馈,平安证券,2024-03-04,食品饮料,https://pdf.dfcfw.com/pdf/H3_AP202403041625214799_1.pdf?1709538128000.pdf
食品饮料行业周报：淡季关注渠道秩序，零食板块仍有红利,开源证券,2024-03-04,食品饮料,https://pdf.dfcfw.com/pdf/H3_AP202403041625214802_1.pdf?1709538128000.pdf
清香型白酒深度报告：清风徐来，水波渐兴,山西证券,2024-03-04,食品饮料,https://pdf.dfcfw.com/pdf/H3_AP202403041625390477_1.pdf?1709577304000.pdf
酒水饮料周报：酒企提价或推动信心回暖，关注春糖催化,天风证券,2024-03-04,食品饮料,https://pdf.dfcfw.com/pdf/H3_AP202403041625388939_1.pdf?1709625275000.pdf
消费行业3月投资策略：关注消费股的分红潜力,海通国际,2024-03-04,食品饮料,https://pdf.dfcfw.com/pdf/H3_AP202403041625293024_1.pdf?1709564452000.pdf
HTI消费品2月需求月报：惯性因素和基数原因导致弱势增长,海通国际,2024-03-04,食品饮料,https://pdf.dfcfw.com/pdf/H3_AP202403041625293111_1.pdf?1709564958000.pdf
食品饮料：开门红积极，复苏韧性渐显,华福证券,2024-03-04,食品饮料,https://pdf.dfcfw.com/pdf/H3_AP202403041625377445_1.pdf?1709628574000.pdf
食品饮料行业周报：酒企部分提价+春糖临近，市场情绪稳步升温,华鑫证券,2024-03-03,食品饮料,https://pdf.dfcfw.com/pdf/H3_AP202403031625208689_1.pdf?1709470814000.pdf
食品饮料行业报告：无糖茶有望成为新风口，零食集中化趋势凸显,中邮证券,2024-03-03,食品饮料,https://pdf.dfcfw.com/pdf/H3_AP202403031625210361_1.pdf?1709542154000.pdf
椰子饮料投资机会展望,信达证券,2024-03-03,食品饮料,https://pdf.dfcfw.com/pdf/H3_AP202403031625211043_1.pdf?1709504744000.pdf
食品饮料行业1月月报：食饮板块表现延续弱势,中原证券,2024-03-03,食品饮料,https://pdf.dfcfw.com/pdf/H3_AP202403031625209434_1.pdf?1709479948000.pdf
食品饮料行业周度市场观察2024年第6周,艾瑞股份,2024-03-03,食品饮料,https://pdf.dfcfw.com/pdf/H3_AP202404101630104815_1.pdf?1712755406000.pdf
食品饮料行业报告：大众品春节动销韧性中不乏亮点，关注节后补库存表现,中邮证券,2024-02-29,食品饮料,https://pdf.dfcfw.com/pdf/H3_AP202402291624100580_1.pdf?1709205914000.pdf
大众品系列研究（二）：预制菜风起云涌，全景梳理探发展,东海证券,2024-02-29,食品饮料,https://pdf.dfcfw.com/pdf/H3_AP202402291624116987_1.pdf?1709232977000.pdf
食品饮料行业点评报告：1月电商数据分析：白酒线上销售高增，大众品表现分化,开源证券,2024-02-28,食品饮料,https://pdf.dfcfw.com/pdf/H3_AP202402281623930639_1.pdf?1709119008000.pdf
食品行业周报：24年1月大众品成本指数环比回落,海通国际,2024-02-28,食品饮料,https://pdf.dfcfw.com/pdf/H3_AP202402281623982999_1.pdf?1709138382000.pdf
