研报名称,机构名称,发布时间,行业,研报地址
食品饮料行业2023年业绩分析：降本增效，股东盈利增厚，周转普遍提升,中原证券,2024-05-31,食品饮料,https://pdf.dfcfw.com/pdf/H3_AP202405311635040132_1.pdf?1717150977000.pdf
现制茶饮投资探讨：拥抱极致性价比与下沉时代,华安证券,2024-05-31,食品饮料,https://pdf.dfcfw.com/pdf/H3_AP202405311635047723_1.pdf?1717166493000.pdf
食品饮料：植提甜味剂专题：快速扩容的代糖黄金赛道,华福证券,2024-05-31,食品饮料,https://pdf.dfcfw.com/pdf/H3_AP202405311635079508_1.pdf?1717186235000.pdf
食品行业专题报告：23年业绩平稳，24Q1景气度有所提升,海通国际,2024-05-29,食品饮料,https://pdf.dfcfw.com/pdf/H3_AP202405291634789485_1.pdf?1716972654000.pdf
饮料行业季报：白酒收入延续稳增，啤酒盈利持续改善,海通国际,2024-05-29,食品饮料,https://pdf.dfcfw.com/pdf/H3_AP202405291634789508_1.pdf?1716972344000.pdf
食品饮料：预制菜产业之河南发展现状,中原证券,2024-05-29,食品饮料,https://pdf.dfcfw.com/pdf/H3_AP202405291634790391_1.pdf?1716972876000.pdf
乳制品行业深度：筑基已成，潜力犹存,联储证券,2024-05-28,食品饮料,https://pdf.dfcfw.com/pdf/H3_AP202405281634736002_1.pdf?1716895341000.pdf
休闲零食：线上红利消失的趋势下，竞争转向下沉市场和品类升级 头豹词条报告系列,头豹研究院,2024-05-28,食品饮料,https://pdf.dfcfw.com/pdf/H3_AP202405281634757715_1.pdf?1716927726000.pdf
消费一周看图2024W21：图说经济总量及结构对白酒传导影响分析,国投证券,2024-05-27,食品饮料,https://pdf.dfcfw.com/pdf/H3_AP202405261634695067_1.pdf?1716802735000.pdf
食品饮料行业周报：茅台批价波动不改长期趋势，饮料旺季来临重视配置机会,华金证券,2024-05-27,食品饮料,https://pdf.dfcfw.com/pdf/H3_AP202405271634706126_1.pdf?1716808905000.pdf
食品饮料周报（24年第20周）：白酒淡季聚焦市场秩序管控，啤酒短期催化因素增多,国信证券,2024-05-27,食品饮料,https://pdf.dfcfw.com/pdf/H3_AP202405271634710623_1.pdf?1716816848000.pdf
食品饮料行业周报：白酒龙头批价波动，关注端午动销,东海证券,2024-05-27,食品饮料,https://pdf.dfcfw.com/pdf/H3_AP202405271634711292_1.pdf?1716843689000.pdf
休闲食品板块2023年及2024Q1总结：渠道转型红利释放，盈利端增长可期,华鑫证券,2024-05-26,食品饮料,https://pdf.dfcfw.com/pdf/H3_AP202405251634674207_1.pdf?1716715675000.pdf
乳制品板块2023年及2024Q1总结：奶价持续下行，乳企内部分化,华鑫证券,2024-05-26,食品饮料,https://pdf.dfcfw.com/pdf/H3_AP202405251634674208_1.pdf?1716715566000.pdf
调味发酵品行业专题研究：业绩稳健增长，分红率提升&激励计划彰显信心,天风证券,2024-05-24,食品饮料,https://pdf.dfcfw.com/pdf/H3_AP202405241634556363_1.pdf?1716577185000.pdf
维生物蛋白专题：蛋白新能源，探究微生物蛋白的投资机遇,华福证券,2024-05-24,食品饮料,https://pdf.dfcfw.com/pdf/H3_AP202405241634556373_1.pdf?1716577347000.pdf
食品饮料行业点评：4月社零同比+2.3%，品类表现有所分化,甬兴证券,2024-05-23,食品饮料,https://pdf.dfcfw.com/pdf/H3_AP202405231634373819_1.pdf?1716455687000.pdf
休闲食品及食品加工行业2023年年报及2024年一季报业绩综述：春节旺季动销亮眼，成本红利延续释放,民生证券,2024-05-23,食品饮料,https://pdf.dfcfw.com/pdf/H3_AP202405231634382597_1.pdf?1716472973000.pdf
食品饮料行业周度市场观察第21周,艾瑞股份,2024-05-22,食品饮料,https://pdf.dfcfw.com/pdf/H3_AP202405221634323369_1.pdf?1716396447000.pdf
2024年中国牛奶行业概览,头豹研究院,2024-05-22,食品饮料,https://pdf.dfcfw.com/pdf/H3_AP202405221634333847_1.pdf?1716407069000.pdf
酒行业周度市场观察第19周,艾瑞股份,2024-05-21,食品饮料,https://pdf.dfcfw.com/pdf/H3_AP202405211634046650_1.pdf?1716302033000.pdf
食品饮料行业周度市场观察第19周,艾瑞股份,2024-05-21,食品饮料,https://pdf.dfcfw.com/pdf/H3_AP202405211634046654_1.pdf?1716298451000.pdf
酒行业周度市场观察2024年第20周,艾瑞股份,2024-05-21,食品饮料,https://pdf.dfcfw.com/pdf/H3_AP202405211634046651_1.pdf?1716301861000.pdf
食品饮料行业周度市场观察第20周,艾瑞股份,2024-05-21,食品饮料,https://pdf.dfcfw.com/pdf/H3_AP202405211634046655_1.pdf?1716298361000.pdf
啤酒行业2023年报&2024一季报综述：产品结构升级趋势不改，成本红利有望持续释放,中银证券,2024-05-20,食品饮料,https://pdf.dfcfw.com/pdf/H3_AP202405201633850939_1.pdf?1716200067000.pdf
食品饮料行业周报：地产调控加力，板块估值扩张,国海证券,2024-05-20,食品饮料,https://pdf.dfcfw.com/pdf/H3_AP202405201633840189_1.pdf?1716199965000.pdf
食品饮料行业周报：地产政策密集出台，看多板块需求反转,德邦证券,2024-05-20,食品饮料,https://pdf.dfcfw.com/pdf/H3_AP202405201633846793_1.pdf?1716199337000.pdf
食品饮料周报（24年第19周）：地产政策密集出台，白酒需求有望企稳回升,国信证券,2024-05-20,食品饮料,https://pdf.dfcfw.com/pdf/H3_AP202405201633865782_1.pdf?1716226941000.pdf
食品饮料行业报告：酒企营销再细化，饮料增速环比上行,中邮证券,2024-05-20,食品饮料,https://pdf.dfcfw.com/pdf/H3_AP202405201633871914_1.pdf?1716240343000.pdf
食品饮料行业周报：政策催化，关注白酒预期改善,华龙证券,2024-05-20,食品饮料,https://pdf.dfcfw.com/pdf/H3_AP202405201633876577_1.pdf?1716240904000.pdf
食品饮料行业周报：地产政策落地，板块中期需求预期逐渐扭转，继续推荐竞争力强公司,国投证券,2024-05-20,食品饮料,https://pdf.dfcfw.com/pdf/H3_AP202405201633852610_1.pdf?1716210149000.pdf
食品饮料行业点评：白酒板块2023年报及24年一季报总结-业绩顺利兑现 分化下关注酒企增长质量,申港证券,2024-05-17,食品饮料,https://pdf.dfcfw.com/pdf/H3_AP202405171633686634_1.pdf?1715932567000.pdf
啤酒行业深度报告：啤酒高端化方兴未艾，龙头错位竞争共享红利,国信证券,2024-05-17,食品饮料,https://pdf.dfcfw.com/pdf/H3_AP202405171633698629_1.pdf?1715953409000.pdf
食品饮料行业专题研究：日本保健品行业：国民健康为基，政策激发活力,东方财富证券,2024-05-17,食品饮料,https://pdf.dfcfw.com/pdf/H3_AP202405171633711335_1.pdf?1715970893000.pdf
现包云吞饺子：现包云吞饺子行业兴起，社区门店势头强劲 头豹词条报告系列,头豹研究院,2024-05-17,食品饮料,https://pdf.dfcfw.com/pdf/H3_AP202405171633719988_1.pdf?1715974737000.pdf
中国自热食品行业市场规模测算逻辑模型 头豹词条报告系列,头豹研究院,2024-05-17,食品饮料,https://pdf.dfcfw.com/pdf/H3_AP202405171633719989_1.pdf?1715974845000.pdf
食品饮料行业专题报告：短期波动不改C端升级扩容趋势，需求修复、格局优化提振龙头成长,华福证券,2024-05-17,食品饮料,https://pdf.dfcfw.com/pdf/H3_AP202405171633721182_1.pdf?1715975413000.pdf
食品饮料行业2024Q1业绩综述报告：整体稳健增长，零食、白酒、软饮料业绩较为出色,万联证券,2024-05-16,食品饮料,https://pdf.dfcfw.com/pdf/H3_AP202405161633243756_1.pdf?1715853791000.pdf
大众品2023年报&2024一季报总结：分化中寻找机遇，成本进入红利期,中泰证券,2024-05-15,食品饮料,https://pdf.dfcfw.com/pdf/H3_AP202405151633154656_1.pdf?1715764719000.pdf
啤酒板块2023A&24Q1业绩总结：看好成本下降和销量同比改善,中国银河,2024-05-14,食品饮料,https://pdf.dfcfw.com/pdf/H3_AP202405141633050325_1.pdf?1715681550000.pdf
食品饮料行业周报：五一旅游延续复苏，建议关注啤酒机会,华金证券,2024-05-13,食品饮料,https://pdf.dfcfw.com/pdf/H3_AP202405131632925707_1.pdf?1715590466000.pdf
食品饮料行业周报：24Q1平稳落地，行业基本面无虞,德邦证券,2024-05-13,食品饮料,https://pdf.dfcfw.com/pdf/H3_AP202405131632932673_1.pdf?1715597225000.pdf
食品饮料周报（24年第18周）：五一消费持续回温，食品饮料行业顺利实现开门红,国信证券,2024-05-13,食品饮料,https://pdf.dfcfw.com/pdf/H3_AP202405131632934340_1.pdf?1715597010000.pdf
食品饮料行业专题报告：沪上阿姨招股书梳理：广覆盖现制茶饮品牌，重创新协同供应链建设加码下沉市场,华福证券,2024-05-13,食品饮料,https://pdf.dfcfw.com/pdf/H3_AP202405131632936701_1.pdf?1715599735000.pdf
饮品江湖系列一：从Top 4品牌招股书看现制茶饮行业,国金证券,2024-05-13,食品饮料,https://pdf.dfcfw.com/pdf/H3_AP202405131632940976_1.pdf?1715613591000.pdf
食品饮料行业周报：4月CPI温和上行，关注淡季需求表现,东海证券,2024-05-13,食品饮料,https://pdf.dfcfw.com/pdf/H3_AP202405131632946706_1.pdf?1715618377000.pdf
食品饮料行业2023年报及2024年一季报总结：白酒业绩与分红均兑现，大众品零食饮料增速优,国海证券,2024-05-13,食品饮料,https://pdf.dfcfw.com/pdf/H3_AP202405131632959580_1.pdf?1715629339000.pdf
2024年中国儿童牛奶市场洞察：成长的力量，解析中国儿童牛奶消费趋势,头豹研究院,2024-05-13,食品饮料,https://pdf.dfcfw.com/pdf/H3_AP202405131632959653_1.pdf?1715629444000.pdf
儿童零食市场：新一代父母转变消费观念，助推千亿级细分市场 头豹词条报告系列,头豹研究院,2024-05-13,食品饮料,https://pdf.dfcfw.com/pdf/H3_AP202405131632959657_1.pdf?1715629726000.pdf
食品饮料行业2023年及2024年一季度业绩总结：白酒报表展现韧性，大众品成本红利逐步释放,国信证券,2024-05-13,食品饮料,https://pdf.dfcfw.com/pdf/H3_AP202405131632962378_1.pdf?1715631328000.pdf
2024年中国包装饮用水行业概览：包装饮用水市场发展机遇解析,头豹研究院,2024-05-12,食品饮料,https://pdf.dfcfw.com/pdf/H3_AP202405111632897463_1.pdf?1715503848000.pdf
速冻品及其他板块2023年及2024Q1总结：B端开拓为主线，预制菜红利释放,华鑫证券,2024-05-12,食品饮料,https://pdf.dfcfw.com/pdf/H3_AP202405121632913348_1.pdf?1715516375000.pdf
食品饮料行业报告：政策面资金面助力情绪改善，看好啤酒&软饮旺季表现,中邮证券,2024-05-12,食品饮料,https://pdf.dfcfw.com/pdf/H3_AP202405121632920499_1.pdf?1715590157000.pdf
调味品板块2023年及2024Q1总结：市场边际修复，品牌势能充足,华鑫证券,2024-05-12,食品饮料,https://pdf.dfcfw.com/pdf/H3_AP202405121632913351_1.pdf?1715516565000.pdf
食品饮料行业2023年业绩综述报告：业绩稳增长，盈利能力提升,万联证券,2024-05-11,食品饮料,https://pdf.dfcfw.com/pdf/H3_AP202405111632873761_1.pdf?1715420124000.pdf
白酒板块2023A&24Q1业绩总结和投资机会梳理：现阶段板块机会大于风险,中国银河,2024-05-10,食品饮料,https://pdf.dfcfw.com/pdf/H3_AP202405091632786392_1.pdf?1715330462000.pdf
食品饮料行业2024Q1基金持仓分析：行业重仓比例上行，白酒为拉动因素,万联证券,2024-05-10,食品饮料,https://pdf.dfcfw.com/pdf/H3_AP202405101632800693_1.pdf?1715330462000.pdf
食品饮料2023年报&2024年一季报总结：白酒竞争格局愈发清晰下强者更强，零食&饮料景气度较好，啤酒_乳品利润端超预期,中邮证券,2024-05-10,食品饮料,https://pdf.dfcfw.com/pdf/H3_AP202405101632807444_1.pdf?1715335189000.pdf
大众品2023年报及2024Q1季报综述：需求平稳，个股分化,国联证券,2024-05-10,食品饮料,https://pdf.dfcfw.com/pdf/H3_AP202405101632831718_1.pdf?1715372507000.pdf
食品饮料行业周度市场观察第18周,艾瑞股份,2024-05-09,食品饮料,https://pdf.dfcfw.com/pdf/H3_AP202405091632714901_1.pdf?1715246275000.pdf
酒行业周度市场观察第18周,艾瑞股份,2024-05-09,食品饮料,https://pdf.dfcfw.com/pdf/H3_AP202405091632714899_1.pdf?1715246275000.pdf
食品饮料行业周报：一季度社零同比增长4.7%，关注板块结构性机会,华龙证券,2024-05-09,食品饮料,https://pdf.dfcfw.com/pdf/H3_AP202405091632714936_1.pdf?1715244789000.pdf
食品饮料2023年报&2024一季报总结：置信度高，估值底过万重山,华福证券,2024-05-09,食品饮料,https://pdf.dfcfw.com/pdf/H3_AP202405091632714932_1.pdf?1715244686000.pdf
食品饮料行业2023&2024Q1业绩点评：2024Q1业绩增长明显，行业景气度回归,源达信息,2024-05-09,食品饮料,https://pdf.dfcfw.com/pdf/H3_AP202405091632751203_1.pdf?1715254680000.pdf
白酒渠道：迭代中前行，变革中发展,平安证券,2024-05-09,食品饮料,https://pdf.dfcfw.com/pdf/H3_AP202405091632756961_1.pdf?1715260208000.pdf
食品饮料行业投资策略：白酒势能不减， 大众品枯木逢春,开源证券,2024-05-09,食品饮料,https://pdf.dfcfw.com/pdf/H3_AP202405091632759379_1.pdf?1715265263000.pdf
食品饮料行业2023年与2024年一季度业绩综述：内部表现分化，关注边际改善,东莞证券,2024-05-09,食品饮料,https://pdf.dfcfw.com/pdf/H3_AP202405091632767317_1.pdf?1715275752000.pdf
食品饮料行业深度报告：大众品2023年报&2024年一季报总结：景气各异，成本红利普遍,东吴证券,2024-05-09,食品饮料,https://pdf.dfcfw.com/pdf/H3_AP202405091632766793_1.pdf?1715275752000.pdf
2024年中国火锅产业链发展现状洞察：火锅行业加剧“内卷”，如何打破市场僵局？（摘要版）,头豹研究院,2024-05-09,食品饮料,https://pdf.dfcfw.com/pdf/H3_AP202405091632774623_1.pdf?1715284470000.pdf
新消费研究之咖啡系列报告：咖啡研究的年度复盘及探讨：何时进入稳态？,民生证券,2024-05-09,食品饮料,https://pdf.dfcfw.com/pdf/H3_AP202405091632775501_1.pdf?1715284674000.pdf
饮料行业2023年及2024年一季度总结：新品贡献增量收入，费投加大利润部分承压,华鑫证券,2024-05-08,食品饮料,https://pdf.dfcfw.com/pdf/H3_AP202405081632638831_1.pdf?1715160742000.pdf
非酒板块23A与24Q1业绩总结：盈利弹性率先兑现，关注三大子板块,中国银河,2024-05-07,食品饮料,https://pdf.dfcfw.com/pdf/H3_AP202405061632491282_1.pdf?1715069236000.pdf
食品饮料行业周观点：业绩披露完毕，飞天茅台批价回升,万联证券,2024-05-07,食品饮料,https://pdf.dfcfw.com/pdf/H3_AP202405071632538473_1.pdf?1715067384000.pdf
HTI中国消费行业5月投资报告：分红率如期提高，资金面预期改善,海通国际,2024-05-07,食品饮料,https://pdf.dfcfw.com/pdf/H3_AP202405071632560041_1.pdf?1715097333000.pdf
白酒2023年报及2024年一季报总结：需求韧性仍强，个体分化加剧,东吴证券,2024-05-07,食品饮料,https://pdf.dfcfw.com/pdf/H3_AP202405071632562059_1.pdf?1715099370000.pdf
食品板块年报及一季报总结：板块需求分化，龙头势能犹存,国金证券,2024-05-06,食品饮料,https://pdf.dfcfw.com/pdf/H3_AP202405061632474781_1.pdf?1715003943000.pdf
食品饮料板块2023年&24Q1业绩综述：业绩存韧性内部有分化，分红提升经营,国投证券,2024-05-06,食品饮料,https://pdf.dfcfw.com/pdf/H3_AP202405061632478412_1.pdf?1715013377000.pdf
食品饮料行业2024年度中期投资策略：白酒势能不减，大众品枯木逢春,开源证券,2024-05-06,食品饮料,https://pdf.dfcfw.com/pdf/H3_AP202405061632479877_1.pdf?1715012331000.pdf
2024年五一假期食品饮料行业动态点评：五一提振需求，关注消费新趋势,东莞证券,2024-05-06,食品饮料,https://pdf.dfcfw.com/pdf/H3_AP202405061632467761_1.pdf?1714987979000.pdf
白酒行业研究：白酒业绩兑现强，分化中坚布局强势龙头,国金证券,2024-05-06,食品饮料,https://pdf.dfcfw.com/pdf/H3_AP202405061632470553_1.pdf?1714991666000.pdf
消费品价格跟踪报告：整箱、散飞走势分化，方便食品折扣力度减小,海通国际,2024-05-06,食品饮料,https://pdf.dfcfw.com/pdf/H3_AP202405061632474225_1.pdf?1715009342000.pdf
HTI中国消费品4月需求报告：多数行业依然处于低速增长,海通国际,2024-05-06,食品饮料,https://pdf.dfcfw.com/pdf/H3_AP202405061632474224_1.pdf?1715009940000.pdf
饮料行业深度报告（系列二）：从新品周期视角寻找饮料板块投资机会,中国银河,2024-05-06,食品饮料,https://pdf.dfcfw.com/pdf/H3_AP202405061632497907_1.pdf?1715031537000.pdf
2024年中国量贩式零食店行业：头部品牌收购及合并动作频频，跑马圈地正当时（摘要版）,头豹研究院,2024-05-06,食品饮料,https://pdf.dfcfw.com/pdf/H3_AP202405061632492252_1.pdf?1715025731000.pdf
咖啡行业点评：瑞幸咖啡发布2024年Q1业绩：加速开店&优惠影响延续，盈利能力环比下滑,民生证券,2024-05-03,食品饮料,https://pdf.dfcfw.com/pdf/H3_AP202405031632293731_1.pdf?1714730143000.pdf
啤酒：原材料成本的毛利率敏感性分析,国投证券,2024-04-30,食品饮料,https://pdf.dfcfw.com/pdf/H3_AP202404301632073341_1.pdf?1714504596000.pdf
玉米淀粉：玉米淀粉需求增加，企业加速向规模化、现代化发展 头豹词条报告系列,头豹研究院,2024-04-30,食品饮料,https://pdf.dfcfw.com/pdf/H3_AP202404301632079842_1.pdf?1714505803000.pdf
粥店：一粥千店，餐饮行业的新潜力股 头豹词条报告系列,头豹研究院,2024-04-30,食品饮料,https://pdf.dfcfw.com/pdf/H3_AP202404301632079852_1.pdf?1714506021000.pdf
中国柚子汁饮料行业市场规模测算逻辑模型 头豹词条报告系列,头豹研究院,2024-04-30,食品饮料,https://pdf.dfcfw.com/pdf/H3_AP202404301632079941_1.pdf?1714506220000.pdf
食品饮料行业专题报告：FANCL历史复盘：成熟市场探索新需求，内外兼修问鼎健康美护赛道,华福证券,2024-04-30,食品饮料,https://pdf.dfcfw.com/pdf/H3_AP202404301632032188_1.pdf?1714484794000.pdf
果酒：近年崛起的时尚酒类，看头部企业如何做好品牌化与高端化 头豹词条报告系列,头豹研究院,2024-04-29,食品饮料,https://pdf.dfcfw.com/pdf/H3_AP202404291631621100_1.pdf?1714424175000.pdf
食品饮料行业周观点：白酒板块上行，食饮龙头企业业绩喜人,万联证券,2024-04-29,食品饮料,https://pdf.dfcfw.com/pdf/H3_AP202404291631675246_1.pdf?1714431542000.pdf
茶餐厅：行业发展遇瓶颈，融合化的新式茶餐厅破局而出 头豹词条报告系列,头豹研究院,2024-04-28,食品饮料,https://pdf.dfcfw.com/pdf/H3_AP202404281631549460_1.pdf?1714333350000.pdf
食品饮料行业2024Q1基金重仓分析：估值修复，集中度提升,信达证券,2024-04-26,食品饮料,https://pdf.dfcfw.com/pdf/H3_AP202404261631370825_1.pdf?1714129131000.pdf
食品饮料24Q1基金持仓：白酒环比加仓，五粮液_古井增持最多,国联证券,2024-04-26,食品饮料,https://pdf.dfcfw.com/pdf/H3_AP202404261631372986_1.pdf?1714136771000.pdf
2024年中国婴幼儿零辅食行业洞察报告,艾瑞股份,2024-04-26,食品饮料,https://pdf.dfcfw.com/pdf/H3_AP202404261631373421_1.pdf?1714147416000.pdf
日本酱油行业专题一：龟行稳健“甲”天下，“万”千风味再出发,华福证券,2024-04-26,食品饮料,https://pdf.dfcfw.com/pdf/H3_AP202404261631373436_1.pdf?1714137370000.pdf
牛奶：最古老的天然饮料，新时代的营养必需品 头豹词条报告系列,头豹研究院,2024-04-26,食品饮料,https://pdf.dfcfw.com/pdf/H3_AP202404261631416330_1.pdf?1714161281000.pdf
24Q1食品饮料持仓分析：酒类环比加仓，食品分化加剧,东吴证券,2024-04-25,食品饮料,https://pdf.dfcfw.com/pdf/H3_AP202404251631258263_1.pdf?1714036413000.pdf
食品饮料24Q1持仓分析：白酒加仓食品减仓，盐津铺子首入前20,华金证券,2024-04-25,食品饮料,https://pdf.dfcfw.com/pdf/H3_AP202404251631263537_1.pdf?1714051718000.pdf
食品饮料行业月度点评：曲折前行，业绩为锚,财信证券,2024-04-25,食品饮料,https://pdf.dfcfw.com/pdf/H3_AP202404251631264809_1.pdf?1714051437000.pdf
预制食品行业全景图：供需两旺，行业正在走向高质量发展,平安证券,2024-04-25,食品饮料,https://pdf.dfcfw.com/pdf/H3_AP202404251631284228_1.pdf?1714070964000.pdf
奶酪：源自中亚西亚的牛乳制品，国内乳业破局之希望 头豹词条报告系列,头豹研究院,2024-04-25,食品饮料,https://pdf.dfcfw.com/pdf/H3_AP202404251631301650_1.pdf?1714073843000.pdf
食品饮料行业专题报告：浅析功能性糖醇的应用空间及市场格局,华福证券,2024-04-24,食品饮料,https://pdf.dfcfw.com/pdf/H3_AP202404241631118398_1.pdf?1713966434000.pdf
复合调味品：行业景气，竞争稳定,国联证券,2024-04-24,食品饮料,https://pdf.dfcfw.com/pdf/H3_AP202404241631124701_1.pdf?1713975226000.pdf
食品饮料：24Q1基金持仓分析：板块持仓增长，白酒超配幅度扩大，大众品龙头获青睐,国投证券,2024-04-24,食品饮料,https://pdf.dfcfw.com/pdf/H3_AP202404241631127193_1.pdf?1713977459000.pdf
消费品成本指数跟踪：棕榈油价格止涨转跌，玉米、豆粕持续探底,海通国际,2024-04-24,食品饮料,https://pdf.dfcfw.com/pdf/H3_AP202404241631146926_1.pdf?1713988782000.pdf
食品饮料行业2024年一季度基金持仓分析：食品饮料行业基金重仓占比小幅下滑，非茅白酒获得加配,国信证券,2024-04-24,食品饮料,https://pdf.dfcfw.com/pdf/H3_AP202404241631149760_1.pdf?1713989797000.pdf
食品饮料行业周观点：年度业绩报告持续披露，多数企业表现亮眼,万联证券,2024-04-22,食品饮料,https://pdf.dfcfw.com/pdf/H3_AP202404221630985344_1.pdf?1713815574000.pdf
食品饮料行业周报：1季度餐饮及烟酒类数据表现较好，承德露露旺季需求实现较快增长,中银证券,2024-04-22,食品饮料,https://pdf.dfcfw.com/pdf/H3_AP202404221630992840_1.pdf?1713819582000.pdf
食品饮料行业报告：食品饮料行业报告户外场景催化软饮需求，关注高分红_有潜力提高分红标的,中邮证券,2024-04-22,食品饮料,https://pdf.dfcfw.com/pdf/H3_AP202404221631010509_1.pdf?1713857741000.pdf
食品饮料行业周报：烟酒社零数据坚韧，餐饮淡季增速回落,国海证券,2024-04-21,食品饮料,https://pdf.dfcfw.com/pdf/H3_AP202404211630937867_1.pdf?1713773693000.pdf
2024年良之隆食材电商节评析：餐饮供应链专题报告：餐饮内卷时代，产业链分工协作百花齐放,国海证券,2024-04-19,食品饮料,https://pdf.dfcfw.com/pdf/H3_AP202404181630607077_1.pdf?1713514284000.pdf
食品饮料酒类行业点评：政策提振信心，顺周期主线有望强化,甬兴证券,2024-04-19,食品饮料,https://pdf.dfcfw.com/pdf/H3_AP202404191630642704_1.pdf?1713519565000.pdf
酒行业周度市场观察：2024年第16周,艾媒咨询,2024-04-19,食品饮料,https://pdf.dfcfw.com/pdf/H3_AP202404191630648342_1.pdf?1713540495000.pdf
食品饮料行业周度市场观察第16周,艾瑞股份,2024-04-19,食品饮料,https://pdf.dfcfw.com/pdf/H3_AP202404191630648344_1.pdf?1713537896000.pdf
食品饮料行业+公司首次覆盖：中低速增长阶段的行业发展路径——啤酒篇,东吴证券,2024-04-19,食品饮料,https://pdf.dfcfw.com/pdf/H3_AP202404191630653571_1.pdf?1713540389000.pdf
食品饮料行业点评：3月社零增速有所放缓，必选消费韧性较强,甬兴证券,2024-04-19,食品饮料,https://pdf.dfcfw.com/pdf/H3_AP202404191630720267_1.pdf?1713562544000.pdf
食品饮料行业研究：再论千元高端龙头量价策略,国金证券,2024-04-18,食品饮料,https://pdf.dfcfw.com/pdf/H3_AP202404181630501091_1.pdf?1713434276000.pdf
2023年中国管道直饮水行业概览：饮用水需求升级，巨量市场潜力有待开发,头豹研究院,2024-04-18,食品饮料,https://pdf.dfcfw.com/pdf/H3_AP202404181630528207_1.pdf?1713469238000.pdf
食品饮料行业点评报告：3月社零增速环比放缓，淡季需求季节性波动,开源证券,2024-04-17,食品饮料,https://pdf.dfcfw.com/pdf/H3_AP202404171630393325_1.pdf?1713352607000.pdf
白酒批发价格跟踪：飞天批价筑底回涨，次高端稳中有升,海通国际,2024-04-16,食品饮料,https://pdf.dfcfw.com/pdf/H3_AP202404161630268842_1.pdf?1713257471000.pdf
食品饮料：光瓶酒专题（二）：后疫情时代光瓶酒的分化演绎,华福证券,2024-04-16,食品饮料,https://pdf.dfcfw.com/pdf/H3_AP202404161630274870_1.pdf?1713280370000.pdf
食品饮料行业周报：1季度行业营收稳健增长可期，大众价格带表现较好,中银证券,2024-04-15,食品饮料,https://pdf.dfcfw.com/pdf/H3_AP202404151630224927_1.pdf?1713204127000.pdf
食品饮料行业专题：24Q1食品饮料关注公司前瞻,华安证券,2024-04-15,食品饮料,https://pdf.dfcfw.com/pdf/H3_AP202404151630229382_1.pdf?1713207828000.pdf
被低估的新种业，挖掘4000亿规模的行业机会 词条报告系列,头豹研究院,2024-04-15,食品饮料,https://pdf.dfcfw.com/pdf/H3_AP202404151630231543_1.pdf?1713210577000.pdf
食品饮料行业周观点：食品安全标准新规发布，食饮年报业绩密集披露,万联证券,2024-04-15,食品饮料,https://pdf.dfcfw.com/pdf/H3_AP202404151630233726_1.pdf?1713211631000.pdf
食品饮料行业周报：飞天批价企稳，零食业绩亮眼,东海证券,2024-04-15,食品饮料,https://pdf.dfcfw.com/pdf/H3_AP202404151630236866_1.pdf?1713215140000.pdf
咖啡的觉醒年代系列（一）：如何看待中国咖啡需求的天花板？,国金证券,2024-04-14,食品饮料,https://pdf.dfcfw.com/pdf/H3_AP202404141630208033_1.pdf?1713107978000.pdf
咖啡行业报告：披坚执“瑞”从头越，“幸”光不问赶路人,天风证券,2024-04-14,食品饮料,https://pdf.dfcfw.com/pdf/H3_AP202404141630208133_1.pdf?1713104558000.pdf
