研报名称,机构名称,发布时间,行业,研报地址
预制菜行业深度报告：顺应趋势，优者恒优,东莞证券,2024-02-28,食品饮料,https://pdf.dfcfw.com/pdf/H3_AP202402281623983986_1.pdf?1709139515000.pdf
食品饮料行业动态点评：市场监管总局发文，促进保健食品发展,东方财富证券,2024-02-28,食品饮料,https://pdf.dfcfw.com/pdf/H3_AP202402281623984800_1.pdf?1709139065000.pdf
食品饮料行业周报：白酒春节动销回暖，市场情绪修复,东海证券,2024-02-27,食品饮料,https://pdf.dfcfw.com/pdf/H3_AP202402261623621019_1.pdf?1709023805000.pdf
食品饮料周报（24年第7周）：各大酒企陆续出台2024年营销规划，关注节后渠道补库存,国信证券,2024-02-27,食品饮料,https://pdf.dfcfw.com/pdf/H3_AP202402271623722907_1.pdf?1709024109000.pdf
食品饮料行业周观点：白酒板块上行，酒企新春会议定调全年任务目标,万联证券,2024-02-27,食品饮料,https://pdf.dfcfw.com/pdf/H3_AP202402271623723709_1.pdf?1709024752000.pdf
食品饮料：新春旺季开门红，韧性凸显稳复苏,华福证券,2024-02-27,食品饮料,https://pdf.dfcfw.com/pdf/H3_AP202402271623726689_1.pdf?1709032812000.pdf
白酒：春节动销正增长超预期，高端和地产龙头动销领先,太平洋,2024-02-27,食品饮料,https://pdf.dfcfw.com/pdf/H3_AP202402271623730916_1.pdf?1709044795000.pdf
食品饮料行业周报：2024年春节茅台酒市场观察,信达证券,2024-02-27,食品饮料,https://pdf.dfcfw.com/pdf/H3_AP202402271623742839_1.pdf?1709053509000.pdf
食品饮料行业周报：春节旺季消费回暖，动销表现略超预期,华龙证券,2024-02-27,食品饮料,https://pdf.dfcfw.com/pdf/H3_AP202402271623748041_1.pdf?1709062005000.pdf
食品饮料行业跟踪周报：回购潮涌，水穷云起,东吴证券,2024-02-27,食品饮料,https://pdf.dfcfw.com/pdf/H3_AP202402271623832244_1.pdf?1709106183000.pdf
食品饮料行业周报：白酒韧性突显，调味品持续改善,开源证券,2024-02-26,食品饮料,https://pdf.dfcfw.com/pdf/H3_AP202402261623573141_1.pdf?1708934981000.pdf
食品饮料行业周报：春节整体动销旺盛，看好板块估值修复,德邦证券,2024-02-26,食品饮料,https://pdf.dfcfw.com/pdf/H3_AP202402261623574045_1.pdf?1708942796000.pdf
食品饮料行业周报：新业态新趋势，变化正悄然发生,华金证券,2024-02-26,食品饮料,https://pdf.dfcfw.com/pdf/H3_AP202402261623574079_1.pdf?1708943119000.pdf
白酒行业线上化发展深度研究：白酒线上化之风已至，将为行业带来什么,中泰证券,2024-02-26,食品饮料,https://pdf.dfcfw.com/pdf/H3_AP202402261623574631_1.pdf?1708941486000.pdf
食品饮料行业周思考(第9周)：春节动销较好，消费韧性突显,中泰证券,2024-02-26,食品饮料,https://pdf.dfcfw.com/pdf/H3_AP202402261623574612_1.pdf?1708941160000.pdf
食品饮料行业专题报告：回乡见闻之二：潜心耕耘，也无风雨也无晴,华金证券,2024-02-26,食品饮料,https://pdf.dfcfw.com/pdf/H3_AP202402251623566731_1.pdf?1708932401000.pdf
食品饮料行业周报：酒企密集展开2024年部署，关注大众食品复苏,上海证券,2024-02-26,食品饮料,https://pdf.dfcfw.com/pdf/H3_AP202402261623584677_1.pdf?1708967040000.pdf
食品级透明质酸终端产品（透明质酸食品） 头豹词条报告系列,头豹研究院,2024-02-26,食品饮料,https://pdf.dfcfw.com/pdf/H3_AP202402261623592845_1.pdf?1708976903000.pdf
白酒专题：红包政策弱化反映的厂商新矛盾,国投证券,2024-02-26,食品饮料,https://pdf.dfcfw.com/pdf/H3_AP202402261623598175_1.pdf?1708981504000.pdf
食品饮料行业周报：春节超预期，关注后续表现,平安证券,2024-02-26,食品饮料,https://pdf.dfcfw.com/pdf/H3_AP202402261623578018_1.pdf?1708952651000.pdf
食品饮料行业周报：2024年春节旺季总结：年味浓，人气足，大众消费韧性强,国海证券,2024-02-25,食品饮料,https://pdf.dfcfw.com/pdf/H3_AP202402251623566853_1.pdf?1708937713000.pdf
咖啡行业点评：瑞幸咖啡发布2023年Q4业绩：淡季加速开店叠加优惠活动影响，利润有所承压,民生证券,2024-02-25,食品饮料,https://pdf.dfcfw.com/pdf/H3_AP202402251623563784_1.pdf?1708869510000.pdf
食品饮料行业周报：休闲食品调研反馈，板块回暖推荐布局,国金证券,2024-02-25,食品饮料,https://pdf.dfcfw.com/pdf/H3_AP202402251623564503_1.pdf?1708871717000.pdf
食品饮料行业周报：春节动销良性，持续关注需求复苏进展,东莞证券,2024-02-25,食品饮料,https://pdf.dfcfw.com/pdf/H3_AP202402251623565171_1.pdf?1708874019000.pdf
食品饮料行业周报：信心逐步修复，库存正常消化,华鑫证券,2024-02-25,食品饮料,https://pdf.dfcfw.com/pdf/H3_AP202402251623566652_1.pdf?1708882424000.pdf
食品饮料行业专题报告：回乡见闻之一：收入消费小有变化，闲看庭前花开花落,华金证券,2024-02-23,食品饮料,https://pdf.dfcfw.com/pdf/H3_AP202402231623008576_1.pdf?1708672512000.pdf
HTI大众品零售价格跟踪：多数产品折扣力度较春节前增加,海通国际,2024-02-23,食品饮料,https://pdf.dfcfw.com/pdf/H3_AP202402231623034571_1.pdf?1708680206000.pdf
低度酒产业研究系列三：他山之石——高度酒是否有低度化的可能性？,华福证券,2024-02-23,食品饮料,https://pdf.dfcfw.com/pdf/H3_AP202402231623156156_1.pdf?1708700099000.pdf
食品饮料行业：两宏观因素推动企业现金流好转-2020年复盘和2024年展望,东兴证券,2024-02-23,食品饮料,https://pdf.dfcfw.com/pdf/H3_AP202402231623226596_1.pdf?1708708428000.pdf
广式月饼 头豹词条报告系列,头豹研究院,2024-02-23,食品饮料,https://pdf.dfcfw.com/pdf/H3_AP202402231623268876_1.pdf?1708719165000.pdf
鸡蛋 头豹词条报告系列,头豹研究院,2024-02-23,食品饮料,https://pdf.dfcfw.com/pdf/H3_AP202402231623268879_1.pdf?1708719576000.pdf
食品饮料行业深度报告：大众品春节调研反馈：乳制品旺销，基调稳健、复调龙头亮眼,东吴证券,2024-02-22,食品饮料,https://pdf.dfcfw.com/pdf/H3_AP202402211622526917_1.pdf?1708587011000.pdf
食品饮料：春节返乡带动大众消费提升 白酒动销回暖分化延续,南京证券,2024-02-22,食品饮料,https://pdf.dfcfw.com/pdf/H3_AP202402221622753205_1.pdf?1708592484000.pdf
HTI消费品成本指数：节后现货成本小幅波动，期货成本跌幅明显,海通国际,2024-02-22,食品饮料,https://pdf.dfcfw.com/pdf/H3_AP202402221622748657_1.pdf?1708612216000.pdf
黑松露流心奶黄月饼 头豹词条报告系列,头豹研究院,2024-02-22,食品饮料,https://pdf.dfcfw.com/pdf/H3_AP202402221622865069_1.pdf?1708632303000.pdf
食品饮料1月月报：线下食品销售额同比表现优于饮品,国联证券,2024-02-21,食品饮料,https://pdf.dfcfw.com/pdf/H3_AP202402201622451132_1.pdf?1708499936000.pdf
2023年中国粤式火锅行业概览：广东火锅品牌的崛起机会在何处？（摘要版）,头豹研究院,2024-02-21,食品饮料,https://pdf.dfcfw.com/pdf/H3_AP202402211622516747_1.pdf?1708548443000.pdf
白酒春节反馈：动销改善，批价稳定,平安证券,2024-02-20,食品饮料,https://pdf.dfcfw.com/pdf/H3_AP202402201622406073_1.pdf?1708417537000.pdf
行业周报：春节：白酒量价齐升，库存高位略降,华金证券,2024-02-20,食品饮料,https://pdf.dfcfw.com/pdf/H3_AP202402201622408991_1.pdf?1708429435000.pdf
食品饮料行业周报：春节：白酒量价齐升，库存高位略降,华金证券,2024-02-20,食品饮料,https://pdf.dfcfw.com/pdf/H3_AP202402201622409244_1.pdf?1708434767000.pdf
食品行业周报：24年1月CPI同比下降0.8%,海通国际,2024-02-20,食品饮料,https://pdf.dfcfw.com/pdf/H3_AP202402201622414382_1.pdf?1708448470000.pdf
HTI重点白酒品牌价格跟踪：批价较上月、较年初均跌多涨少,海通国际,2024-02-20,食品饮料,https://pdf.dfcfw.com/pdf/H3_AP202402201622406347_1.pdf?1708435919000.pdf
食品饮料行业报告：春节动销好于预期，关注节后延续性,中邮证券,2024-02-20,食品饮料,https://pdf.dfcfw.com/pdf/H3_AP202402201622448322_1.pdf?1708464922000.pdf
食品饮料行业周报：“走亲戚”带来的旺季超预期,国投证券,2024-02-19,食品饮料,https://pdf.dfcfw.com/pdf/H3_AP202402191622381123_1.pdf?1708328828000.pdf
食品饮料行业周报：春节动销回暖，大众消费更优,开源证券,2024-02-19,食品饮料,https://pdf.dfcfw.com/pdf/H3_AP202402191622382142_1.pdf?1708332297000.pdf
食品行业23年业绩预告总结：需求温和复苏，关注结构性机会,天风证券,2024-02-19,食品饮料,https://pdf.dfcfw.com/pdf/H3_AP202402191622382478_1.pdf?1708335185000.pdf
食品饮料2024春节旺季点评：动销韧性凸显，大众消费活跃,东吴证券,2024-02-19,食品饮料,https://pdf.dfcfw.com/pdf/H3_AP202402191622382486_1.pdf?1708335999000.pdf
食品饮料行业2024年春节假期行业动态点评：春节提振需求，动销表现良性,东莞证券,2024-02-19,食品饮料,https://pdf.dfcfw.com/pdf/H3_AP202402191622380010_1.pdf?1708339021000.pdf
食品饮料周报（24年第6周）：春节返乡效应促进居民消费，大众价位带白酒动销较好,国信证券,2024-02-19,食品饮料,https://pdf.dfcfw.com/pdf/H3_AP202402191622397291_1.pdf?1708377366000.pdf
食品饮料行业周观点：头部酒企组团亮相春晚，春节假期点亮消费“开门红”,万联证券,2024-02-19,食品饮料,https://pdf.dfcfw.com/pdf/H3_AP202402191622402360_1.pdf?1708423325000.pdf
食品饮料行业周报：春节需求平稳，库存逐步去化,上海证券,2024-02-19,食品饮料,https://pdf.dfcfw.com/pdf/H3_AP202402191622385011_1.pdf?1708358092000.pdf
2024年春节白酒动销总结：消费倾向随人口返乡而提高，氛围好于节前跟踪,国信证券,2024-02-19,食品饮料,https://pdf.dfcfw.com/pdf/H3_AP202402191622386441_1.pdf?1708349050000.pdf
食品饮料专题：2024年春节见闻录：旺季如期来临，礼赠宴席需求突出,国投证券,2024-02-18,食品饮料,https://pdf.dfcfw.com/pdf/H3_AP202402171622192992_1.pdf?1708248376000.pdf
食品饮料行业周报：白酒春节动销分化，高端、地产酒需求旺盛,华鑫证券,2024-02-18,食品饮料,https://pdf.dfcfw.com/pdf/H3_AP202402171622233613_1.pdf?1708248281000.pdf
海外消费复盘系列：日本咖啡行业启示录之供给篇-连锁咖啡的竞争与终局,国金证券,2024-02-18,食品饮料,https://pdf.dfcfw.com/pdf/H3_AP202402181622335948_1.pdf?1708269320000.pdf
食品饮料行业研究：春节调研反馈：动销回暖，分化延续,国金证券,2024-02-18,食品饮料,https://pdf.dfcfw.com/pdf/H3_AP202402181622335927_1.pdf?1708264276000.pdf
白酒行业春节跟踪专题报告：动销回暖趋势向好，内部分化态势依旧,华鑫证券,2024-02-18,食品饮料,https://pdf.dfcfw.com/pdf/H3_AP202402181622349486_1.pdf?1708271130000.pdf
食品饮料行业周报：五粮液提价提振信心，关注旺季动销,甬兴证券,2024-02-15,食品饮料,https://pdf.dfcfw.com/pdf/H3_AP202402151621802395_1.pdf?1708005047000.pdf
调味品行业全景图：人间美味，始于调味,平安证券,2024-02-08,食品饮料,https://pdf.dfcfw.com/pdf/H3_AP202402081621124905_1.pdf?1707387109000.pdf
食品饮料行业周报：五粮液提价落地，关注春节期间动销表现,上海证券,2024-02-08,食品饮料,https://pdf.dfcfw.com/pdf/H3_AP202402081621127880_1.pdf?1707428640000.pdf
食品饮料行业周度市场观察第4周,艾瑞股份,2024-02-08,食品饮料,https://pdf.dfcfw.com/pdf/H3_AP202404101630105462_1.pdf?1712761526000.pdf
食品饮料2月周报：细分品类有望超预期——大众品春节开门红思考,国联证券,2024-02-07,食品饮料,https://pdf.dfcfw.com/pdf/H3_AP202402071621033592_1.pdf?1707340011000.pdf
食品饮料行业周报：大众消费需求旺盛，零食板块景气度较高,华龙证券,2024-02-06,食品饮料,https://pdf.dfcfw.com/pdf/H3_AP202402061620914145_1.pdf?1707218026000.pdf
食品饮料周报：动销逐渐起势，回款进度分化,平安证券,2024-02-06,食品饮料,https://pdf.dfcfw.com/pdf/H3_AP202402061620914138_1.pdf?1707215414000.pdf
食品饮料周报（24年第5周）：白酒动销环比提速，关注大众品板块需求复苏,国信证券,2024-02-06,食品饮料,https://pdf.dfcfw.com/pdf/H3_AP202402061620914139_1.pdf?1707217897000.pdf
HTI重点白酒品牌价格跟踪：高端批价小幅抬升，普五提价彰显信心,海通国际,2024-02-06,食品饮料,https://pdf.dfcfw.com/pdf/H3_AP202402061620909702_1.pdf?1707229950000.pdf
2024年员工持股计划（草案）点评：激发员工积极性，助力新战略目标,中国银河,2024-02-06,食品饮料,https://pdf.dfcfw.com/pdf/H3_AP202402061620950993_1.pdf?1707234313000.pdf
2024白酒行业年度策略报告：底部寻金，四维聚焦优选稳健和关注困境反转标的,首创证券,2024-02-05,食品饮料,https://pdf.dfcfw.com/pdf/H3_AP202402051620559226_1.pdf?1707128719000.pdf
食品饮料“霓虹甜心”系列（一）：日本烘焙行业进击启示录,中泰证券,2024-02-05,食品饮料,https://pdf.dfcfw.com/pdf/H3_AP202402051620560109_1.pdf?1707128246000.pdf
食品饮料行业周报：塔斯汀破局的关键：基于性价比的体验升级,信达证券,2024-02-05,食品饮料,https://pdf.dfcfw.com/pdf/H3_AP202402051620565197_1.pdf?1707153554000.pdf
食品加工行业跟踪报告：23年国内主产区原奶均价同比-7.6%,海通国际,2024-02-04,食品饮料,https://pdf.dfcfw.com/pdf/H3_AP202402041620271333_1.pdf?1707043215000.pdf
食品饮料行业周报：春节回款持续分化，板块底部趋势向好,华鑫证券,2024-02-04,食品饮料,https://pdf.dfcfw.com/pdf/H3_AP202402041620551188_1.pdf?1707068095000.pdf
食品饮料周专题：各区域白酒春节开门红反馈及思考,国联证券,2024-02-04,食品饮料,https://pdf.dfcfw.com/pdf/H3_AP202402041620553212_1.pdf?1707068670000.pdf
食品饮料：白酒春节动销逐步开启 关注春节年货需求,南京证券,2024-02-04,食品饮料,https://pdf.dfcfw.com/pdf/H3_AP202404101630105419_1.pdf?1712760093000.pdf
大众品系列研究（一）：严冬将过，卤制品公司拓店进行时,东海证券,2024-02-02,食品饮料,https://pdf.dfcfw.com/pdf/H3_AP202402021620086317_1.pdf?1706907319000.pdf
HTI消费品1月需求月报：餐饮品牌同店同比或有承压,海通国际,2024-02-02,食品饮料,https://pdf.dfcfw.com/pdf/H3_AP202402021620063833_1.pdf?1706887994000.pdf
预制菜专题研究系列二：预制菜走入年夜饭餐桌，关注产业链龙头公司,源达信息,2024-02-02,食品饮料,https://pdf.dfcfw.com/pdf/H3_AP202402021620073535_1.pdf?1706892511000.pdf
食品饮料行业：物价温和回升预期增强，食品饮料企业盈利有望进一步增强,东兴证券,2024-02-01,食品饮料,https://pdf.dfcfw.com/pdf/H3_AP202402011619992024_1.pdf?1706776258000.pdf
中国绿茶行业市场规模测算逻辑模型 头豹词条报告系列,头豹研究院,2024-02-01,食品饮料,https://pdf.dfcfw.com/pdf/H3_AP202402011620018505_1.pdf?1706816658000.pdf
食品饮料行业研究：如何看待24年大众品成本改善？,国金证券,2024-01-31,食品饮料,https://pdf.dfcfw.com/pdf/H3_AP202401311619789194_1.pdf?1706717043000.pdf
中国椰子肉加工行业市场规模测算逻辑模型 头豹词条报告系列,头豹研究院,2024-01-31,食品饮料,https://pdf.dfcfw.com/pdf/H3_AP202401311619800968_1.pdf?1706730257000.pdf
酱油行业深度报告：BC端推动行业稳健发展，短期关注需求复苏,东莞证券,2024-01-30,食品饮料,https://pdf.dfcfw.com/pdf/H3_AP202401301619518311_1.pdf?1706635561000.pdf
食品饮料行业：再论我国酱油C端消费升级路径，探寻品类β机遇,华福证券,2024-01-30,食品饮料,https://pdf.dfcfw.com/pdf/H3_AP202401301619498982_1.pdf?1706607467000.pdf
食品饮料行业周报：白酒进入动销旺季，多家披露业绩预告,华金证券,2024-01-29,食品饮料,https://pdf.dfcfw.com/pdf/H3_AP202401291619271718_1.pdf?1706539499000.pdf
食品饮料行业周报：春节旺季来临，需求持续改善,东海证券,2024-01-29,食品饮料,https://pdf.dfcfw.com/pdf/H3_AP202401291619273276_1.pdf?1706545229000.pdf
中国酒类行业展望，2024年1月,中诚信国际,2024-01-29,食品饮料,https://pdf.dfcfw.com/pdf/H3_AP202401291619275084_1.pdf?1706555620000.pdf
方便面 头豹词条报告系列,头豹研究院,2024-01-29,食品饮料,https://pdf.dfcfw.com/pdf/H3_AP202401291619283945_1.pdf?1706560953000.pdf
食品添加剂：产品定价与毛利率归因复杂,信达证券,2024-01-29,食品饮料,https://pdf.dfcfw.com/pdf/H3_AP202401291619307959_1.pdf?1706563196000.pdf
食品饮料周报：回款与备货稳步推进，期待后续表现,平安证券,2024-01-29,食品饮料,https://pdf.dfcfw.com/pdf/H3_AP202401291619253772_1.pdf?1706519019000.pdf
食品饮料行业2023Q4基金重仓分析：行业持仓环比回落，重仓比例维持居前,德邦证券,2024-01-28,食品饮料,https://pdf.dfcfw.com/pdf/H3_AP202401281619241611_1.pdf?1706445381000.pdf
食品饮料行业周报：政策利好提振市场信心，情绪修复支撑短期估值,华鑫证券,2024-01-28,食品饮料,https://pdf.dfcfw.com/pdf/H3_AP202401281619242521_1.pdf?1706448524000.pdf
食品饮料行业点评报告：12月电商数据分析：线上销售下降，需求温和复苏,开源证券,2024-01-28,食品饮料,https://pdf.dfcfw.com/pdf/H3_AP202401281619241619_1.pdf?1706446009000.pdf
食品饮料行业周报：进入春节旺季，重视零食板块机会,甬兴证券,2024-01-26,食品饮料,https://pdf.dfcfw.com/pdf/H3_AP202401261618281856_1.pdf?1706521243000.pdf
食品饮料23Q4基金持仓分析：板块持仓延续回落，白酒超配再度收窄，食品龙头获加仓,国投证券,2024-01-25,食品饮料,https://pdf.dfcfw.com/pdf/H3_AP202401241618006263_1.pdf?1706176058000.pdf
估值低位，防御性标的受青睐—食品饮料行业 2023Q4 基金重仓分析,信达证券,2024-01-25,食品饮料,https://pdf.dfcfw.com/pdf/H3_AP202401251618101980_1.pdf?1706182220000.pdf
食品饮料行业点评：茅台再推联名新品，关注酒业品牌势能,甬兴证券,2024-01-25,食品饮料,https://pdf.dfcfw.com/pdf/H3_AP202401251618102658_1.pdf?1706188714000.pdf
食品饮料行业周报：酒企的大小商抉择本质多为效率提升,信达证券,2024-01-24,食品饮料,https://pdf.dfcfw.com/pdf/H3_AP202401241617994904_1.pdf?1706114588000.pdf
食品饮料行业周观点：茅台开年营销发力消费终端，多家食饮公司业绩预喜,万联证券,2024-01-23,食品饮料,https://pdf.dfcfw.com/pdf/H3_AP202401231617941566_1.pdf?1705994753000.pdf
HTI重点白酒品牌价格跟踪：以价换量迹象显现，回款备货有序进行,海通国际,2024-01-23,食品饮料,https://pdf.dfcfw.com/pdf/H3_AP202401231617944613_1.pdf?1706022630000.pdf
大众食品12月电商数据跟踪：12月休闲零食同比跌幅扩大，冲饮和调味品线上销售情况有所回暖,万联证券,2024-01-23,食品饮料,https://pdf.dfcfw.com/pdf/H3_AP202401231617953254_1.pdf?1706029367000.pdf
食品饮料行业：建议关注长期基本面扎实个股,东兴证券,2024-01-23,食品饮料,https://pdf.dfcfw.com/pdf/H3_AP202401231617953352_1.pdf?1706029292000.pdf
食品饮料行业周报：零食企业业绩亮眼，白酒动销有序推进,东海证券,2024-01-22,食品饮料,https://pdf.dfcfw.com/pdf/H3_AP202401221617912773_1.pdf?1705946492000.pdf
食品检测 头豹词条报告系列,头豹研究院,2024-01-22,食品饮料,https://pdf.dfcfw.com/pdf/H3_AP202401221617916075_1.pdf?1705953128000.pdf
食品饮料行业周报：进入春节旺季，关注动销节奏及需求端变化,华龙证券,2024-01-22,食品饮料,https://pdf.dfcfw.com/pdf/H3_AP202401221617924546_1.pdf?1705959061000.pdf
食品饮料周思考（第4周）：23年规上白酒产量小幅下降，啤酒24年轻装上阵,中泰证券,2024-01-22,食品饮料,https://pdf.dfcfw.com/pdf/H3_AP202401221617898722_1.pdf?1705918963000.pdf
食品饮料行业周报：关注分红能力及意愿对估值的影响,申港证券,2024-01-22,食品饮料,https://pdf.dfcfw.com/pdf/H3_AP202401221617905218_1.pdf?1705934420000.pdf
食品饮料行业周报：进入春节备货期，行业有望迎来开门红,上海证券,2024-01-22,食品饮料,https://pdf.dfcfw.com/pdf/H3_AP202401221617905429_1.pdf?1705935214000.pdf
食品饮料行业周报：寻找护城河高、可持续成长的高股息品种,中银证券,2024-01-22,食品饮料,https://pdf.dfcfw.com/pdf/H3_AP202401221617905287_1.pdf?1705934754000.pdf
食品饮料行业周报：零食景气度亮眼，大众品关注需求提升,甬兴证券,2024-01-22,食品饮料,https://pdf.dfcfw.com/pdf/H3_AP202401221617890186_1.pdf?1705918866000.pdf
食品饮料行业周报：看多春节旺季行情，关注市场反弹机会,德邦证券,2024-01-22,食品饮料,https://pdf.dfcfw.com/pdf/H3_AP202401221617890998_1.pdf?1705915173000.pdf
食品饮料行业点评报告：12月社零增速环比回落，消费需求延续修复趋势,开源证券,2024-01-22,食品饮料,https://pdf.dfcfw.com/pdf/H3_AP202401221617891045_1.pdf?1705911215000.pdf
食品饮料行业研究：23Q4业绩前瞻，分化中关注韧性,国金证券,2024-01-22,食品饮料,https://pdf.dfcfw.com/pdf/H3_AP202401221617891586_1.pdf?1705918446000.pdf
食品饮料行业周报：零食景气度持续，行业仍在红利期,开源证券,2024-01-22,食品饮料,https://pdf.dfcfw.com/pdf/H3_AP202401221617891603_1.pdf?1705916023000.pdf
食品饮料行业周报：春节回款分化中，休闲食品备货加速中,华鑫证券,2024-01-22,食品饮料,https://pdf.dfcfw.com/pdf/H3_AP202401211617888483_1.pdf?1705912502000.pdf
食品饮料1月周报：国家积极发展银发经济，保健品板块有望受益,国联证券,2024-01-21,食品饮料,https://pdf.dfcfw.com/pdf/H3_AP202401211617886522_1.pdf?1705832711000.pdf
食品饮料行业双周报：春节备货陆续启动，关注动销、库存等重要指标,东莞证券,2024-01-21,食品饮料,https://pdf.dfcfw.com/pdf/H3_AP202401211617888111_1.pdf?1705857585000.pdf
12月食品饮料社零数据点评：4季度餐饮、烟酒、饮料社零数据增速环比提速,中银证券,2024-01-21,食品饮料,https://pdf.dfcfw.com/pdf/H3_AP202401201617819838_1.pdf?1705831878000.pdf
白酒行业12月电商数据跟踪：12月白酒线上销售额同比上行，但增速较11月下滑,万联证券,2024-01-19,食品饮料,https://pdf.dfcfw.com/pdf/H3_AP202401191617724016_1.pdf?1705656130000.pdf
食品饮料行业周度市场观察第52周,艾瑞股份,2024-01-19,食品饮料,https://pdf.dfcfw.com/pdf/H3_AP202401191617730854_1.pdf?1705678801000.pdf
食品饮料行业低度酒产业研究系列二：我们该如何判断预调酒行业的格局演变？,华福证券,2024-01-19,食品饮料,https://pdf.dfcfw.com/pdf/H3_AP202401191617708705_1.pdf?1705650645000.pdf
啤酒行业12月电商数据跟踪：12月啤酒线上销售维持正增长，淘系表现较优,万联证券,2024-01-19,食品饮料,https://pdf.dfcfw.com/pdf/H3_AP202401191617708707_1.pdf?1705649109000.pdf
中国必需消费：HTI消费品成本指数：期货成本指数同比均转负,海通国际,2024-01-18,食品饮料,https://pdf.dfcfw.com/pdf/H3_AP202401181617671773_1.pdf?1705584919000.pdf
中国乳制品行业：基本面依然稳健，新常态下估值超跌明显,浦银国际证券,2024-01-18,食品饮料,https://pdf.dfcfw.com/pdf/H3_AP202401181617676821_1.pdf?1705587210000.pdf
食品饮料行业24年年度投资策略：立足确定，优选龙头,山西证券,2024-01-18,食品饮料,https://pdf.dfcfw.com/pdf/H3_AP202401181617685217_1.pdf?1705597591000.pdf
羊肉 头豹词条报告系列,头豹研究院,2024-01-17,食品饮料,https://pdf.dfcfw.com/pdf/H3_AP202401171617593386_1.pdf?1705521642000.pdf
液态调味品 头豹词条报告系列,头豹研究院,2024-01-17,食品饮料,https://pdf.dfcfw.com/pdf/H3_AP202401171617593385_1.pdf?1705521642000.pdf
油茶籽 头豹词条报告系列,头豹研究院,2024-01-17,食品饮料,https://pdf.dfcfw.com/pdf/H3_AP202401171617593392_1.pdf?1705521834000.pdf
食品饮料行业周报：需求主导时代，折扣业态兴起,信达证券,2024-01-17,食品饮料,https://pdf.dfcfw.com/pdf/H3_AP202401161617542969_1.pdf?1705476922000.pdf
食品饮料行业周报：啤酒估值底部 投资机会将至,申港证券,2024-01-17,食品饮料,https://pdf.dfcfw.com/pdf/H3_AP202401171617577411_1.pdf?1705480417000.pdf
新消费研究之咖啡系列报告：蜜雪_古茗招股，咖啡和现制茶饮的对比研究,民生证券,2024-01-17,食品饮料,https://pdf.dfcfw.com/pdf/H3_AP202401171617582795_1.pdf?1705502004000.pdf
中国儿童DHA市场白皮书,艾瑞股份,2024-01-16,食品饮料,https://pdf.dfcfw.com/pdf/H3_AP202401161617509441_1.pdf?1705419178000.pdf
食品饮料行业周观点：2023年业绩预告陆续发布，食品饮料业绩呈回暖迹象,万联证券,2024-01-16,食品饮料,https://pdf.dfcfw.com/pdf/H3_AP202401161617534605_1.pdf?1705436817000.pdf
食品饮料行业2024年度策略：白酒进入换挡期，关注黄酒变革，大众品结构性亮点多,中银证券,2024-01-16,食品饮料,https://pdf.dfcfw.com/pdf/H3_AP202401161617533845_1.pdf?1705444174000.pdf
食品饮料行业周报：春节旺季临近，关注终端需求复苏进程,国海证券,2024-01-16,食品饮料,https://pdf.dfcfw.com/pdf/H3_AP202401161617504867_1.pdf?1705389518000.pdf
食品饮料行业：消费预期稳中有升，逐级恢复关注细分机会,华福证券,2024-01-16,食品饮料,https://pdf.dfcfw.com/pdf/H3_AP202401161617506562_1.pdf?1705395229000.pdf
