研报名称,机构名称,发布时间,行业,研报地址
食品饮料行业周报：调整中孕育着机会，大众价格带需求不乏亮点,中银证券,2024-01-16,食品饮料,https://pdf.dfcfw.com/pdf/H3_AP202401161617507274_1.pdf?1705397807000.pdf
食品饮料行业周报：消费有韧性，旺季将至，回款进度略慢但任务达成无忧,国投证券,2024-01-16,食品饮料,https://pdf.dfcfw.com/pdf/H3_AP202401161617508651_1.pdf?1705403737000.pdf
食品饮料行业研究：策略会反馈专题，旺季临近关注催化,国金证券,2024-01-15,食品饮料,https://pdf.dfcfw.com/pdf/H3_AP202401151617486094_1.pdf?1705315583000.pdf
食品饮料行业周报：春节消费景气度较高，关注备货及动销节奏,德邦证券,2024-01-15,食品饮料,https://pdf.dfcfw.com/pdf/H3_AP202401151617487324_1.pdf?1705315583000.pdf
食品饮料周思考（第3周）：零食业绩亮眼，啤酒逐步筑底,中泰证券,2024-01-15,食品饮料,https://pdf.dfcfw.com/pdf/H3_AP202401151617488880_1.pdf?1705318315000.pdf
食品饮料行业周报：休闲食品迎销售旺季，酒企24年稳字当先,华金证券,2024-01-15,食品饮料,https://pdf.dfcfw.com/pdf/H3_AP202401151617489401_1.pdf?1705325625000.pdf
酒行业周度市场观察,艾瑞股份,2024-01-15,食品饮料,https://pdf.dfcfw.com/pdf/H3_AP202401151617484851_1.pdf?1705335254000.pdf
食品饮料行业周报：静待信心修复，关注春节回款,甬兴证券,2024-01-15,食品饮料,https://pdf.dfcfw.com/pdf/H3_AP202401151617484990_1.pdf?1705312365000.pdf
食品饮料行业周度市场观察2024年第1周,艾瑞股份,2024-01-15,食品饮料,https://pdf.dfcfw.com/pdf/H3_AP202401151617485026_1.pdf?1705329422000.pdf
食品饮料周报：关注白酒春节动销与预制食品板块,平安证券,2024-01-15,食品饮料,https://pdf.dfcfw.com/pdf/H3_AP202401151617485882_1.pdf?1705306947000.pdf
食品饮料行业周报：零食延续成长性，白酒关注春节动销,开源证券,2024-01-15,食品饮料,https://pdf.dfcfw.com/pdf/H3_AP202401151617485879_1.pdf?1705306730000.pdf
食品饮料周报（24年第2周）：春节旺季临近，白酒进入动销验证期，关注大众品需求恢复节奏,国信证券,2024-01-15,食品饮料,https://pdf.dfcfw.com/pdf/H3_AP202401151617490365_1.pdf?1705331746000.pdf
食品饮料行业周报：春节备货旺季来临，关注绩优企业,东海证券,2024-01-15,食品饮料,https://pdf.dfcfw.com/pdf/H3_AP202401151617496828_1.pdf?1705344836000.pdf
食品饮料1月周报：2023年食饮销售数据展现出的三大趋势,国联证券,2024-01-14,食品饮料,https://pdf.dfcfw.com/pdf/H3_AP202401121617426474_1.pdf?1705228294000.pdf
食品饮料行业周报：业绩预告提振信心，关注板块估值修复,华鑫证券,2024-01-14,食品饮料,https://pdf.dfcfw.com/pdf/H3_AP202401141617483962_1.pdf?1705252896000.pdf
食品饮料&农林牧渔：休闲零食龙头势能向上，生猪市场近期供强需弱,首创证券,2024-01-12,食品饮料,https://pdf.dfcfw.com/pdf/H3_AP202401121617297976_1.pdf?1705050556000.pdf
食品饮料周报（24年第1周）：白酒春节开门红回款有序进行，关注大众品板块需求复苏,国信证券,2024-01-12,食品饮料,https://pdf.dfcfw.com/pdf/H3_AP202401121617310227_1.pdf?1705053845000.pdf
食品饮料12月月报：线下饮品销售额同比表现优于食品,国联证券,2024-01-12,食品饮料,https://pdf.dfcfw.com/pdf/H3_AP202401121617315152_1.pdf?1705069029000.pdf
啤酒专题研究系列二：啤酒行业估值处于历史底部，大麦成本下降有望驱动利润提升,源达信息,2024-01-11,食品饮料,https://pdf.dfcfw.com/pdf/H3_AP202401111617254561_1.pdf?1704988338000.pdf
中国红茶行业市场规模测算逻辑模型,头豹研究院,2024-01-11,食品饮料,https://pdf.dfcfw.com/pdf/H3_AP202401111617266997_1.pdf?1705004764000.pdf
酒水饮料周报：酒企新年定调积极，春节回款进行中,天风证券,2024-01-11,食品饮料,https://pdf.dfcfw.com/pdf/H3_AP202401111617231776_1.pdf?1704961582000.pdf
中国食品饮料：HTI重点白酒品牌价格跟踪：开年批价小幅回升，春节回款陆续启动,海通国际,2024-01-09,食品饮料,https://pdf.dfcfw.com/pdf/H3_AP202401091616859278_1.pdf?1704808750000.pdf
食品饮料行业：海外与国内烘焙品类差异与渠道结构对比,华福证券,2024-01-09,食品饮料,https://pdf.dfcfw.com/pdf/H3_AP202401091616860434_1.pdf?1704790936000.pdf
食品饮料行业周报：业绩预告陆续发布，报表端具备韧性,华龙证券,2024-01-09,食品饮料,https://pdf.dfcfw.com/pdf/H3_AP202401091616863865_1.pdf?1704793919000.pdf
食品饮料行业周观点：迎接消费旺季，多家酒企推出龙年生肖酒,万联证券,2024-01-09,食品饮料,https://pdf.dfcfw.com/pdf/H3_AP202401091616863874_1.pdf?1704793993000.pdf
食品饮料行业周报：蜜雪和古茗同日发布招股书，推升大众现制饮品热度,中银证券,2024-01-08,食品饮料,https://pdf.dfcfw.com/pdf/H3_AP202401081616761979_1.pdf?1704711169000.pdf
食品饮料行业周报：酒企春节回款逐步推进，关注增长目标,东海证券,2024-01-08,食品饮料,https://pdf.dfcfw.com/pdf/H3_AP202401081616763592_1.pdf?1704721933000.pdf
食品饮料行业周报：茅台生肖酒发布，关注行业结构性机会,上海证券,2024-01-08,食品饮料,https://pdf.dfcfw.com/pdf/H3_AP202401081616772669_1.pdf?1704743222000.pdf
食品饮料行业：食品饮料行业高分红个股梳理,东兴证券,2024-01-08,食品饮料,https://pdf.dfcfw.com/pdf/H3_AP202401081616773167_1.pdf?1704743788000.pdf
食品饮料行业双周报：茅台2023年顺利收官，关注开门红进展,东莞证券,2024-01-08,食品饮料,https://pdf.dfcfw.com/pdf/H3_AP202401081616758742_1.pdf?1704699328000.pdf
食品饮料行业研究：如何看待本周啤酒板块大跌？,国金证券,2024-01-08,食品饮料,https://pdf.dfcfw.com/pdf/H3_AP202401081616759880_1.pdf?1704707974000.pdf
食品饮料行业周报：大众品业绩存分化，蜜雪古茗欲港股上市,华金证券,2024-01-08,食品饮料,https://pdf.dfcfw.com/pdf/H3_AP202401081616759978_1.pdf?1704708267000.pdf
食品饮料周思考（第2周）：白酒规划稳健，燕京、盐津等顺利收官,中泰证券,2024-01-08,食品饮料,https://pdf.dfcfw.com/pdf/H3_AP202401081616761340_1.pdf?1704708670000.pdf
食品饮料行业周报：春节旺季氛围渐浓，头部酒企反馈稳健,德邦证券,2024-01-08,食品饮料,https://pdf.dfcfw.com/pdf/H3_AP202401081616761650_1.pdf?1704709784000.pdf
食品饮料行业周报：关注白酒春节回款，防守思路布局龙头,开源证券,2024-01-08,食品饮料,https://pdf.dfcfw.com/pdf/H3_AP202401081616759616_1.pdf?1704704538000.pdf
食品饮料行业周报：市场信心等待催化，春节回款正常推进,华鑫证券,2024-01-07,食品饮料,https://pdf.dfcfw.com/pdf/H3_AP202401071616757421_1.pdf?1704640244000.pdf
食品饮料周专题：现制茶饮密集递表，行业拥抱资本化新阶段,国联证券,2024-01-07,食品饮料,https://pdf.dfcfw.com/pdf/H3_AP202401071616756922_1.pdf?1704623314000.pdf
食品饮料行业月报：市场表现再度弱化，估值修复螺旋行进,中原证券,2024-01-05,食品饮料,https://pdf.dfcfw.com/pdf/H3_AP202401051616540728_1.pdf?1704447355000.pdf
2024年度食品饮料策略报告：供需要素重新匹配，大变局中迎价值重估,信达证券,2024-01-05,食品饮料,https://pdf.dfcfw.com/pdf/H3_AP202401051616552158_1.pdf?1704454638000.pdf
食品饮料行业周报：2023年收官，2024年砥砺前行,上海证券,2024-01-05,食品饮料,https://pdf.dfcfw.com/pdf/H3_AP202401051616648697_1.pdf?1704466525000.pdf
食品饮料行业点评报告：11月电商数据分析： 白酒线上销售延续增长，食品、饮料类线上销售有所分化,开源证券,2024-01-04,食品饮料,https://pdf.dfcfw.com/pdf/H3_AP202401041616283929_1.pdf?1704353241000.pdf
食品饮料行业周报：2023波动中前行，2024关注结构性机会,开源证券,2024-01-04,食品饮料,https://pdf.dfcfw.com/pdf/H3_AP202401041616289283_1.pdf?1704357797000.pdf
酒水饮料周报：龙头业绩平稳落地提振信心，估值低位价值凸显,天风证券,2024-01-04,食品饮料,https://pdf.dfcfw.com/pdf/H3_AP202401041616338707_1.pdf?1704377752000.pdf
食品饮料行业周报：白酒龙头高质量收官，关注旺季来临需求催化,华龙证券,2024-01-03,食品饮料,https://pdf.dfcfw.com/pdf/H3_AP202401031616090271_1.pdf?1704275657000.pdf
食品饮料行业周报：2023年收官，2024年稳健前行,国海证券,2024-01-03,食品饮料,https://pdf.dfcfw.com/pdf/H3_AP202401031616018228_1.pdf?1704270288000.pdf
食品饮料2024年度策略报告（二）：白酒：需求扰动因素减少，在复苏中分化,国信证券,2024-01-03,食品饮料,https://pdf.dfcfw.com/pdf/H3_AP202401031616127662_1.pdf?1704275087000.pdf
食品饮料行业：复盘日本保健品：从产业链视角看日本保健品对中国的借鉴,华福证券,2024-01-03,食品饮料,https://pdf.dfcfw.com/pdf/H3_AP202401031616128465_1.pdf?1704274329000.pdf
HTI消费品行业12月需求月报：元旦假期国内旅游消费复苏较好,海通国际,2024-01-03,食品饮料,https://pdf.dfcfw.com/pdf/H3_AP202401031616156904_1.pdf?1704292458000.pdf
食品饮料行业2024年度策略报告（一）：去伪存真，格局为王,国信证券,2024-01-03,食品饮料,https://pdf.dfcfw.com/pdf/H3_AP202401031616217461_1.pdf?1704292265000.pdf
食品饮料行业研究：酒企近况更新，龙头态势向好持续关注,国金证券,2024-01-02,食品饮料,https://pdf.dfcfw.com/pdf/H3_AP202401021615914475_1.pdf?1704190560000.pdf
食品饮料行业2024年度策略：需求温和复苏，关注龙头价值回归,华龙证券,2024-01-02,食品饮料,https://pdf.dfcfw.com/pdf/H3_AP202401021615918294_1.pdf?1704215301000.pdf
食品饮料周报：龙头稳健增长，关注春节表现,平安证券,2024-01-02,食品饮料,https://pdf.dfcfw.com/pdf/H3_AP202401021615918344_1.pdf?1704212418000.pdf
食品饮料行业周报：2023年不尽人意，2024年重新出发,中银证券,2024-01-02,食品饮料,https://pdf.dfcfw.com/pdf/H3_AP202401021615918218_1.pdf?1704210859000.pdf
食品饮料行业周报：经销商大会传递信心，头部酒企务实前进,德邦证券,2024-01-02,食品饮料,https://pdf.dfcfw.com/pdf/H3_AP202401021615912891_1.pdf?1704190560000.pdf
食品饮料行业周思考（第1周）：元旦出行火热，茅台圆满收官,中泰证券,2024-01-02,食品饮料,https://pdf.dfcfw.com/pdf/H3_AP202401021615914480_1.pdf?1704190369000.pdf
食品饮料行业周报：经销商大会传递信号，重视行业配置机会,华金证券,2024-01-02,食品饮料,https://pdf.dfcfw.com/pdf/H3_AP202401021615917943_1.pdf?1704211913000.pdf
食品饮料周报（23年第53周）：茅台经销商大会明确增长方向，关注大众品板块需求复苏,国信证券,2024-01-02,食品饮料,https://pdf.dfcfw.com/pdf/H3_AP202401021615918282_1.pdf?1704209075000.pdf
酒行业周度市场观察2023年第53周,艾瑞股份,2024-01-02,食品饮料,https://pdf.dfcfw.com/pdf/H3_AP202401021615911808_1.pdf?1704204234000.pdf
食品饮料行业2024年投资策略：白酒具备中长期配置价值，大众品关注弹性,西南证券,2024-01-02,食品饮料,https://pdf.dfcfw.com/pdf/H3_AP202401021615911941_1.pdf?1704194035000.pdf
食品饮料行业：11月社零数据进一步回暖，餐饮业加速复苏,东兴证券,2024-01-02,食品饮料,https://pdf.dfcfw.com/pdf/H3_AP202401021615912428_1.pdf?1704189483000.pdf
乳制品10月线下商超&11月线上淘系月度数据跟踪：双十一提振短期需求，低温奶线上增速亮眼,民生证券,2024-01-01,食品饮料,https://pdf.dfcfw.com/pdf/H3_AP202312311615848565_1.pdf?1704107561000.pdf
食品饮料行业周报：经销商大会反馈积极，白酒板块回款进行中,华鑫证券,2024-01-01,食品饮料,https://pdf.dfcfw.com/pdf/H3_AP202312311615848577_1.pdf?1704100787000.pdf
食品饮料周报：出生人口数或企稳回升，食饮哪些板块将受益？,国联证券,2024-01-01,食品饮料,https://pdf.dfcfw.com/pdf/H3_AP202312311615861458_1.pdf?1704102805000.pdf
2024年食品饮料投资策略：“先破后立”重构进行时，修复亦可期,东吴证券,2023-12-29,食品饮料,https://pdf.dfcfw.com/pdf/H3_AP202312291615369752_1.pdf?1703840957000.pdf
食品饮料行业专题研究：高成长性细分赛道，国货品牌优势显著,东方财富证券,2023-12-29,食品饮料,https://pdf.dfcfw.com/pdf/H3_AP202312291615488741_1.pdf?1703879418000.pdf
食品饮料行业2024年年度策略：周期时钟论下，行业进入新三大周期,天风证券,2023-12-29,食品饮料,https://pdf.dfcfw.com/pdf/H3_AP202312291615464902_1.pdf?1703836355000.pdf
食品饮料行业点评：关注量价关系，聚焦长期发展,平安证券,2023-12-29,食品饮料,https://pdf.dfcfw.com/pdf/H3_AP202312291615465350_1.pdf?1703839565000.pdf
食品饮料行业：“转型”、“分化”为白酒关键词，复苏仍待经济回暖,东兴证券,2023-12-29,食品饮料,https://pdf.dfcfw.com/pdf/H3_AP202312291615465370_1.pdf?1703839663000.pdf
食品饮料行业：国际奶价震荡为主，国内奶价中短期依然存在下行压力,东兴证券,2023-12-28,食品饮料,https://pdf.dfcfw.com/pdf/H3_AP202312281615139448_1.pdf?1703749061000.pdf
2024蓝帽子国内保健品消费趋势报告,第一财经商业数据中心,2023-12-28,食品饮料,https://pdf.dfcfw.com/pdf/H3_AP202312281615145068_1.pdf?1703760395000.pdf
酒行业周度市场观察第52周,艾瑞股份,2023-12-28,食品饮料,https://pdf.dfcfw.com/pdf/H3_AP202312281615145069_1.pdf?1703759599000.pdf
食品饮料行业周报：白酒经销商大会召开，关注24年规划,甬兴证券,2023-12-28,食品饮料,https://pdf.dfcfw.com/pdf/H3_AP202312281615148992_1.pdf?1703774726000.pdf
酒水饮料周报：经销商大会提振信心，看好春节板块赚钱效应,天风证券,2023-12-28,食品饮料,https://pdf.dfcfw.com/pdf/H3_AP202312281615149016_1.pdf?1703773455000.pdf
食品饮料行业周报：积极蓄力明年，把握需求趋势,上海证券,2023-12-28,食品饮料,https://pdf.dfcfw.com/pdf/H3_AP202312281615149028_1.pdf?1703773243000.pdf
食品饮料板块2024年度策略：聚焦挖掘α品种，等待需求反转,德邦证券,2023-12-28,食品饮料,https://pdf.dfcfw.com/pdf/H3_AP202312281615149098_1.pdf?1703774214000.pdf
食品饮料行业周度市场观察,艾瑞股份,2023-12-28,食品饮料,https://pdf.dfcfw.com/pdf/H3_AP202312281615149113_1.pdf?1703776516000.pdf
食品饮料行业周度市场观察第50周,艾瑞股份,2023-12-28,食品饮料,https://pdf.dfcfw.com/pdf/H3_AP202312281615149122_1.pdf?1703776936000.pdf
软饮料行业深度报告（系列一）：无糖茶：消费分级与品类繁荣,中国银河,2023-12-27,食品饮料,https://pdf.dfcfw.com/pdf/H3_AP202312271615027469_1.pdf?1703703435000.pdf
食品饮料行业周报：五粮液统筹量价关系，渠道信心有望提升,华龙证券,2023-12-26,食品饮料,https://pdf.dfcfw.com/pdf/H3_AP202312261614898738_1.pdf?1703580820000.pdf
食品饮料行业2024年度投资策略：新常态中育新机，大变局中开新局,华福证券,2023-12-26,食品饮料,https://pdf.dfcfw.com/pdf/H3_AP202312261614899906_1.pdf?1703582813000.pdf
食品饮料周报（23年第52周）：五粮液减量政策顺利落地，当前白酒板块可适度乐观,国信证券,2023-12-26,食品饮料,https://pdf.dfcfw.com/pdf/H3_AP202312261614899921_1.pdf?1703582626000.pdf
食品饮料行业周观点：12月中旬白酒价格环比上行，多家酒企上榜胡润品牌榜,万联证券,2023-12-26,食品饮料,https://pdf.dfcfw.com/pdf/H3_AP202312261614901479_1.pdf?1703586297000.pdf
中国火锅行业研究报告：中国火锅产业规模大，消费者重‘质’喜欢大品牌,艾德证券期货,2023-12-26,食品饮料,https://pdf.dfcfw.com/pdf/H3_AP202312261614903827_1.pdf?1703607752000.pdf
食品饮料2024年度投资策略：白酒持续分化，大众品盈利修复可期,万和证券,2023-12-26,食品饮料,https://pdf.dfcfw.com/pdf/H3_AP202312261614905643_1.pdf?1703608507000.pdf
粤菜 头豹词条报告系列,头豹研究院,2023-12-26,食品饮料,https://pdf.dfcfw.com/pdf/H3_AP202312261614910342_1.pdf?1703620340000.pdf
食品饮料行业：静待花开,华福证券,2023-12-26,食品饮料,https://pdf.dfcfw.com/pdf/H3_AP202312261614898730_1.pdf?1703579479000.pdf
食品饮料行业研究：春季开门红回款陆续推进，强势龙头持续推荐,国金证券,2023-12-25,食品饮料,https://pdf.dfcfw.com/pdf/H3_AP202312251614885299_1.pdf?1703502565000.pdf
食品饮料行业周报：年末需求有望回暖，关注旺季备货节奏,德邦证券,2023-12-25,食品饮料,https://pdf.dfcfw.com/pdf/H3_AP202312251614885322_1.pdf?1703501387000.pdf
食品饮料行业周报：1218圆满落幕，行业携手共进,上海证券,2023-12-25,食品饮料,https://pdf.dfcfw.com/pdf/H3_AP202312251614886483_1.pdf?1703512248000.pdf
食品饮料行业周报：优化量价关系，蓄力春节开门红,平安证券,2023-12-25,食品饮料,https://pdf.dfcfw.com/pdf/H3_AP202312251614886913_1.pdf?1703516740000.pdf
食品饮料行业周报：五粮液保价稳量，零食很忙再获投资,华金证券,2023-12-25,食品饮料,https://pdf.dfcfw.com/pdf/H3_AP202312251614887400_1.pdf?1703519379000.pdf
中国水果罐头行业市场规模测算逻辑模型 头豹词条报告系列,头豹研究院,2023-12-25,食品饮料,https://pdf.dfcfw.com/pdf/H3_AP202312251614893604_1.pdf?1703533594000.pdf
绿茶 头豹词条报告系列,头豹研究院,2023-12-25,食品饮料,https://pdf.dfcfw.com/pdf/H3_AP202312251614893609_1.pdf?1703533323000.pdf
液态乳制品 头豹词条报告系列,头豹研究院,2023-12-25,食品饮料,https://pdf.dfcfw.com/pdf/H3_AP202312251614893610_1.pdf?1703533323000.pdf
食品饮料行业周报：五粮液渠道信心恢复，名酒仍在良性区间运行,开源证券,2023-12-25,食品饮料,https://pdf.dfcfw.com/pdf/H3_AP202312251614882604_1.pdf?1703494050000.pdf
食品饮料行业周报：白酒正进入换挡期，大众品有望持续复苏,中银证券,2023-12-25,食品饮料,https://pdf.dfcfw.com/pdf/H3_AP202312251614885124_1.pdf?1703500054000.pdf
食品饮料周思考（第51周）：积极调整政策，静待春节开门红,中泰证券,2023-12-25,食品饮料,https://pdf.dfcfw.com/pdf/H3_AP202312251614885194_1.pdf?1703503224000.pdf
民生食饮周报：批价环比稳定，左侧优选确定性,民生证券,2023-12-25,食品饮料,https://pdf.dfcfw.com/pdf/H3_AP202312241614881272_1.pdf?1703494050000.pdf
食品饮料行业双周报：部分酒企增持股份提振信心，调整经营策略备战开门红,东莞证券,2023-12-24,食品饮料,https://pdf.dfcfw.com/pdf/H3_AP202312241614880527_1.pdf?1703430565000.pdf
食品饮料行业周报：开门红陆续回款，情绪面主导市场,华鑫证券,2023-12-24,食品饮料,https://pdf.dfcfw.com/pdf/H3_AP202312241614880831_1.pdf?1703438617000.pdf
食品饮料行业：好想你及盐津控股投资零食很忙，有望获得协同效应,东兴证券,2023-12-24,食品饮料,https://pdf.dfcfw.com/pdf/H3_AP202312241614880435_1.pdf?1703428024000.pdf
食品饮料12月周报：保健品行业新周期，供需有何新变化？,国联证券,2023-12-22,食品饮料,https://pdf.dfcfw.com/pdf/H3_AP202312221614824501_1.pdf?1703268766000.pdf
食品饮料行业周观点：股价低迷，头部酒企股东增持彰显发展信心,万联证券,2023-12-21,食品饮料,https://pdf.dfcfw.com/pdf/H3_AP202312211614628341_1.pdf?1703144311000.pdf
大众食品11月电商数据跟踪：11月休闲零食和调味品同比跌幅收窄，冲饮同比大幅增长,万联证券,2023-12-21,食品饮料,https://pdf.dfcfw.com/pdf/H3_AP202312211614641033_1.pdf?1703150662000.pdf
酒行业周度市场观察2023年第50周,艾瑞股份,2023-12-21,食品饮料,https://pdf.dfcfw.com/pdf/H3_AP202312211614644774_1.pdf?1703171756000.pdf
酒行业周度市场观察2023年第51周,艾瑞股份,2023-12-21,食品饮料,https://pdf.dfcfw.com/pdf/H3_AP202312211614644775_1.pdf?1703170896000.pdf
食品饮料行业：食品安全国家标准修订，或有利于乳制品的进一步升级,东兴证券,2023-12-20,食品饮料,https://pdf.dfcfw.com/pdf/H3_AP202312201614569208_1.pdf?1703058976000.pdf
食品饮料行业：中央经济工作会议传递信号，扩大新型消费是消费主线,东兴证券,2023-12-20,食品饮料,https://pdf.dfcfw.com/pdf/H3_AP202312201614569209_1.pdf?1703058542000.pdf
食品饮料：社零低基数下较快增长 龙头公司回购彰显信心,南京证券,2023-12-20,食品饮料,https://pdf.dfcfw.com/pdf/H3_AP202312201614569223_1.pdf?1703060636000.pdf
食品饮料2024年度策略：挤压中寻找结构性增长机会,国联证券,2023-12-20,食品饮料,https://pdf.dfcfw.com/pdf/H3_AP202312201614590052_1.pdf?1703080117000.pdf
酒水饮料周报：龙头增持彰显信心，把握估值低位机会,天风证券,2023-12-20,食品饮料,https://pdf.dfcfw.com/pdf/H3_AP202312201614590653_1.pdf?1703084434000.pdf
在家吃饭餐食产品（预制菜）行业研究报告：在家吃饭餐食产品是优质赛道，2027年将达万亿规模,艾德证券期货,2023-12-20,食品饮料,https://pdf.dfcfw.com/pdf/H3_AP202312201614591550_1.pdf?1703097297000.pdf
果蔬汁饮料 头豹词条报告系列,头豹研究院,2023-12-20,食品饮料,https://pdf.dfcfw.com/pdf/H3_AP202312201614600044_1.pdf?1703101368000.pdf
食品饮料行业周报：11月社零数据持续向好，头部酒企大股东增持提升信心,华龙证券,2023-12-19,食品饮料,https://pdf.dfcfw.com/pdf/H3_AP202312191614504449_1.pdf?1702976034000.pdf
食品饮料周报（23年第51周）：龙头酒企底部增持提振信心，关注大众品板块复苏节奏,国信证券,2023-12-19,食品饮料,https://pdf.dfcfw.com/pdf/H3_AP202312191614507544_1.pdf?1702980071000.pdf
食品饮料行业2024年度策略（酒饮篇）：取势：优选高势能,民生证券,2023-12-19,食品饮料,https://pdf.dfcfw.com/pdf/H3_AP202312191614546242_1.pdf?1703022658000.pdf
食品饮料行业周报：市场情绪低迷，龙头酒企大股东积极增持,国海证券,2023-12-19,食品饮料,https://pdf.dfcfw.com/pdf/H3_AP202312181614462257_1.pdf?1702970431000.pdf
食品饮料行业：浅析我国酱油消费升级路径,华福证券,2023-12-19,食品饮料,https://pdf.dfcfw.com/pdf/H3_AP202312191614504443_1.pdf?1702976240000.pdf
中国熟食行业市场规模测算逻辑模型 头豹词条报告系列,头豹研究院,2023-12-19,食品饮料,https://pdf.dfcfw.com/pdf/H3_AP202403131626654783_1.pdf?1710359477000.pdf
食品饮料：11月社零增速环比提升，消费需求平稳复苏,开源证券,2023-12-18,食品饮料,https://pdf.dfcfw.com/pdf/H3_AP202312181614436192_1.pdf?1702888409000.pdf
食品饮料行业周报：白酒底部渐行渐近，重视板块布局良机,开源证券,2023-12-18,食品饮料,https://pdf.dfcfw.com/pdf/H3_AP202312181614436193_1.pdf?1702887153000.pdf
啤酒行业11月电商数据跟踪：11月啤酒线上销售同比增速由负转正，龙头分化加剧,万联证券,2023-12-18,食品饮料,https://pdf.dfcfw.com/pdf/H3_AP202312181614436229_1.pdf?1702885981000.pdf
食品饮料行业2024年度投资策略报告：走向大众化的高品质消费,中泰证券,2023-12-18,食品饮料,https://pdf.dfcfw.com/pdf/H3_AP202312181614436252_1.pdf?1702900644000.pdf
食品饮料周专题：当下时点我们如何看东鹏,国联证券,2023-12-18,食品饮料,https://pdf.dfcfw.com/pdf/H3_AP202312171614435169_1.pdf?1702885600000.pdf
食品饮料行业周报：白酒处于弱平衡状态，精选优质个股,中银证券,2023-12-18,食品饮料,https://pdf.dfcfw.com/pdf/H3_AP202312171614435415_1.pdf?1702891960000.pdf
食品饮料行业周报：估值或已充分反映悲观预期，关注边际变化,华鑫证券,2023-12-18,食品饮料,https://pdf.dfcfw.com/pdf/H3_AP202312171614435569_1.pdf?1702887899000.pdf
食品饮料周专题：解铃还须系铃人,国投证券,2023-12-18,食品饮料,https://pdf.dfcfw.com/pdf/H3_AP202312181614444490_1.pdf?1702919032000.pdf
食品饮料行业2024年投资策略报告：风物长宜放眼量，板块底部确定性为先,华鑫证券,2023-12-18,食品饮料,https://pdf.dfcfw.com/pdf/H3_AP202312181614444549_1.pdf?1702920461000.pdf
食品饮料行业2024年度策略：供需矛盾缓解,中国银河,2023-12-18,食品饮料,https://pdf.dfcfw.com/pdf/H3_AP202312181614447076_1.pdf?1702922010000.pdf
快餐 头豹词条报告系列,头豹研究院,2023-12-18,食品饮料,https://pdf.dfcfw.com/pdf/H3_AP202312181614449212_1.pdf?1702930312000.pdf
西式快餐 头豹词条报告系列,头豹研究院,2023-12-18,食品饮料,https://pdf.dfcfw.com/pdf/H3_AP202312181614449215_1.pdf?1702930422000.pdf
食品饮料行业2024年度投资策略：大众品：需求复苏在途，探寻趋势变化下结构性机会,东方财富证券,2023-12-18,食品饮料,https://pdf.dfcfw.com/pdf/H3_AP202312181614447107_1.pdf?1702922777000.pdf
食品饮料行业研究：如何看待酒企开门红政策传递的信息？,国金证券,2023-12-18,食品饮料,https://pdf.dfcfw.com/pdf/H3_AP202312181614436861_1.pdf?1702907710000.pdf
披萨 头豹词条报告系列,头豹研究院,2023-12-18,食品饮料,https://pdf.dfcfw.com/pdf/H3_AP202312181614449211_1.pdf?1702930114000.pdf
食品饮料行业：龙头增持夯实信心，关注五粮液1218大会,平安证券,2023-12-18,食品饮料,https://pdf.dfcfw.com/pdf/H3_AP202312181614436937_1.pdf?1702908290000.pdf
